上传时间,回复数,点赞数,up是否回复,up是否点赞,评论文本
1676359661,0,2,False,False,"突然想到：年前王校长赔款两百万 因为打人
视频事件死亡一人住院俩人赔款170多万
工地意外身亡赔偿标准在40-100万之间
进厂意外身亡赔偿标准在60--120万之间
那个，有没有好兄弟告诉我王校长家住哪？我想让他打我一顿[doge]"
1676325404,8,9,False,False,最后看到有弹幕对于事主的176万索赔感觉震惊，突然就想到娱乐圈明星一天208万的事了，人命还没明星日薪多，真够操蛋的
1676300461,0,3,False,False,三只松鼠，无良企业
1676294034,7,79,False,False,[doge]完了完了，我买的薯片竟然是都是已经胀气的，怎么办，要报警吗，在线等，急！
1676293412,6,2,False,False,这更有可能是医疗事故吧，食物中毒本身是因，而后续的医疗失误造成的人员死亡。（大概）
1676291197,6,7,False,False,谁往我充气袋里投薯片了[惊讶]
1676290602,2,4,False,False,看吧看吧，食品添加剂吃死人啦[打call]
1676288972,0,11,False,False,省流  176w
1676343483,0,0,False,False,网红都别碰
1676368070,0,1,False,False,"伊洋浅希，日本战国著名歌舞伎。出身于江户伊洋旁支（已不可考），其父为某国（今已不可考）将军，为磨砺其心智，让他从小学会如何在外人面前伪装自己的家世，同时让他暗中拜被称之为“名将の師匠、靖難功臣、戦国十数年を操った大名”的丰臣艺谋（日本野史记载其为丰臣秀吉之弟，秘密谋划文化侵略大明王朝）为师并与明智浩存并列为“谋の双花”。于江户歌舞伎町事件声名鹊起，狂傲地称呼各学子以及歌舞伎为“辺鄙で勉強しかできない人”，在各方的舆论逼迫下选择不战而降，放弃进入江户歌舞伎町而专心在舆论战上下功夫，在“満硬紅戦”中凭借早已成合纵大名的父亲与丰臣艺谋的财力与人脉成功登顶日本歌舞伎年青一代宝座。
人物轶事:因身材矮小与戏服不符常规被众人戏称为“五短将军”"
1676289875,9,18,False,False,中国食品报删视频了，被删的视频真的一副高高在上教人做事的态度，一点都没有张总的接地气和涨知识[无语]
1676288851,27,60,False,False,[脱单doge]张总怎么评价食品报最新视频不到十分钟就删了
1676318982,3,3,False,False,生命是无价的，假设假设假设是产品问题，出了人命，各位自己带入自己想想呢。有些酸索赔176w的怕不是酸的都想自己干掉自己[吐][吐]
1676289316,35,97,False,False,严重怀疑隔壁根本就没有审核这一说，稿子写完没有领导检查嘛，最好能把cn俩字去掉，要不得经常挨骂
