上传时间,回复数,点赞数,up是否回复,up是否点赞,评论文本
1676289004,40,3837,True,False,《鉴定网口热门食品安全事件》[doge]
1676328398,23,575,False,False,"当时看到很多评论说是吃了加热包，当时我果断回复了周星驰电影里的台词。
“一斤砒霜半斤糖倒下去，这怪不隆冬粘稠稠像是芝麻糊的东西，你会喝吗？你笨的跟猪一样，你都不会喝，戚家人会比你还笨？”"
1676324360,9,239,False,False,我妈也发了这个给我，因为我最近偶尔会吃自热火锅，然后那个营销号不止说了这个，还说 某部门（没说是谁）送检了十款自热火锅，均查出内含亚硝酸盐然后说了一下亚硝酸盐的毒性就没后文了。我看了下数据，最多的一份亚硝酸盐的含量是7.95毫克，我看了下维基百科 这玩意每公斤体重是22毫克，想达到致死量我得一天吃二十多碗，我两个月都吃不了二十碗，然后现在这个视频已经被删了
1676333755,13,715,False,False,这事确实迷，同一批次的货全部检测都没问题，偏偏就是这三人食用的三盒出了问题，目前我觉得要么是其中一人的自嗨锅出现了问题，然后三人分食了有问题的菜品导致食物中毒，要么就是很巧的这三个产品都有问题，要么就是当天不仅食用了自嗨锅，还食用了自家的什么菜或是什么食物，等等警方通报看吧
1676288965,47,3237,False,False,省流:不确定因素太多，不好判断，如果有涨袋，漏气不要吃了
1676289339,22,1819,False,True,检测出药物应该是在救的时候用的药物，氯丙嗪可以镇吐，也可以增强麻醉镇静作用
1676289209,65,1300,False,False,食品中毒这玩意儿很迷，我高中晚饭在家吃，回家路上也没吃东西，结果夜里肠胃剧痛叫120，但我父母一点事没有，吃得同样的菜同样的饭[微笑]
1676396893,3,38,False,False,我和舍友经常吃华莱士，这么多年我没腹泻过一次，但他是真的喷，而且几乎是次次都喷，不管什么套餐还是其他地方的华莱士，他都这样，食物中毒真的是个很玄乎的东西[藏狐]
1676349489,29,173,False,False,千万不要小看变质食品，我大爷家有只鸡掉粪坑淹死了，我大爷觉得可惜了就捞出来洗干净吃了，第二天人就没了。
1676289100,73,945,False,False,这起事故的后果是死亡一人，入院两人。如果可以的话那幸存的两位当事人应该还是能回忆起当天吃过的其他食物的，希望这些在再后续的通报中透露清除。
1676310297,4,56,False,False,想起我家之前有一盒鸡汤的（什么牌子忘了），我当时就是好奇怎么会有鸡汤的自热锅给拆开看了，结果里面鸡肉包是破的（一个很圆的小洞）当时就跟家里人说了打算扔，结果我奶奶还很不舍得觉得能吃，被凶了才放弃[笑哭][笑哭]家里有老人的还是要注意点，毕竟胀包破损虽然是小概率事件，但不代表完全不会发生
1676388282,3,13,False,False,如果真的是厂家责任，我觉得176w是很少的 毕竟出了人命。钱赔的多厂家才会肉疼[藏狐]
1676288912,119,535,True,False,张总，隔壁翻车了啊，有时间还是要指导下的[笑哭]
1676302635,0,63,False,False,"一家三口都出事，同一批次没听见再有别的案例，我觉得是自己家里面别
的东西出现问题的可能性最大"
1676320524,0,31,False,False,信息太少了，个人是倾向于当天进食的其他食品遭到污染。但是从人性的角度来说很难指望死者家属会在这方面帮助厂家去洗脱嫌疑，毕竟厂家可能赔钱，但是如果是其他问题就一毛钱都拿不到了...只能再观望一下
1676289525,0,36,False,True,氯丙嗪，异丙嗪，哌替啶是人工冬眠合剂，一般用于抢救，让患者渡过缺氧状态，给抢救争取时间的，应该是医院抢救时的用药吧
1676395600,1,6,False,False,"个人觉得可能性最高的
1：吃了自家变质食物
2：遇到商店私自改生产日期售卖
3：其中一盒有问题，三人互相分享了"
1676298768,0,108,False,False,"食品生产每一批次都会留样的，估计市场监管会进行抽样，
我猜测的啊，
1.同口味同批次的留样
2.同口味同批次的召回产品
3.同天生产其他产品的留样
4.同口味不同批次的留样
5.市场在售同口味不同批次的产品
如果都没有发现异常那么基本排除了是产品的问题，但是因为死人了，厂家估计会有人道主义的赔偿
万一检查出了问题，那就是大问题了，九成要停业整改"
1676296802,8,47,False,False,很好奇为什么会有咪达唑仑、氯丙嗪、异丙嗪、哌替啶，巧了氯丙嗪、异丙嗪、哌替啶是冬眠合剂，警方或许可以从这方面调查，其中单单是哌替啶就是国家规定的管制类麻醉药品，肯定不可能是食品生产中任何一步原料或者中间产物，来源真的很可疑，可惜只有定性检测，没有定量检测出具体含量
1676319232,1,14,False,False,"[吃瓜]有没有可能自嗨锅是其中一道菜，自己炒的乱七八糟的菜没说，咱们也不知道就不乱猜了。同一批次生产的检测出问题没？
同一批次生产的检测如果都没问题，前者概率很大，自己食用了什么谁也讲不清。
3个人单纯如果吃自嗨锅也是奇怪的很，自己炒个菜，叫个外卖比自嗨锅来得好吃，量还多。搞不懂。。。"
1676302145,14,450,True,False,"首先我不是洗，如果那个自热火锅有质量问题，那十分该死，我也坚决不会再购买他们家的产品。
但是！我必须要提，短视频报道，没有后续的跟进完全是在带节奏。我妈给我看过一个视频，就很短的一个小视频，讲的就是这个事，只说了第一，这一家人都食用了该自热火锅，第二女士死亡，第三医生怀疑是食物中毒，然后就结束了。后面警察的跟进还有自热火锅品牌召回该批产品的事完全不说。
这就直接给人一种所有的自热火锅都会引发食物中毒的感觉，然后这一家的自热火锅更是罪大恶极。
真的太恶心这种事了，你报道可以报道啊，你可以后面加上品牌方召回产品自检，警察正在详细调查也可以啊，最起码要公平公正吧，要不是品牌方的问题以后生意怎么做？自己损失了客源不说，甚至还可能因为人道主义赔钱，纯是赔了夫人又折兵。"
1676288861,15,115,False,False,吃自嗨锅，和生活在俄亥俄，哪个中毒的概率更大一些啊？[doge]
1676309132,3,11,False,False,一般来说饮用水滋生细菌的概率不大，因为里面最多含有一些无机盐，有机物含量低，难以让细菌进行繁衍生殖，而且自来水中一般含有余氯即使加热后也会有残留，不适合细菌生长。除非用的是生的井水，还是放了很久，但是这一般也不太可能出现，除非特别干旱的地区，没有人会大量存很多水，而且一般来说就算存水，根据国人习惯喝热水，也不至于喝生水。水这一点可以大概率排除。有可能是发酵食物的问题，还有一种可能食用了其他被污染的食物，例如吃过有毒藻类的海鲜，河鲜，或是一些被杂菌污染蘑菇，甚至是木耳。
1676292538,4,59,False,False,有一条弹幕说，看到死的不是孩子松了一口气。。。好迷惑啊？？不管死的是谁都是一条生命好吧，母亲就不配比孩子活的更久是吗
1676349112,3,15,False,False,"自嗨锅那玩意，一般都是真空包装吧
那么问题这样估摸着我猜有没有可能是体质问题类似过敏一样，一家人正好体质相近。
另外自嗨锅那种建议不要搞带肉食的，吃起来怪怪的每次。

这个事情当时看了我就在想这个问题，他们这个都工厂规模生产所以同批次问题没有那就很可能设计到单体问题，所以也有可能是某些食品相冲，自己又吃了啥东西的那个"
1676389384,5,4,False,False,弹幕都在说176很多，但是我想的是一条人命才176万?
1676303229,18,21,False,False,索赔176w 哇趣 是真敢要啊  先不说是不是真的厂家的问题  一条人命也不可能赔那么多 虽然不像以前几万可能就完事 但也要不了这么多吧
1676291247,0,13,False,False,咪达唑仑应该是插管后镇静用的，氯丙嗪和异丙嗪应该是心脏停搏复苏后亚低温治疗用的。
1676304635,2,45,False,False,176万基本是不可能的。如果是和解176万还有可能，但是这个事情已经闹到现在这样了，如果和解，就相当于自嗨锅接了这口屎盆子了，所以肯定是要追究到有结果为止的，毕竟死了人，想私了也私了不了了。所以我估计最后就是要么一份不赔，或者人道主义赔个三五万，要么就是石锤商品有问题，没个三五百万下不来
1676303268,0,21,False,False,作为工业产品 批次出货的产品用料封装都是一样的 但是目前除了受害者一家人没有其余反馈 如果排除外界其他因素 大概率是一家人食用的其他东西或者饮用水出了问题
1676390106,0,2,False,False,看完视频后，我个人怀疑是他们家自己的问题，以前跟过修家电的师傅，有些人的冰箱真的就是大型培养皿，剩菜剩饭舍不得倒，存着也不吃。
1676392685,0,2,False,False,关于说不会吃的那条评论，我看到很多人觉得不可能，世界之大，没啥不可能的，之前就有人在火车上把石灰直接倒进食材里，别人好心提醒，他还骂人的
1676308005,1,3,False,False,想起高中的时候，喝一口家里放了几天的水就胃痉挛。去医院诊断好像是食物中毒[捂脸]。
1676393067,0,2,False,False,"举两个例子：
我和我老公过年回家前，买了自嗨锅的临期产品，因为价格便宜而且到货没几天就拿路上吃了所以专门买的这种临期的，也是买了4盒，我两都吃了也没发生这问题。
到家后的几天时间里，桌上有一碗我妈自己腌制的辣黄豆，我外婆说那个辣黄豆都长霉了的被我爸鼓捣鼓捣炒一炒然后摆桌上吃了好几天，除了我外婆我们都吃了，连个拉肚子的人都没有。
所以。我更觉得是这一家子吃了什么变质的其他东西导致的。但是，逝者已逝，希望活下来的人节哀[拥抱]"
1676290039,17,8,False,False,得等最终结果。这种全家中招的事情，按照我家的经验，可能是过期食品改日期再售卖。如果真是这个，最后大概啥都查不出来不了了之。
1676375606,6,6,False,False,我今天买了包薯片，然后惊讶的发现它涨袋了[抠鼻][抠鼻]
1676421940,0,3,False,False,只能说真是这个品牌产品有问题那肯定不能只有这一家人住院，如果说非要万千偶然聚到一块导致的这个结果那也只能说是真的倒霉，阎王非要收你，陨石碎片都带制导锁定你
1676387705,0,2,False,False,检出咪达唑仑等药物是患者终末期在ICU的时候会给予这类药物进行镇静，检出比较正常。
1676298895,3,10,False,False,但凡上过学也知道自热火锅和水能有啥反应。。。[辣眼睛]那些说吃石灰粉的。。。。。
1676289139,0,11,False,False,这个有且仅有他们这三碗有问题，可能性确实太小了。
1676290529,1,5,False,False,真出人命了就该严重怀疑，当然不是下定论，而是要严查这个企业，如果自身没问题，肯定是不怕查的，对吧[吃瓜]
1676292254,5,8,False,False,作为肠胃弱的我来说下[微笑]我跟别人吃一样东西，我会食物中毒别人不会这很正常。我这两天也是吃错东西一直拉肚子。
1676294510,4,9,False,False,冷知识：品牌方并没有下架蒜香花蛤粉自热锅，我刚下了单（没敢付款[doge]）
1676289180,19,16,False,False,张总泡菜充气了还能吃吗，我百度说泡菜里有乳酸菌，涨袋是正常的。但是我还是不太敢吃[笑哭]
1676289584,3,4,False,False,我看鉴定结论是针对脑组织的，而不是针对食品取样，所以并不能明确表明食品中有氯丙嗪等物质[喜极而泣]
1676292428,3,8,False,False,收拾寝室的时候发现了上一届留下来的自热锅，看日期，还有一个月到期，就做了吃了，一共三个人吃的，除了我，另外两个都拉肚子，拉了一整天
1676302094,6,3,False,False,"六种假说，分别是，1运输包装破损，2生产设备封装不严，3水变质，4其他食品，5食品胀袋，6投毒。

从实际情况来看，我个人觉得最有可能性的应该是改生产日期。这样就符合一家三口都中毒，但其他人没发现有事的情况。

如果是上面说的假说一，那破损的都被这家人买到，概率有点太低。假说二，没看到其他人中招。假说三，一家四口，丈夫没事。假说四，同样丈夫没事，且如果是其他食品有问题，如果是散装，那摄入量不同中毒程度也应该不同。如果是成一份一份的，那也很好排查。"
1676290372,0,10,False,False,原来三只松鼠不但眯眯眼，质量有问题也不召回，幸好几年前买过它家变质坚果还不能退就不再买它家产品了，咳~tui~
1676289044,4,16,False,False,有后续真的太好了，不像那些蹭流量的
1676292193,0,7,False,False,我先来，“没问题为什么要召回，这不是石锤了吗”
1676397253,0,1,False,False,最烦这种新闻了，我以后吃的时候肯定会被父母碎碎念，拿这种特殊案例来教育我。可我真的很喜欢吃某个牌子的自热米饭，QQ弹弹的很好吃。
1676428092,0,2,False,False,说是后续来了，然后看了半天前情回顾，结果听你讲个人推测？[辣眼睛]
1676291834,1,5,False,False,最后说错了吧，不是往氮气里充薯片？？[脱单doge]
1676389875,0,1,False,False,有且仅有一个家庭的三人分别食用三盒自热火锅还同时出现食物中毒的现象，很难让人不怀疑是不是这家人吃了其他什么变质的东西或者储存不当导致自热火锅变质了[辣眼睛]这玩意很难联想到厂家生产出问题啊又不是大规模中毒事件[辣眼睛]
1676393049,0,1,False,False,"我家有放了一周多的苕皮和金针菇，我妈居然还想把这些做出来吃了，在我的极力反对下，丢了。
五块钱不到的东西，冰箱放了这么久，万一一家人吃了进医院，怕是要上千个五块钱哦"
1676299517,0,6,False,False,我大学有幸吃过一次让人食物中毒的自嗨锅，就是视频那个狗头那一家，感觉腰也痛，肚子也痛，还呕吐，抗了三天算是扛过去了，期间除了去厕所就是躺在床上
1676288875,0,21,False,False,省流：连wifi 看视频啊
1676424479,0,1,False,False,"到底是怎么吃的一家三口人都出问题了啊[笑哭]
会不会是妈妈那一份问出问题然后三个人分吃过那一份，或者说吃了自家变质的东西？"
1676293673,3,7,False,False,一两年之前我买了阿七的牛杂，吃了一桶之后，过了几天打开第二桶的时候，结果里面的袋装食品膨胀变的很大，我思考了一会决定不吃（我当时已经忘了第一包是什么样子了，有点不确定是不是胀包），反馈给客服，（第一次反馈的时候某宝客服说他们已经向上反映了，告诉我不要吃，并且正在召开会议）客服过了一两个小时打电话给我，让我把东西寄回去，我说可以，但是你得付快递费，过了几分钟，客服又跟我说不用寄了，然后让我剩下的也别吃，退款给我了。那个牛杂也是自热食品，味道是很不错，但是不知道为什么居然出现胀包[无语][无语][无语]
1676289187,0,9,False,False,这家人真倒霉，吃饭出人命了 ，希望快点查明原因
1676437161,1,2,False,False,无语全是废话！浪费时间！你这推测不就是撒网吗，把所有可能性说了一遍，还可以缝合到其他案例里面，没有找到真实的数据，没必要做成视频，还鉴定完毕？
1676387715,1,1,False,False,我一直以为食物中毒一般是上吐下泻之类的，只有毒土豆，豆角，蘑菇一类的才会有生命危险。这也太可怕了
1676437141,0,1,False,False,如果是随机性的食品安全问题，那真是离谱到家了
1676289404,16,15,False,False,还得是张总，隔壁换个人脑子都换了，新视频真的败人品，曲解原视频意思就随便找个人拉出来打靶，就这中间还开始跑题。原视频的意思是现在很多原来简单的街边小吃披上网红二字以后过度营销卖出了天价
1676296732,2,5,False,False,我吃过蛮多次自热饭来着，虽说没什么事情，但我的评价是，在味道方面和分量方面还不如泡面
1676289164,0,7,False,False,这件事要查出来到底是什么原因还是挺难的
1676289609,1,5,False,False,脑组织检测出几个安眠类药物可能是女主人正在吃的药吧，个人感觉是使用的水不干净的可能性最大，因为就我家里父母的使用习惯来说，比较陈的水会用来洗脸洗脚啥的，不会直接倒掉。
1676383701,0,1,False,False,我不知道几年前第一次吃自热火锅不知道怎么弄就把自热包拆开当成调料包了[笑哭]  弄完后发现不能自热啊  找了半天看到盒子上的提醒才发现那个白包是加热用的不能吃  就给扔了艹 好几十块呢[小电视_发愁]
1676288840,11,17,False,False,不知道为什么，感觉自热米饭里的米饭好难吃[笑哭]
1676295920,5,5,False,False,我家前几天买的肉肠有一包漏气，找淘宝客服赔了30红包，打算下个星期拿去给亲戚的狗狗吃[脱单doge]
1676289443,0,6,False,False,当下短视频时代，很多人已经放弃了思考，容易被带节奏，也有些人是明显的坏为了流量博眼球制造恐慌心理。
1676289100,0,7,False,False,我还记得我以前吃自热火锅，里面的粉条包发霉了[辣眼睛][辣眼睛]还好被我发现了
1676300731,1,5,False,False,同样的食物对于不同人可能会有不同影响，我就记得小时候吃了亲戚家做的蘑菇然后就肠胃炎，刚刚开始还以为是别的，因为我父母吃都没事，但是后面家长把那个蘑菇煮进面里我又吃了一次，然后再次肠胃炎，这样反复了好几次[保卫萝卜_哭哭]
1676290037,0,5,False,False,每次看到这种家破人亡亲人离世的新闻都好痛心[委屈]（不针对哪一方，单纯发表看法）
1676401026,0,1,False,False,谁能想到我半夜肚子饿吃夜宵吃的正是自热火锅[灵魂出窍]
1676295280,1,3,False,False,有没有可能是过敏？我记得有些人是同时吃两种食物后一段时间出现反应的。
1676288975,1,11,False,False,省流，没有鉴定出有毒，但是该自热火锅己下架[呲牙]
1676291368,2,5,False,False,突然想起我之前网购的自热年糕有一个里面的年糕是漏气了的，反馈给客服，客服竟然说年糕不容易变质，漏气了也可以吃[辣眼睛][辣眼睛]
1676359708,1,1,False,False,[微笑]不排除一家人因体质问题导致事故的可能哈，我拿我自己举例，我吃冰箱刚拿出来的水果，剩菜，酱（老干妈之类的都算），都会拉肚子，甚至有的时候剩菜热的不是很透都拉，我喝牛奶、豆浆（酸奶之类的某些也包含，蒙牛伊利的某些含奶制品产品除外）也会拉肚子（十分钟内见效那种，某些海鲜类的也拉肚子。所以我吃东西都很小心。可能这就是我的命吧，我检查过，医院没答案
1676389833,0,1,False,False,提个醒各位吃的时候加热时离远点通风不然可能会头痛这些情况的[脱单doge]
1676290715,1,5,False,False,（我来钻牛角尖的哈，其实也不是什么大问题）视频02:10左右 的“质量”的“质”好像读成了三声，正确的其实是读四声的[doge]
1676412841,0,1,False,False,同批次产品让他俩再吃一次看看还中不中毒[doge]。。。。。。算了 太损了[笑哭]
1676289352,4,6,True,False,没关注到这个事件的过程，不过既然急性中毒，那么吃剩的残余还在吧？将残余鉴定一下不就有结论了吗
1676389835,0,1,False,False,觉得一份出了问题分食了导致的三人中毒
1676390322,0,1,False,False,在超市被人拿针扎了个小眼[思考][思考]
1676291395,0,3,False,False,难道张总真是我农学子吗，有一期请的专家我说那个微信头像怎么这么像给我们讲课的老师呢
1676292191,4,4,False,False,我就有一次吃了涨袋的芋圆[笑哭]因为刚拿到两包都是这样的，然后我还以为是充的氮气，后来煮了吃，非常的酸，一问客服才知道是坏了，好在没出什么事情
1676367234,1,1,False,False,前几天买的冷冻榴莲，是塑封包装的，有1包漏气了，商家说这个塑封只是为了好看，漏气没关系。我不敢吃扔了。不知道是不是真的这样。
1676340156,7,1,False,False,我这里烟雾报警器有bug，一开自热锅就报警[辣眼睛]
1676315441,0,1,False,False,还是张总的视频看着舒服  隔壁换人了感觉已经没内味了
1676295168,0,3,False,False,很喜欢张总的视频，但建议下次把没有明确结果说在前面，本来以为是下集，结果是中集，有失落感
1676378670,0,1,False,False,不行，薯片我只吃真空包装的，涨袋的偏不吃[脱单doge]
1676289170,0,4,False,False,省流：还在查
1676395539,0,1,False,False,食物搭配问题？吃了和火锅里的东西一起吃会中毒的食物？（不能理解什么情况）
1676336113,0,1,False,False,国家他妈这么大，人特么这么多，哪种食物从来没出现过中毒的现象？
1676289941,6,4,False,False,张总，看了您的视频之后我有一个问题，您提到说可能是水放变质了产生的问题，那我自己家买的那种就是烧开之后可以恒温保温的水壶，我一般烧开之后会保温60或者80度放着，想喝的时候接，但是有时候会放好几天甚至十几天都喝不完，这里面的水会变质吗？象印的电热水壶。
1676357345,2,1,False,False,上次在无人柜买了一盒，结果整完了吃巨酸。吓死人，催了下吐直接漱口
1676290868,0,3,False,False,首先，排除这一家人聪明的把石灰加热包吃了
1676389897,0,1,False,False,可能是这家子存放不当变质吗
1676292418,0,2,False,False,有没有可能是黄曲霉中毒比如变质的花生之类的东西没吃出来
1676444186,0,0,False,False,有没有可能是他们吃了泡过夜的木耳，直接嘎了，我朋友就是全家食物中毒，去了医院，说是食物中毒查半天没查出来吃的啥中毒，快治好了她想起来是当天晚上吃了昨天泡的木耳，不过她们家都打了1星期吊瓶就出院了
1676390346,0,1,False,False,“国外出这种事两百万美元起步吧，176万多吗”笑死我了。10万美元顶了天了，还200万美元，活在哪个星球呢？
1676289217,0,2,False,False,感觉这玩意又贵又不好吃
1676289608,1,3,False,False,盲猜有人出来说自热产品有问题吃死人，商家下架产品系心虚的出来带节奏。
1676291505,0,3,False,False,我记笔记了，内容是：提到了三只蟑螂事件
1676445038,0,0,False,False,出厂检验没问题，留样检验没问题，同批次产品其他人吃了也没问题，就这三盒出了问题，确实挺玄的
1676386900,0,0,False,False,只能说经典虎头新闻，恕我直言，我不信有多少人会真的跟进这种事件，看个开头，收集有限至极的可信信息，结合个人观点，做出自己满意的解读，然后止步于此，绝对是大多数人的现状，更不用说还有多少连事情的没看清，纯跟着节奏走的人。
1676289534,2,3,False,False,自嗨锅主要是难吃，以前有个火锅面还行，其余都不好吃，太油了，凑数的藕片和粉都不行
1676389637,0,1,False,False,唉逝者安息
1676442391,0,0,False,False,只有我为这一家感到唏嘘吗，我脑海中都是幸福的一家三口买了一包自热食品想尝尝鲜结果吃出一条人命....
1676303653,0,2,False,False,试过公司食堂食物中毒，中午午饭，下午就喝一口开水，下午5点高烧呕吐拉肚子去的医院。[辣眼睛]，关键是就我一个。
1676294733,1,3,False,False,我吃速食装南昌拌粉，里面酸菜有一股怪味，我尝了一口，以为没啥大问题，然后我把它拌到整个米粉里，尝了一个，感觉味道不对，后来把米粉倒了，那个味道简直了，要不是心疼钱，把剩下的米粉都扔了，但以后把剩下的米粉吃完就再也不会回购了，咸菜也不放了
1676303649,1,2,False,False,好几年前，去我姥姥家吃饭，凉调的黑木耳，我吃了一点，半夜上吐下泻，其他人屁事没有，我姥姥姥爷都70多了。然后去年十一放假，和我一个朋友出去吃饭，也点了凉拌菜，里面有黑木耳，她一点事儿没有，我拉了一个星期
1676450255,0,0,False,False,https://b23.tv/BV1A44y1D7QM 元芳，你对“护肝片”有什么看法
1676289246,0,2,False,False,不管咋说，起码召回了，就比三只松鼠好
1676294546,0,3,False,False,《断章取义》涨袋的食品不能吃，所以薯片不能吃[doge]
1676288968,0,3,False,False,省流：没有定论
1676439714,0,0,False,False,还有一种可能就是水加多了，水跟石灰发生反应，导致石灰水沸腾到食材里面了
1676441829,0,0,False,False,怎么没人说 莫小仙  这玩意不管是自热火锅还是自热米饭真的就是抽奖   吃完大概率窜 或者不舒服   有个同事还进急诊了
