上传时间,回复数,点赞数,up是否回复,up是否点赞,评论文本
1676379307,0,0,False,False,我也倾向与他们自己的问题，究竟发生了什么谁也不知道，只有当事人清楚，而外部条件无法证明是食品安全问题，那就只能是他们自己的问题了，相信警察已经调查过当事人的购买渠道的同一箱自热锅并且检查过还毫无发现（如果是网购的调查起来就比较麻烦）。三人一起中毒这个破绽太明显了已经可以笃定要么这个批次生存的食品安全问题要么他们家自己的原因。
1676390816,0,1,False,False,看到一个弹幕，176万一条命。很经典的看热闹不嫌事大，我就想说，那么你觉得多少钱一条命呢？为什么关注这个点？是你想给人命定价吗？
1676385188,0,0,False,False,常见自嗨锅（自热食品）中毒还有一种可能，就是加到加热包里的水不干净，有毒物质很可能先在水里，然后随蒸汽进入食品
1676288807,0,3,False,False,[打call][打call][打call]
1676288826,0,4,False,False,这个点 家人们记得吃饭
1676365299,6,0,False,False,那个我只看了一个开头 后面有说之类的我不管 反正我先来这说了我想说你们可能听说过自热火锅上面冒出来的那个气可以点火别他妈试喷了20厘米的火啊后来塑料又烧了而且灭也灭不掉湿毛巾湿纸什么的放上去由于他是喷气的 他还会从边上继续着火只能放在大理石的地板的那个浴室里后来由于洞太大了 那个喷的气没着火只剩下塑料着火 我就拿那个水龙头给他灭了
1676432012,0,0,False,False,如果没分食过那应该就是他们自己的问题，因为同一批次就那三份有问题的被他们买了概率太小了
1676381242,0,0,False,False,其实我倾向于食品包装收到污染，在开盖的时候手接触了包装上的有害物质，存储出现了问题，或者就是还吃了什么别的东西。
1676374071,2,0,False,False,"前几天从超市买了一罐白腐乳。才吃了一块。
今天打开直接冒烟了。(那个烟就跟特效一样)
表面有一层薄薄的类似黑色霉菌的东西。(没有放冰箱保存)。"
1676438430,0,0,False,False,[吐]生产线问题也有可能，之前买的包装面里面有蟑螂尸体粘在面里面
1676289247,3,2,False,False,体内有精神类药物 这里面假说多了去了
1676441083,0,0,False,False,我遇到过，煮饭大叔把干燥剂也加进去了。还跟我说这个配料老是浮起来，搅了很久才下去
1676444482,0,0,False,False,怕不是把加热火锅的水放在食品里了吧[辣眼睛]
1676300205,7,1,False,False,假说中水的放很多天会有细菌？水里又没有营养物质哪来的细菌？就是有也该饿死了吧
1676293511,0,3,False,False,就视频里那个自热米饭，是真难吃，泡个方便面都比他强
1676290153,2,4,False,False,疫情期间为了方便买了盒自嗨锅试试，很难吃，味道很怪，坚决不浪费食物的我努力吃了几口后扔了……
1676288854,0,6,False,False,正义或许会迟到但不会缺席✌
1676295052,1,2,False,False,吃过一次，是比较廉价的那种，吃完肚子疼，但是学校卖的那种就没什么问题
1676294478,0,1,False,False,太客观啦
1676435533,2,0,False,False,氯丙嗪异丙嗪各一支是做冬眠合剂的，以前在脑外科见过这个用法。冬眠合剂配方挺多的，不过应该没加咪达唑仑的？唑仑类的效果是镇静催眠，可能是配合使用的吧。
1676289970,7,2,False,False,原来某品牌会送袋装水是这样啊 （不过精神类药物还是不能理解 食物变质会产生这类成分吗？）
1676443777,0,0,False,False,为什么在出了人命的情况下索赔176万大家还觉得很惊讶
1676291458,2,2,False,False,食用同一批次产品是不是只有这三个人有问题？如果只有这三个人中毒了，那么他们同时食用的其他食物有问题的可能性很大，或者不是食物，而是饮用水或者吸入了有毒性气体。
1676358088,3,0,False,False,由于后果太严重，所以假说基本都验证不了了，因为假设只是假设哪怕是由于那家人自己对涨袋破损的不在意，他们也不会承认的
1676289637,1,2,False,False,品牌方立刻把该口味产品下架，感觉挺负责的
1676444700,0,0,False,False,怎么，把包装都吃下去了一点汤汤水水都没留吗
1676382002,1,0,False,False,就因为这事我妈还把我骂了一顿[笑哭]
1676424869,0,0,False,False,到底是什么品牌，先提前避雷吧即使不是质量问题，以后基本也不考虑了
1676401658,1,1,False,False,一条人命176万多吗？说抢钱的什么成份？
1676294412,4,2,False,False,曾经两次吃泡面食物中毒…两次都是藤椒，两次都是粉包有问题，只不过一次康师傅，一次今麦郎。
1676303405,12,1,False,False,看到了张总说暖瓶里的水，这个是得放多长时间才有可能变质。
1676427780,0,0,False,False,这个粉里面有没有黑木耳啊？如果有的话有没有可能是黑木耳变质产生了毒素啊！我没吃过这个口味的自嗨锅不咋清楚
1676288895,3,3,False,False,话说上哪买张总的东西
1676451827,0,0,False,False,要是真是厂家问题，国家就该重罚了
1676377728,0,0,False,False,权健差不多就是这么名声败坏的
1676366351,0,0,False,False,有幸买过一袋康师傅的红烧牛肉面，菜包感觉涨袋了但又不是很明显，总之是有胀，有幸没吃[doge]
1676296735,0,2,False,False,食物中毒也是因人而异的，我小时候一家人吃四季豆，我和我妈上吐下泻，我奶奶爷爷和我爸一点事都没有[笑哭][笑哭]
1676375700,0,0,False,False,??自嗨锅那个自热米饭腊肠的我在学校经常吃特别好吃ww
1676449964,0,0,False,False,省流：还没结果
1676289485,0,1,False,False,-[doge]
1676299030,0,2,False,False,大学学《微生物》时，第一节课老师就说“袋胀勿食”
1676452131,0,0,False,False,嘶，这真的好迷惑，到底能是咋回事啊，话说有查过是否过敏么？
1676429374,0,0,False,False,这是复数，不是解释，要解释的话，等事件结果出来之后
1676362337,0,1,False,False,《大科的食品雷普日常》（幻视）
1676303689,0,12,False,False,看了下诊断，必然是需要气管插管使用呼吸机的，而使用呼吸机一般都需要镇静镇痛，咪达唑仑是常用的镇静药物，能检测出来不奇怪，而氯丙嗪，异丙嗪之类的，看患者诊断脓毒血症，缺血缺氧性脑病，垂体危象，估计是体温太高用了冬眠合剂。
1676289838,2,2,False,False,这种应该很难检测出到底是那个环境环节出了问题吧？一方面家属很难证明他们吃的其他的食物或者自热火锅用的饮用水没问题，另一方面厂家又很难证明这家人是因为吃了其他的东西出的问题或者是包装出现破漏但是他们依旧食用导致的
1676359575,0,0,False,False,要不是听最后一句我就把薯片扔了[doge]
1676306124,0,1,False,False,之前上班上午没吃饭，中午叫个外卖，下午两点开始感觉肚子不舒服，没当回事以为是常见的外卖不干净，到了六七点下班时候开始发烧，150斤的人连路都走不动了…勉强撑到诊所打了点滴说食物中毒[藏狐]
1676307808,0,6,False,False,"有些家庭甭说是胀袋了，只要是觉得吃了死不了，就算是长毛发霉黄曲霉都肉眼可见了，撒上调料重盐重油照样吃。
那过期几年的豆油酱油，吃一次直接便血，下次就掺着没过期的混着吃。
这幸亏是现在工地管得严，不然都得去工地偷盐吃，什么亚硝酸盐，没听说过！"
1676343084,0,3,False,False,我一月底和一个姐姐还有她家俩小孩去滑雪 雪场饭太难吃了她带了点速食 有几盒自热米饭  到那没滑两天 其中一个小朋友就因为吃了自热米饭吐了 最后没办法提前回了  回的那天  另一个小朋友因为吃了自热米饭吐车上了[灵魂出窍]
1676307581,1,3,False,False,"不可能是吃了加热包，加热包里面主要是生石灰，这玩意吃进去嘴里和火烧一样，嘴巴食道都烂了，不可能吃的进去，也不可能发现不了。
生石灰遇水变熟石灰吃进去也不可能，熟石灰和石头一样，咬都咬不动，怎么吃。"
1676313077,3,0,False,False,哌替啶？这不是杜冷丁么？还有异丙嗪和咪达唑仑？这是生前做手术了？？？？杜冷丁作为主麻醉剂，异丙嗪用于缓解杜冷丁引起的呕吐的副作用，咪达唑仑用来镇定。
1676307653,0,3,False,False,最大的可能就是在吃自嗨锅的时候，同时吃了自家做的某些腌制发酵之类的东西，食物中毒了。
1676338216,0,1,False,False,我觉得最有可能是他们自己加了什么料吃进去中毒的，同一批生产就刚好这家三口中毒，别地方都没有发生这种事，还没查个水落石出就要赔钱了，我觉得这家人自身的责任更大些，跟商家食品问题不大
1676325685,7,0,False,False,还有种可能性，这家人对该产品中的某种物质有过敏，好巧不巧剂量吃够了，引发过敏性腹泻和感染[思考]
1676336246,0,0,False,False,还有一点安全知识，就是自热包会释放氢气，所以在密闭环境不要使用自热包[妙啊]
1676309330,1,0,False,False,返校后吃了几包留下来的肉松面包，今天一看过期了了几天[辣眼睛]
1676291643,0,2,False,False,所有可能的原因都说了，但无奈线索太少，很难确定概率，不过建议厂家能把同批次所有产品召回并在见证下进行全面化验分析，如果未检出可能危险物，那就可以抗诉反诉了。
1676297422,0,0,False,False,为什么标题是“鉴定网死热门食品安全事件”[哦呼]
1676303064,0,1,False,False,省流:没结果[doge]
1676337409,0,0,False,False,充气的薯片是包装瘪了不能吃，说明漏气了。[脱单doge]
1676334432,0,0,False,False,我吃自热食品，都是用冷开水。那里送的水我都是丢冰箱当冰袋用的。夏天的时候挂电风扇前面吹风贼爽
1676333470,0,0,False,False,我觉得水有问题几率大点，我奶奶真干过，被我阻止了
1676341457,0,0,False,False,[思考]过了那么长时间，证物自嗨锅的毒物检测还没出来吗？
1676344629,0,0,False,False,有点不好想象啊，一家三口坐在一块，一人一份自热火锅？
1676343889,0,1,False,False,食品生产企业都有留样，如果没有留样要重罚，肯定有问题。
1676332346,1,1,False,False,膨化食品没开封憋袋了能吃吗 气不足 大概50%
1676334686,1,0,False,False,话说食品生产企业不是会留样以应对检测吗，那就让监管部门来检测，看看是不是产品的问题
1676361626,0,0,False,False,如果是品牌的问题176w不多吧，一条人命呢诶
1676339652,0,0,False,False,啊这，这家的菌菇牛肉饭挺好吃的，我前两天还吃了，这看的我有点后怕[捂脸]
1676372068,0,0,False,False,我觉得他们自己加的配菜出现问题的可能性更大
1676358964,1,0,False,False,Up up能不能讲一下？@superB太 这个up说植物奶油跟动物奶油的视频[doge]
1676339982,0,0,False,False,有种可能是不是你们的配菜和？自己家的菜发生的反应，就是一起吃的而且那两个冬天还不能一起吃，可能注意是可能不是一定
1676387333,0,0,False,False,这概率和中彩票哪个高[笑哭]
1676381456,0,0,False,False,我感觉也是水的问题…
1676295785,0,1,False,False,准备看3•15晚会，看看又有什么妖魔鬼怪出来。
1676375004,0,0,False,False,无论如何，这类本身就性价比低的产品我是更不会买了
1676327266,0,0,False,False,"[妙啊]没看到结果前我选择避开自热系列,某松鼠那些掉过一次坑这辈子我都不会考虑这牌子"
1676303655,3,0,False,False,176W多么？现在死人都是百万起步。而且还是两个人进医院的。孩子是半条命。
1676382715,1,0,False,False,罐装薯片鼓包了还能吃么？之前买到过，被我全扔了
1676375968,0,0,False,False,不过好像听说自热过程中孔散发的气有点不适，一般需要通风环境，三个一起放气浓度大点？
1676367788,0,0,False,False,我经常吃自嗨锅的肥牛火锅[笑哭]
1676337899,0,0,False,False,省流：我不知道
1676377998,0,0,False,False,不太喜欢吃自热火锅，感觉不卫生[笑哭]吃的时候总感觉哪个菜变质了
1676346921,7,0,False,False,这两天吃螺蛳粉应该也是食物中毒，难受了我两三天，现在还是有点腹泻
1676343251,0,0,False,False,在家吃自热 是有多懒啊[doge]
1676343771,0,0,False,False,我试过加热包水加多了会溢进食物格，然后就不能吃了[笑哭]
1676294015,0,1,False,False,所以还是多注意一下吧。。。防不胜防
1676305803,1,0,False,False,大概率是吃了自热包
1676338348,0,0,False,False,花蛤二次加热，温度和时间不够也可能会病毒感染的。
1676288858,0,5,False,False,刚想看你视频，没想到你就更新了[脱单doge]
1676441565,0,0,False,False,这个牌子两次了吧
1676334881,1,0,False,False,虽然很不尊重因食物中毒而死亡的逝者，但这件事出来后没看到有多少幸教徒出来跳脚我是有点不信的。
1676345921,0,0,False,False,我在自嗨锅里吃到过指甲[tv_呕吐]以后都不想吃了
1676292661,0,1,False,False,我就吃过一次自热火锅，感觉就是油泡食物，就再没吃过其他自热食品了
1676430414,0,0,False,False,希望还有后续跟踪报道呀
1676431453,0,0,False,False,不喜欢吃这种东西，又贵又难吃
1676293156,0,1,False,False,省流:薯片可以吃[doge]
1676336241,0,0,False,False,是不是把自热包吃了？
1676288898,0,1,False,False,我好早哎！
1676303337,0,0,False,False,惨是真的惨，但迷也是真的迷
1676302757,2,0,False,False,那薯片胀袋了怎么办呢[藏狐]
1676333642,0,0,False,False,还以为有真相结果是假说[tv_白眼]
1676288899,0,1,False,False,逝者安息
1676290363,0,1,False,False,[doge]还是张总的视频看着得劲
1676290976,2,12,False,False,前几年，老家也是发生一起食物中毒，说是西瓜有毒，一时间人心惶惶，最后发现是吃太多乱七八糟的东西导致的，一家人死了老的和小的，得亏有人醒过来说了自己一家吃的东西，要不然那年所有水果店都得亏损。[辣眼睛]
1676292845,0,14,False,False,"怎么说呢，不太希望在真相还未得知的情况下就向人家要金钱索赔。（毕竟得知真相后，如果真是自热锅的问题，再要索赔也为时不晚并且合情合理，但万一跟人家没关系呢。。。）
如果已经知道就是产品问题，那么维护自身权益无可厚非，人命一条，要多少钱都为过。但现在真相未明就先行索赔总感觉有点与其说想知道真相，不如说想借此机会捞钱的感觉。（并不是说这家人一定是想捞钱，只是觉得这种到头来还是要钱的姿态给人的感觉不好）"
1676430155,0,0,False,False,不能直接提取死者胃里面的消化物来确认吗[疑惑]
1676295963,2,8,False,False,天生肠胃不是很好 同一个菜只吃了两口立马拉肚子 家人里一点事没有 甚至后来隔夜变剩菜家里人再吃还是没问题；超市试吃的鱿鱼丝 和家里人一人吃了一口 同样家里人没事 然后自己直接胃肠炎拉虚脱了…感觉的确不是很好判断是不是食物的问题[跪了]
1676291234,9,6,False,False,如果，我是说如果，这家人食物中毒不是因为自热火锅，而是自己的问题，那他们是不是还要反过来赔偿对应的商家？毕竟已经完成了负面影响。
1676291377,9,13,False,False,我个人还是倾向于同时食用了自家的食品，因为产品本身出问题应该是批次性的，如果出现随机性问题还真好这一家都买到概率实在低。怀疑自热火锅是当事人说的，人们通常认为自家家的做的食品没问题，自然往自热锅上联想
1676293652,6,11,False,False,"人的肠胃真的很奇怪。
曾经煮了吧一碗霉变的面条，没啥事，一点不舒服的感觉都没有
吃饭如果肉片没有熟透，哪怕只有一点点，半天时间过后立马变成喷射战士。"
1676364870,0,0,False,False,在家吃的话，确实大概率配了剩菜，母亲应该是吃剩菜的主力，借机讹钱
1676326241,2,0,False,False,吃了加热包？
1676441392,0,0,False,False,听视频说原因还没查清？那怎么就开始要钱了？
1676293365,1,0,False,False,能不能进一步鉴定出是什么毒物导致的食物中毒。这样会更好判断点。
1676291284,0,1,False,False,前两天买了个一个自热锅，然后我自己给炒成麻辣香锅了
1676301285,0,1,False,False,[脱单doge]说话简洁明了，快捷，吐字清晰。多好。
1676288854,0,2,False,False,来了来了首页[doge]
1676292974,0,2,False,False,还有少从网上买一些特别劣质网红食品！（尤其什么直播间）！跟三无没什么区别！
1676428121,0,0,False,False,"up主你好，我在自助餐厅吃饭的时候发现，里面的不知名品牌的饮料，营养成分表标注的含糖量才1g，但实际喝起来不止1g，配料表里也没有其他甜味成分。
请问这个成分表有强制规定吗？虚标违法吗？可以举报吗？"
1676295476,0,1,False,False,涨袋是可以免费换的！！大家千万不要吃
1676293368,1,4,False,False,评论区还有人怀疑投毒....不管是丈夫还是谁，能投一个没法检测出的合成毒物，有这水平还有必要为了一两百万投毒？
1676289089,0,1,False,False,才4分钟就没座了[热]
1676293999,0,0,False,False,[撇嘴]
1676385028,0,0,False,False,？什么逻辑？就是因为人已经没了 所以隐瞒不会有更糟糕的后果啊  咬死是厂家的问题多陪几十万呢
1676295411,2,1,False,False,我之前买的百草味礼包零食，打开有几个鸡腿都绿了，后来联系商家给他们看了以后退款了。。。如果我没看吃下去，，后果不堪设想[笑哭][笑哭]
1676339437,0,0,False,False,[藏狐]啥人会怀疑投毒的…啥事都有人阴谋论
1676293699,0,0,False,False,[兔年]
1676318570,0,0,False,False,就是加了菜了，那个菜有问题
1676297892,0,0,False,False,好
1676289499,0,1,False,False,薯片是如果憋了就别吃了[喜极而泣]
1676289495,4,1,False,False,我和我朋友吃小龙虾回来还打包给我爸爸，结果只有我进ICU了[笑哭]很难说的其实
1676291387,0,0,False,False,蹲一个
1676292432,0,0,False,False,可怜
1676309077,0,0,False,False,洗一洗就可以吃了
1676305250,0,0,False,False,滋
1676290180,3,1,False,False,他这个鉴定的是脑组织有精神类药物，这就可能性更多了
1676290421,2,1,False,False,吃进去的东西真的麻烦，我吃臭豆腐以前都没事，上次居然过敏了，不过同时吃了其他东西，不过都是确定不会过敏的东西。结果差点给我整休克了。
1676306385,0,0,False,False,以前还出现过果粒橙农药中毒案
1676289027,1,1,False,False,拼多多1块钱一箱那个吗？
1676289900,0,0,False,False,好看
1676288948,0,1,False,False,张总加油[打call]，努力做出更好的视频
1676450861,0,0,False,False,都没出结果就去索赔，够无语的
1676290218,2,1,False,False,曾经吃过自热火锅，然后肚子疼了一天，疯狂去厕所，之后就再也不敢吃了[笑哭]
1676288866,0,1,False,False,[吃瓜][吃瓜][吃瓜]
1676302290,0,0,False,False,有后续真好
1676288871,0,1,False,False,来了来了[打call][打call]
1676306236,0,0,False,False,人家出人命都没那么贵啊 有点狮子大开口
1676288828,0,1,False,False,[吃瓜][吃瓜][吃瓜]
1676288837,0,1,False,False,[咖喱饭_冲鸭]
1676288814,1,1,False,False,芜湖
1676441975,0,0,False,False,我吃过一次自热食品，直接吃吐了，太太太难吃了！
1676288882,0,1,False,False,热乎的
1676306665,1,1,False,False,可以让Chubbyemu来看看
1676306141,0,0,False,False,[微笑]我觉得最大可能性就是吃自热锅的时候也在吃其他东西
1676288826,0,1,False,False,来了来了﹗[打call]
1676301868,2,0,False,False,张总牛奶说说吧
1676289685,4,0,False,False,买的压缩饼干漏气了能食用吗？
1676289505,0,0,False,False,好像知道后续
1676293646,0,0,False,False,才176万
1676431103,2,0,False,False,这怕不是生石灰拌饭
1676290712,0,0,False,False,真的严谨
1676298490,0,0,False,False,盲猜过敏
1676289031,7,1,False,False,说得好，那为啥薯片会涨袋[doge]
1676289496,1,0,False,False,网口是个啥。。。
1676300542,0,0,False,False,敲诈勒索稳了
1676299668,0,0,False,False,176牛
1676423117,1,0,False,False,严打一下碰瓷的
1676290727,3,0,False,False,UP 我买的可乐涨瓶了可以喝吗？
1676289568,0,0,False,False,所以现在还有具体原因呗
1676299300,0,0,False,False,所以还是没结果呗[无语]
1676389584,0,0,False,False,全是废话呀，结果呢？
1676290653,0,0,False,False,[呆]…还是没结果。
1676297634,0,0,False,False,我想知道蜂蜜结果在哪一集啊？
1676292709,0,0,False,False,等会，大雷又回来了？
1676300040,0,0,False,False,涨袋不能吃，除了薯片[笑哭][笑哭]
1676297007,0,0,False,False,蹲雷子一个后续[脱单doge]
1676303658,0,0,False,False,176万？不可能，这纯纯做梦呢。就算厂家认赔了也就56十万顶天了
1676428944,1,0,False,False,把石灰吃了吧……
1676289015,0,0,False,False,[星星眼][星星眼][星星眼]
1676289605,0,0,False,False,张总的视频还是好
1676288992,0,0,False,False,来了来了
1676288938,0,0,False,False,好早
1676293325,0,1,False,False,这种不明不白的人没了是最吓人的[尴尬]
1676288987,0,0,False,False,我来好早
1676292750,0,0,False,False,有没有可能是不同食物混合吃中毒了
1676294713,1,0,False,False,[笑哭]小孩子吃三只松鼠那种漏了干燥剂的零食会不会中毒？
1676290655,0,0,False,False,省流:不知道
1676288903,0,0,False,False,刚发
1676289022,0,0,False,False,热乎的[打call]给张总打call
1676289675,1,0,False,False,我吃花蛤有时候会吐有时候不会，就很迷
1676362260,0,0,False,False,说了等于没说
1676289131,0,0,False,False,话说上哪买张总的东西
1676289517,0,0,False,False,我之前也有过 自热辣火锅吃进医院 不过朋友都没事 我就觉得是我的肠胃不行
1676354740,0,0,False,False,看个寂寞
1676289109,0,0,False,False,还是要继续调查
1676290747,1,0,False,False,盲猜发热包放饭里了[doge]
1676294573,0,0,False,False,几年前吃了一次自热食品，挂了三天水，从此看到自热食品就害怕
1676291662,7,0,False,False,有没有一种可能是石灰变性了导致加热温度/时间不够，然后食材没熟透出现的食物中毒
1676288836,0,0,False,False,(⊙o⊙)
1676289540,0,0,False,False,不管原因是什么，大家注意食品安全。毕竟吃食物中毒了挺难受的
1676291243,5,0,False,False,感觉家里自己还是不要弄泡姜泡海椒这类东西挺危险的
1676289939,5,0,False,False,原来那个水是用来放在饭里的，我一直以为是泡石灰包的
1676296009,1,0,False,False,本来瘪的胀了不能吃，本来胀的瘪了不能吃[妙啊]
1676288979,0,0,False,False,等一个后续的后溪[辣眼睛]
1676290620,6,0,False,False,为啥会检测出来这么多药品..检测肯定是查没吃完的食物吧？..难不成检测胃里的食物 或者呕吐物？...一脸懵逼
1676291096,8,0,False,False,去年吃了自热火锅，急性肠胃炎，我怀疑当时石灰水溢到面里了，然后我忍着胃痛好几天
1676289529,0,0,False,False,食品报：号危，速归
1676289295,1,0,False,False,[囧]感染性腹泻，脓毒血症。这吃了啥放了几天的食物？难道是生产厂子里食品掉地上又被工人拿回生产线上再包装了？
1676289257,0,0,False,False,涨袋漏气是真的可怕，以前买过一盒素排，发过来的时候有一个很鼓，害怕
1676288857,0,0,False,False,[热词系列_肥肠自信]
1676289220,0,0,False,False,省流:暂无定论，不要阴谋论
1676288835,0,0,False,False,[doge]
1676288830,0,0,False,False,[打call][打call][打call]
1676288839,0,0,False,False,来得早
1676288828,0,0,False,False,[打call][打call][打call]
1676294698,0,0,False,False,我之前买自热小火锅，一箱四盒，其中两盒的粉条都是变质的，拆开酸臭冲头，但是没涨袋。当时真的后悔，一盒那么贵，我直接吃麻辣烫不香吗[笑哭]
1676288834,0,0,False,False,我出息了
1676288935,0,0,False,False,张总能分析一下为什么探路者和其他人类用的大药是一样的吗[doge]
1676292484,5,0,False,False,会不会是丈夫投毒啊……老婆死了马上就索赔百万[囧]
1676294782,0,1,False,False,抢救后，人的尸检检测出药物不是很正常吗？
1676300846,0,0,False,False,肖战代言的
1676290471,3,1,False,False,省流：别买薯片吃，空气太多不划算
1676312587,0,0,False,False,刚才看到一个军事博主拷打网络热门军事谣言。我突然想到一个问题。大雷手下的员工有么有开账号传播谣言的，一个谣言一个辟谣，产业闭环。[doge]
1676288889,0,0,False,False,1观看270赞
1676452310,0,0,False,False,如果自身属于过敏体质，花蛤吃多了可能会出现过敏反应，导致全身红疹，伴有刺痛感、烧灼感、瘙痒的症状，甚至会出现头晕、恶心、呕吐等症状。如果过敏情况比较严重，需要及时前往医院就诊
1676387334,1,0,False,False,一家人食用了3盒自热火锅，这是他们肾脏发生的变化
