上传时间,回复数,点赞数,up是否回复,up是否点赞,评论文本
1676041363,5,44,False,False,高启强执行死刑后，高启兰像往常在厨房正做着早餐。突然发现厨房砧板下面还有一个夹层，里面藏着一个信封，高启兰缓缓抽出信件，看到里面内容后失声哭了起来。 原来是高启强被捕前写她的遗书。“小兰，这是哥哥给你的最后一封信了，有些话只 能选择这种方式告诉你，我知道你和晓晨恨我。我从香港找来杀手，是为了让你和晓晨能够和我在最后关头表现的决绝。只有决绝你们才会能够 检举揭发我，这样你们才能够争取到宽大处理，我才能最大限度的保全我的家人。 瑶瑶是我让她告诉你香港那边财务信息的，也是我安排她去举报我的，因为这样对她来说也是一 种戴罪立功，不要告诉他们这些，让他们带着这份恨学会独立自强。背面是我在银行的账户和密码，是哥卖鱼赚的钱，不多但干干净净，你们先去注册一个股票账户，最近A股已经开始涨了，未来大概率要突破前高6124点，抓住603203快克股份的机会，22.22元稳健投资，33.33正常投资。它会到88.88-203元。让你们的下半辈子衣食无忧。”
1676086986,0,9,False,False,各位请一定要知道时势造英雄，而不是英雄造时势，有这样的黑恶份子我们真要考虑是不是大环境出了什么问题，要怎么解决
1676014939,0,29,False,False,狂飙让我有种梦回2000年那种电视剧的感觉，这种台词放到现在真是难得一见。
1675932926,8,201,False,False,因为穷受的罪，我是受够了 够够的
1676392981,2,2,False,False,为什么一定是给社会做贡献而不是给自己正当的赚钱？这就是现实
1676042770,0,19,False,False,里边的小孩子也说过一句话，汉堡吃多了会太撑
1676011160,7,23,False,False,如果不是安欣出生好，压根就用不着高启强出手，他早就寄了。
1676119774,0,8,False,False,土壤的作用大于农作物的基因，任何不法都是自上而下的。
1676091991,8,9,False,False,"人生的发展轨迹当然和出身有关系，但出身不好的人难道就不能在现在这个社会活的很好吗？[哦呼]

重点在于，出身再如何也无法成为一个人必须得铤而走险、抛弃尊严、践踏他人的理由"
1676076061,7,12,False,False,这部片子，很多人可以共鸣高启强，却难以共鸣安欣
1676174467,3,9,False,False,"那些人这么羡慕好出身，但是拥有好出身的安欣，二等功在身不也几年没提升吗？？所以安欣灵魂上比他们都高贵。
出身可能是你放弃的借口，但绝对不会是你一直放弃的借口。"
1676169296,0,4,False,False,安、高二人在医院跟小孩子就汉堡话题聊天的那场戏的小孩子最后的锐评没剪进去，这也是剧方要传达的价值观，预设立场是吧，另外20年前知道靠倒腾小灵通做生意的，加上剧中高弟的见识和能力，高兄的气魄和执行力，发不了财？只有写进刑法里的才叫发财，才叫致富是吧。
1676133080,1,3,False,False,劳动无法致富
1676111287,1,10,False,False,fenpei失衡导致jiceng资源总量不足从而陷入极端零和博弈。什么意思？不踩人就被踩，没有中间的选择，你老实得被人骑，就得忍。对剧中人物进行价值判断没有太多现实意义，有胆识有脑子敢玩命的就是这种博弈中的胜利者，狠者通吃。只要失衡的本质存在，永远春风吹又生，这是规律，不以个人意志为转移。
1675995148,1,23,False,False,跟出身没关系曹闯还会有那个下场？[doge]
1676129946,0,8,False,False,这部剧就很现实，位置到了某一个高度，基本都是有师生、亲戚或者是联姻的关系。
1676024848,8,20,False,False,确实还存在一些不公平的分配，唉，你还是说的太晚约了。
1676092499,2,6,False,False,没有贪欲你何来的动力？
1676040645,2,43,False,False,小盛的心很重，或者说有他那样童年经历的人心都会有点重，需要用一生去治愈，把那块坠着心线的石头给拉上来。
1676018128,4,43,False,False,就最后台词而论，强哥不选另外一条路 除非他养大的弟妹大富大贵了 否侧一辈子菜市场卖鱼被欺负 而他的后代要再努力20年才有可能跻身中层
1676142508,0,4,False,False,正因人有差异有贪欲，所以永远存在不公。虽然法律和道德的角度上高启强是错的，但恐怕想成为高启强的占绝大多数，只是没机会而已，一旦有机会只要你做了选择就能得到想要的一切，有几个能守住本心，恐怕少数能的那些人也是因为胆子小，每个人都是第一视角看周围，所以理所当然的会想拥有对其他事物的支配权，当生存空间小了，能支配的事物也少了，就会产生不满，而空间多了，那更完了，他会更加理所当然的支配一切，所以要抢夺更多的空间，所以人的争斗永无休止，其实还是动物属性，弱肉强食何来公平，想要公平除非摆脱动物性，让人不再作为一种高级动物存在，而是人，这也是共产主义想实现的前提
1676051314,2,16,False,False,我出来工作以后，吐槽最多的一句话，我工作这么苦这么累，但是钱都到哪儿去了呢？
1676187059,0,4,False,False,后面的那些台词，给那些还没进入社会，还没遭受过毒打的小年轻看看还行
1676026579,1,18,False,False,不选另一个方向，那么另一个方向就是卖一辈子鱼，最后得病，全算医药费了[藏狐]
1676029059,13,18,False,False,高启强如果走正道，大概率会跟安欣成朋友。成安欣的朋友大概率会提前盒饭[笑哭]
1676088100,6,10,False,False,跟出身有太大关系了，我学画画的时候我宿舍有一个北京舍友，同样的分数她能上公办一本，我就只能去公办二本，她继续留在北京，我还呆在河北，这就是差距。万幸我没有生出歹念，也许平平凡凡过普通人的生活也很好
1676180784,1,4,False,False,不靠工龄是对年轻人好，年轻人更容易晋升，但对学历相对较低的中年职员就不好了，所为追求公平就是这样的，对你公平了总会对其他人不公平
1676098300,0,5,False,False,出身太他妈的的重要了
1676103103,1,11,False,False,弹幕好多人竟然以为被压迫的自己是高启强，有没有可能你是被高启强小弟欺压的无名老百姓[doge]
1676080463,3,8,False,False,何止剧情现实，能把这部剧播出来，剧组的后台也够大了，继《人民的名义》后第二个映照社会现实的剧就是《狂飙》，我将开始二刷！
1676172656,0,3,False,False,现实生活中的走起来的有谁是干净的呢
1676085943,0,8,False,False,做个老实人还要到处被欺负，做个坏人可就爽多了
1676051686,8,14,False,False,这剧好就好在，有聪明人和正常人。太多剧为了剧情推动搞了很多降智的人和剧情，就是那种但凡是个正常人都不会干的。这部剧告诉我，没有不降智也能推动剧情！
1676075883,0,9,False,False,真正的普通小警察是陆寒啊，安欣有关系的。
1676123507,0,8,False,False,出身确实可以决定一个人的未来，也可以决定一个人未来的走向，但是有些路是可以自己走，可以自己选择，有些机会是可以自己把握，自己抓住，有的人可能忙碌一生，碌碌无为，安分守己，可能有的时候机会从他身边错过，他都没有察觉，而有的人却一样，也是忙碌一生，但是这些人确实能抓住身边的机会，世界本就无公平可言，如果想要出人头地，我们就要比别人付出100倍，1000倍，10000倍，这就是人生，所谓的捷径，也只是在你成功之后，而这些捷径，也是你前期打下的基础，所浮现的通道，我们不需要别人看得起我们，我们只需要让自己看得起自己，我们所有的付出，我们所做的一切，都不是白费，只要做就是有意义，也许你在梦的道路上，可能成功还很遥远，但是不做，你就注定无法成功，综上所述，并不是针对谁，只是对于出身的说法的一个评价，我也希望看到这条评论的朋友，不管你的，出身状况是好还是不好，都要记住，只要你努力，终有一天，你会得到你应有的回报，人在做，天在看，心怀坦荡，努力不放弃，走你自己的道路，一条宽而又大，坚硬无比的道路，我相信终有一天你一定会成功[微笑]
1676391776,2,2,False,False,和小孩那段安欣说错了吗？我不明白弹幕里的人受过什么样的打击，在那一直骂安欣。
1676050978,4,13,False,False,安欣06年之后就不光明正大的查了   不然和李响一个下场罢了
1676126868,3,6,False,False,不看出身，那安欣也早就被封在桶里扔江中了
1676093706,2,6,False,False,话说，这剧看完真的有人会想做👮嘛[口罩]
1675953294,6,43,False,False,做好人，被坏人欺负；做坏人，被好人审判。
1676032896,16,35,False,False,出身这个借口可太好用了
1676049438,0,10,False,False,踏马是十字路口？从始至终只有一条路。
1676015694,0,17,False,False,穷人深知底中苦，陪哭陪笑为钱财。若有朝日抬头时，方为一方霸道人。
1676119643,1,5,False,False,恶能找到本源吗？如果说那两个市场管理员是整部电视剧里的恶的起源，那么管理员的恶来自哪里？这个世界上的恶有来自哪，他们为什么会有这样的恶呢？最根源的问题是什么？
1676049771,1,12,False,False,高启强那样的人不是谁都能做的……人要认清楚自己，可惜包括我大部分人都认不清自己适合什么
1676167021,0,4,False,False,我们没有十字路口，我们的路太少，要硬生生走出一条路也太难
1676042085,3,13,False,False,这部剧里我最喜欢的角色不是安欣也不是高启强，而是高启盛。当然，我不认同这个角色的三观，只是觉得演员的肢体语言和台词功底很棒，这角色发起疯来那真不一般[妙啊]
1676008765,0,15,False,False,选择？普通人根本没得选好么，
1676109050,0,4,False,False,30集以后我不爱看，但是没这几集，这剧播不出去
1676090908,3,6,False,False,我更宁愿看见高启盛不犯病，强盛兄弟带着老默做大做强霸甲一方，第一第二部分就应该结束了，第三部分为了宣扬某些东西而拍，太过书面
1676193101,2,3,False,False,原神其实更像一款不定期更新的美剧，虽然可能越到后面剧情越完善，人物性格越鲜明，但是仔细一想，原神最开始的剧情蕴含的信息可能更多，所以请不要轻视原神里的任何一个剧情。[脱单doge]
1676028507,4,14,False,False,告诉你做人不要有贪欲的人 一般就是最贪的那几个 贪的人少了 他们贪的就更多了
1676111449,0,4,False,False,"命是弱者的借口，运是强者的谦词
                                            ——黑塞"
1676060414,0,9,False,False,很多人都把自己带入了高启强，但是自己有没有想过，自己可能会成为李青呢？
1676041507,0,14,False,False,安心成长在靠山身边的人和身边一无所靠的人，他们眼中的世界是完全不一样的 。王子可以菩提树下悟道成为佛祖，而农民得先想想怎么吃饱。
1676050516,1,11,False,False,是那个方向选择了他，弹幕说的真好！！
1676038859,4,18,False,False,高启强他只是小部分人忍受不了反抗的人，大部分人都在忍受着，如果有人实在忍无可忍了，也许下一个高启强就会出现
1676141047,1,3,False,False,其实我特别想看高启盛后面搞他这同学的[笑哭]
1676051550,0,19,False,False,我最常听的一句话“这个社会最不缺的就是 你这样的           人”[微笑]
1676028739,0,11,False,False,风浪越大 鱼 越 贵！
1676043125,2,12,False,False,出身太重要了。 但是不管什么出身都要学会低头哈腰， 钱到手就行
1676099224,0,5,False,False,不要过分吹捧黑暗森林法则，因为大部分人都不够理智。
1676097033,0,5,False,False,其他不论，李顺父子是真的惨
1676026946,0,10,False,False,您出身好 需要靠赵立冬？需要找靠山？
1676011104,1,16,False,False,那你觉得多少年过去了，死了多少人，多少人的家庭失去了顶梁柱，多少年的损失，最后才抓到，现实中这种人还有很多，表面功夫的人太多了，我身边就有几个
1676082379,0,6,False,False,狂飙这个名字起的真的很好，选了这条路就没可能停下来了，停下来的后果就是被瓜分吃净，只能继续爬上去，上不去就是末路了。而另一条正义的路就更难走，赔上一家人也只能成为压路石，看不到出路。（正义是好的，善良是好的，没有力量或许也是好的，至少对其他人来说是这样的），你的善良老实正派，都是好公民的定义。
1676105857,0,5,False,False,看弹幕就看到一堆抱怨不公的人，出身确实不能选择，再苦也坚持吧，乐观的心态始终很重要，无论怎样也要做合法公民，就像安欣说的多看书很重要，心思也要放在正道。
1676087819,0,5,False,False,社会贡献：卖鱼
1676116164,0,5,False,False,出身没关系，是最大的慌言，那个人如果有安欣的背景，也不用冒险给人当手套，如果安欣没有背景，估计早就是陆寒的下场了。
1676038517,1,11,False,False,每次吴刚的气泡音一出来我就想打他
1676114447,0,5,False,False,这个剧也还是个弟弟，只不过是现实的一个反应，而现实远远比这更让你觉得神奇
1676113624,2,5,False,False,刚看完，这剧真的可惜了，韩剧美剧看多了这剧看前面其实就猜到个七七八八，孟德海肯定是隐藏boss，根据前期剧情他就不可能清白，瑶瑶发现老莫死因复仇，赵立东或许也是小虾米，结果看完气的不是我猜错了，是猜对了结果强行给删减成这样，孟德海楞是给强行扶正了，泰叔的线也莫名其妙的，这种级别的轻轻松松就被迫养老了，高启强那么爱陈舒婷，儿子对陈舒婷又是全部，那么重视家庭的人结果居然舍得杀高晓晨，安欣后面近乎透明....崩的太厉害了，我心里八分到八点五的剧愣是删减成七分。
1676072719,0,6,False,False,"安欣要理想
李响要安心"
1676040536,0,12,False,False,不是他在十字路口选择了另一个方向，而是那边是能走，即便是红灯。
1676098948,0,4,False,False,贡献不重要，搞清楚为谁做贡献很重要！
1676038588,0,11,False,False,最有意思的，就是后面曹队出现在废旧工厂那一幕呼应前面对高启盛教育的那一幕[doge]
1676045212,1,11,False,False,我觉得李青他爹说的挺有道理的，趁年轻学点手艺
1676100299,0,4,False,False,因为高启强勤勤恳恳卖一辈子鱼还比不上叫泰叔一声爹[微笑]
1676031385,0,13,False,False,没有贪欲？贪嗔痴能戒一个你就成圣人了。
1675962565,1,18,False,False,高启强的贪欲和狠辣注定他不会是老实人，这个角色一定要客观看待，不然三观很有可能被带沟里
1676036703,7,10,False,False,他没得选好吧，从借助安警官狐假虎威开始就没得选了，一开始退也退不得，进也不敢进，后面慢慢的抛弃底线了
1676224893,2,2,False,False,看的出来，某些人的三观真的很扭曲
1676077796,0,6,False,False,拍的越好越有代入感，就说明现实比那更残酷
1676064637,1,8,False,False,不贪的人，一辈子都很平庸，但是踏实
1676040116,0,12,False,False,不要造神又灭神，我现在已经很反感了[藏狐]
1675996637,0,16,False,False,如同养蛊，你不吞噬别人，那你就是别人吞噬的目标。
1676038983,6,10,False,False,我看这个反贪的片子也很怕一些人去学高启强觉得他是对的[笑哭]毕竟坏人演的太有魅力了
1676030416,1,12,False,False,以他的聪明才智，却只有一条路可走，他们只修了一条路
1676102565,0,4,False,False,其实我觉得那些“配角”说的都很对啊  这就是现实我们也不想这样  可是人得活下去才能说其他的不是吗
1676043430,11,7,False,False,做贡献？高启强做个好人不就一直卖鱼，然后把合法所得变成唐氏兄弟的不合法收入，是吗
1676050693,0,4,False,False,卧槽！现在这个点一千多人看
1676002823,1,15,False,False,"出身寒微不是耻辱,能屈能伸方为丈夫"
1676060822,3,7,False,False,普通人有2次机会能逆天改命，一是高考、二是婚姻。讲这话太绝对了，也有很多人抓住了这个时代的风口，完成了阶级的跨越，至少目前财富自由，能够给家人良好的物质保障。
1675991892,0,17,False,False,曹对说的话到后面对他自己挺讽刺的
1676110507,0,4,False,False,出身不好的肯定有爬的上去的，但，凭什么你觉得会是你，或是你觉得的人呢[偷笑]
1676041270,3,10,False,False,法律是为了保护大部分普通人的，就算你代入的是高启强，也要想想自己有没有高启强那个缜密的思维，能够让人心甘情愿为自己顶罪的能力。出名的犯罪也是要有脑子的啊！
1676085382,0,5,False,False,是啊，聪明才智的前提想开个小灵通店，然后还得搞关系送钱，你在聪明没用啊
1676032707,0,9,False,False,6，弹幕给我干懵了[微笑]
1676131331,0,3,False,False,这戏经不起细琢磨，太好看太有深意了
1676052457,0,9,False,False,高启强有两次选择的机会，一次是不借用安欣身份，听安欣的不和小龙小虎混在一起，而第二次陈书婷在蒋天步步紧逼下劝他收手。我们不说他在小民时的选择，他彻底取代泰叔后，高启强的地位人脉都让他有很多收手的机会，但他都没有选[2233娘_耶]
1676038299,1,23,False,False,天堂和地狱没有我选择的权利，只有我被选择的命运。
1676120604,0,4,False,False,所以我还是觉得他人即地狱，人人即地狱。人，性，本，恶。一个行为放在一千个人眼里有一千个解读也可能有一千种恶。恶从何来呢？
1676091060,0,5,False,False,人有贪欲是没错的，错的是贪欲越过了底线
1676076080,0,6,False,False,出身确实是衡量一个人能衣食无忧做大做强，或者一辈子辛辛苦苦依旧一事无成的理由……但不是做坏事的理由。电视剧里他们调查高启盛，发现他有嫌疑后说的那句“出身不是理由”，意思应该是：“出身不好不是你就可以做坏事的理由”……那确实是啊，你去偷抢打杀其他人，都来一句“因为我穷”，那中国至少几万人都可以随便去杀人了；另外出身好的就会安安份份遵纪守法？……现实反而是出身不好的，善良安分甚至懦弱，命运专挑命苦人扼。出身好的，反而喜欢玩闹，在法律边缘试探……
1676099276,0,4,False,False,"出身寒微，不是耻辱
能屈能伸，方为丈夫"
1676128025,0,4,False,False,"能靠光明的方法发家的，寥寥无几，而且还要有机遇，手段和人脉。
那些个1，2年发家的，哪一个背后没有肮脏的手段？"
1676042006,0,10,False,False,评论里百分之八十的人如果有高启强的脑子和经历肯定也会变成这种坏人的
1675960629,1,16,False,False,台词顶吧，逼出一堆唇语人在切片翻译[笑哭]
1676051681,0,8,False,False,有些人不给社会添乱就是最大的贡献 确实啊 其实高启强也很想安稳一辈子啊 就是 被逼后两个字真的挺心酸 你说有些人狠起来确实没边了都[阴险]
1676026861,1,12,False,False,出生卑微不是耻辱，能屈能伸，方为丈夫
1676115214,0,4,False,False,高启强说过，他不后悔当年的选择，因为如果听了安欣的话，我只能卖一辈子鱼
1676081217,0,5,False,False,吴刚最后的独白是真实的社会  “不靠非法的手段，想翻身可太难了”
1676040033,0,22,False,False,我们很难要求一个身处窘境的人欣然接受现实，这是结构性的不公平落到微观个体上的悲哀；但可能只有在你有着安欣的出身时还能选择做一个像陆寒那样的人，这个社会才有机会逐渐变好。当你真有一辆车的时候，是否会在需要之时愿意把它捐出
1675931949,3,105,False,False,希望内娱多一些狂飙这样的好剧[打call]希望剧里所有演员事业一路狂飙！
1676036432,0,9,False,False,道理都懂，但触犯法律红线一定是错的，因为法律是人道德的底线
1676101738,0,4,False,False,道理我都懂，但我关心的是谁能带我上山，上完山我还想吃鱼[doge]
1676040299,5,29,False,False,"小孩子需要的是纯度，不是强度。
当一个人失去了纯度。身体是小小的，灵魂却是巨人，这不是不好。
这很强，强到逆天，强到癫狂。没什么不好的。
只是那样就不是小孩子了，是个大人了。"
1675965461,1,13,False,False,坏人比好人更懂道理[doge]
1676125645,0,3,False,False,"为什么很多人纠结“高启强”们的故事应不应该在具体展开呢?你们在怕什么我没懂啊？
深层次点说，既然存在这样哔上梁山的故事，影视上为什么不能搬上去?
给坏定一个标签，照准打靶，不去洞悉坏背后的故事，就是正确的么？[无语]"
1676016202,0,12,False,False,说出身是借口的人，都是忽悠
1676036394,7,9,False,False,我想知道上进心和贪欲有啥区别，我没贪欲，不吸烟不喝酒不打牌不赌博不PC不泡妞，最近连游戏也不想玩，干啥都没动力，饿不死就行，别人都说我不争气，没人说我贪欲不贪欲。
1676096647,1,4,False,False,如果让安欣再选一次 我相信他还会给高启强送年夜饭 因为他骨子里就是个善良的人
1676049550,1,9,False,False,我们当地也有黑，非常有名，我小时候就知道他了，去年据说被抓了，然后前阵子又听说他弟弟扛了所有事然后自杀了，现在本人依然没事，我只想说别想要去成为高启强那种人。
1676096601,1,4,False,False,大家都认为自己会成为高启强，其实大部分终其一生都在卖鱼
1676045592,0,8,False,False,有人出身就在终点，而大部分人至死也只在起点徘徊。
1676114586,3,3,False,False,我就问一个问题，换做你是高启强，你会走什么样的路？答案心里都有了吧
1676034490,0,8,False,False,弹幕说高启盛没害人的，后面贩毒还不算害人？[疑惑]
1676094620,0,4,False,False,忽然发现，如果他们不变坏的话根本没办法生存，我知道犯罪没有借口，但是不得不说现实就这样
1676059063,10,6,False,False,如果安欣是个没有任何关系的普通警察，他坚持的正义，会有结果吗？
1676385939,0,1,False,False,按照开局剧情设定，市场的档口要重新打乱，龙虎兄弟暗示高启强送等离子电视则可以不换档口，那么就有两条路：A.送等离子电视 B.不送。剧中是送了差一点的电视，姑且称为第三条路，结果就是电视被砸，人被打，进去后续剧情；选A则相安无事，继续卖鱼生活；假如选B或者有其他档主送了等离子，那高启强就要换摊位或者搬离旧街厂市场，无论哪种，前期投入鱼档的固定设备成本就打水漂了，损失一大笔钱，要继续卖鱼可能要拿积蓄或者找人借钱，生活雪上加霜，非常艰难，或者还是会因为缺钱而走上歧途[doge]想勤勤恳恳、本本分分活着，难啊！
1675952285,1,26,False,False,所有做坏事赚钱的人被抓后都不是后悔做了坏事，而是后悔没有早一点收手导致被抓
1676018796,5,8,False,False,我觉得让我选择，我会做高启盛
1676112661,0,3,False,False,好剧看的就是容易上头，大家少熬夜[笑哭]
1676004090,2,12,False,False,我一直不太理解为啥这电视剧叫《狂飙》，直到吉他大帝出场，终于明白是我太懵懂了[害羞]
1676045973,3,8,False,False,对于狂飙的评论，我只觉得要多想，我个人认为，有的人只能随着环境流动，就像那一片一片浮萍一般，所以我们更应该去改变那片环境。
1676123876,0,4,False,False,只有安欣才知道二十年前高启强吃饺子是笑着的。也只有高启强才知道转调交警时安欣崩溃过。好剧[给心心]
1676046741,5,8,False,False,其实分配不是问题，是无处不在的欺凌弱小，是人性之恶，如果没有那俩二货，老高还是卖鱼的，不会铤而走险
1676126858,0,3,False,False,做好人被欺负，做坏人被审判
1676052367,0,7,False,False,"大多数都太普通,从出身好像都定好了一切，先是不会也没人教到不能，平淡的像泡了很久的茶"
1675948675,0,31,False,False,它讽刺的一切都是现实，心寒吗。诸位前途保重，好自为之。[2023][保佑]
1676372530,0,1,False,False,我当时看剧曹闯说出身只不过是太好用的借口罢了  有被说服强烈附和 但下一秒我就反驳了我自己 出身就是借口 就是挡不住的阳光刺向你  只不过我们大都是认了 无关紧要而已
1676393375,0,1,False,False,剧里的人物有两面性，都是社会中常见的。比如高启强精通人情世故，圆滑，选择捞偏门，食肉糜，越走越远。安欣坚守正义，为人轴，执着，不食肉糜，但也被迫付出了代价，好在安欣有后台，不然像他徒弟那样的结局
1676041477,2,8,False,False,"如果我是那个孩子，我会对安欣笑一声
然后从慢慢吃汉堡变成狼吞虎咽"
