上传时间,回复数,点赞数,up是否回复,up是否点赞,评论文本
1676099748,0,0,False,False,今天是大年二十一。祝你新年快乐，要不下次出一期新的吃汉堡的视频吧。
1676035689,0,0,False,False,[支持]
1676044887,0,0,False,False,经典滤镜呢？
1676037284,0,0,False,False,音乐好好听
1676035664,0,0,False,False,哈喽[打call][打call]
1676035469,0,0,False,False,拍的好好
1676176072,0,0,False,False,@苑举正 @王炳忠台湾 @歷史哥李易修 @翟翾 @雷倩台湾 @
1676026318,0,0,False,False,来料
1676186400,0,0,False,False,长得有点像麦克信田
1676032117,0,0,False,False,FutureBass不错
1676292912,0,0,False,False,羡慕了，大城市就是爽，基础建设好
1676118586,0,0,False,False,赶紧看看1美元炸鸡压压惊
1676033088,2,0,False,False,深圳不是禁摩禁电吗
1676023210,0,0,False,False,他有很多
1676300526,0,0,False,False,印度网友顶不住了[doge]
1676117738,0,0,False,False,很会拍啊
1676310224,0,0,False,False,北京地铁也不错，但经常人太多了[灵魂出窍]
1676262260,0,0,False,False,地铁站比武汉的先进一点
1676133758,0,0,False,False,你来龙岗大运站来看看
1676069984,0,0,False,False,拍得不錯 也確實蓋得不錯
1676178375,0,0,False,False,我一个北京人一样没去过大城市
1676022771,0,0,False,False,拍的真漂亮
1676302430,0,0,False,False,来深圳一年多了还真没注意到[笑哭]
1676114798,0,0,False,False,转场超赞[打call]
1676300800,0,0,False,False,去过深圳广州，深圳的地铁真的太新了[笑哭]
1676120102,0,0,False,False,是深圳地铁，不是中国地铁
1676118869,0,0,False,False,可爱的Rafa[脱单doge]
1676028968,0,1,False,False,你把油管上老外对你的中国地铁站之行的评论翻译了再做个视频，中国网友应该很感兴趣
1676267276,0,0,False,False,深圳地铁细节好多啊，太震撼了
1676039408,0,0,False,False,比广州漂亮
1676024884,0,0,False,False,18世纪西方就有地铁了，丫震撼不？
1676166409,0,0,False,False,深圳地铁新开的几条线路的每个站厅都很干净
1676110868,0,0,False,False,6，确实漂亮
1676046003,0,0,False,False,运镜真不错
1676128143,0,0,False,False,这娃又是那个国家的
1676292641,0,0,False,False,很快上海能坐着地铁直接到苏州了[保卫萝卜_哇]
1676023641,0,1,False,False,up居然来盐田啦[星星眼]
1676220442,0,0,False,False,很现代化也很漂亮，不过我更喜欢莫斯科的地铁
1676044235,0,0,False,False,这视频做的真好
1676102915,0,0,False,False,无人驾驶?我们也没有。
1676084335,0,0,False,False,白石龙会在这里
1676029685,0,0,False,False,地铁真亮啊[支持][支持][支持]
1676186020,0,0,False,False,深圳14号线岗厦北
1676021954,0,0,False,False,刷脸可进好评
1676028560,0,0,False,False,这剪接水平，教练可以教我吗
1676001064,0,0,False,False,拍得很棒
1676036696,1,0,False,False,建议深圳233米一个地铁站
1676219565,1,0,False,False,看了你的视频我想去深圳了，我还从来都没有去过深圳，因为我超级害怕广东特产——又大又黑还会飞的大强[笑哭]但是视频拍得我真的想去了[脱单doge]
1676122466,0,0,False,False,感觉是一个优秀的纪录片
1676114812,1,0,False,False,现在地铁都支持人脸解锁了？
1676287880,0,0,False,False,长春的地铁比这个还漂亮
1676212572,0,0,False,False,武汉新建成的地铁站也挺浮夸的[笑哭]
1676043791,0,0,False,False,委内瑞拉的小哥哥
1676000000,0,0,False,False,12号线，我家楼下就是[呲牙]
1676192045,0,0,False,False,深圳地铁有没有给你广告费[脱单doge]
1676134131,0,0,False,False,那个静脉解锁的，怎么录入的呀？找地铁站服务人员？
1676023811,0,0,False,False,这也太高科技了吧！
1676185732,0,0,False,False,我一个深圳人都感觉很多东西没玩过，新奇
1676133337,1,0,False,False,[笑哭][笑哭]我这种村里人都没看过
1676209298,0,0,False,False,这个就是我们深圳的地铁站吗？每天都要坐地铁
1676188393,0,0,False,False,希望赣州早日修建地铁[脱单doge]
1676002078,9,0,False,False,深圳地铁不是不能拍照吗
1676102123,0,0,False,False,峡谷山城，木有地铁。
1676187166,0,0,False,False,什么时候最大边境尘世丹东能用上地铁🤤
1676128759,0,0,False,False,拍得真好，也剪辑得好。也大深圳威武
1676091015,0,0,False,False,无线充电在车厢哪个位置，我咋没看到[酸了]
1676152300,0,0,False,False,嘻嘻嘻欢迎大家来深圳喔
1676093471,0,0,False,False,呦呵，16号线四联站，我就住旁边[doge]
1676039561,0,0,False,False,视频做的很用心，转场视角切换都很棒
1675995382,0,0,False,False,太漂亮了！[喜欢]
1676209007,0,0,False,False,也就厉害的省会，城市才有地铁。大多数人还是接触不到。没什么好吹的，就地铁而已
1676024829,0,0,False,False,深圳在太多领域领先全国10年以上，其它城市应该学习
1676111310,0,0,False,False,最漂亮的还是成都地铁[呲牙][呲牙]
1676094228,0,0,False,False,通过vlog了解自己居住的深圳
1676004287,0,0,False,False,拍得太棒了👏🏻👏🏻👏🏻
1676175570,0,0,False,False,俺的深圳通卡里还有钱，但俺已不在深圳噜
1676034750,0,0,False,False,来自印度的爱[酸了]
1676018394,0,0,False,False,美丽的深圳
1676043369,0,0,False,False,人生太匆忙，没有注意身边的美好！
1676112231,1,0,False,False,好巧哦，遇到个在深圳的外国up[兔年]
1676199025,4,0,False,False,这种视频给中国人看没什么意义的，建议发到国际视频网站
1676170168,0,0,False,False,bbc：他被战忽局收买了！
1676129061,0,0,False,False,Thank you for uploading the same video on YouTube
1676119926,0,0,False,False,不谈内容，阁下的视频制作水平可以[奥比岛_点赞]
1676141794,0,0,False,False,欢迎大家坐长沙地铁！
1676033215,0,0,False,False,人在东莞，不想多说[笑哭]
1676033600,0,0,False,False,虽然我就住深圳，但是深圳的地铁漂亮程度不如好几个我去过的城市
1676158362,1,0,False,False,没道理啊，地铁站里咋没啥人
1676126145,0,0,False,False,唉惠州没地铁 去深圳坐地铁的时候感觉像个乡巴佬[笑哭][笑哭]
1676043154,0,0,False,False,镜头画面很好看～给你点赞[脱单doge][脱单doge]
1676027273,0,0,False,False,哇！12号线也拍了，刚开通2个多月哦！[支持]
1676115715,0,0,False,False,基础设施的建设是重要的，但往往都是借未来的钱，基础设施的维护费用才是大头
1676045018,0,0,False,False,up拍的好漂亮！好喜欢深圳，几年没去深圳了
1676006121,4,0,True,False,还是太少了，我住这里最近的地铁12号线也要800米[翻白眼]
1676014931,1,0,False,False,东莞十年搞不出两条地铁[笑哭][笑哭][笑哭]
1676030880,2,0,False,False,没文化的地铁，去看看西安地铁，满满的文化风
1676123300,1,0,False,False,@高烧39度啊  果然这才是大城市[囧]
1676087575,0,0,False,False,可以再去一下黄木岗站，也是个大枢纽
1676015537,0,0,False,False,是的，堪比美国新修110亿美元的那个火车站
1676212378,1,1,False,False,自卑的人就爱看这些
1676035933,2,0,False,False,一线城市一辈子买不起一套房更震惊
1676122811,0,0,False,False,拍的太好了，就像宣传片一样
1676128111,0,0,False,False,打开时：哇哪里的地铁我看看四联是哪里 十几秒后：啊我们深圳的地铁[doge]
1675998238,1,0,False,False,艺术与现代化的结合[支持]
1676044476,0,0,False,False,从小在深圳长大，有一说一地铁出行真的很方便[脱单doge]
1676054991,1,0,False,False,Pero las estaciones de metro en Wuhan tb son maravillosas no?
1676014596,0,0,False,False,新开的几条线我都没坐过，就11号线开通后特意去岗厦北拍了下深圳之眼。[笑哭][笑哭][笑哭]
1676035347,0,0,False,False,在上海打工的深圳人，看到你的视频起了思乡之情
1676005354,2,0,False,False,在某些地铁站你可能会被站务阻止拍摄，尤其是外国人[doge]
1676103819,0,0,False,False,哇，新线路真的好漂亮。镜头感真好。有点想去深圳旅游了[思考]
1676086946,0,0,False,False,工作日早晚高峰人才多，挤都挤不进去
1676129205,0,0,False,False,想起来乌鲁木齐地铁刚开通时，前几年都没什么人坐，我甚至不需要站着，经常出现一个人坐一节车厢的情况，说正经的，在北京五年和沈阳四年，从来都不知道坐在地铁上是什么感觉[笑哭]
1676081488,0,0,False,False,生活中不是没有美，而是缺少发现美的眼睛！[星星眼]
1676027238,0,0,False,False,经常坐深圳地铁，在别人视频里发现深圳地铁很漂亮[tv_笑哭]
1676122614,3,0,False,False,欢迎来深圳 一个根本不知道啥叫本地人的地方
1676097421,0,0,False,False,Rafa梦寐以求的播放量终于有了[doge]
1676086894,0,0,False,False,天天坐地铁上班，每次早高峰都挤死，特别是深圳北换乘，人间痛苦，希望大家都别体验到
1676121650,0,0,False,False,论地铁站的现代化标杆（不是美丽度或者艺术度），全球目前独中国一份。
1676017493,2,0,False,False,长城很伟大，可惜的是，你是建造者，并且家里无盐无米
1676068755,0,0,False,False,地铁up主，新板块诞生了！
1676078813,0,0,False,False,大惊小怪
1676129163,0,1,False,False,比北京要好看[酸了][酸了]
1676012545,0,0,False,False,再漂亮维护不好或者熊孩子不文明的人多不管严点也是白费
1676083317,0,0,False,False,这种视频在油管会限流吗
1676189176,0,0,False,False,。。。你这给中国人看，没噱头啊，谁不知道地铁是这样的，
1676014465,0,0,False,False,这人在国外多少粉丝
1676031012,0,0,False,False,感觉不错
1675996476,3,0,False,False,12号线的驾驶室不是被封住了吗？
1676203864,0,0,False,False,对于老外 这就是天堂！
