上传时间,回复数,点赞数,up是否回复,up是否点赞,评论文本
1676391216,0,1,False,False,"20年的人真不能说2000年的人，根本没法说，以别说高启强了，正常人给你两个选择：今天倒霉了惹到人了，卖不了鱼了，做不了生意了，那就是你命根子，你弟弟妹妹还要靠你养，甚至惹到的人还要欺负你，甚至干其他的事情也赚不了钱。去工厂打工最后累死的，还得妹妹弟弟养哥哥。
第二个选择拼一把，获得重生，每次都吃饱，常在河边走没有不湿鞋，那是永远都是湿鞋吗？别说高启强了，现在的企业你说他没犯过法你叫大多数人可信不？"
1676018319,2,10,False,False,社会发展的方向肯定是一股合力，所以不要说什么如果不是安欣怎么样，实际上在这条路上奋斗的人有无数，不同阶层，不同信仰。方向对了，社会就会前进。目前来看还是坚持正义的人更多不是吗？最近一直在流行一个词叫“共情”，但其实你阅历越深，越明白，共情是不可能的，能选择相同的方向就已经不容易了。
1676107028,1,3,False,False,他咋读书嘛……还有弟弟妹妹拉扯，他怎么走读书的路啊
1675955564,0,24,False,False,白话里句俗语  ～奸奸狡狡，朝煎晚炒；忠忠直直，终归乞食
1676085906,0,10,False,False,人心中的成见，就是一座大山 这种社会 怎么让人民有安全感呢
1676239215,0,2,False,False,"靠原始积累白手起家的，我很希望能看到一个有好结局的好人。。。
但是我没找到，看历史书也没找到。"
1676391146,0,1,False,False,我觉得高启强选的没错，如果我可以选我也愿意，我甚至愿意十年荣华富贵之后就立马死我都愿意。跟何况高启强爽了那么多年
1676362295,0,1,False,False,高启强的另一个方向就是：解决掉徐江之后自首，坐十年牢，出来被歧视，可能会不得已走上犯罪的道路
1676344072,0,1,False,False,大概十多年前吧，我爸找人办事儿，得带着现金去。现在找人办事儿，请吃饭都不敢去，而且，只要是合规定的，办的都挺爽快。这不就是改变么？弹幕里的各位看来都是受过迫害的呀。
1676374455,0,1,False,False,未经他人苦，莫劝他人善
1676284165,0,2,False,False,现在早就阶层分化了。别人出生就得到的，你一辈子都得不到。你要说那也是他父母辛苦应得的，那要看最初是怎么得来的。事实上，最初的原始积累，靠守法是不可能超越普通人的。
1676277482,0,2,False,False,有选择的话，谁乐意被逼上梁山
1676059246,1,4,False,False,可以看看沉默的真相[脱单doge]
1676088952,0,4,False,False,所以，社会要公平地给人机会，给人发展的机会，也要给人做好人的机会。有些人从一出生就没得选……
1676053719,1,26,False,False,"很多话其实没有对错，
只不过是对与对的争论罢了"
1675949573,18,27,False,False,安欣说的没错，高启强也说的没错，各有各的活法
1676089486,3,3,False,False,出身不是借口，那请问为什么美国是世界第一？
1676200814,0,2,False,False,也正是你选择做什么样的人，什么样的人才会造就什么样的社会和国家，我觉得还是好人多，所以国家还是好的
1676118056,0,3,False,False,活了20多年了，虽然没活透，但是也活明白了，人呐这一辈子是不可能永远呆在一个地方的，你有欲望想多吃一口肉多喝一杯水，你就得在这个社会跟别人掰手腕，这个世界想致富只能靠手段，所谓靠运气那都是骗你的，你少点上进少点心思，这杯羹你就吃不了。
1676112810,1,3,False,False,看到长椅和小朋友聊天那段我觉得这就像大超和蝙蝠侠的理念之争，但是中国没哥谭那么黑暗“恶”也没那么强大
1676046140,0,7,False,False,一个孩子想要吃汉堡只是正常的欲念，但当他为了吃汉堡不顾一切欲念就成了“贪欲”。这个孩子心安理得的接受了高启强的汉堡，是不是说明他也有可能会在之后同样的接受他人的汉堡，不管给汉堡的是谁，汉堡里有没有毒？稍一失手就是终身大错，就像高启强一样。安欣的提醒不无道理。
1676038460,0,7,False,False,一般人跨越不了阶级，犯法确实是一个可行的邪道，但是绝对是得不偿失，万劫不复
1676309002,0,1,False,False,发觉很多人三观不正，当然对于自己来说这不是错，但是对于这个社会就是错，你们毕竟是这个社会的人，就要服从社会的游戏规则，总执拗自己的想法，总要吃亏。
1676088128,0,3,False,False,安欣没背景估计早倒闭了
1676245361,0,1,False,False,曹闯真是 哎 跟李响说拿他换功名 真是心酸
1676073519,3,5,False,False,跟出生太有关系了，影视剧里所有的反派都是穷人，家境不好，遭遇过不幸。
1676050764,0,3,False,False,《一些》
1676042055,1,7,False,False,电视剧是电视剧，现实生活是现实生活，影视作品最终必定会有结局，而现实生活直到你死去，才算结束!
1676047062,0,7,False,False,聪明才智，徐忠在说他用茅台酒劝杨健投降么[tv_皱眉]
1676271731,0,1,False,False,没错，所有人都没错，恶人是被社会刻下的形状，好人也未必是圣人，但正如那句话，不是命运选择了神龙大侠，而是你选择成为神龙大侠。作为最最普通的人，我们拥有的唯一权力就是拒绝。
1676031045,0,7,False,False,个人选择，社会环境，缺一不可
1676188634,0,2,False,False,这部戏最大的不同是，不是简单的抨击黑社会这个现象，而是去探讨黑社会产生的土壤和根源。有个人原因，也有社会原因。
1675942983,2,27,False,False,干炒牛河，别具一格
1676136396,0,2,False,False,出身太重要了
1676019856,3,11,False,False,一部扫黑剧，硬生生看成了励志剧
1676031900,2,30,False,False,大丈夫生于天地间，岂能郁郁久居人下！
1675963802,2,11,False,False,开头那一幕后来小盛拿板砖把那个同学给砸了，然后就没下文了，那同学死了吗？
1676114705,0,4,False,False,狂飙这部剧很有意思，甚至看评论都很有意思
1676049001,0,24,False,False,不管人生怎么样！花大量时间去关注别人的剧本，自己的人生只会稀碎。那千里外不关自己的灯红酒绿与八卦，已将白纸滤浸得色彩混乱。没有了纯粹，认为青春普通，时间无意，演绎着糟糕的剧本，就继续羡慕那灯光前，财富下的人生。
1676394638,1,1,False,False,如果遵纪守法。估计高启强之前的性格会打一辈子光棍
1676038825,0,22,False,False,很少看剧，但是这次狂飙塑造的大部分人物真是特别的好，各个人物都有非常鲜明的特色，大部分台词也设计的不错，深入人心。我最喜欢的角色是高启强，他从一开始的卖鱼贩变成了集团的总经理最后摇身一变成为黑社会老大和京海市的委员，一手遮天，黑白两道通吃。看到这样的故事发展我也觉得十分的精彩，但是有一点是肯定的，我们都可以自己选择成为什么样的人，高启强变成这样也源于他做的每一个决定，使他越陷越深，他选择了属于他的道路，犯罪的道路，虽说他刚开始的故事非常的坎坷，非常的让人同情，但是从他选择走一些路以后就不一样了，这条路使他越陷越深，无法再回头，所以说每个人都可以选择自己的路，但是法律是一个人的底线，永远都不要走犯罪的道路。
1676036744,0,6,False,False,有魅力的角色，紧凑的节奏，逻辑自洽的剧情，有代入感的故事，高明的讲述方式
1675993716,0,11,False,False,发财的有几个钱是干净的
1676044324,2,10,False,False,这剧看到后面给我一种立意偏了的感觉，就好像在告诉人们没背景就别掺和这些事，不然就是李响谭思言陆寒的下场，毕竟现实里大多数人都是这样的普通人。当然出身优渥还能替底层老百姓伸张正义的人是非常值得尊敬的。
1675950514,0,20,False,False,多说无用，细品吧
1676041439,1,6,False,False,这也就是一个高启强，很多人都学会了妥协，当他们也会反抗，早就乱套咯
1676109465,1,2,False,False,瞧不起卖鱼的那些，先看看自己
1676082043,0,3,False,False,《海瑞罢官》是有明代封建王朝自主研发的一款缓和官民矛盾的文学作品，在这里你将扮演海瑞……
1676395259,1,1,False,False,不是一些难道是所有？弹幕真都是老董哥。
1676299088,0,2,False,False,这个剧最打动人心的地方就是 真实 真正从普通老百姓的视角出发了 不是阳春白雪 真诚才是必杀技
1676050262,0,7,False,False,看似弱小者，当他们步入黑暗，才是让人最看不清的。
1676041675,0,5,False,False,蒸馍，你不符器吗？
1676043392,0,5,False,False,风浪越大，鱼越贵！
1676179010,10,2,False,False,高启强这辈子值了，从发家到被抓，也潇洒了十几年。
1676194294,0,2,False,False,高启强是谁？[doge]https://b23.tv/5R9ubhB
1676125986,0,2,False,False,有人出生就在罗马，
1676160976,1,2,False,False,剧本不妨再写得直白，大胆一点，我就认为是神作
1676138606,1,2,False,False,"戏内，高启强靠着不法手段才最终发家致富，被观众当作是现实的写照。
戏外，张颂文靠着多年的拼搏努力，厚积薄发，用心演绎，成就了高启强这个角色，获得观众的肯定名噪一时，才是真正的现实。"
1676175993,0,2,False,False,高启盛拿咸鱼鲨人的时候有人欢呼，高启盛死的时候有人惋惜，李响呢？陆寒呢？
1676391542,0,1,False,False,我更喜欢李响
1676133620,0,2,False,False,能说一些就给足面子了，就算他们说了别的那就连一些都没有
1676141838,2,2,False,False,高启盛的自尊心和对法律的蔑视害死了他和他哥[难过]
1676183961,1,2,False,False,不论黑白灰的边界在哪里，刑法是做人的最终底线
1676050590,0,4,False,False,“以他的聪明才智原本可以为社会作出贡献”纯属开玩笑，怎么炖得出来这么难喝的鸡汤。他一个卖鱼的没文凭没钱没渠道，就算他真有那不存在的聪明才智谁给他机会转化为社会做所谓贡献?
1676303351,3,3,False,False,你凭什么觉得你寒窗苦读18年能比得上人家几代人的努力？
1676004457,10,21,False,False,遵纪守法温饱容易，富裕很难，没办法
1676170109,0,2,False,False,"可惜选择错了？可以为社会做贡献？教小孩子奋斗吃起自己能吃的东西，会变成贪欲？知道为什么这么说吗？
因为吃饱了。"
1676004120,8,7,False,False,为啥高启强给小龙小虎送电视，他们要打他啊？[傲娇]（还没得空去看剧，想先了解一下[偷笑]）
1676036279,0,5,False,False,这是要被克服的问题，不是面对问题的借口
1676056686,1,4,False,False,有人可真会杠，安欣说的不是让你放弃贪欲，这不可能，而是让你要学会控制贪欲
1676041835,0,4,False,False,忠忠直直迟早乞食
1675952306,0,16,False,False,像王传福，刘强东这样造福一方百姓的企业家也是有的，起码能提供不少就业岗位
1675953646,0,16,False,False,小龙小胡之前可能也被人家欺负，你后面欺负人了，所以你和他们没差别，没资格说人家，自由没有欺负人的，才有资格说他们俩
1676083792,0,2,False,False,谁不想过好日子
1676134883,0,2,False,False,就从高启强借着“安警官”和“安局”的名头“招摇撞骗”发的家，就足以说明人和人的不同到底会有多奇妙的反差
1676046594,0,5,False,False,人是会被推向某条路的，不是一定要走，是只有这条路。
1675945781,0,22,False,False,从未拥有，何来失去。不怕贫穷，就怕不开心。活的问心无愧，死的清清白白。
1676133588,0,2,False,False,普通人可能连唐家兄弟那关都过不去，心理素质太强
1676173996,0,2,False,False,看看弹幕看看评论区，有这种现象才是最大的悲哀。
1676045207,0,4,False,False,谁发的“安欣何不食肉糜”[辣眼睛]，是没看过剧吗？[辣眼睛][辣眼睛]
1676131916,0,2,False,False,说实话，如果小时候有人像高启强这样告诉我人生的真理就好了，钱虽然不能解决一切问题，但能解决这个世界上绝大部分的问题，没有钱真的什么都不是
1675949921,5,19,False,False,看完了 最后几集烂了
1676122594,0,2,False,False,你还是改不了翻评论的习惯啊，彭于晏
1676071015,0,3,False,False,不是在十字路口选错了，而是他的出身决定了十字路口只剩一个路口了[滑稽]
1676123095,0,2,False,False,怎么就和出身没关系呢？每个人呱呱坠地，出身能够选择吗？显然是不能！不同的出身，命运截然不同。
1676104112,0,2,False,False,出身不能决定人生 但能决定你的上限
1676094530,0,2,False,False,跟出身就是有关系，社会是真社会
1676069623,2,3,False,False,这个盛呀，长大就降低智商了。
1676048477,1,4,False,False,弹幕说“没有贪欲，我们还在山洞里”。我不同意。应该说“没有求知欲，我们还在山洞里”。而且你们是不是觉得自己比山洞里的人强很多啊？[笑哭]
1676116485,1,2,False,False,[吃瓜]罪也是人定的。你也成为给别人定罪之人你永远不会犯罪
1676008286,0,9,False,False,你们魔幻就行是吧，我比你们更魔幻就是我的错[吃瓜]
1676121960,0,2,False,False,有的人一出生，就是我们的终点，怎么没关系
1676097107,0,2,False,False,如果结局安欣也噶了，然后又来了一个新的安欣，估计会更好[doge]
1676108822,0,2,False,False,太有深度了，刷了好几遍，做什么的人由你自己选择。
1676043302,0,4,False,False,风浪越大，鱼越贵！
1676052829,1,3,False,False,跟出身太有关系了
1676182861,0,1,False,False,"我发布了一篇笔记，快来看看吧
狂飙的人物、剧情、台词都很贴近现实，每个人台词都能让人耐人寻味。
https://www.bilibili.com/h5/note-app/view?cvid=21780273&pagefrom=comment&richtext=true"
1676077613,0,2,False,False,评论里一群大聪明
1676118033,0,2,False,False,如果和出身没关系，那安欣肯定比李响没得早[doge]
1676108308,1,2,False,False,"他有那个材，没那个运气，好像也就只能卖一辈子鱼啊。
说真的，学校你教的也就是做人，至少说道德上面不会有太大的问题。
可是社会上，就是教你怎么好好做人了。"
1676390490,1,1,False,False,不说二十年，能过十年高启强那样的日子，我被活剐了都行
1676024752,0,4,False,False,可惜很多人连选择的机会都没有
1676108405,0,2,False,False,年轻的时候总觉得人能改变事情等步入社会后才知道一直都是事情在改变人，我们都是被欲望奴役的动物而已。
1675959734,0,8,False,False,有没有发现阿盛从厕所出来头上写着严禁吸毒珍爱生命。[星星眼]
1676094432,1,2,False,False,普通人努力一辈子一定也能赚大钱吧[打call][打call]
1676043972,1,4,False,False,如果人民的名义以祁同伟的视角像狂飙一样拍摄的话想来也是十分精彩
1676115485,1,2,False,False,话说……小盛打死那个人之后，后续怎么没啥报道了……公安局也没说，我一度怀疑我是不是漏看了……
1676105054,0,2,False,False,“工龄”那段话，我们单位的老员工说过一模一样的话
1676101991,0,2,False,False,出身太特么重要了，不重要那是因为他身在福中不知福
1676206164,0,2,False,False,做什么贡献 卖一辈子鱼
1676023661,0,8,False,False,出身好的不给不好的人机会，也不要高高在上教育。什么人都不能又有面子又有里子，如果有，就是所有人的敌人
1676383404,0,1,False,False,高启强这种脑子好使会审时度势的都得走上不归路，更何况普通人甚至是生活困苦的人呢？
1676285422,2,0,False,False,高启强再狠，没想过杀安欣，高启盛再疯，没想过杀安欣，老默再魔鬼，没想过杀安欣，一顿年夜饭，高启兰等了安欣21年，偏偏那个说自己深爱安欣的孟钰，却动了毒死安欣的想法。安欣敢吃高启强的药，却不敢喝孟钰的奶茶。爱了20年的孟钰，最后嫁给了杨建。你告诉我什么是爱情?但我们乐此不疲的反复，穿梭在这现实的世界，不断寻找属于自己的未来，我从来不笑话任何人，因为我们身在其中。
1676101552,0,2,False,False,还有人在说高启强有机会选对路，我只能说，你没在底层你不知道选对路有多难，要经历多少连续不断的打压，走捷径的诱惑力有多大
1676119229,0,2,False,False,家里有资产的人大部分肯定比普通人有自信和想法。。因为他有那个条件和资本接触更多东西和去尝试更多东西 底层的人没有那个时间也没有那个资本去尝试。输不起。
1676082731,0,2,False,False,都说和出身没关系，咋没人和我换换呢
1676125451,0,2,False,False,当穷人不怕死的时候，你要小心一点
1676037468,0,3,False,False,哼，是她选择了另一个方向吗？是社会不要吧！社会需要嘛[脱单doge]
1676089833,0,2,False,False,出身寒微不是耻辱，能屈能伸方为丈夫
1676447988,0,0,False,False,但是千万不要得罪聪明人，真要跟你计较起来，给你安排的明明白白。给各位提个醒儿。还有那种老实巴交的也不要惹。真心交朋友的也一样。有什么事儿都跟你说的那样的人。也是跟以上几个都是一样的。但他狠起来之后可能跟以上几位不大一样  他可能会以人头数来换自己的一条命，这种方法   所以以往的那些杀人犯大多都是从以上出来的  。不信你就可以搜一下近期杀人犯什么等等。看看他的相关信息，特征   是不是从贫困地区来的  真的，给各位一个忠告好吧。现在我自己喜欢研究一些心理学。我发现这东西真的好。抓住人的心那是一个准
1676051928,2,3,False,False,不是他在十字路口选择了另一个方向，而是没有人拉他上正确的方向
1676438747,0,0,False,False,我可以为建设那什么奉献一生，但我要不然居无定所，要不然就需要每个月上交我辛苦工作的酬劳的大部分去换取一个最后的避风港，而且这种情况要一直持续在我生命最有活力的那段时间。至于金钱至上的利己者却可以凭借金钱轻易把我踩在脚下。为什么拜金主义被批判，但大多数人还都在趋之若鹜。一切东西甚至包括道德、法制、爱情都可以放在天平上用金钱来称重的时候，追逐金钱变成一种本能又有什么错呢？
1676380939,0,0,False,False,"如果高启强渴望公平，认为社会亏欠了他，那他就应该去劫富济贫，而不是鱼肉百姓
如果他相信弱肉强食，那他就不该抱怨社会对他不公，因为按这个逻辑，当年他是弱者，活该被压迫
这是一个关于观念转变的故事，也就是“被社会毒打”的故事：相信公平的人被崇尚自由（弱肉强食）的社会粉碎了道心，然后没有选择抗争，而是打不过就加入。"
1676414526,2,0,False,False,高启盛就是被高启强害死的，倘若他后来不接触建工集团，而是和弟弟开小灵通店，他弟弟也不会死，他说他弟弟不听话，而他也不听弟弟的话。
1676323847,0,0,False,False,主要是他还不是真正的一无所有 他还有弟弟妹妹 所以弟弟死了显得他走错路了。事实上很多罪犯除了自己的命什么都没有了。某种意义上也是一种“穷寇莫追”，但社会并没有人的智慧
1676410613,0,0,False,False,只能说希望所有人都能不陷入面临极端处境，以及在面对巨大诱惑是能不完全丢失本心
1676424129,0,0,False,False,其实别太上头了，安欣和高启强这样的人少之又少，他们的存在条件很严苛，他们是许多人在一个角色身上的浓缩。接受不能改变的，改变能改变的，愿我们都有能区分这二者的智慧与能力。
1676051534,0,3,False,False,不是他选择的另一个方向，而是只有一个方向给他
1676026803,6,3,False,False,我觉得应该学安欣，升不升无所谓
1676391848,1,0,False,False,就说一个最简单的例子，以后你的某个亲戚对你孩子说，有了钱你就有了一切，有了钱你就什么都能买到，你愿意吗？
1676368409,1,0,False,False,如果一开始，唐家兄弟不跟高启强收卫生费可能也不会扯到黑社会去[doge]
1676344269,0,0,False,False,大多数人都是普通人，没有过人的智慧和能力，这个时候背景就显得相当的重要了，确实，总会有一些人告诉你，那谁谁谁也是靠自己上来的。。。。。。这样的个例确实总是存在的，但要也需要很大的机遇和时代与环境，但是这样的个例无法做为“共性”的理论去说服别人，大部分的普通人就是有背景和没背景相差太多了，我自己也是曾经享受过背景和特权的那种最普通的普通人，现在享受不到了，很清楚的能感受到这里的落差
1676179639,1,2,False,False,这部剧的正面角色有点假大空是为什么，就是看不见人民的无奈和痛苦，认为正义比什么都重要，没有人味儿
1676347774,0,0,False,False,我想说。就是屏幕前的各位，在成为资本后。也会做一些伤害没有资本的人。就如同有屈原，有岳飞。却也容不下岳飞，屈原。权力和欲望可以让人无限进步，也可以让人罪不容诛。当世界只有你一个人清醒。你便是醉（罪）的那个
1676436647,0,0,False,False,看得我真的想哭 我感觉我所有的努力就是白费 连顶层出生的人的起跑线都够不到
1676087783,5,2,False,False,李想的师傅被誰殺的啊，那一段我没看。
1676055933,1,2,False,False,我的天哪。。这个弹幕到底怎么了。。
1676387226,0,0,False,False,高启盛其实还是有机会的，他可是2000年的大学生，活到今天起码也是公司的管理层了
1676333903,0,0,False,False,看这个剧最大的感受就是身不由己的无奈，那种绝望感那种无力感，描写的太好了
1676398544,0,0,False,False,一些人总喜欢拿他有后， 台说事情，殊不知有后，台选择 同 流 合， 污的诱惑也很大，换句话说安欣要是想做 靠这个。钱可太容易了，安欣没有成为那样的人还不算好人么？还没有好坏之分呢。就因为高满足了你们对。权 钱的理想罢了，看不到多少人 被迫 害，被欺负，被害
1676424135,2,0,False,False,人们在面对失败时，总是想把原因归于不可控的外界因素，比如家庭背景，比如所谓出身。这就是人性，不过我厌恶这样的人性，不过是个冠冕堂皇的借口而已。
1676391867,0,0,False,False,正道让人走的没劲了，自然就该走偏路了
1676005377,0,4,False,False,人类就是矛盾的群体，有爱自己人害害别人，即是一个族群，又不是一个组织
1676089288,1,2,False,False,"真正有条件成为甚至超越高启强的安欣，在努力维护公平正义，一堆极可能是高启强出位的代价的人，却在高谈阔论高启强的风光和不得已？
谁给你们的勇气，和高启强共情的？高启强看到你们这帮，估计只会冷笑着问一句，“你们也配？”"
1676378594,0,0,False,False,"共情高家是因为社会大多人都穷过苦过，特别是大城市打工的，那些挤在几十张大通铺的人，某一瞬间都会埋怨的，特别是这几年都不好过
赞扬安欣那样的人是因为他是善良坚韧的，他愿意自身苦难入道，求得一方安宁
但是也不要过多在哪里说不应该喜欢高家，因为穷日子真的很难过，其实在其中以他弟弟为例子就是很典型的家庭暴力校园欺凌下的扭曲心理，被校园欺凌的人其实真的很想像他那样打对方一顿，所以应该把如何减少校园欺凌家庭暴力，社会不公等等关注起来。
这么多年过去了，其实地方办事讲人情送礼的事情也还是很多呀"
1676343924,1,0,False,False,世界也许会不公，但自身的不幸绝不该是你作恶的理由
1676401180,0,0,False,False,安欣要是没后台 刚开始要是敢像剧里一样惹徐江估计早就让埋了
1676374958,0,0,False,False,这里指的贡献就是卖一辈子鱼，别想了
1676357258,0,0,False,False,有机会，谁愿意碌碌无为，一辈子被人看不起
1676359098,0,0,False,False,聪明才智：没💰无用武之地
1676369909,0,0,False,False,"《以他的聪明才智，原本可以为社会做出贡献》，指卖一辈子鱼，被小龙殴打欺压一辈子。

小龙是导火索，但是没有小龙，他依然卖一辈子鱼，辛苦的给弟弟妹妹赚钱读书，然后自己孤寡终老。

这是勤勤恳恳的人最终归宿"
1676375126,0,0,False,False,如果都像高启强这么想，你能保证你每次都是猎人而不是猎物吗？
1676390783,0,0,False,False,错了，十字路口前是死还是活那是他的选择，现在的人应该还是比以前更觉醒了，在高启强面前就只有两个选择：死，还是犯罪
1676433742,0,0,False,False,安欣有背景，黑道不敢动他，陆寒没有背景，人没了。
1676364476,0,0,False,False,人民的名义跟这个哪个好一点其实我感觉都有塑造的很成功的人
1676378268,0,0,False,False,有才华的很多，能被人记住的只有“高启强”
