上传时间,回复数,点赞数,up是否回复,up是否点赞,评论文本
1676051750,82,7357,False,False,安欣一个小警察 没有一开始孟德海 安长林的背景 就和陆寒的下场一样 安长林比安欣成熟多了 他懂得维护正义同样需要权力 不是一腔孤勇就能惩恶扬善的
1676123456,32,1958,False,False,我还记得看结尾的时候，大概是高启强说，你说如果当初我没有去狐假虎威跟市场管理员，会不会就会有个好的结果，我当时内心就是，那你连鱼都卖不了[doge]
1676034921,72,2127,False,False,最后那段旁白太真实了，像强哥这样拥有聪明才智的人如果走到正道可以为社会作出贡献，可是如果继续守法他除了卖一辈子的鱼还能做什么贡献呢？过年的时候我一个亲戚给我说他在岗位上勤勤恳恳十几年还是一个四级科员，但是一个大学刚毕业的年轻人五年就做到了科长，能说什么呢？
1676043087,58,2983,False,False,张彪那句：不是谁都有人保。让我印象深刻
1676089031,66,579,False,False,这剧还是太缺乏对受害者的描写了，出身有关系但出身不是犯罪的借口，光看到安欣的背景，没看到他父母双亡，光看到高启强的“励志”，没看到被他害得许多家破人亡的普通人（高利贷，赌博，嫖娼，毒品），李响、谭思言、陆寒做错了什么要为别人的贪欲买单？只不过是选择了让自己最有利可图的路也叫只有一条路可走么？
1675991951,17,948,False,False,大家不要说曹队没资格说什么了[笑哭]，这时候演员本人也觉得自己是好人，所以这么理直气壮
1676039154,153,3241,False,False,在这个时代勤勤恳恳干活只能混个温饱不可能致富，你要致富就得用些手段
1676043811,39,1372,False,False,我记得我看扫黑风暴的时候就没有那么多争议，这些故事里面的黑社会一样都很坏 罪大恶极，但扫黑风暴注重描写受害者多么痛苦，宛如活在地狱中，狂飙注重描写加害者如何成长如何躲避警察的搜查。这两部拍得都很好，都非常反映历史反映现实，但侧重点不一样。不如说都别吵了，现实里别学高启强，你怎么知道自己是受害者还是加害者。
1676095346,42,494,False,False,这时候就没人想起受害者了，李响陆寒李青父子谭思言看不见，出身还真成了某些干什么什么不行的人的借口了，给你狐假虎威的机会你也不敢去音像店，就是因为没底线的多了，如何黎明赵立冬高启强等人，才导致的恶性循环，少把犯罪合理化
1676038208,21,416,False,False,他那么聪明，要是读书经商不会比现在更有前途吗？答案是肯定的，但是他能去读书吗？他不能。
1675932002,34,5822,False,False,《狂飙》台词有深度有隐喻偶尔还有点诙谐[给心心]最喜欢那句“我们还年轻，我们总要面对许多选择的机会，我们要选择做什么样的人，这决定着我们会成为什么样的人。”
1675935982,48,2944,False,False,台词是真的敢写敢说敢拍，我最开始就是因为台词追的剧
1675957030,27,1623,False,False,我擦，UP剪得这个就是我当时追狂飙的原因，就是我看到了一个普通小市民走上这条不归路的原因，这个比什么都真实，也最现实
1675946377,19,1821,False,False,"我被酒色掏空了身体，整日浑噩。
今日起，戒酒！"
1676043165,30,370,False,False,说实话特别伟光正的人物真的很难构建。。。我现在就能想起来一个海瑞，安欣有时候还是有点自私的，比如跟李响借枪，他不知道借枪这种事直接违法了吗，他平常讲原则这时候怎么就开口了。所以安欣这个角色我看的时候就有点割裂。
1675945403,15,1166,False,False,达康书记这段话说到我心坎里了
1676095850,4,48,False,False,别说高启强有得选，要是凭他的聪明才智走正路，那就是一辈子卖鱼，被人欺负，被人搜刮[doge]
1675944308,2,42,False,False,太真实了 看得我直流泪
1676103387,6,56,False,False,高启强（高启盛）受了恶，才会变得更恶，而安欣受了恶依然会做善事，这两人开始都是好人，为什么走向不同呢？因为出身环境不同，所以面对机会不公，环境不公的时候，走向就截然不同，表面上是高危害社会实际上是社会的负面产物在危害社会
1675932590,92,4193,False,False,"我发布了一篇笔记，快来看看吧
狂飙真的对得起剧名，拿下了央八近九年来的收视第一，他真的在狂飙啊。
https://www.bilibili.com/h5/note-app/view?cvid=21724260&pagefrom=comment&richtext=true"
1676014119,36,1250,False,False,"从底层爬起来的人
从顶层出生的人
想法是不一样的"
1676165027,4,36,False,False,恕我直言，每个白手起家的大老板，如果不是靠关系人脉，哪个手段干净？纯纯粹粹的按制度，安分守己，能一步一步做大做强？做梦。这就是根本原因。上升渠道只能通过其他手段才能实现
1676170329,6,39,False,False,和出生没关系吗？那为什么要有陆寒这个角色？性格，聪明程度，正义，和安欣有什么区别？区别就是出生，所以陆寒没了，安欣能一直活着
1676039574,6,57,False,False,鱼鳞刮好，鱼肚破好，还加两根葱，2块6毛算2块5，可是买给小龙小虎的电视机就要7000块
1676248522,0,11,False,False,但是也别对黑社会有滤镜昂，你以为黑社会欺压的是谁？谁没有过苦难？
1676038761,16,439,False,False,"穷活一辈子，风光20年。
－我选择后者"
1676334881,1,7,False,False,这就是扫黑除恶的意义所在，让所谓的出身低的人，让每一个普通人都在社会上有一个安身立命之所，而不是让大家生活在一个弱肉强食、充满丛林法则的世界。奉劝那些同情高启强，把扫黑剧当成励志剧看的人，你如果生活在那个世界你真的以为你是高启强吗？你99.99%是被高启强式的人埋在高速路地下，谁也不知道。
1676313231,0,12,False,False,“你跟小孩子说这些只会激发他的贪欲”“当绵羊不再愿意提供羊毛时，这个冬天所有人都要受冷”“底层的人在第一次接触到权力的王冠时，都会被其蛊惑，却对王冠旁的枯骨视而不见，只有少部分能加冕为王”
1676310445,2,8,False,False,这部剧本来应该安欣是男一号，高启强是男二号的，结果直接反过来了，高启强真是太有魅力了，简直就是枭雄，说实话在剧里我还真不希望强哥死，一个最底层的打工人直接翻身做主人了，但如果现实有高启强，我希望他快点被枪毙[doge]
1676287362,4,15,False,False,我爸勤勤恳恳为干了半辈子 还有5年退休 还是个副科 原来也管财政 管土地 我爸和安欣一样，一辈子非常正直 做了一辈子对社会有贡献的人，但我家里还住着60平米的房子。
1676391315,1,6,False,False,"你要写强盛，你就不能只写强盛。

你要写年夜饭的饺子与哥哥煲的汤
写老屋里昏黄的光与满墙装裱的奖状
写卖鱼佬满身的腥与细佬偏执的痴狂

你要写铤而走险的那两万
写天台，写小灵通，写冻鱼
写哥哥的纵容与弟弟的放纵荒诞

你要写抽在桌子上的皮带
写落在脸上的巴掌与颈间收紧的手
写出狱的拥抱与纠缠的目光

你要写逃亡的船只摇摇晃晃
写卦卦不得生吾命换吾兄
写最后的猪脚面与那一声枪响

你要写挂满红绸的小楼下溢出的血
写再也不会睁开的眼和遥遥远去的背影
写离开的心满意足而留下的世界崩塌"
1676186451,16,13,False,False,最后那段独白在十字路口确选择了另一个方向，我感觉他从来就没有十字路口，而是别无选择
1676135954,2,12,False,False,自古以来都是一样，宫阙变成写字楼了，只是换了身装扮，心里门清就好[doge]
1676177050,7,7,False,False,讲道理他卖鱼的贡献都没他做项目的贡献大
1676175681,6,34,False,False,其实在现实中这样已经是结局了
1676043995,16,36,False,False,高启强的最开始的黑化不是选择，也没有选择，如果前面不装作自己在警局有靠山，小龙小虎还是会继续欺负高启强，与徐江对线是因为不对线徐江就会来干自己，不去自首很大一部分还是因为自己的弟弟妹妹，如果不投靠泰叔，自己家开的小灵通店到后面黄成那个样子也没办法捞起来。
1676438910,1,3,False,False,其实，高涉黑的时候，弟弟也快毕业了，妹妹也差不多了，俩高材生，其实要算到最后的话，他们的生活也不一定差
1676085478,10,58,False,False,热评里带入高启强的醒醒吧，，还“风光二十年”，你做风光之下的李青父子或者陆寒谭思言的概率大多了。什么毛病。。。
1676119153,6,8,False,False,韩国就是敢拍，但是他社会还是该怎么样怎么样
1676116001,2,14,False,False,只有我很讨厌吴刚的旁白吗 我觉得他是站着说话不腰疼。。。还有他把他儿子塞进这部剧演的稀巴烂自己不觉得讽刺吗
1676213298,2,9,False,False,给我一种感觉就是，我们都知道，但是我们不改，嘿嘿
1676267490,1,9,False,False,学校总说你不能追求权力和钱财，那请问没有权利和钱财你上哪活着？就因为这些不告诉不说明，才会有多少人在中国式教育下迷茫，不喜欢学习，自暴自弃
1676387413,0,5,False,False,在名利场的坐标轴里，安欣是一条与x轴平行的直线，高启强是一条在y轴上狂飙的指数函数。只是在不知道的地方还有个叫善恶的z轴，人们的因果在那里累积，在那里被审判
1676388023,3,5,False,False,看很多人都共情反派，觉得反派说的话很实际，就知道正派要比反派难演多了
1676171845,1,11,False,False,如果勤奋有用的话那村里的牛早就发大财了[吃瓜]
1676038522,18,96,False,False,我看这种剧的第一反应就是，在那个黑社会泛滥的时代，腾讯这些大厂要是真的干干净净凭什么能做大做强，太讽刺了[笑哭]
1676041499,14,114,False,False,"颂文老师告别强子这个角色的时候说，如果回到过去他会好好过完年，再去抱鲸解决，改变这一切。可回到故事里强子这样做，我们扪心自问，真的有用么。[微笑]
他们第一次沈他的时候不知道市场有期压行为么？还是第二次李响用安欣身份嚯稀泥的时候不知道呢？
需要郑义的时候，郑艺在干等什么呢[辣眼睛]
等苦难把人哔成了怪兽，消除怪兽好像就是取得了伟大的胜利一样，欢呼声震耳欲聋。🌹[抱拳]"
1676137997,7,24,False,False,19年的时候去过一次瑞士，我以为这么发达的国家最穷的人应该也比中国的中产阶级强吧？但我们去出差的那家工厂，我和一个土生土长的本地小伙聊天，那时候我英语不是很好，有一半的话需要翻译软件交流，我问了他每个月薪水是多少，他说他在工厂里属于是基层员工，每个月6300瑞士法郎，相当于差不多4万人民币左右，我被吓了一跳，这是我当时工资的三倍了，但是除去每月的各种账单和税收，每月仅剩500瑞士法郎的零用钱，因为瑞士的消费水平非常高，每天仅仅是吃最普通的饭，三餐下来基本要50瑞士法郎左右，他不敢在工厂附近租房住，因为最便宜的房子也不低于1000瑞士法郎，所以他必须每天乘坐两个小时的公共交通上下班，这也就导致了他每天必须额外花4小时的时间在上下班的路上，所以平时除了上班就是睡觉，也就周末有一点属于自己的时间，但是他周末通常选择加班，因为这样可以赚到额外的加班费，他说加班费通常他会存起来，因为他想以后在工厂附近的城镇买房子，这样以后就不需要跑这么远了，我问他去过哪些国家，他说只去过法国，因为法国离瑞士比较近……我当时改观其实很大，这样对比一下我认为我虽然工资没他高，但我真没觉得他比我富裕多少，从那以后我还去过其它国家，看到的情况都差不多，很多人都在抱怨自己的国家不够好，抱怨社会不公平，但仔细想想，大家都一样！
1676130296,0,18,False,False,这么说吧，高启强在被动卷入徐雷之死后，他的一系列判断和操作，是九成九的人都想不到，也不敢做的。我当时看的时候就感觉，如果他去做警察或者走其他正路，真的能为社会做很大贡献，这样一个人，在那样的环境下，只能卖一辈子鱼，或者走上违法犯罪的道路才能发迹，只能说环境不给好人活路。像安欣这种后台够硬，黑白两道都有人保的，想当好人，也只能干到交警，干去宣传部门，其他人又有啥办法？
1676053808,1,20,False,False,如果你看了这部剧还认为安欣是错的，是何不食肉糜的话，那你就白看了
1676176553,7,22,False,False,说出身低，李响出身不低？他为什么就是一个好警察呢？00年高启强高启盛都开起小灵通店了，论赚钱也该够了。一个普普通通出身低的老百姓，谁会跟高启盛一样做枪啊，看剧可以，别太入戏了
1675958150,16,1331,False,False,"杀人放火金腰带
修桥补路无尸骸"
1675993853,25,125,False,False,现实中有高启强这种手腕的 这个岁数早就带钱出国 退居二线了   把孙子兵法玩儿的这么溜的人 还等你来抓   都这个岁数了
1676024592,7,68,False,False,出身好的人都说和出身没关系
1676108416,0,10,False,False,出身和环境真的是太重要了，有些东西出生下来有，一辈子就大概率都有，如果出生下来没有，这辈子基本都不会有了，环境注定价值观，注定思想认知，接触到的哪怕是一个人，对于人生的影响也是巨大的，如果可以，我也想做那个高启强，可惜我没有他的胆量，没有他的气运，没有那段时机，有狂飙就会有慢下来的时候，当狂飙到了最后，大概率的结果就是会撞上一堵坚固的墙，最后从神坛上摔下来，摔得粉碎
1676038069,1,76,False,False,安欣如果没有关系，他肯定活不过06年，就好像孟钰虽然会被绑架但是有人会救她，有人会因为她的爸爸不敢杀她。。。。但是我们不能因为安欣的背景而否定他一切的努力。。。。就好像觉醒年代那部剧，百年前，一群家境优渥的人勇敢的走进黑暗里，如所以说人间正道是沧桑。。。。。不求像安欣一样背负着很多艰难的行走在和黑暗斗争的道路里，只求如果有一天站着命运的十字路口，能劝的住自己，不要像高启强一步错步步错，从此再也回不了头。。。
1676132467,0,12,False,False,像高启强这么聪明的人不一样卖鱼卖到三十多岁？
1676241539,0,5,False,False,"这剧人物的名字结合剧情来看真的很有意思

安欣=安心
李响=理想

但他们双方却向着对方的名字前进，
安欣想要理想
李响想要安心"
1676097724,4,13,False,False,虽然我也很喜欢高启强高启盛，从小人物抓住机遇翻身，但是高启强集团后期确实太过分了，手底下的人根本不给别人活路，才导致了他的覆灭，他们明明已经起来了，没必要这样鱼肉百姓
1676133576,0,4,False,False,勤奋不等于勤劳。勤奋是上进，是向上爬做出的努力。勤劳是每日辛苦的赚取收入。你很勤劳，但是你可能没有机会去勤奋。因为每一条已知的往上爬的路都是被人把控的，要么加入他们，要么开辟未来[脱单doge]
1676106170,1,18,False,False,出身好的都说出身没用[翻白眼]
1676194752,1,4,False,False,安欣很少，赵立春很多
1676175535,1,10,False,False,很奇怪怎么这么多人喜欢共情高启强，在现实生活里，平凡的你们连成为高启强的机会都没有，甚至你们连被埋在高速路下的机会都没有，你们只能畏畏缩缩的过完毫无记忆点的一生，还幻想着高启强能代表自己[tv_无奈]
1676006013,18,90,False,False,出身怎么就没关系，安欣和他徒弟就最好的证明
1676034293,7,64,False,False,说出身没关系的基本都是出身好的那种
1676019671,71,135,False,False,说安欣有人保，在安欣那么多的生死时刻，有人保这种东西可是屁用没有的
1676097158,11,49,False,False,靠努力就想改变阶层那确实是有点做梦，这个年头努力是最廉价的玩意儿
1676005553,11,101,False,False,事实证明了人民群众不傻，心眼里面门清[吃瓜]对人民群众好的人，人民群众会把他高高举起
1676213497,0,6,False,False,没有孟德海，安长林，安心早死了，和陆寒一样，高启强要是没铤而走险，别说为社会做贡献了，卖鱼摊都保不住。
1676084040,9,18,False,False,穷人无论怎么努力还是被资本压榨的韭菜，穷人无论你怎么努力都不可能，所以和出生关系很大的[无语]
1676023548,0,62,False,False,总有人喜欢把父母的荫庇归功于自己的努力
1676168382,0,9,False,False,不是所有人都有人保 这句话把狂飙又提升到更高的高度
1676031882,5,71,False,False,安欣人确实是好。是这个社会上最稀缺的那群人，但如果他没有背景的话，他就是第二个鹿寒，真的，说实话，他的每一句话都是他心目中的社会最理想的状态，没有贪欲，没有犯罪每个人都是善良的守法公民，多美好啊。但这不现实，没有几个人会不喜欢钱。
1676038251,5,37,False,False,不要盲目崇拜高启强，普通人没有那种智慧和胆量。建议喜欢高启强的多看看李青一家
1676143129,1,6,False,False,公平只有一条，就是你只有一条命他也只有一条命。
1676039267,3,53,False,False,"我没想到的是竟然真的有人觉得高启强后来犯罪得来的荣华富贵是他应得的，三观不对了吧？建议去监狱清醒清醒呢。。。
就凭高启强害死李青一家，死一万遍都不够[吐]"
1676026732,12,44,False,False,小孩吃汉堡的那段深刻的是在后面，高启强问小孩是选择只能吃一个汉堡还是能吃很多汉堡（大概意思），那个小孩回答他：汉堡吃多了也会吐
1676044552,2,39,False,False,"总有人想着强哥如何如何，做坏事多风生水起。
但是啊，并不是做坏事，让他取得了他的暂时短暂的成就，而是他的好学、机智、判断等能力，成就了他的短暂的事业。
总有人想实在不行自己就抢YH，去偷、去抢，去赌、去做那些不好的事情，比自己安分过日子强多了。
拜托，你学习学习不好，打工混不出头，搞对象都搞不到，你凭什么以为你自己做坏事就能成为黑道老大？
正如剧里那句”以他的聪明才智“，选择道路固然重要，但更重要的是自身的聪明才智性格品质，打铁还需自身硬。"
1676099867,1,25,False,False,所以弹幕是只看到了他们辛辛苦苦打拼，没看到有钱后为了利益随意欺压百姓，甚至殴打杀害一些百姓吗。。。。他通过努力和头脑赚钱了为百姓和城市做贡献了，当然值得敬佩和欣赏，关键是他有钱后为什么做好事？是因为想回报社会吗？并不是，他有钱了就想要权利，想要的更多，而且他的钱大部分是赌场，弟弟贩毒，放高利贷，暴力强拆，在一方称王称霸得来的，都理解高启强了，那你们怎么不试着去理解贪官，人家也是辛辛苦苦收的贿赂，冒着生命危险赚来的钱，普通公务员又有多高的工资呢，都是人都是为了钱，没有什么本质的区别，如果你们能理解高启强，那也要理解那些贪官，都是为了钱嘛，但是你们并不会理解和欣赏一个贪官的，哪怕这个官为所在城市做了多少贡献，做了多少好事。
1676337083,0,3,False,False,最后一段话只能说前半部分基本准确，后半部分一派胡言，就像水泊梁山的108，等他们发展成型了你就说你们本来都是好人本来都有本事为什么去做坏事，人家是不上梁山真的没有活路，高启强如果不拼一下那就是一辈子卖鱼崽，纯纯的社会底层 一辈子都不会有翻身之日，我们不去考虑高启强的各种丧尽天良的事迹和他对社会的危害只从他凭着买鱼和凭着攀炎附势等等36计各种手段对比，你觉得哪一种有机会翻身？
1676116548,1,15,False,False,我要有安欣的背景当年就不用被迫脱掉那身警服了
1676077810,2,86,False,False,"我发布了一篇笔记，快来看看吧
靠着权力获得的，远比你从底层艰苦奋斗好使太多。安份守己积累一辈子，不及手段与权力的轻轻一挥手。
https://www.bilibili.com/h5/note-app/view?cvid=21756639&pagefrom=comment&richtext=true"
1675955779,59,259,False,False,高启强没有选择对的方向的机会
1676123119,0,13,False,False,安欣要是普通出身，丢枪就足够踢出刑警队了，直接记过进档案然后一辈子当基层民警吧。
1676017872,9,36,False,False,出身没关系 安心还能活到最后? 黑白两道都有人 而且都得大佬
1676104445,11,12,False,False,这剧挺好 但真不至于封神  火是真火  一旦火起来  就有人无脑吹了  这很不好
1676096243,1,12,False,False,有些人通过不光彩起来后，然后他就通过各种手段，把别人的后路堵死了[微笑]
1676088938,1,4,False,False,英雄不怕出身低啊，但是前提得是英雄啊，如果普通人出身真的很重要，虽然这话说着不耐听但这是事实，其实在现在真的是个人踩人的社会，不争不抢就被人羞辱，各行各业竞争真的很激烈，没办法，这是事实，真正像安欣那样的人真的太少了，迫于压力的情况下，大家都慢慢变得麻木圆滑
1676387260,0,2,False,False,我们喜欢看的不是反派，而是来自底层的逆袭
1675975837,16,24,False,False,台词整改.最后烂尾.瑕不掩瑜.凑活着看.
1676033563,3,19,False,False,看了下评论区，大多数人都是说想走启强的路子，不知道有人想过没，话有点难听，大部分人拿的是被高启强20年狂飙路上某天下午顺路踩死的一只蚂蚁的剧本，甚至连他的垫脚石都不是
1676206310,1,4,False,False,后面的高启强不值得可怜，如果带入现实绝大多数人只是被压榨剥削的npc
1676271819,0,2,False,False,这剧是政法委联合拍的，政法委应该什么都知道。
1676036694,1,28,False,False,他从弱者中走来，却踩着弱者的血泪上位
1676038410,3,111,False,False,什么叫在十字路选择了另一个方向 难道不是从他父母都不在的那一刻起他就已经没有了选择吗
1675954591,0,72,False,False,别的不说，高启盛如果有一个好一些的家庭环境。没有从小受欺凌苦难那些。凭借他的才智或许会成长为不错的人吧。父亲严重家暴，小时候受别人的欺辱，对一个人人格的形成影响太大了。
1675990266,6,44,False,False,不是他弟一直在劝，高启强早自首去了，不是他弟 他就不会去接徐雷的单子，一失足成千古恨，后面一步一步都是被逼着这么走的，高启强也是在这个过程中慢慢改变的。
1676004659,0,38,False,False,选择很多时候是个伪命题，看上去有得选，实际没得选。
1676039375,13,20,False,False,出身大于一切，别提天赋，再牛没钱培养也就是等着伤仲永吧
1676136488,0,5,False,False,出身太重要了，有些人出身就含着金汤匙，接受这世界所有的美好，就算在扶不起来。见识还是有
1676029141,1,26,False,False,以他得聪明才智，如果不走歪路子，只能当一辈子的买鱼佬
1676046360,1,19,False,False,不是高启强选择了这样的方向，而是这样的方向选择了高启强
1676098700,2,9,False,False,若果能把所有世家贵族拉下水，我愿意放弃贪欲拉着高启强卖一辈子鱼，但这现实吗安欣？
1676101637,2,14,False,False,高启强如果继续卖鱼估计成就也不会低的，他那个摊子设备都2w多，还是2000年，而且都是自己进货自己卖，每个月弟弟妹妹生活费接近2000，收入估计不低，到现在怎么也是水产大亨了
1676392208,3,2,False,False,贪婪欲望，可以是激励你的动力，亦是葬送你的深渊，是一把无与伦比的双刃剑
