上传时间,回复数,点赞数,up是否回复,up是否点赞,评论文本
1676353802,10,217,False,False,"一个物种濒危，不是看它多强，而是看它获取食物难度，猪吃的这么杂，想灭绝都难。
反之剑齿虎这些猛兽靠吃肉才能生存的，才容易灭绝。"
1676347941,17,165,False,False,每次一到动物话题就有人贬低人类，好像人类的食物链顶端地位是假的一样，别说猪了，你让猛犸象来也得被成群结队的原始人干趴下。解放双手制造武器使用武器是人类进化的里程碑，训练有素的成年人拿着钢矛别说猪了，猎杀虎熊都不是问题。
1676259864,23,92,False,False,野猪真的亲眼见后只觉得战斗力恐怖，前一阵林业局说打一头野猪2000奖励，就和高中同学他爸还有我叔一行七个人。十一只狗（正儿八经的杜高）然后为了抓到一只成年的雄野猪（后来又来了三头）。死了四条狗。活生生被顶穿肚子。两只狗腿骨折。一只狗被撞倒滚下山撞树上死了。还有一只脸烂了。十一只狗前后死伤八只。就这都没抓到。野猪身上被咬掉好多肉。但也让跑了。最后要不是碰到同学村里的专业人士真的十一只狗都得死。。很刺激。但野猪也很恐怖战斗力。所以碰到野猪一个人的情况下就跑。没有任何选择。上树很有用。[脸红]
1676277765,14,104,False,False,被驯化作为食物的动物就像跟人类签订了恶魔契约，人类尽力保你延续，代价就是要被人类吃[doge]
1676225684,149,732,False,False,首先，野猪耐力好我不否认，但是和人比的话应该要拿家猪，和野猪比起码得挑军人或者半职业的运动员，耐力与脑力是人类引以为傲的强项，不是其他动物能碰瓷的，而且耐力强不是因为身体素质或是意志力之类的东西，而是直立行走与发达的汗腺，一个省力一个散热，很多动物都输在散热上，哪怕他身体机能再强大，只要他要住在野外，就必须长厚实的皮毛，也就注定了没法进化出与人相媲美的散热系统，人类哪怕收回所有科技，那也是自然界最顶级的猎手，只需要一根木棍一块石头，组成长矛，人类的正面输出能力已经秒杀地球上绝大多数的生物，如果技能点上弓箭与毒液（蛇毒、昆虫毒）就可以征服陆地，不要忘了，人类的双眼长在正前方，世界上所有的顶级猎食者都是如此，只有吃素的才长在两侧，时刻保持警惕，而猎食者只需要专注与猎物，不要忘记本性。
1676293679,1,53,False,False,从古至今，猪的战术一再被人们成功所利用[tv_doge]
1676349871,0,30,False,False,进化路选得好，一胎多生，有武器，跑得快，聪明，不挑食
1676290144,10,46,False,False,不知道大家抓过猪没。。小时候村里卖猪，我亲眼看着6-7个手持电棒的大汉被一头家猪拱的人仰马翻[辣眼睛]最后还是猪累了回圈里吃饭的时候，偷袭，给它电倒了
1676198705,37,581,False,False,猪猪！我的餐桌上不能没有你！
1676275330,5,31,False,False,猪怎么就胖了，猪的体脂率，我看超越了身边九成九的人。
1676301714,29,77,False,False,视屏还少说了一点，猪的智商和记忆力都很高，可以从镜子里面认出自己，这一点要优于猫狗
1676209485,7,74,False,False,要不要讲下，需要依靠人类才能繁衍的动物——马，毕竟就马的习性，没有人类饲养，估计就在自然界灭绝了，就连现在的野马都是人类驯化之后，放生野化的[笑哭][笑哭][笑哭]
1676339668,4,11,False,False,前年有生以来第一次和野猪对上眼。在山上，就隔着一排灌木丛，一群野猪，两只大的七八只小的，刚对上眼双方都愣了一秒，然后两边都转身赶紧跑[笑哭]
1676344755,2,16,False,False,村里打了一头野公猪，连续吃席3天（真的只是吃猪而已[藏狐]）
1676349410,1,12,False,False,猪是进化最成功的哺乳动物之一，特别是成为人类口粮以后[doge]
1676274376,0,9,False,False,二师兄体型这么大的动物，一般一胎一到两个，对比二师兄一窝十个跟老鼠似的，又能打能抗，又杂事，还聪明（比猫狗都更聪明），没理由不强盛
1676291234,6,36,False,False,弹幕区说一斤多拿来煎着吃的，出来。你站好受我一拜
1676285511,2,47,False,False,猪是杂食动物，基本什么都吃，包括同类的肉或者腐肉。这是能生存下去的重要能力之一。
1676274490,3,7,False,False,如果有一天，人类把自己玩死了，猪🐷重回野外很快就能重新适应
1676253781,9,27,False,False,"之前看过一个很有意思的说法，是人类培养了小麦还是小麦驯化了人类，让人类转而几千年如一日为自己传播种子。
猪也是一样，放到宏观来看，猪这个种族把自身与地球最强大的掠食者进行了深度绑定，付出一定量的牺牲换来更大的基数以及更好的生存环境（人工饲养），到如今，如果说猪要被种族大消灭掉，人类绝对第一个站出来反对的。"
1676213937,9,30,False,False,"总是惯性以为猪就是猪圈里面肥肥胖胖的粉肉
但是猪真的是身边最猛的动物之一了
肉猪第一都是被阉割了，第二，出栏其实也就半年
不割蛋蛋扔山林里返祖个几年，真就得出动武装部队才能拿得下了[tv_斜眼笑]
那一身刚毛+厚皮獠牙，放藏獒也不好使"
1676295431,3,8,False,False,"古代人生活范围十里内就没有猛兽
因为人就是最恐怖的猛兽
 十个长矛手轻松围猎狮虎
一百个长矛手就能围杀猛犸象群了"
1676336213,1,8,False,False,猪是杂食动物，很人类一样
1676298389,3,8,False,False,一个吃素就能长肉的家伙
1676197806,88,1225,False,False,这种动物能生能打怎么会灭绝呢？[呲牙]
1676297962,3,7,False,False,就这繁殖能力，居然还是保护动物，不让猎杀[doge]
1676291763,12,7,False,False,雄性家猪，如果没有绝育的情况下，脾气也是很暴躁的，一般的狗子单挑都打不过。
1676302901,11,6,False,False,猪：聪明、胆小、卫生、能生，体型壮还什么都能吃
1676362408,0,2,False,False,"怎么说呢。比起体格与团队协作来说，智力就是人类能够碾压其他动物的终极武器。

想要正确理解上面那句话的含金量，就得理解人类与其他动物在智力上的差距到底有多悬殊。

一般来说，动物（包括人在内）的智力水平与认知能力是基本挂钩的。而瑞士著名心理学家让·皮亚杰通过大量研究，把人（儿童）的认知发展归类为四个阶段：感知运动阶段（0到2岁）、前运算阶段（2到7岁）、具体运算阶段（7到11岁）、形式运算阶段（11岁以后）。这四个阶段的具体内容可以在百度看到，这里就只强调前两个阶段的特点。

儿童在感知运算阶段的过程会逐渐获得两项能力：获得客体永久性和形成因果联系。值得一提的是，儿童经过这个阶段后都可以通过镜子测试。

儿童在前运算阶段则有以下的特点
具有延迟模仿和简单的语言能力
思想特点体现为泛灵论和自我中心主义
思维只具有相对性，不能进行抽象运算
思维不可逆，也就是不能从看到的结果去推测原因

对于智商公认比较高的非人类动物，可以通过大量的事实来断定：这类动物们大都具有相当于0到2岁人类婴幼儿的水平，可以寻找到一些简单的物品（说明它们的思维具有客体永久性和因果联系）。有比较聪明些的则相当于2到7岁的人类儿童，它们大都可以听懂主人的话，可以简单模仿主人或其他伙伴的行为，甚至可以掌握简单的单词，但不懂其中的原因。

但对于非人类动物来说，具体运算阶段（人类7岁左右儿童的智力）则是一个天大的门槛，是一个被基因锁死的门槛，是一个除非进行基因改造否则绝无可能跨过去的门槛。形式运算阶段则就更不用说了，对于动物来说，这种可以逆天改命的能力就是神力，人类也就是全族获得了这份“神力”后才慢慢从石器时代一路点开科技树并逐渐掌握了一些逆天科技走来的。"
1676353977,6,4,False,False,繁殖能力这么强，为何猪肉这么贵。。。怪不得老话说的，要致富，去养猪了。
1676198211,14,64,False,False,能射一斤，为啥没人吃猪鞭，猪外肾[doge][doge]
1676295771,1,5,False,False,"杂食类的动物，很难灭绝；
自然界的动物，都在往这个方向发展。"
1676309247,1,5,False,False,美味好吃的动物，在自然界里多多少少都有点实力，否则压根保不住身上的肉[吃瓜]
1676293492,0,5,False,False,还有一点，猪和人类一样是杂食动物，既能吃肉也能吃植物，在缺少食物的环境这是生存的关键。
1676214362,5,18,False,True,"你猜猜野猪能长多大？！
我老家那边山里有熊，野猪，渐金层，但是有一个小山坳里有一只野猪王，听老人说那只野猪王都活了十几年了，后来来了专业人士给打死了，八百多斤！嘴里都是大獠牙，猪皮乌黑发亮！"
1676197093,15,466,False,False,卧槽看标题我以为是芳斯塔糊，仔细一看是病毒区的3f？
1676364656,0,2,False,False,我记得黑毛猪好像是中国特有的吧，应该是吧不是很确定，后来外国佬发现黑毛猪肉质很顶就偷回去做特产，结果泛滥[吃瓜][吃瓜][吃瓜]
1676274557,0,4,False,False,十年前可看不到这个视频，真是清风流淌。───叫我慈善事业冠军
1676303113,1,4,False,False,移动的红烧肉  算个储备粮吧 也挺好
1676276103,2,9,False,False,就这中大型动物，一窝能下八九个，然后还是杂食，啥也能吃。。有这种天赋的中大型动物也就没谁了。。
1676294801,0,3,False,False,知道的越多，敢吃的越少[doge]
1676210090,3,26,False,False,"自古以来，猪的战术……
总座高见！（抢答）"
1676283440,0,3,False,False,猪必须排第一~你的生活中可以没有熊没有虎但是没了猪你就会吃不到好吃猪肉[滑稽][滑稽][滑稽]
1676222419,5,11,False,False,古来征战，猪的战术……
1676286895,0,3,False,False,在几十年前，咱们粮食少，但子弹多
1676289135,1,3,False,False,[doge]所以说，能吃能睡，活得最久
1676264724,0,9,False,False,杂食，能抗能打，适应力强，繁殖力出众，不能留存到现在才怪呢
1676209604,11,13,False,False,这么恐怖的动物早年人类是哪根筋不对才会想到把它们圈起来养[灵魂出窍]
1676264155,12,3,False,False,突然有一个想法，也许不对。我们不吃野生动物，野兽动物携带的病毒就一定不会传给人类吗？这肯定是伪命题吧！真的有很多病毒是靠熟肉传播吗？煮熟不都是蛋白质脂肪了吗
1676258976,6,10,False,False,猪是脾气最暴躁的一种动物，攻击性极强，别问我为什么知道！
1676199180,5,267,True,False,这一期竟然没有把相关论文列出来。差评差评
1676265312,9,7,False,False,那么问题来了，凭什么人类只能几秒，猪能半小时[热词系列_锤]
1676253860,1,9,False,False,二师兄伴随着人类渡过了多少岁月，红烧肉真好吃。[doge]
1676250850,1,8,False,False,猪是杂食，还特别能打，也很能生，怎么看都不像可能灭绝的
1676224190,2,10,False,False,吃的杂，又能生，还很能打，它们能灭绝世界上也不剩几种动物了
1676292004,0,6,False,False,法国向野猪宣战？亏得野猪不会说话不然这不又得投一次[tv_笑哭]
1676255995,0,7,False,False,一胎二十八个还个个存活率超高[藏狐]不挑食
1676210624,3,10,False,False,猪🐷是真的可怕，看上去憨厚的样子，可即便是一头母猪就能让大狗闻风丧胆，吃耗子、大鸡更是一口一个，小时候看见都吓坏我了。
1676258229,8,9,False,False,豨科不是猪，是与猪趋同演化的远亲，和鲸与河马亲缘关系更近。
1676409608,2,1,False,False,我看过一个老汉拿着柴刀单杀了野猪老汉还好好的活着的新闻。[无语]
1676389342,2,1,False,False,其实它最成功的进化就是不好吃且没什么特别的营养价值，不然分分钟被吃成一级，最差都得是个二级。[doge]
1676225206,0,6,False,False,太暗了想看清楚有点费劲
1676281338,0,2,False,False,开头说没有广告的，回锅肉广告就不是广告了？饿了，吃回锅肉去咯！！
1676330538,1,2,False,False,因为它驯服了人类
1676380944,0,1,False,False,野猪确实可怕，玩好多种游戏都被猪拱死过[doge]
1676220273,8,8,False,False,我记得很多植物的毒素都是对人类有毒，但是对猪没有，很神奇
1676283946,0,2,False,False,哺乳类+杂食性，想灭绝都难
1676264378,2,7,False,False,02：50这里问一下，UP说的低端武器，是火药动能转换率不高的土猎枪吗？毕竟现实里不可能存在血肉之躯能抗住全威力子弹的情况。[嗑瓜子][嗑瓜子][嗑瓜子]
1676272826,0,3,False,False,跟着人类混的都不至于绝种
1676292178,3,2,False,False,家中常备四川腊肉，煮好了存放着，随时片几下，可以当零食（真的可以），当然可以端上桌，没有配菜也能行，有配菜就更加彩色了。
1676213312,1,9,False,False,战斗力强，聪明狡猾，繁殖能力又强，，确实很难不泛滥
1676290712,1,5,False,False,猪是比较全能型的选手，除了智慧不及人类其他的能力都很全面
1676220332,0,9,False,False,[笑哭]刚出生的野猪幼崽中 最强壮的一只会占领靠前的乳头  更用力的吃奶  而这会刺激哺乳母猪分泌更多的乳汁 使得一窝幼崽都受益[笑哭]
1676281856,0,3,False,False,繁殖能力强 不挑食 适应能力强 还有一定自我保护能力 怎么灭绝？？？
1676196325,1,8,False,False,山里排座次，猪熊虎.二师兄可真不菜
1676257348,0,6,False,False,猪太能生，战斗力也不弱，老虎见了也会头疼。
1676209573,1,8,False,False,能生能打适应性强演化潜力高，这玩意儿除非出现大灭绝事件，否则很难灭的
1676272679,0,2,False,False,这生殖能力跟耗子有的一拼。
1676196104,1,8,False,False,[doge]因为我小时候读书读不好，被骂成猪，长大了被对象说是傻猪猪，宅在家里是懒猪猪，肚子饿了吃成胖猪猪
1676265014,0,6,False,False,不只是猪，猪牛羊在野外环境适应力几乎都是家禽很强的。不然也不会被人类逮着驯化[doge]
1676236418,1,6,False,False,精子库要求一次2毫升，不要问我为什么知道
1676220590,0,8,False,False,和老鼠一样。本身整体素质强。而且实力并不弱。再加上不挑食什么都吃。而且还非常能生。
1676203699,0,8,False,False,裸猿：感谢大自然的馈赠（啥都吃，长得快，生的快，还能圈养）
1676254643,0,4,False,False,猪猪这么可爱，你们忍心只吃一顿？
1676213239,1,6,False,False,不挑食生的快战斗力不错脑子还挺好
1676223970,9,7,False,False,能抗能打能吃能生，整个就一六边形战士[笑哭]
1676363742,0,1,False,False,猪猪我啊长的很好吃哦[歪嘴]
1676245270,0,6,False,False,战斗力强，繁殖力强，食谱广泛，智力高。不赶紧消灭他们等着他们生火做饭吗？[doge]
1676209956,3,9,False,False,枪是瞄不准的吧，而不是伤害不够。
1676232036,0,3,False,False,嗯？？？谁说我死绝了[tv_疑问]
1676197899,12,7,False,False,那么问题来了，这么彪悍的居居是如何被驯化成家畜的?[思考]
1676213621,0,4,False,False,猪的战术[奸笑]
1676297308,1,4,False,False,人类走后，二师兄有望赢来高光时刻[笑哭]
1676222088,1,5,False,False,我不敢相信我和猪的繁殖能力五五开
1676359144,0,1,False,False,知道越多，饿得越快[妙啊]
1676222341,0,6,False,False,有机会统治地球的猪，因为太能生而沦为食物。。。[doge]
1676213695,1,6,False,False,我们这里的🐗晚上会从山上下来到海边沙滩上来玩水，半夜经常有人在公路上看见它们。
1676209833,4,6,False,False,[doge]主要是它吃X长肉，尤其是人的，还会拱地，开荒全靠他们，又会生，而且特别聪明。
1676250013,2,4,False,False,猫三狗四猪五羊六。猪好像是两年五胎
1676248440,2,5,False,False,猪明显是做成功的动物设计之一吧，杂食性，繁殖力强，耐力不错。
1676351612,0,1,False,False,在国内就有家猪咬死婴儿的事件
1676354258,1,1,False,False,猪：我为什么要灭绝？
1676356751,0,1,False,False,那想必是因为太好吃了，又太好养了）
1676353763,0,1,False,False,一胎生10个
1676383710,3,0,False,False,"不让上山打野猪，实际上不是为了保护野猪而是为了保护头脑发热想上山跟野猪单挑的人。
野猪不是傻狍子，正规狩猎野猪成本不低，出去一次至少六七个人，三支猎枪，通讯设备，还要带上猎犬，清早上山一直爬山路爬到天黑，这事真不适合非专业人士干。
另一个问题是误伤，十几年前管理不严的时候每年都有打野猪猎枪误伤致死的事件。而且很多人法律意识不强，既然都带着猎枪上山了途中遇到别的野生动物多数人都会捎带上打一枪，多少都是块肉。"
1676214083,2,5,False,False,食性杂能生群居都不是猪没灭绝的原因。你们所说的食性杂能生的物种有很多，最后还不是被人类吃绝的杀绝的，猪能不灭绝就是因为能被驯化
1676286847,0,2,False,False,阿婆主可能是不太了解枪[doge]
1676437498,0,0,False,False,"在自然界，野猪的确比老虎、熊危险。第一是老虎、熊这种动物一般不敢跟人死斗，像老虎如果受伤了，那他可能饿死。而公熊也基本是独立生活，靠自己觅食。猪就不一样，啥都可以吃，伤了也未必会饿死，还有群体存在，能帮扶一下。
第二是人类的武器对老虎、熊的效果远比对猪好，虎熊的攻击方式主要是扑、咬、拍，这几个动作都要贴近人来输出伤害，而且都会暴露出从脖子到胸部的危险区域，如果对上人的长矛，一个不巧就以死换伤的结局，甚至自己重伤致死，长矛后的人直接无伤。但野猪不同，他就是冲，正面遭遇战对上长矛，他不会直接暴露致命区域在长矛之下，而且不管如何，冲击的动能都一定会传递到人体。再差也是以伤换伤，甚至以死换死，可能钢叉的效果比长矛好，但总体而言，只要陷入近战，正面冲突，人类很难做到无伤秒杀。
但如果是准备充分的捕猎情况，使用远程武器的情况下野猪远比虎熊好杀，毕竟野猪能一杀杀一窝，一次捕猎够人吃很久。"
1676218270,0,5,False,False,"整个片子全看完了，心里有很大触动，迸发出无数的热情，让我有一种感觉一定要做点什么的激情!

于是，我在床上翻了个身

然后发现充电器太短又翻回来了[doge]"
1676220187,13,3,False,False,国家如果能放开狩猎用不了多久就能濒危甚至极危
1676199615,0,4,False,False,省流：回锅肉[吃瓜]
1676430233,0,0,False,False,冷知识：唯一灭绝的野猪亚种是苏丹野猪，乌苏里野猪是体型最大的野猪亚种[嗑瓜子]
1676373714,0,0,False,False,其实猪的耐力不比人好，就人类这全身汗腺的散热能力，动物界每一个能比的
1676386341,3,0,False,False,野生二师兄成年体积大的可是坦克啊  能抗能打 食物摄取面广简单 更别提繁育能力了 这可不是长一身肉的傻傻的大型有蹄类食草动物一样那些动物最多也就是血槽厚点最多是个装甲运兵车。二师兄可是坦克 坦克 坦克！！！
1676251054,3,3,False,False,法国连踏马猪都打不过
1676244877,0,3,False,False,知道的越多，恐惧越多[怪我咯]
1676265965,0,3,False,False,up你在3：35左右的图选错了，那叫鹿豚，和猪血缘关系很远，与河马血缘较近
1676369585,0,0,False,False,我觉的把野猪耐力和人类马拉松比较不合适，马拉松主要比速度不是单纯耐力极限，最长的马拉松差不多5000公里，有人43天跑完，野猪应该跑不完。而且单纯跑步的话，我去年练了一个月，也一口气能跑十几公里，虽然比较慢[妙啊]现在一年没跑了，已经不行了。
1676368948,0,0,False,False,生长快繁殖快，肉料比还可观，如果抛开味道这简直就是最合适不过的肉畜
1676346256,0,1,False,False,鲸下水之前，大概也是这么一个模板
1676381363,0,0,False,False,猪猪的三大优点：聪明，可爱，好吃
1676333349,1,1,False,False,本来生猛，遇到了更生猛的人类，且被驯化
1676275097,0,1,False,False,不同物种物互相合作，能有效提高抗风险能力和存活率。
1676289532,0,1,False,False,视频结尾引发了我的馋虫，容易好想吃【回锅肉】。[微笑][doge]
1676350903,1,1,False,False,这生物长相很像努尔哈赤
1676309723,0,1,False,False,猪是杂食动物，基本啥都吃包括自己同伴死尸也吃。长的快，繁殖能力强，智商也在线。一些老猪经年累月的蹭树脂，相当于裹了一层厚厚的盔甲，根本不惧老虎和狮子
1676298493,1,1,False,False,它不成功，我们吃什么[脱单doge]
1676287792,1,1,False,False,猪有没有天敌[doge]
1676390569,0,0,False,False,[tv_斜眼笑]吃的杂好存活，生的多容错率高，气候适应性强可以全球备份不放一篮子里。有这三样，不碰上倒霉的大灭绝就很难完蛋，就算碰上大灭绝，也比别的物种机会大
1676196141,29,10,True,False,新冠不出了？
1676365877,0,0,False,False,开玩笑，大型哺乳类里面猪的生存能力绝对算是T0级别的，比大型食肉动物和纯食草动物都强得多
1676247406,1,3,False,False,之前玩魔兽都知道猪是前期比较好上手的宠物，啥都吃，有冲锋
1676262236,2,3,False,False,回锅肉 红烧肉 姜仔蹄花 冒脑花 火爆腰花 都是我的最爱[呲牙][脱单doge]
1676275398,0,2,False,False,我就在想怎么这一期就说起了二师兄，直到我看到了下面的京东链接
1676446065,0,0,False,False,没有灵长类的话，猪很有可能站上人类的位置吧
1676362267,0,0,False,False,B站就有非洲部落撒开网狩猎的视频，男女老少手持木矛蚂蚁一样铺开，矛如雨下什么河马猎豹全灭
1676395476,3,0,False,False,猎枪那段也有点离谱了吧，野猪这皮这么猛怎么不拿去做防弹衣，蛋白质挡热武器这是否有点
1676208160,3,4,False,False,一斤。。。中杯奶茶也才400ml，一杯奶茶盛不下，还要洒的到处都是。[doge]
1676201989,0,4,False,False,有一说一猪猪真好吃，猪肉炒蔬菜也香得难以抵抗[doge]
1676201572,1,4,False,False,家猪的战斗力也很强，小时候以前老家杀猪的时候看过几次，五六个成年人都拉不住，都是前后夹击把拿麻绳把腿绑住放在老虎凳上，还得专门有个人拿个杀猪刀眼疾手快的直接捅脖子。
1676255447,0,2,False,False,杂食，能吃能打能抗，简直离谱
1676248094,8,3,False,False,作为群体动物，生育能力强大，杂食性这三种因素已经生存能力堪称黄金搭档。还有能抗霰弹枪的皮肤，强大獠牙和咬合力，高智商（动物界前10）自身素质过硬，这种生物没有统治地球是因为他们太过强大天敌少，而且有点懒
1676213912,1,3,False,False,配合上核辐射这个不确定因素会不会弄出个猪球崛起？[doge]
1676292115,0,1,False,False,好动物
1676372101,0,0,False,False,因为基因序列里点了美味[doge]
1676301111,1,1,False,False,为什么狗没有灭绝，鸡没有灭绝，蟑螂没有灭绝，鱼没有灭绝。[笑]这个标题也是。。。。。。
1676206851,0,6,False,False,天敌少，不挑食，还能生
1676287514,0,1,False,False,明白了，这就开始吃猪鞭猪蛋[歪嘴]
1676213874,3,24,False,False,果然，刘峙的战术真的很厉害[脱单doge]
1676379190,0,0,False,False,知道的越多吃的越多[doge]
1676393163,0,0,False,False,我们这有被猪吃掉的成年人[灵魂出窍]
1676358928,1,0,False,False,如果真的能培育出跟狗差不多大的成年猪，那宠物界的猫狗大战恐怕就会演变成三国演义了。
1676199297,2,15,False,False,"那么链接呢？
想起去年开始流行吃黑猪肉，喝白酒也要醒酒"
1676214995,0,3,False,False,动物庄园里的猪都能直立行走了[tv_斜眼笑]
1676249951,0,2,False,False,新世界只有西貒吧[吃瓜]
1676391610,0,0,False,False,某些专家的带地就是强[支持]
1676289563,0,1,False,False,靠，饿了
1676384986,0,0,False,False,为什么某些人说的人类那么弱鸡但还没有灭绝？甚至主宰了世界？[滑稽][滑稽][滑稽]
1676259694,1,2,False,False,听说家猪放养会有返祖现象
1676213817,10,3,False,False,真正的谜题，我们的祖先是怎么把这种可怕的猛兽驯服为温顺的家畜的
1676283332,0,2,False,False,好的，刚查了恐怖直立猿就是人类老祖宗[笑哭][笑哭]有点不信
1676257511,0,2,False,False,國立中央大學知名校友[doge]
1676198799,0,7,False,False,聊天区没了[笑哭]
1676428057,0,0,False,False,以前走野道爬紫金山看到过野猪还有獐子
1676216475,2,2,False,False,我就是养殖小香猪的！！！
1676210799,7,19,False,False,重点来了，一公斤，三十分钟！
1676198473,3,9,False,False,因为它们真的好吃。
1676219305,0,4,False,False,"神特么马拉松200公里
发这条弹幕的年纪不超过10岁"
