上传时间,回复数,点赞数,up是否回复,up是否点赞,评论文本
1676264489,2,2,False,False,虽然但是，这个和19年的撞车了BV1q441177e9
1676262765,0,2,False,False,相爱很难，要勇敢一点，去感受，去体验
1676301841,0,2,False,False,"恋爱趁年轻谈

黄昏后一起散步看天边的晚霞

露营时对着满片星空期许流星划过

许愿

故意放慢跟你一起的脚步

捕捉你独特的角度

年轻时跌跌撞撞 青涩上头

成熟之后患得患失 更难动心

爱更像是棋逢对手 势均力敌"
1676391700,0,1,False,False,推荐一部电影：超脱
1676278345,0,2,False,False,希望大家都可以遇见真诚的人
1676183598,0,4,False,False,爱情只存在于两个精神健全人格平等的人之间，爱情是让两个人都变得美好向上的东西，是过程也是结果，是双方同频的电波，有最低的沟通成本。世俗中太多人将自己的私欲加以爱情之名，又自认为被爱情背叛，着实玷污了爱情。
1676176162,1,4,False,False,23年了 还没有遇见
1676386640,0,1,False,False,1000赞给喜欢的人表白[脱单doge]
1676176601,0,6,False,False,总有人的青春或生命是平淡的。所以，那些为爱奔赴的勇敢者们，你们多么幸福！
1676280711,2,2,False,False,我一直相信爱情，但23年了从未谈过，我有很大问题我承认，没钱，不主动，之前甚至内向，但退役后我至少改变的不再内向了，但我发现我和女孩说话会局促，嗯，最近我开始认为我是不是上辈子犯了什么事，还是上天在创造我的时候是不是用的完美的材料，让我根本在这个世界没有另一半，我一直在等的那个人根本没有。[笑哭]明天考科三，祝我自己一把过吧，然后看深海去了，然后吃炖烧烤，虽然和过年一样又我一个人，不过没关系，电影是我想看的，烧烤是我爱吃的，除了孤独，望以后的我也能像现在为了自己快乐快乐吧！[爱心]
1676143819,0,6,False,False,"可惜我遇见的太早，在缺乏勇气去爱的时候
可惜我明白的太晚，在失去再爱一个人的能力的时候
真希望我能拥有再爱一次的能力，再体验一次那种心悸的感觉，再体验一次时间都静止的奇妙体验，再体验一次透彻心扉的淋漓尽致
就好像，我活着"
1676162302,0,6,False,False,斯人若彩虹，你到底啥时候出现啊！！我也想谈个双向奔赴的恋爱啊！！
1676270795,0,2,False,False,美好的爱情只存在于小说电影里，我的初恋让我心碎
1676151786,5,5,False,False,总有人会克服万难来爱我对吗
1676192299,1,2,False,False,为什么学校不教爱人
1676245708,0,2,False,False,"爱上一个人会让人勇敢，
被一个人深爱会变得坚强。"
1676253251,0,2,False,False,看得我又相信爱情了，但是我看到了我发了一堆消息，她就回了一个什么的聊天记录[辣眼睛]果然我不适合谈恋爱
1676251504,0,2,False,False,希望遇到双向喜欢的人，不要再单向了，被拒和拒绝别人都让我感到无奈
1676229812,1,2,False,False,被伤过了，也不打算再拥有另一个，把自己活好就可以了，养只猫猫做个善良的老实人度过余生
1676384902,0,1,False,False,羽彤爱你呦[脱单doge]
1676384601,0,1,False,False,爱而不得，没有再爱的勇气
1676157841,2,5,False,False,准备去跟喜欢的女孩见面   我们微信聊得很好   第一次见面    祝福我吧！[打call]
1676291614,0,2,False,False,"里面看过的有
《泰坦尼克号》
《情书》
《傲慢与偏见》
《诺丁山》
《时空恋旅人》
《爱在黎明破晓前》
《哈利波特与魔法石》
《大鱼》
《一天》
《小妇人》
《美丽人生》
《真爱至上》
《怦然心动》
《海上钢琴师》
《小妇人》
《爱你罗西》
《大鱼》"
1676143488,1,10,False,False,我一直都坚定的真诚，但是真可惜啊~我没有遇到真诚的她呢。[保卫萝卜_白眼]
1676215031,0,2,False,False,今年26岁，牡丹，好希望那个人早点出现
1676159714,9,5,False,False,昨晚才和相亲对象把天聊死，一点都不想相亲，今早就给我推这个[大哭]
1676222532,0,2,False,False,"之前一直以为“我爱你”是一个俗不可耐的字眼。
但是在某些时候，你会觉得这三个字胜过很多语言，在你真的fall in love 的时候。"
1676225808,1,2,False,False,我和我女朋友在一起三年了，我们的家庭相差很大，我很想在一起，但是家庭原因，我很担心我们不能在一起。我担心我的父母看不起她的出身，担心亲戚好友的闲言碎语，我更担心她心里的压力，因为她不善表达，老一个人自己承担，我该咋办，应该继续下去吗[tv_难过][tv_难过]
1676215078,1,2,False,False,我们或许已在感情中遍体鳞伤，亦或者被现实重重束缚，但是一定要有爱，再爱的勇气。因为遇到了喜欢的人，怎么能够让她就这样溜走呢。勇敢起来，跑向心爱的人吧，朋友们
1676261826,0,2,False,False,愿大家都能碰到喜欢的人、而她/他刚好也喜欢你[爱心][爱心][爱心][爱心][爱心]
1676224953,4,2,False,False,真的会有一见钟情吗？真的会有时间停止的感觉吗？
1676215455,0,2,False,False,无所谓，我会披上孤独的枷锁，在名曰自由的牢狱里永世囚禁。禁奥义•封情绝爱斩[妙啊]
1676216263,0,2,False,False,希望今年可以遇到相互奔赴的人
1676394099,0,1,False,False,我真的可以吗
1676218363,0,2,False,False,我今年已经27了，对于恋爱，我对爱情还是充满幻想的，虽然错过了校园爱情，我也希望自己可以拥有一段真正的感情，我也想着可以走到最后。总之，现在的话，记得开心～
1676155537,0,5,False,False,爱很奇妙，产生的对象不一定是人，但确实会改变你的生活。整个人都充实平和起来。
1676218690,0,2,False,False,这个视频做的好好，看哭了都[保卫萝卜_哭哭]很好的诠释了爱情原本美好的样子，真的会感叹爱情赋予的幸福与神奇[爱心][爱心][爱心]
1676177091,0,4,False,False,剪的很好。但是爱情还是不了。。
1676400746,0,1,False,False,这么晚了还不睡？
1676210424,0,2,False,False,为了遇上那个人，我要好好努力，等着我，cute girl
1676171858,1,5,False,False,不知道为啥，谈恋爱的我总是会变的歇斯底里，我自已都感觉恐怖，我还是单着慢慢成长吧
1676165255,1,5,False,False,又是一个人，无论有没男朋友，好像没正式过一个情人节，也许别人觉得我不值得。昨天给自己买了一束花，可不开心，也不会伤心，很平静
1676165711,0,5,False,False,祝有情人终成眷属，愿你遗憾比我少一些
1676219456,0,3,False,False,"愿你不要忘记爱，爱是一种给予自我的希望，是看不见的屋顶上的光。
如果你相信爱的存在，那这间黑屋之外就是晴空万里，在此之前你度过的每一漫长黑夜，都会犹如佳酿的沉积，在开封的那一刻漫溢芬芳。
请不要忘记爱，爱是我能给予你最好的东西，也是我能获得的最好的礼物。"
1676258807,0,2,False,False,我可以一直勇敢下去，但前提是你要给我力量，你退缩一步，我就会开始怀疑自己。
1676398422,0,1,False,False,这个币投给爱情
1676399342,0,1,False,False,都是骗人的
1676174674,1,3,False,False,日漫那一点格格不入
1676201265,0,2,False,False,突然好想我男朋友啊[保卫萝卜_哭哭]异地恋真的好想他[保卫萝卜_哭哭][保卫萝卜_哭哭]
1676201049,1,2,False,False,明天满20岁，没谈过恋爱，但是我身边的许多人用实际行动向我证明了什么是失败的爱情，现在我早就不相信爱情了[脸红]
1676205657,0,2,False,False,那天为了留住她，说的话叫我自己都瞧不起自己。回想在一起的几年，酸甜苦辣，平平淡淡，没有过多的色彩，两个人只是相互陪伴而已，我感觉我自己沉浸在自己的自我感动，觉得我是个很好的男朋友，越来越感觉忽略了她的感受，也可能人家不是特别喜欢我，当我的价值不复存在，我也就可有可无了。哈哈可笑
1676176894,1,4,False,False,"啊。。。封面，我的最爱。
用余生了解你。《big fish》"
1676258294,2,2,False,False,我一直是个勇敢的女孩，可是好像越勇敢，越会受伤
1676196613,0,2,False,False,但这全都是影视里的，人们总愿意吧美好的事物搬到荧幕上，因为这些东西现实生活中太少了。如果人人都过得幸福也用不着那么多幸福的电影来填充空缺的心。更多的是随着年龄增长，找寒了心，将就凑合了。自古以来就是有情人难成眷属，有钱人终成眷属。
1676169348,0,4,False,False,喜欢看别人的爱情，自己羡慕爱情但又不配拥有爱情，因为没钱
1676180422,1,3,False,False,爱情不需要懂，只在于你相信不相信
1676173185,0,4,False,False,哈哈哈我对前任们也都是觉得对，觉得灵魂同频思想共鸣，现在再想都是还债，现在还完了，我也成长很多，是好事情，希望今年遇到真的正缘吧
1676207260,0,2,False,False,我们这些年轻人活得真的非常苦，苦到连爱情都不敢奢望，但我们依然相信爱情。
1676191866,0,2,False,False,我缺少爱与被爱的能力。
1676172041,2,4,False,False,既不想伤害别人，也不想被人伤害[难过]
1676433265,1,1,False,False,我真的好幸运[大哭]@H灵梦梦灵
1676139334,1,4,False,False,这些都成为了我的想象……我不想说话
1676196977,0,2,False,False,从来都相信爱情，他出现在任何地方，但是我从来没遇到过
1676194078,0,2,False,False,我不知道我对别人的爱是怎么样的！是因为我不够爱自己，以至于我连对别人的爱是怎么样的都不清楚。这可能就是此刻的感悟。[热词表情_世萌双冠][热词系列_身体健康]
1676196353,0,2,False,False,宝藏发现我的能力一直是可以的[脱单doge]
1676168804,3,4,False,False,昨天刚分手，四次分手都是她提的，这次不想挽回了
1676189110,0,2,False,False,或许人生不像电影那么美好，但至少，希望你能为自己而活，只有先爱自己，才会懂得如何去爱别人。每个人都有，追求幸福的权利，自私一点无所谓了，以自己喜欢的方式活着，不要留下遗憾就好
1676171384,0,3,False,False,爱可以，别结婚[吃瓜]
1676171373,0,4,False,False,遇到一个你喜欢的女孩，而那个女孩也喜欢你，这种美好的双向奔赴的爱情可太令人羡慕了
1676198023,0,2,False,False,看完真的好感动[委屈]里面的一些场景让我想到了前一个星期和她一起过元宵，一起闲聊散步猜灯谜。。。可惜现在又要开学了，我俩又不在同一个大学（幸好隔得近），但这对我来说都是小问题，我怕的就是我俩到最后也只是止步于挚友[大哭]
1676173744,1,4,False,False,莺莺燕燕的最后，人到中年，回忆中只有一个人
1676169933,0,4,False,False,看到人为了爱情奋不顾身，我觉得他们很勇敢，也很羡慕，因为他们知道所见即所爱。可是人更多时候是很迟钝的，迟钝到很多年以后，看到一个很相似的背影才突然明白，原来，我想和她在一起。
1676164723,0,4,False,False,现在的我会嘴角扬起微笑看着年轻人终成眷属，并衷心祝福他们[响指]
1676155047,0,4,False,False,《诺丁山》可太美好了。
1676359316,0,1,False,False,"首先，希望你要有被讨厌的勇气，做勇往直前的自己。
然后，希望你有被爱的勇气，当有人爱你，就让ta爱你，做享受爱的自己。
最后，希望你有爱的勇气，爱别人，更爱自己，无论世界上有没有人爱你，你都能给自己一个拥抱，做幸福的自己。"
1676447830,0,0,False,False,希望这种幸福感能永远传递下去！
1676437491,0,0,False,False,标题这句话月光蟑螂的黑森町奇谭里有类似的话“我羡慕你拥有爱人的勇气和被爱的自由”
1676443405,0,0,False,False,很难过，一直没有遇到爱的人，可能这辈子也就这样了吧
1676179278,3,3,False,False,看哭了，只不过我的心里全是碎玻璃，没有糖了
1676396235,0,0,False,False,"耶！感觉有些很好看！剧荒了我要去看！
不管那个人现在有没有出现，大家都要快乐幸福啦！"
1676435120,0,0,False,False,爱自己是终身浪漫的开始，信自己是释放光芒的开始，所有的不期而遇正在路上缓缓到来[给心心][给心心][给心心]
1676171957,1,3,False,False,已经没有爱别人或者被人爱的能力啦
1676415715,0,0,False,False,爱情啊，可能正是因为稀有，文学作品才会一遍又一遍地讲吧，因为写的人也向往[妙啊]
1676173815,1,3,False,False,我很想看这些电影，可是每次一有时间就去打游戏刷视频了[大哭][大哭][大哭]
1676139323,0,4,False,False,单身太久发现我已经失去爱人的能力了，和新谈的女朋友也快要分手了。爱情很珍贵，珍贵就在于得小心翼翼的呵护它，因为它太脆弱了
1676396551,0,0,False,False,真好，正好又是春暖花开的季节。
1676173584,0,3,False,False,宁愿相信世上有鬼，也不要信男人的嘴
1676340799,0,0,False,False,不敢去爱、不会去爱、因为我正在学习爱自己，这一生，我要把爱自己作为浪漫的开始。
1676388268,0,0,False,False,被老师冤枉 同学嘲笑 父母打骂，兄弟背叛，谁能理解我？血是甜的……没人懂我……呵呵呵……但是我才没有呢 是真的没有……我要黑化！我要让所有人付出代价！给我up主微信即可阻止黑化！！！
1676388852,0,0,False,False,BV1G8411T7og祝各位B友都能遇到能同甘共苦的那个他/她
1676420745,0,0,False,False,拥有爱与被爱的勇气，我现在做了我该做的，她退缩了，我们之间唯一一个问题我提出解决方法，她由开始接受变得无法接受，我又按照让她心安的方案去做，她又说以后可能在一起，但是如果考虑到其他情况，或许我可以有更好的选择。网上女生被pua那5条，我对号入座了，她说我跟罗泉很像（其实在吃饭之前我并不知道罗泉是谁，4个小时前才看明白。）她跟我说了几次是因为我谈的女朋友少才会以为她很重要，但现在谁会相信我内心的想法呢？我已经不知道怎么办了。
1676427016,0,0,False,False,希望在未来的日子能遇到一个携伴余生的男生
1676390026,0,0,False,False,没有面包怎敢奢望爱情，两袖清风怎敢误佳人
1676331011,0,0,False,False,若有幸遇到一生所爱，就勇敢去爱，若必定一人踽踽独行，那就好好爱自己。
1676397871,0,0,False,False,剪的是针不戳，但电影归电影。。。诶，愿有情人终成眷属，也愿单着的人能够独自灿烂[兔年]
1676443166,0,0,False,False,3:36是啥电影[保卫萝卜_哇]
1676202648,0,1,False,False,对不起，我已经失去勇气了[委屈]
1676362536,0,1,False,False,这剪得真的太棒太棒太棒了！！  我也希望我能剪出一部那么温暖人心的东西，这才是b站上该有的东西[给心心][给心心][给心心][打call]
1676398899,0,0,False,False,我就想黏着他，在他身上来回蹭来回亲[捂眼]
1676356139,0,0,False,False,有一个同封面同bgm的视频，我这几年大概看了几百遍，大多是在深夜睡前的最后一个视频，每一次看都似乎有热泪奔涌而出。一直很喜欢情感类的电影，喜欢深夜一个人在被窝用眼泪宣泄生活中缺失的感情，前些年每天晚上一部电影，后来看无可看便靠一些剪辑来回忆最初的感动，偶尔也复看一些很喜欢的电影，可再也找不到第一次时的感觉了。上一次宣泄应该还是张子枫的那部姐姐，也过去好久了啊
1676360202,0,0,False,False,“你想要爱或是被爱？”
1676388581,0,0,False,False,"斯人若彩虹🌈 

遇上方知有"
1676348002,0,0,False,False,永远相信爱情，但也相信爱情易逝。
1676365200,0,0,False,False,昨晚看《秒速5厘米》的解说哭了，再来看这些，哪怕弹幕再怎么说震撼我也没有感觉，好像自己的人生已经走完了大半，我以为错过的是某个人，某种感情，其实是错过了一段可能幸福美满的人生
1676174568,0,3,False,False,在这地儿，爱与被爱确实是需要勇气的
1676387210,0,0,False,False,爱情，我是没有了，祝愿所有看到这条消息的陌生人都有美美的爱情吧
1676351568,0,0,False,False,祝大家情人节快乐！
1676359275,3,0,False,False,情人节当天刷到，然而只有一个人孤零零躺在家里
1676370130,0,0,False,False,我一直认为世界充满爱，我一直在追随着爱，我一直也未曾拥有过爱…
1676382030,0,0,False,False,也许一生中遇到的大部分人都只是匆匆的过客！可是，过客又何妨呢？都为彼此留下的记忆。
1676138237,1,3,False,False,最近发现我似乎没有爱的勇气，很难过
1676347509,0,0,False,False,我们在一起三年了 去年中秋节她向我求婚了 今年过年她回去向家里出柜 她家人也默许了 下周她妈妈要来见我 和她在一起我每天都过着公主一样的生活
1676343909,0,0,False,False,感谢up，今天凌晨表白，被婉拒了，晚上都没睡着[无语]不过剪的很好[脱单doge]
1676387104,0,0,False,False,先收藏，等谈恋爱了看，杀伤力就没那么强了[脸红][脸红]
1676391208,0,0,False,False,不知道你会不会看这个视频，我会经常想起来我们在一起的时候，很想你，希望你一切都好。
1676372147,0,0,False,False,又是期待爱情的一天但是我这样无趣的人真的能遇到那个她吗唉
1676309827,2,2,False,False,过了12点了，今天就要返校了，很烦，刚才还把手机内屏摔碎了，真的很烦，但看了这个视频看着看着就笑了，谢谢
1676370143,0,0,False,False,很遗憾的是，你并不一定是你的best one 的best one
1676372243,0,0,False,False,从前慢，车，马，邮件都很慢，一生只够爱一个人！[大哭][大哭][大哭][大哭]
1676385329,0,0,False,False,真的好喜欢的视频，只是中间有个早恋的小朋友，他初恋在高中，就不想转发给男朋友了谁懂[委屈]
1676357981,0,0,False,False,謝謝up[保卫萝卜_哇]一把年紀還能被感動到，也許是因為我也遇到了對的人，也祝up與另一半幸福美滿[爱心]
1676435816,0,0,False,False,"送上我的三连，
暖到了. 阿里嘎多"
1676308747,3,3,False,False,今天刚刚分手，结束了将近两年的感情，心里有种说不出的难受，不知道以后能不能爱，敢不敢接受被爱，但愿以后有这个勇气吧
1676182130,4,3,False,False,世上爱情是有的，但是，，，爱情是有保质期的
1676332314,0,0,False,False,电影混剪真的好浪漫[大哭]
1676183204,0,3,False,False,最后你发现你还是最爱你自己
1676344714,0,0,False,False,真诚又坚定的人真的可遇不可求
1676381636,0,0,False,False,愿我们永远都拥有爱与被爱的勇气
1676355376,0,0,False,False,好想有那么一天，能对一个人，全心全意、义无反顾地说出那句话~[拥抱][爱心]
1676349775,0,2,False,False,好像勇敢表白，但是没有自己想象的那么勇敢[大哭]
1676350652,0,0,False,False,最可怕的是，我特么都结婚十几年了，才遇到这么一个人…
1676149002,1,3,False,False,失去的时候才会珍惜，这是我明明懂得的道理。
1676177995,0,3,False,False,封面这个都不用富二代来形容了[妙啊]我听他说全美的花都给他拿买过来种姑娘窗下了
1676160106,0,3,False,False,愿我们都有爱与被爱的勇气，都有爱与被爱的能力。
1676343480,0,1,False,False,"BGM：柔和之光
地址：酷狗搜，柔和之光网友自制版六分钟的"
1676168850,1,3,False,False,我不敢再勇敢了，我怕我的真心又负错人[大哭][大哭]
1676344876,0,0,False,False,情人节刷到的[脱单doge][脱单doge][脱单doge]
1676383241,0,0,False,False,情人节到了，我心好痛，可是我喜欢她，可是可是…。……
1676410394,0,0,False,False,爱情这东西，看别人吃糖就够了[Cat2_BlackHole!]
1676391965,0,0,False,False,对不起啊，人近三十却开始对爱望而止手。
1676381666,0,0,False,False,爱与被爱的勇气，都没有了
1676173354,0,3,False,False,是的，往日斑斓的光影中只有她一人是那么的清晰，可惜无缘
1676336000,0,0,False,False,川渝地区想脱单的进群，个人动态置顶[吃瓜]
1676348380,0,0,False,False,心里还有那么一点点余热，就留给自己吧[呲牙]
1676393634,0,0,False,False,爱情不爱情的，无所谓了，我只想平平安安地生活。
1676378259,0,0,False,False,要一辈子都在一起，幸幸福福快快乐乐平平安安开开心心健健康康顺顺利利，好贪心啊@余淮的小可爱
1676171487,2,3,False,False,我没有了，我喜欢的人都很快有了男朋友，有的速度取决于我的喜欢程度，我怀疑我是月老触犯天规被贬[大哭]
1676350298,0,0,False,False,有些时候，是控制不住的。
1676128910,0,3,False,False,好啦，今生对爱情的幻想和期待在点开视频的4:22秒后圆满了也结束了[打call]
1676363112,0,0,False,False,永远抱有期待，坚信不存在。善意待人，严于律己！
1676367837,0,0,False,False,谈过恋爱但都不是真爱
1676376952,0,0,False,False,很抱歉，我已没有了这种勇气
1676172879,0,5,False,False,多出点我就得意这种精神鸦片[doge]
1676368197,0,0,False,False,加好友，无任何其他操作，通过了就10元当场立结（洗数据）
1676162945,1,2,True,False,封面是什么的片段啊？求up分享
1676293755,0,3,False,False,“有人住高楼，人在深沟；有人光万丈，有人一身锈；世人千万种，浮云莫去求，斯人若彩虹，遇上方知有。”
1676390213,0,0,False,False,感动但不心动，爱也许轮不到我
1676294793,0,0,False,False,哎，看见标题点了进来，想想自己不配退出去了，忘了点赞，留下这条痕迹
1676390556,0,0,False,False,永远 永远 永远相信爱情
1676353977,0,0,False,False,28了，是不是很失败......
1676384030,0,0,False,False,情人节快乐！我不想再做单身狗了啊啊啊啊啊啊啊[tv_发怒][tv_发怒]
1676396450,0,0,False,False,封面图出自电影《大鱼》
1676399276,0,0,False,False,我也想像他们一样开心的笑
1676389514,0,0,False,False,带名扬四海玩的都是好人[doge]
1676374479,0,0,False,False,没有爱与被爱的勇气
1676361815,0,0,False,False,热爱电影的我和失去的我哭了
1676381450,0,0,False,False,别把 放心  不是人人都是主角[doge]
1676344515,0,0,False,False,你这片单没有一部国产的？国产日韩爱情剧不配吗？[保卫萝卜_哭哭]
1676166178,7,3,False,False,"我发布了一篇笔记，快来看看吧
家人们这两部是什么？
https://www.bilibili.com/h5/note-app/view?cvid=21775510&pagefrom=comment&richtext=true"
1676278742,2,2,False,False,我一直都相信着爱情啊，也希望我们每个人都能好好地爱与被爱[给心心]
1676395203,0,0,False,False,看见你的时候都适用跑的
1676138811,0,2,False,False,爱可是奢侈品.
1676374274,0,0,False,False,希望爱情永远幸福
1676388086,0,0,False,False,还是会为爱情感动流泪啊
1676348416,0,0,False,False,我突然不懂爱情是什么
1676351394,0,0,False,False,01:04 这部是什么呀！想看
1676169445,3,1,False,False,女生用书扇男生的是哪个电影[星星眼]
1676339856,0,0,False,False,愿我得偿所愿
1676171887,0,4,False,False,因为独属于我的蒙娜丽莎，我早已遇见
1676419048,0,0,False,False,happy ending～
1676364058,0,0,False,False,爱一个人真的好痛苦
1676370081,0,0,False,False,错过了就很难在有了
1676390799,0,0,False,False,时间停止过，但我没有停留
1676164416,0,2,False,False,爱与被爱，都很幸运！
1676366884,0,0,False,False,这两种我都没有[小电视_笑]
1676398650,0,0,False,False,失去爱的勇气了
1676350697,0,0,False,False,我没有，将来也不会有的
1676372508,0,0,False,False,[洛天依_傲娇]双向奔赴的爱到底在哪里
1676374545,1,0,False,False,我爱今天的夕阳 梅花盛开
1676133840,0,2,False,False,爱与被爱都需要勇气！[打call]
1676387236,0,0,False,False,爱是一物降一物
1676301902,1,1,False,False,我也会被爱吧
1676300897,0,1,False,False,爱在三部曲[爱心]
1676278715,2,1,False,False,@无昵称啊呀哦
1676393774,0,0,False,False,可惜终究只是电影
1676163797,0,2,False,False,爱情很美妙可惜我不配
1676384959,0,1,False,False,@打小是祖宗0218
1676266953,0,1,False,False,[酸了][酸了][酸了][酸了][酸了][酸了]
1676265304,0,1,False,False,三连了
1676298893,0,1,False,False,希望永远能爱与被爱！
1676392468,1,0,False,False,@晓晓晓东弟弟 我要你一辈子都幸福[害羞]
1676219015,0,1,False,False,[兔年]
1676202931,0,0,False,False,剪得太好了，剪得我头好痒，恋爱脑快长出来了（不是
1676216794,1,1,False,False,我不相信爱情
1676368241,0,0,False,False,才11号就开始预热了吗
1676427375,0,0,False,False,愿我拥有钱
1676302794,0,1,False,False,看啥，明天还不是得一个人过[难过]
1676149578,1,2,False,False,我们现在应该更像陌生人吧
1676307749,0,1,False,False,我永远相信爱情❤️，相信我有爱的勇气！
1676265064,0,1,False,False,想问一下背景音乐叫什么，谢谢[保卫萝卜_哇]
1676303647,0,1,False,False,完了头痒，要长恋爱脑了
