上传时间,回复数,点赞数,up是否回复,up是否点赞,评论文本
1676418541,0,0,False,False,真的很爱大鱼！！！
1676205825,0,1,False,False,@嫉妒八戒肚子大 正能量
1676303028,0,1,False,False,"I will break your heart 
already break"
1676398161,0,0,False,False,没有这个能力你知道吧
1676311169,0,1,False,False,这类视频真的好喜欢，上次在首页刷到还在3年前
1676206096,0,1,False,False,@尼莫.
1676384183,0,0,False,False,喜欢整个世界和你！
1676168794,1,2,False,False,没有了，不敢了，怕了[喜极而泣]
1676304456,0,1,False,False,单身，情人节再看一遍[脱单doge]
1676299346,0,1,False,False,让我们为爱拼个头破血流吧
1676108610,0,2,False,False,不被爱才是常态
1676307920,0,1,False,False,我选择相信爱情，纯爱狮子永不认输，永不妥协！
1676309001,0,1,False,False,我敢说这是，中国最伟大的爱情故事 https://www.bilibili.com/video/BV1za411h7f3/?share_source=copy_web&vd_source=eb39e3a834c5c319c08715a05e9f4bf8
1676443888,0,0,False,False,Love  yourself
1676302133,0,1,False,False,明天情人节，单身狗看这个真的合适吗
1676282226,2,1,False,False,距离情人节的前一天分手了。
1676305382,3,1,False,False,我有一个喜欢的女孩，但是我不敢分享给她。
1676300100,0,1,False,False,爱情真的很美好啊，可惜遇到自己喜欢的人几率本来就很小
1676169937,0,2,False,False,大鱼，爱乐之城，情书[委屈]心中神作
1676169611,0,2,False,False,唉……无论如何愿我们都有爱与被爱的勇气！！！
1676292650,0,1,False,False,相信爱情，同时也热衷自由
1676392333,0,0,False,False,To love
1676339321,0,0,False,False,感谢博主，辛苦啦，很感动
1676178321,0,2,False,False,以前这种视频我是不会点进来的，谈过一次以后手欠欠的
1676223722,0,1,False,False,勇气尚余 她已不在
1676358745,0,1,False,False,https://b23.tv/BV1xY411e7Rx
1676395929,0,0,False,False,还以为是川宝呢
1676250755,0,1,False,False,点开就想到了n久之前收藏的一个【电影混剪 | 愿你有一天终将与重要的人相遇-哔哩哔哩】 https://b23.tv/WHv9s9y，这音乐真的点开就爱了
1676141962,1,2,False,False,真好，是我遥不可及的梦想
1676168904,0,2,False,False,谢谢up，感受到这样的幸福了[给心心]
1676131635,0,2,False,False,爱与被爱的勇气......是黑森町奇谭吗
1676132967,0,2,False,False,如果你有空的话，愿意和我约会吗[脸红]
1676271236,0,1,False,False,Thank u！（敬礼～）
1676303220,0,1,False,False,这稀有而美好的爱情，在这物质的社会下是不是越来稀少了？[辣眼睛]
1676219585,0,1,False,False,周星驰你什么时候嫁给我[保卫萝卜_哇]
1676185212,0,2,False,False,孤身祝福每一份诚挚的爱情
1676373380,0,0,False,False,再也不会有喜欢的人了。这辈子就这样了
1676129512,0,2,False,False,二分二十七英语字幕错了一个词（不好意思，一不小心看到了[脱单doge]）
1676383887,0,0,False,False,封面是恋恋笔记本吗？
1676180751,5,2,False,False,刚被相亲对象拒绝 但是我想努力一把哪怕最后结果没有变化 。
1676177586,0,2,False,False,斯人若彩虹遇上方知有
1676166275,1,2,False,False,为啥我的遇见，我也以为是这样，咋都成了，你是个好人，我们不合适，轮不到你，忘了吧[笑哭]不敢奢求了，应该是我还不够努力吧
1676161063,1,2,False,False,单身二十多年对爱情毫无波澜了[呲牙]
1676162498,0,2,False,False,现在，我觉得，有些东西，真的会事与愿违。除了我们自己，好好爱自己吧，各位。
1676424874,1,0,False,False,@七龙珠_京墨 @和小涵说晚安吗 @钨丝精神状态很好 @肉肉素未谋面的老婆 @_北一鹤_ 太美好了来看看
1676215792,0,1,False,False,24岁，还在等一个有缘人
1676204000,2,2,False,False,这辈子不知道，能不能遇到一个心爱的女孩。[酸了]
1676297858,0,1,False,False,我相信爱情，但我从未拥有过，假如我是异性，当然也不会喜欢自己
1676125877,0,2,False,False,爱情是有的，只是不知道自己在害怕什么
1676426730,0,0,False,False,封面是什么，看着很舒服
1676220407,0,1,False,False,那就祝福被爱者，祝福自己
1676126943,0,2,False,False,剪得真好，但…请别让我刷到了，会再一次的难受[大哭]
1676084243,0,2,False,False,雨中灯市欲眠原已萧萧数年。
1676287033,0,1,False,False,"致单身的您一封信📩：
 
    浪漫不仅是诗里的乌托邦，还有我送你的活动邀请，请允许我成为您的幸福通道
    爱是永不止息 （林前13:8）
欢迎您加入2月14日 盲盒-初遇线上情人节交友活动
-也欢迎想帮其他人找另一半的您🙆‍♀️ 
免费参加请私信我！"
1676383693,0,0,False,False,最后那个是啥电影
1676388212,0,0,False,False,Thank you
1676197797,0,1,False,False,这辈子应该不会遇到了
1676372262,0,0,False,False,不存在的
1676271802,0,1,False,False,14号之前刷到这个！是想告诉我，爱还是会来的嘛？只要一直保持着一颗有爱心[喜极而泣][喜极而泣]但，请尽快来啊！
1676386627,1,0,False,False,封面是什么电影啊
1676254233,0,1,False,False,没钱没颜没勇气没爱人
1676147211,0,2,False,False,你像是潜在字句的语法，完全我生涩的情话
1676275677,0,1,False,False,情人节前夕，放这个[喜极而泣][喜极而泣][喜极而泣]
1676213262,1,1,False,False,视频封面的图是那哪部电影的，好喜欢
1676258369,0,1,False,False,我不配，马上40了要孤独终老了吧
1676080260,3,2,False,False,虽然但是……我是打算在情人节这天分手啊……
1676176195,0,1,False,False,@佳子不想吃药
1676347034,0,1,False,False,@啊眠儿 看到了我们 嘻嘻
1676213579,0,1,False,False,见大鱼进，我真的好喜欢大鱼
1676229153,0,1,False,False,为了更好的观看体验竟然都没有水印，好朴实的up，爱了爱了
1676254190,1,1,False,False,既然点进了这个视频，不要回想过去，享受现在好吗[爱心]
1676229542,0,1,False,False,md给我条单身狗看哭了[大哭]
1676218994,0,1,False,False,很简单，我现在直到24岁了 我也想爱与被爱 我很想趁着现在还没过年纪 去勇敢一次
1676440070,1,0,False,False,二十多年来，因我爸赌博，我姐高中读完就打工，我没钱读本科，家里还欠着债，他不悔改，自以为是，从来没有过一句表扬，做错一点都能骂个不停，还动手打我妈，已经受够了，等我妈不在，我亲手送他陪我妈去
1676271036,1,1,False,False,我26了 桃花运很不错 可是一直单身 因为我一直没找到那个一眼望去互相热烈的眼神 我知道这难如登天 但我还是热烈的渴望着
1676221100,0,1,False,False,被爱是一件很幸运的事 勇敢去爱也是
1676170250,0,2,False,False,女孩等了我6年 那天才反应过来
1676273420,0,1,False,False,可这些都存在于文学作品，艺术品中，但艺术是高于生活的。我相信，但是也反抗不了现实，所以我会将它放在我心灵的一寸地方上，使它得以永久保留。
1676264985,0,1,False,False,爱情的开始总是浪漫的，但不可能一直浪漫下去。
1676219403,0,1,False,False,我很幸运，大部分都看过，并且对美好的爱情心存期待[干杯]
1676280623,0,1,False,False,爱过，但是累了，只能祝各位遇到对的、喜欢的人。爱对方是对的，但是也不应该忘了爱自己，关心一下自己。[打call][打call][打call]
1676239444,0,1,False,False,愿你走变千山万水，归来仍是少年
1676255796,0,1,False,False,成长 各种状态 心眼早开为好 何为虚幻何为梦 需要一个陀螺告诉你 当然 或许你可以靠自己让它停下来
1676268827,0,1,False,False,当你看到爱情轰轰烈烈的时候，也应该接受本就占爱情大多数时间的平平淡淡。
1676381889,0,0,False,False,剪的非常棒[打call][打call][打call]
1676274099,0,1,False,False,相信爱情，却不相信自己可以拥有的。很抱歉这么说，但个人觉得这样真的很可怜。你们要相信美好的事物，你也能拥有吖。[打call]
1676257557,0,1,False,False,两袖清风，怎敢误佳人[跪了]
1676386835,0,0,False,False,@Blakelivelyv
1676259763,0,1,False,False,原来大家都在期待爱情，那就希望下次遇到的人也和我一样，是带着真诚去奔赴的。
1676226597,1,1,False,False,真的好怕爱人，只想玩。。
1676219713,0,1,False,False,天 封面那一幕我真的记好多年 真的好浪漫[大哭]
1676400785,0,0,False,False,@不会骑海豚 因为在看这个嘛宝贝
1676215340,0,1,False,False,太美了，我对爱情抱有希望，对人对我自己却难以信任
1676345821,0,0,False,False,封面是big fish
1676229516,1,1,False,False,"有一说一，不是我桑，我已经有点不信了[笑哭]去年追了一个暗恋的女孩  emm
今年也毕业了 还是好好工作挣钱吧   后面有一定能力了没准心态就又转换了 又有了 追求的动力或者是喜欢别人的意愿"
1676167660,1,1,False,False,@我_向上是迷茫 [给心心][给心心][给心心][给心心]
1676227256,1,1,False,False,许愿自己也会获得这样一份真挚的爱情。哪怕等多久，也一定要出现！
1676217489,0,1,False,False,生的每一刻，都要对美好的事物保持憧憬和向往，留住那一份冲动，直至生命最后一刻！
1676215679,0,1,False,False,这种爱只存在于好看的人身上怎么办[酸了]
1676197880,0,1,False,False,就在春节，我也遇到了我爱他，她也爱我的女孩子啦啦啦
1676359788,0,0,False,False,特别棒特别爱[给心心]
1676389790,0,0,False,False,期待相遇
1676272895,0,1,False,False,纯爱战士！请求出战！为自己的爱而战！为这个充满欺骗的世界而战！
1676256205,1,1,False,False,爱情需要一个人不仅仅外貌上一见钟情两情相悦，还需要长期灵魂契合。也许世上确实有一个人适合你，但是一辈子都无法有交集。
1676214199,0,1,False,False,真正的爱情，是两个有趣的灵魂相互碰撞，而彼此相爱！而外表的优秀只是锦上添花
1676141347,0,2,False,False,斯人若彩虹 遇上方知有
1676191552,0,1,False,False,曾经拥有三十多了应该不会再有了
1676357449,0,0,False,False,不想告白
1676387821,0,0,False,False,我依然憧憬
1676214339,0,1,False,False,"不要介意年龄
我的朋友
只要心脏还能跳动
就可以为爱情注入
最新鲜的血液"
1676212666,0,1,False,False,最后都埋于现实，归于尘埃，那怕再相爱，现实生活终究压倒一切
1676205914,1,1,False,False,"我相信爱情，
我也努力让自己更好，
我也期待美好与热忱。
但在高中里错过了一次，
但在大学里怯怯拒绝了一次，
但在工作后错付了一次。
我又开始怀疑自己的真心与性情，
然后好像又懂得了，
无关乎时机对不对，
无关乎对方错不错，
人生百态，不断失去或得不到才是普通人的常态。
让自己更好，能遇上了就是最好的天意，
斯人若彩虹，遇上方知有，
坚持善待自己，善待他人，善待关系。[微笑]"
1676222301,0,1,False,False,看到这样的爱情，我很喜欢，很羡慕即使知道他是演的无所谓，因为我相信现实里一定会有这样感人的爱情，能让我感动，我希望我能遇到这样的爱情，但是我又怕这样的爱情真正砸在我面前的时候，我会感到无助，会害怕，因为我不知道我获得这样一份爱情，我需要付出什么代价，是房？是车？是钱？是家长的为难？还是一些其他的困难？所以我想啊只要能看到别人幸福的模样，我也许也能被分到一点边边角角就已经足够了。[脱单doge]
1676211103,0,1,False,False,这些美好让它留在回忆里会更美好，如果留在现实中，长时间的柴米油盐会消磨殆尽，我一直以为是这样的，但是慢慢的又不同了，人生本来就是一场体验，3万天而已，追求开心快乐就好了，说不定意外来了
1676172820,0,1,False,False,好喜欢这种感觉@Lil-Waterislit
1676197370,0,1,False,False,剪的太好了，跟One piece的音乐很搭啊[打call]
1676334534,0,0,False,False,永远相信
1676434550,0,0,False,False,@Ballmeat 要一起看完哦(｀・ω・´)
1676402072,0,0,False,False,谢谢
1676209159,0,1,False,False,如果我们都可以过得很好，拥有爱与被爱的勇气，相信我，你会遇到爱的人，当然，也是爱你的人
1676189046,0,1,False,False,愿所有人都永远拥有爱与被爱的勇气
1676194486,0,1,False,False,当初再珍惜一点点、也许结果就不一样了....
1676379271,0,0,False,False,封面是啥
1676351302,0,0,False,False,love you@王刀刀er
1676206280,2,1,False,False,美好的梦总会在现实中被打碎[tv_难过]
1676193750,0,1,False,False,我是没勇气？ 我是没钱[大哭]
1676374312,2,0,False,False,我都没有
1676194015,0,1,False,False,能够带给那些张口闭口都是科幻的自以为是一些触动，就已经成功了。
1676353420,0,0,False,False,谢谢哦
1676335114,0,0,False,False,我想你了
1676393575,1,0,False,False,封面是什么电影？
1676195075,0,1,False,False,我不会因为一段失败的恋情去放弃对爱情的追寻，虽然你做的不尽人意，但我仍然感激，在我过去的四年里，有你的陪伴。但是原谅我，就像我每次原谅你一样，真的走不下去了。我曾经说过，只要你爱我，我可以坚持到永远。但其实你早就不爱我了。我祝你余生幸福，但我不希望我的余生和你再有任何关系。
1676191730,0,1,False,False,我还年轻，但我会永远爱我身边的人，特别的那个她可以不存在，但我还是会一样的爱我身边的人。
1676193402,0,1,False,False,有些人，不在身边，也不会常常想起。但一旦想起，就不只是与那个人有关的回忆了，可能是整个青春，也可能是与其无关却是自己的大半个人生，甚至还有自己往后的人生。
1676381199,0,0,False,False,封面是什么电影啊？
1676189340,0,1,False,False,小小安妮是我的喜欢的，笨拙热烈质朴纯粹的安妮终于有了属于自己的家庭和爱人，自己以前摇摇晃晃走过的泥巴路也会有人站在一个地方等着回家。
1676390447,0,0,False,False,年少无知的时候，才会觉得影视剧中所谓的爱情多么伟大动人，终有一天会发现他们是多么可笑，所有的影视作品和文学艺术都在像PUA一样向我们灌输：爱情是人的阳光，是人的雨露，有爱就能战胜一切，爱的让人可以风雨无阻，总之搞得没有爱情人就会马上枯萎一样。尤其近几年各种国产影视剧中更是离谱。打开电视机，武侠剧得要恋爱，科幻得要恋爱，伦理剧必须有，甚至枪林弹雨中也不能免俗，就差新闻联播里没来上一段了，真是能恶心人。我不知道这种近乎滥俗的视听洗脑，对当代年轻人的爱情观究竟能有多少正面效应。但不可否认的是，现实中那些感情里动不动闹着寻死的小仙女，追女生得不到就毁掉人家的人渣，绝对有这些影视作品的功劳！
1676342146,0,0,False,False,投币、点赞，喜欢。
