上传时间,回复数,点赞数,up是否回复,up是否点赞,评论文本
1676415144,0,0,False,False,真夏龙お爺さん、こんにちは。bilibiliに入ってようこそいらっしゃいませ。初めまして、今後も頑張って。
1676307486,0,2,False,False,永不言弃的雷欧，永远热血的凤源，身为王者的狮子高傲的头颅从不低下。欢迎加入哔哩哔哩真夏龙老师
1676223881,0,2,False,False,あなたは来ました 本当に来ましたか 少し興奮している
1676370666,0,1,False,False,[脱单doge][脱单doge][脱单doge]
1676275097,0,2,False,False,被吉普车追的师傅
1676370267,0,0,False,False,太好了，雷欧老爷子终于来B站了[嗑瓜子]
1676210915,0,2,False,False,老爷子现在还有举办线上线下的粉丝会么，有没有报名渠道呀[星星眼]
1676365868,0,0,False,False,欢迎老爷子入驻b站[热词系列_好耶]
1676353576,1,0,False,False,"そなたは,本当のウルトラマンレオか[大笑]"
1676361069,1,0,False,False,当年风华正茂的雷欧，也敌不过岁月的侵蚀啊……
1676198704,0,1,False,False,狮子之瞳永远闪耀
1676432543,0,0,False,False,你的表情怎么回事，那眼泪又是怎么回事！
1676268692,1,2,False,False,什么时候找赛文报吉普车之仇？[滑稽]
1676362603,0,0,False,False,看着老爷子逐渐苍老的面孔不经意的哼起了星空叙事曲，那年老爷子才24……时间绕过谁
1676433498,0,0,False,False,雷欧算不算临时工转正。
1676345636,0,0,False,False,欢迎老爷子入驻!!! 雷欧奥特曼我的童年!!呜呜呜[大哭][大哭][大哭][大哭]
1676197293,0,3,False,False,tnnd，赛文还在追我
1676212329,0,2,False,False,真夏龙来b站啦！
1676218013,0,3,False,False,太喜欢老爷子和雷欧了，感谢老爷子陪伴我度过了我最开心的童年
1676206965,0,2,False,False,赛文在哪
1676205402,0,2,False,False,雷欧！
1676368877,0,0,False,False,真的是岁月不饶人啊，老爷子明明年轻时候那么帅气大哥哥
1676214254,1,2,False,False,IP：江苏？
1676336619,0,1,False,False,梦比优斯呢，快来跟雷欧对对碰[脱单doge][doge]
1676271056,1,3,False,False,想说日语控你起哇 突然发现我不会写[囧]
1676200918,3,2,False,False,你的ID地址怎么是江苏
1676294257,0,2,False,False,6啊，不可思议[热词系列_知识增加]
1676337393,0,2,False,False,终于看到老爷子了[给心心][给心心][给心心]，我将来要去日本留学，想跟老爷子握手和拍照。
1676223143,0,2,False,False,训练小梦@五十岚隼士
1676204988,0,2,False,False,我丢是真的，欢迎入驻[打call]
1676201152,0,14,False,False,狮子之瞳闪烁着光芒！
