上传时间,回复数,点赞数,up是否回复,up是否点赞,评论文本
1676368728,84,4792,False,False,没写重点，高考宿迁理科状元
1676376590,61,1642,False,False,"绝不能把刘强东定性为普通人
他只是出身普通
但他的意志力等等是人类里面顶尖的"
1676369366,50,3463,False,True,刘强东逆商很强啊  。巨能赚钱 然后亏损还能迅速还上 并且继续转换思路  。属于一条鲶鱼一般。看视频里 他有过三四次失败经历  每一次都是损失惨重 倾家荡产那种。但是 继续爬起来 淦。这样的人的父母应该也不会是普通思维的人 。刘强东和多少农村出来的有正气的少年一样 开始都是想着做父母官 改变社会。最后发现一点都改变不了。然后 及时转型  成为一代商业枭雄。
1676378540,114,1343,False,False,他父亲一个五零年左右的人有高中学历，就这一点就足够厉害了
1676378389,5,331,False,False,所谓二代资源，是指出生即拥有的，资源比方说金钱，人脉这些，出生没有而后天拥有的，就叫一代，不论是富家千金女友还是相助的贵人，这些东西他出生没有，是他后面凭借人格魅力得到的，那就是一代，显然，刘强东就是标准的普通人甚至穷苦人靠读书奋斗逆袭的最典型的案例。
1676375186,45,512,False,False,不得不说京东的次日达真的爽歪歪，谁用谁知道[脱单doge]
1676363421,77,833,False,False,东哥确实是普通人的顶点了。想成富一代，还得好好学习。
1676354529,72,488,False,False,他为什么总是被骗[笑哭]每次被骗的还不少，还能越挫越勇，继续创业？
1676367421,7,142,False,False,最让我震惊的就是东哥从小到大一成不变的发型
1676355906,63,740,False,False,刘强东看完其实才是一个普通人崛起的榜样，又努力又能把所有机缘抓住。
1676371115,33,285,False,False,大二一个月就能赚五w，厉害[笑哭]
1676354453,17,88,True,True,强哥真的算是白手起家！
1676389902,33,78,False,False,笑死，父亲仅上过高中？那个年代，高中生比现在的研究生可能都吃香
1676390010,11,23,False,False,我在想up主什么时候出出希特勒的前半生，看看弹幕里那些动不动就提家境的人还能说出些什么？[嗑瓜子][嗑瓜子][嗑瓜子]
1676365631,28,113,False,False,平民出身的天花板
1676359601,23,124,False,False,寒门再难出贵子！大多数人连寒门都不算！
1676394299,25,98,False,False,刘强东他爹是船厂老板，90年代刘强东上学时他爹就给他买大哥大，毕业后他爹直接拿出25万给他创业，那个时候25万相当于现在500万了。
1676378707,4,14,True,False,有没有一种可能，他家做生意没钱进货，问庄家借了几十万进货，结果买家放它鸽子了[脱单doge]
1676425679,6,79,False,False,"刘强东绝不是普通人。有采访为证——

“你的创业天赋是从哪儿来的呢?”

刘强东回答道，“我认为这是家族遗传。我们家就是做生意的。多年前，他们驶船做买卖，就像今天京东的物流业务。我能从父亲，祖父，曾祖父那儿听到很多故事。是他们教会我如何做生意，如何取得合作伙伴信任。”"
1676448099,1,6,False,False,砍人怎么没收录进去？就是把一个水果摊老板给劈了，这是他几岁的事？
1676423066,1,44,False,False,他是他那高考的理科状元，光这一点几乎就杀死了比赛，哪个状元最后会成为普通人[doge]
1676438065,2,10,False,True,很顺利了，不像我，只能不停的考研考公考编考研考公考编……
1676442767,0,6,False,False,没有说的一点就是刘强东自己大二开始学编程，到大四毕业时总共赚了将近40万左右（他自己说的），然后大学一毕业就把40万全花了盘下了北京一个饭馆要进军餐饮业，结果饭馆员工宿舍太差了住在地下室，他连带自己之前2编程的钱外加从老家找亲戚朋友借的钱把饭馆宿舍整个翻修了一遍，然后这帮员工不但没感激反而还贪污饭馆的公款，各种贪污，最后刘强东才心灰意冷的把饭馆给关了，然后他还清亲戚朋友的债务有一半是靠家里人帮忙还上的，刘强东也是说从那时他才下定决心不再管家里要一分钱
1676406229,0,20,False,False,状元最直观的说明并不是什么读书改变生活 而是他智商就比大多数人高[doge]
1676446835,0,3,False,True,我可以很自豪的说。我说大学没问家里要过一分钱。除了一大的学费，全是自己打工兼职挣得。上大学以后就没花过家里钱了。这或许是当我回忆自己很灰暗的人生时唯一几个亮色。
1676436737,0,6,False,False,《父亲仅上过高中》
1676442891,1,4,False,False,up做了这么多的富豪人生之路榜单，一定受益匪浅吧，现在一定是富豪吧
1676388287,0,12,False,False,头婚为什么没说 那是重点
1676434434,2,8,False,False,92年家里就有几十万可以被骗，家底也很殷实了。
1676425858,1,14,False,False,就算让东哥再来一次也不能复刻，时代变了
1676389988,2,8,False,False,东子怎么会是普通人，普通人都上不了学。
1676427168,0,6,False,False,东哥还有一个老婆吧
1676418956,2,10,False,False,那时候亿元富翁还叫万元富翁，普通人的父母能被骗几十亿真的不可能啊
1676366336,37,88,False,False,18岁，1992年家里能有几十w被骗说明家境很好好吧[吃瓜]
1676374844,12,11,False,False,东哥的父亲高中学历很高了，因为那是60年代的高中！！！92年能欠十几万的也不是普通人家了！！！东哥的家庭其实自己超越99%的人了，当然东哥自己也努力。东哥并不是贫民代表的案例[滑稽]
1676395568,0,3,False,False,就一个状元身份就够很多人学的了
1676417516,0,11,False,False,评论是不是觉得从小父母双亡，带个弟弟妹妹在大街上捡饭吃上不起学才叫普通人啊？我的评价是不要把你那悲惨世界代入到其他普通老百姓身上
1676366804,4,20,False,False,努力+贵人+机遇，缺一不可。成功率跟买彩票似的
1676370557,1,4,False,False,前妻的事得提一下啊，算是人生一个转折了
1676421536,4,9,False,False,东子前妻不是普通人吧
1676393447,1,5,False,False,92年家里有几十万[笑哭][笑哭][笑哭]
1676382398,6,9,False,False,京，怎么解释？
1676387087,0,2,False,False,74年的，父亲上过高中，已经算很有文化了
1676421678,1,3,False,False,1974年的高中啊，金77银78！那是不能考大学的年代！那个年代城市人不如农村人吃香…………
1676358673,9,26,False,False,善良，有能力，会思考，在一次次经历后变成狠人。我想如果让他现在不忘初心去当官，可以是一个好官
1676382596,38,136,False,False,"我很纳闷很多人动不动抱怨别人出身好的那些人。
你先问问自己哪怕是努力了，有做到起码达到像他们这样的程度了吗？当然了，其实某种程度上讲，努力是代表不了成功的，因为成功者胜在思维[笑哭]"
1676388660,1,11,False,False,别在这硬吹了行不行，非得把刘强东的童年说得多优越然来体现自己没有成功只是因为家境不好如何如何，刘强东这个背景可以说是对他经商没有任何意义上的帮助，只是一个很普通的农村家庭好吧
1676373075,1,4,False,False,确实厉害，看来底层翻身真的是难于上青天，连东哥这种聪明人都踩了那么多坑。
1676414698,0,8,False,False,要娶到京首先你要考到人大。 然而看这视频里的人99.999%考不上，迈向成功的第一步都过不去的人你们在酸什么？？
1676427519,3,2,False,False,有没有可能有些是他人自编或者是夸大其词的[笑哭]
1676413576,0,4,False,False,个别人呐，就爱拿老子不行天赋不行当自己开摆的借口
1676450372,0,1,False,True,我们村里的50、60年的长辈都是初中毕业的，年轻时候都做过挑河工，说是给家里赚什么分来着。再往后辈就是我爸那一辈，都是中专高中毕业的，也有小部分初中毕业，还有初中辍学的。村里我爸那一辈的没有一个上过大学的，那时候中专不知道什么情况，我爸是高中毕业后直接自己出去打拼了。
1676375841,2,58,False,False,"对网友来说，名人的父母是乞丐都比他们的好。
整天说他前女友说他前岳父，也不想想没本事的人，连女人的手都没摸过。"
1676379758,0,2,False,False,强子可以说是普通人天花板了
1676389350,0,4,False,False,刚开始我特么看成刘华强了[笑哭]
1676368844,5,10,False,False,那个年代能考上人大，很厉害了
1676359731,29,75,True,False,知道啦知道啦，知道寒门难出贵子啦，一天推广个七八遍，烦不烦呐
1676386800,0,3,False,False,我爸妈也是70后，那会别说上学了，吃饱都是问题
1676387305,2,2,False,False,还真的，刘强东就是我的榜样啊...我喜欢的女生当年跟章泽天齐名呢，我得多努力才配得上她，唉，我已经因为挫折而重度抑郁了，不得不说刘强东太强了
1676359151,23,20,False,False,74年，往前算10年吧，64年上高中牛批
1676380982,1,1,True,False,刘强东才48岁？我一直以为他50多了[笑哭]
1676381863,3,3,False,False,1974年上高中，懂不懂含金量。。。比2023年大学还稀有[笑哭][笑哭]
1676409785,9,2,False,False,看完了 虽然我不否认我比不上他一根毛 但是 他家庭比我家强上几十倍 根据年代算  说普通 过分了 有句话怎么说来着  寒门  也是有门的 他家寒门  我家贫民 所以 天天说他家普通家庭 有意思么  你说他家普通家庭  那我们县那些算什么？
1676442079,0,1,False,False,"好惨，从高考完一直被骗到快30岁，一路遭遇各种骗子骗局，糟心
普通人一次就被骗趴下了，能者还能坚持到被骗2次
他骗这么多次还能再重来，强者还是不一样的[跪了]而且还都是自己赚的钱，不是家里给的资金，真的牛"
1676393967,4,4,False,False,也不说老刘走了之后怎么样吧，年前我发的货明明到了营业部，山西阳泉盂县营业部那边的快递员不给我找，最后还是我自己坐火车过去一件一件找的，包装和货也损坏了。我让他们给我把货返回来居然还要收运费，真晦气，从今以后再也不用京东了，绝不在京东上买一件商品
1676448933,0,1,False,False,真正寒门贵子，感觉人挺好的
1676438139,0,1,False,False,国内所有商界大佬里最草根，最励志的，平民逆袭的传奇[打call]
1676438824,0,1,False,False,不是吧，这就是天花板了？？如果我想的话，我完全可以在我二十多岁的年纪，去完成东哥44岁的事情[热]
1676375462,1,5,False,False,这种多了去了，只是这些人不会上b站发言
1676374628,0,5,False,False,知恩图报，自己发达了还带动了家乡！
1676366728,7,8,False,False,1974年比我爸大两岁，我爷爷才小学学历，那个年代高中学历可真的不简单
1676445082,0,1,False,False,个人能力强的同时还得攀上个好岳父
1676436634,0,1,False,False,我当成刘华强看了半天[笑哭]看到最后才反应过来
1676389331,4,2,False,False,知道京东这个名字的由来么 白手起家的鸡汤都是骗二傻子的
1676439807,0,1,False,True,这个心性很强，一般人挫折两三次，有见过家里变故就会求稳了吧[微笑]
1676360426,2,11,False,False,中国14亿人不就出了一个刘强东吗？这概率比考国家最热门竞争最激烈的公务员岗位难至少上万倍。如果你考公务员和玩一样随便考可以去试试运气。地狱级别的开局和他成功的概率比都是简单练习模式。
1676446614,0,1,False,False,人出名了，你怎么写都行也不知道是不是真的
1676438827,0,1,False,False,普通人想实现阶级的跃迁是难于登天的
1676379654,3,5,False,False,那个年代就能自学编程还能月入五万[笑哭]
1676439077,0,1,False,True,我们高中杰出校友，之前校庆的时候还来的[笑哭]
1676385717,1,2,False,False,1992年拿出几十万，还是普通人？ 笑死了
1676436856,0,1,False,False,唯一的黑点还是被套路的，很强了
1676431060,0,1,False,False,妥妥的小说男主，出身贫寒，逆袭，出任CEO，迎娶白富美，走向人生巅峰。
1676356315,6,11,False,False,普通人只看到了表面，里面的东西只有少数人才懂
1676445642,1,1,False,False,B友最喜欢这种鸡汤了
1676379761,0,4,False,False,他不能算普通人啦，放在人尖尖里也是顶尖的啦
1676443192,0,1,False,False,没写他前妻啊，帮助很大
1676431936,0,1,False,False,说实话刘强东很了不起的，中国比他条件好的大有人在
1676433269,0,1,False,True,我也做电商，开了个小公司，在我心里有两个榜样，一个刘强东一个于东来。
1676367649,3,2,True,False,从我记事我爷爷到我这，我爷爷没上过学，我爸三年级，我妈一年级，我哥初一辍学，我初中毕业，没想到我竟是我们家学历最高的[doge]
1676428182,0,1,False,False,哥们我开头看成了刘华强还有救吗[笑哭]
1676428196,5,1,False,False,刘强东基本普通人天花板了，没背景没势力[笑哭]
1676431672,0,1,False,False,他父母虽然其他方面没给他什么，但是给了最重要的，就是智商。
1676426895,0,1,False,False,"什么逆境开司。
这意志力真不是普通人能做到的。
而且哪怕是这样的人也得傍个富婆。"
1676448648,1,1,False,False,92年家里能有几十万被骗，属实大户人家了[无语]
1676428354,0,1,False,False,东哥确实很义气，当年全村人凑500块钱让他去上学，他一回村里就给村里人发红包，确实值得很多人学习
1676383198,0,2,False,False,当年高考状元毕业 去卖盘，当年的人是不理解的[tv_笑哭]
1676435557,0,1,False,False,九几年月薪5w？那时候茅台才多少钱啊，有几百？
1676384984,1,1,False,False,东子我们会把你挂低点的
1676448263,0,1,False,False,学习改变命运[奥比岛_点赞]
1676450606,0,1,False,False,法外狂徒@罗翔说刑法
1676424707,1,0,True,False,有个弹幕写着：44岁超级赛亚人。笑死了[喜极而泣][喜极而泣][喜极而泣][喜极而泣][喜极而泣]
1676400730,0,1,False,False,说实话，东哥这家庭放在农村也是非常优秀富有的，父亲那个年代高中学历，自己小时候还有照片，我爸那个年代家里就没有旧相片，没那个钱拍照，农村人那个时候基本上都没有老照片的。
1676387253,0,1,False,False,74年出生 我父亲73年学历初中 我爷好像是小学学历  。。。
1676392752,3,1,False,False,强哥的父亲有高中学历已经超过那个年代百分之九十的人了吧，如果有误那就是百分之九十五
1676387110,1,1,False,False,18岁家里就有几十万[囧]
1676388323,5,1,False,False,刘强东算个屁的普通人啊..高考状元，大二自写编程一个月赚5万，那时候才1994年，那时候的5万相当于现在的50万了。这就属于那种有天赋的人，压根不是什么普通人
1676384885,1,1,False,False,那个年代父亲上过高中，也是超级厉害了好吧
1676369551,1,3,False,False,雷军:你说什么[doge][doge][doge][doge]
1676440650,0,1,False,False,社会学在哪儿都不吃香
1676365161,0,6,False,False,还是那张44岁的耐看[吃瓜]
1676445776,2,1,False,False,公司发的官方
1676369750,0,6,False,False,还得是他才让人心服口服
1676431490,2,0,True,False,物流+自营+售后，京东的核心竞争力
1676355958,0,4,False,False,东哥还是很正直的京东服务是几个电商巨头里最好最快最有保障的，可惜了，东哥被人下套了，唉
1676437053,0,1,False,False,普通人考人大？
1676371775,0,1,False,False,东子算寒门吧，92年能被骗几十万说明家境真的不错了，寒门不算普通家庭。
1676385544,0,1,False,False,首先他父母经过商，然后他自己也很赶拼。想想你刚能温饱，有几个人敢冒险？很厉害。最后就是他逆熵（是这么写吧）真强啊，最后有一点机遇。机遇留给有准备的人，真厉害。当然也不能忽略他读书很厉害
1676382711,2,1,False,False,我感觉还是不如雷军还是雷军更强
1676377121,1,1,False,False,东哥干洋妞是真的吗
1676392747,0,1,False,False,京东为啥叫京东，这京字你是一点不提啊
1676363678,0,5,False,False,我还是先收藏吧。东哥是每个普通人想成富一代的标杆。
1676368480,8,1,False,False,他第一任女朋友是谁 懂了吧
1676427440,1,1,False,False,74年高中什么概念？
1676370065,0,2,False,False,不愧是根红苗正干能出来的事[吃瓜]
1676380900,0,1,False,False,阿强爱上了阿珍（珍珠奶茶），在一个有东时的夜晚[藏狐]
1676441774,0,0,False,False,大二自学编程，到大四赚了24w，这已经不是普通人能企及的了
1676378697,1,1,False,False,"哎，强子刚来啊，都等你半天了昂[doge]
强子你这是干什么？太客气了吧，你太客气了，都是自己兄弟[doge]"
1676451080,0,0,False,False,父亲仅上过高中。。以前年代能上高中应该很厉害了吧[doge]
1676378090,0,1,False,False,强子是个做实事的人，很聪明
1676377532,0,1,False,False,东哥被小人坑了
1676429022,1,1,False,False,是只有普通人创业成功叫励志，富二代创业成功叫丑陋？
1676450585,0,0,False,False,这些成就才不到50岁，这就是天才，什么普通人
1676436960,2,1,False,False,媳妇家是干嘛的来着？
1676450429,0,0,False,False,那个年代农村出来的少年都是心怀梦想，心存正道的。至少别的不说，宿迁人没一个说他坏的，人们都以他自豪。因为他干的是实事，是少有的实业家。
1676447931,0,0,False,False,任何人 一旦有了点钱就有无数骗子找上门，也不是刚好谁就倒霉，创业更是容易遇到骗子
1676437857,1,1,True,False,真尼玛混蛋，这up
1676450090,0,0,False,False,我只能说这是现代社会，出身普通的人达到的极限。没有靠关系，父母。雷军也是。
1676443130,0,0,False,False,现在很多年轻人的思路都陷入了误区[藏狐]别人成功就是因为他家境好有关系智商高，反正都是外因；我失败就是因为社会环境差，运气差，反正跟我自己毛关系没有
1676385751,0,1,False,False,看弹幕，厌气真重无语了，别人挣到钱全都是有父母原因社会原因时代原因其它原因。自己挣不到钱也全都是别的原因就不想是不是自己的原因[笑哭]
1676442077,0,0,False,False,老爸是高中生在那个年代就已经超过百分之九十九的人了
1676441736,0,0,False,False,也是真的牛B，偶像。那么多次倒下，又能站起来。最终冲到顶峰、
1676443177,0,1,False,False,可惜最后还是被当猪宰了
1676444175,0,0,False,False,他已经是高玩了，如今普通人崛起谈何容易，逐渐固话真的很难的了[脱单doge]
1676397521,4,1,False,False,重点是他前妻的家庭，大家真抓不住重点？
1676443538,0,0,False,False,笑死，人家还是高考状元，人大的学霸[doge]
1676444689,0,0,False,False,别的不说，就连蹲号子东哥都与众不同，都是一般人不能轻易达到的。
1676444812,0,1,False,False,"月赚五万
巨亏十六万
一年把十六万还清
你要不看看你在说什么"
1676447976,0,0,False,False,果然，对象只会影响拔刀的速度[妙啊]
1676390612,0,1,False,False,我发现有多少人再用“他不是普通人”，“他不是普通家庭”为自己的失败找借口，在你们眼里只有扭螺丝的，打杂工的，搬砖的，服务员才算普通人是吧？
1676371174,0,1,False,False,看到入狱照没绷住
1676446632,0,0,False,False,东哥和雷军都是普通人的顶点了
1676450401,0,0,False,False,自身实力，天时地利都不能少
1676441725,0,0,False,False,“普通人”精彩而又可笑的半生
1676447227,0,0,False,False,确实算普通人成功的典型案例了
1676442180,0,0,False,False,报意思，看成刘华强了[跪了]
1676443032,0,0,False,False,谁家普通人考市理科状元啊？
1676441210,0,0,False,False,怎么不写他前妻的帮助
1676437372,0,0,False,False,44直接变身超级赛亚人这有几个鞥做到
1676431225,0,0,False,False,一个月赚五万，大四就赚24W确实很牛逼[笑哭]
1676424358,2,1,False,False,他只是靠他前妻而已
1676433994,0,0,False,False,东哥除了脸认不清楚，真没啥可黑的。
1676443917,0,0,False,False,刷到必须喊一声 东哥
1676421182,0,0,False,False,"雷军，刘强东，当代社会穷人出身的唯二天花板了。
一路学霸进名校→毕业进大厂→升职到高层→攒够人脉和资本→创业"
1676426748,0,0,False,False,首先他考上了人大，虽然是社会学但也很牛了
1676431171,0,0,False,False,我发现了呀，东哥的人生就是不断被骗，被套路，然后倒下，然后再站起来努力，然后再被套路被骗倒下，再站起来的一个不断重复的过程，在美国性侵案之前，大家都以为强哥到了巅峰，果然后面还是被骗被套路了，哈哈哈
1676439455,0,0,False,False,人的智商是真的有区别，并且很大。这让我想到了我们村的天才…
1676439111,0,0,False,False,牛逼人都在宿迁干生意，出了名的黑店
1676436660,0,0,False,False,感觉他已经尽可能在想象苦日子
1676444106,0,0,False,False,他爸那个年代高中很强了。。。[口罩]
1676431356,0,0,False,False,唯一一个愿意站出来替穷人说话的富人
1676413123,0,0,False,False,"44岁，功力突破界限
终于达到了超级赛亚人的地步[奋斗][奋斗]"
1676422476,4,0,False,False,1974年他父亲上高中 你细品你好好平
1676384778,0,1,False,False,从19岁学习编程就改变了，钱多了就有后续的项目
1676425360,0,0,False,False,那些骗他的人，都是给他拿来练级的[doge]
1676425751,0,0,False,False,哪个年代高中的学历就不能用仅了。同年代的人大部分都是小学或者是文盲状态。
1676371752,0,1,False,False,强哥，才是我的偶像。他那努力、奋斗、拼搏的样子真帅！
1676424315,0,0,False,False,失败创业失败再创业再失败，再创业。
1676426647,0,0,False,False,东子在我这能算个民族企业家，绝不是马云之辈能比的
1676426253,0,0,False,False,70后的爸爸应该是40-50后，50后上过高中那都是高级知识分子了
1676429183,0,0,False,False,14岁  父亲运煤从不会偷媒[doge]
1676434205,2,0,False,False,从一个吃百家饭长大的孩子到现在我觉得他非常厉害
1676424321,0,0,False,False,事业是成功的，但是对于他的第一任妻子，他并不是好丈夫，所以女孩子找对象的时候也不要太看重这些，毕竟男孩子的优秀只是为了自己，不一定是为了你们。
1676449584,0,0,False,False,好好学习吧❗️
1676425021,0,0,False,False,东哥这心理素质一般人真的比不了，要是我这么多挫折早崩溃了。
1676381183,0,1,False,False,投资是张磊投资的吧？怎么变成徐新了。当时不是说干不过淘宝，找到大佬张磊投资建物流仓，怎么变人了，人都整不明白，别扯淡了
1676412206,4,0,False,False,他根本不算普通人，普通人是我们这种二本毕业，家里没房没车，全家一直在租房，父母靠做体力劳动在城市工作！
1676432213,0,0,False,False,74年 父亲上过高中就已经比大部分强很多啦，仅？
1676402385,0,0,False,False,东哥做到了厚积薄发，不然也没有现在的京东，以前的企业都不会管理，不像现在了
1676438955,0,0,False,False,丁磊比他猛点，白手起家30出头当首富了
1676404302,0,0,False,False,这已经算是寒门了，别用什么外在因素来否认人家的努力
1676420455,0,0,False,False,他优化的那些老人都拿到赔偿了，没走的和后面进的毛都没有是吗？东哥先见之明
1676398967,0,0,False,False,人家爸妈高中学历，看见好多人，他爸妈也高中学历，不怎么样，我真的想笑，请问你多大了，你爸妈多大，刘强东多大，人家爸妈和你爸妈都不是一个时代的人 那个时候说高中学历不怎么样 真好笑，但凡有点了解，都不至于说这种话，那个时候高中可不普通了
1676434266,0,0,False,False,否定一个人不能否定他的全部，只否定他错误的，肯定一个人也不能肯定他的全部，只肯定他正确的。他长大后回报，小时候照顾他的父老乡亲，我觉得很棒很棒了
1676445521,0,0,False,False,在座的各位，你有没有东哥的潜力呢？
1676435633,2,0,False,False,关键是即使深处何种险境，东子都有女朋友。
1676400576,0,0,False,False,东子可以说是最强创业者之一了吧，智力意志力执行力分开来说都不算经常拿来比较的人里最顶尖的，但综合却是最高的，我丝毫不怀疑这个人不论早在二十岁还是晚到六十岁都必定会成功。
1676403683,0,0,False,False,我太脆弱了，论韧劲，东哥是我学习的榜样
1676401786,1,0,False,False,人家有商业头脑遇到贵人相助，很多条件缺一不可都被他碰上了，打工人连试错资格都没没法比
1676399223,2,0,False,False,"出身普通而已，人家学习能力本来就逆天。理科状元，人民大学，那个年代大学自学编程赚5万
这种人放到哪里都是天之骄子老天爷抢着喂饭吃
这个学习能力上的天赋可以说拉满了"
1676434753,1,0,False,False,我江苏小城市的，亲戚普遍初中毕业文化，那个年代能上高中的真的不差了
