上传时间,回复数,点赞数,up是否回复,up是否点赞,评论文本
1676026548,0,8,False,True,高考完的那个下午我们全班家长和学生老师们再次相聚在班里举办了属于我们班的“毕业典礼”，我还记得我们每人切了一块印有自己名字的蛋糕🎂。有人早早地给老师同学告个别就离开了，也有的不舍得离开仍待在班里和老师叙旧。那天我们都清楚，这是一个结束，又会是一个崭新的开始。
1676017592,0,14,False,False,昨天回去看老师，保安：干啥的？出去！[捂脸]
1676006958,0,45,False,True,"这就是6月8日后的故事，这也是一个新时代的开始
                                              ——2022届毕业生"
1676025612,2,9,False,False,我一直想回学校看老师的，但因为考差了一直不好意思。现在也是十分遗憾的
1675995209,3,22,True,True,首页刷到的，真的很想再聚一次去感受一下当年的青春
1676049462,0,4,False,True,牛逼!理想主义者永远闪光
1676034562,7,10,True,True,或许像我一样差一分的同学，如果有这样的活动，或许能找到当时的失误在哪里，在平行时空把遗憾补上[大哭]
1676043791,1,5,True,True,好感动啊[保卫萝卜_哭哭]好想要有这样子，跟前后桌聊聊高考的试卷，问问题，画画，聊天的机会呀
1676076042,0,5,False,True,21高考生，现在已经大二了，可是看到老师出场后直接泪目了，那是我们回不去的痛苦却又无比幸福的时光，如果我也能有回校讲评高考试卷的一天...
1676004615,0,14,False,True,真的太酷了！！！“这是一次理想主义者的胜利”这句话太棒了[打call][打call]好羡慕你们能有这样的机会。。。[大哭]
1676029180,3,9,True,False,有幸遇见up主，和他成为同学[doge]有幸遇见高三19班全体同学和老师[惊喜]
1676123438,0,3,False,False,好羡慕，到现在还会做梦会到学校讲卷子[委屈]
1676129681,0,3,False,False,虽然学习很苦，但是好想那段一点小事都能让我们开心好久的时光哦
1676007052,0,12,False,True,我们不应该这样草草分离，这是一场盛大的离开，为了更好的遇见。
1676052116,0,2,False,True,疫情三年，高中生活模糊的开始，模糊的结束，好像没有做完的梦…
1676110328,0,4,False,False,致那再也找不回的高中时光，青春万岁。---曾经的一名山东22年考生
1676086656,0,4,False,True,羡慕你们的执行力和凝聚力，我2020年高中毕业，之后就毕业那你暑假搞过一次大规模的聚会，之后也没人提议了，群里也没人说话了，再凑齐这么多人恐怕是不太可能了
1676025042,0,5,False,False,天呐[大哭][大哭]好想参加这样的活动，但我们班应该组织不起来。大家散了就是散了，很难再见面了，没有一个好好的告别，up和组织的同学真的太棒了
1676023897,1,9,False,False,我不是怀念高中，只是怀念陪我度过高中三年的一群人。
1676184434,0,4,False,True,忘不了傍晚吃完饭在操场上和好朋友一起散步聊八卦，第一节晚自习会开小差看天边金色的夕阳，冬天上午跑操时溜去学校栅栏旁买热乎乎的烤地瓜，晚上放学自己偷着买关东煮吃完才敢回家，还有高三下学期最后的冲刺时段的体育课上，在雨后初晴的操场上和好朋友一起说话，那时的天空好蓝，操场好绿，空气清新，就连凹凸不平地面上的水坑里，都倒映着云彩的影子[大哭]
1676088045,3,5,False,True,@呃呃呃_阿巴阿巴 @邪神瓜瓜 @爷不吃曜 各位到时候组织一下可以吗[大哭]
1676027494,0,4,False,True,我的青春和高中好像缺一个句号
1676201931,2,2,True,True,我会永远怀念我的十八岁，那是我的青春，但我不会怀念我那些在中学的最后的时光里碰见的那些人和事。我明白我去到那个所谓的普通班级里我自身的原因占绝大部分，我也明白百因必有果，但我不会怀念那个班级，那个班主任，某几个老师以及那个班上的绝大部分同学。
1676040686,0,4,False,True,说实话，我也想有个这样的仪式，只不过相比初高中，我更喜欢小学和小学同学，认识六年，组织过多少次春游秋游，同学情其实比初中高中各三年还要深切点，而且当时都比较纯真，过节还在班里举办仪式互相送礼物撒糖[调皮][调皮]不过不可能力，都好几年了，早各奔东西了。上一次群里聊天记录两年前。也许对我们来说不互相打扰，保留美好记忆，就是最好的结局了。
1676012299,0,9,False,False,看得真的好感动[保卫萝卜_哭哭]我的高中啊，真的真的没想到会在大学的时候无数次想到你，原来高中真的一眨眼就过去啦，我虚幻而热切的三年。
1676011535,0,7,False,False,夜深忽梦少年事
1676091355,0,3,False,False,羡慕了，高中一潭死水，难以让我去回忆；正如大刘写的，在哪里，任何飞扬的思想终将怦然坠地[大哭]
1676009485,0,9,False,True,现在大四了。无数次幻想我们也能有这么一个机会再聚一次。
1676007269,3,10,False,True,respect！和你一届的，但是寒假里面只是同学聚了一下，四十多个人只来了三十个。也回去看老师了，但是总觉得缺了点啥，看完你的视频才知道原来我最缺的是坐在原来的教室 和原来的同学一起上课
1676105112,1,3,False,True,我19年从高中毕业后到现在，在回忆里的最美丽的夕阳是在高三自习的时候突然抬头看到的夕阳
1676041022,1,3,False,True,@数帝一月三十回归 最后up说的蛮感动，哎，但是我还是没有勇气回忆我的高中生活……
1676112610,0,3,False,True,快给哥们整哭了，大学毕业一年多了，聚齐来的高中同学不过几人，up的高中老师也都好有爱，祝愿前程似锦[打call]
1676091595,0,3,False,True,我是19届毕业的，在22年上半年在一所高中实习教书，每次从教师宿舍（其实就是学生宿舍加两张老师用的大木桌子）醒来，推门看到熙熙攘攘的学生进入教学楼，就仿佛自己又成为他们中的一员。
1676008558,1,9,False,True,真的 刚刚还在跟朋友说 好想让全班同学再来一次学校一日沉浸体验啊[星星眼]
1676041520,0,3,False,True,这是一次理想主义者的胜利哈哈哈哈
1676009843,1,8,True,True,老师们都很支持诶，好棒[老鼠]
1676027922,0,5,False,True,"同2022届，我的高中第一个学期是我学习生涯中最快乐的一个学期，一群志同道合的好友，那个时候我接触了篮球，羽毛球，乒乓球，这是在我之前完全没有接触这些运动的前提下！中午放学一帮约7/8个同学跑去食堂卖饭（那时候我吃饭是最积极的，他们就叫我黑色闪电，哈哈想想也真是有意思），买完饭就去篮球场打，打完回宿舍才吃饭，下午放学便打羽毛球，乒乓球.....
一切的转变发生在选科分班，这就涉及我高中最后悔的事情了。因为当时地理比生物高了几分，我便选择了物化地（那个时候我还不知道物化生的班，和物生地因为班多开设尖子班，后来想想在尖子班里所取得的成就也应该更高）我的那些好朋友就去了物化生和物生地的班了。随后在经历了一蹶不振的网课回到学校，一群不认识的同学出现在我面前......（由于同学不志同道合加上网课时期让本来内向的自己更加封闭，朋友倒是也有但感觉我们并不算是深交的）独来独往的我形成了。
现在在大学了，（本来对舍友抱有期待，结果和另一个大一的跟两个大三的一个宿舍，看他们都挺摆烂的）我选择还是独来独往，基本天天泡图书馆，偶尔晚上拿上自己带的球占一个半场开始属于自己的休闲时光，希望对得起3年后的自己！[打call][打call]"
1676013602,4,8,False,False,好想哭哭，但是我高中甚至没有一个可以回去的班
1676111475,0,3,False,False,已经开始难受了[大哭]，原来我已经大学快毕业了，我也偶尔会梦见以前上课的样子，醒过来直接当场抑郁
1676114341,0,3,False,True,我也希望能有这么一场约定，up做了我一直想做的事，很是感动
1676086924,0,3,False,False,大学了才知道当年自己在不自知的情况下，如何度过了人生中很重要的三年
1676012004,1,8,False,True,真看不得这些，好想念高中。纯粹、简单的快乐，大学好难啊啊啊啊
1676030042,1,4,True,False,我也想这么干，可惜同学们似乎不怀念老师们，这是多强的凝聚力啊
1676106836,0,3,False,True,我梦里无数次出现过的场景，竟然真的有人让它变成了现实。寒假的时候连刷完了想见你盒一闪一闪亮星星，我看完以后就常在想如果真的有一个平行时空，如果我可以带着大一上学期、疫情即将结束的记忆回到我的高中，再来一次高三，那是不是我会有所改变，是不是能够少一些遗憾呢
1676041023,0,3,False,True,上了大学之后对高中有着十分多的感慨，为什么我不早点努力，为什么我不多拍几张照片留着回忆，很想与好伙伴们再吹吹晚风……但是高中还是适合回忆的好啊，如果让我再来一次，我可能还是受不了。[UPOWER_686127_开怀大笑]
1676027250,0,3,False,True,300人正在看！！大家都在怀念自己的青春吧
1676015089,0,7,False,False,到了大学真正发现，原来最美好的生活居然是我当初每天都想逃离结束的高中。有机会真想再和当年同学一起再体验一回高中生活啊[tv_难过]
1676011949,0,7,False,False,真的好怀念，永远记得6月5号离校前最后一天。高三下学期因为疫情原因班级被分为ab班分别上课，平时老师不让大家随便在ab班之间乱窜，但最后一天大家自发的坐在一个班里，平时特别严厉的班主任也没有管我们，让大家在这个学校的最后几个小时是一起度过的。
1676011590,0,7,False,False,非常羡慕有这样子的班级凝聚力和良好的师生氛围
1676013286,0,7,False,True,感觉高中三年就像一场梦，由无数次的心酸与欢愉组成，正在做梦的你需要努力将其变成一个美梦，做完梦的我们只需要接受这个美梦并浅浅回味
1676121657,3,5,False,True,高二马上升高三是一个高二的学生在高一分完班的时候（学的文科）我刚进去的时候大概三百六十多分 期末考了四百二出头 每天就是感觉到高考离我还很远 用自己文综二百四左右的成绩混日子 但在高一入高二的假期我找到了自己的梦想 我想考公大以后做一名警察 但是以我自己的水平 本科都难 我知道自己最难搞的是数学和英语 于是我在刚入高二的寒假把高二的选修数学给学完了但我自己的水平很差 就是一味的往前赶 预习 英语每天看陶大 语文看石油 在高二入学考我的主科除了数学吧都提了一定的成绩 英语提了二十多分 语文提了十多分 因为我原来的语文也不是很差 但我平常还是看的 我在假期的时候虽然没有复习和学习文综 但我的文综因为我每天都在看纪录片 是全年级第一 政治历史年级第一 地理年级第二（普通高中普通班的学生）我在尝到了甜头之后我更加注意了我的学习每天疯狂内卷专注自己的学习 可好景不长 我抵抗力下降得了肺炎 从十月国庆一直到现在我没有去学校 住完院出院去过大概反反复复回去过来五天 我的课程落下很多 我的数学和地理更是担心 现在在家还不至于摆烂 但也差不多了 现在真的很焦虑又不知道该如何 家里人也不同意我复读和留级 我是最后一年老高考的学生 现在就相当于少别人一个学期 真的有点崩溃 我回学校自己心中又有一点害怕 怕那种大起大落的感觉 又害怕那种与课堂融入不进去的感觉 学也不知道该从何学起 因为我原来的文科就不差 所以我根本就没拿时间到文科中 现在还要分配时间进入主科 真的有点不知道咋办了
1676049119,0,3,False,False,已经上大学好几年了，突然回首发现，人生最美好的记忆还是高中，真的很纯粹青春，一辈子都怀念那时热烈的夏天。[奥比岛_委屈]
1676040103,2,5,True,False,24年高考，马上就要到我了，好好珍惜现在的时光吧[tv_难过][tv_难过]
1676015653,0,3,False,False,唉，还是高中好
1676012954,0,3,False,False,没必要我觉得
1676032917,1,5,True,True,感同身受，谢谢up圆我的梦
1676166237,1,2,False,False,泪目@澪与颖 @白鹿白露白路
1676011118,2,12,False,False,我也希望组织这样的活动，哪怕不像这样的，一块吃个饭也行，但是自从21年毕业后，班级群已经没人说话了[大哭]
1676369209,0,1,False,False,我和up是同一届的，up真的是好有执行力而且敢于付出实践的人啊，做到了我们真的做梦想做到的事情
1676446045,0,1,False,False,大学牲看不得这些，高中三年没分班，但毕业了班级群里面都没有消息了[大哭][大哭]
1676394859,0,1,False,True,悄悄的忘记了我的理想，幸好现在还赶得上，明天继续努力，勇者。以为早已结束，其实从未结束，永远的少年气。
1676004850,0,6,False,True,up，😭也想组织一场这样的活动，可是我们班级群已经很久没人说话了
1676001853,1,6,False,True,我疯狂地看别人的青春
1676026824,1,7,False,False,15年毕业的，UP做到了我梦里才会有的事，直到现在还是想回到高中，再和同学一起上一堂那时候的课。
1676021117,0,8,False,True,在复习准备研究生开学考试时刷到这个视频，现在还多了对本科的怀念
1676375342,0,1,False,True,致敬那炽热、滚烫且充满梦想的青春
1676010339,0,6,False,True,上了大学后再也没有当初的感觉了，好希望再做一次这样的梦[哭哭]
1676252548,0,2,False,False,看到2019级高三心里震了一下，我是2019届高三毕业生，瞬间感觉时间过得真快啊
1676022513,2,3,False,False,今天才结束一模，迷茫……
1676025397,0,3,False,False,我高考过后做过几次这个情节的梦，每次都被吓醒
1676038492,2,5,True,True,"今年高考[脱单doge]也希望自己能考去理想的大学[脱单doge]
高中三年确实是人生中又痛又美好的时候呢[脱单doge]
我也痛恨这g管理，但是毕竟那是青春哇～往事怎能随风而逝……"
1676183866,0,2,False,False,刚刚做梦回高中吓醒了，大家在聊什么啊😁
1676031856,3,3,True,True,up的高中也是实行的衡水模式吗
1676264165,0,2,False,True,“这是高中迟来的一场谢幕”，真的泪目了，看着好想哭
1676386771,0,1,False,False,湖北文理学院!，大学!，我来了，生活是如此的美好!
1676024420,0,3,False,False,大学生复习开学考的时候突然想起原来还有一张高中卷子没有答案[奥比岛_委屈]
1676179272,0,2,False,True,"高中唯一的记忆就是上午上完第五节课冲向食堂
点一盘八块钱的拌宽面狂加狼牙土豆狂加葱狂加醋哈哈哈哈[笑哭]
主要是那个时候消耗太大了，所以每一次中午基本上都吃的是这玩意，那味道在饥饿的时候是真的爽[打call]"
1676008474,1,8,True,True,哇塞，在首页看见刚好6666播放量555点赞
1676169450,0,2,False,False,yysy我还挺想听听老师讲当年的高考卷的，毕竟那张数学卷是真TM难啊
1676091630,0,5,False,False,今年高考，初中的班级真的很好很好，但是高中三年有人离开了这个小县城，跟随父母去远方读书，有人收到了国外的学校的offer，即将去往海外，前段时间得知朋友在高中毕业后也要离开这个小县城。不知道还有没有机会聚在一起，但我真的很想他们所有人。
1676024210,0,3,False,False,我不喜欢高中，只是喜欢和那一群人度过的时光
1676131362,0,2,False,True,总是会想起2019年的夏天  想起忙着高考  忙着离开 忙着聚会  忙着走进大学开启新生活的我们  高考结束回到学校那天好像什么都顾不得了一心向往外面的世界  匆匆和老师同学告别  就这样  一晃就要大学毕业了  还是会想起那个夏天那群人  明明有些人连名字都想不起来了  但就是会想念那个学生年代稚嫩热血的我们  想念在无聊生活中为你掀起波澜的那群人  以前是遗憾  现在是释然  总有人年轻  让我看到那时的自己 （河南的乡音让我看的更加沉浸！！！）
1676132616,0,2,False,True,兄弟给你投币了，你做了我想做但是没有办法实现的事情，我19年高考，江苏卷的倒数第二年，我总是会想起高中的那些时光，今年还有几个月都要毕业了，时间真快
1676013348,0,5,False,True,当年选考以后真的有讲过高考试卷哈哈哈哈哈哈哈
1676012662,0,5,False,False,真好哇……同样是厌恶着高中一切的制度和规定同时也怀念着那段只是单纯的为着一件事努力担心的日子……20级的高考还随便见证了个高考推迟的历史 高考后的第一次同学聚会终究还是缺了两个人
1676004425,0,6,False,False,[打call]现在读研一，其实在本科毕业的时候也会无限怀念本科的课堂人都是这样的，永远怀念上一个阶段。
1676027835,1,2,True,False,老师讲卷子那段bgm太大了，我都听不清了[大哭]
1676043411,1,3,False,True,上课，起立，老师好，一声声的代入，我鸡皮疙瘩都起来啦 喜欢
1676014603,0,5,False,False,当时只道是寻常   我的高中去了两个班级  对两个班级都没有太大归属感  比较怀念的是和同学一起聊天的时光  虽然很平淡但是才发觉平平淡淡才是真
1676016057,0,3,False,False,好熟悉的口音啊 可惜我们和老师之间关系并没有特别融洽 就弄不成
1676120871,1,2,False,False,我是21年毕业的，我第二年手机收到一个短信，是运营商发的高考期间信号可能不好的那种提示短信，忽然我才想起来我已经毕业了，才发现高中每一个睡觉的早自习，摸鱼写小说的晚自习（作业写完了搞点业余爱好[脱单doge]），包括以前讨厌至极，想要早日摆脱的枯燥生活都回不去了。我们高中班级不是很团结，所以看到up这样的活动真的很有感触，人总是不懂珍惜他现在拥有的岁月，直到再也回不去的时候才会怀念
1676101425,2,2,True,True,真的羡慕住了感动住了(ಥ_ಥ)看到那个熟悉的百题无错真的会很感动[保卫萝卜_哭哭] 我说怎么刷到了原来是我的校友[保卫萝卜_哭哭]
1676103367,0,2,False,False,22年考生真的意难平呀，很有感触，三连了
1676005459,1,6,True,True,祝福你
1676006294,4,5,False,False,好羡慕啊 虽然我现在高三 也不知道以后我会不会怀念高中 高中对我来说真的迷茫懒惰和焦虑一直大过我能体会到的快乐
1676096887,0,2,False,False,大学还剩最后一学期，但还是无比怀念高中三年
1676083180,0,2,False,False,没想到大学会这么快 19年高考的我今年就毕业了 好好珍惜大学时光吧！！！
1676005434,0,5,False,True,讲评高考试卷？复读生值得拥有[doge]不过up这个方案很棒，很有意义[点赞]
1676120142,0,2,False,False,真好 但我首先要策划一下今年高考完在学校放烟花的事[doge]
1676027016,0,2,False,True,这个币投给青春，投给我想做却没做的事情
1676022416,0,3,False,False,理想主义者真是太棒了，好感动[保卫萝卜_哭哭]
1676019616,0,2,False,False,你们为啥会回忆高中啊。。。。
1676086137,0,2,False,True,别太好哭了我说[大哭] 意义非凡的聚会
1676009970,1,2,False,True,好棒啊
1676014824,1,4,False,False,能够续上这样一场好梦，这多是一件浪漫的事啊！梦醒了，但同学们之间的情谊永恒！
1676002872,2,4,False,True,只有我一点也不想回到过去嘛[笑哭]
1676103951,0,2,False,True,今天看到了一句话 高考结束仿佛就是一辈子结束了 而新的人生又开始了
1676104899,0,2,False,True,看完这么多评论，我也发觉高三在教室旁边的阳台看风起云涌是多么美好
1676098499,0,2,False,True,很希望up的视频能火[大哭][大哭][大哭][大哭][大哭][大哭][大哭]这是一次属于理想主义者的胜利、属于曾经的我们再也回不去的梦[大哭][大哭][大哭][大哭]
1676113934,0,2,False,False,真的上大学之后特别怀念高中，尤其是高三和老师合朋友一起奋斗的日子[大哭][大哭]
1676087185,0,2,False,True,从所有人离开考场的那个瞬间开始，这个班级就很难再聚齐了
1676077297,0,2,False,True,好羡慕，真好啊，高中毕业五六年了，刚开始还很想念同学们，渐渐联系也就少了，变成了朋友圈里的一个个头像。人啊真的是，没毕业的时候想毕业，毕业了又无数次想回到从前[大哭]
1676010662,0,3,False,False,同为2022届高考生，好羡慕这样[打call]
1676112965,0,2,False,True,这个梦在我的梦里梦到过好几遍，在梦里自己还是那个高三未毕业的学生 梦醒了却已经是一名大一的学子了[委屈]
1676054479,0,2,False,True,同河南22届毕业，高三辛苦劳累了一年，也经历了各种事，当时在高三只想着赶快逃离这种生活，真上了大学，变得比高三安逸多了，反而挺怀念以前那种紧张刺激的拼搏
1676046171,0,2,False,True,太浪漫了[打call]我也多么想回到高三的课堂，再听听老师的课，和同学们嬉闹啊。希望在考研的过程中找回高三时努力的模样吧[微笑]
1676030317,0,2,False,True,返校讲评试卷也太浪漫了[大哭][大哭][大哭][大哭]
1676094037,0,2,False,False,可恶，催我泪是吧[热词系列_泪目]，快给我火，我不能一个人泪目
1676101126,0,2,False,True,苦難不值得留戀，但面對苦難的日子卻更有意義
1676039721,1,2,False,True,我们班在高考完后的第二天晚上定了一个农家乐，那晚大家都喝得很尽兴，也算是对高中时光的告别吧
1676025497,0,4,False,False,这种机会真的有就好了，对我来说有一些过于浪漫了反而显得有些虚幻
1676030040,0,2,False,False,我也想组织这样的聚会，可是好多同学不愿再回忆那一段时光。。。
1676044965,0,2,False,False,曾今最令人感到痛苦艰酸的时光，在历经名为成长的洗礼后，留下的是大浪淘金后最为闪闪发光的每，还有稚气未脱遥望六月灿烂阳光的我们
1676091962,0,2,False,False,真好啊，好怀念啊，全都是人生最纯真最美好的回忆，都是最好的同学和最好的老师。可惜大学都毕业了，大伙各奔东西为生活疲于奔命，以后恐怕很难再齐聚一堂了。
1676105378,0,2,False,False,还有100多天高考，看到up的视频浑身哆嗦。真的太有感染力了，我要好好珍惜现在，不留遗憾！
1676007578,0,3,False,True,只可惜回不去了啊，这三年[大哭]
1676026866,0,2,False,True,青春的最重要的回忆--高考[大哭]
1676007345,0,2,False,True,哭了
1676026339,0,2,False,True,很有意义的事情，狠狠地赞了！[镜音铃·连_送花]
1676006517,0,3,False,False,我们终将落俗，但浪漫不死
1676275585,3,1,True,True,哎呦绷不住了想哭
1676118908,1,1,True,True,谢谢up，看完视频感触颇多[拥抱][拥抱][拥抱]
1676372219,1,0,True,False,应该找一张以前的座位表 然后排好座位 不然男生和女生只能分开坐了
1676008225,1,4,True,True,很棒的计划
1676008611,0,2,False,True,哎，很怀念啊[捂脸]
1676007490,0,2,False,True,看了好想哭[大哭][大哭][大哭]
1676012664,0,3,False,False,本以为up只是在讲自己做过的一个梦，没想到是真的干啊（）
1676121567,1,1,True,True,看了就是做了[脱单doge]谢谢up帮忙圆梦
1676004024,0,3,False,False,能不能不要再反复处刑了[委屈][委屈]
1675968380,0,4,False,True,百般皆过客，唯热血相随。那些忘也忘不了的记忆就锁在我的心中，随时品味都是心动。
1676442176,0,1,False,False,杀我别用青春刀
1676347449,0,0,False,False,22届高考生，高考语文的时候我有道题不太确定，下意识划了一下做标记，打算过两天考完了问问老师，然后突然反应过来，已经不会再有试卷讲评了[委屈]
1676148691,1,1,True,False,22级的艺考生，专业考崩，文化拼命读还是没书念，就复读了！成了22+1，专业正常发挥了，现在正在猛攻文化！希望今年可以如愿吧！
1676394561,0,1,False,True,做了我曾经梦想的事
1675952268,1,4,False,True,现在关注，就是老粉了[doge]
1676384188,0,0,False,False,20年毕业的老学长，到现在老班还欠我们一顿全班的聚会呢，我们一直也没有在聚在一起，回头看看，都快毕业了
1676306547,0,2,False,True,研一了，才发现已经高中毕业五年，时间过得好快啊。高三那会儿晚上会偷偷爬到教学楼顶，俯瞰学校四周一片荒芜漆黑的工地，和黑暗中贯穿的一条灯火璀璨的路，像银河一样汇聚在很远很亮的地方。我们在那里唱歌，唱我们再也无法拥有的理想
