上传时间,回复数,点赞数,up是否回复,up是否点赞,评论文本
1675920116,1,15,False,False,up的分析很像我们老师说的只从一个角度看问题，先给人物定义了本质，当然高启强确实是坏人所以也分析的合情合理。但分析一个人从来不是先给这个人定性，人是多面的，在不同时间不同空间映射出来也应该是不同的。
1675912746,7,30,False,False,看图说话
1675962384,4,31,False,False,张颂文都说了高启强深爱他老婆，搁着就你们分析懂完了
1676222949,0,5,False,False,我觉得高挺爱陈的，感情本来就不能拿来分析，难道大家的感情都没有私心吗，很正常啊，就算高是借着陈往上爬，也不妨碍高爱陈，陈也算是道上的，如果高就是个臭卖鱼的，那他们两个永远不会相交，单从电视剧讲，我觉得他们是相爱的，这种爱肯定不是咱们这种家庭所能理解的爱了，他们的格局和我们也都不一样了[妙啊]
1675903102,0,25,False,False,过度解读
1675909122,0,18,False,False,没必要为了证明一个角色的恶劣和立场错误去否定他的一切
1676263383,0,4,False,False,up主还是太绝对 了，人性是极其复杂的，没有绝对的好坏之分，高在我看来就是个普通的上位人，而且相对成功的
1675875058,0,15,False,False,终于有人Get到这点，当时我看剧就觉的他把陈当妈，安当父，弥补童年阴影……我朋友说我乱比喻
1675877350,1,26,False,False,咳咳，突然想起以前隐秘的角落火的时候，导演回复一个网友的细节贴说，根本没想那么多。
1675886265,1,29,False,False,高启强不是一个好人，但是也绝对不是up解读的那种恶。他对陈书婷和弟弟妹妹的爱是他最重要最柔软的部分。说实话挺胡扯的，就像一篇古诗被反复剖析解读，最后人家作者也许都没这个意思。高启强没有那么深，他也不过市井小民出身，没有绝对的善和恶，但是他绝对爱陈书婷和家人的。不是为了妹妹刚开始就自首了。他对陈书婷约法三章也遵守诺言。不要把人解读的那么黑暗，把人性想的美好一点吧。都是个人看法，过度解读也挺搞笑的。演员张颂文本人说了他很爱很爱陈书婷，虽然刚开始肯定有一些成分在，但是相对来说还是纯粹的。演员演技很到位让我更能对于他感情的部分共情。但不是同情。别的不说，高启强还是对爱人家人重情义的。
1675963035,1,20,False,False,为什么偏要极端，，，从一个极端到另一个极端，可以说高启强对陈书婷没那么爱的深刻(当然个人认为高启强就是深爱大嫂哈)但么必要说完全为了人家的人脉资源，可以说高启强坏但也确实没必要把人家一些好的行为都刻画上邪恶的影子。有些评论真的让人啧啧称奇，认为你的观点夸张了就让多读点书[调皮]服6[调皮]
1676373762,0,4,False,False,……为什么要对人的行为有那么多逻辑性的解读 不是说不能有 但感情与逻辑并不冲突 可能恶人会真的很爱一个人 有人杀人开肠破肚却会给一个快枯死的盆栽浇水 人之所以为人 高启强这个角色之所以立体 就是因为复杂 你说他不爱 只爱他自己 但假如他一直骗自己特别特别特别爱她 时间久了他自己也会不明白到底爱不爱 有些东西就是说不清析不透的 何必纠结
1675944368,0,11,False,False,"这顿分析有点先射箭再划靶的感觉，就是用符合自己预设的片段来“推导”出一个符合自己预期的结论。
一个善于笼络人心的人是不可能一直靠假的东西，他身上一定要有真的东西。
不然，如何解释站在上帝视角的观众对他恨不起来"
1675946950,0,21,False,False,假定一个恶的立场来分析，不顾环境和人情的改变，那很好得出UP的结论，预定一个不能改变的立场反推一切，把所有事情都归于恶，这种分析问题的方式是不是太偷懒了？
1675865346,1,74,True,True,Up你是我见过最牛也最合我想法的解读了[给心心]有些解读我和你相同，你的一些解读也补上了一些我没想到的部分。好会讲好会讲，你的那个智慧火花呲啦呲啦的冒啊[大笑]
1676367140,0,5,False,False,别管别人磕cp行不行，人家爱磕什么磕什么
1675948668,0,17,False,False,张颂文都在微博说了：初恋，能不爱吗？
1675903008,0,19,False,False,"原作者：我当时就是想睡个觉
过度解读：不，你不想，你肯定是…………了会在那个时候睡觉"
1676184691,0,5,False,False,陈书婷选择依附婚姻去生存就注定会没有好结局 像大多数的家庭妇女一样 让别人掌握自身的命运
1675907708,1,13,False,False,很明显是真爱，只不过很多人不能理解而已
1675911393,7,18,False,False,演员在微博说他俩是爱情……可能是恋爱剧情剧里讲得不多吧，才会让up这样解读……而且高启强说，想杀高晓晨是因为恨他间接害死了陈书婷……
1676309853,0,4,False,False,老百姓里的夫妻难道不是一样吗？很多夫妻也是互相利用罢了
1676035873,1,50,False,False,up有些想法有点极端，高启强虽然是恶人但是不用所有地方都想的那么阴暗，他又不是所有感情都是在利用别人，就是他的矛盾和复杂才吸引人…况且我觉得张老师作为诠释这个角色的人他对高这个人物的性格理解得是最透彻的，以及他诠释的高是懂爱的
1675873933,0,23,False,True,过度解读是专属于读者的狂欢🎉
1675895738,0,17,False,False,"高启强杀人：他穷凶极恶，披着人皮的动物
高启强忍住没杀人：他怎么可能管什么约法三章，就是不爱大嫂，就应该直接开枪复仇"
1675872755,8,44,True,True,看剧的时候就觉得，高启强是一个表演型人格，在所有人面前扮演不同的人设，而且十分注重细节的表演。最让我印象深刻的是，他带徐江参观幼儿园和养老院的时候，他记得扑过来的小男孩的名字、养老院老人的名字，演绎的非常细节，在徐江面前越谦卑随和，越让人细思极恐。这幼儿园养老院的每一个人，他为什么了解的这么详细，因为必要的时候，这些人都是棋子和筹码。慧极必伤，他后期所表现出来的暴戾，也是长期压抑天性去表演所带来的后遗症，最终演到崩盘也是他的宿命，他的解脱。
1676023574,0,12,False,False,我知道up为了让我们不共情高启强付出了很大努力，但真的有点过度解读了
1675874051,1,13,False,True,其实爱不爱陈舒婷从高晓晨成长就可以窥探，高启强明知道陈舒婷想要的生活，希望晓晨可以过平静的生活，而高还是潜移默化毁掉了这个孩子。高对晓晨不是包容，反而是恶意的纵容，因果相依，他对陈舒婷母子的亏欠最终结出了毁掉他的恶果。
1676332191,0,4,False,False,是真的爱啊，演员本人在微博都说了
1675902133,0,16,False,False,是我敏感了嘛？为什么充斥着一种男性有原罪的论调呢？
1676340082,0,3,False,False,张颂文形容高启强对陈书婷的感情是“跨越了爱情，她是他的终身伴侣”
1676326002,0,6,False,False,什么时候才能摆脱“非黑即白”的观点呢？
1675907975,1,65,False,True,陈书婷教育有很大问题。因为出身黑道，害怕儿子受伤害，对儿子过度保护，一点委屈不能受。但她在安欣来访时借骂孩子指桑骂槐的行为，也能说明这种事她平时常干。孩子总是在莫名其妙被骂和被溺爱之间转换，很难有一个健全的性格。
1675998680,6,21,False,False,很多人没看懂up的分析。。。和陈舒婷是真爱，和家人都是真爱，没说不是真爱。他是骨子里坏，缺乏共情能力，每个人爱的能力不一样。
1675955223,0,10,False,False,没有一个坏人时100%，彻头彻尾的坏人，他也是个人，也有感情。不要强行解读为完全黑化完全自私。
1675868515,6,35,False,False,高启强这个人不是好人，但是张颂文演的太好了，给他赋予在这个人物形象上赋予了一种极为复杂的魅力，所以很多人被迷惑了，会跟这么一个黑大佬共情。。。但是想想，高启强这种人在你身边是很恐怖的，因为他除了狠，还很精明狡猾会伪装
1675931029,0,16,False,False,高启强就是一个表演形人格的人  善于伪装  他特别会把一切归咎于外因  并且特别会利用外在表现去收拢人心 实则内心除了有血缘的两个亲人 对别人都没过多的感情  从刚开始给唐小龙小虎送礼那里就知道 他这个人很会利用别人达成目的  他前期与后期就没有什么质的变化 只不过前期可利用的人少 后期可以让他利用的人更多了而已
1676333907,0,3,False,False,我不太认同你这个说法，你这个和那些高度认同高启强的那些人其实也没啥区别，但可惜我嘴笨又说不出来为啥
1675903923,1,14,False,False,"我认同up说的高启强选择陈舒婷作为自己妻子的缘由，以及高启强后期逐渐刹不住车的原因，但是up说的感觉就好像是高启强一味的索取而陈舒婷什么都没有得到一样，陈舒婷想要的是一个有能力管理泰叔（可以看成陈舒婷一方）的灰色产业的人，爱护儿子给自己一个稳定生活的人，前期的高启强确实没有做到给陈舒婷一个安稳的生活，陈舒婷也察觉到了，所以选择离开了他，后来跟高启强约法三章后才选择回到高启强身边，高启强确实做到了，陈舒婷后面也得到了，他们两个之间就是互相索取，互相温暖，就像是作者开头一部分说的，说的很有道理，他们就是在对方身上发现了自己的影子。

爱情本就是相互索取，但是up主只说了一个人的索取，把对方描写的十分被动真的好吗💦（有一段时间高启强确实十分强势，陈舒婷也包容了那段时间但是不久后高启强就得到了报应，陈舒婷离开了他），up主的描写下陈舒婷就像是一个受害者一样💦，明明他们两个都在享受这段感情。陈舒婷没有一直被动，她甚至是真正掌握这段关系的人。评论区有人将高启强和陈舒婷的关系比做寄居蟹，我好难受，他们两个明明就是各自把各自掏空来填补对方。

陈舒婷也从未失去与高启强平等对话的权利，她不仅平等对话了还成功了，（高启强遵守约法三章）

以及高启强善于将自己伪装成弱势来获取对方的同情这一方面我也很认同，在与安心对话的时候我也发现了，这是高启强对手下对对手的一种手段，但是他对陈舒婷露出弱势的一面是真实的是必要的，他希望能从陈舒婷这里获取关爱，获取类似母亲的关爱，这是没有恶意的索取类似情人之间的打闹，都是希望可以从对方身上得到自己想要的回应，并且我认为这种方式在陈舒婷这里是受用的，她本来就是陈泰培养的接班人，对可以“掌控”的，示弱的高启强在她哪里也是加分项。

占不下了放下面了"
1676366414,0,3,False,False,张老师认证他超爱！！
1675874321,13,14,False,False,狂飙里的女性角色都非常工具人，就连大家觉得写得最好的、最受欢迎的大嫂也非常的工具人，是演员演得好。陈书婷完全就是为了高启强而存在的一个角色，出现是为了让高启强有一步登天的资格，展现夫妻生活是为了让高启强这个人物有一点温度，没那么冷血。她跑到香港，是编剧要借她的口说出高启强的真面目，而后来回京海就是为了死去，给观众一个高启强不再压制自己、完全失控的理由。
1675940945,0,11,False,False,"正因为张颂文老师把这么会伪装的高启强演活了！

所以全网才会被高启超的表象欺骗了，去同情他，这绝不是证明社会上人们三观不正，这反而更说明了三点问题

1 张颂文老师把高启强演活了！

2 高启超这种人太会伪装和欺骗来博人同情了。

3 社会大众是看不透这种人的，所以日常里一定要小心黑恶势力的眼泪。"
1675911677,1,19,False,True,我的理解，陈书婷本质是把家庭观念当做核心价值的人，出于这一点，她选择了看上去具备同样价值观的高启强扶植上位，给孩子庇护。但她的想法是让高启强做稳白江波的位子，所以在解决程程时她是支持态度的。她作为陈泰与高启强之间的纽带，对双方起到了一个非常微妙的牵制和说和作用，这其实是她地位的核心。但她没有认识到高启强的野心和贪婪，他的欲望是取代陈泰，陈书婷错在婚姻生活中一步步陷入高启强提供给他的“关心和爱”，导致默许或容忍高扳倒陈泰，彻底失去了对高权力的驾驭。后来，她又被高追妻感动，回到京海，失去了对高感情的驾驭。可以说，从hk回来那一刻，就注定了陈高二人关系的彻底翻转，陈为“家庭”选择了高启强，也被高启强彻底束缚在“家庭”里。
1676297870,3,3,False,False,今天我还和同事聊天说到，安欣和李响对高启强那么好，高启强却从来没为他们考虑过，而是一开始就借他们的势、损毁他们的名誉，不管自己的行为是否可能为他人带去了麻烦。
1675982658,0,10,False,False,太绝对了  他要是真那么恶  不会干那么久的鱼档  不会打断蒋天的腿  不会跟高晓晨玩命飙车  不会说出“阿盛 书婷 慢慢喝啊”
1676336496,0,6,False,False,艺术源于生活，高于生活，小编你应该多体验生活，再用你那学来的专业词汇再编排，
1675917449,0,11,False,False,我是在网上又不是在现实，我爱怎么发疯就怎么发疯，爱磕哪个磕哪个
1675874010,0,13,False,True,我觉得高启强肯定是爱大嫂的，但要说多爱…高启强心中重要性的排名应该是：自己，弟弟妹妹，大嫂/安欣，高晓晨黄瑶。前四个是住在心里面的，后两个是住在心外面的，安欣是守门的。
1675964736,1,9,False,False,张颂文自己说的，这个角色生命中最爱的四个女人，母亲妹妹陈书婷黄瑶
1675875780,3,47,False,True,说得太好了 张颂文演绎着高启强 而反过来高启强这个具有表演型人格的角色在戏里也无时无刻模仿着一个像现实里的张颂文这样非常有共情力的人
1675876109,0,16,False,False,我认为高启强是爱陈书婷的 并且非常非常依赖他 从他总能在重要场合想到大嫂对他的嘱托看出 开枪对蒋天的那一幕我认为是他不确定陈书婷是否真的是蒋天杀的 作为一个老大他还是要权衡利弊 当场杀死蒋天 他估计也出不来了  不过后面也是有惩罚蒋天 估计那时候他认定陈书婷是蒋天害死的 通过绑架他家人惩罚他 包括他保护高晓晨也是为了给陈书婷一个交代他不喜欢高晓晨 后面说要杀死他 我更倾向于他知道自己大势已去 为了让高晓晨死心举报他 也为了让高启兰安心去非洲 不然高晓晨不可能还活着 我更倾向于高启强是一个重家人的老大 一个人到那个地位 很孤独 他需要通过陪伴家人弥补 家人和安欣可能就是他的底线
1675866116,40,49,False,False,从来也没磕过大哥大嫂的CP，我只磕强盛兄弟，他俩属实是双向奔赴了，要不是亲兄弟我都能在一旁起哄喊在一起了。
1676353425,0,3,False,False,不过是先把一个人假设的很极端再找论点而已。
1675907703,8,7,False,False,可恶受不了了，强子很爱家人的，他俩都好好去看剧啊，强子是自私是伪善是坏但是对待家人也是实打实的好啊可恶[藏狐]
1675878132,9,19,True,False,up有个地方我不是很同意，就是我觉得吧……强子这人虽然虚伪，但如果再怎么说他没杀蒋天也不能代表他对书亭感情浅，只能说他非常审时度势，也有很多考虑自己的因素。但是您上期说他对弟弟感情假我觉得有的说不过去，当三人和李响对峙时，启强一是懵的，他不知道弟弟会报警整这一出。二就是启强甚至当时把绑架记者的事情说了出来，只为能不能换弟弟一命（就理性讨论一下[给心心][脱单doge]）
1675947206,0,8,False,False,从陈舒婷死后，高启强不找女的，不要孩子 就完全足以证明是真心只爱陈舒婷的，如果按照你说的他为自己活，那首先就得找女的，生属于自己的孩子。陈舒婷死后，高启强的穿着都变得普通了，人也相比之前低调了，心气没那么高了
1676394237,0,3,False,False,"过度解读肯定是有，通过高启强童年经历推断出只为自己而活这个已经就是完完全全的臆想。后面说因为人物的共情与悲悯是演员赋予而不是角色自带的更是莫名其妙，这就陷入一种他是坏人所以他不能有人性的怪圈，如果这么解读是不是一切复杂的文学影视形象，比如说鲍国安老师饰演的曹操，是不是能说曹操本身是个奸诈小人，那些雄浑威武只是演员演绎的呢？这显然不合理。
公平的评价一个角色，需要抛弃春秋笔法，做到不隐善，不扬恶，如果不能做到这些而妄下论断只会为人耻笑。"
1675926122,0,14,False,False,有不同分析是正常的，但看个分析就觉得自己掌握真理觉得别人是错的就是纯搞笑
1675873579,2,33,False,False,"陈并不是因为高才落入坏下场，她黑道出身，和高一样骨子里也是追逐那种掌控他人，危险刺激的生活（虽然她嘴上说不想这样了，但高随便回去找她逗两句她就马上回头）
只是两个危险份子碰到了一起，结局也是显而易见的，并不是高束缚住她，是她自己选择了高，她就是喜欢这份危险，和高一样"
1675928372,0,12,False,False,小时候最不能理解的就是《雷雨》里的周老爷，以前以为他是真的爱过真的愧疚，甚至觉得他是好男人，非常不理解周老爷发现爱人后的转变怎么那么大。现在还是不太懂他为什么装，但是现在年纪大了明白了点他虚伪。高启强也是这样虚伪阴狠的人啊
1675915420,3,9,False,False,不敢苟同，做个有思想的人。
1675904822,2,14,False,False,很精准，但是有的事情不能深究，深究下去，终有一天，你会发现自己身边的父母，爱人，孩子和朋友，可能都是利益关系，这都是人性没办法。虽然不如高启强一样有脑子有机遇，但是人性是经不起试探的，如果你身边的人能逆成长成高启强，ta们说不定比高还要自私和冷漠，你就会反过来怀疑之前的爱和关心可能都是装的
1675935470,0,7,False,False,不要简单评论“披着人皮的野兽”，就是人，就是矛盾，就是复杂。
1675867103,1,13,False,False,"我觉得高启盛绑架高启强，他根本不会伤害高启强。如果高启强想救这个弟弟，完全可以把他送进监狱，再考虑一些操作，死刑变缓刑，缓刑变有期。但是他没有思考保高启盛的路。高启盛回来是一个昏招，高启强已经准备甩掉这个包袱了。他把赵立冬想杀李响的消息当场透露给高启盛，高启盛才报警拉上李响去送死。我不知道高启强是不是故意的。
但是高启盛的死是换了赵立冬的保护伞，陈书婷换了情侣大街和京海一人之下的地位，蒋天没能立足。高启强的愤怒永远实现了利益最大化。
我觉得高启强像那个金蟾，张大嘴巴，贪婪的吞噬欲望，曾经的金蟾被泰叔嫌弃，而后面的金蟾将泰叔送进监狱。
“人皮动物”很精准。"
1675862207,2,26,True,True,还想看狂飙的解读，随便解读谁，太棒了[星星眼]
1675962331,0,6,False,False,都不想理你，爱，一直爱
1675910191,1,42,False,False,我觉得不否认高启强最爱自己，但高启强爱陈书婷的程度比视频里说的要深。他当初接陈书婷回去承诺的约法三章一直到陈书婷死的时候都在遵守，不然他在和陈书婷争吵的过程中也不会说一直忍，正是因为陈书婷知道高启强因为那约法三章受了气才会安抚他。高启强在陈书婷死后对着蒋天举着枪的时候高启强还不知道老婆的死因，即使是这样，还是冲动地打掉了他的一条腿。多年过后，他也承认看谁都没感觉，就觉得一个人挺好的，而且还冒着生命危险和高晓晨飙车就为了陈书婷当初的一句话。所以我觉得他的爱绝对不止浮在表面上的那样，至少在接陈书婷回去后给了她几年安稳的日子。
1675879686,0,22,False,False,其他的都有理有据，就是陈书婷死后高启强找蒋天的那里的分析不太赞同，感觉那里up有点为了证明自己的观点而下结论了，当时高启强并不知道陈书婷车祸是谁干的，从他后来对的话中能看出来甚至都不确定是不是人为，他打蒋天那一枪我个人为是由于当时他糟糕的心情所致，一是陈书婷一死高启强直接没束缚了，蒋天之前就因为项目得罪高启强，眼下高启强还正在气头上，赔这个项目是给他消气的，高启强开枪，意思是这一个项目还不够他消气的，二是蒋天确实有嫌疑，这一枪是警告，以后别在我面前搞事，这就是让我高启强生气的下场，王秘书那句为了一个女人值得吗，与其说是陈书婷这条命值不值，更不如说是陈书婷的死带给高启强的愤怒与失控所干的这些事值不值
1675874073,11,18,False,True,up的解读深度非常牛逼。但是你要说高启强对陈书婷不是真爱，也不能算。高启强确实爱陈书婷，但是他更爱自己的事业。他确实是一个伪善自私的人。而且他最后跟安欣吃两次饭，最主要的目的一是套话，二是给自己妹妹谋后路。但我不觉得他不爱陈书婷，他将泰叔踢出局后。陈书婷和高启强算是强势地位转换了，但实话陈书婷在家里地位并没有太多的降低（也许因为剧里面描写太少）。陈书婷和高启强既合适又互补，但高启强没杀蒋天这件事，我觉得不能简单解读为，陈书婷不过是高启强的一条腿。高启强和徐江并不完全一样，徐江为了儿子，真是见一个弄一个完全失控，但高启强不同，他不是一个容易失控的人。高启盛死了，他没有当场失控，而是说了句我报的警。我只能说骨子里高启强就是个自私到极致的人，对他来说爱自己大于一切，但不代表他不爱陈书婷，只不过排在自己之后。爱这种东西对不同人无法相同的解读，对于高启强能够把陈书婷放在仅次于自己，甚至愿意为了她去短暂失控（打伤蒋天的腿）已经是非常爱陈书婷的表现了。
1675876241,1,15,False,False,人是复杂的，但也没up讲的那么复杂，演的和真的都有交织的情况下，时间长了根本分不清是演的多一点还是真诚多一点。就比如高不动安，是感恩多一点还是演给手下感恩的状态多一点？这很难说，甚至有演的多了自己信了的意思在。这剧好就好在演出了这种复杂，但也没有把表演和真诚分的很开。我觉得倒不用像up一样追究的那么细致。
1675873099,3,12,False,True,看到他进白金瀚的时候，总觉得高启强身边人离他而去是必然的，日后扳倒陈泰也猜到了，比如他弟弟和他，感觉弟弟是那种哥哥犯错了可以豁得出去甚至代替他受罪（原剧是弟弟自己的罪）的人，但是高启强就不一定能这么做的人，他会真情实感地伤心，但是或许内心里最希望的还是弟弟自己去，没有弟弟那种决心。陈书婷应该也能做到为他挡刀，但是高启强不一定能做到为陈书婷挡，但是他会哭着大喊着真情实感地伤心。爱他的人的爱都超过他对那个人的爱，好像他们都更重情重义太多，当他得到选错但是他贪心不肯丢弃得来的东西，后果就是最后孤身一人
1675923766,0,5,False,False,up有空会解读解读《大时代》里的丁蟹吗？丁蟹也是一个非常有意思的人[脱单doge]
1675909937,1,11,False,True,"任何一个敢于做恶多年的人都已经丧失正常人感情的了，这不是因为他们被命运逼的，而是他们的善与爱从来就不是根植于骨子的，仅是被外部束缚产生的，被亲人，被社会关系，被生活资源约束着。一旦一些外部条件缺失，那么他们就会走上不正常的道路。
高启强剧里从未对自己那些残忍的事后悔过或者思考过一天，每天脑子里就是如何获取更大的个人利益活得更好，如果一个人从未回忆过自己那些背道人伦的丑事那么这人从他没犯罪开始骨子里就是坏人了，这世界的规则他是持有反叛心理的，所以对于世界的规则他是装作顺从实则时刻做着挑战的事情。
虽然高启强人格魅力很大，但底线一定要有，坏人就是坏人，绝不是我等可以崇拜的"
1675873630,2,23,True,False,我都不想理你！爱，爱，一直都爱！[doge][doge]
