上传时间,回复数,点赞数,up是否回复,up是否点赞,评论文本
1675888738,0,10,False,False,用对峙蒋天那段来证明说不爱书婷没什么说服力…单刀赴会当场报仇不太现实，不止是开枪之后家业会没，自己命也会没啊，那种情形当场开枪杀人基本等于去殉情了。。正常人逻辑的报（疑似）杀妻之仇都是报警or自己执着调查真凶，当然他不是正常人，但是要求必须当场殉情证明是真爱而不是更爱自己也有是有点勉强。
1676371576,0,4,False,False,高启强是个恶面远大于正面的人，但他不是反社会人格，up 主这种过度解读我还是不能接受
1675903045,0,7,False,True,这期解说展示了张颂文老师的强大[大哭]…看完后感觉高启强这个角色更有魅力了。（并不是好感恶势力的意思，单纯是感叹这么复杂的角色能被演活，难度真的高
1675898316,2,15,False,False,up阅读理解完全偏了，而且偏阴谋论，世界上不是所有的事情非黑即白，往往都是灰色中间地带。高启盛爱陈书婷吗？是爱的，但是两个人的结合纯粹是爱吗？也有相互利用，也有利益输送。陈舒婷一开始是想安宁度日吗？并不是，她要是想就不会与高启强这个身上黑社会色彩尤其浓重的底层人物结合，后期只不过是利益相关下给自己与高分手找个体面又貌似合理的借口而已，两者之间既有相知相爱，又有利益矛盾。只不过端看关键节点的选择而已。up不要太阴谋论，人性是复杂的，有善有恶
1675905111,0,7,False,False,"高跟儿子飙摩托后雇佣香港杀手只砍不杀,那是在救他儿子呀! 
以及把财务的工作交给瑶瑶, 他做的事情就是他弟弟救他的另一个版本.
这次用他的命,换他儿子+瑶瑶两条命, 一条命给他老婆舒婷, 另一条命给老默"
1675956773,2,6,False,False,"我认为有些地方过度解读了
弹幕里有人说了过度解读就被骂[笑哭]，这是干什么呀。既然创作者发了这个视频，那观众也可以提出自己的想法，又没说什么不文明的话。"
1675908824,2,18,False,True,"有人说张颂文老师的微博评论里说自己对陈书婷就是真爱的，跟up的观点不一样。
其实我想说这二者并不冲突！
现实生活里很多人都不知道自己的爱是出于什么原因立场，很多人把夹杂其他因素的感情误以为成是百分百的爱。所以演员本人和up说的情况并不冲突"
1675879063,4,11,False,False,虽然可能有点绝对，但是日常生活中那些杀猪杀鸡杀鱼的一切需要亲眼看见亲手结束掉一个生命的这些工种，对于生命的态度是很淡漠的。只要他试过一次杀人，第二次就跟杀条鱼没有任何区别。
1675873314,0,8,False,False,跟up有点不同看法，虽然我很讨厌高启强，但我认为他是从有人性到被野心占据渐渐泯灭人性的。其他就很赞同up，尤其是老默和高启强对比部分。
1675914475,0,20,False,True,两性关系要建立在平等尊重的前提下，高启强是缺爱的，他知道妻子真心爱他，他才会掏真心爱妻子，但并不平等。我倒是觉得高启强不要孩子是不想多个弱点，安新说过他太累了，被弟弟妹妹拖累的前半生就是他弱点。
1675920616,0,8,False,False,[辣眼睛][辣眼睛]现在这种掰饽饽说馅似把爱情剖析干净的视频越来越多了，人的感情包括爱情哪有那么单纯阿，单纯的那叫x欲
1675873911,0,7,False,True,真就是演员演的好，把一个自私自利的表演型人格的坏人演的让所有人共情。因为这就是那个人想让你看见的。
1675865833,2,6,True,False,up，能不能问一下，高启盛程蝶衣式的表演，是不是演员自己发挥的，而并不是编剧导演要求的？如果换一个人来演高启盛，演成普通的兄弟情会是怎么样的呈现呢？也会看起来像有一层弟弟对哥哥的占有欲吗？[吃瓜]
1675919002,3,6,False,False,什么高考阅读理解。人家编剧演员都美往这想[吃瓜]
1675902046,5,6,False,False,难怪我看到30多集，高对儿子说，我爱你母亲，我才教训你，只有在教训你的时候，我才能接近你母亲，还是什么的……记不太清了，我是半路二十多集开始看的，但这段表白实在变扭，所以印象深，因为如果爱的话，那教训儿子是为了让爱人心安，但他却是通过模仿爱人，让自己心安。如果说他看重的是书婷身上母性角色，那说的过去了。[囧]
1675917378,1,6,False,False,感觉和高中的阅读理解题目一样   作者写的时候真的是这样想的吗？
1675879639,3,7,False,False,高启强爱陈舒婷的方式就是杀了她的儿子，其实很惊悚……那是陈舒婷亲儿子，她可以拿命换的人……陈舒婷：这福气给你你要不要？
1675920720,2,7,False,False,从高启强的童年来看，他一直极度缺爱，而且童年只有一个酗酒家暴的父亲榜样，对于他来说，对于什么是正常的情感，很可能是没有一个正确的认知的。这样的高启强，没有被爱过，却竭尽全力爱自己的弟弟妹妹，供两个人上大学，这种人正常情况下应该会一直努力的生活下去的。可是世事弄人，就在他偷偷的想犯一点儿小错，赚两万块钱改变命运的时候，命运送给他一个巨大的玩笑。从此以后，他一步错，步步错，再也回不去了，他的人性中好的东西越来越不合时宜，坏的部分被激发得越来越多。我个人不太认为高启强是没有感情的，或者说是不能共情的。只不过，一个人能够理解你，不意味着他就会让渡自己的利益，安欣也理解高启强，他也坚守了自己的立场，只不过，他的立场是对的。
1675908430,6,22,False,True,很独特的分析，虽然并不认同，但是不同的分析角度有助于认识提高
1675906862,1,6,False,False,其实我从高启强身上感受到的更多的是为了家人要怎么做，而不是为了自己，他在家人要与权利作出让步时都是无可奈何的情况
1675918936,1,7,False,False,我个人：一开始陈书婷是利用的，但是后来栽了，她的爱是上升式的直线。而高启强的爱一直都是那个量，直到高启强老了，也是没有变多也没有变少，他的爱是一条直线
1675917837,3,6,False,False,没有杠的意思昂，只是不太明白，高启强最后的时候为什么要救黄瑶？我看见了他在天台的犹豫。难道警察不来的话他就会任凭过山峰杀了黄瑶？还是说他更在意的是黄瑶手中证据。那就让她死了就好了啊？我也不知道[思考][思考]
1675880288,0,7,False,False,“成年人的爱情，本来就没那么简单。”——高叶
1675861667,6,39,True,True,关于高启强为何不要孩子的解读真的妙啊！我自己虽然感觉有异样，但是想不通为什么？up一解读通透了[Cat2_Launch!]
1675866611,0,14,False,True,高启强欺骗了上帝视角的观众，说到我心坎上了
1675953348,0,9,False,False,总体分析得不错，但有一些还是不能苟同，实在太牵强了。一开始预设的立场太强，对高的分析从他是一个纯粹伪善的恶人开展，甚至都没把他当人，而是当做伪善本身，导致分析中他的任何行为都是虚假的，都是别有所图的，像是一个理性机器。在我看来，这样的人是不现实的，人终究不是机器。按照你的分析，他又为什么在前期含辛茹苦不求回报地为弟弟妹妹付出？明明转变是渐进发生的，却从结果导向预设他是一个天生伪善的坏人。个人见解，不喜勿喷。
1676387104,0,2,False,False,对这部剧当然可以这样分析，套进来看也很好，但请不要用这个理论来分析自己，很可能让自己很难受，觉得自己也是个表演型人格。小时候经常听到帮助别人就是快乐自己，我为人人人人为我之类的标语。但突然有一天，当我在帮助朋友或者做点好事过后，总是反思自己的行为是为了什么。我在遇到困难时当然是希望得到别人帮助的，所以我积极地对待别人，当然别人不帮我我也能理解。但这种“想要我遇到困难时别人也能帮我”的念头一出，是不是就说明我在帮助别人时是挟恩图报呢(就算我帮助的是陌生人，因为我希望遇到困难时也有陌生人帮我)。总是这样想，最终的结果就是我就是个伪善的人，当然我现在也差不多接受了虽然挺伤心的。
1676428623,0,3,False,False,"up用艺术的角度分析，把高启强给描述的太黑暗了，中后期还能认可，但是前期，大年三十被打受欺负，我认为那时的他是善良的，守法的。
        从扫黑除恶的角度来看，国家不只是打击黑恶势力，也是想表达怎么预防黑恶势力的诞生。徐忠的旁白和安欣在表彰大会的发言就概括了。社会中不平等的分配导致像高启强这样的人，不相信不靠非法手段会获得财富，所以铤而走险，黑化。而安欣作为一个理想主义者的警察，一直在给这些误入歧途的人选择的机会，可惜老默，高启强没有回头自首，最终要么丧生，要么判刑。如黄瑶等，选择了正义，揭露了高启强。
       所以本意还是预防这些守法的人，走向犯罪的道路，而不是站在上帝视角，认定他们本来就是坏，是伪善。
       狂飙第五集徐忠有这样一段感慨：“我开始慢慢明白了，为什么像高启强这样一个曾经也是守法的公民，他在他的领域曾经勤勤恳恳，没日没夜的工作，到后来为什么会发生这么大的变化？如果说唐小龙唐小虎这样称霸一方的市场管理员是导火索的话，不如说是因为我们的社会当中确实还存在着一些不公平的分配，导致基层的百姓觉得如果不靠非法的手段，是无法实现致富的，所以就有了铤而走险的一些人出现。高启强就是其中的代表，他铤而走险，而且在后期通过诸多违法手段获得不法之财，凌驾于一方百姓之上。有时候我在想，以他的聪明才智，原本可以为社会做出贡献，可是在十字路口，他选择错了方向。”

安心表彰大会说的，“有人问我，为何救一个嫌疑人，把自己搞的伤成这么重，到底值不值。我其实当时什么也没有想，我只是觉得眼前是一个活生生的生命，当我扑过去抓住他的时候，我心里踏实了。因为我发现好像我给了他一次重新选择的机会。每个人都会犯错误，这个时候我们特别需要重启人生，重做选择。他这个时候特别会需要有一个人伸出手，帮他一把，让他重新选择。这是我们这份警察的职业存在的价值和意义。”"
1675873462,1,10,False,False,看过讨论，说狂飙开拍时只有11集剧本，往后都是边写剧本边拍边修改的，直播也有演员说过不知道情节，再加上演员在表演时会融入自己的思考和表演细节，可以看到原剧本小说跟实际播出剧集中的人物关系和性格也是有偏差的，所以在解读角色时会觉得矛盾和多面。对我来说up讲的是一个新的深入的角度，挺值得思考。
1675908813,16,30,False,False,我也感觉高启强没那么爱陈书婷，陈书婷和他结婚是因为觉得他是个好人能给他安全感，他却做不到还是带着陈书婷东躲西藏。真正的爱看安欣怎么对孟钰就知道了，安欣那么爱孟钰，但怕孟钰和他结婚会受到伤害，最后让孟钰和别人结婚了。高启强要是真正爱陈书婷，他肯定会让陈嫁给一个能给她和孩子安全感的男人而不是自己，他死死抓住陈书婷不肯放手不就是为自私
1675906028,2,9,False,False,就一部电视剧，哪来这么多过分解读啊[呆][喜极而泣]
1675865747,4,15,False,False,记得没错的话，高启盛好像积压了几十万台小灵通，2000年初小灵通价格挺贵的，进价就算100元，几十万台也是高启强承担不起的，把整个建工集团卖了可能值那么多，但那是不可能的，高启强那时候还没掌握公司，而且高启强也不是没帮，有一段在白金瀚里面，手下人跟高启强说他弟欠了白金瀚60万，高启强不是帮他解决了吗？
1675926025,0,8,False,False,"太强了，如果说上一期是分析人物在剧情中承担的定位与作用，这一期就是把人物刻在骨子里的东西给抓出来了
上一期如果up对社会关系把握不到位的话，很多地方都能说是巧合，
这一期不仅抓出了人物性格，还说出了人物改变的过程与诱因，展现了一个人在不同阶段的需求与压力
有人说总是以最大的恶意揣度高启强，一个人骨子里的东西并不总是表现出来，但又总是不经意间表现出来，这不妨碍他爱一个人或者做好事，但总会时不时影响一个人的考量"
1675872811,3,12,False,True,那我想问下，他独自吃饭的时候还要给小盛和书婷备下碗筷是为了满足自己心里有家人的信念吗
1675946888,0,5,False,False,要是有可能为了陈书婷不生孩子吗？陈书婷死了为什么还不续弦？他后面早就不需要在乎别人的看法了
1676434571,0,2,False,False,都已经没有出轨没有小三，对你又好的，言听计从的，如果这不是真爱，大概真的就没有爱情了！
1675949703,8,5,False,False,"希望一直刷过度解读的朋友明白一件事
不是，只要不符合你们想法的观点，就是过度解读。"
1675932236,3,10,False,False,说的太好了 高启强就是很伪善的一个人 不然也不会一开始就利用安欣的身份狐假虎威
1675947009,0,5,False,False,那他为什么要救黄瑶啊
1676372592,5,3,False,False,"解读有些误解：
1、陈舒婷为什么选择高启强？有3个原因：一是她失去了老公，虽然有泰叔照着，但她真的想给白晓晨找个爹。当高启强带着白晓晨玩的不亦乐乎的时候，她给予了肯定，认定他能保护好晓晨。二是高启强的憨厚老实又细心大胆，能成事或者说不坏事，可以跟上她的步调。这也是为啥推荐他给泰叔的原因，不管他能不能成事，起码他不坏事！三是高启强听话，从翻领子开始，他认为陈舒婷说的对的事情，都会极力执行。"
1675967413,0,5,False,False,不同意捏，反正我个人就是觉得他是爱大嫂的捏[萌妹_好喜欢]
1676096230,0,4,False,False,陈书婷输在了爱上了高启强，将自己当做了高家人，当她认为自己是高家人时，她和泰叔的家业就已经暗示了最终会成为高家家业了。她将自己的全部都输进去了。
1676170529,0,4,False,False,只能说你没太看明白
1675860304,3,167,True,False,说实话，这每个视频都可以搞一搞然后写个论文了[脱单doge]
1676368422,0,2,False,False,我看的时候也是这么想的，之前被网上吹的我还有高启强是位重情重义之人呢，看完之后我真的一点都不喜欢[微笑]甚至是厌恶，我身边就有这种人，我也体验到他们利用别人达成自己目的的手段，但是现实中往往这钟人过的顺风顺水呢，那些善良为别人着想的“菩萨”不是被利用就是在被利用的路上[微笑]
1676356904,0,2,False,False,"所以我磕不起来强欣，我看到的只有一个拙劣的表演型人格早已在安欣机警正义的俯瞰下一览无余，而安欣这么多年坚持规训高启强（好像从那时候开始认领了高启强把监护他作为自己一生的责任）对我来说是过界的。
虽然不好磕但他俩关系中的宿命感可以品味很久，两个演员之间的化学反应也非常有张力"
1675926896,1,12,False,False,为啥不能说be啊 虽然这个词不算流行，但是一般评价电视剧小说电影结局都会用bad ending，happy ending这种啊
1675931101,0,5,False,False,太过极端也不可取，高确实本性上如up说的一样是野心欲望占大头的人，不然也不可能做出后面那么多丧心病狂的事，但是他身上也有人的特点，有一个人被命运推着走时该有的感情，如果说全是演的那我是不信的
1675939424,0,4,False,False,成年人搭伙过日子，你还想怎样？已经很甜了
1676266714,0,2,False,False,有点。。。过度解读了，而且有些细节和剧里对不上
1675954514,5,5,False,False,其实张颂文在微博说了：初恋，能不爱吗？ 他是好演员那他就会去琢磨角色性格 所以该信谁呢？感觉就和做阅读理解一样
1675909779,3,19,False,True,说白了，就是高启强从小就把家撑起来，当弟弟妹妹的大人，他也希望有人可以引导一下他，给他安全感和教育，可怜可恨
1675909625,0,26,False,True,不少人认为up的解读有些过于非黑即白了，但在我看来其实都是视角问题，部分人看到了高启强从一个卖鱼的成为大哥的过程，觉得他的一切“恶”都是有外部环境根源的，而up则是呈现高启强作为一个人他在多次面临选择时主观走向的“恶”。说实话，一个人自私、虚伪，大概确实是因为他成长的环境塑造了他，但能成为“大哥”的人本身肯定确实有一些不同于常人之处。比如面对徐江的威胁，唐小龙会妥协屈从，而高就会想反杀。杀了徐江并脱罪后本身就可以有个结束了，但他又去拜了泰叔。陈书婷对他而言是一种具有“母亲”特色的束缚，当陈死后，高的束缚就没有了。陈书婷被安欣接回京海的时候，曾经差点就命丧高启强之手，但虽逃了一时，却终究在高疯狂的追逐权与利之后成为牺牲品……
1675866246,7,30,False,True,这么一解读侧面更能看出来导演拍的确实是启强传[喜极而泣][大笑]对这个人物真是方方面面的刻画[大笑]
1675905231,0,5,False,False,不是全部认同up的观点。但有一点很确认，我现在更爱颂文老师了……
1675888520,0,18,False,False,"其实每个人都会有很深的爱，也有很深的恶，人是复杂的，所以我也不认为高启强对陈舒婷不完全纯粹的爱就不配感人，他的利己主义就十分可恶
伪装中有一秒的真情也是真情，他的复杂和大部分人生活中的真实心理产生了链接与共鸣，而打动我们的就是，裹挟在算计和情感中哪怕一瞬的真诚。比起让人敬仰的，拥有难以企及品质的珍稀角色，我们对相似中的特别更为敏感"
1675952251,0,4,False,False,爱！
1676342721,0,2,False,False,我前期一直不喜欢高启强这个角色就是能看出来他真的一直在利用安欣的善意，而且不以为耻那种。
1675907087,1,5,False,False,爱自己才能爱别人，尤其这种“走出来”的人物。爱是个不确定因素，像邓布利多和格林德沃，与魔法世界相悖的格林德沃到最后到没有背叛邓布利多，哪怕他们很早分道扬镳。承认一个反派有爱没什么问题，一个虚拟人物而已，大家喜欢他跟大家的三观没有什么关联。“共情”不适用于文学作品，喜欢就是喜欢，反派又如何。
1676174808,0,2,False,False,非常认同up的理解，不是否定高启强对亲人的爱，而是他永远最爱自己。
1675919018,0,5,False,False,角度新奇，也可以自圆其说，但是对高启强还是有些道德绑架的味道
1675916450,0,5,False,False,"好的作品能引发大家的思考是非常棒的一件事情，每个人看待事物时也不可避免的带有主观意识，基于自己理解的判断，在讨论过程中产生分歧也再正常不过了。需要注意的就是不要吵，不要上头，理智探讨，没必要上纲上线，更没必要为了虚拟的人物在网上跟不认识的人叫嚣、辱骂、讽刺、挖苦。
有人喜欢高启强就一定有人不喜欢高启强，有人认可up的观点，就一定有人不认可，各抒己见，理智讨论。"
1675902377,0,5,False,False,高启强绝对是爱他的，但在高启强的心里，他的弟弟妹妹是第一，他的妻子是第二，他自己和儿子是第三，其他人根本不算人，但在爱情这方面，高启强还真的是很爱他的，从为了他可以去教训自己的弟弟，就可以明白是对他有感情的
1676000848,1,5,False,False,高启强在陈书婷死前没有别的女人，死后也没有找，那不是爱是啥啊，是ed吗[笑哭]
1675909126,0,5,False,False,感情本来就是复杂的 没有很纯粹的感情，有了反而是很可怕的事情。
1675926685,0,6,False,False,这剧里女角色其实都挺惨的，怎么没个好的结局呢。
1675920480,4,12,False,False,他把陈当成自己的一条腿，本质还是自我的延伸，爱的还是自己
1675913831,2,4,False,False,一个人说是 后面都说是 太有意思了
1675885494,0,5,False,False,听了up的解读后我总感觉高启强这个角色表面描摹的很好，但仔细看总能看到一星半点跟高启强完全背道而驰的张颂文本人的底色。比如视频里试探老默那段，说到安欣对自己有恩，他眼睛里有点泪光，但明明这段从台词到神情高启强都是带着戏谑和虚伪的，而且前后两段都没泪光，只有中间有…只能说演员共情能力太强大了，导致玉有微瑕。（没有在指责，只是感慨加心疼）
1675866953,0,5,False,True,up主说他是动物这个说法，我理解的是：一直到中年他都过得很苦，而且没有自己内心所坚定、坚持的东西。所以当他有了财富之后，就无意识地从其他人身上索取来补偿自己。关键是他没有一个可以坚持的底线吧。
1675860456,1,5,True,True,可以可以！还会更狂飙吗
1675913504,1,9,True,True,不得不说，很多看的时候觉得突兀的点，被up两期视频讲的串起来了。很多说up过度解读的，up是针对已经完成放映的影视剧桥段进行分析的。而不是要拿演员做的幕后补充花絮一起分析的，好比我观感就是后面21年的剧情稀碎，即使我知道是疫情导致拍摄周期跟审核，也不妨碍这部剧本身后面的问题是客观存在的。演员的临场发挥，你觉得妙，不仅是视听语言上对你胃口，也是潜意识里符合你的逻辑感官才会觉得妙。所以大嫂拿领带勒的那段，是演员觉得这样更好，可能没有一个理论性的动机，并且拍摄效果也好，但关注觉得合理也是因为符合大嫂的人物设计。总的来说，张颂文老师是演活了高启强这个“演员”，不仅是令人折服的，也是带有欺骗性的。大嫂在我心里也从来不是什么善人，毕竟哪个想过安稳日子的女人，能给试图杀自己又出狱的人送一个赌场。不过送赌场也可能是高启强自己想缓和两个人关系，做的戏。但明知自己家的产业是建立在黄赌上面的，就别说什么为人父母知道这些东西害人还想全身而退了。最后回到up视频里提到的一些人物性格的映射。其实送橘子那里，小盛这个僚机也是强子的表演人格的投射，毕竟后面的对比看得出来他对这个大嫂意见很大，虽然也有抢夺了强子的原因，但就小盛那个点头哈腰笑脸相迎，全部投递有用信息的样子，你说高家兄弟来之前没排练过我是不信的。
1675925438,2,4,False,False,如果高启强真的是毫无人性的动物，也不可能在最后时刻还在叮嘱高启兰让她快点出国，甚至想把高启兰托付给安欣。
1675925126,0,4,False,False,陈书婷对高启强的认知不会是一个老实憨厚的人，真是这样的话怎么可能介绍给泰叔做干儿子？只能说陈书婷低估了高启强，最后失去了对他的控制而沦为附属
1675918484,3,4,False,False,有点过度解读了，这部剧的隐喻并没有这么多
1675929992,1,4,False,False,很欣赏up主的观点，不过个人还是觉得高启强这个角色并没有up分析的那样从一开始就有强烈的表演型人格，观众对于高启强这一角色的喜爱说明了他是一个复杂立体的角色，虽然因为各种原因，最终剧里高启强的转变有点割裂，我还是相信卖鱼强时期的高虽然有城府，心理素质过人，但存有一丝普通人的善。恶人也不是一天练成的，如果一开始高启强就是个隐藏大佬的话应该也不会引起这么多人的“共情”。
1675874731,0,5,False,True,看过up的解说，我才知道为什么有些书是“文学作品”，有些书是“小说”。
1675912815,0,7,False,True,我只能说颂文老师不愧是专业第一考出来的演员，演出来的细微之处，以及对高启强的人性善变隐藏感到害怕……原生家庭不好带来的暗处凝视
1675913117,0,6,False,True,只能说张颂文演技好，总有种温情的感觉，但绝对不能共情高启强这种人
1675873409,0,5,False,False,看剧个时候看剧的时候第一次觉得不对劲，是在陈舒婷为了高启强背叛泰叔，或者不能说背叛，只能说心里的天平倒向了更晚认识的高启强，表演型的人格真是太具有伪装性了
