上传时间,回复数,点赞数,up是否回复,up是否点赞,评论文本
1676204895,0,4,False,False,公测记得下官服，原神b服60级的经验
1676018237,0,4,False,False,我看你也挺急的，角色PV都放出来了，要不咱们干脆开服吧
1675995136,1,6,False,False,千劫：你没有资格……你们……你们都没有资格！[崩坏3·光辉矢愿_瞄准]
1676003161,0,4,False,False,"萝莉体型
能回血
会医术
不是人类
技能动作是转身[脱单doge]
白露：没错，正是...（捂住）
七七：正是在下。[脱单doge]"
1676001847,0,4,False,False,这以后会不会是七七差不多，喜欢但是常驻[tv_doge]
1676008493,0,12,False,False,"千劫：
“你没那个资格...你们...都没有那个资格！”"
1675994594,1,59,False,False,是我的错觉吗，感觉每半句间的停顿好长（？）（白露超级无敌世界第一可爱小龙女！）
1676023728,0,5,False,False,角色PV都出了，这游戏想必已经开服很久了罢[崩坏3·终焉归始_咀嚼][崩坏3·终焉归始_指点]
1676027888,1,8,False,False,给我一种，胡桃上了七七的身成了不卜庐第七十七代老板的感觉[doge]火把冰化成了水神之眼很合理
1676017760,0,3,False,False,铁道是回合制游戏嘛？
1675994997,4,21,False,False,4月26公测，好耶！
1676126517,2,7,False,False,ios爆了[doge]4.26[doge]不见不散
1675994682,1,3,False,False,虽然但是，配音感觉好怪？
1676043189,0,5,False,False,EMMMM 成分复杂 简单概括 喷水龙王 多多屁 带着神之嘴 在异世界药房打工的故事代号 77 [doge][doge][doge][doge]
1676185271,0,3,False,False,仙？仙…仙不灭！
1675996637,0,3,False,False,关注仙家军谢谢喵[原神_哇]
1676010514,2,4,False,False,现在看都是虚的，我得等玩了才知道，别像原那么无聊就行
1676079025,1,4,False,False,氪金点走一批，不爱看剧情走一批，二次元回合制走一批，这游戏能回到当年崩二和谐小圈子的氛围吗？留下的都是期待新剧情，新活动，二次元圈地自萌的玩家[妙啊]
1676024765,0,5,False,False,我崩不住了，游戏都还没出dv先出了
1676010057,0,3,False,False,[撇嘴][撇嘴]
1676004785,0,3,False,False,我叫白露，是个僵尸[脱单doge]
1676090026,3,5,False,False,给我一种萝莉版的帝君的感觉（ps:二创视频的），但我真的很喜欢这种[打call]（ps:没有重金属，是类似于对女儿的那种），赶紧公测！！！我现在就要玩！！！白露嘿嘿嘿嘿嘿嘿嘿嘿嘿嘿嘿嘿嘿嘿嘿嘿嘿嘿嘿嘿嘿嘿嘿嘿嘿嘿嘿嘿嘿嘿嘿嘿嘿嘿嘿嘿嘿嘿嘿嘿嘿嘿嘿嘿嘿嘿嘿嘿嘿嘿
1676094635,0,3,False,False,哼哼
1675995355,0,2,False,False,众所周知，龙跟龙的尾巴是两种生物[脱单doge]
1675994874,1,5,False,False,仙气飘飘的小白露🤤
1675994915,1,6,False,False,"旧事重提 ：https://space.bilibili.com/463937
这个人之前空口煎炒绝区零，却关注了崩铁"
1675995364,0,2,False,False,哈哈哈，我要在三测里面先体验一下试试[doge]
1675995367,1,4,False,False,来点弔图[崩坏3·终焉归始_咀嚼]
1676086228,2,5,False,False,大家入坑一定不要去B服啊！你的朋友大概率跟你不是一个服的！
1676022486,0,4,False,False,这盔甲，隔壁千岩军馋哭了[吃瓜]
1675998931,2,4,False,False,所以你到底公不公测？到底什么时候公测？！[初音未来_生气]
1676191376,8,4,False,False,"几个疑问望好心人解答：
1.重剧情党，但崩三20年已弃，只认识老角色，影不影响剧情体验
2.根据目前的测试内容来看，一个月几百块的微氪休闲养生党体验如何（没具体云过，但看过试抽视频爆率真的低）
3.日常必做重复任务多不多"
1676039391,3,7,False,False,这个孩子，看上去能当应急食品[doge]
1676004663,0,5,False,False,谁偷走了我的测试资格（跑来跑去）谁啊（仰天长啸）是不是你偷了我的测试资格（揪住衣领）说啊是不是你（狠狠盯住）什么？不是你？（十分不解）那是谁偷走了我的测试资格？是谁啊（继续奔跑）
1676001855,1,3,False,False,感谢🙏PV区评论提醒我去看了邮箱，让我发现我中了测试资格好耶[Cat2_Boom!]
1676032469,0,5,False,False,别看她小，她奶量惊人，流水的主C铁打的辅助
1676004660,0,3,False,False,还再往下看什么呢？十连双黄真君[脱单doge]
1675994741,0,3,False,False,快点给我公测[口罩][口罩]
1676092104,1,5,False,False,我为蹦三流过血，我帮原神锄过地，让我进去[大哭][大哭][大哭]
1676003504,0,5,False,False,白露是为了告诉大家，没资格的不要上火[tv_笑哭]
1676117258,2,4,False,False,"白露医生,我不是内燥,而是内湿,有的治吗"
1676167574,2,3,False,False,有资格却没时间玩[大哭]
1676029809,0,3,False,False,派蒙给我个资格好不好
1676026919,1,4,False,False,这萝莉怎么看起来像正太啊[笑哭]连我这个老萝莉控都犹豫
1676004904,0,3,False,False,唉，白露是挺可爱的，但是资格倒是给一个呀[辣眼睛]
1676002242,0,3,False,False,都有pv了，这游戏公测多久了啊[脱单doge]
1676089315,2,5,False,False,确实太干燥，我看着看着流鼻血了[脱单doge]
1676001323,0,3,False,False,"4月26日公测，补充，4月26日是我国铁路之父詹天佑的诞辰
4.26和三月初七都赶上了，很绝"
1675995035,0,5,False,False,终于，玩家们心心念念的第一个给敌人回血的人物诞生了[doge]
1675994478,0,3,False,False,让我看看，是谁没有资格只能在这里看PV[崩坏3·光辉矢愿_不可以看]哦是我啊[崩坏3·光辉矢愿_擦地]
1676055819,0,4,False,False,我看你这游戏应该做好了吧，你懂我意思吧[崩坏3_你好]
1675995947,0,4,False,False,已经体验过星穹铁道了，铁道是极好的
1675995097,3,18,False,False,"持明族在寿元到时会结茧涅槃重新变回幼年体，但会丢失大部分记忆
持明族要生长两百年后才会长大，但有些个体永远也长不大
白露是持明族族长
也就是说，白露合法n年了"
1676170922,0,4,False,False,好可爱的小姑娘！我真不喜欢回合制哇！要不要考虑一下把白露移到原神里？你看派蒙菲谢尔刻晴都过去了～
1676203588,0,3,False,False,虽然但是，总有点像水元素七七啊[笑哭]
1676172717,0,4,False,False,"没有资格？
原来不止我一个人没有资格！
[doge][doge][doge][doge][doge][doge][doge][doge][doge]"
1676249177,0,3,False,False,试玩过了，我认为还有些地方是可以打磨的，比如地图阴影和一些道具的阴影，一定要加上！可以提供更多的拟真感，让人看着舒服
1675996088,1,8,False,False,不会用着用着，就把敌人给奶了吧[脱单doge]
1675995197,2,3,False,False,"《崩坏：星穹铁道》白露角色PV——「天干物燥」
天干物燥，小心上火。内燥外调，外燥内养。要是都燥，就得吃药！
中文CV：
白露——多多
日文CV：
白露——加藤英美里
省流：农历三月七公测[脱单doge]"
1675994839,0,3,False,False,这小龙说话一套一套的哈哈哈哈
1676034511,0,3,False,False,4月26的公测应该是板上钉钉了，先是苹果商店的日期暴露，4.26换算成农历就是三月七，而且还是中国铁道之父詹天佑的生日，要素拉满了属于是[doge]
1675994419,2,43,False,False,白露白露[喜欢][喜欢][喜欢][喜欢]
1676105839,1,4,False,False,你不是会做萝莉跑步吗？为什么原神都用飞机跑？[生气]
1676020072,10,6,False,False,有个问题兄弟们，就是有内测资格玩了一下主线，然后时间问题不打算玩儿了，能直接把号给朋友玩儿吗？会封号吗？
1676125063,0,3,False,False,我看她的眼神，她是想来璃月了[原神_哇][原神_哇][原神_哇]
1676042681,2,3,False,False,詹天佑（1861年4月26日－1919年4月24日，英文名：Jeme Tien Yow），男，汉族，字眷诚，号达朝【34】。祖籍徽州婺源（今江西上饶市婺源县），生于广东省广州府南海县（现广州市荔湾区恩宁路十二甫西街芽菜巷42号）。12岁留学美国，1878年考入耶鲁大学土木工程系【2】，主修铁路工程。他是中国近代铁路工程专家【3】，被誉为中国首位铁路总工程师。其负责修建了京张铁路等工程，有“中国铁路之父”、“中国近代工程之父”之称。
1675998588,2,23,False,False,今天开测，QQ炸了，一定是米哈游干的[滑稽]
1675996965,0,4,False,False,4月26日，我与白露不见不散[doge]
1675994978,2,16,False,False,白露我也要给你起一个绰号，就叫你卖药的[傲娇]
1676007435,0,3,False,False,农历3.7公测，别忘了，这也是中国铁路之父詹天佑的生日啊[大哭]
1676164302,2,3,False,False,像，很像啊，有种姐妹关系dog[doge]（bushi
1676003107,0,3,False,False,"就算给怪回血我也抽[奋斗]
什么？真回啊[囧]"
1676028898,0,6,False,False,我看到了七七和可莉的影子，还有多莉的屑[藏狐]
1676003009,1,9,False,False,公测时间难道要在今年白露[热词系列_知识增加]
1676222658,1,3,False,False,谁搁那发了个弹幕“苍蝇搓手”笑死我了[喜极而泣][喜极而泣]
1676092823,0,3,False,False,医者仁心，给敌人回血（确信）
1675998065,0,3,False,False,我有一计，不如我们命今天为三月七，然后命三测为公测，这样大家就都能玩到了[脱单doge]
1675995248,0,6,False,False,多好的一款游戏，还没上线就胎死腹中了，我连游戏都没见到[doge]
1675994596,2,12,False,False,有的人已经玩上了，有的人只能在这里看pv[原神_躺平]
1675994623,8,209,False,False,"一个全新的星穹铁道频道，一个由真正热爱御宅文化的大家组建频道，欢迎对米哈游社区感到心累的玩家，也欢迎不想参与节奏的普通玩家，没有歪屁股管理，还有激情♂三房老哥，给大家一个和谐的讨论的氛围，一片社区净土
http://b23.tv/STdwSfy
点击链接加入频道：https://pd.qq.com/s/bh6551omb"
1676040304,0,3,False,False,确实顶，今天跨级打怪，人全死完了就剩爷和白露俩人1vN莽过去了。
1676087905,2,4,False,False,看到英配时候，发现没有翻译。那么问题来了，我是怎么听懂日配的[辣眼睛][崩坏3_？][音律联觉_疑惑]
1676116611,0,4,False,False,我感觉这次中配更好，其它的感觉有点成熟了，而且台词中有很多中国的专属词语是其它国不能很好翻译过去的。
1675999976,1,14,False,False,？把人打了，奶起来接着打？这是什么可怕行为[惊讶]
1676012128,0,3,False,False,把回合制的演示做的像动作游戏[笑哭][笑哭]
1676001037,2,5,False,False,还好我没有给我资格，不然这几天得累死。[墨镜]
1675995412,0,10,False,False,看看是谁还没有测试资格啊，原来我也没有，那没事了
1676033672,4,3,False,False,连着出，眼泪流了下来[崩坏3_哭哭]
1676029858,1,13,False,False,家中常储一日粮，单身光棍心不慌；家中常备二日粮，成双鸳鸯心不慌；家中常存三日粮，老幼妇孺心不慌；家中常贮四日粮，阿猫阿狗心不慌；家中常留五日粮，远亲近邻心不慌；家中常积六日粮，旱涝虫灾心不慌；家中常堆七日粮，天塌地陷心不慌；家中常满百日粮，敲锣打鼓奔小康…
1676009196,0,3,False,False,干翻原神，铁道永存[歪嘴]
1675997491,0,3,False,False,能喷水的葫芦，有角 ，能治疗，想到了以前动画里的大角牛[doge]
1675996324,2,24,False,False,早上好各位，抽到资格的除外捏[傲娇]
1676091781,3,3,False,False,"回合制的奶妈，重要性不用说
关键每轮战斗除白露外的队友被杀后，白露能直接复活队友，复活只有一次机会
已经是很优秀的奶妈了"
1676002141,0,3,False,False,寡人素闻“医治好治不病以为功”  白露“忘闻问踢，先打个半死在治病” 桓侯 “神医啊  寡人好了”
1675996187,0,3,False,False,真是没意思啊，仙帝居然刷这么多弹幕
1676035516,0,3,False,False,七七的动作，派蒙的声音，流浪者的吐舌头，你到底是谁[眞白花音_大头]
1676267365,1,3,False,False,我得了一种百年奇病，只有你这种药才能治我[脱单doge][脱单doge][脱单doge]
1676124760,1,3,False,False,改名叫原神•星穹铁道吧一股原神味[呆]
1676000482,1,9,False,False,我为崩三流过血！我为原神立过功！让我进去啊啊啊啊我要玩铁道[崩坏3·光辉矢愿_小喇叭][崩坏3·光辉矢愿_小喇叭][崩坏3·光辉矢愿_小喇叭][崩坏3·光辉矢愿_瞄准][崩坏3·光辉矢愿_瞄准][崩坏3·光辉矢愿_瞄准][崩坏3·光辉矢愿_大伟哥][崩坏3·光辉矢愿_大伟哥][崩坏3·光辉矢愿_大伟哥]
1676121399,0,3,False,False,没有资格但是抽到了白露抱枕[崩坏3·光辉矢愿_遨游]
1676219996,0,3,False,False,联动原神做成外传角色加入提瓦特吧！
1676043729,2,4,False,False,要是真的在3.7号上线(阳历)，我就给我自己买一台笔记本电脑，专门玩这个游戏
1676015605,0,3,False,False,"这是干什么这是干设么这是干什么这是干什么😭😭😭😭😭😭😭😭😨😨😨😨😨😨😨😨😱😱😱😱😱😱😱😱😭😭😭😭😭😭😭😨😨😨😨😨😨😨😨😱😱😱😱😱😱😱😭😱😭😱😭😱😭😱😱😨😨😋😋😭😋😭😨😱😨😱😨😨白露你太可爱了啊！！！！啊！！！！
白露的小脸蛋😭😭😭白露的小角角😋😋😋白露的眉头皱一皱😱😱😱白露的小嘴撇一撇😨😨😨
啊！！！啊！！！！这是干什么！！！啊！！铁道你再不公测我再抽不到白露宝贝我真的会好崩溃[大哭][大哭][大哭][大哭][大哭][大哭][大哭][大哭][大哭][大哭][大哭]"
1676008205,0,4,False,False,"我发布了一篇笔记，快来看看吧
甘雨？
深海的加护！
嘟嘟可？（可莉？）
https://www.bilibili.com/h5/note-app/view?cvid=21741212&pagefrom=comment&richtext=true"
1675994577,3,55,False,False,不给提前下资源更新，真坐得住啊你米忽悠[原神_给我走开]（我进去了）
1676010720,10,4,False,False,崩三和原玩了好几年了，来给各位提个醒，玩米家游戏要么一点别氪，要么多氪，你微氪和你不氪的游戏体验是一样的[OK]
1675994431,0,9,False,False,小仙帝！！
1676044303,1,5,False,False,看着如此欢乐的PV，我心中莫名的有种不安的感觉……
1676000463,3,5,False,False,玩了一早上，太好玩啦[脱单doge]
1676091810,1,3,False,False,因为你没有资格，正式因为没有资格啊
1676107372,1,4,False,False,这什么 游戏推广的广告吗（看了看自家广告 叹气）
1676010831,0,5,False,False,！！！！能不能给成男也出个这样带大龙尾巴的！！！！比如钟离皮肤也可以
1675998963,0,4,False,False,"给大伙说个事情，三测前3600块的1.5倍实际也不是赚的。3600块1.5倍是54000古老梦华。正式服前1308是双倍的，这部分是26160古老梦华，剩下的2292元全按充值648份额的1.25倍算是28650,两部分加起来是54750。三测返还和正式服给的是差不多的，所以不存在前1.5是赚的这个问题。（最后，我还要提一嘴。为什么我抽不到测试资格[大哭][大哭][大哭]"
1676002373,2,9,False,False,"蓝紫色头发，萝莉体型，定位奶辅，鼓捣药的！
是77没认错[doge]"
1676167507,0,3,False,False,我一直以为白露还没up，结果看了一些up发的视频有白露我就好奇，不是没up吗，结果新手池50抽一看，好家伙，最右边有一个不起眼的小白露[笑哭]啊啊啊啊啊啊啊，白露啊，我抽到克拉拉了
1676026186,1,3,False,False,这白露怎么派里派气的[脱单doge]
1676196416,0,3,False,False,"这个造型让我想起了小龙人，

  
 
 
     暴露年龄了，

  
       [鹿鸣_嗨]"
1676202031,0,3,False,False,"我:原神，又一个好消息一个坏消息
原神:？
我:坏消息是我喜欢上了其他游戏
     好消息是这款游戏也是米哈游的[滑稽][滑稽][滑稽]"
1676120053,3,3,False,False,咱浅浅问一下，这个不分B服跟官服吧[doge]
1676088480,0,3,False,False,雷电法王杨永信:你是懂治病的[doge]
1676056098,0,3,False,False,"我：冷静点，摆阵回合制有什么游戏性，你还嫌游戏不够多吗，以后各种游戏聚一起更新，你肝不过来的，还有，你忘了你预约完绝区零了吗？
（白露追尾巴）
我：预约预约🤪👉📱"
1676012749,0,3,False,False,拒绝犹太审美，从德意志开始
1675994489,5,23,False,False,星穹铁道三月初七就能公测，这多亏了小三月七，谢谢你，三月七
1676002455,6,43,False,False,原来没出的水系萝莉在这里[脱单doge]
1676007607,0,4,False,False,游戏都没有，你让我怎么荔枝[2233娘_怒][2233娘_怒]
1676166059,1,3,False,False,@废宅龙神决不中二 @幼菜的狱友 @好想rua白露啊 @木叶村在职下忍
1676038220,1,3,False,False,有资格的来看没有资格的看pv[doge]
1676108233,1,3,False,False,"原来望闻问切的“切”实指用手刀把病人打晕[口罩][口罩]
好吧，中医在古代就有非药物的麻醉技术了，真先进！"
1676023608,1,3,False,False,这游戏出了这么多pv，想必公测很久了吧？
1675994747,0,3,False,False,派蒙你看看人家！（考哥.jpg）
1676034721,2,4,False,False,"我现在就要玩：
星穹铁道，边狱巴士，终末地，来自星尘，丝之歌，霍格沃兹遗产，人格解体，犹格索托斯庭院[脱单doge][脱单doge][脱单doge][脱单doge][脱单doge]"
1676263268,2,3,False,False,"坏消息，希儿歪了
好消息，歪的白露！！！[崩坏3·光辉矢愿_遨游]"
1676003084,1,14,False,False,给怪加血，可以奶里加毒吗[doge][doge][doge]
1675995833,0,15,False,False,坏了，这下真给怪回血了，这下不得不抽了
1676014615,0,7,False,False,新的77已经出现，怎么能够抽卡不歪，穿越时空，穿破黑暗，77一定会出现～
1676019868,0,4,False,False,你不说，我不说，谁能想到这是个回合制游戏
1675995606,0,3,False,False,"从心理来说，人类肢体末端就两部分，一个是手，一个是jio，相对于手来说，脚因为不承担精细的活动所以并不灵活，脚趾短小紧致，脚掌所做出的活动范围也很小，整体上脚就呈现出一种静止的状态，导致脚天生就多了一种观赏和把玩的特性，她就像杨贵妃一样，侍儿扶起娇无力，懒散乖巧易推倒，很容易诱导人们的控制欲。从审美来讲，相较于脸部手部其他易可见的肌肤，由于脚在日光的露出时间少，更容易保养肤色，更容易保持娇嫩白皙的状态，如果再加上体态纤细的话，白嫩的足背上青筋隐现，足趾轻盈灵动，每个脚趾甲上浸染着少女青春活力的粉红色，从色彩搭配和构成来说就会给人一种雅致的感觉，而稍微丰腴的少女，足背也会圆润柔软，脚趾间隙少了疏离感多添一份丰富可爱，不禁让人感叹西子的淡妆浓抹总相宜。再说说足面和脚踝，足面红润可爱，五个脚趾面和脚掌的相近又分离显得相得益彰，灵动又不失雅趣，而顺着曲线从脚趾一直延伸到脚踝，由于处于脚部和腿部的连接处，踝骨和筋带带来的肌肤收缩甚至使这里成为判断女孩体态是否纤细轻盈的重要标志，一双白皙纤细的脚踝在罗袜的映衬下足以令人怦然心动，最后，脚呈现出来的整体曲线也是一种曲线美和造型美，玲珑的曲线上带动视觉造型薄厚的立体变化，让温润白皙的玉足就像最精美的玉器一样令人无限遐思
所以我能舔白露的脚吗？"
1675994822,0,2,False,False,真快呀。[滑稽]
1675994724,0,2,False,False,摇葫芦真可爱[崩坏3·光辉矢愿_比心]
1676001070,0,5,False,False,角色pv都出了，这游戏公测很久了吧[原神_嗯]
1675995842,0,6,False,False,既然角色PV都出来了，想必游戏已经开服很久了吧？[滑稽]
1676022977,1,3,False,False,你看她长的像不像隔壁一个冰系单手剑[doge][doge]
1676035253,4,4,False,False,游戏还没出怎么就角色pv了？[脸红]
1675994937,1,2,False,False,仙帝
1676001647,0,3,False,False,前排提醒，好吧已经后排了……铁道在苹果商店显示4.28公测，应该差不多，
1676017953,0,5,False,False,测试没落下，抽奖没缺过，就是没中过[hanser动物套装_泪流成河][hanser动物套装_泪流成河][hanser动物套装_泪流成河]
1676005430,0,3,False,False,想玩我 尾巴么
1675995098,0,2,False,False,[原神_哇][原神_哇][原神_哇][原神_哇][原神_哇][原神_哇][原神_哇][原神_哇]
1675995057,0,4,False,False,有的人参加测试，有的人看几遍pv[酸了][酸了][酸了][酸了]
1675996051,0,2,False,False,仙不灭
1676015208,1,3,False,False,应急食品，别以为换个样子我就认不出你了[doge]
1676041302,0,9,False,False,撩又撩的很，资格又不肯给[暖暖十周年_生气]
1675995110,0,12,False,False,今日我们相聚于此是因为我们没有三测资格
1676034352,0,3,False,False,[OK][OK][OK]130寸大白墙和4K投影机已备好，尽情的展示你的细节吧
1676026941,0,3,False,False,有测试资格，但是我玩了一会不知道我在玩什么，甚至差点睡着了[笑哭]
1675994643,1,7,False,False,"这个龙女是持明族的，
持明仙者，是余药力等所成。
换句话说，就是靠吃药之类的方法成就的神仙，难怪手里捧着药葫芦。"
1676017286,0,3,False,False,看完了，所以这角色是能复活敌方并能给对面回血是吗[脱单doge]
1675999015,5,17,False,False,"白露说的望闻问韩国人不会说是""韩医""吧[藏狐]，已经看到了未来"
1675997638,3,3,False,False,哎呀，小萝莉一个，嗯，什么时候开测呀？[嫌弃]
1675994753,0,5,False,False,啊哈哈，没有资格真好，能提前看到PV呢[墨镜][墨镜][墨镜]（发疯）
1676439273,0,1,False,False,人民日报居然也喜欢白露[doge][嗑瓜子]看来这次英语配音老师得加鸡腿了
1676041520,0,3,False,False,白露宝贝可爱到犯规[眞白花音_星星眼]
1675995817,0,6,False,False,今日我们相聚与此.....是因为我们都没有测试资格[保卫萝卜_哭哭]
1676259374,0,2,False,False,求帮
1676006783,0,5,False,False,我的仙术能使已死之人复活！
1675999614,0,3,False,False,【双厨狂喜！假如白露角色PV换上原神可莉角色PV声音，违和感去哪了-哔哩哔哩】 https://b23.tv/LImxhxg
1676038787,2,11,False,False,今天搜了一下，4月26号上线，已经预约了，终于有个盼头[热词系列_肥肠自信]
1676002268,0,5,False,False,早上在qq群里讨论星穹铁道，突然崩溃了
1676113726,0,3,False,False,这个角色简直长在了我的心…呃…心巴上！[喜欢][喜欢][喜欢]
1676028217,1,3,False,False,好可爱好可爱[原神_哇]有人能给我讲讲设定嘛？
1676018415,3,4,False,False,pv都这样了，角色演示怎么拍[热词系列_知识增加]
1676032123,1,3,False,False,@果蝇轰 果子哥快来发癫了[脱单doge]
1675994501,1,2,False,False,这下不得不抽了
1676001112,1,11,False,False,我头上有犄角♪~我身后有尾巴♪~谁也不知道♪~我有多少~秘~密♪~~~~
1675995637,0,3,False,False,"夜晚的愚戏该结束了

此刻你们没有观众

所有崇高的牺牲

都将铭刻于仙碑之上，与仙庭长存

在高洁的仙之尊主麾下

我们将攫取天地的权柄..."
1676006091,2,3,False,False,@待风来时_ @诺-别闹 @遐籁_永爱温迪 @拜托你今天和我咕咕 一起一起一起玩！！
1676117501,8,5,False,False,等等，这不会是铁道里的七七吧？[笑哭]
1676371150,0,1,False,False,我要资格快让我资格啊，我要资格
1676364662,0,1,False,False,什么时候公测！！！！
1676017342,3,7,False,False,"又出新老婆了,想必这游戏已经公测很久了吧"
1676001822,0,13,False,False,没有内测资格的人只能看PV，哪像我看完PV感觉自己真的有内测资格一样[妙啊]
1675994802,1,2,False,False,仙不灭🤘
1676006864,1,4,False,False,《转发给你想玩星穹铁道的朋友》，谢谢已经被暴击了
1675994488,0,11,False,False,仙涤啊😭😭
1675998735,0,6,False,False,怎么角色pv就出来了！我还没上车呐[崩坏3·终焉归始_摸头]
1676005307,0,2,False,False,这次的配音很好
1676378686,0,0,False,False,"我发布了一篇笔记，快来看看吧
我发布了一篇笔记，快来看看吧~
https://www.bilibili.com/h5/note-app/view?cvid=21828241&pagefrom=comment&richtext=true"
1676021538,0,3,False,False,你不给资格我怎么玩游戏？从今天开始我就是米黑了[阴险]
1676046013,1,3,False,False,这个角色好有特点啊，可爱又顽皮，但不是那种典型萝莉，是那种有点像正太萝莉结合体的感觉，有点小坏蛋的感觉，挺可爱的，终于不只是会做乖女儿形象的萝莉了。[星星眼][热词系列_妙啊][热词系列_吹爆]
1676002068,0,2,False,False,可爱的，诶嘿嘿，小白露
1676024237,2,5,False,False,"我原神好特么非
从上上雷神池 五连歪到了现在
歪到了七七抽胡桃72都还没出金[大哭]
希望公测的铁道 能给我克拉拉  
给我歪满命啊  歪到关服都行啊"
1676437195,0,1,False,False,动态撩的很，公测又不肯[灵魂出窍]
