上传时间,回复数,点赞数,up是否回复,up是否点赞,评论文本
1675995684,158,20445,False,False,[酸了]没资格的人都在这里看pv
1675995450,65,22039,False,False,"颜卿：诶嘿
白露：诶嘿是什么意思啊！"
1675995635,825,23776,False,False,打云骑军是吧，刚刚开到友军了，我也是仙舟人，我也喜欢仙舟
1675995583,101,9858,False,False,没有测试资格，泪目了
1675995662,21,3522,False,False,点开米游社-资格查询-后台关闭米游社-艹[囧]
1675995550,79,2912,False,False,坏了，这下真给怪回血了[吃瓜]
1675995746,34,6002,False,False,呵呵，你敢发角色PV，你敢不敢给个资格。我要资格啊，啊啊啊啊啊啊，次次参与次次无缘，我现在就要玩星穹，啊啊啊啊啊啊啊啊啊啊啊啊啊啊啊[大哭]
1675995745,45,3032,False,False,多多声音好像调了，看来找到专属声线了[doge]
1675995598,38,3205,False,False,难民区了属于是
1675995512,17,1567,False,False,"听声音感觉好屑哦[tv_调侃]
嗯？是多多配的啊！[tv_呆]
嗯，感觉更屑了～[tv_斜眼笑]"
1675995777,66,2720,False,False,不行了mhy我明天就要玩到星穹铁道，我等不到3月7了啊啊啊[抓狂][抓狂]
1675995494,56,725,False,False,没资格的集合，呜呜
1675995516,16,1070,False,False,白露女儿快让妈妈亲亲[大哭][大哭]没有你我怎么活啊
1675995548,14,795,False,False,白露！我的白露！我！受~不了啦~~！（发出改子哥的声音）
1675995618,16,471,False,False,穹宝，穹宝，你看看我，看看我真挚而热烈的眼神，你是不是还有三测资格忘记发了[大哭][大哭][大哭]
1675995538,15,321,False,False,白露好可爱！那个葫芦会出周边吗？[请吃红小豆吧！_wow]
1675995559,4,230,False,False,我倒是想充钱拿点返利，结果没有资格[辣眼睛]
1675995838,6,416,False,False,啊啊啊啊啊，我是白露大人的狗！
1675995543,2,116,False,False,武力爆棚的萝莉奶妈?[脱单doge]
1675995463,21,418,False,False,mihoyo的萝莉太纯真了 没有让人犯罪的欲望[doge]
1676427342,0,6,False,False,利刃打过来了吗，先投个降吧
1676345885,11,11,False,False,仙帝幼体绷不住了🤣👉
1675995247,2,16,False,False,这下不得不加入仙家军了
1675995284,3,19,False,False,小仙帝帮大家治病啦[微笑]
1675995212,1,21,False,False,这下给怪加血我都抽了，小仙帝[脱单doge]
1675995275,1,33,False,False,白露好可爱，看起来仙里仙气的，一眼就给人感觉是仙舟的本地人或者仙人什么的，给人一种别样的太上无极感！
1676034250,2,61,False,False,"没有用的冷知识：
苹果appstore预售日期为4月26日，农历三月七，系詹天佑诞辰。早年米哈游3巨头之一，蔡喵（蔡浩宇），第一款游戏是娑婆物语，主角叫弥生奈奈月。“弥生奈奈月”最早出现在本人蔡浩宇的轻小说《格物默示录》里，随后改编成了游戏娑婆物语。“弥生”是三月，“奈奈”是日语读音“七(なな)”的音译，所以弥生奈奈月就是三月七日。
在原神稻妻主城的炼金台旁边，可以看见一个叫“弥生七月”的须弥学者NPC。
而《星穹铁道》里也有一个名字就叫“三月七”的角色。只能说三月七是米哈游蔡喵的一个执念了"
1675995282,6,67,False,False,00:28 我先放两张图在这儿[可爱联盟新年_嘿嘿]
1675999557,1,17,False,False,"中国铁道之父，詹天佑，生日：4月26日。
星穹轨道公测，可以，这很可以，很帅。[原神_哼哼]
农历正好是：三月七。[原神_小事一桩]"
1676177134,2,14,False,False,"我发布了一篇笔记，快来看看吧
白露韩配角色PV中韩双语字幕&声优介绍
날씨가 건조할 땐 화병을 조심해
天干物燥，小心上火
내상과 외상은 치료법이 달라
内燥外调，外躁内养
둘 다...
https://www.bilibili.com/h5/note-app/view?cvid=21778764&pagefrom=comment&richtext=true"
1675995467,10,280,False,False,01:32 众所周知，龙和龙的尾巴是两种东西[可爱联盟新年_嘿嘿]
1675994605,4,39,False,False,仙涤可爱捏[星瞳_见钱眼开]
1675994803,1,15,False,False,我去，小仙涤的pv[星星眼]
1676016763,12,24,False,False,这个角色是脚不是人脚的形状吗？是说他的这个鞋里头的结构类似于一个后脚跟垫高的高跟鞋，其实里头一直在踮脚？这个鞋底儿的形状看着感觉真的好怪[疑惑]
1675995573,2,20,False,False,小仙帝可爱捏[永雏塔菲_对呀对呀]
1675995454,9,85,False,False,[崩坏3·光辉矢愿_吃西瓜冰]
1675996149,12,181,False,False,友情提醒：玩官服，玩官服，还是特喵的玩官服，别忘了喵[物述有栖_Foo↑Foo↑]
1675995335,3,17,False,False,我们今日相聚在这里，是因为我们都没有资格！（反转了我有资格但是是明天12点发车的二等座（悲[崩坏学园2_绷不住了]
1675995834,0,60,False,False,《给怪加血都抽》
1675994690,1,17,False,False,白露可爱捏[星瞳_见钱眼开]
1675994426,8,140,False,False,这么多pv这个游戏应该已经开服了吧
1675995650,2,18,False,False,谁有仙舟寒假生活的答案？日后必有重谢！！！
1675994886,1,10,False,False,刚才打到友军了，我也是仙舟人，我也很喜欢仙舟[响指]
1675995061,4,45,False,False,"我发布了一篇笔记，快来看看吧
It's hard to stay cool in this dry weather.

External heat needs inner coolin...
https://www.bilibili.com/h5/note-app/view?cvid=21736504&pagefrom=comment&richtext=true"
1675996115,5,38,False,False,首先，我要批评一个公司，其次我要批评一款游戏，为什么每次申请测试服资格都轮不到我，崩坏三也是，原神也是，次次都轮不到我[tv_发怒]
1676044779,5,14,False,False,太期待了，以后就是玩原神和铁道，没时间留给方舟了[永雏塔菲_太好吃了]
1676387819,7,6,False,False,服了，别在白露吐舌头的时候提流浪者那玩意嘛。[捂脸]
1676023323,6,12,False,False,速速公测，另外一些不喜欢回合制的，其实也没人逼你玩。早就告诉你是回合制游戏了，到现在了还在这说
1675994556,2,17,False,False,好诶，是小仙涤
1675994433,1,14,False,False,仙涤可爱呐[崩坏3·终焉归始_臭美][崩坏3·终焉归始_臭美]
1675994688,1,14,False,False,仙帝好可爱😍
1675994510,1,30,False,False,"顺便一下宣传喵
一个全新的星穹铁道频道，一个由真正热爱御宅文化的大家组建频道，欢迎对米哈游社区感到心累的玩家，也欢迎不想参与节奏的普通玩家，没有歪屁股管理，还有激情♂三房老哥，给大家一个和谐的讨论的氛围，一片社区净土

https://b23.tv/Ls9kt9A"
1676116438,0,10,False,False,那么好看的PV，想必游戏已经公测很久了吧
1676006075,2,68,False,False,"我发布了一篇笔记，快来看看吧
内养：脾胃健康与饮食、情志、起居等都有密切的联系，因此，通过情志疗法、茶疗、食疗、音乐养生等都可起到内养脾胃的目的。
外调：推拿、艾灸、刮痧、热敷、气功、...
https://www.bilibili.com/h5/note-app/view?cvid=21740502&pagefrom=comment&richtext=true"
1675994426,2,15,False,False,仙不灭！
1675995523,2,10,False,False,刚刚开到友军了
1675994909,4,126,False,False,"你这葫芦里卖的药是能给敌人加血的药吗？
你是故意的还是不小心的？"
1675995931,2,20,False,False,@诸天未来仙帝 给我变😡
1676349567,1,4,False,False,可恶啊，这个尾巴为什么抓不到，哼，一定要给你起个难听的绰号，就叫你坏尾巴好了[doge]
1676417460,1,2,False,False,黄牛抢到炒上天了，真正想玩的却没有[脸红]
1675994831,14,328,False,False,"我发布了一篇笔记，快来看看吧
我需要一个比可爱更好的词
德丽莎:犹大，发射！
舰长，原神好玩吗？
https://www.bilibili.com/h5/note-app/view?cvid=21736409&pagefrom=comment&richtext=true"
1676119178,0,9,False,False,"七七是个奶，白露是个奶。
七七是非人萝莉，白露是非人萝莉。
七七是璃月角色，璃月以中国为原型，白露是仙舟角色，仙舟应该也是以中国为原型。
七七是常驻角色，白露是常驻角色。
七七的角色演示好像是公测前。白露的角色演示是三测前。"
1676132750,0,7,False,False,作为一个医学英语专业的专八生，对中医英语有一点了解，这个视频里“上火”“望闻问切”“体虚”等等术语英文翻译的都很地道，为字幕组点赞[打call]
1675994632,3,73,False,False,我要给你起一个难听的绰号：就叫你买药的好啦[doge][doge][doge][doge][doge]
1675994679,1,14,False,False,"一个全新的星穹铁道频道，一个由真正热爱御宅文化的大家组建频道，欢迎对米哈游社区感到心累的玩家，也欢迎不想参与节奏的普通玩家，没有歪屁股管理，还有激情三房老哥，给大家一个和谐的讨论的氛围，一片社区净土
http://b23.tv/STdwSfy
点击链接加入频道：https://pd.qq.com/s/bh6551omb"
1675994590,0,22,False,False,收了仙家军这么多压岁钱终于有仙帝的pv了
1676013664,0,13,False,False,不好😫，我的……😣我的手……😖✊，仙……😔仙不灭😤🤟！
1675995357,0,5,False,False,好可爱啊，不过为什么一边叫白露大人，一边还要锤她，难道是翘班或者抓淘气的小孩子回家嘛[喜极而泣][喜极而泣][喜极而泣]
1676000194,2,49,False,False,我发布了一篇笔记，一起来看看吧！
1675994541,1,11,False,False,仙里仙气的小白露！会使用轮回仙术的小白露！
1675995865,2,9,False,False,各位记得给仙舟罗浮官方联合远航会点点关注，我将会为大家带来最新的攻略！[打call][打call][打call]
1675994664,0,9,False,False,白露……是诸天至尊的…独断万古的…太上无极的…永世不朽的
1675994470,0,9,False,False,白露，我一直相信着你的存在啊😭
1675994495,1,10,False,False,白露：我的轮回仙术能使死人复生[物述有栖_好耶]
1675996205,1,9,False,False,"我也玩白露，我也喜欢白露。
白露娇嫩丰满的两只小jiojio，紧密套在厚厚的小靴子里。如果用蛮力扯下靴子，就会伴随着汗液的拉丝，与少女劲大的体香。
白露柔嫩的小手手，宛如玉雕粉砌一般，可其中蕴含大力量。当一位仙舟的仙驱牵着她的手，就会情不自禁的念诵“太上无极白露，诸天至尊白露，独断万古白露，轮回九转白露”等崇高的字眼。
白露头上华丽的紫色龙角，彰显其神秘而高贵的身份。昔日一星神强者名为“仙帝”，着白衣，佩紫色龙角。今日方圆八方寰宇，亦只有白露继承仙帝这装扮，岂不是前世今生，仙帝再世？
所以，白露就是仙帝，仙帝就是白露。白露乃是太上无极仙帝，诸天至尊仙帝，轮回九转仙帝的最强化身。白露乃是星神之帝，天之帝，帝中之帝！"
1675996562,0,9,False,False,可以，我喜欢仙…舟
1675994742,2,8,False,False,仙不灭！
1675999832,0,6,False,False,"一个全新的星穹铁道频道，一个由真正热爱御宅文化的大家组建频道，欢迎对米哈游社区感到心累的玩家，也欢迎不想参与节奏的普通玩家，没有歪屁股管理，还有激情♂三房老哥，给大家一个和谐的讨论的氛围，一片社区净土
http://b23.tv/STdwSfy
点击链接加入频道：https://pd.qq.com/s/bh6551omb"
1675996883,9,49,False,False,[笑哭]
1675995681,2,6,False,False,永生！还是仙人，我去[热词表情_世萌双冠]
1675995147,1,7,False,False,仙帝
1675994905,0,6,False,False,仙帝[喜欢]
1675994587,1,6,False,False,仙不灭！😤[响指]
1675994532,0,6,False,False,仙不灭[崩坏3_GKD]
1675995082,1,5,False,False,仙帝可爱捏
1675994697,1,6,False,False,"一个全新的星穹铁道频道，一个由真正热爱御宅文化的大家组建频道，欢迎对米哈游社区感到心累的玩家，也欢迎不想参与节奏的普通玩家，没有歪屁股管理，还有激情♂三房老哥，给大家一个和谐的讨论的氛围，一片社区净土
http://b23.tv/STdwSfy
点击链接加入频道：https://pd.qq.com/s/bh6551omb"
1675994513,1,5,False,False,仙帝😍
1676010069,0,7,False,False,@独断万古仙帝 给我变😡
1675994557,0,20,False,False,"恭迎我主白露：
太上无极乾坤万法救苦救难悬壶除殃引雷辟水大罗金仙十方上帝。
🙏🙏🙏
南斗阳极广目慧明通天上清上气雷声显化伏魔九天司命衔药尊者。
🙏🙏🙏"
1676187016,0,4,False,False,你们都没有资格！
1676114735,0,4,False,False,"我发布了一篇笔记，快来看看吧
可爱捏
01:20 可爱捏
https://www.bilibili.com/h5/note-app/view?cvid=21767124&pagefrom=comment&richtext=true"
1675994545,2,7,False,False,诸天未来！
1676036496,3,7,False,False,已经被萌死了啊啊啊啊啊啊啊啊啊啊啊啊啊啊[大哭]
1676098471,0,9,False,False,游戏一般，目前不行，未来可期，因为我现在玩不了[酸了]
1676376942,3,2,False,False,我想问一下，铁道分不分官服和B服的？
1676006162,2,10,False,False,4月26日，农历三月七公测，望周知
1675994571,1,68,False,False,猜猜我为什么在这看pv，对喽，我没资格呀！[崩坏3·光辉矢愿_彩虹水枪][崩坏3·光辉矢愿_彩虹水枪][崩坏3·光辉矢愿_彩虹水枪][崩坏3·光辉矢愿_彩虹水枪][崩坏3·光辉矢愿_彩虹水枪]
1675994557,0,16,False,False,"一个全新的星穹铁道频道，一个由真正热爱御宅文化的大家组建频道，欢迎对米哈游社区感到心累的玩家，也欢迎不想参与节奏的普通玩家，没有歪屁股管理，还有激情三房老哥，给大家一个和谐的讨论的氛围，一片社区净土
http://b23.tv/STdwSfy
点击链接加入频道：https://pd.qq.com/s/bh6551omb"
1675994781,1,5,False,False,仙不灭🤟
1676030615,0,7,False,False,"蒹葭苍苍，白露为霜。所谓仙涤，在水一方。
😩"
1676016461,1,5,False,False,刚才开到友军了
1675996120,1,8,False,False,仙不灭👐
1675995350,1,5,False,False,小仙帝可爱捏🥰
1676003548,2,16,False,False,俺的测试资格。。我崩三1800天登录，原神1000ID开头，你不能这样对我[大哭][大哭][大哭]
1676271359,6,2,False,False,确定崩3里不出么？做成宠物也行，我再氪个648[保卫萝卜_哇]
1676375959,1,2,False,False,回合制游戏，不太想玩。
1676167648,1,5,False,False,哈哈，让我试试刀吧！怎么没刀啊，哦，这游戏肯定很甜！
1676380286,0,2,False,False,多多配的好好！！！！！[原神_哇][原神_哇]
1675995102,4,42,False,False,好可爱呜呜呜，新女鹅快来妈妈亲亿口，宝贝妈妈一定努力赚钱养你和爸爸，一定要快点来妈妈怀里，没有你们妈妈要怎么过啊[酸了]
1676016336,1,4,False,False,[笑哭][笑哭][笑哭]
1675995305,2,5,False,False,"你管我拳打脚踢，还是水淹雷劈，能治病的就是良医
白露作为良医甚至奶敌人，她真的我哭死"
1676065062,10,8,False,False,希望崩铁的圈子能小点，不要招来那么多乱七八糟的东西。(ᇂ_ᇂ|||)
1675995366,5,5,False,False,相当于派蒙可以加入战斗了[doge]
1676024121,4,13,False,False,"萝莉是一颗青涩的果，成熟了反而不好吃了
萝莉是一个女孩子最美好的年华，那可爱而美丽的容颜，那稚嫩而动听的嗓音，那天真而纯洁的笑脸，那娇小而玲珑的身体，喜欢那生气时而微鼓起的脸颊，喜欢那害羞时而微红的俏脸，喜欢那得到礼物时露出的开心表情，都透露出深深地魔力，让人为这着迷的魔力。
萝莉，是亚文化的珍贵结晶；萝莉，是可爱与萌的象征；萝莉，是女生最精华的年龄段的雏形；萝莉，是二次元送给人类的瑰宝；萝莉，是另一个次元的正义本身！萝莉，给了人类莫大的勇气和动力，她是盛开的花朵，她是高歌的鸟儿，她像是清晨绿草上的露珠，她像是世界上一切美好的事物，她是未来，她代表希望，她展露生命的美好，她代表神的奇迹。……没错，爷爱白露[保卫萝卜_笔芯]"
1676054324,0,7,False,False,今天开三测后从中午十一点一直玩到晚上一点，有一说一，非常上头，但还是想在地图设计上提出一点小建议：可不可以在公测时在游戏除主城区以外的野外地图里把宝箱位置标记出来呢？我知道星铁的游戏模式是回合制战斗+箱庭探索，内置角色没有膝盖无法起跳，所以其实宝箱的放置方法非常有限，即犄角旮旯的小宝箱，普通野怪附近的普通宝箱，地图解密的宝箱和精英怪看守的大宝箱，我认为这四种宝箱都应该显示在地图上。前两种，宝箱的显示其实是玩家探索路径的引导和动力，一场地图探索下来除精英怪看守的宝箱一个不剩还是很打动人的，而关于精英怪看守宝箱，我认为这个必须标出，因为它的存在和探索没有任何关系，玩过单机回合制RPG的都明白，这个宝箱都是后期回来再拿的卡等级宝箱，你不标记出来玩家后面难道要再沿着地图搜刮一遍吗？即便前三种宝箱官方要为攻略区up留的一口饭，也不影响你把精英怪看守宝箱标出对吧？
1676005694,2,91,False,False,头上有犄角，身后有尾巴，谁也不知道，我有多少秘密[滑稽]
1675994597,1,15,False,False,玉签·仙法开闸！
1676018591,2,6,False,False,公测我就不玩原神了，怕认错游戏[doge]
1675994712,1,7,False,False,仙涤可爱捏[崩坏3·终焉归始_燃起来了]
1676020591,20,6,False,False,借楼问下，这个游戏是否不能提“回合制”？最近看星穹铁道人物挺好看的，有点想玩，看了下这个游戏的直播，发现是回合制，我发弹幕说“原来是回合制”，然后很多人喷我，类似“回合制怎么了”但我只是说出了我看到的游戏机制，没说别的呀？正常情况下应该不至于被人喷吧，求好心人解惑[保佑]
1675998214,0,6,False,False,Ios苹果商店化身内鬼透露，4月26日（阴历三月七）预期公测，还有75天[滑稽]
1675994440,2,8,False,False,热知识:苹果商店已经显示了星穹铁道的公测日期-4月26日，而这一天是中国农历“三月初七”[脱单doge]
1675995395,0,6,False,False,00:59  01:01  01:02  01:04 白露女鹅太可爱了，真---给敌人回血我也抽！！！！[可爱联盟新年_嘿嘿]
1676167453,0,5,False,False,这游戏什么都好，就是没有给我测试资格
1676023393,2,8,False,False,喷水龙王，托管之王，一键AUTO，轻松肝完～[脱单doge][脱单doge]这下每天都可以睡饱饱了
1676145546,3,6,False,False,"感觉氪金是真的贵啊，还是走原神那一套，新手池50发保底就给我有点劝退了，十连还大概率一紫，新手送的抽数要是只出光锥不出角色或者不出金硬吃保底我都不知道怎么坚持玩下去。。。
up池也是原神的那个模式，就感觉很诡异，还把一个up角色保底搞这么贵，不氪金的只能硬攒很长时间，如果像崩坏3那种每周有稳定的高额可肝我觉得容易接受的多。
还有那个商店靠抽数兑换武器的功能我也觉得蚌埠住了，至少我玩的游戏里，开服第一批角色的武器，也很少能有几个版本到一年后还保值推荐硬抽和硬换的[笑哭]，这个感觉只适合玩久了该有的常驻已经齐了的玩家，零氪月卡微氪要攒个80抽小保底就谢天谢地了，更别说你这个新手池50发保底还得至少坑进去肝的20发了。"
1676128504,1,5,False,False,个人感觉还是得加个剧情跳过，但是发现崩三主线甚至没多少人知道人造终焉的原理，就挺难蚌[笑哭][笑哭][笑哭]
1676281672,1,5,False,False,"从心理来说，人类肢体末端就两部分，一个是手，一个是jio，相对于手来说，脚因为不承担精细的活动所以并不灵活，脚趾短小紧致，脚掌所做出的活动范围也很小，整体上脚就呈现出一种静止的状态，导致脚天生就多了一种观赏和把玩的特性，她就像杨贵妃一样，侍儿扶起娇无力，懒散乖巧易推倒，很容易诱导人们的控制欲。从审美来讲，相较于脸部手部其他易可见的肌肤，由于脚在日光的露出时间少，更容易保养肤色，更容易保持娇嫩白皙的状态，如果再加上体态纤细的话，白嫩的足背上青筋隐现，足趾轻盈灵动，每个脚趾甲上浸染着少女青春活力的粉红色，从色彩搭配和构成来说就会给人一种雅致的感觉，而稍微丰腴的少女，足背也会圆润柔软，脚趾间隙少了疏离感多添一份丰富可爱，不禁让人感叹西子的淡妆浓抹总相宜。再说说足面和脚踝，足面红润可爱，五个脚趾面和脚掌的相近又分离显得相得益彰，灵动又不失雅趣，而顺着曲线从脚趾一直延伸到脚踝，由于处于脚部和腿部的连接处，踝骨和筋带带来的肌肤收缩甚至使这里成为判断女孩体态是否纤细轻盈的重要标志，一双白皙纤细的脚踝在罗袜的映衬下足以令人怦然心动，最后，脚呈现出来的整体曲线也是一种曲线美和造型美，玲珑的曲线上带动视觉造型薄厚的立体变化，让温润白皙的玉足就像最精美的玉器一样令人无限遐思
所以我能舔白露的脚吗？"
1675994624,1,6,False,False,"旧事重提 ：https://space.bilibili.com/463937
这个人之前空口煎炒绝区零，却关注了崩铁"
1676101452,1,5,False,False,说第二个原的，铁道和绝区零是米新游戏，质量肯定得上去，都是米家游戏肯定有相似的地方。但原是旗舰游戏，这俩一个崩坏续作，一个新团队试水，大家都知道翻不起太大水花。旗舰作肯定打磨很久，比如之前砍掉的
1676083374,6,6,False,False,可不可以提高一下出货概率啊，作为一个回合制游戏，0.6的概率着实有些低....
1676007667,0,5,False,False,我也没有，但还是被这个图笑到
1676003738,4,24,False,False,以前只听说过奶队友，第一看见把敌人拉起来再打一遍[原神_欸嘿]
1675995253,0,3,False,False,天干物燥，没你没我，一肚子火[热]
1676016360,0,4,False,False,喜欢你的视频~
1676021024,0,7,False,False,"你发这个有用吗？我又玩不到，玩不到，玩不到。。。[未定事件簿_呜呜]
快给爷公测啊喂[未定事件簿_你醒啦]"
1676033779,1,5,False,False,对于此事，你怎么看（不知真假，来官方套套话[doge]）
1676019017,0,8,False,False,看封面又以为是哪个大佬给派蒙换皮了[脱单doge]
1676408836,1,2,False,False,先走一步[滑稽]
1675995198,1,5,False,False,01:04 能复活敌人，不觉得很酷吗，非常符合我对经常网上冲浪的米哈游的想象
1675994524,0,4,False,False,仙家军，集合
1676107918,0,2,False,False,这也太虚了吧[doge]，表情包拿走
1676037435,0,7,False,False,可爱的龙龙！！！！我真的超喜欢呜呜呜呜呜，很难拒绝会尾巴摇摇的小龙啊！！！
1676169463,0,2,False,False,@苏辞想吃烤肉 这不入坑？
1676006265,0,4,False,False,《我的仙术能使人起死回生》
1676002976,0,4,False,False,不抽白露的人全部图图了😡😡
1676036657,0,9,False,False,"可爱小龙妹亲＾3＾一个
白露:抗拒，你这老bt
一把抱紧
虽然不能玩到但是脑内剧场已经开演了[打call]"
1675995262,0,2,False,False,声音比派蒙要尖一点，而且情绪反馈也很活泼，而且白露好可爱啊好喜欢[保卫萝卜_笔芯][保卫萝卜_笔芯][保卫萝卜_笔芯]
1676001760,1,11,False,False,有这么可爱角色的游戏，一定公测了很久，很多人在玩吧[doge]
1676041028,0,7,False,False,他让我选择自己的年龄，我实话实说，14岁，然后，结束了[初音未来_吃惊]，
1676097583,0,4,False,False,在米游社看到的
1676028789,0,6,False,False,你发发这么多PV，你倒是把游戏发出来啊
1676003093,0,3,False,False,6
1676024226,0,4,False,False,喜欢你的视频~
1675997243,0,4,False,False,mhy!法克鱿!
1676013607,3,57,False,False,大家讨论的这么热火朝天，想必游戏已经开服许久了吧？[妙啊]
1676048513,0,2,False,False,请和原神联动，我要在原神玩到白露
1676042785,2,6,False,False,这些前期的角色，都有可能成为七七的那种存在[呆]可爱，但是没人想要
1675995643,0,7,False,False,"我也玩白露，我也喜欢白露。
白露娇嫩丰满的两只小jiojio，紧密套在厚厚的小靴子里。如果用蛮力扯下靴子，就会伴随着汗液的拉丝，与少女劲大的体香。
白露柔嫩的小手手，宛如玉雕粉砌一般，可其中蕴含大力量。当一位仙舟的仙驱牵着她的手，就会情不自禁的念诵“太上无极白露，诸天至尊白露，独断万古白露，轮回九转白露”等崇高的字眼。
白露头上华丽的紫色龙角，彰显其神秘而高贵的身份。昔日一星神强者名为“仙帝”，着白衣，佩紫色龙角。今日方圆八方寰宇，亦只有白露继承仙帝这装扮，岂不是前世今生，仙帝再世？
所以，白露就是仙帝，仙帝就是白露。白露乃是太上无极仙帝，诸天至尊仙帝，轮回九转仙帝的最强化身。白露乃是星神之帝，天之帝，帝中之帝！"
1676004789,1,6,False,False,我丢，谁说的这是心海和一斗的女儿，回不去了已经[笑哭][笑哭][笑哭]
