上传时间,回复数,点赞数,up是否回复,up是否点赞,评论文本
1676087488,0,5,False,False,我锅还妹买到呢你在这问我我这菜好不好吃？？？[脱单doge][脱单doge][脱单doge][脱单doge]
1676021167,2,3,False,False,想玩但没资格，这老米，三崩算是开服玩的（只因八版本，原直接是开服就玩的，就这样无论是撅渠0还是崩铁，申请资格一次没过，反倒那些一次没接触过的申请就通过，通过了就算了还骑脸嘲讽，太痛了
1676301843,0,2,False,False,氪金量这么大的游戏，一个原神就够了，我决定这游戏做个零氪党了[doge]再氪我是狗（月卡除外）
1676411501,0,1,False,False,已经看到这个抽卡率了吗真的低到可怕
1675996094,0,3,False,False,我是白露小姐的狗！！！！！！不要和我抢！！！[大哭][大哭][大哭][大哭]
1676000312,2,5,False,False,6元大礼包送金色绝版武器，首充双倍
1675995998,5,3,False,False,无意义的问卷，无意义的公告，无意义的活动，无意义的抽奖。消失吧，这个没有测试资格的世界[阴险]（掏出千律核心）
1676387539,0,1,False,False,这几个你小兵真逊啊，竟然打不过一个小孩儿[喜欢]
1675997754,0,2,False,False,小白露[鼓掌][鼓掌]搓手手
1676369971,0,1,False,False,二创那么多了，连攻略都有了，一定开服很久了吧
1676122256,0,2,False,False,我可不是炫耀[脱单doge]
1676124115,0,2,False,False,这一次我也要成为开服玩家。
1675994921,0,2,False,False,不看了，去玩测试了
1676000436,0,3,False,False,只给看不给玩，难受哇[崩坏3·光辉矢愿_剪掉]
1676108350,1,3,False,False,没错，这就是我和心海的女儿[原神_欸嘿]
1675995107,0,2,False,False,这是什么？超了[喜欢][喜欢][喜欢]
1676000980,0,3,False,False,声优加藤英美里，出道二十年，拥有开朗而且高音的声线，擅长配傲娇系和元气系的角色，也擅长配正太以及伪娘类角色。另外除了植田佳奈之外，加藤英美里也是有名的双马尾角色声优。非常喜欢电玩，游戏废人。曾自曝放假在家时一天打游戏的时间超过10个小时(现如今依旧)。08年获得第2回声优奖最佳新人女声优奖和歌唱奖(两个奖项)。12年获得第6回声优奖最佳助演女声优奖[tv_点赞]。
1676002900,0,5,False,False,完成成就:老六是不会被抓住的[脱单doge]
1676042453,0,3,False,False,作为一个从三崩子二周年开始接触崩坏系列的玩家看到崩坏出新作定然是很开心的，但是为什么我的海岛爆爆鸦变成奶妈了我不接受，其次原神火了之后就应该有很多要了解米哈游更多游戏的玩家，我是很开心的自己喜欢的系列被更多玩家所了解所喜爱，但是云肯定也有很多。从原神过来的希望先了解下背景，玩下系列其他作品了解下剧情，我很不喜欢云，希望云玩越来越少真爱越来越多希望米哈游越做越大，就这样。
1676030702,0,4,False,False,大概率是今年暑假上线了吧！[doge]
1676123151,1,2,False,False,水系的，蓝色的，小小的龙，尾巴会立直，技能与3有关（治疗3个单位）。嘟嘟脸可以rua！或许还能帮我洗衣服！不如。。。。。我就叫你小蓝吧！[脱单doge]
1675994751,0,2,False,False,没有资格的，出列
1676015414,3,5,False,False,原来有那么多人都没有啊！心里稍微有那么一点点平衡[藏狐][酸了][酸了][酸了]但是我周围的人都有啊，，又不平衡了[大哭]
1676377029,0,1,False,False,"现在的我：我要七七[大哭]呜呜，我要七七[大哭]为什么不歪七七老婆[大哭]
以后的我（极大概率）：我要白露[大哭]呜呜，我要白露[大哭]为什么不歪白露老婆[大哭]
（[保卫萝卜_哭哭]什么时候公测啊呜呜😭）"
1675999984,0,2,False,False,我需要一段时间来适应这种风格的
1676371952,1,1,False,False,兄弟们啊我记得是4月6号还是4月26号呀，但是我3月14号就成年了[脱单doge]
1675995290,0,1,False,False,相比大家都玩的都累了吧[脱单doge]
1675995334,0,1,False,False,快让我玩星穹铁道，瘾犯了[星星眼]
1675995260,0,1,False,False,中配是爱丽丝和桃乐丝，日配是欣华（阿克夏的幻书➕3）
1676123201,0,2,False,False,要是能和原神联动这个角色就好了[原神_哇]
1675994752,0,2,False,False,小龙人，好可爱
1676010921,0,4,False,False,搞我是吧（指没有测试资格）
1676121185,0,2,False,False,所以倒是给我资格啊[藏狐][doge]
1675995646,1,2,False,False,我没资格啊，我没资格
1675994450,0,24,False,False,无所谓，我玩不到[原神_喝茶]
1676125734,0,2,False,False,上火别国语言是怎么翻译的[笑哭]
1675997003,0,2,False,False,白露是丹鼎司司舵吗？
1676381330,0,1,False,False,12+（警觉）[doge]
1675994763,0,3,False,False,神他妈望闻问踢[喜极而泣]
1675994634,0,2,False,False,仙气飘飘[珈乐Carol_啵啵]
1676124370,0,2,False,False,"盲猜一波  
开服前:白露不歪，玩到关服
开服一年后:白露已出，前来还怨[doge]"
1676120321,0,2,False,False,大派蒙是吧
1675996126,0,5,False,False,剩下的角色pv建议一天一发[热词系列_妙啊]
1675995192,0,1,False,False,因为没中资格生气了，这次的硬币就不投了[崩坏3·终焉归始_燃起来了]
1676051747,1,8,False,False,朋友们，不要下b服不要下b服！！要去官服！！[未定事件簿_宕机]
1676026640,0,3,False,False,目前来看星穹像是崩三和原神的孩子[doge]
1676120126,0,2,False,False,我觉得可刑[doge]你们呢？
1676124613,0,2,False,False,常驻77，大家都会有的
1676115070,1,2,False,False,所以，这是常驻角色吗[微笑]
1676014245,0,5,False,False,不要惹恼奶妈，她不高兴可以打你，打完你还能治好你，之后接着打你[脱单doge]
1676004438,0,8,False,False,提前说一声，这个不是水系是雷系，崩铁里没水系
1675995143,0,2,False,False,在？抽个资格@崩坏星穹铁道
1676126224,2,2,False,False,你怎么知道我40发双金
1676246471,0,2,False,False,懂了，以后上火翻译成尿黄
1676032459,0,2,False,False,什么？水神出了？
1676005502,2,5,False,False,我为崩坏充过钱，我为原神氪过金，放我进去[崩坏3·终焉归始_摸头]
1675994907,1,2,False,False,铁道里的萝莉都能正常跑步 为啥原神就不能呢。
1676183578,0,2,False,False,角色pv都有了，这游戏想必已经公测很久了吧
1676167426,0,2,False,False,好可爱www
1676247671,0,2,False,False,回合制抽卡也要命数啊？
1676427197,0,1,False,False,仙虫真的是😓
1676141329,0,2,False,False,切记：不要在B站下载
1675994745,1,2,False,False,给敌方加血?
1676136566,0,2,False,False,@狂三酱请尽情蹂躏在下
1675994995,0,2,False,False,我先来，我是白露的[doge]
1676246940,0,2,False,False,太幼化了反而没那么可爱
1676273035,1,1,False,False,开评论的游戏都是实力派[脱单doge]
1675995271,0,1,False,False,我的资格呢，我那么大的一个测试资格呢？[微笑]
1675995019,0,6,False,False,角色pv都出了，想必这个游戏已经公测了吧？[脱单doge]
1675994968,0,2,False,False,好耶！新的女儿[给心心]
1676129697,0,2,False,False,@护妻魈仙人 [tv_点赞]
1676023772,3,4,False,False,这个我是不会喊女儿的，因为我女儿在她肚子里[脱单doge]
1676013582,0,2,False,False,咕嘿嘿，派蒙老婆好萌
1675994847,1,2,False,False,不会是公测后第一个up池吧
1676034298,2,4,False,False,西林出发。
1676001208,0,8,False,False,角色PV都出了，你这个游戏一定公测很久了吧[藏狐]
1675995044,0,2,False,False,卧槽，木下秀吉
1676166651,0,2,False,False,我都预约多久了，你都不给我开操。
1676002958,0,2,False,False,龙女仆-洗衣龙女
1675995862,1,22,False,False,直播间味儿对了，这下必玩星穹铁道了[呲牙]
1676007523,0,3,False,False,好可爱[未来有你_热情][未来有你_热情]
1676025489,0,4,False,False,白露，我的白露，啊啊啊，我命中注定的外敷呀！
1676008814,0,3,False,False,为什么不给我资格，明明是我先来的[小紫才没有摸鱼_又哭又闹]
1675997508,0,2,False,False,牛啊，这表情也太丰富了吧
1676124276,0,2,False,False,"无所谓，保底还没吃到[doge][doge][doge]米哈游所有游戏的欧气是通用的吧
三十发三个紫，我成功继承了我原神里的欧气[无语][无语][无语]"
1676002067,3,2,False,False,大家都没有资格吧！[脱单doge][脱单doge]
1675998114,2,2,False,False,虽然但是，这声音哪里像派蒙了，弹幕一直在说
1676129904,0,2,False,False,你滴，公测滴干活，钞票，大大滴！(๑‾ ꇴ ‾๑)
1675994754,0,3,False,False,今日我们相聚于此，是因为我们都没资格[tv_大哭][tv_大哭]
1675994786,0,2,False,False,pv好晃眼睛
1676004957,1,2,False,False,小时候的令真可爱（bushi）[原神_哇]
1676394191,0,1,False,False,仙帝😭😭😭
1676124194,0,2,False,False,没有白鹭rua我好燥[tv_抓狂][tv_抓狂][tv_抓狂]
1676006997,0,2,False,False,我抽到后一用，感觉就是雷系七七
1675994867,0,2,False,False,想必大家都没测试资格吧[藏狐]
1675994676,0,2,False,False,已！（经开服）无！（我）[热词系列_标准结局]
1675994836,0,2,False,False,前面的方舟，以后再来探索吧～[脱单doge]
1676017071,0,6,False,False,转圈抓不到尾巴，踢完人却可以抓着尾巴挡在身前的屑白露[星星眼]
1675994886,0,2,False,False,给怪加血我都抽.[doge]
1675994490,1,5,False,False,能在此相聚，想必诸位都没有资格吧[酸了]
1676211089,0,2,False,False,仙不灭
1676001400,0,2,False,False,给怪加血？新的内鬼出现了
1675994884,0,2,False,False,有没有和我一样三次测试一次都没中的
1675995102,0,2,False,False,像极了开服给77打的宣传pv[滑稽]
1676004902,0,4,False,False,这pv质量有所提高啊[脱单doge]
1676167378,0,2,False,False,我很佩服米哈游推出的角色，永远看不出来男女
1676126495,0,2,False,False,感觉确实没多大意思[思考]
1676007426,0,3,False,False,阿这，多多终于可以抽自己了吗，来跟我说，谢谢白露！[妙啊][妙啊][妙啊]
1675995968,0,6,False,False,《怎么这么虚啊》
1676002431,0,2,False,False,回合制的奶妈可是宝贝呀～(￣▽￣～)~
1675998722,0,2,False,False,中午好，除了有资格的人[保卫萝卜_哭哭][保卫萝卜_哭哭]
1676126664,0,2,False,False,派蒙
1675995894,0,2,False,False,听说今年农历三月七公测
1675995235,0,1,False,False,"“望闻问……”
切啊，扁鹊听了都觉得欣慰，还挺讲究的[妙啊]
“提！！！”
诶？？？？？？[惊讶]"
1676023078,0,3,False,False,这声音也太可爱了吧，有点小傲娇的龙宝宝
1676138583,0,2,False,False,这BGM很音游，超喜欢
1675995096,0,2,False,False,你这葫芦里卖的什么药[doge]
1676131705,0,2,False,False,感觉无论立绘还是建模都比原神强不少啊[笑哭][笑哭][笑哭]
1675999326,0,2,False,False,用水，城市科技发达。懂了，您就是大名鼎鼎的枫丹白露吧[脱单doge]
1676249596,0,2,False,False,好玩
1675998782,0,2,False,False,"朋友挤眉弄眼地问我:你手机里那100多G的都是啥？
我脸一红，赶紧凑过去压低了声音:嘘，嘿嘿，这可是好看的，剧情又好，布景又有气氛，各种人物都有，最重要的那些人的表情，哎呦呦，真的棒啊!
那朋友也来兴趣了，赶忙问我:我有个朋友也想要，能发我一份不，我转交给他。
我当然同意了，很慷慨，反手就把链接发给他。
朋友很兴奋，我趁机火上加油，又凑到他耳边说道:玩崩坏星穹铁道，享成功圆满人生。"
1676088643,0,6,False,False,我头上有犄角，我身后有尾巴，谁也不知道，我有多少秘密[热词系列_知识增加]
1676002975,0,3,False,False,赛博仙人起搏器[崩坏3·光辉矢愿_让我摸摸]
1676000025,1,2,False,False,天干物燥，我也燥起来了（翻白眼抻舌头）
1675996200,1,12,False,False,"我：“嘿铁道，你动不动就不发资格给我的日子到头了，把测试资格给我”
铁道：“如果你想要，那就自己来拿”（资格发完）
“这规矩你早懂得”
我：“我就知道你会这么说”（填写问卷*∞）
铁道：“我们之间发生过多少这种事情了”
我：“说不清，打发放测试资格开始，我们尽是在相互拉扯”
我：“是时候做个了结了，铁道…一了百了”（填写表格*∞+1）
铁道：（亮出角色pv）
一段时间过后…
我：（倒飞出去）"
1676246509,0,2,False,False,看见鬼叔的抽卡视频，一直歪这个，笑拉了，真的是[笑哭]
1676136430,0,2,False,False,好多次都被我划过去了，因为是创作推广，直到看到这jiojio，啊，awsl
1676248921,3,2,False,False,这是小正太吗，为什么评论都觉得是萝莉
1676136567,0,2,False,False,她以后不会就是吃你小保底的角色吧
1675995006,0,2,False,False,葫芦里卖的是什么药？是白露让我爱的无可救药[喜欢]
1676135122,0,2,False,False,这个可不是77  人权卡
1675997246,0,2,False,False,好想抓着尾巴薅啊
1676017701,2,2,False,False,好抽象的热评啊看不懂[辣眼睛]
1676165802,1,2,False,False,这是崩坏4？
1675994928,0,2,False,False,祝一楼抽池子必歪，我太羡慕一楼了（doge）
1675994513,1,2,False,False,今日我们相聚于此🕶😭
1675999639,2,8,False,False,农历3月7是4月26日，米哈游，我要在这一天玩到星穹铁道！
1676006448,0,2,False,False,《转发给你想玩星穹铁道的朋友》
1675995057,0,2,False,False,白露又小又坏又得意又生气的样子太戳我咧，好想养一只在家[兔年吉祥東雪蓮_宝]
1676009261,0,2,False,False,你可千万不要是飞机跑啊
1675997052,0,2,False,False,给敌人加血我也抽.jpg
1675995930,0,2,False,False,啊这  也太虚了吧？[捂眼]
1676016868,0,2,False,False,啊啊啊啊，好可爱啊啊啊啊啊，首先说一下我不是萝莉控，但是白露真的好可爱啊，可爱的小脚，可爱的小角，可爱的尾巴，我不是萝莉控，我真的不是萝莉控，嗯，真的不是（认真脸）
1675994807,0,2,False,False,我先来，白露我老婆！！！！！！！！！！！！！！！！！
1676120976,1,2,False,False,我大概明白了，是个大小姐，向往自由到处乱跑，而她家里人派了一队人去搜寻她。
1676002071,0,2,False,False,"首先我是不ll控
其次我不是ll控
最后，你说世界上为什么有这么巧的事，白露有一双脚，而我刚好有一张嘴🥵🥵"
1675994971,0,2,False,False,啊啊啊啊啊啊啊啊啊白露啊啊啊啊啊啊啊啊啊啊宝贝啊啊啊啊啊啊啊啊啊么么么么么么么么么么么么么么么么么么么么么么么么么么么么么么么么么么么么么么么么么么么么么么么么么么么么么么么么么么么么么么么么么么么么么么么么么么么么么么么么么么么么么么么么么么么么么么么么么么么么么么么么么么么么么么么么么么么
1676010215,3,3,False,False,所以星穹轨道多久公测啊 等哭了[大哭]
