上传时间,回复数,点赞数,up是否回复,up是否点赞,评论文本
1676009117,27,10646,False,False,深渊打成角色试用了属于是[梦音茶糯_绷不住了]
1676010047,12,5966,False,True,看完视频真的感慨，之前看时雨视频省略了凹的过程，给人一种轻轻松松的感觉，这两天开始看时雨直播，昨晚我四点多睡的时候还在凹（应该两点左右开始的），中间是无数次的尝试和失败。我看弹幕有人说“这号只是没角色又不是没练度”，但这号主四星角色没命座就很难打了，能过，但是操作要拉满，原魔还要配合（srds我想起昨晚时大夫对着原魔破防还是有点好笑），只能说时大夫真的妙手回春，你活该这么火活该赚大钱好吧！最后也恭喜时大夫千舰啦（其实前天就该祝贺的），很幸运能亲眼见证嘿嘿[给心心][给心心][给心心]
1676055586,13,795,False,False,身家万亿一分不舍得花，跑去村委会门口当保安拿工资1800苦苦熬日子说的就是号主[doge]
1676009138,41,4671,False,False,时大夫开药：夜兰➕绝缘[doge]
1676017208,110,2283,False,False,昨晚看了开头部分，为啥时大夫没把那句“要是你抽了枫丹的满命发现不符合想象，岂不是跟你存了七八年钱取个老婆然后他把你绿了”剪进来[doge]
1676009277,34,4156,False,False,这可是从两点打到六点的深渊
1676009143,33,3001,False,False,只看这个视频你永远不知道大夫凹了多久
1676011035,7,101,False,False,"看到弹幕里有人觉得圣骸兽又肉又多动，惊讶这个队伍居然和自己打的速度差不多的，估计是不太了解这两个怪的机制。
简单说一下吧，，这两个怪在正常情况下是处于圣骸状态下的，在此状态下对应的元素抗性为70%，其他元素抗性为40%。
弱点在于开局半分钟左右会放圣骸技，具体表现就是鸟会飞起来用尾羽放导弹，蝎子会把尾巴竖起来放小雷楔一样的技能，在放完这个技能后，这两个怪会留下对应元素的小衍生物，此时用对应元素攻击可以快速破除，不用对应元素只要攻击频率够也可以。
退出圣骸状态的这俩就会瘫痪，同时所有元素抗性回到10%，这时候全力输出就可以快速击杀了。这也是为什么大多数4金左右的队伍打这俩怪时间都差不多，一般都是圣骸状态磨血半分钟左右打烂状态一波带走。"
1676099322,4,89,False,False,这期视频夸的不只是号主顽强的xp与只用这些角色也能玩得下去的耐心，而是主播高超的技术和坚定满星的决心；也向我们证实了没有好的角色不代表不能战胜深渊，重要的还是我们为每个角色日新月异地提升练度啊[加油][脱单doge][支持]
1676009783,33,1153,False,False,今天凌晨从三点左右看到六点，一直在打这个号，作业都补不动了up还在凹，太牛逼了
1676040412,6,45,False,False,这不是纯纯痛苦号？四星没命座比圣遗物烂更致命，基本上四星的毒点都靠命座解决，尤其是玩惯了高命四星去打低命四星是真痛苦。点秋香我都满的，上个版本雷国打无相铁差不多50s，然后我帮我朋友打，他面板跟我差不多，还是二命雷神（问就是九条没练起来），打雷国结果打着打着发现怎么这无相铁不掉血啊，雷神一刀比我多10w，速度还没我的号快，最后不对劲，回去看圣遗物和天赋，没问题，结果TM发现0命班尼特，1命香菱0命行秋，，，我自己对雷国的轴是按四命的大招来对的，他这个0命搞得我轴根本对不上，雷国蒸发一转才2w[藏狐]四星没命座是真痛苦，而且这个视频一看这个怪的走位就凹了很久[藏狐]
1676009196,16,1043,False,False,真的在现场，凹到半夜两点多，之后我顶不住，睡觉了。[笑哭]
1676009188,11,686,False,False,生活必需品，一天不看你的视频就浑身难受[吃瓜]
1676021499,10,395,False,False,《凹279次深渊》（视频号）[doge]
1676062968,1,27,False,False,从八万粉看到二十万粉，期期不落，期期白嫖，甚至没关注，全靠首页推荐[脱单doge]
1676012561,14,91,False,False,号主怕不是听了某些“大佬”的话准备屯一个满命满精的角色[脱单doge]
1676026050,9,68,False,False,好家伙57级原石粉球你是一个都没抽啊，就这九万原石氪金都得六七千，差不多六七百抽一个人满命加一个专武绝对有了，我除了胡桃赞了一百抽剩下原石就没超过1600过。我懂了现在都角色属性是会贬值的只有原石是不会贬值的，这波啊是理财游戏
1676014035,0,147,False,False,真的要三连支持一下，雨大夫凹了四个多小时，全成一句脏话都没骂，当时弹幕都在吵让号主出来叫停，up还劝弹幕要友善，中途出来刷新了buff，终于凹出一次三个女团能靠近一点让砂糖颠个勺，凹完还又继续打了三个舰长的号，真的很敬业情商又高！！[点赞][点赞][点赞]
1676010184,2,37,False,False,"种门都难救……
说说吧，昨天直播间有多少看睡着的[跪了]"
1676021517,22,48,False,False,我23开头(2022年6月入坑)都总计用了10万原石了，这人怎么一年半了才9万原石[疑惑]
1676172644,0,6,False,False,这种太痛苦了，人家PC端技术好得凹四小时，那只能说基本上号主自己玩基本没可能满，要是手机端直接寄。深渊满星纯属折磨自己
1676008444,4,37,False,False,虽然我们想看主播玩痛苦号，但这已经不能称为痛苦，都难产了……代玩的痛苦，看的也痛苦
1676118088,0,9,False,False,视频确实爽，一下就过了，但是时大夫可是花了四个小时才满星啊！
1676014413,0,32,False,False,这次本质上没有动这个号的练度，但是展示了up高贵的手部乘区。。我只能说，手法真的太强了[脸红]
1676014583,0,54,False,False,在现场，主播真敬业，打了五六个小时
1676008861,8,51,False,False,这个号问题最大的是没有五星人权卡，22开头的uid说明他至少错过了去年的万叶和夜兰，而且不抽卡四星没有什么命座，所以就算练度高也会打的相当痛苦。等枫丹角色未来可期不如现在就开始精益求精。
1676141555,5,12,False,False,不是强度党且不喜欢夜兰就不抽夜兰呗。号主有厨力以及自制力值得致敬。主播接了单就一定给打满不管凹多久也很牛逼。不理解踩号主的，人主播都没说接深渊限制条件呢[辣眼睛]
1676008025,9,31,False,False,"昨天晚上那个天灾号 时雨凹了快四个小时居然过了 惊为天人[打call]
时大夫妙手回春啊[脱单doge]"
1676008161,1,27,False,False,省流：等枫来
1676011633,2,26,False,False,在现场，看到后面直播间所有人都痛苦了
1676008481,1,22,False,False,这练度其实很高（相比往期），他自己都打到12-3了，我们觉得打不满是因为号主没有我们常用的角色如雷神草神什么的，因此这次抓药只需要些许的时大夫[doge][doge]
1676009291,4,20,False,False,这个号主应该是看到了枫丹八骏图，不得不说，枫丹角色确实很戳xp
1676031966,13,79,False,False,"这种抽卡还是太过极端了，其实每个版本官方都会出一些平民战神级别的队伍，像是2.0的雷国，3.0的绽放。
但凡下个两金，抽个草神妮露，组一队原绽放对群，再组一队超绽放对单。不说深渊自由，至少自己能打满了。
这个号少了200抽攒到枫丹应该也至少有个七八百，到时候还是可以选个枫丹的角色满命。芙卡洛斯，琳妮特，喜欢啥都能抽个满"
1676029375,1,18,False,False,手术做了4个小时，手术很成功[脱单doge]
1676024892,1,15,False,False,不管是不是痛苦号，打了四个小时真的是敬业，希望不要再有这么折磨人号了[捂脸]心疼心疼up吧
1676025718,7,11,False,False,说只是没角色不是没练度的，有没有可能主包凹了4个小时你才能看到这个视频[藏狐]
1676059985,0,13,False,False,"1命行秋，0命97忍，1命柯莱，0命凯亚..香菱班尼特命座没看到，但是应该也不高。低命座四星真的不是练度可以解决的，哪怕圣遗物250分都救不回来。圣遗物只能弥补伤害（但是能有eq+3级多？何况还有行秋那种减水抗和硬增伤命座），命座里还有各种机制啊。光是一个技能持续时间+3s给角色带来的提升都是难以想象的。
这是真的痛得不行的痛苦号。"
1676012777,1,18,False,False,这号一直打那么多时间的原因是因为四星全是低命，练度其实还是不错的，但奈何本身就是四星角色组出来的队伍，再加上几乎都没有命座，就显得非常难打
1676030290,16,11,False,False,搞不懂这种玩法的意义何在，哪怕中间偶尔抽点新角色玩都行，一个不抽去等一个没见过不知道技能的角色，然后为了这个丢失一堆玩法和角色的体验，长时间玩角色没有新鲜感，跟正常玩家比少了太多游戏体验
1676049600,6,10,False,False,"0抽，11w原石了
其实有一部分人也是无抽噢[Cat_slip]"
1676052896,5,9,False,False,就是练度高的痛苦号，不是练度垃圾而是四星就是弱，大部分人包括我都拿着高命甚至满命四星，可能已经对零命低命四星的强度失去概念了，直播的时候也说了练度高了，这个就没必要在弹幕吵了吧
1676075026,2,9,False,False,抽了xp出来最后发现没队友就搞笑咯
1676021690,3,12,False,False,虽然这样囤很爽，但是一想到每月的5个篮球5个粉球换不到，心里就很难受，所以我没囤过。[崩坏3_糖葫芦]
1676021007,16,10,False,False,虽然满命夜兰确实很强但是还是希望大家不要无脑劝人抽，首先囤一个满命夜的体验未必有多抽几个低命五星好，此外像这种囤了这么多的不是在等真爱就是在整活，肯定不是强度党嘛
1676022291,3,12,False,False,都说夜兰有强度的美，可我xp就是夜兰，我好喜欢啊，刚出的时候一命，现在满命二精了[笑哭]
1676027247,6,14,False,False,怎么老说这号练度不低，只是缺命座，搞得好像随便就能过一样，就算抽了能随便打那又怎样呢，不就是难在没有抽。为啥不夸夸up手法呢？
1676129794,4,6,False,False,我觉得这个号培养思路和思路下的完成度可以了，只是没抽卡。这样的队伍打起来这么费劲，怀疑是不是说明游戏设计时就隐形要求抽5星角色抽命座才能正常玩了。。。
1676117894,0,8,False,False,我觉得号主就是来消遣主播的，人家打过肯定知道自己这号满星有多坐牢[doge][doge]但凡抽抽限定池都随便满的，可能号主XP是纠缠和原石，也可能是在等天理(bushi
1676008417,9,12,False,False,这才是真的爽好呀，练度也在深渊可以打满。这么多原石，到时候可以抽个爽。
1676010471,5,26,False,False,都不用猜，这种屯屯鼠就是纯XP党，逮住一个喜欢的把骨髓都抽出来，其他看都不看一眼。
1676085861,0,8,False,False,这根本不是命座问题，还是练度问题，看久岐忍身上那0级圣遗物，才这么几个角色，都还有人能带零级圣遗物，香菱也是刮，我看根本没刷几把绝缘，材料也不见多
1676008684,0,23,False,False,好牛！！昨晚本来想亲眼看到结果，结果从两点半打到四点半结果睡着了 。。一觉起来看到结果的感觉太好了！！时大夫nb！！！
1676034352,0,11,False,False,极致闪避和聚怪手法，真的强，五体投地了
1676015245,3,11,False,False,号主的名字叫无何有镜，夏娜里面的，估计什么时候原神出钉宫配音了就抽了
1676029112,2,6,False,False,还好吧这个号，至少圣遗物练度角色等级技能天赋都拉了，点秋香国家队加种门也能打
1676017675,0,11,False,False,"我觉得这号主倒是个正面例子，也给了时大夫一个证明自己的机会。
反正我是真的怕了，没点强力组合，真没耐心打。"
1676008948,1,11,False,False,凹了4小时的号哎  真痛苦[辣眼睛]
1676009530,1,11,False,False,以后我也不抽卡了 这全四星不也能满吗[doge]
1676028628,3,9,False,False,看着我自己的号留下了眼泪 怎么我比人家多这么多金还是打不过呢
1676009541,1,11,False,False,虽然不怎么抽卡，但除了很能屯之外应该是最近视频最正常的一个[2233娘_大笑]
1676048670,3,14,False,False,说爽号的，剪出来看着当然爽。这玩意up从不到三点凹到六点多。这期深渊说实话对伤害要求不是特别高，但是对手法要求很高。我上雷国行秋换夜兰出来溜溜，下神鹤万心，第二间重开了不下四十次，琢磨手法，调圣遗物重开加一起也得有两个半小时。特别是12-2上半，香菱被击退或者击飞瞬间满血蒸发，补救机会都没有，雷神砍一半脚踩班的圈（四千九一跳），被打扛不住一秒。我的剪出来也是爽号一遍过。个人认为这期上半没钟离或者尼绽放就不存在爽不爽号这一说法，哪怕你满命满精雷神的雷九万班和满命满精公子的万达，没秒了这俩玩意被击退或者击飞也得重开
1676028762,0,14,False,False,离谱，谁再说零氪不能玩我就把这视频扔过去[笑哭]不抽卡都能玩
1676027130,2,7,False,False,开服只充了六张小月卡，十三金，存了八万六。没有遇上特别喜欢的角色，准备一直屯下去。
1676008432,2,16,False,False,up昨晚打了近4个小时，五点才打满星[藏狐]
1676007951,0,11,False,False,极品自抽号[doge]
1676008885,1,15,False,False,[大哭]很喜欢雨师傅，特意在饭点发出来当我的电子榨菜
1676012107,1,10,False,False,我从凌晨十二点开始看up直播 然后up两点左右就开始凹这个号  凹到五点多的时候我已经看困了看累了都 up还在坚持不懈地凹 听说是早上六点多才打完 真的好敬业[大哭]
1676008745,0,12,False,False,太惨了，凌晨5点我都睡了还在打，居然真的过了，时大夫牛逼
1676444994,0,1,False,False,时大夫，太牛批了啊[打call][打call][打call]怎么请时大夫看看我的号，从来没打瞒过12层
1676183358,2,3,False,False,不像小号，这么多到肝了100%，很好奇存这么多原石到底在等什么
1676009782,0,81,False,False,太牛了[大哭][大哭][大哭]昨天全程看着凹的，时大夫挑战自己，太牛了！！！
1676009617,1,8,False,False,一天不看时大夫心刺挠[脱单doge]
1676035263,6,16,False,False,我在等一个白毛红瞳哥特风的合法萝莉，不是可莉这种（当然这种也不错，我也1+1了），草神可惜了是绿瞳，所以只抽了2+1，如果哪天米哈游敢出一个完美符合我xp的萝莉那当场6+5，哪怕全部大保底的满定轨（来自究极白毛红瞳控的执念）[原神_哼]
1676008308,0,15,False,False,号主:我攒原石那么累，懒得抽怎么了[doge][doge]
1676008245,11,9,False,False,为什么枫丹剧情角色都还没有就已经有死忠粉了呢[热词系列_知识增加]
1676019237,0,8,False,False,不算爽号，因为打的不舒服。但也不是痛苦号，因为痛苦号就像up以前视频那样根本没法打深渊。
1676014765,0,8,False,False,以前觉得深渊博主都是氪师傅来着，看完视频觉得原来还有手法怪来着
1676010158,0,8,False,False,昨晚直播在现场，时大夫真的凹了好久我早上六点醒来还在打，泪目
1676008583,2,8,False,False,证明全4星也可以满深渊[doge]
1676106234,0,7,False,False,这是纯纯的手法，把这个号拉胯的强度抬到了不属于它的高度，牛逼。
1676024930,1,7,False,False,查id  本期深渊你一共凹了279次
1676009370,0,7,False,False,路过的一个打不满深渊的57级好像被狠狠地踹了一脚
1676033109,2,6,False,False,推荐夜兰可以，但是劝满命感觉不太合适[喜极而泣][喜极而泣]夜兰剧情和人设很好但是建模真的不怎么样，人家存了那么久肯定是想要个戳XP的角色。卡深渊了抽个零命的够用了
1676026927,9,6,False,False,还有人说夜兰丑我是没想到的，都是建模的锅，原画是一点都没问题
1676010613,5,8,False,False,这号怎么说呢一旦爆发原石，就能爆杀一条路，但是可惜现在不能。还好角色练的集中，至少练的角色有练度?[囧]
1676120245,1,5,False,False,"觉着9w原石不多的我阐述一下(
首先我不氪金不抽卡的小号开号一个月剧情清空活动一个都没做，1w多原石，地图只清了蒙德，目前1w9原石，中间混了1800的日常任务给的原石，璃月稻妻须弥的宝箱清完目测还有1w+40粉球左右，转换一下地图清干净也就3w原石左右的抽数，就和某多某宝的科技号差不多，不过我深渊还没打只打到5-3[笑哭]要攒9w那还得算上各种大大小小的活动奖励，起码要肝十来期活动，我对uid的日期没啥印象，但是目测是八重神子上线那期池子开的号吧，那就约等于每期不落的肝才能肝到9w，号主有没有氪金我不晓得，有大小月卡应该会更合理一点[思考]
自己手动不抽卡肝了小号才意识到我大号又肝又氪抽的那么多抽数得多让人心疼[笑哭]"
1676023549,0,6,False,False,打了四个小时，我看了一个小时半[脱单doge]
1676008033,0,8,False,False,某种意义上的爽号[doge]（指抽的爽）
1676116937,0,4,False,False,以前一直白嫖，今天这视频必须投币[doge]
1676023263,1,7,False,False,时子哥，等我一年，我开个小号打一年地脉来找你打深渊[doge]
1676177127,1,3,False,False,"想问问号主,这样有办法每个月换满5个粉球吗？
我也在囤,不过突然发现第一个月换了5蓝球血吗亏[大哭]"
1676168932,2,2,False,False,刚玩买了月卡，创世结晶该怎么用
1676042592,2,3,False,False,冲了一万块感觉是一样的体验...
1676029206,2,5,False,False,原石肯定少领了很多，一年半全勤快有60级了。
1676057139,10,5,False,False,手残党，打不过[辣眼睛]
1676386719,1,1,False,False,夜兰真的好用，萌新提前进入养老院
1676270827,2,2,False,False,自愧不如的我只能打11-2。25开头的
1676015319,6,6,False,False,他至少还有久岐忍，我好羡慕
1676008998,1,6,False,False,要练度有练度要操作有时雨[吃瓜]
1676011978,0,6,False,False,在现场，真的凹了好久好久好久好久，观众都看痛苦了
1676038443,1,6,False,False,低命四星，也就97忍和班神比较好用，看到“练度高”的言论感觉挺好笑的
1676109236,1,5,False,False,说不抽角色也能玩的，砂糖，久岐忍这种没有10层都难打[辣眼睛]
1676009068,0,6,False,False,昨晚失眠，我基本是跟着看的，人都看麻了不知不觉就睡着了，醒来还在打我焯
1676020211,3,6,False,False,夜兰不对xp抽了干啥，我都没练她
1676018730,3,6,False,False,有一说一，他只是角色少，但是练度都是可以的
1676028243,0,5,False,False,"柯莱：来跳舞吧
空：别来碍事"
1676138211,0,2,False,False,"凯厨+4星爱好者
看到这个视频表示倍儿有面子[doge]"
1676018248,1,6,False,False,时雨这个素材剪的可惜了，半夜凹的时候真的看得热血沸腾，只看这个视频的小伙伴可能真的感受不到
1676013860,0,5,False,False,我早上睡醒，一进去正好打的最后一次。
1676020126,2,6,False,False,真的，深渊满星什么也代表不了，我1.3脱坑的，刚回来3个月，0氪弄了套雷国(运气好雷神和专武都没歪)。弄了套刻尔西(回归抽的草神)，刻师父也是常驻出的，用的海参的专武。今天上午刚把刻师父等级和武器提上去，下午深渊就满了而且相当轻松。只能说这游戏深渊只是对玩家的最低要求，就算你0氪、玩的时间短又怎样？深渊满星又算不了什么……就算不满也又能怎样，能代表什么呢。[无语]
1676030107,0,5,False,False,枫丹，今年就有了，要等，也等坎瑞亚[doge][doge][doge][doge]，迷语人戴因，或者等大号派蒙
1676026226,4,3,False,False,"50原石而已  何必呢
12层6星  随便打的
执着50原石  不如充个月卡"
1676040887,0,4,False,False,时大夫真的是生死人肉白骨，太牛了
1676093255,2,3,False,False,有人说不抽是号主的事，但是你让主播花了3个小时凹，后面一堆排队的你这不是纯折磨人
1676008635,3,6,False,False,离谱的是居然打满了，还不痛苦[doge]
1676008633,2,6,False,False,真的见证历史了，这个号看到半夜三点多实在吃不消就润了[笑哭][笑哭]
1676029555,0,4,False,False,本来看着时大夫的千舰还想着原友的钱真好挣，结果人家是有真本事的，活该他赚钱啊
1676078652,0,4,False,False,痛苦的不是号，是主播
1676010841,3,6,False,False,这样的号凹4个小时都能过这up太牛了，那我的号应该也能过了
1676025259,0,4,False,False,顶级自抽号~！
1676114800,2,3,False,False,加成下来一转最高才1.9w 这香菱哪里伤害高啊
1676032829,1,5,False,False,越是这种一个都不抽的，越是小号，正常人咋可能这么刻意。不过也确实牛，这种号可以自己调节战斗强度，也不用追剧情，保证战斗体验始终处于可以打的过又不至于轻松虐的状态。现在老玩家都有点尴尬一旦圣遗物基本毕业后，这游戏战斗都是复读机，反而没有之前开荒那种小心翼翼的压迫感了。
1676121820,0,2,False,False,不是1年半，uid对不上
1676170473,0,2,False,False,不懂就问，主播在玩万达国际青春版吗
1676013631,0,5,False,False,"吾日三省吾身
你原石呢？
你树脂呢？
你在干嘛？"
1676096085,0,4,False,False,结论：高贵的手部乘区
1676014985,0,13,False,False,"命座问题，行秋只有一命，挂水空档期长，贴身水剑产种效率低，香菱没四命爆发时间太短了
操作难度上砂糖聚怪依赖走位，上半队伍生存压力也大，凹起来还是很费劲的"
1676013583,1,5,False,False,玩这么久才九万？[辣眼睛]，我上年九月份到现在都花了12w了[辣眼睛]
1676010829,7,5,False,False,一金还是天空刃，0.5金的成本打满[嘟嘟][嘟嘟]这可太牛了
1676082027,0,4,False,False,这不就是磊哥的屯八万原石玩法吗[doge]
1676094831,2,3,False,False,玩的应该不到1年半，uid226开头，挺靠后的了
1676013571,0,5,False,False,芽儿哟，这能满[洛天依_棒]
1676011339,3,9,False,False,事实证明，原神不需要抽限定五星[doge]
1676027849,0,4,False,False,多注意休息，路还很长，身体垮了一切都补不回来了
1676017298,3,5,False,False,四星阵容练度高也是可以横推深渊的，特别是种门，只要求精通和等级，玩游戏玩个乐，想怎么来怎么来就好没出喜欢的角色就不抽，这没毛病[OK]
1676024415,3,5,False,False,既然是肝帝，且原石97000，像是零氪或者月卡，那问题就来了，这个人是提督或者舰长吗[思考]
1676078017,1,4,False,False,"芽儿哟（0/1）
哎→↗呀→→（0/1）
每日一淦（0/1）
CPU（0/1）
（悲）
[doge]"
1676013782,1,6,False,False,就怕这种，看这还可以，其实处处是雷的。看着还可以，所以你不打别人肯定有意见，但是这号除了角色基础练度外，要什么都没有，打起来巨痛苦。还不如那种一眼就知道不行的，那种号不打别人也没意见。
1676010325,11,30,False,False,这才是囤囤鼠该有的练度态度[抱拳]
1676008599,0,5,False,False,什么时候来个原人整活啊[脱单doge]
1676009806,3,5,False,False,时大夫妙手回春，但是这个号主练得真的很不错啊，比前面看的几个痛苦号不知道好了多少倍[保卫萝卜_哇]
1676009817,1,4,False,False,你不是搞笑区up吗[笑哭]
1676030474,0,3,False,False,这个号可不是没练度，是没角色没命座。up给行秋换西风是因为祭礼精1，只有40%的触发概率。
1676023659,0,5,False,False,这个老哥和我xp差不多一样，就是喜欢枫丹角色，但忍耐力真不如他，不过我对高练没什么大要求，除了水神命座和专武外，其他的有个0命就可以了[脱单doge]
1676015758,0,4,False,False,肯定是芙芙啦！芙门[鼓掌][保佑]
1676008016,1,9,False,False,戒毒所出来的吧[辣眼睛]
1676036401,4,4,False,False,本人218开头，今天刚刚满365天，一周年纪念日了属于是()[脱单doge]
1676030771,8,4,False,False,好歹深渊先抽两队打再屯满命啊，两金和零金完全是两种体验，一队雷国一队妮露也不用多少抽，但是深渊体验天差地别
1676020565,8,4,False,False,全歪都能满命的我笑了，我299抽刚好一命夜兰[跪了][跪了]，你猜他这够不够
1676023953,0,5,False,False,当我看到弹幕说时大夫凹4个小时的时候，路转粉了[原神_喝茶]
1676027528,3,4,False,False,看完视频，打开深渊，自信满满，不可食用鸡蛋，退出深渊，打两块矿，下线
1676021619,1,5,False,False,其实数量到一定程度后你就不会想抽了，亲身经历，这么多抽完会心疼还有一种空虚感[微笑]
1676023389,4,4,False,False,90级凯亚迪卢克，天空剑班尼特。种门都90级了，这不爽号吗
1676017007,0,4,False,False,这号之前没种门的时候怎么打的深渊？？？[辣眼睛]
1676008103,0,4,False,False,这是等着抽满命天理呢[doge]
1676023194,0,4,False,False,今天凌晨看到四点多实在熬不住了[笑哭][笑哭]
1676023561,0,4,False,False,四神一帝一后都是功能行角色抽了保值直接能玩到官服，现在温蒂弱点但是大世界也不差啊如果你是角色厨当我没说
