上传时间,回复数,点赞数,up是否回复,up是否点赞,评论文本
1676036816,5,3,False,False,为什么我打的速度比这个号都慢一堆[灵魂出窍]我练度真的这么低吗[微笑][灵魂出窍][笑哭]，我是刚玩三个月半的萌新。[笑哭][笑哭]
1676012431,0,3,False,False,屯石抽天理
1676008060,0,2,False,False,[崩坏3·终焉归始_嘲笑]
1676032631,0,2,False,False,需要代肝的老板看下动态捏[脸红][脸红]
1676011996,0,4,False,False,太感动了，我两点睡的，八点起来一问说时大夫终于过了，凹了四个半小时，[热词系列_泪目]
1676019152,0,4,False,False,这个时候就要来一句：你的角色像被融了一样[大笑]
1676018626,0,4,False,False,号主自己能打到深渊十二层也是很牛逼的
1676065978,0,3,False,False,全程在现场 我森林书做了一半凹了四个半小时才凹过的 中间多次尝试换队换圣遗物以及破防 另外这里插一句题外话 包括此号在内的各种痛苦号 时雨在打的时候总是有路人会骂号主 甚至道德绑架号主的 时雨自己都没说啥 基本能打能凹都会试 实在不行的充6块 总之号主打深渊是上舰长排队才能打的 希望各位能理智看直播 看个乐就行[脱单doge]
1676041514,3,3,False,False,深渊能满星，原石又多，这不是爽号是什么？[doge]
1676041147,3,3,False,False,弹幕一个个吹种门种门的，没妮露草神爱尔海森的种门真的不是特别强，凹了好几个小时给你看的剪辑版.
1676011594,4,4,False,False,看完发现我是真手残，中等毕业雷国12-2死了十几次
1676027746,0,3,False,False,感想：不是四星打不了，是没手[藏狐]
1676016949,0,4,False,False,这个号练度对于这么少角色挺高的，但是真的很难打满星，这种情况属于有希望满星但很难，真的折磨人，主播真牛[请吃红小豆吧！_倒地]
1676018345,0,4,False,False,不得不说时大夫的操作乘区真的牛逼，拉满满爆了属于是，三剑鬼几乎没有打到一下
1676026358,0,3,False,False,@Automata丶镜 这是号主，小月卡都不充的，硬囤等枫丹满命战神
1676125054,6,2,False,False,小号这样屯  很正常。我三个号  一个号什么都玩，一个号全肝一种圣遗物单推，一个全屯
1676385738,0,0,False,False,"体验过深渊练度不够的就知道这种痛苦了，操作都练熟了，死不了，就是伤害上不去，超时结束。
或者有时卡在某个关卡，被几个冰女雷莹之类的精英怪虐得惨兮兮，深渊就是卡练度和阵容的地方，手法可以保证生存，但在限时的情况下被限制就很难过去。这个UP主很有耐心，能坚持尝试"
1676099223,0,2,False,False,抽枫丹的德沃沙克
1676008794,0,3,False,False,今早凹了几小时，不会就是这个号吧
1676036311,0,3,False,False,因为我自己抽角色也比较印度，所以也特别喜欢看这种阴间号，虽然痛苦的是主播哈哈哈。自己目前有好感的只有钟离一个，零氪非酋原石全砸钟离满精满命上了，开服号目前为止还没实现满精的目标，所以现在情况是角色特别少，仓库五星武器特别多X。不过幸好也不太想抽别人，估计接下去三年应该也不会有人超过他了，除非把赤王给我捞回来[doge]
1676122539,0,2,False,False,不用质疑UP主的手法。只要看他节目看上10几期以上都知道。[妙啊]
1676023919,1,3,False,False,抽个6+5夜兰，原神通关了[妙啊]
1676123786,1,2,False,False,根据已有的角色，做出正确的配队，并且配以操作，这才是乐趣所在
1676008055,1,3,False,False,史诗级囤囤鼠
1676011092,0,3,False,False,在现场，折磨观众
1676009743,0,49,False,False,在现场，后半夜没顶住睡着了，雨哥真的，我哭死[崩坏3·光辉矢愿_比心]
1676353183,0,1,False,False,看完视频真的感慨，之前看时雨视频省略了凹的过程，给人一种轻轻松松的感觉，这两天开始看时雨直播，昨晚我四点多睡的时候还在凹（应该两点左右开始的），中间是无数次的尝试和失败。我看弹幕有人说“这号只是没角色又不是没练度”，但这号主四星角色没命座就很难打了，能过，但是操作要拉满，原魔还要配合（srds我想起昨晚时大夫对着原魔破防还是有点好笑），只能说时大夫真的妙手回春，你活该这么火活该赚大钱好吧！最后也恭喜时大夫千舰啦（其实前天就该祝贺的），很幸运能亲眼见证嘿嘿[给心心][给心心][给心心]
1676046102,0,3,False,False,这种号如果不是小号我是真的难以想象是怎么坚持下去的？
1676010517,0,3,False,False,高贵的手部乘区，我有四队完整配对，练度也在正常水平之上，可惜深渊期期差两个星也懒得凹。
1676016431,2,2,False,False,什么时候来个原人号打12-3
1676043598,1,3,False,False,这个号是不是昨天晚上主播凌晨三点还在打的那个啊
1676342510,0,0,False,False,"这种四星队伍主要是容错低不太能失误。
对于弹幕里说砂国+芭芭拉超绽的，我在这想说，上半几乎都是对单环境，这种情况下芭芭拉的挂水不如行秋（心海也不行），这会造成产种效率严重低下。
芭芭拉和心海的挂水需要在三个及以上的怪情况下，才能超过行秋。
但卧龙凤雏的对群挂草能力一般，怪散一些的话，草主Q就只对着一只怪打（而不是像甘雨绫人Q这种轮流来）。
12-2上半走位稍微迟疑很容易被蝎子+火鸟连击秒，下半班尼特给自己挂火也很容易给冰剑鬼打融化秒掉。
12-3下半第一波，水刀妹容易突然一个技能突刺几十米远，导致伤害利用率下降，三位召唤师这边也容易让你一不注意就被烧死。砂糖死了会导致三个聚不起来以及减抗和精通收益的丢失；凯亚/香菱死了会少一个输出，以及反应增伤；班尼特死了少了将近1k的攻击力，凯亚Q和香菱一样也能锁。
看着up打觉着简单，剩的时间那么多，实际上手就会发现压根不是那么一回事"
1676008595,0,3,False,False,我昨晚看着看着都睡过去了，最后终于打过了，妙手回春啊时大夫
1676436508,0,0,False,False,真正诠释了什么叫全四星也能满星深渊[doge]
1676024201,1,3,False,False,当初我也为了钟离存过2w。果然，上天不会亏待努力自律的人。我150抽直接出了3只干到了二命。然后我就用剩下的去抽武器池。果然，上天会让人运气守恒，我的班尼特有五星武器用了。
1676236219,1,0,False,False,这个账号只要武器圣遗物没问题，就已经可以去砍深渊了。久崎忍/柯莱/草主/芭芭拉是种门；行秋/香菱/班尼特齐全，拉上迪卢克或砂糖都可以出国家队。五星主C基本上随便抽哪一个都可以进国家队，妮露复刻抽一个可以玩妮绽放。
1676025248,3,3,False,False,我自己的号深渊凹了101次才过，痛苦死了。主要问题就是最后一间聚怪。最后莫名奇妙怪聚一起了过了。
1676007971,0,3,False,False,电子榨菜[doge]
1676010412,1,3,False,False,昨晚4点起床，做日常，然后顺手点进直播间，就看见在凹这个号。通宵了一整晚？
1676009481,0,3,False,False,全四星练度有还是能满星，但明显比以前难了[doge]
1676086676,0,2,False,False,我从3.0抽完草神到现在，没咋碰都快攒够4w了，57级才9w确实不多
1676009339,0,3,False,False,xp是原石，淦得蒸蚌
1676353258,0,0,False,False,我朋友也有个屯屯鼠，但他至少把各国神都抽了[笑哭]
1676349901,0,0,False,False,太恐怖了，我有雷国 万达 草国 宵夜 神莫万猫，连通关12层都做不到[捂脸]别说满星了
1676283385,1,1,False,False,up你这样玩会会显得我充钱也打不满深渊很呆诶[辣眼睛][辣眼睛]
1676381251,0,0,False,False,我也uid226开头，去年四月份绫人刚出玩的，这号比我还晚入坑，有一年半？[笑哭]
1676082281,2,2,False,False,这期是UP话最少的一期[doge]
1676104555,0,2,False,False,弹幕有人说他xp是法国的[辣眼睛]
1676009010,0,3,False,False,种门拯救了时大夫[梦音茶糯_绷不住了]
1676019599,1,3,False,False,屯原石会上瘾，抽卡也会上瘾。索性我俩号，一个屯原石，一个抽卡。[doge]
1676382058,0,0,False,False,估计是在等戴因[嗑瓜子] 因为我就是[调皮]
1676008578,0,3,False,False,真打满了，这不纯爽号[doge]
1676031515,0,2,False,False,我是开头2263比他快一点点，现在签到300零几天
1676095378,10,2,False,False,这号有人说是爽号？凹了多长时间你们知道嘛？
1676028731,0,2,False,False,存天理，灭人欲[滑稽]
1676057138,3,2,False,False,号主没抽过那97忍怎么来的啊，我也好想搞一个，之前up都没抽。
1676089132,1,2,False,False,看到这个号，我觉得我该练个香菱和班尼特了
1676011720,0,3,False,False,太敬业了雨大夫，晚上开着直播睡着了醒来早上7点钟看到还在直播[抱拳][抱拳]
1676387295,0,0,False,False,"已点赞 up主不喜可删
萌新up主首页视频抽奖送大小月卡128 欢迎大家来参加[打call]"
1676369883,0,0,False,False,不抽的话天空刀怎么弄的我也想弄一把（没杠真的想知道班尼特很馋）
1676383126,0,0,False,False,原石好多，想偷点[脸红]
1676395855,0,0,False,False,这个号最少玩了三百天了，232开头的273天。
1676360447,0,0,False,False,"我群里也有这种的，很早之前就建了个小号，当屯屯鼠
我也想过，但是肝不动[笑哭]"
1676032000,0,3,False,False,"号主：行
时雨：行
观众：不行[tv_尴尬]"
1676114622,0,2,False,False,夜兰真的第一幻神主C，雷神在夜兰比都要稍逊一筹，毕竟综合能力是真的高，能打能替能辅
1676014298,0,2,False,False,你倒是说句话呀 时大夫
1676343531,0,0,False,False,我突然发现我现在体系成熟了，我好像完全可以攒着等满命冰神了
1676036513,1,2,False,False,什么法国号主[笑哭]
1676020421,0,7,False,False,这走位，这聚怪都是顶级
1676007929,0,2,False,False,第一
1676432435,3,0,False,False,他不抽卡池哪来的全四星角色呢，抽了卡池就算歪也不应该只有个开局给的迪卢克啊
1676031966,0,3,False,False,怎么弹幕里面人家不抽夜兰还能急啊 真把这游戏完成原兰了？
1676108938,0,2,False,False,看up视频体会各样游戏人生了属于是
1676023029,0,2,False,False,时大夫妙手回春呀[点赞][点赞][点赞]
1676356220,0,0,False,False,我小号就差不多这样，只玩四星，五星就一个最喜欢的纳西妲
1676370168,0,0,False,False,为什么不再坚持个一年？那样凑够两年半你就成了！
1676060812,2,2,False,False,xp为什么就不能打深渊了………  人家可能自己打不了 这不就是花钱让主播打吗 反正自己又有快乐也有满星。。
1676030583,3,2,False,False,第一次刷到，为什么这个up粉丝没那么多却千舰啊，是哪里特别好吗
1676350162,1,0,False,False,60级打不通12层，11层勉强6颗星[笑哭]
1676045772,2,2,False,False,弹幕说几点打到几点的都有，一时间不知道到底是谁没有看直播，又是谁在瞎说[原神_喝茶]
1676025803,2,2,False,False,迪卢克:为何弃我如敝屣……原神设计师！
1676110617,4,2,False,False,一年半的每月粉球你岂不是一个都没换[思考]
1676037111,5,2,False,False,感觉种子伤害好低，这个久岐忍是三精吗[翻白眼]
1676007981,1,2,False,False,攒满命呢[doge]
1676052743,0,2,False,False,有练度但没命座，伤害刚刚够打满星，行秋，香玲，砂糖这要是三个里只要有两个是满命就up这手法估计能一遍过
1676094171,0,2,False,False,好奇，这么多原石是在等谁啊？还是说单纯地攒着玩儿？
1676007937,0,2,False,False,一楼
1676008514,0,2,False,False,我只看到1点到6点，有没有人知道凹了多久
1676021467,5,8,False,False,我想问一下，铁三角要破隐身不应该是先打机关，再用雷去打另一个机关，为什么up直接打就破隐了？
1676009265,1,2,False,False,视频里的凯亚怎么配的？
1676022904,0,2,False,False,我要有这种手法无敌了
1676027088,7,2,False,False,那个我有点好奇，怎么让主播打号啊？我也有点想让主播帮我打一下[给心心][给心心]，没看过直播，请教一下[笑哭][笑哭]
1676385244,0,0,False,False,"已点赞 up主不喜可删
萌新up主首页视频抽奖送月卡 欢迎大家来参加[打call]"
1676041427,0,2,False,False,我3点醒来看还在打，6点再看 还在打[Cat2_Boom!]时大夫真的难啊[Cat2_Boom!]
1676007971,0,2,False,False,昨晚看到了，主播凹了好几个小时
1676022807,6,2,False,False,迪卢克哪来呐 我第一次知道不抽卡也有五星角色
1676346893,0,0,False,False,这应该是小号，从圣遗物数量就可以看出来，基本是不刷树脂
1676352391,1,0,False,False,枫丹是火之国吗？然后旅行者进去就会慢慢的被烧死那种
1676010430,0,2,False,False,两点凹到六点，我只能说牛逼
1676089381,0,2,False,False,我也是XP党[歪嘴]要不是种门深渊过不去的。以前深渊都是雷神感电一呲1W，虽然伤害有，但是触发满，触发少，带火就控制不好底色了。现在种门是雷神稳定触发，种子只有她能反应，不需要在意什么底，单次协同还能触发多次种子，强度就直接起飞了。
1676007963,0,14,False,False,电子榨菜[doge]
1676019193,0,2,False,False,不看直播怎么知道主播凹那么久，怎么感觉弹幕有点。。。虽然是辛苦没错
1676301446,0,1,False,False,700多抽[哦呼][哦呼][哦呼][哦呼]
1676223993,0,1,False,False,哈哈，我在等冰神[脱单doge]
1676234542,0,1,False,False,看到弹幕说在等一个空前绝后的xp角色哈哈哈哈哈哈哈哈哈
1676031215,0,1,False,False,快再出一个钟离吧，高贵的手部乘区，只能说我不配
1676021435,15,2,False,False,??这个练度迪卢克不用?下半纯火完全能打，我把配置压到跟视频里差不多打了几把就过了，带个凯亚伤害没有反应没有图个啥啊，这样还凹了几小时我是不理解
1676032526,0,2,False,False,以前没看过up直播，都是首页推荐看痛苦号视频图一乐的，今天看这视频被up深深折服，真的太强了，关注了[打call]
1676040086,0,2,False,False,突然发现我满不了的原因不是我练度不高，而是我太菜了[笑哭]
1676048674,0,2,False,False,"看完我只想说
我是废物[崩坏3_路过]"
1676008753,0,2,False,False,昨天半夜看凹这个号给我看睡着了[笑哭]
1676169927,0,1,False,False,up主太强了
1676180163,0,1,False,False,等至冬五星普京大帝[doge]
1676023200,1,2,False,False,他这九万多原石还真不多 22开头的
1676014812,0,2,False,False,脱手c的含金量[OK]
1676166950,1,1,False,False,看了一眼练度 攒石头的小号吧这
1676012860,0,2,False,False,练的角色是挺不错的，感觉像是大佬小号
1676021848,0,2,False,False,才九万原石带70抽，我0抽十六万原石，轻松满星
1676099252,1,2,False,False,哈哈哈哈哈这种角色少练度高，还能有满星希望，我昨天祸害一个主播，他看完号跟我说要不然我去祸害别的主播吧[脱单doge]
1676009230,1,2,False,False,问一下，主播这里怎么看号啊
1676008121,3,2,False,False,没有夜兰，为啥抽到夜天后就是解放双手了[doge]，6命效果还是抽到就是解放
1676020357,0,2,False,False,从未关注 从未错过哈哈哈哈
1676015954,1,2,False,False,投个币吧，确实牛，我以为up一遍过，没想到硬凹了几个小时
1676031073,1,3,False,False,痛苦又不是完全痛苦，说爽号完全是扯淡，有金没金完全是两个游戏，这号抽个草神雷神，万叶海森夜兰这些组两队才是爽号，四星角色练度都高，但是你纯四星爽号纯属扯淡啊，凹4个小时2点到6点都是爽号？[妙啊][妙啊]
1676025290,18,2,False,False,外甥有个痛苦号55级了  他开学了  知道我玩原神让我帮他肝    真的好痛苦  想让up帮忙捋一捋[笑哭]
1676008112,0,2,False,False,xp是原石你不懂[doge]
1676198504,0,1,False,False,看你们深渊嘎嘎乱杀，我就只会嘎嘎[抠鼻]
1676015474,1,2,False,False,我看着时大夫凹了4个多小时[笑哭]时大夫是真滴牛批
1676143227,0,1,False,False,看到50多个树脂，我绷不住了[酸了]
1676176866,0,1,False,False,这才叫玩游戏嘛，有希望就一直坚持
1676008112,0,2,False,False,封面不是58级么[doge]
1676019990,3,2,False,False,啊这，“就喜欢枫丹的，出什么抽什么”，感觉好像不太对？[囧]
1676162498,0,1,False,False,一看这三剑鬼这么听话就知道凹了很久
1676025094,0,2,False,False,有没有可能后来另一位哥哥（妹妹）进卡池，自己的主角选的空就开妹妹卡池，选的荧就开空的卡池，技能数据相同，动作模组不同呢？和天理同一个属性就行了，反正都没神之眼和神之心[吃瓜]
1676351533,1,0,False,False,这个小仙灵是 新地图任务 送的吗？大佬们
1676009732,6,2,False,False,"额我的阿忍种子的伤害是2W9，四花神的，精通是越叠，元素反应百分比增伤越低的。花神套是固定有100%增伤的
我950精通"
1676370716,0,0,False,False,有没有大佬帮我打深渊uID 251108253
1676010114,0,2,False,False,昨晚上看到3点多，今天已经刷了一天绝缘了[微笑]
1676144419,2,1,False,False,跟我朋友的号一样我朋友也是一直攒等魈复刻然后今年他池子全歪直接破防
1676202830,0,1,False,False,真是学不来的手部乘区[打call]
1676008685,0,2,False,False,在现场，没熬住睡了，期间中了个胡桃[脱单doge]
1676007994,0,2,False,False,每天就等你更这个，和追番似的[星星眼]
1676021928,0,2,False,False,哎呀这种号我太了解了 我之前囤了快750多抽抽满命草神 视频在动态里 抽完就释怀了[鼓掌]
1676008622,2,2,False,False,目前为止唯一比较正常的号主（戒赌正常，我都200抽了，等水神[doge]）
1676008809,1,2,False,False,时大夫真肝啊凌晨三点的直播现在就剪出来了[辣眼睛]
1676361582,0,0,False,False,一年半不抽請刪遊戲[歪嘴]
1676011268,0,2,False,False,这种手法都卡极限可想而知，失误多一两次就寄了
1676013082,1,2,False,False,还是那句话，xp高于一切，想抽啥就是啥，然后再考虑强度
1676370455,0,0,False,False,大佬帮我打深渊
1676011896,0,3,False,False,昨晚56级终于打通了12层，首通，虽然只要3星
1676175691,0,1,False,False,时大夫牛逼，没看直播不知道，看评论才知道打了四个小时[笑哭]
1676139656,2,1,False,False,我觉得不出数值怪，或者新机制，水神有点难超过夜兰[doge]
1676015907,0,2,False,False,太强了，全是练度，但是又全是手法[Cat2_JupiterSpot]
1676345938,0,0,False,False,深渊啥时候给试用角色啊 唉
1676133383,2,1,False,False,首先，不充钱能不能玩？能玩。能不能满星深渊？能满但不会期期满，满星这需要天时地利人和，天时就是深渊BUFF，地利就是深渊牌子，人和就是角色池+练度足够。不要看时大夫打通了就认为不充钱满深渊很简单，人家凹了好几个小时在加上号主培养的角色也确实是建队基石，所以才能做到满星。所以不是不充钱不能玩，是充钱就可以玩得爽，除非你常驻池+开服到现在送角色的活动一个不落能有4命香菱5命班尼特6命行秋6命砂糖再加上菲谢尔久岐忍瑶瑶科莱，这种角色池才能打深渊不那么费力。[藏狐]
1676138915,0,1,False,False,我id比他早还不到一年，他这肯定不是一年半
1676124558,0,1,False,False,这号不错，我五十收了
1676033714,0,3,False,False,大佬给你跪下了[跪了]
1676011257,1,1,False,False,@是贺长醉捏 [小电视_太太喜欢]
1676012480,8,2,False,False,芙门不是吹的，现在看到好多玩家都在开始屯满命芙芙了，包括我。夜兰是谁不认识[脱单doge]
1676117800,0,1,False,False,好了  这次不白嫖  点个赞  还发条评论[doge]
1676022128,0,2,False,False,"我感觉这个号肯定是号主的整活小号[笑哭]
该练的角色都练了，甚至练度还挺高。
但我就是不抽卡，就是玩，逮住up就开始折磨[脱单doge]"
1676017028,0,2,False,False,主播把这个号的上限打出来了
1676046250,0,1,False,False,留着抽天理[笑哭]
1676063709,0,1,False,False,在现场，我很早睡[热词表情_世萌双冠]
1676380497,0,0,False,False,枫丹的迪卢克
1676081529,0,1,False,False,这种是不是自抽号啊[doge]
1676091605,0,1,False,False,这聚怪是真的牛。
1676027594,0,1,False,False,昨天晚上打的，从两点看到早上六点
1676040132,0,1,False,False,经典痛苦号
1676092925,0,1,False,False,我抽到啦  二命的莫天后
1676319078,0,0,False,False,怎么老有人用戒毒所出来的这种话来开玩笑， 玩梗请适度，这不合适
1676130976,1,1,False,False,简直妙手回春，等我入坑满俩月，凑够两队80级，就来找大夫看看诊
1676007978,0,1,False,False,来了
1676110456,3,1,False,False,玩了三个月，深渊没满过
1676097897,0,1,False,False,夜阑不冲一个吗？
1676109201,0,1,False,False,没什么好说的 阁下的手法值得我的币
1676014771,0,1,False,False,太辛苦了 投币了
1676364884,0,0,False,False,大佬[热词系列_知识增加]
1676011532,0,3,False,False,up现在还没醒吧[藏狐]
1676097493,0,1,False,False,大为震撼[热词系列_知识增加]
1676040943,0,1,False,False,追番[OK]
1676010667,0,1,False,False,太厉害了
1676097686,5,1,False,False,行秋走下打砂锅，上用芭芭拉会不会好点
1676131236,0,1,False,False,人家成功的做到了在时大夫人都麻了的情况下做到了合理的练度，光是这点值得时大夫一手回春术
1676099333,0,1,False,False,其实砂糖挺好用的[吃瓜]
1676354328,0,0,False,False,有点厉害
1676014025,0,1,False,False,投币回血[脱单doge]
1676028816,0,1,False,False,满命夜兰直接走起[doge]
1676078156,7,1,False,False,帮忙配两个队呗  不经常玩  十层就开始打不过了[笑哭][笑哭]
1676056203,0,1,False,False,妙手回春啊时大夫
1676339838,0,0,False,False,这都能打满[笑哭]
1676084073,0,1,False,False,抽个满命水神，在抽个满命火神打蒸发
1676413363,0,0,False,False,厉害！
1676111389,0,1,False,False,视频里玩家的言论真滴震撼
1676124617,0,1,False,False,22的号应该正好一年，可能不到，不过，你都不抽卡了还打啥深渊，真的折磨人
1676127430,0,1,False,False,这个号的抽数算上星辉起码650抽朝上。直接6加1。武器不歪就行。这不爽死。附赠满命行秋。但就是要屯雀氏没办法。
1676015519,0,1,False,False,UP的操作太强了！
1676115428,0,1,False,False,以后别人问原神无氪全四星打深渊体验是什么样，就把这个视频推荐给TA[笑哭]
1676036778,1,1,False,False,现在成为粉丝还来得及吗[doge]
1676010956,0,1,False,False,究极自抽号
1676009595,0,1,False,False,真的好厉害(ง •̀_•́)ง
1676029559,0,1,False,False,我是真服，真的强
1676026923,2,1,False,False,900多抽，能卖不少钱了
1676125068,2,1,False,False,内个...琴好抽吗？我刚入坑，然后第二次十连抽中了琴，然后今天抽十连，又抽中一次[呆]
1676012143,0,1,False,False,芙门！
1676011909,0,1,False,False,妙手回春啊
1676008003,0,1,False,False,极速欣赏
1676035080,1,1,False,False,我觉得下半凯亚换重云能更好点
1676010978,0,1,False,False,昨天在现场）看了半天溜了
1676023964,0,1,False,False,单推原石的厨力
1676107719,0,0,False,False,这伤害看着就痛苦
1676355496,0,0,False,False,牛逼
1676095160,0,1,False,False,比我全五星队打的都快啊，特别是12-3，我就是打不满[笑哭]
1676098917,0,1,False,False,像这种快玩一年的号是能直接满命一个的
1676021340,0,1,False,False,爱看 多发[初音未来_大笑][初音未来_大笑][初音未来_大笑]
1676029232,0,1,False,False,up主太敬业了
1676010292,3,0,False,False,这号补齐三神就是爽号
1676110958,0,1,False,False,3.3将军池玩的，就一个将军，深渊10-2（含）之前的全满
1676009332,0,1,False,False,在现场 太感动了
1676031475,0,1,False,False,真的昨天我被折磨到4点半 实在是熬不住了 时大夫真的强
1676438334,0,0,False,False,@星辰与青山
1676099907,6,1,False,False,号主肯定漏了啥奖励 我玩了一年的号差不多是10w原石
1676011998,2,1,False,False,怎么才可以被up选中打深渊
1676078012,2,1,False,False,怎么才能让时雨看号
1676112727,0,1,False,False,看完就觉得号主和up是真的逆天（）
1676116920,10,1,False,False,除了没一直囤原石，我小号也差不多是这个状况，除了散兵全四星，没有命座全靠练度，玩了大概两个月的时候把深渊打穿了，但拿不到满星，目前三个多月，9-11能满，12层不行[tv_鬼脸]
1676029774,0,1,False,False,然而我在mys看到过30原石的屯屯鼠[妙啊]
1676007950,0,1,False,False,来了[打call]
1676012479,1,1,False,False,屯一年半是这些吗？最近开个小号打算这么搞
1676028201,0,1,False,False,太强了，比秒秒秒好看，能学到东西。[打call]
1676110873,0,1,False,False,不算很难，痛点在于三剑鬼。这期还是有种子保底的。真那种角色特多，一点练度没有的是真难受。
1676025434,0,1,False,False,教练，我也想满星[doge]
1676014236,0,1,False,False,雨师傅妙手回春
1676015803,0,1,False,False,给敬业的主播投个币
1676360411,0,0,False,False,[脱单doge]
