上传时间,回复数,点赞数,up是否回复,up是否点赞,评论文本
1676203531,0,1,False,False,祝同学们开学快乐！
1676388053,0,0,False,False,[难过]开学前甚至在家偷偷哭了一场
1676255277,1,1,False,False,原来老师也焦虑呀，我的开学焦虑瞬间少了一点[喜极而泣]
1676209422,0,1,False,False,太好啦蒸锅煮饭大学开学考期末啦[打call]
1676201264,0,1,False,False,嗯？怎么不会呢？[脸红]
1676197993,0,1,False,False,第一次热乎的热乎的！！！！烫手
1676198654,1,2,False,False,难道没有让学生直面开学的小说吗[大哭]
1676197986,0,1,False,False,[脱单doge]
1676198095,0,1,False,False,罗老师！✿ヽ(°▽°)ノ✿
1676214140,1,1,False,False,人生没有意义，为了意义而活的人生不是人生
1676263678,0,1,False,False,真正的勇士，敢于直面惨淡的开学[吃瓜]
1676305417,1,2,False,False,开学前连续失眠一周，焦虑到急性荨麻疹发作的老师在此[微笑]
1676378374,0,0,False,False,我们今天开学考才考完英语没了扣十分了[大哭]
1676390631,0,0,False,False,感谢罗老师，一语惊醒梦中人[抱拳]
1676198029,0,1,False,False,来的太早了，不知道该说什么（紧张[脱单doge]
1676232966,0,1,False,False,放假一时爽，复习火葬场，一个星期四本书，感觉自己快升天
1676385995,0,0,False,False,s三人行必有我师，择其善者而从之
1676216051,0,1,False,False,妙啊，开学期末考，想躲躲不掉(´-ω-`)
1676203929,0,1,False,False,我艹 原来明天开学[藏狐].....
1676198872,0,1,False,False,我的演技很棒[脱单doge]
1676205617,0,1,False,False,？原来现在还有没开的吗？？？
1676215709,0,1,False,False,什么？即将？我们已经开学一周了呀[微笑]
1676198022,0,1,False,False,我们是开工了
1676258853,0,1,False,False,本人常年荣获学校最受欢迎的老师，，因为我教信息技术。[doge]
1676304031,0,1,False,False,快进到罗老师和大刘见面（想起来余华老师）[doge]
1676221339,0,1,False,False,没有作业只有开学考，才考了两门还剩下6门[大哭][大哭][大哭]
1676198078,0,1,False,False,张三老师好帅呀
1676198248,0,2,False,False,《开学》《面具》[doge][妙啊]
1676355280,0,0,False,False,人生的意义在人生之外是什么意思老师
1676198007,0,1,False,False,还是热的
1676282684,0,1,False,False,我刚上班的时候，也是假装自己是个医生，表演感很强烈，现在时间长了，已经信以为真了
1676295504,0,1,False,False,从学生变成老师的过程不仅仅身份的转换，更多的是责任的承担。
1676201028,0,1,False,False,毕业生实习焦虑[蛆音娘_吐血]
1676435079,0,0,False,False,"【女子讨薪被老板带人暴打，称花十万剁了她的手，老板：捅了四刀没进去-哔哩哔哩】 https://b23.tv/f73L8m4
希望大家可以关注一下这件事情。"
1676198655,2,2,False,False,为什么现在全网都在说马上开学 我们都已经开学一周了啊[大哭]下周期末考
1676198079,0,2,False,False,虽然是这样，我们已经开学一个周了，我同学的卷子被我同学吃了[脱单doge]
1676350877,0,0,False,False,有的人  早已开学半个月[酸了]
1676198014,0,1,False,False,在现场，我是张三
1676197998,0,1,False,False,眨眼就这么多人[笑哭]
1676208739,0,1,False,False,传道授业解惑——传递人类文明！这使命无上光荣哈！
1676200054,0,1,False,False,我感觉罗老师的发量变多了
1676347125,0,1,False,False,人生的意义在人生之外
1676207456,0,1,False,False,小学四年级的老师已经开学一周了[辣眼睛]
1676202047,0,1,False,False,刚坐电梯看到罗老师卖车的广告 就感觉好怪哦
1676296467,0,1,False,False,开学焦虑× 面试焦虑✓
1676198827,0,1,False,False,明天就要考试了[向晚_头大][向晚_头大][向晚_头大]
1676215819,0,1,False,False,我能不能把我此刻在看视频等同于和一个叫做罗老师的高级人工智能在交流
1676328455,0,0,False,False,和一个朋友互加了微信，但是对方的信息被删除了，这算什么？
1676213837,0,1,False,False,假期综合症，开学上班了提不起劲[笑哭]
1676289255,2,1,False,False,一个引人深思，唤醒教师良知的故事，被沈腾拍成了喜剧片。
1676202662,0,1,False,False,我是老师，我已经开始焦虑了
1676199679,1,2,False,False,老师被称作园丁真的很对，因为快开学了，现在要做的事就是想卸甲归田
1676208878,0,1,False,False,高情商：猫猫狗狗也爱学习
1676198027,0,1,False,False,我的作业被小偷擦掉了
1676198041,0,1,False,False,看到标题已经紧张了
1676298639,0,1,False,False,我们直接严禁期末考严禁检查寒假作业[微笑]
1676207108,0,1,False,False,《乡村教师》给了我继续执业的动力与目标。
1676198723,0,2,False,False,然鹅我们已经开学两周了
1676207786,0,1,False,False,哥们的作业被yyf吃了[辣眼睛]
1676244585,0,1,False,False,《乡村教师》是刘慈欣的短篇里我最喜欢的TAT嫌长可以去找有一个高中语文试卷删减版本的，也很好哭，当时还裁下来贴笔记本上了。
1676198446,0,1,False,False,祝同学们开学快乐！
1676217754,0,1,False,False,罗老师，我看了您在寒假教师研修班的课，希望您能更多的讲一讲，如何成为一名合格的高校教师[呲牙]
1676198112,0,1,False,False,紧跟时事[doge]
1676209045,1,1,False,False,罗老师 我已经开学一个星期啦[tv_大哭][tv_大哭]（悲）
1676201186,0,1,False,False,还好，上星期开学了，开学考也考完了
1676209251,0,1,False,False,如果失去了奔跑的目标，这其实比西西弗斯都可悲。
1676198003,0,1,False,False,老师我们明天开学考。[沈剑心第三季专属装扮_裂开]
1676199866,1,48,False,False,"我发布了一篇笔记，快来看看吧
课代表来了，希望大家帮忙顶上去。视频总结+详细笔记！
━━━━━━━━
总结：1、作为老师，应该不断的去学习追逐理想的老师模型，另一方面也可以突破对于老师...
https://www.bilibili.com/h5/note-app/view?cvid=21784797&pagefrom=comment&richtext=true"
1676214216,0,1,False,False,谢谢罗老师，也祝您开学快乐！[给心心]
1676344283,0,0,False,False,老师讲哲学吧，讲多亿点[脱单doge][脱单doge][脱单doge]
1676344748,0,0,False,False,罗老师，刚才看你抖音在直播阿，还是本人视频
1676198016,0,1,False,False,开学考都结束了[笑哭][笑哭][笑哭]
1676207059,0,1,False,False,老师我爱你！自荐一下BV15R4y1B7x9
1676198287,0,1,False,False,开学考期末[大哭][大哭][大哭]
1676198816,0,2,False,False,刘慈欣《乡村教师》
1676343131,0,0,False,False,人生的意义是在人生之外
1676382342,0,0,False,False,导师今天给我发信息了[笑哭][笑哭][笑哭]
1676198004,0,1,False,False,第一次这么早[星星眼]
1676198855,0,4,False,False,祝同学们开学快乐！
1676200264,0,1,False,False,我是老师啊，开学前一天根本睡不着，难熬死了
1676199702,0,1,False,False,虽然已经开学一周了，但还是看了这个视频
1676201879,0,1,False,False,开庭前，张三律师也焦虑[doge](怎样才能把对方判久点呢)
1676200323,0,1,False,False,罗老师是不是也很焦虑开学
1676198078,0,1,False,False,已经开学一周了，过两天考试[保卫萝卜_哭哭][保卫萝卜_哭哭]
1676199774,0,1,False,False,粉色衬衣很好看！！可以多穿穿嘛[tv_微笑][tv_微笑]
1676260158,0,1,False,False,什么职业不焦虑啊，大家都很焦虑的，焦虑是很正常的情绪，不要排斥它，但也不要让它占据你的全部身心。
1676198120,0,1,False,False,大学生还在家准备考试[大哭][大哭]
1676198305,0,1,False,False,已经...没有开学了...[大哭]
1676198449,0,1,False,False,来早了，但没活儿。上学即上班。
1676198125,0,1,False,False,两分钟还有谁?嗯?还有谁！
1676204725,0,1,False,False,意义是看不见的，但不代表它不存在。
1676354568,0,0,False,False,额。。。各位朋友大家好啊
1676257771,0,1,False,False,谢谢罗老师，即将开学的老师，正被chatgpt的东西搞得有点焦虑，有被安慰到[OK]
1676334071,0,0,False,False,听君一席话如听一席话
1676201868,0,1,False,False,老师都在疯狂抄教案[脱单doge]
1676200409,1,1,False,False,那个吐槽物理学不是宇宙相通的举个例子反驳一下
1676197973,0,1,False,False,好快！！！！！没人！！
1676290691,0,1,False,False,谢谢罗老师治好了我的焦虑，这学期开了两门课，最近真的是焦虑得每晚都在做噩梦。待会去拜读一下《乡村教师》。
1676203548,0,1,False,False,老师能说说火锅跳车案和类似的海量个案吗[doge]
1676198075,0,1,False,False,高数三天速成[大笑]
1676199466,3,1,False,False,我都上课半个月了 老师也很焦虑的[辣眼睛]
1676198106,0,1,False,False,上学路上看罗老师[脱单doge]
1676200644,0,1,False,False,投币失败 超过粉丝投币数量上限 [抓狂][爱心][爱心]
1676385627,0,0,False,False,牛顿三定律那个短篇叫什么？谁知道么
1676198008,0,1,False,False,开学不可怕，开学考才可怕
1676216704,2,1,False,False,"马上要开学[微笑]
初八去上课，现在延迟的期末考成绩都出了，老师都把我们骂好了[脸红]
更疯狂的的是高三初二就去了[星星眼]"
1676201876,0,1,False,False,要不罗老师顺便看看《三体》吧[滑稽]
1676197978,0,1,False,False,祝同学们开学快乐！[打call]
1676198894,0,1,False,False,人生的意义是在人生之外！[奋斗]
1676199079,1,1,False,False,我是2月26号开学，在家好无聊啊_(:з」∠)_
1676197978,0,1,False,False,罗老师害怕开学吗[doge]
1676200569,0,1,False,False,科学家下一步的目标是实现记忆遗产功能，从此人类将主宰宇宙
1676199811,0,1,False,False,人生的意义在于人生之外
1676198241,0,0,False,False,[2023][2023][2023][OK][OK][OK]
1676198135,0,1,False,False,社畜每周日晚都很焦虑[大哭]
1676198022,0,1,False,False,作业被老师吃了 判几年？
1676197979,0,1,False,False,已经开学了，开学还有考试[笑哭]
1676199187,1,1,False,False,我们开学一周了，下周五期末考试(悲)
1676200002,0,1,False,False,我能告诉我老师我的作业被熊孩子撕掉了吗？[微笑][微笑]
1676198131,2,1,False,False,作业笔灯，一夜奇迹[热词表情_世萌双冠]
1676198034,0,1,False,False,开学考试的同学正坐在学校看…
1676198146,0,3,False,False,我去除了大部分三连的痕迹， 只保留了一个播放量，这样才能让人觉得我看的是法律视频，而不是美女视频[doge][doge]
1676200222,0,1,False,False,机器人只有绝对理性，人文主义与浪漫情怀还是要靠老师、家长进行潜移默化得教导
1676198144,0,1,False,False,开学焦虑，是不是不开学就不焦虑了[脱单doge]
1676198063,0,1,False,False,发晚了，已经开学一周了[doge]
1676203575,0,1,False,False,罗老师更的真及时，今天刚到校，开学考五门，脑子已经焦了[微笑]
1676355040,0,0,False,False,我有GPT渠道，简单好用，需要的问我
1676204708,0,1,False,False,学生焦虑，老师焦虑，假期支教的师范生更焦虑[大哭]
1676388947,0,0,False,False,热热还能吃[doge]
1676198375,0,1,False,False,梦幻联动[大哭][大哭][大哭]乡村教师也是我最喜欢的一篇科幻短篇
1676197951,0,4,False,False,[doge][doge][doge]
1676203848,0,1,False,False,好消息，我毕业了，同时实习单位延期了，3月6才报道[妙啊]
1676198207,0,1,False,False,省流：乡村教师
1676205975,0,1,False,False,好惨一老师，哈哈哈哈哈啊啊哈哈哈哈哈哈哈哈啊哈哈哈哈哈。既然这样，都别学了，人快被卷没了。嘤嘤嘤
1676198151,0,1,False,False,祝同学们开学快乐！[脱单doge]
1676341447,0,0,False,False,张三信了
1676214048,0,1,False,False,转眼就要开学，一部小说让老师直面开学。
1676197988,0,1,False,False,开学主要是因为考试、作业和家长的期待而焦虑
1676198172,0,1,False,False,我不一样，大学生没有寒假作业[滑稽]
1676342047,0,0,False,False,要考试了啊[OK]
1676197986,0,1,False,False,大学牲毫无畏惧[滑稽]
1676202952,0,1,False,False,在陪伴中进行价值、意义和智慧的传递，以微小的力量传递人类文明。人生的意义在于人生之外。
1676198252,0,1,False,False,还没入职就被问：你能直接来学校上课吗？ [跪了][跪了]
1676198037,0,1,False,False,原来罗老师是个演员[冥冥meichan_好喜欢哦][冥冥meichan_mua][梦音茶糯_mua][梦音茶糯_好耶]
1676197991,0,1,False,False,[打call]来了来了来了来了明天开学考的人真的会谢[笑哭]大家都顺顺利利！一起加油
1676210582,0,1,False,False,应该在加一个群体 即将面临中高考的学生 因为我已经开学一周了[嗑瓜子][嗑瓜子]
1676198443,0,1,False,False,为什么还有作业这东西？都已经大学牲了[委屈]
1676288626,0,0,False,False,听我说谢谢你~明天期末考......
1676197977,0,1,False,False,热乎的张三老师[doge]
1676276945,0,0,False,False,谢谢老师[阿库娅_nice]
1676289188,0,0,False,False,快开学了，觉都不好睡[大哭][大哭]
1676276179,0,0,False,False,这一篇看得我哭的稀里哗啦
1676214206,0,0,False,False,'啊啊不想开学搬行李好累⊙﹏⊙
1676362619,0,0,False,False,[热词表情_世萌双冠]
1676199242,0,1,False,False,虚拟现实最大的罪恶就是可以几乎无限的满足精神的欲望。
1676198064,0,1,False,False,其实无论怎样，害怕开学的还是怕开学[吃瓜]
1676277045,0,0,False,False,开学考4门还有谁
1676211740,0,0,False,False,我急需
1676198597,0,1,False,False,总结一句话，老师存在的意义不只是传递知识，所以无法取代。
1676212635,0,0,False,False,高中已经上了两周课了
1676214279,0,0,False,False,老师好[微笑]
1676205892,0,0,False,False,我们都开学一星期了[辣眼睛]
1676289354,0,0,False,False,罗老师陈签签这个事怎么判
1676281409,0,0,False,False,我老师欠我23块钱。
1676277515,0,0,False,False,"BV1LJ411k7tp
人工智能永远取代不了人类教师"
1676277338,0,0,False,False,罗老师紧跟潮流
1676258726,0,0,False,False,接受思想改造
1676197997,0,1,False,False,老鼠把作业吃了，老鼠该判几年[doge]
1676290810,0,0,False,False,我直接实习了[吃瓜]
1676261318,0,0,False,False,哇哦！换4.5和5.5开的发型！🙄
1676210136,0,0,False,False,老师好温柔呜呜呜呜呜我死了
1676284497,0,0,False,False,人生的意义是在人生之外
1676266897,0,0,False,False,谢谢罗老师[给心心]
1676208731,0,0,False,False,已经开学一周了，谢谢
1676285084,0,0,False,False,[喜欢][喜欢]
1676259059,0,0,False,False,师者所以传道受业解惑也
1676211364,0,0,False,False,哈哈，已经开学半个月了[tv_难过]
1676293759,0,0,False,False,[罗翔说刑法-43]
1676292166,0,0,False,False,希望下次读评论能读到我[呲牙]
1676291067,0,0,False,False,谢谢
