上传时间,回复数,点赞数,up是否回复,up是否点赞,评论文本
1676206107,3,5,False,False,"不管是假装做老师也好，还是做老师也好，我认为，一个好老师不在于假装不假装，更多的是传授自己的能量，才是重要的，教与学的促进，只要能给任何人带来正向的引导，其实都是老师，教授知识，传道授业解惑，提供机会，都可以成为师，为师为人，都是自己选择的，只要，你所面对的人，认可你是一个好老师，那你就是一个好老师，但是，如果你不能面对最真实的自己，那你就是“假”老师，所以我对于老师的定义是，把，老师所认为的传授给学生，同时学生接收到你的传授而走到对于学生所发展的未来是正确的道，这就是老师，如果前面加一个真，那么，是不是应该脱掉自己的面具？但是往往人都会有一个面具，去隐藏自己，很简单，面具就等于口罩和衣服，所以我觉得不能一丝不挂，但是也要让自己感受到舒适才能衡量这个假老师这个词
总结一下，不愧于自己，自己能过得去，同时把自己传授的知识给学生们，或者是自己懂得的道义，让他们接收到，成为更好的自己，这就是我认为的好老师"
1676197958,1,28,False,False,[吃瓜]
1676203663,0,5,False,False,虽然已经上过一个星期班了，但想想明天周一，还是很痛苦：麻麻，我不想开学！
1676198174,1,7,False,False,可我们已经要期末考试了（上学期延下来的）[大哭][大哭][大哭]
1676198456,1,10,False,False,罗老师，如果有一个人校园暴力我我把他反杀了，本来可以无罪释放的，结果有一方认为我有罪，把我在警察局拘留了一年才确定我无罪，我可以申请赔偿吗？[doge][doge]
1676209815,0,2,False,False,笑死，我期末期初一起考，考了5天[2233娘_耶]
1676201404,0,4,False,False,而你，我的朋友，是正真的teacher[吃瓜][吃瓜][吃瓜]
1676214889,0,2,False,False,不会就我已经开学一星期了吧[辣眼睛]
1676295725,0,3,False,False,开学了，这学期要讲完两本书，看着其他老师悠游自在还在unit 1，我火急火燎已经结束了unit 2，再讲两天练习就要周练又要讲试卷了，学生作业写不完，我的课我也感觉讲不完
1676197998,0,6,False,False,开学恐惧症”的主要症状是情绪低落、心慌意乱、无缘无故发脾气、浑身疲劳、注意力不集中、记忆力减退、失眠等，有的还有头痛、胃痛等躯体不适症状。不难想象，在家中享受无忧无虑的假期生活的孩子，可能会耽误学习。许多孩子由于假期作业未完成、对新学期紧张、迫于中高考的压力等因素对到来的学习生活缺乏必要心理准备，安逸、闲散惯了之后想到开学后紧张、苦累、枯燥的校园、学习生活形成了鲜明的反差，从而产生了焦虑、恐惧的情绪，造成了对开学存在心理阴影，严重时就导致了开学恐惧症。更严重的可能会导致自杀。与开学焦虑症症状相同，要尽早克服。
1676201220,0,3,False,False,开学已经一周了，还是焦虑[笑哭]
1676216087,0,2,False,False,医学专硕就不一样了一直没放假，每个周一重复一种相同的痛苦
1676203917,0,4,False,False,老师的开学焦虑只有一个单纯的原因，那就是不想上班
1676199681,0,3,False,False,想先看看《乡村教师》这部小说的，可以来听听这个https://b23.tv/BV11b411z7mK ，真的很赞。
1676286709,0,3,False,False,"我们班主任说，老师干的都是良心活。
作为学生，我还是在心里默默期望能遇到想矢的猛一样的好老师[保卫萝卜_哭哭]"
1676203987,0,4,False,False,我对不起我初中到大学的所有物理老师，我没能第一时间想起牛顿三定律[大哭]
1676296439,0,2,False,False,好消息，没有开学焦虑，坏消息，失业在家[热词系列_我太南了]
1676198181,7,3,False,False,我是中学老师，我比学生更不想开学。。。
1676208686,0,3,False,False,高三党开学考都考完了 明天就出成绩[跪了]
1676199194,1,6,False,False,如果把解构继续下去的话，也许整个人类文明也不过是一个大号的西西弗斯，但西西弗斯未尝不是一个英雄，文明的意义不必在于缥缈的未来，而可以在于当下，正如刘慈欣所说，“给岁月以文明，而不是给文明以岁月”
1676207465,0,3,False,False,好消息，学考推迟啦[嗑瓜子]坏消息，一边学新的一边考学考[大哭][大哭][大哭]
1676204728,2,3,False,False,还在准备突如其来的课，触及到了知识盲区，焦虑到用ChatGPT写课件
1676209613,0,2,False,False,谢谢罗老师，谢谢所有的老师！[打call][打call]
1676220925,1,2,False,False,曾经的我很怕开学，如今大一学牲无所畏惧了[doge]
1676197986,1,4,False,False,新学期希望转专业到法学可以成功！罗老师保佑我！
1676199073,0,5,False,False,身为大学生不害怕作业，而是开学考[热][热]还有一句话“只要专业选的好年年期末塞高考”，计算机专业，每年期末一大堆实验报告，课设要交[无语]
1676198372,0,5,False,False,学生负责表演学习，老师负责表演上课 大家都是好演员[滑稽][脱单doge]
1676202890,3,4,False,False,[doge]学生:物理寒假作业最好写，答案字少，容易抄……
1676208998,0,4,False,False,省流：祝同学们和老师们开学快乐[doge]
1676209819,2,2,False,False,"表面的teacher,背后的homo[吃瓜][吃瓜]"
1676201355,0,3,False,False,想听罗老师讲一讲马鞍山“药神”案[脱单doge]
1676198286,1,4,False,False,新晋中学老师在这儿，真的不想开学，作业也不想留，不想判作业[妙啊]
1676201460,0,4,False,False,身上太多枷锁被裹挟着走，但内心是空的，怎么都没有归属感，不开心总是惶惶不安。对比这点真的羡慕你们了，一点点释放了枷锁充盈了内心，所以无论什么路都会走的更坚定也更开心。
1676202567,0,3,False,False,老师应该分为两类：高中老师和其他[微笑]
1676198236,0,3,False,False,我的作业被张三撕了[tv_笑哭]
1676200020,0,7,False,False,"省流：刘慈欣的短篇小说《乡村教师》
但建议看一看"
1676199361,1,4,False,False,我有一段时间一直在想人生的意义是什么，思来想去都觉得没有意义，心情极其糟糕，后来慢慢放下了，心情才归于平静。今天听到罗老师的回答很有感触：人生的意义在人生之外。此前我从未跳出我的一生去思考人生的意义。
1676201269,0,2,False,False,"怕你们没看过。给你们看速通版
https://b23.tv/4SpbDN2"
1676223423,0,3,False,False,大学生讲什么作业，要讲的是开学考上学期遗留的期末考，咱就是说能不能打扫干净屋子再开学[疼]
1676204150,0,3,False,False,教师胜于ChatGPT的地方是对价值和意义的选择，会被这个观点启发到！我在之前也很忧虑教师将会被ai取代。和朋友讨论时，他们说ai不能进行创新，可很多时候，创新是对几件事物的巧妙搭配，而这样的创新，ai通过穷举也可以做到。而基于价值和意义的选择，人类可以做出丰富的富有智慧的选择，ai却难以做到
1676198168,0,4,False,False,所以罗老师也要准备开学的PPT和补考卷子了吗[doge][囧]
1676198254,12,7,False,False,"一想到那么多本寒假作业都没写，要在几天甚至一天内赶出来，简直想想都要疯了
幸好我已经大学了，没有寒假作业[脱单doge]"
1676203206,3,2,False,False,是的，人的信息和选择项越多，越不容易做出好的选择…在众多可选项里选择较优解很需要智慧。
1676232372,0,2,False,False,有，所以我复工一周后直接辞职了（前私立幼儿园小班老师）
1676291054,0,2,False,False,大学生表示，没有疫情的开学还是很值得期待的，但是开学考真的让我很想死啊
1676201905,0,2,False,False,大部分老师都是一种职业吧，这是我的偏见
1676198942,0,4,False,False,我已经开学一周了，可有的人却还在放假[大哭]
1676217545,0,3,False,False,这学期的小目标是能每天都以精神饱满地状态上好每一节课，在自我学习以外的时间尽可能地给予崽子们更多的陪伴，更加热爱享受每时每刻！[兔年]
1676199908,0,7,False,False,老师跟学生表达苦楚：刚旅游遭完罪，又回来经受“洗耳”之苦[doge]
1676201824,1,3,False,False,大部分行业都一样吧，刚从业，年轻气盛，鸿鹄之志，最后还是败给了现实
1676209146,0,2,False,False,可以把自己认为的大概率正确的东西传授给别人的人就是老师，over
1676199526,2,3,False,False,大学生现在最希望的就是开学了[笑哭]（我们开学没考试）
1676198016,0,3,False,False,谢谢你罗翔，我明天开学，作业还没写完[笑哭]
1676208784,1,2,False,False,教师不仅是知识的传递，更是智慧的传递
1676202773,0,3,False,False,罗翔老师，既然把一个人做成表情包犯法，那没经过一个人的同意，把一个人做成鬼畜犯法吗？[吃瓜]
1676202687,1,3,False,False,一个优秀的教师，应该是“经师”和“人师”的统一，正所谓教书育人，只教书不育人的只能称为“教书匠”。
1676198303,1,8,False,False,虽然我高中，但我本质上和小学生一样，都不想开学[大哭]
1676198011,1,3,False,False,高三表示开学已是几辈子前的事了[doge]
1676206357,2,27,False,False,"感觉ai并不会导致社恐。
只不过说chatgpt会取代任何人都是滑天下之大稽。
因为chat有效运行的前提是言论自由，否则你既看不懂它输出的“*****”，它也不明白你输入的“*****”"
1676198078,0,3,False,False,高中已经开学两周了，有什么办法可以把校领导送进去啊[doge]
1676205320,0,2,False,False,上学时不想开学，工作后也不想上班[doge]
1676290904,0,2,False,False,听罗老师说到西西弗斯我感觉我的老师就像西西弗斯而我就像巨石，就算被不断推动却依然无法屹立顶点（学不进）如果推力一但停止就会倒退，而老师和我就是不断重复这个过程
1676212792,1,2,False,False,是的，今天周末又结束了，不想去学校，老师也不想去学校，老师也想逃课[大哭][大哭][大哭]
1676198421,0,3,False,False,大刘的作品都挺有深度的，是科幻，也是现实！
1676199576,1,3,False,False,"给老师提个建议吧，不知道老师有没有下意识注意到自己会发出乍舌的声音。我一般用敏感的麦的时候也会无意识发出憋气的声音，自己可能没自觉但听的那一方会觉得特别闹心。一般歌手也会在唱片里把自己的换气声给消掉或者不要让呼吸声录进麦克风里，道理大抵上是差不多的。
老师可以试着换一个便宜点的麦克风，毕竟乍舌声太怪了搞得我心思都不在视频上了反而会在意老师讲话会不会发怪声[tv_doge]"
1676200994,0,3,False,False,优秀的老师 是可以交给你一种有益的价值观的 这点会比知识存在的更长久。目前看来 我倒是很想能够做罗老师的学生 因为罗老师有些观念是我非常想习得并长用的
1676374243,0,1,False,False,取消教师编很焦虑啊
1676213446,0,3,False,False,职业的理想化模板我觉得是不存在的，很多小孩的老师都面临不同的小孩，要调节不同的孩子之间不同的关系，不同风格的好老师会用不同的方法，达成这一个职责，但这些都是特殊化的典型，让一个温和老师粗犷又完美的解决问题几乎不可能，这样每个好老师都有不同的方法，但都是好的，能达成职责的老师可称的上完美的老师，但怎么达成职责，这有很多种方式，是无数个不确定的路线，因此追求完美的模板老师只能是追求，而不可能实现。除非一个活圣人，能驾驭各种风格，处理问题有无数个完美的办法，这样称得上老师模板，因为这个人不论自身性格如何，都能灵活的改变自己面对外人时的风格，这样就能自由的采用无数种方法，而多数好老师，只是能完美的解决学生的问题。就像写题，理想的学霸能穷尽所有路线得到答案，一道题能写出很多种解法，而实际上，只要写一个解法就行了，况且在实践中，总不能让两个刚和好的学生在吵起来，重新实验另一种解决方法。
1676198405,0,6,False,False,师者，传道受业解惑也。或许现实会因为各种原因有所妥协，但真心传道授业的教师都是值得尊重
1676199764,0,4,False,False,"等等等……等一下，先别滑走！
那个，你是最棒的，最优秀的，爱你喲
可以走了，以免一天都没人夸你！[拥抱][拥抱][脱单doge][doge]"
1676201861,1,2,False,False,一巴掌打醒我，我也要开学考试[微笑][微笑][微笑]
1676201454,1,2,False,False,老师也在加班加点赶作业[doge]
1676350121,0,1,False,False,"我发布了一篇笔记，快来看看吧
知识与信息的优势并不一定会让人成为一个智慧的人！
https://www.bilibili.com/h5/note-app/view?cvid=21818174&pagefrom=comment&richtext=true"
1676198619,2,2,False,False,"请问 a和b 争执, a向b 吐口水, b如何正当防卫?"
1676252861,0,2,False,False,谢谢老师，人生的意义在于人生之外[兔年]@罗翔说刑法
1676198118,0,2,False,False,面对开学吧…！…
1676352333,0,0,False,False,最近三体在热播，我就在想大刘在三体中的弱肉强食理论与罗老师的爱与美好想冲突会不会让两个人谈不到一块，没想到大刘的另一个作品确鼓舞了罗老师，我真的没想到哈哈！看来是我想多了，还挺期待有机会大刘能与罗老师在一起好好探讨，三观理念碰撞一下。
1676390441,0,0,False,False,我也是学习ai的，对于chatgpt，我和罗老师看法一样但总是无法清晰表述出来，罗老师说出了我想说的：“知识与信息的优势，并不一定会让人承认成为一个有智慧的人，人们占有的信息越多，越不会进行选择，甚至做出最坏的选择。作为老师，最重要的不一定是智慧的传输，而是在陪伴中进行价值、意义和智慧的传输。”。
1676204222,0,2,False,False,开学还会焦虑啊？想当年每次开学我都老高兴了，除了高中。但是如果你出来打工后你就会发现还是tmd上学好
1676209062,0,3,False,False,已经开学一周了，每天看着学生没那么烦，看到领导火冒三丈
1676206294,2,5,False,False,最近在读《苏格拉底的申辩》，罗翔老师真牛，b站竟然2600万粉丝，罗老师不要去抖音了，就在bilibili吧
1676199418,0,2,False,False,我其实我清楚 我害怕的是成长[无语]
1676205253,0,2,False,False,罗老师，如果没有开学考试，大学生开学还是比较开心的[大哭][大哭]
1676203156,2,8,False,False,我上个星期刚开学联考结束，下个星期又要联考了。直接考试焦虑[跪了]
1676198135,1,50,False,False,最紧张的是要开学考的大学生！！！（声嘶力竭[大哭][大哭][大哭]
1676201176,0,2,False,False,所以罗老师您有没有开学焦虑[doge]
1676297188,0,2,False,False,张三买枪，但要刺杀卖枪的王五，但王五动了手脚，张三把自己打死了，请问怎么判
1676197974,0,2,False,False,刚刚
1676389693,0,0,False,False,"其实在我个人眼中看来，无之所谓也。
无论是假装做个老师，还是真正做个老师，这都不重要。
重要的是往上看一个层面，到底什么是老师。
我们古代的韩大才子给出了答案：师者，所以传道受业解惑也。
这才是核心。而这，就够了。"
1676198335,0,2,False,False,师者，传道授业解惑也
1676204015,0,2,False,False,对罗老师在视频中提到的“存在先于本质”、是否有意义等等哲学问题感兴趣的朋友，可以读一读海德格尔、萨特、加缪等人的书。推荐一本个人觉得很好的存在主义哲学的入门书《存在主义咖啡馆》。[2233娘_喝水]
1676198059,0,1,False,False,"好消息：来得早
坏消息：不敢在这里说骚话
[脱单doge][脱单doge]"
1676198007,0,2,False,False,罗老师：开学了[doge][doge][doge]
1676199683,0,2,False,False,等等，我好像已经开学两周了[tv_doge]
1676206108,0,2,False,False,AI取代教师有点难，教师的作用是传道授业解惑，第一就是传道，而AI只能授业解惑，意义不一样。
1676198439,0,2,False,False,为什么我们都开学俩星期了[大哭][大哭][大哭]
1676328618,0,1,False,False,罗老师你有4个身份：律师，教授，法律研究所所长，法律教师！你在工作前切换身份，会迷茫吗？谢谢
1676334751,0,2,False,False,读了《圆圈正义》，罗老师分享了许多人生道理[脱单doge]
1676197980,0,2,False,False,才放下行李箱，就看见罗老师更新了，好耶[星星眼][星星眼][星星眼]
1676198107,0,2,False,False,开学了[大哭]但是要考试 真的不快乐啊[大哭][大哭]
1676209284,0,2,False,False,[大哭][大哭][大哭][大哭][大哭][大哭][大哭][大哭][大哭][大哭][大哭][大哭][大哭]
1676202162,1,2,False,False,已经开学了，作业还没写，请问应该判什么刑[doge]
1676198113,0,2,False,False,已经在学校备战期末了[灵魂出窍]
1676203762,1,2,False,False,好消息 我们开学摸底考，期末考之前网课已经考掉了，还要月考和分班捏[星星眼][星星眼][星星眼]
1676198031,0,2,False,False,"金刚经偈语：一切有为法 如梦幻泡影 如露亦如电 应作如是观  愿看到偈语者都能得到功德利益  愿此功德智慧至心回向给十方法界一切众生  
生活很苦，但仍需努力！"
1676198614,0,1,False,False,罗老师这标题[脱单doge]爷青回
1676198837,0,5,False,False,555我们都开学一周了，而且下周四考试，现在是从复习资料堆里爬出来看看B站[灵魂出窍]
1676210076,0,2,False,False,学生是上学焦虑，老师是上班焦虑[doge]
1676199269,0,4,False,False,不用焦虑，作为一个实习老师更害怕开学[难过]
1676198383,0,2,False,False,人在中原，表示去东北车票还没买到，月底开学[笑哭]
1676267586,0,2,False,False,我妈是个小学老师，昨晚发了一条朋友圈“太心塞了~”，问了才知道是学生考砸了，第一名搞到倒数去了，心里难受，有点坎，让我觉得平时大家都说小学老师轻松，一点都不对，还是有那么一大批为孩子们操劳的人。
1676200228,2,2,False,False,罗老师，我的作业被张三偷了，该怎么判？[doge][doge][doge][doge]
1676201178,0,2,False,False,最后罗老师好像知道进度条快撑不住了，主动加快语速[妙啊]
1676214111,0,2,False,False,罗老师提到的例子：萨特、加缪、爱因斯坦和刘慈欣，都是我近一个月了解和感兴趣的，未免太巧了点[点赞][思考]
1676198299,0,2,False,False,大学牲今天返校[微笑]
1676394590,0,0,False,False,刚买了《乡村教师》还没拆封，视频看到一半，求问后半部分罗老师有没有剧透[笑哭]
1676201341,0,2,False,False,"等等等……等一下，先别划走！
那个，你可以划走，不用看了
[脱单doge]"
1676275632,0,1,False,False,1445
1676212715,0,1,False,False,@裡而
1676209279,0,2,False,False,明天开学[大哭][大哭][大哭][大哭][大哭][大哭][大哭][大哭][大哭][大哭][大哭][大哭][大哭][大哭]
1676212366,0,1,False,False,对鸭对鸭🦆
1676268512,0,1,False,False,不怕开学 就怕开学考[大哭]
1676212376,0,1,False,False,为人师表，行为世范！
1676210694,0,1,False,False,明天一定开始看书，绝不拖了！
1676198009,0,1,False,False,那么何必要相互折磨呢？[doge][doge][doge]
1676249625,0,1,False,False,[笑哭][笑哭]
1676197992,0,2,False,False,快乐两个字不应该跟开学连在一起[委屈]
1676250025,0,1,False,False,我正大光明的说:我救前女友
1676198715,0,1,False,False,来啦来啦
1676198214,0,2,False,False,罗老师有一种上台演讲的那种正经味，不知道怎么说[吃瓜]
1676209090,0,1,False,False,哎嘿，我作业写完辽[脱单doge]
1676198654,0,2,False,False,三十岁了，晚上做梦梦到学生时期的时候，竟然被写不完作业吓醒[辣眼睛]
1676198388,0,1,False,False,来了来了
1676198267,0,2,False,False,我怕的是开学考，一个假期人都傻了
1676289493,0,1,False,False,开学“寄”[脱单doge]
1676209554,0,1,False,False,比学生还焦虑！
1676198546,0,2,False,False,好哲学……人生的意义，在人生之外。
1676209669,0,1,False,False,10比特，我就知道了这个[思考]
1676198436,4,3,False,False,请问我开学过后，一次放学后，和同学张三一起回家时发现[热词系列_张三]的自行车和另一个自行车一块锁了，然后张三又用自己的锁也把别人的自行车和自己的车一块锁了，这犯法吗？
1676201645,0,1,False,False,不想开学
1676223526,0,1,False,False,在补作业…
1676198221,0,1,False,False,很快啊！
1676203874,0,2,False,False,讲真！我都上班四五年了，还会做上数学课的噩梦
1676199672,0,2,False,False,（尖叫）（扭曲）（阴暗的爬行） （爬行）（扭动）（阴暗地蠕动）（翻滚）（激烈地爬动）（扭曲）（痉挛）（嘶吼）（蠕动）（阴森的低吼）（爬行）（分裂）（走上岸）（扭动）（痉挛）（蠕动）（扭曲的行走）（不分对象攻击）不想开学啊啊啊
1676199446,0,2,False,False,人生的意义是在人生之外。这也正是我做老师的原因。
1676198047,0,2,False,False,你们初中或者高中的已经上学了 而我们大学的却还在家里啃老[妙啊][妙啊]
1676201422,0,1,False,False,to be or pretend to be[doge]
1676198391,0,1,False,False,太懂了
1676294236,0,1,False,False,囗袋狼人杀是11级的休闲房赌博我举报了许多次没有用。
1676201463,0,1,False,False,哎，啥东西下好了
1676200489,0,1,False,False,[吃瓜][吃瓜]
1676200357,0,1,False,False,后天就开学了
1676199188,0,1,False,False,没错
1676198139,0,1,False,False,[妙啊]
1676201677,0,1,False,False,为什么要留作业
1676198121,0,1,False,False,[doge]
1676204634,1,1,False,False,明天开学[大哭][大哭][大哭]
1676201715,0,1,False,False,明天就开学了。[笑哭]
1676201260,0,1,False,False,新视频😂😂
1676198318,0,1,False,False,不要啊[元气O崽_记仇][元气O崽_记仇]
1676201678,0,1,False,False,开学焦虑中[难过]
1676198108,0,1,False,False,赶上了
1676198035,0,1,False,False,好耶
1676198629,0,1,False,False,又是醍醐灌顶的一堂课[热词系列_知识增加][热词系列_知识增加][热词系列_知识增加]
1676200054,0,2,False,False,我高中班主任问候同学家长，同学立马抓住这点不放，事后班主任当全班面鞠躬道歉，家长来后，一路跟着家长鞠躬到办公室[妙啊]
1676198137,0,2,False,False,我去除了大部分三连的痕迹，只保留了一个播放量，这样才能让人觉得我看的是法律视频，而不是美女视频[doge][doge]
1676203271,2,1,False,False,都2023年了谁还有作业啊[doge][doge][doge][调皮][歪嘴][呲牙]
1676198066,0,1,False,False,"up
nb
[脱单doge]"
1676209535,0,1,False,False,开学即毕业，毕业即失业
1676198041,0,1,False,False,开学快乐！[脱单doge][脱单doge]
1676198125,0,1,False,False,第一次好早
1676198009,0,2,False,False,反正作业没写，开不开都一样，已经准备好站走廊了[doge]
1676216166,0,1,False,False,chatgpt写的论文小说，查重能通过吗？... ...
1676198149,2,2,False,False,老师：听说你的作业被狗吃了，狗是故意的，还是不小心？[脱单doge]
1676258665,0,1,False,False,我们6号就开学了明天考试我只是回家复习。。。。。
1676212572,0,1,False,False,好消息，已经开学一周了[大哭]
1676204832,0,1,False,False,祝同学们开学快乐！
1676198779,0,4,False,False,知识并非是智慧，老子说：“明白四达，能无知乎?”或许知道的更少，相较人工智能，对人，对我们来说才是优势[脱单doge]
1676198020,0,1,False,False,怎么人这么少[doge]
1676199192,0,1,False,False,热评呢？我是来找热评的[热]
1676434002,0,0,False,False,入职半年的小老师来报到～昨天返校日，真的累到哭
1676209603,0,1,False,False,老师这学期教音乐吗？老师唱的饿狼传说很好听。
1676198009,0,1,False,False,[脱单doge]
1676202274,6,2,False,False,"坏消息，我寒假作业只字未动，甚至没复印出来
好消息，我寒假作业总数快点不到半小时就能写完[doge]"
1676274160,0,1,False,False,罗老师现在讲得没以前看你在学校讲的视频有味道了声音太小了
1676208676,0,1,False,False,笑死，已经开学两个星期[微笑][微笑][微笑]
1676198350,0,1,False,False,我们早开学了
1676294308,0,1,False,False,罗老师对于启动器事件怎么看https://b23.tv/BV1rd4y1n7Hc [doge]
1676212534,0,1,False,False,我真的不想上课啊！可是我是老师。[大哭][大哭][大哭]
1676264544,1,1,False,False,请问罗老师，对于未来人工智能将取代律师的说法，您怎么看？
1676198000,0,1,False,False,[doge][doge][doge][doge]
1676199903,0,2,False,False,如果你看见我这条评论，记住，你是最可爱的人，每天保持好心情，要开开心心的，身体健康，万事如意！！！[拥抱][拥抱][福]
1676198913,0,2,False,False,我来插一手，后排出售折叠凳，板砖，烧火棍，撬棍，现代汉语词典，牛津高阶词典，维基百科纸质书[doge]
