上传时间,回复数,点赞数,up是否回复,up是否点赞,评论文本
1676163194,0,3,False,False,有些似乎很关心歧视问题的人恰恰是最有可能“不由分说的愤怒”的人。我觉得为什么不测视频里已经讲的很清楚了
1676170870,2,3,False,False,讲普通话被歧视的话，可以切换英式英语，立马被捧
1676179345,0,2,False,False,不是美元！不是美元！不是美元！
1676121269,0,6,False,False,资本峰奥，来香港，指定，没有你好果汁吃！[脱单doge]
1676181695,0,3,False,False,重庆大厦是不是有过离奇的鬼故事
1676124738,7,4,True,False,[给心心]峰哥，重庆大厦进去瘆人吗 今天我和朋友俩女生不敢进去 我想去吃下印度美食
1676246399,2,2,False,False,什么农村结合部……感觉好落后啊[笑哭]，除了物价高，啥优点都没有
1676174886,4,19,False,False,嘻嘻
1676264264,0,2,False,False,19年和女朋友去香港，住的重庆大厦，后来才知道这地方比较乱。
1676120999,4,3,True,False,为啥卡是负数啊，是扣了管理费吗？
1676377815,0,1,False,False,在香港住这样，你已经处于上流了
1676269232,0,2,False,False,"带着口罩去香港。
不怕被虫子打啊？[笑哭]"
1676193074,0,2,False,False,香港很多大酒店，外面看起来蛮大气，里面的装饰都是上世纪90年代的风格
1676121143,14,8,False,False,感觉不如台湾
1676132153,0,4,False,False,歧视就是歧视，没说的，为什么有这种想法的前提是诱导想法的事实
1676120813,0,4,False,False,7：35
1676181631,3,2,False,False,现哥住160平你住4平
1676165838,3,7,False,False,现在已经不是三十年前了，如今每年去香港的大陆人太多了，人家早就习以为常了，大陆人早就不是最初他们眼里的“说普通话的土包子”了，很少有人歧视你的，不会粤语完全可以生活下去。
1676246153,0,2,False,False,香港我印象最深的还是4年前富士大厦顶层的韩国小妹妹[脱单doge]
1676180396,4,4,False,False,峰哥，我在香港这边留学，有兴趣采访吗
1676127577,5,3,False,False,别说hk了，我去南方，说话带口音，人家也[微笑]
1676125274,2,3,True,False,是的，真的很想看挑战说一天普通话啊！一定会一键三连！
1676128809,4,12,False,False,我感觉我住这个房子我真的会疯掉，因为没窗户，房间狭小没关系，没窗户我感觉住几天我就会疯，会觉得像禁闭市[笑哭]
1676165981,0,3,False,False,几年前陪朋友去了一次香港，朋友因为结婚去那边买黄金和包给女方。然后一起待了四天。我手机因为没有办国际漫游，在进去香港前把住的酒店地址给截图了。然后我是真没感觉对内地人的歧视。特别是当时不知道去酒店的路了，问了年轻人和老年人都很热情给你指路，有一个老奶奶恨不得走几条大街一直要把我带到住的酒店楼下。然后晚上吃饭找了一个摊 老板一家竟然是湖南人移居到香港的，包括去崇光啊这些商场和柜员说普通话人家也是笑脸，所以有些人说的被歧视，我确实没感觉到[微笑][哦呼]
1676268583,0,2,False,False,贵了，汀九桥那边，329人民币，环境好很多
1676220767,12,2,False,False,不喜欢香港可以不要来 这里是一个多元化的地方 请互相尊重
1676121663,0,6,False,False,现哥8k酒店，峰哥酒店散百块，真是十年河东 十年河西
1676124589,1,2,False,False,弹幕咋都在刷$是美元啊[思考]
1676125233,0,2,False,False,可以的
1676204907,0,2,False,False,峰哥这一期我看了好几遍[東雪蓮_美妙][東雪蓮_美妙][東雪蓮_好耶]
1676169718,3,4,False,False,电视上报道香港人不是很欢迎内地人来的吗，怎么这就歧视了，你是不是想破坏双方的感情
1676147588,6,3,False,False,其实在香港不会说粤语被歧视很正常，可以说在无论哪个地方不会说本地语言都会被区别对待这是人之常情，至于为啥说英文显得高大上，因为英语是世界语言，一战英国是世界第一，二战是美国世界第一并一直持续至今，而这两个世界霸主的官方语言是英语，总的来说拳头大才是真理[笑哭]如果有些人连这些幼儿园都知道的道理都想不明白我也只能说继续当阿q吧。
1676136057,0,3,False,False,这旅馆还行啊。该有的都有，睡一宿挺好。至于它小它压抑，咱又不常住
1676121128,4,3,False,False,地铁要44块？[哦呼]
1676120999,3,28,False,False,著名爱国网红峰子的格局实在太大了。我爱香港！我爱中国！[给心心][给心心][给心心]
1676176054,0,2,False,False,兄弟萌 资本峰跑路了！
1676140811,0,3,False,False,在香港生意好的茶餐厅小店偶尔能遇到服务态度差的，不过本地人也是享受和我一样的服务[doge]，然后是去商场各种连锁品牌店服务都很好。。。你要是带个名表过去那服务更好，我有次去香港带了块玫瑰金AP，然后有一天去金店买伴手礼，那门口店员一个托马斯回旋绕过前面一对情侣接待我（夸张描述），结果被我坑了，我只消费几千，那对情侣是结婚买金货的[doge]。。总结就是旅游来说感觉态度都很好，而且普通话沟通没什么问题，毕竟旅游的话面对的都是服务业人员吧。。。香港真的挺好逛，地铁步行很方便，我每次去都住铜锣湾，走到仙后街好像有家清汤牛腩不错。。。像我这种喜欢去小店吃饭的真适合去香港。。。
1676192603,0,2,False,False,重庆大厦 据说外国人很多的 东南亚的南亚的[辣眼睛]
1676135991,12,18,False,False,在香港上学，已经准备去福田租房住了[给心心]
1676138822,0,12,False,False,香港也就那样，当做一个大购物中心就好了，有东西要买就去，没有的话去的必要不大
1676169434,0,2,False,False,峰哥，去香港扫楼呗[脱单doge]富士大厦有攒劲儿的节目
1676125203,0,3,False,False,峰哥，言多必失呀，容易引起别人攻击，不过我支持你[呲牙]，峰哥加油，支持峰哥的排起队，让他们看看首陀罗的力量[奋斗]
1676130948,1,2,False,False,你来啦[doge]面基吗[doge]我就在决赛中
1676168908,12,11,False,False,鸽子屋，笼子房的普遍存在，简直是打脸香港所谓国际化金融大都市。
1676192378,0,2,False,False,去香港几次，有遇到听到普通话冷漠的人，也有非常热心的香港人。只能说，人有多样性吧。
1676185066,0,9,False,False,峰哥拍不了在香港说普通话会不会被歧视，峰哥只能拍在香港说东北话会不会被歧视
1676146948,0,3,False,False,峰哥明明可以制造更大的话题来骗弹幕的，比如谈谈大富豪对我们伟大贡献之类的，谈谈大陆人可以尊贵的奢侈的停留7天之类的，但他没有说，他真的，太爱国了，我哭死[大哭]
1676364838,1,1,False,False,我和up思想是一样的。另外我在理工上学。租的房子在佐敦，一个月3600港币，个人房间大概7平左右。香港房子还是挺贵的。
1676121068,0,3,False,False,蚌埠住了捏[呲牙]
1676191470,0,2,False,False,看到弹幕有说像是赛博朋克，确实给我一种夜之城低质量蜗居生活的感觉
1676121245,0,5,False,False,上一秒还在深圳最贵酒店，下一秒直接香港挂壁房
1676131739,0,3,False,False,我是深圳人，小学初中经常去香港，拿我当时的经历来说你说普通话基本上都会对你很无语的，当时我记得还有新闻是大陆水客被香港人打的，所以当时我一般想要什么都是让我妈说粤语买的
1676129046,0,3,False,False,峰子，给现哥开车，让现哥从他工资里发工资给你
1676175058,0,2,False,False,只要每期都上热门，2023百大非你莫属
1676140427,0,2,False,False,相反我更喜欢澳门多一些，香港虽然也不错，讲普通话也没什么不妥
1676121101,1,5,False,False,父皇 ，您又在巡狩岭南了
1676121830,0,4,False,False,记得全程都说普通话，感受不一样的全城。
1676128210,0,3,False,False,"视频里现哥住8000元酒店 峰哥住挂壁房
现实里是不是直接反过来了"
1676219026,0,2,False,False,4平米的酒店，好家伙，待1小时我都要疯。
1676138403,0,3,False,False,我关注的up，一个住深圳最贵酒店，一个住香港最便宜旅馆，怎么回事呢[doge]
1676125142,26,15,False,False,y1s1，香港这城建属实是跟不上了
1676121544,0,2,False,False,准
1676121517,1,4,False,False,吃饭没用手，不正宗啊[doge]
1676121842,0,4,False,False,住宿环境 石头看了都流泪
1676187740,2,2,False,False,小时候还挺喜欢hk的，后来对hk了解的多了就越来越讨厌了
1676185753,0,3,False,False,个个视频爆款   别飘啊  危险
1676139951,3,11,False,False,广州和深圳这种极小的，没窗户的，但是有空调和独卫24小时热水和wifi的宾馆，我住过好多次，便宜的时候美团只要59，贵一点的时候也就79，89左右。[辣眼睛]
1676193322,0,2,False,False,每当生活迷茫时，我就会来翻看峰哥的视频
1676186512,5,3,True,False,北佬峰建议你不要去香港  不会粤语  人家歧视你的  讲粤语还好一点  [喜极而泣]
1676212069,0,2,False,False,还是这种高密度网宅路有生活气息，现在很多城市的低密度大宽路，围墙小区写字楼，是真没城市气息
1676122339,0,4,False,False,这物价对比一线城市也差不多，再考虑他们收入。。。
1676136015,0,2,False,False,富士 建兴 发利 峰哥都去拍拍吧
1676175938,2,2,False,False,哥们儿你是用什么拍的？看着好稳啊
1676172595,0,2,False,False,让我联想起了星爷住过的丽晶大宾馆。
1676183738,2,1,True,False,峰哥还在吗，我住你旁边
1676193058,0,2,False,False,最后一句话竟然有点可爱：更好玩的东hxi
1676130215,1,3,False,False,歧视普通话？我没歧视香港这小破地方算不错了
1676179452,0,2,False,False,有多少人还记得，讲内地话的那个差点被捶丝
1676214264,0,2,False,False,又是对比，素质这一套，说真的，现在大部分旅游up主都已经不搞这套了，敢明着带节奏的也就峰弟了[抠鼻]
1676189678,1,2,False,False,我在中国地界讲普通话还要被歧视？难道不该是我们歧视他们么？作为中国地界中国人，连通话都不会讲，属实没谁了，好多人普通话不标准都有点自卑呢，这直接不会说了。
1676120776,2,4,False,False,峰哥疯狂整活啊，不知道去了香港能不能遇到香港明星
1676172725,3,1,True,False,峰哥在香港待多久啊？
1676130386,1,6,False,False,峰哥去香港探店结果整了顿印度美食[疑惑]
1676120780,0,5,False,False,峰子这是想念印度了，专门去住重庆大厦是吧
1676120976,2,8,False,False,峰哥你为什么不走港珠澳大桥？
1676176295,0,2,False,False,差点没把床卡门上了，这种房间，第一次见，哈哈哈哈哈[嗑瓜子]
1676197907,4,2,False,False,香港不算出境吧
1676121543,1,4,False,False,峰哥香港素材非常的多，可以多拍一拍底层人员。[doge]
1676191814,1,2,False,False,看来戴不戴口罩确实看自觉，网友记忆力确实不好[嗑瓜子] 还有就是小时候去迪士尼玩，买东西付钱让我用rmb1:1的付，那时候还不知道被坑了，五年级夏令营
1676121290,0,4,False,False,峰哥怎么突然这么正能量了？这还是我认识的峰哥吗？
1676125664,0,4,False,False,峰哥在香港出奇的宽容
1676130040,1,5,False,False,19年为了看演唱会去过一次，本来计划呆个十来天的，第三天我就受不了了，赶紧改了机票走了，而且正赶上暴乱，得亏走得早，再晚两天机场就要被占领了😓
1676186546,0,2,False,False,行政拘留24小时，保释费299元[干杯][吃瓜][兔年]性价比挺高[doge]
1676163295,1,2,False,False,峰哥不敢拍说一天普通话，怕一直营造的形象崩塌。
1676174384,0,3,False,False,敢歧视？小卡了米不怕峰哥背包里随时掏出一把斩牛刀[笑]
1676165511,0,2,False,False,你去拍香港路边探店，煲仔饭，大排档，说普通话试试老板态度
1676120821,3,6,False,False,16年去参加凤凰卫视的《倾倾百老汇》录制，住过50人民币一晚的，就一个床位公用卫生间。
1676199974,0,2,False,False,我在香港呆了这么多年，都没你这视频里见的印巴人多，好家伙，卖东西的都是印巴人
1676170762,0,2,False,False,这房间对于峰哥来说还是太大了，宽敞过头了反而显得寂寞
1676135287,1,5,False,False,一想到可能跟峰子在街上擦肩而过 整个人都不好了[灵魂出窍]
1676184992,1,2,False,False,去年去过一次香港  酒店里的 兰州炒面 炒饭100港币。。还要百分之十五服务费     路边小餐馆一顿饭最低120人民币  旅店住宿费高的离谱 普通小旅店费用比国内五星级大酒店都贵   房产中介门店 墙壁上贴满了 各种房子的售价都在700万-2500万港币以上     教师工资2万左右   消防员工资2.5万左右  沙滩，游泳池救生员月薪3万左右(工资信息来自我一香港同事他曾经做过游泳池救生员 另外几项工作他都考虑过所以比较了解具体薪水)  香港大学毕业的
1676122167,0,3,False,False,峰哥你还会跟G姐复婚吗？两个孩子你都不要了？
1676128202,0,3,False,False,峰哥跟小马一块：小马有钱，住贵的。自己：挂逼房。[doge]
1676364082,0,1,False,False,这床上起码四五个魂环
1676138477,0,10,False,False,18岁高中毕业暑假去香港和两个同学玩，玛德携程订的就是这个房子，200一晚，三个人一开房门就傻眼了。然后直接退房，感受了香港的网吧，那时候好多人玩街头篮球[doge]
1676158763,0,2,False,False,峰哥是大神呢，这么有代入感的歌曲。。[呲牙][打call][打call]
1676390470,0,1,False,False,猛一看还纳闷，软卧怎么是这种空调机？
1676197828,0,2,False,False,百万播放害得封面选的好，一眼老哥[妙啊]
1676172300,4,5,False,False,19年元旦跨年去香港看烟花，住两平米的挂壁房一张一米二的单人床，床尾就是厕所，那才是真正的挂壁房。老板是东南亚人，人很热情一直用浓厚口语的英语交流唯一会讲的中国话就是靓仔[喜极而泣]一晚268当时元旦贵一点。
1676163125,0,2,False,False,[笑哭]虽说是出境，但土地还是中国的
1676177449,0,2,False,False,😂不得不说峰哥100多万粉丝这些视频还这么多播放，拍的确实不错。
1676120991,0,2,False,False,香港挂壁之旅
1676176878,0,2,False,False,记得香港可以直接用支付宝买东西，会根据汇率自动换算港币
1676125073,0,2,False,False,峰哥啥时候去泰国美男餐厅？[脱单doge][调皮]
1676130336,0,11,False,False,泪目了家人们，峰哥作为🇮🇳人在开关之后终于回到了家乡人在香港的据点，又能吃上热乎乎的手抓饭了[大哭]
1676267553,0,2,False,False,要是有人歧视你的话 多半低层生活总是在抱怨 要是有人瞧不起你 找警察 某些人直接丢工作
1676134643,7,3,False,False,内地怎么去香港，流程是什么？
1676131297,3,5,False,False,根本不需要说英文，街上那些餐厅都是大妈，大叔再开，他们不会英文的。而且我经常去餐厅吃饭，发现很多服务员本身就是大陆来的，说普通话的。
1676213906,0,2,False,False,重庆大廈的宾馆是很便宜，以前去住过一次，一个晚上就200港币，还是两张单人床的房间。
1676133296,0,2,False,False,峰哥三观很好，去哪里都好做好自己是最基本的🤙💃
1676123858,0,2,False,False,在上海住过一晚100的，类似于这样。。。一套房子被房东分成大概能住4-5个人的样子吧，医院附近。哎
1676201627,2,2,False,False,这个重庆大厦好神奇，吃喝拉撒睡全都在一个楼内。如果一个人是靠直播赚钱，那么完全可以在重庆大厦里一年都不用离开这个大楼。吃饭买菜在楼内，买水果零食日用品也在楼内。然后在房间里工作直播赚钱。回归简约生活。
1676126327,0,2,False,False,香港真的是非常有赛博朋克的味道。。
1676181438,1,3,False,False,香港物价也有便宜的，你可以来理工宿舍附近的佳宝食品超级市场看看，冻肉、饮料价格跟内地差不多了，但是蔬菜贵
1676125782,0,7,False,False,峰想到可以以香港为跳板彻底润印度一去不返而落泪，这三年印度河山只在他梦里，想到奔腾的恒河，g姐jelly也不再亲近
1676385781,0,1,False,False,可乐5元真的便宜[doge]
1676122871,0,2,False,False,不试下本地货？
1676133278,8,1,True,False,好恐怖，点不开，限流？
1676124735,0,2,False,False,喜欢的up主来自己居住的城市原来是这种感觉
1676134964,1,2,False,False,何止普通话歧视，他喵的不同口音的粤语也歧视[呆]
1676130459,6,4,False,False,疫情没发生时，大部分香港澳门人来到大陆就戴口罩，我在想他们都得了传染病么？
1676207105,1,2,False,False,有次去香港探亲逛街经过重庆大厦门口一股咖喱味，看进去全是阿三哥
1676181589,0,2,False,False,看到插头那块，我怎么觉得这个人不怎么聪明
1676140021,0,2,False,False,这个真的最便宜了宾馆一晚都350起步
1676120763,1,10,False,False,G了
1676121604,0,5,False,False,老比登真就是来要点钱就下播了，你就是我的偶像
1676376631,0,1,False,False,这种我们一般不叫酒店 叫窝
1676170829,2,2,False,False,"不讨论别的，香港给我印象就是金融中心和TVB。
去旅游我只看风景和古建筑。
这两个他都不搭边。"
1676120825,1,8,False,False,爱你峰哥[星星眼]
1676130145,2,3,False,False,让他拍什么歧视太多余了，拍了核心粉丝就该有意见了，好不容易洗的粉。
1676163101,0,2,False,False,先给峰哥上个舰冲个电再提要求，有些人一点米没打过就搁这当股东指导做派来了，峰哥我说的对吗
1676124669,0,2,False,False,怎么不去丽晶大宾馆 本地货很出名的
1676121286,0,2,False,False,好拥挤啊，晚上住在这里感觉好压抑
1676122336,9,2,False,False,香港这消费也太高了，中位数工资多少啊？感觉一个月1w港币才能勉强生活。
1676140282,0,2,False,False,我姨丈是香港人，他一家人都会说普通话，在香港说普通话有什么奇怪的，他门都是中国人
1676141737,0,2,False,False,至少现在给我的感受就是 澳门已经完胜香港了
1676121997,3,2,False,False,丽晶大酒店！
1676176400,0,3,False,False,学到了，以后去香港只讲普通话，管他什么语，只回普通话。
1676124954,0,2,False,False,峰哥，请教教我们你是怎么把B友的心态玩弄于股掌之中的。
1676131718,5,9,False,False,香港大部分人都是广东移民过去的原住民早移民了[吃瓜]
1676217911,0,2,False,False,小时候去香港，结果正好碰上大运会了，旅馆全部订满，只好一日游就回深圳了[笑哭]
1676139462,3,2,True,False,晕，峰哥，我今天到港也在重庆大厦住，明早去看灌篮高手电影
1676163996,0,2,False,False,老板，看你样子穿的倒是挺抻头的，这间房间算你70块，每天12点以前要Check out哦 [滑稽]
1676167193,0,2,False,False,说普通话逛奢侈品店肯定不会被歧视，人家眼里就是移动的钱包[脱单doge]
1676174828,0,2,False,False,峰哥 可以出一期 去香港的流程和注意事项吗
1676391786,0,0,False,False,之前跟我舅舅去香港玩 是租别人的房子住 我们到的时候前一个租客还在收拾东西啊我舅就用英语跟她们交流 交流半天我舅告诉我说她们是大学生来旅游的 然后那两个女的惊呼原来你们也是中国人[惊讶]
1676121133,0,3,False,False,重庆大厦卖咖喱，旺角杀过人
1676124174,0,6,False,False,17年春节去的香港，感觉远远不如成都
1676125426,1,2,False,False,香港heisehui有点多 都是真dao真qiang的 峰子别乱瞅别人 你这面相容易挨打 [doge]
1676124841,0,1,False,False,一楼一凤，就要楼凤。峰哥，靠你了
1676122299,1,2,False,False,峰哥 香港可以开粉丝见面会吗[大哭]
1676174873,0,3,False,False,口罩是稳健的吗
1676147629,0,2,False,False,去过香港二十多次，别说北角炮台山，西贡南丫岛我都住过，就是没住过重庆大厦。峰哥这视频属实是给我扫盲了[doge]
1676177894,0,3,False,False,十几年前去香港看演唱会的时候为了省钱住过。。。小到可怕[呆] 被香港的酒店价格吓到了 比日本都贵不少[无语]
1676121501,0,3,False,False,省流：妹安好心
1676205296,0,1,False,False,我抖音上关注你  好像也三年多了
1676172052,0,2,False,False,有中国护照，就可以和贝爷德爷一起荒野求生了
1676156548,0,2,False,False,"低情商:HK简直是小R本的。
高情商:HK是包容性很大的一座城市。"
1676121060,0,3,False,False,低于二十分钟的视频我都不想看
1676122438,0,2,False,False,香港的印度菜就是好啊 瑞典的都本地化了 没意思
1676121858,0,2,False,False,现在上班都听峰哥录播
1676120802,0,2,False,False,稳健医疗反弹，有钱去玩了
1676364560,0,1,False,False,观彩板
1676141960,0,2,False,False,看完峰哥住的这个300块。。。突然感觉隔壁现哥8000的好像没那么离谱了[笑哭]
1676121849,0,2,False,False,峰哥来了？既来之休走之
1676135691,0,2,False,False,小马，参观8000一晚的深圳酒店房间，峰哥住四面墙
1676168347,6,7,False,False,好久没去了，真的起码有三年了，还记得当时在香港一天晚上酒店得花700多块才六七平，真的贵死
1676176858,0,2,False,False,太压抑了
1676132943,0,2,False,False,内陆五线小城市看来，资本峰带我开眼界[笑哭]
1676218121,0,2,False,False,看弹幕，看评论，比看喜剧电影还精彩，我亲爱的同胞们，我爱死你们了[滑稽][思考][吃瓜][嗑瓜子][笑哭][偷笑][喜极而泣][抠鼻][大笑][惊喜][点赞][思考][撇嘴]
1676121584,3,3,False,False,我在口岸工作 愣是没遇到谢霆锋峰哥
1676122915,2,11,False,False,峰哥，你怎么又去香港啦？哈哈哈 [笑哭]
1676170232,0,2,False,False,去过一次，再也不去，因为真的会有歧视。我是吃饱了撑的去看人脸色。
1676209591,0,2,False,False,峰子住宿还是太奢侈了，我18年去香港在缺德地图上找的佐敦床位房75一晚[OK]
1676122441,0,2,False,False,抓峰哥请吃饭
1676135063,0,2,False,False,说白了，不管你讲什么话，每个人气值穿戴都不一样，你气场强，哪里都不虚，土豪跟高人是两个极端，穷酸跟西装革领没什么区别
1676121100,0,2,False,False,峰哥，兰桂坊的Lucy晚上约你了吗
1676173346,1,3,False,False,说被歧视其实就是自己内心的自卑，与其说被人家歧视还不如做好自己，如果抱着这些心态去别的地方就是反应自己的不自在。
1676122480,0,2,False,False,冲啊峰哥，咱们夏天加拿大见
1676390330,0,1,False,False,香港对说普通话的人很排斥 真的 反感这个地方
1676126194,0,2,False,False,终于和峰哥在同一座城市了[喜欢]如果我守着重庆大夏门口一定蹲得到，可是我不会[doge]
1676132978,0,3,False,False,最近一次去还是19年暴乱的时候，11月份，回来就开始新冠了
1676169943,0,1,False,False,小月月是谁呀？
1676127658,0,2,False,False,该商户目前暂不支持中国大陆地区钱包支付，请通过钱包右上角-“切换钱包地区”-“中国香港”切换至中国香港地区钱包进行支付。
1676128364,7,5,False,False,就去香港一天    地铁可以用支付宝微信嘛
1676141981,11,6,False,False,03:55  03:54 羡慕洋人[脱单doge]
1676124230,2,4,True,False,briyani不是炒饭，炒饭是goreng
1676382272,0,0,False,False,00:31突然流下了鳄鱼的眼泪
1676201767,5,0,True,False,一份羊腿饭98美元？我去。。。
1676124883,0,2,False,False,峰哥来科大看海啊，带b友们到西贡转转吃吃海鲜[脱单doge]
1676127340,0,2,False,False,下一期来个香江的夜店耍耍
1676391660,0,0,False,False,"真怕那保险柜掉下来……
我觉得那保险柜还不如放床底下，不更省空间？"
1676121254,0,2,False,False,4平米房间都得299这么贵[辣眼睛]这价格比日本还离谱
1676134753,0,2,False,False,插到第二个的时候我甚至还有点认真。太傻了，
1676344238,0,0,False,False,那个说老人的你确定不是在开玩笑？我们这边经常能看到老人蹲路边卖菜的，还是量很少一天不知能不能卖几十块钱的那种。
1676348323,0,0,False,False,中国人说中国话，大羊腿给我整口水了！
1676391928,0,0,False,False,去迪士尼玩 看那个人猿泰山的表演 选的中文场结果全特莫讲粤语 跟鸭子听雷公一样
1676169714,0,2,False,False,看完信哥看峰哥，明白了他们之间已经隔了一层可悲的厚障壁了[doge][doge][doge]
