上传时间,回复数,点赞数,up是否回复,up是否点赞,评论文本
1676252403,1,3,True,True,去香港在那些叫“XX大厦”的地方住，最喜欢的餐厅是：大喜屋，海鲜自助便宜到哭好吃极了。穷啊，就吃那个最开心了，不然一碗云吞都好几十
1676173365,0,5,False,False,峰哥：国外大学我只认*港中文大学
1676177950,2,4,False,False,那个苍蝇笑了[歪嘴]
1676224052,1,5,False,False,弹幕居然还有这么多人不知道境外和国外的区别，震惊。
1676135800,10,53,False,False,每次去香港我心里都是一个想法 ：不如深圳  但是有段时间在那边照顾我妹妹读书时邻居是个素质挺高的大叔 天天请我吃哈根达斯[doge]让我跟他聊内地的事 他说他的梦想是有生之年走遍祖国的河山 也不知道他现在实现了没  反正我现在除非是要去香港过境转机 否则不会想去那个地方  澳门他不香吗[doge]
1676181343,0,5,False,False,这是香港？不知道的还以为去的印度
1676195684,0,3,False,False,來香港油麻地大廈找好玩的?[doge]
1676181432,1,3,False,False,峰哥，谢谢让我劝退了香港
1676172333,2,3,False,False,为什么街景看着跟县城区别不大
1676217056,0,3,False,False,我的评价是 歧视没那么严重 分人
1676125933,15,7,False,False,之前朋友给了我有一份pdf，里面记录者各个出名的大厦攻略[喜极而泣]
1676216803,1,14,False,False,去过两次，再也不想去，还不如去隔壁澳门玩，香港唯一开心的事就是在一个大厦里面遇到一家从上海过去的餐馆老板，跟老板聊了好久，老板听到我们说方言挺激动的
1676177595,1,4,False,False,"香港人路過,其實2百多你可以去北角/油麻地/旺角住M1 hotel 也有十幾平方米 ,會比尖沙咀的重慶大廈好多了, 吃的也比較多"
1676140288,0,7,False,False,16年去了一次，就决定再也不去了，我真忘不了那个女服务员听到我讲普通话那个拉下来的笑容，太让人印象深刻了[笑哭]
1676184182,2,3,False,False,英语＞粤语＞普通话
1676121040,2,21,False,False,峰哥出发当天，把视频拍好、剪好、发布，晚上还去买本地电话卡直播，这工作效率属实有点厉害[点赞]
1676133918,0,6,False,False,"峰哥你係邊度呀？fans可以見個面嘛？
峰哥你在哪里呀？我是你粉丝可以见个面嘛哈哈"
1676149886,2,7,False,False,之前出租车说普通话说地名被叼，家人直接切到零星粤语后持续英语疯狂对线[呆]司机老实了
1676253303,0,4,False,False,港岛内讲啥都不会被歧视的，都是做生意的，讲啥都是爷。去偏僻市井点的地，老板年岁比较大的那种，有时候就只会粤语，讲普通话会懒得理你。
1676121960,3,18,False,False,峰哥马上润美利坚加州啦，各位B友们[给心心][给心心][给心心]
1676175371,0,5,False,False,会不会被歧视是一个客观问题，有就是有，没有就是没有，连这都不能明着回答，原因是啥不多说了
1676121025,0,31,False,False,峰哥真的拉了，人小马现哥离开了你都去8000的酒店住了
1676221997,1,4,False,False,香港东西都很贵，但是感觉真材实料味道千变万化，内地千篇一律不是甜就是辣，就像是吃调味剂一样
1676123931,15,81,False,False,14年去香港，印象最深的：有个小哥热情的推销传单让我拿，我用普通话说不用了谢谢，他立即翻了个白眼走了
1676184180,11,23,False,False,以后组团去香港看白眼，叫上朋友一起围观，看谁翻得白，最后问他们知道宇智波家族吗
1676249304,1,3,False,False,一张中国脸，一本中国护照就是畅通世界的通行证[星星眼]
1676197876,0,4,False,False,峰哥 最近的视频都上了热门 百万播放 我很开心，希望可以继续看到。我想你可以置顶我的这条评论么？ 爱你哟[OK]
1676209131,0,7,False,False,我一直说的都是普通话 还没遇到过歧视啥的啊 相反有些人听我说普通话反而会给我更多帮助因为知道我是内地来的 上次我去拿快递我不知道那个自提点在哪 我问旁边一个扫地阿姨她给我领了一段路告诉我在哪 然后我先去吃饭了 她还提醒我快点吃完因为马上就要关门了 挺感动的 只能说我运气好遇到的都是好人吧
1676366253,0,2,False,False,去过一次香港，从此不喜欢粤语
1676217567,3,5,False,False,我在港大读研的时候租住的就是这种房子，住了整整一年，现在想想没疯我也挺牛逼的
1676215087,3,5,False,False,鋒哥係尖沙咀，有冇去建興大廈、富士大廈、發利大廈同香檳大廈 睇下。 可以探訪很多來港的異鄉人。經過可以上去睇下，又唔洗錢。 下半年@励志生蚝哥 励志生蚝哥 有機會來港發展，開生蠔店。 帶佢見識下外國人
1676169118,0,3,False,False,五线小渔港有什么好去的
1676132492,15,41,False,False,17岁去的香港，找路人问个路，见我说普通话，马上扭头摆摆手一声不吭走了。吃饭地铁站出来找的冰室，点餐不知道是哪里出了问题，反正等饭等了半小时才出来。
1676173499,0,5,False,False,"我昨天也去了香港，下午去了重庆大厦，没碰到峰哥有点遗憾呐[呆]
这次过去感觉碰到的服务员态度还好，看到是内地来的服务员也会主动说普通话，另外公交地铁、好多店铺都能用支付宝了，还是蛮方便的[妙啊]"
1676206518,0,3,False,False,当你习惯性的仰视别人，别人就会习惯性的歧视你。
1676208928,6,2,True,False,能见见峰哥吗？
1676167676,0,5,False,False,"我发布了一篇笔记，快来看看吧
峰哥还是会拍啊，这是什么情况
https://www.bilibili.com/h5/note-app/view?cvid=21776020&pagefrom=comment&richtext=true"
1676128611,3,5,False,False,"我去广州说普通话 也没少挨白眼
是不是那块儿的人都这样？"
1676179340,2,8,False,False,19年在香港出事的也就前半个月吧去香港毕业旅游，全程说的普通话并没有遭到歧视。印象很深的是在一家茶餐厅吃饭，服务的大娘和我说了一段粤语，因为我是东北人听不懂，以为大娘要我去结账。然后我就拿着钱去前台，结果大娘笑着和我说意思大概是小伙子慢点吃吃好再结账，她本来的意思是让我吃好。在其他地方博物馆商场服务人员都是微笑服务的，并没有感到歧视。
1676171940,7,5,False,False,评论区太有趣了，香港ip的在澄清没遇到歧视，内地ip的言之凿凿存在歧视[大笑]
1676180505,1,3,False,False,突然发现UP主长的也太像对马岛之魂里的境井仁了吧....
1676131141,0,4,False,False,我就在尖沙咀 明天逮峰！
1676173886,5,5,False,False,刚回来，不会讲广东话，公交地铁支付宝乘车码，基本所有店都可以支付宝微信，还会有优惠汇率和券刺激消费，态度基本都还不错，有两家店特别好，一开始看我们看菜单就用普通话招呼，走的时候还问你们是旅游还是读书，读书要加油哦。也有态度一般的只收现金，我回来去买伴手礼，一家曲奇店，不说不好，就是没什么服务意识。吃的住的也不算很贵，特别是喜茶哈哈哈哈。
1676196491,0,4,False,False,"我是老实人，我先来，香港的马路边的餐厅不论好不好吃，到饭点基本都是要排队的。造成这个状况的因素肯定不会单一，人多啦、餐厅小导致转台慢啦之类的，不一而足，如果赶时间购物的话折磨确实是挺折磨的。
另外那边的旅店也是真的贵，所以去那边购物的人（尤其是买奶粉）一般都是一日来回，不会考虑住宿。而假如你是去拜访朋友，在你的朋友不是大富豪的情况下，你大概是没有机会去他的家里坐下喝口茶的，因为不出意外他要么住的是几人合租的房子（类似大陆里刚毕业工作的学生合租一间商品房，而香港的商品房相对大陆的会小的多），要么就是住鸽笼，总之是不方便招待客人的，所以一般在外面请你吃顿饭便算是尽了地主之谊了。"
1676121255,2,15,False,False,峰哥直播了一天完事还偷摸剪了个视频发出来，b友们老是问峰哥怎么才能财富自由，其实答案就在峰哥的视频里，首先你得比峰哥还勤奋你才有那么一点点可能[呲牙]
1676252308,0,3,False,False,18年去香港，你跟他讲普通话，他跟你说英语
1676174247,0,4,False,False,我走过的地方都是中国的地盘，就是这么牛
1676192761,0,3,False,False,汇率最近都是在86，除了交通，吃饭购物跟深圳比不算贵[脱单doge][脱单doge]
1676120904,0,13,False,False,"不知道从什么时候开始，在什么东西上面都有个日期，秋刀鱼会过期，肉罐头会过期，连保鲜纸都会过期，我开始怀疑，在这个世界上，还有什么东西是不会过期的？ --《重庆森林》
 峰哥你什么时候过期啊？[星星眼]"
1676222255,0,4,False,False,找兰芳园的时候误入过重庆大厦里面，一楼一堆印度人一进去给我吓的直接出来了，，，
1676123038,7,41,False,False,世界的参差
1676122068,7,10,False,False,香港也就那样吧，没啥看头了，不像20年前挤破头去香港，现在大陆城市乡村建设得都不错。还有香港真的一点都没有变化，很多地方跟8，90年代一样[2023]
1676122953,2,4,False,False,建兴大厦可是旺角必须光临的旅游胜地哦，还有维多利亚港对面的富士大厦，现在俄乌战争应该很多乌克兰美少女需要援助。
1676127034,8,5,True,False,不是去日本吗。。
1676128100,32,28,False,False,香港最低收入320每天，这间房220。北京最低收入60+每天，我去北京儿研所，找不到40一天的这种宾馆，大家有知道的，能告诉我吗
1676202119,38,5,True,False,再重申一次：“香港是中国的”！去香港不叫出境！谢谢！
1676147357,4,9,False,False,可以尝试下两送或者三送饭店，30多港币就能有三个菜荤素任选，一般来说排队多的那几家都挺好吃的
1676171868,6,8,False,False,记得19年去过一次，中午了找一家茶餐厅吃饭，进门有那种排队限流通道，没有人，我就从边上径直走到柜台，一开口点餐，那店员眼神一甩，说我“只能从那边进来点餐”，我一看没有人，就说没有人啊，他又说只能从那边进来才能点餐，我绕回去沿着那个弯来弯去走过来，旁边来了几个本地人，径直走过去，我也刚好走到，我们同时开口点餐，店员理都不理我，帮人家一家子先点，等他们点完我看着店员，店员也不理我，直到另一个店员问我，我才开口点餐[微笑]这真的不是歧视吗
1676121994,2,7,False,False,有一说一，插一个转换插头其实就行了
1676135187,2,6,False,False,在HK不会说粤语遭到的歧视肯定比在潮汕不会说潮汕话遭到的歧视少。
1676126553,0,4,False,False,没关系，一分钟也不错了！
1676168816,0,4,False,False,峰哥这形象，香港人没人当他是大陆人，印度人看他以为是老乡。
1676185576,0,3,False,False,峰哥，现哥的8000元房间能隔着江看到你，你在挂壁房能抬头看到现哥吗？
1676124111,1,7,False,False,香港节奏那个飞快，坐地铁上个电梯都巴不得飞起来的，哪儿有空没事听你说什么语言歧视你这那那这。不过看完峰哥这视频，我倒是特地查了下港澳的酒店价格，好家伙，香港同样的酒店比疫情前翻了一番，澳门也回到疫情前价格，再也没有50住四星，100住五星，200住国际五星的羊毛时刻了
1676190880,2,12,False,False,峰子 内地老人夫妻70多岁还下田种水稻，种蔬菜 养些鸡鸭。真实情况，他四个子女一女三男。儿女都在外地上班 比如广东。为什么我了解 因为就我家隔壁，什么内地老人不用自己拎包 张口就来。
1676126668,1,6,False,False,你在北京说粤语我也照样不鸟你
1676186165,0,3,False,False,闯红灯不是深圳惯出来的嘛[给心心][干杯][兔年][吃瓜]
1676131886,1,6,False,False,这里不鼓励女生去住，印度人很多，有一定危险系数，不信可以查查旧新闻
1676122637,2,10,False,False,这个如果称为挂逼房的话只能说香港挂逼房标准比大陆高太多。看上去干净的房间床单，居然还有独立卫生间，能用的空调和能看的电视。价格考虑当地工资淡季的话比大陆还要便宜。  中国大部分地区挂逼房都要30-50一晚，空调很多即使有也用不了（有的额外要加钱），电视机还是大块头（看不了），被子床单看起来颜色就不对劲，一般睡觉不脱衣服。房子基本是毛坯，地上爬各种虫子挺常见的。独立卫浴想都不敢想。只有共享厕所，洗澡要去澡堂。唯一优势就是房间面积比这个大。做到这么干净和齐全的“挂逼房”也就一线城市，当然价格要100多，房间面积也极小。
1676126588,28,30,False,False,香港说普通话真的要被歧视，我上次去香港说普通话被歧视了，别人装听不懂[笑哭]
1676194832,0,14,False,False,好多年前去美国留学有一次从香港转机，就是住的重庆大厦，一楼的店里面的印度食物其实是放在那里好几天的，卖不掉就继续放着，也不放冰箱。
1676143924,0,11,False,False,"小时候第一次香港的时候有三感受
1香港有钱人多寸土寸金
2香港人走的真快生活节奏快
3真不如在内地生活舒服，尤其是居住条件除非你很有钱。"
1676133236,0,8,False,False,还是一副英殖地的样子
1676210277,1,2,False,False,[doge]嗯？10:37
1676194006,1,3,False,False,香港还没有深圳大，道路狭窄，那些路人看上去都非常忙碌，优点就是路上比大陆的要干净些，也没啥好玩，购物的可以去香港，旅游就没必要了。
1676159068,1,5,False,False,其实终点不是歧视，是要反击。总觉得去香港玩的人素质太高了。这种事情要是发生在内地，早就喷起来了。
1676128241,2,4,False,False,峰哥准备去🇯🇵？[脱单doge]
1676129322,1,5,False,False,峰哥肯定在重庆大厦直播下，拍个视屏，就出门左拐去半岛酒店了
1676188456,1,3,False,False,小学去的台湾，高一暑假去的香港游学，两者对比鲜明[笑哭]台湾人看见大陆来的游客都挺热情，不知道是不是看见冤大头来消费了高兴的，但是在香港真的是说普通话就没人吊你，还有那中老年人对你翻白眼
1676167869,0,3,False,False,峰哥属实把b友口味拿捏住了
1676171210,26,14,False,False,虽然但是，香港不也是中国的嘛，为啥叫出境呀
1676139083,2,6,False,False,冷知识，你在厦门不说闽南语会被宰。
1676122705,1,3,False,False,我就住油麻地，现在周末跑东莞玩去了[tv_doge]峰哥香港玩几天啊
1676210683,0,3,False,False,当外国人可以在本地经营一家外国风味的餐饮小吃，才是真正的国际化
1676176268,7,8,False,False,如果我有一天去香港，我就说山东话，把他们整一愣楞的！
1676127547,0,6,False,False,离开了自适应故乡深圳，峰哥来到了香港，这里充满了精神故乡日本和真实故乡印度的元素，这一趟可以说是寻乡之旅了
1676392047,1,1,True,False,关于我喜欢的up来到了香港但我完全不知情这件事
1676192726,4,3,True,False,峰哥你是10号晚上飞机来的吗😂，那天在机场巴士里看见个人很像你
1676122739,0,5,False,False,重庆大厦全是楼凤 峰哥会玩！
1676128390,0,4,False,False,什么扬州宾馆、新中华宾馆跟国内那些维也纳酒店、英伦酒店也差不多一个意思[doge]
1676121037,3,8,False,False,来香港怎么算出境！！峰哥你悔改罢[脱单doge][脱单doge]
1676160788,3,3,False,False,香港没什么节目效果，带石头去澳门比较有节目效果
1676122323,0,6,False,False,今天朋友在落马洲地铁站看到峰哥了[滑稽]
1676283811,0,2,False,False,其实大部分人不会在意你是不是说的粤语或者普通话亦或英文，因为大家都很忙，尤其是hk人地方很小 大家赶路都是匆匆忙忙，当然个别人你说普通话肯定会被看不起他也不会直接表现出来，不过在hk的话说港式英文对于我来说压力不大，就把一些字换成英文（记得不要发尾音）这就行了，千万别去hk影院看戏，第一次现场和好几个本地亲戚一起在看，那个画面太血腥了，把我吓得一大跳捂着眼睛不敢看。
1676125219,0,3,False,False,峰哥看下私信
1676173952,0,3,False,False,我没歧视别人都算好的了，还担心别人歧视你，得多自卑啊
1676120787,0,4,False,False,峰哥房间门口已经排起了长队
1676290696,0,2,False,False,我更喜欢澳门，不像香港那么挤
1676125129,0,4,False,False,蜂子不想讨论，在香港讲普通话会不会被歧视这问题，为啥有些人老想看呢？香港又不远，整张机票过去，自己拍一下视频吧
1676294268,0,2,False,False,笑死，来澳门读书，天天讲普通话
1676269508,0,3,False,False,香港监狱住的比这酒店都宽敞多了
1676123501,0,5,False,False,资本峰去香港也只敢吃家乡的食物，不敢跟香港人交流，怂了[doge]
1676218841,4,4,False,False,讲道理，我来香港这么多年我都不敢走进重庆大厦，住旁边的帝国酒店不好吗，价格差不多，还比这间大，真不行去君怡，老酒店，房间大还有浴缸
1676163943,0,3,False,False,峰哥在内地也是被异样的眼光看着，属于是习以为常了
1676127950,0,3,False,False,交通方面大陆是真薄纱世界任何地方
1676139285,5,3,False,False,我感觉没啥歧视，刚来半年，一直讲普通话[doge]
1676129098,8,5,False,False,清代是广东省的香港说着方言粤语，在现代摇身一变变官方语言了，还歧视普通话，我们没歧视方言当官话已经很好了，他们怎么敢的啊[辣眼睛]
1676224724,0,2,False,False,去香港简直是花钱找罪受。
1676124125,3,9,True,False,峰哥这次挂壁房真没找对，建议去住cege homes，那才是挂壁方，相比之下你这就是五星级的了。
1676121865,1,3,False,False,为什么不住丽晶大宾馆
1676260178,0,2,False,False,香港是个可以去无数次的地方，如果你只看得见购物就太可惜了，网红地方打卡和奢侈品只会误导你体会香港的魅力。殖民地回忆、文化演出、博物馆、远足徒步、配套齐全的免费公共露营区，海岛渔村、地质奇观、百年老街风俗等等。去之前，先在网上报名一些本地导赏，像蓝屋、孙中山、中环、活化古建筑之类，都有主题导赏。
1676392601,0,1,False,False,不说粤语会被歧视，真的。。。我以前去上海说粤语，都有服务员问我是广东的还是香港的。。。。。地域歧视无所不在
1676179982,0,8,False,False,峰哥能不能拍一期香港上流场所的视频？想看看光鲜亮丽的[笑哭]
1676260287,0,2,False,False,这跟说什么语言有很大关系么？澳门人不是说粤语？态度比香港好。台湾不是说普通话么？一样不喜欢大陆人，这玩意更多是由小到大的教育观念环境所致。
1676268748,0,2,False,False,笑嘻[星星眼]
1676131955,2,2,True,False,想问一下需要换港币吗？尤其是那个八达通
1676121332,0,10,False,False,啥情况？？？啥情况？？？小马住最贵你住最便宜[doge]你行不行阿小峰子
1676163932,1,8,False,False,以前台湾综艺讨论过香港服务态度不好的问题，台湾人也觉得香港服务行业普遍态度不太好，倒也没提到歧视问题
1676150222,4,4,False,False,其实歧视大多还真是假象，因为我社恐无论到哪里上街大部分我都感觉他们看不起我，如果我自信就好了，所以我觉得吧主要就是自卑心作祟， 对自己所使用的语言，对自己所输出的语言不自信的表现，有一天你骄傲的说出你是中国人，在你心里不再有大陆香港之分就不会有歧视了，共同的归属感那就有共同话题了！
1676216973,0,2,False,False,[脸红]真的有楼凤吗[脱单doge][吃瓜]
1676127013,10,7,True,False,怎么说呢，峰哥，你做自媒体赚的钱，缴税了吗
1676121260,10,6,False,False,怎么香港还这么多人戴口罩？坐标重庆，主城几乎只有一半的人戴口罩，区县更是四分之一甚至更少的人戴口罩[笑哭]
1676137270,0,3,False,False,也就峰哥这样的装扮能安全融入重庆大厦里头了
1676382242,0,1,False,False,"这种229*0.8=183元的酒店适合穷人7日游，实惠！

但卫生间条件是真的太恶劣了，住的短可以考虑339*0.8=271档次的。"
1676140730,2,2,True,False,英语》粤语》国语，你可以试一试
1676133212,0,5,False,False,镜子对着床，房间常年无光，峰哥今晚小心点可能。。。[妙啊]
1676192981,0,2,False,False,扬州宾馆哈哈哈哈
1676121765,0,4,False,False,找找香港的日结大神，峰哥
1676136866,6,4,False,False,我在大街上拿出手机拍照，会不会被歧视
1676126505,0,4,False,False,峰哥你不要忘记你的家在印度[嫌弃]
1676128902,0,4,False,False,小马现哥在深圳住8000一晚的酒店，峰哥住上了hk挂壁房，攻守之势异也。
1676217455,0,2,False,False,这一刻 见证历史！！！
1676125346,0,5,False,False,"这是一首藏头诗:

不须沈水自然香,
瞒不过主腰胸带。
你从前入道未是，
说英雄谁是英雄。
白日放歌须纵酒，
嫖姚何日破重围。
好是春风湖上亭 ，
爽气朝来万里清。
三万里河东入海，
连山断处大江流。
别巷寂寥人散后，
想见城南春水深。

如何独得百丈索,
有人夺得玄珠饵。
看是处春回柳眼，
到如今犹宿花阴。
送春争得不殷勤,
我醉只知今夜月。
上言二年隔烟水，
去年却下七里滩。
[脸红][doge][doge][doge]"
1676165246,2,3,False,False,会歧视普通话，关键机场容易分辨大陆仔，我反正在机场被服务员白眼过
1676120913,0,3,False,False,马上去尖沙咀抓他
1676195670,0,2,False,False,我还以为去日本才用买转换器，原来香港也用啊？
1676121138,0,7,False,False,重庆大厦的小旅馆太脏了，峰哥小心床单上莫名其妙的液体，有些楼层的楼梯竟然有大片血迹
1676290238,0,2,False,False,我去澳门玩的时候正常购物吃饭，没感觉到歧视，去香港没注意到，前几年去的时候我不知道他们那边还有歧视一说，笑死我了[脱单doge]
1676158289,1,2,False,False,我家也才10平米[原神_哦]
1676125321,3,5,False,False,重庆大厦有不少印度料理挺好吃的，住就别住了，有风险。另外，印度人的服务比大多数香港本地服务强的多。
1676194564,0,2,False,False,重庆大厦我住过，哈哈哈
1676142065,0,2,False,False,一开视频峰哥竟然已经拍到了每天的必经之路，属实有点巧，明星竟在我身边
1676121285,0,8,False,False,峰子直接奔着家乡的味道就去了，下一站新德里
1676161058,0,2,False,False,好压抑。。。。。。
1676122006,1,5,False,False,别让我逮到峰哥你嗷[疼]
1676166589,1,8,False,False,讲普通话没问题啊我不会讲粤语都来香港留学两年了，香港姨姨伯伯会很努力跟你讲普通话，虽然是港普但是好可爱[大笑]（第一年来的时候粤语一句也听不懂，待了一年基本能听懂了）
1676181183,0,2,False,False,必须三连
1676219128,0,2,False,False,就tm中意峰哥的性情
1676184168,1,6,False,False,本佛山人表示，讲粤语也会被歧视，还是去澳门好玩一点，香港真的不喜欢去。我宁愿去上海的迪士尼也不想去香港的。
1676212065,0,2,False,False,我主动出列逮捕峰哥！
1676178909,5,2,False,False,说英语会不会受尊敬
1676232095,1,2,False,False,去香港不如来新加坡
1676127465,0,3,False,False,离境第一期 必须狠狠地三连一波[脱单doge]
1676129680,0,4,False,False,预设了答案的视频不需要看，因为拍摄者会用各种方式让他的预设实现。 顶你
1676122502,0,12,False,False,有没有在香港的逮峰队，把它打一顿。
1676275224,7,2,False,False,个人经历告诉我说普通话会被歧视还会被翻白眼，不理你。还是在机场这种服务行业的从业人员中出现这种状况。
1676180610,5,6,True,False,峰哥，我也想做自媒体创业，请问你是用IPhone剪的片子，还是用mac剪得片子啊
1676132434,0,2,False,False,有点像日本
1676305423,0,2,False,False,！绝了就是这间，我跟我朋友两个人住的，订的时候看着很大啊[喜极而泣]一进去我们傻眼了，我跟朋友坐着睡一晚
1676121918,1,6,False,False,足不出户就能看世界，谢谢你峰哥[给心心]
1676180156,0,2,False,False,峰哥买盒美心蛋卷炫吧！
1676176984,0,2,False,False,这个视频也快百万了
1676180824,0,3,False,False,大家来香港买水一定要去士多店 别去便利店（OK店、711）会便宜很多
1676176956,0,3,False,False,1月26日去了一趟香港，没啥感觉，人也不多，实话说确实有些老破小
1676218073,0,2,False,False,锋子什么时候来拷打一下我住的地方😃
1676195974,0,2,False,False,港岛还是有情怀的
1676132732,13,3,False,False,认识好多香港朋友，感觉是有点歧视的，称呼都北佬，捞佬，当然广东也有这样称呼北方的
1676122102,7,5,False,False,香港感觉也没多发达啊，怎么总看一些人吹得吊打大陆这个那个城市的[思考]
1676177754,0,2,False,False,峰哥，现在现哥一晚8000
