上传时间,回复数,点赞数,up是否回复,up是否点赞,评论文本
1676292730,3,2,False,False,对嘛，上面的是深灰色。下面的颜色浅一点，看半天都没看出哪里一样了[笑哭]
1676424465,0,0,False,False,雀氏有点，，画画的以后又学到了[妙啊]
1676331566,2,1,False,False,同一张图片，确实颜色一样
1676365345,0,0,False,False,我是美术生，这个在我们处理画面效果的时候经常用，具体表现为固有色的区别方法，很白的物体暗面一定要比暗色物体亮面亮，而且根据图中情况，地面会给白色物品一定程度的反光，所以白色物品暗面一定比暗色物品的亮面亮（白色物品也会给暗色物品一个反光从而暗色物中间偏下部分不那么暗，但艺术效果上为了是画面效果更好要用深颜色来衬出亮色物品的亮面）
1676421586,1,0,False,False,拿画世界取的色，可能有误差，但确实感觉A好像比B的颜色要淡
1676392851,0,0,False,False,遮住了下面和上面还是不一样，下面明显比上面要白一些[无语]
1676369647,0,1,False,False,@理塘丁真 我怎么看不出来
1676377680,0,0,False,False,"卧槽，真的一样，截屏分别裁剪A,B区域，不敢相信眼睛了"
1676426919,0,0,False,False,我都觉得我不配我的脑子了，它比我聪明[大哭]
1676418328,0,0,False,False,把背景颜色也遮上就一样了 把变量全去掉剩下的就是一样的了
1676364898,0,0,False,False,完了，看多了，现在不一样了[微笑][微笑]这张图不知道养活了多少，视频，最近一直刷到，看多了大脑形成意识了，现在他俩不会变成一样了[微笑]
1676365682,0,0,False,False,看不一样的兄弟萌，把四周挡住更好看出来。或者挡住中间后集中注意只盯着那俩块看，一会儿它就会变的一样了，会有种聚焦的那种感觉。
1676437034,0,0,False,False,他们中间是一个颜色，但不代表他们旁边就是一个颜色了
1676383690,0,0,False,False,他应该说手动挡住白色高亮和黑色深暗的地方。这图做的就很搞笑。浅蓝色衬托上面的深，然后底下用深色的地面来衬托这个颜色的浅。
1676381643,0,0,False,False,横着手机，视线和屏幕成一个十多度的夹角能轻易看到A、B区域的颜色和中间亮、暗条纹的区分。
1676380986,0,0,False,False,"其实a面没啥用。
直接看带高光区域的b面和挡住高亮区域的b面，大概就可以理解了。
一个是以为白+阴影
另一个是觉得本来就是灰色"
1676363858,0,0,False,False,"首要，我将a,b的中心范围进行了拼接，用肉眼不难看出颜色是近乎一致的。
但是我们的大脑真的那么容易被骗吗？于是我又进行了探究。
不难看出，图2我将图片的边缘背景进行了去除，进而我发现我可以用肉眼分辨出A和B的范围区域颜色是一致的。
最后又用直线发现，这个图片在设置上又有一些其他的玄机，比如A和B并不是完全垂直，A与B与中心分界线的垂直距离也并不一致，这些影响聚焦点的因素也是图片能够欺骗大脑的一大原因。
图片背后的边缘的渐变色也是一大导致我们错觉的原因。
我们的大脑在识别颜色的过程中应该是通过整个区域的色块进行融合分析，如果不是人为还是很难背骗的。"
1676391601,0,0,False,False,a的固有色比b的黑，挡住中间和边缘只是看到a的亮面和b的暗面一样。但他们的固有色就是a比b黑，稍微学过点素描都知道
1676386924,0,0,False,False,用大拇指把黑色和白色一起挡住试试[doge]只能说有点感觉！
1676364646,0,0,False,False,别说遮不全了，你只要遮住后一直看b你就会发现颜色在变深，需要适应的
1676376560,0,0,False,False,挡住中间后发现上面还是更灰一点，挡住阴影之后就发现差不多了
1676397518,0,0,False,False,我还以为是说这个“物体的颜色”，没成想是“图片”的颜色[笑哭]
1676383395,0,0,False,False,上面深灰，下面浅灰，Up诱导，观众不自信，那它们的颜色就一样了。
1676384180,0,0,False,False,一个偏黄一个偏蓝啊不知道对不对（不是学美术的
1676368029,0,0,False,False,挡住后会误会上下是一个颜色[歪嘴]
1676366464,0,1,False,False,不知道多少年前就确定了的事实还耶稣来了都上黑下白，真有意思
1676384626,0,0,False,False,受光面是固有色，A面受光面是灰色，固有色就是重灰，同理，B面就是白色。
1676391820,0,0,False,False,为什么我盖住之后也不太一样?A面更暖一些，亮度低一些，B面更冷一些，亮度高一些
1676397105,0,0,False,False,@和光同尘yo 是我的问题吗  为什么感觉遮住了之后 上面的深一点 下面的浅一点 还是不一样[捂脸]
1676372669,0,0,False,False,随便逮一只美术生来都能回答这个问题[蛆音娘_滑稽]
1676419178,0,0,False,False,同时遮住中间和左边部位就一样了，而且要遮的稍微宽一点，就是有光照的地方都得遮掉，就一样了
1676437147,0,0,False,False,想必大家只挡住中间的话，会感觉这是哑光黑和磨砂黑的区别
1676368448,0,0,False,False,说实话，好几年前我吸了一下真的一样。。。[坎公骑冠剑_惊叹]
1676364305,0,0,False,False,此时一位靓仔伸出了中指挡住了中间白色部分
1676363947,1,0,False,False,"T我遮住看也不是一个颜色啊，上面的灰色偏黑，下面的灰色偏白
对了，我是面料跟单员[嗑瓜子]"
1676373124,0,0,False,False,我挡住了一样是上面深，我挡住了90%以上一样看起来A深
1676214365,3,16,False,False,遮住要好很多，但是b看起来还是浅一些[doge]
1676427841,0,0,False,False,什么时候显卡能有大脑的图形渲染能力，摄像头能有眼睛的画质[吃瓜]
1676384652,0,0,False,False,00:01
1676374410,0,0,False,False,离屏幕有一定距离的情况下，一眼就能看出两块是同一颜色了
1676365686,1,0,False,False,，我感觉这俩不是一个颜色，就算你挡住了，你看的是一个颜色，我感觉其实还是不是一个颜色，不要完全挡住留一点，仔细观察在挡住他，会发现下面的颜色更淡
1676419054,0,0,False,False,同一个颜色一个是两面一个是暗面，给大脑识别颜色肯定不一样啊[嗑瓜子]
1676423034,0,0,False,False,确实，我用手挡住，然后眼睛眯成一道缝乘他不注意偷偷看，确实不是一样的，果然在骗我！！
1676426821,0,0,False,False,视觉恒常性还是直觉补偿性，虽然我知道是错觉
1676406766,0,0,False,False,话说，这个大脑怎么好像不太聪明的样子呢[喜极而泣]
1676363033,0,0,False,False,提示:得把中间和底下影子都遮住，就显示一样的颜色了
1676304222,2,5,False,False,遮住之后看着还是不一样是没眨眼睛，大脑还在脑补，眨两下眼睛就一样了[2233娘_大笑]
1676451607,0,0,False,False,我一开始还以为是反串，看到一半发现竟然真的是闹贪。
1676444984,0,0,False,False,中间有了渐变色，所以人眼就开始有所区别了。
1676390637,0,0,False,False,渐变色，用手挡住中间上下移动，下面暴露得越多色差越大，
1676381537,0,0,False,False,你但凡把下面的那个白色的阴影部分全部露出来，你这话就说错了
1676377692,0,0,False,False,还以为是说上下呢，原来是说中间那个色块了[笑哭][笑哭]
1676416293,0,0,False,False,坏了，很快就会有一堆装聪明的来给你解释说这是视错觉
1676362547,0,0,False,False,为了防止大脑继续自作主张，我一般会用多巴胺冲昏大脑，我真是太聪明了[tv_鬼脸]
1676362856,0,0,False,False,我吧白色加上灰的都挡住了，我说什么东西一样啊，愣了一会儿反应过来了...好87[可爱联盟_无语]
1676362646,0,0,False,False,难怪看别人教画画的那种，对色彩，阴影的把握都需要很精准。
1676363551,0,0,False,False,是因为中间是白色，然后就会认为b面@下面是阴影吧？所以感觉ab颜色不一样
1676364390,0,0,False,False,所以，只要你看的作品够多，大脑就会自动去码[doge]
1676432101,0,0,False,False,两个颜色还是有差别，A区域的颜色比B区域深，这是我遮住up说的区域后看到的
1676387212,0,0,False,False,就是一样的，取色器上会有微小的差异但那是图片压缩后的误差
1676371894,0,0,False,False,人看到的颜色，才是真实状态下，物品本身的颜色。
1676367879,0,0,False,False,不光是中间颜色的问题这个和背景也有关系下次说的话记得严谨一点并且标注色号[doge]
1676301229,3,2,False,False,up好像放错图了（估计是电子包浆），看上去上下颜色不一样，以前在《加油，向未来》里也看到过这张图，那个图上下是一样的[doge]
1676385189,0,0,False,False,B面在挡住白色部分后确实变暗了，但比A面浅，不是一样的灰
1676383719,0,0,False,False,正常，就像有码的我的大脑也能自动换算成无码的。
1676379950,0,0,False,False,把中间分界线深的和亮的都挡住就一样
1676372181,0,0,False,False,建议改成:老师解释答案现状
1676375222,0,0,False,False,在B站，网有总会因为奇怪的点吵起来
1676302959,0,2,False,False,我是做配色工作的，这种情况经常出现。当你的眼睛长时间看荧光桃红色后看蓝色就会变成紫色[藏狐]
1676423375,0,0,False,False,逻辑上可能是对的，但图片，即使把中间的给挡了，下面的颜色依然比上面更淡些
1676370522,0,0,False,False,我的大脑为什么要自作主张，他为什么不听我的话
1676430797,0,0,False,False,这证明了，人类的视觉也是唯心的产物[doge]
1676368496,0,0,False,False,不一样，上面一点下面白一点而且背景颜色不同
1676339194,0,1,False,False,自己看呗
1676363336,0,0,False,False,颜色的确是一样的，觉得b颜色比较浅是因为边缘反光不同大脑还在欺骗你，把中间和边缘都遮起来就行
1676362322,2,1,False,False,还是不一样
1676370754,0,0,False,False,把白色地方罩住，还是上面的比下面的更深一点
1676303173,6,3,False,False,我觉得视频的解释不对，你把手机反过来还是B面更亮一点。
1676315656,0,1,False,False,真是一样的
1676375069,0,0,False,False,刚刚用纸遮挡的时候，感觉还是上面更灰，我截图涂鸦之后，发现颜色一样
1676287730,2,2,False,False,@李论科学 在现实中，如果正常光照下，B其实会比A更黑，这样我们就可以看到B与A是一样的，up用软件里的图片是不对的，用ps提色确实A与B的颜色一样，但既然加了光照，就要改变所有区域的颜色，根据不同区域不同光照强度，改变的值也是不同的。相同颜色下A会变亮，B会变暗。经过人眼处理，A与B的颜色就一样了。如果人类的眼睛这样差，还给你纠正错了，我认为是不合理的。在现实生活，正常光照下，人眼的纠正是完全正确的，可以让人正确分析颜色。软件里的很多东西都是不对的，不完全符合现实物理规律。这就是为啥我们能用显示器显示照片，但用来画图就会觉得假，不像现实里的东西。人眼是为现实设计的，不是为这些人类编程的不靠谱的软件设计的。
1676419887,0,0,False,False,我们考虑的是逻辑，不是颜色本身。
1676384703,0,0,False,False,两个都是渐变色，你把最顶上的挡了他能不一样吗
1676403476,0,1,False,False,就是不一样的，可能因为这个图不是高清图，所以颜色有微微的差别
1676316467,0,1,False,False,如此
1676390936,0,0,False,False,我第一次看到这种图还是小学，现在大学了[无语][无语]
1676317743,0,1,False,False,还真是
1676368180,0,0,False,False,单独看，别听他的，你会发现三个区域颜色都不一样
1676380720,0,0,False,False,完了，我手机跟你们不一样，我挡住了看颜色还是不一样
1676380604,2,0,False,False,不是一个颜色，用一只眼睛看会更明显[doge]
1676384391,0,0,False,False,你要纠结的不是一不一样的颜色，是道理你懂不懂
1676425842,0,0,False,False,有没有大可能怕把自己吓死自动过滤了一些东西
1676378009,0,0,False,False,倒过来看就很明显都是灰色了这是为啥
1676388878,1,0,False,False,本来也不一样，挡不挡都不一样，但白色部分确实有提亮的效果。
1676438103,0,0,False,False,所以大脑才是真的强，真的智能
1676381353,0,0,False,False,"–
－
不要被你的大脑欺骗了，他们一样长
💛💙
不要被你的大脑欺骗了，他们一个色"
1676416889,0,0,False,False,为什么我挡住了以后也发现上面确实更暗一些[吃瓜]
1676381133,0,0,False,False,大脑会自主脑补这些简单的挺神奇。应该也可以自主整理信息吧，比如得到一个数学题会自主脑补出答案不
1676313600,0,1,False,False,感觉还是有区别
1676390360,0,0,False,False,你用手横向慢慢遮挡白色居然在一点点变深
1676364084,0,0,False,False,我认为，取色结果不一样，是因为电子包浆吧，这图在设计之初应该是一个颜色
1676391573,0,0,False,False,遮住了，还是不一样啊！老板
1676390700,0,0,False,False,是一样的，用A或B附近颜色做了下过度衔接方可说明
1676389010,0,0,False,False,挡住也是上面深呀，A旁边还有一圈阴影?
1676417208,0,0,False,False,Ab两块的颜色就是不一样的
1676436845,0,1,False,False,天王老子来了也是一样的
1676362725,0,0,False,False,坏了，为什么我把白色的挡上，还是下面那个更亮[捂脸]是手机的问题还是我的问题[捂脸]
1676314892,0,1,False,False,等我更新一下显卡驱动[doge]
1676292387,0,1,False,False,挡住了也是上边颜色深一些
1676401473,0,0,False,False,本来就不一样的不是什么脑补，只是微小的反差被环境放大了。上面边缘明显渐变黑，而下面除了中间几乎像是一个平面。
1676382559,0,1,False,False,第一张是A，第二张是B(都取中间部分)
1676213982,3,13,False,False,天王老子来了他也是有色差[doge]
1676369269,0,0,False,False,挡住中间就有用了吗. . . 你没亲自试试吗. . . 不把旁边轮廓挡住就是不一样. . .
1676386034,0,0,False,False,差不多但确实不一样，不过还是能证明up主说的大脑脑补还是存在的
1676388265,0,0,False,False,电脑是检验真理的唯一标准不信你自己看我的视频
1676384803,0,0,False,False,刚挡住开始是不一样，看久了你会发现一样了，然后使用屏幕取色确实是一样的（7b7b7e）
1676388401,0,0,False,False,但是遮住我看也是不一样的[微笑]
1676393446,0,0,False,False,我还是觉得阴影和白色的档了也是两种颜色 虽然两个都是灰色 但是一个是浅灰一个稍微深一点[吃瓜]
1676427657,0,0,False,False,接近的色值太多了 可以只看AB两个字母附近的色值就容易分辨了 是一样的 A这一个方块起码4种接近的色值了
1676395530,0,0,False,False,大家可以来我视频底下看整个讨论辩证过程，测试是4k
1676393521,0,0,False,False,确实都是灰色，但底下的就是更亮一点，显得更白。
1676436802,0,0,False,False,用大拇指和食指围成小圈，对着AB那个点看，真的一样
1676379995,0,0,False,False,e......你们都不会查rgb吗
1676383012,0,0,False,False,只看a面和b面，你分别盯着看，别看别的地方，就是一样的
1676377059,0,0,False,False,快帮我叫救护车 我眼睛出问题了
1676370418,0,0,False,False,你说的对 但是我们民科b友会看着这图说不一样
1676377887,0,0,False,False,虽然我手挡住看两个颜色还是不一样 但是拉到ps里确实是一样的[doge]
1676389969,0,0,False,False,用两根手指挡住上面和下面你会发现中间是不一样的
1676389281,0,1,False,False,评论嘴是真硬啊
1676380783,0,0,False,False,不一样，一个深灰一个浅灰
1676385194,0,0,False,False,所以说情人眼里出西施，祝你们情人节快乐！
1676381952,0,0,False,False,然而从美术的角度来说 考虑光影就是一黑一白
1676312567,0,1,False,False,需要遮的东西有点多
1676371196,0,0,False,False,所以我被我自己骗了[奸笑]
1676382078,0,0,False,False,b面确实色轻，不过这问题确实存在
1676367370,0,0,False,False,光照不会改变颜色吗？中间过渡带颜色就是不一样，光照覆盖也会改变颜色在人眼中的成像，啥时候光照亮度不算颜色改变了？
1676380965,0,0,False,False,那是阴影，就是白色的，挡住了那条白色的ab还是跟a的颜色不一样
1676364169,0,0,False,False,我怎么感觉挡住中间后a甚至还浅一点[辣眼睛]
1676384917,0,0,False,False,今天就是天王老子来了他也是白色
1676369911,0,1,False,False,天王老子来了这两也不是一个颜色
1676370981,0,0,False,False,电脑取色工具显示上下一样，颜色值都是7B7B7E
1676389069,0,0,False,False,切一手看看不就完了，请评判吧
1676423245,0,0,False,False,为啥我遮住了还是不一样[辣眼睛]
1676423334,0,0,False,False,居然还有人说地球OL没有bug[doge]
1676385716,0,0,False,False,在离开了背景和白色的对比下，确实是一样的
1676292468,0,1,False,False,挡住了 颜色还是不一样
1676391945,0,0,False,False,相机的矩阵测光也是一样的。除非是点测光。
1676294988,1,1,False,False,至少在我的这个截图的色差几乎没有，
1676366567,0,0,False,False,我挡住了下面只是浅灰色的不是深灰色
1676319717,0,1,False,False,挡住也不一样
1676380021,0,0,False,False,这个才是问题的关键，已经圈起来了
1676380424,0,0,False,False,有没有可能这个图就是错的[doge]
1676430047,0,0,False,False,上方深灰色，中间白色，下方浅灰色，不管怎么样做，颜色都是有一些差异。
1676403555,0,0,False,False,rgb数值都是123，123，125
1676395960,0,0,False,False,颜色不一样，下面浅一些，这不是阴影吗？
1676377345,0,0,False,False,不一样，并且我挡住中间了。
1676382847,0,0,False,False,因为你脑子开了光追
1676399078,0,1,False,False,天王老子来了这也是不一样的
1676385177,2,0,False,False,你这个说的不对，上面是黑色，下面是灰色。
1676446023,0,0,False,False,不一样啊。还是上面深，下面浅。
1676429502,0,0,False,False,你可真是个大聪明
1676363120,0,0,False,False,不一样啊 我感觉a比b的灰深
1676373199,0,0,False,False,好多人不愿承认自己是大多数啊
1676407434,0,0,False,False,确实是变成了灰色不过和上面的颜色相比还是不一样
1676427939,0,0,False,False,为什么我遮住了还是不一样[跪了]
1676389921,0,0,False,False,屏幕取色取出来颜色都不一样，怎么可能一样[藏狐]
1676360883,0,1,False,False,这都多久的图了，翻出来了又
1676396206,0,0,False,False,实际情况是，下面就是更亮[辣眼睛]
1676362939,0,0,False,False,大脑：玩阴的是吧
1676375825,0,0,False,False,是把眼睛👀中间挡住吗，像这样子(中ω 中)
1676368817,0,0,False,False,挡住了，上边比下边黑
1676437237,0,0,False,False,老师是不是上过三力的小事牛刀节目，讲星座的那期，喜马拉雅
1676434383,0,0,False,False,确实挡住看起来暗了一些，但是有色差，不一样，
1676283072,1,1,False,False,挡住也不一样啊[思考]
1676366488,0,0,False,False,挡住过一会儿上下都是灰色了
1676415693,0,0,False,False,省流:视频刚开始那个图没问题，之后在人下方摆的那个一直都有问题，截屏出来就又会没问题，所以评论那些测试的都没有针对性，纯粹是本视频有误，不能证明，一切证明皆失效，纯粹是此视频后台加工的问题，截屏包括复制视频都会还原至原来的正常，所以无法证明
1676367137,0,0,False,False,唉？灰色，手指拿开，唉？白色！，卧槽，我会魔法
1676384798,0,0,False,False,不一样，下面明显淡一点
1676378039,0,0,False,False,方块边缘和背景导致的
1676367804,0,0,False,False,这俩不是一个颜色，上边的更黑，下边的黑的差一点。
1676418410,0,0,False,False,不一样，上面颜色还是要更深一点
1676363912,0,0,False,False,不一样啊…虽然都是灰色但是深度不同
1676302799,0,1,False,False,截图后，发到电脑，去除其它，，确实一样，，
1676393117,0,0,False,False,这不就是固有色的问题吗
1676436442,0,0,False,False,挡住觉得上面颜色深，还是看着不一样呀
1676381814,1,0,False,False,为什么我看着感觉还是一样？抱歉四色视
1676370903,1,0,False,False,还是不一样
1676376990,1,0,False,False,把明暗变化的地方全遮住
1676426345,0,0,False,False,b是灰色的但是就是比a亮啊，全遮了都没用
1676391834,0,0,False,False,颜色感觉是一样的，但是感觉a面颜色要更密集一点
1676380688,0,0,False,False,虽然都是灰色 但是下面的没那么灰
1676355389,1,0,False,False,别吵了，截图打ps拾色器取一下就知道了。
1676371877,0,0,False,False,UP..我试了试，上下颜色根本不一样啊，下面色轻，上面色重，但是不是一种颜色啊
1676277348,2,1,False,False,截图后，确实基本一致
1676367046,0,0,False,False,怎么办CPU烧了[辣眼睛]
1676289452,0,2,False,False,"多遮一点，因为上班的a也有暗部阴影，
把中间多遮点，上面只露出a字母，下边露出b字母"
1676390907,0,0,False,False,"？问题是这俩灰不一样啊，B受光面是白色那肯定自动想成下面是白色的阴影面啊，阴影面又不可能是亮白色当然是灰的啊[辣眼睛]
这种没有认证的up瞎j13说居然还能有这个量的关注，包括这个视频刷到过三次，有两次都是乱加前提或者乱举例
之前还说球2的太空电梯设计出来和火箭相比是鸡肋，谁告诉你火箭和太空电梯是一个用途的[辣眼睛]"
1676418411,0,0,False,False,可是我挡住他也不一样啊
1676402312,0,0,False,False,确实不一样，挡住看下面会亮一点
1676289179,0,1,False,False,不一样  明显下面那个淡灰色。可以自信看
1676373595,0,0,False,False,如果是一个没有常识的全新的脑子，也会认为上下不一样颜色吗
1676446701,0,0,False,False,我看了，有点色差上面深，下面浅
1676374644,0,0,False,False,我挡一半会不会把脑袋烧坏[doge]
1676252686,0,1,False,False,破案了，有些手机显示色号不一样，有些设备显示出来色号一样。色域有区别。
1676369179,2,0,False,False,不一样 调色后更明显了
1676364929,0,0,False,False,你们有没有考虑自己手机色差的问题
1676383021,0,0,False,False,不一样，a更深 b更浅
1676363729,0,0,False,False,但是我遮不遮看着都一样的啊，上面是要黑点啊
1676439065,0,0,False,False,我上下取一块对比，肉眼可见的不一样
1676422372,0,0,False,False,倒过来在打挡住就是一样
1676366087,0,0,False,False,"为什么要拿a的阳面和b的阴影面比啊ಠ_ಠ
这不是和穿有些颜色衣服显白有些颜色显黑一个理吗竟然要科普(°_°)还是热门(o_o)"
1676403297,0,0,False,False,为啥挡住了看不一样
1676286057,0,1,False,False,我不信，来个人截图去ps里面用吸管吸
1676361918,0,0,False,False,颜色确实不一样 只是一瞬间感觉是一样 [笑哭]
1676383956,0,0,False,False,还是A面要灰一点
1676382635,0,0,False,False,肉眼可见的不一样。。。
1676381757,0,0,False,False,这其实是视频问题
1676377755,1,0,False,False,省流：自做聪明
1676361914,0,0,False,False,其实蓝天也是一种干扰，让你误以为上面有阳光照下来🤔
1676364521,0,0,False,False,打开ps吸色，就是不一样
1676380113,0,0,False,False,怎么能一样。明度一眼看出差别
1676386054,0,0,False,False,怎么看都是有色差啊[辣眼睛]
1676361812,0,0,False,False,这个图，学过色彩的人应该比较容易分辨吧
1676361627,0,0,False,False,so，世界有很多不符合常识的东西被大脑故意忽略了？
1676427330,0,0,False,False,有没有吸色的，来个大佬用数值说话
1676428719,0,0,False,False,这就是个车轱辘话，“一样”结论其实是偷换了概念，拿a的亮面和b的暗面进行对比。我们常人看见“a与b颜色是不是一样”这个命题时的理解是对比a这个整体本色与b这个整体本色，而不是对比a的部分与b的部分
1676435058,0,0,False,False,手机炸了也是两个颜色，
1676356215,1,0,False,False,RGB取色，数据不一样，不是同种颜色
1676384494,0,0,False,False,挡住看得颜色也不一样。。
1676304809,1,4,False,False,"我发布了一篇笔记，快来看看吧
只隐藏白色部分也能看出AB面是同一颜色的
同时隐藏就没有任何问题了。
https://www.bilibili.com/h5/note-app/view?cvid=21809617&pagefrom=comment&richtext=true"
1676362469,0,0,False,False,准确的说，A灰色更深一些！不接受反驳
1676382181,0,0,False,False,完全不一样啊，色度差了好几个档次
1676392163,0,0,False,False,这是两种不同的颜色，如果你遮住中间发现颜色一样了，这是你大脑自作主张的结果
1676381381,0,0,False,False,至少我这里不一样
1676372478,0,0,False,False,"用十字把A,B也遮了就行了"
1676289617,0,1,False,False,就是有那么一内内的不一样[脱单doge]
1676301013,1,12,False,False,"我发布了一篇笔记，快来看看吧
只隐藏白色部分也能看出AB面是同一颜色的
同时隐藏就没有任何问题了。
https://www.bilibili.com/h5/note-app/view?cvid=21809617&pagefrom=comment&richtext=true"
1676374297,0,0,False,False,有没有人查看一下RGB颜色是不是一致性
