上传时间,回复数,点赞数,up是否回复,up是否点赞,评论文本
1676362129,1,0,False,False,亲测:近视眼拿下眼镜👓看，不用挡就是灰色
1676385909,0,0,False,False,遮住了也不一样。只遮中间。
1676366056,0,0,False,False,中间挡着手机反过来看
1676362423,0,0,False,False,挡住中间也不是一样颜色的
1676375545,0,0,False,False,我挡住了没变化啊[吃瓜]
1676423242,0,0,False,False,敢不敢测个色？
1676374418,0,0,False,False,周围挡前、后
1676380624,0,0,False,False,明显上面的颜色深一点
1676423946,0,0,False,False,为什么我看的是一个盒子，中间有个白色的开口[辣眼睛]
1676417857,0,0,False,False,脑补不出来……
1676362586,0,1,False,False,现在的网络环境乌烟瘴气杠精一堆这是实事，自己不实验也不听别人的，一句话就硬刚。像所有人都和你一样的想法这是不可能的，只能是你自己高血压[吃瓜]
1676259870,1,1,False,False,RGB:124 123 127
1676282114,0,1,False,False,就算是天王老子来了，他的曝光也不一样
1676376574,0,0,False,False,模拟光照阴影过度
1676369303,0,0,False,False,那我把两边遮住只看中间不行吗[doge]
1676363934,0,0,False,False,我截图看了，  前面颜色不一样
1676371718,0,0,False,False,用截图软件对比就行
1676394456,0,0,False,False,B灰色但是没A那么灰
1676426934,0,0,False,False,我永远相信我2弟[doge]
1676374579,0,0,False,False,ps涂一下两个颜色就是一样
1676383832,1,0,False,False,为什么挡了还是不一样[捂眼]
1676435568,0,0,False,False,一个偏红一个偏蓝[脱单doge]
1676364111,0,0,False,False,完了 挡住看到的也一样
1676362357,0,0,False,False,已经拿取色器测过了，7b7b7d[doge]
1676394462,0,0,False,False,暂停截图，对比一下，目测一样的
1676388513,0,0,False,False,能不能先审核一下你的图
1676381123,0,0,False,False,有灰度差别…
1676381458,0,0,False,False,直接截图，ps看rgb的值是不是一样的。
1676447929,0,0,False,False,这个有色差啊，不是一样的颜色
1676368509,0,0,False,False,下面明显浅一点吧
1676216260,0,8,False,False,我记得脊索动物按道理应该优先发展视觉的，但是哺乳动物或者说合弓纲当年在侏罗纪和白垩纪竞争不过恐龙所在蜥形纲，于是选择了发展嗅觉和听觉以此走夜行动物，视力什么的够用二色视觉就行。但是到了新生代，兽族崛起尤其是我们灵长类中的人类占据主流生态位顶级掠食者于是又开始发展视觉，终于又有了三色视觉，不过终究是基础薄弱，有时候有点基因变异就又变成了色盲，而且硬件也不行，只能用软件也就是我们的大脑硬往上抬。至于一直发展视觉的恐龙后裔——鸟类一般是四色视觉。
1676358192,0,0,False,False,设置/其他设置/主观与解读/自动解读脑补（选择关闭），这样就不会被你的大脑骗了，你学会了吗[doge]
1676361561,0,0,False,False,真一样，你们像我这样涂一下
1676368027,0,0,False,False,不一样，有一点区别。上面黑一点，
1676380811,0,0,False,False,挡住也不一样
1676382090,0,0,False,False,一个暗物质亮面一个亮物质暗面颜色一样很稀奇么
1676366935,0,0,False,False,不过是坐忘道的小把戏而已😓😓😓
1676384223,0,0,False,False,耶稣来了都不一样，我说的
1676393743,0,0,False,False,我挡住了，怎么还是不一样
1676361159,0,0,False,False,把下面的白色和上面的深色都挡住，颜色就一样了。只挡一块颜色会变，但是还是有区别。
1676360814,0,0,False,False,说不一样的才是眼睛有问题吧[妙啊][笑哭]
1676390080,0,0,False,False,明显上面深一点
1676213788,2,6,False,False,我挡住了也不一样呀
1676361880,0,0,False,False,用手捂住就一样了
1676361704,0,0,False,False,但问题是我看到上面的更暗[吃瓜]
1676391438,0,0,False,False,今天就是天王老子来了，这两个颜色也不一样[微笑]
1676362884,0,0,False,False,感觉下面那个浅一点
1676296319,0,8,False,False,"我发布了一篇笔记，快来看看吧
A面的上半面是一个渐变色，下半面和b面一个色
https://www.bilibili.com/h5/note-app/view?cvid=21808154&pagefrom=comment&richtext=true"
1676367443,0,0,False,False,为啥我没把b看成灰色？
1676213414,2,2,False,False,遮住白线B也和A有色差啊 有没有大佬看得出颜色代码[doge]
1676215741,0,4,False,False,[doge][doge][doge]
1676224529,1,3,False,False,挡住的一瞬间下面和上面的颜色有点不一样，上面深灰色下面浅灰色，然后再过一会两个就一样了很神奇
1676371597,0,0,False,False,我不管，就是白色，我大脑告诉我，就算天王老子来了，也是白色[傲娇]
1676296795,0,1,False,False,把背景和中间过渡的处理掉颜色就是完全一样啊，哪有什么深浅
1676383293,0,0,False,False,你特么遮一下我看看？
1676213469,0,2,False,False,截图裁剪了，确实一样哦
1676396114,0,0,False,False,罕见的解说
1676344583,2,1,False,False,你遮挡之后B的颜色变了不就可以说明问题了吗？为什么要吵到底AB颜色是不是一样的，不是又怎么样呢？你挡住之后B颜色变得趋近于A也能说明问题了好吗？
1676366328,0,0,False,False,那么为啥不用实际物体
1676372779,0,0,False,False,记得撒贝宁讲过这个
1676381347,0,0,False,False,还真是一样的
1676361826,0,0,False,False,如果我没有常识呢[doge]
1676360881,0,0,False,False,中间一样不代表一个图上有黑色一个图上有白色啊[笑哭][笑哭][笑哭]中间确实都是灰面，但是本质上一个黑色块一个白色块，侧面打光那块能看出来
1676361653,1,0,False,False,我的为啥上面要深点
1676363904,0,0,False,False,好像确实一样
1676377291,0,0,False,False,遮住中间倒着看
1676365903,0,0,False,False,打死我这两个颜色也不一样
1676311825,0,5,False,False,这玩意，难道不是因为，两边颜色一样，然后越往中间交界的地方，颜色就差别被调大了吗，我看着A区上下颜色深浅都不一样，B区上下部分深浅也不一样[思考]
1676286864,0,2,False,False,a和b颜色是一样的，但是分界处的颜色是不一样的，上面的a到分界处由灰转黑下面的b从分界处由白转灰，所以你会感觉颜色不一样而遮住分界后颜色一样，因为颜色不一样的不是上下，而是被你遮住的那一小块分界区域，你如果反过来把上半部分和下半部分遮住，只留下分界处周围能看到，那就能感觉到颜色十分明显的不同。
1676289720,5,9,False,False,不一样哦，这种类似的都是伪科普，为了效果更明显所以确实是有颜色区别的，不信可以用取色软件尝试，如果颜色一样人眼还是可以识别出来的，你之所以看到不一样，那就确实是不一样的，只不过差别很小而已。类似的实例还有环境闪光球移动的例子，实际确实有几个像素点的移动
1676391984,0,0,False,False,上面偏棕灰色 下面偏冷灰色
1676319614,2,4,False,False,确实是一样的兄弟们，我总吸管工具分别提取两个方块的中心颜色，画出来都是一个色
1676312548,1,5,False,False,这图其实很有争议，你如果把它看成二维图那么ab两部分都是灰色毫无疑问，但是如果你把它看成三维图那么a就是深灰色b就是白色其中的渐变只是阴影
1676378140,0,0,False,False,我的大脑明明是我的大脑，为啥不问问我就自作主张把他认成白色了，这脑子还能要吗
1676314784,1,1,False,False,有一瞬间我甚至觉得下面颜色更深，为什么每次这种视错觉图片底下都有人要嘴硬说颜色不一样呢，用软件取色不就知道了，要是一下被你看出来了还叫视错觉吗[喜极而泣]
1676283440,2,1,False,False,那如果是一个没有常识的婴儿眼中看起来什么样子的?人家的大脑会脑补成和我们一样吗？
1676382129,0,0,False,False,预装了程序。
1676384704,0,0,False,False,原来真的是我的脑子多想了[脱单doge]
1676340947,0,3,False,False,再次证明网络上发泄情绪和理性思考的需求占比五五开
1676313179,0,2,False,False,大胆竟敢自作主张[妙啊]
1676312135,0,0,False,False,这张图片本身就是假的，有什么好猜的。再说了，现实世界中就没有颜色这一属性，认可的物体的颜色也是定义在太阳光或者说白光的照射下物体反射出来的光在人眼的颜色，所以谈论颜色不得不考虑，光源、入射介质、反射物、反射介质、接收器
1676358555,0,4,False,False,确实是一样的颜色，但是在摄影和绘画中，它表达的物体颜色的信息是不一样的。一个是物体亮面，一个是物体暗面。我想说的是，和不同颜色搭配，一个颜色能表达不同的讯息
1676341827,2,2,False,False,挡一下就能看出一样的，说不一样的只能说大脑太好骗，逃避事实，往往最接受不了新东西
1676317782,6,3,False,False,一样个鬼。摊牌了，我学美术的，一眼看出色差。结束。辨别出素描关系黑白灰一点点的微差对于学美术的朋友应该不难吧[脱单doge]
1676311181,0,1,False,False,那是因为这俩东西你脑子告诉你它是立体的方块，如果一开始问你AB区域俩平面颜色是不是一样的，色感好的人仔细一看就会发现是一样的。
1676328692,1,0,False,False,啊…可是遮住之后我还是觉得A面更暗啊…
1676312622,3,5,False,False,天王老子来了也没用，就是不同颜色，下面就是亮一些[傲娇]
1676232232,0,10,False,False,"web取色器取过了，上下中间确实是一样的，别争了，颜色代码：
#FF7B7B7D
rgb(123,123,125)"
1676311737,0,0,False,False,"ab的颜色都是H:240  S:2  V:49 是相同的一个稍微偏冷的灰色 。有人遮住了中间还是觉得颜色不一样 . 首先上面背景蓝色对比下面背景的颜色较浅 所以a看起来要比b深
然后 上面的背景是个冷色 a较于背景是暖色 看起来会感觉偏暖。下面的背景色整体来说是偏暖的 与b对比会显得b偏冷。虽然ab是相同的颜色但与不同的颜色的对比，你的感觉也会不同。"
1676357138,2,0,False,False,不准确，是因为白色暗部周围的颜色更深，对比显得亮，黑色亮部周围颜色鲜亮，对比显得黑。这就是为什么学美术的时候所有老师都会和学生说要整体观察，要观察事物之间的关系，辩证的看问题。相同的情况还会出现在冷暖，纯灰，强弱，长短，粗细等上。说白了就是对比
1676279713,4,0,False,False,只因毛一样的[歪嘴]，上面颜色更深，如果实在其他地方比如纸上效果可能就不一样了
1676358769,0,2,False,False,主要是人类的眼睛构造太反直觉了，在进化之初就出了大问题，导致人类在观察外界时不得不依靠大脑强大的脑补能力，这个脑补能力对人类而言是绝对的好事，至于视觉错觉这个确实很难避免，毕竟如果没有脑补，你连外界是啥样子都看不清
1676280068,1,0,False,False,一样的。。。你们把上下方块继续全部挡住只留一点，就会发现是一样的
1676301020,0,4,False,False,"使用画世界Pro对比两颜色
A面
H：240
S：2
V：49

B面
H：240
S：2
V：49"
1676289633,8,5,False,False,学美术的应该都看的出来A和B根本就不一样吧[思考]
1676326263,0,0,False,False,其实在你得出了这两个面颜色一样的结论之后，再看的话哪怕你不遮住也会发现差不多了
1676311967,3,2,False,False,这图不符合逻辑，既然B的光照区这么亮那么A的光照区怎么不亮呢？
1676358807,0,0,False,False,继那件蓝灰还是白金的连衣裙之后又出现了一场关于颜色的争论
1676329953,0,0,False,False,用手指把A一圈都遮住，把B白光部分遮住，把背景都遮住，这样才发现一样。
1676354954,1,5,False,False,A面的灰色是作为固有色，而B面的灰色是作为阴影色，跟背景没什么关系[微笑]
1676292578,0,0,False,False,所以你知道苹果摄像头为啥牛逼了吧，因为虽然我近视➕散光。但是我脑补能力强！
1676395244,0,0,False,False,挡了，还是不一样
1676379459,0,0,False,False,a要比b灰
1676317727,3,3,False,False,可是确实上面的更亮啊[喜极而泣][喜极而泣][喜极而泣]
