上传时间,回复数,点赞数,up是否回复,up是否点赞,评论文本
1676376010,0,0,False,False,不知道季不助会不会回，想问问过三四个月可能去多伦多到时候影响大不大[灵魂出窍][灵魂出窍]看到这个新闻的时候人都傻了
1676446573,0,0,False,False,人在克利夫兰，已经变👽了
1676444114,0,0,False,False,绝地求生：大逃杀，刷毒了[滑稽]
1676390333,0,0,False,False,省流：没飞鸽[doge]
1676377314,0,0,False,False,预言一下，这像个争端的发展口子[吃瓜]
1676417025,1,0,False,False,毒圈加枪战 好熟悉[呲牙][呲牙]
1676436809,0,0,False,False,美国正当盛世，放点毒气又何妨？[脱单doge]
1676420881,0,0,False,False,原来气象气球是真的[笑哭]感谢党和国家
1676429910,0,0,False,False,我想提问的是有没有俄亥俄州的朋友3号火车出事故就收到预警的呢？这么大的事情媒体不报道就够离谱了，如果没有当地消防局或者啥的通告那岂不是太魔幻了。
1676421328,0,0,False,False,人类最大的敌人不是别人，就是人类自己
1676380886,0,0,False,False,但是它们是自由的[doge][doge]
1676435877,0,0,False,False,何止是香甜？简直吸一口升天吸两口成仙啊
1676382169,0,0,False,False,漂亮国的空气确实很香甜[doge]
1676375772,0,0,False,False,靠外星人来掩盖化学品泄露
1676424797,0,0,False,False,"原来在美国啊？？？,还好我离美国内陆蛮远的[辣眼睛]"
1676376471,2,0,False,False,XHS曾经说过，最好的方法就是燃烧。
1676375227,0,0,False,False,感觉这一把火要是做个分析研究，保不准出几个诺贝尔奖
1676427557,0,0,False,False,我好像申请了个学校，就在俄亥俄[tv_思考]
1676423617,0,0,False,False,是这样的，我建议大家去苏联都好，千万不要来美国[喜极而泣][捂脸]
1676374283,0,0,False,False,要不要顺便说下可不可能对别的国家造成什么影响
1676376795,0,0,False,False,这种等级的事故能压十天热搜，还得是霉国
1676375184,0,0,False,False,御…御坂表示大受震撼，do，御坂如…如此吃惊的說道
1676376328,0,0,False,False,外国空气没想到真是香甜的[委屈]
1676433975,2,0,False,False,比起美国，我更关心我们国家的环境会不会受到影响
1676436269,0,0,False,False,这届高考生悲伤了[doge]
1676382312,0,0,False,False,《But dranking water is safe》
1676396603,0,0,False,False,这。。。这算报应吗？[捂脸]
1676374336,0,0,False,False,省流：整个晋西北乱成一锅粥[doge]
1676374823,0,0,False,False,"如果只是氯化氢的话，水还能喝
但是加上各种不完全燃烧产物，，，
还是给自己来一枪吧[doge]"
1676374495,0,0,False,False,woc我以为季不助凉了咋才这么点儿赞，感慨了半天结果一看时间十分钟前，原来是我来早了啊，那没事了
1676375938,0,0,False,False,[吃瓜]我们大美利坚的空气就是好！充满了香甜的滋味！
1676430299,0,0,False,False,能不在搞这个了吗？污染会扩散，每个地方泄露一点，地球你可跑不掉啊
1676374405,0,0,False,False,何止空气是香甜的，在美国有些地方，直到现在都有麦芽般的甜味[doge]
1676421640,0,0,False,False,这下橙剂撒到美国本土了捏[妙啊]
1676374266,0,0,False,False,"雷切尔·卡森目前的表情：
[辣眼睛][热][灵魂出窍]"
1676400869,0,0,False,False,你相信命运嘛[吃瓜]，相信就别跑，不然就和电影《死神来了》一样，直接变成大逃杀，不信就更不用跑了，命运都拿捏不了你你还怕死？
1676377687,0,0,False,False,米果人：[热词系列_我故意的][热词系列_肥肠自信]
1676375567,0,0,False,False,外星人:你家有毒，勿cue
1676374446,0,0,False,False,看某某群聊，说一百公里外的牛和蛙已经开始犯病了。我个人觉得，润出三百公里可能保险一点
1676397091,0,0,False,False,人类清除计划——阿美
1676374515,0,0,False,False,昨天看这个新闻还知道有人主动去烧氯乙烯的时候我已经买防毒面具了
1676374311,0,0,False,False,省流:能润则润！
1676374398,0,0,False,False,光气还好了，呼吸道防护就好，要是来个vx那才是要命[doge]
1676374304,0,0,False,False,原来辐射五是免费游戏
1676374536,0,0,False,False,自由的国度就是好，连空气都是甜的[doge]
1676377162,0,0,False,False,破案啦，火车时被导弹炸的（乱讲的）
1676428547,1,0,False,False,美国佬处理的那么好应该不会影响到平流层吧[脱单doge]
1676436652,0,0,False,False,致命弯道npc生长环境已建立
1676377247,0,0,False,False,耗叠而入[doge][doge][doge]
1676430537,1,0,False,False,我离了300公里...有危险吗？[囧]
1676374305,0,0,False,False,好家伙，搁这元素反应打满了[doge]
1676443837,0,1,False,False,我怎么感觉丢个氢弹下去都比这强一万倍啊！
1676374613,0,0,False,False,给那姐们道个歉，我错了，美国的空气果然是香甜的[热词系列_标准结局]
1676422671,0,0,False,False,我赛诺，妮露，草神，香菱一队都没这个会打反应
1676374090,0,1,False,False,刚好第50赞，[星星眼]好耶
1676379198,0,0,False,False,省流：跑就完了[吃瓜]
1676374379,3,0,False,False,这个气体。。它会飘到别的国家吗。。比如中国？
1676387417,3,0,False,False,空气净化器能稍微起点作用么[撇嘴]我的朋友在100公里以内，但是学校不放假
1676394584,0,0,False,False,高浓度橙剂，越南都乐了[doge]
1676390982,0,0,False,False,漏出来问题还不算太大 烧了麻烦就大了
1676375123,1,0,False,False,推荐借鉴毛子给福岛提的建议，给一发核弹，哪有什么不充分燃烧造成的问题
1676374929,0,0,False,False,来自阿美丽卡原生态的化学制剂[doge]
1676436040,0,0,False,False,诶，咱们的N95是不是可以高价卖给漂亮国嘞，清理一下库存
1676435505,0,0,False,False,美利坚帝国晚期突发生化事件
1676417264,0,0,False,False,我怎么觉得你有点幸灾乐祸呢？这样不好！下次请加大力度！[滑稽][滑稽][滑稽][滑稽]
1676434997,0,0,False,False,霓虹：不愧是欧豆桑[doge]
1676433165,0,0,False,False,切尔诺贝利 人称 小俄亥俄州
1676435361,0,0,False,False,橙剂最后又回到了霉戾奸[脱单doge]
1676427737,0,0,False,False,点火点的非常快，可能有更恐怖的物质泄露
1676374474,1,0,False,False,唉，人类今年真是多灾多难，希望当地居民不要有长期的健康问题…
1676374941,0,0,False,False,原来大核正统在美丽卡[微笑]
1676435371,0,0,False,False,需要一颗聚变弹帮助完全燃烧[doge]
1676428458,0,0,False,False,希望Erie湖能把毒气多吸收点[奥比岛_委屈][奥比岛_委屈][奥比岛_委屈]
1676374679,0,0,False,False,谁让你谈论这个的，快去看看气球🎈
1676426940,0,0,False,False,得看到蓝天，鲜花花满枝头，才能回去！
1676431562,0,0,False,False,还有九节泄露的车厢不知道装的啥呢[吃瓜]
1676378349,0,0,False,False,俄亥俄净化区（雾）
1676400572,0,0,False,False,美国甜个鸟啊？还得看我们叶子国[呲牙]，北边冻土的清香，南边叶子的气息[呲牙]
1676419727,0,1,False,False,[滑稽]
1676414603,0,0,False,False,都这样了，怎么没人劝他们反思呢
1676403348,0,0,False,False,学化学的看到这个直接收拾收拾准备进土了[OK][doge]
1676374486,0,0,False,False,霉国的空气不是一直都是“香甜”的吗？
1676376116,0,0,False,False,叠地狱buff了属于是[doge]
1676435270,0,0,False,False,这效果估计不亚于切尔诺贝利的毒性
1676376228,0,0,False,False,最近才问的话，已经10多天跑也没用了吧
1676426039,0,0,False,False,越共英魂 从地狱趴终于杀回来了
1676423440,0,0,False,False,感觉美国正在蒸蒸日上啊[doge]
1676374444,0,0,False,False,原来这就是美好香甜的空气啊[doge]
1676381670,0,0,False,False,阿妹你看，上帝压狗
1676374994,0,0,False,False,这混合物质堪比科技与狠活啊[吃瓜]
1676438197,0,0,False,False,我们不禁要问[doge]
1676379135,0,0,False,False,美国的那个发言人是智子吧！也是降临派的？
1676425645,0,0,False,False,看这期视频有一种我在上课的错觉[灵魂出窍]
1676385671,0,0,False,False,"环保少女呢？
出来谴责一下！"
1676377133,0,0,False,False,米国和韩国在一些事情上没有让我失望过
1676421825,0,0,False,False,原来杨大漂亮是个预言家[吃瓜]
1676427664,0,0,False,False,今年高考会不会考这个[藏狐][藏狐]
1676374441,2,0,False,False,我自己烧塑料袋产生的刺激性气味，是不是跟这个差不多？
1676374275,0,0,False,False,老哥没有新闻资质不要乱发这些内容，很容易被人针对的。
1676378871,0,0,False,False,马上缩圈了，赶紧跑毒吧
1676442486,0,0,False,False,我这二十多年还没见过酸雨，知道这东西还是在初中课本
1676378875,0,0,False,False,哈哈哈哈这是他们阴的的哈哈哈哈
1676433862,0,0,False,False,完蛋了，死亡搁浅要来了
1676387785,0,0,False,False,没有人员伤亡 估计热度不会太大 再压一压就忘得差不多了
1676380452,0,0,False,False,所以美国的产品还能不能使用呢 美国品牌的宠物食品也会有影响吗[tv_抓狂]
1676380598,0,0,False,False,自由国香甜的空气是谁说的，预言家呀！
1676434283,0,0,False,False,今年化学新高考，没这个题我不看[妙啊]
1676374135,0,1,False,False,不知道发啥[doge]
1676435713,0,0,False,False,都是假的，外国怎么可能会这样，我不信[给心心][给心心]
1676421983,0,0,False,False,出事的时候是被压下去了吗？还是我消息慢。我前两天才知道这个事情
1676426943,0,0,False,False,泻药，人在米国，刚下飞机
1676376063,0,0,False,False,日美不愧是一家人[doge]
1676375969,0,0,False,False,希望那边人没事，尽量减少伤亡吧
1676401188,0,0,False,False,这下真成镁锂锏了[吃瓜]
1676422155,0,0,False,False,没法子了，只能让环保少女出手了
1676374293,0,0,False,False,一氧化碳、氯化氢、光气 啥都来了
1676378162,0,0,False,False,我想知道地下水会不会污染会不会循环到世界各地[来古-疑问]
1676446209,0,0,False,False,这期节目显得有些过于开心了[doge]
1676393378,0,0,False,False,人类清除计划开始
1676410732,0,0,False,False,老美这十万加仑是液体啊   挥发扩散不得了
1676389921,0,0,False,False,什么美国版的切尔诺贝利，明明是美国版的福岛好吧。
1676383064,0,0,False,False,这下only in Ohio了
1676409652,0,0,False,False,原来阿美也这样啊，我也是第一次知道
1676434352,2,0,False,False,我在其他评论里看到说是20节车厢，但是报道说的是5节，这是真的假的啊
1676375151,0,0,False,False,辐射2023[doge]
1676375096,0,0,False,False,应该把辛鸡飞送过去
1676435633,0,0,False,False,only in ohio 还成真了
1676378565,0,1,False,False,以前我会骂，现在👴撅醒了[脱单doge]
1676411530,0,0,False,False,我终于知道我买的试剂为什么这么久没到了[辣眼睛]
1676374103,0,1,False,False,到我了到我了，热乎的[脱单doge]
1676425491,0,0,False,False,我朋友已经润回来了，昨天就开始找我打游戏了
1676375607,0,0,False,False,不会霉国又要整什么活吧
1676375568,0,0,False,False,这下真成科技与狠活了[doge]
1676374148,0,1,False,False,两分钟，烫嘴
1676388245,0,0,False,False,美式死亡自由
1676448039,0,0,False,False,这次空气真的香甜了[脱单doge]
1676429795,0,0,False,False,"讽刺的很，全西方的""环保家""们都闭嘴了[微笑]"
1676434799,0,0,False,False,[doge]俄亥俄是不是改改名了？核亥核比较贴切
1676435509,0,0,False,False,这是想造第二个宇宙出来是吧
1676391123,1,0,False,False,如果在附近引爆一颗小型核弹，能不能处理掉所有的有害物质？
1676374295,0,0,False,False,我先来 给大家添麻烦了[doge]
1676389784,0,0,False,False,正好借楼推一下波士顿圆脸，今天也出视频讲解了，推荐大家收看
1676375043,0,0,False,False,没关系，就当是我点的[傲娇]
1676422387,0,0,False,False,美国日本不愧是父子关系
1676432236,0,0,False,False,这还让人直接回去住实在是6[辣眼睛]
1676374807,0,0,False,False,我就说美国空气香甜吧[doge]
1676426375,0,0,False,False,美国政府这种处理方法是最优解
1676420139,0,0,False,False,Only in Ohio💀
1676378334,0,0,False,False,UP可以讲一下博帕尔事故，感觉这就是新时代的博帕尔
1676374127,0,1,False,False,好巧[星星眼][星星眼][星星眼][星星眼]
1676439102,0,0,False,False,哎，后果不是马上展现的，致癌几率大大提升
1676426217,0,0,False,False,乙烯一克一克（悲）
1676409933,0,0,False,False,这才叫环保
1676412448,0,0,False,False,3分39秒的视频至少2分半我在其他视频看到过，那些化学成分，毒性危害啥的[灵魂出窍]千篇一律
1676374266,0,0,False,False,自由的香气！多是一件美逝啊[doge]
1676374588,0,0,False,False,这下真是香甜空气了[星星眼]
1676436227,0,0,False,False,only in Ohio💀💀💀
1676449617,0,0,False,False,哈哈哈！三个球球也没掩饰住！☁
1676375980,0,0,False,False,辛叫兽不来解读一下？
1676425512,0,0,False,False,美国空气真的是甜的啊[吃瓜]
1676433230,0,0,False,False,你看吧，我就知道美国的空气是香甜的
1676389300,0,0,False,False,FBI警告，CIA暗杀警告，根本没有这件事！美利坚正腐表示：根本没有这个事[滑稽][滑稽]
1676423910,7,0,False,False,张家口泄露的比俄亥俄州多多了，也没见张家口变无人区啊
