上传时间,回复数,点赞数,up是否回复,up是否点赞,评论文本
1676391836,263,7928,False,False,"地狱笑话之我妈给我打电话：
“俄亥俄州在你们的哪边啊”
“哈哈我们隔壁”[Cat2_Boom!]"
1676443721,11,754,False,False,我现在总算能听懂之前美国的一个黑人脱口秀演员说的是什么意思了。“他们如果告诉我这个疫苗是免费的，我说滚我才不打呢。他们如果是这个疫苗是2000美金的，那我觉得that's ok。我虽然不懂疫苗，但我懂历史，历史告诉我，有用的东西就一定要花钱”
1676425394,28,1811,False,False,动保和环保组织 又又又又一次的集体失声了[滑稽]
1676424117,52,1216,False,False,我回忆下啊，曾经有个不可一世的强大帝国，经历了：1，阿富汗撤军。2，污染全球的重大环境污染。3，没多久就解体了。[tv_doge]
1676374176,122,5214,False,False,"好消息:不用润
坏消息:已经扩散到了，这是好几天前的事。"
1676374546,37,3896,False,False,白宫发言人又提外星人了，我才意识到问题的严重性
1676421972,41,829,False,False,"我发布了一篇笔记，快来看看吧
老实说，这些说起来好像问题很大，其实只不过闹一阵就会平息下去。

真正奇怪的是这几年西方经济体的火车脱轨事故多得有点诡异。

前几天其实休斯顿也发生了一次...
https://www.bilibili.com/h5/note-app/view?cvid=21833981&pagefrom=comment&richtext=true"
1676386979,39,1418,False,False,按照美国那个尿性，当地居民想要赔偿短时间是不可能要到的。大概率是拖个十几年然后当时的总统开个发言会说找到了有关赔偿的文件，然后白宫接见几个受害者代表，象征性的给活着的人赔个几万刀就完了。
1676374130,45,2483,False,False,之前有了枪，这下又有了毒圈，现实版大逃杀了属于是[吃瓜]
1676377069,49,1469,False,False,泻药，刚要去那边读研。现在麻了，准备借着这个事找学校多要点奖学金，说不多给就不去了。
1676388102,23,565,False,False,"我发布了一篇笔记，快来看看吧
这不喝一口，我是不认可的。

我不禁要问：隔壁小日子的福岛官员都敢喝，你们差哪了？
https://www.bilibili.com/h5/note-app/view?cvid=21831120&pagefrom=comment&richtext=true"
1676377652,12,685,False,False,"抢物资
拼枪
跑毒
啊，我素未谋面的故乡啊。
我好像在哪里玩过。"
1676424327,100,3783,False,False,"复制大佬，防止被带节奏

有奇葩人士，说张家口那次泄露氯乙烯2046立方，换算成加仑，就是54万加仑，美国俄亥俄这次才10万加仑
他们故意混了，或者隐去了一个事实，就是张家口那次泄露的是气体，而俄亥俄这次泄露的是液体。
氯乙烯的气体密度是2.77公斤每立方米，液体密度是903公斤每立方米。
2046立方米氯乙烯气体换算成质量，是5.6吨
10万加仑氯乙烯液体换算成质量，是378吨。
张家口泄露的氯乙烯连美国的零头都不到。

2018年张家口CH2CHCl的理论泄漏量是2046标立，注意是标立。（22.5米直径的气柜浮头下降了5米算得）。俄亥俄本次总量10万加仑约370立方米，注意是液体。约330吨，再折成标立大约120000标立。（液体密度0.9，气体密度2.7）。
不要碰瓷切尔诺贝利。
论处理，切尔诺比利事件里苏联是举全国之力，领导带头，群众参与，付出了惨痛代价把损失压缩到最小。而且发生的原因是实验中的偶然事故，不是火车大量运输危险化学品+削减监管这种必然导致事故的原因。
论危害，切尔诺贝利的危害被成功的救援限制在了一定范围内，甚至完成抢修之后，未损坏的机组还在长期发电。
氯乙烯本身就是一级致癌物，不容易分解，渗入地下水会污染水源（五大湖就在旁边），叠加不完全燃烧的二噁英四处飘散，危害可以参考越战时期的橙剂（主要成分相类似）。"
1676431692,12,216,False,False,环保少女在哪里啊？国外环保组织在哪里啊？都在哪里啊？怎么集体当哑巴了啊？[脱单doge][脱单doge]
1676438730,4,122,False,False,集美们，这个氯乙烯真的是绝绝子，我直接暴风吸入
1676434306,4,142,False,False,比新冠好的一点就是，这个蛊它大概率不会进化[doge]
1676427816,140,2433,False,False,什么叫高合法性神国啊
1676374478,17,821,False,False,所以那个杨舒平说的是真的，我们误解她了[doge]
1676434108,2,76,False,False,这么说吧，我cf玩生化模式都没这列火车烧出来的东西毒性大，这些玩意吸进去了高低都得变成母体
1676436660,5,53,False,False,[偷笑]环保，动保呢！快@柴静再拍个《穹顶之下》它现在在美国的[抠鼻]
1676374651,32,512,False,False,难怪国内外媒体报道最近到处都是不明飞行物呢
1676437583,0,10,False,False,两个点要注意，一是快速检索中国俄罗斯伊朗等国的类似事件，同时注意换算，使用尽可能相似的数量级单位。二是快速放出大量“辟谣号”，以“先造谣再辟谣”的方式将流出的图片和视频与各类谣言共同处理，以实现把真相打成谣言的目的。
1676380308,53,464,False,False,86年切尔诺贝利，91年俄成了现在的俄，，5年后的美利坚会？
1676375165,2,592,False,False,美国的空气是香甜的（氯乙烯）[喜欢]有着世纪美称的好东西（二噁英）[喜欢]还有全世界最强大的军事实力（导弹打气球）[喜欢]
1676431773,2,45,False,False,马上小号毒气言论即将到达战场，请吃瓜群众备好瓜子，且看水军连夜加班的成果[doge]
1676386283,24,198,False,False,正规操作是密闭加压1200度以上，不滿足条件主产就是二恶英加光气加氯化氰，约等于生化武器大礼包
1676438591,1,25,False,False,"橙剂都没二噁英毒 二噁英要稀释一千倍左右才能做橙剂的主材料之一
－来自大佬科普复制"
1676375293,5,194,False,False,"俄亥俄氯乙烯泄露，大量动物死亡 
NPR：没事的，很安全，让我们镜头来关注导弹打气球[doge][doge]"
1676402044,6,90,False,False,"“正在发射铝热剂手雷”
“击碎了敌方护盾”
“我是新的击杀王”
[doge]"
1676386642,20,1219,True,False,"我发布了一篇笔记，快来看看吧
死神的骷髅头哎
https://www.bilibili.com/h5/note-app/view?cvid=21830717&pagefrom=comment&richtext=true"
1676375428,4,320,False,False,"火车刚刚出轨，有毒物刚刚泄露时
美国：赶紧的把中国气球打下来，转移视线，让那些记者闭上他们的臭嘴！
自己国内瞒不住了时
美国：有外星人…"
1676384427,5,53,False,False,中国铁路还有很多方面要像美国学习，没有任何理由说铁路不能全面转向市场化运营[doge]
1676376171,4,59,False,False,日本和美国为什么是父子啊[脱单doge]
1676382111,2,45,False,False,这一波是打算靠生物变异取得优势吗？[吓]
1676421530,11,44,False,False,张家口还能和这个比？张家口吸附了充分燃烧再光解，能有多少问题。量也比不上这次的零头。泄露是天灾，这种水平的处理就是人祸了[喜极而泣]
1676375286,1,119,False,False,"全世界：为了逼登的父母着想，是故意的，还是不小心？
霉国：是故意的（骄傲）
[doge][doge][doge]"
1676433870,0,6,False,False,加州应该是不用跑毒了orz 这几天把东部附近几个朋友都问候了一边，都没啥问题。虽然但是，我还是希望所有人都能平安无事最好。
1676379309,1,59,False,False,可能莓果人觉得最近的游改美剧《美国末日》拍的不够真实，想搞个真实点的[嗑瓜子][嗑瓜子][嗑瓜子]
1676386749,10,204,False,False,劝居民回去是想生物过滤吗？不愧是美国真高级[doge]
1676422510,5,16,False,False,正在担心我在附近上学的中国（留学加拿大）学生[笑哭][笑哭]他都开始准备后事了[微笑][微笑]
1676374324,25,93,False,False,好像听李三金说俄亥俄州是生产农作物的，还会出口到中国[撇嘴]
1676410173,1,6,False,False,头一次觉得门外的沙漠真好看，希望不会飘来美西[笑哭]
1676425215,0,9,False,False,[doge]美国火车脱轨，那是美国的火车崇尚自由民主，不接受固定轨道的束缚。这是普世之光！民主自由的典范！
1676417755,0,24,False,False,自由！
1676441151,2,3,False,False,我们这边上段时间大火，把塑料厂给烧掉了[笑哭]新闻都没有报道，总觉得空气甜甜的。足足三天整个镇子在阴霾之下[妙啊]
1676374081,5,93,False,False,没逝的，很安全[doge]
1676374782,9,152,False,False,永远不要幻想资本主义国家会在乎人民的死活
1676374436,1,41,False,False,气球事大，毒气泄露事小[doge]
1676404483,0,18,False,False,"转载——b站用户读书是个好习惯
有奇葩人士，说张家口那次泄露氯乙烯2046立方，换算成加仑，就是54万加仑，美国俄亥俄这次才10万加仑
他们故意混了，或者隐去了一个事实，就是张家口那次泄露的是气体，而俄亥俄这次泄露的是液体。
氯乙烯的气体密度是2.77公斤每立方米，液体密度是903公斤每立方米。
2046立方米氯乙烯气体换算成质量，是5.6吨
10万加仑氯乙烯液体换算成质量，是378吨。
张家口泄露的氯乙烯连美国的零头都不到。

2018年张家口CH2CHCl的理论泄漏量是2046标立，注意是标立。（22.5米直径的气柜浮头下降了5米算得）。俄亥俄本次总量10万加仑约370立方米，注意是液体。约330吨，再折成标立大约120000标立。（液体密度0.9，气体密度2.7）。"
1676376720,40,37,False,False,求波科普啊，我今天专门搜索了2022.11.1之前的新闻，那时候报道氯乙烯也提到过张家口事件，其中确实有说过废弃后应使用焚烧法处理，那为什么阿美这波操作这么严重呢
1676430475,0,6,False,False,那个时候的美国在关注中国的“气象”气球，怪不得美国那么紧张，一直想要击落，不得不说，中国有两下，美国也有两下[思考][doge][doge]
1676438148,0,4,False,False,我怕不是能在有生之年把元素周期表前几行全看到[辣眼睛][辣眼睛][辣眼睛]
1676381204,1,86,False,False,不愧是日本的亲爹，出了事用的托词都是一样一样的[抠鼻]
1676413647,0,4,False,False,这地方到纽约直线也就不到400mile [doge]而且这地方叫东巴勒斯坦，我和我爸说的时候他还问我去以色列干嘛
1676420512,1,2,False,False,即使是🇺🇸街头最落魄的乞丐，闻到阿美莉卡天空飘荡的香甜的空气，也会不自觉骄傲的挺起胸膛[调皮]
1676374091,16,25,False,False,据说老美那里一点点浪花都没有的
1676374797,1,105,False,False,毒圈+枪支=现实版吃鸡
1676380381,0,18,False,False,这才是真正的科技与狠活啊
1676382094,0,2,False,False,"还  在  玩  传  统  吃  鸡  ？
毒  圈  yes
遍  地  是  枪 yes
快来美国体验现实版吃鸡[OK][OK][OK]"
1676422165,0,24,False,False,"有奇葩人士，说张家口那次泄露氯乙烯2046立方，换算成加仑，就是54万加仑，美国俄亥俄这次才10万加仑
他们故意混了，或者隐去了一个事实，就是张家口那次泄露的是气体，而俄亥俄这次泄露的是液体。
氯乙烯的气体密度是2.77公斤每立方米，液体密度是903公斤每立方米。
2046立方米氯乙烯气体换算成质量，是5.6吨
10万加仑氯乙烯液体换算成质量，是378吨。
张家口泄露的氯乙烯连美国的零头都不到。

2018年张家口CH2CHCl的理论泄漏量是2046标立，注意是标立。（22.5米直径的气柜浮头下降了5米算得）。俄亥俄本次总量10万加仑约370立方米，注意是液体。约330吨，再折成标立大约120000标立。（液体密度0.9，气体密度2.7）。（刚刚热评是这个，不知道是谁删了）"
1676378404,10,6,True,False,up主可以鉴定我老家的民俗——穿令。虽然原理可能知道的七七八八。但现在还是没有正式的解释。
1676374380,0,14,False,False,这下真人大逃杀了[阿库娅_不关我事]
1676376609,3,42,False,False,这都是科技与横祸哥们[大笑]
1676374152,4,17,False,False,看看远处的波士顿吧
1676418370,12,6,False,False,俄亥俄留守人员报道
1676374100,3,13,False,False,乐，生化危机前兆[笑哭]
1676382799,1,4,False,False,"几十年前就有过类似的情况，还拍成了电影《危情时速》那次是解决了，少有的火车灾难片

老美这次出事，完全不意外
封锁消息不奇怪，但后面没有及时处理，得，载入史册吧"
1676374170,5,50,False,False,降解个几十年“就”降解了[doge]
1676422211,0,10,False,False,好多五十万啊，这评论马上没了[嗑瓜子]
1676374395,0,11,False,False,真·香甜的空气[doge]
1676430171,4,2,False,False,非我国事，何烦其忧
1676389252,7,7,False,False,姐姐陪姐夫在那边工作[藏狐]一问才知道离俄洲不远，关键是姐姐去年年底刚怀孕[藏狐]你妈的美帝是真tmd不当人[藏狐]
1676374177,0,8,False,False,当地的鱼都噶了https://b23.tv/BV13v4y1x7Zb
1676374224,0,8,False,False,希俄亥俄人民站起来
1676374079,0,7,False,False,美国空气香甜的原因找到了[doge]
1676433630,1,2,False,False,"二恶英是越战之中，美军所使用的著名化学武器橙剂的主要成分，它曾经在越南造成了300万人中毒，100万人受到严重伤害，15万婴儿先天畸形的严重后果。
   现在20节装满毒气的车厢脱轨，大量的氯气以及二恶英正在向周边扩散，二恶英极难自然分解，当它飞入大气之中，会和云混合到一起，变成雨水降落到地面。因此，本次事故覆盖的范围可能会波及俄亥俄州和紧邻的宾夕法尼亚州，至少2000多万美国公民都有可能遭受毒气的不良影响，二恶英是人体无法自行排出，它会诱发人体产生癌变，孕妇出现畸胎或者死胎等情况。
    而令人震惊的是，当事故发生之后，第一，美国当地的政府部门并没有第一时间疏散居民，导致几千名居民受到了毒气的直接影响，大量的动物、植物直接死亡。
   第二，当地政府部门甚至单方面宣称，经过测量，发现水和空气是安全的，并且取消了疏散。
    第三，有多名尝试进入事故现场的记者遭到了当局的殴打，这显然是美国俄亥俄州政府试图欺骗民众，掩盖毒气泄漏的真实情况。
  综上所述，当地居民的人权、记者的自由采访权已然遭到了严重的侵害，这种行为是不可接受的。
   

  （以下纯属虚编） 对于美国政府掩盖真相的行为，中国人权组织已经宣布对此事进行调查，并且批准了一项不具约束力的决议案，宣布俄亥俄州州长犯下了反人类罪，并对其进行相关的制裁。
    考虑到美国是世界上唯一没有加入禁止化学武器公约的国家（真实事情），而本次爆炸所产生的二恶英就是化学武器的主要成分，我们不排除本次事故可能是一场人为制造的化学武器实验行为。  
    根据不愿透露姓名的消息灵通匿名人士提供的证据表明，美国军方正在暗中跟踪毒气，对当地居民产生的影响，以为后续的武器制造提供数据。
    全球反化学武器联盟的高级顾问认为，俄亥俄州州长麦克德瓦恩应该对人体毒气实验承担主要责任，并且考虑到本次毒气泄露事件对大气层的破坏作用，要求美国政府赔偿5000亿美元用于大气层的恢复工作，并且建议冻结美国有关公司的资产。
   如果是发生在国内，妥妥的，最起码的他得是这个节奏，然后，还得找点儿什么NGO组织，出来闹一闹，脱光了出去跑两圈儿，你看节奏不就起来了吗？
  然后，雇个美国的导演拍个纪录片儿，记录一下当地居民的惨状，谁家孩子长得丑，就说他变异了，都是俄亥俄人体实验的牺牲品。"
1676437512,0,1,False,False,"有奇葩人士，说张家口那次泄露氯乙烯2046立方，换算成加仑，就是54万加仑，美国俄亥俄这次才10万加仑
他们故意混了，或者隐去了一个事实，就是张家口那次泄露的是气体，而俄亥俄这次泄露的是液体。
氯乙烯的气体密度是2.77公斤每立方米，液体密度是903公斤每立方米。
2046立方米氯乙烯气体换算成质量，是5.6吨
10万加仑氯乙烯液体换算成质量，是378吨。
张家口泄露的氯乙烯连美国的零头都不到。

2018年张家口CH2CHCl的理论泄漏量是2046标立，注意是标立。（22.5米直径的气柜浮头下降了5米算得）。俄亥俄本次总量10万加仑约370立方米，注意是液体。约330吨，再折成标立大约120000标立。（液体密度0.9，气体密度2.7）。（刚刚热评是这个，不知道是谁删了）"
1676381026,0,5,False,False,"美媒：
好消息：俄亥俄州民众可以自由吸毒了
坏消息：是真的吸毒"
1676374159,1,7,False,False,氯乙烯（橙剂）香甜可口[doge]
1676429853,0,1,False,False,仔细查了下资料，1KG氯乙烯燃烧能释放50g二恶英，这次378吨如果燃烧完能释放18.9吨，越南战争期间美国向越南投放了366kg的橙剂（二恶英）作为化学武器，造成数百万人受影响，出生了几十万先天畸形儿童，这次相当于向自己头上扔了51次越南战争的量
1676380378,1,9,False,False,"纽约人民一边吸着毒，一边闻着二恶英,优雅高尚"
1676448660,0,1,False,False,看其他up主的科普视频说，那个二噁英28克左右就能杀死100万人了[灵魂出窍]越战美军用的橙剂就是二噁英稀释一千倍才能搞到主要材料。所以说这玩意绝绝子，吸入一点点，死亡千千万[吃瓜]
1676439891,0,3,False,False,[偷笑]
1676443354,0,1,False,False,毒圈有了，俄亥俄遍地都是枪，加油，特种兵！
1676449869,0,1,False,False,媒体：我有不报道的自由[doge]
1676441034,0,1,False,False,很喜欢二句话“一把火烧它个精光吧，哈哈哈哈”“此城，于我已无用”[doge]
1676440130,0,1,False,False,日本福岛附近放射性物质超标，美国直接毒气满天飞，我感觉再这样下去人类真会把自己玩死了
1676446183,0,1,False,False,"""氯乙烯不过是大号尾气罢了，经过十天的进化，毒性已经变得非常低了，我们要学会共存。"""
1676389322,1,3,False,False,刚开始是枪战，现在是跑毒。[doge]
1676447102,0,1,False,False,杨舒萍预言成真，她真的，我哭死，
1676438492,0,1,False,False,招工：人工净化工，包吃住，工作时间早八晚五。工作内容是在空旷地做深呼吸。工资面议。
1676427106,0,1,False,False,"哇～绝绝子集美们，美国的香甜空气真特别，舒服到剁jiojio！我直接一整个暴风吸入的大动作！超甜超好吸！
——俄亥俄州"
1676374172,0,5,False,False,原来美国空气真是甜的[喜欢]
1676447464,1,1,False,False,额，我在俄亥俄的Oxford，现在学校没啥反应，该不该润，要不要屯点物资(´･_･`)
1676393949,0,2,False,False,"上联：俄州释放氯乙烯真安全不肯吸一口
下联：福岛倾倒核废水很干净不愿喝两杯
横批：父子同心"
1676374078,1,5,False,False,祝大家早日找到女朋友[doge]
1676421129,0,2,False,False,只能说水已经屯好了
1676436684,0,1,False,False,"已经有美畜牧业散养的拿张家口那次氯乙烯泄露说事了，说张家口那次氯乙氯乙烯2046立方米，换算成加仑，就是54万加仑，美国俄亥俄这次才10万加仑。
它们故意混淆了，或者隐去了一个事实，就是张家口那次泄露的是气体，而俄亥俄这次泄露的是液体。
氯乙烯的气体密度是2.77公斤每立方米，液体密度是903公斤每立方米。
2046立方米氯乙烯气体换算成质量，是5.6吨。
10万加仑氯乙烯液体换算成质量，是378吨。
张家口泄露的氯乙烯连美国的零头都不到。
大伙儿不要被忽悠哦。
（我也是复制粘贴的，让更多的人看到）"
1676433957,0,1,False,False,美国空气中散发着氯乙烯特有的芳香味，而且听说日本樱岛火山又喷了，要不众筹一下富士山也喷一下致敬一下霉国的泄漏？[tv_点赞]
1676435210,0,1,False,False,我更在意的是那边有没有华人，还有自然生态系统被破坏了[来古-呆滞]
1676446418,0,1,False,False,"这玩意要严重很多
复制大佬，防止被带节奏

有奇葩人士，说张家口那次泄露氯乙烯2046立方，换算成加仑，就是54万加仑，美国俄亥俄这次才10万加仑
他们故意混了，或者隐去了一个事实，就是张家口那次泄露的是气体，而俄亥俄这次泄露的是液体。
氯乙烯的气体密度是2.77公斤每立方米，液体密度是903公斤每立方米。
2046立方米氯乙烯气体换算成质量，是5.6吨
10万加仑氯乙烯液体换算成质量，是378吨。
张家口泄露的氯乙烯连美国的零头都不到。

2018年张家口CH2CHCl的理论泄漏量是2046标立，注意是标立。（22.5米直径的气柜浮头下降了5米算得）。俄亥俄本次总量10万加仑约370立方米，注意是液体。约330吨，再折成标立大约120000标立。（液体密度0.9，气体密度2.7）。"
1676433948,1,1,False,False,我高中离这地方40mile，这地方离匹兹堡市区也56mile，真的很担心我同学还有我高中老师
1676375660,8,4,True,False,🤔那pvc加工制作厂的工人岂不是高危职业
1676420685,0,2,False,False,还好我这差六百公里[脱单doge]
1676440581,0,1,False,False,UP主怎么敢鉴定这个？这是碰都不能碰的滑梯[doge]
1676421149,1,1,False,False,溢！无！（指氯乙烯溢出，人都无了）
1676430269,0,1,False,False,以前不一直说美国人不吃淡水鱼吗，因为淡水鱼不好吃，可能的确没海鱼好吃，但会不会是因为其他原因[doge]
1676431817,0,1,False,False,"一个在海上，一个在天上
好好好，父子局"
1676433536,1,1,False,False,博主你好，关注您很久了。我是做食品的，最近为了食品消毒安全，查阅了很多关于臭氧机消毒方面知识。您能不能做一期有关于臭氧消毒的知识指导。在此感激不尽
1676386758,0,2,False,False,美国青春mini版切尔诺贝利是吧[嗑瓜子]
1676384580,0,2,False,False,真是爱民如纸
1676427298,0,1,False,False,很喜欢b友的一个评论，你们快回来，镇里发氯乙烯了😭。
1676379718,0,1,False,False,"那句话怎么说来着，啊，对！
How dare you![doge]"
1676417501,0,1,False,False,坏消息是泄露了！更坏的消息是他给烧了还是不充分燃烧!最坏的消息是顺着空气到处飘
1676401537,0,1,False,False,更像是美国故意点燃，进行人类清除计划[2023拜年纪_两眼一黑]
1676416375,0,1,False,False,反正呢，现在日本真的有理由可以放核污水了，毕竟这诺福克南方的正在列车上的几百吨化学原料都释放出去了，大不了这诺福克南方铁路被其他的一级铁路公司解散重组呗，毕竟这可是一大笔巨款，从各方面原因来说
1676433338,1,1,False,False,有这样的政府，也难怪美国人不相信。
1676387207,1,2,False,False,我去，那这一把火烧的跟大规模谋杀当地人民有啥区别?[辣眼睛][辣眼睛]
1676409082,9,1,False,False,光看乐子了，所以那个人到底该怎么样啊... 我应该还好我在波士顿附近，可我有朋友在卡梅大学（匹兹堡），40多英里。如果不知道要出去躲多久那没法出去躲啊，休学一学期吗[撇嘴]对他来说有啥靠谱点的建议没？喝桶装水？可是学校食堂的饭也用的自来水啊。戴口罩肯定没用吧。
1676376941,0,1,False,False,上次装猴子的车翻了 全球新冠 栽赃中国 好家伙 现在连自己人都不放过了 真狠呐 阿玛瑞卡[辣眼睛]
1676387044,0,1,False,False,众所周知  我们一般用苦杏仁味和苹果香气来形容某些氰化物
1676397018,0,1,False,False,你以为是大气污染，其实是自由国大厨在烹饪国宴[脱单doge]
1676388022,0,1,False,False,我感觉是因为那边开始允许公开吸东西，所以怕有些人买不起，为了人人有毒吸，所以制造了一堆毒气出来[tv_doge]
1676404845,0,1,False,False,都得归功于普普的逆天操作，把奥巴马在任期间搞的危险化学品运输条款给取消了
1676403795,0,1,False,False,这玩意是真正的科技与狠活了，地球上没几个人才能干出这种事[辣眼睛]
1676416250,0,1,False,False,好消息不用不用怕了，他们已经把他烧了，还可以在那里继续居住的[脱单doge][脱单doge][脱单doge]
1676389465,0,1,False,False,芭比Q了，这边新闻被压热度了，刚出事上头条了 现在已经看不见了。现在头条还是中国流浪气球[妙啊]
1676418122,0,1,False,False,那估计不只是气球，真的是监视用途的，美国军方开始开会了
1676374151,0,2,False,False,[星星眼][星星眼]热乎的
1676389540,1,1,False,False,派我们的辛圣人去闻一下，就知道都有什么有害物质了，然后再开一场新闻发布会，给当地人科普一下[doge]
1676419196,0,1,False,False,这个时候环保少女又眼瞎耳聋了！环保少女了？？说好的环保了[doge]
1676375112,0,1,False,False,懂了，阿梅利卡刚考验完国民的生物抗毒性，现在又准备考验过敏的化学抗毒性了[doge]
1676423511,4,1,False,False,一个化工行业从业者不知道这有什么好笑的[疑惑]
