上传时间,回复数,点赞数,up是否回复,up是否点赞,评论文本
1675941143,54,747,False,False,我是艾莉，我不打算为老乔复仇了，我升华了，放下仇恨才能活得更高尚[滑稽]
1675938360,61,269,False,False,怎么说呢，看了阿斗推荐去看的，但是觉得套路和之前的一些剧或者电影挺像的：世界因为生化危机而沦陷，女主有免疫的基因，然后一路逃亡最后拯救人类。前两集的事情我基本都猜对了走向，目前开始没有惊艳的感觉，不过还是支持阿斗，点个赞哈哈哈[呲牙]
1675944544,15,137,False,False,有一说一，如果这集把弗兰克改成女性我反而不会被感动，感觉从两人见面就可以猜到两人一定会相爱了
1675953049,13,94,False,False,看完这一集唯一感受是：两个大老爷们亲嘴，不会扎嘴吗？
1675997909,6,157,False,False,这一集就像恐怖片中穿插了一个美丽的童话，别出心裁的用另一个视角展现了末日下的人心，告诉人们末日不是只有丧尸病毒和枪支弹药，还有余生陪伴和岁月静好，它不像之前两集那么惊悚紧张，相反用细腻的镜头语言，展现了两个灵魂在这地狱般的世界中，平淡朴实的相知相伴，同生共死。当这个世界真的走到了末日，你成为了生还者，是的你已经“生还”，但是你如何继续“生活”？是焦虑紧张惶惶不可终日，还是积极勇敢面对，种下草莓期待着明天？这也映射到现实，生命的陪伴，两个孤独灵魂的契合，是跨越性别生死病痛的一种更强大的力量，我们不能带着政治正确，或者对txl 群体的刻板印象去钻牛角尖，看看这部剧真正要表达的核心：最感人的爱不是轰轰烈烈，而是平淡的共度人间岁月，世界险恶多端，但我的灵魂和臂膀会永远伴你左右
1676004324,3,36,False,False,以为会是生化危机版，没想到是断背山。
1675946190,3,29,False,False,这第三集的内容也太戳人泪点了[委屈][委屈][委屈]
1675940212,55,43,False,False,西方老美那边，LGBT是不是成了主旋律了
1676006766,2,32,False,False,我也不喜欢txl，但是这一段表现的确实好啊，不管是txl还是yxl，表达出来的是爱情纯粹的样子不就行了吗，实在是带着意见去看 硬喷的当我没说
1676012597,7,46,False,False,我是对同性恋很不感冒的，我不反对，但也绝对不会主动了解，但这集确实是挺感人的，最真挚的情感往往是从生活的小事萌发的，在生命的最后时刻，一切都是那么的珍贵。
1676023737,4,33,False,False,"当时看的时候我在想，这男的赖着不走也不打架，不会亲上了吧？
结果真亲了，看的我直接跳过。
但是吧，如果自家防御工事里掉了美女，我觉得实在浪漫些了
两个男人走到一起，恰恰体现了末世里两个人对美好生活的期盼，和对彼此到来的惊喜
何况二人最后结局我觉得挺感动人的
srds突然就亲看得咱确实难接受，但是老美那现在就这样了。要是俩人正常处，久而久之发展到亲密的爱人，可能咱接受的程度能多点"
1675961055,7,23,False,False,[tv_冷漠]啥啊 第三集就应该单独细剖 一开始的森林 对话 过桥的美景 在从破碎的布料镜头代入比尔线 在从弗兰克呼喊濒死比尔镜头切换到轮椅弗兰克叫比尔推自己回去 还有很多精美的镜头画面 作为一名观众我是觉得很久没看过这样的艺术品了 明显感觉到制作人员真的诚意满满 这一赶工解说 第三集直接变和第四集一样水了 不如等5出了在4 5合并…
1676007964,2,8,False,False,我越看越不像艾莉，更像第二部的壮女[笑哭]
1675937994,6,22,False,False,124可以说主线大差不差，只是设定改了一些，第三集不太一样，但是真的封神。
1675948230,22,139,False,False,第三集拍的特别好。而且这一部丧尸片把侧重点放到人与人之间温暖的感情上我觉得挺创新的 🥺之前的丧尸片大部分都喜欢描写人性丑恶和互相残杀，目前从第四集的结尾来看女首领明显也是有着悲痛过往的，黑人兄弟看起来也很有故事
1676003764,0,10,False,False,希望第一部完全按照原著来拍，第二部完全别按照原著来拍
1676113662,0,4,False,False,十几年的陪伴别说同性了，在这种长期孤独的末世没个互动早就疯了，所以我觉得哪怕是恋物、跨物种之类的结个婚都合理。何况游戏本身就有说明这方面的性取向。虽然不是同，但对同也就是尊重。至于zzzq啥的，就算真的有，拍得好其实也没啥（黑美人鱼那种就算了[脱单doge]
1676272760,1,4,False,False,省略太多了，这解说真的不行，不知道是不是做大了感觉无所谓了，这文案应该是别人写的或者从网上抄的，精髓之处全都略过了
1675942847,37,74,False,False,找的这俩演员如果没有这嗜好，那真是太敬业了。两个大胡子接吻也真是叫人叹为观止。
1675956789,66,221,False,False,我本人是非常非常反感同性恋的，很不能理解。但是，我也不会去试图把身边认识的弯的掰直，性取向不同就跟我喜欢辣的，你喜欢甜的一样，就这么简单。虽然确实很违背伦理。但，起码富兰克和比尔的感情确实很让人感动，去享受剧情就好。另，阿斗的解说真的从权游后段就看得出来，真的越来越拉胯了，细节各种漏掉，重点各种抓不住，文案也一塌糊涂。所以拼多多真的才是万恶之源。
1675955923,16,64,False,False,"我发布了一篇笔记，快来看看吧
 啊斗看看，记了笔记，是你自己说熊女第一次杀人后，老乔还安慰了她，那前边捅死人的只能是熊女了，我是看见你说了这句话才说你看片不认真的！
https://www.bilibili.com/h5/note-app/view?cvid=21731649&pagefrom=comment&richtext=true"
1676384473,0,2,False,False,弹幕都是什么成分，一会说辣眼，一会说女主丑，不想看别看，要不然就你来拍，那些xxs没这本事真不知道在这里叫什么
1676117596,0,3,False,False,看了半集看不进去了，看阿斗解说质量不一样了，不追美剧追阿斗归来了[笑哭]
1676128370,0,4,False,False,可是说真的，第三集真的很感人，虽然其实不贴合，看过很多的影视作品，无论是生离死别，还是青梅竹马，我始终看的没感觉，但是这对，真的完美的诠释了，陪伴是最长情的告白，也许白头偕老才是最令人动容的。
1675976417,6,44,False,False,人在美国，这个剧还是有点东西，身边朋友同事都在看，男生女生都在看，中国人外国人都在看[笑哭][笑哭][笑哭]每周见面就问，新的一集看了吗哈哈哈
1676016381,6,25,False,False,不喜欢看可以不看，而不是硬要搁这看，一边看还要一边狠狠批判[微笑]
1676192116,1,3,False,False,这剧情确实像是那个byd的尼尔会搞的东西，我的评价是——保留了答辩原味的九转大肠，真的是太牛了捏~
1675951623,1,40,False,False,我一个直男看着第三集都有点感动[笑哭]一开始非常排斥很tm离谱，然后看下去觉得真不错这两个[藏狐]
1675945733,4,50,False,False,虽然我不喜欢同性恋 但是看完比尔和弗兰克那一集后还是有点感动的 这俩人相依为命了快二十年 连死都要一起死
1675996502,16,52,False,False,在中国，批评zzzq不也是一种zzzq吗，大哥不要说二哥 古代我们可比西方开放多了，龙阳之好 断袖之癖 皇帝都有男宠，不管接不接受 在自然界中的哺乳动物中 通讯录都是 客观存在的事实 又没影响你，与其在网上口嗨恶言恶语伤他人，不如做个善良的人，这个世界这个社会已经这么苦了 让世界充满爱和善良来调剂一下 这不是一件很美好的事情吗
1675942282,26,38,False,False,剧情是好剧情，就看能不能接受了，如果觉得这个剧情完全没有必要，觉得就是来拖时间的，或者对txl元素实在无法忍受的，那就直接从第三集的0：16：00跳到的1：02：20就行（不可能就是因为穿插了一个支线剧情导致主线讲不完吧，等后面更新看后面的就行了）。能接受的我强烈建议看看，虽然前面确实很难让人接受这么突然的kiss和那个......但后面的剧情把两个人的性格表现得淋漓尽致，最后两人的结局和最后的运镜配合上一些BGM和long long time对我个人而言真的是非常感人。zzzq什么的，在这种情况下我觉得就算这是zzzq的产物，只要它能让我觉得这好看，就算是zzzq又怎么样呢（个人观点，勿喷）
1675986635,2,33,False,False,这tm居然是2023年能看到的弹幕，真是对一些人的开化程度太高估了
1675940617,1,20,False,False,不是阿斗的问题  是墨菲解说的太好了[doge]
1676044478,2,13,False,False,啥都得拍和啥都不让拍 到底哪个更搞笑啊
1675953638,0,13,False,False,那些发zzzq的人，少自命不凡了，自以为发现了什么不得了的秘密，你们就是些知道一个词就用到每个有哪怕一点点接近的地方的小丑，用zzzq总结导演演员的作品，尤其是那些优秀的作品只会暴露你们的无知和愚蠢，绿皮书也是lgbt，有黑人，按你们说也是政治正确，但人家得了奥斯卡，请按照正常剧集的评判标准评价同影，而不是当个只会复读的机器
1676285391,2,2,False,False,我是想看丧尸的[笑哭][笑哭][笑哭]
1675951624,13,31,False,False,弹幕为什么这么多大为震撼的 也没有什么过分的同性情节啊 是第一次在互联网听说同性这种事吗
1675939894,2,13,False,False,真来第二部，精神变态，高尔夫的梗，玩了不知多少次了
1676102719,1,4,False,False,这导演就是夹带私货，第二季肯定是原翻不动的拍。
1675950641,1,19,False,False,退后，乔尔，我有个很强壮的女儿，而且喜欢打高尔夫[doge]
1676122123,0,3,False,False,政治正确必须出现？必须解说？
1675941313,8,7,False,False,烤饼干都烤不死真菌，为什么感染者可以被火烧死？
1676001564,18,13,False,False,说实话前面两个人啃在一起的时候我确实忍不住快进了，但是后面也的确能感受到抛开男女仅仅作为人类的感情共鸣
1676126743,1,3,False,False,有个弹幕说：“异性恋霸权的闭嘴吧”。嗯？异性恋霸权？
1675956514,14,8,False,False,我也感觉为什么讲的越来越不细了
1676029202,1,11,False,False,我一直紧张会不会翻水水，结果他们突然亲起来了[热词系列_知识增加][热词系列_知识增加]
1676019067,0,12,False,False,我是老乔，我没有被高尔夫球棒打死，我还活着，V我50，等我养精蓄锐后重出江湖拯救世界[脱单doge][脱单doge]
1675950631,1,17,False,False,游戏里好像就暗示俩人是南桐把  只不过 法兰克好像是想逃离比尔 然后被虫草抓了  就上吊自杀了？？？  不过好像比尔没这么老  大概感觉跟乔尔差不多也就50 多岁把 在游戏里
1675943657,9,15,False,False,第三集出现男同，不难猜测有政治正确的原因，但是同样是政治正确的同性爱情也能做到让人感动。只能说政治正确亦有差距，你说是吧——甲级战犯，精神变态，高尔夫持有者，玩家辱骂者，政治正确sucker，令人唾弃的年度游戏《最后的吉他2》的制作人——尼尔。
1675941867,3,14,False,False,事实证明，政治正确从来都不是问题，问题是拍的不好。大表哥2的莎迪、查尔斯，一个黑人一个女人，有谁说他们政治正确不对吗？这两个人也一样，他俩不同框的时候，我完全感觉不到这是两个男人。
1675962402,0,7,False,False,我是高尔夫杆，点赞过8W，敲爆艾比的头
1676003873,0,3,False,False,第三集太出彩了，真好
1676046073,1,10,False,False,看了评论和弹幕，我只想说，当我们在这儿吵起来的时候，就已经上当了，这些美国人的观念，本来就跟我们没关系，但拱火大师可以成功把火输出给全世界，妄图渔翁得利[吃瓜]
1675939940,0,15,False,False,阿斗你太慢了 我已经给墨菲了[傲娇]
1675948278,0,4,False,False,讲的太粗糙了
1675959370,4,22,False,False,弗兰克吃完食物后和比尔嗨嗨嗨算不算肉偿呢[吃瓜]
1675940740,0,11,False,False,建议看完原片再来评价。20分钟解说，别觉得自己就看过了
1675973893,2,14,False,False,第三集兄弟们一定要去看原片 细节完善 以及场景的气氛烘托 特别是完成最后遗愿时 那种情感 真的 绝绝子兄弟们
1675953807,0,10,False,False,第三集真的一言难尽……可能我真的接受不了同性吧
1675955375,1,15,False,False,越讲越敷衍了，包括权游后几季也是，是不是被拼多多催更了
1675940710,11,19,False,False,虽然看到他们的爱情很感动，但我还是接受不了两个大男人...[笑哭]
1675946829,0,18,False,False,阿斗——一个木讷的男人，做过的最浪漫的事或许就是一次更两期[doge]
1675948481,57,309,True,False,这次要批评阿斗看片不认真，小熊女偷拿手枪原因不说，还有小熊女只是打伤并没有击杀，击杀是男主用刀完成的，阿斗说成了小熊女。
1676005017,0,10,False,False,其实第三集两个角色之所以是同，是因为游戏里面设定就是这样的，只不过游戏里面两人的结局相比剧集更残酷些
1675939276,1,20,False,False,抱歉阿斗，墨菲比你长，我喜欢长的up[doge]
1675953172,13,10,False,False,[tv_笑哭]看完后，四个字总结:政治正确！
1676124345,0,2,False,False,省流:钙片
1675939367,0,8,False,False,跨越性别的真爱
1675939786,2,16,False,False,[囧]快给老乔托梦啊！第二季一定要把曼达洛人的头盔带上
1676133346,0,2,False,False,阿斗，万人血书，白井！
1675950747,0,3,False,False,看不下去还在边看边骂？承受能力不错呀
1675949040,6,37,False,False,其实我想说，如果，实在是不想看这一集的话，其实也没必要看，喜欢看就看不喜欢的就点退出就行了
1675955428,0,3,False,False,希望讲细点吧
1676177139,0,2,False,False,@Lodrovi [大哭]
1676148813,0,2,False,False,我的评价是不如莫非
1676127755,0,2,False,False,从这一段看出这编剧是真的很想评个奖项
1676055870,0,3,False,False,本g是毫不在乎蠢直得什么认同不认同 搞得好像你的认同很重要似的
1675937749,2,17,False,False,希望它成为继越狱和毒师后的第三大惊喜
1675943099,1,14,False,False,我是艾莉，昨晚我和乔尔正躲着楼里休息，现在被入侵者发现了，如果你愿意v我50请我吃一顿肯德基疯狂星期四，等我成功逃离他们的追捕，到达火萤研究所后，生产出真菌疫苗免费给你使用[doge]
1675939867,1,7,False,False,哎，在墨菲那看了这里不想看了[藏狐]
1676006290,5,10,False,False,在我看来：爱情 = 精神陪伴+肉体欲望；把肉体部分剥离，其实没什么不同。[拥抱]
1675944003,8,14,False,False,尼尔自己搞zzzq，然而自己就是个反亚裔份子，凡是游戏和剧里的亚裔，要么是反派，要么就是被一枪爆头的npc
1675945835,0,10,False,False,不得不说，这段男同的故事真的感人
1676117713,0,2,False,False,“虽然我不赞同同性恋，……”哈哈哈哈哈哈哈
1675938938,2,14,False,False,俩胡子男接吻我真的看的生理不适了[笑哭][笑哭][笑哭]
1676093215,0,2,False,False,这些剧都在哪里看啊
1676195921,1,2,False,False,这种美剧在哪里看的谁有资源啊
1676020140,3,3,False,False,真喜欢剧情，还是建议玩游戏吧。
1676053216,4,4,False,False,love is love 希望大家少一点偏见
1676199402,0,2,False,False,快发下一部啊啊啊啊啊
1675952684,1,5,False,False,现在美国片不整点这个就不行了吗，真的受不了这种
1676170920,0,2,False,False,同性恋是一件很寻常的事，不必大费周章，不必用心良苦，更不必自持清高，攻击他人。
1676125745,0,2,False,False,政治正确呀，这片子格局是要得奥斯卡[脱单doge]
1675940891,0,7,False,False,比尔：你知道零元购是怎么来的吗？[大笑]
1675941611,3,8,False,False,一起生活了十几年，我小熊女还这么小？[傲娇][傲娇]
1676266894,0,2,False,False,求这个BGM的出处[给心心][给心心]
1675938698,0,13,False,False,真正的爱情是可以跨越一切阻碍的。
1675954162,1,5,False,False,比尔和弗兰克两个演员外形很像马克思和恩格斯
1676261176,0,1,False,False,"第三集一定要去看原片一定要去看原片一定要去看原片
一开始亲吻我也觉得辣眼睛，尬得想笑，但后面整集看下来两人的情感真的很好看啊，剧情 氛围 镜头语言的"
1676205068,0,2,False,False,"阿斗，解说还算可以的了，早些年从优酷和爱奇艺上开始追的，那时候还是2018年末呢。
我觉得还是，先把其他的坑先填完再开新坑吧。[笑哭]"
1675939380,15,61,False,False,第二季当然是要改剧本了 游戏做坏了 电视剧改好不还是赚嘛？
1676007431,6,4,False,False,看了这剧之后我要去买游戏了！！！
1675974272,0,8,False,False,我也想拥有能陪伴到老的伴侣，男人我也不介意，你就是我人生的意义。
1676284988,0,1,False,False,真心相爱的两个人可以祝福，但看着弹幕露骨的说出自己不接受什么的话，看着就有点折磨了
1676030404,0,5,False,False,美末的同性一点不排斥，甚至小感动，
1676133674,2,4,False,False,拒绝米帝zzzq就是要大胆说出来，舆论阵地你不占据就有人占据。文化侵略不会一开始就骑脸，先裹上厚厚的糖衣，再循序渐进，逐步蚕食
1675958670,6,5,False,False,满分改编？你不尬我都起一身鸡皮。
1676335702,0,1,False,False,一个小时都在看两个大胡子谈恋爱啊哈哈哈哈哈哈
1675952665,6,7,False,False,讲真的，对这种题材的没兴趣了，再拍也就是那些套路了。《僵尸世界大战2》一直难产也是因为，对于丧尸大家都拍烂了
1676001716,1,8,False,False,"玩过游戏看这个改编剧真的处处惊喜，因为知道了原剧情的情况下，把剧情改编的更深刻了，npc角色更加丰富多彩。
不过说要来第二季，我想乔尔肯定也会死，不过我预测肯定会把死的剧情改编成让大家都能理解的死"
1676272647,0,1,False,False,一直说zzzq的也快形成自己的zzzq了
1675951228,11,7,False,False,怎么最近的脏比片都说将人性这类的，难道就不能多来几波尸潮打么
1675951895,2,3,False,False,我也好想找个人一起吃草莓，真的，好感动~！~[大哭]
1675938966,1,7,False,False,上一秒在看吃饭，下一秒就对眼然后吧唧亲嘴，然后压床，车速太快，大脑差点宕机[微笑]
1675945775,3,6,False,False,没玩过游戏，第三集开头我居然怀疑弗兰克是坏人[委屈]
1675959519,3,8,False,False,《美末》一是我接触的第一款主机游戏，当时那个剧情真的是很吸引我，喜欢的不得了，之后的第二部只能说是一坨zzzq和txl的糅合答辩。现在出了这个剧集，只能说千万别对它抱有太大期望[微笑]，希望等它完结的时候不要再给我们来一次小小的震撼
1675937816,0,8,False,False,今天看到一个男的像阿斗，我发了疯似的跑过去，可突然想起阿斗不在，我愣了，放慢了脚步，也放下了手里的麻袋
1675945977,2,7,False,False,阿斗可以解说一下国产三体电视剧吗？[脱单doge][2023][打call]
1675939450,0,4,False,False,阿斗可以解说一下电视剧三体吗
1675960950,0,6,False,False,第三集like：🚘🕳🧔👕👖🎹🎼💋🍓🧑‍🦽🎨💍🥩💊🍷🛏👨‍👧✉️🔑🪟💗———[脱单doge]
1676039015,0,2,False,False,哪位有这个电视剧的资源
1675940117,0,7,False,False,[doge][doge][doge]这次我先来小熊女像扎克伯格
1675939511,0,7,False,False,"阿美莉卡看好了！lgbt平权是这样推进的！
哦，这就是美剧啊，那没事了。[妙啊]"
1675946837,0,4,False,False,烦òᆺó比尔那里有什么好看的
1675947686,1,8,False,False,我达到了末日生存其中一条自卫[捂眼]
1676005126,2,5,False,False,我觉得编剧还是牛逼的，就算抛开zzzq，把弗兰克换成女的，这个剧情依然感人，而且也说得通
1676298166,0,1,False,False,卧槽，老嫂子居然是……居然是我女神……Rose
1675951612,0,4,False,False,能不能把大表哥2改编成电视剧啊
1675937882,0,4,False,False,以后用ChatGPT制作视频
1675941537,0,2,False,False,来了
1675940005,0,4,False,False,讲的不是很细，感觉有点滑[微笑]
1675938901,0,8,False,False,比尔这对真的改编的很好，当然，生理不适那部分抛去[辣眼睛]
1676389726,0,1,False,False,别学个zzzq就一直用了，这年代看哪的剧没有zzzq了
1675943378,2,7,False,False,美末电视剧第二季怕是怎么改都不会被骂的太惨了，因为游戏剧情烂的无人能及
1675960166,0,3,False,False,我觉得第三集可以单拍一部电影  看的太跳戏了
1675938896,3,6,False,False,耽美对于现在的我来说还是太先进了[笑哭][笑哭][笑哭][笑哭]
1676027102,0,6,False,False,两个男的接吻我看也受不了，不过看原片最后还是被感动到了，非常不错，不过经常看美剧的什么乱七八糟的尺度都有，这点还能接受，那些平时不看的肯定接受不了，就别在这受罪浪费时间了
1676016453,0,5,False,False,游戏和美剧的设定都是真菌，不是病毒🦠真菌是真菌，病毒是病毒，没有《真菌病毒》这一说法。阿斗的视频很不错，但还是建议标题再严谨一点点[鼓掌](已三连，勿冲)
1675942169,0,6,False,False,第三集满满的激情[妙啊]
1675950735,0,2,False,False,热乎的[脱单doge]
1675961538,0,2,False,False,真爱[大哭]
1675942780,0,3,False,False,改编算挺成功的
1675938746,0,7,False,False,话说，标题里面“真菌病毒”这种表达是不是有问题
1675943587,1,6,False,False,比尔车后面写的美国精神，然后他就去零元购了，这就是美国精神
1675954633,0,6,False,False,最后生还者这个游戏，我是云通关的，我看一些游戏up玩的时候确实很好，电视剧我是看了好多B站推荐，所以去看了原剧，个人观感觉得还不错！就是电视剧还原问题肯定和游戏场景有些出入，不过第三集还是不错的，挺感人的。
1675940801,0,4,False,False,开头真的挺好了，希望不要烂尾
1675937724,0,7,False,False,《来的很早的不知道评论什么所以先投个币吧[doge]》
1675938326,0,6,False,False,日常催更浴血黑帮最终季
1676004896,0,5,False,False,突然类目 在这毫无希望的末日世界里生存 彼此成为照亮黑暗的光束 把坚苦的生存变成相依的生活 最后死在最美好的时光里 虽然物质上贫瘠 但精神上是极大的满足
1676184007,0,2,False,False,第三集的内容讲的没别的up主好。
1675941707,4,6,False,False,真的世界末日不可能有那么多食物资源留给你，看看新冠就知道了超市里的东西都是抢的[笑哭][笑哭][笑哭]
1676026473,0,2,False,False,你想表达什么
1675937981,0,7,False,False,阿斗你真快，满足了[doge]
1676021417,0,2,False,False,爱丽丝还更吗？
1676340860,0,1,False,False,阿斗怎么还不更新，不会去过情人节了吧[doge][doge]
1675946516,0,4,False,False,真菌病毒就很离谱[喜极而泣]
1675955414,0,5,False,False,中间npc的剧情给我看哭了，真是神来之笔
1675943749,1,5,False,False,给人看落泪了，结局起码是好的[大哭][大哭]
1675953356,0,6,False,False,前门把社区的人杀掉是因为隔离区要看有没有席位，如果没有的话是会中途杀掉的，不是什么死了就不会传染之类的，作者说的不严谨
1675997661,0,4,False,False,没有明说，但是根据游戏内找到的文本资料都有暗示两人之间的关系不一般，包括弗兰克出逃的原因也和剧里两人第一次吵架的原因类似。
1675937686,0,2,False,False,1播放
1675965868,1,2,False,False,这集好看
1675950232,0,4,False,False,看视频前526评论，看完了看了一眼变514了。
1675959916,1,4,False,False,‍这真菌可以，坐轮椅都能站起来跑起来了
1675942757,0,3,False,False,这集拍的是真的好
1675937981,1,3,False,False,咋总和别的up撞了[笑哭]
1676011386,12,5,False,False,其实第二部 是神作  不知道网上为啥那么多人骂   我自己玩的感受 在最后控制艾利在河边和艾比决斗的时候 我内心已经完全原谅艾比了 我当时就不想在打艾比了 我真心希望就这样停止了   我都以为要打死艾比了 最后终于停下来了  。  第二部从仇恨到相互理解到最后的原谅   也是对自己的救赎原谅   我相信绝对有人跟我一样很喜欢第二部  只是骂的人太多了 都不敢说第二部好了
1676388195,0,1,False,False,看完意犹未尽，求推荐好看的末日剧
1675970527,1,3,False,False,四集看完了，还行吧，觉得豆瓣9+也太虚高了
1675955348,0,5,False,False,看着看着，不禁在想阿斗是不是要宣布自己出柜了！[呲牙]
1676082857,0,2,False,False,政治正确 真就没必要
1675937816,0,5,False,False,云玩家！集合！
1676374926,0,1,False,False,爱丽丝弥留之国第二季，更新啦
1675950901,0,2,False,False,少了很多片段
1675977209,1,2,False,False,讲的确实糙
