上传时间,回复数,点赞数,up是否回复,up是否点赞,评论文本
1676392989,1,1,False,False,"吵架确实是一种解决问题的手段，但是多少有些伤感情，还是应该尽量冷静地去沟通，有些过于细的东西可以用关怀代替明说。沟通不是去揪着导火索讲那些所谓就事论事的道理，而是分析更深层次的问题根源再去就事论事。

其实一旦吵架吵起来了，锅早就不是一开始的导火索了。在大家都没遇到什么事、情绪稳定的时候，有问题就就事论事一起解决了就结束了。而在任何一方压力过大无法维持情绪稳定的时候（很多时候是双方），就很容易吵起架来，想要不吵架还是要及时体谅对方、相互理解（需要双方的共识，单纯一方无休止体谅另一方是不可能也不合理的）。

不是单纯地因为happy wife happy life，这只是简化后的行为指南而已，wife最希望的也许是对方能透过导火索的表面体会到、理解到自己的难处，并且至少短期内精神上进行分担，长期内落实到行动上（此处用wife是有历史、社会原因的，按下不表，当然，wife以外的一方也是需要理解和体谅的）。"
1676423985,0,1,False,False,不过说到父母该不该吵架这个问题，我小时候会觉得父母在我面前吵架特别痛苦，就算如今已经是二十多岁的成年人了，前几天我爸妈因为一件小事吵起来我心里也会特别难过。后面我也反思了很多，因为难过之后我觉得生活中不可能不会吵架，而且再怎么做都是父母作为自己的选择，我不能因为我的心理感受就要求他们几十年如一日的和和气气相敬如宾（当然这个小时候是想不出来的），这样想着才好受了一些。但是我觉得最痛苦的不是我爸妈的争吵，最痛苦的是他们两个人都是对对方很喜欢冷暴力的，这些年来吵架的过程一般都是，热战争冷处理，轰轰烈烈的吵一个大架，然后根据生气的情况冷战一段时间，几分钟到几个月不等，我觉得这种情况才是最折磨对方也是最折磨小孩的。磕磕绊绊肯定无法避免，但是两个人总要沟通总要解决，即使我在自己的恋爱中会很勇敢的沟通和解决，碰上我爸妈他们吵架的时候，我根本就不敢也不愿意开口去劝和。所以如果我以后有自己的小家了吧，我觉得最重要的一点是，在吵完架之后还是要关注小孩的情绪，像可爸可妈这样就非常好了
1676447303,0,1,False,False,我觉得很甜蜜啊，这样的婚姻已经是很优秀的婚姻了，人也更抗压了
1676380381,0,2,False,False,WDL同志INTJ实锤，面对可妈的情绪，啪的一下提出解决方案，喜获无效判决一张[doge]
1676380782,0,1,False,False,这样看来其实维持婚姻，或者是任何亲密关系，真的都是需要习得的能力，也是一门艺术吧，最近真的觉得一个人其实不太可能改变另一个人，或者说很难吧，即使是很多小的坏习惯也很难改变，在很多情况下是不是一开始就找比较合适的好一点嘞，无论是朋友还是伴侣
1676408488,0,1,False,False,看到有条弹幕觉得说的很对，重新拍照领证是一个非常非常有意义的心理暗示和标志，而且也是一种世间少有的体验
1676380747,0,1,False,False,谈恋爱应该就是把自己最好的那部分展示给对方，结婚就是把两个独自工作的齿轮想办法给有序扣合到一起，好的不好的地方都会展露出来，磕磕碰碰是难免的。（当然了知道这个也避免不了会吵会闹会上头
1676393191,0,1,False,False,我也是从小就是对父母吵架很敏感，有一点我想提醒一下就是“可可是个小大人”这一点，小孩子过早的表现出比较成熟的一面，可能是有一些家长的问题在的。比如说过早的承担了一些责任，或者说照顾了父母的心理之类的。不说的很详细了，总之是自己经历过的一个点，提醒一下吧。还有就是吵架争吵不管在这个家的哪里都会感觉到的，家长的一举一动孩子都很敏感，甚至是一个表情都很敏感，砸东西之类的真的很不好。
1676388255,0,1,False,False,可妈可爸的分享好感动，让自己对于亲密关系之中的解决有启发，能把吵架事复盘，真是很认真的自家人咯[doge]可妈可爸紧张的工作节奏中，加油让自己放松下来哟! 看完视频也提醒自己工作生活要有些松弛感[调皮]
1676381891,0,1,False,False,感谢可妈分享[给心心][给心心]自媒体把太多美好的没有杂质的爱情糊在我眼前，反而有些失真，生活还是一地鸡毛相互支持，压力也是动力，加油加油！
1676380396,0,1,False,False,第一个问题也太真实了 每次我的抱怨都会被男朋友理解成我怪他
1676375941,0,8,False,False,婚礼什么时候呀？随份子钱可以看看多多嘛？[星星眼][星星眼]
1676390178,0,1,False,False,总结：童话里都是骗人的，还是好好过日子吧……过不下去就别让双方演的太累或压抑的太累
1676376268,0,3,False,False,啊这，可爸这么直男的吗[笑哭][笑哭][笑哭]，，，
1676425419,0,1,False,False,这期视频好符合我的心情，我们也是结婚四年，一个娃，从春节过后真的感觉好疲惫，好无力，真的可能是到了一个压力的节点
1676401399,0,1,False,False,男权社会里，很多男性意识不到自己是既得利益者，却能意识到自己不该是先低头的那个，有趣捏。
1676375973,0,4,False,False,啊哈哈，结婚证揭晓了？等我看完的[doge]
1676397330,1,1,False,False,那是我不给台阶？是她得想下啊！！！！！我给八百个她都不下，还怼回来，我能怎么办
1676394819,0,1,False,False,我家也是父母喜欢吵架，从小吵到大，我已经懒得管了，但是我妈又会怪我不会说话吧啦吧啦
1676377557,0,2,False,False,"我改变不了你wwq,但是你应该明白这件事情你想的就是不对"
1676442297,0,2,False,False,溢美之词可不是什么好词哦
1676386010,0,1,False,False,我就记得我很小的时候我爸妈在我面前吵过一次架，我不太记得他们吵的什么内容了，我就记得我在房间里睡觉他们在外面特别激烈，好像还摔东西，我特别害怕不想让他们吵了，我就开始哭，哭的特别大声然后他们就进来哄我[笑哭]之后就再也没见到他们在我面前吵架了，这一点真的要注意。
1676375691,0,9,False,False,省流:自己看[doge][doge]
1676393947,0,1,False,False,放松一下，钱啥时候都不够用，你们可是我这单身汉的榜样，互相理解包容一下，爱你们呦[呲牙]
1676381780,0,1,False,False,"没注意今天是什么日子，鬼使神差点开了朋友圈，第一条就是结婚的，下面也有晒男女朋友的，给我酸死了
直到此刻，看到可妈可爸也有吵架的时候，虽然但是，心里平衡了一些[doge]"
1676381636,0,2,False,False,可妈背心好好看 球一个牌子[星星眼]
1676376114,0,3,False,False,省流：可妈这么好看，你自己看[脱单doge][脱单doge][脱单doge]
1676396506,0,1,False,False,感觉是生活压力太大了，会变得没有耐心，可爸可妈真的挺辛苦的，所以觉得你们配得上所有美好。希望可家能一直幸福，就算有吵架也会很快和好
1676375817,1,5,False,False,我老婆也撕过，然后她自己去本地补办
1676383859,0,1,False,False,辛苦了两位，真的很不容易很不容易，很多事不是一般人能做到的，休息一下吧（是真的心疼可妈了）
1676436305,0,1,False,False,"如果被凶的时候说一句“你凶我！”然后呜呜呜坐地上伸手“你得抱抱我亲亲我才能和好”；累的时候“啊，老公抱抱～宝宝好累哦，可不可以帮我…爱你爱你”；忙的时候“我现在事情有些着急，一会儿再帮你好不好嘛”…
难道步入婚姻，有了孩子就一定要变得像个大人，像个顶天立地的人吗？一定要理性解决、成熟解决吗？吵架如果是事情本身可以那就事论事，但很多矛盾只是情绪的问题。
而情绪问题的解决不能用理性的方式，会让矛盾更激化，也会觉得更委屈。我们很难改变对方是一个怎样的人，寄希望于对方总会让心更难受。但可以表达出自己想要的情感需求来自我救赎，就像小孩子那样，只不过这种表达能力在成长的过程中被很多道理训斥规则磨没了。"
1676386148,0,1,False,False,小时候我爸我妈吵架也撕过结婚证，奇葩的是一人撕一本，我印象太深了[笑哭]
1676387450,0,1,False,False,你们很棒了，你们是一个team，抢要对准外面，你们是对方的依靠，是对方的队友，加油！！！
1676395165,0,1,False,False,有矛盾很正常，事后反思真的很重要，祝好
1676422816,0,1,False,False,王德龙你好好反思吧啊[嗑瓜子][嗑瓜子][嗑瓜子]
1676427639,0,1,False,False,就是生活压力太大了，太压抑了，有压力多打几场扑克不就没有事了(ಡωಡ)hiahiahia[doge][doge][doge][doge]
1676380567,0,1,False,False,菜米油盐酱醋茶，生活就是琐事，再好的感情也更需要维护，而不是感觉进入婚姻就不需要维护和经营了，希望可妈可爸给自己放松一下，幸福快乐！
1676439393,0,1,False,False,压死骆驼从来不只是那一根稻草
1676387287,0,1,False,False,好久没看B站 居然二胎都这么大了，可爸肉眼可见的唇色发白一脸疲惫
1676392723,0,1,False,False,其实很能理解可爸可妈 生活压力确实太大了[tv_流泪]
1676378065,0,2,False,False,我只看到了恩爱[星星眼]
1676393516,0,1,False,False,可能还有工作还得还房贷
1676376145,0,2,False,False,多多小可爱拍照还会说不要拍吗[吃瓜]
1676381742,0,1,False,False,感觉可爸可妈对待婚姻的观点一直没变，保持着初心啊[给心心]
1676376439,1,2,False,False,结婚证，好像只有离婚的时候有用吧[doge]
1676435640,3,0,True,False,[妙啊]春晚的小品没你俩我不看
1676379689,0,1,False,False,今天一定要再看一遍《诺丁山》[脱单doge]
1676380564,0,1,False,False,感觉拍结婚照的时候可妈也在偷偷报复[doge]
1676377192,0,1,False,False,想听可姐的劝架过程[doge]
1676386922,0,1,False,False,生活琐事和各种压力，让感情没那么简单错碎了。
1676383148,0,1,False,False,你们给自己找太多事儿了。
1676427103,0,1,False,False,[笑哭]那我觉得我确实应该给自己安排个沙袋挂在家里。。。。
1676436320,0,1,False,False,感谢可爸可妈能够复盘这一经历，如果每一对夫妻都能够及时复盘，反思自己的问题并及时改变，生活会更从容，家庭也会更幸福![支持][支持][支持]
1676389905,0,1,False,False,感觉这期很现实 很多话很有现实道理
1676387533,0,1,False,False,你们上一次办结婚证我就看过了，当时肚子里好像还有一个小宝宝[大笑]原来四年了吗？时间过得好快
1676383156,0,1,False,False,我现在学会了，只要对象一起火，我立刻：你干嘛~哎吆
1676432040,0,1,False,False,最主要还是读博压力，太难了，顺利挺过去！！可爸一定要多包容，多宠溺可妈
1676378458,0,2,False,False,可妈的项链是哪款的？[微笑]
1676376448,0,2,False,False,沟通确实非常重要！！！
1676432487,1,1,False,False,民政局：你们是真会找事[doge]
1676387833,0,1,False,False,可爸可妈真的都很棒
1676423201,0,1,False,False,感觉很谢谢可爸可妈真诚的分享给我们生活的点滴！新的一年大家肯定都会越来越好的！
1676384588,0,1,False,False,人生必经的婚姻阶段，相信你们能够幸福开心一直相伴的，喜欢你们俩在一起的样子。
1676403071,0,1,False,False,我家那本是第七年撕的🤪
1676393344,0,1,False,False,共性大于个性！！可爸可妈太甜辣[鼓掌]
1676378667,0,1,False,False,我小时候也给我姥娘说，我爸妈总吵架，我爸总拿出来说我败坏他的形象[吃瓜]
1676447275,0,1,False,False,哈哈哈 想起春晚小品
1676389877,0,1,False,False,新年感觉大家压力都好大呀[捂眼]
1676442642,0,1,False,False,又了解到了婚姻的一面，[点赞][点赞][点赞]
1676382099,0,1,False,False,希望可爸可妈一直幸福下去，共渡生活的难处，小粉丝一键三连默默支持
1676385449,2,0,True,False,希望可妈的视频都能配字幕，在办公室摸鱼看[脱单doge]
1676430704,0,1,False,False,"补办结婚证时，能重新拍照片吗？
因为当时拍的那个照片……"
1676394985,1,1,False,False,全程看得人有点窒息和压抑。。。果然这才是真实的婚姻
1676389983,0,1,False,False,还是全是自己承担费用压力太大了，现在大家都啃老，可妈可爸靠自己咋跟一个level别的同龄人pk呀。小孩还是让社会劳动来承担吧，毕竟清华的时间用来挣钱多好，或者让父母帮着承担费用啥的。
1676383955,0,1,False,False,可爸和可妈都好好[大哭]日子会慢慢过下来的，希望你们都勇敢地熬着熬着
1676378126,0,1,False,False,可爸：错错错，是我的错
1676431125,0,1,False,False,题外话:求个可妈马甲[呲牙]
1676386420,0,1,False,False,三连啦，希望未来可以像可妈可爸一样幸福
1676377054,0,1,False,False,可爸的反思确实是有点走心了
1676377791,0,1,False,False,这期分享好真诚且很有启发性[打call]
1676390194,2,1,False,False,让让wdl嘛
1676383280,0,1,False,False,WDL全责[生气]
1676377729,0,1,False,False,可爸真是人间理想[保卫萝卜_哇][保卫萝卜_哇][保卫萝卜_哇]
1676377259,1,1,False,False,@GavinRans 可妈撕了结婚证😂
1676393377,0,1,False,False,深度绑定的两个人 轻易离不了婚
1676377560,0,1,False,False,好想看可姐劝架复盘！
1676430727,0,1,False,False,三联了 为可爸可妈 然后说不定有一起看的时候
1676446556,0,0,False,False,上热搜之后好多没关注的路人也看了确实因为可妈开始的言论产生一些错误印象，感觉确实在这样的一个视频里这么说不太合适啊，说自己没有错这种可能对方或者粉丝是能理解的，但是给路人的感觉就是一副女王的样子
1676430644,0,1,False,False,为啥没有考虑嚷父母搭把手照顾孩子呢 感觉太累啦
1676378809,0,1,False,False,天呢，可爸和孩子道歉这点真的很好[大哭]父母争吵就是童年阴影
1676385683,1,0,True,False,一直盯着项链 是dior么？还是啥牌子？想要！
1676411680,0,1,False,False,虽然夫妻生活各有各的过法，但一定要有个人认错，又或是可爸把错都揽在自己身上这种行为，让我很不舒服。
1676379335,0,1,False,False,happy wife happy life
1676403165,1,0,False,False,以前小时候父母经常在我面前吵架，我可能会怕可能会不敢说话，到了初高中我是无视，再到现在读完大学，父母就很少在我面前吵架了。为什么？因为他们吵架我就开骂，而且他们两个人都骂不赢我这种[脱单doge][脱单doge]
1676439822,0,1,False,False,看来婚礼长期是办不成了
1676378160,0,1,False,False,我就知道今天有虐狗套餐[doge]
1676383935,0,1,False,False,可妈真的好美[脱单doge]
1676379636,0,1,False,False,好想知道可可给姥姥咋说的哈哈哈
1676383566,0,1,False,False,唉我觉得两个人压力都太大了[2233娘_大哭]
1676385981,0,0,False,False,看完视频又感叹可妈可爸的压力实在是太大了，太多大事都赶在一起，而且大家都很优秀都想好好对待。不过这一次吵架应该是很有价值的吵架，至少在压力这么大的情况下被动按了暂停键，大家有机会停下来重新想想为何出发、重新寻找合适的道路，这样可家就能大步跨进更美好生活啦！未来一定是更美好的！！！
1676385541,0,0,False,False,可妈叙述的三件事，其实未婚狗单纯听起来都不是很大的事，还是夫妻平时积攒的压力太多了，一下子爆发出来；很感谢可妈可爸展示生活的不易，平时自己看到了太多的光鲜亮丽，其实每个人都不容易。加油，别生气，别泄气。
1676391822,0,0,False,False,"我爸妈也会偶尔吵架，几年一次那种。
不会动手，就干吵。
双方情绪都不对的时候吵架确实可以解决问题。"
1676447252,0,1,False,False,@Kerau_ 乐
1676375897,0,2,False,False,可妈今天好漂亮
1676405475,0,0,False,False,抛开事实不谈，WDL有什么错呢，他只是行为颇为的直男[藏狐]，羡慕可妈多爸[奥比岛_点赞]
1676387267,0,0,False,False,特别赞同一个观点：家人（包括夫妻）之间不能太过论对错，我觉得可妈也并没有真的觉得就是可爸的错，听完全程，两个人都很理智，而且感觉可爸可妈的婚姻更加厚重了。
1676414293,0,0,False,False,确实不容易，压力大啊，谁的生活不是一地鸡毛，笑对人生，加油
1676424647,0,1,False,False,脚本分镜可以看看影视剧风的闪电分镜
1676379608,0,1,False,False,可爸是全职博主吗？
1676431834,0,1,False,False,看得出来很凶
1676423765,0,1,False,False,看到弹幕里有人提INTJ，所以可爸是INTJ？
1676381352,0,0,False,False,我爸妈有一次吵架就撕过结婚证，结果去民政局补办的时候，说之前那个结婚证不符合规定，然后办完新的和我说我不是他们结婚后生的娃，他俩才结婚[喜极而泣][喜极而泣][喜极而泣]
1676404141,0,0,False,False,这最后不亲一个，给大家撒波狗粮[doge]
1676436056,1,1,False,False,如果是难的撕的话会怎么样呢？
1676392691,0,0,False,False,幸福与压力并存，这是一道辩证题
1676381108,0,0,False,False,一直觉得可妈和可爸很牛了已经，而且都很上进，可妈清华读博，学业压力大，年纪轻轻还照顾两个娃儿，可爸暂时应该是家庭的主要经济来源，这几年从买车到买房，其实也是看着变得越来越好吧，可爸工作能力应该很强。两个人都不容易捏，可能等娃儿大点，不用操很多心的时候压力就小点了，情绪也会好点[胜利]
1676444371,0,1,False,False,咋说呢，刚才从一个视频过来说学生时代在一起，现在多么多么多么恩爱，一群人搁哪歌功颂德，就挺好笑的[喜极而泣][喜极而泣][喜极而泣]结婚了不都是有摩擦，不都是有吵架有压力吗？谁比谁高贵[捂眼][捂眼][捂眼]
1676400335,0,0,False,False,结婚证：下次吵架你们可以约去学校操场单挑啊，戴上拳套，来一场势均力敌的较量，干嘛啊哎呦[脱单doge][脱单doge]
1676383020,0,0,False,False,这一期看得我真是又想哭又想笑，过去这半年我过得很难，学业事业家人全方位打击，一直靠可妈视频续命。以前总觉得可妈就是我的榜样和奋斗目标（不论是学业还是选老公的眼光哈哈哈哈）。看完这一期，才发现原来大家都一样，一样要面对各种压力和矛盾。而在这种情境下，你俩相互理解、理性思考的样子真的太感人了！（ps：WDL你要对可妈更好！！！这么好的老婆可太难找了！！！）
1676382809,0,0,False,False,想到了金斯伯格，正好最近看了异见时刻，可妈的学术、育儿和家庭各种压力的情况跟金斯伯格还挺像，金斯伯格虽然当时就一个孩子，但还要照顾患癌症的丈夫，压力应该也不小，夫妻之间最重要的还是相互理解和扶持吧，加油！
1676382773,0,0,False,False,好真实的婚姻生活，我知道美满和谐完全不吵架没有矛盾的夫妻确实存在，但是于大部分人而言起码我来说，这是不可能，生活总是会有摩擦的，我自己一个人都会和我自己生气内耗，更何况是两个人以及两个人组成的婚姻生活，问题发生来临，不一定是要找一个人担全责这很无理取闹（在我看来，更重要的是平复稳定情绪，找问题所在根源，下次不再有同样的问题。
1676385311,0,0,False,False,去年九月领的证，疫情期间宣誓台不开放……顺义人民终于在视频里看到了，好羡慕呀~~
1676381900,0,0,False,False,我之前觉得可爸可妈是神仙爱情，无数次因为我没有这样的爱情而难过。今天谢谢你们告诉了我人间真实（不是说看学霸考砸幸灾乐祸），我将更加客观看待我的生活，终于放过自己了。真的谢谢你们
1676380414,0,0,False,False,可爸可妈真的好努力，也好正能量，作为同龄人对比起来真的愧疚。读书，工作，婚姻，带娃，挣钱养家，当两个人这在一段时间里一起承担这所有的事情，难以想象压力是有多大。幸好你们有彼此可以依靠，手牵手一起跨越大大小小的困难，未来一定会更幸福[给心心]
1676381273,0,1,False,False,呜呜呜，这期视频真的很有意义哇[保卫萝卜_哭哭]
1676381025,0,0,False,False,如果真的到了忍不住想要大吵大闹的时候，还有一个选择就是先离开可能会发生争执的环境，出门走走冷静一下。
1676380697,0,0,False,False,[藏狐]可爸现在小嘴叭叭这么能说，到那会儿又控制不住自己了[doge]
1676419831,0,0,False,False,《男人来自火星女人来自金星》
1676380689,0,0,False,False,撕了结婚证就没法离婚得捆绑一辈子了呀[脱单doge]
1676445592,0,1,False,False,热搜了[脱单doge]
1676380793,0,0,False,False,生可可我单身，生多多我单身，补办结婚证我还单身[囧][囧][囧]
1676380699,0,0,False,False,同龄人都未必结过婚；可爸可妈证儿都补办过了[doge]
1676381666,0,0,False,False,"能在今天的日子发出这样的视频，看得出可妈可爸这段时间的状态的疲惫，也能看出你们对婚姻生活的负责，敢于揭开伤口和我们分享，有很大的意义。我和你们一样大，很羡慕你们的爱情和婚姻，但也看出了巨大生活压力下两个人总有矛盾的时刻，希望可妈可爸适当减负，给自己生活点空间，你们感情会更好的！
最后，可爸全责[doge]"
1676380626,1,0,False,False,我们在一起两年，结婚一年，我还在纠改他老抬杠这个毛病，每次抬杠都会整的我哑口无言一肚子火不知道该怎么跟他沟通，给他讲明白要花上好长时间，超级心累。
1676382576,0,0,False,False,害，原来所有家庭的烦恼都这么相似，希望可家永远幸福快乐，烦恼消失消失
1676379754,0,0,False,False,我觉得吧，不管是谈恋爱还是结婚了都不要把“不过了”“那就分吧”这种话挂嘴上，每次说话的时候都先过过脑子，别后悔自己说的话就行
1676380089,0,0,False,False,我觉得最近可以多拍拍生活vlog ，这样可妈不用有那么大的文案压力，可以把主要精力放在学术上，可爸负责后期也有更多的主动权。
1676380172,0,0,False,False,可爸可妈看起来都蛮温柔的，难以想象吵起来是什么样子
1676382206,0,0,False,False,太真实了 但凡能长久在一起的 哪对不是互相包容 迁就 反思 改变过来的呢 慢慢地磨合…蜕变…
1676443836,0,1,False,False,窒息了，感觉好像跟我老公也是这样，沟通很无力，稍微抱怨一下就教我做人
1676381959,0,0,False,False,天哪！说真的，大概三年前我也撕过，所以我也很后悔……但是这个证还可以重新申领。吃惊！考虑再去补领一个
1676384901,0,1,False,False,Happy wife happy life!
1676443200,0,0,False,False,婚姻的幸福还是要建立在经济基础上，现在催生备孕，而且没上班，胖了20斤不说，本来就是敏感的人，双方家长不理解，很无奈
1676390530,0,0,False,False,非常理解，谈恋爱的时候吵架很简单，但是还没结婚的我们就因为买房背负贷款，经济比较紧张而容易爆发矛盾，对金钱敏感，想到那么多压力就感到无力[笑哭]
1676380027,0,0,False,False,我父母就是小时候在就好吵架还打架，感觉我都是那种很敏感的人，真的害怕我以后结婚吵架打架的我感觉好吓人[委屈]
1676382302,0,0,False,False,感觉像自己结婚一样……云“婚姻”，爱情的《五三》哈哈
1676379776,0,0,False,False,我觉得有感情基础的夫妻谨慎说出不过了这样的话，很伤人的
1676376178,0,1,False,False,省流：补办结婚证，没有可可多多[doge]
1676389475,0,0,False,False,结尾没有亲嘴儿，爷青结....[doge]
1676387952,0,0,False,False,真的一些描述好像我爸爸妈妈的感情状态，我一直觉得可以改，我妈说那是改不了的，两个人彼此之间太太太太了解了，感情真的需要呵护
1676380947,0,0,False,False,可妈可爸真人生导师[打call]
1676379685,0,0,False,False,在照顾娃和学业事业的同时可妈可爸也要让自己适当放松，不要太累了
1676402140,0,0,False,False,可爸可妈的视频对于快要进入婚姻阶段的人很有启示，例如我
1676381991,0,0,False,False,王师傅和小毛毛[妙啊]虽然离了，但还是好朋友[妙啊][妙啊][妙啊][妙啊]
1676447645,0,0,False,False,相互理解吧，生气什么都解决不了
1676384013,0,0,False,False,跑个题，可妈越来越漂亮了
1676408375,0,0,False,False,这期视频让我们看到了岁月静好背后的一地鸡毛，非常真实。[爱心]感谢分享！
1676395617,0,0,False,False,可爸可妈绝对是我人生轨迹上特别是对于婚姻的指路人。
