上传时间,回复数,点赞数,up是否回复,up是否点赞,评论文本
1676435935,0,8,False,False,结婚马上十年了。我们是2013年1月4号领的证。算是比较有意义的吧。后来在那年的四月份，因为吵架，ta把我的那份结婚证撕成了碎渣。后来因为要补证，ta的那份证书被收回了（想想还不如收藏着）。补完的证是5月份，没有了任何意义。再来的2015年，因为吵架离婚，隔天复婚。再后来2018年，又因为吵架离婚，隔天再复婚。这次之后，有因为吵架办过了两次离婚，都是因为冷静期30天，所以不用再离。说这么多，是想发泄一下。还有告诫大家，不要把离婚总挂在嘴边。我对任何仪式上的东西没有任何感觉，所以想守着这份感情，在我看来离和不离是一样的，只有情在即可。但是，任何离婚的行为是会在感情上留下伤痕的，奉劝大家不要轻易的学我，万一哪天重归于好，也会恍如隔世的。
1676385344,0,17,False,False,"因为父母原因，从小就情绪敏感外加内向孤僻。从初中到大学都不擅长和人相处，经历过孤立无援的境地但也只能自己支撑。
但幸运的是认识了现在的男朋友。跟我相反，他是从一个父母关系稳定的家庭出来的。在我生气想要冷战时他总是问我：要喝奶茶吗？每次这样我也就开始放松。
相处将近六年，发觉自己情绪稳定很多。而且我认为，要学会告诉自己开心最重要。如果生活里有太多琐事，那就适当慢下来。只是可能需要用一辈子自愈了。"
1676434982,0,4,False,False,热门来的 感觉你俩好疲惫 可能长期休息不好真的会影响情绪
1676416082,4,9,False,True,WDL真的好摩羯[嫌弃]理智冲昏头脑，吵架迎难而上
1676383801,0,25,False,False,平时看视频我们可能只看到了可爸可妈拥有两个可爱的小宝宝，有房有车，读博创业，在这些幸福的背后，当然也有很多伴随而来的压力，希望大家都互相理解，互相包容，开心过好每一天呀[拥抱][爱心]
1676389911,8,31,False,False,高学历，思想又深刻，条件又好，两个人又恩爱，这样的人的婚姻都好难，看得更不想结婚了[囧]
1676444947,0,6,False,False,今天撕证，明天就打人，暴力倾向的人赶紧拉倒
1676433001,0,6,False,False,20岁生日那天爸妈吵架打架，我下跪请求妈妈不要再跟我爸打了，因为我很怕我爸真的下死手把我妈妈打出什么好歹出来。一想到这些还是控制不住眼泪，所以以后真的不要结婚生孩子，一切感情只会在柴米油盐中消磨殆尽。[拥抱][怪我咯][怪我咯]
1676379376,0,21,False,False,前面发生的事我都能理解双方的情绪，觉得各自的委屈和由头都能共情。但最后那件吵着吵着摆烂了脱口而出不过了，真的太狠了，无法共情，我听着都觉得诛心刺骨，当事人承受方得有多难受。还好双方都乐意放下自己的不服气，好好的沟通妥协退让，各自都有所行动来挽回关系，没有放任矛盾扩大，没有含糊其辞的混过去。夫妻之间或许就是要经历着生活的锤打磨炼，在磨难里学着磨合协作，祝可爸可妈风雨同舟的路上都能各得其所[拥抱]。
1676426852,0,7,False,False,觉得可爸可妈可以试试冥想，吸引力法则和许愿（虽然可能可妈在学马哲跟这些灵修类的东西或许稍微有点不是一个体系），一切当下的不顺利都会过去，你们真正的亲情和爱情和知遇之情确实是不会被表面的琐事所埋没的，感谢你们一家人的分享和真诚，也感谢你们的很多想法给我提供了很多关于各种事物认知的方向～祝你们的婚姻幸福美满，一家人身体都健健康康，感情长长久久[给心心]
1676442691,0,3,False,False,笑死，我爸我妈倒是老吵架，我感觉已经是吵架了，大吵大闹的，结果他俩倒不觉得。。。。有一次他俩已经很过分了，我直接开炮让他俩过的下去过过不下去就离婚，结果搁第二天人家两和好了，，，，感情气的一晚上没睡着站在两边给他俩做心理开解的就我一个呗[灵魂出窍][无语]
1676380106,3,12,False,False,"我小时候我爸爸妈妈吵架，妈妈摔东西砸到了我（因为我试图劝架挪到了他们旁边然后被误伤了）记得那次如果不是我胳膊挡了一下，那个巨大的装满东西的沉重的购物袋会直接砸我头上的
我胳膊挡了一下，结果大臂和肩膀上被重重砸到划伤了一大块，我一边流血一边想哭一边发抖
然而爸爸妈妈没人注意到我，我一个人眼泪鼻涕糊一脸自己走着去找诊所大夫（就在旁边几栋楼门口很好找）

真的是童年阴影之一，当时我还没上小学[酸了][灵魂出窍]"
1676426842,0,6,False,False,想起《父母爱情》，安杰和江德福相互迁就，相互道歉，就很美好很长久
1676394094,0,7,False,False,"抱抱可妈 生活一定会越来越好。
最近看可妈视频，总觉得可妈很疲惫，带孩子，做课题，录视频……各种压力堆在一起，就会让人挺受不住的。希望可妈多和可爸交流舒缓自己的情绪，不要一直压着，要开心要快乐呀！我喜欢由内而外散发快乐充满活力的可妈！[给心心]"
1676375980,4,37,False,False,实不相瞒，想撕结婚证的，绝对不止你们俩
1676432663,2,10,False,False,虽然是看视频（没有针对up的意思啊），但是有些女的在她自己真的错了的时候，还在死咬着说自己没错的真的挺E心的。
1676382553,16,8,False,False,"我不知道如何去形容   你先按女生的宣泄的来，问题之后再提  这件事[辣眼睛]可能我是钢铁直男吧。
如果鼓励这样的事情，难道不会让女生觉得自己的判断永远都是对的吗？当然这只是我的单方面忧虑[酸了]大家可以自由讨论，但不要过激"
1676377721,0,34,False,False,很真诚的分享！可妈读博做up主带娃，真的是给自己压力很大了！我觉得你们各自需要一定自己的时间，让自己休息。婚姻里也是需要呼吸的。
1676434935,1,9,False,False,好撕
1676376425,0,24,False,True,我靠 谁不看活该单身一辈子
1676376592,1,27,False,False,"不是原则性问题其实都可以睁一只眼闭一只眼           
                                               ——某智慧男生留[doge]"
1676385790,2,7,True,False,可妈有没有推荐好看的饰品，快到我女朋友生日了，我想给她买个饰品，例如：项链 手链啥的
1676377580,1,22,False,True,懂了，《孙子兵法》才是婚姻圣经
1676442945,0,4,False,False,一个家的事说大不大，说小不小，老夫老妻吵架正常，压力大也可以理解，但是永远不要提离婚之类的鸭～希望可爸可妈一直幸福[脱单doge]
1676377755,4,42,True,False,好奇可妈和可爸大吵一架之后会不会冷战呀，又会怎么和好呢？[拥抱]
1676378932,0,13,False,False,感觉可妈说着说着都哽咽了！WDL对可妈多理解一点！（呜呜可家要幸福喔 不止情人节快乐）
1676440612,0,5,False,False,我是真的佩服可爸可妈[支持]读博期间结婚生俩娃还买房买车这压力挤在一起可太大了[笑哭]不过熬过这几年往后真的会轻松不少
1676418640,0,4,False,False,我快30了前一段还因为爸妈吵架自己偷偷哭，真的从小吵到大，特别不喜欢这样的家庭氛围
1676435530,0,3,False,False,贫贱夫妻百事哀啊。。。没有钱真的很难开心
1676393965,0,5,False,False,作为过来人，早生娃，虽然早期会有很多事儿，但是孩子一旦成长起来，对相对年轻的父母来说，还是好的方面居多
1676440113,0,4,False,False,大数据恐怖如斯，刚好下周末就要去领结婚证咧，提前预习一下[星星眼]
1676441213,0,4,False,False,本人多年（七八年）的感情因为这些分手了，希望可妈可爸坚持下去，我想看一下这个问题的最优解（加油）[加油][加油][爱心]
1676380975,0,14,False,False,看到第七分钟突然想到吐槽大会，我隔壁宿舍就会定期开吐槽大会，每个人都把自己的观点和情绪抒发一下，难得的是每个人都是对事不对人的性格，所以宿舍感情一直很好，感觉吐槽大会这种形式也可以用在夫妻/情侣之间（主要还是看双方能不能接受，不接受的话就成没事找事了）
1676378488,0,21,False,False,光鲜的视频前，总有茶米油盐的幕后。可爸这次也教会很多，说到底还是可爸可妈压力大了，还是要找到合适的抒发渠道
1676403267,1,2,True,False,好家伙，我能咬成这样，我得多大能耐啊[doge]
1676434118,2,4,False,False,我记得我小时候我爸我妈吵架，我担心我妈所以去敲我爸妈的门，结果我爸一开门直接把我推倒了，让我滚
1676393151,1,4,False,False,不是很懂，脚本不能商量么？不是可妈的好吗？男方全职运营？“吃干饭”说的真有点狠了。
1676381423,0,8,False,False,为什么我关注的博主都有撕结婚证然后补办的情节，是我的问题[微笑]
1676376289,1,12,True,False,我有个问题，结婚证不补也行吧？平时用的上吗
1676425314,1,3,False,False,怎么说呢…这样分享也蛮好的，分享婚姻美好的同时，也要揭露婚姻的真实，再恩爱的夫妻也会吵架也会有矛盾，只是因为相爱，所以才愿意和好。
1676380783,2,8,True,False,可妈是不是纹眉毛了，真的好好看！！！！真的好好看！！！看得我明天就想去预约47
1676386878,0,3,False,False,真的，个人觉得这种真实的婚姻日常更好磕。可爸可妈在如此大的压力下，爆发争吵，度过冷静期在其中去反思，最后做总结。虽然问题说大不大说小不小，甚至撕掉了结婚证，但是他们依旧选择跟对方去再次补办去想要把日子过得更好。这是真的令人羡慕并且是非常能磕点。最后在孩子面前吵架的问题，本人是从小在家庭吵架中度过的，个人的状况到现在23都不是很乐观，所以确实要注意。可爸也在视频里保证了，我相信可爸可妈会做到，并且会越来越好，等到两人以后回忆这段往事绝对会更加幸福！祝福你们可爸可妈，新婚快乐！！！！[打call]
1676401488,0,3,False,False,当两个成长速度不一致时，往往就是婚姻走向坟墓的开始。
1676439119,1,4,False,False,不懂就问，我从搜索栏里看到视频在自动播放，加没加播放量？
1676381653,0,3,False,False,其实这样的视频真的会更真实，我们在生活中真的不会一直只有开心！酸甜苦辣才是生活，有哭有笑[给心心][给心心]
1676376764,0,15,False,False,可爸这个共情能力有待提高啊，进步空间很大！
1676376716,1,15,False,False,属于是硬凑情人节vlog了[脱单doge][脱单doge]
1676401973,0,3,False,False,太理解可妈了，光是读个博，我都感觉自己的狗命快无了[藏狐]
1676380669,0,12,False,False,把撕碎的结婚证裱起来警钟长鸣[吃瓜]
1676382658,0,6,False,False,“所有的久处不厌都是用心经营的结果。”
1676441094,0,4,False,False,初见照相馆？
1676384694,1,6,False,False,要不把房子卖了吧，真诚建议[拥抱][拥抱]
1676376202,0,22,False,False,可爸：我还要剪一遍加深反思哈哈哈哈哈哈哈哈
1676435574,2,5,False,False,想看可爸可妈一起看离婚综艺《再见爱人》的reaction！！
1676428889,0,3,False,False,可妈，你们前期压力确实好大，但是之后一定会特别幸福的，会有钱有闲哒
1676435460,0,4,False,False,可妈可以讲讲你们吵架结束以后是怎么复合的吗😊
1676434772,0,3,False,False,对不起，明明是吵架复盘。这个氛围怎么有点搞笑啊。这俩人复盘的样子还有点可爱。
1676382727,0,9,False,False,"看完真的是觉得有些问题是没有办法解决的。
比如一方太累了，对对方有点失去耐心了，这点真的很像我，我就是如果太累的话，真的是想躺着一句话都不想说，但是如果此时另一半对你有需求，这种状态就会让对方觉得你心不在焉或者态度不对，虽然事后第一时间也会觉得自己做的很不好，但是，也明白如果以后还遇到这种比较down的状态，可能自己还会这样……
总之这种争吵可能是没有办法避免的，所以我感觉能做的就是当大家兴致高昂的时候能多一些二人空间，出去散散心，多看看自然风光，给对方准备一些惊喜，多一些独属于两人的甜蜜瞬间，在一些矛盾时刻或许可以抵御双方的负面情绪，尽量不让情绪激化。
生活很累，忙忙碌碌还是得记得去生活，人就是为了这一点点的幸福，才负重前行，所以要记得那一瞬。"
1676377367,0,8,False,False,这个话题我也能有同感了，弱弱说一句我的结婚证就是蜜月旅行回来收拾行李复盘的时候撕的，一直没好意思去补办，也不知道可以补办，到现在已经第七年了。。。同理也非常认同可妈的话。吵架不代表没有感情了而只是希望大家一起能走的更远更好。
1676397193,1,2,False,False,爸妈吵架 太痛苦了 尤其是吵得妈妈离家出走然后把孩子带上了
1676391771,1,2,False,False,高三那年 家里吵架 一个喝了酒拿了把菜刀 一个从厨房搬了罐液化气 然后我就报警了……[无语]
1676391375,0,4,False,False,我觉得可爸可妈相处模式已经比我周围大部分的家庭要成熟得多了……
1676446031,0,3,False,False,上热搜了[无语]这狗粮都有热乎的了
1676445645,0,6,False,False,好炒
1676376184,4,13,True,False,1:33 惊现草莓印[吃瓜]
1676421407,0,2,False,False,讲得太乐观了，不是各自自我反思的问题，而是非理性的人际关系问题，这才是矛盾所致的关键。如果你们还是止步于反思的环节，问题是不会解决的。
1676443436,0,5,False,False,😓
1676438427,0,4,False,False,撕身份证也没啥用呀，到时候有需要了还得去补办[tv_点赞]
1676405067,0,2,False,False,读博和照顾两个年幼的孩子压力都超级大，真的很难想象两个事情加在一起....可妈一定要照顾好自己[大哭]
1676433084,0,4,False,False,我看着相处模式有点不太健康[tv_笑哭]，好好在一起吧
1676379317,0,9,False,False,我还怕省流的没有审美审辨清楚，重新看了一遍[笑哭]，结论：可爸全责！ 不过能理解，可能现阶段的吵架只是一个结果，原因是其他，好好坦诚沟通是可以解决的，情绪解决不了问题。不过我好像也学到了，结婚证可以撕还可以补[笑哭]
1676375659,0,34,False,False,开头就这么劲爆吗[妙啊]
1676434294,0,2,False,False,但是拍视频复盘的时候嘴上都说自己没错，吵架时更不会说自己错了，现在可爸能说都是自己的错，吵起来可不会说，会激化矛盾的。
1676375850,0,19,False,False,撕结婚证是夫妻吵架的必经路吗[笑哭][笑哭][笑哭]
1676378099,0,7,False,False,两个优秀的人，偶尔慢下来甚至停一会也没什么，相互抱抱，别那么大压力吧。
1676428773,0,3,False,False,至理名言 happy wife happy life
1676421227,0,2,False,False,就，少管家务事吧[保卫萝卜_哭哭]弹幕里有些说的啥呀，咱旁观者也不一定清啊
1676427724,0,3,False,False,其实就是累脱序了， 情绪也是要精力控制的。
1676390808,1,3,False,False,刚看到开头抓伤打架就不想看了。对up夫妻有点印象，应该都是高学历人才，连你们这种都难免吵架打架撕离婚证，真的觉得婚姻太难了。。。
1676443711,0,2,False,False,应该是最近都感觉压力很大，才吵架的，但已经是非常优秀的年轻夫妻了，即使吵架了也会很好的沟通，而且也都各自复盘反思，这就是学霸的过人之处吧，夫妻相处之道真是个大课题啊，大部分夫妻都没法避免，好像只有越吵才能越理解对方，这么看吵架也算是个沟通方式，就是这个沟通方式有点累
1676431321,1,4,False,False,看到案主可妈上来就说自己没有错，觉得很不舒服。家庭的问题并不是对错的问题，是体谅和同理。
1676375919,3,15,False,True,八卦一下，可爸可妈会在可可多多面前吵架吗[脸红]祝大家今天开心[喜欢]
1676378108,1,8,False,False,我以为是可可和多多撕的[tv_笑哭][tv_笑哭][tv_笑哭]
1676377850,0,6,False,False,每个男人都想在家讲道理[脱单doge]
1676375692,1,26,False,False,快复盘一遍可妈的情绪管理课
1676393713,0,2,False,False,想知道可可在姥姥面前怎么说的[吃瓜][吃瓜][吃瓜]
1676387829,0,2,False,False,真的是人生开了二倍速，可爸可妈能做到这样已经很让人佩服了，确实放在普通人身上会崩溃的，但确实也收获了平常人没有的幸福，希望可爸可妈多想想这些幸福的瞬间，更多的是能体验生活的种种。一些浅薄的建议吧。祝可妈顺利毕业，两位宝宝健康成长，可爸可妈事业顺利~
1676435368,0,3,False,False,好家伙，上热搜啊
1676431310,2,3,False,False,智者不入爱河。
1676394366,0,2,False,False,可爸的压力真的有点大
1676434126,0,2,False,False,我和我老公在一起16年才生的孩子(恋爱九年)，一样要疯了，各种事情搞到一起让我觉得前面十几年感情一笔勾销了一样，我们原来真的一直很好的
1676376012,0,11,False,False,看完了，情人节清流就是你啦[吃瓜]
1676418866,6,2,False,False,其实在孩子面前吵架到不算什么，孩子也会认识到人和人之间总会有摩擦。
1676377553,0,7,False,False,很高兴在情人节听到关于爱情清醒的言论[给心心][给心心]
1676387490,0,2,False,False,你们要不断更一下吧 不然太累了 好好调整一下状态呢[给心心][给心心][给心心]
1676376921,0,7,False,False,在恋爱和婚姻中真的是一点鸡毛蒜皮的小事就会搞得双方都不开心，所以双方能够独立且有稳定的情绪和解决问题的能力是走入婚姻的第一步呢，但现在我还不具备这些能力哈哈哈[doge]
1676376545,0,7,False,False,可爸会反思已经很不错了！！可妈可爸要幸福呀！！！！！不要再补办结婚证了[doge]
1676381879,0,4,False,False,"整了视频不就是happy wife,happy life[兔年][兔年][兔年]"
1676393461,0,2,False,False,春晚节目源于生活哈哈哈[笑哭]
1676434718,0,2,False,False,表面再好，婚姻不都是一地鸡毛吗，消耗两个人的心力去维持这段关系比分开还要不容易。
1676395865,0,2,False,False,希望我们都不被生活打压得喘不过气，希望现实的压力不会磨蚀真挚的感情。
1676445753,0,2,False,False,【容易情绪化怎么办？6个技巧让你成为情绪稳定的人-哔哩哔哩】 https://b23.tv/l2IuFQF[tv_斜眼笑]
1676378129,0,5,False,False,生活中，是爱人更是并肩作战的战友，互相体谅互相支持，才能奔向共同的目的地，才能实现共同的目标[给心心][给心心]
1676376975,0,8,False,False,[抓狂]可妈辛苦嗷 学业家庭事业顺顺利利的！！
1676378772,0,5,False,False,结婚证这东西，正常夫妻估计都撕过😂
1676377048,0,4,False,False,"呆在一起太久了，会吵架正常[喜极而泣][喜极而泣]，重要的是吵架以后双方对这件事的反思和成长，总归是要遇到对的那个人,才能一起面对这些生活琐事一起走下去，紧张的时候给自己一些时间放松放松也是好滴"
1676375760,4,11,False,False,打架能把脖子上打出红点！？[无语]
1676376149,0,15,False,False,WDL认错大会
1676377375,0,5,False,False,母单23年半，突然感觉俩人吵吵架也挺好的[藏狐]
1676376438,1,5,True,False,[笑哭]就我想知道照片是哪儿照的
1676377136,0,5,False,False,救命，好喜欢这种会反思在孩子面前吵架的父母。我要用我的后半身去治愈我童年的幼小的心灵[大哭][大哭][大哭]
1676437366,0,2,False,False,感谢可爸可妈把这段发出来。原来家家都有本难念的经。读博的确压力大，可妈找到自己受用的发泄方式吧，推荐选一种自己热爱的运动方式，固定时间练，把所有的负面情绪都借机释放掉，对待可爸和娃们就更多的是积极的一面了。单看这视频，个人感觉两个人好像还没有完全过去。很像我和我老公吵完架，没完全过去的感觉。加油，等过两年，可妈拿到学位，突然发现天更蓝了，云更白了，鸟儿唱的更动听了，身边的可爸优点光芒闪耀，缺点也都在可接受范围内了。哈哈。熬过了带俩娃，熬过了博士毕业，估计就没有啥能撼动你俩坚固的感情了。祝福可妈可爸和俩娃！
1676438315,0,2,False,False,喜欢这期视频，尤其是可妈可爸理性的分析与思考。偶尔吵架才是真实的生活。
1676443393,0,2,False,False,预订今年春晚内容
1676423756,2,2,False,False,我上大学都有做梦梦到爸妈在吵架，然后哭醒了
1676384741,0,3,False,False,可妈看着还是有点生气 德龙（不知道是不是这个名字了）你可长点心吧
1676389160,0,2,False,False,看到可爸可妈的这个分享，我觉得启发更多，我跟男朋友在一起七年已经订婚，我在上研三他已经工作，也会因为一些压力的问题而在对方身上撒气，好在我们都一样坚信未来还是有对方更好。我们吵架之后也会复盘，在反思和沟通中也成长了
1676442314,0,2,False,False,这不是春晚内容?
1676379364,2,1,True,False,想知道撕证那一刻，可爸是什么反应[哦呼][吃瓜]
1676375636,0,10,False,False,怪不得喜提了新结婚证[doge]
1676376476,0,9,False,False,BV1Wd4y1o7FW你们不是第一对这样的up主[脱单doge]
1676390543,0,2,False,False,啊我就是沉浸一年多考研+工作……也可能快两年吧，姐姐二胎了？我村通网了……我的记忆还在姐姐复学的时候[喜极而泣]
1676376863,1,6,False,False,去找@沈奕斐 老师！
1676378528,0,4,False,False,岔个题，可妈这件针织背心好好看[喜欢][喜欢]
1676376816,0,4,False,False,可妈真的理想伴侣(我是女生)
1676384036,0,3,False,False,真是很用心的拍摄，很真诚地诉说生活
1676377305,1,7,False,False,https://b23.tv/nZDZJUA来一个
1676440774,0,3,False,False,为啥你们也不是大富大贵还要生俩？？？
1676376916,0,3,False,False,可爸金句：婚姻其实不是爱情的坟墓，很多事情要从自己身上找问题
1676388787,0,4,False,False,抱抱可妈[拥抱][拥抱] 可妈衣服好好看，有链接吗[喜极而泣]
1676378150,0,3,False,False,可妈的表情跟我妈刚和我爸吵完和好一摸一样救命哈哈哈哈哈
1676387046,0,2,False,False,好好笑啊，本大学生听着很带劲[大笑][大笑][大笑]
1676378022,0,2,False,False,8：28 在说完“这些都是财产”之后剪掉了什么？[妙啊][doge]
1676377743,0,3,False,False,所以我觉得婚姻幸福真的很不容易[灵魂出窍]
1676393087,0,2,False,False,我一直以为这个账号名字是可爸可妈[笑哭]
1676381000,0,2,False,False,真的要告诉他们，爸爸妈妈不会分开，让他们有底。我记得我小时候我爸我妈总以为我爸喝酒的事情吵架，严重时候我妈有一次就哭了，不过初中之后再也没有那种大吵架了。不过我还是很害怕很害怕他们会有感情纠葛啊什么的，虽然我知道，他们感情很好，但是就是心里面总是在害怕。高中有一次他们俩在我考试前一天吵架，就是一点小矛盾都没喊起来，我第二天考试满脑子都是他们俩会不会分开啊什么的，潜意识就是在想，那次考的特别差，我妈就后悔为什么非要那天吵架。孩子还是很敏感的，真的要给足安全感
1676382030,0,2,False,False,感谢可爸可妈这么坦诚，其实坎坷波折也是婚姻的常态，值得被分享[给心心]
1676375706,0,9,False,False,祝可妈和我情人节快乐[脱单doge][脱单doge][脱单doge]可爸随便
1676380791,0,2,False,False,"谁说婚姻是爱情的坟墓
应该反过来
爱情是婚姻的坟墓🪦[脱单doge][doge]"
1676442877,0,1,False,False,不过说真的，在经济条件没有稳定的时候，为啥要生二胎[思考]必出事啊，，，要说开，一定要说开，不能一方想着忍忍就过去了，有一说一你俩其实也不能叫做结婚了好多年，话说不开一方一直憋气下场很惨
1676397141,0,1,False,False,可爸想拉人聊这个我有体会，我以前做片子之前也特爱拉人聊，关键聊的这人还给我不了啥建议，就是随声复合（小组作业那种），这种感觉巨无力，就有种“我难道是欠你的了？”的感觉。然后到头来我本来是想让大家集思广益的，结果啥点子也没有想出来，整的人家还不乐意了，这种情况真的是极其的无奈了。[捂脸]
1676375973,0,5,False,False,省流：补办离婚证[doge]
1676377107,0,6,False,False,happy wife happy life [脱单doge]
1676375666,0,7,False,False,《可可多多撕的》[doge]
1676438411,0,1,False,False,你删我评论我就继续发，大家千万不要学，会影响孩子登记的！
