上传时间,回复数,点赞数,up是否回复,up是否点赞,评论文本
1675948770,0,5,False,False,我18年的时候在翻译公司实习，前台接待客户，南京的。一天就五十，还不包饭。到一天给五十，周末双休。一个月也就一千出头，而且每天通勤都要八块，人都麻了。每天回到学校的时候食堂都没饭了。一天的钱只够午饭晚饭加通勤
1675952656,0,4,False,False,我现在是设计师里面最会做咖啡的，是做咖啡里不一定最会设计的呜呜呜呜！
1676337606,0,0,False,False,下午要去面试设计师助理，早上就在主页刷到这个视频，这波是及时止损
1675915723,0,5,False,False,省流：洗孩子[doge]
1675936900,0,4,False,False,月薪0.00亿在学校听课[tv_笑哭]
1675915283,0,5,False,False,省流：去洗孩子了
1676439835,0,0,False,False,助教 底薪2000+奖金400，每天三个半小时
1675922612,0,4,False,False,[藏狐]我同学也设计师助理，但是已经转正了
1676355586,0,0,False,False,同专业干了一年多的告诉你，别说1500大多数设计师看你是个小白根本就不想要你，甘愿联系别人的助理来帮忙
1675916248,0,5,False,False,我寒假在影城兼职，六天赚了760，莫宝别季度[打call]
1675952458,1,4,False,False,莫宝莫宝，一起来电焊吧，这是属于男人的浪漫[doge]
1676038126,1,2,False,False,实习医生没钱就算了 专硕规培还特么的没钱 还好劳资有单位[藏狐]
1675931208,0,5,False,False,护士实习还每个月给医院钱[大哭]
1675915589,0,4,False,False,哈哈哈哈哈哈哈哈可以呀0.08w涨到0.15w了
1675915730,0,4,False,False,学会了，要找最漂亮的树吊死！[脱单doge]
1675920588,1,4,False,False,实习工资那么低真的 不如不干了
1676030219,2,2,False,False,幼师自主实习一个月1200包吃，一天啥事都干累得要死[大哭]
1675937498,0,3,False,False,哟～涨工资了。根本花不完[脱单doge][脱单doge]
1675949835,0,4,False,False,那不如抽两个粉丝洗孩子吧（[doge]
1676012652,2,2,False,False,电视台实习：0元
1675935440,3,4,False,False,[脱单doge]我也想洗孩子
1675917305,0,16,False,False,我们是朋友 可以把我的鞋子带去免费洗嘛
1675954588,5,4,False,False,20年实习深圳当设计助理，1500不管吃住，6个同学合租倒贴上班，大饼里的五险一金也没有，实习要一年才给转正。5个月跑路了，本身性格导致沉没成本极低，摸爬滚打了挺多行业，现在兼职打假，一个月1-4个左右，不稳定[热]
1676017953,4,2,False,False,[囧]可能我这个专业方向，好找工作吧，实习7k转正13k base深圳 不过拒了
1676015197,1,2,False,False,我现在就是应届毕业生，之前来学校宣传的一个公司说我们应聘设计师的话得学三年，并且三年没有工资[阴险]
1675916689,1,3,False,False,洗鞋的工作也介绍我一份吧
1675915750,3,12,False,False,为什么重庆找工作这么难 我不理解[笑哭]正在春招emo中
1676034982,0,2,False,False,（没有专业领域的人际关系）任何专业的尽头是体力劳动
1675915586,0,8,False,False,哥，擦小白鞋吗？[doge]
1675929450,0,4,False,False,可不可以教我怎么洗孩子 我的孩子总是洗不干净
1676029967,4,2,False,False,兼职教小孩儿画画，一个月去13天，一次顶多俩小时，挣了快2k[妙啊]
1676000660,0,2,False,False,月入1500生龙又活虎[嗑瓜子]
1675946936,0,3,False,False,1200的代课老师前来报道[微笑]
1676392929,0,0,False,False,说一下我本科专业金属材料工程  我本科同学去钢厂 已经一年了现在一个月八千在我们这个三线小城还是很舒服的  刚进去工资也得有个四五千啊 [笑哭]
1676016965,3,4,False,False,设计师助理我们这才600一个月，基本都是贴钱上班，干一年也没机会做设计师[doge]
1676019047,0,2,False,False,工资扣完还剩一千三百多，还算轻松，有双休[藏狐]
1675918027,0,4,False,False,莫宝你是我最好的朋友，可以帮我洗孩子吗[大笑][大笑][大笑][害羞][害羞]
1675934607,0,4,False,False,莫宝，看着你逐渐成熟，如果有一天你要是突然发达了，也算是一部成功记录史，为后面的学弟学妹们提供成功的方向
1676008761,6,2,False,False,求个推荐，在南京的女生，没技能。想找工资四千以上，可以熬时间上班，单休，没五险一金也行，有好厂也行，不过还是希望可以摸鱼有福利
1675920247,2,4,False,False,实习这么低的嘛…广州实习虽然也没有太高但是还是有3000的虽然可能不包饭[囧]
1676421655,0,0,False,False,你小子干自媒体，一年少说百万rmb起步，还吐槽哭穷
1676370950,0,0,False,False,设计师助理？工资800一个月是吧[doge]
1675916153,0,4,False,False,省流：莫宝去洗孩子了
1676011657,0,2,False,False,重庆环境检测行业，底薪3000，7个点绩效，到手五六千，周六经常加班，全重庆到处跑
1676015148,0,2,False,False,我实习没工资[大哭][大哭][大哭]
1675959746,4,3,False,False,河南某地设计师助理一个月500元还不到[辣眼睛]
1676440576,0,0,False,False,哈哈哈哈哈哈哈哈哈哈哈哈哈哈几天不见干了这么多事了哈哈哈哈
1675915479,0,5,False,False,设计师保姆
1675933760,0,4,False,False,呜呜呜呜好想跟莫宝谈恋爱我就是好喜欢他他好可爱呜呜呜
1675915313,0,3,False,False,没关注但是第一时间刷到了[doge]
1675953622,1,3,False,False,今天刚入职，啥也不懂。具体工资，实习时间啥都没问，就屁颠屁颠来工作了。
1675939648,0,4,False,False,什么，本设计师也天天打电话，床换了自己车螺丝[doge]
1675917507,0,3,False,False,国贸专业毕业，但是讲解员[脸红]
1675946409,0,2,False,False,哈哈哈哈哈真实又辛酸@dkk睡不够
1675916330,0,4,False,False,这么一说我们公司找的那些眼视光学的专科生已经很舒服了，有些留下来的底薪比我一个工作十几年的还高[doge]
1676007095,2,2,False,False,靠啊，我妹实习副班主任，带初中生，就包住，还不包吃，一分钱工资也没
1676346883,0,0,False,False,哇，你们实习还有几千毛钱的工资。（来自一毛钱不发的医学生）
1675936415,0,4,False,False,谢谢莫宝给产设人打开新思路，下半年实习找个花店打工去[脱单doge]
1676260034,0,1,False,False,年级轻轻就高达0.15个w
1676010563,1,2,False,False,电厂工人，月薪三千八，好消息是国企不容易失业。
1675936528,0,3,False,False,我咋记得我去年毕业实习的时候也是当设计师助理，那时候一天100块呀，今年行情这么惨了吗？
1676395089,0,0,False,False,我发现我这份销售比你们都好多了，毕竟不看业绩只看能力
1675915986,0,4,False,False,有没有一种可能，牛都没有你累，因为不用天天耕地的[doge]
1675917527,1,3,False,False,为什么设计专业的实习章能去找鞋店盖啊？这个真的可以吗？
1675961986,3,2,False,False,实习不是p个章上去就好吗[吃瓜]
1675919695,0,4,False,False,骗人 助理只是兼职[doge]正儿八经的工作还得是up主
1676370842,0,0,False,False,我们这，养猪的，驻厂，6000起步
1675958096,0,3,False,False,看错了，以为你找了1万5的活，嫉妒的我连忙点进来
1676410153,0,0,False,False,我第一份设计师助理800一个月我永远记得
1676336362,0,0,False,False,问一下，你为什么没有去打电话或者车螺丝，再或者是打电话叫人来带电话车螺丝
1676161352,0,1,False,False,我在现在这里专门给定制家具公司做广告，（每天早安，专卖店店面广告）然后闲的要死，没事就摸摸猫，撸撸狗，没打卡包吃住早八晚六中午俩小时一个月3k5，现在又学了效果图，十块钱一个平方，一个月摸摸就4k，已经知足了，八点上班不打卡通常八点半才起床，老板娘看到也不会说[Muse Dash_爱了爱了]
1675915312,1,4,False,False,省流：球鞋护理师[doge]
1676085788,0,1,False,False,"准备月底辞职跑路，不干设计师助理了，我这边公司真正有能力的助理都跑了，基本都是因为赚不到钱，没有晋升空间跑路的。但可悲的是每到毕业实习季，为了学校对口专业实习三方的学生们，绝大多数刚刚出来，都去到了这些吸血的狗公司里。[辣眼睛]
哈哈哈月底跑路啊，就没有画图加班不得画图费，也不会在活动期，第三方督战队的视野里，上30天一天14小时的班，每天都是精神的折磨。[囧]"
1676009082,4,4,False,False,😲原来，除了幼儿园代课老师工资是1500还有别人也是[大哭]
1675916162,1,4,False,False,实习工资刚好和我生活费一样，一千五，干着保育员的活，但是只有保育员一半的工资[星星眼]
1676382515,2,0,False,False,没事啊 我去学校实习 工资0
1675965405,0,2,False,False,莫宝莫宝真不考虑去讲脱口秀吗
1675947495,0,4,False,False,笑死，我毕业一年半了，考了两次研究生没考上，上了三个月的班辞职了，在家待了好久了
1675950180,0,3,False,False,省流:洗孩子[脱单doge]
1675955992,0,3,False,False,私企单休小人事，干四年了最近刚调薪到手4100，够了够了[笑哭]。
1676006141,0,2,False,False,还行吧，我大学学视传的，我实习找我爸公司盖了个章。但有个同学，去了个公司实习，钱少抛开不谈，第一天有二十多个实习生，一去，跟他们说“这周你们每人交50个原创ppt模板，每个不低于10页”，第三天就剩10个人了，第二周就剩我同学和另外三个大冤种，第三周全跑了[吃瓜]我同学一分钱没拿到，倒贴了不少车费饭钱，不幸中的万幸是章盖了
1676436427,0,0,False,False,双休3000，单休5000 麻了
1676114904,1,1,False,False,我一天帮忙看孩子写作业工资500  可惜一周只能去一天[妙啊]
1675953729,0,3,False,False,我虽然没有每个视频都看 …但是烙铁们我每次看都暴笑如雷[大哭][大哭][大哭][大哭][大哭][大哭]
1675956623,0,6,False,False,上个助理同事四川跑南京过来工作500一个月 现在跑回成都了，继续卧底不对是助理1.5到2好歹人家能裹住自己[大哭]
1676026442,1,3,False,False,量化私募，实习一天1000[doge]
1675917173,0,6,False,False,莫宝莫宝，几天不见这么拉了？
1675991210,1,2,False,False,设计师，真的别来！互联网红利已经没了
1676091449,0,1,False,False,工作特别累的不一定工资特别低，但是工资特别低的一定工作是最累的，[脱单doge]
1675916731,1,3,False,False,我妈的餐厅服务员也有至少3500[妙啊]
1676002006,2,2,False,False,正在大学毕业实习工程师，月只有7100包吃住，已经准备跑路了
1675916042,0,3,False,False,我是粉丝 孩子寄给你 帮我洗[脱单doge]
1675995655,0,2,False,False,玛德好恐怖，跟我生活费一样多
1675939174,0,2,False,False,！包饭真的很不错[大哭]
1675916236,0,3,False,False,原来我们那么近阿[doge]，招聘会就一家建筑设计
1675918451,0,2,False,False,找不到工作就去看店了[辣眼睛]
1676347417,0,0,False,False,刚找到，一天200[难过]
1676179185,14,1,False,False,来做维修佬吧[笑哭]，日薪0.2k到0.8k左右。
1675915932,0,3,False,False,哪里洗，我也想要70w的up主给我洗孩子[doge]
1675949551,0,3,False,False,合肥财务专业，只有客服，销售，代账[辣眼睛]
1675915843,0,3,False,False,包饭和洗鞋免费确实令人心动[喜欢]
1675953485,0,3,False,False,我这里能赚钱的工作就，去卖钢材公司，塑料公司，和家具行业，塑料基本不请员工，都是家族企业，钢铁公司赚的钱最多，也是最经常招人的 家具其次拍第二，但是去钢材公司那边上班就是要小心有那些载着铁的大货车，除了那个高峰期的时间点不能进去之外
1675917895,6,3,False,False,相比较我们实习待遇还是可以的[大笑]，补助一个月九百+额外的辅导费一个月一千多  最后拿了0.9w[偷笑]
1675959958,0,2,False,False,二十年前一千五真不低了
1676053052,0,1,False,False,最近面了个865的实习，3k，不包吃住，广州，感觉有点点低。hr说要跟着正式员工参与开发，不能摸鱼…
1675942873,0,3,False,False,狠狠地心动了！！！还需要人不[星星眼]
1676212017,0,1,False,False,你看这孩子笑得多开心[doge]
1676385227,0,0,False,False,不会还有人实习工资1200吧！
1676290953,0,1,False,False,看到视频我都有点后悔拒绝那个到手9k左右但要求接收长期出差的工作[笑哭]
1675915636,0,4,False,False,"高情商：鞋子护理师
低情商：洗臭孩子[doge]哈哈哈哈哈哈哈哈"
1675919421,0,3,False,False,笑死了我大三实习根本没工资，白干三个月
1675915650,0,7,False,False,多好啊，这设计师助理全方面学习[星星眼][星星眼][星星眼]
1676110121,0,1,False,False,23应届生学弟学妹来找我内推，tier1级别的国企[兔年]
1676077121,0,1,False,False,笑死，学校会抽的
1675961939,1,2,False,False,靠 都不容易啊家人们[大哭][大哭][大哭][大哭]
1676179294,0,1,False,False,Tm设计助理还不如销售
1675939300,0,3,False,False,我只想感慨，原来实习还给钱啊，我们是去老师手底下打工，给不给钱我都不知道[保卫萝卜_哭哭]
1676036033,0,1,False,False,你是真的秀[大哭]
1675933279,0,3,False,False,想当年，我实习都没钱[妙啊]哈，现在都不知道当时怎么想的[tv_笑哭]
1676444543,0,0,False,False,律师助理一样的
1676045605,0,1,False,False,我就是设计师助理，1800单休[大哭][大哭]
1675966210,0,2,False,False,23毕业生，5k好歹够俺活[调皮][调皮][调皮]
1675917637,0,2,False,False,我可以找莫宝洗鞋子吗[doge]
1676028007,0,1,False,False,哈哈小盆友可爱
1675942277,0,2,False,False,比土木强100倍我不是夸张
1675982195,0,2,False,False,有一段确实对，一种活儿进工厂，一种活儿是人力资源公司，一种活儿是客服网店电推。其实小地方就这些东西，剩下的吃喝拉撒人家有坐商或物流。
1676181109,0,1,False,False,也是学设计的，在一家婚庆公司搞照片调色，一个月0.19w单休包吃住，就是住宿环境差，伙食差，老板差，加班没工资，假期少
1676169232,0,1,False,False,养蛊的（不是）一个月3000，10月底开始休息，到1月份他都给我发工资[脱单doge]
1675960988,1,2,False,False,莫宝，我今天刚因为工资低不想去做，看了你这个视频我又有动力了[委屈]
1675952864,5,2,False,False,我以为银行暑期实习一个月2000够低的了
1675962125,1,2,False,False,笑死了风景园林设计也是，不过还好1000一个月她包饭哈哈哈哈
1676173199,0,1,False,False,想当初我就是臭打电话的1200
1676374103,0,0,False,False,真的这么难嘛…………
1676047754,0,1,False,False,找到份3700一个月包吃住的实习，但是越做越觉得这个工作做不下去了，每天只有食堂的饭菜能让我振作起来，饭菜挺不错[笑哭]
1676181303,0,1,False,False,"整个社会现在就是，销售、客服、进厂。
你让年轻人怎么办呢？"
1675958367,0,2,False,False,我打螺丝22一小时，每天十小时，一个月都有六千
1676085897,0,1,False,False,不如我土木施工员实习，月入0.09w
1675960833,3,2,False,False,就一个章的事，没必要花这样的精力去干这些活，划不来，拿这时间去规划下自己准备干嘛，哪怕是考研考公它不香吗
1676304569,0,1,False,False,IDC运维，社保工资扣，包住，双休，月4200，转正5000，夜班补贴节假日三倍补贴，年终奖。忙的时候能加班一周，闲的时候能玩手机一个月，腾讯机房，左手毁服务器，右手炸核心
1675964492,4,2,False,False,兄弟们转行转啥呀，室内设计加班虽然一个月偶尔几天到22-0点，但是真的深夜感觉很低落心累也身累 回去凌晨就是只能躺着了啥也干不了，虽然一个月就那么几天但是真的控制不住的情绪低落，现在辞职很迷茫[tv_难过]刚毕业半年已经换了两份工作了
1676013578,0,2,False,False,1500？我一个月交的保险跟税都得两三千[跪了]
1676034487,0,1,False,False,漠叔多少岁
1675943089,0,2,False,False,在家附近找的实习工作 也是包饭的 我已经很满足了
1676181392,0,1,False,False,底薪4900，得靠加班费吃饭[微笑]
1676045845,0,1,False,False,你剪视频的能力已经5000保底了，当然了，看你想怎么活而已[doge]
1676081482,0,1,False,False,有没有那个可能，洗鞋店是莫宝开的哈哈哈
1676118755,0,1,False,False,别说了。。。师范生工实习，工资都不给的[doge]就是免费劳动力
1676133317,1,1,False,False,领导让我招实习生，2500的试用期工资，我都不好意思发[辣眼睛]，发了到现在一个联系我的都没有[呆]
1675952042,18,3,False,False,占个顶楼，养猪可以来找我，本科以上场外也可以推荐，我河南农大的，牧原算是校企[脱单doge][脱单doge][脱单doge]
1675917414,1,1,False,False,无语了，我们老板开了一个店，就是球鞋洗护，结果三个月倒闭了。你这个机器我都知道，半自动洗鞋机。还有烘干机，铁丝刷，洗鞋带的用彩票粉，还有染色的，各种各种我全知道。[脱单doge]
1675915657,0,2,False,False,莫宝像老嫂子[星星眼][星星眼][doge]
1676012354,0,1,False,False,呜呜笑不出来
1675928399,0,2,False,False,哟 怎么改标题了[脱单doge]
1676301391,0,1,False,False,说得我都心动了，要不你去做打电话来拧螺丝的工作吧，肯定做得得心应手。
1676084713,0,1,False,False,哈 800已经不错了…我们这招设计师助理前三个月没有工资 之后1000一个月 转正的话2000 但是啥时候转正看老板心情…我招人都不好意思招…之前的四个助理全走了……
1676082578,0,1,False,False,年轻还好，年纪大了还会被hr质问，你没结婚没生孩子的一律不要哎
1675961357,1,2,False,False,网管，2.7k，看是上班8小时，实际上班3小时，剩下五小时边玩手机边等下班
1675915679,1,30,False,False,莫宝你这个状态，可以整个水滴筹[doge]
1675955249,0,2,False,False,心动了，俺们规培200/月 还是餐卡
1675916432,0,2,False,False,解放鞋从来不洗[doge]
1676084287,0,1,False,False,笑着笑着就哭了😭学设计的感觉自己毕业连助理都当不了，专业技能学了个寂寞，而且基本功也退化到和牛马没学过美术一样，在网上赛博站街卖画也不可能了
1676047606,2,1,False,False,重庆，一座奥特曼飞过都要留下来做两个月客服销售的城市[笑哭][笑哭]
1675929981,0,5,False,False,你们盖章这么难吗[辣眼睛]随便找个工作室不就可以盖了吗
1675946046,9,2,False,False,[doge]你第一句话我就应激了好嘛
1675966067,0,2,False,False,真好，我之前实习就没有过工资，不过也是说累吧不是很累，不累吧每天都去上班，主要是时间短一般就一个月左右
1676115721,0,1,False,False,就我本人的看法，感觉除了机电那些自动化的专业其他都不好找工作，尤其是计算机的，自从19年疫情开始就扑街到不行了[微笑]
1675953587,3,2,False,False,太淦了明天刚好要去面试设计师助理[大哭][大哭][大哭]
