上传时间,回复数,点赞数,up是否回复,up是否点赞,评论文本
1675916282,79,12531,True,True,三种工作好真实……打电话的 车螺丝的 打电话叫你来车螺丝的
1675931283,430,5695,True,False,这我不得不说了 我养猪的实习工资6000怎么说[豹富]
1675919773,80,6354,True,True,不如搬砖[doge]
1676043085,7,367,False,False,🙋🏻‍♀️表示已经熬到设计师的前设计师助理表示：up一点都不夸张！设计师助理一月0.1万，设备自备，吃饭自费，工具自备，打杂小跑学会自卫，处理人际关系你还得都会，到了年底一摸手机好家伙：欠费..[热词系列_肥肠自信]
1675945425,42,3693,False,False,"毕业前：我学的可是xxx专业。
毕业后：1500就1500。"
1676123945,16,197,False,False,告诉你一个实习的好办法，在大学成立一家自己的公司（成立公司是免费的，至于业务，每年让爸爸妈妈给自己做一单就好了，反正你只要成交一单，也算是有业务的），然后自己刻章，自己给自己盖实习证明就好了。
1675915786,96,5310,False,False,一个月0.15万感觉好心酸
1675917277,25,4036,False,False,省流:月薪0.15w包饭
1675944337,31,1917,False,False,为了能盖章完成实习成功毕业，广大毕业生让老板们体会到几个月无与伦比的人口红利…每年有这么几个月，怪不得老板们越来越舍不得开工资了…
1675948761,41,332,False,False,"毕业前：经济学我能找不到工作？
毕业后：两千够了"
1675924107,25,2383,False,True,孙悟空来重庆都要打个电话才能走[灵魂出窍]
1675915765,73,2106,False,False,玛雅 现在实习工作这么难找吗 我还选了个新专业都没几届毕业生 现在很慌[保卫萝卜_哭哭]
1675919787,26,805,False,False,当年一个游戏公司来我们学校把我招去实习原画，800一个月包住宿，一个月后我走了，他还扣我200，说我不符合要求。[微笑]
1675961886,38,639,False,False,我是学机械自动化的  开数控车床  两班倒  实习工资5000一个月 转正7000  工作不算太累 空闲时间也多  但是吃住都是这里了  很多时候都在车间  人的欲望也降低了  二十一岁的年纪已经感觉到这辈子跟同龄异性没有机会接触 来往了  些许恐怖[捂眼]
1675946269,17,205,False,False,重庆只有四种职业，餐饮，销售，车螺丝，打电话的
1676007730,17,307,False,False,医学生表示实习没工资宿舍给自己找，不包三餐什么都不包，实习结束不包分配，本科医院都不要，博士才考虑，你可以发现医院附近的宿舍只有楼上最顶层才有人住，而且还是阳台，一个阳台全是考研生，只有规培才有独立房间，独立厕所，其他人都是挤一间房间加上公共厕所，都研究生了还有人上厕所不冲厕所的，那才叫一个心态[热词系列_肥肠自信]
1675946737,20,176,False,False,我今天去面试的是直播助理，但是培训的时候成了主播。[喜极而泣]
1675941743,53,555,False,False,都来做客服吧，电商客服永远缺人…无经验要求，主要打字快就行[难过]
1675936555,10,476,False,False,您好 白色网布鞋怎么洗 布那一块容易脏还不好洗
1675937569,51,488,False,False,"酒店实习工，无社保，包吃包住，可调休8天，月1600，➕夜班补贴节假日三倍补贴全勤奖，满三个月+没走奖励100，实习也有年终奖
转正后月3500➕以上补贴➕社保……
感觉我这上一份工怎么还不错的呢[无语][无语][无语]
可惜已经辞职了……"
1675969327,8,244,False,False,实习的时候自己找了个客服活，从3k的客服干到了5k的美工，老板还想留我给他当助理[doge]
1675930078,12,108,False,False,"咱们就是说，寒暑假兼职当助教，时薪30很轻松，一天就上六小时，双休，一个月加全勤和一些体验课帮忙有4000[喜极而泣]
我觉得实习生工资是比兼职工资低的多得多的，还累"
1675959012,10,85,False,False,听我们室内的老师讲工地贴瓷砖每个月都有1w了，环艺人还在打白工。。。。。。。好累
1675922079,6,99,False,False,我当时在医院实习的时候工资为0 每月两次加班 加班费共50 相当于50/月 这么一想800块我依然很嫉妒
1676009672,14,136,False,False,学医实习：0元
1676038628,7,31,False,False,刚才看到一个在德国实习1500欧而且一天工作量巨少的😭
1675915692,1,198,False,False,拿最少的工资，干最全能的活[doge]
1675917782,7,113,False,False,重庆工作：1.销售 2.推销 3.化工 4.车螺丝 5.打电话推销.（我这里是这样，其他的不说没有，就是要求高的离谱，动不动就2_3年工作经验）
1675978508,6,182,False,False,确实啊，好的工作人员流动性很低，像我们队四年了才走了三个，其中两个还是考出去的，剩下那个去跟朋友合伙干工程。工作轻松私人时间充足工资比同等高三分之一。。。，谁愿意走啊
1676041545,6,25,False,False,[翻白眼]现实就是混到经验就赶紧溜，跳槽是最好的加薪途径
1675934743,12,181,False,False,广告学专业，在去温州水果店削水果的路上，一个月0.5k，包住不包吃[酸了]
1675955563,4,125,False,False,这么说我感觉我上一份工作也挺好，三线小城市5800扣完社保5200然后再来加班费，就是工作时间很久，下班晚上早就8点晚就11点半走起，周末经常加班，可惜已经辞职了
1675916371,10,186,False,False,1500招不来农民工 但是能招来一大摞大学牲[笑哭]
1675916028,1,97,False,False,"“夫人！找到少爷了！在洗鞋子！”“什么？快带我去见他！”
到了那地 只见他缓缓抬眸：不了，这儿包饭"
1675916050,0,69,False,False,有人看段子，有人照镜子[doge]
1676045569,2,27,False,False,[微笑]说个真实的，我朋友前天说他们单位招扫地阿姨，贼闲，早上扫一次，下午上班扫一次，然后就可以跑路，还能打包饭堂剩下的菜。双休，能早退，3400一个月，包吃，节日加500，年底奖金6500，工会那些洗发水沐浴露米油电影票都是一样拥有。我真的心动了，每天去扫两下地，这妥妥像个兼职一样。我想少走几十年弯路，还能直接干到退休。他们却嫌弃我太年轻。
1676013819,6,31,False,False,在面包工厂干过一年夜班，该说不说，真的很闲，第一年整体工资就4000-5000左右，不高也不低，干熟练了每天晚上9点去打3小时单子就能回去睡觉了，忙完就刷B站打游戏，还可以拿面包蛋糕吃，干了一年鬼都不怕了，就是还年轻，还想去大城市闯闯，去年辞职了，虽然有点可惜，但也收获了很多[兔年]
1675930530,23,115,False,False,敲他美的，动画专业的辛辛苦苦做7天测试，做完问你愿不愿意3个月无薪资实习培训再底薪试用三个月再考核转正，我倒贴给你打工[脸红]
1675916510,2,63,False,False,笑死我了，也太真实了吧，我学姐学设计马上也要毕业了，现在在宠物店给宠物洗澡hhh
1676083013,2,12,False,False,之前还笑莫宝，这个月就找了个800的实习
1676167404,2,4,False,False,设计师助理我当时实习一月1500，不管吃住[柚恩不加糖_呆滞]
1675921643,5,102,False,False,麦麦打工吃劳饭还有员工折扣哦[喜欢]
1676025332,0,11,False,False,我妈觉得现在的人月入过万才正常，还问我一个月有多少剩的
1675963617,1,28,False,False,0.15万有点磕碜了，我们这里都是1.5k，整整翻了十倍[doge]
1676004827,0,21,False,False,以前那家公司，招了个211的高分子材料高材生进去，培训完把人丢到工地管材料，那少年不服气去找人力，人力问你是学什么的，他就回答高分子材料，人力听了马上说，高分子材料不也是材料吗，让你管材料就对口了[笑哭]
1676113435,0,8,False,False,以前看不起我爹天天追债，现在我只想工资3000活到月底
1675916791,0,53,False,False,我以为你当设计师助理还要给设计师洗鞋[笑哭][笑哭][笑哭]心想“现在助理都干到这份上了？”
1675943580,4,35,False,False,? 我暑假去电子厂穿防水圈，就是把两个电线穿进圈里，包三餐住宿有热水淋浴，一个小时16块，我一个月挣了五千多[辣眼睛]说实话，感觉当大学生不如进厂，厂里还有空调可以吹（工作间）
1675940396,5,43,False,False,nm我实习可是打白工啊，还不包吃不包住，实习四个月倒贴6000焯
1676013962,1,19,False,False,"毕业前在学校的幻想:我学这个专业，出去一定能找到好工作，工资怎么的都要5000以上吧！啊哈哈哈。
毕业后:2000就2000，饿不死就行，其他的不敢想了[大哭]"
1675952962,1,32,False,False,大四哪会我同学开了个画室，我们一窝蜂的跑去他那盖章去了[喜极而泣]
1675919439,0,42,False,False,"我发布了一篇笔记，快来看看吧
我发布了一篇笔记，快来看看吧~
https://www.bilibili.com/h5/note-app/view?cvid=21718703&pagefrom=comment&richtext=true"
1675929529,2,44,False,False,别怕 医学实习永远为你兜底[微笑]
1675937052,12,201,False,False,阿b这是在干嘛啊[doge]
1675932949,5,40,False,False,我真建议美术生可以去学一下调漆补漆hhh，我爸（苦力活出身）50岁去学的，不太需要很多美术功底，最重要的是你能调出一样的色，然后给他补成跟原先差不多的，调的好的话网上接单一单挣的还可以捏。
1675948336,0,37,False,False,"请选择你的英雄：
800的设计师助理
1500的洗鞋（包饭还有提成）
选择的权力给到大家
不好意思，我是个俗人，我选择洗鞋"
1676127458,2,8,False,False,妈呀 哥们大四动画 听室友实习动画补帧一个月就两千多我还觉得可能公司没找好 原来大家都是这样的…… 家里亲戚过年还劝我出去闯闯 哥们还是算了收拾收拾回家继承家里的小破厂了 虽然小县城环境差点但是辛苦一些一年几百个还是有的……
1676096508,0,6,False,False,当你觉得你工资低的时候总有人在替你美好。[藏狐]
1675938025,2,35,False,False,审计实习一天一百，从此过上下班电量还有80%的生活，不怕失业怕猝死
1675915772,6,31,False,False,"不会吧不会吧，这年头还有人在做设计师助理吗？
看这个岗位要求，你不说是设计师助理，我还以为你在招总经理[doge]"
1676107512,0,7,False,False,我给我爸妈打工，每天只有下午工作三小时，工资1500，一年只休息一个月，每月零花钱1w[脱单doge]
1676007036,1,15,False,False,"刚开始看标题《心动了！可是工资1500呀！！》
看完视频再看标题原来是《心动了！工资可是1500呀！！》
中华文化 博大精深 诚不欺我"
1675942249,12,41,False,False,法学生在律所实习一天50，要干四个多月才给盖章，还要租房，我直接倒贴
1675925489,5,30,False,False,我现在实习，工资一千包吃住（二人间有独立卫浴和空调，吃是公司食堂）每天上六小时，周末双休，有节假日，姐妹家离我公司十几分钟（我们在一个城市找工作）可以一起出去玩好快乐[保卫萝卜_哇]
1675958462,9,28,False,False,"pdd100+块盖章包回访，公司还是真实存在的。
不是我不想实习是和复试冲突了"
1676004728,0,11,False,False,感觉没啥人劝退设计类的专业，明明这玩意大部分加班和计算机是一个级别的，工资还低[捂脸][捂脸]
1675918281,5,26,False,False,嘿嘿，师范生实习，没有工资，不包吃住，路费自付（不过无所谓，我会去我爸的学校划水[脱单doge]）
1675949370,16,20,False,False,我一个月四千有双休不加班，上班可以刷手机看视频，工作不累环境好，每天还有饭补[Cat2_Nyampage]
1676107352,0,5,False,False,1500挺高了 我每个月利息才600
1675922293,0,28,False,False,学医的实习生甚至交钱实习[doge]
1675916415,0,20,False,False,前途光明我看不见，道路曲折我走不完（唉）
1675921637,22,94,False,False,22届毕业生还在家待业，我看了一下南昌的工作，销售居多，而且写字楼里好多皮包公司，有的公司有五险还算做是福利...
1675963877,8,15,False,False,设计师 在杭州，2022应届生，某上市公司月薪10k[脱单doge]
1676085132,0,3,False,False,好米！工资发了1500，给姐姐转1314，还有186是我的身高！结婚！
1675987673,11,9,False,False,现在工地的工人一个月干满30天平均工资9000，不过没有五险，一般包住不包吃。
1676020662,5,8,False,False,重庆现在不是销售 就是打电话 找工作都找麻了 前段时间我找实习 人家给我800块呢 设计师助理 不包吃 还要求我会PS CAD Ai 最好还会pr帮他剪辑 尼玛一天上班8-8 我说我考虑一下 第二天他给我回信息 说已经招满了 反正重庆大多数说是办公室文员的基本上是带点销售性质  而且都有7天试岗期 试岗期没工资就离谱[保卫萝卜_白眼]
1675999636,2,11,False,False,医院实习不仅要给医院钱还不包饭[微笑]
1676037382,1,6,False,False,来发一条正常一点的评论吧，随便进个厂，月入三四千一点问题没有。为什么一定要去那些地方卷呢？我不知道。屏幕前应该有很多和我一样的厂狗吧，看这个视频可能会想，原来我还不错？大家都不爱评论，评论的也往往是up这一类。所以请大家不要相信，这并不是常态，而是互联网放大了局部
1676022224,1,10,False,False,我实习四个月结算一千九[保卫萝卜_哭哭]
1675932663,2,19,False,False,毕业也想当设计师来着，毕业前就知道这个行业的德性，实习去了家具店工作，毕业攒够了钱找了家建筑公司待了两个月啥也没学着，发了一千多块，算了，又去家具店了[OK]，梦想就算了吧，摆烂了
1675920783,3,19,False,False,这几天在渝北找工作，会计助理，我是精挑细选才选出来了两千的，这几天面试得都累了
1675938880,3,33,False,False,一个月1500你找不到你个农民工，但是你能找到一个大学生[脱单doge]
1675927836,0,22,False,False,师范的实习不但没钱，而且实习结束还要自掏腰包给学生买小零食[doge]
1676012032,4,9,False,False,我干保安的每天都是在银行里晃悠晃悠，包吃住。6000.没有休息，但有年假三十天。
1675915468,0,30,False,False,莫宝莫宝，你这工装不错哈[脱单doge]
1675934152,4,24,False,False,麻，之前找了个新媒体运营实习生，然后对面说招满了，有行政助理实习生来不来，我说可以，然后对面说一个月只有五百块工资还要一周上班五天，尼玛的还不如在学校的时候在教务处当学生助理挣得多一周还只要去办公室三天
1675922636,19,61,False,False,工资真的太低了，我们公司设计师助理8000+还是五年前的工资
1675937603,3,14,False,False,实习？不就是找个开店的亲戚盖个章，然后躺家里玩吗？[doge]
1675926417,1,20,False,False,这几天找工作 真的 狗来了石家庄都得干两个月的客服再走[微笑][辣眼睛][辣眼睛]
1675917390,0,20,False,False,哭死，莫宝甚至有工资，我大二去事业单位实习甚至没有工资，更不用说包饭了，我倒贴上班[微笑]
1675939547,5,24,False,False,啊？医学生实习可是没有工资的[墨镜]
1675950309,5,31,False,False,园林生看见标题1500，啪的一声就点进来了啊[大哭][大哭]
1675928711,2,36,False,False,0.4万也许请不来一个清洁工大妈，但是能请来三个大学生[doge]
1675918643,0,17,False,False,我们实习的时候也是工资三位数哈哈嗨，一起实习的同学说不如去当保安，少走三十年弯路
1675956174,2,5,False,False,重庆那边这么低了嘛，我实习我直接找的一个设计师岗位，看都没看助理这个岗位，嗯找到了，第1个月1000，第2个月2500，第3个月3000，每个月500的住房补贴，朝九晚六双休，工作内容比较弹性少的时候你可以闲得慌，多的时候忙都忙不过来，最开始大部分工作内容都不是做图，而是剪辑视频，每天都有剪辑视频，我每天最多的时候6条，最少的时候三条，每天剪辑剪辑，想文案，编文案这些鬼东西，我当时剪的都快吐了，那些素材我都快用烂了，那些文案我已经编不下去了。他们发过来的素材也是很普通的那种，拿手机在那里随便拍的，就这情况我也没办法，剪出什么鬼东西来，我只能挑挑这几条视频，截一条那几条视频，截一条显得显得他很高端的样子，后来我这边的丧事他大概是看出来了，这个路不好走了，已经赚不到什么钱了，他就不转身做抖音了，就继续回到做设计师做主图那些东西了，但是吧，我的另一个上司他没想过来，他还是得给我找视频运营，在那里让我剪。那段时间我头发掉了好多，后面我不止每天都要在那里剪视频，我还得抽出时间来做主图，还得抽出时间来给他做详情页。后面放假期间，他直接给我发了一个一堆的瓷砖图片，让我做画册，排版都可以排死人，然后我就辞职了。反正他那里面说的那个效绩，我是一点都没有看到他是怎么算的。工资还是按照底薪的工资那么给说的，效绩也没有看到，说是培训，最后全是靠我自己摸索出来的，我自己靠着自己摸索那些网站设置，每次叫我做什么主图那些图的时候，他给我的图片都没有，就是让我自己去网站上面下载，网站上面下载的那个产品图片它有水印啊，我还得在那里抠水印，我一抠就是五六张那个水印还淡淡的，他要是那种颜色深的我还好抠一些，他那种颜色淡的我在那里，使劲的在那里把他给调调调回去的那种就真的很麻烦。每次要做什么图的时候，问产品图呢，他说没有，然后又得让我自己去网站上面下载自己扣 没挺过去都有视频要剪，上午基本上都在那里剪视频，剪的快，然后我上午就剪完了，我下午就有时间做图，但剪的那个有的时候剪完视频了给凑个发过去，问他可不可以的时候，他那边又给我要求这些那些我，然后又在那里改字改那改，然后下午的时候还在做，我又不喜欢加班，也不喜欢周末加班他又不给我加班费，之后我撑不下去了，我朋友就给我推荐了一个培训机构，现在我感觉我的设计功底比在以前学校的时候好了不止一星半点了。
1676025104,6,6,False,False,我的工资也是1500，不过是美元，但是日子还是过的紧巴巴
1676031067,0,6,False,False,笑死我室友在造价事务所实习工资0不包吃不包住。一年转正工资不到0.3w。贷款上班了属于是。
1675916316,0,16,False,False,莫宝莫宝，按这么算下去，你下一份工作就是0.3万的，以此类推…成为百万富翁指日可待啊
1675946393,0,65,False,False,只能说3000招不来农民工，但是可以招两个毕业生[doge][doge]
1675942159,0,14,False,False,活动策划助理，摄影师助理，剪辑师助理，活动执行助理，婚礼策划助理，管培生，他mua的
1675945810,3,13,False,False,我还以为我的实习包食宿，工资3k已经算少了[笑哭]
1675942439,1,13,False,False,虽然但是，各位要专一，就是从事的工作要一直是这个，不要问我为什么，说多都是泪
1675918151,4,12,False,False,未来护理行业必然是朝阳产业，目前资本还没有进入，还没有大品牌建立，市场还有很大的拓展空间，不要看不起洗鞋，远远赚钱的都是一般人想不到的，如果大家都知道赚钱，要么是门槛高，要么是下的局
1675952098,2,15,False,False,"请选择你的英雄：
800的设计师助理
1500的洗鞋（包饭还有提成）
选择的权力给到大家
不好意思，我是个俗人，我选择洗鞋"
1675957506,3,11,False,False,我是建筑设计专业，看了你的视频，我感觉我已经半截身子准备入土了。
1675916737,3,14,False,False,还挺好的呀，我以前在卖画材的店里打工也是差不多的这个价钱，主要是画材店也很悠闲，有时候还可以插插花，教人DIY手机壳，或者教业余顾客画画，花卉店也可以，但是都是工资不高
1675951017,6,11,False,False,我22专科毕业，下半年找工作，在养猪场工作，试用期一个月3K5，转正后6k多，包吃包住，就是封场出不去，一两个月出去4～5天！活也比较累，但是很少加班，早8晚6，一天8小时！但是存得住钱还是挺开心的
1675961476,11,23,False,False,这么看来我这个活还可以，年前嫌给的少我还一直想跳槽，一个月扣完到手5500来块钱，优点到也有，就是不加班，八点半到五点半准时打卡溜溜球，还双休，看来人要知足才能常乐，沉下心来在这里干一年吧，要是还能涨两千就接着干
1675946332,1,11,False,False,我服了 今天刚来重庆 确实是只有客服 进厂 和中介 早发视频我就去广东
1675924158,0,14,False,False,莫宝原来是这么高瞻远瞩的人吗？提前预知自己要洗鞋，先买了厂服
1675932657,0,26,False,False,很好，很形象
1675916698,10,155,True,False,up主你房租零点几个大不溜呀
1675940066,0,12,False,False,我刚想去干室内设计师助理学习室内设计就刷到了这个视频[呲牙]
1675917007,4,12,False,False,实习章可以淘宝买啊莫宝，不一定真要去当社畜啊[思考]
1675936730,29,36,False,False,我们这边暑假工最低工资5000[疑惑][疑惑][疑惑]
1676028235,3,5,False,False,真的，我视传设计专业这几天根本找不到什么好工作，真的好崩溃
1675916846,0,16,False,False,我学的英语翻译，二外学的法语，牛马店长从德国进口的吸尘器看不懂说明书让我翻译翻译[微笑][微笑]，我也看不懂啊[保卫萝卜_哭哭]
1675964396,8,8,False,False,真实[笑哭]设计师助理底薪1200+提成，已经在贷款上班了
1675942239,3,11,False,False,护理大专实习倒贴 转本以后又倒贴实习一年 不要碰护理会变得不幸
1675957054,3,19,False,False,辞职重新找了份工作，才觉得上一份工作好，单休 26天的班，但实际上一个月上22天的。5000的工资，没什么活，很闲，中午休息两小时，一天工作七个半小时（因为我会迟到半小时，可我是算工资的没人说我[脱单doge]）
1675965135,3,8,False,False,当保姆吧，最近在找保姆，没个5、6000都招不到人，我真怀疑我以后毕业能有这工资不，活也不多啊
1675954387,5,10,False,False,我一开始找的设计师助理，一个月400，伙食费自费300，一个月公交90[微笑]
1676418960,0,1,False,False,销售里卖保险的比较多[doge]以前去应聘个运维工程师，然后到了公司谈着谈着就给给你画大饼喊你卖保险。对了那是家做医疗器械生意的公司[呆]
1675922754,2,13,False,False,在医院还得补钱[保卫萝卜_哭哭]
1676442568,1,1,False,False,同样学的服装设计师，要么销售要么进车间。[藏狐]原本还想专升本，想了想，捏马的，劳资本科也蹋mua的毕业了一个月一千。我捏马的花钱上班，小城市没有职位，大城市连房租都不够。干，干捏mua的啊。我在济南，宠物美容助理，一个月三千底薪，卖东西有提成，给宠物洗澡有提成，还包午饭。原本老板还想给我租房子，我拒绝了。还有猫撸，还有工资拿，三千底薪，三千啊，你心动不？我心动了，我甚至感觉我踏马竟然这么之前。[藏狐][藏狐][藏狐][藏狐][藏狐][藏狐]
1676022015,5,5,False,False,我们专业大四实习是分到各个中小学，然后工资竟然高达一个月100块坐公交[星星眼][星星眼][星星眼]
1675922822,0,10,False,False,喜剧的内核是悲剧
1675995981,0,7,False,False,你们大学毕业1500，我初中毕业也是1500，少走10年弯路[doge]
1675937483,3,10,False,False,景观毕业五年的在深圳失业半年多，莫慌。过几天找个厂子打螺丝了
1675942504,16,70,False,False,泥好，我在当会计助理[脱单doge]
1675938758,1,45,False,False,我在上课时看的视频，不敢开声音，但是后来发现好像也没有开声音的必要...[doge]
1675915978,2,11,False,False,重庆真的就是“打电话，车螺丝，打电话让人来车螺丝”这三种工作吗[doge]
1676299143,0,2,False,False,成都才是孙悟空来了都要打1000个电话
1675935609,1,10,False,False,美院毕业了，去花店打工了[脱单doge]
1675986443,2,7,False,False,还好我们护理学生都是付费实习，没按医院规定来医院还会不给发证，一实习还TM实习8个月打底，累死累活没工资脏活累活你搞定。[辣眼睛]
1675916628,0,12,False,False,教你一个办法，现在想办法把老板孩子娶了，毕业这店就是你的✅
1675916310,2,10,False,False,看到一个设计师助理一个月500我寻思咱去捡破烂也赚的比这多吧 太难了[辣眼睛][辣眼睛][辣眼睛]
1676380024,0,1,False,False,去法院实习，工资零。[百变星瞳_好好好]
1675945580,1,10,False,False,重庆的工作除了销售就是餐饮。。。或者进厂车螺丝
1675917299,0,10,False,False,确实当时感觉自叼爆了，一找工作简直弱爆了
