上传时间,回复数,点赞数,up是否回复,up是否点赞,评论文本
1675936410,3,13,False,False,风景园林，实习也是1500[脱单doge]，就算是全成都，也是普遍1-2k，房租嘛，便宜点的合租老鼠窝一个月六七百，吃饭嘛一天少说要30，算下来还要倒贴点儿，还没算交通和其他生活花销
1675957359,0,8,False,False,师范生实习一分钱没有[大哭]
1675915743,1,10,False,False,刚刚朋友转给我的重庆招聘 实习和尚8k/月 要求985硕 熟练背诵金刚经等[打call]
1675937365,10,10,False,False,不懂就问，实习盖章找个和自己专业无关的实习都行么[喜欢]
1675928530,0,11,False,False,我还以为微博发那个视频你在奶茶店兼职[囧][囧]
1675957276,0,7,False,False,我他妈都毕业了，还他妈没考到教资的证，被我妈在没有告知我本人的前提下，给我整到幼儿园实习，免费干一年，我当时就懵了，你说在幼儿园待个三个月，体验体验到还行，一年是不是太夸张了？我妈说这是给我累积经验，能学到很多，方便我考证，本来我不喜欢小孩，接触了之后发现小孩还是挺可爱的，但是他妈要经常考核，有时候他妈的放假在家还得被拉去凌晨四五点当志愿者，每周都开好几次会，还要让我这个社恐人发言，还经常举行什么比赛，给我这个啥都不会的摆烂人整的痛苦的不行，妈的，我可不想过这种生活，虽然饭很好吃，但没钱拿一切都是白搭，所以我干了一半之后跑路了[小电视_赞]外面的工作虽然累，但钱是自己的，跑路之后攒钱买了自己一直以来都很想要的switch，妈的，在外面工作都感觉实在是太爽了，这他妈就是自由的味道啊
1675938466,1,10,False,False,同重庆，作为应届生找个合适的工作太难了[笑哭](叠个甲，仅代表本人的观点)
1675937338,3,29,False,False,我也设计师助理，不过工资是你四倍[脱单doge]
1675917282,0,15,False,False,知道为什么没什么人黑up嘛？因为能黑他的话都被他说完了，小黑子无话可说了[脱单doge]
1676393134,0,1,False,False,笑死了 1500怎么用的完？[热词系列_肥肠自信]
1676014288,0,5,False,False,看了评论这些 还没毕业的大学生感觉好焦虑哦 哎……
1675940688,0,10,False,False,救命🆘我们实习别说工资了，还是倒贴钱进去的，很多不包吃包住，只有学校安排的是包住的[小鸟芋圆_俺无语][小鸟芋圆_俺无语]
1675952692,5,9,False,False,大三实习，工资1～3k＋午餐补贴（还没发不知道具体多少），每天来回路费20，早餐10～15，午餐18～25，晚餐30[2233兔年新春_烦躁]
1675923519,0,9,False,False,新传专业电视台实习倒贴哈哈哈
1675933322,2,9,False,False,找工作好难[大哭][大哭][大哭]
1675917860,1,10,False,False,"实习老师,笑死,没工资不包饭包住,各种杂活,倒贴上班,你值得拥有[兔年]"
1675941605,2,32,False,False,师范生实习无工资 有的不包吃住的还要倒贴呢
1675929459,2,9,False,False,同环艺专业，毕业后当过纹身师，现在在书店当店长[喜极而泣]
1676094038,1,2,False,False,莫宝呀，保洁也不是不行，我们格局要打开
1675915878,0,10,False,False,省流：这可是0.15个达不溜啊[doge]
1676029021,1,4,False,False,我们要自己学的专业盖的章，这0.15k的好工作我可能都捞不着
1676028021,0,4,False,False,最近在找实习能投的都投了，把人都搞焦了。莫宝都去洗孩子，看来我还有些投的空间[微笑]
1675917332,0,10,False,False,墨宝可以内推我去洗孩子吗
1675944580,9,31,False,False,读了会计，毕业之后不想做会计，随便做点什么都比会计工资高
1675941506,2,9,False,False,财务实习生 底薪➕提成600/月，不包吃住[脱单doge]，或者写着招聘财务实习生实际一聊 销售，打电话推销理财产品[doge]。无所谓我会成为个会报账的coco员工，交五险一金到手4500[doge]
1675915643,5,16,False,False,在安庆话：鞋叫孩子[doge]（看了好久的孩子才想起来）
1675953608,2,8,False,False,明天解放碑国泰广场见[保卫萝卜_哭哭]我就不信了百来个企业没有适合我的[OK]
1675949471,2,9,False,False,医学生实习，，没有工资，，是不是更惨[妙啊][妙啊]
1676012590,0,4,False,False,实习体育老师，做了五个月，就拿到了一个月得工资，1500，剩下的6000已经欠了半年
1676029986,3,3,False,False,来干风电运维吧，一个月8000多就是天天在偏远地区出差，大专以上就行，不过分配的地方看运气，有的地方可能待不下去，不过我刚好分配在重庆还好，能接受，干几年存个老婆本看情况跳槽或者换行业
1675944370,0,8,False,False,这可是0.15万啊，年纪轻轻就赚这么多了[大哭]
1675924112,0,9,False,False,我们老师给学生介绍的实习工资1200，房租 通勤费 伙食费加起来都不只1200，直接倒贴上班
1675948136,0,8,False,False,会计事务所实习 800一个月，不包吃不包住，一个月交通费都不够
1676005112,1,4,False,False,师范生免费劳动力没得工资[大哭]
1676116245,8,3,False,False,美团点外卖===点开外卖 在下面那一栏找到拼饭 里面的吃的比一般外卖便宜将近一半的价格 还不用配送费 （不是广告 就是想分享点外卖心得，因为真的没有多少人知道去用 没朋友找个拼饭蹭便宜都难[微笑]）
1675916286,4,8,False,False,我们学果树，不用实习盖章，我们实习是去山里果园修果树，就没事了
1676177142,0,2,False,False,焦虑死了现在，实习快结束了，找不到工作[大哭][大哭][大哭]你们都是怎么找到的工作？是不是很多人找到的工作专业不对口
1675925318,0,7,False,False,谁说厂服没用？[doge]
1675934875,1,8,False,False,重庆打电话可太真实了，我法学的，之前有个公司来学校招聘，说招“知识产权顾问”，实际上就是打电话做销售
1675915599,0,6,False,False,说的我都想去洗鞋了
1675951245,3,7,False,False,1500够好了 大三去中建三局西南实习1000[呲牙]
1675918269,0,7,False,False,莫宝你真的好可爱![兔年][兔年][兔年]
1675920564,0,9,False,False,别人问是做什么事的：我从事一份体面但薪资不高的职业
1675922626,2,9,False,False,我看搞软件的实习工资高，一个月能八千（不过那个同学确实硬实力蛮强的）
1676037083,0,3,False,False,兽医助理实习一个月600不包吃不包住[呲牙][笑哭][大哭]
1675958747,0,6,False,False,没关系，实习律师也这个价格[星星眼]
1675919154,0,7,False,False,0.15w啊我现在大一兼职送餐都0.115w了
1675916290,4,8,False,False,感觉，体面的工作一开始都不体面，看着不体面的工作，工资高的吓人[doge]比如家政保姆之类的
1675927528,0,8,False,False,md心动了，一个月0.15达不溜啊！还包饭啊！还可以免费洗孩子啊！
1675915336,3,8,False,False,莫宝有想过全职up吗？
1675917024,1,14,False,False,给的实在太多了[脱单doge]
1676030312,0,3,False,False,这么说来我不该嫌弃我的银行工作了
1675949249,0,6,False,False,怎么刷个b站刷到自己头上了[大哭]我要出去干就是设计师助理阿 我还是早点转行吧
1675951797,0,7,False,False,毕业实习有钱就不错了，我们当年师范生去学校实习，还要交钱给单位。
1676022165,1,3,False,False,所以啊学门技术多好[妙啊]我工地电工学徒都270一天 每天基本上2小时 其他时间打酱油
1675915540,2,74,False,False,哈哈哈哈哈哈哈哈洗孩子？
1675921277,1,8,False,False,法学生实习一般是一毛钱都没有的，去律所还很多不包吃住[呆]
1675937860,4,7,False,False,果然环艺人都逃离这个圈子了[笑哭][笑哭][笑哭]
1676015116,0,11,False,True,是设计师里最会说相声的
1675917574,1,8,False,False,我能说话吗，幼师，公立学校实习，没有工资的！没有工资的！一分钱不给你！干的就是班里老师的活，一件不落，你还要写实习作业，免费加班[大哭]
1675923032,0,7,False,False,我过年去影城上班10天，赚了1k6，初一到初三还包饭还能看电影[脱单doge]
1675956026,6,6,False,False,你来给我每天代肝打游戏外加做饭打扫洗澡搓背吧，我给你0.2w，吃饭的时候可以一起吃，拖了的地可以放凉席给你睡，但是被子要自带哈
1676197064,4,2,False,False,我实习，学校安排的公司，一天38块，骑自行车去公司得45分钟，打车25块，来回50，不包饭，[大哭]亏本上班，为了省那车钱，除了天冷下大雪天天蹬车蹬的人发麻
1676078883,0,2,False,False,实习就是在做设计师助理，月薪两千双休，感觉这行就是要看你自己内不内卷，技术硬的随便赚，现在带我实习的前辈才23，已经出来干了一年多了，这个月谈了第一单，底薪变三千，还有总报价5%的设计分成，随便过万是有了，学这行的基本都是读大专了，月薪过万+双休还有年假已经很满足了，当然有可能一个月谈不了一单，但是这行非常好学，你肯努力学一点东西相对来说赚钱还是挺方便的
1676052403,0,2,False,False,"重庆大老乡。重庆工资工资就那样就那样。
2022.9-2022.11月在重庆李子坝轻轨站当  轻勤务保安：工资安8小时算：八小时98元转正是120元，上一天休一天，一个月可以拿3000-4000元左右。工作轻松但是工资太低了。
2022.12又报名回重庆垫江（老家）去考辅警， 考起了辅警，工资3200元一个月，双休制度。
现在2023.2跑到浙江温州来上班，  工资再怎么都是5000左右起步，而且我看了浙江温州辅警工作工资（一年都可以八万起步：相当于一个月6000+工资）。
个人动态有发工资吐槽，可以看看。

真的是，一比下来，重庆工资太伤心了。[吐]"
1675923752,0,6,False,False,莫宝莫宝，我实习是没工资的哟～
1675958564,10,6,False,False,[冷]我现在实习一天两百，本来还嫌弃给的少，一个月除去房租水电吃饭就赚不了多少了，外面吃饭太贵了，看了大家我突然感觉我幸福了好多 ，大家可以往互联网方向靠，我感觉带点互联网的实习都会好一些[拥抱]
1675947798,2,7,False,False,三类工作，客服，销售，进厂[呲牙]
1676028830,0,3,False,False,我对工作的要求已经是离家近不加班双休法定节假日工资至少一千了。。。[保卫萝卜_哭哭]
1676002362,5,4,False,False,会计实习生，月入1500，不包吃不包住，转正三千三险[妙啊]
1675916991,0,9,False,False,人鞋合一，顶天立地[脱单doge]
1675954692,6,7,False,False,审计实习，一天 110包吃包住。。。尼玛一天工作十一个小时[囧][囧][囧][囧]累惨了
1675920311,3,6,False,False,什么时候医学生实习能有工资!!
1675945536,2,7,False,False,我这儿，小县城，当摄影助理800一个月，不包吃不包住。进厂打工，包吃包住，一天135[捂脸][大哭][大哭][大哭]
1675948365,3,7,False,False,月薪2500已经上班了[大哭]实习生
1675949776,0,6,False,False,可以出一个洗鞋小技巧吗？顺便出个洗鞋好物推荐，好吗？莫宝！！
1675958231,0,6,False,False,虽然他说的很搞笑，但是巨他妈真实，我当年实习，80一天，只有出差才会包食宿，在公司只有80，离我家还贼远
1675959872,2,5,False,False,医学生实习生：0元
1675934050,1,7,False,False,emmmmm制药快毕业很迷茫啊
1675961051,2,5,False,False,你m的观音桥这个招聘会我也去看了 有注会 5-10年工作经验 开的薪酬是6000-8000 给爷整笑了
1676006847,5,3,False,False,"各位考研吧，研究生身份，底薪最普通了底薪也得5000吧，再加上其他待遇，考的证书
各位卷起来"
1675960139,1,4,False,False,艹，我就是助理设计师
1675921552,0,7,False,False,这个推荐就很有意思[doge]
1675928278,0,7,False,False,莫宝在哪里洗孩子，我过来给你提高点业绩[妙啊][妙啊][妙啊]
1676019447,2,3,False,False,我曾经去了一个助理设计师 1500-2000 天天摸鱼 没啥要做的 虽然做的也蛮好 但是离职了 现在我想回去都来不及[辣眼睛]
1675954136,4,13,False,False,护理实习8个月，不包吃住，一个月喜提0元[大哭][大哭][大哭]
1676020189,0,3,False,False,学产品设计的，实习去做银行客服了，4k1[微笑]
1675932995,1,8,False,False,搞动画还要倒贴钱
1676005933,0,4,False,False,有广州的毕业实习的影视后期的实习生可以找我，可实操，有帮带。不用端茶送水，不用提包陪跑，转正一至三个月，看自己意愿及表现。实习工资私聊。有兴趣的可私信。PS:小工作室，想找大单位的可略过。
1675915346,0,10,False,False,省流:去洗孩子了[doge]
1675998361,3,4,False,False,我们班主任给我们挂名实习，一个月200，不用去上班就挂着(但是那个公司账上写两千多工资，发两千多，然后我再退回去两千多留两百)[来古-注意]我现在就在家躺着做毕设
1676094293,0,2,False,False,那里助理这么惨的嘛？我这里助理2千块，虽然不多但是工作内容就是只画图我觉得貌似还好[思考]
1675957159,0,6,False,False,没有实习专业对口的要求的话，去麦当劳吧，起码有最低工资，还能给你盖公章和提供学校要求的企业资料（营业执照复印件之类的）（本人找了n多个，不是被刷业绩就是不给盖公章）
1675928662,1,6,False,False,奶茶店四小时工一个月2000
1675962674,0,5,False,False,所以知道为啥今年春节重庆返乡率全国第一、二的水平，因为本地真没啥工作[微笑]
1675961404,1,5,False,False,我曾经以为我大四实习不管多少钱，好歹能赚点零花钱，结果我是掏自己的钱去医院打工，怎么说呢，专家建议竟是现实[微笑][微笑]而且什么餐补都没有，不仅要交实习费，还要自己解决住宿问题（医院有宿舍就要跟大学宿舍一样交住宿费，没有就自己租房子）
1675940889,0,6,False,False,拜托，师范生实习也是没工资的，甚至还不包饭[大哭]
1675975607,0,4,False,False,大部分医学生：什么？实习还有工资？？？
1675930517,4,6,False,False,俺服装设计助理深圳南山上班一个月4000 通勤两小时 因为租不起近的
1675916365,0,7,False,False,求职APP里面有个笑话:就算是孙悟空来了重庆也要给我打300个销售电话才准走！谁懂[跪了]
1675938113,2,6,False,False,银行实习爽死了天天玩，还包饭，一个月2000多
1676008511,0,3,False,False,同设计专业（工业设计）寒假一个多月打工当服务员赚了5000+。。。妈的过两年实习工资1500我真的会…
1675992927,2,4,False,False,我也是设计师助理过来的，经理天天跟我说努努力以后你就是设计总监了[doge]
1675936525,2,6,False,False,建议美术行业的朋友们可以学一学补漆补木头啥的（一些地区平台上每天单子都够了[汤圆]
1676000723,3,3,False,False,我早6年前出来实习的时候那公司包吃包住一个月工资3000那个时候买的2险一金[辣眼睛][辣眼睛][辣眼睛][辣眼睛]
1676013344,0,3,False,False,师范生  入职是吧 做体检先倒贴两百[藏狐]月入-200
1675996166,0,3,False,False,实习期7500包吃住，但是在高原[脱单doge]
1675945842,0,6,False,False,笑死，大四实习了三个月设计师助理后果断转行[doge]
1675936649,3,5,False,False,我听说医院实习还倒贴钱呢[阿梓从小就很可爱新装扮_唉]
1675939203,4,6,False,False,还好我的专业校企合作直接去实习，双休3000一月，每天手机都耍烦了[妙啊]打算这个月底离职
1676002332,0,3,False,False,莫叔莫叔，我看上了你视频这个无帽外套，求个链接，两个圆圆的东西跟你换[热词系列_知识增加]
1675920465,0,6,False,False,工业设计，连设计师助理都没有
1675915746,0,7,False,False,省流：洗凑孩子里最会设计的
1675916374,0,6,False,False,省流：哭吧哭吧哭吧~不是罪~
1675958030,0,5,False,False,投币帮你回回血 当代大学生实习工资属于是饭都吃不起
1675917019,0,7,False,False,我也在找实习，也是设计[笑哭]
1675958858,1,5,False,False,实习一毛钱没有（不包饭不包住宿），甚至倒贴开了会员，问就是新传
1676345273,0,0,False,False,实习这件事怎么说呢。医学牲实习和花钱上学没啥区别，想要挣个行业正常工资，8年后见吧您嘞[灵魂出窍]
1675921268,2,5,False,False,莫宝莫宝 我上一份实习一天200还包三餐哦（凡尔赛中（已离职[脱单doge]
1675933932,0,5,False,False,视传的慌了
1675957336,1,5,False,False,[笑哭]想当年我实习章是找我同学公司盖的，我毕业别人都当老板了
1675946488,1,5,False,False,深圳不是销售就是白夜班[doge]
1675951196,0,5,False,False,单休，早八，两千[脱单doge][脱单doge][脱单doge]
1675953483,2,4,False,False,实习月薪2w rmb[微笑]
1675953815,1,5,False,False,哈哈，看起来我还不错，我刚出来的时候4.5k，天天摸鱼，因为都没人找我，我都怀疑我被骗了，但是又按时发工资[笑哭]
1675936521,0,5,False,False,洗鞋的工作真的有点心动[保卫萝卜_哭哭][保卫萝卜_哭哭][保卫萝卜_哭哭]
1675919637,0,5,False,False,结尾没有彩蛋我很失望[热词系列_两面包夹芝士]
1675921771,0,5,False,False,昨天去面试，稍微高点1500+200元，哈哈哈哈哈。
1676001432,0,3,False,False,"那我去年实习的公司好像还挺好[思考]
3500/月，餐补一百多，转正之后四千多
交五险
金融公司做图的，主要就是套模板
不过还是跑了哈哈哈哈（公司没保洁，卫生是大家排班打扫的，还老加班，领导想一出是一出）"
1675931996,8,6,False,False,环艺为什么会有这种工资低的现象啊，都是因为这个把我劝退去动画了
1675966895,3,4,False,False,小时候觉得设计师很酷，现在在工作室当厂妹串项链挂耳环，到点就跑，有想法了就给自己做点首饰，小日子嘎嘎快乐
1675937270,0,6,False,False,卷不过别人，那只有整活了[大笑]
1675949049,4,8,False,False,我的实习情况是，包吃包住月薪三千，早九晚六，周休一天[微笑]
1675926678,2,5,False,False,审计实习一天一百包饭[doge]
1675918409,0,4,False,False,洗孩子洗孩子～
1675915870,0,6,False,False,有了对比真的这个洗鞋子工作好好哦[笑哭]
1676020554,0,3,False,False,学法去律所去法院也是没钱，在法院起码还能包饭，在律所是倒补贴
1676003111,1,4,False,False,……医院实习没有工资和补贴
1675967683,0,3,False,False,学广告的要求专业对口，我抬头一看，销售，低头一看，穿着综合实习生衣服的销售，和写着运营策划的工作联系了之后再看，皮的底下还是销售[捂脸]
1675948313,0,4,False,False,医院实习还要交钱[doge]
1676027045,0,2,False,False,我一边洗鞋一边当助理，入2300[脱单doge]
1675942938,0,4,False,False,要搞实习公章去淘宝买啊
1676000243,3,3,False,False,设计师助理800一个月 坐标成都 我房租800一个月 把钱给我算的准准的[doge]
1675954291,3,6,False,False,这种就是成长型工作  要一边干一边学  我是坚持不了[热]
1676389149,2,0,False,False,啊这，这实习生找工作真的这么惨吗，我大一寒假工都有180一班的安全员，曾经有个神人拼命干，一天上两个班，一个月能过万。
1675947502,0,5,False,False,我一天一百，一周一休做百科词条，开心的一批，比去当什么设计师助理强。
1676020324,3,2,False,False,1300的幼师我的妈呀太幸运了
1675919284,0,5,False,False,莫宝莫宝，我们学校实习盖章要不要对口的工作噢？
1675916083,0,3,False,False,哈哈哈哈哈哈原谅我不厚道地笑了[吃瓜]
1675935351,0,5,False,False,莫宝 内推一下 我也想去洗孩子
1675928536,0,5,False,False,确实你这么一说[doge]我还是去拧螺丝吧
1675951195,0,4,False,False,我17年刚出来实习的时候工资也没有低下0.2万啊[疼]
1675936605,1,5,False,False,莫宝做好防护，不要手上感染脚气[喜极而泣]
1675996660,0,3,False,False,护士实习还有没有工资咱们要实习差不多一年好见
1676436613,0,0,False,False,"小学文凭的保安到手都能7500，扣掉社保后的 
大学生也太惨了"
1675952457,0,3,False,False,各种招聘软件这两天看的头疼 哎 找工作太难了
1675915247,0,6,False,False,我就跟你不一样了，上大学时就觉得自己是弟弟
1675951213,0,5,False,False,怎么说，前几天看到最离谱的是10-80一天[呲牙]成都会计实习1k左右的很普遍了[OK]
1676009124,7,2,False,False,我厨师大专毕业去年七月份的，现在在药厂上二休二平均月薪67k[歪嘴]
1675921266,1,5,False,False,我们实习要么找专业对口的工作，要么就和学校介绍的那些企业签约工作，都特喵的坑得一匹[笑哭]
1675921209,1,5,False,False,为啥我们随便一个绘图员的实习也有3000-5000，我以为实习工资都这样，我是土木的
1675918549,0,4,False,False,莫宝，你们需要在软件签到吗？
1675922025,1,5,False,False,"要不是为了毕业证毕设
我才不会去当工资六百的CAD画图员[吐]"
1675954422,2,3,False,False,Tamard，你那助理还有1500
1676036750,0,2,False,False,我寒假去火锅店干了14天1680[doge]
1675917380,0,5,False,False,莫慌莫宝，两年后我这设计师助理就去接替你的岗位了
1675937234,0,5,False,False,我舍友去学校推推荐的企业上班，都倒贴钱，我还好，跑了[妙啊]，走后门去我爸的朋友的朋友一家公司面试，一听一个月1500-2000，妥了，马上入职！，不挑了
1675977357,0,3,False,False,专家眼里的年轻人是吃不起苦的[doge]
1676323794,0,0,False,False,观音桥汇博招聘会我是没去，我知道就是那几个单位在招；我以前就是做设计的，从业十来年，现在老了找不到工作，哈哈~~汇博和BOSS安静地让我感到害怕，好久没收到过消息了~
1675916770,0,5,False,False,省流：去spa洗孩子了[辣眼睛][辣眼睛]
1675959102,0,3,False,False,这么多年了还是800  1500
1675935269,0,6,False,False,正在做室内设计助理的我留下了泪水
1675919145,0,5,False,False,景观实习，一个月0.2万，工作日加班是常态，周末加班[热]洗鞋子还包饭真心动了
1676386359,0,0,False,False,"唉，而我对未来啥都不知道，只知道我不想当老师啊，
顺便我们的实习，除了顶岗的少数名额有补助，其它本来就毛都没有，想顶岗去偏远地带做牛做马，额…看你积极"
1676354118,0,0,False,False,我超，心动了，我也想去洗孩子了
1676371931,1,0,False,False,我老公学的视觉传达，第一份实习工作去了一个融媒公司做设计师助理，可以帮你盖章，但是没工资，早八晚七，每天都要出图稿并且图稿使用权归他们，我老公去了几天后下定决心不给别人打工了，要自己创业，现在成了烧烤店老板月入三四万，但是比之前更累了。[脸红]
1675945887,0,11,False,False,哥们儿在外面狠狠做人设是吧！居然在外面洗孩子！
1675952117,0,4,False,False,幸运的我 实习就0.5w 月300房补 500饭补
1675924168,0,3,False,False,我实习期月薪也是0.15w…
1675937222,0,4,False,False,我昨天工资发了，突然了一笔不知道什么补贴，也是1500[doge]
1676356706,0,1,False,False,提个建议，up粉丝的基础这么高其实是可以走当设计师这一行的，前期靠发视频补贴家用等到技术上来了，可以发一下关于装修的视频引流接单，设计费加项目经理返点简直不要赚太多
1675917871,0,5,False,False,我觉得莫宝应该从倒霉区up晋升为咆哮区up[笑哭]
1675946021,0,4,False,False,。。。据说我表哥实习是直接找亲戚盖的章
1675945204,0,7,False,False,老师还说这是你应该的，这可是学习的机会啊
1675920469,0,4,False,False,负债上班我说啥了[呆]
1675915850,0,6,False,False,早九晚五，周末双休这应该算是一种梦想了[妙啊]
1675920395,1,5,False,False,[笑哭][笑哭]我妈妈去做家政，打扫卫生和做饭加起来都三千[吃瓜]，还只需要做一上午的工作，下午休息
1676370991,0,0,False,False,每一段经历都有其意涵，一定是上天为了启发咱，让咱设计一款免洗鞋，去颠覆洗鞋行业。
1675958779,1,3,False,False,挖槽，找工作好烦，能不能来个包住8小时双休五险一金工作[辣眼睛]
1675921441,3,4,False,False,去年工资9月份实习，前三月没工资，然后12月羊了三天，事假三天，人事和我说我出勤天数才17天，工资不到三百块[热词系列_多谢款待]设计师助理我真的服，师傅还叫我去报名设计师培训，妈的半年就让我充当文员，工地不带我去，也不给我工地交接工作什么得天天就是放图，选材料，搞才材料，草
1675915370,0,4,False,False,我在莫宝这里买了房
1676357003,0,1,False,False,1500就心动了[doge]，目标也太低了吧。像我这边做激光切割的一个月4000实习，一天8小时，可惜没有单双休，只有节假日才放假，一个月最多能请两天假，但是请假的话没工资。
1675916519,0,4,False,False,成都也一样，要么打电话，要么车螺丝[doge]
