上传时间,回复数,点赞数,up是否回复,up是否点赞,评论文本
1676249197,4,11,False,False,其实可以多点主播做这种系列，把这些人的id都挂出来，好好整治一下国服的环境
1676262233,1,6,False,False,主播王者炸黄金？那这个诺手黑铁炸黄金不算炸鱼？
1676261800,4,12,False,False,估计也不是这一波的问题，他前面可能被针对一两次 不服气 换血激进然后又被单吃， 他被搞了或者是他被一直压塔你不帮一下他玩的就很不舒服，就算瞎子其他地方抓了更多收益 总归是没帮他，他肯定不开心，打游戏毕竟不是电子竞技 不能指望路人为团队思考，他只关心他自己的利益，急了 终于找到机会喷你可以理解。
1676199819,10,12,False,False,好惨，到了下一盘他心里不平衡，越想越气开始连跪，还得被网爆，建议加大力度，改id了也给我狠狠的追着咬
1676268891,2,13,False,False,这波诺手在大气层，对面全被他送成终结头变相给瞎子拿经济，他真的我哭死[大哭][大哭][大哭]
1676254147,3,12,False,False,马服和台服环境一对比，就知道大陆人过的是有多不如意
1676218006,12,9,False,False,诺手赢家啊，送完还发泄了情绪躺赢[doge]
1676264348,0,12,False,False,可以看得出来，meiko上次事件很多人说他是因为被说到痛处了，因为国服确实烂[大笑]
1676261286,2,10,False,False,这游戏急需像up一样的玩家整治一下游戏了
1676268993,2,28,False,False,s10的时候，遇到很多这样的人，明明自己的问题第一时间打字，讲道理讲不通，后面遇到这种直接屏蔽，倒是清净了一段时间，再后来发现有人只要不顺心就问候你家人，以至于养成个习惯，进游戏先不买装备，第一时间mute all [笑哭][笑哭]
1676264325,9,4,False,False,他都玩诺手了，你还说他什么呢[抠鼻]
1676388792,0,1,False,False,楠神的热度很高呀，创作毫无瓶颈，希望早日百大[打call]
1676306833,2,6,False,False,视频里玩诺手的东西是什么品种的啊，和我的一个室友真的像，真该死啊[打call][打call][打call]
1676297791,0,9,False,False,大家都在开心打游戏，只有一个小丑诺手在和自己斗气
1676251670,4,10,False,False,你为什么总能碰到这种逆天啊，哈哈哈哈哈
1676263859,1,7,False,False,掌盟号021207554
1676249867,0,9,False,False,想赢赢不了，想输输不掉，这诺手急的要死
1676279622,4,9,False,False,这种人头被拿了我只会说打野你c 我已经不行了[微笑]有时候遇到难打的英雄或者对面很厉害，崩了队友也不会怪你的。
1676395275,0,1,False,False,都是主播的问题，你看看人家诺手，十分之一血杀半血而已，轻轻松松[打call]
1676256350,1,11,False,False,昨天开黑，路人打野玩蜘蛛，我武器上单打阿卡丽贼折磨，对面耗子辅助4分钟抓三波，根本对不了线，14分钟后我只能去下路发育，但是蜘蛛把对面中下杀穿了，然后说一句：“辛苦了哥们，耗子辅助就是这样会恶心上单”，woc这把说啥我都得好好打，0-5打成5-7打赢了，后期我直接骑对面耗子头上拉屎
1676396756,1,1,False,False,我lol新手，上单打的菜，队友骂我我就感觉是应该的，就算队友骂，我也会认真玩游戏。
1676303979,0,4,False,False,谁将爱意丿掩埋灬
1676277230,5,7,False,False,百场诺手玩家表示 诺手玩家不是这样的 呜呜呜
1676196684,0,5,False,False,谁将爱意丿掩埋
1676249047,4,9,False,False,我要被单杀这么多次恨不得找个洞钻起来，希望队友别注意到我
1676287428,2,9,False,False,送人头真不一定能送输，要抢线把线带出去，抢刷野怪，打团逛街再k头，才有机会输，而且还看对面会不会更犯病
1676180473,2,6,False,False,这就是丝马服[打call]
1676245567,7,41,False,False,昨天玩台服，一开始我加速器失灵，延迟很高，重连了，我爆破鬼才1级，对面3级，上单杰斯被对面锐雯吊起来打，打野也2-6炸了，对面雪人巨猛，但我炸弹人挺克制他滚雪球的。有一波我残血守中二塔，对面锐雯加猫，我必备越，喊复活的红凯来守塔，半天就是不来，刷三狼呢，我就标记了他下，就说雪人又不是他送的，开始摆烂，不团，只刷野我们清线快拖起来最后赢了
1676288387,0,8,False,False,省流：人菜b话多
1676279495,2,9,False,False,"这就是不能开所有人聊天的原因，队友摆烂爆打野位置，打野就直接废了。
别说不可能，我tm被搞了十几把。"
1676279881,4,10,False,False,去打省服了，发现和国服环境真的不一样，你打的再菜真的没有一个人说一句话，最多打个问号。打的好夸一句，但不多，人均高冷，投降该点点，不恶心队友，也没压力队友的，可能是等级没上来的原因把
1676277836,0,10,False,False,诺手玩个游戏快把自己气死了哈哈哈，还加胜点自己这操作成这样自己打能赢嘛[嗑瓜子]
1676247094,0,8,False,False,问问他敢不敢在b站现身
1676267607,1,8,False,False,我靠我要是上单有这样的打野我TM给他买骑士之誓呢
1676253553,6,10,False,False,我玩狗头的，主打的就是个自律，队友能想起来我就不错了，队友帮抓就很好了呀，要是碰到善心人不脏兵或者带我吃镀层我结束就给他点赞，最好还能帮我留个眼。（好像有点贪了，嘿嘿。）[乃琳个性装扮2.0_打招呼]
1676303817,3,8,False,False,所以我一直玩娱乐模式，匹配都很少玩了，前段时间我朋友来我家找我硬要双排，我就玩ad，他辅助，因为一直没打排位，我是定级赛，下路我们都能把对面打爆，但是队友就是贼菜，我心态好觉得没啥，我朋友就一直和队友骂，看他们骂我也觉得心烦，各种“不差这局”“不想玩就挂机”的话语，真的感觉游戏环境太恶心了，就是那种要么犯错了不承认，要么队友失误一点能说一整局，我被恶心坏了真的，后来我跟朋友说换位置吧，我去中，他去上，我朋友玩上路还挺c的，但是有波我在下路，我朋友去中路收线的时候打野提前把中路线给清了，我朋友一句“不清楚谁是爹?”我当时就有点不想打了，打完那局我就说打娱乐吧，连我朋友都这样，我是真的觉得这游戏环境没救了。
1676387436,0,1,False,False,不错，这诺手有我风范，劳资还缺一个号啊[星星眼]
1676259163,1,12,False,False,他说他要送的时候，你就说:啊?现在才开始送吗？
1676269999,1,9,False,False,原来是在玩旧国服难怪环境是这B样 去了新国服一年的我表示 身心健康 也不怎么吵架 做人都快乐了[给心心]https://b23.tv/BV1uM4y1Q7g3
1676274455,1,5,False,False,诺手改名了，有新消息踢我
1676277825,0,7,False,False,"诺手:我加胜点了
盲僧:你8连跪"
1676301406,0,4,False,False,告诉蝙蝠侠，小丑找到了！[吃瓜][吃瓜]
1676288446,4,7,False,False,诺手小丑本地人，up主炸鱼刷素材，要我说，就是诺手和up还真是有缘啊[呲牙]
1676251101,0,5,False,False,联盟环境是真的差，这个b 1-12我就打完在wegame点了一下拉黑。第二把匹配到他就直接喷我真的无语
1676255089,0,9,False,False,她还是有贡献的，毕竟都给大伙看乐了吗[脱单doge]
1676281646,2,7,False,False,哈哈哈，已经进台服了，环境没的说[tv_doge]
1676287819,0,10,False,False,我白银把把这样我不是MVP就是SVP，真的都是那种游戏玩不懂的，就必须哄着玩，辅助老鼠，下路一打二被对面ADC双杀，最后怪中路打野没去抓几个人吵架直接爆炸。然后我上路是个3-0没用，对面辅助辅助装备都压我一件。玩不了。把把这样，玩的菜的往往最会叫。
1676291514,3,8,False,False,国服就是这样的，承认自己菜真的很难，我知道你很想carry全场，但队友NB不就轻松一点？
1676269797,0,10,False,False,我的建议是，必须狠狠的扣他5点信誉分
1676390329,0,1,False,False,首先，诺手打不过船长就问题很大，前期3级船长的爆发还是不如诺手的，除非，自己给对面消耗还推线[tv_doge]
1676270208,1,11,False,False,我觉得实名而且涉及信誉就绝对美人摆了
1676297941,5,9,False,False,游戏账号最终解释权不是在腾讯嘛
1676277430,0,6,False,False,狠狠扣他5信用分
1676182979,1,12,False,False,这诺手都搞不清楚自己位置啊 这边游戏输赢和他关系都不大 单纯凑够十个人开游戏用的 这吧就是他挂机感觉都能赢  明明装死就能开开心心的吃分 唉 没有c的实力偏偏有一颗想c的心[滑稽] 好好的躺赢吃分的局 还要跳出来找存在感[笑哭] 嘴还硬 啄木鸟转世？咳咳
1676273686,6,5,False,False,很符合我对诺手玩家的想象
1676308488,0,4,False,False,被杀到爆，用挂机摆烂送头来甩锅和掩饰自己问题的人，想必大伙玩这么多年见的没100也80了，现在看都感觉有人干这种事，挺正常嗷[脱单doge]
1676268330,3,12,False,False,你们再不攻击诺手，我可要攻击你们了😡
1676280977,2,8,False,False,我跟你们说千万不要觉得这是剧本，我打游戏遇到的奇葩比现实里多的多[囧]，有的人玩个无限火力都能跟你扯现实的优越，我玩蔚跟牛头走下路，乱顶送人头，送了六个了然后说我送人头，我一看我才死三次，主要是有一次还是救他死的所以我就气不过跟他打字，然后跟我扯现实，说我穷比在网吧玩连个皮肤都买不起，我一查主页，一百多个皮肤也没我多，我就嘲讽他，他忍不了，说五分钟就200个，完事又说什么深圳有车有房，有公司，我就问他，您公司日常业务是不是英雄联盟打无限火力？骂了五分钟我问他皮肤呢，没变化啊，然后游戏输了出去我加他继续嘲讽，他又开始在装，唉，小朋友，年轻人多想想怎么赚钱，自己深圳几套房，开奥迪R8，我就纳闷了跟我有啥关系？那把打完我把他微信加了，包夜结束了嘛，我就开车送我朋友回家，然后他发了一堆我打算过会看的，到家了一看给我删了[辣眼睛]游戏里这种人还不在少数，真的，很离谱，打完游戏我还在思考，我现实里遇到的人都和和气气的，怎么游戏里的人戾气这么重，还几乎把把必有奇葩，我打游戏本来就图个竞技感，现在这匹配机制，不是家里碾压就是对面碾压，环境还这么臭，真的好几次因为臭摆子，和喷子不想打游戏。
1676263289,1,7,False,False,他要是能看出来也不至于让船长这个时间段值750，要知道这才6级，一个船长6级前能值750，这洛克得多菜！
1676207034,1,9,False,False,故意送都这么慢，才1-17-4，有的人正常玩都能0-17-2
1676256746,0,9,False,False,"虽然但是，这波明显是诺手问题
我想起来一把，当时神分和青钢影都没削。我青钢影前期把刀妹单杀1次，打回家1次，细节都做好了，结果打野一来，直接站撸叠满被动的刀妹，送了双buff。我人看傻了，然后打野的赏金给了刀妹后，这刀妹又和对面打野把我干死，后来这俩连体了……再后面就是刀妹出来破败攻速鞋，这段时间我本来不想和他打的，等3件套有了再和他打，结果打团的时候，他薄纱我队友，我切死他们家的下路2人，然后就也被收下。
一波完全起飞，这逼打野还一直点我给压力，[捂脸]"
1676287648,3,8,False,False,"弹幕:诺手玩家是这样的！
我:开地图炮？？？
.
.
.
.
.
.
.
.
.
.英雄联盟玩家是这样的！"
1676274268,2,9,False,False,说剧本那是没遇到这种逆天的，我遇到最离谱的中单琪亚娜送了39个[吃瓜]
1676243259,7,11,False,False,你们要是不把这出声家地址曝出来让我网暴他，那我就要网暴在座得各位了
1676276948,0,6,False,False,这诺手🧠是不正常的，完全不能理他
1676249098,2,6,False,False,建议把微信号发出来，让它见见社会的险恶
1676274991,0,9,False,False,"“不巧刷到了你的视频”
up这不问他一下视频里的诺手小不小丑😁😁？"
1676281769,0,7,False,False,一格血他凭什么能反杀半血船长啊？而且船长还在草丛旁边有视野优势
1676243715,1,5,False,False,少爷玩家打游戏只能这样了 理解一下
1676289492,4,7,False,False,英雄联盟还是太保守了不能杀队友，不如三国杀能杀队友拿赏金。我是这个诺手，把盲僧杀了，不是1000块直接起飞。
1676281833,0,8,False,False,哦，这个人我见过。之前他遇见承太郎嘴臭被承太郎欧拉了一顿，全身都给欧拉出马赛克了嘴是一点没事
1676257845,1,7,False,False,这诺手放在以前高低得是个翻译官
1676299708,0,5,False,False,我说刚买的扑克牌里怎么缺张牌，原来跑这来了[doge]
1676289662,0,3,False,False,看的我血压飙升，还好有后续
1676257514,3,11,False,False,当你觉得你很努力的想赢的时候，这个人就已经无懈可击了，可以直接说你们gu i着求他上分，还舔着求，你输了就是他赢了，你赢了他上分，你还窝火，看UP最后那段扬眉吐气只能说是这诺手太不懂嘲讽了，他说你们就是gui着求他赢，挨着骂还要送他上分的，输赢都让人感到难受，反正骂人只扣信誉分，谁在乎呢？
1676301839,0,7,False,False,"之前玩把乱斗，肉蛮子，打不过对面，最后一波对面卡莎拿了四杀，全员存活，我们就我还活着，于是我去送了五杀，对面也一波拆完了，结果第二把玩冰女遇到上把队友，选了个电耗子，看到我就一直嘴臭，因为我送了五杀，然后去送，我走哪里他送哪里。
不过最后还是4打5打赢惹"
1676294045,0,7,False,False,现在玩英雄联盟的小孩子心态都其差无比，一点点不顺心就心态爆炸，和现实中一样，都是惯的
1676256005,3,3,False,False,诺手是不是改id了，我怎么查不到了
1676287573,14,8,False,False,别理他就好了，何必后面阴阳怪气揽责任在自己身上呢？看似揽责任实则火上浇油，也是阴阳惯了
1676267632,0,4,False,False,留个v，我去新年祝福一下
1676243067,4,8,False,False,诺手0—10几他后面玩不玩很重要吗[喜极而泣]，炮车都比他能扛还值钱，伤害没伤害，控制没控制，扛扛不住，从他0—3还不缩塔要出去送这局不就已经跟他没有关系了吗，怎么会觉得说一句不玩了其他人就要服软的啊[喜极而泣]
1676206919,6,4,False,False,建议把微信号也发出来
1676300897,1,4,False,False,很符合我对诺手勾玩家的印象
1676278959,0,4,False,False,这个楠桐李青玩得挺厉害👍🏻
1676274931,2,4,False,False,@电棍otto 进来断案
1676249664,0,7,False,False,与其检讨自己，不如压力他人
1676292704,2,5,False,False,底下唯一赢的一把1-17崩不住了
1676304022,0,6,False,False,有些对局确实4打5能打赢，我之前有一局队友进来就挂机了，我就劝队友点了重开吧，结果队友们特别有毅力。没投成我就跟着打，最后没想到4打5打赢了，游戏结束我看了下挂机的历史战绩，平均没把死12次以上，还好他没上线[笑哭]
1676280327,0,5,False,False,哎呀你们都骂罗手什么意思，我就不站你up边，除非你带我玩
1676296565,1,7,False,False,甚至大乱斗也有这样的，今天一把大乱斗，有个人大头，队友泰坦带的疾走没带雪球，大头开局就骂，骂完就挂机。太离谱了，一个召唤师技能就开摆，这还是大乱斗，峡谷我不敢想
1676291104,0,5,False,False,这种点对话框旁边的举报可以封个几天，严重的在游戏内直接掉线，前几天试过
1676252832,0,9,False,False,这种人太多了，玩的菜自尊心又强，线上永远打不过但是又不愿意承认自己菜，也不想混，只能想办法找机会甩锅了，被单杀八次只要有一次能找个角度甩给队友，那就是队友全责
1676266621,0,3,False,False,改名了草，
1676368571,1,1,False,False,改名吧，游戏社死了，不过199块钱，我不相信他199花不起却请得起律师
1676274461,0,8,False,False,他甚至完了一把暗爪瞎子，还是所有战绩中最好的一次[doge]
1676380383,0,1,False,False,虽然但是有一波确实你的问题r直接秒了，上单不用死，我是玩中单的对打野可能带有个人观念[doge]
1676180897,1,7,False,False,这局赢了诺手加胜点没问题，迟早输回来[doge]
1676271996,0,6,False,False,为什么没有排到对面去的爽文[大哭][大哭]
1676276948,10,8,False,False,哈哈我去台服匹配没有惩戒，队友也不去打野，就选了个亚索和诺手走上路，然后这人看着我死说我抢他位置，关键选人的时候我就说了我没惩戒了[惊讶]说了一整局他还是那句话“你抢我位置我不想玩”
1676237356,5,8,False,False,"强者被抓死都是笑着玩的，弱者被抓死必定先甩锅。强者和强者一起玩游戏是怎么分配经济怎么在做事好让打野抓死对面扩大优势或者把劣势打回来。目的还是为了赢

弱者和弱者之间玩游戏是怎么把这个锅甩了好让自己有面子不那么难堪，于是你发现强者上单送7个头但是他队友依旧帮他最后拿下比赛。弱者上单揪住队友一个失误不放恨不得咬死自己队友，比赛在口水战中结束。"
1676438106,0,1,False,False,所以玩星际好，输就是自己菜
1676257008,2,6,False,False,他甚至学了一把盲僧[doge]
1676280118,1,8,False,False,哈哈，讲一下今天的爽局[脱单doge]。下路被杀烂了，然后打野下路开始互相嫌弃，我说了句别吵了，然后去帮下路失误了，省技能让对面跑了（我也没想到对面爆杀他们闪现居然还在），然后adc可能被对面用狂风追上又杀了，我就来了句看得出来女枪不太会玩，还没来得及说下一句让他们稳住的话，就被下路双人组给疯咬。然后我一屏蔽，说我蚂蚱r只给大腿用，你们下路活该被打爆，最后在大腿船长带领下赢了。第二把他俩去了对面，一个上单船长一个中单妮蔻，技术确实比我好，疯狂压我，最搞笑的是，打起团来这俩人不杀我们这天肥的adc，狂砍我一个半肉蚂蚱，毫不意外就赢了，哈哈，这俩人技术比我好，但是脑子是一点都不带呀，估计对线压我的时候没少亮表情，可惜我屏蔽了[呲牙]。
1676302554,0,2,False,False,完了十年了，没有一把故意送人头的。被杀穿到是有不少，被炸鱼没办法
1676263206,2,7,False,False,说实话，这种真的无解，你帮他他会说你k头，不帮他会说你有什么用
1676287958,0,5,False,False,你要是换其他游戏我觉得可能是剧本，但是如果是马服的这游戏我只能说很真实，现在进游戏前就屏蔽队友了，反正认真打的人战术是直接给信号的，聊天框全是骂人的
1676276874,1,6,False,False,就现在上路的游戏环境 别说打野来上路抢我人头 只要是来帮一次 甚至和我配合失误双送了 只要愿意帮一次 这把游戏打野也是我爹[doge]
1676275507,0,7,False,False,他甚至不敢用B号私信[嗑瓜子]
1676269057,4,6,False,False,互联网实名制，游戏实名制会不会环境变好一点啊？
1676252338,4,6,False,False,说实话，我玩上路，有打野抓都好了，拿几个人头无所谓[doge]只要给我留一两个就行，打野拿了头C了我还bb什么捏
1676272559,1,6,False,False,马服玩家是这样的，之前闲来无事回归打匹配，注意是匹配。当时一年多没玩了玩的有点菜被单杀了两次辅助就在一直点我，说什么玩的菜赶紧去电子厂找个班上，我没理他继续抗压，结果人还以为我好欺负继续叭叭没完了，各种人身攻击这那的，说什么这辈子就是个穷狗，开始攻击父母。巧的是我爸的s350l不怎么开我开着呢，直接跟她说结束完加v视频，人还在那一口笃定我在装什么[呲牙]结果加v视频后直接沉默不语哈哈哈哈，这人还是个女的，由此可见这游戏环境已经成什么样子了。
1676278351,1,5,False,False,经典自己100血对面600血，我能单杀[大笑]
1676290650,0,7,False,False,这样的人，应该是缺少父母的管教吧[委屈][委屈]
1676193056,1,8,False,False,赶快寄律师函吧，村口厕所缺纸了
1676254712,0,4,False,False,有剧情，有小丑，有后续，这不给个三连？
1676269950,0,7,False,False,一枚臭屁的电子少爷捏～[给心心]
1676253580,1,8,False,False,盲僧这波给了个盾，打了六百多的输出。上去一瞬间，诺手一丝血，船长半血，诺手站在船长大招里四层流血，还得先a桶子再a船长才能出血怒不然直接死，这能说自己单杀被抢属实逆天
1676260790,1,5,False,False,不喜欢可以攻击，没必要划走[脱单doge]
1676243846,0,6,False,False,四打五是真的能打的，怕就怕有队友被搞心态不想玩了，三打五就比较难了。打了这么多年，只赢过一把三打五。
1676265831,0,6,False,False,拒绝删除！大力曝光！游戏环境就得这样整顿
1676277923,0,7,False,False,这诺手属于是被游戏玩了，而不是在玩游戏
1676212492,0,7,False,False,改ID很简单啊，先查主播的ID，然后找到这把对局，找到诺手即可
1676300585,2,5,False,False,弹幕好多说台服的，别台服台服了，一直宣传。现在一堆少爷公主到台服了已经，风气明显变差了
1676294854,0,5,False,False,这波up属实赢嘛了，赢了游戏，有了素材，还给我们观看诺手小丑王哈哈哈
1676279015,0,6,False,False,仔细看了一下，本人北部大区星耀一，这波确实是李青的问题。这波诺手想当巨婴，你就应该当他抚琴。而不是和他讲道理。然后你利用抚琴优势狠狠的教育他，给予他成长。
1676382909,1,1,False,False,碰到能c的打野，我玩上单巴不得他拿人头。[doge]
1676277900,1,5,False,False,你这手速，在我区是守不住家人的
1676254214,4,7,False,False,他但凡是被对面打野单杀甩锅给自家打野都能说的过去
1676288001,3,5,False,False,如果我是诺手我会说，赢了我加胜点，而且我战绩这么差elo机制下把还匹配你
1676261242,2,10,False,False,是炸鱼，但是这是摆烂嘴臭挂机的理由嘛？更何况他还不是被炸的那个，躺着还要嘴硬。
1676240776,0,6,False,False,献祭流诺手，让对面赏金变多，然后再让队友收下，他在第五层[星星眼]
1676264832,8,6,False,False,龙瞎这个神话炫彩，第一眼我还以为是神拳[笑哭][笑哭][笑哭]后来看着看着好像不对劲，才发现是龙瞎。
1676278987,0,6,False,False,这种输了真不开心，之前我一页svp然后摆烂玩了吧翠神打野，然后赢了，我比输还难受
1676251277,3,9,False,False,这种的输了他也不痛不痒，就扣几点信誉分罢了😄😄建议以后改成送人头的队友的分从他身上扣
1676259072,2,3,False,False,打野拿头不是应该的吗，而且还是盲僧[喜极而泣]，我玩上单的
1676191008,0,5,False,False,少爷估计都要急死了[妙啊][妙啊]
1676255502,6,6,False,False,可能会杀，但是会被换掉，因为船长进草了，船长有Q的话就换不掉，没Q的话船长能多一个A，勉强换掉，他说的那个好不容易的机会有点牵强，船长桶子要是不失误，或者大招放好点诺手完全没机会
1676272825,0,7,False,False,我昨天还是前天晚上和朋友开黑打匹配娱乐，上路路人选的瑞雯，对位塔姆，我剑圣打野。有一波我去帮他，但看他兵线进塔了，我就先等着让他先清线，结果他三分之一血直接上了，然后太突然了我只好Q起手，最后塔姆两百多血跑了。然后我的视角，塔姆走了不见了，兵线要进瑞雯塔了，我想着就帮他清了，但我刚Q完，塔姆靠E还是啥的回血又回来了，所以我就又清了个跑车把兵线给瑞雯卡在了塔前，他上线了还吃到了下波线和这波线的三个兵。但是我帮他清线时他，一直ping我，卡完线后他又说我不懂兵线，清线不清完，想把他塔皮吃了啥的。挺无语的[无语]
1676438031,0,1,False,False,但凡主播那波q没中，诺手都死了，这种还怪打野的纯纯晚餐，没叫打野一声迭都是大不敬
1676280733,0,5,False,False,咋样都能赢 根本输不了 学到啊Q真传 精神胜利法!他是懂得我只能说
1676290139,4,3,False,False,为啥诺手前期会打不过船长
1676269668,0,6,False,False,不得不说，其他三个队友是真给力
1676304530,1,5,False,False,"现在所有人聊天关了，以前是可以给对面报点的。
比如打野去下了，所有ap出杀人书等等。"
1676440641,0,0,False,False,今天我玩的时候虽然有点坑吧，我没甩锅，知道是我自己的问题，然后我唠着唠着辅助开始骂我了，我寻思我也没干啥呀，是坑了点，但团我也参，我也没说不能扛，我也没说怂，但是辅助就一直在骂我说话多啥的让我闭嘴，好好玩我寻思我也没摆烂啊[笑哭]
1676263427,0,6,False,False,我是韦鲁斯或者泰坦我都追着盲僧保，我保不住我都骂自己，这叫什么这叫格局，是上大分的
1676297779,3,2,False,False,不喜欢代练，踩了
1676190491,0,5,False,False,很符合我对低分段玩重装上单的人的印象
