上传时间,回复数,点赞数,up是否回复,up是否点赞,评论文本
1676279589,0,6,False,False,"观众行为，观众买单。这种事真的跟“自媒体”人没关系(抱歉，主要是我非常隔应“主播，粉丝”这种词)
因为，真论什么权益不权益的事。
他这个账号的维权，应该是由拳头亲自下来找你谈，但从利益维权上来讲，你并没有冒犯拳头这个集体的利害关系。
因为归根结底玩家并没有对账号的实际管理权限。(虽然听着残酷，但这是事实)[妙啊]
所以这玩意纯属于是被人薄纱了还要当小丑。
当然，你得注意，你不能教唆你的关注群体去“人身攻击”这个“人”，你可以透露，可以在自己的立场埋怨。
但你不能整什么“你们去帮我骂他”以及“大家怎么看”这种话。
说白了，没公众影响力的人，你随便咋骂都行，只要你不往上面去得罪。
而像你这种有公众影响力(自媒体流浪超过100都算)的人，说话就得想尽办法只牵扯自我了，一旦有对公众性质的言论就容易吃亏。
我以前帮我一伙计(算不上啥朋友，我动用人脉拿钱捧他，结果有点小火了直接优越感爆棚，现又落魄了我理他个丢嗨[笑哭])处理过的杂碎真不少，它们请的那些律师，一般会扣什么字眼我心里面都有一点点底的。[妙啊]"
1676270180,1,7,False,False,有没有一种可能，诺手本身就连看一眼船长的资格都没有[吃瓜]
1676239786,1,8,False,False,菜就是菜，非要说自己在摆烂送人头[doge]
1676360619,0,1,False,False,黑色玫瑰 黄金2 游戏ID：谁将爱意丿掩埋，大家去加他好友，就算他不通过，每天上线也要一直看到很多好友添加，排到了记得问候一下
1676299947,0,5,False,False,诺手本人来了[喜极而泣]，这下双重打击了，是不是纯纯小丑？
1676255214,0,5,False,False,这比诺手急死了哈哈哈哈哈哈哈哈哈
1676251546,0,6,False,False,你别搞了，别人本来生活就不如意，这下肯定气的几天没好觉睡了
1676367225,0,1,False,False,大哥，你是大哥，卧槽你这盲僧太牛逼了！
1676293377,0,4,False,False,这洛克是懂搞节目效果的
1676286437,0,5,False,False,一点小小的信誉分震撼
1676293623,2,5,False,False,本来他就是想着网络里肆无忌惮 嘴脸再丑陋下一把也没人知道，结果一下被挂出来了，丢人丢大发了开始急了。[妙啊]
1676252045,1,7,False,False,嗨，我选个寡妇打野，上路是个武器，我们两边都是人头在打野身上。对面艾克大爹我寡妇也超神了。武器帮了两波还是被打爆我也没说啥。中期一波团战我和辅助偷死对面打野，最后打了二换五。我，AD，武器存活，武器满血我和ad半血。我和AD打信号打大龙。我们都去了，但是我们两个半血的脆皮，寡妇打龙又慢，AD莎弥拉也快不起来。武器不来大龙跑去带线。最后大龙差一丝血对面艾克复活赶来抢了大龙还拿了双杀。我就点了点武器说了句早来早打完了。结果他开始发脾气，开始骂人，用一键文字疯狂刷屏。我寻思我也没说啥攻击性的话啊。真的服。
1676303686,1,3,False,False,只能说 这波影响到生活了是吧 这回是不是不开心了？不是一直开心吗 不是输赢都开心吗？
1676290400,0,3,False,False,《老子加胜点了》
1676301722,0,4,False,False,上次打游戏仨挂机，我上单和打野硬干对面5个人，我家被干到门牙我和打野杀到对面高地，队友说我看不清局势，说我不会玩，我真不理解[囧]
1676294091,0,2,False,False,火速更后续
1676331713,0,1,False,False,这，就是国服带给我的自信
1676279846,1,3,False,False,虽然但是为什么解说和操作不一样呢@[doge]
1676180860,7,3,False,False,我觉得主播真没问题
1676393504,0,0,False,False,爆杀这种故儿是最爽的，混了这把分也改变不了自身是个飞舞这件事
1676241651,5,35,False,False,"第一波，冲太快了，草里没眼，船长等Q加A必杀（没盲僧情况下）[吃瓜]
正常打就是：稍微等一下小兵，诺手过来给盲僧w，双招都在，交个闪控船长一下，船长有橘子但是反应肯定没那么快，基本上下波有疾跑，在等一波野爹，诺手如果拿其中一个头，基本上压力不会特别大（被这么打过[大哭]）"
1676296021,1,2,False,False,所以说你炸鱼没问题吗
1676292937,0,3,False,False,想赢的都去韩服了，国服就剩大乱斗了
1676280221,0,4,False,False,是的，我们上单玩家是这样的[呲牙]
1676301476,0,5,False,False,所以有时候想到所有人聊天被锁 我还挺庆幸的 因为以前我遇到过这种摆子队友 在所有人聊天那里报队友的位置[藏狐]
1676283528,2,4,False,False,不是说必定让你们输吗，诺手怎么已经开始假设赢了的情况了
1676265092,2,6,False,False,国服是这样，什么1-6指点江山我9-0，不知道的还以为是对面打野疯狂抓导致的，下路我们6 7个人小团战，上路谁也没去过。你回他一句被单杀，他就说你第一波来帮我杀了我能经济劣势？有些各别的看后面我们优势要赢，又怕显得他很废物，直接开始单带吃线，不跟团也不推塔。非要让你一块输
1676248092,1,2,False,False,[doge]
1676279860,0,5,False,False,要是我我就问盲僧大哥能不能踢个残血过来让我爽爽[doge]
1676185520,1,5,False,False,为了这个聊天记录，我投币了，兄弟们怎么说？[吃瓜]
1676299705,0,2,False,False,马服的素质是这样的，今天和朋友玩个无限火力都有人开喷，打完加好友进我房间开麦喷 ，句句不离妈，然后我和我朋友说人越缺什么就越会提什么，给他干沉默删好友跑路了[热][热]
1676392009,0,0,False,False,还是太年轻，实际上这么送没啥用，也不值钱，不如不送人头，把自己家野区的野怪红蓝BUFF都杀了，之后补一会儿自己就值钱了，然后再去送[脱单doge]
1676272375,0,21,False,False,对，是打野的问题，就不该去打野，就应该出个辅助装在上路陪着他应该让拳头也跟复仇之矛一样，开局带把小斧头，给辅助，辅助a人也带血滴[大笑]
1676272791,0,6,False,False,笑死了，前几天玩大乱斗，一个玩卡萨丁的前期一直猪鼻操作各种送，也没说他，后面好不容易被我们拖到他16级了拿了几个人头又开始r脸给对面上面上嘴脸结果我们一波团打赢推过去一波不了战略性送了两残血，对面复活大家都往后退，就他刚复活踩上去直接被秒导致gg，问了他一句怎么打的直接1喷4，完了还加我好友说不过就扯现实自己多有钱，我打开掌盟一开，最高段位黄金4，我最高钻二，他400个皮肤，不到我1/3，游戏游戏比不过，现实也没体现出来多有钱，光靠张嘴和键盘我还说自己是首富呢[OK]
1676358547,0,1,False,False,玩诺手的是这样的，不配打野去帮，你去了多少次他优势了都会觉得是自己玩的好，一打多的觉得自己很帅。崩了就全是打野的毛病，“我都玩无敌的诺手了，我怎么能打不过呢？一定是打野的问题”
1676240543,1,4,False,False,这个段位你指望他有啥理解啊，第一波船长一个吸蓝刀，诺手一把长剑，他都敢直接疾跑上去。顺从他不好吗？
1676440770,0,0,False,False,有大腿抱还能叫啊[吃瓜]，以前版本没那么畸形，抱上个代中代，一手鳄鱼蜘蛛一宿从钻石守门员打到钻一这个不属于我的段位，当时还在上学直接做个条幅挂寝室窗外狠狠炫耀了一把，这诺手格局多少是有点低了。
1676265046,1,12,False,False,made，真看的我血压上来了，几天前我玩豹女，我们上单酒桶打铁男，我前期帮他抓死铁男两次，然后铁男到6了，我跟他说上路我不好抓了，因为我们两个谁被关进去都打不过，让他猥琐塔下别死就行了，此时我是5/0，好家伙他非不，被单杀两次后直接说了句垃圾打野，我？？？他被单杀后对面打野拿先锋直接撞了上路两座塔起飞，然后我豹女也可以乏力了，就这样输了，真的气死人了
1676268851,2,5,False,False,我突然想到如果开全体聊天，诺手是不是就会报位置了，想起以前的事了
1676180427,1,5,False,False,他都这样了，干嘛还理他[思考]
1676293748,1,3,False,False,懂了，献祭流诺手[doge]
1676374362,0,1,False,False,好久没看到这么爽的了，这币给了[热词表情_世萌双冠]
1676433011,0,0,False,False,这就是咱国家星际争霸等难的游戏没人玩了，这种不愿承认自己菜的建肿太多了[脱单doge]
1676279001,0,3,False,False,看他盲僧，在学你出装[嗑瓜子][嗑瓜子][嗑瓜子]
1676194302,3,3,False,False,搞不懂，有人买的彩色显示器就喜欢看黑白电视，你能有什么办法，
1676282659,0,5,False,False,很符合国服的环境，嘴硬，少爷，摆烂，公主，烂中烂！
1676290155,0,5,False,False,我上单开局拼一血没拼过都不敢说话[热]
1676298417,0,3,False,False,改名＋设置隐私咯[doge][doge][doge]
1676180870,32,4,False,False,不谈事情到底如何。这种事真追究下来你确实要删视频的。就看他愿不愿意花钱了。
1676285729,0,5,False,False,诺手想赢赢不了，想输输不掉[嗑瓜子]
1676256062,0,3,False,False,那天早上碰到对面《脚本》金克斯翻盘的视频呢？喜欢你嘴硬的样子，炸鱼炸多了碰到不属于这个段位的操作就是脚本？
1676290053,0,4,False,False,我觉得不是剧本，因为我遇到过更离谱的
1676357410,4,1,False,False,玩游戏最重要的是什么？开心呐！一直输开心吗？有这种大带飞的队友我要是遇上了不吹牛别说人头我连兵线都让他吃，只要能带我赢，打团前先让我祭天都无所谓[喜极而泣][喜极而泣]
1676296844,1,5,False,False,臭鱼烂虾罢了，有一次我皇子打野10分钟抓对面中下野，一共10个人头，我贡献了8个，然后上路锐雯被剑魔单杀两次，第三次的时候对面木木上去喝了口汤。然后少爷忍不住就开始甩锅了。是真的搞笑。[大笑][大笑][大笑]
1676293419,0,2,False,False,速速出后续
1676292680,1,5,False,False,你以为诺手在第一层，其实人家在第五层[doge]
1676243608,0,5,False,False,压力队友的我都不说了，我TM昨天一天就遇到两把，什么话都没说也要开摆的，选个打野蔚自己掉线兵都到线上了，下路回线没帮他他就只在野区玩了。还有一局上单被单杀死了一次直接挂机。我是真的服气，两个我都举报了都狠狠的扣了信用分[藏狐]。
1676294960,0,5,False,False,别的不说，六七级来帮你一个被船长压着打的诺手反蹲，换我已经开始管打野叫兄弟了。
1676294711,1,5,False,False,up这瞎子后期都这么猛啊，我后期就像个自爆卡车，最好的结果就是换一个走[辣眼睛]
1676288297,0,3,False,False,英雄联盟是这样的，后来我想通了，没必要带他赢，然后就退坑了
1676278528,0,5,False,False,其实有的时候是这样的，有的时候我真的是搞不懂他又菜又嘴硬是怎么敢的，有一把我诺手配合打野差点五杀然后我当时打字说亚索，我让一个就在他面前他不让给我抢了，我说你真该死呀，好兄弟，对吧？这一看就不是骂他的话，他就说你算什么玩意啊，你个玩诺手有什么资格叫啊？我说来单挑，别说话，他说行，1000一把，我说OK结果加他不同意，出去一看他是玩诺手的你这真的不是搞笑吗？但是我朋友就遇到一个这种不服的，一把一把还真的给我靠，已经给了400了
1676290323,1,5,False,False,这人真不会以为他送了能影响什么吧，都不如小兵值钱
1676349616,5,1,False,False,我最近刚入坑吗，对线能力不及格，但是看了几年比赛脑子还是有点的，基本上就玩个塞恩，我还能压腕豪，我们打野也超级好，让我捡先锋，让我吃塔皮，这种诺手就不应该玩这个游戏，应该玩火影忍者
1676259653,16,5,False,False,炸鱼挂队友 你还挺骄傲？
1676294912,0,3,False,False,省流:哈↗哈↘哈↗哈↘，有🤡
1676269887,0,3,False,False,送他上首页[吃瓜]
1676367139,0,1,False,False,他娘的没有后续了？[生气]
1676280462,2,4,False,False,别说台服了，现在那些少爷也去台服了，自己送还骂本地人
1676386144,0,0,False,False,诺手这一个微信聊天。直接让这个视频的戏剧性上升了一截[还有醒着的么2.0_PRPR]
1676262544,1,3,False,False,麻烦快进到诺手号主哭着发视频道歉，谢谢，🙏我最爱看这种了[脱单doge]
1676426733,0,0,False,False,其实最后你们四个一起投降，这样输赢他都难受
1676287391,0,3,False,False,掌盟都给干成热搜了
1676263455,0,3,False,False,真的典啊，太典了[捂脸]
1676266662,0,8,False,False,这种人不被网暴我会看不起大家的[星星眼]
1676291004,0,4,False,False,这种人该不会有父母吧[吃瓜]
1676282565,3,2,False,False,认真你才输了  这种就是找存在感的  说白了他打谁都是一样崩   他也不怕输   我不知道你打的啥分段  反正在我白银  这太正常不过了   你觉得白银差分吗
1676442017,0,0,False,False,我们四黑 遇到小丑都是认真打 推到水晶一丝直接投[doge][doge]
1676388915,0,1,False,False,你就这啊诺手，真够离谱(感谢抖音的好xd)
1676300682,0,5,False,False,我有一把带白银朋友玩跟这局一样，同样的诺手对线船长，我是蜘蛛打野，我晓得诺手不好打船长，赶紧速三帮他减轻压力，第一波抓了个闪现，紧接着第二波以我方诺手闪现疾跑为代价抓死船长了，我拿了头，经典的来了，诺手疯狂点我，问我他双招都交了，还抢他人头什么意思，我说我大鸟和石头人已经被对面打野反了，我需要点经济出法穿鞋，不然打不出效果，这哥们给我来句:那你刷对面野啊?不然你帮我抓有什么意义?从他说出这句话开始我就知道跟他说什么理解已经晚了，他没被打爆还好，被打爆了一定疯狂甩锅，诺手果然不负期望，刚上线就被丹砂了，我见他已经癌症晚期了，就不帮他了，过了好久打开tab看了下，诺手已经送了8个了，聊天版打开一看，这大哥来来回回就那两句，要不是打野第一波k我头，我不会被打那么惨的，话里话外骂打野把自己撇的干干净净，还好队友是明眼人，我们这边ad阴阳了两句诺手就破防了，开送!边送边口嗨:爹不想让你们赢你们就赢不了，他又连续送了5个头，可惜我太肥了，一波火龙魂给对面干穿了[呲牙]，结束后诺手主动加我好友要求看回放，仔细复盘我那波抓船长是不是我的问题，真的逆天
1676386816,0,0,False,False,看置顶我敢肯定这诺手头像应该是自拍了[呲牙]
1676272000,0,3,False,False,很符合我对马服环境的想象
1676384206,0,0,False,False,这诺手难道没发现自己送出去的钱最后都进了瞎子口袋[doge]
1676256497,0,5,False,False,🤣🤣🤣🤣报警的逆天怎么不在评论区叫
1676270538,2,5,False,False,我今天玩手游遇见了更离谱的，我上单剑魔单杀剑姬四次，然后打团又拿了两个人头，后面团战没打过，我这边一杠五的打野凯隐就说我拿那么多人头有什么用，还不是废了，我寻思着我大部分人头都是单杀的，和他们一点关系都没有，打不过的锅也能甩给我，也是长见识了
1676293271,1,5,False,False,这种大概率年龄不超过15岁 超过了我只能说没救了转生吧[doge]
1676295162,0,4,False,False,《谁将爱意丿掩埋》[doge]
1676259916,2,3,False,False,又不值多少钱，还少个人清兵，反正打团也没有兵线有价值[辣眼睛]
1676287710,2,6,False,False,万能的网友 我想家访了 懂我意思吧[脱单doge]
1676375346,0,0,False,False,建议把它微信QQ都挂出来，让兄弟们好好困扰困扰它[吃瓜]
1676287981,2,5,False,False,"建议发一句:反正你也不值钱，就如你的人生一样
你看他破不破防[吃瓜]"
1676381200,0,0,False,False,诺手这是在激发队友潜能，这波是在大气层[doge]
1676294539,0,3,False,False,诺手怒扣5点信誉分
1676293993,0,3,False,False,国服打都是要mute all的
1676302118,1,2,False,False,师承余小c
1676422126,0,0,False,False,我的评价是，ctrl+3能有不同的嘲讽动作[嘉然_笔芯]
1676274121,1,4,False,False,就逆天 我玩个上单对线拿一血 被对面打野恶心兵线 上线对面一直卡着打野又来一波 经验都吃不到 我们打野就隔那刷 我怎么就遇不到主播这种打野[藏狐]
1676268869,1,4,False,False,现在动不动就怪打野的爷新太多了，国服本来功能性打野玩家就少，没有几个说像比赛一样控血线等打野的，对线能力的影响肯定更大，而且被单杀就是自己的锅，有啥问题吗
1676277574,0,5,False,False,"换我是盲僧，我就一句话：
你都没血了跟我BB抢人头？[疑惑]"
1676283043,2,3,False,False,掌盟都搜不到了哈哈哈哈
1676261796,1,4,False,False,诺手现实中应该没有接受过什么教育😄
1676275429,2,3,False,False,握草，这诺手是我[难过]
1676371256,0,0,False,False,就这个年代了，还老子老子的叫自己[尴尬]我还以为我穿越回十年前了，就这个词，在我老家方言里面都消失了
1676400534,0,0,False,False,八连跪的逆天东西笑死我了
1676393352,4,1,False,False,你自己打的低分局，又要找人评理，低分的有几个有游戏理解？
1676299954,0,3,False,False,谢谢UP让我爽了，还有评论区后续，感谢，给你三连加热度[脱单doge]
1676294525,0,3,False,False,这个诺手回去还得骂设计师，还要哭诺手弱
1676376989,0,0,False,False,老实说。我关注你就是为了看后续[脱单doge]
1676233525,0,2,False,False,少爷是这样的
1676385575,6,0,False,False,很强，但有必要把人挂起来烤吗？还挂两次。本身服务器环境都不好，是不是每个这样人都挂上去。这么强，直接线下见面，网上搞这些花里胡哨有趣吗。
1676245930,0,5,False,False,第一波反杀之后不得给他来一句：我看你不是能杀吗？给个解释
1676263576,0,7,False,False,建议微信号也爆一下，大伙都爱看这种小丑🤣👉
1676248285,2,4,False,False,我之前玩亚索，有个人玩李青，没帮，我打不过对面亚索，他就骂我飞舞，我才玩2～3个月，至此我以后玩亚索会把队友全禁言
1676367481,0,0,False,False,我就不一样了，up要是带我别说听指挥了吃我兵都没问题，我甚至欢迎他拿先锋来单吃度成，所以up我们一起玩吧[阴险][脱单doge][奸笑]
1676271599,2,5,False,False,我要是这诺手送了这么多首先是一句话不敢说。你来帮我吃了终结大头，要不是炮车被塔打死了我得pin烂你的cj和炮车，然后化身贪啃奇开舔，过后稳稳躺平，能怂就怂，找个机会闪现e能立功就行，不能就肉身开团，最后美美吃分下一把！
1676247702,0,4,False,False,就马服这个sm举报系统 让他嚣张到能说出来赢了我得胜点 输了我开心
1676245416,0,4,False,False,第一波，船长再点个桶子，a个火刀直接就单杀，那么大的兵线彻底宣告上路游戏结束，这诺手真是又菜嘴又硬[偷笑]
1676265850,1,5,False,False,有的是这样的，昨天无限火力，玩艾克对位一个剑圣，一级团人家好几个人头，出门十字镐加箭袋对位我一本增幅法典，然后他线上还被我杀一次，js就开始游走了，每波我都敖敖给信号，但是队友就是一直死，然后就开始疯狂点我，喷我。玩个无限火力都能喷人，理解不了
1676443498,0,0,False,False,这有什么，这不是国服日常吗？身为一个打野玩家表示黄金局队友会帮上单指责你
1676437422,0,0,False,False,上了怪你抢人头。你没上被杀怪你为什么不跟。[doge]
1676246235,2,5,False,False,我的建议是，对于这种人肯定要展现自己实力，狠狠C，在最后！他认为就算自己摆成狗还是能赢的时候，推水晶了，点投降！让他爽也爽不了，放弃了输的念头准备安心嘴硬拿胜点的时候，让他掉胜点，他会疯掉[doge]
1676249675,0,7,False,False,他甚至想玩一把暗爪虾子，纯小丑啊[大哭]
1676298542,0,3,False,False,对面也离谱，这诺手送一两次就看出来了是不想玩了，龙坑那里送人头的时候还往它身上交那么多技能
1676290421,0,2,False,False,昨晚遇见了一个和这诺手差不多的，举报封号了[妙啊]
1676250141,2,4,False,False,主播说诺手没说到点子上啊，这诺手嘴硬在哪里，他的意思是我虽然被单杀，但是自己能把劣势打回来，但是自己单杀人头被k了所以崩了。如果真的按他说的那还真是打野的锅，可是很明显他单杀不了，我感觉应该抓住这点说他
1676237177,0,4,False,False,"线上被单杀永远不肯承认自己打不过。
“就差一点”“如果xxx就杀了”“他怎么有闪现”“他没那口橘子就打过了”“他不暴击我就杀了”“下波我必杀他”
就是不服，就是觉得无论如何自己一定比对面强。[吃瓜]"
1676264491,0,4,False,False,[尴尬]这诺手实在🤡   我不想玩的话也不会吵架骂人 直接退出去就行了   玩游戏不开心还玩啥呢
1676268693,0,4,False,False,勇敢的心是这样的[藏狐]
1676270183,1,3,False,False,国服=代练+主播+喷子。
1676257338,10,6,False,False,摆烂的尽头就是你无比努力秀来秀去的，但是你赢了他加胜点，骂你骂爽了还顶多掉信誉分，你输了那他就赢了啊，他只想让你输，你觉得自己很牛逼赢了，其实还是让他加胜点，点他有什么用呢，他加胜点了
1676287384,0,4,False,False,这个诺手已经抽象到像是up找的托了哈哈[doge][doge]
1676273314,1,4,False,False,1-8骂13-1马服传统了属于是，带躺还指指点点
1676230835,0,6,False,False,这种人应该是国服特色了。有些主播也这样。不过开着直播装人设罢了
1676376540,0,0,False,False,你把它惯坏了 以至于后来比赛以为有大跌帮它赢
1676397338,0,0,False,False,诺手设置隐私了，战绩查不到了[辣眼睛]
1676399247,0,0,False,False,up视频素材都这样的逆天队友，可见国服环境真的烂透了
1676264513,1,2,False,False,我还以为只有塞恩能玩送死流
1676364507,0,0,False,False,就喜欢你这样的视频，给你点赞投币了。多把这样的垃圾拉出来晒晒，让他们见见阳光
1676275730,1,3,False,False,这种人最喜欢隐藏战绩了[吃瓜]
1676402861,0,0,False,False,你为什么能匹配到黄金啊 这么厉害的瞎子绝活
1676386548,0,0,False,False,我感觉你应该说“不需要你也能赢”，这样杀伤力强一点
1676285909,1,5,False,False,诺手开疾跑的那一刻，他要么脑子有问题，要么段位不超过白银，就这波兵线，除非船长是个10伯的人头，不然亏炸[呆]
1676191901,1,2,False,False,应该来一句4打5，有人没用呀
1676296452,3,4,False,False,某种意义上来说他已经明白了玩游戏的意义，玩游戏就是要开心，不管输赢[doge]
1676259556,0,5,False,False,前天在台服碰见一个俄洛伊名字叫511hh。我点对面让他去留，我一个劫打野。上去被对面盖伦扭了e，我看他死了，准备把兵线推进去，吃了三个他点我。  我直接走了去抓中，对面盖伦直接来中。他在那叫说自己亏了两波线。打不过了。我一看战绩1/3，结果紧接着后面还被盖伦单杀了。在哪说自己炸了，玩不了了。我说我吃了三个兵，兵线只是成了回推线，对面盖伦直接来的中，按你的算法对面盖伦比你少吃两波线差三个兵，你怎么还被单杀。然后他退了。我们四打五还赢了🤣👉🤡
1676235116,1,6,False,False,玩得又菜还喜欢叫 为什么低分段这种人这么多 之前帮朋友上分经常遇见这种人 自己被单杀怪队友 真服了
1676265778,8,4,False,False,每个人都有玩得菜的时候，我也是一样的。我玩得菜的时候，很多人都不说我。哪怕说我我也当看不见，除非说得过分了，我会回答。我花钱玩游戏，你想管就管？
1676262737,0,8,False,False,网络上活不起，现实中唯唯诺诺，太失败了这人[大笑]
1676370969,0,0,False,False,[doge]要说躺赢还是我会 我要是up队友我已经帮忙骂诺手了 每次队友骂我认为打的没毛病的 我都要帮忙
1676293052,6,2,False,False,这瞎子怎么看的那么像脚本
1676287159,0,4,False,False,"相当大一部分人认为打野的作用：
把线上人打残然后我一个平A收人头"
1676250692,0,4,False,False,纯送人头而已问题不大，反而给对面加赏金[doge]在我放有大爹伤害高能操作的情况下，看似4打5，实际上是4.5打5。[抠鼻]
1676249411,0,4,False,False,大家别误会，我们联盟玩家是这样的[脱单doge]
1676277140,2,3,False,False,我在想那一波盲人不上，他被船长单杀他不也照样甩锅给打野
1676182898,0,8,False,False,我已经笑麻了，你要说林子大了什么鸟人都有还真是，物种多样性真就在这个游戏里体现的淋漓尽致呐
1676257082,0,2,False,False,我想挑战一下当你队友让你输
1676282722,0,2,False,False,太有效果了，直接硬币奉上
