上传时间,回复数,点赞数,up是否回复,up是否点赞,评论文本
1676299187,0,2,False,False,太抽象了，不等兵线进塔，直接疾跑。
1676258395,1,5,False,False,3202年了都 玩这游戏还要说K头的 赶紧埋了吧
1676246891,0,4,False,False,有一次玩上路，对面中路，打野过来越塔追着我打[doge]我都不知道是不是我太强了，然后我让打野来帮忙，他给我来句把输出装卖了出肉，我特么真的很费解，游戏结束打野都没帮过忙
1676255056,1,2,False,False,我没啥意识，反正只要对面被杀了我就是赚了，谁杀无所谓
1676271228,1,3,False,False,多送点狠狠的扣信誉分
1676285901,0,3,False,False,谁将爱意丿掩埋
1676396305,0,0,False,False,我也遇到过被单杀两次然后对面打野去抓了一次，此时他0-3，后面对面没有任何人去抓过他，7分钟后0-8，说被对面疯狂针对然后骂打野
1676364712,0,0,False,False,上我的战略就是我顺风就压线一打二，逆风就不死塔下当乌龟[大笑][大笑][大笑]有一把被抓爆了，下路打野把对面抓爆了，我是石头人开个大就好了保护我方ad[惊喜]切记不可心急
1676257605,0,2,False,False,玩诺手的确实是这样的
1676232079,0,4,False,False,“谁将爱意丿掩埋”[笑哭]
1676264800,0,6,False,False,原来精彩好戏在评论区啊，害得我把视频看完了
1676296837,0,2,False,False,这种人是专门给人刷素材的
1676272692,4,7,False,False,这不是国服特色，这是国人特色，我日服台服都是玩家，这情况之前都少有，国人来多了也成乐色场了。
1676303387,0,2,False,False,你这是强行将他的段位提升，然后让他后续一直输，高，果然高
1676264899,1,2,False,False,有人能带我赢 我他喵直接出辅助装，能推就推，
1676250795,8,4,False,False,有没有大佬能做一个插件把这种人的ID记下来次次排位的时候自动检索[星星眼]
1676253510,2,3,False,False,人家能单杀，你把塔下兵吃了就好了。
1676252819,0,4,False,False,诺手又不是真的强，不要觉得qingtian比赛上玩了一把就觉得强[妙啊]，大伙都宁愿玩杰西都不玩笨比懂得都懂[喜欢]
1676248995,0,2,False,False,送人头那种不是会判定不给分吗
1676273254,0,3,False,False,这诺手是怎么进化成人的？[奸笑]
1676284041,0,4,False,False,很长时间没碰LOL了，之前想明白了，我天天上班碰到儿必，打个游戏还能碰到儿比，还得盼着我伺候，还不如我去玩老滚5，雇个NPC都比这儿比队友有用。
1676311061,0,1,False,False,^^
1676290780,0,4,False,False,洛手这把游戏没输人跪了，八连跪
1676295681,5,4,False,False,诺手喜死了，喷你一顿自己还能加胜点[doge]
1676292374,0,2,False,False,什么时候有后续啊？哈哈，律师函都来了[呲牙]
1676249532,0,4,False,False,"节目效果拉满了
🤭🤭🤭🤭🤭
🤭🤣👇🤣🤭
🤭👉🤡👈🤭
🤭🤣👆🤣🤭
🤭🤭🤭🤭🤭"
1676295784,0,2,False,False,@LOL楠神李青 主播素质有待降低[嗑瓜子]
1676386640,0,0,False,False,还要寄律师函哈哈哈哈
1676366997,0,0,False,False,LOL的黄金局基本上都是这样的，我反正在战争学院打的时候10局里面9局不是吵架就是摆烂
1676295508,0,3,False,False,7级船长值750块的时候就已经说明一切了[笑哭]
1676282944,0,3,False,False,想起玩上单铁皮人对线小袋青钢影 我被杀穿了[微笑]队友也没有压力我 我都唯唯诺诺不敢讲话
1676258209,1,3,False,False,一大早开开心心的，看到这个气的我难受
1676248582,1,2,False,False,诺手没错，他凭什么没错。。
1676252756,0,3,False,False,我不怎么玩上路但开局我就感觉很离谱，打野在后面为啥要开疾跑强行1打1，你有什么想法可以发信号打字交流，觉得不稳妥的话可以让打野走河道抓，为啥非要这样打？打野第一时间完全跟不上啊[辣眼睛]
1676443618,1,0,False,False,所以up用什么软件查战绩的 wegame隐藏了看不了
1676280990,0,2,False,False,马服是这样的
1676250242,0,4,False,False,连坑这么多局，难道有8个妈？[给心心]
1676281759,0,2,False,False,蹲个后续，有了踢我一下[doge]
1676256852,0,2,False,False,这嘴怕是钛合金做的
1676256944,1,3,False,False,那他为什么不向剩下4个队友道歉？
1676263877,0,4,False,False,1/17还能赢之后两天不输十把根本回不到本地[笑哭]
1676283679,1,3,False,False,马服现状[藏狐]
1676350060,0,2,False,False,搞不明白这种人，杀了不就行了吗，一个人头而已，你要是能带飞线都给你吃，当然了拿了经济还c不了…你可不要怪我了[doge]
1676273660,0,3,False,False,输了游戏不可怕，就怕游戏里玩完，在现实上也认真，这人真失败
1676302702,0,4,False,False,很久没完了，看看还是很有意思，菜加那点胜点是没用的，多大能耐就多少段位，短时间的一点分改变不了什么，下局又掉下去了
1676249420,4,4,False,False,说实在，最近玩起来不知道为什么，感觉比以前正常许多。最少队友知道被对方碾压，真的无力反击会投降[妙啊]
1676266703,0,2,False,False,马服魅力时刻
1676182363,1,4,False,False,他说他加胜点的时候就应该四票一否投了的[doge]
1676270647,0,2,False,False,给我狠狠的扣他荣誉值
1676374025,0,0,False,False,省流：大快人心
1676184987,6,24,False,False,我昨天玩一晚上就没碰见过一个正常人诺手，要么被爆线压力嘴臭打野，要么对线打不过被无限单杀，打团不来就嗯带  真不怪哥们对诺手玩家有偏见
1676254507,0,3,False,False,太小丑了，我都以为是剧本了
1676256621,0,2,False,False,最好诺手q闪没k到头有被爽到，期待现实再薄纱一手
1676258840,0,3,False,False,那诺手是不是诽谤up呢，要不要赔偿精神损失费呢[给心心][给心心][给心心]
1676262832,0,4,False,False,前几天我抓上，蹲了半分钟，我家狗头就是不上去给减速在那里q小兵拿我当保镖。对面就回城了。我上去推线，他直接闪现疾跑去中路送头。然后我家辅助亚索我怀疑是跟他双排的，一直不参团，还刷我野。最后我和中单刀妹加ad卡莎多次3打5打爆对面基地。狗头最后送成0-13-0，举报了，就扣了个信誉分。我直接润台服了。我宁愿开新号都不愿意在这种恶臭的环境了。
1676255555,0,3,False,False,《私人游戏id》连账号都不是你的还私人？[偷笑]
1676291417,0,3,False,False,这就是我退游的原因 全员逆天🤣
1676404737,0,0,False,False,[藏狐]有的人坑了不敢吱声。有的人坑了开始脑补：完了我这把蔡了，输了怪我怎么办啊，不对，不怪我，都怪队友不帮我（帮了就是抢人头）。然后结束脑补“合着输了都是老子的锅呗，你们有什么资格怪我？”然后队友：？
1676261192,0,2,False,False,他生活的一定很困扰吧
1676381303,0,0,False,False,除了这个诺手，还有千千万个诺手，英雄联盟只会破坏你的好心情[脱单doge]
1676258687,0,3,False,False,经常玩排位这种人挺多，懒得搭理，打好自己尽力了就行[吃瓜]
1676379454,0,0,False,False,玩网络就别怕现实🤡，up干得好
1676256638,1,3,False,False,这诺手还行，昨天我陪我一个新手朋友打人机，有个诺手人机局10/2/3自我高抄了，嘲讽新手没他打的好[吃瓜]问我朋友，怎么还有人死啊？我可是越泉水杀对面[笑哭][笑哭]我就说了一句闹谭
1676345072,1,3,False,False,遇到过这种人，送了一整把恶心一整把。完了我们四打五赢了，出来就嘲讽对面说自己这么送他们都赢不了
1676382762,0,0,False,False,这种人国服一抓一大把[tv_doge]常玩打野的都遇见过
1676303314,2,2,False,False,游戏官方应该加一个限制，比如说多少秒之内连续死多少次就会让对面获得的金币锐减。
1676228252,1,11,False,False,德莱厄斯：懦弱之举，绝不姑息！此子投敌叛变，这个锅我不背！！！这个玻璃心召唤师玩谁谁输，我也无可奈何[热]
1676299764,0,2,False,False,鉴定诺手为，心理年龄不足18岁的小丑
1676261716,0,3,False,False,诺手b站号呢 要开学了很不爽 想骂人[生气][生气][生气][生气]
1676254001,0,6,False,False,我身边一朋友也沾点这味 电竞少爷 “我玩的不爽你们都tnn别玩” “我玩游戏是为了开心的凭什么惯着他们”
1676300714,0,2,False,False,这诺手怎么做到青铜局把把被打崩还能坚持玩的，我都感觉联盟快凉了，这么菜还能坚持玩，他快乐的点在哪啊？这游戏不会还有新手吧？但一个老玩家别说十年八年了，你玩个两三年至少也该上个黄金了
1676305522,0,2,False,False,小孩子是这样的
1676336437,0,5,False,False,最可笑的是，这种人被举报了，只会扣除信誉分，然后待观察，国服真好捏，大家快来玩
1676399413,0,0,False,False,打到水晶，点投降胜点都不让他加
1676280177,0,2,False,False,一般打野来帮，我都直接打野随便吃，我猥琐。[妙啊]
1676371770,0,0,False,False,这是儿子在怪爸爸呢
1676246961,0,3,False,False,很符合我对诺手玩家刻板印象
1676257606,0,5,False,False,显然，别人用屁股都能想明白的事，他用他肩膀上面那玩意想不明白
1676286451,0,3,False,False,"371杠17，孤独凯瑞！
你滴神王，彻底疯狂！"
1676384527,0,0,False,False,6级打9级 这废物心里没点数是怎么被压的？
1676387523,0,0,False,False,今天玩台服打匹配，玩个上路铁男乱杀对面腕豪和艾克打野，队友一直送，我说了句稳住，他们就骂我站着说话不腰疼，我[微笑]后面我们队伍就我一个正战绩16/4被我们那下路2/7的寒冰说成是国服来的巨婴，我可真c了[微笑]送的是他们，我说稳住他们不干，那我就说点呗，不想稳还要送，就别玩了点呗，就骂我是国服巨婴，给我气的，我真服了[微笑]每次打架遇见对面下路养起来的VN手短摸不到，被杀一次下路两就扣6，台服已经给我打出阴影了
1676421939,0,0,False,False,游戏里嘴比火箭外壳还硬，然后视频出来发现好像是自己的问题开始扯别的了[笑哭]
1676286855,0,3,False,False,我好想说一句话啊，这么强的诺手，都送成0-11＋了，还能让队友赢，这诺手好猛，（你这么帮助还能让我们优势，棒，继续加油）
1676346061,0,1,False,False,越听越和bbgg的声音一样，感觉狮子狗在玩盲仔[豹富]
1676250315,0,4,False,False,打灵活在187组的五人车队 就遇到过类似的诺手 也是玩诺手 打野没帮他 他被单杀了就说因为没人帮 打不过 说灵活都不帮打什么灵活 直接去开送 说自己玩的不舒服也不能让我们不舒服 诺手打狗头还是船长我忘了 对面是个发育型上单 号称自己是黑色玫瑰刚转区过来 段位青铜2 不愧是青铜
