上传时间,回复数,点赞数,up是否回复,up是否点赞,评论文本
1676273382,77,897,False,True,"米家游戏的玩家的特殊性有其环境的特殊性造成的[笑哭]这是我的个人看法。
因为厂商之间的博弈导致mhy的游戏（包括角色）上线之前的节奏一直很大，节奏最大的时候游戏可能都要没了，更别谈能有现在的mhy和米家游戏了。所以这导致老玩家对节奏非常敏感[笑哭]
我当时作为路人，也是因为这些节奏一直没有入坑原神，直到开服一年后才入坑。隔壁第一个跟开放世界的幻塔，它的玩家是不是画风也有点不一样？
说这些也是希望能稍微理解一下老玩家吧！"
1676282509,78,518,False,True,铁道我觉得大概率还是走原神那套，就是没有pvp，靠更新速度不断出新地图和剧情，以及一些活动来留住玩家，长草肯定会长草，但是只要更新版本后玩家就会乖乖回来玩。
1676272746,67,458,False,True,其实我不太想玩pvp，不知道大家怎么想的，出pvp我可能就不太想玩了[辣眼睛]
1676286478,254,541,False,True,请问氪10w在火影，明日，yys，率土，一人，dnf，cfm，bgo，赛马娘，方舟，三国杀，游戏王，幻塔等等里面是什么水平啊@爱听杰伦的春水 [给心心][给心心][给心心][星星眼][星星眼][星星眼]
1676293465,4,68,False,True,"我发布了一篇笔记，快来看看吧
全角色满命图片
杰帕德

14:23 
瓦尔特

14:32 
姬子

14:36 
克拉拉14:38 
彦卿

14:51 
布洛妮娅

14:5...
https://www.bilibili.com/h5/note-app/view?cvid=21807228&pagefrom=comment&richtext=true"
1676271641,9,163,False,True,鬼叔别急 米哈游还有 绝区零 那个才是你喜欢的动作手游[脱单doge]
1676263401,9,233,False,True,回合制游戏就是自己玩才有意思，而且米哈游做的也没那么深，还是倾向于休闲摸鱼的类型，
1676270111,43,206,False,True,我觉得贵，但鬼叔这种人肯定觉得便宜一个648够我买十几个单机小游戏了，我玩这种游戏一般都只充月卡娱乐娱乐
1676262675,24,134,False,True,10w就全了。。。和火影比真是。。
1676264310,9,109,False,True,[歪嘴] 看完鬼叔整个游玩过程，感觉这游戏未来肯定比原神还长草。。前期肯定要肝些但是主线支线跑完后。由于是个回合制游戏，挂机刷本就是了。期待鬼叔到仙舟罗浮的剧情。
1676279978,9,60,False,True,春水这波纯属是自己一发回旋镖打死一大票人，但凡之前别人冲官方的时候他站在玩家角度说话了，这波都没有问题。
1676301176,0,10,False,False,我这么理解的，我一直以为铁道这款游戏，它有没有一种可能是米家角色聚合在一块的主神空间。就是你玩米家的其他游戏，有一些角色可能挂了，就在这个游戏里得以复活，那么仅仅只是靠着其他游戏玩家对于经典角色的喜爱就可以让玩家对这款游戏产生留恋的感觉，毕竟偶尔回游戏见见老朋友也是挺不错的。
1676264895,0,67,False,True,"钱包：你能不能行啊
手：略感疲惫[脱单doge]"
1676263230,37,1486,False,True,鬼叔一想，区区10w竟然氪穿了？有点意思[笑哭]
1676263499,6,76,False,True,早上刚看一个12w普池全角色满命满金的。然后就再想鬼叔会不会也这样。结果中午就来了[辣眼睛]
1676292284,16,22,False,True,666，光速切割是吧，你昨天安慰春水的时候大伙可都在场呢[嘘声]
1676288833,1,19,False,True,鬼叔心态算好的，春水那个b就算了吧，看他的料真的逆天
1676345777,13,25,False,False,春水的玛娜西斯回想的视频是去年六月做的，那时候他得玩30个小时才敢评价游戏，说人家三小时玩明白了啥，现在他也变成了三小时就评价游戏的人，这半年他到底怎么了[doge]
1676285134,2,55,False,True,入门简单 适合养老，回合制游戏就这样，不同游戏不同群体，期待铁道公测后能给出什么样的优秀答案[星汐seki_太牛啦]
1676282950,66,334,False,True,"弹幕：“崩3玩了一年，1000块，原神玩了两年，2000块，太贵了，退坑了”
只能说，赶紧走吧，学业重要，中考还是挺难的。"
1676342842,1,20,False,False,兄弟们，我带来了春水哥哥的新圣经！《这游戏公测下来还没有三个小时，就有一堆喷他的视频出现了》《拜托三小时，我玩了30个小时才敢做评测，三小时你玩明白了啥呀》《上来就说这游戏骗钱坑钱，我一分钱没花都直接毕业了》《评测游戏真的就一点门槛都没有吗》[滑稽]以上均为春水哥哥在游玩玛娜西斯回想后的真实发言，截图为证
1676274843,9,32,False,True,有一点担心就是，这游戏乐趣主要在各种文案和剧情演出上，测试服体验过的这部分等正式服再过一遍的时候就会有点痛苦了
1676275703,17,35,False,True,比起原神感觉星铁更适合我，原神我晕3D玩不了一会就头晕不说还特别菜，抽了几个角色了现在璃月剧情都没过[喜极而泣]
1676283647,17,48,False,True,大家都以为返利血赚，实际上是氪佬只赚到1.5倍（3600元以内）的一丢丢，到1.25倍压根没赚。首先，氪一单（非首充）不是给6480，而是8080，但公告明确初始比例1:10【在「跃迁测试」期间，开拓者的充值总金额（包含古老梦华、列车补给凭证、无名客的荣勋或无名客的奖章）将按照1元=10古老梦华的标准进行返还】，也就是返还6480x1.25=8100，赚了20（相当于赚了0.24%），你要氪404单（26w人民币）才能免费赚到1单，之所以各大主播都这么氪是因为原神已经氪了很多了，后面星铁开服横竖都得氪，不如早点氪。但对于连原神首充都没清的平民玩家来说，你往测试服里氪金可以说亏炸了。望周知[脱单doge]
1676264165,7,28,False,True,穹妹啊[吃瓜]所以都惦记着你的原姐呢？从来没人说满星魂满叠影，大家都是说满命满精呢？你也不想大家惦记你姐姐吧？[呲牙][阴险]
1676275775,7,125,False,True,鬼叔，实际上，春水之前有过前科，这波又一波AOE基本上把很多游戏玩家得罪了，然后被算总账了，所以才出现了这么惨烈的状态（有一个完全不了解游戏性质的人瞎讲，也才被怼了1000多评论，而且还有护着的，他能被怼上2000多评论还能被追着怼…）
1676282956,7,29,False,True,回合制游戏可太多好玩的了...中老年人最爱了，我现在天天就梦幻西游端游和阴阳师。上班摸鱼的起飞，再就是打打农药，周末带领导小孩上上分...
1676264726,3,49,False,True,鬼叔不要抽游戏了，抽我吧[脱单doge]
1676292904,0,16,False,True,游戏有鬼叔就不用担心流水了，我直接白嫖[2233娘_耶]
1676350201,0,5,False,True,听了鬼叔的话，决定入坑了
1676265231,2,90,False,True,鬼叔，让米哈游特地给你整个无忧充值吧[嗑瓜子][嗑瓜子][嗑瓜子][嗑瓜子][嗑瓜子]648一个个扫码太累了，我心疼你啊
1676262756,0,28,False,True,看你玩游戏，相当于我玩游戏，舒服了[doge]
1676305153,2,12,False,False,春水你别走[大哭][大哭]幻塔需要你[大哭][大哭]
1676263542,1,37,False,True,「感谢鬼叔黍的舰长，诶怎么名字和我一样？哦就是我啊」[doge]
1676267857,7,44,False,True,对于我这种弃坑营养师，崩坏的非酋玩家看到这种抽卡就知道有多坑，我还是安心放个云玩家好了，不去碰[嗑瓜子]
1676273848,20,131,False,True,"最后捞一手春水我是没想到的
前面说的还挺中肯的，后面在被人蓄意带节奏并且有证据的时候把反击的玩家称作魔怔人我认为不妥"
1676388874,2,2,False,False,有没有一种可能，春水那种人来了，更会让游戏环境变差呢？
1676367326,0,3,False,False,我建议你不要和那个up牵扯，也不要为他说话，他搞事情已经不是第一次了，他就是故意的，他也不是来提意见的。
1676263127,4,18,False,True,没人提醒鬼叔300抽的那个留着最后来补吗[doge]
1676289353,1,8,False,True,看完了，通篇说的挺好，除了春水那一段，我是一个字都不觉得对，我们首先要对话的是一个人才能和他和和气气的说话[崩坏3·光辉矢愿_瞄准]
1676268029,3,88,False,True,身V11的我，还是低估了火影氪佬们的钱包容量[辣眼睛]
1676271575,1,10,True,True,鬼叔这期视频的标签和合集都打错了呀[吃瓜]，是不是后期的锅
1676264151,0,26,False,True,标配强捞确实不容易，点赞支持
1676309285,7,6,False,False,不靠蹭热度吃饭这个我知道，但是在网上随便乱说话就是要负责任的，希望正视之前的节奏。
1676263489,0,14,False,True,“公测谁抽普池啊”
1676266720,0,20,False,True,昨天鬼叔错过rap彩蛋了[藏狐]
1676276119,5,20,False,True,这个大概和时空猎人当时差不多，鬼叔最近可能会多更星铁，一段时间玩腻了就回去播火影说书了
1676276569,0,16,False,True,第一个把米家游戏测试版完成破解办的人
1676266848,1,15,False,True,想看鬼叔玩微信小游戏咸鱼之王[doge]
1676292118,0,3,False,True,啊，一会再看，一集都没看过，一会再看
1676300841,0,3,False,False,养着400人团队的游戏，又没有pvp而且要它长期更新下去，薄利多销本来就不太现实，对玩家基数有很高的要求
1676296853,4,3,False,False,"有没有懂的人说一下鬼叔关于崩三的事啊？我这边的了解是，剧情没做完就锐评终焉，过奥托剧情不认识卡莲（这边有人说因为当时说太困了，不过我持怀疑态度，到剧情高潮了怎么还会困？）
然后我就不关注他了，甚至刻意躲着，不知道是不是误会，希望有个大佬来解释一下[脱单doge]
不过，看评论和视频的话，感觉不像这样的人，观点挺中肯有自己理解的，而且人家也不是干这个吃饭也不怕节奏，感觉挺值得关注的"
1676267031,0,10,False,True,标签：崩坏苍穹铁道
1676279855,3,10,False,True,懂了，囤3500抽可以抽到全图鉴[doge]
1676291394,1,5,False,True,鬼叔说过，他发视频是分享，氪金是乐趣，后半段客观分析游戏走向的时候就弹幕还有带节奏的[辣眼睛]
1676265476,0,10,False,True,我觉得到公测时又会大变一番，毕竟你游是自由的[妙啊]
1676280151,0,10,False,True,鬼叔的视频都是当抽卡模拟器看的[微笑]
1676289795,2,14,True,True,给我点赞，叫我宝[白色情人节_老婆赛高]
1676276371,2,58,False,True,我可能知道老杨去哪了，昨天看到一个up叫什么什么熊来着，说不想要老杨，结果五星全是老杨。白露抽了半天还是300抽换的[OK][OK][OK]
1676292571,0,2,False,True,现出猿形[doge]
1676263264,0,14,False,True,希望鬼叔别再被恶意带节奏了[拥抱]
1676263093,1,8,False,True,体验感受15：19[吃瓜]
1676438084,0,1,False,False,目前看来，除了老杨，其他人都算是崩三的同分异构体。[脱单doge]
1676274205,5,6,False,True,"有点离谱双金的概率也太低了
感觉比崩坏和原神还离谱[辣眼睛]"
1676262876,29,9,False,True,米哈游的游戏是真的良心，要是腾讯的，上限没几千w下不来，dnf就是这样
1676284294,0,23,False,True,[doge]别人是测试游戏其他内容，鬼叔是真测试概率来的顺便玩玩抽卡[OK]
1676287032,2,28,False,True,大家不要带入，会叔他有科技，用的蓝绿修改器[笑哭]
1676269695,8,23,False,True,其实我真的挺喜欢回合制游戏的，勇者斗恶龙系列 仙剑系列等等大部分回合制都玩过。但是现在已经没那么多精力玩了[辣眼睛]
1676263425,1,23,False,True,鬼叔准备把星穹铁道列为常驻，那以后考虑帮粉丝抽卡吗[脱单doge][doge][脱单doge]
1676272765,0,19,False,True,区区十万，我蹬个七八年三轮就有了[傲娇]
1676356280,3,2,False,False,铁道应该都知道是回合制手游吧，但是某主播在直播，大家看的津津有味的时候，突然跑出个说回合制无聊，说手游无聊的，不觉得很ky吗？
1676265807,1,16,False,True,米哈游的水是深的，但有没有想过？我叔的水你米是摸不透[歪嘴]
1676263011,0,6,False,True,再氪 把全部角色弄成满命满精两套 [doge]
1676266744,1,16,False,True,依稀记得鬼叔沙哑的“老杨～”
1676264125,0,11,False,True,0太多了，我还以为是100万呢[吃瓜][吃瓜]
1676265894,0,6,False,True,细数鬼叔一晚上喊了多少次老杨[tv_doge]
1676264867,1,11,False,True,我过剧情的时候确实也觉得看动漫似的，但又不同于看动漫，总之很有参与感。[脱单doge]
1676275750,0,6,False,True,鬼叔我马上征兵体检了能祝我好运吗[脱单doge]
1676290871,2,2,False,True,希望鬼叔还是别和春水扯上关系了，那家伙说话嘴把不住门，不知道什么时候就爆出几个雷把别人连累了，真心建议远离[呆]
1676285850,9,12,False,True,这才内测啊，up太豪了
1676266086,30,22,False,True,我已经开始期待鬼叔入坑崩三了[脱单doge][支持]
1676272906,6,6,False,True,感觉根据自己玩公主连结的理解（崩坏铁道了解不多感觉应该差不多吧） 有些角色的练度什么的是不是都要卡到一定的程度最好就别往上升了（例如公主连结部分角色打公会战需要卡rank和卡专武等级 到后面法队还要卡角色等级方便对轴🤔）当然全拉满也不是不行（）
1676290643,0,2,False,True,讲真的，有点想玩这游戏了，不过氪金是不可能的
1676268355,4,6,False,True,"鬼叔 合集名字打错了 旅打成了律[脱单doge][脱单doge]
这是打律者打多了吧[脱单doge]"
1676385172,0,1,False,False,我觉得吧，喷春水最主要的就是，这家伙没有深入体验游戏不说，还在那双标带节奏，吃着刚崩铁刚开服的流量，开服打着为玩家好的旗帜，做着引战的事情，看着就很令人生气
1676263481,2,7,False,True,六命的碎片都是没穿衣服的吸溜[鼓掌][给心心][给心心]
1676290380,0,2,False,True,羡慕嫉妒恨，我已经不想再说了
1676385851,0,1,False,False,mhy的想法简单：我的游戏轮流长草，你们就轮流玩，反正更新我跟得上
1676292418,0,2,False,True,第一次，在现场[星星眼]
1676264221,3,29,False,True,4：26记住这句话，兄弟们[崩坏3·终焉归始_咀嚼]
1676365935,2,1,False,False,我希望能出PVP，因为回合制玩法就是比谁伤害高、谁刷得快，如果到时候为了0氪玩家出的关卡难度太低，必然会牺牲氪佬的游戏体验，0氪玩家可以运用丰富的配队和战斗机制获胜，而氪佬点一下自动战斗就过了，会大大降低氪佬的游戏体验，而pvp可以照顾氪佬的游戏体验，让他们觉得氪得值，这样mhy可以投入更多经费做好绝区零等游戏，大不了PVP的奖励设置低一些，普通玩家不参加PVP就好了
1676341496,2,1,False,False,崩铁确实适合养老，目前主线、支线、全宝箱肝完，今天清日常+体力不到十分钟就搞定了，然后默默的下线[藏狐]
1676268556,2,36,False,True,玩游戏都不用自己玩，看鬼叔玩就可以了，体验感十足🙄
1676285520,14,29,False,True,一共10W还是加上上一个视频的5W呀。。我感觉比崩崩崩便宜多了。。。
1676286660,0,5,False,True,《崩坏苍穹铁道》[辣眼睛]
1676380665,1,1,False,False,我是学生，up能帮我充10万吗？[tv_doge]
1676291730,0,2,False,True,商业单子
1676276808,11,35,False,True,米哈游差一个小说网站，二创小说一多就可以做进崩坏铁道，文案就不缺了
1676263897,0,15,False,False,我删掉了王者荣耀，我退出了同学的作业共享群，我披星戴月，我奋不顾身，我还是没抢到沙发[tv_呆][tv_呆]
1676291484,0,1,False,True,我更期待绝区零，回合制我真的提不起兴趣了[热词系列_知识增加]
1676274558,0,5,False,True,"看之前:让我看看更新了啥！
看之后:老杨~～老杨～～老杨啊～～"
1676289830,0,2,False,True,这3天体验光抽卡了
1676264401,0,6,False,True,老杨老杨老杨笑死我了[笑哭]
1676269969,0,7,False,True,魔方失宠了[doge][doge]
1676303507,0,9,False,False,你小子我是真不喜欢啊，能不能别蹭哦
1676293367,1,2,False,True,"作为一个原神微氪玩家，很期待星穹铁道，一开始就能感受到，米哈游是更加自由了，可能通过原神累积的金钱和技术，让他们更能实现一些以前做不到或者不敢做的想法。
这两天看的这个氪金节奏也是觉得可笑。因为没有测试资格，只是从各个视频观察的，一个，星铁没有PVP，那么是否抽取强力角色就不是那么必要了。然后，也没有看到因为没有五星角色而被卡主线关卡的情况，甚至在游戏过程中就送了游玩需要的各种属性各种类型的角色了。
没有PVP，不卡关卡，那也就没有必须氪金的理由了。氪金就只是成为一个选择项而不是必选项。"
1676294741,8,3,False,False,如果说指责抽卡贵的话，那他也没说错啊，咱们国服游戏商品都溢价到这个鬼样子了，该有点反抗的声音了吧，毕竟如果把价格打下来的话，获利的是玩家啊，你去维护厂家是什么操作- -
1676277363,3,6,False,True,有点欧啊 全满命满精3000多抽 我看别的有抽10000+抽的[妙啊]
1676289854,0,2,False,True,回合制到后期如果没PVP真的会很枯燥
1676292899,0,2,False,True,白嫖呗，我目前就没充过，正常玩就行了。作为玩家，要是玩这个游戏不开心那™不会换一个啊，游戏这么多非要在一棵树上吊死是吧。主机游戏，网游，大型单机，手游都是我的翅膀。
1676290251,0,1,False,True,鬼鬼我近期看不到你的视频了[大哭]，马上就要中考了，我想考到本地最好的高中，要戒一下电子产品，等我中考完再来看[大哭]
1676288234,0,4,False,True,崩铁？
1676293137,0,2,False,True,只希望剧情可以不要想原神那样小孩子剧情就可以了
1676279171,0,4,False,True,看过等于抽过真爽，和那些健身视频一样。
1676283780,0,8,False,True,鬼叔好久没翻我牌子了[脱单doge]
1676264120,0,4,False,True,在现场，传说中的扬八万[脱单doge]
1676292323,0,2,False,True,鬼叔试试万国觉醒，那个游戏不花钱[脱单doge]
1676263527,9,4,False,True,鬼叔，常驻池现在没必要抽满吧，以后你经常玩的话肯定能歪满的[笑哭]
1676274627,0,4,False,True,很难想象返利后星穹爆仓
1676279239,0,8,False,True,看完了，相当我也氪了个十万
1676262775,0,3,False,True,哎
1676265092,0,3,False,True,[脱单doge][脱单doge][脱单doge][脱单doge]
1676267710,4,11,False,False,一个人几乎养活了整个服务器[喜极而泣]
1676267292,1,1,True,True,取关了。鬼宝，你终究当了叛忍
1676289075,1,3,False,True,开服返150%，up已经赚了五万了[doge]
1676266835,9,6,False,True,回合制看别人玩比较无聊吧
1676280394,0,6,False,True,鬼叔不要村子了是吧？
1676280387,4,3,False,True,看起来是真没啥意思。。
1676287556,6,5,False,True,回合制没有pvp太无聊了[笑哭]
1676263161,0,3,False,True,完了，我还没开始玩就索然无味了
1676271335,1,3,False,True,简单20*648[疑惑][疑惑][疑惑][奸笑][奸笑][奸笑][支持][支持][支持]
1676269933,3,37,False,True,要是开服后常驻抽满，如果以后歪了不是就没用了？感觉血亏，不过我想鬼叔应该不会介意这点[doge]
1676273560,1,3,False,True,是不是控制出率了啊
1676376816,0,1,False,False,富哥v我50助我夺取胡桃[tv_doge]
1676279680,0,6,False,True,"我（看到封面）：我看看什么逼游戏氪了十万，以后看不起这游戏
（点进来看到up）：哦，和游戏没关系，打扰了"
1676280306,6,3,False,True,看视频有个很帅的古风男，拿大剑的景元，怎么没有了？就冲他来的
1676264452,0,3,False,True,合集名是不是不对，《之旅》吧，为什么是《之律》
1676280614,0,3,False,True,这游戏和时空猎人比，简直良心[笑哭][笑哭]
1676262884,0,3,False,True,可爱呢，我直接撅了[星星眼]
1676435531,1,0,False,False,个人感觉现在的手游价格越来越趋同了，而且还很贵。。。648已经固定下来了，很多手游都以这个为标准，但是玩家收益却还是赌博性的概率，差异化特别大。还有一个就是为啥要定648这么高呢？[呆]
1676288096,0,3,False,True,哈哈哈嗝
1676373822,7,0,False,False,这游戏看起来游戏性很一般，我觉得不值得浪费过多的时间精力和金钱投入，简单玩一玩还是可以的。主要是他作为一个回合制但是要卖角色，因为技能问题导致机制简化这种割裂感让我觉得很难受。过简就只能导致策略性下降，搭配好阵容估计战斗直接挂机都行。真养老游戏
1676376760,1,0,False,False,除了pvp就是养成，收集，牧场，社交，这些能保持上线这些类型代表就是宝可梦，暖暖，星露谷，光遇，不过我都还不知道星穹能不能串门，不过大抵是不能的，mhy估计也做不出来很有意思的副玩法，玩了6年他游活动和玩法就那样，这也算是二次元游戏的通病了，其他游戏是本来就没想做那么大，mhy的已经破圈了
1676291282,0,1,False,True,鬼叔大气啊我也刚入坑[妙啊]
1676265783,0,4,False,True,鬼鬼我爱你😍
1676284177,1,6,False,True,玩这么多游戏真的忙的来吗[笑哭]
1676372992,0,1,False,False,游戏真佬来了[妙啊]
1676316354,0,0,False,False,宝可梦除了switch上朱紫的排位，卡牌的线下对战也是常青树。当然玩卡牌和游戏的有对战党，也有收集党PVE党。PVP和PVE，老玩家和新玩家，本地人和外地人，不一定要非此即彼。
1676365822,0,0,False,False,00:21 鬼叔一想，区区10w竟然氪穿了？简简单单抽
1676377306,3,0,False,False,我一直觉得米家的游戏抽卡很贵··· 不过一群嘲讽我穷逼的人让我不敢发言···但是玩游戏吧··看个人吧  看很多视频都是攒攒抽一个角色抽满 感觉也能攒下来 不那么贪心应该也能有比较不错的体验···吧？
1676340638,0,0,False,False,玩了四年崩三氪了42块钱，如果全勤应该能红莲，拿了一次零食箱和一本138块的设定集，米家游戏太贵了[保卫萝卜_哭哭]
1676289936,0,2,False,True,还得是鬼叔啊
1676292339,0,2,False,True,PVE枯燥？你是在小瞧我米哈游的产能？
1676290298,0,2,False,True,妈耶，这是破解版吗[笑哭]
1676353026,0,0,False,False,"以前:马哥我是鬼鬼
以后:鬼鬼我是马哥[doge]"
1676320609,3,0,False,False,"卧槽10W氪穿啊
忽然觉得也不是很贵，主要是氪穿才10W而已
当然我没钱氪，零氪玩家非常感谢大佬们养服[保佑]"
1676322267,0,0,False,False,"“回应我吧！瓦尔特杨！！！”
：嗨，想我了吗
“无论何时何地，瓦尔塔杨都会回应你的期待”

（对不起，脑子里的错乱DNA[脱单doge]）"
1676356202,0,0,False,False,鬼叔:在这游戏充钱仿佛找到了当初火影拉勾玉的感觉[脱单doge][脱单doge][脱单doge]
1676355781,1,0,False,False,米哈游玩家永远的内战幻神，不看鬼叔那个评价春水的视频我还真以为是鬼叔自己刷到、想看的
1676442150,1,1,False,False,劝人大度是吧，相对不客观是吧，游戏环境是吧，那么为什么不去先劝劝所谓的相对不客观的不要破坏游戏环境。
1676306259,3,1,False,False,[笑哭]没打算玩但是点进来康康，主线剧情感觉只能作为加分项，建模固然重要但是其他回合制游戏走剧情强化刷材料基本都是点点就ok的也方便来回刷，不知道这个3D的是否便利。另外关于PVP肯定不能和宝可梦比，宝可梦的培养比抽卡抽重复刷圣遗物快得多得多，想走什么战术也比较容易实现而且还可以租队打，手游培养自由得建立在肝和氪上所以官方也不可能按宝可梦搞对战。还有648确实不便宜，钱没那么多的小伙伴与其硬玩然后和某些玩家争（官方也不会理），不如去玩更加实惠的游戏比较快乐
1676424817,1,0,False,False,挺好的我就喜欢这种回合制单机剧情，能让我找回当初那种玩轨迹系列的感觉
1676341011,0,0,False,False,观点一致，作为一名杂食性PVP为主的竞技玩家，也是把崩铁作为常驻养老游戏玩的~点个关注常来坐坐
1676396514,0,1,False,False,众所周知，米家的游戏没节奏我不玩[doge][崩坏3·光辉矢愿_遨游]
1676358620,0,0,False,False,这种回合制的话，还有命座武器这种东西，本来就不合理，很多这种类型的游戏命座都可以说是免费的，只要肝就行，可以免费拿碎片，慢慢给他升上去，但这种可不一样哦，感觉非常氪金
1676356847,1,0,False,False,看了这视频才知道叔叔也是崩三玩家，不是崩三曾经的玩家我不信能出这样的视频[微笑]
1676373998,0,0,False,False,它要出PVP我肯定不考虑玩，但如果跟原差不多搞个月卡啥的也还算可以接受
1676319261,1,1,False,False,但是这个游戏大概率是没有PVP的，甚至没有排行榜。感觉也不一定合适鬼叔。[doge]
1676369447,1,1,False,False,比阴阳师好多了
