上传时间,回复数,点赞数,up是否回复,up是否点赞,评论文本
1676446494,0,0,False,False,求问，老家双控一个灯的要怎么改造智能开关
1676385291,1,0,True,False,你家全屋才四个开关吗？[doge]
1676449217,0,0,False,False,有没有华为的，下次出个视频呗
1676447941,0,0,False,False,@生咖啡 酷
1676380822,1,0,True,False,没网的情况想让我家车库门和电灯联动
1676435146,0,0,False,False,阿弥陀佛
1676387127,4,0,True,False,单火版会大概率出现频闪，有零线最好买零火版。还有这个小米音箱经常喊不听
1676384314,1,0,True,False,aqara和小米选哪个
1676389020,5,0,True,False,我家小牛开关只有L L1 L2 L3且都是红线，我该买单火还是零火的[笑哭]
1676387058,5,0,True,False,起初我也想弄套华为的（有音箱、电视了），但是对应的蓝牙门窗传感器要150+，人体移动传感器200+.....[笑哭][笑哭][笑哭]
1676393862,0,0,False,False,不错，家里有个半成品，用智能音箱控制电热水器，有钱继续补充
1676386764,3,0,True,False,荣耀智慧屏能遥控吗？
1676392615,1,0,False,False,小米那个开关要做好常换的准备。。。。半年就坏了
1676379070,1,0,True,False,厉害[星星眼][星星眼][星星眼]
1676386974,1,0,True,False,想问下双控的灯怎么改开关，是弃掉一个然后加随意贴吗
1676391897,0,0,False,False,"还是得买小米的全家智控的那个皮
屏幕，断网还能用"
1676388298,0,0,False,False,━━━∑(ﾟ□ﾟ*川━我一个房间就有四张窗帘
1676388256,0,0,False,False,墙壁开关关了  还可以语音控制灯嘛
1676387950,3,0,False,False,"卫生间怎么自动关灯呢 ？我设置的有人经过自动开 20分钟后自动关
但是洗澡有时候超过20分钟"
1676388639,1,0,False,False,这个小爱音响连接主要是靠网络还是靠蓝牙呀？我屋卧室的网不是特别好，会不会连不起啊？
1676387720,0,0,False,False,485模块怎么接米家？
1676441984,0,0,False,False,家里大概140平能不能覆盖到啊
1676388153,0,0,False,False,我怎么没有红外控制
1676395774,0,0,False,False,我用天猫精灵，还有开关有一对联动按钮
1676395647,0,0,False,False,hilink呢
1676387884,0,0,False,False,谢谢up[呲牙]
1676448744,0,0,False,False,说下买什么电视好，怎么去广告。
1676434765,0,0,False,False,全是广告位
1676436498,0,0,False,False,有86面板的还叫老房子？
1676438064,0,0,False,False,没什么卵用
