上传时间,回复数,点赞数,up是否回复,up是否点赞,评论文本
1676371537,101,1505,True,False,给互联网上的朋友清醒清醒，中国并不都是北上广那么繁华的[妙啊][妙啊]
1676377621,12,169,True,False,今天偶遇了阿雅和王桑，本人更好看，[星星眼][星星眼]
1676375674,17,693,False,False,别再说摊子脏了，我是外卖员，跑过很多城市，负责任的告诉你们，外卖这个东西，真赶不上摊子干净！只有一小部分外卖，因为是大餐厅，才能干净点，即使是大餐厅，也有一部分脏的，环境确实不脏，脏的是人
1676379145,3,96,False,False,能让你看见的，你说不卫生，不让你看见的，你说干净[tv_抠鼻]
1676372086,14,161,True,False,其实在临沂农村，跟阿雅差不多大的小媳妇，也没有穿着这个棉袄出门的，一般打扮的漂漂亮亮的，这棉袄一般在家穿，轻便又暖和，还真是佩服阿雅的勇气
1676370675,6,245,False,False,"我发布了一篇笔记，快来看看吧
看看，像不像大白馒头在就着烧饼吃丸子？
胖乎乎，香喷喷，圆滚滚，齐了😋
祝阿雅老王天天好胃口！！
https://www.bilibili.com/h5/note-app/view?cvid=21826203&pagefrom=comment&richtext=true"
1676382513,4,80,False,True,我二十年前小时候就经常在这种农村小铺吃饭，现在我也觉得可以接受啊。特别是我现在在日本看这个视频，这一桌子菜真是馋死我了，别说35块，就是135我也愿意出，家乡的味道，童年的味道
1676376441,1,36,False,False,中国很大并不是所有地方都是北上广深，不是大城市发达的标准，中国还在发展中，所有我觉得出现不是“发达国家城市的标准”场景很正常
1676372735,10,189,False,False,35四个菜让我躺这地上吃都行[doge]就没见过这划算的
1676373656,5,148,False,False,"我不觉得不干净
挺有烟火气的
还便宜
比有些饭店后厨还干净"
1676376616,2,73,False,False,"赶集是这样的吧，你看到阿雅夫妇过来的时候都没菜了，明显是赶大集高峰期刚过。
这种小店人手又不多，不可能一边炒菜一边打扫卫生，可不得有些脏吗？"
1676371717,7,205,False,False,有人说不卫生，我只能说大集都是这样，有时候你在饭店吃的还不一定吃得比大集香并且划算呢
1676377793,3,58,False,False,跟着妈妈去赶集，吃一串糖葫芦，是我一个农村孩子最珍贵的童年。即使网上有那么多人嫌弃它的卫生、环境。
1676375323,7,34,False,False,这是赶大集，看布局是很简单，卫生我觉得很正常，嫌脏的难道都是一群城里娇生惯养的富家公子公主？
1676372646,4,53,False,False,山东大集，物美价廉，最主要能感受到山东老农民的纯朴，这种东西将来就要消失了[酸了]
1676370236,0,203,False,False,“不一定能被所有人接受，但一定能引起部分人强烈的共鸣”！！[星星眼][星星眼]
1676370568,0,139,False,False,这媳妇一点都不矫情[支持]好好珍惜阿雅
1676372848,1,44,False,False,集上吃饭就讲究一个随性实惠，翻桌也快，拿城市餐馆环境跟这比就没意思了
1676379865,0,15,False,False,吃外卖我吃十次能拉九次，这种透明的，外卖能比？
1676374228,0,16,False,False,干不干净是看厨师有没有良心的，不是看店面豪不豪华的你懂吗？普遍理论而言，其实这种小摊有良心的可能性比大城市里每天机械化工作的饭馆大不少……
1676371499,31,669,False,False,弹幕有些人真的矫情又娇贵，一会这不卫生，一会手碰到菜了，你别活了
1676372512,10,487,False,False,兄弟们以我疫情三年期间换工作导致，送外卖兼职打零工的经历告诉你们，你们平时吃的外卖的卫生水平八成以上不如这家店。及格线以上的基本上就是酒楼这种，纯做外卖的卫生水平及格的屈指可数。别挑刺了。就跟有的弹幕说赶集的比你外卖强多了。
1676372020,5,42,False,False,好看好吃😋（字面含义，非引战，非水军，非反串，此话仅为个人感想无任何衍生含义，此话不代表任何其他团体、个人，此话无任何鄙视其他游戏、个人、团体的衍生含义，此话为本人真实个人想法非抄袭、此话仅为个人感想、无碰瓷、蹭热度、骗赞想法、如有雷同纯属巧合，构思相似不算做抄袭，本人玩过各种平台的数十款游戏、并非没玩过游戏，本人家庭和睦安康、请菩萨、道教老祖、上帝耶稣、玉帝和孙悟空保佑，本人拥有本科以上的学历，本人无任何心理或精神疾病，若想复制、借鉴此话、本人十分欢迎，本人无任何垄断评论想法，此声明未来可能继续添加，此话及声明的最终解释权归本人所有）
1676372867,15,234,False,False,还有个弹幕说手都碰到菜了，你这样的人最好别去饭店吃饭，也别点外卖，谁知道后厨会不会在你菜里给你加点料呢，吐口口水啥的，反正你也看不到。这么讲究建议别吃外面饭。
1676376473,3,5,False,False,700日元两个人吃饱，日本人多半不敢想象吧[吃瓜]
1676370927,0,36,False,False,我超羡慕阿雅这个随遇而安的性格[笑哭]
1676370610,32,52,False,False,[藏狐]草莓才8块钱一斤？。。。好便宜哦。我买的额最便宜的18.8
1676376674,0,5,False,False,大集上就餐条件是差了点但是绝对不脏，而且味道绝对不差的，一群不食人间烟火的神仙，你天天点的外卖没这个干净！！还有希望我大美临沂越来越好[妙啊][妙啊][妙啊]
1676373026,0,11,False,False,你吃的外卖不一定有这个干净
1676373270,0,10,False,False,[给心心]这样的饭店比米其林强。
1676370511,4,26,False,False,山东餐桌最高礼仪“叨叨叨”
1676370452,0,42,False,False,真挚的感情总是让人神往。
1676372241,6,40,False,False,天天住大酒店的您就不要看了  大酒店的饭也不一定有这集市的干净 谢谢您了
1676371391,0,8,False,False,集市篇好看，up主多出出呗[呲牙][呲牙]
1676370891,0,12,False,False,这就是生活啊，和相爱的人平凡又充满爱的生活
1676370685,7,17,False,False,草莓8块一斤我哭死，前两天30块钱一斤买的草莓[大哭]
1676372542,1,54,False,False,有的人可能确实是挺讲究的，但你嫌埋汰是你的事儿，你不来就行了或者你这个视频也可以不看，你非得到这儿叨叨两句显得你多么高贵吗。我这样的地方也去过，也偶尔会去那种道边苍蝇馆子，偶尔去个一次两次也不至于窜，而且这样的店做菜确实有锅气，很香。真的很烦某些弹幕，太爱挑毛病，人家去吃的人都没嫌埋汰，再说了也没让你去，你倒是事儿挺多。
1676370394,7,13,False,False,在苏州，这4个菜得近200，日
1676377727,3,2,False,False,老两口要忙活包饺子做饭之类的还得一直保证卫生，不请服务员能做到，你觉得35的成本你们能吃到这个价的菜？既然要求好环境，[OK]可以!去吃50一盘菜的，绝对保证你那儿干净卫生，
1676371347,7,8,False,False,很喜欢这样的集市，但环境更卫生一点就好了[翻白眼]
1676376510,0,21,False,False,饭店是干净呀 ，可是你以为白干净吗？？ 那是你自己掏的钱，饭店上哪找四个菜35的？？以为现在好多地方都是大城市吗？一忙起来人手就不够了， 再说打扫卫生还需要雇人，我看最后不忙的时候就开始打扫卫生了呀。
1676372654,0,3,False,False,好真实的生活，蛮快乐的[给心心][给心心]
1676373937,5,39,False,False,其实吧，我能理解你觉得卫生差，但是路边摊能比饭店吗？真的没必要在那说，你说出来除了膈应人什么都改变不了，不是吗？
1676380389,0,2,False,False,幸福
1676370396,8,20,False,False,情人节被拒了
1676373078,5,14,False,False,全中国都指望吃山东种的菜，山东本地能不便宜吗？
1676372879,25,19,False,False,确实是不卫生，别嘴硬了。环境可以理解，不带手套我觉得正常。但是，但是满地烟头纸巾你不扫？
1676438320,0,1,False,False,环境不干净≠食物不干净，同理环境干净≠食物干净
1676372853,2,15,False,False,给各位提个醒 你吃的外卖可比这脏的多 还都是料理包  这地人家走的时候会打扫 这种集不停扫地纯浪费时间  而且各位是没吃过烧烤吗  都不是往地上扔
1676370589,0,5,False,False,看完视频才发现居然是刚发的视频！！！居然没抢到沙发！！！！！！！[白色情人节_555]
1676387692,0,1,False,False,地脏不代表菜不干净，你吃饭在地上吃？都是没客人或者下班打扫。我回老家吃饭，桌子小，亲戚朋友就会把骨头啥的吐在地上，也是土地，吃完饭再打扫，很正常的事
1676384156,0,1,False,False,不食人间烟火的人真多，乡下集市还想要什么环境条件，基本是家庭经营，特别是吃饭的时候，忙得来做菜，哪里管了地上脏不脏
1676385411,2,9,False,False,说卫生条件的，你吃外卖连这个都不如[吃瓜]
1676428285,0,1,False,False,我们是发展中国家啊，真服了，又不是所有人都出生在罗马。
1676384002,0,1,False,False,日本媳妇被山东大集的物价惊到：四个菜才35？？？真的便宜啊！！
1676383419,1,1,False,False,好多广东的富哥（姐）们在指指点点，反正你们嫌弃不吃就是了，也没人逼你们吃这里的饭，up只不过是在分享生活罢了，你们在这说三道四也没用。反正我们山东人在这种环境下也都顺利成长了，长的都还不矮[脱单doge][脱单doge][脱单doge]
1676382163,0,6,False,False,又不是你们吃，挑三拣四的，真以为自己点的外卖多干净啊[微笑]
1676377388,0,1,False,False,[doge]我来自爆卡车，我上一个餐饮店，老鼠蟑螂满地，不开玩笑，杀不完的，而且那怕我店杀光了，旁边的店也会跑过来。
1676370353,2,17,False,False,我是第四个三连，截图[打call][打call]
1676382451,0,1,False,False,感觉这种用大锅快炒的菜都挺好吃的，有股烟味，这正是我喜欢的地方。
1676423102,0,1,False,False,只要看到你俩的视频我的嘴就没合上过，你们要永远幸福呀！
1676395217,2,0,True,False,我一直觉得阿雅的这个花棉袄好可爱啊，上次我觉得这么可爱的还是花花（和花花）
1676375893,0,1,False,False,[保卫萝卜_白眼][保卫萝卜_白眼]建议何不食肉糜的人别上网了
1676372678,0,2,False,False,很多饭店的后厨比这好不到哪去，还有一些外卖更脏
1676387723,0,1,False,False,看到标题，四个菜居然35？看到内容，四个菜才35？（我以为是菜市场买菜[喜极而泣]）
1676374559,1,1,False,False,终究跟不上一些大城市人的思路，弹幕不提我都不会注意什么卫生问题，就挺正常的
1676376580,0,1,False,False,上海农村以前吃席，就是围裙和袖套帽子都是戴好的，其他的好像差不多
1676374894,0,1,False,False,今天也是我们这里的集，我妈给我买了一根猪尾巴[妙啊]真香
1676370720,5,2,False,False,山东物价真低呀
1676374355,0,1,False,False,都是不食人间烟火的仙女少爷[支持]
1676389837,0,1,False,False,这个集上的吃的跟我们这里大不相同，我们这里都是各种面食[笑哭]
1676374536,0,1,False,False,你们平时吃的外卖还没有这个干净呢吧
1676374339,0,1,False,False,阿雅好可爱阿呜呜呜[酸了]可爱的我多吃两碗饭
1676383661,0,1,False,False,很久没赶过集了😂
1676379431,0,1,False,False,從來沒見過趕集，好想去看看，這種小餐館也好有趣，還可以這樣點菜的，太好玩了[星星眼][星星眼][星星眼]
1676393609,0,0,False,False,说卫生的朋友们，村里的集市差不多都这样，人一窝风的都去了替换的也快，入手不够忙不过来但桌子都是干净的得空的时候老板会打扫的，集市上的小贩差不多下午就收摊了，而且城里的饭店后厨也不见得都干净，东西都不贵也别那么挑剔搁城里也吃不到这么便宜的饭菜
1676447730,0,0,False,False,以前在小吃街看到那些摊子，都挺干净的，还有棚子遮灰尘，反正比看不见的外卖好，感觉最不干净的是旅游区的餐饮，一次性消费[笑哭][笑哭]  吃了就走了
1676370681,0,2,False,False,第一次这么早
1676372144,0,1,False,False,像我这里15年前的物价[大哭]
1676370247,7,7,False,False,地面好乱[笑哭][笑哭][笑哭]
1676374239,0,1,False,False,都是大城市孩子👍
1676423910,0,0,False,False,不得不说，临沂乡下物价是真便宜。。。06年左右吧。。我学弟宿舍7个大小伙子去临沂乡下旅游。早晨吃饭，老板推荐了10块钱的，那7个大小伙子一听，这能够吃？非要再来点，老板说你们吃不了，说什么不给上。。最后7个大小伙子10块钱的早点没吃了。。
1676370493,0,4,False,False,节日快乐，阿雅，龙桑
1676402178,0,0,False,False,回复阿雅和老王，以前我们家一家三口由我管账的时候50是一家人一天所有开销的总合，这也是我妈妈为什么放心我一个人在外面生活，就是因为论管钱谁都没办法和我比。
1676389919,1,0,True,False,up把头发竖起来是为了显得成熟些吗？
1676392450,0,0,False,False,这个35确实好便宜，回临沂老家的时候也去饭店炒过菜，这些最少也得50块。
1676385290,0,0,False,False,"确实不干净啊，但是都习惯了就这样呗，不干不净吃了没病[脱单doge]
我回乡下老家的时候也觉得这不干净那不干净这不习惯那不习惯，实际上过两天就想不起来这些了，乡下是真的很温暖（人心方面）"
1676385839,1,0,False,False,每年去山东济南那边过暑假，经常感叹那边物价真低，一份米线9块钱够两个人吃饱饱的，十二块钱的饺子框擦一大塑料袋，水果蔬菜更不用说，如果早上赶集去早市更便宜还贼新鲜，还有章丘大葱真的好好吃，脆脆甜甜的！只是我一直吃不来那个煎饼[点赞]
1676384853,0,0,False,False,别说小县城了，我在成都荷花池那边也看到过这种景象 ，不过那时我也没觉得不干净，只觉得有点丢脸，因为我还有一个跟我一起的同学，结果我爹转头就进了路边摊[笑哭][笑哭][笑哭]，不过我同学也不娇惯，我也觉得没啥了
1676386101,0,0,False,False,外卖大多是预制菜，没营养还脏……真正这种现炒小店才干净还实惠，都是现做的真材实料[点赞]
1676431733,0,0,False,False,作为一个从小到大生活在城市里的人，时不时看看朴素农村的经济形态有利于更好理解中国经济基本面。
1676438040,0,0,False,False,比起那些看起来高大上的店面，我更喜欢这种...属于是山猪吃不了细糠[抠鼻]
1676401118,0,0,False,False,这种地方确实不太干净 但它有它的市场和存在的意义 能接受和喜欢的人可以去吃 不能接受的人不去就行了。
1676441323,0,0,False,False,这才是普通老百姓夫妻真实生活，好喜欢！[给心心]
1676390949,0,1,False,False,看评论全在说某些问题，俺也是觉得奇了怪了，真就不食人间烟火是吧，苍蝇馆子没去过？再说这也没问题，八大碗都没吃过我一看，世俗点，眼光这么超脱，要涅槃还是咋[藏狐]
1676371710,0,1,False,False,阿雅真的太讨人喜欢了[星星眼]
1676371595,0,1,False,False,感觉突然就结束了，赶集的生活日常能长一点么，建议十分钟起步！奥利给！
1676384476,0,0,False,False,"市里饭店把原生态吹上天
农村自种菜入不了您法眼[微笑]"
1676383806,0,0,False,False,阿雅可真会过日子 持家有道的好媳妇儿啊 老王上辈子肯定是拯救了世界[酸了][酸了]
1676390452,0,0,False,False,你在外面吃东西就别想，你仔细想外面就没干净玩意儿，大酒店后厨好比厕所[doge][doge]
1676382941,0,0,False,False,这种在外面的小摊子，我还能吃到16块钱一盘的锅包肉溜肉段，现在饭店都快上40了
1676384876,0,0,False,False,额，怎么说呢，这种环境虽然一般，但是并不代表做的菜就有啥问题，只要不是用坏的菜和往里面乱加“小调料”就行。而且有一说一，这种环境小县城很多，不过这个确实有点重。不过底层人民的气息大部分都是这种，有一种苦但是有味道的感觉。
1676433025,0,0,False,False,我到现在认钱真假的方式还是摸领子，水印反而不太会认
1676374112,3,1,False,False,我大中华不可能有这么落后的地方
1676383601,0,0,False,False,看到现金结账突然一下有点怀念了，我老家基本都扫码了...
1676411097,0,0,False,False,上学时吃过路边这种炒菜，自己随便组合蔬菜，还可以加面条一起炒，有种神奇的锅气味道，喷喷香。
1676382935,0,0,False,False,"生活看着真让人羡慕，返璞归真啊。
谁都希望大城市的收入，小县城的生活。
up才是人生赢家啊。"
1676428291,0,0,False,False,[大笑]有点想念老家大集了，记得小时候逛可热闹了
1676388853,0,0,False,False,这种大集炒菜都是看得见摸得着的，而且肯定都会洗再炒，跟街边大排档是一样的，我个人肠胃弱，稍微不干净的都会闹肚子，吃过几次大集的基本都没什么事
1676386063,1,0,False,False,此地不卫生百般维护，印度不卫生群起而攻[呲牙]
1676444731,0,0,False,False,希望山东等全国的农村都发展起来，大家都生活幸福。
1676420333,0,0,False,False,这个世界上让我不讨厌的日本人不多，阿雅算一个。朴实、真诚，不做作。[支持]
1676371367,0,1,False,False,日本只有猪蹄便宜，大多数好吃的还是咱们中国便宜吧
1676379554,0,0,False,False,大集很乡土，炒菜接地气。但是，阿雅就算穿上红花棉袄，还是那么洋气！
1676382766,0,1,False,False,馅子是啥
1676377134,0,0,False,False,"小的时候，在奶奶家瓦房长大，昏黄的灯光，丝瓜汤，腌菜，正上方就是灯泡，热气上涌。
   密密麻麻的蚊子在灯泡旁转悠，总有那么几只跟着热气掉下来，我奶奶拿勺要了一勺汤喝，我跟她说里面有蚊子，她笑了笑就喝了
  两千年的时候到外地去，四处在建设，吃着盖饭，看着路过的渣土车带着满天灰尘和汽油味，四周都是充满希望，且朝气蓬勃的人"
1676436001,1,0,False,False,等一下，难道其他省份的菜很贵吗，我感觉视频里的都是正常菜价
1676401556,0,0,False,False,这菜俩让我出35我都能乐出声，居然四个菜35[大哭]
1676378442,1,0,False,False,八块钱一斤的草莓[酸了][酸了][酸了]我下午刚买草莓，一盒16，200g。
1676372233,0,1,False,False,说不卫生的建议从大棚里走出来看看外边的世界
1676431609,0,1,False,False,美女
1676393570,1,0,False,False,北方的赶集真的就是随便一块野地里摆摊卖吗？地面都是土阿，连硬化都没有，下雨天不是全都水泥路？
1676397211,0,0,False,False,刚刷到up的某个视频，然后一口气看了好几个视频，觉得阿雅真的超级超级超级可爱⚈₃⚈，我好喜欢呀，果断关注啦[保卫萝卜_哇]
1676386609,0,0,False,False,在成都这叫苍蝇馆子。只要味道好，便宜，吃的人多的去了。吃的脏不生疮。不干不净吃了没病。[呲牙][呲牙][呲牙][呲牙]
1676385997,0,0,False,False,"不识人间疾苦的可真多，老王阿雅这个号叫“日本媳妇儿在山东农村”，认识字儿么？知道啥叫农村么？
一个个的都真特玛德能装逼！"
1676385033,1,0,False,False,这是赶集 不是镇上的饭店 就跟工地跟前的吃饭的一样 平时不开 只有赶集时才开 地上脏 都是最后收摊时才扫地
1676438546,0,0,False,False,被相亲对象冷处理了好难过，来看看你俩让我甜一下[大哭][大哭][大哭][大哭][大哭][大哭][大哭][大哭]
1676376106,0,0,False,False,好家伙，每次看山东的UP主发的吃饭视频，发现饭量都不小，价格还实惠。
1676379650,0,0,False,False,山东菜就是实在，我娘家靠近山东，我婆家合肥周边的，我婆婆每次炒菜都好少，吃不饱[笑哭]
1676376031,0,0,False,False,外面吃都这样，后厨师傅掉地上都得给你捡起来，麦当劳肯德基也一样，大师傅擤完鼻涕会再去洗洗手继续切菜吗，就是咱们看不见而已。
1676382475,0,0,False,False,虽然回过几次农村但从没体验过赶集[酸了]
1676437492,0,0,False,False,羡慕死了，城里人均一百，活不起
1676388771,0,0,False,False,乖乖，这个价钱，梦回20年前，就我这小县城一个过油肉拌面都35了
1676370179,0,5,False,False,越来越帅了封面[doge]
1676375310,0,0,False,False,草莓八块一斤，太便宜了吧，我家小县城现在都是二十块一斤了，没想到还能看到这么便宜的了草莓
1676383834,0,0,False,False,4个菜才35块钱这也太便宜了吧[酸了][酸了]
1676388152,0,0,False,False,脏不代表不卫生，脏不代表有细菌，就是一些泥土污垢，不知道有啥好觉得不卫生。
1676373917,0,0,False,False,这种现炒菜，明厨明灶，比外卖干净多了，还物美价廉，卫生怪叉出去
1676376326,0,0,False,False,入乡随俗，到哪就吃哪的饭，就算天津也是狗食馆好吃呀
1676374188,0,0,False,False,两个出门一化妆就是俊男靓女[呲牙] 能让外地媳妇这么接受本地生活并融入的男人是真男人
1676386615,0,0,False,False,卫生就不好，吵什么？饭馆搞好卫生是一种态度，更是责任！不能惯！
1676396072,0,0,False,False,这几个菜觉得不错，芹菜肉馅，豆芽辣椒豆干爱了，萝卜丸子也喜欢，夹烧饼里吃绝了！
1676396556,0,0,False,False,转发给我的山东朋友看了，好有烟火气好想去住两天啊
1676382145,0,0,False,False,地上有土，扫的话都是灰。所以下班了再扫
1676383228,0,0,False,False,对比你刚来中国的时候，起码大了几圈！！！
1676387186,0,0,False,False,菠菜被霜雪冻一下就很甜，包括小青菜，好次的不得了
1676378458,0,0,False,False,在这边蔬菜便宜，在那边电子产品发达。我小时候是这样，不知道现在咋样了
1676376190,0,0,False,False,4个菜35，一个菜不到10块，虽然没啥肉，不过还是很划算
1676437905,0,0,False,False,嫩菠菜才会发甜，不识货了属于是
1676384416,0,0,False,False,这集把人拍胖了[笑哭][笑哭][笑哭]
1676387586,0,0,False,False,额。。。自己家种的新鲜蔬果总比大棚里或者无土化的转基因蔬果 营养健康好恰吧[妙啊][妙啊]
1676373931,0,0,False,False,下次从南京回泰安老家的时侯经过临沂真想去老王家做客，主要想蹭饭[吃瓜][吃瓜][吃瓜][吃瓜][吃瓜][吃瓜]
1676390690,0,0,False,False,临沂的物价是真的好便宜啊[doge][doge]可以的
1676379234,0,0,False,False,35四个菜我以为是买四个蔬菜。。没想到是炒菜，真的舒服
1676376312,0,0,False,False,其实吧，不要那么敏感，确实不太卫生，毕竟鲁南、苏北不算富裕，我是邳州的，紧靠临沂，农村大集环境不太好。冬天干燥，灰尘大，真不如南方。阿雅和老王就生活在这样的环境，有啥办法呢？
1676375474,0,0,False,False,哪里都是真实中国 不要少见多怪了年轻朋友
1676394009,0,0,False,False,矜贵的城里人啊，人家日本人都不嫌弃，你们嫌弃啥？
1676375609,0,0,False,False,纯透明操作，吃的人不嫌就行，你觉着不卫生就不吃呗
1676388170,0,0,False,False,你变了啊，开始用上滤镜了，哎…我喜欢真实
1676379007,0,0,False,False,真便宜  农村的淳朴 低物价的地方人很善良
1676375643,0,0,False,False,老王比他老婆长得像日本人，他妻子倒像是中国人
1676386855,0,0,False,False,萝卜丸子yyds，另外大集炒菜真的香，可惜我们这附近没有。
1676372843,0,0,False,False,春节和爸妈还专门去山东赶集，很好玩啊，弹幕还是城市小孩多，集市卖吃的都这样，他们没得钱搞装修
1676372847,5,0,False,False,确实是不卫生，别嘴硬了。环境可以理解，不带手套我觉得正常。但是，但是满地烟头至今你不扫？
1676374295,1,0,False,False,这也太便宜了，我们这儿一个菜就得35。昨儿买的草莓还20一斤呢。
1676372884,0,0,False,False,阿雅进步好多呀，现在都能用山东话和小商贩交流了，以前都是“多钱？多钱？”[妙啊]
1676376645,0,1,False,False,[支持][支持][支持]
1676375464,0,0,False,False,我上次买了两个小胡萝卜，五毛钱，有点想笑[笑哭]
1676377808,0,0,False,False,这种在眼皮子底下做的，挺好的了
1676375613,0,0,False,False,喷香粉丝集合了！
1676378891,0,0,False,False,我们这里草莓20多元一小盒 感觉没有一斤，面条15元一碗，碗不大，就薄薄的一片肉。
1676375909,0,0,False,False,山东up的归宿，拍大集[doge]
1676422376,0,0,False,False,[脱单doge]迟来的情人节祝福，祝你们小两口子甜甜蜜蜜，长长久久
1676394348,0,0,False,False,今天，这顿“狗粮”我干了[呲牙][支持]
1676406226,0,0,False,False,有钱人，可劲吃！这一盘这么多菜，可以带回家晚上吃！
1676427566,0,0,False,False,每期都不落下[打call][打call]
1676374429,0,0,False,False,起码是当你面炒的，你知道你点的外卖是怎么来的吗？
1676377717,0,0,False,False,四个菜三十五，大部分地方一个素材都20多。
