上传时间,回复数,点赞数,up是否回复,up是否点赞,评论文本
1676291769,1,5,False,False,对的，网上都是在制造焦虑，实际上根本没那么严重，我小学毕业，0年经验，深圳面了888家，拿了999个offer，最高666k，最低888k#(太开心)  #(太开心)  666k是外包，还有个108k的自研可以考虑一下，不说了，明天还要5555个面试，#(太开心)  #(太开心)  寒冬年年有，年年都是计算机，结果计算机工资不是还是轻轻松松月入过w， xdm，有一说一，现在不学JAVA，以后就没机会了，趁着现在的红利，狠狠的赚一笔
1676286256,0,2,False,False,自己都找不到工作教我找工作[笑哭][笑哭][笑哭]
1676127965,1,2,False,False,说起来可能不信，我啥也不会，校招过了一家，现在上班有点坐牢[妙啊]
1676286179,0,1,False,False,千万别培训就是天坑[doge][doge]
1676386556,0,1,False,False,你说话这么严肃好尬啊[doge]
1676197296,0,1,False,False,你周围不都是喝强爽的[doge]
1676282935,0,0,False,False,我也觉得兄弟 这是托吧
1676283088,0,0,False,False,166天同一件衣服 兄弟你是被尚硅谷控制了吗
1676178504,12,0,False,False,你像个拖
