上传时间,回复数,点赞数,up是否回复,up是否点赞,评论文本
1676298402,0,3,False,False,我可太喜欢，有大量时间读书写小说[星星眼]
1676207224,0,2,False,False,稳定工作你也能成为有钱人，加油，你可以的[doge]
1676081714,1,5,False,False,开头第一句，没人认为公务员能“大富”吧，除非你很刑
1676017669,1,6,False,False,希望大家考之前就能够想清楚自己是否能够接受这些可能遇到的情况，我已经想的很清楚了，就差上岸了[doge]
1676490855,0,0,False,False,大三，广东非珠地区有没有5k啊[辣眼睛]
1676013031,5,5,False,False,我还在啃老呢，去年备考到今年工作一年了，但还是每个月不够花，真的有点对不起去年考第一的成绩了
1676018368,0,5,False,False,看我IP。我不觉得gwy是很好的，只是想离家近点工作也没更好的选择了，我是工科女生[笑哭]
1676012779,8,2,False,False,不管是刷题还是申论的积累，都需要坚持，除此之外最重要的就是方法和技巧了，尤其是行测真的很看重技巧啊
