上传时间,回复数,点赞数,up是否回复,up是否点赞,评论文本
1675870185,1,1,True,False,老师说的未来大概还要多少年
1676177407,0,1,False,False,"我认为其他行业都有可能，唯独建筑行业不可能广泛应用。2000年用cad画图，现在2023年不还是用cad画图？就算revit，已经出了多少年了，我记得2010年revit还在校园搞设计竞赛，现在也没说推广到全行业都普遍使用。
chatGPT经过训练，规范一类的问题都根本不是问题，成熟化的建筑类型有大量的数据样本训练，更不是问题。技术问题不是阻碍ai进入建筑设计的根本原因。

就算是已经成熟的bim，上一套设备也得几十万，平时还得有人维护，只有中型以上的企业才会上，上一套设备的成本远比雇佣5个专业画图工高，资本就不会去选择用设备，因为这是有风险的，而人力没啥经营风险。

现阶段只有大型企业才有开发、使用ai的本钱。未来会不会出现“赢家通吃”的局面，不好说，用训练过的ai实现10倍20倍的速度去干活，以半价的价格去打价格战，把手工画图都淘汰掉，这个就不得而知了。当ai设备的价格降低到足够便宜多的时候，各种中小型企业才可能生存。
即便如此，到那时，中国可能早已产业转型，地产开发的数量可能都不足以支撑中小企业去抢赢家的饭碗了[doge]"
