发送时间,视频内弹幕出现时间,弹幕文本
1676090293,371.09900,在对华问题上倒挺一致的
1676090068,276.33900,←你不同意是你的事，我不同意你的观点是我的事
1676089841,513.68200,只要欧洲不那么听美国的话，美国必然。长久不了。
1676089749,197.73500,爵士乐确实不错，但是说到文影响，稍晚一点诞生了叫摇滚的
1676089719,464.36200,03伊拉克 背后主要是欧盟想和中东石油佬弄欧元结算方式吧
1676089580,362.27700,法国都黑了
1676089571,375.30600,种族不是问题？美国出生率第一已经不是白人了
1676089549,499.03200,《守望者》
1676089483,464.95300,大规模杀伤性洗衣粉
1676089480,284.06600,美国电影这些年也走下坡路了
1676088968,399.06700,军工复合体
1676088566,57.87500,马克龙是美国扶上去的
1676088308,366.36100,现在气球事件美国这么丢脸就是扯皮扯的
1676087551,406.47100,美国大停电的时候不是明确说了吗，没有对人民负责的义务？
1676086934,372.95100,好
1676086167,2.62200,马克龙这么说的？
1676084876,121.41400,母子关系倒挂啦
1676084384,374.68500,但是在涉中国议题上他们很统一
1676083687,157.80000,最后一个。。
1676083203,344.78200,评论区都不分被美国暴力文化影响了
1676082602,428.36000,西欧环保概念深入人心的，所以他们会很惊讶（但是行为是否环保就不清楚了）
1676081876,54.49900,哈哈哈，这个姿势很灵性
1676081846,36.09900,上历史课了，哈哈
1676072323,9.29900,没脾气，硬三秒
1676064892,197.30600,还好，现在有意法半导体，单片机行业头把交椅哦
1676063001,234.23800,日本动漫，韩国营业，宝莱坞不都有自己一片天地？
1676062906,181.58800,互联网和芯片也是美国人发明的呀，怎么比
1676062818,547.83600,我们要时刻抵防美国。因为他们太阴太黑做坏事无底线
1676061310,65.68400,而且我记得好像还把新路易斯安那卖给了美国？
1676061256,72.07300,英国得罪太多人了
1676061249,36.91200,老路的普通话真的不普通啊，大赞
1676055761,225.93900,喜欢法国文艺片
1676054518,394.53600,欧洲没有互联网，用的是美国人技术/app/网络平台，所以欧洲及许多国家都被美国洗脑
1676053227,383.30300,看来都住在美国
1676052446,396.23700,正常啊，美国电影就是崇尚个人暴力解决问题
1676051041,291.61500,漫威有些过气了
1676050638,399.81900,如何解释世界杯法国队大部分场上球员都是黑人？
1676050581,391.95200,实际上有没有可能允许持枪本就是有着巨大弊端
1676050170,19.33900,美国人不在乎，手动狗头
1676049406,22.52300,美国国父路易十六
1676048650,163.20200,真男人
1676048298,360.51100,但现在美国不是黑命贵吗.那些电影肯定有一个主角是黑人
1676048019,379.35000,自由美利坚，枪击每一天
1676047988,435.42100,他们在美国星
1676047943,406.92000,哈哈哈，还在狂野西部
1676047631,399.17700,法国人用法国思维去质问美国，文化冲突啊
1676047596,174.08800,美国一直都干干扰别人核武的事儿
1676047588,388.99800,如果美国听从老路意见，那美国就变成了法国
1676047021,110.07200,忘恩负义
1676046999,302.50800,很准确
1676046957,113.39900,法国国力不行和美国不是一个层次
1676046334,58.07600,只要有损英国利益的事法国都干
1676046264,29.17300,美国国父路易十六 他真的我哭死
1676045795,93.39100,美国国父路易十六
1676044981,127.29500,一战也是啊
1676043876,35.25900,莱克星顿吧我记得是
1676043763,381.71400,欧洲的海盗文明不行了，不知道未来会怎么样
1676043631,373.43700,马克龙时不时戴高乐附体好像得了精神病一样
1676043590,378.36200,@全国步枪协会
1676043381,324.17600,水浒？
1676043148,372.35100,明末党争
1676043025,134.19800,那又怎样   照样把阿尔斯通抢了
1676042545,368.25200,美国远看是罗马，近看这不大明吗？
1676042528,403.62600,3亿人的枪战梦想
1676042201,296.58000,好官方啊 哈哈哈哈哈哈哈
1676042153,218.55300,美国文化有活力和创造力，但缺乏深度和底蕴。
1676041738,8.51000,美国虚假的父亲：带英
1676041375,214.74200,犹太财团的媒体帝国
1676041308,246.61900,老路的思维方式很法国，独立自主大国气质
1676041168,253.41300,印度感到毫无压力
1676041146,491.66500,总有一天会反噬的！
1676041090,534.37700,主要是这个国家他本身就不像一个有高度个性的国家 像是一帮有钱人组了国家 掠夺全球的
1676040770,555.71100,公正客观全面
1676040613,352.21900,欧洲包括法国现在政坛是严重缺乏自主性，不亲美的政客甚至参与竞选都难，舆论也被控制。
1676040376,402.11000,全民皆兵
1676040350,380.94700,盎撒传统
1676040325,317.52200,是的，暴发户是这样的
1676040170,260.67000,鲨卷风
1676039936,402.69100,自由美利坚，枪战每一天
1676039863,422.25800,人家是川宝（傲娇）
1676039611,390.18400,实际上美国的枪击案在允许持枪的国家里算少的了
1676039405,284.15200,比如部分极端的lgbt
1676038827,36.39900,萨拉偷噶
1676038650,309.67200,蝙蝠侠
1676038519,360.38100,美国的南北战争被南方夺取了胜利果实，工业的问题是解决了，但种族问题呢
1676038393,141.19000,法国的问题是再没有戴高乐了
1676038373,521.36300,美国只是霸权在衰弱，还是霸权地位啊
1676038259,27.07900,美国妈妈
1676038150,405.07500,亚瑟摩根：6
1676038051,206.71800,美国畜牧业很发达
1676037706,370.45700,明末党争
1676037515,378.80900,完蛋，在给美国提意见了哈哈
1676037430,375.86900,牠好评
1676037207,84.26900,英雄不问出身，胜败乃常事，法国加油，中国加油
1676037024,64.49900,美国国父路易十六
1676036951,369.09200,驴象之争
1676036824,449.99400,精神殖民成本更低
1676036743,377.77900,美利坚利益共和体
1676036204,114.17800,阿尔斯通
1676036173,246.33400,以前还有法国电影或者法国女演员，现在啥都没有
1676036164,389.56200,美国最擅长找假想敌
1676035978,44.01100,美国亲蝶法兰西
1676035757,404.59800,中法都爱玩大表哥
1676035667,246.46200,文化输出看你的实力了，美国人也喜欢日本动漫、武士道什么的
1676035281,460.88300,川宝还是搞笑的，希望2年后再上位
1676035271,380.84500,那么这里呢
1676035014,85.31800,那法国就是美国荼毒世界的帮凶。
1676034190,486.09100,俄罗斯那里是莽啊。。。退无可退，困兽斗
1676034178,276.00000,英语影响力太强了
1676033839,101.49100,刚没认证听，恍惚听到的是“罪恶”女神像
1676033097,331.93700,祖国人
1676032632,410.25300,哈哈
1676032370,190.68100,芯片领域：阿尔斯通
1676032130,243.71000,文明：文化胜利
1676031886,414.91000,比如借超发印货币制造经济危机、借乌克兰战争割欧洲盟友的韭菜等
1676031851,410.74900,人人持枪，它才不乱
1676031745,323.98600,确实啊都在打不停
1676031011,541.76300,陆老师，你好厉害
1676030807,526.81300,企业型国家
1676030555,402.46200,老路你的视频好适合高中政治课啊
1676030063,398.85900,真人《GTA》
1676029886,506.66500,冷战说实话，无论是哪一个超级大国，存活下来都是对世界的不安
1676029381,478.08100,还有再早些的东芝 西门子
1676029204,383.15100,"冷知识：2022年美国死于枪击人数（含自杀）为44,296人"
1676028404,85.86300,事实上也是这样的
1676028020,406.17900,牛仔只是美化美国对印第安人的种族灭绝
1676027300,268.98600,我不同意这是文化霸权的说法
1676027294,407.83300,哈哈
1676027181,85.66000,确实不可能
1676026899,183.05400,美国后来还在电影里说是法国的核试验导致哥斯拉变异
1676026344,368.54000,多亏了中国，牠们才团结一致
1676026099,351.63600,现在怎么没人说话了
1676026058,404.83000,荒野大镖客2哈哈哈
1676026023,563.13500,客观的老路
1676025435,44.24800,头一次听到老路说这个词“大嘤帝国”
1676025323,470.98900,这个是chapo guzman
1676025259,383.57000,自由美利坚，枪击每一天
1676025189,72.41400,前面的美国国父是路易16
1676024703,526.87100,说的太对了，一定不要觉得中国超过美国了，其实差的很远，特别是军事方面
1676024647,92.89300,美国国父——路易十六
1676024256,35.85900,刚通关刺客信条3
1676023874,1.51900,我来了，你就不是第一了
1676090569,84.13900,这个确实
1676089650,65.85100,原来是你小子
1676089402,114.65900,至少国土没有驻军
1676088772,245.86700,媒体霸权
1676088353,296.81700,夺命五头鲨
1676087345,112.67800,阿尔卡特
1676086103,56.62500,美国人坑了你法国真惨
1676084721,309.73900,祖国人点了个赞
1676084086,263.39100,夺命好几头鲨
1676082935,85.90100,这不用半开玩笑，就是真的吧？
1676082093,276.65900,？？？？我看美剧反而是美国人疯狂迷恋法国人的性格和口音等
1676081823,21.29900,我确实挺好奇的
1676081008,284.39000,外网看到一堆牛气的
1676075446,513.85900,大家还是小心这个帝国在霸权的最后的军事冒险吧！
1676075326,465.26000,著名洗衣粉了
1676075200,552.13400,战略上藐视敌人 战术上重视敌人
1676060501,521.74700,二战和冷战是美国的高光了，冷战结束以后，美国就失去梦想和制约了，越来越肆无忌惮，最终会走向所有霸权国家的衰落之路
1676056318,415.07500,这一块可以表扬法国
1676054476,134.54100,"本来就是自己的企业还多花钱买回来,很骄傲呀"
1676054424,563.19400,老师下课！
1676050777,527.44600,还有全球几百个病毒实验室，可以拉着你一起完蛋
1676050089,324.43700,西部
1676048099,450.01800,how dare you
1676047796,197.77000,确实
1676046398,44.82600,带英帝国（字正腔圆）
1676044916,128.83900,关于阿尔斯通现在被法国买回来了，找到资料了解一下发现这事贼有意思，事情不简单
1676044790,352.62400,就反思就反思
1676044627,84.25900,独立肯定会独立，不过可能要迟很多年
1676044028,556.93400,我希望中国强大，但并不希望是以美国那样的方式。中国还是得靠中国人自己，不是靠抢人抢资源。
1676043892,486.85300,哈哈哈，间接承认自己大不如前
1676042995,534.99300,没毛病
1676042624,436.39800,美国三体人实锤了
1676042272,445.04900,谁跟你说法国是美国小弟的？
1676041145,245.92600,两百多年的历史文化，哈哈
1676041043,34.93800,美国国父路易十六
1676040687,72.89100,前面那个 路易十四是吧，回去给我读历史
1676039912,21.84300,最看得起法国国内没有美国驻军
1676038982,247.11500,文化霸权也是美国霸权的体现之一
1676038848,56.78300,爸爸打儿子，儿子哭着喊妈妈
1676037874,471.33800,洗衣粉
1676037757,37.93900,路易斯安州
1676037633,318.30400,霸权
1676037374,101.90100,法国的一个决策，导致法语失去世界通用语言的机会。
1676037046,219.72400,我最热爱美国卡车文化
1676036565,412.01900,这个太对了，格局太小，短视
1676036430,3.43900,发国人：米国人文化！
1676035913,302.70500,拿破仑觉得很赞
1676035447,193.61600,fgnb
1676035184,255.25700,有一部法国电影，里面的价值观我一直很不认同，叫心灵奇旅，完全就是把上帝那一套放在黑人身上再来一遍
1676035100,183.61400,这操作真耳熟
1676034334,501.36000,一个文明先延续个数千年再说自己伟大吧。
1676033188,94.04600,卖头援助美国独立不是吹的
1676032690,28.50700,美国国父路易16
1676032608,478.61100,阿尔斯通真可惜
1676031686,58.46400,世上只有妈妈好～～
1676030928,491.77600,We choose to go to the moon.
1676029803,66.04200,农夫与蛇
1676027900,346.47900,非战斗人员请撤离
1676027857,28.89700,美国国父兼法国国王
1676027643,542.85900,嗯嗯
1676026523,9.56700,331人
1676025805,112.32600,暴发户和落魄贵族
1676024211,34.75500,刚通关刺客信条3
1676090768,56.45000,龙虾兵当时很强
1676083606,83.51700,好像也没毛病
1676083486,248.20500,讲道理 法国的电影比美国的好看很多很多  好莱坞软洗脑太厉害了  各种暗戳戳地文化挪用别的国家
1676076205,83.94400,这是实话
1676075698,4.02800,美国国父路易十六
1676074711,21.27900,merde
1676074226,331.98800,敢死队
1676065853,245.71500,美国文化所倡导的内核一定解决了人们的某些需求，比如面对巨大庞然的阶级差距的嬉皮士
1676054398,87.14400,你们的阿尔斯通呢?
1676050162,227.16800,一个几百年的国家能有什么文化？文化是要经过沉淀才能出好东西的。不说要中国五千年历史，也得英法那样千年以上
1676048124,557.96000,不低估，也不害怕
1676047776,277.12800,美国一向自大，没底蕴，哼
1676047344,34.22600,历史书里的故事
1676047212,10.51900,怎么干
1676046953,72.98400,日落帝国
1676045472,208.73600,法国的电影强的很，真的没必要去崇拜美国
1676043629,219.96500,好莱坞大片现在没人看了
1676043564,535.71900,我拿500亿的天地银行来赌不可能出现第二个小罗斯福
1676043448,543.52400,短短两百多年对一个国家一个文明来说还真不能就下这样的判断
1676042988,352.71200,？？？？种族问题并不是问题
1676042765,318.95200,还是苏格拉底说得好：美德即知识
1676042229,234.79600,那这声音就是谎言！
1676042084,174.57300,智子计划了属于是
1676041865,66.51800,路易十六：让人摸不着头脑
1676041171,563.93400,希望人类文明新形态能引领未来
1676040866,123.95600,阿尔斯通被法国买回来了
1676040785,292.20000,那就是假的，美国硬汉离不开止疼片的哈哈哈
1676040752,111.49900,微妙～
1676039313,324.62200,可怕吗？美国不是车轮上的国家，而是枪杆上的国家，从建国到现在全民持枪
1676038616,284.73200,殖民者
1676038540,136.21200,路老师，成立北约应该是对抗苏联为首的华约吧？
1676038447,129.91700,不是美国帮助法国打败德国？
1676038206,535.65400,主要是底蕴好，潜力够，只要不被肢解，总会兴衰更替
1676038095,461.09600,洗衣粉
1676038069,245.32800,欧美歌单全是英文歌曲，很少有法语、德语。在中国，甚至韩语日语歌曲横行，就是没有法语啊
1676037836,59.56300,你直接说法国拱火就理解了
1676037651,415.89900,没有大国担当是对的，本来就应该本国为先，因为大家是竞争关系
1676037625,298.03900,很精辟
1676037532,217.50200,法国文化被美国影响太大了
1676037431,324.70900,暴力美学
1676036855,302.86500,说的太好了
1676036440,111.01700,法国阿尔斯通
1676036433,522.34500,雅思老师：but后面是重点
1676036353,451.24500,但是阻止世界支援叙利亚
1676036162,115.11400,羡慕嫉妒恨
1676036049,277.54200,太可气了
1676035995,493.13900,吗噶
1676035849,465.47800,洗衣粉
1676034977,347.83500,反思怪闲的没事干啊到处刷存在感
1676033686,471.46600,典
1676033426,270.75800,阿尔弗雷德·F·琼斯
1676033266,159.16300,然后就加入欧盟，当美国的棋子。。。
1676032324,487.33500,广场协议
1676032207,527.66900,老路中肯
1676030819,310.98200,所以我从来不看漫威和DC，我一直不喜欢英雄主义
1676030501,432.14000,天佑美利坚（doge）
1676030312,10.13900,同念
1676030183,27.92500,美国国父路易十六~
1676029676,479.42000,现在的俄罗斯乌克兰就是很好的例子，主要俄罗斯太莽了
1676029602,445.23100,诶，法国还真没当小弟，当小弟的是英国，法国在欧洲常被排挤，也是因为他不服美国
1676027234,102.00000,在法国不能有法举单手的东西存在是吧？
1676026994,141.60200,属于是想当接生婆的爹了
1676026302,437.86000,青出于蓝而胜于蓝
1676026284,424.48400,不装了，摊牌了
1676025244,34.15200,老路的毛衣好好看
1676024559,198.36900,关键是远程养殖技术厉害
1676024508,56.60700,美国使用了场外援助:法棍，效果拔群doge
1676024469,44.91700,带英
1676024255,27.92300,自由女神像
1676023897,20.61800,我第一次第一
1676090592,154.76800,这历史书上都有啊
1676090525,32.84400,有点像憨豆
1676090262,130.21900,苏联还从德国那里拯救了法国呢
1676089957,198.40100,讲个笑话，美国有文化
1676089163,413.27900,老路太对了
1676088855,325.57400,老路口才和见解真的太牛了
1676086117,31.60700,美国缔造者
1676080069,29.33900,自由女神像都是法国送的～
1676078315,61.97900,万恶之源
1676077372,27.79600,法国是美国的小弟 美国主宰的世界秩序的维护者
1676061797,303.68100,说的很好，很用心又有学问
1676050251,474.00200,台积电
1676048152,558.98400,所以美国才害怕中国强大，因为感觉到了威胁
1676047498,110.94100,哈哈
1676047438,73.39400,哈哈，法国人应该最希望看到英国输
1676047379,56.32800,那时候还算是盟军
1676047042,311.31200,而且电影塑造的很多都是英雄个体（似救世主
1676044403,451.30000,各位千万别被小知识误导，中国古代的附属国只是称臣，但享有几乎所有政治权力
1676043589,523.57900,你问过我印度了吗
1676043036,553.36200,不要低估它，也不要畏惧它
1676042946,264.37100,法国电影曾经在中国有很大的市场和影响力，如今却难觅法国电影的踪影
1676042819,235.75300,美式生活也是美国对外输出的美国文化……
1676042549,187.12600,这套操作真熟悉
1676041035,277.58100,西城是爱尔兰组合啊，主要发展也是在英国，怎么到你这就变成美国的了
1676040813,527.97600,清醒的
1676040574,45.22500,《带英帝国》
1676040486,437.89300,日本：你们继续吵，我继续倒
1676040449,55.79600,英法老冤家了
1676040416,39.78500,然后路易十六选择预支了自己的脑袋
1676039594,83.20800,早知道就把它掐死在襁褓里doge
1676038582,465.54500,听说鲍威尔手里拿的是立白洗衣粉
1676037724,164.37000,欧盟是法德主导的，但北约不是
1676037395,27.86400,美国国父路易十六
1676037300,89.36400,早晚会独立 不过确实得晚个几十年
1676037265,12.69200,辱法炮制
1676035892,503.44600,瘦死的骆驼：我还行！！！
1676035719,110.89900,凑合过呗，还能离咋滴
1676035560,248.52800,可不止文化胜利，科技，统治都是第一
1676034806,298.63200,好！
1676034591,83.36600,是实话
1676034137,318.97900,法国游戏:《师父》
1676032747,480.09300,原来这些事欧洲人也知道啊，那我就放心了，离心离德是早晚的事
1676032291,446.30800,核动力印钞机
1676032011,115.35800,阿尔斯通？！
1676029913,493.34800,美国从未伟大过
1676029096,342.38700,冷知识：2022年美国出生后预期寿命为76.1岁，为发达国家中最低。甚至被中国和古巴超越。
1676029017,39.23400,先说一下我们讨厌的是现在的美国而不是独立前的美国，我们是不应该讨厌他，正因为他，他才激发了殖民地的反抗，这是一件正确的事情，不应该骂他
1676027842,353.38000,虽然有blm但是无ylm，blm还是排斥y的。平等？双标！
1676027292,95.62200,好像这个自由女神像是一对，巴黎也有一座
1676026974,102.66400,毕竟法国是第一个承认新中国的西方世界国家
1676026674,67.25900,英法不愧是老仇人
1676026386,508.57100,因为霸权这事本身就是反客观规律的
1676026118,68.65800,拉法叶
1676024900,256.17200,美国主要是吸引人啊……像披头士 西城这种音乐领域的 说是英国的 其实还是美国的…
1676023964,5.12500,哦豁老路~
1676023885,19.89100,1播放？
1676089481,294.46700,你喜欢无产者 住你周围嘛
1676089074,95.75400,凯奇的《国家宝藏》
1676084452,236.03600,人家搞的好 没办法
1676084133,79.78300,各怀鬼胎
1676084015,481.97900,那一年我们家不敢用洗衣粉
1676082256,353.89100,印第安人：我们来了上万年了
1676081987,115.45900,我们这对美其实感觉也差不多，不过民间哪边占的多真不太懂
1676078691,19.44500,阿尔斯通，太恨了
1676077005,19.78900,里 森 堡
1676076555,528.09000,阿美利加天降猛男，带领人民走出未曾设想的道路
1676075066,494.66200,但是现在黑化了，不是衰弱
1676060520,110.34300,你当人家是铁子，人家只当你是K子
1676053585,31.53800,法国算是美国爹吧，没有法国支持美国搞独立战争就没有美国
1676049559,82.82400,干了件多么缺德的事。。。
1676049374,62.17900,法国当时就是只要对英国有害的都支持
1676048772,89.99100,除了阿尔斯通
1676047169,159.36100,法国最后的男人
1676046357,31.01500,没法国援助美国不一定能独立
1676045958,451.75300,我在评论区有反驳
1676045140,535.92900,说不定过几年就解体了
1676043833,446.71900,美国在叙利亚地震时做的事真的太没人性了
1676043590,475.11500,八国联军也有你~~~
1676043170,326.26300,确实是
1676043007,220.81900,法国电影票房榜也被占据了很多
1676042848,558.99600,老路最后是在善意的给我们提醒。感谢老路。
1676042559,110.57700,最不应该的，是拿破仑把新奥尔良和路易斯安娜（比现在大许多）两个州卖给美国
1676042045,130.74200,没有法国的支持，印第安人还能摸到头皮
1676040911,417.51500,是不是全世界允许唯一合法持枪的地方？
1676040522,305.68400,这法国人的语文比我都好
1676040042,465.66000,当美国说你有的时候，你最好真的有
1676040038,55.56700,主要是不想英国好
1676038893,487.57200,他也仅是想回到可以任意掠夺他国利益的时代而已
1676038787,68.88900,法国不仅独立战争帮了米国，后面拿破仑时期更是卖了当今美国国土三分之一的路易斯安那区域
1676038644,40.79900,没有法国，美国独立不了。
1676037982,239.99800,美国消费文化
1676037966,249.87500,目前文化胜利进度最快的是韩国吧（悲），摇了多少摇滚乐队了（
1676037928,138.11300,冷战时期，法国可牛逼了，建立欧盟前身，试图团结全欧洲形成世界第三极！
1676037824,166.50300,欧盟就像一个营养不良的人，除了经济 政治和军事都掌握在美国人的手里
1676037334,311.95500,过于个人和过于集体都是不行的
1676037268,244.97900,靠各种NGO悄悄渗透
1676037067,564.84000,三联了，merci
1676036862,461.50400,老路是个明白人
1676036632,278.26500,英雄？
1676036353,104.33900,法国在密西西比河畔的殖民地呢
1676035538,198.53900,老路和乐柏不一样，老路理解不同国家的利益，乐柏一味白左洗脑。
1676035515,210.54900,美国有什么值得品味的文化，还不是其他文化融合的
1676033417,230.57700,以前法国还有独立电影可以风靡世界，现在0。啥也没有了。法文歌也完了。
1676031968,514.72800,瘦死的骆驼比马大，何况还没怎么瘦
1676030861,270.85900,披头士是美国的，真服了
1676029758,22.85800,阿尔斯通
1676029293,544.97600,这个中肯，不要放松
1676028388,45.45600,美国国父路易十六是吧（
1676027973,528.20000,瘦死的骆驼比马大，我们应该自信，但也不要盲目自信
1676027089,195.57300,全世界都听爵士乐和穿牛仔裤
1676025969,175.38800,fgnb
1676024437,424.70300,这点太对了
1676024419,298.84500,太对了！
1676023990,5.30100,42顺位
1676023915,14.59900,老路由器玩完法国之后又回来讲故事了
1676090984,566.28800,没错不承认强者，永远都是弱者
1676090033,451.98700,美国就是英国的儿子，联合外人把老子打跑了自己当家而已
1676089551,237.18700,法国在国际上对美国很听话啊
1676089543,326.62200,但武力确实是最有效最快捷的 解决问题的方法  用嘴不好使的时候 就得用拳头
1676089438,251.30400,说5000年的，你们爱看京戏嘛
1676084415,18.79200,自由女神
1676083704,220.84000,被美国洗脑
1676083613,327.02200,美国和谁关系不好 想要提携谁  马上在电影里面清楚体现  比如现在反派不是俄就是中 偶尔还有墨西哥 亚洲人的角色全部交给韩裔
1676082902,475.59000,为了利益美国可以不择手段
1676080500,14.88000,乳法炮制
1676075019,217.73800,美国到处偷文化拍电影
1676063276,413.41900,罗斯福时期还是有这个但当的
1676063156,306.30800,美国印度化，印度神仙化
1676060682,167.42400,英国就没有完整的核武器，火箭需要美国提供。
1676059487,312.55300,还容易生产自负的笨蛋
1676057750,258.77900,速度与激情
1676056723,495.26300,崛起，一样的
1676053030,321.89000,真理在大炮射程内
1676052632,243.69900,美国网站占领了国际互联网高地，文化入侵从来没有变得如此容易
1676051919,349.31900,盎格鲁撒克逊人的丛林法则
1676050127,523.65900,军事实力绝对的第一
1676047933,96.54500,美国国父 路易十六
1676047847,322.26900,那些系列的美国大片，哪部不是打打打
1676047624,187.48500,哈哈，就是想当第一名
1676047621,131.99000,阿尔斯通
1676047488,104.62600,微妙，对
1676047393,62.47200,敌人的敌人是朋友
1676047305,5.55400,老路好儒雅的感觉
1676047274,15.70300,哈哈，来了来了
1676047218,14.73900,老六
1676043264,420.13700,那就得问美国的枪支协会了
1676042960,116.20200,启蒙思想  是法国人冲在前线
1676042905,91.25100,不是诚心要让美国独立，就是想给英国人找不痛快
1676042896,264.40200,，，
1676042010,146.01800,法国人自己把戴高乐选下去的，人类不感谢罗辑
1676041568,466.27100,一针见血，直击本质
1676040472,30.75600,正直的人都不会看得起美国
