发送时间,视频内弹幕出现时间,弹幕文本
1676087107,393.25900,用不过来=养不过来
1676087069,1157.25700,555然后我抽了夜宵12命
1676086509,849.68300,水神大辅助，加生命上限，夜兰胡桃更加起飞
1676086307,1165.10300,宵宫在斜坡打怪会高血压
1676085475,1116.08600,宵宫真的不容易啊
1676085471,341.18500,我就准备一点一点抽到八重六命
1676084426,271.30500,刚入坑2个月的我表示抽到就是爽不知道为什么还有人黑
1676083834,1125.64900,破防了
1676082323,1023.62100,夜阑天敌：迟滞之水
1676081956,1205.86200,璃月角色做强是米哈游的本分
1676081605,32.19900,有些角色明显低于平均水平比如尤拉，专武都要背刺
1676080836,842.88000,而且普攻模组就是标准的5发
1676080306,371.09200,除了一命其他都是提升伤害的吧，但伤害完全是够的
1676079329,56.86300,神鹤万心练度高起来后就会发现，带温迪循环更舒服，更能应对现在深渊东一个西一个的刷怪
1676077771,377.94000,有一种强度的美
1676077070,1130.34800,太痛了
1676076736,1037.86100,海哥：报我身份证吧
1676075567,260.24700,我若水都不抽 单纯是1命摸圣遗物太爽了
1676075513,1156.43000,一个能对群，一个能对空，其实已经分好了
1676074262,949.92000,夜兰吊打甘雨好吧
1676074225,1198.78700,宵夜其实也不错，可惜宵宫不吃生命
1676073803,852.35900,6命夜兰能当武装驾驶员将是绝杀
1676073035,696.31900,〖欺负〗用的好
1676071270,836.84100,DPS高了
1676068584,852.49000,加入我们种门吧
1676066414,1160.91400,宵宫厨要掉小珍珠了
1676063766,1269.62800,胡桃一命就完全体了
1676061877,141.20300,都是160抽一个角色，凭什么你神就比我的高贵
1676059104,1137.84100,千夜泛用性不错的，核爆必备，高成本竞速必备，平民抽一个也可以给很多角色用
1676057705,547.33800,没我好点
1676055903,1091.01300,可是我满命满精的胡桃配了6加2的夜兰
1676055751,365.04400,月卡党 从1+1补到4+1了
1676055563,808.64300,说的就是我胡桃橱，不过我也喜欢夜兰。胡桃满命满精夜兰6加2
1676055115,920.31800,说到这里我就要提艾尔海森，前台角色不给抗打断，q空数不胜数手打伤害和敲计算器差一个镜子＋几段大招伤害
1676054041,717.26700,本来就超模，水国有肯定要拐生命
1676053814,368.35700,是的 本来只想补个4命拐一下绽放队的生命，结果想想不能忍多抽了100发满命了，现在纠结武器要不要精通5了
1676053246,832.84600,出伤速度提了，更不占场
1676053009,106.88000,这个是什么剧情
1676051503,815.65900,出嫁
1676051457,744.65700,几乎可以点名绝大部分角色，4命等于满命的拦路虎了
1676051344,1016.61700,姥爷：啊对对对
1676051098,646.50400,妮露：谁在说我
1676050908,163.29900,班尼特：说的就是我
1676049712,1159.84300,环境待遇不公平前提是谁造了环境
1676049316,484.14200,人体比例好怪，
1676049130,946.54800,现在的懂哥：夜吹
1676048984,176.68000,不是神创造了人，是人创造了神
1676048967,751.65800,魈
1676048749,32.30200,2
1676048596,367.42500,充了1300块也毕业了补了四只野狼连歪了三个漫名叫精一
1676048111,1164.00800,大世界宵宫就是绫人和散兵的下位
1676048092,944.91700,懂哥夜堕了
1676048054,1128.37900,出了俩不知道给谁了
1676047940,1170.94200,宵宫也只能说说大世界了
1676047178,842.60300,约等于满面以下的八重大招 放和不放伤害都一样 但是出的更快 深渊收尾舒服
1676046760,774.88300,某些角色本身就不强还各种小细节的毒
1676046470,437.31700,从下面那一个蓝点我就知道不是ai了
1676045611,360.47300,确实，抽完满命夜兰之后很空虚，不知道玩这个游戏的意义在哪了
1676045587,741.88700,纳西妲4命可不算弱，就是让你换掉精通杯提升伤害的
1676045459,366.82400,在满命夜兰之前，抽其他角色的命座是种浪费，喜欢就抽0命玩玩就行
1676045237,28.61900,1
1676045217,833.88800,缩短了时间轴伤害不变=DPS提高
1676045210,1114.53600,宵宫厨表示很羡慕胡桃厨
1676045087,743.35100,很多角色四命都是可有可无的存在，要么就是自己吃不到=-=
1676045080,273.84300,直接满命
1676044900,879.31500,神子，雷神：怎么会有人的四命会有这么高的数值
1676044853,274.21900, 说的很对，我这个囤囤鼠已经6+1了
1676044756,596.58900,换若水我都70-210
1676044464,1103.64000,护膜：我只打高端局
1676044457,32.97900,2222
1676044259,1192.11900,胡桃是吧
1676043991,800.66300,胡桃不压血玩什么
1676043759,1168.22300,宵宫大世界感觉确实一般，我也玩挺久了，不如0人，可能是解谜占模？
1676043663,1136.40300,是火A和火C啊
1676043606,85.55900,没有温迪的我从来都是手动聚怪
1676043564,374.29100,小月卡党4个月没抽 攒了4+1夜兰 太爽了
1676043546,1097.68700,胡桃-护摩终末-夜兰-胡夜护摩若水-未来的枫丹生命依赖角色。仿佛能看到一条给强度党的线
1676043355,797.65100,红字怕不是连为什么要压血都没搞明白…
1676043275,368.16800,满命能让你以后只抽xp
1676043250,898.84700,因为凌华池子四十天 老米有点慌怕玩家流失
1676043159,833.36100,水神肯定能优化掉行秋
1676043147,759.95000,什么百万魂环设定
1676043045,613.21300,夜兰纯生命倍率，大生命词条可太值钱了
1676042982,1262.67100,就是增傷夜闌自己吃得到，甚至六命能存後台，導致胡桃的成本不如抽夜闌
1676042895,592.24600,水神有可能是超强生命拐的，你看看水系角色奶妈有多少
1676042579,290.44700,真的 我就是月卡 我2+1了
1676042460,366.67600,我差点退出视频去继续冲命座 看到这句话以后忍住了
1676042401,1128.89800,宵宫厨哭唧唧
1676042026,1095.94500,是至今只up过一次的，狼的末路
1676042014,155.39600,不然呢？
1676041943,709.61900,这样说，枫丹说不定还需要水拐
1676041888,1206.58200,纯伤型角色，mhy之前可没那么上心过，现在拿夜兰做了实验
1676041816,1134.97600,宵宫打的就是一个安逸
1676041789,1147.49400,散兵只要你会聚怪就是群伤，不会真的有人信散兵对单吧？
1676041724,1135.79200,宵宫好可怜（宵宫厨落泪）
1676041524,1102.90100,就是说要上强度了
1676041503,1115.65300,笑容渐渐消失
1676041390,852.91900,改成一发没必要，伤害溢出浪费
1676041365,155.45900,谁给你说设定强的就一点得强的
1676041343,778.97000,好爽 
1676041276,1121.24200,所以我宵宫带余响
1676041231,807.14500,唯酢被拿捏死了哈哈哈哈，
1676041214,197.14000,你为什么总提出？提出后就问大家问题？
1676041089,28.37900,1111111
1676040659,52.60300,萬葉 反覆破產
1676040483,197.20400,有种 定的感觉
1676040452,1133.78000,七神武器没必要讨论泛用性了吧 自己用的好基本不换的
1676040290,1106.70600,宵宫：谢谢你米哈游
1676040261,840.10900,总倍率不变，改成一发就爆炸了
1676039662,1134.03800,乐，草神专武泛用性是不高，但是草神泛用性高啊
1676039529,421.77600,明显不是
1676039386,954.53500,除了一二命夜阑不也是直接上数值？
1676039330,252.33200,我就是那个少部分没补一命的
1676039038,452.68100,强者处处是惊喜
1676038967,976.40600,这波血压拉满，不仅充能失败还让击飞（）
1676038861,362.61400,为了抽夜兰雷神池都没碰
1676038659,1134.55000,武器泛用不高，小草神能让它高起来（
1676038527,1150.22200,散兵a和重击可以打群怪的
1676038507,1161.69300,宵宫想想都知道大世界表现不会差
1676038472,1065.40800,来骗，来偷袭
1676038461,33.03900,10086
1676038435,742.03800,点名公子
1676038393,912.76000,说夜兰颜值的无非就是嫉妒她比自己厨的角色强呗，不然谁没事天天聊一个自己不想关心的角色啊
1676038064,799.22300,生命上限变高了不是增加容错率吗，啊这
1676038016,1127.06700,千夜浮梦 草神 砂糖毕业武器
1676037933,44.47700,1
1676037805,372.63700,满命夜兰确实太逆天了
1676037712,1025.09500,rnm 陌生人
1676037603,798.61400,钟离：你当我玩得吗？
1676037570,45.35600,11
1676037192,266.42900,玩这个就想多收集角色的应该不会抽命座吧
1676037106,983.61200,但是游戏里新角色和老角色抽取成本一样的啊
1676037099,1145.27300,但宵宫真的只能对单啊
1676036982,472.85100,这是BUG 要修复！
1676036960,1161.83200,说宵宫大世界强的，夜散万钟肯定没有或者不全
1676036562,225.62400,哎呀这个零命的夜兰巴拉巴拉
1676036499,1135.79400,宵宫擅长摆完挂机（即答）
1676036424,16.99900,3000+
1676036244,1112.10000,但是我夜兰是给宵宫抽的。
1676036199,334.54200,珐没啥好争的啊，本来就是拆出来的伤害模型
1676036068,1250.02000,要是国家论谁来解释一下魈和申怎么回事？
1676036060,803.85500,胡行钟也从来不怕深渊压力好吧，如果这个队都扛不住那也就带钟离的岩队可以抗了
1676036009,1132.95500,策划桃厨早就知道了
1676035882,1126.88200,我的宵宫！！！！！
1676035859,1131.88100,很低
1676035757,266.72100,然后夜兰满命了玩家就不用抽其他角色了米哈游不是亏死
1676035651,416.72500,逆天命座
1676035630,1127.59000,哈哈哈哈哈哈哈
1676035501,808.73900,这种生命值是按照百分比来的，脱一下圣遗物一样的
1676035500,701.73900,死域debuff进深渊胡桃也要遭殃
1676035374,32.60600,2
1676035251,842.50300,出伤快
1676035222,799.87500,胡桃有生存压力吗？特别是1命桃
1676035164,756.51300,草神就4命不行
1676034978,32.95300,111111
1676034962,553.50000,160充能有点难
1676034870,825.74800,说起飞的，水神和夜兰大概率走的是不一样的路线
1676034820,151.03700,这个仇，我记下了
1676034775,366.49700,甘雨直接满命毫无犹豫
1676034760,1161.43700,宵宫是火C
1676034716,33.19300,2
1676034687,1109.78800,你，我，宵宫，啊啊啊啊
1676034632,241.96700,确实明显
1676034569,1112.03900,本人老板娘厨听到这不自觉地笑出声
1676034565,250.17200,国际长途谁打的？
1676034537,1118.49400,宵宫哭辣
1676034456,28.28400,1
1676034430,32.19300,2
1676034299,366.82500,盲猜会出更有诱惑力的命座
1676034265,145.57500,刻晴七七辛炎罗莎莉亚安柏丽莎宵宫优菈
1676034104,853.32900,就和dnf一样脱手技能和出伤速度越快就表示你这个职业越完美
1676033985,464.12500,所以这就是最恶心的地方，全游最变态的四命
1676033934,817.27500,优化只能说目前环境还不是满命胡夜登场的时候
1676033732,1128.50200,砂糖也算能用
1676033648,362.05100,已经从1命，氪金首冲＋1个648到6+1了
1676033552,807.20700,用胡桃的不带盾吗？（单纯的好奇）
1676033514,1082.43000,第二武器赤沙也是终末陪跑
1676033504,563.34500,夜兰专武不是加88.1%暴伤吗？绿字你在说什么？
1676033501,253.53100,已经6+1了
1676033455,752.78800,草神4和6明显照着夜兰做的，但给的实在是抠
1676033440,747.62500,330抽，一次没歪，5命1精夜天后
1676033406,681.47000,确实 我夜兰走下都没带奶 最后一间剩几千血过了
1676033400,741.69500,草神这四命我tm无语
1676033362,260.39200,下次直接满命
1676033352,32.14700,1111111
1676033214,834.72900,时间乘区
1676033137,765.18200,但是叠加起来，和版本深入就很吓人了
1676033094,1138.36100,擅长不等于只能，这句话有点偏激了
1676033024,1133.02700,精五弓藏和精一飞雷的差距几乎可以忽略
1676032898,742.89100,也有可能策划接下来不准备让夜兰喝到一点汤，所以强度全锁命作
1676032891,162.38000,主要是这个游戏就叫原神，mhy出角色应该要想一想原神这个词到底是什么意思
1676032826,795.92800,别啊这啊这了，你这逆天理解能力也基本告别正常生活了
1676032756,316.29000,前面的 夜兰才T1请问什么才是T0？
1676032545,389.83600,2W原石在手，卡池毫无欲望
1676032503,1061.80400,简称《史最香》doge
1676032364,1256.57100,夜兰：摩拉克斯，我以成神(被ch造成的神)
1676032276,1138.66300,这话哪里有问题？
1676032239,1073.11500,终末加绿剑池还差不多，不养胡桃和魈这武器池还是少点意思
1676032234,740.38700,魈和阿贝多，永远难解的心结
1676032217,1158.86400,大世界很强哈哈，我笑拉了，大世界根本没难度
1676032164,1131.98400,雾切：我也有话说，蜈蚣大剑我也陪跑过
1676032148,191.82500,这不很正常吗
1676032130,376.12500,《大》
1676032051,1045.20400,赛诺海哥，赶紧报我的命之座吧
1676032017,379.83500,下身也在持续前进
1676031968,1102.40000,第一次我抽出狼末（悲）
1676031865,934.86300,既然是这种方式吹甘雨的吗，真是太奇妙了
1676031718,920.31500,万叶就是这样，e技能手感和优势完全不是数值可以体现出来的，用了就知道
1676031678,674.52200,深渊再加生存压力我们手残党就不玩了
1676031652,1139.90700,坏了 我成未来可期了
1676031556,1030.64600,最近的角色命座基本都等效圣遗物词条
1676031382,1003.80000,你现在IP6和IP13卖一样价的话你看会不会被批判
1676031312,750.09900,胡桃：？？？难道没人注意到我的四命有多扣？
1676031307,746.51000,很多角色四命都是劝善命座，提醒你过了这里就往满命不能回头
1676031193,750.16100,xiao姓人士觉得很赞
1676031087,891.24100,夜兰长得像策划老婆，他也是被迫的
1676031020,1160.55700,手机端宵宫，电脑甘雨挺爽的，弓箭手大世界都不错
1676030900,842.72400,夜兰能吃雷神6命那就快乐了
1676030866,1154.66100,深渊适应力不一样
1676030814,1131.43300,心海：你不用给我
1676030789,1099.01300,24小时，哈人
1676030744,1097.51200,别用未来的眼光看开服的狼末，当时大剑太稀缺了，还是人上人
1676030696,1096.27200,1.3的狼末什么水平，T0大剑啊
1676030694,1144.21200,宵宫强在0+0，胡桃强在1+1，但抽夜兰命座的都抽得起1+1
1676030684,961.63800,强是强，但是大世界真没那么多路要跑的
1676030638,618.24100,反正草神2了等个白术不就可以等水国了吗
1676030543,839.38200,宵宫的夜兰云堇本质上就是蹭的别人的
1676030521,805.23500,如果不是1滴血的话，你的当前生命值也提升40%
1676030512,801.24700,关于这一点，也可以解释为，夜兰没有治疗能力吧
1676030448,370.66800,关键词：大
1676030275,1251.30500,人均满命夜阑之后怎么办呢
1676030255,845.95200,笑死，对比海森专武特意调慢出伤速度
1676030243,785.55300,普 普 通 通 小 6 命
1676030232,33.17200,2
1676030220,801.78500,红字就这点理解啊，6
1676030147,462.89700,而且当次E就有提升。还是25S长时间
1676030046,378.20400,月卡 已经满命了 抽卡还巨非
1676029760,377.81300,这张原图很好看
1676029756,1088.15300,满命满精胡桃厨配了4+5的终末夜兰
1676029727,115.32500,给了温迪还当什么神。。
1676029722,367.43800,确实，一个月卡玩家没忍住2+1了
1676029691,912.89900,数据是算不出角色机制的
1676029563,1145.60800,散兵能用重击打群，还挺爽的，就是真的吵
1676029539,1118.39800,宵宫厨破防了
1676029533,826.73200,倍率不变，时间缩短，其实上dps是提升的
1676029334,137.78800,胡桃哭了
1676029132,819.84300,胡桃的外置命座，我认识的很多月卡党的胡桃厨都去冲夜兰命座了
1676029126,204.62700,《前两天》，指好几个月前
1676029106,1100.60300,而且那时候还没定轨
1676029081,492.40600,阿贝多六命:捡结晶盾加17%伤害，太好笑了
1676029063,830.81900,dps的提高
1676029056,1155.71300,应该说胡桃和肖工的输出舒适期间是对单
1676028920,1190.57200,毕竟是隔壁薪炎律者
1676028841,1091.86300,胡桃真的每次武器池都超级豪华
1676028829,32.64000,1
1676028799,731.05000,对妮露来说是真的可怕
1676028759,364.09800,满命后特别空虚。。没有经打。。
1676028609,304.25100,雷神不一样，那个二命数值爆表
1676028548,804.07700,美元，领带美元（哭）
1676028450,544.86900,我是70+230
1676028390,85.58000,其实温迪打岩蛇还是有用的，我当时队里全是近战，但是用温迪滑步弓一秒四破
1676028140,799.34100,前面的红字。。。
1676028133,1229.46500,大居八？
1676028118,869.84700,知不道
1676027874,344.95700,甘雨：终究是错付了
1676027731,1120.95600,痛，太痛了
1676027728,1110.55200,宵宫厨防老早破完了，所以永不破防
1676027402,841.46200,妮露：敢不敢把我的大招调成一段总倍率不变
1676027393,1117.12800,宵宫厨破防了
1676027361,1089.92600,我看了一眼迪西雅，貌似更加契合，就看数值了
1676027340,466.55400,4命最强辅助命座
1676027317,791.62000,要是胡桃加血了夜兰不是还能当奶妈（
1676026920,237.50100,用了发现，满命夜阑单人对比其他满命确实猛，但是算上队友就其实不差多少，因为没有拐
1676026843,797.40300,不带钟离，加40%，是不是很多原本2W血的不会被秒掉？然后补个奶回血
1676026808,1254.81500,随你策划如何抬，我还是选辅助
1676026780,794.63900,绫人2命是加完血，又减回去了
1676026751,295.71400,月卡，2+1
1676026745,505.72100,降魔大圣怎么你了
1676026693,1162.64100,低命宵宫单人大世界还是很不错的尤其是手机端
1676026642,460.82900,一命两个E，EQE，无限四命！
1676026501,385.76600,一大堆仓管了
1676026286,498.75000,又得抽卡了
1676026167,998.32200,膨胀是必然的，不然不可能推动玩家购买力
1676026051,374.76800,夜兰刚出抽了1+0，大保底加攒的72抽到2+1，然后6单满命
1676026019,1159.22900,说宵宫大世界不强的肯定没有宵宫
1676026003,942.12100,甘厨 掉小珍珠了
1676025982,1155.90100,前面胡桃就是对群的这话真说的出来，吹的时候麻烦思考一下
1676025912,1128.84700,八重：我有话要说，你不用给我
1676025861,1135.33600,主要是有谁会抽千夜不抽草神啊
1676025846,392.77500,须弥后几个辅助副c都还能看看，到枫丹估计要更新主c，流水可能是纯xp的反应了
1676025826,1129.96000,没事草神泛用性高就行了（
1676025813,1105.09300,其实散兵的名作也属于较好那一类 了
1676025791,758.44100,不用举例，大部分限5的四命都是一坨
1676025772,1116.56300,赞同，宵宫完全成了卖其他角色（神）的陪衬
1676025666,1054.01300,夜兰这六命根本就是怼强度吧，不像魈六命那样有设计感
1676025657,1132.00000,谢谢破防了
1676025638,1191.11200,某些桃黑玩家急了，笑死我了
1676025606,815.38800,那是二命和四命提升比胡桃自己的命座都大，准备明明抽了
1676025575,804.12200,绫人二命不是也是一样吗
1676025551,1207.31600,毕竟是行秋上位嘛
1676025524,16.89900,贡献了30块
1676025390,1094.44000,阿贝多：我要批评一款游戏
1676025224,449.05100,现在不画手的默认是AI就行了
1676025221,720.87000,要么像赛诺那样被ch废了两个可以写进技能描述里的天赋
1676025220,1234.77900,白术是海哥售后，想啥呢铁子
1676025213,1107.66700,ch胡桃厨（确信）
1676025196,553.87800,充能要这么高嘛，我充能不合格其他差不多
1676025167,277.70100,但是每次抽夜兰都是150多抽，是会死人的
1676025106,1106.09200,所以冰系夜兰什么时候来
1676025089,750.35200,阿贝多：我要批评一款游戏
1676025082,583.21700,99.6過高   80我也在努力了
1676025081,1114.89800,前两次说的是雾切吧？
1676025069,851.08000,纳西妲频率高才好蔓激化
1676025059,721.09800,阿贝多：我要批评一款游戏
1676024934,57.79300,但我是江湖鼠士
1676024896,396.45700,姐姐hso prprprprprprprprpr
1676024840,253.30000,半年没抽就等今天，下个池子就是2+1水神。草神7.0再抽
1676024800,1101.90700,懂了，策划胡桃厨
1676024726,796.21300,这边吃了30%的生命加成 吃满的话胡桃生命能上 41566
1676024718,218.98100,我都是造神的人
1676024714,954.31100,你说是吧草神
1676024671,288.42500,不卷怎么拿钱。做强度风向内容的实际都在帮mhy赚钱呢
1676024597,1112.97700,老板娘：你礼貌吗
1676024577,835.19600,出伤快了啊
1676024570,740.80800,个别角色的4命约等于没有
1676024561,213.13900,你之前不还说是设计师没预想到的强度嘛
1676024497,1154.84000,《亲女儿》
1676024415,514.34100,魈：我不破防
1676024374,1114.38100,懂了，宵宫下次跟水神一块打高端局（doge）
1676024373,1164.89400,大世界我只认可万叶，夜兰（doge）
1676024330,1030.92000,太哈人了
1676024316,1145.27600,宵宫优势是远程，擅长转火，比如这期下面三个女贼
1676024284,1178.32500,胡桃在待遇上拿得女主剧本，我想到了琪亚娜
1676024213,32.42000,1
1676024185,1090.76300,肝帝认证
1676024096,739.73200,这之前就神里四命能看其实
1676024044,1125.58000,哈哈哈哈哈
1676023946,1108.63800,声明一下，我是老板
1676023940,1123.88100,别说了，别说了，宵宫太可怜了
1676023934,1106.63800,甘雨的阿莫斯陪跑的都是什么，大家不会忘了吧
1676023902,492.45900,所以我现在是4命夜兰和心海绑在一起
1676023888,1122.30200,我的阿莫斯陪跑更惨
1676023802,505.49100,原来设计早也有利处...
1676023779,848.69400,夜兰5发大炮可是秒天秒地的
1676023751,1166.07400,别尬黑，米忽悠新出的散兵专武就很适合宵宫
1676023746,1114.60000,破防了
1676023723,245.88500,给她一把若水直接离谱起来了一个e4w9，我3命绫人还要砍几刀。。。
1676023655,995.78500,不膨胀那就是一潭死水了
1676023625,371.73100,第一眼没认出来是绫华
1676023549,821.44600,乐死，我二命一精35词条夜兰也没见纯水比胡桃高
1676023547,826.30200,难怪要甘雨战技起连发
1676023417,565.24400,双水生命会更高吗
1676023390,1110.76000,别说了，宵宫厨早就破防了
1676023374,1147.47400,胡桃是对群的角色
1676023347,1119.09100,别骂了别骂了，呜呜呜
1676023337,840.96100,纳西妲：所以我六命为什么是六下？
1676023291,1046.52000,魈:?
1676023282,39.53500,辛焱剧情多是因为开始塑造人设做的非常单一 然后不服气疯狂找补
1676023260,1154.96000,有些角色设计就是容易躺，环境针对的不是你，但你也跟着受阻，过好几个环境才发现是自身不被期望
1676023257,823.11900,二命额外伤害加的也不少了
1676023257,352.03100,甘雨真的到1命，后面眼前一黑啊
1676023241,837.08500,出伤速度相比6发快了
1676023234,1177.84600,不如增强一下胡桃的提升暴击率天赋和四命，变成一个强力暴击拐命座
1676023206,421.73000,魈：？
1676023197,1139.02100,千夜适合整活
1676023157,280.97000,月卡，已经1+1了
1676023155,184.70000,心海被草系占模了，万叶命座保守，环现在，二命变一命，六命变二命
1676023117,547.64400,不夸张，我面板和这差不多
1676023115,810.36400,阿贝多：我现在要点名批评一个角色
1676023073,1109.23300,哈哈哈。。
1676023070,480.95500,《大》
1676023066,1133.75500,宵宫好可怜啊。。。
1676023059,760.41800,双生武魂
1676023052,1044.85400,年假还没请，缝合一下，赶工交差
1676023049,1128.71400,破防
1676023040,847.59700,一發五倍倍率才是最強的
1676023038,755.09000,而且抽到第四个就可以解锁
1676023026,1138.90600,比较可爱！（即答）
1676023016,1143.73400,散兵也能对群
1676022987,790.12100,改變生命上限不會改變生命值比例
1676022981,1111.98400,我哭了
1676022965,1129.50800,没事，我千叶和飞雷都抽了
1676022958,899.21100,夜兰也就建模拉，立绘挺好看的
1676022930,1188.32600,前面的，胡桃剧情哪多了？？
1676022908,1158.07000,宵宫大世界也不强好吗
1676022898,782.72900,草神虽然给得少但是给得巧 精草爆精通刚好配平
1676022877,1105.51700,完了胡桃竟是亲女儿
1676022837,816.07300,没有胡桃感觉抽到2命作用也不太大
1676022830,1156.58400,散兵没把宵宫爆金币我已经很满意了
1676022830,246.88600,关键词：爽
1676022825,1088.09200,懂了胡桃亲女儿
1676022822,1106.64600,胡夜万还差一个完美的打火机
1676022811,1171.45500,你说的对，最后夜兰和水神一起把宵宫胡桃都优化掉（doge）
1676022765,1010.40600,夜兰是870，后面的角色是888/8gen1，这应该更形象点
1676022752,926.52500,@卡特非
1676022734,826.31300,水神直接设计成胡桃吃不到
1676022706,1128.95600,难道有人不抽草神抽千夜吗
1676022691,1144.75300,可是散兵也有对群能力
1676022688,32.15400,1
1676022656,831.27100,蒸发收益和容错都变高了
1676022654,1167.48200,就散兵专武变成弓给宵宫都行，可米哈游不愿意
1676022634,1212.49700,虽然但是，还是希望大伟哥上班挤地铁，下半住40平米十几个人的宿舍。然后洗澡要排队到12点还一直有人催
1676022610,33.21400,优菈就是被忽视最严重的呢种
1676022587,632.27800,不能这么说，竞速里面boss都吃不满的
1676022575,1093.96000,8小时，哈人
1676022567,816.12800,所以抽个四命夜兰拿终末给桃子打工去了
1676022561,1098.96100,夜胡
1676022534,745.44600,小草？魈和阿贝多！
1676022522,836.45300,出伤速度提了 赖场时间减了
1676022509,1107.59400,宵宫:这里我要批评一款游戏
1676022508,1219.24100,这是在暗示白术嘛
1676022486,1126.63900,没事，小草神泛用就够了
