发送时间,视频内弹幕出现时间,弹幕文本
1675999558,393.08600,还有，说家有儿女里刘星是小雪男朋友，无语
1675996722,0.00000,吓死我了啊啊 我叫吴曈
1675994637,371.10000,艺人资源估计是唯一一个可以和湖南台比的了，其他台我就没见过能请到这么多人
1675994129,78.75800,当时看的时候我就觉得是剧本
1675985526,190.10900,说了半天我也不知道书柜在说啥哈哈哈哈
1675972796,310.51700,雖然但是 前面的粉絲別搞笑好嗎 再怎麼樣演技也是演員自己的東西 總不可能說是吳桐教他怎麼演的吧哈哈哈
1675954316,260.10000,其实我个人作为耀文他们的粉丝，我的建议是只要别说孩子，其他的尽管骂，因为我感
1675949862,212.35900,路温造过明星的谣，不是什么好玩意儿
1675941715,16.97700,给大家点一下，青春环游记抄袭韩国综艺
1675940644,194.49400,怎么，有些人就这么确定以及肯定地骂流量了？
1675935709,435.00700,现在的综艺真的无聊，看着浪费时间
1675927722,477.21800,芒果的综艺做的真的不错
1675920891,393.84700,呢呢
1675910367,424.49900,关键这两部综艺，是真的拉
1675906177,373.41200,好像他原来就是负责艺人的，后来才改的导演
1675870084,396.09900,等一下，真·吃瓜吃到自己家，别太离谱啊吴桐
1675866158,286.02700,哈哈哈哈哈哈合情合理
1675862103,221.06000,说别人都没问题 说刘耀文就是给梧桐洗白 好了我知道刘耀文火了
1675847386,386.55800,近千万的收入，别说喝完酒吃药，喝完不吃药都行
1675843161,107.58500,哦哦哦哦
1675841456,261.97900,前面那位我也，感觉这个真就是捧杀吧，目前没看到有人因为这个节目粉耀文，作为粉丝也看不下去这个节目
1675840715,393.54500,他真的  谁都不认识
1675834453,166.44400,所以可能就是单纯眼缘嘛
1675831938,385.70400,周董可以请来吗哈哈
1675831688,395.45000,挣钱嘛，他既然想要钱肯定得受着
1675824528,173.79500,粉丝真敢拿这个吹
1675788915,361.57100,感谢他是浙江台的吧，浙江台本身也不缺招商
1675787955,22.21500,吴彤拉
1675786243,388.26100,赶紧死在酒桌上吧？算是对内娱做贡献
1675786109,275.56100,看老罗的节目就知道怎么顺了，
1675784277,175.12400,这是在说啥？
1675784119,225.69900,后期剪辑就叫剪辑阿，人家不是有名字吗干嘛要叫剧本
1675781679,204.13500,路温还没倒呢，不是个好东西
1675780583,30.90000,我印象里他就是个抄袭狂魔
1675777366,454.04900,极限挑战（前四季）！​
1675777174,127.73800,救命这个综艺没看过……
1675776493,238.86300,？？？
1675775546,454.25600,名侦探学院!!!!
1675774750,182.90700,刘耀文像不像吴彦祖这也是主观判断 乍一看 有点感觉 但吴彤反反复复拉出来营销 赚的黑心钱
1675773073,396.80300,大哥，你没有骂他
1675772391,454.29100,明侦和明学真的可以
1675772248,173.84600,笑得。。
1675771954,166.60900,张emo因为资本
1675770998,256.41900,这些对我们来说就是剧本。这里也不用这么严谨的解释“剧本”的定义
1675769295,383.48600,只能说人是努力的，不过没努力对地方。
1675769212,351.67700,确实，一般节目不可能每期都有爆点，但是搞经典情怀煽情这些确实更容易引发观众共情
1675768285,36.35100,！！简直就是一坨沟石！
1675767187,134.35200,出道六年紧张哭了牛
1675767008,86.97200,我有同学在浙江卫视做后期剪辑，她劝我们综艺别看
1675764630,344.97100,但是不可否认的是，确实给了刘耀文热度
1675764032,363.56600,「想问一下上热搜什么公司或者中介会给人钱吗？」
1675761220,189.77800,？？巧合的多机位近远景镜头？不敢苟同
1675760232,469.19500,三连支持啦，加油～
1675759653,133.92900,emmm
1675759290,211.26200,鸭子赚的就是喷射机的钱啊，他大概没有考虑过“中肯”二字
1675758103,337.77100,煽情从来不看，尴尬（游戏抄袭不知道
1675757483,375.48800,我也觉得哈哈哈哈看王牌的时候我都在感叹他人缘牛批
1675757233,121.13600,沈月那里我相信她真的是紧张哭了哈哈哈哈
1675753839,375.26700,。。招商多，曝光大，艺人肯定愿意去，还轻松
1675753365,155.10400,尔冬升是剧本，为什么小四是自己私心啊哈哈哈
1675753178,158.77200,小四那是竞技类节目，无限超越班不是啊
1675752543,17.34200,吴彤？罗彤吧，就知道抄罗pd
1675744783,19.16700,他是抄的，当然有剧本
1675744656,448.86300,闪亮的日子真的真的很推荐！！在腾讯
1675744432,392.78000,Jaejae！真的超级努力又厉害！
1675744233,394.90000,这是他故意卖的人设吧
1675743925,134.41900,她最近几年哪里有走黑红路线
1675743300,463.28500,受害者：老罗
1675743221,384.40600,救过杨迪贾玲沈腾的命吧
1675743169,289.07000,专业对口看着更闹心哈哈哈哈哈
1675742568,460.21800,大侦探！
1675740220,43.58100,罗pd是吴彤的爹！
1675711588,154.85700,就是他抄了老罗的综艺里的各种点 但是！哪怕他动动脑子贴合一下国内的娱乐环境呢！就是生搬硬套啊脑子一点也不动啊
1675710866,454.94700,明侦是真的牛，选题和立意方面是国内综艺首位了
1675704671,212.03500,我觉得路温说的有道理所以我听他的有错？
1675696690,388.73200,wt请周深作综艺，不知道周深的歌《情是何物》也就算了，还质疑人家有这首歌吗？
1675696455,390.57200,wt叫迈克尔·杰克逊叫麦扣杰克心……
1675695928,5.91900,给我骂！
1675693806,366.79600,跳过也能有热度哦
1675689521,400.31800,nene
1675687531,36.51900,up好像穆婷婷啊
1675684047,259.43400,二极管不适合看分析视频啊，，
1675683397,386.47900,这不是拍烂综艺的理由，还是得噴
1675683017,50.90700,极限挑战
1675682978,392.72400,他连人有时候都认不清 名字还能叫错
1675680615,181.85900,呃粉丝都跑这里了
1675677759,66.57300,无限超越班，三托答辩
1675673209,240.11000,我当时看找影子哪个介绍就很不适
1675673032,389.23600,希望通风早点战胜它  对就是这个它
1675668943,388.18800,好声音也请了
1675664895,43.88000,你说是吧 杨幂
1675664456,155.08400,……
1675657150,375.44300,不是他牛 是钱牛
1675650440,400.53900,这是他演的吧，故意博眼球，让节目让自己让热搜
1675639941,58.02600,马蒂，还记得曾经在b站骂吴桐被喷
1675636003,210.78300,但用好存做例子反而更加说明了资本和双赢的力量吧……
1675634466,93.40100,我当时是觉得他拿到的时间比别人晚半个小时，比如别人规定九点，他规定9.30 
1675634008,376.04100,骂得好啊！！
1675627205,462.89800,闪亮的日子！！！
1675622905,236.18000,综艺不可能有剧本，因为现在电视剧电影都没剧本
1675610813,375.17900,就是有资源所以才这么抢手 能赚钱就是好员工(
1675608836,408.94500,虽然但是宋亚轩八十岁那个是纯属嘴瓢吧
1675608708,331.87900,服死了，就那几个游戏，看一个吴彤的综艺等于看了全部
1675607757,196.65900,ln up
1675607548,364.20000,刚开始看吴彤的节目是冲吴彤的口碑去的，现在…
1675606547,197.42800,成龙两期都说了刘耀文像，正式剧目表演结束之后又说了一次，说补录的成龙自己不知道自己要对谁说吗…
1675605461,387.35400,他要这么搞真担心能活多久
1675603642,360.99800,没错，没内容
1675602092,394.51100,前面jaejae的，我超爱jaejae，她是真用心
1675591976,142.00100,可是沈月看起来真的不像是被吓是
1675591048,183.07100,刘耀文真是普通家庭哪有啥资本啊，ha
1675590840,464.37500,想起舒慧之前说的民乐综艺
1675588368,160.05900,所以说这些老从艺者并没我们想的那么好
1675588211,365.50200,说实话一开始情怀搞得还挺好。。。不过所有都这么搞就审美疲劳了
1675585539,396.52200,不去做艺统真的很可惜就是了
1675584184,295.09900,确实就和电视剧电影不一样。
1675581141,303.57700,吴彤这种导演去芒果台面试都拿不到offer，水平真的很一般
1675581013,241.09800,我真的觉得天天说皇子的简直不要太没品好吧
1675580855,158.44500,笑死要真是皇子倒好了
1675578883,290.60900,一个本来应该锻炼演技的综艺结果还是在玩游戏。。。亲爱的客栈也在玩游戏。。。真是没见过这么多一眼就能知道导演的综艺啊
1675577048,449.21000,可是王牌好看啊
1675574876,173.45900,张艺谋………
1675571225,324.29200,柠檬长出来了吗？
1675569008,189.63100,退卡的时候有八个机位拍？
1675568443,436.23200,是把工作做好
1675567641,383.58700,喝酒吃药s得快hh
1675567244,367.18200,当时期待欢天喜地七仙女的重聚，结果就2分钟，不过就这两分钟我也点进去看了
1675561518,415.10700,他怎么配啊。。。无语
1675529978,384.90900,喝酒配头孢吗
1675526475,436.45700,想想芒果的再见爱人 高下立见
1675524219,289.91900,吴彤拿着真多资源依托答辩
1675523889,372.49900,这让他更有恃无恐，没什么好夸的
1675523793,477.45600,大千还可以，闪亮的日子，快乐再出发，好像都是他们的
1675523673,386.28000,他很拼，请人也很有方法，这点真的让我佩服。
1675523416,114.11000,沈月有这么自然的演技吗哈哈哈哈
1675521560,173.24400,但是同样的情况尔冬升骂了别人，另一个综艺
1675521515,337.19400,我就不明白了，为什么无限超越班也要有传声筒
1675521441,401.06200,这就是不尊重人
1675521371,398.13700,我估计要么是真不知道，要么就是故意说错的为了上热搜
1675521142,391.61400,就是！一点都不真诚！还叫错名字！他以为他很可爱吗？无语了
1675520901,274.45200,没错，生硬尴尬，王牌总是不介绍嘉宾，青春环游记刻意煽情，就会抄袭，能不能封杀他
1675520745,432.49900,我们的客栈 看到第一期接力做饭就不看了
1675520457,446.29800,反正我也不看内娱综艺，可能都没有你吐槽好看
1675520138,225.77900,所以说，后期是二次创作
1675520136,370.90100,对，请好多明星，所以他的节目看了之后就觉得有点浪费阵容
1675518148,375.55500,还有王菲，去跟王菲搞关系拍照结果还是没下文
1675518040,295.63900,广告比正片还长的感觉
1675517566,386.63800,那也许有一天人就突然没了呢
1675517463,357.13900,我看王牌都直接快进掉传声游戏的，真的好无聊啊
1675515983,365.15900,对的，对于资方，当然谁能赚钱选谁，管你节目好不好呢
1675515805,262.50300,的确
1675515702,179.75300,就还卡那段摄像的清晰度，多机位，纯纯是说好的
1675515624,376.74500,还有周星驰 他是真的低调！！！
1675513675,167.27300,刘浩存是刘岩侄女 就是奥运会开幕式摔残的女的 刘岩还当过小三
1675511347,166.37500,张艺谋。。。。。。
1675510702,390.86600,做功课最牛逼的人叫jaejae
1675510534,377.70300,他原来做的就是艺人统筹好像
1675510055,201.08600,别把明星团队想的那么傻，可能有操作失误，但是很多东西是可以拒绝的
1675509157,73.14500,舒慧今天好美
1675507140,360.60700,他能不能别抄了，真的烦…广告里插播综艺，无语（＃－.－）
1675506608,474.22000,所以内娱哈哈
1675505358,393.66300,舒惠说的好客观
1675936200,154.77500,罗英锡是吴彤的爹
1675921568,31.20700,罗彤吧
1675916892,295.65600,我一个满月（刘耀文粉丝）我都没眼看这个综艺，耀文咱回楼吧
1675882251,138.05900,如果是真哭那她演技烂也不是没有理由
1675849551,181.35700,真会洗。
1675844258,133.87900,是的，再加上剪辑，造成如今效果
1675833163,173.86200,搁这洗呢
1675829395,174.15900,他可能真不这么想？
1675827960,238.36600,我就说一句 演员为了红什么干不出来？
1675827664,158.91100,沈月就算了演技基本等于没有
1675815951,454.64700,种地吧，少年篇
1675790439,468.88800,大千就是这样…贴钱做新综艺 没有赞助商
1675781510,462.61900,名侦探学院
1675768760,181.20200,？哪个部位像了，不过绑定上这个名头不管路人认不认可倒是能营销大帅哥了，就厌烦这些通过别人来标榜自己的
1675768596,133.43700,哪个黑红的起来了？何况本身有一定流量粉丝，谁愿意被骂一样。。
1675766791,166.88800,真的笑了，就是逮住刘耀文骂皇子
1675764025,202.40300,吴彤知道范专一只想选反派，不会变，所以专让导师针对他。
1675754599,238.69600,不管什么情况，都是不好好做内容投机取巧的
1675754580,167.17000,给红卡背景故事花絮里有，不过大家好像都没看
1675754089,337.81200,人设都抄我真的忍不了
1675753729,210.09400,还红卡设计感太重
1675751771,174.44100,不认同哦，粉丝是真拿这个吹的
1675750505,24.13900,主要他能不能不出镜，真的眼睛受到伤害
1675749810,87.46400,好漂亮
1675747991,437.05900,也许已经用了……就这效果了
1675745912,259.17900,捧不捧说实话刘耀文也不适合演戏综艺，一塌糊涂
1675743246,409.28100,很不尊重人吧
1675741612,425.68800,我们的客栈也是他的？？光知道烂了不知道也烂在wt身上。。
1675739289,345.32100,韩国综艺能火不是没有道理，他们敢搞敢创新
1675731079,454.76000,名侦也是隔壁引入的 只不过是买了版权的那类罢了
1675729281,401.74000,我觉得有些是他故意说错的他真的很想红很想走到幕前啊
1675699723,159.46500,哈哈哈哈哈哈哈但像吴彦祖那 是后期剪的
1675698811,454.81200,芒果TV： 欢迎来到蘑菇屋和快乐再出发！！
1675690445,355.24100,罗彤不行啊
1675687824,227.31100,直接蒙太奇就可以有很多观众被当炮灰了
1675687184,5.56300,前面的在省什么流啊。。。理性分析这么就是洗了。。。
1675686880,214.08900,救救我啊，不客观的到底是谁，up不比你们懂。。
1675680879,250.28800,前面那位说一直捧得lyw的有没有可能是捧杀
1675680369,303.72100,n而且梧桐这种艺人导演出生的，镜头那是差是差的来….
1675678620,100.69000,不像，导师们开骂的样子明显是准备好的
1675677687,36.81800,我觉得王牌挺好看的，我身边的人都看，非常火
1675673126,181.21800,给的都是负面流量啊。。这种流量没用的好吗
1675664621,189.43800,退卡的时候还多机位，搁那儿拍微电影呢
1675664590,189.43800,怎么没好处，没好处那把这个剧本给别人啊哈哈哈
1675660380,454.47600,名侦探学院是韩国美秋里，建议先看原版
1675659321,196.57100,给红卡不是抬他吗，还买了热搜，热搜词条底下都是粉丝在吹演技好
1675658818,275.98500,他是真的没那个能力..
1675655631,166.62100,我发现我看到现在 杨淑慧说的人我一个都不认识
1675653754,93.92900,为啥国内综艺都是整这些无聊的台本
1675651311,310.64000,吴彤的水平放芒果台是属于海选都过不了的那种
1675649417,209.94000,路温也不是什么好东西
1675648720,291.19800,所以我不看吴彤的综艺，太烂了
1675639645,476.71100,大千做的综艺还挺不错的～
1675622628,448.75500,名侦探学院！强推！！
1675620969,462.81900,内娱不配
1675608312,476.53300,米未和芒果综艺确实厉害
1675605891,238.67400,赵樱子后面镜头挺多的啊
1675601379,44.73400,罗英锡是他爹
1675600009,79.35300,动作指导：宇智波带土
1675598893,154.53900,。。。。。。。。
1675592368,58.02800,抛去奇葩操作，他请的人也没有一个有演技啊。。。
1675589003,122.25200,沈月那个很假矣
1675588109,143.19400,靠黑红的明星也不少呢
1675580901,50.91800,妆好看耶
1675580786,196.25500,成龙后面一期又说了一遍像，这真不能怪艺人吧……谁又能力逼成龙啊
1675578817,290.60900,刷到一个无限超越班玩传声筒的视频我都蒙了，结果一看还是官方的号。。。。
1675552835,448.74400,都是“借鉴”过来的
1675551442,115.26100,要求她表演个现场哭戏 她反而一时哭不出来
1675531741,203.41900,导演给红卡就跟评委给通过的剧本一样，有啥不可能
1675525095,433.06700,看综艺还得是芒果台
1675524985,356.90700,也可能是买热搜
1675523590,287.59200,不管什么节目都是重温重聚……
1675522688,19.39000,可以和高碧一起吐槽吴彤
1675521080,241.13700,她说的那些话有可能是剧本，毕竟她目前就是走那种黑红路线
1675519764,287.70300,而且很多广告
1675519719,262.60300,哈哈哈哈衣服上没有口袋
1675519275,331.93300,还有洗白大会
1675518321,468.64000,就是恶性循环
1675516887,329.56600,老罗的节目快被他抄了个遍了
1675516077,222.48300,是的，我担直拍完整版和正片卡到那句的意思完全不一样
1675514113,4.24100,你又要上热搜了，姐妹，我当初就因为山河令上王牌被剪辑骂的吴彤，热搜挂了两天
1675508527,448.65200,我的老罗……
1675508343,5.04000,吴彤区up主再填一枚大将
1675508297,434.30200,书柜要哭了
1675508021,159.43900,哈哈哈哈哈哈哈哈哈不愧是我们舒惠，说的挺不一样角度
1675504901,13.78000,早啊
1675994388,154.08800,西九没出，今年没得抄
1675954127,330.19600,我文宝现在就是被骂了
1675945481,272.06400,真的离谱，特别喜欢搞情怀，王牌对王牌次次都在搞，我真的无语
1675920866,416.58200,nene
1675918331,214.30000,？？？
1675910295,291.20300,哈哈哈哈哈哈哈
1675873896,461.58100,推快乐再出发！
1675869763,228.61400,我也觉得明星不可能这么傻
1675844428,263.05900,从小看综艺节目不都这样
1675834216,432.70300,赚快钱
1675831253,180.54100,那个机位不太可能是导演提前没安排不知情
1675829752,455.03800,明学yyds！！！
1675822616,174.70000,？
1675819327,38.06500,台本只规定这一part要玩什么，剧本甚至连谁赢都规定好了
1675803126,202.07600,哈哈哈
1675796445,6.50300,吴彤的综艺就是答辩
1675792317,262.69500,这不就是大伙理解的剧本
1675789851,46.95300,亿托答辩
1675789823,31.42200,要不是有我喜欢的人 鬼去看
1675781577,180.99800,早知道不投币了
1675781506,462.61900,名侦探学院
1675780145,257.55500,平庸懒惰的人登高还要维护，错看你们了
1675779732,13.71400,高碧战友
1675776359,180.88000,哦，我们糊团内娱第一
1675774640,24.17900,保护！！
1675769542,130.70600,沈月靠自己的vlog路人缘比以前拍戏的时候好多了。。
1675768528,448.06000,srds明侦也是有韩国原版的
1675754796,241.20400,前面不一定，后面那个给赵樱子洗白应该是有引导的
1675754556,237.41600,情况不绝对呀，为了流量点击率热度和其他目的舒惠说的情况和别人说的有故事线都说得通了
1675753908,94.95300,…………………………
1675753232,143.82500,说实话，这个节目看到后面和红卡压根没什么关系
1675748603,161.21200,所以就是钱呀，就是资本啊，为什么会觉得每个人在综艺里面都是在做自己呢？
1675743109,258.26300,那全部都是台本啦，哪有这么细致的剧本
1675741724,124.49900,罗彤不会抄而已
1675741636,3.77400,不是洗白，耐心看下去
1675734297,161.21300,笑死了
1675697279,476.21700,米未第二季我觉得比第一季好多了
1675696716,208.24600,前面的有没有一种可能刘耀文压根就不知道吴彤要请他来参加的是一个演戏的综艺节目
1675694841,19.75900,这波支持书柜，俩币拿走不谢！
1675694787,12.55500,三坨答辩
1675693849,410.23200,为的就是热度啊…………挣那个什么钱哎
1675693684,296.57400,演戏不知道，反正综艺猜词是没有剧本
1675692383,438.67600,快乐再出发
1675689080,160.78500,不要说别人为什么演的好没给他红卡，那人家毕竟都演戏多少年了，没演过戏有没演过戏的标准
1675688112,208.05900,不是为什么不可能呢？
1675686854,6.37500,按错了
1675683634,188.75800,让他多点镜头？
1675683189,201.95900,这段搁这儿洗白是吧？
1675671524,159.80500,？
1675657633,468.35000,闪亮的日子也是一样的，大寒冥国的我独自生活
1675651718,76.24300,告诉他错的时间  去了就晚了
1675637810,477.88600,可悲可叹
1675612701,51.72600,极限挑战
1675612471,104.72300,怎么可能经纪团队自己设计，这不纯自砸招牌，谁会干呢
1675607134,228.58400,但是后期主要看导演的意愿，不是后期工作人员的问题
1675606088,455.14300,其实我还挺喜欢王牌的，萌探1和青环2也不错，但萌探2和青环3就有点尬
1675604644,467.65100,←节目有赚钱的能力就上来了，管它烂不烂
1675597308,154.23400,？
1675597203,5.60800,没事，还有高碧
1675591238,319.43100,电视剧电影都会有研读剧本的时期，特别是电影制作周期特别长
1675590962,195.57100,标题说好要梧桐，看到现在一直在洗白！
1675585453,354.41300,真的，，，，，
1675581963,355.00600,我天天跳过
1675567310,276.20000,他真的就硬cue 昨天那期 ，转组镜头的时候直接嘉宾后期配音棒读 他真的我服
1675563422,345.54000,王牌真的应该感谢沈腾贾玲拼了命做效果，给人俩加钱！
1675560531,167.19300,但是lhc在悬崖之上至少及格了
1675528801,287.29100,哈哈哈哈哈哈哈哈哈哈或哈哈哈哈哈哈哈哈哈哈哈哈哈哈
1675524790,195.37100,给红卡这事可能有剧本吧 以前明日之子薛之谦也被节目组骗过给投票
1675523327,59.39400,而且广告方也会要求
1675521704,175.20800,没事 粉丝更败
1675521282,338.13200,全是快本十几年前玩废的游戏
1675521030,332.30800,这么多个节目玩来玩去就是那几个游戏，每个节目都要打电话无不无聊，一个传声游戏各种花样，换汤不换药，抄袭怪
1675519019,237.75800,前面的可是当时那个片段刚出来的时候全网都觉得她很迷而且评委也是一脸看不下去的表情
1675518675,453.55400,感觉舒惠说到自己难过了
1675516695,138.63800,而且他的节目绝大部分都是抄的老罗！！！！！！！
1675516179,461.92700,内鱼现在的风气真的挺……哎
1675514591,401.74700,对对！好多次他叫人出错 开始搞笑后面多了就反感了
1675511135,438.59000,可是我们不会丢公司脸  他把我锅脸都丢了
1675511018,214.14300,wt那创新思维那么低下咋可能写出来这么有话题度的剧本
1675510215,81.38500,所以这样不会导演跟艺人闹翻嚒
1675510188,115.87000,wt真的很烂
1675509770,107.65800,这个综艺真的很烂
1675509410,287.45900,哈哈哈哈哈哈哈这个咬牙
1675509247,167.21900,你去夸他，怎么夸他，你随便夸我不知道。
1675508955,222.69500,救命 这样也太引导性质了吧 
1675508551,432.97700,他就是自己想红
1675508261,310.94300,想看你和高碧联动，感觉会很有共鸣
1675506067,175.14500,给红卡有争议，有讨论，有流量，就这么简单
1675994531,297.04900,尴尬贯彻他所有的综艺
1675954791,447.04900,舞千年舞千年舞千年
1675946890,105.05200,？没什么不能说啊
1675935058,447.07900,直接说老罗 老罗的综艺他都抄个遍了吧
1675928720,253.75400,全都不是剧本吗
1675907967,175.49100,大陆能不能搞清楚粉丝和路人的区别呀？
1675871082,12.30700,不认识他谁啊
1675868556,6.63900,少了，他拍的综艺没几个好的
1675866346,455.63900,快乐再出发！！！
1675849411,175.42500,可不一定，人家炫耀一辈子
1675849347,124.62500,对啊，人家又不是不红，为啥要靠黑而红呢，那是不红的人才用的招
1675846660,179.53900,本来就没路人缘，再败坏点也没关系
1675846488,183.23900,这是在洗吗
1675846411,167.91300,……原来是在洗白啊
1675844570,354.29500,我最不喜欢这两个
1675840374,474.39100,我想推跑男，但是吧现在的跑男真的很流水，没意思，还是推以前的跑男，姚pd在的时候吧
1675831483,153.50700,看完也不知道，还是感觉很假
1675831201,291.67500,我们客栈巨生硬，背台词
1675822116,461.48000,芒果的综艺是真好看
1675787894,194.76200,……
1675786125,432.63700,可是就是有人看啊就是赚钱啊(害
1675783926,176.33900,呃呃呃
1675783685,161.23900,？？？
1675773216,175.75600,就是为了设计退红卡这个情节啊
1675767059,237.11800,但是没人选能选到韩雪这个助理演也很离谱啊，这和选个主持上有什么区别
1675766264,232.65900,怎么感觉像在给吴解释
1675765772,214.71300,刘接节目还能不知道什么类型的？别逗了。以刘的热度不可能不知道，而且以wt的习惯要是真的不说是什么节目的话，肯定会录这一段的反应
1675759644,195.07500,刘耀文最多当当爱豆什么的了，他被wt骗来的，以为是来学习，没想到好端端一个演技综艺，变成了唱跳舞台
1675757824,21.81100,给老罗版权费了吗
1675757639,201.45900,先黑红出圈甩锅给节目组洗干净不就好了
1675756284,161.57900,你在给吴洗吗
1675756122,6.71800,吴彤原名罗彤
1675754322,410.79900,我就是不懂他为什么能请那么多大咖
1675753280,144.16400,这个节目不是竞技类节目，不是演员那种的
1675750518,474.47300,这个瞬间的哽咽我真的狠狠共情了 抱抱up 加油
1675749775,52.87500,好美噢
1675747147,90.05900,这种剧本肯定会生气啊，所以你看吴彤为啥安排给范世琦而不是其他大牌明星【doge】
1675744376,207.93900,听人理性说话不好吗，非得听路温鸭子叫是吧
