1675652808,444.67700,太离谱了，你得站在高的经历上说话啊，高怎么可能选择远离，你的结果是对的，但推论逻辑完全不成立
1675652099,1245.92900,没有安欣这样的人，这个社会早就完蛋了
1675650520,795.32800,这个解读好啊
1675649705,382.48600,但是他们当时作为市场管理员，高和他们亲近也可以让自己的日子过得更顺利一点啊
1675649401,10.40200,刚看十秒钟就开始过度解读了？
1675648028,1229.01300,李这个是电视剧，别和现实搞混
1675645584,129.50000,本质就是好的人又有几个，人的本质本来就是坏的
1675644659,154.01400,共情是因为编剧很明显刻画人物的时候太偏向高启强了，用心程度和完整程度跟正面角色完全不一样
1675644187,395.78600,保护费强哥可是交了不少，而且主动，摊位就是最好的证明，强哥对兄弟两人的利用不少哦
1675644180,1397.00300,那社会是不是也应该保护坚守的安辛保护在市场受气的高企强保护在学校受气的高企盛啊！！
1675643516,711.92700,Up 真的有看剧吗
1675643461,45.46800,有些人觉得烂尾就是因为把自己代入反派了想一直爽下去
1675642854,168.34900,一个能在勾心斗角的菜市场占据黄金位置十来年的人本来就该是个有点手段的人
1675642836,867.78100,up最后把李向的特点最后解读到安欣身上了
1675642537,1213.43800,共情太限制人了
1675641659,394.69600,他要活着啊，没必要再和别人闹矛盾
1675641572,0.37900,现实的阻力越大，作恶的人就会越多
1675639882,231.18500,整个前26年的回忆貌似是安欣的回忆，不是高启强的回忆
1675638812,534.66500,巨蟹座吧
1675633310,276.13700,谁叫他尝到了甜头 这个社会难道不是这样的吗
1675625282,429.55200,后面剧里有评价，高启强心理素质非常好
1675622338,27.71700,曾经？以往现在未来，都会有
1675620354,829.40000,这个我是真同意
1675620335,597.45500,这是原创剧本，哪来的原著，那是剧改书
1675620187,1368.03100,这里解读得太妙了
1675619928,101.52800,坏不代表不能共情，如果没有社会分配问题，也不会诞生那么多黑社会
1675619115,662.29300,现实中的哥哥又有谁会花几百万给弟弟填啊……
1675618749,395.57800,???
1675617204,595.78800,就是自我发挥，很多的自我发挥，所以才说大家看到的才准，原设定不准。
1675616679,1022.36300,与其说是分离不如说是融合
1675616500,520.09900,这里是强已经知道家里没人了才这样说的啊
1675616333,646.77300,补了也没有用，弟弟还是会接着贩D
1675616137,450.79600,前期高启强的确就是现实中有点头脑的老百姓形象 没那么多险恶的
1675615665,170.05300,他没有改变，只是他的本质逐渐显现出来而已
1675615003,855.67000,李响走的那一集哭惨咯
1675614835,1297.50000,高启强穿的外白内黑 安欣穿的外黑内白
1675614151,535.55300,我也觉得他已经不自知了。
1675613878,416.95600,你把高启强直接定型天生坏种了，但实际确实是一点点被迫生活
1675613246,605.43500,哪儿来的原文？这剧是边拍边写
1675612963,945.88500,大家都
1675612952,929.59700,前面的，安欣是不是一个人，是千千万万个好警察的缩影
1675612760,1079.76600,陈书婷求锤得锤，她明明知道高是个歹毒的人，不可能受她控制，但还是接纳他，
1675612575,639.35900,是的这里我也有印象
1675612559,108.68500,想要高位必然伪善 不论黑道白道
1675612514,846.46000,对我也觉得
1675612111,536.49800,安欣后面也发觉高启强一直在用父母和弟妹的事情转移话题。
1675611847,456.77900,entj
1675611650,401.01800,他内心一直觉得唐家兄弟属于那种没脑子的，容易控制才会一直带着他们
1675611382,379.15700,有安欣  情况不一样的
1675611024,17.00400,三千人正在看
1675610645,296.58500,安欣就是太善良，太容易被利用
1675610522,1377.44100,小五值得安欣
1675610294,122.06200,伪善才真实
1675610291,543.84400,丁蟹行为
1675610134,629.86400,泰叔是你吗泰叔
1675609732,511.40100,不是高启强知道家里没人 是唐小虎不敢 所以后来唐小虎还是找没人的时候烧房子的
1675609667,1426.99900,现实中的安欣其实更多的是陆寒 
1675609559,827.05100,这段同意
1675609217,675.51800,这段剧里的原声带bgm叫鳄鱼泪
1675608777,30.13800,写得不错
1675608045,1403.59800,少归少，有归有。
1675607789,267.13200,假大空的概括
1675607736,63.17900,前几集他借安欣狐假虎威就知道他不是什么朴实善良的人，只不过是地位太低一直被打压欺负没处展示而已
1675607288,520.23800,高启强和唐小虎截陈书婷车，高启强不让唐小虎杀安欣，这点怎么说
1675605873,500.10300,还会推给弟弟
1675605318,168.69800,警戒线等于飞
1675605186,457.64800,我喜欢高启强这个人设，但是我恨高启强这样的人
1675605012,1367.66000,为了自己可以理解，为了别人的想法就很可怕，可怕到不惜一切手段，高和安本质上都是为了别人而活的人
1675604063,94.39300,不是共情，是在走路
1675603968,980.12400,一声收到战友彻底解封眼泪
1675603944,297.64300,正常人都是这种反应，过度解读了
1675603782,638.78600,我一直以为他是自己也不够钱了……
1675603494,1047.39900,追求正义之实
1675603458,9.97900,哈哈哈
1675603410,331.50600,大嫂别怕，他总归还是很爱你的（虽然我此刻也在怀疑这份爱了）
1675602995,851.15100,好有道理
1675602789,1259.02500,我想到了易小川，易小川就很明显不够共情
1675602643,638.10300,这里我也很疑惑，他家这时候明明不缺钱为啥不让弟弟立刻停手呢
1675601939,1062.64900,“在二人被剥离开的同时，他们也在合二为一着”
1675601927,100.93800,超级伪善
1675600985,494.68300,都是你弟弟启盛害得
1675600936,681.20500,徐雷的死和高启强没一点关系啊。。
1675600435,1035.33800,我悟了
1675600218,565.69800,面向其实像王宝强
1675600189,873.86500,这个点真的好好
1675599871,269.92800,对，最开始是装可怜，之后装和善
1675599626,324.26000,那是高启强自己的描述吧
1675599597,1213.26600,高启强简直马基雅维利
1675599214,100.78000,我早就觉得他伪善了
1675598838,116.53200,没有干净的人，这个理论对高启强是不不公平
1675598453,616.04600,同意一体两面w
1675597833,313.93200,高启强能当大佬安欣有不可推卸的责任
1675597579,821.03200,这个分析厉害！
1675597193,263.32700,高家兄妹都很会装可怜
1675595393,850.50100,李响是现实中有原型的，安心是纯文学创造出来的人物
1675594172,349.33800,P，那是傍上了安欣才不怕得
1675590096,372.15300,看高启强嗑瓜子时候的眼神转变！
1675590026,324.07400,狂飙的细节也太多了 前面两个part没有白拍的地方
1675589926,305.92000,李响这个我第一次看的时候 以为是他不负责 后来发现李响比安心更懂人情世故
1675589861,287.54500,李响也是个好警察啊 而且很会办案 结合up后面的李响安欣共生镜像 更觉得这处暗示了
1675581963,550.57200,此处安利唐小龙的扮演者林家川 也是张颂文的大学同学
1675581849,510.45500,这段太能展现高启强的坏了 没有底线
1675855902,1208.13800,不对，高启强高度共情。到对他而言这些都是手段和技巧
1675854589,911.20400,安欣计划很强，p什么p，infj才对
1675854477,64.23200,看了
1675849567,1220.34200,对的，张颂文演的真厉害，这个眼神体现的同情而是疑惑
1675849406,388.81900,高绝对不是普通人，否则也走不到最后，你可以说他对家人还有最后一丝良知，但他本身绝对不是你想的那种老实人
1675844044,28.81900,太对了
1675843160,1030.47100,对，而且他俩是同时死的
1675840627,407.44400,我不会 我会暴揍他们一顿
1675840048,240.51100,我的天为黑社会老大洗白不用这样，高启强不是infj，安欣才是infj
1675839111,1269.59100,养别人孩子是为了继续当工具啊，怎么看剧的？
1675837873,1212.32300,"高启强:我是很懂共情的,那是我最好的武器."
1675837376,275.19100,intj
1675836157,1403.76000,"""怎么又是这只手啊！""（bushi）"
1675833973,605.13900,磕cp的精神状态不好评价
1675833332,667.66200,有没有可能，弟弟不会接受这种方式
1675831402,88.72500,还有个最大的功劳是，我们没用流量小鲜肉一样可以大杀四方，求资本们推有演技的好演员吧！！
1675827362,662.05900,趋利避害，没有道德底线是可怕的，也许家人是曾经的底线，但面对权钱的腐蚀，底线也会晃动后退，直到没有底线彻底兽化
1675822985,388.21800,更愿意扇他们
1675819271,1213.89900,他能拉拢人脉不是手段吗？跟共情能力又没关系
1675817803,529.41100,错了，人会变的
1675816541,451.59700,他难道不是一开始就坏吗？你们不会真的认为是环境改变了他吧，环境是激发了他心底的恶罢了
1675797530,640.10400,几千万的窟窿怎么随随便便填啊.....而且高启强当时都结婚了，他想填大嫂也不可能同意好吗
1675788516,1416.55600,确实
1675788344,1235.63700,高启强给我的感觉一直都是局外人观察者的视角
1675785129,1048.48300,所以陆寒牺牲了
1675784988,381.93300,我会本能的厌恶，但是思考以后的社交，可能会有所伪装
1675782784,323.68900,过度解读了
1675780308,1053.41100,活着的人替死去的人活着
1675778135,1337.89300,说想去自首，那最后为什么没去？少看他说了什么要看他做了什么
1675776619,535.18500,前期装还有点市井小民的油滑，后期已经究极完成态了
1675775892,520.02900,......................
1675775168,530.41900,自身没有的东西你永远都学不会的
1675769991,646.59500,黑社会的钱他不想让弟弟碰啊
1675768209,855.11200,响！！
1675768068,695.40300,为什么一定要up随着你们的心意说？觉得不符合想法可以不看啊
1675767614,350.80300,博主讲的很好
1675765722,169.07800,人只有得到权力后才会展示真正的一面，高本来就坏
1675764588,674.71800,开小灵通店怎么算误入歧途呢
1675763304,248.03300,对家人的他最真实
1675761530,108.10000,嗯嗯，镜像共生指的是白色巨塔的彩铅和里见这样的人
1675759109,217.39900,21年线真的太仓促了
1675753648,407.33900,因为他们两个有用所以还接触他们
1675753430,142.52400,响！！
1675753388,116.43800,对！！！
1675749804,652.88200,塔寨东叔警告
1675747437,352.91600,你们只看到高启强的遭遇，那些被杀害伤害的普通人遭遇呢？
1675746738,534.88600,这不是应该的么，要生存的
1675746565,382.09900,利用他们
1675746175,388.30700,化敌为友也正常，最主要的是你的地位和实力要强
1675745764,561.77000,我大连聂振宇前任的爸爸也是这样
1675744351,1430.28300,永远有人自己做不到，就否定所有向善者
1675743783,1005.98800,泪目
1675742395,189.78200,3分钟过去 还没进入正题……
1675742195,121.73600,不是共情，是感慨
1675739058,511.41100,这句话出来之前我一直认为高启强走到今天是有些“无奈”一步步推动的，此刻我却看到了一个天使模样的恶魔在人间游荡让人浑身发寒。
1675738086,849.68400,因为他们存在所以要压制自己和他们的共通点反倒是死亡使对方没有了顾及
1675737002,1367.53600,他是为了保护孟钰 他跟孟钰在一起继续调查 坏人会伤害孟钰
1675735376,813.96500,过度解读的，可以去了解一下拉篇和导演到底是干嘛的
1675734961,1410.41400,谁说不存在，他存在
1675733688,542.09000,他是一步步变坏的，不能直接定义天生的坏种
1675733361,422.49000,他指责小龙抢枪害了安欣
1675730952,93.99100,这里有真人真事
1675729520,231.88900,第一幕就收手还能洗白
1675727634,652.99400,可是他前面还为了弟弟要那两万块钱去教训徐雷呢？他就是慢慢变得越来越坏的，不是一开始就这么坏
1675724083,108.19800,大家喜欢的是张颂文的演技
1675723983,581.85100,是吃面那次安欣不让小龙坐下来一起吃，不是平时的眼神
1675715676,94.02700,确实张译的戏明显没有张颂文状态好
1675713731,260.91900,对底层人高道德要求总让人反感
1675709839,1365.66800,看哭了
1675706884,640.37600,这里不认同…
1675706836,840.80600,up解读得不错，关注了
1675702092,400.88800,他本是害怕的，借安欣名头的时候也在怕，后来是绝境中的生存欲才发狠
1675700455,567.52500,笑死我了。你没权力怎么拿捏别人?？?你的仇人变成凤凰了，你不怕吗
1675698820,154.35700,夫妻 我不管
1675697693,500.09900,即使这时候不去教训人，之后也有的是契机让他走上这一条道路
1675697050,407.45400,这里小龙不是手受伤了？
1675696824,135.35200,社会上比高坏的人多得是，高算是有一定底线的了
1675696381,66.10700,他狐假虎威就不是什么好人
1675696368,66.10700,这部剧我觉得有问题。坏人的描写太完整，好人的闪光点不体现（安欣、李响被删了好多镜头，人物塑造没有反派更立体）
1675695973,923.15800,up说的这个我同意，但说高启盛是高启强就全部加在了高启强一个人身上，这不客观
1675695760,382.56900,这个还是类比不了，学生和负担着弟弟妹妹的成年人
1675693679,1214.05500,他很有共情能力的！！
1675690944,646.56900,对，剧里这里拍的是让阿盛自己填窟窿再收手，而不是帮他补上钱，真的不想让滴滴泛读就应该马上终止
1675690826,1220.06700,高启强就是共情能力太强，不出手光靠嘴拿捏那么多人
1675690778,849.90700,呜呜呜李响
1675688665,108.41500,对啊 他一点都不善良好吧 前期只是因为没权利没金钱被欺负 但不代表他一定是多好的人
1675688628,681.05700,+。-+*-+3
1675687931,494.27300,1000人心里有一千个哈姆雷特，不存在什么过度解读
1675687436,535.03800,这里他已经知道家里没人了
1675687366,323.70900,不是过度解读，就是解读错了
1675687336,813.99700,你解读怕不是中邪了？？
1675686186,931.10500,前期的现实主义者历经磨难变成了理想主义者
1675686079,80.48700,告诉老墨我想吃鱼
1675685632,1416.64700,如果他没有局长叔叔，早就磨灭了
1675685601,1386.93000,圣人不死的圣人指的是周礼下的道德败坏的圣人，也就是兵家法家这些
1675685483,372.61400,因为小龙小虎这两抬头不见低头见，直接管你的摊子，就是不想交往也不行
1675685436,1269.13000,按照这个逻辑，怎么解释不杀安和陆？
1675683664,661.80100,这段解说太片面了
1675682867,169.84800,他本来就游离在灰色地带，白色拒绝他，他灰色又呆不下去了
1675681831,72.20600,哪里的坏人会有好结局？
1675681492,847.84700,个人觉得强哥后来是当黑老大当习惯而已，都在这个位置了总不能像卖鱼时唯唯诺诺
1675680435,444.44000,有一个解说说了，强哥听到小龙是为了弟弟，强哥也想到自己弟弟妹妹所以放了一马，但是强哥确实不是什么好人而已
1675679995,395.96600,可是那时候他还在那个市场，必然要和这些人打交道
1675679981,951.65900,张译确实优秀
1675679444,395.99900,我会和他们一起玩
1675679115,338.58500,过度解读
1675678981,596.08500,小说是后期根据剧本补充的，这部剧能被看到的角色都有演员现场发挥的功劳
1675678735,513.74900,这句话我记得应该是王秘书要他放弃他弟弟的时候讲过，而这个时候他弟弟早死了，除了他妹妹他没什么顾忌了
1675678437,494.02500,他又不是从这次事件才开始改变的
1675678314,529.13500,对
1675677364,476.94100,小人物的智慧。up主还年轻
1675676792,596.80400,你上哪儿看的原著，二创是吧
1675675363,1367.62000,我感觉他不让弟弟妹妹参与的主要原因是，这个是他的做人准则吧
1675674746,855.08500,你猜他为啥不去自首，真的为了弟弟妹妹？她们都多大了
1675674534,1403.93500,太喜欢张译演的安欣了，真的是个天生
1675674290,1290.36100,所以像安心这种人，在社会上不大可能存在
1675673807,102.97500,我不共情他我只是很喜欢颂文老师的演技
1675673357,136.83400,发个有个友善的弹幕
1675672769,415.21400,很同意这个观点 一点都不过度
1675672552,1428.17900,“不存在”？一句话磨灭掉多少坚守的人
1675671095,435.25700,说up主分析的太主观的别忘了 狂飙大部分是以高启强视角呈现的
1675670562,513.52900,解读过度了，前期高启强想过要自首的，后来因为家庭的牵绊才没有自首，另外他对自己家人还是蛮好的，前提是真正意义上的家人。
1675667166,163.52100,因为导演剧中侧重点偏向反派，原剧本中李响之死才是重大转折点，16集伏笔都埋好了
1675667059,1213.72200,up可以把前后期的高启强分开来说 
1675665908,415.02800,我觉得前面这里分析得有点乱来了。。。
1675664201,674.90500,高-坦格利安-启强
1675663028,541.63800,被动技能满电
1675662731,916.44400,安心能一直这样轴下去只能说黑社会太慈祥了
1675662024,846.71300,他要去自首，真的去了吗，要看到底做了什么
1675661098,323.08800,这里解读什么 他当时是个卖鱼小贩都带电视去送人家了 还不是弱势方？
1675661088,1053.83000,行于黑暗 侍奉光明
1675660867,102.20500,从来没共情过高
1675660788,45.14200,更多，赘，重复了
1675660452,1253.26900,有共情能力不等于有悲悯之心
1675660308,662.25900,这一块解读完全不能认同
1675659890,387.66800,感情选择会和他们一起玩的都进过看守所吧，我只能这么理解了
1675659467,874.21700,红楼笔法，影子叙事
1675659247,456.16800,一个人骨子里的本质不会变的 这种转变很自然 很迅速 可以说是顺势而为
1675658572,1260.33100,共情越少，混的越好
1675658306,629.91600,高启强本质上就是高启盛，自卑与自负共生，贪欲与野心共存，高启盛是被高启强庇护下的狂化版
1675658039,681.05900,应该考虑到弟弟的脸子吧，弟弟自尊性很强的
1675657341,382.61500,小孩子 才会 这么解读。
1675656693,1227.42400,不杀陆寒是因为麻烦，杀了他没什么用，当时小陆也查不出什么来，杀了他对高没有好处的
1675656246,1403.71900,天性善良的人
1675656185,339.21400,没有过度解读
1675655893,1276.23300,救凡人是典型的工藤新一行为 哈哈哈
1675655867,795.12500,这个解读很正常啊 多简单的镜头语言
1675655729,102.79400,高启强连点渣子根本不配，伪善的是制度，高启强不过是随波逐流
1675655553,639.52100,啥 凭什么要给一个碰毒的人添坑
1675655452,170.02000,因为剧本需要~~海解读，一个电视剧爆火，人人都想来蹭一下热度，做这种解说类的，你比高启强想的还多、
1675654842,451.57900,有一定道理
1675654769,338.96200,觉得过度解读请退出
1675654590,1386.28100,6
1675654466,541.71400,前面说安欣也这样属实离谱
1675654419,27.84900,简称：真实
1675652951,330.80200,我觉得没有过分解读，虽然他早期被欺负，但一看就不是任人欺负和宰割的人
1675652467,1403.74400,京海神女哈哈哈哈
1675652359,898.90900,李响其实就是现实社会中安昕会有的人生
1675652344,1290.48400,我知道了，原来他是反社会人格
1675652141,102.15500,他确实一直在利用别人，而且从杀泰叔和晓晨这里就能看出他很恐怖
1675651530,1396.80500,安欣太理想，理想到虚假，菩萨在世
1675649258,81.24800,每个人的演技都非常好
1675649030,1035.38000,讲解的真好
1675648922,1064.11600,他知道了 要生存只能往上爬
1675648842,190.46200,黄海波李大本事啊
1675648255,128.33700,有啥可骂的…
1675646677,464.07300,扮猪吃老虎
1675646353,899.26100,饭圈是这样得
1675646079,115.71900,超级认同up主
1675643094,604.89800,原著？那有原著？好好看看书的作者去搞清楚再说！别胡说八道！
1675642542,428.76100,别一整就是被迫，社会上被迫的人不少，也没都变成高启强，他自己本身就有一定因素
1675641716,102.19500,所有的主义本质都是伪善的
1675641525,1309.60600,他刚开始不同意弟弟开小灵通店，弟弟想开，不是被逼的？
1675640405,241.03800,真的
1675634611,0.00000,up你在解读时能先看下小说吗？而且剧里台词也都改过，并非全是导演本意。
1675629743,317.32600,过度解读了吧
1675627087,960.21300,花絮里那个楼其实很高是三楼，拍出来不太明显hhhh
1675626756,639.81400,啊，这边我当时看到时候我也不理解，就明明有很多种方法可以立刻制止，但是她哥哥明明那么在意这个事情却没有
1675626304,1378.00600,小五
1675621301,388.39100,唐兄弟对他以后卖鱼有好处
1675619293,388.65000,但是高启强的性格塑造确实有很特殊的背景，这也是让观众产生矛盾的地方
1675618968,625.45800,泰叔
1675618704,456.56500,那会安欣劝他自首他确实动摇过，但是最后还是一念之差想要投机取巧去赌一把
1675618636,519.92400,因为这里他已经失去了弟弟和老婆所以才会黑化的
1675618397,1053.47300,强行分手，以为要拼死一搏，结果装死10年
1675616991,551.30700,他每次回忆父母的时候都在博同情，看到后面真的很烦
1675616632,529.46500,但我觉得他的人性也是在后面慢慢剥离掉的
1675615471,141.40300,响哥
1675614722,1022.64600,确实，两个镜像都消失了。归还到了高启强和安欣身上。
1675614622,519.95900,21年的他确实没有一点感情了
1675614332,52.13100,用配音修改的剧情也没有到烂尾的地步，一群人烂尾烂尾的喊，好像如果没做到最好就是最差
1675613794,813.87900,哇哦，这样解读确实也很有意思
1675613488,966.02600,我才发现郭局原来一直在啊
1675611764,596.44100,原著就是剧本啊
1675611456,674.96100,卖小灵通等于误入歧途？
1675610663,500.01800,过度解读
1675610203,830.39300,和李有田父子饭桌唱京剧一样
1675609747,121.06900,大史说得好，当你试图与你的敌人共情时，你的是非观就会受到很大影响
1675609552,396.00000,龙虎对他的狠还不如高自己对自己的狠这样？那确实蛮狠的
1675609483,303.53900,这里不苟同，认真看完，这里的高没黑是老实人，结合剧情是符合安欣此时心境预期的
1675609400,102.15000,是的 从他开始蹭安欣面子狐假虎威 就开始了
1675609394,400.80900,难道一定高启强害怕才代表他可怜吗
1675609138,513.31600,这里分析不对，这是后面的事情了，人物的性格发生改变了
1675609066,268.29400,确实，一开始是这么看的
1675608813,1228.02500,那些说现实中没有安欣的，其实我们生活中已经有太多了！
1675608504,1234.41100,现实中的“安欣”们 永远致敬！
1675607443,1410.86400,这种人是存在的，你我做不到不代表着世界上不存在
1675607277,1246.13800,三连给你
1675606856,830.39000,牛的
1675606732,479.79900,能当老大的人不可能没有魅力
1675606531,121.07600,角色有魅力不等于跟角色共情哦，这种想法正是审核机制存在的原因
1675606008,976.55900,赵立冬整个慌了，第一遍看的时候我以为他完了
1675605557,807.60000,说过度解读的，“让子弹飞”又被解读了多少呢
1675604241,296.09900,李响派出所上来的
1675604206,794.99500,前面那个觉得过度解读的，一部好的电视剧，在镜头上有一定的指向不是不可能。况且有解读更说明拍的好
1675603685,829.99000,和我理解的一模一样
1675603329,268.68100,我一开始看的时候就觉得他总是在安欣面前装可怜
1675603288,494.41300,说装可怜的，这时候还有意义吗？
1675602802,444.55900,那些恐怕不是回忆，就是客观事件
1675602616,275.17900,童年经历罢了，混世必备技能
1675602301,268.32400,infj
1675601773,388.05800,当然是后者啊，你怎么远离他们？转学？否则过几天他们就又来欺负你了懂吗，因为他们怀恨在心，学校也好社会也好，没有人会一直保护你
1675601391,436.61900,我靠，他骗了所有人，包括观众
1675600892,16.01900,剧本也不错
1675600621,1208.66900,对！
1675598088,946.49600,李响死的时候俺哭惨了
1675597914,211.92600,如果第三条线，15年的那条拍完整了，就符合起承转合了
1675596642,464.91500,就是试探底线
1675596113,317.20600,这个就没啥细思极恐的吧，破烂的电视，小龙的话都可以佐证这些
1675595988,450.95100,好有魅力的一个角色
1675590071,359.15600,心里其实压根不害怕这俩 那时候性格就显现出来了
1675589663,128.23900,说得好，惨不是恶的借口，恶就是恶，是一以贯之的。从强第一次狐假虎威开始。
1675588023,315.85900,哇去。。。。还能这样，真是细思极恐了
1675587462,1276.34500,是啊 如果不是安欣的坚持 黄瑶不管怎么举报收集证据都无法撼动高启强
1675583762,1296.62800,江阳哭死
1675583079,1296.90100,江阳永远的意难平
1675582514,713.48700,原来如此 所以弟弟的戏份其实都是围绕高启强塑造
1675582273,1430.62700,UP主说的太好了吧，太正了
1675582258,639.84300,woc这地方我看的时候没想到
1675581781,479.53300,还不忘卖可怜
1675581546,381.82300,后来好几次镜头也是给到高启强和小龙小虎打牌
