1675604571,1129.10000,程程是一个要面子争强好胜的人，她抹口红了，她选择自我走得体面
1675604513,1092.98000,收了谁身份证？
1675604446,1039.46000,我悟了，原来黑白相交的头发也在说明着这一个意思
1675604429,1196.87800,这个人类在哭什么？
1675604324,745.45600,最真实的地方在于明明是自己想得到非要觉得是为了保护弟弟妹妹，说到底还是视野受限
1675604282,109.33500,你对他共情了，他就赢了
1675604114,1464.69400,说的太好喇叭
1675604064,933.44500,我每次看到这段都会起起皮疙瘩
1675604025,298.73800,李响才是和龙虎兄弟早就认识 偏袒的那一个
1675604018,823.94500,其实我唯一不懂的是盛为什么前后变化这么大？到后面的行为不像是一个高级知识分子能做出来的事
1675603917,758.58600,也难怪他们之间有那种粘连感，但是不同于小虎小龙之间的互相扶持
1675603857,992.63000,张译老师太有才了
1675603828,1182.35700,我们很多普通人内心并没有高启强。。。
1675603706,1495.10800,安欣怎么害孟钰了，嫁给杨健也是孟钰自己的选择啊，这个怪安欣吗
1675603705,731.95700,很久没看到剧情逻辑顺畅严谨且演员班子那么专业用心的剧了。它不火天理难容
1675603673,1188.30900,前面的，安欣也有社会原型的，现实社会还是有理想主义者在坚守
1675603635,366.12600,对啊，对于一个欺负过自己的人就算之后对自己示好，那也不可能心里不会不厌恶吧
1675603468,1119.98000,我有个疑问，老墨到底有没有杀程程
1675603385,1543.37000,不要变成高启强
1675603363,1530.31400,太难到达的境界
1675603316,1503.81800,太心疼安欣了，也万分感谢现实生活中的“安欣们”
1675603280,363.44900,唐氏兄弟第一次去高启强家等他的时候 高启强是把钥匙夹指缝中以防不测的 应该是怕被打
1675603112,1554.39800,剧本牛，演员演技牛，才会成为爆剧
1675603044,117.68900,不是，角色有魅力可以欣赏也可以喜欢，但是这可不兴共情啊。。
1675602990,768.84200,这里的铁栅栏仿佛让高启强在和自己的心魔对话
1675602910,1488.16000,张颂文演的太神了，真神演技
1675602810,1493.33900,安心害了孟玉，这点必须承认，因为他孟玉搭上了一辈子
1675602680,1530.29900,这两个人物塑造的太好了
1675602613,1474.37900,这里演的真好
1675602604,1523.27000,26集黑帮剧，39集神话剧
1675602403,736.69300,只怪张颂文演的太好了，高启强从一开始就不是什么好人
1675602309,1146.68100,马云表示很赞
1675602274,601.37000,张颂文赋予了高启强太多生命力，导致人们产生了高启强是个重情义的人，只能说张颂文太厉害了
1675602184,654.90600,Up的语气像是幼儿园老师
1675602147,1183.70500,安欣这种角色只有文学性，没有社会性
1675602140,1057.44300,响子
1675601973,1149.79000,欣响事成组合
1675601963,1174.98100,但是也是镜像共生 一部分安欣+一部分高启强=普罗大众
1675601961,968.05900,李响死了，也就是理想主义死了
1675601844,862.31900,李响牺牲真的太难过了……
1675601656,642.77900,亏了非常多钱，补不上
1675601626,290.25900,不可能，后面看出来了，就是被欺负的
1675601573,398.17900,所以高启强才能当大哥
1675601487,1115.15900,唐小虎聪明
1675601454,1433.81400,徐雷不是被高启强意外杀死的
1675601431,985.24200,这集剧情，简直是全剧爆点，没有之一
1675601401,1197.17800,这段指挥交通爆哭
1675601067,1140.06400,他把李响仅存的一切背在背上整整十五年
1675601055,1541.43000,讲的好好
1675601003,786.81700,门上还有钱币的图纹
1675600967,496.26800,这是习惯性把错误推给环境，让自己安心
1675600929,35.73900,黑社会被打掉就叫烂尾了？什么三观
1675600835,1369.57900,完成了人性向神性的升华
1675600586,1139.93900,！！！原来一直将理想背在身上
1675600585,1174.31700,确实目前最佳，解决了我的疑惑
1675600534,1135.05000,李响没有离开，永远和安欣在了一起，我爆哭
1675600510,919.15700,这段手机外放是张译设计的！！！
1675600472,104.24300,现实中一样，人善被人欺
1675600219,833.61900,你币有了
1675600119,465.97500,高启盛是他内心恶的投射
1675600113,741.63900,分析得太好了，弟弟就是高启强心里的魔鬼
1675600111,733.22600,说的太好了
1675600058,720.87900,符合逻辑
1675600045,439.28800,拍出来的就是真实的！至少这部剧是！可能会断章取义，但是确实都是真实发生的
1675600013,363.54900,肯定不害怕啊 当时只是因为收费发生矛盾 龙虎也会是小混混还没有变成黑社会
1675599770,272.29000,这就是张颂文表演的高超之处
1675599614,323.34000,细思极恐
1675599538,1165.59800,解说的太棒了，目前最佳
1675599172,1530.13800,孤勇者
1675598886,1530.76800,惨烈啊
1675598549,676.23300,他弟都没跟他哥透露实际的亏损额。。高启盛的自尊心太强，他哥不敢太逼他
1675598340,470.08500,就像killing eve里的eve
1675598141,854.90300,现在看见我响就想哭
1675598061,1550.35600,快更新！！
1675597319,51.03400,张译本来就很火了
1675597029,1497.20300,呜呜呜安欣
1675596811,1146.23200,小背包…出场就是两个人啊
1675596780,486.40000,我觉得这不是卖可怜，人之将死，其言也善。
1675596223,1164.79900,泪，拉了出来
1675596048,1470.16800,镜像中方向互转
1675595567,1440.95900,可惜了，只能两个币
1675594472,456.47900,徐磊死的时候，他敢回去擦指纹
1675594024,365.29800,高启强本来就是宋江一样的人物
1675591191,978.02600,李响给安欣的遗书 也喊他“战友”
1675590993,518.65900,龙虎兄弟只是小混混级别，被强哥影响走上了犯罪道路
1675589970,282.47900,李响从基层派出所上来的 很懂
1675589941,669.33500,他弟弟都已经卖很久了，早没有回头路了，有这心思和钱不如想办法
1675589768,1476.66000,这里真的演得太好了
1675589749,1465.22700,真的耶
1675589652,1372.68100,呜呜呜真的太辛苦了，太让人心疼了
1675588892,1551.96100,加油啊
1675588883,1551.49600,宝藏up快火起来
1675588873,1547.42700,三连了！！太棒了这一期
1675588838,1540.99900,何而为人 听着莫名想落泪
1675588808,1534.41700,想到了江阳 世界正是因为有他们才会一点点变好
1675588784,1526.41700,up太会说了
1675588777,1524.92700,所以狂飙很牛啊这剧
1675588763,1521.50600,真的是这样 就是太惨烈了
1675588713,1472.82900,全剧最为真实的情感展现！真的绝了就是这样
1675588683,1472.82900,张颂文老师演技太强悍了
1675588605,1411.44300,说得太好了woc
1675588589,12.97100,up这期真的讲太好了 我看的时候一直不理解高启强 云里雾里
1675588045,1456.54900,分析的太精彩了
1675587834,1422.56900,所以我更喜欢心疼安欣
1675587359,1240.21200,说得太好了
1675587348,1226.18900,觉醒年代！
1675587251,1162.75200,没错 高启强和安欣从来就不是一路人好吗
1675587233,1158.28900,痛 太痛了
1675587215,1143.33000,“却在精神上完成了镜像的合二为一”
1675587170,1129.51000,响欣cp每次出来 都想落泪
1675587144,1111.76000,高启强成了新的藏在暗处的庞然大物
1675587128,1107.84900,深深把握着基层公务员和退休老干部啊
1675587111,1103.21400,太会了高启强
1675587091,1088.19600,唐小龙收了她的身份证
1675587021,1058.82700,“在二人被剥离开的同时，他们也在合二为一着”
1675587016,1058.26100,“在二人被剥离开的同时，他们也在合二为一着”
1675584631,1536.92600,讲得好好呜呜呜呜
1675584113,1548.14800,哈哈哈哈哈哈，up不兼职了
1675583610,1510.88400,逆转：把思维逆转过来，用另一种方式思考 ——逆转裁判
1675583544,1510.88400,逆转
1675583025,953.51300,这段真的太绝了
1675583024,836.46000,弟弟主外 哥哥主内么2333
1675582742,740.48800,弟弟工具人，演出了自己的疯批
1675582583,747.85300,是啊 现实中培养出来的弟弟早出去自己打拼了 很少回来带哥哥的 更像是另一个自己
1675582528,738.10900,6
1675582047,127.25900,up主是高启盛哦
1675845784,563.13900,前期讨好高启强他就有点扭捏
1675845087,833.35100,上班后的我.jpg
1675841123,517.60900,这句话是后期配的音
1675839927,390.04000,不挣钱养家吗？
1675838378,912.82800,安心才是妥妥的infj，希望世界和平每个人好的小老头，精神导师
1675835905,1215.96100,这点没错，高启强，既缺共又缺情（某种意义上）
1675835656,1003.15800,新会人民会堂
1675835334,920.30200,真的很烦某些人到处把复杂的人心归结为简单的几个字母
1675834784,151.33900,长兄如父
1675834482,448.82300,要是再扯好坏定义那可太早了，现在没有up讲这个的
1675834418,426.82300,"高启强相比""狠""，应该是有大局观，关键时候不慌"
1675833808,1027.13600,融合，这两个人从此完整了
1675833064,530.76000,高端的猎人往往以猎物的形式出现
1675830638,665.75500,他要是这么自私早就不管弟弟妹妹自己出去浪去了，还至于 一把年纪对象都没搞过
1675830490,1018.18200,所以盛和响一定会一起死
1675830060,300.95900,最扯淡的就是：人民群众都是对的都是无辜的
1675829410,383.38600,远离伤害来源是生物的本能，不远离说明心理上不惧怕。
1675827120,133.17900,对他真的很伪善   狡猾  自私    为了自己家不择手段  害了那么多人命  包括手底下干活的人他通通能拿他们挡剑
1675825895,585.46900,‘哥哥’
1675825723,1216.71500,高启强只能“看见”，但他不在乎，他只觉得你可以利用或者可笑
1675824929,800.89100,说过度解读的确实不懂视听语言
1675824498,1242.04200,但是高启强没有悲悯之心。
1675821759,132.57900,人的本质不是好或坏，而是自私、共情，其二者交织出道德观、人生观
1675820270,891.98300,李响更值得人佩服，背负太多，还能忍住诱惑面对危险
1675816877,504.45000,也没有up说的那样吧
1675814575,517.48200,这个解读忽略了人物的成长性。不是后来他是个坏蛋，那么一开始他就是个坏蛋的
1675807901,546.78600,过于拟人wwwwww
1675798912,112.17900,不是伪善，是时代壁出来的一个人。这部剧最大的剧情就是高启强为了生存一步步靠近权利中心。
1675791780,454.82300,太同意了！他总想征服所有人
1675791627,1302.76000,江阳不是安欣，是陆寒，执着、善恶分明但没有背景。人家安欣是警察中的太子，除非没脑子，不然不会有人傻到去杀了他
1675786509,70.33400,张译的演技还有人质疑？？？
1675784465,1435.30100,现实生活中有一些安欣，有些可能比安欣还欣，他们不一定是刑侦，可能也只是某些人的人生片段。只是通常不为人知罢了
1675784408,1216.12900,我觉得高启强有，但是早已经被沉重的抚养责任和环境的压迫磨灭了而已
1675783010,1372.21300,可怜的孩子
1675781024,1423.43300,谁都有坎坷与不公！！坚持下赖守住内心的就是英雄！反之就是恶！
1675780053,1239.25500,升华了升华了
1675778293,212.37500,总共26分钟，三分钟都看不下去的，右上角呗
1675776863,42.52200,主要是没有任何铺垫 突然就被黄瑶打掉了
1675776070,389.69400,不是，他当时只有卖鱼为生，不装作愉快的玩耍，他能呆的下去吗？
1675773242,390.01900,化敌为友
1675772842,1306.10700,中国的发展经历了太多曲折
1675772040,903.39200,最纯粹的善良和正直
1675769793,59.95000,张译本来就是视帝影帝，火到顶了
1675768203,679.18600,代入一下自己的亲人，就知道“因为弟弟自尊心强所以哥哥就不提想要帮他”这种解释有多站不住脚了
1675764845,854.34700,黛玉晴雯…
1675763435,817.90400,徐磊电鱼死让高启强意外获得金钱和之前误打误撞让他成了安心线人获得市场地位一模一样，就是不断催化他的心态
1675763393,1421.84900,没有局长叔叔，安欣被埋到地里也不影响他是理想主义者，不用杠
1675762755,376.96600,霸凌的同学关系可不会管着我的摊位和我的饭碗
1675760970,546.90800,任何人都只从自己的角度出发，不然那是神
1675760678,905.48700,不然为什么李响和弟弟死一块二呢 然后高启强和安欣都变了
1675760084,346.49100,高启强怎么可能一开始就那么坏啊
1675760071,383.77300,有没有一种可能，远离他们他们也会追上来，而告诉他们其实和安欣不熟会立马变成原样继续被欺负...
1675760069,555.24200,高启强这要是在古代绝对是帝王级人物。而且绝对是个好皇帝，肯定能开创盛世！那些经世的道理他太懂了。
1675758634,633.55900,高启强的粉丝们该组织去劫狱或去陪葬吧
1675757039,377.04000,因为他知道唐家兄弟怕安欣啊，如果他躲开的话就等于不打自招了自己没有靠山，之后只能更惨啊
1675756244,920.50300,到现在看这段都很激动
1675755675,864.23400,有没有可能安欣有
1675755506,41.63500,身份认同这词出来就知道你是学影视的了
1675754643,539.59300,龙人性>虎>强
1675752518,539.34900,感觉是个黑化双鱼
1675752100,383.15600,我还真可能去打牌
1675751821,140.32000,响子，呜呜，真的怜爱了
1675750552,1352.94600,但罪不可赦也是真的
1675749811,469.46900,如果是安欣在高启强这个位置的话，我觉得安欣是不会和他们打交道的
1675746635,384.24700,人是复杂的，这解读太主观了
1675743667,525.69000,这就过度了吧，高启强在13岁的时候父母就没了，弟弟妹妹全是他一手把持大的，他要是不会察言观色，他要是不会善变的话，他怎么能活下来的？
1675743296,1232.25600,普通人会共情黑社会吗？不更应该共情李顺李青父子吗？
1675735656,1421.55400,安心这个人物太理想了
1675735234,184.70000,你知道莽村的莽是怎么来的嘛
1675734652,1057.38900,可是李想死后安欣推开所有人啥也没干
1675731670,111.88800,他的胃口是一步步养大的
1675731666,406.13900,因为小龙小虎一直打探他和安欣的关系，如果被发现其实没安欣照着他又要被欺凌了，他当然得周旋讨好他俩人
1675731544,103.81200,我也无法共情
1675730952,412.61300,狐假虎威不应该表现的淡定吗？
1675730823,798.68600,这不叫强行解读，这就是最基本的镜头语言。
1675729980,1375.83500,这样的人可多呢。我爸就是！我很自豪
1675729203,578.17900,安欣是不想搭理这种欺软怕硬的人，内心很排斥这种人。
1675727363,469.46800,他真的不是很坏很坏吧……之前要去教训徐雷，他都没直接动手，本来是想和他好好谈谈的
1675725261,178.22800,高启强是天生的反社会人格，他很善于伪装成正常人
1675724130,119.55800,他演出的人物是立体鲜活的，太有魅力了
1675715954,709.45900,up捅了高启强粉窝了吗
1675713967,665.48900,掏钱弟弟只会fan更多毒只到强破产，强应该会预料到这点
1675709685,266.34500,哪个都是他，然后根据环境做选择罢了
1675709376,818.87800,秒啊up 你币有了
1675708811,48.93100,响！！！！我们响子
1675708513,77.24600,起墙太让人崇拜了
1675708427,626.32400,泰叔
1675704591,1334.16800,妈耶 这剧还不黑白分明？前面觉得自己是黑道大哥代入进去了是吧？
1675703996,383.13300,愉快的打牌玩耍
1675703773,20.76000,看剧的时候也觉得高启强是个彻头彻尾的假人
1675701559,280.46700,对，以退为进利用安欣的同情
1675701448,322.47300,这里过度解读了
1675700766,798.69600,哈哈哈哈。人家不想发达吗，很多是无奈。
1675698644,1263.38900,..我基本没有
1675697931,497.93800,同意，他和老白很像，靠近他的没一个好下场
1675697339,379.14400,那是学生的反应罢了，不是生意人的反应
1675696928,1041.15600,我去
1675696230,665.70000,高启强观念里卖毒就得吸毒，然后吸毒利润风险极大死刑，这是超过底线和他能把握的事情。
1675695765,1392.06100,我觉得高启强和安欣就是相爱相杀的关系
1675695591,84.64200,前期就狐假虎威了，仗着自己是安欣“线人”身份
1675694914,76.93900,高启强是被压迫过，但他靠着压迫别的穷苦人往上爬
1675693242,377.68900,那是在学校，我感觉出来社会后有工作压力还得养着弟妹的人，肯定会审时度势的
1675692500,86.24100,说没压迫的家里条件很好吧
1675690869,925.69300,高光
1675690713,84.17400,第十二集认贼作父开始，他就不是被迫犯罪的人了，而是主动选择
1675690671,19.73800,从王力出场 衔接自然就跟这剧诀别了
1675690181,272.67900,infj内核悲天悯人拯救世界，不一样
1675689724,546.25800,主观臆断
1675689183,70.35100,可以的
1675688727,826.30300,妙啊
1675688021,357.96300,从小认识知根知底会怕但不会特别怕
1675686770,427.10800,不敢苟同
1675684993,860.28200,一个人有背景，一个人没有
1675684629,1382.31200,太惨了
1675684334,389.56100,他还要卖鱼啊 你让他怎么办 我还要在班级里面啊 你让我怎么办
1675684329,949.13800,响
1675684289,686.09500,徐雷死的时候只有高启强在旁边，电视剧里是意外，但有深挖的空间
1675684232,985.51600,战友
1675684059,434.02900,过度解读
1675684047,1294.98800,说没救李青的，你摸摸良心，要不是莽村人使坏，安欣也救了李青。安欣毕竟不是神仙
1675683955,1302.48000,那样老默也不会共情咯
1675682976,994.17600,怎么有一个身高这么扎眼？
1675682832,531.05400,这是只要对自己的人好就行了，不需要对别人好
1675681320,377.94600,高启强本身就是个能力很强的人，根本不害怕龙虎兄弟，这点参考蜘蛛侠。
1675680084,819.66000,镜头语言就是传达出一些东西来的，什么都是过度解读？？？
1675679960,656.63200,已经开始卖了 掏钱有啥用  
1675679837,1423.77700,up的意思高启强就是生来就是恶魔
1675679354,497.90400,我感觉up有点过度解读了，很多人并不是生来就一个样的，结合所处的环境，我觉得更多是环境把高逼成一个什么样的人再加一点点的贪念导致底线越来越低
1675678924,570.63300,唐家兄弟俩就是混混，而高启强是被生活压迫的人物，完全不是一个位面，从高家弟、妹都是高材生也能体现这两家不一样
1675678811,390.13100,和他们玩去欺负别人呐！
1675678764,715.95800,两个人的性格都不一样，
1675678463,1407.40200,高启强只是普通人，但安心是个圣人
1675678406,483.97800,剧中有很多刻画他心里变化的，这里真过度解读了
1675677856,1273.95500,所以这部剧让我产生恐惧感，恐惧并想逃离，源自于高家兄弟部分
1675676800,103.60000,高启强身上有我们每一个人的影子
1675676737,383.45500,我觉得是为了生活不得不这样
1675676422,396.62100,"他们坏或者狠与我无关就行了,这才是人性"
1675675208,812.79300,有些人死了以后，后人就可以尽情杜撰野史了
1675672066,280.66900,曹操本人
1675671996,3.53300,爱死颂文了
1675667932,245.80000,一直没变，实力未到而已
1675667708,833.48200,上班的我
1675666765,504.23700,好多评论都喜欢说他是被迫被逼无奈的 其实都是他自己选的
1675666604,1232.30000,他是聪明能看得懂能伪装 但本质是一个冷漠的观察者
1675666467,175.80500,文采好，文本成熟叫拽文词太多
1675666214,322.81200,这有啥细思极恐的
1675664753,650.14200,他要真是不愿意弟弟碰毒，就会拿自己的钱填窟窿
1675664379,307.59200,李响：这种事，我原来在派出所见多了
1675663703,539.59800,没什么错啊？
1675663296,1280.56000,我救他谁救我
1675662914,1295.12100,借口罢了，很多人接触了社会的黑恶，也没选择犯罪
1675662834,1362.34100,有点想哭
1675660202,679.04300,共情？
1675659934,200.80500,这年份配事件让我突然想到了流浪地球
1675659377,193.57100,原来是他
1675659069,14.45900,说过度解读的，麻烦去看镜像理论和弗洛伊德及相关欧美文学著作
1675659024,252.53200,都是真的
1675658866,1056.90600,呜呜呜呜呜呜呜呜
1675658632,1281.50000,但是李青他没有拯救
1675658268,843.03800,是的，我之前认识的一个人就是这样
1675657591,124.78300,高启强在自己被伤害的同时伤害了更多更无辜的普通老百姓 ，只是你没有看到或者选择看不到
1675657534,252.62200,你看曹操不也是一步步成为枭雄，人是连贯的不是割裂的
1675657270,282.62600,经历使人成长
1675656996,328.10600,人是复杂的，不是纯好纯坏，不就是最深的人性吗？
1675656959,291.00100,每一个都是他，每一个都是真实的他
1675656426,618.70200,原来制片人是泰哥啊~~
1675656394,688.67000,我觉得高启强在徐雷死的那段戏很耐人寻味，他知道擦指纹，而且表现的相对冷静
1675656218,1371.99600,有神性没人性
1675655187,412.59800,？？？？？
1675654894,310.47000,我们一线真的像李响说的这样
1675654686,860.19800,高启强后面不是也暗示老默去杀安欣，老默没同意罢了
1675654411,703.76800,他前期想过自首哎
1675654400,343.57800,高启强真的很会隐忍伪装 鱼腥味他最受不了 却能卖鱼七八年
1675654270,525.62400,这个时候已经开始强行降智了
1675653591,103.69800,我也觉得他伪善
1675653501,642.35100,对啊，我当时也想他为啥不直接拿钱抹平，把他弟弟拽出来
1675653020,961.58000,BGM不错
1675652770,801.08400,过度解读哈哈
1675650577,940.12400,李响比安欣更值得尊重。
1675649662,642.61900,自以为是的解读
1675649546,789.57300,同意
1675649366,642.56500,？高启强说过他弟弟自尊心强心思重啊，他给弟弟吃面自己喝汤是伪善？
1675649358,175.80700,老默从一开始就知道自己的工具人属性
1675649026,3.90700,宝藏分析
1675648256,397.20300,主要是他當時還在市場賣魚啊
1675647421,397.77900,剧里说了，他们从小一起长大的……应该很熟悉
1675646441,833.04300,人设应该是没感情，但是演员有感情
1675646177,671.79800,我有1000块就可以给弟弟100块，这个不是都能做出来也不是都做不出来
1675645381,1255.55600,我已经没有了
1675644918,119.17300,其实根本没人共情高启强就是有一些人又想去道德制高点骂人了
1675644559,1340.87700,高启强这个确实太过了，太绝对的坏，不可能是天生的。确实他弟对他就是累赘
1675641793,111.36500,伪善不全是社会压迫造成的，自己人品问题赖社会赖得着吗
1675641701,1319.65400,他有想过自首的，up这里的解读就绝对的黑与白
1675640255,383.16400,up的意思是他不让弟弟进建工集团是为了保护自己的恶吗，不让释放吗？
1675639854,531.37900,社会现状给他了他反馈，老实人不如狠人过的好
1675638876,14.77900,别小说小说的了 那玩意是根据电视剧写的
1675630596,1310.66900,高与安二人，像极了普世价值与康米主义的对立
1675630354,812.95200,这并没有过度解读。。画面语言很明显了，你当导演不管这些细节，直接拍嘛？
1675629680,405.89000,这绝对是过分解读了~真没必要
1675629575,383.50100,那就问你这鱼档开不开？不开你就可以远离了。
1675628593,837.00000,生动形象地诠释了外人眼中的infj是怎样的
1675624503,657.25600,是因为这个利润太大了，会影响内部团结结构
1675620711,389.67100,我的经历就是干回去，最坏也就是一起被警告，打了两个人事后也就一份检讨
1675620100,600.72000,演员拿的剧本就是这样的剧本啊
1675619018,641.93700,我当时看到这里想到的是 高启盛卖彩色药丸是在小龙的游戏厅 就算出事 也可以让别人顶包
1675618554,454.80700,我觉得过度解读了 他其实就是一
1675618251,1211.72300,他洞察别人的感情，但只是利用，没有悲悯
1675618086,272.69400,说跟安欣脱不了干系的那也是他利用了安欣，关安欣什么事
1675617872,405.63500,前面送礼物讨好不成就动手，你就知道他到底是什么性格底色了，看人下菜碟，就这样
1675617620,103.83900,战歌来了
1675617424,1031.92000,理想死了
1675617359,1241.98500,the more I love，the more I suffer
1675617220,125.87900,笑死了，对高启强不公平什么？不公平在他没压迫到你头上？
1675616328,1225.98500,高启强为什么不杀陆寒
1675616113,257.12100,infj
1675616002,336.29900,感觉过度解读了
1675615272,903.45000,真的非常善良的一个人 可能是少有受到欺骗
1675614858,103.62000,认干爹做恶人换来的爽，背后是无数人的悲剧
1675614659,434.49400,害怕鱼腥味儿的人开水产店
1675613953,1414.86400,学做圣人，迎接大同
1675613930,98.77000,循环。高启强怎么对泰叔的黄瑶也要这么对高启强
1675613023,1285.66600,高就是个恶体，早晚变坏
1675612832,1274.30200,我要是小时候受过高启强那种苦，我也不会对这个世界存留一丝悲悯，从来就没有天生的坏人
1675612608,34.83000,如果还没写完就交白卷吧。。。
1675612461,642.14500,对！当时我也在考虑这个问题
1675612298,146.60100,共情是因为我也要吃饭， 我也想有好生活
1675612045,448.99400,这话我不认可，小说也表明送电视机被打是真实事件，并非高的回忆
1675612024,1211.79500,这个镜头高启强脸上更多是疑惑
