1675587543,1293.79600,江阳和安欣 真的是国剧中让人无比心疼的两个人
1675586934,1018.89500,说得太好了
1675582288,655.98800,高启强对弟弟都不如唐小龙对小虎
1675582180,507.25000,细节！
1675581994,563.31400,唐小龙唐小虎压根玩不过强哥
1675581976,165.02800,这个镜头绝了
1675581825,497.53700,其实本来去教训人换钱就是不对的
1675581799,41.24500,开播第一天就看了
1675581597,390.64800,所以高启强的认知和评判标准从来都是很低的 只不过前期他太惨了
1675855614,1032.71100,“从那一刻起，我心中的那个xx死了。只剩下了xx”
1675854392,410.95700,这是同学和同学么？这是同学和老师的关系
1675852258,273.59900,就是天生如此！换做别人即使同样的环境也不一定同样结局
1675850261,425.60300,隐藏啥啊，看脸看不出谁挨打啊？
1675845279,1003.80500,对不起 我第一次看成了人民食堂
1675844307,643.71500,填补了怎么跟高叶交代
1675844107,453.45500,为了流量说一些自己都不信的话
1675841449,691.71000,你看没看剧啊。。
1675836989,699.53200,每个人想法都会不一样，合理就好
1675836753,216.99300,对，不同时代他们用的通讯工具还有社交媒体都是不同的
1675836024,1300.68000,"""路不同，不相为谋"""
1675835129,791.52000,同意
1675834579,509.30100,"那么多次机会不选，非钻这个牛角尖，所以""差不多一样"""
1675834157,439.69600,我也觉得过度解读了
1675834145,279.41900,infj＝悲天悯人？ssw
1675833858,1077.11400,太对了
1675832341,852.91400,他想去自首但是他弟叫来了妹妹一起吃了一顿饭 高启强就又犹豫了 如果安静
1675829360,237.71900,突然才发现孟钰的名字也谐音梦遇啊
1675829138,172.64200,刚才那个镜头是张译设计的～
1675829032,1046.47300,当代徐阶
1675828311,145.49800,你没见过，不代表安欣这类意志坚定的基层干部不存在
1675824889,1369.69400,张译老师啊啊啊啊
1675819647,375.70700,本来就是一个厂区长大的。高很可能还是他们的哥哥，年龄上看
1675819432,832.31200,分析有点想法
1675817610,47.65000,也不算烂尾吧 只不过黄瑶那条线没怎么埋 最后突然举报显得突兀 但其实逻辑是通的
1675817265,306.91100,确实
1675816078,97.65800,共情？
1675807611,264.96800,都是它，人是会慢慢变化的
1675797766,831.48100,不是说你不能说他们镜生，但是你要说为什么他们是镜生，不是只下结论不分析
1675797386,515.89700,但这已经是二十年后了啊 up逻辑好混乱
1675794797,1404.93400,悲悯这个词，是神对人的情感，安欣配得上这个词。
1675792139,1424.98500,有 缉毒警 我们的人民子弟兵 包括普通人
1675791684,467.71700,双鱼座
1675787767,806.95600,开吵！
1675787743,1300.58300,杀我别用江阳刀！
1675786382,831.79500,对弟弟的放纵，就是实现另一部分自己
1675784692,244.93900,这是伪装？还是真实的改变？
1675784524,375.85700,可能，每个人都有属于自己的观后感，但是这里我个人觉得你打的比方有点牵强
1675783575,180.06600,导演艺术细胞不错，人品可能就，，，，
1675783491,138.72600,我感觉这个解说可以成为论文，真的，角色理解塑造的论文那种
1675782833,969.75900,改戏份是后期疫情的时候了，怎么再叫这么多人跟你一起重拍啊，演员自己都说是按照时间顺序拍的
1675782290,132.27300,高启强是手段更高明的李有田父子
1675781974,306.83200,对啊 办案就该这样
1675781324,1056.20700,好感动555
1675780288,1334.55300,配乐不好
1675780149,1311.23300,升华了升华了
1675779150,385.34700,一起…
1675778492,124.13400,本来开局那么多人物，最后呢
1675778220,399.67600,不太认同
1675776590,333.62700,沒有過度解讀，高啟強就是很會演，甚至是他不自覺就開始演
1675776483,1056.24000,你币有了
1675775255,105.22300,我也是看的时候很不舒服 没法共情 多次突破我 的底线
1675775112,497.09900,但凡你记得那顿饺子你也不该做那么多坏事
1675775009,411.09900,Up说的有道理的
1675774395,109.69900,对的
1675772771,1287.93800,前期是被逼的，后面就是主动作恶了
1675768120,935.36900,张译真的很牛
1675763673,838.06300,苏大强
1675763295,677.66600,高家三个，一个伪善自私冷血一个发疯批一个工具人
1675763169,1224.20000,谭思言不配在天上看安欣是吧？一到这个镜头就替响没完了？
1675762960,342.18300,高启强他就是喜欢表演弱小来博取同情
1675761922,798.35600,前面的知道什么叫本末倒置么
1675758412,460.88100,其实最开始的唯唯诺诺也是突破那层壁障有代价自己不愿意罢了
1675754673,1224.33800,这两部是近几年最好的两部群像剧
1675753586,1210.60700,太太太infj了
1675752021,802.28200,一千人有一千个哈姆雷特 你接受不了别人的理解可以左转
1675751147,1265.32200,对高来说，别人的感情只是他达到目的的工具
1675750204,105.02200,社会分配有问题，也仍然有着好人，好坏也是自己的选择，世界上的任何社会都是不公平的，但路是自己选的
1675749891,563.72800,善恶没有严格标准，但是还是有标准的
1675746956,1292.83700,江阳是另一个更悲惨的安欣
1675743615,1413.37600,普通人杀不了人，望周知
1675742314,643.40100,高启强不是一直爱家人爱兄弟有情有义吗？怎么这时候有人把他弟单纯定义成一个碰毒的人了？
1675742272,532.32300,我也是这样认为的
1675739454,1437.08800,去翻翻历史书，安欣这样的人不少，但在人群中不多
1675737854,1420.36000,正是因为存在这样令人敬佩的人我国才能站起来富起来强起来
1675737346,256.14200,其实都是他
1675736928,375.79500,对，我当时都替他害怕
1675736925,384.93600,这里是因为高启强知道他们为什么讨好自己
1675735157,1320.16900,他已经给弟弟一万了，还人吃饭，弟弟还去找小龙小虎借钱，他知道弟弟说差2万
1675733931,664.12900,他弟弟也说过高启强最怕腥了，但还是卖鱼养活弟弟妹妹
1675733738,555.91000,大家喜欢的是演员赋予的角色魅力
1675733620,502.73000,他要是天生就是坏的，何必等到弟弟妹妹都长大了呢
1675733501,798.19300,好奇怪从视频开始就刷过度解读 然后一直看到一半了还不出去 都是m吗
1675733029,677.70900,也是伪善！他没有停下脚步，落泪只是让自己好过些
1675732411,481.08000,“小人物”的格局不会发展成老大，见好就收才是小人物！
1675732268,538.30200,哈哈哈 张颂文这段演的极其无辜
1675730868,810.48600,导演就是干这个的镜头语言，不然的话要导演干什么？
1675730431,33.17400,双主角双线交错
1675730406,1218.09900,没有良知的人不可怕，高启强最可怕的是后期，有良知而不犹豫得选择了恶。
1675729426,104.76900,确实 同意up观点
1675725750,1398.64200,敬佩但不想成为
1675724500,628.57600,没有过度，挺保守的
1675717224,399.78900,native笑死
1675710820,867.22900,分清楚过度解读和镜头语言解析再开麦
1675709949,391.82300,不是的不是的，他这边就是在扯虎皮，想过更好，你这分析真的有问题
1675709392,166.05100,为何你总喜欢吧一句话翻来覆去地说，简洁明了不行吗
1675707513,14.21500,强哥！
1675702353,592.34600,沒有原著！小說是劇本改的啊啊啊！！！！！
1675701580,1437.65500,我们的国家就是由千千万万个安欣建设起来的
1675701573,75.77900,我是14e分之一，我怎么没有感觉到xx
1675700233,320.74600,可是这个戏没有原著，不像坏孩子一样，所以这是我们的上帝视角啊
1675698703,799.50600,这个解读哈哈哈哈
1675698013,124.14100,.
1675697735,586.95300,不是看不起吧，在菜市场安欣本来就和唐小龙起了冲突，不是看不起，而是有种排斥心里吧。安欣有瞧不起任何人过吗？
1675697013,385.02600,能一样吗？那鱼档是他主要经济来源，有机会他能不想继续做？
1675696798,425.57300,他跟小龙小虎打牌，就能看出来想借安欣的背景，御驶小龙小虎。得到不属于他的东西
1675696526,1250.95000,有人吗
1675694967,418.94100,阴谋论+过度解读……
1675694854,33.37800,点错了，看了的哈哈哈哈
1675693985,996.15600,遗书最后称呼安欣为兄弟
1675692890,439.60300,那狂飙还应该是以安欣视角呈现的呢，毕竟这些回忆都是安欣讲的
1675692844,432.46700,冲进屋子打小龙一群人更倾向是被逼急了，人在被逼上绝路的时候本来就会很疯狂
1675692702,404.23300,Up 解析不接地气啊
1675692067,446.57000,过度解读
1675691246,160.42300,过滤。
1675691234,460.32400,我不觉得高本质就这样，更倾向于选择变成这样
1675688568,1376.32800,不太认同，高启强和安欣都是特定成长环境培育出来的
1675688493,1244.40900,既然每个人都有，为什么强哥就一点都没有呢
1675687880,448.37500,就从CD店那里看得出心理很强，一般人还真顶不住
1675687357,826.65400,作为影视专业的研究生，只能说门那边up没问题
1675685412,600.19200,就是像父子，你们想什么呢？
1675684588,1341.08300,3000个人正在观看
1675684470,391.83400,结果推断，太上帝视角了
1675682215,1230.57400,当然强哥是坏人没法做到这些圣人，不然他晚年建幼儿园、养老院就真没有贿赂退休干部和公务员了
1675681873,717.01000,丝毫没有过度解读，共生这个角度太妙了，说的真好
1675681620,906.44400,所以现实中有李，却没有单独完全对应的安欣，最多是几个人的事迹拼到他一个人身上
1675681191,676.97900,卖小灵通是弟弟主意，强哥最多想卖卖鱼。   自己电死，不算他杀吧。
1675680644,894.29500,李响会显得更现实一点，更真实
1675680195,357.57500,开始狐假虎威了，就是黑化的开端
1675679756,1306.62700,狼性文化的广传和中式教育的偏激其实都是
1675679398,545.40000,你这么说人一直就有好坏之分高启强一直就是坏的不受环境影响从头坏道尾？否定社会给人带来的影响逻辑都不对啊
1675675896,54.53400,13岁一个人出来跑江湖，卖鱼养大两个弟弟妹妹，这种人怎么可能没有心机？
1675674807,538.20500,由此可见这个角色的刻画是多么的成功啊
1675673387,165.44400,试试新买的键盘的打字阴，我好喜欢
1675672985,474.73000,高启强最后也用一死换来了高家包括黄瑶在内三个人的轻判，这一点我有点佩服他
1675668833,1349.36800,高启强的恶很大可能是他童年的家庭环境造成的
1675668405,71.26000,？？
1675667685,950.89400,正派的一大高光了
1675665993,110.41100,我一个普通老百姓，怎么跟他共情
1675664639,487.87200,到也不必非得把他全部黑暗化，人性本就是复杂的，
1675663829,670.01200,可能也是太了解弟弟了他弟弟不可能出来
1675663216,391.52400,这里牵强了 高启强又不是小孩子 他知道小虎是因为他的“北京“””
1675662954,867.19900,李响也算是理想主义者了吧
1675662931,509.17300,这一句是真狠
1675662825,523.49900,你就看他搞高晓晨和唐小虎为了高晓晨死了，就能看出来
1675661426,384.82400,肯定是打牌
1675661286,831.35500,牛哇!
1675660475,273.36900,这是他的本事，极尽所能的利用所有能用上的人脉和资源
1675659133,342.21800,完全合理
1675659020,815.99300,让子弹飞是最高级别最敏感的东西，怎么解读都不过，这部剧配吗？小鱼小虾罢了
1675658284,532.28100,不是黑化，是本质已经不掩饰了
1675658127,523.51600,没有安欣，也会有张欣、高欣……只要他通过打架这个契机认识了一个警察，他就会在后面利用这个警察的名字拉拢唐小龙兄弟
1675657814,1056.24000,仔细想想，高启盛和李响是同时下线的
1675657748,1256.09500,这次一定
1675657407,385.01300,小时候还真经历过，没说玩的有多好至少矛盾是化解成了普通朋友，偶尔还会互相借东西买零食。
1675657244,299.21800,但是这时候说的确实是真话
1675657148,1279.66900,所以被他抓的这些人都不会恨他
1675656899,709.76000,当时泰叔还在  肯定不敢动公司的钱
1675656713,1424.58700,每个人获取权力方式不一样
1675656651,1362.98000,权力变强了
1675656562,1278.69500,不同意不同意不同意
1675656207,453.28500,BGM是啥
1675656121,467.71800,审时度势随波逐流而已，剧里所有人都一样
1675655711,265.75000,据说是infj
1675655303,398.82500,校园跟社会能同类比较吗
1675654897,635.68200,他一直不想让弟弟和自己有牵扯，用自己的钱补弟弟，弟弟就彻底跟自己挂钩了
1675654838,1243.23600,我觉得原本有共情能力的人，再怎么样也不会去做坏事
1675654726,385.49600,这是后来了，本来他在市场就固定摊位很久了
1675654170,817.23000,这个门有什么卵用哈哈哈哈哈
1675653943,69.14100,高启强要是真的纯恶，早就跟小龙小虎混了，何必再有后来那一出呢
1675653466,1370.99800,所以他的基因延续断了。安欣做的对，但不该是一个正常人该做的。
1675653208,273.63900,被欺负不是事实？
1675653107,172.57200,确实没有任何一个国家的制度是健全的，但是不应该视而不见，天天说某某制度是世界上最优秀的制度，但是也要不断的优化，而不是捧着原来的成绩活在过去，最讨厌的就是高谈阔论天下事，不肯低眉看众生
1675652952,251.54100,人都是会变的，或是因为外在环境，或是因为人生轨迹
1675652111,607.62100,这里的围栏其实是一种电影手法，形成两个对立面的人，表明了他不想让弟弟变成一样的人
1675651729,399.19700,这个解读我不认同
1675651412,2.09100,他真的，我哭死。以己之命，胜天半子，把高启兰、晓晨排除在涉黑团伙之外
1675650651,600.01400,冷知识，没有所谓原著，所谓原著是根据剧本写的
1675649117,579.43300,是有点看不上的
1675648494,1370.07500,解说的太好了。
1675648066,496.34900,评价很到位，点赞投币了
1675648053,391.85300,他远离了唐家兄弟，他鱼档还开不开了，你不跟小混混玩照样还能念书
1675647733,244.09800,钱塘江上潮信来，今日方知我是我
1675647611,398.99100,他抓住了这两个人的缺陷和短板 已经盘算好怎么利用了 在等一个机会
1675646818,680.18100,他没杀徐雷啊
1675646624,1434.16900,反派行为是外放的所以让大部分人有好奇心吸引人
1675646602,1334.32500,没任何实际行动
1675646541,643.31200,注意，这里up说的是制片人举的例子，所以不存在过度或者错误解读的可能
1675646343,852.42500,up讲的太好了！
1675645720,648.49300,几十万台小灵通算200一台都是天文数字，强盛不是高启强一个人的怎么拿这么多钱出来
1675645647,40.89400,偷换什么概念 后期剧情逻辑跟前期本来就水平有差距 还不让人说烂尾 说了就是代入反派 
1675644665,186.62100,李大本事！
1675641301,39.55200,不算烂尾，但最后的剧情感觉确实太仓促了
1675640680,717.75600,他们兄弟俩个人的性格特点都不一样，
1675636849,1382.77100,这样的人一直存在啊，想想汶川地震时那个舍身就孩子的老师，想想我们最可爱的人，想想救人民生命财产于水火的蓝朋友，想想舍身取义的先辈们，时刻怀着感恩的心吧，而不是怀疑真善跟恶人共情！
1675630464,132.09500,你对高启强共情，而他却觉得你就是一直待杀的鱼
1675630230,902.77400,这两位好像长征的红军啊……
1675629772,643.14800,编剧都认同你不认同？这部电视剧你拍的？
1675629767,347.29800,前面的高就是善良的
1675627253,251.53900,人是会变的嘛
1675626727,383.12700,真离谱这个比喻，没有经历社会化的大学生才能做出来这样的比喻。
1675626409,404.54200,他能看懂别人是怎样的人，这一点他基本没错过
1675625262,118.69900,高启强没朋友
1675624447,902.76300,让我想到候亮平和祁同伟
1675619765,292.25900,是的这个一阶段一直在表现安欣的不成熟和23阶段形成了成长
1675619437,871.99400,强啊，作者这意思
1675619307,356.84600,怕得罪人和怕这个人本身还是有区别的
1675618619,295.98000,他一开始确实是受欺负
1675617851,683.22700,不是他杀的
1675617743,256.27800,人人都可以是高企强
1675617731,572.23700,我特地回去看来，安欣的眼神很正常，没有瞧不起
1675616975,606.94400,这剧是原创，小说是后面才有的
1675616785,230.02500,哈哈哈 怪不得诶 所以这剧有一些时间bug
1675616185,347.97100,因为他是结果导向性的，没影响到结果过程无所谓啊
1675616019,391.68100,因为他意识到了权利带的的便利和快感，不再愿意回到过去再被欺凌
1675615638,326.86300,woc啊
1675615424,105.24400,非常认同，无论如何犯罪者都是我们的对立面
1675615291,649.16000,这样解读没意思，真的要把细节详情一寸寸给你放出来才有意思，艺术创作而已
1675614102,47.31900,张颂文真的演的太好了
1675614082,2.01200,恭喜发现宝藏！
1675613356,264.03200,他脾气一直都没太好吧
1675612945,138.68100,张颂文演的太好了所以才会共情，换别的演员估计只有厌恶了
1675612863,516.19800,Up你要是预设一个观点再去找材料，那不叫分析
1675612404,643.43900,小灵通不成功？
1675612281,83.55300,看了
1675611857,532.84000,不对，这里是高启强知道安心转移了那家人，只是一种震慑罢了，不要瞎说
1675611655,118.09900,感觉他的手段很可怕特别是程程死的时候
1675610676,279.83200,强太infj了
1675609701,391.49900,可能心里已经定了他们的死局
1675609430,385.64100,我是没有远离的
1675609325,19.29000,感觉不如人民的名誉
1675609284,545.12900,他后面应该也是越来越膨胀了 自卑和自傲是同时存在的
1675609212,1412.37400,“不存在”？一句话磨灭掉多少坚守的人
1675609116,453.36800,风浪越大鱼越贵哈哈哈
1675609069,404.75600,因为他比他们聪明多了
1675608828,1404.71700,前面的为什么要否定这种人的存在，这种人有但很少，毕竟代价太大了
1675608567,1238.37100,所以谁说现实中不存在安欣的？光是从我们的课本里，就有很多啊
1675607364,1434.38600,徐雷死是以高启强视角展开的，真假难辨
1675607364,2.28300,盛子拍我
1675607051,1061.25900,李响，理想
1675606709,882.58900,李响，更现实，同时也更有心，思考的更多。安欣前期其实比较一根筋的，06线以后，才开始成长。
1675606691,124.17900,勿以恶小而为之 勿以善小而不为
1675606529,36.51700,不算烂尾吧
1675606475,1217.69000,张颂文老师这个角色真的是演活了
1675606440,411.83000,前面说别总想自己怎么样，人家就是在分析高
1675606323,985.81700,张彪当时挑衅的时候，李响反驳那段话，我从这里开始喜欢他
1675606174,920.81700,我也觉得
1675605986,926.25100,可以说是剧里封神的一段
1675605562,607.42500,他俩的关系很奇怪
1675605401,664.12100,换成我家里人的话早出钱补上了
1675605311,503.00100,真的这句话不细想，好像他不是这样
1675605302,333.58400,有点过度解读了
1675605194,105.11600,伪善也是社会压迫造成的
1675605082,954.19300,这段我愿称之为国产剧的神，太妙了这个情节
1675604759,705.74500,弟弟像是在衬托哥哥，让哥哥显得善良且亲切，不那么疯狂，实际上哥哥心机更深，坏事做尽的弟弟来背名
1675604725,86.89900,一将功成万骨枯
1675604716,858.08300,欣响事成！！！！
1675604711,109.69900,不管怎么说，见过各种阴暗面的我27集以后就是神话
1675604318,1020.93800,而且高启强和安欣的镜像对象是同时死亡的
1675604299,844.26500,这个解读真好
1675602972,460.25900,和我的理解一样
1675602953,816.67100,编剧让弟弟分了部分原先高启强的恶
1675602616,545.49900,高启强每次谈照顾弟弟妹妹都是要人可怜他的时候
1675601413,419.53900,不狠的话，一个13岁的孩子怎么养大两个襁褓中的弟弟妹妹
1675601378,858.17300,安欣是无数一线警察的共同化身
1675601078,153.09900,李响牺牲的时候哭死我了
1675600908,467.78800,如果角色不能代入生活，这个剧就没有现实意义
1675600875,823.99500,好高级的解读
1675600844,1354.75300,为了个人私利罢了
1675600718,852.61000,京海美帝！！！
1675599928,1042.19700,安欣在李响死后从理想回归现实
1675599822,496.69900,高启强你自己有答案吗？
1675599721,432.23900,细思极恐
1675599696,194.82700,其实他一开始就不是知道适可而止的人
1675599681,1217.72600,高启强简直跟个人皮恶魔似的恐怖
1675599676,104.77800,就很费解为什么那么多人共情高启强，我只觉得他太会演了，就是这个伪善
1675599602,670.86800,woc这我没有发现耶
1675597648,655.81000,他没让弟弟立马销毁货撇干净，而是散完货补窟窿。
1675597646,15.31900,从第一集他说谎和狡辩，想投机取巧就知道他不算善良
1675597622,1404.20700,怎么还是这只手啊 那一刻我就知道 安欣啊他从没变过
1675597292,548.47200,这部剧除了指导组一众，人物都挺丰满，不知道是传递什么样的信息
1675597124,32.81900,不是曾经
1675596510,312.53400,这里真的细思极恐
1675596460,515.61700,很狠的
1675596051,532.21700,阿斯伯格吗
1675596012,19.33800,不是因为这些？ 那我看他干嘛
1675595580,488.02100,不忘卖可怜
1675594613,384.99400,看情况。如果有需要和好没什么。
1675593918,284.57800,理想是从派出所上来的，具有非常丰富的实践经历
1675588432,635.61600,啧啧啧，确实
1675587426,1272.34800,必须是而且只能是安欣
1675584478,1393.24100,呜呜呜呜呜呜
1675583138,940.73900,所以，李响和启盛同时死亡，也就将二者的特点放到了安欣和启强身上
1675582935,921.00800,表彰大会太精彩了
1675582302,659.99500,唐小龙甚至因为弟弟去坐牢了
1675581005,132.17100,不是高启盛吗
1675856568,130.81900,响！响啊！
1675855570,1032.71100,是的！！是融合了，一体两位合二为一，完成了人物的完整。
1675850066,144.70100,抛开事实不谈是吧   高起强可是杀人犯  
1675847699,895.54900,我觉得安欣比较像infj
1675846501,1219.01900,对，就是能不能理解陌生人的痛苦，正是孔子说的“己所不欲，勿施于人。”
1675846209,120.50800,安心的同类人是徐忠
1675845620,425.19900,一般人没杀过鸡鱼的人心都比较软的，经常杀生的心里还是有股狠劲的
1675845396,298.57900,李响是在派出所干了几年了，这种事见过多了
1675839999,99.63400,？张译咋了我觉得演的挺好的啊你们喜欢高启强可以踩一捧一就没意思
1675835682,1401.84000,坚守心中的底线
1675835534,1306.92100,坚守法律和道德底线
1675830904,1270.58200,高启强是NPD人格吧
1675829075,830.86500,up解读的很绝 赞
1675828710,606.27600,根本没有小说，都是现场创作的
1675827158,348.08500,过度解读了
1675824991,1412.19100,安欣的笑啊啊啊啊啊
1675823910,1437.77900,世界以痛吻我，我却报之以歌！
1675820453,523.36800,他13岁做顶梁柱，他必须是野兽，做人他做不了的
1675814637,273.73000,一个人带两个孩子长大，
1675798356,267.25700,问题是得靠这样才能生存
1675798008,18.71900,前面那个 不是 因为你叔演技好
1675797297,418.86500,这里的小龙是残血啊 刚被徐的人揍一顿
1675794569,1206.73000,京海善良的神，站在洪流的孤岛上哭了……这种破碎感真的让我心里闷闷的疼啊~我的欣欣小天使！
1675789467,1237.89900,懂不代表他会选择善的那一面
1675787459,522.67800,我的天
1675786583,557.19800,没有什么是天生的，都是后来选择的
1675785060,1004.76300,机月同梁作吏人
1675784717,1420.28400,作恶难还是自律难？我认为是自律
1675784244,1218.70900,共情和理解还是有区别的
1675782269,857.63700,响！
1675782204,101.37700,从他借安欣狐假虎威开始，我对他的同情逐渐消失
1675781903,537.15000,前期他是想去自首的
1675778595,1219.53700,这里安欣站的位置巧妙地成为了一个孤岛
1675778528,1047.17500,也许现实中不存在安欣 但是现实中有由无数个好警察组成的安欣
1675776792,797.36900,镜头语言啊说过度解读的多看看好的电影你会发现的
1675775654,692.31900,弟弟就是他作恶的工具人
1675774179,61.97900,最让我觉得刻骨铭心的是安欣
1675773129,124.02700,快开始说好不好
1675768845,231.09200,觉得慢的去刷隔壁某音吧，何苦来看长视频折磨自己
1675766791,544.54500,我感觉我也是这种人
1675760541,803.22200,你总不能说高启强一开始就很坏
1675759576,68.79800,不至于烂尾，就是后面感觉被改和删减太多了
1675754324,1055.83500,终究成了世界上的另一个你啊，响
1675753776,382.81300,玩什么耍 那会这兄弟两还是市场监管 还得低头
1675751817,399.85900,因为他的抱负和野心更大
1675750757,1299.43200,但是正常人的话就算说是被社会逼的也不会选择去犯罪啊
1675750102,1278.67800,笑死，工藤新一行为
1675747638,37.61700,阵痛嘛几十年继续
1675747188,1433.97700,难到牺牲自己？
1675745850,886.75700,李响这滴泪真的太扎心了
1675743405,11.70800,话说6年过去了 应该一杠二了
