1675909563,1550.03300,他说想让安欣和高启兰试试，后来安欣问他为啥不找，他就不能回答了吗？他一提陈舒婷就成利用了
1675909458,1523.33300,他这里想把他妹妹介绍给安欣，安欣问他为啥不找，他才顺嘴说的
1675909372,1485.49300,就算高不利用老莫，老莫还是会动徐江的，他一但动徐江就回不了头了
1675909337,1451.74700,对喔，这一点第一次发现
1675909288,1449.63300,老莫想跟黄翠翠结婚，没钱就去抢劫，本身就很暴力吧
1675909115,1465.42400,天哪这解读我以为送鱼是真心感谢
1675908994,1296.88300,从来没有共情。哪怕塑造了再多这个角色悲惨的戏份。不论如何，这种人害了太多人了
1675908934,1201.53300,他这时候还没查清害陈舒婷的凶手呢，这时候只是怀疑，
1675908830,725.71100,这个分析绝
1675908829,1131.29300,他说过后悔把陈舒婷接回来，不回来陈舒婷就不会死了
1675908610,1024.11300,高启强在陈舒婷死后不也遵守她的话了吗
1675908561,92.11800,一半一半
1675908482,1569.61000,这段的试探很明显了
1675908305,1145.42500,洛基还刺他哥呢，不是一样爱么，哪有那么多为什么
1675908203,740.95500,这里前面我听他说还以为他父亲真的那么优秀
1675908200,1541.60300,没那么绝对的
1675908151,733.37500,什么时候解读一下安欣，想听up怎么解读安欣的
1675908000,1193.73900,总有人提原剧本，改了就是改了，薛定谔的杀人是吧
1675907996,791.13400,每次有危险的时候他都让老婆孩子离开，高就没付出吗
1675907944,784.27400,他第一次认识泰叔，不了解，陈舒婷告诉他很正常吧
1675907891,777.61400,高从小在菜场长大，从他给小龙小虎送电视和红包，他本来就会为人处世
1675907782,728.67400,那他还缺失父爱呢，你咋解读？
1675907760,1449.48700,但凡老默多找几次安欣 绝对能找个正常工作的 毕竟坐过牢出来的社会环境真的不太友好 他也努力尝试过 想好好跟女儿过日子的 
1675907697,174.78700,确实，这部剧很多时候都有宿命般的故事发展
1675907656,701.56800,哄着
1675907600,1282.04500,那个是车祸的伤痕吧..不是戒指划破的..
1675907287,1066.80600,弑父情节
1675907047,971.20300,+
1675906882,309.73600,不生孩子一定就是有问题吗别这么框架化去思考了
1675906860,345.53400,他没有哀叹自己被高启盛带上不归路呀
1675906850,1544.65800,这跟唯物又啥关系
1675906588,405.97900,打雷姐！
1675906223,24.42100,这俩都不爱
1675906219,1480.46800,一眼看出他真的爱黄翠翠和女儿
1675906191,1557.24400,我看的时候觉得是有这个意思的，不过也看个人理解吧，人性是复杂的
1675905968,1647.18200,他眼里的家人只有高启盛 高小兰
1675905681,808.43100,卖鱼咋提供经济基础啊 她是希望高接手并洗白 如果高真的老实本分这完全可以做到
1675905650,387.93200,张居正管的也挺严的，万历不还那样儿。
1675905196,1743.77900,解读的好棒
1675904919,1563.14300,试探了两次
1675904856,1310.92900,任何人对任何人都只是一条腿而已，谁会没有谁活不下去啊
1675904834,1310.16800,我觉得分析得一塌糊涂，非黑即白，为了验证这个话题而找了这些线索
1675904727,1218.04300,2021年的时候他还让手下一直调查陈书婷的死因呢？
1675904679,1216.44400,他这时候还没发现杀害陈书婷的凶手，
1675904615,1471.60100,高启强哪里敢动安欣，孟德海和安长林给他撑着
1675904604,227.63100,长兄如父
1675904525,385.79900, 因为陈书婷的教育方式本身就有问题
1675904395,1134.40400,我和一些观众也把高启强看成是憨憨老实人
1675904269,769.42500,严厉吗…宠溺的狠
1675904240,894.43400,陈书婷也喜欢高启强这种
1675903827,394.57200,陈泰没儿子也想洗白公司，如果可以，谁不想洗白呢
1675903617,218.55100,编剧：其实是我的思维定势导致了这样的死法…
1675903562,1131.70700,一次又一次试探底线…
1675903550,1558.93600,对啊就是试探他的态度
1675903456,1367.57800,vm
1675903267,1542.59800,不不不，前面的过世的对象不同确实有区别。如果自家老人过世了更多的是欣然接受。而跟自己一样年轻的爱人过世了是不会与人分享，或者坦然说出来的除非他已经老了，或者看开了自己也时日不多了。
1675903248,828.30400,简单两字就是被吸
1675902899,798.12500,神解读
1675902888,404.91400,领带没有这么多隐喻，就是陈书婷演员觉得更有性张力而改的
1675902592,406.95900,这段戏是临场发挥的，原剧本是扇耳光。过度解读了
1675902453,1540.55100,若真的在意，只会深埋心底。不会说更不会遗忘
1675902228,1528.61500,太经典了唐家三少
1675902140,1697.20900,在他觉醒之前 他肯定后悔 但现在 或许更多的是一将功成后 仍是壮志未酬的恨吧
1675901849,362.75400,我的书婷啊！
1675901589,811.38200,还会争夺母爱哈哈哈
1675901390,1456.36200,老莫当杀手是因为高在他刚出狱还不能被社会接纳的时候趁虚而入
1675901078,379.49900,一切都是为了孩子
1675901020,1231.94400,这枪 不就是开给赵立东看的么
1675900455,1551.83000,还不止试探一次
1675900161,796.97400,确实 一直就觉得陈舒婷这个大嫂  越当越累挺
1675899969,1018.78000,胡扯啊，怎么没有平等对话的权利了，后面她还跟高启强约法三章高启强也成功遵守了
1675899660,1237.10500,如果他真的那么爱陈书婷那他听到这话应该生气的
1675899021,1137.33300,孩宝妈
1675898928,1163.32800,小胖手
1675898824,1447.00100,up是个高手
1675898329,88.00600,是真爱啊
1675897813,1451.48000,老默真的是我的心痛
1675897649,1198.49200,蒋天代表高启强因为暴戾在外结的仇，陈书婷作为他的“软肋”，确实会被报复
1675897432,392.08300,当然可能有这么差的儿子。跟了高之后不还是那些生意，耳濡目染
1675896331,377.62600,可是这就很bug，这么严厉关注孩子的母亲，怎么会有后期的高晓晨
1675895900,1467.89200,鸡皮疙瘩起来了卧槽
1675895548,1084.56400,把高启强 送进了地狱 bae
1675894543,729.31000,分析的真的好!
1675891533,1559.23100,我觉得有啊，很明显啊
1675891230,1262.47400,又不是法院，要什么证据，要不是有赵立冬，有杀错没放过
1675890718,1474.78300,高启强真的感恩，就不会一次一次利用安欣的善意了好吧，他不动安欣是因为他动不了不敢动，京海别的黑恶势力又有谁敢动呢
1675889038,1518.71400,他很擅长利用安欣的同情心
1675888302,729.60600,还是缺爱啊，哎
1675887649,1452.83100,nn那为什么当时把车劫了以后把安欣救了
1675887109,1248.49800,你们就是这么看这个剧的？为什么我觉得这块是蒋天触了高启强的逆鳞后他的报复而已？！难道姓蒋的不是真真实实害死他老婆？黑社会不弄死仇人？！
1675885446,1475.86000,他们区别在于一个更聪明吧
1675885152,1124.54300,好病娇啊
1675884828,1526.35800,大胖橘？？？？
1675884697,515.99400,白晓晨改姓也能说明对家的渴望
1675884304,1236.53300,我觉得这里是因为这句话让高启强想起来现在的家业都是陈淑婷带给他的才冷静下来
1675884138,1527.87400,我初恋过世了。。他活着的时候我经常提，我走了我真的完全不想说
1675884023,1443.08600,我改好了哈哈哈
1675884004,1242.49400,这音乐，高启强是恶鬼
1675883691,1546.38100,只能说他对所有人的好都是有条件的
1675883208,1450.22500,对啊，哎老默阿，要是安欣看到他那张证书就好了
1675883167,1402.89800,冷知识：原著说的是惨胜，指的就是高启强惨胜，他把唯一的妹妹跟儿子摘了出去，不然枪击案就够他儿子关一辈子了。有没有可能，杀手就是只重伤高晓晨，轻伤高启强呢？别忘了孙子兵法还有一招走为上
1675883100,1723.56100,升华了嘤嘤嘤
1675882702,1256.90400,难道非得这个点开枪杀人才是爱吗？何况改词前的原剧情还真不是蒋天杀的
1675882679,1534.39600,说唯物的怎么那么能洗啊 
1675882648,1251.03800,聪明人知道目的现在已经达到了，不然第一枪就不是打腿了。再说确实不是蒋做的，高也一直有疑惑，才让人调查。家业本来就是自己的，当然丢不掉
1675882479,1201.94700,书里面的解释是黄瑶想让高启强也家破人亡
1675882312,1289.36000,有些人这都能往爱上面靠。。。。不知道是啥大恋爱脑
1675882273,99.29800,很爱，说不爱利用的先学会做人，别用上帝视角评判
1675882088,817.20600,高叶就有说陈后来离开高是因为陈认为高是失控的
1675882065,1564.81800,高启强没有直接反驳
1675881919,1004.05100,黄瑶确实挺可怜的，老墨只能说是他自己选的
1675881751,1471.98700,老默本来是有可能走上正道的，奈何没有机遇
1675881738,421.24300,这个解读可以滴
1675881545,29.91400,可人家就是深度解析了啊，而且有理有据
1675881541,1213.89700,丢雷螺母~
1675881505,668.28000,没错 他和高晓晨有种争夺母爱的感觉
1675881494,1145.79200,送衣服的手铐！也是陈书婷很聪明 很有观察力 但是不明说
1675881455,1148.14800,up找的这处镜头好！就是陈书婷送衣服的时候 看到刚刚拷住高启强的手铐
1675881365,391.81500,不洗白我是真想不通。
1675881278,1091.47100,泰叔不是直接被送终了？
1675881276,1552.47700,觉得是有这个意思
1675880862,1456.46400,对的，老默从未借用过安欣的身份要一点点好处或方便
1675880756,1290.64900,高启强爱陈书婷，但更爱自己
1675880458,1148.03900,笑死，高启强杀人放火无恶不作，但他不家暴，真是个好人啊！
1675880449,1555.51800,这里不是过度解读，相反这已经表现得非常明显了啊
1675880427,767.73200,想起向华强说妈妈是小房唯唯诺诺，所以喜欢向太这样果毅的女人
1675880132,807.09300,这点不太同意 她找孩子父亲和自己喜欢的男人肯定不是一个类型 高启强是两种类型的综合选择
1675880062,436.06800,这个视频不是剧情解说，是作品分析，不存在“过度解读”
1675880057,1105.65500,红字的意思是精神特质继承…
1675879972,1559.09600,他就是动了杀意的，但是老默拒绝了
1675879957,598.99500,说白了有点像女主内男就可以主外了……
1675879801,1012.16800,而且瑶瑶是老默出狱后才获得亲人的爱，现在又夺走，能不恨吗
1675879790,1165.26100,清醒的沉沦，所以那通电话甚至没有愤怒，认清 看透后绝望
1675879777,353.29700,牛啊啊
1675879595,107.29100,这个说到点了
1675879555,818.68300,张颂文老师表演出来的也让我有这个感觉！
1675879495,1291.13100,？
1675879442,1236.10000,对当时看到这里就觉得高启强没有那么爱大嫂
1675879368,728.86800,所以他们的长辈和前辈的故事又是一大堆，可以写的用来补充，现在拍不到的
1675879315,1530.17300,唐家三少:你胡说 我反对
1675879081,755.45000,嫂子这里也太美了
1675878966,716.15200,他明白这是爱
1675878783,1550.79200,？？？？这里过度解读了吧
1675878713,551.00400,人家只是以柔克刚
1675878694,557.21500,所以他说妻管严是幸福，他也享受着被管被关心的感受
1675878675,1525.90100,那他爱高启盛吗？
1675878600,1465.63400,高启强被太久的底层生活扭曲了，高启盛也是
1675878572,1249.85800,小孩那桌！
1675878521,1410.33800,他对高晓晨太完美了像是在表演，他有时候都会对他弟弟发火的
1675878502,802.86600,笑死，重新定义憨厚老实
1675878481,1390.41400,喜欢他的人很多，这就显得很恐怖了，因为他会在不同的人面前装出不同的样子
1675878441,1249.99600,因为没有直接证据吧
1675878367,1675.91800,这个镜头很好，他的眼睛已经被利益遮盖住了
1675878193,1156.39300,但是她戳破了，她还是陷进去了
1675878142,1268.75700,这里不认同，高启强到后来都没确定是谁害的他老婆，要是知道肯定不止打腿这么简单了
1675878135,1110.86800,这时候陈舒婷完全不应该听高启强的回去
1675878069,219.52600,然而事实上他们只差了6岁左右
1675878010,1039.25200,泰叔算是陈舒婷一个非常有力的靠山，倒下之后，陈舒婷就彻底失去了和高启强平等对话的权利
1675877896,967.78500,其实我觉得陈舒婷安排的司机出问题之后，他们之间的信任有一点问题
1675877695,824.42500,我觉得高启盛对高启强也有一种学习
1675877630,768.48900,对陈舒婷对儿子的保护，在高启强眼里是加分项。因为高启强也对弟弟也很保护，他非常在意家这个观念
1675877627,84.77300,书婷的关系只是他向上爬的途径罢了
1675877405,539.86700,论演技，不是阿泰也轮不到吴刚的儿子，关系户就是关系户
1675877396,1253.28400,这时候没有明确证据是蒋天干的
1675877344,1223.84500,你们是不是没搞清楚这时候他确实没有证据证明是蒋天干的？他又没开上帝视角，而且拍的时候可能还是黄瑶杀的设定下
1675877248,15.15400,这期真是宝藏
1675877232,696.05900,哈哈哈哈哈哈哈
1675877221,1170.25000,大嫂在高启强心里地位已经是最高的了，弟弟妹妹要听他安排，他只会向大嫂妥协低头好吧。。。你不能拿纯爱那套来评论高启强的爱
1675877202,804.21900,天呐，这不就是我继父和我妈现在的状态吗……
1675877150,372.90600,这样解读好棒，她想过安稳的生活，不是为了自己，是为了儿子
1675877128,1578.16700,试探就是想杀啊，能不能别替高启强洗（我知道张颂文演的很好）
1675876912,1423.08700,高启强对安欣也起了杀心
1675876877,1542.96100,你应该有些错了，你说的像是没见过大海的浩瀚却说那么多大海的话会对吗？
1675876644,724.64900,高曾说有老婆管的，挺好的，其中一部分应该是辩解，掩盖陈强于他，另一部分是因为有缺失的“母爱”。
1675876557,775.84500,所以人真的是用尽一生在治愈童年啊…
1675876530,1241.12600,只有业，没有家了
1675876499,1578.77800,这次是试探，后面那次是真的想杀了
1675876470,1716.42500,这段最重要
1675876334,1516.91300,因为都是伪善的人
1675876297,1485.55500,老默一家子虽然不是好人但是是情种。。。诶。。。
1675876125,1415.63300,假装弱博好感，不就是他前期对安心做的吗？
1675876015,1176.07900,并不是她爱上这样的高，而是心理上在她付出很多之后，会产生爱和纠缠，这又更深层了
1675875979,1481.82900,这感情也很。。。。
1675875942,1234.65500,诶。。。
1675875848,1203.74000,对！这里本来可以杀了他，还是为了事业忍了
1675875711,1186.40300,说起来黄谣杀人了自己是不是也要进去呆个几十年啊
1675875700,1354.34000,而且角色也聪明
1675875648,1124.09700,遇到过这种人，不断吸取我的情绪价值，还利用我去做她不敢做的得罪人的事情，特别会装可怜装友好
1675875602,810.69200,书婷没怎么变，其实她需要的男人反倒是安欣那种，看似年轻实则能教孩子成人的，但她的付出本质决定了她会被高启强吸引
1675875573,1526.83400,我爸很像强哥 根本恨不起来
1675875459,855.59800,我也觉得不对劲，他懂人情世故，但为什么送这么不值钱的东西？
1675875418,1573.66200,这里是试探，并不是真的要杀
1675875347,1529.36200,这要分人，有的人比较唯物就觉得没啥
1675875287,1509.42200,古惑仔不用脑，一辈子都是飞机
1675874982,1249.90600,这就是现实啊
1675874978,1249.63000,不然呢，成一时之快鱼死网破吗？
1675874964,511.19300,的确，我还疑惑她和她儿子为啥那么坦然接受高家高姓，这么看他们只是想要“家”并不在乎是谁的家
1675874932,1205.02600,为了一个女人那句话是吧
1675874884,1166.22600,可能就是这样的高才让她爱上吧
1675874823,1147.31000,当年高启强就是一个心里只有弟妹的人，但人是会变得
1675874822,1121.66600,陈书婷陷得更深
1675874793,1196.88700,回上面，应该是说黄瑶没必要杀她
1675874791,736.37400,听多了我也信了
1675874790,1487.05200,主要他以为黄把他骨血打掉了，恨她，没想到留了个女儿，不恨了，反而愧疚感激了
1675874687,1480.54600,没错！这里是真的 嘴上说着要杀了黄翠翠但表情又压抑不住地难过
1675874618,1443.32600,老默本性应该也不想杀人的 他每次做坏事都会颤抖地吃一根棒棒糖 来缓解压力
1675874588,708.40100,我当时就觉得像在哄儿子哈哈哈
1675874581,1442.56600,老默成为杀手是因为他武力值高但心机不深 容易被别有用心的人忽悠 从而一错再错
1675874423,995.62200,恨肯定是合理的，就是人物塑造还是欠缺了一些
1675874340,1568.15300,他是动过杀安欣念头
1675874323,1491.80900,这就是区别啊，可惜善良的都早死了
1675874289,1478.14900,对！！！！
1675874260,1453.64900,老莫真的就差一步……
1675874168,1460.47300,老默跟他杀这么多人也没多要求过什么，他跟女儿穿着，生活都很朴素
1675873989,541.77200,高启强开始算入赘，合伙人关系
1675873947,992.64700,就因为这里 完全能理解黄瑶对高启强的恨
1675873908,1243.69200,答案就是“家业”更重要
1675873872,1140.70000,这里是不是想说藏锋啊
1675873746,1632.62500,后面的鱼
1675873491,1382.67900,高启强真的骗到了观众，他杀晓晨才显得很突兀
1675873485,1681.54900,在高启强家里的椅子上
1675873428,1256.65800,杀了人也回不来
1675873421,534.22800,带资进组是谣言。。原本是豆瓣一个帖子说要是阿泰的演员来演高晓晨就好了 结果传成了带资进组
1675873412,1559.44100,老墨死那次也是，高启强才是真的白眼狼
1675873411,1172.21000,更好磕了是怎么回事，大嫂在一步步看清他的路上还是没办法不爱他
1675873392,1466.52300,没错
1675873390,1457.25500,他不是没有善恶观，是善良就活不下去了养不了女儿了
1675873321,389.57900,牛！
1675873273,696.20400,确实像在哄孩子
1675873177,1339.89900,要查一查
1675873166,1141.13900,高根本不爱她，爱是这样？
1675873041,1141.63500,nono高启盛也是被利用的
1675872905,1178.84800,ps:剧改小说里面陈书婷是被黄瑶杀死的
1675872838,727.60500,分析的我有些感动
1675872779,757.47900,加长林肯
1675872590,436.21200,这个点挖的很好
1675872475,1689.13100,是李宏伟被高启盛拿冻鱼打后，安欣和陆寒去高启强家做调查时说的
1675872270,1710.95000,三连支持 优秀色up
1675872204,408.25800,哇～虽然这段是演员加上的编剧没这么写，但是过度解读圆上了啊，绝
1675872121,1522.70900,确实像周朴园
1675872023,260.84200,高启强那会对高启盛说，什么都不和他商量
1675871822,1464.10100,区别在这里
1675871809,1466.94800,我碰过这样的人，幸好已经不来往了。
1675871590,922.30200,细，太细了
1675871531,1622.73700,所以说什么安欣因为高启强的心软才活下来我根本不信，高启强不动安欣一是因为没必要二是因为动不了
1675871431,1179.12800,陈书婷在这段关系中付出很多却又得不到自己想要的东西
1675871416,451.30800,！
1675871365,1565.57100,想到抖音那些说高启强从未想过害安欣的，就感觉好笑
1675871297,1452.33800,要是安心在，可能就不卖鱼了吧
1675871202,807.40600,怎么感觉这里up声音有沙哑哭哭的感觉呢
1675871117,42.35800,板凳
1675870866,1136.65900,其实高启强在内心最深处只觉得高启盛和高起兰是自家人，其他人都是可以利用的
1675870443,842.99900,说的很对
1675870358,1555.13900,我记得他一共试探了两次
1675870067,113.83900,张颂文：我都不想理你，爱，一直都爱！！！
1675869692,1102.90400,红字说得好
1675869409,44.52600,肯定爱，24k纯爱，但是这份爱非常复杂，以至于后来陈书婷看不清楚高启强到底是个怎样的人
1675869075,723.39800,茄：那么又是谁在守护着这片沙滩呢
1675869016,10.77900,就凭这题目就值得三连
1675868655,1132.20400,高启强可没家暴，别什么都按
1675868637,1523.42500,唐家三少
1675868417,1524.71100,唐家三少
1675868408,1521.63500,唐家三少
1675868338,739.64400,背酒鬼
1675868325,1238.60700,答案是不值得
1675868312,1523.15100,他就没有“爱”这种能力，或者说没有常人理解中的那种爱，用陈书婷软化安欣，和后面在高启兰面前说他想高启盛了是一个道理
1675868270,1541.28300,人是复杂的
1675868193,608.13600,这里说的好好啊
1675868083,1469.81400,对！醍醐灌顶
1675867948,1466.73700,天啊，有一种恍然大明白的感觉
1675867862,1253.23900,很唏嘘的一点，安欣和高启强最后都因种种原因失去了爱人和兄弟，从一无所有到一无所有……
1675867811,1527.58400,我不认同，这里更多是年老感慨吧
1675867770,1125.84300,家暴男的套路
1675867574,1527.58400,我不认同，这里更多是年老感慨吧
1675867514,1116.53800,这其实说爱也是爱，只不过是扭曲的爱，交织着占有、试探、索取，他没有正常付出这份爱的能力，如同他弟弟对他一样，别扭又疯狂
1675867496,362.06900,天呐
1675867471,1502.59600,这点同意
1675867462,1194.07200,不是蒋天黄瑶也会是其他人的，因为她无法阻止高启强作恶，更没有要离开他
1675867452,825.79900,在陈书婷眼里的踏实的生活可能就是有一点钱有一点权而不是真的那种普普通通的生活，她一开始引荐高的时候也完全想不到高的野心这么大这么狠
1675867358,1527.26300,@唐家三少
1675866973,1128.04600,居然有这么复杂
1675866936,400.96700,哇哦！打雷姐
1675866798,1187.11100,原剧本设定就是陈书婷被黄瑶害死的
1675866667,52.72200,是的，很复杂，并不单纯
1675866566,850.64800,是啊 我记得他看菜单的时候还嫌弃太贵了 但后来还开酒了
1675866391,239.81300,我认为他能补，但他会选择风险高损失小的方式，他就是愿意赌的人而且赌赢了很多次
1675866383,1515.61500,怎么那么像周朴园对侍萍
1675866296,1118.14700,卧槽
1675866152,469.26400,看的时候就觉得这张合照怪怪的
1675865943,1278.89600,真的诶  我刚发现用力把她的手指划破了  这…唉…
1675865912,1464.36100,太对了
1675865869,1538.19500,他一直在那家人亲情来让安欣同情他
1675865804,684.59400,这段的感觉真的像一个母亲在劝导一个叛逆的孩子
1675865749,659.32000,高启强更像是高晓晨的哥哥，高启盛的爸爸
1675865567,443.41000,怪不得我寻思着这俩角色这么突兀
1675865502,363.07500,woc
1675865468,1220.48900,他可以直接开枪杀了蒋天，却只打了腿，还在听到对方官职后放弃了
1675865266,493.47400,强强联合
1675865224,1574.03100,这是试探
1675865193,414.14200,他说“美丽”狗头
1675865079,793.28100,wow
1675865015,804.21000,与其说背道而驰，不如说书婷，她也在变
1675864999,1560.99700,对！！
1675864951,639.02300,我靠牛
1675864934,1491.55400,同意
1675864870,1466.17700,对！！这一点也是我没法共情高启强的一个原因
1675864798,1499.36100,说的太好了
1675864494,1447.10700,可怜的老莫啊，要是当时安欣在就好了
1675864247,801.89800,我也觉得，陈如果真的想安稳过日子，就不会扶持高启强上位，完全可以任由他继续卖鱼
1675864245,673.97100,这个夫妻关系或者说合伙 合作都是真的好
1675864184,32.34800,刷了两遍了 我来发发弹幕！一定看完 不会后悔的
1675863860,1261.98700,不不 up的意思不是高对陈没感情 而是这份感情只相当于一条腿
1675863845,879.34700,本能的利己主义和表演型人格
1675863840,1190.51900,回前面，不是高的主观判断有没有必要害她，而是高启强的作为导致了她的死吧
1675863652,302.93800,怪不得泰叔也不要儿子
1675863500,1237.50300,跟他弟死时一样，很快就认清局势
1675863439,738.59200,确实
1675863348,1183.59400,这个不认同，没必要杀她
1675863266,1033.52900,泰叔是大怨种
1675863145,1440.04800,高启强对安欣的感谢掺杂太多私欲
1675863071,143.04700,字幕是不是错了
1675863058,997.97400,黄瑶听到这个心里有多绝望啊
1675863023,1534.29500,他对高启盛都不是真正的爱 他在他们死后 都迅速的将高启盛和陈书婷作为自己一段可以用的记忆和谈资
1675862862,421.71600,绳子这个算是多解读了
1675862806,797.81600,陈书婷要是真的想要找个老实人就不会把高启强介绍给陈泰。。。人是复杂的。。。欲望是无尽的。。。
1675862798,406.76900,打雷姐！！！！
1675862711,732.97000,那一碗猪脚面
1675862668,1120.87300,成年人的爱本来就很复杂
1675862641,883.75500,可能也不是深思熟虑，就是突然一激灵觉得送这个东西比较好，本能反应最可怕
1675862429,397.49800,BGM:summertime sadness
1675862267,1466.69800,狐假虎威
1675862241,1095.77100,黄瑶继承了高启强的表演 高晓晨继承了高启强的暴虐
1675862202,1095.77100,高启强的三个孩子 高启盛完全继承了他 表现为一个高启强在有保护的情况下会成长成什么样子 高启盛短暂的生命就是高启强完整的隐忍到疯狂的缩影
1675862167,1668.79900,流泪的同时他是有跃跃欲试在的
