1675862038,869.92800,确实，一开始觉得送橘子是实诚，后来越细想越不对……
1675862000,470.60500,坐小孩那桌
1675861991,1561.53900,这里的高启强，还有教唆纵火那里，直让人脊背发凉
1675861832,943.84500,司机一直是陈泰/陈书婷的工具 程程只是也学会了
1675861780,404.17900,妈呀说得好
1675861738,1723.57700,说的太对了
1675861677,275.85000,这个解读很有意思！
1675861456,609.88500,安欣释放了高启强的对权力的唯唯诺诺 陈书婷释放了高启强对人性的含情脉脉
1675861405,1526.35000,唐家三少
1675861197,1113.07900,这样看高启强真没那么爱
1675861151,1520.50000,这不就是亡妻魂环嘛
1675861124,1219.87700,虽然高启强很坏，但这里张颂文好他么帅
1675860978,1038.05900,陈书婷在和高启强这段关系中丢掉了自己
1675860819,924.71900,泰叔在亲密关系这块也挺惨的
1675860645,1520.43800,鞭尸亡妻魂环了
1675860617,1524.96800,其实我觉得这个看每个不同的人，我的爷爷奶奶走了以后，我也经常和朋友们谈起爷爷奶奶
1675860574,827.41900,索取，这个词太精确了
1675860444,728.83900,分析得真好，学到了
1675860164,753.53500,超长劳斯莱斯啊
1675860000,375.49900,这分析神了，陈书婷和高启强是相对而行的，最终活成了对方开始的样子
1675859824,295.47900,分析得太好了，前期因客观原因压抑的个性，逐渐生长释放
1675859769,732.59700,我其实有时也好奇曹操是不是也有点缺少母爱
1676059091,66.49200,过度解读不好，陈颂文本人也说了高启强就是爱陈舒婷的，因为高启强是第一次恋爱
1676052008,626.77900,大师，我悟了！
1676047356,98.71700,高说过，书婷是他的初恋！怎么就不能是真爱？你对爱情过敏吗
1676044605,1263.72100,他背后一群兄弟
1676042742,1074.63000,真·养老送终
1676040262,1724.28700,及时止损啊
1676030235,13.73900,我觉得不爱吧，因为编剧好像没交代他们怎么在一起的
1676029756,26.61200,爱，但不完全爱
1676029473,84.54100,来！你敢说个完美和珍贵的么？谁拿放大镜看还能完美？
1676016484,1040.90700,其实up刚才没有泰叔就失去与高启强平等对话的权利的观点就是不对的
1676010723,632.07300,太细了
1676009780,419.79800,一万人心里有一万部哈姆雷特，
1676001294,618.53900,迟来的青春期哈哈哈
1675997160,489.93200,标准站位不都是孩子中间，父母两边么
1675993459,206.92900,先有的小说，小说更加黑暗的
1675991356,696.21100,前面很多夫妻像母子，再提一个现在很多父女也像母子
1675990924,242.20200,有没有可能这只是高启盛的借口
1675987980,871.06500,局
1675975822,443.57900,很想知道觉得过度解读都是些什么人
1675964135,143.60800,感觉是真爱不是纯爱吧，能做大事的人很少会把感情看很重
1675958972,600.95700,毕竟原来带弟妹是又当爹又当妈
1675953954,1702.71900,独生子女:？？？？？？
1675953880,471.00300,…………这种家庭合影不是很常见吗
1675953169,1639.92500,希望这个世界多一些安欣，少一些高启强
1675953030,453.18500,疯批互文
1675952563,1579.93700,我也觉得在试探呢
1675952514,1287.56800,这就不对了，一条腿是高启强能做出的最大让步，毕竟他没证据，还不能撕破脸，
1675949926,611.60200,男妈妈（不是
1675949807,1697.39000,大部分人都是这样的
1675947705,422.21900,作品解读本来就是二次创作的一部分，敢解读比不敢解读的人创造的价值更大一些
1675947447,228.06400,长兄为父
1675944389,1079.32100,…泰叔和建工集团是第一批被打到的涉黑团体啊，是强盛集团前身，
1675943468,1309.53900,只在刚开始同情他，越后面越觉得他罪有应得
1675941914,1596.28300,很明显了
1675938455,701.58000,哈哈哈哈哈，还自己扶起来
1675935923,1416.00900,都怪安欣给了他一本孙子兵法
1675934183,436.58700,文学解读只要符合原文逻辑就不存在什么过度
1675932943,1005.66200,他疼高晓晨不让他沾手公司，让黄瑶做，能是什么好心
1675930871,1677.10500,不，我觉得都有，当然更多的是对自己前途的哭泣，但是对于人命就值这么一点钱真的没有一点思考吗不见得吧
1675929862,53.03100,语文阅读理解
1675929440,882.04300,很多东西不需要导演或演员意识到才能表达出来，无意识的安排中就会透露出很多东西，这就是多元解读的乐趣
1675929432,458.59900,怪不得 这样子才能做夫妻吧
1675929421,99.56700,陈舒婷想过普通人的生活而不得
1675928164,1341.41500,按荣格八维讲，张颂文使用Fi，高启强使用Fe
1675927685,1287.50200,他一个黑社会，疯得要死，杀人还要讲证据？？？？
1675927560,1632.90000,所以全网心疼高启强的时候，真的是三观歪成啥样了
1675927296,1309.42400,现实中高启强类型的人很多，只是有大成就的少
1675927293,1410.83200,不爱所以不会生气
1675926097,609.08400,算不算说明，女的本可以非常强悍的事业，但都被父权的家文化束缚了
1675925640,413.54500,不一定是过度解读啊，演员也是因为自己的理解改的戏啊
1675923216,885.10000,高在面对权利者，会下意识地装可怜
1675920224,71.80600,他的真爱是安欣
1675920188,1689.31400,冲这句话，点个赞
1675919468,1716.86800,确实
1675918551,882.40800,卧槽
1675918508,1670.16700,当时我也是很能get到，无法回头的恐惧和悲哀
1675918350,4.41400,不懂就问，什么叫be?是中文翻不出来吗?这不是中文社区吗?
1675918291,1403.68700,曹操更合适吧，哈哈
1675917906,434.13800,作品在面向公众后，就已经将其被分析的空间扩大给每一个人了
1675917600,584.48500,讲的很好啊
1675916993,1683.22400,他说过如果听了安欣的现在还是一个卖鱼的
1675916518,1437.23600,老默为他老婆报了仇
1675916317,296.93000,人真的无论什么年纪 只要有机会都想为自己而活
1675916103,247.71300,有疑问的，是因为这段编剧就是要表达高启强的虚伪啊
1675915184,828.31800,神爱世人来到世上死在了十字架代偿赎价赐给人永远生命在真耶稣教会
1675914579,1319.24200,真的，换个人来演真的不一定那么多人喜欢会共情起来
1675914575,256.71800,哪有几千万，小灵通撑死也就几百块吧，几百万
1675914442,998.11500,完全不理解为什么有人骂黄瑶 要是我我恨不得亲手杀了高
1675913930,1585.29500,《他人是不错》好狠的心
1675913270,1431.60400,老默作恶多端，但情感是真实的
1675912091,480.20600,完美融合的
1675911194,413.29600,过不过度的无所谓，up这么讲挺有意思的
1675911109,419.65900,文学作品解读能自圆其说就可以了
1675910998,287.07600,有意思，看剧的时候不容易注意到这份隐藏的欲望，他想没有牵绊地活
1675910557,1025.25100,高的约法三章他想遵守就遵守，不想遵守有反制手段吗？
1675910526,1346.03300,高启强真的很会演
1675910525,1019.13400,陈舒婷失去了制衡高启强的泰叔，进而失去了和高启强平等对话的权利
1675909760,84.59800,上午11点2000多人看，大家都在摸鱼嘛
1675909628,1596.38000,第一次试探失败，所以后面想到了用瑶瑶来威胁这个办法，成功了
1675909512,158.77800,原著高启盛爱高启强
1675908721,90.77400,啊对对对
1675907704,91.45900,对男人的要求已经这么低了吗
1675907481,220.97800,长兄如父
1675905796,4.25900,他超爱
1675905350,1626.71500,什么尼诺萨拉托雷。
1675904904,1368.82700,他说了，陈书婷是初恋，爱一直爱
1675904787,261.09500,？连老婆都没找怎么要孩子
1675904732,3.90500,吓我一跳，我心说什么弹幕跑那么快
1675904612,121.73700,You never satisfy never satisfy
1675904305,97.79000,能做到不出轨都不错了
1675904139,675.70900,这本身就是爱啊，因为在爱里，所以很大胆很自由的敢做自己
1675904062,135.93100,的确，单编剧都会吃设定，多人编剧就更难了
1675903024,1060.67800,这么说kswl
1675902852,1424.15200,确实高启强对于弟弟启盛的管教更多了一份父亲的威严
1675902606,1716.84200,别寄托在你家《哥哥》身上，迟早要塌房的
1675902584,434.12200,文学作品完成过后，神权就流落到读者手中
1675901638,1609.31200,高很早说话就滴水不漏了  只是情绪化的行为控制不住 这也是塑造人物立体性嘛
1675898836,269.40000,不健康，要不上？
1675895429,1375.11800,我没有，他一开始利用安欣我就觉得他阴险了
1675879471,1257.81700,冲动杀了蒋天才是爱？不需要考虑其他家人了吗？？
1675879330,91.25400,爱与不爱不是挽留不挽留来决定的，你爱她难道不想让她过的好吗？你挽留的是她还是自己的面子呢？
1675878832,640.33500,所以爱有时候是一个很复杂的词，怎么能不爱呢
1675878481,711.04600,陈舒婷是严母，安欣是慈父吗233，奇怪的CP增加了
1675876007,1281.72000,不是划伤，手上本来就有血...
1675875287,107.98800,所以两个人分开是必然的，哪怕没有车祸
1675874893,1069.16100,陈书婷影子是黄瑶
1675874767,1656.12300,刘邦
1675874740,191.14400,我看这个剧的时候，一直觉得词就是循环
1675874652,115.26400,相交的两条直线，最后渐行渐远
1675874376,289.93900,很有意思的解读角度！
1675874337,1326.88700,我一直都不觉得他是演的
1675874003,692.29000,陈书婷的格局！！
1675874003,1291.38900,跟他弟弟死的时候一样，很快就认清现实了
1675873796,855.82600,他给安欣送时还只是一个卖鱼的，没什么钱。
1675873588,563.57900,对，陈对高是恋人，母亲，恩人，资源的多位一体
1675873363,1281.92100,早就有伤痕了
1675872851,14.44800,妈呀半夜12点2000+观看
1675872622,45.41900,陈书婷自身的求偶倾向难道不是她悲剧的主要原因吗？
1675872078,1648.07100,小说里，甚至就是高启强背叛了高启盛
1675871547,576.79300,想要一个家
1675869987,200.89800,我注意到了，以为是编剧告诉世人做坏事没后代……猴头
1675868701,1661.41200,【这段天台的戏BGM叫鳄鱼泪！】
1675864606,1711.83400,作为女性up主 这样的观点可以理解 但我还是觉得他俩的爱比up分析的要纯粹点
1675863339,32.37900,有
1675862715,557.24600,酷
1675862428,609.20800,有道理诶
1675862175,287.05400,up主的解读最准确！！！
1675861636,1354.41900,我靠套娃是吧（张颂文演的高启强运用了张颂文的共情能力
1675861182,5.18100,热乎的!!
1675860818,241.21800,对，这里我也有疑问
1675860765,1602.60700,目的性其实很明显，不然根本不会提
1675860383,15.78400,来啦~~来啦~~
1675859504,58.19900,高启强最爱的是他自己
1676049558,611.75500,解惑了！牛呀
1676039811,1411.91900,高级演员啊
1676036073,1733.58100,父亲和老公，还是父亲
1676035680,1697.82200,其实不管什么时候，这样的人永远都存在，我们能选择的，尽可能是作为人的那份意义
1676034715,95.93500,爱这个东西本来就不是非黑即白
1676030474,71.85900,那是想依靠陈背后的势力吧
1676027626,221.46200,我记得一开始高启强还是卖鱼的时候跟安欣说过我就是他们的爸爸还是父母来着
1676027444,32.49400,12
1676023078,586.50200,主要是因为他没有出国留学23333
1676015693,1677.64200,为了他那死去的情感而哭泣
1676014344,350.02000,他没有哀叹高启盛把他带上不归路
1676013912,262.14200,为什么不能解释
1676013434,89.82900,他俩也没背道而驰啊可恶
1676008216,523.77200,高家不养闲人
1676006194,312.51500,高跟他继子飙车是为了驯服他继子，怕继子在非常时期再惹事
1676005504,1661.60700,别说小说了行吗，除非小说是编剧自己写的，其他都别管
1676005088,1712.58200,完蛋了 我感觉我是这样的人
1676005058,1640.18100,而且从高启强每次见老爹，时刻把集团和老爹挂嘴边，他真的太懂别人心里想什么了
1675999326,711.96800,有一种李治和武则天的感觉……
1675998391,90.67900,现在观念应明确：不出轨不找小三是基本要做到的，而不是所谓优秀，完美
1675992163,608.77800,这个牛了！给币
1675973680,242.88200,那个时候他还没当上董事长
1675964810,1595.84000,高着呢害惨了无数人
1675961549,472.37100,一般这种家庭合影和会让这么大的孩子站中间
1675953817,412.86500,过度解读
1675949964,102.09400,我觉得是真爱吧，如果前面只是利用她后期陈没什么利用价值了他还是把她找回了。
1675948733,53.26200,初恋，能不爱？
1675946827,5.67100,阿弥陀如来
1675946504,692.43400,大男子主义的看法：好的妻子是贤内助，能相夫教子，安抚丈夫的情绪。
1675944738,1627.14300,是指感情是空的，假的
1675940285,1279.57200,我突然想到了铁胆神侯朱无视
1675939651,1384.64900,我好喜欢up这种分析！真的有意思
1675939460,1264.21900,噗……up真的犀利
1675938714,632.08700,好的作品真的可以从各种层面分析啊
1675938620,1580.42500,分析得太好了
1675937843,846.31100,陈书婷算上小叔子这算是养了三儿子
1675936590,333.41000,我觉得可能是陈书婷不想让高启强差别对待亲生和非亲生的儿子吧
1675934229,438.08300,不要因为你不喜欢或者不同意就说是过度，你可以直接说你不喜欢或者不同意
1675933027,15.88200,六十岁大爷冲浪吗？be都不知道？
1675931004,228.94500,长兄为父
1675930793,1670.17200,那你敢说一点都没有吗，起码你看到徐雷死的时候是惊慌而难以置信的
1675930708,828.47500,婚姻关系尤其叠加生育关系 本来就是在压榨母亲
1675929666,12.83700,初恋你说爱不爱
1675929544,257.05900,说出不起的看上一期
1675928373,27.04300,张颂文本人自己说的非常爱，，
1675928365,885.22400,这个绝对不是过度解读，uo说的很对
1675928177,1437.44700,老默真的悲剧人物
1675927231,116.21800,陈舒婷以为高是她能控制的了的，只不过后来高对权利的贪恋越来越大，控制不住了，这是演员高叶说的
1675927195,1286.95500,在一个复仇瞬间衡量这么多就已经说明复仇不是第一重要，如同各位网友的马后炮
1675927110,109.67800,陈舒婷选择高就不低调了，还低调过日子
1675925207,880.03000,高和安，假无害和真无害
1675925152,670.86300,他俩演员演得太传神
1675923252,200.93300,坏事做多损子孙福德
1675922911,1726.17000,太难了，好多男的连对自己老婆好都做不到，还不如高启强呢
1675921321,66.97900,但演员都是带着很爱非常爱陈书婷这份信念感去演的   你非要说没那么爱  张颂文老师都不想回你
1675919959,1633.32900,是的，一切表面的善都是模仿和根深蒂固观念的驱使
1675919817,618.72100,这里十分赞同
1675919677,418.95600,这就有点过了，高叶说勒脖子是她临场想出来的
1675919346,13.66600,badending 
1675919074,1397.33300,响哥眼尖啊
1675918982,83.72200,一半一半
1675918326,423.85400,文学解读就是要这样多方解读，不喜点左上方别看
1675917450,433.91400,讲的很好啊
1675917297,1424.79300,妹妹高启兰也是一样的博得弱势，只是比哥哥更加外放
1675916857,577.31700,这很潮汕
1675916580,5.60500,至少我相信是真的爱了
1675916558,697.12000,熊孩子哈哈哈啊
1675916447,423.14300,一个是甘愿被累，一个是想做自己
1675916235,1656.69500,我有一个疑问，他之前想去自首能不能解读一下
1675916222,828.52100,是精神上的索取
1675914513,1308.35400,这个剧里高启强和安欣就是对立的，安欣就是很纯粹的，高是有但是没那么纯粹
1675914029,1376.29900,没办法，他太有魅力了
1675913557,1627.95000,是说感情空啊
1675912825,411.54100,lana del rey
1675912307,296.94500,好多恋爱脑啊
1675910447,122.75800,不扩张别人就不会对付你了吗？入了江湖就再也别想全身而退了
1675910415,5.34400,对！！！
1675910141,286.92600,死前高启强就愿意为了陈不要孩子，死后怎么又愿意？
1675910089,1271.28400,这段重点不是王秘书怎么看，而是高启强没有反驳也没有情绪波动
1675910053,1321.33400,王一博：不可能，绝对不可能
1675910023,1585.95000,自己不下手才要找替死鬼啊
1675909437,59.29000,不是哦 最多的可能就是皮肉关系
1675908893,1075.18800,另一种吃绝户
1675908372,71.91800,他主要是利用吧
1675907821,855.82800,都是他的兵法
1675907048,96.90800,高启强只爱弟弟妹妹
1675906664,248.05400,陈舒婷死后他都没再找老婆，去哪要孩子
1675906181,137.21800,初恋，你说呢？
1675906149,433.57700,解读不存在过度
1675906025,1391.33000,他不是杀晓晨，那是他雇人砍人，然后晓晨看见他被砍了之后自己冲上去了所以才被砍了
1675904251,453.30100,但是高晓晨那个不算疯批，那是为了想高启强证明自己行，高启盛是真的疯批计划周密，在给徐江提供甩掉警察路线的时候就体现出来了
1675903923,329.21500,完全不认同
1675903691,286.91800,生不出不行吗
1675903381,45.90200,好的，他真爱安欣
1675903277,1703.02300,过渡的贬义了，恰恰高启强这样的价值观，占现代社会中的大多数。
1675902200,84.17800,能做到这一点已经很不错很不错了
1675901480,1602.69900,不想杀何必试探 这也没啥可洗的吧
1675900958,269.61900,他不行
1675899812,608.87900,确实  让我这个丁克族有了更深层次的自我认知
1675896690,290.09300,当今多少不婚主义其实也是这个动机
1675891241,221.37700,兄终弟及
1675887321,880.68000,￼
1675884684,45.78000,我都不想理你 爱 非常爱
1675883811,1036.13200,她要保护自己的“家” 必然向着高启强 这个家是一家三口构成的
1675883445,1595.76000,老默：这么多年，听强哥的话做事准没错
1675882983,1717.07600,只希望相信他俩有纯粹爱情的人现实生活中别遇到这种高段位的歹人了。。。
1675881959,1416.25600,这里的草莽是指性格，不是阶段……
1675881526,1292.36000,但是当时开枪，还不是自己的地盘，被抓现行不就没得玩了
1675881320,152.55900,这错字也太多了
1675881016,703.44000,母亲哄儿子，老婆哄老公，哈哈哈哈
1675880441,1432.07000,高对安欣也是真感谢
1675880061,83.43100,啊对对对
1675879975,444.09300,但勒脖子在链条上来说也只能说牵强
1675879487,1287.16700,是啊，蒋天都愿意为了家人跳楼。。。只能说高的爱并没有那么深
1675879242,626.87500,他一生中为他最好的两个人，打破了他手上和脚上的枷锁，却给人民带上了项圈
1675878325,1670.96200,我同意，我觉得他只是在为了自己死去的那一点正直而哭
1675878305,436.67100,作品一旦完成，创作者就不再有唯一解释权，只要这个解释是符合逻辑链条的那就是成立的
1675877951,1014.16400,我只记得养老送终，不接受养老直接物理送终
1675877241,459.05000,这就是传说中的重组四口家庭了
1675877087,321.27900,我觉得泰叔是有儿子的，但是后来夭折，他们那行太危险
1675876712,1416.01000,他妹也擅长
1675876185,1375.49100,高启强不是，徐江才是，所以泰叔一开始抬举徐江
1675876088,1258.36900,但如果是母亲没了孩子，报仇是会豁出一切的。
1675875995,1347.73300,高启强借用了张颂文老师的共情能力给自己披上了一个人皮的假象，天啊这个解读
1675875889,1368.93900,是呢，我爸看完之后还觉得高启强是挺讲义气的人，因为他有能力却没动安欣，以及把旧厂街改成商业街。我说他做的这些才是他伪善的证明
1675875679,1041.57400,怪不得陈淑婷后来要离开
1675875487,882.01500,我觉得这里也不是过度解读，他之前求不要动摊位和开店的时候送礼可都不是这种有心意但不值钱的哦
1675875352,1614.70600,演技真好
1675875148,276.60300,对高启强来说，比起晓晨，高启盛更像是他的儿子
1675874048,191.86400,其实想说高启强会不会潜意识把安欣当成某一种慈父的替代品……
1675872851,131.03800,别听她说了什么，要看她两次挑的是怎样的丈夫。跟着这样的丈夫能过安稳日子吗
1675872614,419.35100,文学作品需要过度解读，up解读的好棒
1675872532,1060.81600,鸡皮疙瘩！
1675872383,1056.53700,没那么复杂。。有仇家就有被灭口的风险。。
1675871927,999.34100,所以怎么会有人去骂黄瑶？？？
1675871523,557.56500,各司其职
1675870829,1297.92400,up主一直都没有否认他们有感情，只是确实太复杂了
1675870104,1689.62400,二十几集的时候 小盛没把李宏伟处理干净逃跑以后  安欣和陆寒去找高启强对话时说的
1675867303,910.45700,我还以为他想提醒她徐江要进局子了
1675867018,90.24600,确实
1675866584,853.71200,他给安欣送的也是朋友给的什么东西！
1675865232,1354.48800,这段分析得太好了
1675864158,837.34900,宝藏up
1675863572,237.05800,有没有可能亏空太大了，他也出不起
1675863457,1292.26500,这个也不能证明没感情吧，比起报仇选择了利益
1675862766,602.75700,太酷啦
1675862568,1648.65000,刘邦啊
1675862566,646.42600,牛
1675861915,719.39900,高启强：陈书婷是能成为我母亲的女人啊
1675861910,290.46100,说得很到位
1675861854,866.22900,所以你认为这个橘子也是他精心思考后“挑选”的礼物？
1675861109,1309.01400,毕竟十佳导游
1675860699,872.44000,老高真有你小子的
1675859701,208.35900,绝后，传统意义上最狠的诅咒
1676054148,1298.33600,-++++++++++++++++++++------------------------++
1676044700,712.07900,宜家的凳子 我家有一个
1676042521,1266.75700,因为蒋天确实不是一个随便能杀的人啊，如果是其他人就算没证据他肯定也说杀就杀，但蒋天他有了证据才能有理由
1676039799,1404.39900,心机深沉
1676039041,453.68400,我也觉得后期的高晓晨承接了高启盛的一些戏剧作用
1676022507,32.58200,你当真了
1676020795,244.00800,恨铁不成钢？
1676018848,1416.61800,高启强生气是眼睛看起来黑雀雀的，好恐怖的样子
1676015273,1293.49300,高赞在说什么？？？？大家不都是在评电视剧么？让不你出去看连头发都不能彩色的动画片吧
1676014973,1628.67500,空才好用计谋，因为不会被感情所影响
1676014956,1051.53100,这其实也是许多女人做家庭主妇的缩影，主动让渡自己的权力，让自己的人生被别人把握
1676013727,249.67800,他哥不知道小灵通的事，高启盛没跟他说！
1676005984,6.05700,他不爱大嫂和弟弟 是我听过最扯的一句话
1676003439,888.10300,导演想得不多出来的就是平时那些粗制滥造的剧，导演能控制一切让你看到的东西
1675990883,473.10800,这合照我这个经常被老师骂过度解读的都觉得确实有点想多了姐姐
1675986663,614.17700,男妈妈
1675968713,971.43200,程程的弟弟是陈书婷安排的吗？
1675958842,494.79500,高夫妇典型不是一家人不进一家门
1675957788,1594.71800,伪善的嘞
1675953500,209.22100,李响呢
1675953493,6.74000,当你试图和敌人共情的时候，你的是非观就已经扭曲了
1675952214,879.74600,对安欣也是这样装的
1675950331,18.05900,爱，但是没有那么爱
1675949348,1656.71400,书里高启墙骗弟弟高启盛回来并报警都
1675945006,1264.79200,你这里是没有证据证明是被他杀得，你典型的过度解读
1675939917,73.30900,如果贪图肉体欲望去找小三，那他就不是那个模仿人的野兽
1675937369,857.46900,前面弹幕安欣也住别墅吗
1675934683,480.52800,？
1675934401,627.03400,讲得确实不错啊
1675934282,461.29100,阅读理解怎么了呢？人的思维本来就不是单线程
1675933457,1365.01900,entp和infp的区别
1675931289,95.73200,天呐不出轨是婚姻的道德底线吧。。。。现在要求都这么低了吗
1675931283,6.54500,爱她，就杀她的崽！
1675931035,42.49600,我感兴趣这个话题
1675930133,541.62700,自己身边要有位能把一切都打理周全的太太，谢天谢地谢太太
1675928641,1595.44500,擅长煽风点火拿人当枪，这种人可怕
1675928408,110.53800,太对了
1675927248,1689.96700,在家里和安欣说的
1675926858,89.07400,不够完美，但是依然珍贵
1675925713,1661.92500,小说就是原剧本改的。
1675925401,1062.58800,up这里搞错了喔，陈泰退居了，是徐忠家的邻居
1675924163,1718.22700,好爱up！
1675922553,608.62700,这个解读好绝
1675920976,1349.55900,张颂文老师演自己
1675919902,1258.57000,有被帅到
1675919734,1025.37300,而且哪里遵守了啊？产业洗白了吗？（我理解的洗白是要真的白，而不是外人看起来而已）还有伤天害理的事情不再做了吗
1675919701,1718.14500,这段话说的极好，女人，如果打算经受生育之苦，最重要的就是学会看人，看不准真的会毁了自己半生
1675918985,1703.66200,对付这样生在暗处的人真的很麻烦
1675918253,411.40800,文本分析和文本作者无关
1675917199,490.28800,这个分析很对啊
1675916381,117.71800,小猫和小猫的食物都不会长大！～
1675915779,1671.28400,叶惠美
1675915535,59.43100,爱但是不多哈哈哈哈
1675912744,1308.34800,张颂文改的不是那段剧本好吗，别误导人，他只是把高启盛和李响的死更合理化了，举报没有根本没提
1675912347,1021.12400,其实主要是倒叙了 很多东西看不出来
