1675905686,99.76000,四个射手就完了
1675901657,144.25900,lbj打无球，参考11热火
1675897496,17.16500,比大师震怒
1675887028,340.17100,垫脚？字母直呼内行
1675884571,145.21800,很差
1675884290,262.69900,黑子键盘nba乱攻
1675880088,267.26900,最近看海兰德深有感触
1675880021,212.38900,哈哈这个好像说的是以前的字母哥
1675879634,212.48000,快攻，上篮不是技术，后仰打铁美如画才是
1675877543,282.25100,伟大而不职业
1675876930,275.66900,历史第一？库里是每个球都三分吗？魔球哈登也不是次次出手都三分啊，都是正面攻筐
1675875973,107.34800,有没有一种可能20园区的詹姆斯换一个全明星也能夺冠
1675874452,262.45900,还是太依赖队友打挡拆吧
1675873438,229.30500,塔图姆就推不起来
1675873139,129.52600,威少来湖人之后詹姆斯不就打了一段时间5吗
1675873019,53.59500,问就是持球刷数据，不吃球甩锅
1675872912,229.30700,很蓝的啦
1675872583,340.25900,说着又来了一南斯拉夫..
1675872277,340.27700,这一招确实玩的最6
1675872171,316.47100,还有关键时刻罚球
1675871933,136.18400,打五是只可以打五小的五，常规时间肯定打不了五
1675871921,262.50300,很难，但这是詹姆斯啊，我们说他不是历史最牛的几个，你非要说他是平均线之上来说我们是错的
1675871330,157.62200,右脚点地了呀
1675871084,229.29300,这会不会是因为他不回防呢
1675870841,229.41200,历史失误王？
1675870778,254.68500,那些黑子会不会打球都不一定吧
1675870776,353.34000,我滴个乖乖这个背！！
1675870670,114.03400,前面整笑了豪华三巨头第二轮
1675870398,157.43700,南斯拉夫步
1675870368,234.33200,@比不中说篮球
1676079576,316.33000,移动挡拆的能力
1676049698,256.07700,真打过全场的，就知道这有多难了
1676041642,330.28300,很多是同脚偷步，南斯拉夫步那得是完全持球了，别云
1676029046,212.29500,1对0
1676021726,212.14300,你不是历史第一？
1676018311,236.34800,威少防守到位？要不要看看威少防守排名
1676017947,316.16300,推土机名不虚传啊！！
1675989941,129.99800,科比：别骂了别骂了
1675957552,235.85900,三分不比突破简单多了
1675943153,274.74000,攻框能走八步当然难防啦
1675938693,129.80300,你说这个就会有黑子说他啥都不行了
1675936886,81.29900,冷知识：詹黑不看球，只看片段
1675928873,274.68300,对标班赛？
1675926371,54.59000,哈哈哈，和后卫比
1675917601,340.86000,《及其精妙》
1675913014,81.27800,不大包大揽，只是要核心战术地位而已
1675907799,262.78200,这里up是不是没提NBA的防守三秒
1675885674,65.17300,20年是控卫还拿了助攻王
1675884516,341.03900,经典印象流，联盟是不是除了詹姆斯没有2米多这个体重的球员？既然没技术，那么第二个詹姆斯呢？
1675881884,163.92700,我就问总决赛没有球权场均八分咋回事
1675876343,163.65700,南斯拉夫步
1675873755,236.21900,经典攻框不如投篮
1675872269,275.04700,直接撞开
1675872247,354.61900,抛投？？？
1675871664,353.94900,《普通球迷》说谁谁知道
1675871445,263.66600,我打班赛过防守人就是一步过，但是打全场队友不拉开我面对协防真的一点脾气没有
1675870674,255.33900,确实，我183到现在都不太会攻框 一般都直接拔中距离
1675870653,113.54500,给阿杜哈登欧文了，还说啥。。。
1676082561,235.91500,这条都黑的hp打球吗？
1676082440,120.81300,这个时候你甜蜜又来讲道理了是吧？狗不狗啊黑子
1676082014,41.82000,詹黑就一定是库蜜？什么nt逻辑
1676078770,13.73600,也中
1676077592,335.57400,说肘子开路的身体挺娇贵的吧？怕推你一下给你推翻咯
