1675962683,152.93900,他无球弱？？？没看过他打快攻吗，你们主队随便什么人都追不上
1675961596,7.06800,历史第一中锋
1675960814,27.37800,quh还洗
1675958420,104.53600,事实就是詹姆斯夺冠需要一个没他也能夺冠的阵容
1675958293,378.02500,我库密我爱詹姆斯，激进詹密别以偏概全
1675955823,138.81900,自带体系说白了就是技术非常全面，球队的战术选择会成倍增加
1675953312,7.60300,别碰瓷乔丹了，好吗？我摊
1675952401,21.26500,重点是国内的
1675948941,314.31800,结果是吧，现在湖人排第几啊？
1675947564,201.40900,光头球昂
1675946242,181.41900,说实话，我觉得詹姆斯比乔丹强
1675941733,7.48500,《误解？？》
1675941176,126.31300,都不精通
1675941027,35.09400,库里没有杜兰特总决赛裤衩子都被打出来了，附加赛更是被亲手绝杀
1675941003,251.90900,确实，你要是没篮的话只要一堆人站在内线你真就一点办法也没有
1675940951,90.33900,现在是必须是四个75大
1675939460,229.58400,塔图姆
1675938668,68.25600,黑子：甩锅
1675937529,292.47100,詹姆斯手活非常细腻，那些突破进去对抗的球一般人打不进
1675937459,257.59900,太简单了对黑子来说
1675936004,159.69900,巴里亚？？？
1675935824,25.67400,好多论点都是秽土转生球迷遗留下来的
1675934129,61.43000,抱歉，打铁果壳第一
1675931944,125.15600,霍华德都抱团，得，省级联赛巨头
1675931844,231.48400,真的吗 那为什么今年快攻命中率联盟百名开外
1675931488,335.73500,会和精通能一样吗
1675929861,286.42700,塔图姆进去就被切球
1675929390,21.52000,威少走了，谁背锅？
1675925316,32.31800,我运23秒传出去，跟我最后一秒接到球触球次数不一样？可真会找角度
1675924430,21.19800,哈哈不就是吗
1675923765,231.56200,比如塔图姆
1675921766,265.48700,那么多哨子怕什么呢
1675921702,293.40700,好意思说技术为结果负责？什么结果能和冠军比？
1675921385,83.34900,第一点还有数据，后面纯主观夸赞了……
1675920946,39.34600,詹姆斯历史第一人！！！詹姆斯历史第一人！！！
1675920939,39.34600,詹姆斯历史第一人！！！詹姆斯历史第一人！！！
1675920842,21.78600,詹姆斯历史第一人！！！
1675920732,174.15700,别误会 他只是不如你们说的那样伟大罢了 前8还是可以的
1675920617,252.03800,关键我们身边有詹姆斯身边那么多射手拉开空间？偷换概念真有一手，别搁着意淫忽悠人了
1675920590,131.37000,干拔跳投都不会 能打得分后卫？
1675919702,61.17300,詹姆斯是无效持球啊，自己尬运15秒
1675919116,342.27700,黑子们CPU过载了，只能不断重复那些无力的言语
1675918507,181.28700,解说这段他自己都配的NBA之外的比赛视频，哈哈心虚
1675918119,27.92100,不黑詹姆斯，就黑李姆斯王姆斯，总需要黑点啥
1675917298,83.56900,是的 因为他并没有持球攻坚或者高超的组织能力
1675916558,75.65700,啊对啊，他敢投吗
1675916207,286.63700,联盟第一的出手次数，得分效率比东契奇少的多
1675915861,342.77900,这。。。。。
1675915038,279.62600,可是历史前二十也没几个有詹姆斯的快攻能力啊
1675915013,34.28700,黑子根本不想去了解这些
1675912061,167.19300,既然无球能力这么强，为什么球不在他手上时他在场上站桩？不愿意打无球？
1675912037,118.00700,众所周知，老詹从不回防
1675908307,75.66300,出手次不高：尬运20突不进找人甩锅/弧顶发牌
1675905752,264.22200,过掉第一线防守人，我就看到了清一色的对面球员
1675905034,300.81900,大道至简
1675904534,55.54500,保罗什么位置，詹姆斯什么位置？
1675904157,180.96900,不懂就问詹姆斯能跑无求定点三分吗？
1675903447,55.59800,视频是耐克的教学，有年头了
1675903258,12.13200,只因把型得分图
1675902977,153.35800,什么叫无球差，无球的时候面前五米没人站着就叫无球差，是谁我不说
1675901784,97.08700,jr
1675900339,68.58100,西部十三
1675899826,216.37900,不回房当然厉害
1675899411,384.57900,来自于黑
1675897317,209.42500,摊手绝对联盟第一
1675895413,256.65300,说突破简单的，估计都没打过篮球……
1675893062,98.01500,还有配备的阵容是这个阵容把老詹拿掉 换成普通的全明星也还是夺冠热门
1675888146,131.23900,20阵容好?季后赛开打都说湖人黑一
1675884412,300.85100,大胆！只有美如画才叫技术
1675884151,245.39600,被两三个人联防别说上篮，突进去都难
1675883774,117.94700,他只有三巨头模式才有机会夺冠
1675883152,321.09800,我要是打球有一半詹姆斯的水平我都能在CBA里摁着郭艾伦打了
1675882608,237.87200,对他来说罢了
1675881804,201.46200,笑死了，你点不点赞关系很大吗
1675880675,231.23900,那为什么队友总是要4打5
1675879902,126.45400,这个支持，他有很强的托底能力
1675878912,47.70100,大哥，咋们都是看了比赛全程的，防都不防，手也不伸，回防散步，快攻神速，你告诉我这是什么打球方式？
1675878809,272.64100,打班赛没哨子么？没打过比赛就承认呗，以后长大了有机会打的
1675877668,394.81300,快速回防
1675877259,104.71700,麦基：彳亍
1675877230,292.62300,结果就是4个冠军，那为啥他能把位置摆到那些冠军更多的人头上呢？
1675876249,216.38000,你说的是字母
1675875536,348.87700,就詹姆斯这个快速移动中的转身上盘可以去试试，你看他做的流畅，自己做人直接就飞了
1675875061,47.98900,它们看不见的
1675874653,286.49900,架着肘子往里干，笑嘻嘻
1675874233,390.21100,三连催更
1675874004,131.90400,巅峰詹姆斯确实可以1打到5，球盲就是喜欢以老化的詹姆斯代入质疑这个观点
1675873834,356.57800,就这个减轻过重量的肌肉群，现在的联盟里95%的球员都还练不出来
1675873728,378.27800,承认他伟大很难。？
1675873542,146.81900,黑子坐不住了
1675873365,186.08400,说只看眼前不看现在的，搞得好像你们以前不找理由黑一样
1675873346,216.23000,就巅峰期来说，热火时期詹姆斯下快攻的速度无人能出其右，天天每日五佳球
1675873222,159.24900,杜兰特侧翼单挑就会个背身干拔还有什么？甜瓜的三威胁是会的还是咋的？
1675873056,145.36100,无球就讲一个篮下终结或者空位投射，那乔丹三分球是射手级别吗？就这硬坳我也会说啊
1675872716,320.99900,前面的有詹姆斯一半技术我做梦都要笑醒天天去球场打班赛
1675872689,270.56500,1v1单挑突破简单
1675872603,159.69700,谁说无球就要一直不停跑动？
1675872331,279.45100,只是因为他们喜欢的球员攻筐能力弱罢了
1675872128,83.97900,助攻王那年不是打的控卫？
1675872040,138.19500,58密最典型
1675871793,249.57200,詹黑怎么可能打过，篮球都没摸过
1675871690,237.59000,但凡打过球都不会这么说
1675871476,245.52600,你但凡打过野球也知道攻框不是件简单的事
1675871343,209.25600,也就老了，年轻的詹姆斯快攻少有敌手
1675871197,147.32500,那你有没有想过在历史侧翼詹姆斯的持球是顶级的
1675871127,110.75000,给你杜兰特MVP哈登你又怎么样了呢
1675871099,394.16000,为什么詹姆斯偏偏没有持球投能力，是天赋问题吗
1675871045,7.01900,这个图震撼
1675870548,251.27100,外面随便传几下，浪头，是班赛的缩影
1675870545,252.01900,打打全场就知道了，二三联防下除非你身体素质特别出众，否则直接突破基本不太可能
1675870468,97.78700,但是需要自己的二当家但是需要自己的二当家能和队手老大互爆​
1675870461,61.82000,控卫？不是中锋吗（doge）
1675870353,13.70300,普通球迷是指那些每场看一眼罚球数和正负值就开始评头论足的二极管艾瑞达吗
1675870125,7.35400,2
1676079637,377.40200,比库拉西只会移动挡拆三分强多了
1676079295,35.40700,只有国内酷狗说别人刷子
1676076057,389.66200,你币有了
1676075589,221.21500,说快攻是easy ball的应该不经常打全场比赛吧
1676061037,8.57700,库密
1676045533,193.22900,别扯这些没用的，聊聊攻坚球能力
1676042569,320.22200,黑子哭了，开始人身攻击了
1676040393,8.41900,我还以为篮球比赛的终极目标是胜利呢
1676036799,55.49900,刷子就是刷子
1676035702,7.01800,裤里球迷个个都是小区得分王当然看不上啊
1676035448,139.82200,哈哈哈每个领域都不是最强，攻框你找到一个比詹姆斯强的？
1676031731,279.11200,确实需要观察，不防守随时等着快攻
1676031503,266.41900,黑子估计都没打过篮球吧，但是应该玩过2k
1676029308,84.35100,黑子：说明他甩锅
1676016758,60.88300,说后卫不能和前锋比的，我怀疑懂不懂球
1676015152,173.51600,话如其名，业余。。。就直接大数据比是吧。。。
1676013358,179.59000,急急急急急急急急
1676010840,324.97300,稍微。。。
1676006712,166.82100,詹姆斯打过5，黑子们破防了，哈哈哈哈
1676005846,89.54700, 那你试试雷阿伦和欧文最后两颗球不射，你看星星现在什么评价？
1676005190,28.96000,关私信
1676004914,67.98500,选秀权全送出去换大腿来，废队第一人
1676004386,12.69900,这篮下都成光柱了
1676001755,55.37700,我要是老板，也让他打，不然亏死
1675999950,300.40600,光头强
1675999941,291.92600,guantouqiang
1675988670,132.21900,库里还觉得直接比乔丹牛，怎么没人黑
1675986876,110.31700,是不是对园区有什么误解 球员自己都说那年季后赛不好打
1675963198,215.61700,等你家哥哥38岁再说吧
1675962478,8.81900,谁有流量给谁做视频，数据向的up当然只看数据
1675959604,6.80200,不是普通球迷 是理性球迷
1675955056,348.50700,NBA历史上最全能的球员没有之一
1675954091,394.82300,省流：黑子连有哨子的全场都没打过几次
1675953536,10.19800,历史第二！！！
1675951163,256.33900,有点竞争性的比赛持球突破进攻都是特难的
1675949884,98.29200,韦德成射手了哈哈哈
1675945726,39.15000,历史第二人，第一还是乔丹
1675942295,192.47900,说库里是历史第一的，笑死我了
1675941685,245.97900,确实，投篮明显简单
1675941534,305.60600,天龙八步
1675938440,159.01900,无球两大项只会1/2也叫不差，是不是要求有点低呀
1675936657,89.49000,他有一次DPOY吗
1675932737,269.51800,你的启动加速指的是，利用队友挡拆启动加速过人叫一对一是吧
1675921854,28.81400,这帆船好多啊
1675921814,84.76600,别说了黑子听不懂
1675921343,117.50000,等等，这里说防守？放手我倒是能看到
1675921268,278.54800,没人说你突破不行 关键是你投射不行啊
1675921238,132.07900,酷狗焦密们来啦
1675920963,39.34600,詹姆斯历史第一人！！！詹姆斯历史第一人！！！
1675920934,39.34600,詹姆斯历史第一人！！！詹姆斯历史第一人！！！
1675920931,341.82500,南斯拉夫步
1675920863,21.78600,詹姆斯历史第一人！！！
1675920853,21.78600,詹姆斯历史第一人！！！
1675920847,21.78600,詹姆斯历史第一人！！！
1675920835,21.78600,詹姆斯历史第一人！！！
1675920788,266.43300,所以这就是一星四射的源头
1675918552,319.96600,利用掩护的能力甚至成了黑点
1675918469,252.22900,只有3v3才算简单，4v4起攻框就很拥挤了
1675918238,117.88900,底薪隆多蹲底角委屈他了是吧，那让隆多弧顶持球詹姆斯蹲底角？
1675916312,200.29900,黑子眼红了呗
1675916290,320.72200,稍微差一点？
1675916090,147.45900,11年打无球被打爆了，还洗呢
1675916067,252.16600,关键就是不防守等快攻
1675915915,179.15500,Excel让别人看比赛？？
1675915898,207.26100,那不回防呢
1675915851,266.21500,全都是主观描述
1675915769,6.65900,刀哥视频节奏感觉好舒服
1675915150,242.56500,那什么是蛋糕理论？
1675914916,185.97800,詹姆斯跑的无球接球投三分可不少，保不齐是真没看比赛
1675914368,313.32700,技术层面不谈我科，这么大胆？
1675913978,98.61800,依赖一个强攻手
1675912967,147.33900,无球不是单纯的跑动然后投三分，还有突破和空切
1675912297,221.37900,你不防守放别人投然后直接反跑下快攻不是简单球？
1675912252,208.56400,不防守去打快攻就是正面
1675912026,246.43900,总觉得是个高级黑
1675911896,85.56000,西部第十三还包含西部十四十五在摆烂，雷霆也在摆
1675911492,59.67100,哈登和保罗的队友可没有那么高的奢侈税
1675911415,6.53400,我对詹姆斯没误解 他和杜兰特库里约老师莫蓝特欧文是我最喜欢的NBA球员
1675910031,61.00700,还在控卫，连老詹持球大核的打法都不知道快出去吧
1675909426,126.92200,？
1675904588,35.80800,跟控卫比是吧
1675904448,109.45900,麦基季后赛都没怎么上
1675904242,155.54600,只是不差
1675903593,190.44800,苦茶子酸死了
1675903555,98.57900,没有特别依赖，但也不能完全没有3分啊
1675903330,238.38600,能不能细数一下詹姆斯在里程碑的防守表现吗
1675903268,147.77900,不差也不给威少
1675903064,132.72400,？
1675902007,286.21900,班赛啥空间？学生有几个投射好的，收缩防守没有空间
1675901932,126.57900,单核巴特勒干了你雄鹿，约基奇干了你快船，走不到湖人面前怪谁啊
1675901816,106.60100,需要三巨头，而不是射手
1675900753,292.04700,乔丹当年也被各种教育，输给谁一次就证明不行？
1675900143,286.35400,控制失误？失误历史第一了都
1675899316,47.32700,1718赛季倒数？
1675894484,152.56500,问问11年小牛再说
1675886314,35.87900,他是控球后卫吗这么排  
1675884922,71.58600,哈哈哈哈哈，并不是非常高
1675883909,200.37900,别的不多说，那些黑的，看看你们粉的哥哥38了能保持什么状态
1675883785,140.55900,他无球看拿什么比，和他自己持球比起来肯定差太多了
1675880838,190.48100,黑子真急啊
1675880156,384.40400,球员应该以球队胜利为第一
1675879901,341.62300,科比就是低配版的乔丹
1675878695,75.52000,就是，就是，就体现黑子的主观性了
1675877396,47.58100,但是詹姆斯打的也不是控卫啊 根本不需要长时间控球
1675877382,299.83500,结果就是湖人交着4000万奢侈税然后西部13名？
1675877221,139.70000,乔丹无球也很强，好多人不知道，不是吹，就是现在的人对无球没什么概念
1675876734,252.10500,进去就是联防，放你投不放你突
1675876008,273.53500,要以历史第一人的标准来评判
1675875300,55.22700,细节它
1675874198,132.69900,夸张了，老球迷应该都知道詹姆斯防大加的那张图，纯纯痛苦面具
1675873731,324.90000,詹姆斯的突破就是最强的武器，巅峰期挂两个人进去劈扣，但凡当年有看过球的人就没不惊叹过的
1675873681,380.24200,黑子说了3万8千分都是刷的，他们上也行
1675873669,245.73900,容易被补防联防或包夹，很难受
1675873562,312.93900,有身体但是要会用啊，你看勇士那个怀斯曼
1675873526,302.45700,打球像詹姆斯怎么就贬义了，突破好挡不住不是在夸
1675873406,84.97600,这期真是piapia打脸，就是叫不醒装睡的
1675873384,356.79600,懂不懂美如画的含金量啊
1675873268,139.06800,詹姆斯去年不是打了好几次5号位吗，效果还不错
1675873165,167.06800,只有一直跑是无球是吧
1675873076,117.79900,20靠防守和浓眉给力
1675873074,377.88200,上面这个南斯拉夫的你一直刷不累吗
1675872860,215.57500,你一下………分解出了这么多能力。。厉害
1675872648,238.03200,不论你的突破能力如何，正规比赛里攻框难度都会随着次数和成功率的增加而增加
1675872570,292.43700,一直被人诟病的是德不配位，我一个詹黑都承认詹姆斯很厉害，但是离goat还差的远
1675872474,89.32900,笑死，一星四射是说明自带体系，就是因为一星那个位置能无解突破才会有给四个射手传球的空间
1675872218,304.83000,如何评价？我有詹姆斯一半的球技我做梦都能笑醒
1675872128,36.39700,excel警告
1675871820,299.85900,如何评价你打球像詹姆斯
1675871811,221.49900,我永远记得詹姆斯拖着小托马斯上篮还保护小托马斯
1675871789,179.66100,前面的真6
1675871749,231.79000,詹姆斯快攻确实强
1675871608,357.04700,詹姆斯这个背是穿着球衣都盖不住的那种
1675871576,344.41700,詹姆斯一个抹身上篮是多少人苦苦练过的
1675871574,231.60600,快攻还需要心理素质
1675871356,173.71400,毕竟不像库里，躺着还能排名上升
1675871131,103.86600,那是因为20年的浓眉太强了
1675870909,208.27500,前面的字母哥是现役快攻最强不假 但字母哥和巅峰期老詹没有可比性
1675870788,312.76600,kd立棍干拔中距离
1675870648,231.77900,保罗的问题就是不打快攻
1675870624,6.34100,小心！刀哥！小心被喷！
1675870602,12.63600,这是黑子不喜欢看的一集
1675870588,256.37000,确实，像阿杜这样的无解中距离手也很少
1675870553,334.94500,光头强
1675870479,68.13900,本质还是锋线
1675870467,109.45900, 那这种配置其他优秀控卫会不会也能夺冠呢
1675870327,126.84400,乐了
1676083045,246.75500,二三联防nba很少用 nba大多都是人盯人
1676081715,256.31900,这个确实
1676079327,67.73900,野狗酸了所以要黑
1676078935,67.53900,不用数据证明用gif证明？
1676073887,166.44300,突破技术难道不是技术？？？？
1676057667,185.51700,越来越扯了
1676053934,127.03600,一打到五别笑死人了，就那个态度还五
1676050356,395.17900,裤衩子急死了
1676045585,54.40000,拿控卫对比？你咋不去和中锋比呢？
1676042404,232.26400,黑子急的都快哭了
1676037404,199.88900,那垫脚技术算不算对自己球队有正面价值
1676037402,151.93900,国内篮球观认为的无球就是不持球，然后跑位接球投射，仅此而已
1676035637,269.39200,惊了，没人学咋历史得分王了呢
1676034516,236.25900,攻筐简单的话塔图姆就不会输了，被防得投射稀碎，突又突不进去
1676031792,339.57400,詹姆斯找不到招牌动作，问就是全能
1676031635,177.23400,经典队友打球，自己在旁边看着
1676027153,359.64400,还会铁肘开路 把篮下大个子顶开两米外
1676026880,220.60900,够快的速度+适时放弃防守
1676025323,226.04600,如果场上能带椅子，他能住在对方半场了
1676022752,312.67800,前面乔丹那个笑死我了，有几条你认真的？一看就是裤衩子
1676022488,78.39800,裤衩子们16年怎么进的决赛啊，自己好意思提16年？
1676021079,43.43900,33位还不高？你是认真的？
1676019270,74.86800,你要不要也搞个表格
1676017270,185.59900,先别急
1676013855,353.10500,黑子哪管你 直接黑就完事了
1676012413,38.62700,不如我阿伟罗
1676012070,227.79000,威少至少防守到位 詹姆斯什么拉稀防守？
1676011863,22.80100,难道不是吗？
1676008883,92.48400,你猜吕布为什么没有关羽地位高？
1676007664,22.49900,铁血两分算不算刷嘛就说  
1676004970,0.56500,詹黑：詹姆斯数据好就是刷的。什么你说我会打球吗 我小区生涯1万分！
1676001588,29.99100,国内科密太多
1676001009,212.11300,讲个笑话:詹姆斯砍分是刷数据
1675994767,47.06800,用数据证明数据
1675994095,89.13100,一星四射最成功是霍华德，而詹姆斯配的不是这一套，他更依赖有一个能兑掉对手大当家的二当家队友和不占内线空间的空间性内线
1675992973,29.02100,腾讯不就从里到外的黑詹姆斯，捧库里？
1675992853,166.41200,防守吗？？？？
1675992682,22.75500,我想要这个图
1675990350,9.06000,乔丹很强，但如果放到詹姆斯的时代乔丹连全明星首发都进不去
1675986700,215.25900,他好厉害，可我就是不喜欢
1675986017,190.48900,为吹而吹
1675957631,147.80900,起码点名你格林还是简单的
1675956149,220.27100,说快攻简单的八成都是云黑子，自己去打打就知道快攻有多考验技术了，不过你要是打的幼儿场当我没说
1675952950,113.24900,所以，今年能进附加赛吗？？？？？
1675947635,0.54500,乔丹历史第一！
1675947609,0.62500,詹姆斯无法超越乔丹的伟大
1675946766,120.33900,湖人禁飞区还历历在目
1675941187,80.19500,exc的神 可惜呀六亚军哈哈哈
1675940069,190.63900,我看职业演员
1675937629,9.02500,不是误解
1675936733,345.00900,兰斯拉夫走步哦
1675936611,43.55900,防守呢？
1675934477,21.89800,没办法，国内啥都有“饭圈”味儿
1675934320,133.77900,？不会有人不知道詹姆斯20年是首发控卫的身份夺得冠吧？真就硬黑啊
1675934178,50.29800,打铁第一不是科比，持球率也高就是效率不行
1675933695,190.64000,看比赛就是詹姆斯一下场队友就送三四个失误杀死比赛
1675933366,6.33700,【省流：这集黑子急死了】
1675931207,319.29900,刀哥只说最顶尖的技术能力，库里无球能力不顶尖吗，咋了？
1675929440,38.67500,我库希望再次吊打姆斯
1675928269,140.77900,从1号位漏到5号位
1675926398,59.36800,哈哈哈，和mvp时期的后卫比持球时间
1675925690,73.32800,不是队友CBA嘛，怎么又变成抱大腿了，能不能统一一下口径
1675925589,29.81900,没用，黑子不看
1675924444,0.35800,不是误解只是不愿意承认
1675924245,357.77000,《及其精妙》笑死
1675922196,0.25200,祖坟？骑士就是他永远的归属！他为克利夫兰带来了几十年没见过的荣誉！
1675921588,87.31300,不是非常高都来了
1675921298,242.78400,但凡打过班赛呢
1675921254,148.24700,酷狗焦密们来啦
1675921199,204.51600,看似高级的篮球术语 其实还是excel
1675919943,253.21200,黑子估计连联防都不懂吧
1675918635,290.53000,命中率比东契奇高，没哨效率的确比不过
1675918540,267.05800,说防守三秒的你家球星攻框怎么打不进呢？
1675917548,238.49900,《笨分》
1675917246,133.60100,太是了
1675917126,108.69300,这套模式给哪位巨星打都能夺冠
1675916818,256.21400,确实 黑子应该没打过班赛
1675916454,351.58000,看比赛就看个效率是吧？
1675915914,55.05900,能看持球时间？哈登是组织后卫能比么
1675915804,129.09800,你要不要听一下你自己在说什么
1675915756,345.01500,黑子又来队友CBA了
1675915683,85.40800,他不是必须要一星四射，他需要绝对开阔的空间。
1675915653,176.97900,这叫掩护吗？
1675915539,71.93900,跑快攻当然不用太高，攻坚打不进去就传球了
1675915113,357.94800,能加速用身体强吃一步过你为什么还要浪费时间变向？
1675915088,299.50600,你自己看看自己说的和刀哥说的在同一频道上不
1675914720,266.93900,二三很少有机会可以有单打机会
1675914103,304.63800,一星四射只是因为他突破强可以选择这种快速低价的建队模式，但是他确实需要射手
1675912940,122.83300,篮网三巨头，湖人f4，哪个夺冠了？
1675912820,185.71400,不仅黑还是云黑，自己看看比赛吧，别跟那带节奏
1675912045,246.64400,肘子顶人，当然简单了
1675911596,89.19700,这个···说实话 骑士夺冠那年 也没两个真正意义称的上是“射手”得分点这种队友···
1675910382,214.69300,趁小球时代没人当它一回事 淘汰中锋出了这个玩意儿
1675910263,334.13900,最强的突破偷步高手
1675910064,38.48300,是哦 拿着球不撒手  最后一个甩锅  触球就少
1675907222,155.70600,无球需要大量跑动，打替补可以，主力没体力
1675906928,99.16600,？
1675905837,169.67300,如果说他无球不差，那11年就是纯粹的演韦德呗？不想韦德FMVP？
1675905780,204.09400,快攻以不回防为代价 就不是正面了  
1675904770,117.38400,20决赛的热火什么水平？
1675904493,316.14600,不美如画都不算
1675904309,389.36800,我跟黑子对过线，你是根本不可能跟他们理论的，他们就认死理，往死里黑
1675902493,176.25900,詹姆斯现在的定位都是标准大前锋了
1675902350,57.31400,组织前锋和组织后卫比持球率？
1675901586,102.68800,需要三巨头模式
1675897620,285.50300,你和这些黑子解释啥，他的伟大就在那里，等我的孩子长大后，我可以很自豪的告诉他，爸爸见证过历史第一人
1675896930,43.75300,不用看了、持球时间证明了哥锤子
1675893008,92.81400,不是要四个射手 是要一个大能当大当家的二当家 还有一个愿意当三当家的二当家
1675891892,29.22300,罚球格外闪亮
1675889223,30.81900,无论黑还是吹，他就在那里
1675884948,169.21900,你的生命停留在11年了吗，人不会成长吗？
1675883071,170.86300,那么现在的詹姆斯有做吗？
1675882958,169.51500,...
1675882153,225.74300,南斯拉夫步也是
1675881724,29.91900,投篮出手次数排名是多少
1675880647,304.77900,有人看投三分看傻了
1675879989,15.34400,“中文”重读
1675878616,383.13900,詹姆斯持球推进非阵地战基本防不了
1675878591,0.44800,你叫不醒病入膏肓的人的刀哥
1675876450,134.09600,詹姆斯回放能力强
1675875992,9.36600,省流：没有解释对防守方面的误解
1675875567,176.65300,不懂就问库里能打攻框吗
1675875346,256.19800,等一下，黑子可能跟本不知道啥叫联防
1675875057,103.07400,智能控卫，智能前锋
1675874339,288.53900,黑子正在措辞中……请稍等
1675874140,383.69900,多看他的比赛
