1675874113,246.76500,班赛，系赛一般都是二三联防，一突破就包夹的
1675873837,377.13900,命中率超高
1675873077,242.00400,b站球迷是这样的，估计没打过全场
1675872971,246.57100,确实，进去就协防
1675872905,133.47700,打5就搞笑了
1675872687,144.32800,詹姆斯不是不会无球，只是他无球威力远小于持球而已
1675872541,299.75700,现在新生代技术都比老一辈好，得分能力还是不如一些老一辈
1675872246,388.74100,上开讲了还真不至于吹捧，那是因为当时科比的确名气最大
1675872163,337.26800,投射真的可以算是詹姆斯的短板
1675872120,241.49300,所以说小黑子们打过正经的5v5篮球赛么？
1675871843,29.91900,哇，礼花耶
1675871514,277.32200,刀哥别念了，黑子大脑CPU都要炸了哈哈哈哈哈
1675871476,266.50800,第二第三个防守者往往是最头疼的，这时候还不如干脆拔起来一个中投算了。攻框从来不是简单事
1675871461,226.39000,塔兔不就是吗，那运球气死人
1675871450,117.13500,看看库里，没有汤神kd立马在巅峰期连钓两年鱼，还交着联盟第一奢侈税
1675871267,247.16700,真不行 联防了突破的作用更多是撕裂阵型 找机会出球
1675871230,185.63900,黑子酸了
1675871133,78.50200,本来就是转型空位，只有一小段担任中锋，不知道在杠什么
1675871014,266.49900,一般来说，形成中距离出手的机会比突破简单太多了
1675870945,238.99500,比不中！
1675870934,394.85700,刀哥说得好！
1675870456,273.71900,打比赛攻框多的基本都是大腿，一般人就是在外边浪投
1676084407,233.84100,下雨你你要这么说的话那科比岂不是连球员都不算
1676082041,45.58000,老詹历史第一人！！！
1676080418,163.03700,各方面都不是最优秀的，凭啥是goat
1676079964,151.22200,防空也投不进啊，不然马刺为什么退一步防守了
1676079822,79.74700,那他确实不出手终结啊
1676077577,204.79200,感觉不如乔丹
1676074646,156.07800,让他打无球就8分
1676073684,59.01900,哈登算一个组织
1676052254,149.96300,詹姆斯真能打5就不会让威少去顶格贝尔了
1676047357,205.90800,不回防快攻是第一
1676038603,169.86100,关键一传，
1676038050,352.46900,不会不知道詹姆斯没有中轴脚吧
1676037921,298.46500,别吹了，中远距离长期被放空，投篮都玩不明白，比赛强度一上去，你詹姆斯就捉急了，看下马刺是怎么防守詹姆斯的
1676036991,127.73900,他们听不懂的
1676033550,14.46700,篮球只有一个神
1676031559,102.00100,毕竟数据体现不了防守
1676030887,30.07000,摊
1676028140,289.92500,事实就是三分手的篮下命中率都要比自己的三分命中率高，你说谁更easy？别那么多主观感受！
1676028087,15.94800,詹姆斯历史第一！
1676027994,227.35200,但是事实就是快攻对于绝大多数球员来说命中率都会比自己的平均命中率高，你说谁更easy吧
1676025497,387.82000,抱团跑路的技术非他莫属
1676021649,135.14200,还不差？
1676018046,74.78300,你是会洗的
1676017547,79.54700,反正我是没见过不断创下纪录却狂输球的球星
1676016415,359.47500,就拿绝杀绿军失败那球，看起来就是简简单单接球打进去，但这一项就没几人做得到，何况当时詹姆斯这过程还轻描淡写
1676013445,247.50200,哈哈哈哈哈哈
1676012301,268.12000,看过比赛吗詹蜜
1676012283,268.09200,11年打小牛，上个联防，詹姆斯突进去了吗？
1676011783,178.39100,洗的人没看过11年总决赛吗？照这么说来只能说明他那年就是不想让韦德mvp？
1676009522,253.94000,33打半场野球不防守突破是简单的呀！
1676006094,382.09900,焦蜜表示不服
1676005754,93.45900,我大鹰蜜来了
1676004827,23.76200,数据我拿走，胜利你拿走
1676002524,9.60800,库里历史第一！！！
1676000955,191.10000,无脑(注意是无脑)黑詹姆斯的不是云就是跟风
1675998451,73.67100,本来就是甩锅，有什么争议吗
1675998039,50.52100,我就问一句话，他跟科比有的比吗？
1675992281,0.70500,他们只是为了黑而黑，观点黑，情绪黑，再多数据都没用，因为有些东西是不需要逻辑和证据
1675986640,169.90700,越来越强，指的是直接在别人半场等快攻？
1675981520,219.50500,狗：说库里历史第一的，笑死我了
1675980528,67.07900,对抗都不一个级别
1675970965,375.59900,南斯拉夫转身一大招牌，确实映像深刻，因为你刚刚剪了一个在你视频里
1675970680,260.92700,一攻坚就有犯规领，对面高个多直接坐牢，真以为攻筐无敌是吧
1675970450,213.72600,难蚌，这也能硬吹了是吧，能打NBA的谁没有这些技能？
1675970379,185.76600,是，经典点名小后卫的打法
1675969670,199.61900,笨分:D
1675965912,348.13600,说半天还是没有招牌啊
1675965073,318.97000,纯也中up
1675963321,37.58500,哇，好多也中啊
1675963240,233.21700,听不下去了。。走了
1675961620,30.06900,历史第一中锋
1675960935,116.60200,需要的是巨星
1675956405,102.51100,20年不是围绕浓眉建队？摊就是个抱大腿的
1675955248,285.03900,你在说什么明明百分之八十的人都可以历史得分第一
1675953637,37.80500,一场比赛48分钟球在他手里40分钟.你洗78呐?野球场早让人干费了.~
1675953536,37.80500,"30-50名,他们家控球后卫啥数据啊?达没达到NBA后卫控球平均值?"
1675950400,388.51200,再更黑子们要气死了
1675947555,0.62500,詹姆斯再强也是人，而乔丹是神
1675947012,121.55300,光头强？
1675942939,338.87600,张口就来
1675942575,45.70000,落后的时候，根本就不碰球，哪来的触球
1675940911,93.36700,大包大揽=持球率？？？
1675938900,247.41200,别说班赛了，看过球的都知道，所以说觉得攻框简单的只有没看过球也没打过球的
1675938342,121.42700,鹈鹕浓眉还不好？空砍群群主不知道？那动不动四五十分也叫不行？
1675937907,23.26000,詹姆斯肯定非常强，但是肯定不是历史第二人，更别说碰瓷乔丹
1675937527,326.30000,科比不简单好看然后打铁美如画
1675937027,223.42400,直接不回防等快攻传球
1675936828,284.47900,防不住是因为你不知道他走了三步之后还有几步
1675933932,298.76200,都说了，原话是：我认为我是我自己的goat。黑子是中英文都看不懂是吧
1675933526,303.27100,蜗壳一顿运球摆脱不了最后四氧化三铁不是技术？
1675929905,58.86900,场均出手数和球权占有率都是历史第一
1675929574,213.69400,说了一大堆“P话”，除了摆烂球队，湖人战绩俯冲倒数第一
1675928954,305.13900,乔丹还有防守，背筐，阅读比赛，突破，带队友，关键球，身体保养，技术打磨，体能
1675928924,79.05900,Excel 王者
1675925583,289.11000,其实詹姆斯正面突破能力不强吧，他的突破一般都是挡拆突空位或者错位碾压突破。
1675922423,232.87900,乔治 塔图姆
1675922413,227.48500,问湖人为什么第十三，我大威少首当其冲
1675921541,87.34500,《没有高超的组织能力-指20年助攻王》
1675921449,318.99400,投手一个
1675920982,50.42600,詹姆斯历史第一人！！！詹姆斯历史第一人！！！
1675920124,155.73300,8分
1675919999,108.46800,这赛季不是出手数联盟第一？
1675918344,199.67100,说快攻是easyball的我都怀疑是不是没打过全场比赛
1675918314,177.37300,没库更强的阵容夺冠也是库里功劳，这就是为什么国内已经很多人给库里历史第一，国外最多给到第十左右
1675918081,337.68200,这种转身我也经常用，转过身过人是一个关键，最后上蓝又是一个关键
1675917829,16.27800,事实上这个赛季总正负值也是詹姆斯最高
1675917387,116.58300,保罗夺冠了嘛？黑个鸟
1675917233,120.82600,哈哈哈
1675917210,298.59100,确实，给杜兰特配个格林补防，再配个克莱投三分，再配个威金斯，后卫栓条狗也能赢吧
1675916694,24.35700,威少才是刷，季后赛现原形
1675916668,16.06300,季后赛比常规赛还牛逼，难道季后赛也刷？（
1675916505,241.32000,比不中这个出生
1675916244,311.15700,这可不简单
1675915786,128.07400,？？？
1675915532,37.44800,但是慕斯不是控卫吧
1675915109,332.51700,詹姆斯有三威胁，所以对手放他两米远，笑死我了
1675913022,352.39200,这个背
1675913016,170.12400,鬼场均8分，那是场均十八分
1675911766,0.72500,詹姆斯就是流量本身
1675910775,15.52700,你完了，你要被黑到死。但是我支持你。
1675910641,319.03700,大腿才是真的实力吧
1675910441,261.94000,有三巨头可能真的很容易
1675908653,9.41900,刀哥最近一直为勒布朗“洗白”来了，哈哈哈
1675908205,59.19700,湖人争冠无望，只能霸球权赶411工程
1675907286,226.74100,因为他不回去啊
1675906615,50.45000,开始了 excel数据不看比赛了，最后一节他不打那是不是持球时间就少了呢
1675904847,288.82400,哈哈哈，用班赛来解释攻框难，然后有人说这是拿詹姆斯和班赛比，6
1675904018,30.53400,那些人的强大之处在于它完全不会听你的分析解释
1675903910,142.06300,8分
1675903073,142.22300,这能反驳是我没想到的
1675902973,388.44100,黑子在小区球场10年4万分
1675902132,100.17900,哪个球星不需要投手？库里还需要克莱呢，你给他四个追梦试试
1675901692,249.02300,班赛？
1675900809,359.46000,到底懂不懂啥事南斯拉夫步啊 一个劲叫
1675897891,233.78800,那些人都不打球
1675896272,108.97900,支持刀哥，支持詹姆斯，太不容易了
1675893443,43.87900,战绩倒数这这么解释？
1675893361,345.49600,直接上比赛录像分析吧
1675885944,166.09800,忍不住了，哈哈哈哈哈哈
1675885871,241.40600,比不中
1675885621,30.51800,比不中只会说詹姆斯霸占球权
1675883687,79.15900,隆多都不能让勒布朗无球发挥，湖人选后卫不如找锋线
1675881814,253.89900,所以他依赖一猩四射带来的空间，对手没法摆联防啊
1675880715,326.85200,也许詹姆斯随着年龄在变弱，但只是他变弱了，不是他比别人弱了
1675879216,135.26400,就拿之前湖人的四后卫阵容lbj确实打得5号位
1675878519,332.53900,詹姆斯持球推进绝对历史第一
1675878183,108.22500,因为20浓眉有篮，湖人打的是单塔
1675877543,0.72500,【省流：这集黑子急死了】
1675876991,190.77900,高额奢侈税你问威少去啊
1675876854,135.14000,不如说有时候无球意愿差
1675876391,290.12700,所以有难度的攻框他选择交给队友
1675874725,375.39900,饭圈兄弟拿头有画面啊
1675874721,242.05900,打个全场就行 体能 视野都很重要
1675874397,241.15400,离不开挡拆吧
1675873761,311.49900,有詹姆斯一半能力你都在nba了
1675872667,178.41400,无球威胁只是无球能力的一个点
1675872318,248.15400,说突破简单的，估计都没打过篮球……
1675872250,240.81900,球评人哈哈哈
1675872167,284.13900,现在的攻框跟以前比难不难你问问高圆圆啊
1675871952,9.46200,你币有了
1675871924,9.42500,第二集快来吧，投币了
1675871894,395.38200,希望有第二集，投币啦！
1675871787,268.53900,关键要有哨子啊大哥
1675871575,276.94800,多打打有质量的比赛都知道，能持球攻框的全是大腿，外边顶点投手谁不会练？
1675871389,135.02900,《坊间》说谁自己清楚
1675871353,177.43900,低龄球迷就只会拿今年湖人能不能进附加赛说事
1675870992,253.92900,等一下刀哥 人黑子不理解什么是联防 你先解释一下
1675870932,116.54000,哈登欧文第二轮伤了一个半就别拿出来比较了，非完全体阵容都能和冠军雄鹿打到抢七加时最后一分钟
1675870781,219.21700,总有人觉得快攻就是上空篮
1675870724,227.64500,《老詹不会运球》
1675870656,67.36200,确实都是后卫只有他是前锋
1675870577,190.69100,这不强哥吗
1675870446,135.10900,有些人觉得无球等于接球三分 哈哈哈
1676084044,191.29200,说特么没技术的鹰蜜，看录像训练，三分球绝对十中九
1676075441,165.79900,什么叫分均移动啊，我第一次听说
1676055555,242.62400,你说的这个不玩篮球的人不明白的
1676053397,45.04600,excel战士
1676048775,179.48300,有个黑子笑死我了哈哈哈场均八分？？？
1676046505,93.48600,一星四射要夺冠要有大梦那种内线技术才行
1676040877,121.80300,‘、儿童我去、’
1676038391,53.46500,他也不是后卫啊
1676036462,0.00000,詹黑：詹姆斯肯定不是历史前10！什么你问第一到第十都是谁 不了解！
1676036221,191.18500,建议去看11总决赛，他们还真敢放空詹姆斯防韦德，看到这笑死了，up你是懂流量的
1676032780,24.44400,现在的站母爱
1676026445,327.43700,肘子开路+天龙八步=老摊
1676025786,14.14000,没有普通球迷，只有对家黑子
1676021300,191.53900,说实话就变成黑了，报团就是报团
1676020835,108.19700,就是要巨星啊，报团呗
1676018186,16.53900,第一本赛季防守问题早就说过了，第二他说的是全生涯，你非要坚持他全生涯没防守就跟坚持他全生涯不会打球，你让人跟你说什么呢
1676017261,178.61900,先别急
1676012403,283.50400,在天赋爆炸的詹姆斯面前攻筐不比其他人简单吗，这有什么好吹的
1676012195,248.07000,防守不比进攻重要吗？你摸过球吗？你打球也两手一摊？
1676012102,227.79000,一个球员连基本的防守都做不好，你拿什么谈其他的
1676010405,170.35400,酷狗啥时候有过防守？纯漏洞
1676009700,317.74000,运球20甩锅能力确实历史第一
1676009626,267.06000,只要裁判偏心，突破确实简单，别人不敢防
1676005937,290.56000,NBA历史失误王
1676004799,9.75000,布朗尼给我冲！
1676004264,2.42500,黑子：数据！看不明白，球我也没打过高质量班赛 但是比我哥哥数据好就是刷子！
1676004084,380.44100,无敌单打巴里亚
1676003473,199.28800,快攻是简单球的估计现实里不打球或是菜菜
1675999931,276.31400,詹姆斯在核心球员的助失比最保守都是最差一档，激进一点就是最差的，你怎么解释？
1675995393,347.83600,有些时候
1675991460,156.29800,防守赢得总冠军
1675990865,233.90100,黑粉全是意念流 叹为观止
1675990068,36.86100,加强型全自动棉花收割机
1675989895,99.97800,科比报团天下无敌
1675988099,254.25100,如果会投篮，真就是投篮容易
1675987997,170.89100,不是做了这个事就是我很厉害，集锦不是全部比赛
1675986040,213.11400,带到西部第十三
1675984896,339.21200,科和乔不太一样，科比持球更多
1675971499,114.30700,波普丹尼格林，总决赛隆指导，还有浓眉的中远投都被忘光了捏
1675967379,135.61900,骑士詹一号位，到湖人能顶到五，加上主流头衔三号位没什么问题
1675963077,79.91900,他不敢终结。。。巨星才会去终结比赛
1675961641,24.47100,你说这些都是些啥数据啊！！！！！！！！！
1675958794,107.89900,20年阵容也是历史级别的 双核加超豪华板凳席
1675954811,164.98900,高情商突破强低情商没篮
1675952750,170.15000,哈哈哈
1675951831,31.09900,8分先生
1675949926,107.27200,麦基：没爱了是吗
1675949297,149.78400,说说摊手啊
1675948487,282.71900,塔图姆就是这样，做不到
1675947256,80.16600,说表格的，你们截得每个动图不过是数据中的一个，每个球星都有集锦而数据是最客观的
1675944854,218.65600,刀哥有开玩笑啦，这都是笨分那需要技术啊
1675941427,228.63300,这不是他防守摊手的理由
1675940361,183.75200,这个up主怕不是反串黑吧（doge），前面几项说得我快乐死了，明洗实黑
1675938277,253.99200,很多么，所以第一人是要和平均水平对比么
1675937383,359.33000,黑子急死啦
1675936759,353.02900,禅师：我被up评为普通球迷。
1675936259,43.99900,约基奇算后卫吗？你管啥位置都是持球大核有啥不能比的
1675935940,228.99600,《很少失误》
1675935918,30.77900,别扯这个了，就问你他和乔丹科比，谁更出色？
1675933752,99.98700,如果你们队的后场，三分命中率都不过三十，或刚过三十，那没人能取得成功
1675933356,3.43600,【省流：这集黑子急死了】
1675932424,142.63900,啊对对对，一个你们嘴里的历史超巨打了20年NBA搞不明白无球跑动，也叫历史最佳？
1675932069,234.20000,说南斯拉夫步的是不是不知道南斯拉夫解体了
1675929377,16.31800,在福田等你指示
1675927494,219.05600,快攻不算分
1675924753,52.40000,高阶数据都是刷的
1675924469,135.42900,没有王朝 就别碰瓷第一人了
1675922469,304.11900,《简》
1675921639,248.36500,比不中就是个出生
1675920915,310.24500,没有蜗壳的爆肘亚裔我是不服的
1675920909,30.78600,詹姆斯历史第一人！！！詹姆斯历史第一人！！！
1675920900,30.78600,詹姆斯历史第一人！！！詹姆斯历史第一人！！！
1675920469,128.61900,？
1675918900,387.59600,智能定位
1675918321,275.98200,慕斯突破能力历史前三没什么问题，也就AI和乔老板有资格和詹姆斯比
1675916919,206.31500,快攻字母才是第一，也没见人黑
1675916905,122.92500,自己说自己GOAT就很有问题了
1675916870,332.07700,这个球是走步啊，前脚连续点地的南斯拉夫步
1675916129,239.83700,明明说的是篮下吃饼
1675915864,30.61900,难道不是？
1675915353,254.18400,打过班赛的都知道，没有防守三秒，永远都在联防，最好的得分方式就是抢了篮板，后卫抓紧往前跑打快攻
1675914827,206.67800,问题来了，快攻数联盟第一的詹姆斯，场均移动距离联盟倒数第一，所以，你说得这些能力体现在哪里？？干站着就能体现出来？？
1675914764,66.62100,有威少他为什么要打控卫，不能去打强力侧翼吗？
1675914727,183.70800,库里不能攻框的话，你猜22年怎么夺冠的
1675913605,240.21900,比不中？比也中！！！！就看他那个豪猪脸！！！
1675913086,240.37900,你看塔图姆能不能攻框就知道攻框是不是简单活了
1675912237,81.43900,严格意义？
1675911821,73.80100,所以就很奇怪，既然持球时间都不多，那为什么球队给他的控卫小托马斯，罗斯，威少这种持球型的全跟他不搭，而功能型不需要太多持球时间的后卫查尔莫斯，诺里斯科尔，小莫能和他搭起来
1675911789,290.87600,哪一年强的步行者整体防守，巅峰乔治希尔 芬森 泡椒
1675911531,158.43000,视而不见永远是黑子的自嗨点
1675910695,44.19300,打铁不是蜗壳第一？就硬黑是吧
1675909885,218.95000,看着詹黑急，就很舒服
1675908274,93.65400,詹姆斯不是持球的打法，这个角度去讨论真的牛逼啊
1675908198,317.05500,“稍微”差一些？客观吗？
1675906141,74.22000,控卫内核的小前锋
1675906099,339.15800,那你倒是让那些CBA队友干这些活啊
1675905942,283.92700,什么时候能够战胜80%的前锋，就能标榜自己历史第一了？
1675903811,347.24900,低配算不上，我觉得在效率上和乔丹差的远
1675901979,331.90800,三威胁极其凶猛
1675901518,107.80000,..........................
1675900553,58.38100,根本不是战术球技的问题好吗
1675900345,74.02800,笑死·
1675899882,242.63900,对的，突破能多走两步上篮当然厉害
1675899743,142.79900,动都不动还不差
1675898296,10.05900,压根也不黑，怎么叫洗白
1675897491,291.51500,可是他自称goat啊
1675895550,380.49100,确实
1675884605,331.93400,前面说这些技术谁都会的，那要是这些都集中在一个人身上呢，张口就来是吧？
1675884073,79.95900,完了，给黑子整不会了，下一步黑子要说不持球也是持球的一种方式了
1675883486,212.88600,字母现在论身体不输当时的慕斯论技术也比慕斯强还是雄鹿的建队核心咋就被你们说的这么不堪呢
1675883180,198.98300,快攻确实不是easy ball，但是詹姆斯打的快攻大多数是，起码本赛季
1675882120,329.68900,这些乔治小卡字母布朗谁不会
1675881441,51.52300,灯泡谁都能组织啊 不能这样横向对比我觉得
1675881111,347.68300,黑子：反正不管怎样在B站黑詹姆斯就是对的，你们詹姆斯球迷反驳一句就是布朗尼
1675880921,213.22900,攻坚能力不行，为了黑而黑，练自己看篮球的底线都不要了是吧。还在这装懂哥呢？
1675879932,136.22000,打5的防守对方后卫吗
1675879831,93.54500,那么有谁特别依赖？有吗？
1675879792,254.19900,他们打个野球半场防守人手都不举的，攻框肯定容易
1675879768,267.61300,第一个防守人好过，难的是第二个人上来了之后前后一夹就完了
1675879367,66.49300,湖人搞笑的点就在于拉了一堆后卫过来然后还要詹姆斯组织
1675875658,228.00100,还真是 高个前锋冲起来的时候运球都运不好
1675875139,341.31200,说南斯拉夫步得春hu
1675875064,395.64400,个人观点，只认可两个数据，冠军数量和每场比赛的的比分，只喜欢一种球员，进攻和防守都拼尽全力，用不放弃的球员。
1675875027,9.65900,布朗尼刀警告（狗头）
1675874331,374.75000,近框命中率高于大部分中锋，想想就知道多牛逼
1675874194,261.79400,nba的联防是阉割版的
1675874049,260.13900,真实了，我打野球突的进去打帮赛一般都中投
1675874018,30.77900,这么说吧，火箭登当然也被黑的很惨。再想想他们共同的对手是谁？
1675874002,170.76500,让詹姆斯这种重型前锋跑来跑去就是折磨人
1675873965,115.62000,园区
1675873854,122.89800,666
1675873842,359.18300,詹姆斯上篮是真的稳，不需要欧文那种花活也能进，大道至简
1675872864,88.62200,一星四射局限太大
1675872577,316.86900,这就够致命了，三威胁只有突则无威胁
1675872432,135.27200,詹姆斯挂的3号位，其实干的一直是1号位的活儿
1675872426,395.63000,南斯拉夫步之王
1675872381,267.72900,那些人最多也就打打2k
1675872297,115.35200,确实，鹈鹕浓眉没打出好，20忽然爆种是吧
1675872236,149.95000,让他打无球就是浪费
1675872146,297.68800,可黑子认为炒菜才是技术呀
1675872034,234.10600,不回防可还行
1675871672,191.94600,光头强
1675871656,207.00500,说的是快攻吗？说的是你不防守等快攻
1675871456,234.14100,不是 你觉得打职业跟打院赛一样站着半场得球啊
1675871083,74.54500,詹姆斯20年不就是控位拿的总冠军嘛，要黑也不至于这样吧
1675870940,374.14400,确实
1675870814,128.88300,詹姆斯打不了5，你要他怎么防？他能防到4已经可以了
1675870664,135.72700,空切一绝
1676080959,81.03000,串子急啥
1676072469,358.90600,别人是普通球迷，你是最懂的
1676055167,198.75500,摊密急了
1676045401,80.84400,一顿尬运加甩锅怎么说
1676033278,380.39800,皮蓬，皮尔斯在沾密眼中全都不会打球，黑子打不过大爷但能打爆你
1676027544,80.55900,你跟谁比呢 跟后卫比控球时间66
1676025892,330.88900,科比生涯中投41，詹姆斯38，三分科比32，詹姆斯34
1676022703,282.69800,没打过篮球的裤衩子急咯
1676017776,234.77100,笑死
1676017310,171.35300,你让他系列赛打五能拿下吗？打过五跟会打是两种区别。
1676008619,329.70400,科比前十前十都进不去吹什么呢
1676005263,94.99200,库里有好多次dpoy是吧
1676004473,254.44600,是詹姆斯的比赛让人觉得太容易了
1675998890,157.61500,他为什么要打无球？高效呢
1675996638,1.12500,抱团说明一下
1675992181,297.43900,牛的，一个自称goat盖过所有优点，够客观
1675990051,396.00000,我对詹姆斯本人没有任何意见，我只对他在中国的球迷看不惯，你们吹他第二球王就算了，非要整成历史第一人，就是欠喷
1675986220,54.10300,@比不中
1675983853,80.93900,开洗
1675981394,95.47200,狗：黑子：甩锅
1675980515,54.04000,只是时代问题罢了
1675962755,1.91300,乔丹和他谁强？
1675959832,157.83000,一到认真分析的时候，黑子就油盐不进变复读机了
1675954616,281.65900,别说了，毫无疑问詹姆斯就是历史第一小前
1675954533,124.37800,鹈鹕浓眉不空砍群群主？
1675952178,107.28000,园区冠军都能论证了？
1675951707,198.01500,光头强你怎么在这
1675950012,18.06000,乔丹历史第一！！！！
1675949718,17.67900,小心被网暴
1675944327,124.63200,我要是詹姆斯我也会说自己是第一
1675944120,164.24100,波多黎各一座山
1675944078,143.98700,8888888
1675928094,94.37900,詹库报团天下无敌
1675921567,66.47600,刷的更多了
1675920464,164.57800,马刺：？
1675919031,171.02900,不防守怎么说？
1675918421,234.94100,真的笑死了，打过5v5阵地战的都知道那tm冲进去都是人堆，水平不够的真不如在外面乱扔一个命中率高
1675916921,129.29500,失误多
1675916464,183.67300,看似说的很有道理，其实全部依照表格
1675915761,113.99200,确实不是一星四射，但是隆多要被迫蹲底角。
1675915731,235.37900,连快攻都推不起来的前锋能进nba？
1675915157,353.55700,包括左侧四十五度的三分球，那可是詹姆斯的专属投球点
1675915004,295.63800,结果就是常年组对三巨头，拿了六次总亚军，两次被剃光头
1675914480,136.09100,进攻打1号位，防守让威少扛中锋，这叫打5
1675911840,254.60000,开发不出来、
1675911732,290.87600,咋了，高圆圆是没被淘汰，还是那一轮系列赛淘汰詹姆斯了
1675905770,80.55900,别说了，黑子都要急死了
