发送时间,视频内弹幕出现时间,弹幕文本
1676483429,298.25800,那时候的电脑计算机真的能支持阿波罗计划麽？
1676482192,613.17400,一个推进器的密封圈出问题了
1676481657,737.75600,没关系，好莱坞摄影棚会出手
1676481263,1241.42400,美国人有，我们也要有！！！
1676481134,1121.44200,震撼！！！
1676480692,721.23400,《美国解体》
1676480616,654.09300,《拔苗助长》
1676480020,408.04600,经过2022年美国重返月球计划之后居然还有人相信美国登月了？！
1676479144,1143.80600,承认美国的成就和否认美国并不冲突
1676478893,1220.05800,可以用来炸
1676475593,198.45900,炸气球
1676475418,1109.18000,虽然之前看过这个画面，但还是想说：给老子炸！！
1676475372,1083.56200,当时的大型电脑运行能力还不如现在的手机
1676475103,1105.52500,美国历史是能用论迹不论心洗得吗？你个反串黑子
1676474916,917.53000,你现在回去做高考卷能考当年一半分数吗？程序员三个月没看的代码都要重新整理。几十年的配套设施，百万零件，工厂，你以为你一张嘴简单？
1676474833,1240.32800,我还记得那个广告词，月球离我们38万千米
1676474815,919.50700,你高考时候的分数，现在回去能考到一半吗？人从出生就是0开始，现在早就全换人了，NC思想？
1676473601,1127.81900,质疑登月让美汪急了啊
1676473336,950.73900,然后好莱坞就上
1676473303,813.18000,航天是为了更好地在地面生存
1676473009,875.88100,难道这不就是美国间谍搞得鬼
1676472553,162.30700,梅森快乐行动
1676472170,125.62300,299
1676471726,796.77600,测试软件里显示的影响最弱的圈都能直接把房子轰塌，这不叫废墟？
1676471290,1094.17000,人类必须在地球上解决自己的冲突，决不能把冲突带入宇宙
1676471098,739.10200,还是苏联的火箭安全
1676470693,412.98900,相比他的另一场表演还是有很大差距的
1676470523,769.14300,美国买武器？找苏联买吗？
1676470428,494.84300,合格甲方
1676470056,982.03000,这些说美国登月的，也感觉自己很聪明
1676469990,335.45100,我想问一下，用导弹送上太空的人还能下来吗
1676469341,10.35900,人去没去过，不知道！
1676469239,872.72700,其实，苏联的航天工程并没有领先，反而落后了，只是因为美国的宣传太过高调，所以苏联有了时间上的优势
1676468565,1137.98700,科技方面的，我很佩服美国，但是他们经常不干人事。
1676468391,1120.11300,美国做的事，过大于功。
1676468327,29.11800,骗人的 虽然台面上是不能这么说 但是登月这种顶尖的技术你和我说不保留 现在登不上了 造不出来了 我是真不信
1676468267,1092.12000,人类的勇气与坚毅，会跨越历史
1676468238,1031.26200,这真的是太浪漫了，迈入太空的第一步。我的一小步，人类的一大步。
1676467025,724.49800,前面的你别忘了啊，美国啊在成立之前的也是好几个国家呀，啊，哦，不对，抢的领地，那那难道不是吗？
1676466040,1240.49500,登山是智慧生命的本能，虽然我们尚不清楚这种本能源自于何处
1676465864,1082.80800,承认敌人的强大是自信，你对韩国、日本这种四部悔改的国家有多少好印象
1676465735,1130.17900,这就叫格局 懂吗
1676465074,751.06400,我觉得美国登月是真的，但是现在人才没了，登不了了
1676465067,734.23300,所以就拍了一部登月电影
1676465041,1116.82900,不带刹车上月球是可能的，但是载人不带刹车上还要活着回来，细品！！！！
1676464840,1191.18900,当年全世界对克格勃都是单向透明的，如果有问题，第一个说话的是苏联，但它沉默了。
1676464570,550.50200,早期面壁者
1676464340,318.63100,你信不信苏苏刚答应卖技术转头就全世界宣传老镁不行了？
1676463745,502.22000,V！
1676463380,1112.82700,we choose to go to the moon!!
1676463075,428.04000,那这个上帝可够偏心眼的
1676462506,1083.34900,说登月骗人的，是当苏联的克格勃吃白饭的吗？
1676462493,44.36200,我在太空搜寻了一圈，没有发现上帝和天使
1676462279,926.03000,去好莱坞拍个片子，把登月设施往月球一抛，完美的载人登月出来了
1676462241,751.20600,场务  道具师 各就各位  预备  爱克逊
1676462096,771.39000,美国现在火车不出轨就谢天谢地了
1676462067,576.86100,月球场景搭建 对好莱坞来说也是蛮大的挑战
1676462029,805.50600,B站的风气真像清末 这些反美的真够愚昧的
1676462003,513.16000,有办法  因为有好莱坞
1676461900,676.16900,+++
1676461889,1132.95900,探索太空这件事是全人类的高度，承认对方的功绩并不可耻
1676461497,11.27900,我Judy呢？
1676460947,1132.32800,提高屏蔽等级能过滤一大批反美魔怔人
1676459156,1127.53400,B站特产 反美魔怔人
1676459073,852.86000,可惜科罗廖夫死的太早了。。
1676459055,1047.45400,然后把月球炸了
1676458989,1082.44900,历史都是胜利者谱写的  你说那么多有什么用。拳头 科技 经济就是实力的体现 别太自大了。
1676458872,385.58800,美国在当时还不是灯塔？
1676458586,226.17900,驾驶洗衣机横渡太平洋
1676458468,728.09700,现在俄罗斯 英国 美国也都联邦国啊
1676458396,390.52100,灯塔的意义是为了照亮阴霾，是一个航标。是要跟周围有对比才有意义的
1676458352,430.31000,.338
1676458254,1115.19900,美国从来就不是为了全人类 只是为了他自己而已
1676457932,975.14700,都23年了还有人不想想算力差距多大
1676457813,725.67900,美国太傲慢了
1676457644,114.26600,醉拳甘迺迪
1676457410,1012.27500,在航空领域现在NASA就是最牛的
1676457213,1128.63700,看得有点热血沸腾
1676457194,724.49900,美国解体
1676456990,1209.36900,真真假假，本就无法分辨，不必为了自己的信仰而去轻蔑他人，道不同罢了。
1676456980,765.04800,这里好像是变形金刚3
1676456809,1163.13300,没有一个国家能代表全人类
1676456789,1192.45900,竟然还有人争论真的假的
1676456657,1089.87400,尽信书不如无书，权威说的都对
1676456629,1088.97800,先是真的再说好吧？
1676456386,404.45000,+
1676455764,780.68200,军方抢预算
1676455604,1189.08300,哎，反正这么多问题就是没出事，问就是丑国超人，下帝保佑
1676455049,914.16800,好莱坞救急
1676455028,733.48200,美国不也是很多国家吗，每个州都可以独立出去
1676454953,744.43700,那些说冷战吧啦吧啦的，那是你把丑国载人登月默认为事实，你怎么就那么肯定呢？
1676454760,634.16400,然后就连续5次成功，小说都不敢这么吹
1676454704,597.23700,今天丑国都不敢保证能成功载人登月，你告诉我50年前丑国靠计算器连续成功5次，笑死人了
1676454683,253.19800,哈哈哈哈哈，《美国历史学家》
1676454518,1253.23400,不好意思，我只想买个房子，但是始终买不起
1676454401,779.41100,这是变3的片段
1676452983,443.56100,印第安头皮发麻
1676452160,771.20600,去了月球代表了你的科技水平的发展，看看苏联，不说我超过他了，我至少赶上他了
1676452078,1311.32400,现在的美国：二战是美国队长带队打赢的，苏俄登场必然反派
1676451973,1311.32400,说得好，RU战争之后西方国家否定掉R历史上各种成就的操作把我惊呆了
1676451767,1199.14300,别再做这题材了，大聪明太多看了降智
1676451714,767.24000,哈哈哈哈，
1676451648,1122.53800,"""承认别人的成功很难是吧""虽然你说得没错，但是我还是觉得这句话太典了"
1676451401,459.04000,可以搜音乐听一下，we choose go to the moon，感觉还挺震撼的
1676451319,457.44400,确实如此
1676451121,1125.84300,星条旗真不落吗
1676451063,1091.56500,当时有多伟大，对现在的美国就有多讽刺
1676451047,918.59200,←大聪明，供应链早拆完了，你现在哪去找零件重建当年的火箭？重新设计的话不需要时间？不需要反复测试？
1676450802,765.93000,你们别觉得钱是小问题，其实是最大的问题，财政本来就有固定的去向，哪里都缺钱，投太空计划其他地方就要削减预算，关键是金额还巨大
1676450441,247.95600,这种修改毫不逊色于“你好”改为“来揍老子”
1676450101,1198.56700,是啊，用钢笔顶都连续6次成功，真当是些科幻小说呢
1676450011,1135.51500,否定不否定，跟客观事实有关系吗？
1676449578,370.41700,那时候的鹰酱还算是一只上进的禽兽
1676448829,721.39100,电视剧《为了全人类》苏联率先登月。。。美国被迫选择登陆火星计划
1676448702,618.73000,boon
1676448402,332.38600,但美国载人航天计划其实并不比苏联晚，只是发射时间晚了。。
1676448339,411.84300,又称人类噩梦的开始
1676448181,269.63200,茅塞顿开~！
1676447774,440.77900,应该是傲慢的国家，傲慢的人民
1676446791,541.90500,面壁人是吧
1676446626,731.77400,百分之1000%
1676446448,869.27700,《一些》
1676446440,868.67900,《领先》
1676446327,779.62100,这段感情化的叙述完全没必要，浪费时间
1676446245,722.57100,其实苏联根本赶不上，这是战略误判
1676446180,392.53300,宇航员？飞走了呀！
1676445897,403.71500,这个演讲确实经典
1676445602,1116.48200,“彩虹旗永不落“”
1676445283,1093.77000,以后的灯塔由兔子造
1676445105,936.34700,现在还真不好说
1676445105,406.98900,we choose to go to the moon!
1676444520,908.09200,其实如果美国没有钱学森那登月计划绝对是黄粱一梦
1676444379,351.34500,神风特攻队：太对了老美，太对了
1676442702,802.71300,毁灭人类都做不到，去看看美国解密的核大战计划吧
1676441069,1129.90200,Longlive USA
1676438184,868.91200,好熟悉啊
1676437371,733.26300,美国不也是好几个国家一起的吗
1676436474,1079.00600,美国只是强大 从头到尾都没伟大过
1676435870,1133.88300,如果我们一味地肯定，那我们就是不尊重！更是不尊重我们自己！
1676435381,776.36400,太有意义了
1676435356,724.62800,好多个国家一起就能否认苏联牛逼了？而且那时候苏联就是一个国家。
1676435139,1238.29900,太空版航海时代
1676435003,1121.77900,燃起来了
1676434715,378.38900,《》美国人失去自信了吗》
1676432088,1362.86300,自信在赢了之后，会变成自大 人类就是这样
1676425813,794.90900,天地同寿了解一下
1676425600,1296.79200,苏联克格勃盯着呢 不可能假的
1676425094,970.03400,都23年了还有人觉得登月是假的啊
1676425024,925.32200,现在上去没有意义，花那个钱干嘛
1676423292,1151.71700,不到50%的成功率你说是不是阴谋论？
1676422569,379.64500,与其提高自己，不如贬低他人
1676422061,871.18700,变3是真的不错，完美地融入了历史事件
1676421014,1140.16700,你所说的成就，也就是我们的起步。并不是终点。
1676420927,1114.50600,集全球高端人才于一起，还能停滞不前，只能说也就一般般吧。未来还得看中国
1676420630,242.87900,科学家＝导演√
1676420611,317.71600,找苏联买技术
1676419997,972.20100,就算是真的，直播也是假的，当时技术很难
1676419806,475.45800,2333333畜牧业的开端
1676419015,750.46300,这是个苏吹吧
1676417700,74.34000,卷起来了
1676415265,1105.86300,美国登陆月球是孤注一掷，太空技术是个无底洞，没有一致的支持没法持续发展
1676414581,1004.15100,美国是人类之脓可不是什么光看看他做的事儿吧有几件是造福人类的
1676410380,854.88800,明白了一个道理，研发曲率飞船需要强权得护航，她需要韦德，额 不好意思 串台了
1676410169,722.36500,简直不敢想象！快去请好莱坞佛祖！
1676405101,100.57900,脑洞大开
1676404195,1124.02600,狗腿子急了哈哈哈哈哈哈哈
1676402711,887.07800,这不就是历朝历代的历史循环吗？
1676399914,380.58200,我个人认为美国是好莱坞登月
1676398156,454.09900,脑洞大开
1676398044,1137.21400,美帝是懂摄像的
1676397898,367.89400,登月不仅仅是验证当下的技术  更是探索未来的可能性
1676397665,1053.43700,然而看了一场戏
1676397512,982.00100,本来就是真的 苏联都没质疑的东西
1676396559,1145.17700,确实强啊
1676395762,1173.21600,美国蛮伟大的 尊重对手 人类社会没有国家之间的内卷就不会加速进步
1676395705,892.56600,什么人性，不过是对不同群体的性的一个方向的总结，不是人性，是社会生产
1676394162,379.95800,现在哪还有对手，一个不卖对手就凉了
1676393964,561.12300,对，鸽王望远镜的命名就是他
1676392520,1164.99100,成功完成了吗？在好莱坞摄影棚里完成的？
1676392327,1119.91500,印第安人摸不着头皮
1676390981,53.13900,挺好的
1676390729,1135.34900,不是否定，是合理怀疑
1676389590,800.42500,核武器不能，你的嘴巴能
1676389272,416.23300,恐怖的清教徒  登上即屠杀开始
1676389046,1121.96100,五毛急了吖
1676388446,1083.45300,灯塔
1676388310,1080.97900,强大就是伟大？？？什么超人类罗辑？
1676387731,1340.15700,后来发现比好太难了，还是比烂更容易做到
1676387626,1268.19000,这不是美国的伟大，是人类的伟大，科学的伟大，只不过碰巧让美国遇到了而已
1676387502,781.88600,哎……去了回来就搞黑科技
1676387360,684.33900,科罗廖夫，太可惜了
1676386713,393.45100,美国从来都没有当什么灯塔
1676386705,1109.17300,美国可是带着目的干这事的，本来准备插旗宣布占领月球的
1676386614,1124.41800,美国这次还带上了苏联的国旗
1676385817,725.67300,我们登日
1676385776,571.89900,摄影技术吧
1676385686,1126.66400,我们要正视客观事实，当时也不要忘记当下的主观目的
1676385570,127.81900,十个人，八碗饭，耶稣来了他也是奴隶制
1676385529,1136.85900,你要知道现在中国依然在自保。但是在几十年前，美国就已经是人类之光了。
1676385353,839.97500,所以美国91%的人反对流浪地球计划
1676385189,625.54800,一键火化？？？
1676385154,526.49000,你还真是我的好朋友啊
1676384907,749.99800,不能正视历史和差距。那谈什么追上赶超
1676384846,148.88700,看大门的：你礼貌吗？
1676384805,85.51700,然后，现在好像反过来了
1676383761,740.85900,看着弹幕 一个个的  我笑了
1676383000,1275.73100,因为它就在那里，因为山的那边是海啊
1676382778,1367.82900,有的人死了但他还活着，有的人活着但他已经死了
1676382759,1099.97600,假的 都是假的 都是好莱坞摄影棚做的! 咦? 我的华为怎么黑屏了
1676382613,726.15200,好在暗杀了
1676382474,1129.87100,克格勃什么都能查星球大战计划一定没被骗吧，换个论据吧
1676381891,1124.45900,阴谋论者：登月是摄影棚拍出来的，美苏争霸都是儿戏，克格勃都是吃白饭的
1676381401,142.76500,好莱坞：正是在下。
1676381339,6.55300,假的，中国不可能登月，都是PS
1676381152,1297.31300,别外星云霍霍了
1676380872,1283.20000,世界上没有苏联，假的
1676380871,755.43100,内部调查
1676380028,549.53700,我卡了？
1676379889,1082.94400,以苏联的能力都没实锤证据，说美国登月造假。居然还有人质疑？
1676379852,860.90900,CIA
1676379733,715.58500,回来不得变成斯普林特
1676379577,1124.43500,伟大的成就
1676379417,1118.35400,承认别人的成功很难是吧
1676379361,1135.81900,登月我信，载人我不信
1676379178,859.73900,变形金刚3
1676378817,1136.95800,但你不能否定他的成就
1676378365,799.53900,核武器只能毁灭人类，地球嘛还好好的
1676378273,736.65900,太空发射系统也只是绕了绕…
1676378086,591.73900,成熟（物理）
1676377813,1016.52200,五十年后，伟大的美国完成了无人绕月  狗头
1676377677,264.21900,这些片段up可以直接放电影资料
1676377625,1097.32500,印第安那点事，放到明清都不够史官提笔的，
1676377326,1141.80200,登月是人类历史中的伟大瞬间，无可厚非
1676377296,1141.80200,是的，美国的伟大在于苏联还在。
1676377288,772.12600,我们现在的显卡笔记本电脑，显示屏和手机都是那时候航天技术发展而来的
1676377167,801.64500,核武厉害得很但也就是那样子，现在都是钢筋混凝土，一般的核武还真不能毁了一个城市，所以核武不会乱丢的后果很严重的
1676377102,1232.82100,因为我们要“自古以来”
1676376981,1324.92700,是的，此一时彼一时。人都会变的
1676376737,772.33300,基于登月航天研发的一系列科技产品，改变了之后的时代，这些影响早就超过了登月本身，
1676376673,1239.99600,技术验证吧，毕竟走一步路用到的肌肉不止一块
1676376450,1059.33900,为什么就不能承认美国登过月，阴谋论看多了吗，别扯什么好莱坞演技
1676376270,60.71600,内卷战争
1676376142,727.95200,绕月不是登月
1676375756,412.25300,Not because it’s easy
1676375652,807.13600,美国的核弹也可以把苏联给扬了
1676375173,85.37100,苏联时候就是发房子的啊
1676375004,1255.31500,人类可以冒险可以进步，但不能像美国给人类灾难
1676374992,454.05500,笑不活啦
1676374769,775.40100,真不是取消探月的理由，美国成功登月后苏联立马就垮了称霸地球，只是没有威胁了 不用再证明自己厉害了
1676374628,82.85900,人类黄金年代
1676374336,390.18800,美国已经又一次感到威胁了，已经重新做了阿耳忒弥斯登月计划 想要巩固自己老大地位
1676373809,800.65100,你看他们三五代后的人（现在）都在做什么
1676373408,40.71100,真会套路
1676373313,1353.87200,zhiq
1676373190,724.06900,发生了《为了全人类》里面的事呗
1676372993,692.35000,苏联：真没想到能上热搜
1676372942,1085.75100,不要盲目自大，现在的世界三足鼎立，但你们要知道吴蜀加一块也远不如那个远扬半世纪的曹魏
1676372430,380.25800,我就想知道那个坐导弹的回来了没
1676372425,791.82100,不要夸大核弹威力，核武器远没有你们想象的那么灭世
1676372329,562.98700,什么太空加成尤里卡
1676372306,479.27700,确实是人类星光闪耀时
1676372039,1332.84300,他们互相成就了彼此
1676371845,1254.36700,BGM！！
1676371729,1109.57900,所谓灯塔国，那盏灯里燃烧的都是其他国家的血肉
1676371439,1087.18600,汽车里的油不要把自己当客人了
1676371272,1094.11900,美国这个工具100年前就是58了
1676371225,1092.71100,我只要人们有58
1676371164,1140.69500,当时的灯塔多少还讲点信用
1676371078,387.68900,等等，那个宇航员呢等等，那个宇航员呢？
1676370923,804.20700,有个jer道理
1676370899,775.58300,我们决定做这件事，不是因为它很容易，而是因为它很难
1676370526,376.27500,美国还不冒险啊，不要被美国宣传机器影响你的脑瓜子
1676370391,1292.96300,迷人的反派
1676370228,603.54800,本来就是为了不让你们联系塔台的。
1676370091,1090.76900,美国有梦想那个，纯纯的公知，美国就是靠侵略他人土地立足，剥夺他人资源苟活，这种也配称得上是梦想
1676370061,1255.11500,山就在那里
1676369964,205.66200,黑宫呢
1676369944,1150.19300,这是人类文明的进步，致敬
1676369869,372.77500,美国不冒险？
1676369780,769.85900,串爆：去了月球就能当话事人
1676369774,460.59600,美丽心灵 推荐大家看看
1676369689,1136.78700,忠诚
1676369622,1065.99500,当时的美苏，就是人类之光
1676369597,67.28800,不用证明了，苏联玩蛋了
1676369570,135.67900,于是找来了一个实习生导演……
1676369565,715.80100,《美国人失去自信了吗？》doge
1676369544,1029.41100,美帝撒了个弥天大谎！50多年前就去并返了，现在月球早成了他的后花园了！
1676369505,100.61900,肯尼迪坐敞篷车～
1676369343,791.41100,政治利益永远大于实际利益
1676368969,776.43200,登月发展出来的技术是通信时代的基石
1676368868,1111.00600,成就和貢獻就是多了一段用無數人的血拼湊的幾段文字
1676368674,1053.87800,当时美国还可以是因为苏联还在
1676368390,1090.53200,美国崛起之后变得傲慢，残忍和焦虑
1676368340,421.79900,338年哪点正好？
1676368328,1132.94800,如果我们一味地否定，那我们就是不尊重！更是不尊重我们自己！
1676368165,1097.39900,因为火星还上不去
1676368100,1080.74500,然后他们上去了就有竞争、偏见和国家冲突了。。。这万恶的灯塔。。。
1676368042,1127.97400,不要局限于美国的错，要正视美国偶尔对的事情。
1676368014,275.71900,茅塞顿开
1676367955,1081.19000,美国作为灯塔的时候，是欧美人的灯塔，苏联作为另一个灯塔的时候是苏联人的灯塔，记住中国在那时候他们眼里就是想要我们成为附庸而不是一个前辈带后辈的强大，他们对我们来说不是灯塔
1676367843,1065.23000,否决掉敌人的历史与强大，只能证明自己这辈子就那样了。
1676367625,918.55000,现在没钱给他们，而且内部贪腐问题也严重的很，简单而言，冷战结束后美国就已经不是那个自信的美国了。
1676367590,1086.67500,期待我国登月
1676367565,411.14700,从水下第一个生命的萌芽开始.....（
1676367548,890.47000,思想是没错，但有几个人能做到。套用一位伟人说的话，用嘴改变世界的永远是大多数，我双手改变世界的是极少数
1676367352,824.90000,所以美国91%的人反对流浪地球计划
1676366609,409.74000,更喜欢他的节目《脑洞大开》
1676366441,830.30000,这个概念不就是公知多年前一直在和我们说的事情吗？
1676366368,1106.47900,美国从来就没想过这是全人类的事儿！你们自己沾啥光啊
1676365841,495.76000,万户是吧
1676365733,405.45000,还有人用一首歌附带这则演讲
1676365496,1157.41900,1971年，中国向三体文明发出信息
1676365462,1128.74600,但是美国人的成就你是不可以否定的
1676365452,732.72000,然后就有了电影史上的登月名场面
1676365203,856.77700,绕远路往往才是最近的捷径!
1676365070,1138.41900,那时的灯塔，好歹还光鲜
1676364988,755.12100,冷战时期什么科技都在突飞猛进
1676364879,1046.99000,？美国人不是人类是吧
1676364867,1113.19100,冷战时候的美国客观上确实为人类科技的进步做出了巨大贡献
1676364573,170.09800,我已经开始笑了
1676364566,647.17900,纯氧
1676364464,431.44700,《民族》
1676364431,1108.34900,如果他们会分享技术，那才能代表全人类
1676364383,162.71800,只要计划实施，一切都会好起来的
1676364376,662.89000,冒进了
1676364248,722.47300,会发生什么？苏联会解体不管会不会发生实际上都会解体
1676364160,888.91800,美国的航天真就多亏了德国人
1676364081,828.52700,粒子对撞机是真烧钱，那玩意碰一下就是天文数字
1676363986,750.80100,冷战时期，各项技术真就是成突变式的增长
1676363664,642.26900,阿波罗火化场
1676363575,1099.64000,站在数千万尸骸上的反人类匪帮是灯塔？？？
1676363318,845.44000,然后赚疯了
1676363166,1116.90500,我们知道美国做过很多破事儿 但是没必要否认他的成就
1676363153,812.95400,冷战期间美国的唯一目标是击垮苏联，苏联的目标是团结力量打一场世界大战，无论谁活下来，不转变思路都是对世界百害无一利
1676362948,93.83900,美国人现在还在怀念的黄金时代离不开苏联
1676362848,888.12700,东梦 这里用了词 还是不太了解当时的情况 当时苏联航天的设计师有私人矛盾 因为当时他们有一个啊，因为被举报曾经被送去古拉格
1676362633,1177.48100,为什么还有人不相信人类登上过月球？
1676362522,884.51700,人性和思想还是有区别的你坏，不代表思想错
1676362394,437.38500,以前是比好，但自从犹太掌权之后就开始比烂了
1676362301,1096.00200,君子论迹不论行，上去了上去了
1676362290,721.75600,已经完成了吧？动植物不是生物？
1676362178,1123.82100,一切都是为了美国人的面子跟所谓的高人一等的想法
1676362119,107.07000,苏联把美国超了（dogo）
1676362034,1088.83100,那只是，投机主义碰巧和梦想相遇了一瞬间。
1676361948,1118.98200,相信登月这件事情，无关信仰，无关立场。因为它是人类自诞生以来最伟大的壮举。是真的得是真的，假的也得是真的。
1676361858,1304.23800,我觉得只是那时候国际新环境还不稳定，美国没有完全掌握话语权而已
1676361764,1325.79800,灯塔已经不亮了
1676361733,1139.75200,美国为数不多可以吹牛的壮举。
1676361641,1091.68000,现在全世界都没什么梦想
1676361604,1231.06600,为了后代的自古以来
1676361450,1107.24500,美国的成就和贡献该承认还得承认
1676361395,1127.53100,当时的灯塔
1676361351,725.17700,牛吹的太大了，兜不住
1676361266,1101.82600,美国是把技术向全人类公开了还是让亚非拉人民和美国一样富了？甚至连欧洲都是有代价有限的给了一点而已
1676361238,733.34900,pyccknn！ypa！
1676361033,735.66100,损失的是信心
1676360985,699.40400,这是一个集成发射器
1676360928,1353.24000,内无法家拂士，出则无敌国外患者，国恒亡
1676360858,584.28500,实际上一堆问题没解决，赶鸭子上架
