1676458707,1137.14000,这一刻，确实是人类群星闪耀
1676458138,166.16100,现在还有傻子信登月是骗局
1676457312,1235.52700,谁告诉你祖国要搞月球基地了？你是航天局的？
1676457147,1030.14900,你们整天喷美国自大，自己又全方面否定敌人强大，果然人种除了肤色不一样，其他都一样。
1676456896,1191.03700,就你会逆向思维，你就不考虑别的吗，你觉得拆穿这么简单？
1676456767,1209.45600,那你要这么说的话，我还说，竟然有人认为是真的呢？谁能确定是真假呢？
1676456710,1115.19700,什么星条旗永不落？精神美国人？
1676456600,37.65600,没有智能勿扰
1676456478,986.08300,本来就是假的，你就知道没质疑？
1676456147,1219.69400,假的你们也相信，哈哈、、
1676455991,8.97800,去过。傻子才不信
1676455516,1138.20900,质疑一下怎么这么多牧羊犬坐不住了？当你真的干了一件事被人揭穿，才会显得这么不安
1676455347,1018.17300,咱中国也登月了，就问你，我们登的月球跟丑国当时的视频一样吗？眼瞎的当我没说
1676454935,210.89900,不能
1676454883,1238.75500,还真有  傻狗  认为 美国登月了
1676454227,212.91900,丑国这嘴脸还不知道吗，必然假的
1676452847,1248.42100,UP把人类想得太好了，你视频下的弹幕和评论里一堆类人在诋毁人类的成就
1676451488,1116.29700,不要盲目自信
1676450198,1226.28000,意义是可以给美国人洗脑，可以给世界洗脑，就在屏幕上都还一堆跪舔，这意义大了去了，“话语权”，懂不？
1676449962,1088.72700,这里面一群的美的舔狗，苏联在航天领域也很优秀，为什么没人舔苏联
1676449931,1121.91300,发现别人造假很难是吧？哦忘记了，你是香蕉人
1676449393,1249.65600,是我们，但美国不是，美国只是单纯的贱
1676449264,1103.86000,这都能黑华为，看来美国养狗真是有一套、、
1676449220,1079.67800,什么你的国家比美国强大么，你特么是中国人么？
1676449148,1039.74100,K的爹要挂了
1676448549,467.20600,美国确实登月了，你看月球现在就没有月球人dog
1676446886,1100.75100,up带节奏都带的有问题，前后叙事节奏都是分离对立的，真的审视审视自己
1676445458,1004.80600,那人类之屑的那面呢 ？墙挡住你的狗眼了？
1676445402,8.83200,这个话题每次都涌现出一堆睿智，反美也不意味着否定掉一切，这和西方否定俄罗斯各种成就有什么不同？
1676445341,1260.17400,月球是太空旅行最适合积累技术的天体，人类不能永远在地球上
1676442591,1081.25900,美国一直都不是什么灯塔，以前不是，现在不是，以后更不可能是
1676441371,993.87800,文盲太多了，噗！你报警吧
1676438006,1046.79100,就克格勃的渗透程度  如果是假的你觉得苏联会放过这个绝好机会？
1676437063,737.15900,说登日的那就是纯爷们了
1676436292,60.51300,现在丑国学会了比烂和堵嘴
1676435915,1145.61900,太假了
1676435592,654.49100,扯着蛋了
1676435469,463.72500,太难得了
1676435062,1326.82800,萎了
1676435010,1283.79100,那倒是，记住，贼鹰负责PPT吹牛皮，兔子负责实现并开发出价值
1676429764,241.42600,苏联乃至全世界那么多专家看不出是假的，一群弹幕科学家说是假的，乐
1676425848,1379.62300,说百大的这个你一看就不是老粉
1676425675,1201.41100,阴谋论会毁了你
1676425535,1280.70000,因为它就在那里
1676416215,2.11500,省流：俄国斯诺登透露登月是骗局
1676410942,1272.51000,信美登月是假的除了满足一下自己那zzzq得虚荣心还有什么帮助么？就当他是真的至少让我觉得我们进步，不会自我安慰找借口
1676404224,1139.92600,忠诚你妈忠诚
1676399497,57.42500,肆意拥抱 自私 贪婪 懒惰 的社会 何来的未来
1676395306,590.38000,我以前上过你妈，后来她生了个小孩叫，“精神美国人”我就忘了怎么上你妈了，真奇怪
1676394925,1099.96100,嗯嗯，别人都造假，就你是真的
1676392940,1323.00700,不怕，美国的坦克是瘦坦克，报纸壳壳
1676392404,1124.93200,必须否认！！
1676390978,12.00000,光速推进器
1676388170,1167.91500,纠结真假的同学，建议你少看点阴谋论。毕竟当时苏联克格勃那么强大也没有发现造假
1676387428,1318.36400,说得好，所以我们也不要变成它们现在的样子
1676387413,3.06700,B站这么多锤登月造假的视频，你能不能给点反证的证据，别在这陈述
1676387174,854.91500,华尔街是吧，毕竟美国自己人说的美政府只是个中层机构
1676386087,1081.84600,真那么多无知的人觉得登月是假的？ 可悲
1676385688,716.53900,急了
1676385317,799.34300,短视的ZZ
1676385311,1077.36800,弹幕都是些什么啊。自信和自大两回事。我国要超越的是强大的美国。而不是毁灭的美国。
1676384938,1090.04200,真有没脑子的觉得美国登月是假的？
1676384923,255.37600,小小的修改
1676384584,74.90000,这就是为什么欧美老白人怀念冷战，因为那个时候资本主义是在给百姓让利，也解释了为啥苏联没了，西方普通人就三十年没怎么提过收入
1676383617,637.77900,致敬
1676383578,1153.18300,力大砖飞
1676382025,412.24100,我们选择登月 不是因为它简单 而是因为它困难!
1676381937,770.34300,肯尼迪：“钱给你，你去给我把苏联扬了，不然就别逼逼。”
1676381246,684.88600,大刘的灵感来源？doge
1676381152,36.48900,、
1676381031,252.45300,小小的修改？
1676380178,1018.72800,请告诉我你的风格为什么变了？这篇稿子给多少钱啊你和乌鸦校尉这样的爱国up都接？
1676379212,1139.46400,尊重自己的对手，也是尊重自己，不要被片面的信息蒙蔽了心智
1676379054,1053.22800,竟然有人能说出美国的进步是人类的灾难，这是得有多无知的脑子啊
1676378742,1085.93500,这是·人类的进步，请不要讨论政治问题
1676377621,1090.36500,太空上没竞争？哈哈哈就不到中国玩还必须立法限制一切技术传到中国
1676377420,46.25900,尤里加加林
1676377387,1118.70800,弹幕二极管真多
1676376566,1143.53900,致敬
1676376480,230.65900,我不道啊，别问我啊老灯
1676376062,658.11200,步子迈大了
1676376002,1248.59400,为什么要登山？因为山在那里
1676375314,272.75400,拨云见日，茅塞顿开！
1676375283,1077.74500,这弹幕真可悲额
1676374643,262.96800,小小修改
1676373373,1039.46200,肤色怎么是红的
1676373212,96.01100,苏联不就是因为装不下去才解体的吗
1676372747,437.37900,美国算啥民族？？？  基本上都是欧洲和非洲的人移民来的
1676372701,146.78500,苏联都没看出美国上月球是假的你能看出来你也是真牛
1676371834,857.41700,美国核心政府部门的行动见不得光啊，碰到就停了
1676371558,227.13200,妇科学 家
1676371443,1075.23500,举报了
1676371422,1188.14600,好吧，你们就愿意给苏联做子，一切为了你们父亲讲话
1676371259,142.01300,急了
1676371069,1087.44200,人家有58制，看视频的韭菜可真够多的
1676370797,1152.67900,铆钉比焊接安全。
1676370308,126.27000,我要五八
1676370271,107.06900,我只要5天八小时
1676369842,200.19000,转移注意力x 转移矛盾✓
1676369822,349.30900,马逆表示你是很懂超音武器定义啊
1676369490,4.58500,你tmd终于更新了！
1676368825,772.83800,这个后来还真成了美国取消探月的理由
1676368811,1086.77200,有夢想個屁，美國沒有一年是乾淨的
1676368638,1011.79400,这个速度太快了
1676368610,37.63300,晚上不睡觉干嘛。。。莫名其妙
1676367965,233.65500,我不道啊
1676367712,927.85100,勃勃生机万物竞发
1676367658,6.49500,哈哈呢？
1676366383,1053.61400,美国才多少人少数派能代表多数了？
1676365695,639.97900,致敬个屁啊！这是美国政府制造的惨剧！航天员被蒙在鼓里
1676365176,869.05900,是变形金刚的画面
1676365077,1279.10000,美国在冷战期间确实可以称之为资本主义社会的灯塔，现在嘛呵呵
1676364979,882.46200,不对啊
1676364736,34.79100,打通电话后，说有个漂亮妞想和你一起睡觉，它就不困了！
1676364718,1135.06500,还灯塔呢 垃圾玩应
1676364471,1233.38100,车轱辘话说不完
1676364384,664.61000,所以要尊重客观规律啊
1676363864,1129.70300,成就就是成就
1676363713,379.08700,毕竟遏制对手的成本比发展自身的成本要低
1676363261,924.09000,没人跟你比好你为毛要向上?
1676362738,265.93700,把难题交给好莱坞
1676362004,1168.84000,苏联上天就是人类之光 美国上天就是和全世界没关系 你比老美还双标
1676361748,1119.32000,登月对人类没用 那你说个中国对全世界有贡献的事? 啥事在你那都没用
1676361691,1102.88000,你小孩用纸尿布么?用手机么?这些都是因为航天工程来的
1676361430,1327.40600,狗咬狗
1676361340,0.00000,情人节发视频，鉴定完毕，友军无疑
1676361197,136.07200,日丹诺夫
1676361148,858.26300,快就是慢，慢就是快
1676360501,1153.96300,呵呵
1676360359,1101.87000,前面那个赶紧爬吧，看着你想吐
1676360013,684.07700,大力砖飞
1676360003,135.89200,急死了
1676359719,1198.79500,如果要讲无比带上阿波罗13
1676359536,1178.84500,克格勃比美国都懂美国，这玩意是假的苏联不得笑死
1676358982,12.07500,大早上的你叫啥啊！你个**！！！
1676358719,227.13400,妇科学家
1676358174,1129.51300,基辛格都坦言美登月是假滴。。。嘿嘿
1676357454,1231.55500,要去把他们旗拔了
1676357437,400.00000,"not because they are easy, but because they are hard"
1676357282,77.09100,合着你比克格勃还厉害呗。人家拿放大镜都没找着美国航天做假的破绽，你一张嘴就否认。
1676356927,583.32700,小破球2的BGM
1676356098,1103.50700,因为它们就在那里！
1676356092,1261.93200,展示实力罢了。我行你不行，那我就是比你强
1676355602,633.12200,致敬
1676355167,175.67200,猪玩
1676354811,10.77900,你TM谁啊？doge
1676354784,78.84800,那是美国最接近灯塔地位的时代
1676354767,301.12400,怎么还没申遗呀？
1676354581,254.89900,小小修改
1676354563,21.87000,食不食油饼（）
1676354530,252.40300,哈哈哈哈哈哈哈哈哈哈哈哈
