上传时间,回复数,点赞数,up是否回复,up是否点赞,评论文本
1676802499,25,764,False,False,"省流：A家里人安排三甲医院月薪七千，但是和女朋友分手了
B自己考进二甲医院（急救科）月薪五千，也分手了
C家境不错，卫健委月薪六千，且修成正果
D专升本，目前在三甲医院实习
E在县城ICU，又忙又累，月薪五千五
F家里人安排，三甲急救科月薪六千+
护理很累[笑哭]"
1676800104,35,346,False,False,本科大三护理男生报告，不建议入坑，其实这行业男生也多起来了，不建议后面的人入坑，现阶段还是可以的
1676988287,1,22,False,False,有个朋友是男护，今年过年回家他说要入伍了，我也是想着男护这么缺为什么会去入伍，他说没钱没关系进不了医院，小县城医院都得本科起步，他一大专人不要，宁愿缺人也不要大专，要么得二十万安排，一听算了入伍去了
1676905101,0,14,False,False,西安专升本男护，应届毕业生劝你，跑，赶紧跑，护理这行业是一眼到头的，没关系进不了管理层，不信你实习的时候看看哪些老护士，她们年龄多大？在做什么工作？看看她们日子过得怎么样？我现在在准备转临床监查员和协调员中，哪里缺人我想来。
1676800738,20,104,False,False,我已经在跑的路上了，奉劝各位可别听别人说男护吃香啥的。有机会跑就赶紧跑。我身边的男同学都没几个干这个，要不考研毕业考公，要不转行干别的，要不就去当医药代表。这专业真心感觉不好。
1677014167,1,5,False,False,护理这专业这么说好呢，就业前景看个人努力，如果是光想混混日子就在普通科室里当个护士，虽然累，但年资、支撑上去了，一个月1w左右轻轻松松，一年下来零零散散算上15w能达到，如果想奋斗就读研读博，考专科护士，现在国家也在大力支持专科护士建设，我认识很多老师就是在读专科护士，其中一个最厉害的就是烧伤专科，跟医生一样门诊坐诊，周末双休
1676799474,32,151,False,False,终于到护理专业了，我就是，实习感觉不快乐，没有前途
1676799693,20,71,False,False,压线专升本考民办本科=努力，真的假的？
1676805096,4,8,False,False,男护师 三甲医院工作 已经润了[妙啊][妙啊]
1676816996,7,4,False,False,欢迎大家报考轮机专业，工资高，待遇好
1676804141,10,17,False,False,为什么不提规培的事，1-2年，每个月2000块[大哭]，狗听了都摇头
1676800490,23,16,False,False,这么低的工资父母养老，子女教育，换车换房真的。。。 个人觉得且不说卷不卷 起码要个人努力有10k吧  不然真不会很拮据吗？[思考]
1676821697,1,5,False,False,570甚至可以去华科武大读护理
1677117717,1,1,False,False,我同学说的，劝人学医天打雷劈[笑哭]
1677059415,0,1,False,False,沿海城市手术室在职，一年全包二十出头做三休三爽歪歪[脱单doge]
1676801886,5,7,False,False,本科男护大四实习中，我的评价说跑，快跑，一定他们的要跑
1676804795,1,3,False,False,身处坑底看什么都好，比环境985硕强
1676799426,4,20,False,False,专科7k，还是三甲[笑哭]
1676816948,1,12,False,False,护理这个行业，性价比比较高的是二本三本的护理生，可以进不是很差的三甲医院，当然那些顶级医院也别想了。一本以上护理生，尤其是男生建议读研跑路
1676820308,8,7,False,False,专科这么牛逼？表哥三本连回县里实习的资格都没[吃瓜]后来当兵去了
1676814973,2,9,False,False,视频里这些人都有编制吗？没有编制护理工资很低的，我们这边只有两三千……
1677061479,0,0,False,False,当初差点报这个了，现在想想还好没报，遭不住
1676800011,12,19,False,False,不是都说很好很赚钱的吗？还是我们不了解，我一个好朋友也要当男护士了，大一，等他工作了我也来投稿
1676799854,2,10,False,False,建议直接动物医学，去牧原尝试一下生物安全。
1676800209,0,7,False,False,卫健委工作！
1676803392,0,2,False,False,有心理学的吗
1676811261,1,5,False,False,要么是黄河护理，要么是郑州澍清医专的，河南科技职业大学18年就是本科了，医药健康学校21年才建设
1676865412,0,2,False,False,护理专业要去大医院必须研究生起步，但是男护在医院很累，并且会有点不被尊重
1676807744,0,2,False,False,他们地方小，来北上广去一些累的科室，20+w不是问题
1677115382,0,0,False,False,本科去年入职西安某三甲的男护士，同样想跑路，不会干时间长的，过渡一下就跑。
1677075768,0,0,False,False,男护很难升护士长吧
1677086690,0,0,False,False,机械专科有什么好的就业方向吗有人能告知一下吗[笑哭]
1676805826,2,3,False,False,我大学就是护理学，毕业之后没有考护资，一直想参军。今年我又报了名，希望这次能去往部队
1676807428,0,2,False,False,男生表示，从来没想过当男护士[doge][doge]
1676799918,0,4,False,False,感觉还是挺好的了
1676895257,0,1,False,False,2015年的本科男护，现在30岁转行都没人要
1677110882,0,0,False,False,医院不是得考试？能是随便进的？
1676882991,0,1,False,False,所以自己喜欢的才最重要，哪怕忙到吐也不抱怨
1677061433,0,0,False,False,这工资水对的起专科毕业
1676810138,9,2,False,False,"哎 我记得以前做过一期男护理本科吧[热词系列_知识增加]
嗯…..男护理硕士和博士那岂不是凤毛麟角了哇 不知道硕士和博士工作会是怎样的[热词系列_知识增加]"
1677062285,0,0,False,False,我觉得手术室好一点
1677104160,0,0,False,False,才20000？来铁路。
1677109462,0,0,False,False,怎么会找不到工作呢 换个地方试试
1676815686,2,1,False,False,挺不错啊，我本科广告学专业的出来3500天天加班，实名制羡慕了
1676813425,0,1,False,False,护理硕士来了不知道以后的工资能不能对得起我的学位
1676809785,7,1,False,False,感觉好像没啥人想学护理，我学校护理分数线一直都比其他临床低很多
1676799516,3,5,False,False,护理专业，今年7月份就要去实习了[笑哭][笑哭][笑哭]
1676799659,0,3,False,False,普通呀，怎么不普通，都是努力生活的人罢了[保卫萝卜_哭哭]
1676961250,0,0,False,False,可算是在B站刷到了
1676992692,0,0,False,False,民本都能去三甲实习，，，男护士确实吃香啊
1676981944,0,0,False,False,至少比传统生化环材专业要好[doge]读个硕士全润到别的行业去了
1676927779,0,0,False,False,医院不新增编制了，有编制估计是卫健委派过去的
1676903563,2,0,False,False,好多985的护理专业分数都巨低，为啥
1676892723,2,0,False,False,牛的，家里关系都这么强吗，直接安排进医院的
1676906171,2,0,False,False,有没有一种可能，是河南护理职业学院
1676869894,0,0,False,False,分享人是开封哪医院的？同在开封市医院急诊科
1676871888,0,0,False,False,男护理最大的麻烦是三班倒要很久（毕竟工资是比不过医生的），优点是只要大专哪都好去，不像女的要本科才好，不过好多年前男护理就开始慢慢有了多起来了
1676813816,1,0,False,False,是不是新乡医学院三全学院？
1676812718,0,0,False,False,其实男护士挺吃香的
1676811358,0,0,False,False,我超，专科混的还可以
1676811466,0,0,False,False,专科这样已经很不错了
1676804811,0,0,False,False,协和医学院的护理怎么样[doge]
1676814830,1,0,False,False,所以本科护理学和专科护理学有啥区别
1676807174,1,0,False,False,有条弹幕说有没有电力的学长学姐，我也想知道啊！
1676802255,7,0,False,False,为啥好多都是三甲医院 工资却那么低啊
1676802165,0,0,False,False,一个班能凑6个男护士，可以啊
1676801718,3,0,False,False,怎么感觉未来一片光明啊 专科都能进三甲
1676893524,0,0,False,False,是不是在澍青读书啊👀
1676802251,0,0,False,False,看成了专业男科护理[妙啊][妙啊]
1676801433,0,0,False,False,在实习男护生表示，快跑💨。
1676801138,2,0,False,False,护理专业会成为以后的风口吗
1676802221,2,0,False,False,2022届的专科男护 目前还没找到工作 [笑哭]
1676801547,0,0,False,False,当初高考时，差点填了安徽省内一所医科大学的男护[doge] [吃瓜]
1676801136,0,0,False,False,不止在一个地方听过了，有各种各样的人都说自己的专业、工作像围城
1676799552,0,0,False,False,男护理瑞啊
1676799416,0,0,False,False,去年底刚刚放开应该很舒服吧
