上传时间,回复数,点赞数,up是否回复,up是否点赞,评论文本
1676190963,0,2,False,False,本质的话5个大人绝对有自己孩子，往暗处说未来可能复仇，更重要的是他们是整个家庭的动力，小孩我真的不知道该咋表达，另一个意思也就是5个小孩未来与一个大人的情况比较谁重要了，我也并非是有意说小孩，希望这种事情不会发生在任何人身上[藏狐][藏狐]
1676262666,0,2,False,False,谁建的一下子就看得出来，一开始肉汁手上拿着一个指令棒[doge]
1676178428,0,2,False,False,快把赫子放在铁轨上！
1676177285,0,2,False,False,如果车慢点、远点可以拉向一个人那条铁轨，再冲过去把那一个人拉走[doge]
1676175490,0,5,False,True,如果你选择使用民用家庭核装置击毁电车从而拯救他们，那么这是牧羊的瓦格纳[doge]
1676176496,0,2,False,False,大家好，我是卫宫切嗣
1676181363,1,2,False,False,可以试着放一个传送门 ，或者为了节省材料 可以直接拔掉两个铁轨 [doge]
1676177778,1,2,False,False,五个大人可以获得三个小孩，所以就五个大人等于就五个生命[doge]至五个大人，为什么有三个小孩还多一个大人呢？不能来个三角形吗
1676263293,1,2,False,False,如果有正确答案就不叫难题了，所以大伙不用因为成为少数派就谴责自己哦[妙啊]
1676174181,0,2,False,True,直接双轨漂移！
1676175644,0,2,False,False,[大哭]hehe想要创我
1676174158,0,2,False,True,第二个，hehe火速赞我！[doge][打call][打call]
1676186931,0,2,False,False,"可是他们不是全迷路了吗？
你救哪个都会死呀？"
1676174261,0,2,False,True,不对劲，十分有十一分不对劲
1676453256,0,1,False,False,卡住火车
1676174345,0,2,False,False,主播的开头小短片好抽象
1676174154,0,2,False,True,更新这么勤，不像赫子哥[doge]
1676174937,0,2,False,False,芥末退出了啊😭😭
1676174938,0,2,False,False,我选择把六个都撅了
1676381012,0,1,False,False,好有意思啊[doge]
1676183524,1,3,False,False,我选择在列车头走一半的时候拉[doge]
1676174147,0,2,False,False,[热词系列_知识增加]
1676201964,1,3,False,False,电锯人：我选择猫[doge]
1676174908,2,2,False,True,我靠赫赫疯了快来人竟然连续更新两天了！疯了
1676175176,0,2,False,False,为啥不在车走到交叉点的时候拉拉杆，直接6杀awa[doge]
1676175337,1,2,False,True,那就我一个人会想过能把列车拦下来，想法呢？
1676188190,1,2,False,False,为了赚取利益，让这个为祖国做出贡献的人活着没有贡献的人，却把他杀死，这不是很没理由道理吗？
1676176255,0,2,False,False,结论:没有人错，没有人对
1676174761,0,2,False,True,很简单，不去管开关去把那边另一个人给救下来，那五个人本来就要死，我只是不做选择，然后我还救了一个本来就不应该死的无辜人，完美
1676464723,0,1,False,False,法律角度来说，你不拉拉杆跟你啥关系没有，但是如果你拉下了拉杆你就是杀人[脱单doge]
1676181064,0,3,False,False,我会把拉杆拉一半，然后赫子哥就会飞出去awa
1676174647,0,2,False,False,我想到了一个游戏叫做电车难题有限公司。
1676367272,0,0,False,False,世界著名的电车拉杆问题：原来的是题目是五个不听话的孩子，在铁轨上玩和一个听话的孩子，在一个废弃的铁轨上玩，订车会驶向那五个孩子，这个时候你有一在旁边有一个拉杆，你不能大喊大叫，因为他们听不见，也太远了，你怎么做选择？如果换成大人和小孩的话，矛盾点太难了，这个没法讨论
1676367706,0,1,False,False,拉了故意杀人，不拉会被网暴，我选择下次把网暴的绑上去[呲牙]
1676299425,0,2,False,False,想起来一个表情包[tv_doge]
1676375783,0,0,False,False,如果碰到电车难题，在现实中推荐大家当旁观者，或者直接无视离开，因为如果你搬动了拉杆的话，你就从一个旁观者变成了杀了一个人的杀人凶手了，直接故意谋杀，就算你救另外几个人，那有什么用，你照样要坐牢，顶多就不用枪毙，所以以后碰到类似的题，直接不选择好吧啊AB都不选啊
1676384138,0,0,False,False,直接创过去是意外，你懂了是故意虾仁。第一个你只最多是被骂说见死不救，但是你动了以后不仅会被骂，还会坐牢（几年还不知道）
1676358311,0,0,False,False,无所谓，铁轨最开始在哪边就让车开哪边，我是坐车的，他们自己在铁轨上关我p事
1676375937,0,0,False,False,拉下拉杆，那我就是杀害那个小孩的凶手。不拉拉杆，那就是绑那五个小孩的人是凶手，而我只是一个路人甲[doge]
1676438737,0,1,False,False,爱创哪个创哪个，只要别创我就行[doge]
1676371464,0,0,False,False,DIO：中间不是很宽敞吗，往哪里开[doge][doge]（快说谢谢DIO）
1676175126,0,2,False,False,我选择创碎10亿美金，为了搞一个短期通货膨胀牺牲一个人的生命，怎么想都会被罪恶感杀死的[doge]
1676174603,0,2,False,False,主播有点怪。
1676434722,0,0,False,False,如果这事发生在现实，我个人会选择什么都不做立即报警。让类似的事件让生概率减少。，我会替那些枉死的人们报仇。
1676371553,0,0,False,False,无非就是自己的命换五个人的命吗，但我救人与否取决于我的价值观，因为都会死，所以我的价值观只能决定我的行为而不能决定目的。如果限制在规定内，那我的行为有取决于我的价值观，那我只能说价值观转移，比如出钱要求我做，能判断五人和一人价值的要求我做。这样能救人，而我不用取舍不用考虑，也满足了我的价值观
1676364693,0,0,False,False,很简单要么创死人多的要么不管，因为你拯救了人多的他们会觉得理所应当和庆幸自己没有死，甚至可能会过来骂你口伐笔诛你，说你为什么要去杀死那一个无辜的人，而只救下一个人会让那人千恩万谢的感激你，从利益上来看救一个人比救多个人要更加有效，但是最正确的答案还是不动不去管，这样这件事就与你无关了
1676388599,1,0,False,False,用车创五个，自己在补刀一个，这样就没有人知道了，就什么事都没有发生
1676407795,0,0,False,False,"我会创那一个人，因为比起五个家庭失去亲人，一个还会觉得好受一点。而且创死五个人，那一个人难免会精神失常，甚至会供出我是故意的，五个人相继还会为了面子感谢我。另外我还担心一下子创五个人会不会脱轨[doge]
如果五个陌生人和一个熟人，我指定创陌生人，我都不认识他们为啥要救
如果五个熟人和一个熟人，我会考虑关系好坏来创
反正我就是自私的，创也是创，不创也是创，那为什么不能找一个创完对自己有利的轨道"
1676364526,0,0,False,False,两种选择，一好选择过去吧，只有一个人的铁轨，那里的人救下来，然后把矿车转到一个人那里的铁轨，二会选择把一个人那里的铁轨上的那个人转移到另一个铁轨上的人，就变成了6个人，然后直接铁轨拐到那6个人那[doge][doge]
1676177511,0,1,False,False,难道最新的霍格沃茨之遗要来了吗？
1676358463,0,0,False,False,换我的话，我会在火车拐的一瞬间掰过去，将火车掰断[歪嘴][歪嘴][歪嘴][歪嘴][歪嘴][歪嘴][歪嘴][歪嘴][doge][歪嘴][歪嘴][歪嘴][歪嘴][歪嘴][歪嘴]
1676398530,0,0,False,False,不过现实是你可以把那个轨道掰一半，所以说列车会直接脱轨，但是由于列车本身的装甲足够强，所以说车上的司机生命压根不会有啥损失，就算有损失，无论是压一个人还是压五个人，最后都会导致列车脱轨，并造成同样的损失，所以说，在现实生活中的最优解是把列车的那个铁轨掰一半，使他强行脱轨，这样子虽然会被法律判定为有罪，但是至少把所有人的生命都救下来，并将损失减少到最小。[笑哭][笑哭][笑哭]
1676363890,0,0,False,False,看时间，时间要够的话，我选择让列车行驶到上只有一个人的那个轨道，在列车到的之前，把那个人给解绑，都时间不够的话，我不选择，因为你要是选择让列车，行驶到一个人的轨道的话，他就会杀了那一个人你就会犯故意杀人罪，而你要是让列车走原来的路线的话杀五个人，但你属于是旁观者，没杀人
1676365580,0,0,False,False,通过快速反复拉动拉杆让列车脱轨漂移同时创两条轨道[吃瓜]
1676369467,0,0,False,False,这种情况下不管往哪边拉拉杆都是故意杀人罪，但如果不做选择就是意外事故
1676174299,0,2,False,True,赫啊我已经三连了不过批作业的时候要注意身体啊[哦呼]
1676392948,0,0,False,False,让车翻滚起来吧，然后车毁人亡，所有人都死了，这是什么？这就叫做完美刺杀任务完成[滑稽][滑稽]
1676471054,0,0,False,False,"[脱单doge][脱单doge][脱单doge]这是一首藏头诗:

不须沈水自然香,
瞒不过主腰胸带。
你从前入道未是，
说英谁是英。
白日放歌须纵酒，
嫖姚何日破重围。
好是春风湖上亭 ，
爽气朝来万里清。
三万里河东入海，
连山断处大江流。
别巷寂寥人散后，
想见城南春水深。

如何独得百丈索,
有人夺得玄珠饵。
看是处春回柳眼，
到如今犹宿花阴。
送春争得不殷勤, 
我醉只知今夜月。
上言二年隔烟水，
去年却下七里滩。
[doge]
愣着干嘛，赶紧复制[doge]"
1676445015,0,0,False,False,我会反复拉这个拉杆 让她们凭运气活[吃瓜][吃瓜][吃瓜]
1676375912,0,0,False,False,这种情况下不管往哪边拉拉杆都是故意杀人罪，但如果不做选择就是意外事故
1676464031,0,0,False,False,不能一起活那能不能整个什么骚操作一起死[脱单doge][脱单doge][脱单doge]
1676360904,0,0,False,False,把一个人放到一群人的铁轨上，这样就不会觉得不公平了，对大家都好[tv_doge]
1676433873,0,0,False,False,全都创了，不留下一个目击者[阴险]
1676457832,0,0,False,False,能拿超神（5杀）为什么不拿呢[脱单doge]
1676372363,0,0,False,False,一个你可能得不到的和两个一生的好哥们，说不定好哥们还能给你物色几个[doge]
1676378654,0,0,False,False,电车难题现在好像变成法律之争了，应该改一下变成：如果不拉拉杆会全创死，但是你可以选择救1个或者救5个
1676388005,0,0,False,False,这么说吧，看过诡异直播那个小说我会说，我会直接干掉出题的人，成为那个掀掉棋盘的人[脱单doge]
1676363343,0,0,False,False,我觉得吧，你不碰这个拉杆，不管死几个人，和你都没关系，但是因为你拉了拉杆死了一个人或那六个人，那这件事就和你脱不了干系了(我不太懂法，这只是出于我的个人理解，希望有大佬给我雷厉风行的雷....科普一下我说的对不对)[来古-震撼]
1676382105,0,0,False,False,我本来是想从第一题到最后一题每一个都仔细分析的，但是到最后一题我想通了，当你在这个列车上面的时候，你无论如何都有罪，就算是别人的眼里，你是对的，那要怎么样呢，你依然杀人了！有很多人的意见都不同， 人多的那一方就是你的结果，是好是坏已经无所谓了，一个游戏不能带来实质性的用处或坏处，有些喷子会说出一些道德谴责的话，但也无所谓了，一切就像视频的最后，多成一场游戏结束了，现实也不会有这样的，就当成随便说说的吧。
1676450514,0,0,False,False,我选择让列车刚上分叉口的瞬间拉拉杆，虽然我不能保证所有人都活着，但我可以尽我最大的努力让他们死干净[打call][打call][打call]
1676429925,0,0,False,False,电车难题的最优解就是，看着一切的发生，而不去干预，因为一旦拉下了拉杆，你的身份将会从目击者转变为杀人凶手.
1676432488,0,0,False,False,电车难题就是让弱者胡思乱想的，因为强者能避免这种情况的出现或者直接在电车来之前解救下来。之所以是难题的原因还是弱小的原因
1676372361,0,0,False,False,解脱一个人还是解脱五个人？当然是让列车来一次炫酷的漂移全创飞啊！
1676462048,0,0,False,False,第2个对你有感情的两个同性，我怎么感觉不是好朋友，而是杰哥呢[doge]
1676468570,0,0,False,False,我为什么不能去选择把列车行驶向一个人，然后把那个人给救下来了
1676374731,0,0,False,False,"高级电车难题：
老样子，失控的列车
有你和另一个人决定列车的方向：
1.无人拉杆，5人死
2.一人拉杆，0人死
3.两人拉杆，1人死
（两人不能看到与听到对方）
你会做出怎样的决定？"
1676440167,0,0,False,False,有一点，电车难题不论什么结果，都会面临他人的谴责[doge][doge]所以五个目击证人和一个目击证人[doge][doge]你们懂得
1676369350,0,0,False,False,先把一个人的绳子拿剪刀剪断，然后直接改变轨道，在一个人那里，让那一个人站在旁边的地上完成
1676444461,0,0,False,False,其实这样一看只有up闯死了人[doge]而后面的人和我们都是观众[doge]
1676432434,0,0,False,False,无所谓繁殖机会出手[doge]
1676371187,0,0,False,False,撞忠实粉丝的话，那个100个键盘侠可能变成你的忠实粉丝
1676375964,0,0,False,False,无所谓，我会使用斯派修姆光线
1676370887,1,0,False,False,"新的电车难题：
电车铁轨上绑着密密麻麻的人，电车也已经碾过无数个人。只有你可以让电车停下来，但停下来后活着的会选择一起举报你杀了人。你的决定是让电车继续走还是停下来？[妙啊]"
1676465454,0,0,False,False,第三题得创粉丝，毕竟那100个人可能有说的对的，而且加上那是100条生命，比1条重要多了
1676462167,0,0,False,False,其实呢，我有三种方法，第一种就是徒手或者杠杆原理把铁轨给拆掉，第二种就是拉下拉杆快速跑去把那铁轨上的一个人救下来，第三种不太靠谱简单来说就是卡bug把拉杆用手固定在中间，这样是不是火车哪也不会去[doge]
1676457562,0,0,False,False,怎么说呢，你选择不去改变五个人的死跟你没有任何关系，你是旁观者。改变了故意杀人可以从轻发落
1676358953,0,0,False,False,问单独的一个人要钱[妙啊]然后不拉拉杆，既获得了钱也避开了法律，如果对面五个人给的多，我也不在乎拉拉杆
1676381755,0,0,False,False,电车问题告诉我们，要提前下车，把前面的轨道挖了。
1676365619,0,0,False,False,变轨拉杆是特殊设备，我动了就是违法[doge]
1676381876,0,0,False,False,我会拿出镐子 把铁轨拆掉[脱单doge]
1676461310,0,0,False,False,最有奉献精神：自己下车挡住车
1676394826,0,0,False,False,当对我自身利益没有影响的情况下，我会尊重最初的命运
1676374088,0,0,False,False,我应该会这样：什么拉杆？这只是一个木棍而已[妙啊]
1676379004,0,0,False,False,"我感觉不动还好,要是你拉拉杆的话，那就成故意杀人了( 个人感觉"
1676372314,0,0,False,False,我会恨为什么只有一列车，后面再来一列我再拉下控制杆，不就能全啥了吗？[doge]
1676390745,0,0,False,False,这个怎么说呢，人的生命是无法进行比较的一个人的生命和五个人的生命同等重要，而且这种情况下最好是不要动拉杆，因为你动了那死的人就和你有关系，也就是你犯罪了[笑哭]不懂的话反而不会有任何问题
1676376020,0,0,False,False,我不会改变，因为这是一个定数，必定会撞上人，我选择不去改变
1676400741,0,0,False,False,第一道题个人看法 如果是自己跑到铁轨上的（就不是绑架之类的话）我来选肯定撞大人 小孩子不懂事难道大人也不懂？成年人为自己的行为负责
1676456759,0,0,False,False,一只左右拉拉杆，直接把让电车翻掉，牺牲一车的人，就可以了。
1676433839,0,0,False,False,"其实这是一个人，五个人和一车人的选择题。
车：谁来为我发声[大哭]"
1676433136,0,0,False,False,电车难题我认为解决方法就是以最小的伤亡数字，换更多的存活
1676468112,0,0,False,False,谁会拒绝一个360度的旋转呢[doge](别喷)
1676435625,0,0,False,False,正确答案。用你的手指往上划一下。[脱单doge]
1676375268,0,0,False,False,把铁轨挖了（即答》
1676465556,0,0,False,False,双更好欸！！[打call][打call]我就知道赫子不会让我失望的[妙啊]
1676375315,0,0,False,False,大人终究会老死的，小孩还有那么多青春
1676384442,0,0,False,False,把两边的铁轨过去的时候都砸了，让他往中间走[微笑]
1676372752,0,0,False,False,其实可以给那6个人鞘翅和烟花飞走的[doge][doge][doge][doge][doge]
1676362245,0,0,False,False,我会假装没看见，这个问题就不用我来解决啦！
1676369908,0,0,False,False,多简单，改变轨道就是故意杀人，谁会去犯罪[doge]
1676447746,1,0,False,False,有没有一种可能这样说只不过是为了，涨粉[doge][阴险]虽然我感觉可能会被网爆[doge]
1676372414,0,0,False,False,可以在列车走到一半的时候拉拉杆就可以前边压一个人后面压五个人时漂移然后再漂回来（乐）
1676427996,0,0,False,False,我觉得真有这样的情况时，就要看着，如果别人谴责你，可以让他换位思考。如果创小朋友的话，小朋友是无辜的，如果创成年人的话，那么你得罪的人太多，所以最好就是遇到这种情况，你不要看，直接转身离开
1676436798,0,0,False,False,我突然想到一个问题，火车都是规划好路线的避免冲突的，但如果改变了轨迹会不会出现更严重的事故，所以我选择不改变
1676465279,0,0,False,False,电车难题，我也感觉很难，但是我感觉直接把轨道，给切开不就行了
1676380126,0,0,False,False,我可以把转向的轨道给撸了吗(
1676367820,0,0,False,False,只要你拉下了拉杆，你就是故意杀人，如果你不去碰，只是路过，那你就是无罪
1676421998,0,0,False,False,创什么别人，创我[傲娇]
1676174938,1,2,False,False,趁没人偷偷说一声 我是赫子的狗[脱单doge][脱单doge][脱单doge]
1676438421,0,0,False,False,这个问题放现在很简单，不是你绑的你为什么救[吃瓜]
1676438082,0,0,False,False,我选择短暂性失明，啊，你们在哪儿，怎么做才能救你们！
1676432174,0,0,False,False,现在不是已经解决了吗？不是你的事你为什么要管，不是你的东西为什么要碰[doge][doge][doge]
1676377050,0,0,False,False,不要动，因为动了你会担负刑事责任，那一个人本来不该死，是你动手了，所以你要判刑
1676392117,0,0,False,False,高速换道让列车脱离从中间过
1676374989,0,0,False,False,和你没有关系你为什么要救[doge]
1676375030,0,0,False,False,6000➕……
1676388498,0,0,False,False,"只要你动了拉杆，故意杀人罪是逃不了了
生命不能哪来比较"
1676452153,0,0,False,False,最后一道题应该是更像是祖国人救飞机那差不多吧[doge]
1676426959,0,0,False,False,牺牲少数，保全多数，无奈之举
1676386430,0,0,False,False,真的只有有我一个人选择不拉吗[撇嘴]
1676382637,0,0,False,False,你这种情况下就不要拉了，因为你拉了差不多就是犯法，毕竟另一个也是无辜的，那要不拉就跟你没关系
1676371074,0,0,False,False,不拉拉杆没责任，拉了拉杆就要承担法律责任，我选择明哲保身
1676392042,0,0,False,False,往铁轨上放石头，让火车脱轨[tv_doge]
1676461179,0,0,False,False,131.4w粉丝[脱单doge][脱单doge]
1676402142,0,0,False,False,可是五个大人有自己的五个小孩呢
1676377072,1,0,False,False,把左边那一个人背到右边
1676377250,0,0,False,False,只要把头弄向两边，这样才是正确答案
1676393187,0,0,False,False,总之，只要不管，就不会和我有关（）
1676435921,1,0,False,False,那个，在列车即将拐弯的时候拉下拉杆，让轨道转向另一边，转向时会经过中间，然后列车正好直接从中间脱轨[doge]
1676450072,0,0,False,False,最优解，列车飘移[doge]
1676439933,1,1,False,False,选c含泪拿下六杀
1676376333,0,0,False,False,家里蹲为什么会出去跑到铁道上[doge]
1676431013,0,0,False,False,尊重铁轨本来的行进路线
1676374518,0,0,False,False,我选择干掉出题人
1676378943,0,0,False,False,。。。。。。我跳上去他会脱轨吗
1676381946,0,0,False,False,"请问，当五个人都是白嫖怪，一个人是三连的人
你会放手还是拉下拉"
1676466457,0,0,False,False,想走那边走那边，反正压不到我。
1676473291,0,0,False,False,他说家里蹲的为什么能站在铁轨上呀？
1676377074,0,0,False,False,少闯一个我心里难受[藏狐]
1676402198,0,0,False,False,哪边人多创哪边[保卫萝卜_哇]
1676462879,0,0,False,False,我会选择，撸掉铁轨
1676460393,0,0,False,False,我的话我会把铁轨拆了。[doge][doge][doge]
1676396274,0,0,False,False,嗯，掏出手机拨打110？[tv_冷漠]
1676444308,0,0,False,False,简单，我也在左右拉拉杆创s谁那可就不关我事啦[doge]
1676392579,0,0,False,False,拍卖 价高者活
1676375997,0,0,False,False,不是那些人，他们去轨道上干嘛？他们不能走开吗？
1676397074,0,0,False,False,应该出一个不用动拉杆哪一方会死的选项
1676297484,1,0,False,False,怎么这么多天没有见到芥末了？
1676370831,0,0,False,False,只要你左右左右左左右右左右左左右左右左右左左左右右左左右右左左就这么一直按完美完成六杀
1676463387,1,0,False,False,我就不能把那个人救了，然后在改变轨道吗？
1676444718,0,0,False,False,只要不动拉杆，就不会受到法律的谴责
1676358866,0,0,False,False,把列车轨道随便拉一个然后去解开绳子不就行了？
1676381659,0,0,False,False,就算女神喜欢我，两个人命也更重要
1676433343,0,0,False,False,到今天还有人不知道拉拉杆犯罪不拉拉杆无责吗？
1676472966,0,0,False,False,你不拉拉杆，你就是目击证人，你拉了拉杆你就杀人了
1676442616,0,0,False,False,能五杀为什么要单杀
1676372004,2,0,False,False,当过兵的家里蹲怎么算
1676382912,0,0,False,False,第三题选错，杀了一个粉丝粉丝还能涨回来。
1676380218,0,0,False,False,你不拉就不用賠錢了(doge
1676362920,0,0,False,False,电车一个滑铲把全部都干死[脱单doge]
1676206680,1,0,False,False,为什么要救一个和自己不认识的人[吃瓜]
1676390765,0,0,False,False,肯定撞人数最多的
1676466159,0,0,False,False,我会在新任五个人的时候瞬间改变拉杆然后呢他就会滑出去六个人全都死[歪嘴]
1676464071,0,0,False,False,131.4粉丝6[tv_doge]
1676370673,0,0,False,False,左右左右左右右右左右左左右右左右左左右右右左右右右左左诶，就这么一直按变成了六杀
1676372087,0,0,False,False,我会直接不理，假装什么都没看到
1676373052,0,0,False,False,但是，这是一群村民啊[doge]
1676380012,0,0,False,False,为什么不可以拿石头把列车长岁呢？
1676427981,1,0,False,False,我可不可以两边都选？[脱单doge]
1676364989,0,0,False,False,疯狂拉让火车脱轨[tv_doge]
1676461044,0,0,False,False,我选择六杀[doge]
1676451993,0,0,False,False,顺来的图[doge]
1676376551,0,0,False,False,我选钝角[热词系列_肥肠自信]
1676174393,0,2,False,False,好荒谬[doge]
1676424723,0,0,False,False,为什么不全杀了？那样还省的别人告你了，你保存一个人和保存五个人都是错误，因为他们活下来会止责你，你获得了什么？你什么都获得不了
1676352257,0,1,False,False,含泪拿下五杀[doge]
1676351846,0,1,False,False,弑罪者
1676332173,0,1,False,False,我会建成环状铁轨，含泪6杀
1676388873,0,0,False,False,什么五杀？我要团灭[doge]
1676347752,0,1,False,False,五杀，我的五杀
1676334588,0,1,False,False,我要完成六杀！
1676343983,0,1,False,False,改一半[2022拜年纪_不愧是我]
1676330326,0,1,False,False,不拉拉杆那五个人被撞死，是意外。而拉了拉杆那一个人被撞死是故意杀人。所以只能不拉拉杆，兄弟们觉得我说的对吗？
1676370298,0,0,False,False,我会下去帮他们松绑
1676354259,0,0,False,False,考虑全面再选择[脱单doge]
1676349304,0,1,False,False,你先调到一个人那里，然后在以光的速度去把那个人的绳子解开不就行了吗
1676346884,0,1,False,False,雷迪亚兹：我以为在座的各位都是人权至上的绅士
1676310216,0,1,False,False,哇哦，跟桃桃一模一样哎
1676333338,0,1,False,False,最近死在轨道上的人突然多了起来。[脱单doge][脱单doge][脱单doge][脱单doge]
1676365257,0,0,False,False,"没改就不是你的问题，如果被人拍下来，你就要遭受网络暴力
改了，你就要承担杀了一个人的责任
你想怎么选?[脱单doge]"
1676346893,0,1,False,False,我直接在中间建几道铁轨[doge]
1676303909,0,1,False,False,[热词系列_肥肠自信]
1676365312,0,0,False,False,傻子才做选择，我全都有
