上传时间,回复数,点赞数,up是否回复,up是否点赞,评论文本
1676262555,0,2,False,False,以后谁玩希尔我笑谁[辣眼睛]
1676258805,2,2,False,False,这游戏狗子希尔的存在确实太bug了，弱一点好
1676345365,0,1,False,False,快点来吧，世界尽头这破图已经打吐了
1676262789,0,2,False,False,不过希尔比爆料的好多了[灵魂出窍][灵魂出窍]
1676327026,0,1,False,False,新希尔？谁拿我笑话谁
1676306459,0,0,False,False,希尔确实要砍一刀
1676350638,0,0,False,False,16赛季是什么尾气啊
1676250333,0,2,False,False,狗子现在的被动痕迹还在[星星眼]
1676276079,3,2,False,False,心跳改动合理。其余只能说一般般，q照旧看人轮廓呗[嗑瓜子]把时间砍了就行了，然后把大招看血甲信息以及脚步，这样就可以捏着q来打断了嘛[嗑瓜子][嗑瓜子][嗑瓜子]最好把血甲信息共享至大招内所有人，我称之为世界大战！[吃瓜][吃瓜][吃瓜]
1676262505,1,2,False,False,希尔q是不是不显示敌人血量和护甲了
1676358650,0,1,False,False,希尔传家宝属于是买来割棉花的了[还有醒着的么2.0_W]
1676356508,0,0,False,False,所以啥时候上线呢
1676350233,0,0,False,False,我玩的英雄全改
1676274840,0,1,False,False,希尔这砍的也太惨了
1676270877,4,3,False,False,希尔被动改动啥意思？什么叫只有心跳时才显示
1676263115,0,1,False,False,我只想知道服务器优化了没
1676259016,1,1,False,False,加强亡灵口牙！
1676334550,0,0,False,False,什么时候更新
1676259635,0,1,False,False,命脉空投的体积是不是还改大了
1676348617,0,0,False,False,幻象诱饵ye增强了啊
1676353030,0,0,False,False,幻像假身被打的效果有没有
1676395219,0,0,False,False,@孙兴憨Gaming 高效坐牢
1676271360,3,1,False,False,挖机的那个侦查还在吗
1676261507,2,1,False,False,地平线的削弱呢？？？
1676392545,0,0,False,False,狗重生
1676267636,3,1,False,False,希尔大招直接砍废了
1676262230,0,1,False,False,希尔直接干废了呀
1676332433,0,0,False,False,三明治！[大哭][大哭]
1676344585,0,0,False,False,希尔好削！
1676278602,0,0,False,False,侦查位？ 真不熟[脱单doge]
1676278073,0,0,False,False,bgm:发光弹
1676389622,0,0,False,False,lion，太对了
1676291427,1,0,False,False,镰刀玩了才半个月啊[大哭][大哭][大哭][大哭]
1676368166,0,0,False,False,"亡灵:那我呢?
这边感觉可以来个
Q到人一俩秒内被那人打会回血
打被沉默的人有很弱的吸血效果
被Q到的人打有减伤(这个感觉太low了
也符合人设嘛
不然大招群体加个吸血也不错喔[雫るる制服ver._吨吨吨]"
1676275323,1,0,False,False,命脉拉人速度咋样
1676280767,0,0,False,False,有尾气展示吗？
1676274611,0,0,False,False,希尔废了啊
1676344265,0,0,False,False,不让我点赞[微笑]
1676254537,1,1,False,False,命脉拉人不能加速 真够扯的
1676300437,0,0,False,False,[呲牙]
1676286320,0,0,False,False,@乌塔妈妈爱你 [辣眼睛]
1676259783,0,1,False,False,感觉命脉大招这个速度才像话
1676354506,0,0,False,False,那能不能吧10点伤害和释放速度还有击中的震爆效果还回来啊，现在这还怎么玩
1676262377,0,1,False,False,希尔直接删除比较好[无语]
1676259707,2,1,False,False,信息位，都别玩！[灵魂出窍]
1676257036,0,2,False,False,所以动力的板子真的就连回调都不调一下吗
1676256017,0,1,False,False,希尔已经成灰了
1676260156,0,1,False,False,这命脉改的才叫人道嘛
1676314291,0,0,False,False,命脉机器人亡灵
1676251947,11,0,True,False,削了这么多 为什么不给地平线来一刀
1676342568,0,0,False,False,空投砸人可行性大大提高
1676356015,0,0,False,False,不是幻象被打会高亮攻击者位置吗
1676262111,0,3,False,False,看起来好像是为了迎合新侦查信标，把技能的信息获取手段都削了一些
1676335464,0,0,False,False,这希尔大招还有用吗，遇到乱一点的局开了等于没开
1676264353,3,1,False,False,把命脉的救人盾还回来啊喂[大哭]
1676253180,0,1,False,False,我的希尔[大哭]，我刚提的传家宝啊
1676288302,0,0,False,False,地平线呢
1676342031,1,0,False,False,无所谓，我现在主玩动力小子，冲就得了[抠鼻]
1676281585,0,0,False,False,地平线呢
1676256658,0,1,False,False,刚出传家宝就削成这样。。。希尔要不删了吧
1676342500,1,0,False,False,两个强力信息位这样削，队伍整体配合要求提高了
1676264339,0,0,False,False,几号更新呀
1676264177,0,0,False,False,哪天更新
1676260426,8,1,False,False,退坑几个赛季了，但是一直会关注版本更新。我玩那会希尔刚出完很猛，大削之后就没人玩了，我还以为后面会对希尔回调呢，没想到又被砍了几刀[喜极而泣]这是为什么啊
1676267277,0,0,False,False,明天更新吗？
1676261940,0,1,False,False,曲速命脉仓（喜
1676252744,4,1,False,False,我记得命脉的q救人减速惩罚降低了
1676264421,0,1,False,False,密客史诗级加强密客专注人狂喜[doge]
1676252043,2,1,False,False,哈哈。哥们幻象king终于有说法了！
1676351474,0,0,False,False,希尔废的不能再废了
1676280949,1,0,False,False,命脉顺丰速运？
1676259695,0,1,False,False,希尔大招现在是比不上上狗子的q了
1676262774,0,0,False,False,[脱单doge]
1676321095,0,0,False,False,刚买的希尔传家宝就一刀砍废，真有你的
1676251372,0,1,False,False,喜欢玩的全削了，艹
1676258397,0,1,False,False,命脉好像还有个救人的减速降低了
1676257995,0,1,False,False,幻象这个好啊隐身三秒拉起队友来还能跑你后面打你个背身枪线
1676351096,0,0,False,False,卖完传家宝了就是硬气啊
1676291916,2,0,False,False,地平线没削是吧？
1676272031,0,0,False,False,密客笑嘻了
1676261173,0,0,False,False,@丶涤
1676264334,0,0,False,False,[大哭]感受我的痛苦
1676351447,2,0,False,False,所以这寻血猎犬相当于重做了？那我还是换命脉传家宝吧
1676256585,2,1,False,False,把希尔那个b打断删了回调点强度还能接受
1676357792,0,0,False,False,这他妈机器人大，比瓦鸡上升距离都长了[呆]
1676258423,0,1,False,False,这是要强推密客？
1676270669,2,0,False,False,幻象拉人起来之后掏技能会显形吗
1676253480,0,0,False,False,什么时候更新吖？
1676319888,0,0,False,False,我想问最近匹配图是不是只有两张图的，玩吐了
1676270850,3,0,False,False,狗子和希尔大削
1676291554,0,0,False,False,nmd老子刚买的希尔传家宝[生气][生气][生气]
1676259215,1,0,False,False,地平线呢
1676276921,1,0,False,False,如果哪天把蹬墙跳也改了那差不多游戏直接起飞
1676262475,1,0,False,False,所以啥时候上线呢
1676290371,3,0,False,False,盲猜下个赛季削密客
1676276816,1,1,False,False,希尔这削的太离谱了吧
1676265577,0,2,False,False,seer直接变废物
1676256119,0,0,False,False,尬住了
1676282543,0,0,False,False,这解说有意思，关注了[脱单doge]
1676264166,0,1,False,False,这鸟怎么自带臭屁吖[喜极而泣]
1676256863,1,0,False,False,地平线呢地平线呢
1676255875,0,0,False,False,希尔这q这啥呀
1676292658,1,0,False,False,希尔的被动是改怎么样了
1676259854,0,0,False,False,希尔砍的好啊
1676254335,1,0,False,False,2赛季尾气还会回收吗[笑哭]
1676255850,0,0,False,False,希尔还能显示血量吗
1676264119,0,0,False,False,命脉这个是召唤一个打不穿的掩体也
1676251148,0,0,False,False,催化剂啊
1676261133,1,0,False,False,幻象这个，不掏枪能打血不？
1676279575,0,0,False,False,希尔这边建议删掉
1676252200,3,0,False,False,机器人被动改成啥了啊
1676262684,0,0,False,False,打中幻象分身获取位置没有了吗
1676258814,0,0,False,False,可惜没有新的传奇
1676260741,5,0,False,False,幻象那个我没看懂，之前不也是隐身嘛
1676260084,0,2,False,False,希尔大招有点削过头了
1676257544,0,0,False,False,命脉防守位[doge]
1676252355,0,0,False,False,侦查位削弱好多，
1676259518,0,0,False,False,笑死，真就是出了传家宝就削什么
1676256939,9,0,False,False,希尔q中不显示护甲和血条了吗？
1676256587,0,0,False,False,希尔这大招削的是否有点
1676255891,0,0,False,False,这下不得不练密客了
1676251092,2,0,False,False,命脉拉人的前摇有没有改
1676241435,1,0,False,False,好家伙，找乌鸦（第一个）
1676254156,2,0,False,False,机器人的纤绳这么长吗[doge]
1676264545,0,0,False,False,奶妈这么快的大招...试试当场堵门
1676293689,0,0,False,False,天天炸炸炸，人气不减
1676246951,0,0,False,False,咻的一下，出来了[doge]
1676248460,0,0,False,False,狗子的白乌鸦好像没有之前那么僵硬了
1676257726,6,0,False,False,狗子的q改回第一赛季只有一个投影还是还能实时限时敌人动作
1676250922,0,0,False,False,嗨嗨嗨除了恶灵希尔   传家宝我都有[doge][doge]
1676252389,1,0,False,False,从百草园拉线到三味书屋[doge]
1676365801,0,0,False,False,幻像少介绍了一个效果吧，不是还有攻击分身后敌人显示时间延长吗
1676348069,0,0,False,False,死斗呢什么时候上
1676355416,0,0,False,False,爆料的机器人在滑索上的移动速度增加没有实装吗？
1676284607,0,0,False,False,g7人和恶灵就离谱
1676256788,6,1,False,False,fps有透你还嫌弱，希尔本身就是t0，之前让你爽够了，早该重砍。
1676264188,0,0,False,False,我刚换希尔传家宝啊😭
1676254334,0,0,False,False,1
1676271329,0,0,False,False,我的评价是改得一坨，你让新人怎么想？
