上传时间,回复数,点赞数,up是否回复,up是否点赞,评论文本
1676358250,198,3498,False,False,有人嫌弃仪表盘，有人嫌弃中控屏，有人嫌弃前脸......不懂就问，十万块钱以内有哪些车比这个好的呀 [妙啊]
1676366349,24,2654,False,False,汉：走的时候把那车机给我砸了，什么档次和我用的一样。[doge]
1676351955,87,1249,False,False,这车价格出来之后基本宣告合资A级车的死刑了[笑]
1676354969,75,1336,False,False,我真的搞不懂，老款秦喷人家仪表盘小，现在人家改款做大了，还有人吐槽。这个价位，这个配置，感觉比大多同价位车好多了吧。[疑惑][疑惑]
1676352904,24,813,False,False,马路三大妈，德原朗宝来甚至速腾，脖子上的套索又收紧了一些[妙啊]建议等等买，今年车企竞争更加白热化，还要打价格战。如果说去年是凡尔登绞肉机，新能源的攻城略地才是初露锋芒，那么今年就是索姆河地狱，年底估计有品牌暴死祭天[微笑]
1676361450,58,657,False,False,嫌弃的都买不起还要求这要求那的，买得起的已经在店里看了
1676448083,5,150,False,False,感觉老款秦买早的，可以找特斯拉车主谈谈心，如果还抑郁不得欢的，可以找22年初买车的特斯拉车主谈心，没准特斯拉车主会告诉你他是怎么看开降价幅度等于再买一辆998的秦23年款的。
1676404187,17,229,False,False,"去年过年开同事的卡罗拉从重庆回湖北，这车是真的没动力，高速有点坡度那速度掉的……到家后右耳耳鸣了两三天，开了这么多年车第一次出现这种情况，完全是隧道多隔音太差了。
我真不知道在没有了价格优势后谁还会买卡罗拉？"
1676357975,23,390,False,False,仪表盘和中控屏确实是省成本这没得洗，但是这省的成本又不是比亚迪吃了，价格都摆在这了。十万块钱就能买个车，还是混动的，还要啥自行车啊。
1676356712,9,297,False,False,秦998:那年我双手插兜，不知道什么叫做对手。[歪嘴]
1676433631,22,130,False,False,我觉得我的汉比这个贵10万，没多太多东西，心态出了点问题
1676359779,29,370,False,False,有些人巴不得十万左右的车啥都有[doge]
1676372951,2,163,False,False,9万8给你dmi，这不是买内饰也不是买质感，这是买发动机送你辆车
1676362419,11,185,False,False,之前还在犹豫是加价的秦，还是减价半税的合资，这下好了，比亚迪直接抢答
1676392502,8,132,False,False,提一嘴，我姨买的飞度没蓝牙，不知道嫌弃秦内饰的是开的啥车，雷克萨斯啊。
1676441141,4,81,False,False,十万内的混动，这谁顶得住啊，我都心动了
1676431842,26,63,False,False,其实就我个人而言，我更喜欢实体按键，有中控屏娱乐，而更多按键是实体，比如，空调，座椅，危险灯，音量键，因为我个人十分讨厌在中控屏开车的时候翻了翻去找按键，时间长不说还更费注意力，危险程度提高，同时屏幕触摸一留指纹，强迫症患者每天都要把车机屏幕擦干净，好麻烦
1676360656,19,97,False,False,家里有辆车了，不过丐版10万太香了躁动的心想整一辆，不过听说明年好像有大改款，还是先攒攒吧[捂眼]
1676465706,7,14,False,False,比亚迪秦dmi车主告诉你们，这车电池才开55公里，就要 998，别买。还不如老头乐呢[歪嘴]
1676390323,7,13,False,False,汉dmi车主瑟瑟发抖，求别背刺我[囧]
1676362408,4,49,False,False,十万，要外观好，内饰好，音响好，动力好，省油，安全好[滑稽]什么有一样不行？那我为什么不买XXX
1676356935,1,58,False,False,真的很香了，混动车加上比亚迪DMI的技术只卖这个价，薄纱合资a级车[OK]
1676397707,0,14,False,False,这个价位这配置，突出一个秦王扫六合[吃瓜]
1676382616,13,30,False,False,已经订了顶配，周五提车[脱单doge]
1676352723,1,43,False,False,终于舍得把那个电瓶车仪表盘放大下了[吃瓜]
1676357013,24,222,False,False,三大妈我只坐过卡罗拉，那内饰连我18年9万块裸车的国产都不如，除了全系标配L2驾驶辅助外毫无亮点。十多万的车，没有天窗，内饰全是布，塑料，没一块地方是皮，就档把那块给你个钢琴烤漆的塑料板，好像中控是搪塑还是塑料，记不清了。连窗户升降按钮都是一块黑塑料，连个灯都没，其它配置就更别想。秦下降到这个价位就是明摆着踢馆。再牛逼的内燃机省油省不过混动，比配置又被爆杀，比做工也比卡罗拉好。唯一的问题只是某些人认为比亚迪的品牌力没丰田强罢了，“丧钟”要敲响了[tv_调侃]
1676460720,0,2,False,False,我的715旗舰版汉比秦贵了快19万，看着一样的电机和中控，秦的后座靠椅甚至还能放下来，流下了心酸的泪水
1676352504,9,21,False,False,哎，一直想买吉利，但是吉利的车系和设计语言真的乱，要是能像比亚迪这样统一就好了（不讨论性能和价格，只说车系和设计语言）
1676365580,1,19,False,False,up摸来摸去的，和色狼一样
1676400017,0,10,False,False,这内饰还不行？合资10万级里有比这内饰好的吗？尤其点名日系，做到跟老头乐似的。
1676358301,10,16,False,False,1358，1458两个版本，裸车价格不低了，应该可以有四轮独悬，进一步提高15万级别的竞争力，毕竟是大厂，这个利润空间应该撑得起，其他各方面都很不错了，精益求精，个人见解，不喜勿喷。
1676352357,14,83,False,False,三大妈确实没活路了，多卖点，我去买星瑞砍价底气也能足一点[滑稽][妙啊]
1676460526,2,12,False,False,汉创世车主表示，这踏马不就是我的汉？
1676440983,1,5,False,False,"马路三大妈，德原朗宝来甚至速腾，脖子上的套索又收紧了一些[妙啊]建议等等买，今年车企竞争更加白热化，还要打价格战。如果说去年是凡尔登绞肉机，新能源的攻城略地才是初露锋芒，那么今年就是索姆河地狱，年底估计有品牌暴死祭天[微笑][傲娇][傲娇]
去年是群雄割据   今天是官渡之战了  本初兄[脱单doge][吃瓜][吃瓜]"
1676363259,1,6,False,False,年亲人第一台绿牌新能源高性能运动家用网约车[doge]
1676423253,22,7,False,False,啥都好，价格也实惠，想买，唯一让我有点膈应的就是挺多网约车是秦[笑哭]
1676386310,3,8,False,False,十万块现在能干点啥？去付个首付都嫌少，买个车确实不错
1676438085,0,7,False,False,18岁学车大学生实名爱住了
1676439280,2,4,False,False,有一说一，这车9w，真的会有人在去买4-5w的小电车吗？[吃瓜]
1676367583,1,11,False,False,比亚迪唐dmp出来看看[生气]自家小弟内饰都和你差不多的质感
1676387248,4,5,False,False,你妈妈的，上海现在不是纯电不送绿牌，不然就整个这个了[辣眼睛]
1676355767,5,37,False,False,吐槽仪表盘的，更多的槽点，是他为啥不做成嵌入式的，是认为车主眼神不好吗[doge]
1676459355,2,3,False,False,车是好车，价格也是香，但是我确实嫌弃仪表盘，总感觉这仪表盘不是在开车，而是在看导航，看一个平板，我宁愿不要电动座椅，或者其他的减配，也必须要仪表盘好看[脸红]  希望以后款能改进
1676436562,2,8,False,False,为什么特粉们天天刷到byd的视频，迪粉怎么刷不到特某的视频？[偷笑]
1676362246,0,15,False,False,这998可太香了[打call]
1676414429,0,10,False,False,这都是没见过车吗？10万还嫌这嫌那，挑媳妇都没见你们这么挑剔
1676472411,0,1,False,False,"我来回复你啊，我都不说语音了。
座椅。我不知道你说的什么实体是什么意思，如果你不喜欢电动的，你可以选择低配的手动。
危险灯肯定是有实体按键的。
空调也是有实体按键的。
音量在仪表盘上也是可以直接实体按键调节的。
你说的问题在这款车上根本没有唯一一点你不喜欢大屏幕。"
1676446675,0,3,False,False,这十几万的秦要啥有啥，本汉ev创世版车主感觉被背刺了。[辣眼睛]
1676463259,0,2,False,False,"马路三大妈，德原朗宝来甚至速腾，脖子上的套索又收紧了一些[妙啊]建议等等买，今年车企竞争更加白热化，还要打价格战。如果说去年是凡尔登绞肉机，新能源的攻城略地才是初露锋芒，那么今年就是索姆河地狱，年底估计有品牌暴死祭天[微笑][傲娇][傲娇]
曹老板讲话：去年是群雄割据   今天是官渡之战了  本初兄[脱单doge][吃瓜][吃瓜][滑稽][滑稽]"
1676411902,4,3,False,False,我TM就是芜湖的，明天去提宋plus17.58那款不知道今年改不改款[笑哭]
1676421262,0,2,False,False,踏马的，买早了，一开始看的秦普拉斯弟诶母爱，预算超了两万，只能换另个品牌，现在看这车是真的香啊。
1676450050,0,2,False,False,你常驻芜湖了?什么时候出来吃夜宵啊[doge]
1676448027,0,3,False,False,你这么搞，难道让我承认比亚迪优秀吗？哼，我才不会买碰比亚迪呢，轩逸就是我爹[生气][生气][生气][生气]
1676453113,0,2,False,False,全网都还没看到拍998的，就想看下最低配有些什么
1676457540,0,2,False,False,秦王扫六合啊，秦是这个意思啊
1676368936,2,12,False,False,说实话我觉得秦不好，续航就120km都要这么贵，搞不懂你们为什么这么多人喜欢，比亚迪不比秦强多了？？[doge]
1676470460,0,1,False,False,我邻居家有一辆宋，我看不懂，以为人家姓宋，还想着怎么一个村子出来的咋还改姓了[doge]
1676463077,1,2,False,False,两个月前刚提的宋plus结果现在好像也要出冠军版宋了[大哭][大哭][大哭]
1676467074,0,1,False,False,"马路三大妈，德原朗宝来甚至速腾，脖子上的套索又收紧了一些[妙啊]建议等等买，今年车企竞争更加白热化，还要打价格战。如果说去年是凡尔登绞肉机，新能源的攻城略地才是初露锋芒，那么今年就是索姆河地狱，年底估计有品牌暴死祭天[微笑][傲娇][傲娇]
曹老板讲话：去年是群雄割据   今天是官渡之战了  本初兄[脱单doge][吃瓜][吃瓜][滑稽][滑稽]"
1676402217,9,3,False,False,比亚迪秦油电混合到底怎么样，我姓秦，打算买一辆代步用，在考虑朗逸和秦
1676422442,0,3,False,False,9.9买到不到吃亏
1676465965,0,1,False,False,与其提升自己，不如贬低他人哈哈哈哈，弹幕给我整笑了
1676352391,4,6,False,False,咱就是说这个仪表屏能搞大一点不？太小了感觉
1676355819,11,8,False,False,希望比亚迪能把合资价格打下来[妙啊]
1676447423,2,2,False,False,"懂车帝13.58w（起！！）
你让我拿什么理智"
1676354371,0,8,False,False,爆杀合资车
1676372046,0,4,False,False,电车救活了网约车，网约车把路变成了自家的赛道[笑哭][笑哭]
1676359023,6,11,False,False,要是出个模拟物理指针的仪表台就好了[星星眼]
1676479855,0,1,False,False,这车发布后，我甚至想不到同价位的对手是谁[笑哭]
1676470774,0,1,False,False,没有电动后门……什么不到10万，那没事我可以自己开后门[辣眼睛]
1676351821,2,3,False,False,这价位，无敌了吗
1676365880,0,4,False,False,这个价位为什么不买比亚迪[doge]
1676357912,0,7,False,False,省流:up主写的字好丑呀！
1676351805,0,4,False,False,前排 但是还没想好怎么说骚话
1676352105,2,4,False,False,新款的坐垫不是都是暖阳棕浅色的么？为什么视频里是深色的啊？其实我想要深色的。订的时候没有其他选项。求解惑
1676477706,0,1,False,False,这tm是十万的车？[星星眼]毕业后的第一个小目标有了
1676461938,0,1,False,False,比亚迪：告诉老秦，我想吃卡罗拉、雷凌、轩逸、朗逸……
1676449391,0,1,False,False,羡慕送大牌免购置税，可惜油车没有这么好的待遇[藏狐]
1676477336,0,1,False,False,还好去年因为仪表盘没买老款的，新款背刺严重[大笑]
1676472446,0,0,False,False,希望比亚迪做的更好狠狠抢占合资份额来说几句：按键用中文没毛病，字体选个好看点的，不管是按键还是显示屏都是。仪表ui 优化下，实在不行直接照搬御三家或者领克的方案，这不难吧，现在这套和电驴没区别，真不像轿车的水平，很多摩托的仪表都比这好看太多了。以上两个地方基本上无需成本就可以大大提高车辆逼格，就看相关负责人的审美了
1676462520,0,1,False,False,等24年再买。现在上面已经出手停止别的阿猫阿狗入场了。今年肯定是市场战争白热化。[吃瓜]
1676352683,6,11,False,False,淦，去年11月提的120尊贵版，这就被后浪拍过去了[大哭]
1676475598,1,1,False,False,我14万多买的车，在人眼里就新车八九万，我比吃了大便还难受
1676470903,0,1,False,False,真……真十万内？[大哭]感觉自己又行了，明天去看看
1676472137,0,1,False,False,这个价位还都是扭力梁，什么时候能都下放啊
1676374117,3,2,False,False,跟飞度无法比[微笑]
1676465145,0,1,False,False,不急，我再等等[古剑奇谭三·无所朝夕_弱小]
1676375764,0,1,False,False,很难想象十万块已经能买到这种配置的车了
1676354807,17,4,False,False,超越型55km和120km怎么选？哥们盆友[打call][打call]
1676352456,10,4,False,False,前几天打车打到一辆秦plus，内饰质感在同级是真不错，就是对我来说太矮了[笑哭]坐副驾顶头
1676352462,0,2,False,False,今年所有车企都会很难过[笑哭]，6-30区间真的薄纱。我又听说海鸥6万左右起订
1676439923,0,1,False,False,第一辆车就决定是你了
1676453613,0,1,False,False,就它了，今年攒钱买
1676474755,1,0,False,False,这车性价比很高。在4s店试驾过次顶配的，行驶质感还是很不错的，底盘有点德系的味道，软但又不失支撑性，就是路感有点清晰。轮胎不太行，换上马牌，米其林的一些抓地力强的会好很多，混动是真的跟脚，行驶的时候太早较大，地板油的时候发动机在嘶吼，自吸动力还是差了点。不过整体操控性，极限什么的被univ吊打，长安算是做了个有趣的车出来。
1676447775,0,1,False,False,就是当年看了宋dmi的视频，所以买了[喜极而泣]
1676367865,2,4,False,False,21款车主在此: 比亚迪，我***[脸红]
1676475404,1,0,False,False,买个998，平日下午下班后，周六周日去跑滴滴能不能cover掉每个月的按揭[微笑]
1676471494,0,1,False,False,这个落地大概多少？
1676456676,0,1,False,False,等等15万的model d
1676459678,1,1,False,False,我尼玛能拿我这大众换吗，十几万的车一键启动，电动座椅等等要什么没什么，放大招先宣传啊，一声不吭丢王炸算什么回事[大哭]
1676364028,1,2,False,False,嘛这低配要是有库存直接无双，先把三日打一顿[加油]
1676469663,0,1,False,False,除了顶配都没有L2，看完配置心无波澜
1676447026,1,1,False,False,这买个9.98低配跑网约车这不得赚死 我现在下班没事跑跑花小猪用的帕萨特跟虎8 开俩小时能跑170左右 就是跑着玩散散心 这踏马换个秦dmi不得赚死我[笑哭]
1676471950,0,0,False,False,合资a级车除非把价格压到9万以下，不然拿头打啊？趁byd订单太多来不及供货的空档捞几笔订单最多了[呲牙]
1676463438,0,1,False,False,日系油混卡罗拉雷凌，没绿牌，不免购置税，不能充电，零百加速13秒比秦慢6秒，其他内饰车机配置也更低
1676462709,0,1,False,False,比亚迪，***，**！
1676438382,0,1,False,False,昨天有个汽车up主骂byd不应该降价来着
1676456513,1,1,False,False,懒得充电，可以当油车开吗
1676466627,2,1,False,False,998 入门版 真有需求还是12，13w的那几款
1676477292,0,0,False,False,答应我，不爱机械仪表盘的请划走😡😡😡
1676434605,0,1,False,False,精日:要这么多配置有毛用，容易坏，什么都没有最其实耐用！一车传三代
1676356815,0,3,False,False,秦王扫六国了[tv_鬼脸]
1676351888,0,2,False,False,想上个热评[doge]
1676464254,0,0,False,False,十万左右的车，这就是天花板，谁赞成谁反对
1676461083,0,1,False,False,[辣眼睛]21版心碎的厉害
1676351974,7,2,False,False,一直看不到蓝色的外观，比较好奇蓝色是什么效果
1676352142,0,2,False,False,秦定天下[星星眼]
1676441498,0,1,False,False,这个内饰是要加钱的
1676437727,0,1,False,False,帅汪 998的也测一遍呀[兔年]
1676375442,2,2,False,False,"丰田本田大众通用标志：你想做出头鸟是吧[抠鼻]
比亚迪秦：不要误会，我只想卷死各位，或者被各位卷死[妙啊][doge]"
1676378503,0,1,False,False,全民网约车[doge]。滴滴顺风车：[喜欢][喜欢][喜欢]
1676439310,0,1,False,False,这款是14万的  谢谢[脸红]
1676404540,0,1,False,False,低则板车悬架 高而筷子悬挂
1676460577,0,1,False,False,怨种同事刚买的轩逸 10多万上路
1676447480,0,1,False,False,汪总，不同配置车型内的仪表盘和中控屏尺寸都是一样的吗？
1676376309,0,1,False,False,老秦有这样子我也也不至于去买驱逐舰，还是喜欢秦的外观[喜极而泣]
1676451725,0,1,False,False,汉dm2020款车主，我已经麻木了。
1676468722,0,0,False,False,怎么办，现在我唯一能喷的只有车钥匙丑了[大哭]
1676446943,0,1,False,False,总体的感觉对我来说就是不如比亚迪[doge]
1676429596,0,1,False,False,这个是顶配版本啊……
1676383763,2,1,False,False,我想订9.98的，又没人解毒[脱单doge]
1676469751,1,1,False,False,最顶配要多少钱？
1676405414,0,1,False,False,有水不干净了[吃瓜]
1676460535,1,0,False,False,作为消费者还是希望越便宜越好的[doge]毕竟省的钱是我兜里的 有的评论好像已经成为了比亚迪精神股东 巴不得它卖贵 搞不清脑回路
1676444934,0,0,False,False,"为啥比亚迪能卷飞其他A级车。
无他，唯便宜尔。
这个便宜，不仅仅是价格便宜。
还有后续的使用成本。
论加速，论安静，论省钱，电能才是爹。
而续航，油才是爹。
两个爹在一起，应该叫啥？
没错，叫爸爸。"
1676467231,0,0,False,False,我猜过不了多久就会出现一辆“自燃”或者“A柱弯曲”[doge][doge][doge]
1676468625,0,0,False,False,可以说是历史性的一刻，等于是见证历史了
1676468799,0,0,False,False,现在比亚迪秦车主终于能体会特斯拉车主的心情了[doge]
1676456447,1,0,False,False,驱逐舰05车主表示受到了一万点爆击[大哭][大哭][大哭]
1676391580,0,1,False,False,这。。。秦王扫六合
1676473564,2,0,False,False,这个价位10万真的是要逆天啦   合资车的末日
1676459827,0,1,False,False,看着太可以了，我爸的飞度也差不多这个价，买回来收音机都没有，内饰除了座椅全是大塑料，上个高速能吵死，大部分时间都在市区跑看他显示的油耗7.0，动力在高速超个车踩到底都没力
1676468441,1,0,False,False,该说不说，这车钥匙有点廉价，像个电动自行车雅迪的钥匙[笑哭]
1676469036,1,1,False,False,十万是个毛都没有的配置  别说便宜了[辣眼睛] 价格并没有优势 只是有个丐版顶配也是14 5万
1676471426,0,0,False,False,这内饰真的是10w价格内的？？[笑哭]我在马路上看到秦还以为要卖15w以上的价格，还混动这么香的嘛!赶紧把家里老爸的另一哈弗车给置换了
1676403073,0,0,False,False,比亚迪真该死啊我去年等了四个月提的海豚啊！！！！！！[大哭]
1676466986,0,0,False,False,属于比亚迪的时代已经到来了！给我狠狠地卷！
1676432544,0,1,False,False,笑死我了，一群人一开始说买比亚迪原先说内饰不好，现在内饰好了又说要这些内饰有什么用。
1676471568,0,0,False,False,这座椅就看着很舒服，而且背靠造型上还设计有腰托[鼓掌][鼓掌][鼓掌]
1676472599,0,0,False,False,这配置这价格不错了，好歹是高级家用网约车了。10万价位这车已经无敌了，想买车的可以继续观望各大车企砍价。
1676351875,0,2,False,False,啥时候有乞丐版的视频阿，准备拿下[doge]
1676471757,0,0,False,False,妈的10万不到，真她妈便宜
1676396275,0,0,False,False,喜欢这个视频风格 没说话 但是该展示的都给你展示了 超详细 比那些噼里啪啦说一大堆看着舒服多了[星星眼]
1676435852,0,0,False,False,车不错，就是车标不行，车标换成日系就完美了[doge]
1676474058,0,0,False,False,TMD好恨啊，现在买车的人我愿称之为弄潮儿。
1676470613,1,0,False,False,我的驱逐舰05其实和秦差不多，区别在前脸和后座大一点。价钱却高一大截，55落地要14万[笑哭][笑哭][笑哭]
1676472437,0,0,False,False,使劲卷，争取把那些合资的价格卷下来[OK]
1676399625,0,0,False,False,开了多年日，德，美系车我不是吹。但这个价位德秦。除了空间稍微欠缺一点。真的全方面杀疯了。香到不得了！
1676410135,0,0,False,False,本来在考虑秦和驱逐舰，现在看到新秦，那估计选秦了。不过听说明年还有一次大背刺，再等等，刚好存点钱
1676436552,0,0,False,False,之前还犹豫朗逸 Uni-v的 [滑稽]  其实最开始就看的秦  现在可以了 便宜这么多不说 360也加上了  直接上还不用去4s店拉扯价格
1676444149,3,0,False,False,确实心动了，能告诉我续航和0-100吗[微笑]
1676470834,0,0,False,False,艹之前的旗舰版买早了[笑][笑]生气
1676469269,1,0,False,False,说真的不懂车，这车看着真不错，弹幕说十三万，有想买的欲望[小电视_赞]
1676477070,0,0,False,False,秦王扫六合，虎视何雄哉！
1676454652,0,0,False,False,我去，怪不得说byd是圣经，我都想买了
1676477277,0,0,False,False,我的评价是，不如布加迪[妙啊][doge]
1676477989,0,0,False,False,打算考上研就分期提一台[妙啊]
1676365228,1,1,False,False,真的是暴打轩逸卡罗拉朗逸[脱单doge]
1676470538,0,0,False,False,再等等，忍一忍。[doge]配置更好，续航更高。
1676472116,0,0,False,False,卖便宜了，有些人认为这车滴滴多，拉低自己身份了，
1676471847,1,0,False,False,今年升配置，明年改底盘，后年上四驱，大后年上易四方[doge]
1676473106,0,0,False,False,22年提的老款，现在不忍心看23款的视频，背刺好痛[笑哭][笑哭][笑哭][笑哭]
1676452732,0,0,False,False,十万块还要啥自行车啊 这不就是符合大众需求吗
1676470937,0,0,False,False,汉：背刺我是吧
1676472242,0,0,False,False,120km的可不止10万
1676431061,0,1,False,False,完了，本来日系都快不行了，现在弄了个这，直接又是给日系一铁拳，
1676374809,3,1,False,False,这车混动加速7.3，光油能多少？？？
1676376708,0,1,False,False,后雾灯啥样啊？
1676473695,0,0,False,False,配置太高影响我回家的时间[doge]
1676467168,0,0,False,False,今天在路上见了一辆，外观看着还行，尾灯很好看，就是车开的不怎么样[暹罗猫小豆泥_单纯]
1676475891,0,0,False,False,这款视频车是13.58的，落地也14个多了，唯一比较遗憾的就是后悬架是扭力梁的，也没有L2驾驶辅助，其他都挺不错的。
1676384931,0,0,False,False,测评完要不要回血up主，兄弟们帮你
1676477272,3,0,False,False,我上班80公里，到单位充电，回家充电，完全不用油，真的感觉很实用
1676448202,0,0,False,False,人民币10万左右的车，能达到这样水平，牛逼！
1676395454,0,0,False,False,说真的心动了，我那朗逸在这面前感觉啥也不是，多赚钱，争取早点换车
1676373871,4,2,False,False,讲真你们觉得新能源汽车成熟吗，特别是电车
1676366759,0,0,False,False,多点竞争，对消费者来说是好事（对厂商粉丝和信仰粉来说可能不是），这次洗牌，往后会让消费者用更低的价格买到不错和心仪的配置[吃瓜]也会让一些在这价位段吃老本行的车企很难受，最后说一句不管哪个领域一旦垄断吃亏的是消费者
1676420045,0,0,False,False,驱逐舰应该改成1.5t的awd版，不然估计以后是卖不出去了
1676425968,0,0,False,False,两年之后我应该也要买车了，我希望看见比这更狠的[妙啊]
1676465093,0,0,False,False,狠狠的心动了 真的 才十万呀最低配
1676466249,0,0,False,False,秦扫六合，哪六合呢[doge]
1676384370,0,0,False,False,如果比亚迪让最低配走量，那合资车基本没有活路了，只有降价打折才行了[吃瓜]
1676465465,0,0,False,False,唯一的问题就是容易被背刺—宋Proev车主说到
1676472440,1,0,False,False,有没有car play（刚需）[脸红]
1676384607,0,0,False,False,秦王扫六合，先砍了两田的狗头给大家助助兴
1676387424,0,0,False,False,只要998就能让你爽到不能呼吸[doge]
1676387548,0,0,False,False,又一个前提是新能源本来就比油车贵，但是秦才卖10w[doge]
1676392007,0,1,False,False,不是这最多十四五万的车，弹幕咋就那么多要求呢？你这挑刺的毛病几十万的bba也堵不住你的嘴好吧
1676389682,0,0,False,False,除了仪表盘丑一点，其他都满足我的审美
1676378464,0,0,False,False,堵住轩逸的话，日产就危险了
1676388902,0,0,False,False,比亚迪的内饰是真的丑，建议学习学习吉利的。
1676455845,0,0,False,False,tm秦都有快充口，我宋没有[辣眼睛]
