上传时间,回复数,点赞数,up是否回复,up是否点赞,评论文本
1676318980,113,2024,False,False,"我觉得还是跟大家说一下，星铁和米家以前的游戏都不太一样，简单来说就是星铁的角色更立体，他们是独立于主角存在的，这就意味着他们也会有自己的亲人，爱人，仇人，主角不会是他们围绕的全部，比如就目前知道的，刃有一个疑似已经死去的挚爱，如痴如狂，这样一个角色很难想象他会和主角有什么亲密关系吧？再比如老杨，他是从崩坏3穿越过去的原装角色，人家在原世界都老婆孩子热炕头了，对吧？

另外星铁和原神有一个非常不一样的地方，那就是他是没有好感度语音的！我觉得这可能进一步说明主角对于角色们的意义，那就是你可能会成为他们亲密的战友，可能会是爱护的后辈，甚至可能会是官方点明的爱人，但这不是绝对的，角色很有可能有自己爱的人，甚至可能有官方cp，这是我目前看到的倾向，希望大家可以思考一下

就我个人来说，游戏角色不围着主角过活是一件很棒的事情，有些角色可能会和我们非常亲密，但每个角色都以主角为中心而没有其他的生活，就会让我感到虚假，我可以接受角色们有其他的爱恨情仇，甚至有官方的cp，但我知道很多人是不接受的，所以我想提前跟大家说一下，这个游戏的宣发从来没有说过自己是男性向游戏、女性向游戏、乙女游戏、恋爱游戏，他是一个大众向的存在，并且更像一个番剧，各位也许需要把自己的心里预期放到应该有的位置，以免未来如果有情况发生而歇斯底里，反倒破坏了乙游玩家在更大群体中的形象[笑哭]毕竟说到底我们确实算是小圈子，更大众化的游戏不符合我们的标准也是很正常的

不过最后我还是要说，有cp我tm更带劲了，龙虾博士对不起了，你的男人我收下了！

祝大家玩的都开心~"
1676287589,5,1377,True,False,啊！！！！！！（意义明确的对成男垂涎的鸡叫）
1676296563,22,848,True,False,我喜欢瓦尔特，老男人才香，可惜他有老婆，不过我可以加入他们[星星眼]
1676285190,8,459,True,False,不愧是嗲子姐，很细很细，但其实景元应该属于老大爷的那种年龄了，仙舟人族寿命无量，不会变老，哪怕是长寿的狐族，在仙舟里也算寿命最短的种族，而且好像景元他快退休了(符玄等他退休等到花都谢了)[笑哭]
1676288399,3,242,False,False,提瓦特成男？有啊，要么去镀金旅团找，要么去铁匠铺找
1676369919,7,86,False,False,打个预防针这游戏ml卖的少，cp比较多别到时候感觉又被那啥就不礼貌了
1676342393,9,176,False,False,虽然但是，丹恒是青年，铁道有四种体型，幼年，少年，青年，成年。比原神多
1676283803,1,258,True,False,坏了，嗲子姐不喜欢小男孩了
1676374288,3,62,False,False,米家男角色太少了[笑哭][疑惑]成男做得确实很少，就是男性角色真的很少啊
1676341185,22,128,False,False,原神的成男也很优秀啊，钟离迪卢克凯亚一斗海哥绫人托马，只是游戏跟未定的乙女定位不同而已，米哈游做成男一直都没问题。
1676284965,3,210,True,False,啊！！！！！（意义不明的鸡叫）
1676283981,13,181,True,False,[藏狐]小男孩才是永远的宝！
1676454092,1,5,False,False,有cp完全没问题，前提是一开始就说出来，不要主线无事发生，彩蛋什么的突然爆一个出来[辣眼睛]
1676297248,1,40,False,False,"官网上没有说景元是‘少年’将军啊。[笑哭]
外表懒散，心思缜密的仙舟【罗浮】云骑将军。
这是官网介绍原话。
个人觉得，有没有‘少年’，还是差别蛮大。
UP主介绍的时候还是谨慎些比较好哦。"
1676349277,16,83,False,False,我感觉米哈游的男角色还是有点千篇一律的阴柔，要是再有一点沧桑感和狂野感就更好了
1676283618,1,103,True,False,几首歌词下来阿姐韵脚功力大涨啊
1676284442,1,35,True,False,对自己下手，你怕是不知道我隔壁看了多少荧妹的瑟瑟[崩坏3·终焉归始_咕蛹者][崩坏3·终焉归始_宕机]
1676375008,28,12,False,False,据说好几个成男都有官配cp是真的吗[笑哭] 还有死爱人的
1676350458,44,33,False,False,但，听说男角色就这么多了。剩下十几位全是女角色。
1676293033,11,21,True,False,up想问一下，我没玩过崩坏三，可以入坑星穹铁道吗?剧情能看懂吗?
1676293706,1,25,False,False,主教，答应我，这次好好活可以吗[笑哭]
1676389445,0,10,False,False,目前出来的成男人设都很不错，但也要小心米家的成男陷阱，就怕游戏稳定以后设计下滑，现在米家其他老游戏就有点这个意思，反正当个月卡rp抽卡的话崩铁不亏！[Cat2_CatAMail]
1676290692,5,18,False,False,老杨呜呜呜呜，帅气强大又温柔的靠谱长辈，踢拐杖扶眼镜的动作中透露着一种已经知晓一切的漫不经心，只要有老杨在身边就有满满的安全感他空闲时间还会给列车组放动画，也会细心地科普知识，但是这样的他却又被姬子阿姐评价为“内心其实还是一个热血少年”，积极投入在开拓和冒险上，老杨实在是太帅啦啊啊啊啊啊啊啊啊！！！！[喜欢][喜欢][喜欢]
1676298507,1,18,False,False,为啥要玩星穹，那是可以把玩崩三男人的唯一机会，奥拓，杨，噢这么多成男。
1676361252,8,16,False,False,我有个问题，我是男的，可是喜欢刃怎么办？，在线等急目前所有角色最想满星魂的就是刃
1676375404,2,5,False,False,玩这个就为了瓦尔特，主教和刃崩三玩家的心愿虽说刃是因为确实太帅
1676394265,1,2,False,False,少年 青年 成男是不同的。成男不是18岁后的成年男性而是成熟男性。我发现很多女玩家因为原神青年略少，少年和成男多，导致已经忘记了还有青年的分类，把青年成男全都归为成男。
1676390027,2,3,False,False,yysy，如果刃的挚爱是一个只存在于背景的人，我有点不能接受，但如果刃的挚爱是那个景流的话我就要开始磕了（内鬼爆料景流是在一场大战里入魔然后被杀掉的一个角色而且大概率是失忆前的丹恒杀的，官方在推特发过立绘确认为自机角色）
1676396490,0,2,False,False,本来很想玩的，但是我发现最新一批角色出来之后，成男角色比例大大减少了，这让我有点打退堂鼓[笑哭]还是不玩了，看看感兴趣的角色的相关剧情，当个云玩家也不错，而且省时省钱省力[胜利]
1676344468,5,34,False,False,"笑死我了，老杨这个[辣眼睛]表情笑死我了，叔，你怎么了叔[笑哭]
很好奇老杨遇到罗刹两个人会发生什么
杨：等会，那个人！那个背影！卧槽，奥托！

罗刹皱眉不解：您好，请问奥托是谁？您找我有什么事吗？"
1676289518,0,9,False,False,不知道虚空万藏去哪了 好想看 罗刹与虚空万藏变成了奥托见面[吃瓜]
1676344901,0,5,False,False,先看看前面崩三的凯文，只不过没有自机，米哈游一直都挺会做男人，[崩坏3·终焉归始_嘲笑]
1676389300,2,2,False,False,"瓦尔特！拜托！爹系大叔太棒了！！叔控已经原地起飞了！
（这种靠谱的男性！由内而外散发的成熟魅力，那种无论什么都会在他掌握的感觉，完全无法抗拒啊！[喜欢][喜欢]"
1676320984,0,6,False,False,魈厨表示看到丹恒我就挪不开眼了呜呜呜我的玉面小青龙，xp一下子就对上了！跨游戏出轨不算出轨呜呜呜你们都是我的翅膀[星星眼]
1676297621,1,12,True,False,up语气还可以再bt一点，现在这个语气还是有点不够味儿啊[脱单doge]
1676390671,0,2,False,False,只能说顶级作家了，我一个男的听得都心动了
1676300024,6,10,False,False,公测大概在什么时候啊，一天玩不到这么多男人，感觉有凯亚在身上爬[大哭][大哭]
1676369670,0,2,False,False,出了海子哥我已经很久没睡着了[妙啊]
1676463429,0,1,False,False,我刚回家 难道···这游戏已经上线了么
1676286545,5,10,True,False,为！什！么！没！有！彦！卿！啊![脱单doge]
1676372563,12,2,False,False,大概查了下玩法，这游戏竟然还有短信回复之类的交互功能！这不就是把沉浸式代入感加入了嘛！[捂眼]
1676283767,1,7,False,False,美食区up[doge]
1676421608,0,1,False,False,我！成男！吸溜[嗑瓜子][保卫萝卜_笔芯]但是电脑估计带不动，流泪，七八年前的笔记本了[保卫萝卜_哭哭]
1676455047,0,1,False,False,[鹿乃_比心]是时候把视频发给我小徒弟看了
1676397190,0,1,False,False,凌晨两点刷到这个视频 睡意全无 已经被帅死了 up你赔我睡意！！！
1676292533,0,8,False,False,暂停一下，插播一条重要消息，瓦尔特是已婚，你知道这意味着什么吗，当你[喜欢]他的时候，就相当于特斯拉被ntr了，现在你就是小黄毛，你将获得无与伦比的背德感
1676392707,0,1,False,False,在对抗崩坏的道路上，不断有人献出自己的生命，也有人不断献出自己的生命
1676303056,16,31,False,False,它什么时候不会做了吗？[疑惑]
1676305156,4,2,False,False,崩坏体系成男是这样的[doge]，崩三的也不差啊
1676433038,0,1,False,False,丹恒我老婆！！！！！啊啊啊啊啊啊啊啊
1676294074,1,6,False,False,丹宝🥵丹恒🥵🥵🥵好帅啊❤️❤️❤️绝了帅到眼泪从嘴角流出淹成钱塘江大潮太美了你是神👼🏻👼🏻👼🏻是我的玫瑰🌹🌹🌹你照亮了我黑暗💫💫💫的生命让我的世界🌈🌈🌈有了意义我飞跑🏃‍♀️🏃‍♀️🏃‍♀️我猛跳我在28楼的阳台跳起了探戈💃🏻💃🏻💃🏻你让我意识到神确实存在我被帅💗💗💗💗到泪流不止从此世界不再缺水 🌊🌊🌊丹宝!!!🥵呜呜......💕💕各种状态的丹恒都好可爱唔啊啊啊啊啊......🥵🤤🤤♡嘿嘿...🤤不管是什么样的丹宝...💕🤤♡都♡好♡喜♡欢♡🤤💕嘿嘿......🥵啊//已经...♡完全变成丹宝的形状了...♡🥰没有丹宝就完全活不下去desu♡🥰丹宝🥵丹宝🥵丹宝🥵丹宝🥵今天干了什么不知道，因为我脑子里全都是丹宝🥵💘脑子里...♡咕啾咕啾的...♡已经...♡被丹宝塞满了呐...♡♡🥵
1676300232,1,7,False,False,xp已经是mhy的形状了
1676315517,0,6,False,False,罗刹有种寡夫的背德感，让人有种想犯罪的感觉
1676292998,0,6,False,False,草罗刹，享受强制爱美艳小寡妇的快感[脱单doge]
1676329845,0,6,False,False,未定up每次都给我不一样的发癫震撼[辣眼睛]
1676296009,2,8,True,False,瞎说，老杨是老头[傲娇]
1676342986,11,3,False,False,我记得崩坏不是不出男的自机角色吗🤔还是说男角色只有开服的这些，后续出的都是女角色
1676299953,9,6,False,False,一开服我就把原神删了，攒石头抽景元，希望到时候出个钟离之类的原神角色，到时候我就可以彻底抛弃原神了[喜欢]
1676369357,0,1,False,False,啊啊啊我先来 我是景元的狗！！刃是我老公！！@suzy-ninenai-R
1676376842,0,1,False,False,好喜欢成男，星穹铁道是怎么做到每个男角色都在我的xp上的，这不入坑太说不过去了[星星眼]
1676385977,0,1,False,False,"我可能对成男没有兴趣
但是up主的解说让我欲罢不能[doge]"
1676376676,1,1,False,False,回合制卡牌游戏，不适合宅男玩
1676382253,0,1,False,False,桑博厨晚上笑得睡不着觉[初音未来_大笑]
1676288278,0,5,False,False,喜欢刃！！！！！！星铁早期放的视频里我一眼看上，还以为是个大boss不会出角色！居然出！！！！！星铁开门！我要抽刃！管他寡不寡夫！我就喜欢[doge][doge][脱单doge][脱单doge]快开服！有条件的话我冲六命看六命裸刃[doge][doge][doge][doge]
1676295770,0,6,False,False,我对up主的评价是：一本正经的法典[脱单doge]
1676293451,0,5,False,False,风系长枪，帅强惨，有不愿回忆的过往，这个人是！（魈！丹恒！）果然我喜欢的都是同一个类型啊[原神_欸嘿]
1676297871,1,5,False,False,丹恒，地上有100块钱
1676461050,0,0,False,False,少年呢！！！！（癫狂）小男孩呢！！！（癫狂）怎么只有彦卿啊！！！！（癫狂）怎么全都是成男啊！！！！（癫狂）
1676305572,3,2,False,False,罗刹的那个素材好眼熟，好像是[思考][思考][思考]我当时二测时候录的https://b23.tv/BV1pB4y1X7hf [傲娇][傲娇][傲娇]罗刹真的绝，金发美人谁不爱[抓狂][抓狂][抓狂]
1676315355,2,2,False,False,阿兰：我要点名批评一个UP[妙啊]
1676361383,0,1,False,False,特别喜欢刃和景元，太帅了。奥托主教看着有点出戏[tv_笑哭]，而且看到奥拓就想起崩三里面就感觉难受。丹恒也帅就是感觉有点矮。老杨只能当个老爹看了
1676285051,1,5,True,False,啊嗲的文字功底真的厉害👍🏻👍🏻
1676370083,0,1,False,False,感谢大家……（躲避苦茶子）看在我那么…（飞身接住苦茶子）贫穷的份上，一进来（被劈头盖脸的苦茶子打到）就给我这么多苦茶子……（被苦茶子绊倒）谢谢了（默默把苦茶子收起来）
1676454932,0,0,False,False,我……我喜欢我自己！[保卫萝卜_笔芯]
1676451953,0,0,False,False,本来不太会回合制对星铁观望了一年多也没预约，奈何我已在崩三养女儿戒荤腥三年，整天老母亲的状态实属无味……从零开始养男人的生活姐来啦！！男人们哈哈哈哈哈哈哈哈！！！（脱裤子）（流口水）（狂奔）
1676468135,0,0,False,False,景元，我命运般的阿芙洛狄忒，塞纳河畔的春水不及你，保加利亚的玫瑰不及你。你是神灵般的馈赠，你是上帝赐予我拯救我，使我的灵魂受到洗礼与升华。你是我黯淡升华中一束光亮，你是你照亮了我黑暗的生命，你为我黑白的世界填满色彩，使我得到新生。看到你，我如临仙境，在厄瓜多尔荡秋千，在夏威夷岛冲浪，在清迈放飞天灯，在希腊梅丽萨尼洞泛舟穿梭，在土耳其卡帕多西亚空中漫步。你的一瞥一笑在我心头舞蹈，我全部的心跳都随你跳。我飞奔，我猛跑，我高举手臂，我欢呼雀跃，我在5号21楼的阳台跳起探戈。太美了，你是我的神，我被辣到泪流不止，喷涌而出。我的眼泪从眼眶里高压喷射出来打穿屏幕，飞过珠穆朗玛峰，飞过东非大裂谷，飞出太阳
1676434795,0,0,False,False,除了男人，前久我刷视频看到一个小萝莉贼可爱[保卫萝卜_哭哭]但我手机内存带不动了
1676350698,0,2,False,False,好家伙，够6
1676438785,0,0,False,False,杰帕德[抓狂][抓狂][抓狂]我一见钟情，快开服我要推杰帕德我要买他的谷子[抓狂][抓狂][抓狂]搞快点
1676377444,1,1,False,False,原神喜欢凯亚，铁道喜欢桑博，我怕不是有点那什么[笑哭]
1676466670,0,0,False,False,可能因为我没有弟弟，所以我更喜欢小男孩[脱单doge][脱单doge][脱单doge]
1676468493,0,0,False,False,为什么这个视频是成男下一个视频是直男，我又不是男同[doge]
1676449129,0,0,False,False,up的文笔爱了，太戳我了也，越听越兴奋[脱单doge][脱单doge][脱单doge]
1676305363,0,4,False,False,"刃大帅哥，看一眼我就心动了[保卫萝卜_笔芯]
身上还有好多的故事等着我去探寻，求知欲蠢蠢欲动了"
1676294941,0,5,False,False,好诶——就要成男就要成男（什）[脱单doge]
1676286843,0,4,False,False,杨大爷，景元，刃，罗刹，我命中注定的老婆们[奥比岛_击爪]还未开服，已经迫不及待了
1676286481,0,4,False,False,"此番美景——死亡
我虽求而不得——我虽求死不得
但却能邀诸位共赏——但能把它送给你们的同时，与你们一同欣赏。"
1676299445,0,4,False,False,🥵是、是的…想每天都和丹恒在一起起床睡觉[喜欢]丹宝🥵和我结婚🥵🥵🥵我的心里身体里都是你的啦🥵
1676458612,0,0,False,False,给我出来正太
1676361189,0,1,False,False,原神正太全齐的我
1676338165,0,4,False,False,提醒一下角色没有好感条和好感语音[doge]
1676434425,5,0,False,False,米家怎么就只有萝莉没有正太啊[灵魂出窍][灵魂出窍][灵魂出窍]我等的花都谢了我也想刑
1676457501,0,1,False,False,[2233娘_吃惊]
1676420643,0,0,False,False,目前来看，景元和彦卿有关联，丹恒和刃好像有关联，瓦尔特有老婆，罗刹和李素裳有可能有关联，还有个薛定谔的卡莲。目前就杰帕德看起来没有，还有个桑博不太清楚
1676467239,0,0,False,False,[大哭]为什么没有男主鉴赏呜呜
1676287894,0,2,False,False,@达达利亚娶我吧 [喜欢][喜欢][喜欢]
1676448885,0,0,False,False,啊啊啊啊啊好棒啊我都要舔爆。开服快开服，我全都要[给心心]
1676391634,0,0,False,False,成男通通到我碗里来[大笑]
1676392505,0,0,False,False,开篇点了一下成男之后接下来一直在说少年，呃😓
1676393261,0,0,False,False,可恶啊，这么一说我更想玩了[生气]
1676414459,0,0,False,False,彦卿呢？他不香吗？
1676463803,0,0,False,False,我一男的[疑惑]
1676394223,0,0,False,False,这么可爱的杰帕德生来就是要被爷亲亲的！！[喜欢]
1676295750,0,6,False,False,"咱们言简意赅啊，随便发表几句。
罗刹！！！！！！！我是你的狗！！！！！这是什么？罗刹！超亿下！！这是什么？罗刹！超亿下！！这是什么？罗刹！超亿下！！这是什么？罗刹！超亿下！！这是什么？罗刹！超亿下！！这是什么？罗刹！超亿下！！这是什么？罗刹！超亿下！！这是什么？罗刹！超亿下！！这是什么？罗刹！超亿下！！这是什么？罗刹！超亿下！！！！！
主教大人我从08年就开始等你的实机了功夫不负有心人我终于可以在四月份玩到你了！！！！！！！！！！[跪了][跪了][跪了]"
1676385870,3,0,False,False,"用男主扑倒罗刹美人，卡莲不会生气吧[吃瓜]
啊，卡莲已经拐走樱双飞了[doge]"
1676318443,0,3,False,False,靠！风系美强惨。还有红眼影，冷冷的性格有着悲惨的过往！重点是成男诶！！xp预定！！
1676303922,1,3,False,False,景元年少（只几千岁马上退休）
1676301929,0,3,False,False,马非马因为不明原因逃过一劫[崩坏3·光辉矢愿_回眸]
1676385184,0,0,False,False,可是我对身高有严格的要求[吃瓜]
1676386252,0,0,False,False,我，女生，喜欢少年少女和萝莉，特别是彦卿克拉拉和白露
1676381563,0,0,False,False,我本来觉着是不是差个老马，然后一看标题，成男啊，那没事了。。顺带杰哥那个动作，确实我一个大老爷们，也懂了，萨斯卡米哈游。
1676340918,1,1,False,False,其实史瓦罗先生也很香啊，[妙啊]
1676390219,0,0,False,False,在对抗崩坏这条路上，不断有人献出自己的生命，有人不断献出自己的生命[脱单doge]
1676301466,0,3,False,False,我真的好爱瓦尔特杨[喜欢]成熟大叔的魅力谁懂啊啊啊啊
1676308761,0,3,False,False,"罗刹，刃，两位寡夫
老杨，有家室的男人
哎嘿嘿嘿看起来很刺激呢❤️❤️❤️"
1676301098,0,2,False,False,啊啊啊啊罗刹啊啊啊啊
1676309105,0,3,False,False,把人骗进去杀[吃瓜]
1676285317,4,3,False,False,罗刹的CV是赵路老师哦 也就是原神里面的绫人 丹恒的CV是鱼冻 也就是公子的cv 老熟人还是挺多的
1676301534,0,3,False,False,罗刹，呃呃，金发美女，老早就馋隔壁主教了[胜利]
1676292936,1,3,False,False,"啊啊啊啊啊啊啊啊啊啊啊啊啊啊
woc，什么时候正式上线啊[星星眼]"
1676391679,0,0,False,False,但是男的不抽，歪的不养，没有兴趣。
1676385176,0,0,False,False,靠哈哈哈哈文案不错
1676301193,0,3,False,False,看到罗刹，我：主教下岗再就业（确信[脱单doge]
1676388150,0,0,False,False,丹恒是少年，对比四个丹恒身高比较矮，但是身材比例好，所以少男无疑[脱单doge]
1676383897,0,0,False,False,看你说的连我一个男的都心动了
1676390540,0,0,False,False,那个我不是男同啊。但是里面的男的比女的吸引我。。啊啊国风男太帅了。丹恒和景元[Cat2_Boom!][Cat2_Boom!]
1676384356,0,0,False,False,我只喜欢肌肉，这游戏都没肌肉
1676377887,0,0,False,False,我就是喜欢钟离啊
1676388477,1,0,False,False,@洪味呀土豆 @一顿八个张飞 快来，快来，这个up是真的会讲，瓦尔特之前是崩坏的哎
1676373727,0,0,False,False,srds，是不是穿得太多了（）
1676418377,0,0,False,False,码！
1676376637,0,0,False,False,啊啊啊啊，开学了，每天忙成狗，除了星穹还得肝原神，这几天还在地下[大哭][大哭]根本看不到新这些男人
1676372817,0,0,False,False,长发白毛我要了。
1676442664,1,0,False,False,@geekerliu 新男人
1676378638,0,0,False,False,啊！！话说啥时候才能公测下载呢！我能肝
1676349120,0,1,False,False,什么时候来一期夸成女角色的？我想看！
1676377137,0,0,False,False,你好会哦！谢谢！入坑啦！
1676375586,0,0,False,False,我怎么会刷到[辣眼睛][辣眼睛][辣眼睛]不对劲太不对劲了
1676369548,2,0,False,False,刚刚被朋友安利了这个游戏，漫画什么的在哪里看呀[星星眼][星星眼]
1676369291,0,0,False,False,虽然我是男的，但是罗刹[打call][打call][打call][OK]
1676383851,0,0,False,False,原神为啥就没这种。。。
1676367166,6,0,False,False,其实希望能出一个隔壁赫拉格那样的帅老头（双厨，ky删）
1676386591,0,0,False,False,@叶临零 斯哈斯哈斯哈斯哈斯哈斯哈斯哈[保卫萝卜_笔芯]
1676391860,0,0,False,False,成男！！！啊啊啊啊啊啊啊啊啊啊啊啊啊啊
1676448878,0,0,False,False,全超一遍！
1676468705,0,0,False,False,全超一遍
1676298365,2,4,False,False,[墨镜]什么破游戏，送我我都不玩，哼
1676370821,0,0,False,False,哈哈哈别太离谱了
1676309733,0,2,False,False,毕竟，，，米哈游也有乙游的嘛
1676283498,0,2,False,False,很喜欢，但是没得抽
1676362896,0,0,False,False,可是，都不会跳[辣眼睛]
1676299902,0,2,False,False,这个游戏我很难当单推人🥵
1676359933,0,0,False,False,我真的好想看黑发红瞳M刘海的成男啊！！！！
1676293395,0,2,False,False,杨卧起坐（掏648）你愿意歪吗[星星眼][星星眼][星星眼][星星眼]
1676336821,0,2,False,False,up的发电让我想到了一个同样文案好的发电up果子哥[笑哭]
1676361810,1,0,False,False,这是什么游戏，疯狂心动！
1676358377,0,0,False,False,成男真的很香
1676359656,0,0,False,False,被你说得我都饿了
1676298404,1,2,False,False,目前八个成男有五个有腿环[脱单doge]
1676299852,0,2,False,False,本来在馋帅哥的，up对美食的形容词看着看着，看得我饿了[大哭]
1676285738,0,2,False,False,我怀疑嗲子姐为了说杰帕德真买了螃蟹来
1676359575,0,0,False,False,主角也是成男
1676304388,0,2,False,False,救命，我觉得我已经要变成米哈游的形状了，几乎没有一个不戳我的男人[大哭]
1676363367,0,0,False,False,好变态啊[吃瓜]
1676297268,0,16,False,False,但是爷真的很好看[喜欢]
1676470292,0,0,False,False,@当代废物老年人 @阿白白衣
1676302746,0,2,False,False,从未定就知道！米哈游可会做成男了！！终于要有越来越多成男了！！！[喜欢][喜欢][喜欢]
1676357708,0,2,False,False,好家伙形容词一个一个往外蹦 吃完饭都得馋了[脱单doge]
1676287281,0,1,False,False,好活！
1676376692,0,0,False,False,爱了爱了
1676355966,2,0,False,False,@小螃蟹粉丝绒绒 [喜欢][喜欢][喜欢][喜欢]你猜我为什么喜欢😍
1676355307,0,1,False,False,都好帅啊[大哭]只能等公测了
1676355693,0,2,False,False,这up把我给说饿了........
1676290164,1,0,True,False,居然没有男主
1676341395,2,7,False,False,老师们我有一个小问题，丹恒的衣服怎么脱？他好像是双拉链诶，是拉哪一边脱呀？还是说双拉链一起脱？那中间的条条怎么办？脱下来不会弄丢吗？[微笑]
1676345087,0,3,False,False,看得我都饿了，想吃中饭了[坎公骑冠剑_无语]
1676345100,0,3,False,False,你是会形容的，想玩了，每一句都说在了我的心巴上
1676343836,1,7,False,False,"弹幕发""既然都会走路了，那就自己上来动吧""的heitai妹妹我好喜欢[滑稽]"
1676342862,0,2,False,False,成男我永远爱啊啊啊啊啊啊啊[喜欢][喜欢][喜欢]
1676343582,0,5,False,False,对自己下手怎么了，空宝难道没吃过吗[洛天依]
1676297663,6,3,False,False,这游戏现在入坑来得及么[星星眼]原神长草了
1676341936,0,7,False,False,杰帕德模仿姐姐唱歌唱不下去害羞的样子可太逗了[笑哭]我汤姆一男的不知不觉走上了歪路
1676343921,1,3,False,False,评论里面这么多流口水的 应该都已经玩上游戏了把[妙啊]
1676346251,0,7,False,False,虽然但是，景元他不是少年，他挺有年纪的[妙啊]
1676346378,0,1,False,False,景元这种双商都高的人，我真的很喜欢[喜欢]
1676338727,0,4,False,False,啊啊啊，啊啊啊啊啊我也爱成男！！！太香了！！感觉在玩乙女游戏哈哈哈哈
