上传时间,回复数,点赞数,up是否回复,up是否点赞,评论文本
1676345945,0,5,False,False,实际情况是我一个成男都抽不到……除了送的丹恒，我平铺氪金一个男的都没有！
1676348235,0,4,False,False,为了成男想玩了
1676348367,2,1,False,False,啊啊啊，想知道中间那个蓝色的表情包是什么[星星眼]
1676346479,0,2,False,False,什么食人族视角[doge][doge][doge]
1676344682,0,2,False,False,这期怎么一股果子哥味[辣眼睛]
1676347186,0,2,False,False,害怕，up吃人[惊讶][灵魂出窍]
1676350400,0,4,False,False,什么是六头身和八头身的区别啊（战术后仰
1676350426,1,14,False,False,景元不是少年将军!他年龄不小了……而且城府挺深的……
1676349032,0,0,False,False,9494，而且这次爷的配音好像也多了起来，不用老是靠神之嘴了
1676349173,0,1,False,False,说实话三测把老杨的拐杖整发光了，我觉得逼格一下子就下去了
1676351272,0,2,False,False,彦卿:吓我一跳[脱单doge]
1676351854,0,1,False,False,抽景元
1676377530,0,0,False,False,@沫樱嘤
1676378003,0,0,False,False,@沫樱嘤
1676356449,0,1,False,False,呃啊啊啊啊啊啊啊啊啊啊啊啊啊啊啊啊啊啊急急急急急急急急急急急急急急急急急急急急急急急急急急急急急急急急急急急急急急急急急急急
1676304690,0,2,False,False,mhy，一款xp改造机[喜欢][喜欢][喜欢]
1676316566,1,2,False,False,下巴好尖，全是锥子[妙啊]
1676334956,0,1,False,False,姐姐说的太对了[tv_点赞][tv_点赞][tv_点赞][tv_点赞][tv_点赞][tv_流鼻血]
1676295652,0,1,False,False,真的 太期待公测了[星星眼]
1676345172,0,1,False,False,但是我个人三测玩下来，觉得景元和教主的身材比例怪怪的，好像大头娃娃(仅个人感官，这两位也是我的爱)[来古-注意]
1676315854,3,1,False,False,星穹铁道是什么类型的游戏呀 和原神崩三类似吗
1676285638,0,1,False,False,嗲子姐的发病文学从来没让我失望[doge]
1676302269,0,1,False,False,急死我了啊啊啊啊急急急急急，怎么有这么多成男不给我抽[大哭]
1676296127,0,1,False,False,可是，景元起码4位数起步吧[脱单doge]
1676302574,0,1,False,False,看见景元，我只想鸡叫，好戳我的心巴[打call]
1676303454,0,1,False,False,好的，我要把星穹铁道玩成乙游[Ike Eveland_hi]
1676287079,0,1,False,False,下饭的时候看，既有美食又有美色，妙啊
1676290699,0,1,False,False,杰帕德！！！！[星星眼][星星眼][星星眼][星星眼][星星眼]我一眼就相中你了！
1676295807,0,1,False,False,我好喜欢我好喜欢丹恒[喜欢][喜欢]还有刃 景元 罗刹 好喜欢
1676301383,0,1,False,False,我汤姆一个直男居然看得津津有味[UPOWER_1743593860_乐]
1676284430,0,1,False,False,实在不能不感慨，涩涩才是第一生产力。这文案，太有文采了！
1676297755,0,1,False,False,我要找人抹布桑博！！
1676286776,0,1,False,False,崩铁美男团[喜欢][喜欢][喜欢]
1676308682,0,1,False,False,仙舟美男真好，一个慵懒猫猫和两位寡夫，嘿嘿，寡夫[星星眼][星星眼]寡夫好爱
1676311630,1,1,False,False,玩多了原神看他们都是[保卫萝卜_哭哭]丹恒像年轻帝君，？？（未知名字）像魈长大了。
1676287151,0,1,False,False,哈哈我知道男的为啥很开心的看完了
1676290068,2,1,False,False,蓝色猫猫的表情包叫什么，我想拥有全套
1676342137,0,2,False,False,米忽悠会不会就靠这几个男人忽悠玩家[藏狐]（还在后头的大批女角色）
1676303244,0,1,False,False,语气不够bt，建议加大力度[doge]
1676365198,3,0,False,False,米游特色，所有男性自机都没有胡子[辣眼睛]显得很没有雄性激素，欣赏男性跟欣赏女性没有区别了变的
1676285392,0,1,False,False,急急急急急快让我上车我是无量塔急子
1676301666,0,1,False,False,喔！有风系成男！风男厨狂喜！
1676303286,0,1,False,False,下一个up就是景元！景元啊啊啊啊啊！你等我娶你回家啊啊啊啊啊啊！
1676296975,0,0,False,False,[脱单doge]
1676299611,0,0,False,False,[思考]
1676307551,0,0,False,False,爱了爱了[星星眼]
1676305189,0,0,False,False,up女版@果蝇轰
1676307933,0,0,False,False,小马呢
1676285292,0,0,False,False,[doge]
1676334116,0,0,False,False,[喜欢][喜欢][喜欢][喜欢]
1676283951,0,0,False,False,饿了[思考]
1676298071,0,0,False,False,全部我都爱
1676311341,0,0,False,False,这也太像钟离了…
1676288522,0,1,False,False,我觉得铁道男团就是米哈游踩在我xp上做的[喜欢][喜欢]真的要发疯了！！！
1676298770,0,0,False,False,[OK]奇怪的角度增加了
1676308378,0,0,False,False,嘿嘿嘿，吸溜
1676302905,0,0,False,False,嘿嘿，太太好会说[脱单doge]
1676308323,0,0,False,False,小作文是真的很棒[脱单doge]
1676301114,0,0,False,False,[脱单doge]喜欢冷冷清清的那款！丹恒！
1676316888,0,0,False,False,弹幕最后有魔鬼[笑哭]
1676301708,0,0,False,False,"老马啊！老马！
嗲子姐不会没有彦卿吧"
1676295838,0,0,False,False,异世界的奥托主教！
1676296444,0,0,False,False,我是所有成男的狗[喜欢]
1676304279,0,0,False,False,怎么不能冲自己啊，怎么不能啊[doge]
1676301777,1,0,False,False,手滑点进来的。。。。。。。我居然看完了（男性）
1676308477,0,0,False,False,没有成男的世界，是不完美的[喜欢]
1676301973,0,0,False,False,原我喜欢少年角色，星轨喜欢成男角色，xp补全了[脱单doge]
1676301096,0,0,False,False,我玩铁道！就是为了丹恒！啊啊啊啊啊啊啊啊[喜欢][喜欢][喜欢][喜欢][喜欢][喜欢][喜欢]
1676290338,0,0,False,False,我还喜欢阿兰！！太可爱了[喜欢]
1676302238,0,0,False,False,真的好喜欢成男啊啊啊啊快让我玩[保卫萝卜_哭哭][保卫萝卜_哭哭][保卫萝卜_哭哭]
1676301154,0,0,False,False,我不管！我都要！（震声）（扭曲的爬行）
1676302555,5,0,False,False,我真的好好奇罗刹人和瓦尔特相遇的样子[doge]
1676288293,0,0,False,False,真的很喜欢星铁的男人[脱单doge]
1676340707,0,0,False,False,成男怎么能没有我最喜欢的纳努克[傲娇]
1676302254,0,0,False,False,我要！！！！！！！[喜欢][喜欢][喜欢][喜欢]
1676309777,0,0,False,False,"对自己下手的
没错！正是在下！[热词系列_肥肠自信]"
1676307291,0,0,False,False,成男厨驾到[脱单doge]
1676312807,0,0,False,False,本人帅就罢了，他们的大招也都好帅啊[星星眼][星星眼]
1676300942,0,0,False,False,杰帕德那一趴的背景音乐是什么！！不要逼我跪下来求你！！
1676291896,0,0,False,False,我看到了：快乐肥宅小华赞了[支持][吃瓜]
1676343772,0,0,False,False,男主之所以是男主是有原因的！！！真的太可口啦！[喜欢]
1676302405,0,0,False,False,没有成男的世界是不完整的，就像没有罗刹，景元，丹恒等等的我也是失败的（？）而且主角也是成男！我一整个欣喜若狂！快点公测罢！（迫不及待）
1676306366,0,41,False,False,有心上人不是问题，你们的心上人安娜卡莲李素裳特斯拉也是我的老婆，有孩子更好，我不是拆散这个家的而是来加入这个家的[脱单doge]
1676331954,0,0,False,False,别说了别推了(ಥ_ಥ)，手机没有内存下载，我已经再难受了(ﾉಥ益ಥ)，可恶啊，好多大美人T_T
