上传时间,回复数,点赞数,up是否回复,up是否点赞,评论文本
1676195333,46,2220,False,False,叔，我发现张永彬在学校老把一个同学堵墙角，收他的保护费，还让他带烟，张永彬还说，要是他把他谈恋爱的事情偷偷告诉你，就打断他的腿，叔赶紧给这个同学出个主意吧，我感觉他不知道咋办了
1676202045,33,571,False,False,妈啊好久不看，小家伙这么胖了[笑哭][笑哭]一定要控制饮食啊，先不说形象问题，人胖了就会犯懒[笑哭]
1676265023,9,177,False,False,"我发布了一篇笔记，快来看看吧
初，龙归，带白象，百斤牛肉，时人曰龙念彬未吃，然龙想鱼也，龙有居多兄弟，其中郭忠、底料、葱姜、生抽老抽、阿蒜排场最大，盘踞多年，根深蒂固，龙爱之，深责之切...
https://www.bilibili.com/h5/note-app/view?cvid=21797250&pagefrom=comment&richtext=true"
1676211657,14,134,False,False,盐分超标太严重了，不要以为网友是玩笑话[百变星瞳_豆豆眼]胖龙你自己胖了什么体验心里知道，小家伙这个身材已经超出同龄人太多啦，一查绝对有问题，小孩胖了对身体发育有大影响的，你知道我说的什么
1676199256,3,185,False,False,"小家伙以后容易三高，总这么吃。
这可比刚入镜时候圆太多了。"
1676198266,4,177,False,False,"华强：龙老板这面咋卖的
胖龙：50一碗
华强：你这面是金子做的还是碗是金子做的？这么贵！
胖龙：这都是现炒的牛肉，你看看哪家这样做，你嫌贵我还嫌贵呢
华强：[生气]"
1676203836,1,30,False,False,"我发布了一篇笔记，快来看看吧
省流：高启龙
https://www.bilibili.com/h5/note-app/view?cvid=21785879&pagefrom=comment&richtext=true"
1676195177,9,419,False,False,用100元的牛肉做两桶“牛肉泡面”吃肉都差点吃饱，太豪横了
1676197440,3,80,False,False,叔，张永彬在学校里说你坏话，V我50，我告诉你他说了啥
1676198038,4,235,False,False,龙叔，张永彬用手机随便加微信，打视频电话，刚好打给了我，说来周口大街指定没我好果汁吃[大哭]
1676196628,12,39,False,False,孩子快到青春期了，不要让他太胖，要不然鸟长不大，又细又小。
1676274798,4,20,False,False,moncler羽绒服确实很贵，可是胖龙穿的是monlcer
1676217431,1,10,False,False,好久没看了，小家伙怎么胖成这样了，得控制啊
1676263724,1,14,False,False,全网呼吁张剥蒜减肥 大家帮我顶上去
1676218729,0,13,False,False,孩子都胖成啥了，，，，[笑哭]，天天这样吃也不是办法
1676208478,2,17,False,False,减肥，你和孩子一起减肥，不敢再胖下去了
1676210425,3,20,False,False,龙，张永彬在学校堵着我，还说不给他钱就找人打我[委屈]
1676264744,1,14,False,False,提个建议呀 做菜不要重油重盐  真的对身体太不好了。。。我是学健身这方面的，真的建议不要每天这么重油重盐  一周一次两次 还好 天天这样 早晚出事呀  希望胖龙哥多注意下
1676195277,17,476,False,False,龙，张永彬在学校堵着我，还说不给他烟就找人打我[doge]
1676196489,3,30,False,False,叔叔张永斌问我要芙蓉王，说下周不给他拿三盒就堵厕所踩我头，他在学校现在是小网红小霸王收保护费，我不敢跟家长老师说。
1676198346,0,12,False,False,蒜王该控制饮食了，对比以前的视频，差的有点多了。尤其是站电视前面那个镜头，有胖龙那味了。
1676288663,0,3,False,False,是不是看过了啊这集
1676218420,0,4,False,False,小家伙知道疼爸爸了 必须投币啊 懂事了
1676266748,3,7,False,False,叔，张永彬扒我苦茶子，说看看我的[大哭]
1676267511,2,10,False,False,"我发布了一篇笔记，快来看看吧
我发布了一篇笔记，快来看看吧~
https://www.bilibili.com/h5/note-app/view?cvid=21798077&pagefrom=comment&richtext=true"
1676272018,1,5,False,False,小家伙太胖啦，胖龙给他减减肥吧
1676295835,0,9,False,False,胖龙还是稍微注意卫生吧 毕竟长时间生活在一起是会言传身教的，希望小家伙养成良好的习惯～
1676218460,0,9,False,False,这孩子又矮又胖了 还不引起重视
1676211328,3,12,False,False,俺叔叔，张永彬在学校上课的时候老给我传小纸条，叫老师逮住喽还老说是我给他传的，我本来想今天去给俺妈说的，俺妈说做人要大度，但是我越想越气，不得劲，俺叔，给我做主。
1676195151,2,24,False,False,一楼和龙龙舌吻[傲娇]
1676196116,7,11,False,False,额...我知道有点不合时宜这条评论，我就想问问，长途绿皮火车如果卧铺卖光了，我没抢到票买了硬座，还会有空床吗[难过][难过]要做四十多个小时[酸了](来自去外地读大学大学牲的请求，如果不适立马删）
1676211711,1,8,False,False,小孩胖了影响身高和那个发育，注意点，别吃太胖了
1676195165,0,3,False,False,芜湖~刚刚！！！胖龙加油[doge]
1676196411,4,18,False,False,我觉得冒充同学在下面给别人小孩子安帽子的评论真的很不好，说的都是不应该乱扣帽子对小孩子来说很严肃的言论。。。
1676203679,0,14,False,False,小家伙肚子太大了[大哭][大哭][大哭]太大了太大了 注意减肥啊
1676266898,2,5,False,False,实际上河南吃盐很重的我觉的这个盐量可能刚好
1676263856,0,5,False,False,省流：6：14
1676240376,0,5,False,False,期待胖龙粉丝数逆袭小刚
1676200637,1,5,False,False,龙哥，要教育孩子生命的重要性，绝不是这样对于死亡充满戏谑和漠视
1676200295,0,10,False,False,关注两年了，小家伙肉眼可见的从帅哥到小胖龙了[抓狂]
1676196519,1,11,False,False,金鱼肯定是活不了多久了 ，密度太大了容器太小。卖这种的商家真是缺大德了，草金也不贵网上一堆，真的想养就好好研究好歹是生命。就这么上手肯定是不行
1676292882,0,2,False,False,今天不更吗
1676199091,0,7,False,False,张永斌越来越胖龙了 还想当年多清秀的小孩，现在就剩双大眼睛了
1676276000,1,6,False,False,各地口味不一样，河南人觉得这个盐量没问题，而且家里长辈都这么吃也几十年了
1676195370,0,10,False,False,龙 不用特意告诉我2.14是情人节 我没钱给你发红包 实话告诉你 我这个拖鞋鞋底磨了一个洞 我已经穿半年了 我每天的饭就是面条 清水煮面条 一包6块钱的挂面我要吃一周 不管你怎么想 我的生活就是这样的  
1676198035,1,8,False,False,这点赞量明显比上期少了很多，上次不到一个小时点了5900+，这次才4000左右，希望大号胖龙多休息休息，让蒜来多点镜头[doge]
1676195677,1,10,False,False,叔叔，张永彬在学校抄我的作业，还说不让抄不给我买辣条，但是现在也没给我买辣条
1676474212,0,1,False,False,小家伙吃东西嚼几下就咽下去了，这样长了，导致消化不良、肥胖等情况。
1676220016,0,6,False,False,今天闲的无聊翻看了一下龙哥之前的作品，以为胖，不爱打扫卫生  哈哈想想都过去几年了吧龙哥真的在进步呀，相信很多一路陪着走过来的粉丝们都看在眼里了吧，加油龙哥很爱看你的视频 加油吧
1676199783,1,5,False,False,以前不是做过吗[思考]
1676211060,0,5,False,False,小家伙胖成这样了居然
1676294747,2,3,False,False,小家伙肚子好大呀 是衣服穿多了么？太夸张了
1676195124,0,7,False,False,第一奖励一个大嘴巴子[doge]
1676216809,0,6,False,False,龙，张永彬在学校堵着我，还说不给他烟就找人打我，我的ip可以证明[doge]
1676216528,0,2,False,False,胖龙好起来了啊，蒙口小羽绒服也穿上了
1676218117,0,2,False,False,怎么感觉小家伙的这件毛衣就没穿正过呢[笑哭][笑哭]
1676265739,0,4,False,False,小家伙这么大了都，其实不能让孩子太胖的好，让他多运动
1676219426,0,2,False,False,我强哥没跟你说 他那肠胃炎咋得的吗？就是干吃咖啡吃的[doge]
1676213893,0,3,False,False,好久没看胖龙视频，胖龙儿子胖了好多，一定要控制饮食啊，
1676212221,0,3,False,False,蒙口羽绒服，真有钱呀
1676195514,0,5,False,False,为什么没有火锅底料？我不理解[doge]
1676195522,3,5,False,False,张永彬都胖成这样了，不打算管控一下饮食吗？补偿孩子也不能这样吧
1676197820,1,7,False,False,叔，张永斌说明天的说给我带盒烟，不带给我腿打折。
1676311149,0,2,False,False,为了孩子的健康着想，饮食这方面自真得开始控制了
1676195811,0,3,False,False,带劲带劲[打call]
1676216805,2,13,False,False,弹幕说咸的，你们是眼上长舌头了是吧？叫个没完
1676200737,0,4,False,False,龙啊 注意小家伙的饮食，别太胖了  还小
1676206864,0,5,False,False,养鱼的秘诀就是“勤换鱼”
1676300298,0,4,False,False,虽然可能齁咸，但是看起来真的好香[大哭]
1676295446,0,3,False,False,这才小学吧，节制啊
1676217351,0,3,False,False,一百多w粉丝了，！！刚看你视频才1w多粉
1676208432,0,4,False,False,这么小的盒子养这么多鱼估计活不过今天
1676202924,0,5,False,False,叔，张永彬在学校光嘿唬我[大哭]
1676283591,0,5,False,False,龙，我就是前几天被张永斌欺负的同学。原因是我俩同时喜欢班里面的一个女生，他还在班里当着所有人的面，大声警告我说，让我保护他的梦～
1676292843,0,3,False,False,龙啊，现在是三天两头就断更啊[吃瓜]
1676224968,2,4,False,False,孩子再不减肥某个部位的发育会受到影响[吃瓜]
1676210574,0,3,False,False,龙，泡面不能多吃，注意身体健康！[呲牙]
1676213432,0,4,False,False,胖龙，小家伙胃都到胸腔了啊，这不是往高了长，往宽长了
1676195564,0,3,False,False,孩子太胖了注意下吧
1676197202,0,4,False,False,叔叔，张永彬放学的时候堵着门不让我走，非要我给他介绍个女朋友
1676218869,0,4,False,False,大龙啊，你还我最初的张永彬[大哭][大哭]
1676195525,0,3,False,False,胖龙：不是白象的我不吃
1676195734,1,5,False,False,"第一眼：胖龙就吃这个？这么简单 有点不相信 再看一遍[doge]
第二眼：boom（爆炸了）🙃"
1676257000,1,3,False,False,龙，小家伙要跟我耍朋友，可是他太胖了呀[害羞]
1676373043,0,0,False,False,叔，我发现张永彬在学校老把一个同学堵墙角，收他的保护费，还让他带烟，张永彬还说，要是他把他谈恋爱的事情偷偷告诉你，就打断他的腿，叔赶紧给这个同学出个主意吧，我感觉他不知道咋办了（我的IP对）
1676206406,1,3,False,False,弹幕说咸的，自己做一次饭吧，不难的
1676297030,0,3,False,False,龙哥和小家伙可能节制好一些，太辣太咸量大在填饱肚子之余，可能身体有点吃不消~
1676195871,0,15,False,False,"我发布了一篇笔记，快来看看吧
笔记区新人，点个赞支持一下你们的鹅子吧，可以去看看主页其他笔记
https://www.bilibili.com/h5/note-app/view?cvid=21783881&pagefrom=comment&richtext=true"
1676209003,0,2,False,False,《焯水的水》
1676197536,2,4,False,False,龙，张永彬说今天不给他买烟就让我没学可上，我已经准备转校了
1676195616,0,3,False,False,前排[兔年]希望胖龙和小家伙越来越好 平平安安[2023][兔年]
1676195929,0,4,False,False,什么档次和我吃的牛肉面不一样[doge][傲娇]
1676196992,1,3,False,False,"我一直都有每天守着点儿看胖龙视频的习惯，女朋友看不下去了。

昨天她问我，“你这么喜欢胖龙，我问你个问题，我跟胖龙同时掉进河里，你会先救谁？”

“当然是先救你了”我毫无不犹豫的脱口而出，因为这样，我就可以跟我的龙龙一起坠入爱河了。"
1676263371,1,3,False,False,洛温现在在用鬼畜带大家了解经典名著了
1676201411,2,9,False,False,咖啡都嚼上了，下期该做猪脚面了，小家伙吃猪脚，小哥吃面，胖龙喝汤[doge][doge]
1676198394,0,4,False,False,叔，张永斌开穿越门给我按到墙角要抄我作业，我不知道怎么办了[大哭]
1676204422,0,11,False,False,"我发布了一篇笔记，快来看看吧
省流：高启龙
https://www.bilibili.com/h5/note-app/view?cvid=21785879&pagefrom=comment&richtext=true"
1676196184,0,3,False,False,还记得大学军训的时候，去上了个厕所，然后死活想不起来自己是哪个队伍的，看了视频我才知道，是三连[doge][doge]
1676197080,1,5,False,False,又吃牛肉泡面了啊[tv_微笑][tv_微笑][tv_微笑]
1676256447,0,2,False,False,这个汤我怎么觉得齁咸[辣眼睛]
1676466246,0,0,False,False,龙啊，高启强吃的咖啡里面装的是豆面，你咋那耿直呢！[吃瓜]
1676205485,1,6,False,False,叔，张永斌让我给他带条白将，要不然就真实我
1676288303,1,3,False,False,省流：爸爸，我要吃牛肉面
1676368691,0,0,False,False,羡慕，我小时候我爸从来没有买过牛肉吃。而且从来不允许我吃方便面[大哭][给心心][鼓掌]
1676222485,0,2,False,False,小家伙真的要减肥了[妙啊][妙啊]
1676195562,0,4,False,False,龙，我举报，张永斌一放学就全国各地跑，我老能见着人举报他
1676198933,0,2,False,False,为什么每次都没有小哥的
1676427585,0,0,False,False,不止我觉得小家伙要减肥了吧[呆][呆]
1676195322,0,3,False,False,用100元的牛肉做两桶“牛肉泡面”吃肉都差点吃饱，太豪横了
1676297197,0,2,False,False,胖龙：老夏，我想吃鱼🐟了[脱单doge]
1676264794,3,7,False,False,"初，龙归，带白象，百斤牛肉，时人曰龙念彬未吃，然龙想鱼也，龙有居多兄弟，其中郭忠、底料、葱姜、生抽老抽、阿蒜排场最大，盘踞多年，根深蒂固，龙爱之，深责之切，遂彬说无爱。
因（于是）龙烹，彬玩也，玩何物？鱼也，者曰：汝养鱼何不喂？答曰：生死有命，富贵在天，吾只善后嗝屁鱼也。遂用龙手握鱼尸，弃置不顾，时人皆叹也。
     未几，面熟，龙与彬大快朵颐，只闻梭梭声，合《只因你太美》之调，既以，龙发恶疾，歪其嘴，眼飞之，龙口开，彬听之，只闻父，吾欲食牛肉面饼，彬大惊，确认其词，若有所思，惊曰：此合阿里嘎多美羊羊之音！
      时人皆曰：善，吾得养生之道！
                                              选自《龙与蒜来旨归》"
1676200127,1,2,False,False,人才，干嚼咖啡
1676221900,0,2,False,False,我去，小家伙这肚子咋这么大了
1676205468,0,2,False,False,感觉肉不烂啊，张永彬这牙口费劲
1676297300,0,2,False,False,胖龙：告诉老夏，我想吃鱼🐟了[脱单doge]
1676358993,0,0,False,False,这食量真大，我承认我吃不下去[吃瓜]
1676207290,0,9,False,False,"我发布了一篇笔记，快来看看吧
省流：孩子很喜欢吃
https://www.bilibili.com/h5/note-app/view?cvid=21786869&pagefrom=comment&richtext=true"
1676224391,2,3,False,False,叔，我发现张永彬在学校老把一个同学堵墙角，收他的保护费，还让他带烟，张永彬还说，要是他把他谈恋爱的事情偷偷告诉你，就打断他的腿，叔赶紧给这个同学出个主意吧，我感觉他不知道咋办了
1676422794,0,0,False,False,胖龙会带小家伙定期体检吗🤔，感觉确实相比于同龄孩子来说过胖了
1676211763,3,4,False,False,他们都是假勒。叔看看我，我发现张永彬在学校老把一个同学堵墙角，收他的保护费，还让他带烟，张永彬还说，要是他把他谈恋爱的事情偷偷告诉你，就打断他的腿，叔赶紧给这个同学出个主意吧，我感觉他不知道咋办了
1676213147,0,2,False,False,龙哥最近几个视频弹幕里的指点江山大神和杠精多了不少[呲牙]
1676196810,0,3,False,False,"我发布了一篇笔记，快来看看吧
笔记区新人，点个赞支持一下你们的鹅子吧，可以去看看主页其他笔记
https://www.bilibili.com/h5/note-app/view?cvid=21783881&pagefrom=comment&richtext=true"
1676216883,2,2,False,False,说实话，买点或者做点手擀面再加你做的，不比泡面好吃？_(:з」∠)_
1676195997,0,9,False,False,没有以前的视频那么朴实接地气了。。但笑点多了[doge]
1676195400,0,2,False,False,你干嚼咖啡是什么意思[doge]
1676209102,1,2,False,False,胖龙太豪迈了！干嚼咖啡，再喝矿泉水，肚子里搅拌！太逗了！
1676199983,0,2,False,False,小家伙控制一下体重吧，加强下运动[doge]
1676212619,1,2,False,False,问问张永斌什么时候把女朋友还我，上次打我那账还没算呢！
1676378921,0,0,False,False,《100》《差点》[doge]
1676195342,0,1,False,False,06:13
1676199095,0,3,False,False,想吃牛肉面[tv_发怒]
1676432672,0,0,False,False,所以爱会消失[滑稽]  哈哈哈哈哈哈
1676369833,0,0,False,False,胖龙这是又胖回去了吧
1676197450,0,5,False,False,爷俩吃的太荤了，多吃点素的吧
1676375854,0,0,False,False,火锅底料呢
1676195544,1,2,False,False,胖龙，张永斌在学校欺负我[委屈]
1676315184,0,1,False,False,方便牛肉面：你可以模仿，但超越个啥，啊？，啊！啊啊啊啊啊啊啊啊[doge][滑稽]
1676218023,0,6,False,False,你看你都做面了要不也蹭一下狂飙的热度 做一份猪脚面 我想看胖龙版的猪脚面
1676199152,2,2,False,False,龙叔，张永彬要和我网恋还要收同学保护费来山东找我[大哭]
1676195729,1,2,False,False,抹布开个抽奖，抽了吧[喜欢]
1676444818,1,0,False,False,下一个小刚?
1676195239,0,2,False,False,用100元的牛肉做两桶“牛肉泡面”吃肉都差点吃饱，太豪横了
1676195840,0,2,False,False,咖啡干嚼不加糖，我是周口大胖龙
1676208892,0,1,False,False,看肚包肉
1676195470,0,2,False,False,咖啡干嚼不加糖，我是火锅底料王[doge][doge][doge]
1676195469,0,2,False,False,用100元的牛肉做两桶“牛肉泡面”吃肉都差点吃饱，太豪横了
1676296921,0,1,False,False,牛腩略贵
1676195244,0,2,False,False,省流：没有火锅底料
1676434910,0,0,False,False,这个要炖几个小时能软烂呢
1676197118,0,2,False,False,龙叔，张永斌在学校又抢我的斗罗大陆，这回三四五部全抢走了
1676195138,0,1,False,False,龙啊龙
1676195973,0,1,False,False,【7月】关于养猫我一直是新手【独家正版】
1676198790,0,2,False,False,"50块钱一桶牛肉面✘
买50牛肉送一桶面✔"
1676201229,0,2,False,False,龙，我今天在学校看到了张永彬在学校堵别的同学，被他发现了，他说如果我告诉别人，就找人打我[doge]
1676379669,0,0,False,False,这饭量可以
1676195152,0,1,False,False,今天我也吃牛肉
1676292573,0,1,False,False,这是真牛肉啊！
1676195985,0,2,False,False,用100元的牛肉做两桶“牛肉泡面”吃肉都差点吃饱，太豪横了[妙啊][妙啊]
1676200422,0,3,False,False,看蒜来吃面，品启龙人生[脱单doge]
1676195139,0,1,False,False,差点吃饱[笑哭]
1676198943,0,1,False,False,似曾相识
1676467376,0,0,False,False,看着好香
1676430538,0,0,False,False,小家伙又胖了
1676195566,0,1,False,False,干嚼咖啡
1676220400,0,1,False,False,我是看着他儿子胖起来
1676204383,0,1,False,False,白象好评
1676198653,0,3,False,False,点菜:猪手面
1676196500,0,3,False,False,这boy需要控制饮食了[笑哭]
1676215217,0,1,False,False,高启强猪脚面
1676195139,0,2,False,False,用100元的牛肉做两桶“牛肉泡面”吃肉都差点吃饱，太豪横了
1676199206,0,1,False,False,煮牛肉放点柱侯酱会非常好吃
1676292836,0,1,False,False,2：00
1676245812,2,1,False,False,胖了不送货了？
1676211327,0,1,False,False,把我看饿了，又吃了一顿[tv_生气]
1676195327,0,1,False,False,好爽啊，看起来[打call]
1676292807,0,1,False,False,孩子是不是在看蜜獾的视频[吃瓜]
1676200109,0,1,False,False,白象好评[doge][妙啊]
1676195202,0,7,False,False,[doge]老夏100买了半扇猪排，胖龙100只有2斤牛腩
1676205565,0,1,False,False,牛肉这玩意牛两头啊，嘶～不牛
1676207540,0,1,False,False,小家伙毛衣是穿反了吗[笑哭]
1676214158,0,1,False,False,《所以爱会消失》[OK]
1676199943,0,1,False,False,什么档次跟我吃一样的泡面！！！
1676212636,0,1,False,False,高启龙 下次吃猪脚面[嗑瓜子]
1676198979,2,1,False,False,这碗泡面能卖35元一盒
1676195214,0,1,False,False,你怎么知道我刚看完中国boy的泡面
1676197663,0,1,False,False,矛盾文学笑死我了[大笑][大笑][大笑]
1676264037,0,0,False,False,🌿，刚吃完午饭又把我看饿了[笑哭]
1676259951,0,0,False,False,泡面泡的比牛肉硬感觉
1676265046,0,0,False,False,白象，点赞
1676267300,0,0,False,False,真·牛肉面
1676196459,0,1,False,False,这孩子比以前开朗多了
1676224819,0,1,False,False,好家伙，才发现我大周口出了这么大的up主，支持支持
1676207681,0,2,False,False,龙哥，侄娃子昨天晚上从白金瀚出来，我亲眼所见
1676255338,1,1,False,False,叔，我发现张永彬在学校老把一个同学堵墙角，收他的保护费，还让他带烟，张永彬还说，要是他把他谈恋爱的事情偷偷告诉你，就打断他的腿，叔赶紧给这个同学出个主意吧，我感觉他不知道咋办了
1676304097,1,1,False,False,我新粉问一句，拍视频的小哥不吃吗[思考][思考][思考]
1676356606,0,0,False,False,这期是不是发过了
1676263213,0,1,False,False,省流：蟹老板
1676348714,0,0,False,False,龙  我来许昌了
1676346606,0,0,False,False,放点干海椒更香
1676345152,0,0,False,False,看起来真不错
1676212372,0,1,False,False,今天看了一圈的吃播嗦面視頻，爽
1676271270,0,0,False,False,看着都咸。[妙啊][妙啊][妙啊]
1676324384,0,0,False,False,胖胖
1676220006,0,1,False,False,刚发现一个表情包长得好像小家伙[doge]
1676274599,0,1,False,False,桂皮放多了会苦吗[笑哭]
1676195414,0,1,False,False,蒜来该多运动运动了[呲牙]
1676198666,0,1,False,False,[doge]
1676195583,0,2,False,False,这期没有火锅底料，抹布也变小了，差评哈哈哈哈
1676344500,0,0,False,False,小家伙还挺瘦的，还能继续这么吃
1676214557,0,1,False,False,猴子偷桃是哪一期[脱单doge]
1676198416,0,0,False,False,04:58高启龙
1676215399,0,0,False,False,06:38 [doge][doge][doge]
1676196371,0,1,False,False,看胖龙必上岸！[打call][打call][打call]
1676283594,0,0,False,False,哇
1676327007,0,0,False,False,龙叔，斌哥说明天的说给我带盒烟，不带给我腿打折。
1676196486,0,0,False,False,[点赞][点赞][点赞]
1676196892,0,1,False,False,小张已经成功向二代龙发展了
1676244814,2,1,False,False,胖龙怎么什么都会做每一期视频就没有重样的菜品
1676283247,0,0,False,False,6
1676222906,0,1,False,False,这小家伙，怎么圆了那么多[藏狐]
1676196493,0,0,False,False,6
1676213166,0,0,False,False,@洋宝爱吃乐乐茶
1676198995,0,0,False,False,[热词系列_肥肠自信]
1676225941,2,1,False,False,话说焯水用的水不能再加回去煮肉吧？
1676202380,0,1,False,False,卧槽 豪横啊 两碗大桶泡面居然都一百大洋了
1676220023,0,1,False,False,《爸爸我，要吃牛肉面》[doge]
1676195489,0,0,False,False,早[打call]
1676195624,0,1,False,False,恶龙咆哮[doge]
1676195655,0,0,False,False,来了[打call]
1676200635,0,0,False,False,666
1676316131,0,0,False,False,这小子吃的比我个成年人都多。。。
1676208630,0,1,False,False,龙：告诉老夏，我想吃鱼了
1676195549,0,0,False,False,嗯
1676195325,0,0,False,False,来了来了
1676199029,0,0,False,False,好耶
1676195253,0,0,False,False,[星星眼]
1676195232,0,0,False,False,好早
1676210784,0,0,False,False,嘿。
1676207142,0,1,False,False,胖龙这次犯事了，学高启强嚼咖啡粉了
1676195201,0,0,False,False,[滑稽]
1676214045,0,1,False,False,似曾相识的文案
1676195386,0,0,False,False,[星星眼][星星眼]
1676279930,0,0,False,False,11
1676195312,0,1,False,False,用100元的牛肉做两桶“牛肉泡面”吃肉都差点吃饱，太豪横了
1676216083,0,1,False,False,看在泡面是白象点了个赞👍🏻
1676195159,0,0,False,False,1111
1676195128,0,0,False,False,[doge]
1676197226,0,1,False,False,龙 张永彬在学校恐吓我 把我吓回老家了 我想上学啊
1676213966,0,1,False,False,开始看的时候小朋友还是小不点，现在肚子已经是我两倍了[笑哭]
1676195366,0,0,False,False,早啊[吃瓜]
1676195134,0,0,False,False,11111
1676195121,0,0,False,False,111
1676199477,0,1,False,False,用100元的牛肉做两桶“牛肉泡面”吃肉都差点吃饱，太豪横了
1676300372,0,0,False,False,好吃好吃
1676200403,0,0,False,False,可以[战双帕弥什_吃瓜]
1676195130,0,0,False,False,222
1676195159,0,0,False,False,[doge]
1676195126,0,0,False,False,[星星眼][星星眼][星星眼]
1676195135,0,0,False,False,[吃瓜]
1676199670,0,1,False,False,用100元的牛肉做两桶“牛肉泡面”吃肉都差点吃饱，太豪横了
1676198582,0,1,False,False,用100元的牛肉做两桶“牛肉泡面”吃肉都差点吃饱，太豪横了
1676198538,0,1,False,False,你们说如果直接用方便面调料来做红烧牛肉味道会不会比自己调味儿好呢
1676195323,0,0,False,False,[2023][2023][2023]
1676213617,0,1,False,False,省流：这一期没有放火锅底料[妙啊]
1676195123,0,0,False,False,[兔年]
1676195275,0,0,False,False,今天来的好早[星星眼]
1676195419,0,1,False,False,这一顿抵某兰州拉面半年的牛肉量了[笑哭]
