上传时间,回复数,点赞数,up是否回复,up是否点赞,评论文本
1676201120,113,8487,False,False,"第一个的话 这种情况我爸会开始抱怨然后我爸我妈吵起来
第二个 就会大吵一架我爸出去吃我妈在家哭
第三个 会埋怨我怎么磨磨叽叽的不去得了 然后全家一起回家
我全都亲身经历过[微笑]"
1676191952,42,3061,False,False,简直科幻片，最关键的是我细想了下，如果我处在这种环境可能也会忍不住发火[保卫萝卜_哭哭]因为长期处在这种暴躁压抑的环境，一直忍着很难受，如果你也不暴躁一点就难受加倍
1676124850,73,4713,False,False,科幻片[大哭]
1676223665,71,808,False,False,头俩都没关系，顾不过来错过了忘了都能理解，第三个因为化妆而迟到很难不生气吧[笑哭]明知道赶时间还拖拉，这都不值得说两句多少有点溺爱了。
1676202293,25,566,False,False,天啊 第二种情况我家真有 如果是其他人忘记煮米饭会被骂 如果是我妈忘煮米饭 她会骂我们为什么没人提醒她。。[微笑]
1676199820,17,372,False,False,擦……原来我就是维持周围氛围的情绪最稳定的那个人[无语]
1676215716,11,260,False,False,如果我煮饭忘了按按钮，会被我爸嘲讽死的，真的很坏心的嘲讽，他自己忘记的时候，就各种理由(吼着说自己在忙什么的(忙着刷抖音)然后把问题推到我和妈妈身上(直接无逻辑甩锅就是了)
1676254735,8,103,False,False,小时候家里做饭，然后我出去买我们这当地的一种玻璃瓶饮料，我递给我姐的时候，不知道是我俩谁不小心的，给摔了，我当时还小正要跟我姐争论一下谁的原因的，怕我妈责怪的时候，我妈说碎了就碎了再买一瓶去吧，然后我一直到现在都记得，碰到很多事情绪非常稳定[脸红]
1676255664,14,61,False,False,我家就是绝对要吵起来。我和我妈妈都是很喜欢吃辣的，但是我爸爸只能吃一点点。有一次我妈妈煮火锅煮过头了，太辣了，除了火锅以外还有其他菜，我和妈妈本来吃的很开心，但是我爸爸就一直在发脾气。嘴巴就是一直不干净，骂我妈妈蠢，连个火锅都煮不好，然后还故意用勺子把那个火锅汤泼出来，泼到我妈妈脸上，我实在没忍住跟他吵起来了，好好一顿火锅最后谁也没吃成。
1676197880,10,364,False,False,梦都不敢这么做[保卫萝卜_哭哭]
1676205136,31,553,False,False,小时候是我爸和我妈吵架，现在是我爸妈还有我姐和我一起吵，像是这三种情况在我家来说一般都是我爸妈开始互相埋怨，然后我姐阴阳怪气的劝架并且含沙射影的骂我，然后我就开始吼别人
1676210145,16,277,False,False,"我妈（后面叫1）和我后爸（2）会这么说，1：你不看路啊！有导航你都不看，给你放着干什么用2：那不是你先告诉我说不走高速吗？那不是你的事吗？1：什么叫我的事，不是你开车吗？我就不乐意和你犟，你这样人就和你讲不了道理，还有我没说什么怎么还和我吵起来了，出门的时候让你检查有没有东西没拿，结果都快到我妈家了你才想起了，你说谁的责任2：什么叫做谁的责任，我那那么多东西少带一样两样的不行吗？你也不帮我想就知道说风凉话，我也不乐意和你说
后排的我：[辣眼睛]"
1676216818,2,47,False,False,我爸妈每次一起在车上就必吵架，因为我妈真的很喜欢指挥和指责，我爸从前还忍着，最近几年就不忍了，抱怨能不能别瞎指挥了，再骂就让她自己开，我爸肉眼可见的变暴躁。我妈就更气了，指责我爸应该怎么开为什么不听她的[呆]，然后吵一路，我不理解。。我也很讨厌自己在专注某件事的时候别人在旁边指手画脚，而且还通过这种鸡毛蒜皮的事来以小见大断定一个人的品性。可惜我妈一直是这样，她就是小孩子最怕的那种亲戚，什么都要打听，什么都要说教，热衷于把自己的意识强加给别人。
1676254736,3,26,False,False,"第一个我爸妈肯定就是调侃说几句，
第二个我妈要是没煮饭，我爸肯定去厨房下面条，哈哈哈哈哈
第三个我妈肯定骂我"
1676199702,11,101,False,False,我能做到心态平和，我妈不行。我能在她骂我的时候忍住，等她不骂了我再哭，在她面前哭只会被骂的更惨。
1676254957,0,12,False,False,完全相反的世界，论一家四口人变三口情绪更加不稳定的全家人
1676223962,11,274,False,False,"👨：“那条路那条路，哎哎……”
👩：“哎呀你不早说！”
👨：“让你看路看路，我也是服了。”
👩：“我倒回去。”
[思考]阎王：“你俩咋没得？”
👨：“走保险！”
👩：“抛开事实不谈，货车就没一点责任吗？”"
1676254847,3,7,False,False,我一直以为我是一个很包容很平和的人，直到遇见她，盲目自信，从不听劝，出错了或者没按她的想法做，就会大吵特吵，也不会管你的理由是否比她的更合适。越来越觉得累了。
1676254867,2,6,False,False,每一件事情我都不知道怎么回答。其实就是没经历过[委屈]
1676123266,0,19,False,False,很喜欢这种家庭氛围[大哭]
1676207049,2,23,False,False,"是谁小时候爸妈总吵架就学会看脸色了
是谁因为这个就算旁边有人在吵架自己心也会跟着怦怦的跳 跟着害怕 
是谁因为这个就算自己有很多委屈也不敢说怕成为吵架的导火索——“你看看这都是你惯的”  
是谁好不容易找到彼此都喜欢的恋人但是还一遍遍怀疑自己有什么好的值得人家喜欢[脱单doge]
是谁是谁这是谁呀我不说[撇嘴][撇嘴]"
1676191555,11,152,False,False,我父母情绪就不稳定，我从小就战战兢兢的，现在23了，清晰地意识到自己情绪也不稳定
1676447489,0,6,False,False,耽误飞机那个绝对不能忍！！！！前两个没问题，最后一个可以不骂，那应该教育，让她反思错误[生气]
1676268150,0,4,False,False,"这就是我爸妈!我爱他们![保卫萝卜_哭哭]
我爸爸总是说，办法总比困难多。管他的，玩了再说。放心吧！晚上，想吃烧烤，我和妈妈一起和爸爸说，他就买了两大袋子。有妈妈喜欢的魔芋，我喜欢的鱼排。[鼓掌]
我以为这都是平平常常的，但是，他们给了我他们自己没有过上的快乐童年，给了我有力的支持。我可以走的更远。[保卫萝卜_哇]"
1676217957,1,12,False,False,前两个我甚至可以理解，最后一个在我认知里不生气都不可能了[藏狐]
1676252403,0,12,False,False,"第一第二感觉比较正常。因为是无意的，稍不注意就流逝的。第三种真的很……
你提前已经了解约定的时间，且现在的地图APP都能大致告诉你需要多长时间赶路，但是你在知道这些的前提下就要磨蹭，拖延"
1676258709,1,24,False,False,完全是反向家庭的我，有幸在去朋友家玩的时候体验了这种氛围，真的超级放松，从来没有体验过的家庭氛围，我二十多年来第一次觉得结婚超级幸福，这种感觉仅仅到我真的回家的那一瞬而已
1676195272,1,77,False,False,第一个 会吵起来然后归于平静，第二个会让我自己喊出去买包子 第三个 骂死我
1676219772,0,8,False,False,……最后一个经历多了的后果就是教出一个任性自私没时间观念认为全世界都该让着她的公主
1676251431,1,10,False,False,可是最后一条不看时间化妆耽误事情，难道是对的吗[酸了]虽然我很羡慕这样的家长，但我觉得应该小小的责备一下，让她记住以后做事情要打出提前量，不是每一次都这么幸运能改签到合适的票。
1676205250,13,61,False,False,这是情绪稳定的问题吗，比如那个改签，一般家庭这一笔机票费是不小的支出的。换句话说你今天在外面丢了几千块钱，家长怎么可能不多说你两句？
1676254572,0,8,False,False,其他都还好，但是最后一个我不理解，她没啥时间观念的吗？
1676235390,1,8,False,False,开过高速口了，我家人一般就是“让我看看下个出口在哪 时间还多 不着急”，这种“这条路还没走过，正好看看沿途风景”有点扯[哦呼]
1676210061,0,13,False,False,是可以不富裕，但也得不穷。改签一张飞机票几百块就没了[无语]高速错过出口也得不少油费过路费。我家其实就是这个状态，但是毕业工作后才意识到只不过是父母的收入花的起罢了
1676253757,2,7,False,False,飞机改签不是有手续费嘛，时间观念还是很必要的，就算不生气我觉得还是要说两句[tv_腼腆]
1676467593,0,2,False,False,我们一家子最不稳定的就是情绪，甚至都没有他们俩的婚姻稳定[怪我咯]他俩的婚姻之所能稳定，全靠不稳定的情绪相互制衡
1676183890,1,14,False,False,我爸妈一直跟我说，成年人要学会管理自己的情绪，你要学会的是遇到问题解决问题而不是跟身边的人不停的抱怨。
1676225562,0,8,False,False,太空电梯2045年有可能实现，视频里这种2045年我家都不可能实现[微笑]，甚至我觉得我就算能结婚生孩子我自己都很难做到，原生家庭带来的影响真的永远不能消除
1676220581,0,6,False,False,第三个不行，准时，是负责任的行为。父母适当的责备我觉得也是正常的，情绪稳定的。
1676190486,0,14,False,False,这个视频里很多时候我心里都咯噔一下，现在回味一下突然有点难过[酸了]
1676223209,3,7,False,False,"这么说吧，一个情绪不稳定的家庭养不出一个情绪稳定的孩子[捂脸]
我特别容易因为我爸妈一点点小的举措就生气狂躁（仅对我爸妈特别没耐心，我也不知道原因），一旦情绪上来就砸东西，拿剪刀到处戳，把手边的东西砸得粉碎……因为我爸妈就是这样的[微笑]"
1676267492,1,3,False,False,压抑自己的情绪总是需要释放的你们不会不知道吧？这块容忍那块容忍，他总会需要释放的，如果对方不会帮他想到这些一味的想着对方应该容忍。迟早出问题，吵两句嘴不是什么说不得的东西。
1676268122,0,4,False,False,我觉得“暴怒”必定不可取，但是面对问题时，还是应该客观理性。做错了的事情还是要被指出被批评的，一味说好话只会让错误一遍一遍再犯，而犯错的人永远也无法进步。
1676199244,1,11,False,False,"“错过了，也开了导航的也不会帮我看看，又要绕远路了。”“哎呦，也不知道帮着看一下”“要不是刚刚那个谁谁谁打个电话过来……”“本来可以早点到的”“你说说，坐副驾驶也不帮忙看看”
“服了，饭唉？”“饭都没得咋个吃个”“我就说，谁谁谁靠不住”“我们光吃菜？”“咋个吃嘛”“蒸饭，菜都冷了”"
1676184568,0,11,False,False,我家：只要有一个人不开心，全家就得一起不开心，一件事做不好首先开始甩锅，其次出现一个事后诸葛亮开嘲讽，最后全家心态爆炸。
1676224295,1,5,False,False,第一个你第一次走错过了就错过了 第二个没做主食出去买倒还挺常见 最后一个不纯纯初生？
1676217228,0,5,False,False,前两个还不会怎么样，但不管是哪个家庭成员要是耽误了班次我们都会忍不住指责[笑哭][笑哭]毕竟是不守时了
1676251853,0,5,False,False,都会吵，但都是俺爸吵吵，我和我妈觉得无关紧要的事，他都会很不高兴，我和我妈很高兴的事，他都会干扫兴的事，之前小，觉得自己热情点懂点事积极点，我爸态度就能变好，后来我明白了，谁也不用惯着谁，他觉得冷暴力比教育孩子有用，言传身教，我也是这么觉得的，单只局限于我爸，我和除了他的所有人遇到事儿都会去积极解决，不是呼啸山庄，只是觉得，那么多年了，没啥必要了[捂脸][捂脸][生病]
1676391251,0,2,False,False,@zlllllw 我最爱看科幻片了
1676188619,0,9,False,False,[doge]我爹绝对暴怒……弄的我遇到事心平气和…就算生气还是要解决赶紧解决就好，不喜欢遇到事就抱怨责怪所有人不去想办法解决的
1676198201,0,10,False,False,擦。别的都能理解就是最后那个因为化妆错过航班的让人有点无语（）
1676211762,0,7,False,False,其实真正成为这样的人之后才会发现这不仅仅是情绪稳定，还要兼具自信心责任感以及强势，自身能量足够强才能镇住场子
1676197802,0,8,False,False,从小到大受家庭影响，我已经做不到心平气和的跟身边的人说话了，情绪很容易就会上来，冷静下来后想想又没必要，不过现在我已经控制的不错了，自己一个人不需要在乎身边的人的感受，爽死了
1676256292,0,3,False,False,为什么会成科幻片就是老一辈搭伙过日子的想法导致的。现在还老是催催催催，好想巴不得把人往火坑里推
1676222679,0,5,False,False,第一个我真的深有体会，我男朋友送我去做实验，回来的时候我看导航看错了，没下高速，我们就只能绕路，我从小就是在这种做错事会被责备的环境下长大，我当时非常自责，都快哭了，怕他说我，可是他一句话都没说，反而安慰我，我们可以在下一个口出去就可以了，只要不耽误我实验，没关系的。有时候我真的觉得自己很幸运，可以有一个人来治愈我的童年
1676201225,0,8,False,False,玛德，宁愿相信我会打败钢铁侠[大哭]
1676209601,0,6,False,False,如果是化妆错过，我会很生气，因为这是可以避免的。我干嘛都会提前做好准备的，
1676138239,0,8,False,False,这对我而言已经不是科幻片了...对我而言这是我前世二舅姥爷的二d钙奶片
1676205675,1,7,False,False,我家里就经常吵来吵去的，虽然说感情还行，但是无论大小事，我爸妈总要说两句别人才感觉心里舒服一样，所以我的情绪在外比较稳定，一回到家就极度不稳定！！特别不耐烦不想接触别人，虽然知道这不好，但是我还是控制不住的暴躁，唉，要是我小的时候大人肯像视频这样，我感觉我也不至于性格这么烂
1676200303,0,8,False,False,笑死我家不可能稳定 我妈一遇到事就大吼大叫有时候会把人吓一跳 这也导致我和她吵架也是这样
1676220250,0,5,False,False,"怎么说呢，是不是关系太近的话，真的就容易发脾气呢[难过]
大家不妨把人物换一下，如果把家人换成同事同学之类的，大部分人都能做到视频里的反应。只是一旦变成了家人，就容易吵架[难过]"
1676209507,1,6,False,False,我爸开车送我去上大学，然后走错路了，冲我发脾气骂我，顺带把我妈也说了一顿，导致我大学入学第一天就不高兴[难过]心里也留下疙瘩
1676222914,0,4,False,False,前两个还好 第三个肯定会被骂的 （自己也很不喜欢磨磨唧唧的人 所以会提前准备好）
1676181870,2,7,False,False,好羡慕啊，父母情绪不稳定，长大后发现，我跟他们越来越像，完全不敢生孩子，怕下一代也是这样
1676217892,2,5,False,False,"一：爸爸发火生气埋怨然后我和妈妈不敢说话
二：爸爸埋怨妈妈，母亲不敢说话，我和父亲吵起来
三：被骂，回家，不出去旅游了
这才是正常的啊，感觉"
1676216065,0,4,False,False,"细想了一下 最后一种我还是忍不了
前面的都是粗心的失误，哈哈一笑就过去了。
最后那个化妆耽误时间这就是单纯地没时间观念，化妆久没问题，那你为什么不预留出足够的时间来呢？ 旅游计划又不是十一点出发九点钟才告诉你"
1676201741,0,7,False,False,"下错高速口
开车的我爸：（麻了）
副驾驶我妈：你要挑战自己有没有在全新道路开回老家的运气吗
后排的我：开睡！"
1676138602,1,6,False,False,很幸运，我确实出生在这种家庭
1676209823,1,6,False,False,"我家:【家庭成员犯了一个错误】
其他人:大声嘲笑他，笑完以后再吵"
1676226502,0,4,False,False,真的建议日常情绪不稳定的夫妻先不要生孩子，过年那段时间，走亲戚的时候不小心把红包弄丢了，大概可能只有七、八十块钱左右（广东人），跟妈妈说，她当着一群亲戚的面前大声的骂我，戳我的额头，让我一个人晚上十一点多在马路上找，我一边打着电筒找，一边哭，到最后也没有找到，真的很难过很难过。
1676190473,0,6,False,False,我妈有一点小事就疯了，恨不得家里人都没了
1676196617,3,6,False,False,Md 第二个很感触 我妈每次因为一点小事就和我爸吵 太烦了[大哭]
1676214463,1,4,False,False,第一个我家基本上就是父母相互调侃，第二个多半就不吃主食了，第三个我家还没遇到过，乘飞机高铁什么的都至少提前一个小时到
1676251788,0,4,False,False,我和老公好像就是这样，因为别人问我俩平时吵架不，我还在想对啊我俩怎么不吵架的，现在看起来可能是很多小事都直接奔着怎么解决去了，吵架埋怨解决不了任何事情
1676249732,0,3,False,False,朋友们，下一代的美好生长环境由我们创造
1676252464,0,3,False,False,第一种情况的话，我家大概是，过了，我爸：‘没事，到下一个下，哪不都能下。’【年纪大了，要面子，给自己找补一下。但现实是这种过了的情况，不会发生在我爸身上】如果换别人开车，我爸大概会：‘告诉你下，你就要提前靠过去，blabla。’这个时候，如果我开车，我会跟他喊回去：‘我没看到，你凶什么’之类的。我爸就会说的态度语气不好。然后就过去了。[但我开车，我爸不放心，他肯定坐副驾看着，所以也不太会发生[笑哭]]如果发生在我妈身上，我爸肯定也会说两句，然后说往前继续走吧，到下个地方下。不过，我爸本身就是个傲娇又直男的中年胖大叔。平时和我互损对方身材，被我揍（闹着玩的那种）也会嘻嘻笑。我妈就吐槽他是受虐狂。[笑哭][笑哭][笑哭]
1676218957,0,3,False,False,可是最后那个真的很气人啊[辣眼睛]
1676252125,1,3,False,False,这其实是松弛感，就是什么事情都不用紧张，无所谓的态度
1676210153,2,4,False,False,我想问一下，真的有这样的家吗[囧][囧]
1676229472,0,3,False,False,我家就是这样哎嘿嘿，虽然他们没有那么相敬如宾[脱单doge]，平时更多是小学鸡式拌嘴打闹。
1676210590,0,5,False,False,我爸妈刚吵完[藏狐]，吵架原因是因为我爸觉得我妈开车开的不好。我以前情绪很不稳，发脾气歇斯底里那种，后来我慢慢发现其实我自己得学会控制情绪，做一个平稳情绪的人，这种心理暗示很有用[OK]，虽然这个矫正过程不顺畅，得罪了很多人，但是我现在有慢慢变得稳定了，我的朋友也开始变多了[兔年]。比起环境，有的时候个人的自省也很重要哦[给心心]
1676217814,0,3,False,False,虽然我家一直都吵吵闹闹，不是这样的模范家庭，但他们依旧把我教育的很好，包含了很多爱，也很感激我的爸妈[鼓掌]
1676208794,0,5,False,False,我姐当时刚学出驾照来不太敢开，她开车的时候我爸妈就一直在边上指挥嚷嚷她开的不对，所以她一直很抵触开车，但是她很喜欢带我出去，因为我很佛系[笑哭]，我姐姐倒车入库停不下车后边人催或者走错路了我都是帮她想办法，如果是我爸妈早骂起来了
1676229960,0,3,False,False,我很奇怪[笑哭]我从小到大我爸总会在节假日和我的生日和家里人吵架，没有东西吵也要找理由吵，比如为什么我要在桌子上放两本书，为什么我妈要开客厅的灯没开餐厅灯之类摸不着头脑的理由在家里暴跳如雷。我现在脾气也很暴躁，但是并不会找理由吵架，却学不会心平气和大多数时间都在生闷气，只有和我无关的人我才不会浪费我的情绪，我也希望能好好修身养性，这当是我的新年愿望吧。[鼓掌]
1676191155,0,5,False,False,家庭是我们无法选择的，不管是好的还是坏的我们都必须努力适应接受，最主要是要学会判断什么是好的什么是正常的什么是需要改变的家庭关系
1676203201,0,5,False,False,羡慕这种，我明明没做错什么就要天天挨骂...同学都说我很乖为什么会被骂...就是父母爱计较小事呗
1676200152,3,5,False,False,前两个都可以理解，最后一个反正我会生气，化妆归化妆，让所有人等你还没赶上真的有点烦
1676189126,0,5,False,False,比看谈恋爱还科幻……
1676144218,0,24,False,False,我妈只会拼命催我，还觉得化妆是为了给别人看的[灵魂出窍]
1676213684,1,3,False,False,不可能！绝对不可能！！！！！！这是一定是科幻片！从第一个开始我爸妈已经开始暴怒了各种脏话就已经喷出来了[微笑][微笑][微笑][微笑][微笑][微笑]
1676134699,1,5,False,False,和我家完全相反，我现在在朝着视频里的方向努力，逐渐变成一个情绪稳定的人，不要变成自己最熟悉最讨厌的样子
1676188210,1,5,False,False,我去，根本想象不到啊……这三条…我爸都会暴怒
1676175137,1,12,False,False,好羡慕啊，最后一幕如果是我爸，他肯定会骂我不争气还拖后腿[保卫萝卜_哭哭]
1676211375,0,6,False,False,前两个我家必吵，我爸我妈已经在我脑海里全自动吵起来了，已经开始烦躁了
1676285905,0,3,False,False,高速路那个，我上小学的时候真的发生过一次，不过爸妈都在哈哈哈就过去了，赶高铁我跟我妈有次还错过两次高铁(第一趟时间没赶上，第二趟我在打游戏都没注意然后就又错过了)，我妈也是在笑着怪我，最后我们还在拿这个来开玩笑
1676195856,2,5,False,False,我就是这种人，但我爸我妈不是，我爸会出了事就把错全推到别人身上然后乱发脾气，我妈是一点就爆，啥小的事情我觉得也没啥的，但她瞬间就暴怒。我也不知道我在这个家里咋会心态那么平和的
1676187933,0,3,False,False,这就是童话吧[星星眼]
1676210339,0,4,False,False,我妈有一次也是没按煮饭键，我们知道的时候一直在笑，然后去附近快餐店买了几盒白米饭回来。一般这种事情，我们家没人会生气的，然后说几句话调侃失误的那一方。
1676211479,0,6,False,False,我家长真的，，，我泡衣服，我没晒衣服都要被骂，有的时候开玩笑开着开着就要骂人，打不到人就收手机砸东西，，，现在我看到别人语气稍微不好一点我都害怕。。。
1676310327,0,2,False,False,与其说是科幻，不如说是神话。可望而不可及。
1676191501,0,5,False,False,"科幻片。。。
不过放心，我以后大概会成为这样的父母"
1676391099,0,1,False,False,这是我10岁前的家庭氛围，自从那次发生意外，再醒来发现父母和以前不一样了，虽然长得一样，但是确实感觉到了平行世界，宠我的大姐和经常和我吵架的二哥都从没出现过这个世界，我成了独生子女。
1676221327,0,2,False,False,"第一个第二个一样。
第三个我觉得会被骂的，啊啊啊啊啊"
1676310136,0,2,False,False,太理想了，人有情绪也是很正常的，也不要把情绪妖魔化了，小吵小闹也可以促进感情的
1676390069,0,1,False,False,"我妈：忘记煮米了
我：刚好减肥
我爸：？？？（被迫减肥"
1676209435,0,5,False,False,由此可见，自己都不成熟你怎么敢结婚并养育一个新生命的[藏狐]
1676197820,0,4,False,False,这上辈子绝对拯救世界
1676247797,0,3,False,False,大概我家的沟通方式就是吵架，没有问题能平和的交流，第一句话出口就是指责，随即开始大吵。导致我现在只要听到有人高声说话头就懵
1676194741,0,4,False,False,跟我家完全相反，我现在23了，一直很怕自己做错什么事，就算无意的失误或者只是个人习惯无关对错的事也会迎来劈头盖脸的指责和教导[笑哭]
1676183793,0,4,False,False,我家在山区，弯路特别多，所以第一种情况我们家经常遇见，然后就开始嘲笑开车的人，大家都狠快乐[doge][doge]
1676266514,0,2,False,False,刚看完沈教授的“情绪价值”视频，你这个视频大多评论都说是“科幻片”，或者“做梦都不敢这么想”，确实，过于理想，正因你一人饰演三角，才察觉不出来另外两个人只是只服务于你的想法，或者说他们是你的影子而不是独立的个体，这种情况在现实里是不存在的。不过也有可取之处，虽然幻想很美好，但我们遇到不可挽救的情况时需要控制自己的情绪，不应该着重当下复盘而应该想办法及时补救
1676481105,0,1,False,False,有人看笑话 有人照镜子，还好这个视频我是照镜子的[妙啊]
