上传时间,回复数,点赞数,up是否回复,up是否点赞,评论文本
1676341135,0,2,False,False,我就是那种情绪特别稳定的人，不以物喜，不以己悲。而且因为是长子，所以每次家里爸妈吵架，都是我来沟通调节，我爸妈也听我话。对于我来说，错误已经产生了，与其去互相责备，不如一起想想怎么去改正，我不喜欢责备或者被责备的感觉。也正是因为这种性格，所以生活中很多朋友会找我倾诉觉得我可靠。希望你们也能遇到这样的人
1676270496,0,2,False,False,临近爆发点真的恐怖，从小耳濡目染的学了很多家里人的坏脾气，一点不顺心就会发火。幸好还有纠正的机会kkkkk
1676269456,1,2,False,False,虽然我家没有这样的氛围，但我在努力把自己变成这样情绪稳定的人
1676375348,0,1,False,False,就算有脾气也很正常，大家也要接受自己的情绪吧，生气懊恼也都可以，我觉得不要太过把小事闹大一起找解决办法就已经做的很好了，朝视频方向努力就行了
1676190352,0,4,False,False,我爸爸很反感我妈在家处理工作的事，导致我小时候一听到我妈铃声响了心都提起来了
1676291764,1,2,False,False,"靠。。科幻片吧这是
我的家人自从我满五岁开始就没有让我觉得安心过了
不想组建家庭的原因是因为我怕像我这样恶[爱心]的基因会成功传下去我明明不想变得像他们那样
为什么我还是。。（大悲）

为什么我活在那种家庭里。。。
每次看到这种像做梦一样的场景都嫉妒的相思近几年越来越暴躁
感觉没人关心
莫名有一种想杀了所有人的钝感因为在现实生活中什么都没有得到过所以在网上撒泼是吗

主页可以看到我在其他视频的评论

我想变得友好"
1676179228,0,4,False,False,"我妈活成了她讨厌的我外婆的样子
我又活成了我讨厌的我妈的样子
脾气暴躁，大吼大叫[捂脸]"
1676291967,0,2,False,False,[大哭]疫情期间我妹妹去隔壁市上大学我们都是自己车接车送，明明已经走了五个来回，每次都会错过高速出口/开错分流匝道/错上高架，每一次，都已经习惯了[大哭]昨天去送的时候我按照之前的习惯准备过了隧道变去最右边车道下高速，结果发现它不知道为什么从隧道口到匝道一两公里跟最右侧车道之间全变成导流线了（长得像导流线但是这么长我觉得应该不是，可是我不敢赌），上次年前来的时候那边还在施工，地上没有那么多线，我不敢压导流线啊，只能继续开[大哭]缺德导航这个时候怎么不提醒我在隧道之前先变到最右边车道你个缺德导航
1676191558,0,4,False,False,我爸开错路，我妈忘做米饭时的氛围和视频差不多，但是如果是因为我耽误飞机火车啥的，必不可能是视频里那样[doge]
1676361868,1,1,False,False,这是什么奇幻片[doge]赶紧查下祖孙三代是不是简中家庭
1676273459,1,4,False,False,原来这样子的是情绪稳定啊，虽然一直都知道情绪稳定很重要，还以为是没什么情绪哈哈，那我应该挺稳定的，自己本身就毛手毛脚，走错一个路口也没关系，但会马上推卸责任，很早就发现自己的这个毛病，估计很难改了
1676177073,0,4,False,False,家庭和睦的孩子真的不一样，跟他们对比起来我就有很多缺陷[大哭]
1676261922,0,2,False,False,这个真的很像以前写的假大空作文[笑哭]不会责怪是真的，很少人会说看看没看过的风景，我们更多是想解决方案，例如前面拐一下弯就可以了
1676210536,1,3,False,False,我就是这样对我男朋友的，但是我们还是分手了
1676278039,0,2,False,False,开了几个小时，因为失误又要多开一个小时，不暴躁是不可能的。
1676288360,0,2,False,False,稳定的情绪就是不会互相责怪，爸爸不会责怪妈妈为什么没有注意导航，妈妈不会责怪爸爸开错路，这样的家庭环境真好。
1676210083,0,3,False,False,前两个无所谓，最后一个一定要骂，机票巨贵的好咩
1676285815,0,2,False,False,"1。诶呦我tm就知道你得走过，说多少遍记不住。
那你来开！旁边bb个没完，我不开了！你来开吧！
2。诶呀。忘记煮饭了。
忘记煮饭咱们吃啥？不是我纳闷了煮饭怎么还能忘呢？
我天天一堆事我忘了怎么了？！你天天在这儿等吃的不嫌累。
行那咱都别吃了！反正也没做！咱家晚上都喝西北风吧！
3。我都跟你说了让你快点让你快点！天天打扮你那个脸给谁看啊！有那功夫你不多看两本书在那儿涂来涂去的能涂出花来啊！这下谁也不用去了，回家呆着吧！"
1676260612,1,2,False,False,如果是第一个，我：woc，nb，下一条路在哪
1676288491,2,2,False,False,从小因为各种屁大点事挨骂以及莫名其妙背锅挨骂导致我长大后很长一段时间内，不小心做错了点事都要马上看我妈脸色，即便是吃饭的时候筷子不小心掉了我妈都能从我上学不认真骂到我以后工作不成功，艹
1676254682,0,2,False,False,但凡我爹有这里十分之一的水平
1676207545,0,3,False,False,前两个都很正常，第三个我的话可能会有点生气
1676208923,0,3,False,False,好羡慕。。我爸从我有记忆开始就是脾气很暴躁动不动对我妈生气的那种 导致我长大了和他说话很少很少 在家里像陌生人一样[贝拉个性装扮2.0_拉手摧花]
1676272805,0,2,False,False,我没有家，我和我妈一个月800，出去玩？还是做梦吧，我爸就是这样的，给我和我妈800，然后又说对我们很好，蚌埠住了哈哈哈
1676210376,1,3,False,False,我家就是这样，前些天我妈熬地瓜粥只放了几块地瓜没放米，大家一起喝地瓜水，我22岁长这么大没见过爸妈吵架。
1676256479,0,2,False,False,这才是正常人的家庭[doge]
1676462282,0,1,False,False,一二可以 第三不行 这是时间原则性问题
1676393068,0,1,False,False,要是我家，早就我爸单方面疯狂输出了
1676271487,0,2,False,False,这个假期有一天我煮饭忘记按开关了，然后我妈平时就很暴躁，但是那天没骂我只觉得好笑，当时觉得好开心啊
1676208928,0,3,False,False,我家就是这样，遇到这种事通常是大家一起大笑哈哈哈哈[保卫萝卜_哇]
1676403759,0,1,False,False,世界上真的有这样的家庭吗[微笑]
1676194546,0,4,False,False,假的，都是假的，根本没有这样的，不羡慕，一点也不
1676393654,0,1,False,False,这是假的吧？真的也不会发生在我身上
1676271910,0,2,False,False,出矛盾最怕的就是都只点火不灭火，3个人里哪怕有一个选择灭火，都还有控制的可能，一旦开始互相计较因果得失说气话就完了
1676216649,0,2,False,False,刘慈欣：三体还是太保守了
1676299143,1,1,False,False,@今天真快乐呀 我要做这样的人
1676196888,0,3,False,False,因为除了家人还有很多其他的社会关系的，不是所有人都可以这样，你会有自然的反应
1676275047,1,2,False,False,这是什么科幻片啊啊啊啊我好痛苦[热]说实话我在外面这类情况对朋友都不会生气的，情绪很稳定。但和爸妈在一起就没办法，他们会先开始发脾气然后把我也带得很暴躁[热]
1676224990,0,2,False,False,大多数中国家庭，懂得都懂
1676188760,0,6,False,False,科幻片，我家鸡毛蒜皮的事他都能骂起来
1676187249,0,3,False,False,有记忆起就没一家人一起出去玩过，每次就我妈带我出去，有时候还会被我爸甩脸子[笑哭][笑哭]
1676187402,0,3,False,False,幸好 我家就是这种状态 我摆大烂
1676306371,0,1,False,False,@你干嘛--哈哈-哎呦 要这样相处
1676222433,0,2,False,False,不，只有白眼跟冷暴力和争吵
1676280563,0,1,False,False,"争吵次数（含动手，辱骂，毁物）
310+天×10+ 年（记事以来）
入赘，和姥爷一起住。
结果不是很好。家里一精神病，我也曾经抑郁过
为了治病掏空积蓄，也无法根治。
结婚，找对人比什么都重要。"
1676214030,0,2,False,False,我爸妈就是这样！！呜呜呜呜好爱他们
1676387582,0,1,False,False,不懂就问，这是科幻片吗[酸了]
1676250016,2,2,False,False,改变从你我这代开始，我们有一定的文化思想素养奠基。当有自己的家庭，伴侣孩子之后，就看你和ta如何共同经营这个家啦！，还是要唠叨一句，犯了错误当下的抱怨是不用的，事后的反思教育要给到，这是进步滴！
1676221468,0,2,False,False,第二个还算常见吧 但是第一个和第三个属于必要吵一架 第一个发生在我家 就是我妈骂我爸不会开车 我爸说要不你来开？ 然后就吵起来了 我可能会说一句你们能不能别吵 然后就变成他俩一起骂我[微笑]第三个 就会是我被骂一顿 然后行程取消[微笑]
1676250413,0,2,False,False,真的会有，虽然有时我的妈妈会很凶，但是我真的能感觉到我爸爸妈妈很恩爱，尽管他们会被生活中的繁琐的事情给包围，有时会恼火，不太会表达(有着中国人骨子里的温柔很含蓄)，需要你从一些生活中细节感受。如果有人问我我以后要嫁什么样的人，我还是会说:像我爸一样的人
1676253878,0,2,False,False,我们不可能做到永远情绪稳定，毕竟我们是人，但是我们要尽力做到自己最大程度的情绪稳定。我算情绪稳定的了，但是有的时候还是会爆炸，唉……
1676227745,0,2,False,False,"第一个我印象里好像没有
第二个真的深有体会我爸妈发现没煮饭只会开心的大笑哈哈哈哈然后继续煮饭，先开心吃菜！真的完全不会责怪！
第三个也没体会我家都还蛮准时的基本上从来没有出门迟到一说"
1676218901,0,2,False,False,"1.我妈：你就不能看着点吗？我不说就不知道走啊！然后吵起来相互推卸责任
2.我爸会疯狂贬低我妈然后我妈唠唠叨叨把饭做上
3.这不用说了，哪怕时间充裕改签不要钱也会骂的我狗血淋头往后的整个旅途甚至回家之后都会时不时说我两句"
1676217314,0,2,False,False,真羡慕，这些情况要在我们家不知道得吵多少天，甚至是之后时不时还会翻旧账拿出来吵架的点[笑哭]有时候家里明明我觉得很多都是小事，可以说说笑笑就过去了，可是他们就非得你来我往刺几句，搞得气氛一下子就不好了，我现在一想到一家人一起出门玩第一反应是抗拒，所以从小到大家里气氛好的时刻我都很珍惜，甚至能记很久很久，靠着为数不多的美好回忆治愈自己。不过我现在也不强求了，可能就是我的命吧，命里和这种家庭氛围无缘[捂眼]
1676216520,0,2,False,False,第一种第二种我家都还好，一般是我急，我爸妈无所谓ㅍ_ㅍ，第三种是绝对不可能的，因为我们家里人一般有约定的聚会或者出发的航班，车次都要提前一到两小时到地方，不然会很不安[保卫萝卜_哭哭]
1676237753,0,2,False,False,[酸了]开车回奶奶家，我爸开的，我和我妈在后面聊天，开到一个高架桥本来应该往下面走，他往上走了，他骂我和我妈聊天影响他开车[大哭]回你妈妈家你都不会开吗，奶奶家离我们家开车也就半个小时，也不是很久才回去一次，怎么开错了还骂我们聊天[大哭]而且上高架桥多绕几分钟也就能回奶奶家了。。。我自己情绪也不完全稳定，，，下辈子一定（）
1676224636,0,2,False,False,我爸妈开车吵架，我都会在后排喊这路上车多别吵架我怕死，然后他们就都不好开口了[妙啊]
1676213506,1,2,False,False,做一个情绪稳定的成年人，坚决不让自己的孩子重复自己的童年
1676215149,0,2,False,False,我家就是两个被年龄撑大的小孩组成的家庭
1676213368,1,2,False,False,也许对别的家庭来说是很平常的事，但是对我家来说真的是科幻片。[大哭][大哭][大哭]
1676182988,1,2,False,False,很喜欢这个题材，很温馨。
1676215065,0,2,False,False,先走情绪稳定的人，才有情绪稳定的家庭。而且情绪稳定是可以互相感染的。
1676228268,1,2,False,False,第二个！有次去同学家吃饭同学妈妈没煮饭  同学爸爸一点责怪都没有  耐心哄了自责的妈妈安慰饿着肚子的我和同学  他们家的家庭氛围真的太好了！
1676139153,0,5,False,False,科幻片。。羡慕
1676226790,0,2,False,False,我爸妈一点小事儿就天天吵架，天天吵架。每次他们一吵架我就觉得很烦，巨烦。小时候他们打架还误伤到我，从那个时候开始我对婚姻就有一种莫名的恐惧感和抗拒感。
1676199200,0,2,False,False,看评论才发现原来这不是大部分家庭的氛围吗…
1676375628,0,0,False,False,"第一种情况我家应该是都笑一下，说怎么老是这么迷糊，然后看下一个路口
第二种我家是开玩笑的说，怎么我地位这么低连饭都不能吃了，然后一起煮面或者饺子加餐
第三种，我家没出去旅游过，而且我家都是急性子，无论做啥都会提前，没碰到过"
1676179025,0,2,False,False,太科幻了
1676123799,0,2,False,False,和我家完全相反[大哭]
1676394815,0,0,False,False,之前一直不知道什么叫情绪稳定，现在一看我自己就是情绪稳定那种人
1676212228,0,3,False,False,我刚刚被骂完就刷到这个视频了草[妙啊]
1676207680,0,2,False,False,这是我梦想的家庭环境[大哭]
1676209090,0,2,False,False,[大哭]世界上真的有这种家庭吗
1676212382,0,2,False,False,开错了不会和我妈吵，会和我吵[无语]
1676230914,0,1,False,False,呜呜呜呜怎么会看的想哭呢？可能是所有的片段都只经历了前半段吧。[大哭][无语]
1676389093,0,0,False,False,我家的话，第一个真的会吵架，第二个无所谓，第三个会骂我两句，但也不会怎样，不过第三个不会出现在我家，我爸妈会爸出门时间留的充裕到我起不来[藏狐]
1676207586,1,2,False,False,很羡慕，我爸妈天天吵架骂人摔东西
1676206221,0,2,False,False,啊……看了这个视频我第一次意识到为什么我在家的时候开心不起来……我小时候总是很自豪地跟朋友说我爸妈不吵架，确实他们很少很激烈地吵，但是平常总是互相顶嘴，在我面前贬低对方，一件小事上的意见不同最后都会变成互相冷嘲热讽……唉
1676213123,0,2,False,False,真的好害怕和我爸妈一起旅游，我小时候和他们每一次旅游都是从头到尾都是吵架和被骂，关键有时候并不是我的错却分给我承担，我哭的时候旅团别的人就会跟我说“别再惹爸妈生气了，懂事一点”，当时真的觉得自己好孤单[委屈]
1676207002,0,2,False,False,艹，我终于理解了那些看正常爱情视频的时候说“科幻片”的人的心情了[保卫萝卜_哭哭][保卫萝卜_哭哭][保卫萝卜_哭哭][保卫萝卜_哭哭]
1676428110,0,0,False,False,第一个真的是我前天一家去旅游发生一模一样的事，高德地图完全不提醒导致走多好多路，然后第一个生气的是我，我一直在抱怨浪费时间浪费油钱。害
1676455173,0,0,False,False,我想要一个情绪稳定的家庭，但是我更想要的是一个健全的家庭[鼓掌]
1676387094,1,1,False,False,他妈的。。好羡慕。。已经有心理阴影了，尊滴很恐怖，就觉得屁大点事就能争论个半天，我觉得好压抑。导致我看我姐和我姐夫相处方式我都觉得好恐怖，我姐说他们这正常。但是在我这里就觉得是在吵架一样。可能是因为家庭环境所以玻璃心吧。。
1676209605,0,2,False,False,这是我家!!!!（ 拍拍胸脯 ）
1676450787,0,0,False,False,很羡慕，但我已经潜移默化变成了我爸妈的缩影，一点小事立马开始急躁，想成为这样情绪稳定的人，但是又会抱怨，所以自己配不上[酸了]
1676456441,0,0,False,False,感觉自己好幸运，我真的就是这么长大的[大哭][大哭][大哭]
1676461629,0,0,False,False,好羡慕呀 我爸妈都是急脾气……我爸表现在会在有问题的时候用词比较不好（比如我春考成绩太差很颓 备考春考面试有点懈怠 说教我骂我都是应该的 但是用词是真的难听 直接骂我不知羞耻 私以为当时我罪不至此[原神_躺平]） 而小时候会因为我做作业不专心玩东西打我（我记得最厉害的一次是我六年级在做作业的时候玩圆规 他进来一手提溜我一手拿把尺就开始抽 俩胳膊乌青块 搞得我夏天只能穿一个多礼拜的长袖校服[原神_哭哭] ）且讨厌被质疑甚至纠错（普通的二甲压线人纠正我爸的沪普 甚至搬出百度上权威的读音佐证 他都嘴硬说百度也不一定对）；我妈就是单纯的脾气急 虽然本质上没什么错 但是真的太急了……我至今记得有一次提着个纸盒装的橙子过马路 纸盒突然穿了 橙子滚了一地  我妈回过头第一反应就是骂我[原神_躺平]
1676390429,0,0,False,False,真的羡慕啊，我帮我妈打印一份资料，少印了一一份我妈骂了我十分钟，一下子就不想考驾照了，当司机我要是开错了路还不得被骂死[大哭]
1676437686,0,0,False,False,。。。我爸妈是这样的但我不是，感觉我好像集中了全家的不稳定情绪一样，好怪。。。
1676213102,0,2,False,False,"像第一个这种情况，我爸也不会抱怨，只会安慰我妈
第二个情况，我妈就会从冰箱里找点其他吃的当主食（我家常备塑封食品）
第三个情况，目前还没遇到过。感觉我家氛围算比较好的了[doge]"
1676397526,0,0,False,False,我天，以前回老家，时间有点久了，我爸记不住回老家的路了，走错路就得多走几十几百公里，他说，要一家人撞死？？？？小时候我吓死了。现在也一样，自己没用把错怪其他人身上。就在昨天家里有老鼠，他看到老鼠跑到那个地方，把我家猫带去抓，老鼠不见了。结果我爸说我和我妈两个没用？？？牛批，自己那么厉害怎么没抓到？？真的恶心，我回房的时候，边走边骂他。[藏狐]
1676460546,0,0,False,False,第二个前两天刚发生过，但是这算啥事啊，我妈做饭哎，别说是忘了，不做我们也没资格说，只有她有资格说自己忘了做饭，毕竟这又不是她的义务
1676389271,0,0,False,False,我爸妈之前遇事也是容易吵架，后来我尝试自己先稳定情绪，关键时刻我做那个安抚情绪的人，我们家的氛围也变得很开心很和谐诶，不过也要谢谢爸爸妈妈能听进去我说的话。
1676363489,0,0,False,False,我靠“我们女儿的美也很重要啊”给我整哭了[大哭]
1676390017,0,0,False,False,突然发现我好幸福啊，第二种会去买饼吃，第三种会被数落一句慢然后就没什么事了[保卫萝卜_哭哭][保卫萝卜_哭哭]
1676390627,0,0,False,False,完了，现在异世界系列都出家庭片了吗[大哭][脱单doge]
1676476235,1,0,False,False,男友家没有吵架，没有抱怨，没有拌嘴，每次去他家吃饭他家都说吃不完就不吃，不然对胃不好，每次吃完饭他们一家人都会围在一起聊天一两个小时，每每想到这个都会有触动，因为我吃饱有剩饭会被我妈说，即使她知道我小时候就有胃炎也会很不高兴，有剩饭的时候谁帮我盛饭谁遭殃，也就导致最后我妹对我很有意见。
1676375219,0,0,False,False,关于第一条开车的，我家年前刚出门玩，我爸不会用导航，我妈间歇性分不清左右，我躺在后排呼呼大睡，一路也算快快乐乐地去云南兜了一圈回来咯。真的很羡慕我爸妈的相处状态，我反正就是觉得，如果以后我对象和我达不到这种程度的话那我就要一个人漂漂亮亮生活，不好的对象只会拉低生活质量。
1676421312,0,0,False,False,我只是想说，我家就是这样，所以我也是情绪稳定，感恩父母给的环境，以后希望能遇到情绪稳定的他……
1676389741,0,0,False,False,或许你的父母不是视频那样，但感觉在座的各位，以后我们当家长之后，一定会会如同视频那样，因为自己淋过雨，总想为别人撑伞，[请吃红小豆吧！_wow]
1676375015,0,0,False,False,我爸勉强还算温和，遇到事起码不会第一时间就生气，我妈真的，今天我在她面前抖了腿（我真的控制不住[大哭]）她冲上来就打了一拳我的腿，然后骂我没教养，说一个女孩子怎么能抖腿呢……不能就不能，你骂我打我是干什么，感觉她从来都不能好好说话，每次说个什么事，我只要和她意见不合，语气无论是好还是坏，都会变成我顶嘴，我不孝，我白眼狼……
1676467298,0,0,False,False,我是这种情绪稳定的人很幸运找了个对象也是情绪稳定的人
1676420138,0,0,False,False,那我还挺幸福的，遇到这些事家里人就会一起笑，没有人指责也不需要道歉
1676392016,1,1,False,False,第三个我也忍不了[笑哭]
1676374418,0,0,False,False,哈哈哈，记得高速有一条路，是个弧型的，爷爷开车走错了五次，前两次大家都挺无语的，后来笑的一次比一次开心[脱单doge]可惜我家是尊老型的，爷爷奶奶不在了之后，我家天天吵架，其实都是些小事，就看做错了之后某个人的评价了，有些人就能一笑了之，让大家都能有好心情，有些人就非得酸几句，搞得当事人也委屈，这种节骨眼上最容易发火了，现在我爸妈做错什么事我都不敢让他俩先说，都是我先开个玩笑打个哈哈过去的，要不他们真能吵起来[脱单doge]
1676374750,0,0,False,False,害怕吵架真的很真实，从小爸妈就经常在我面前闹不和，最后还说都是因为我，说什么这个家散了都是怪我，初次听会很难受，想让朋友帮我买把刀，后来听麻木了，手臂上的伤痕也多了[热]
1676398031,0,0,False,False,我在b站看科幻片
1676390050,0,0,False,False,第一种情况的话，我们家跟这也差不多，只不过我坐后排座完全不担心，只会跟我爸开玩笑哈哈哈
1676207025,0,2,False,False,好，从第一件事吵到这以后一件事，然后再扯一扯我的学习，这就是我的家。
1676395832,0,0,False,False,昨天中午热饭，后面跑一边去了，没注意把锅给烧穿了…主要是应该转小火的…就很慌，晚上回来和我妈坦白，我妈就很淡定要我把锅扔了，她还有点笑着和我说以为我要要骂你啊…和她待着就会舒服些，我爸就总是在指责教育我，连洗澡晚了都要总是说…
1676406847,0,0,False,False,在我的小时候，我做“不让人省心的事”第一时间就会被骂，现在长大，我尝试着在类似情况下去安慰、肯定别人，也是对自己的慰藉
1676183973,0,2,False,False,做梦都不敢做这样的[酸了]
1676401908,0,0,False,False,"都遇见过差不多的，第一个我爸开过头了，他会自己懊恼，然后我们都笑他，反正没有红过脸
第二个忘了煮饭，都是我的锅，铁定指着我说[笑哭]
第三个没误过点，倒是买成前一天的火车票了，不过我爸妈也是都说没关系[脱单doge]"
1676476028,0,0,False,False,第一个真的是科幻片 那种时候必吵一架然后我在后排哭[辣眼睛]
1676397649,0,0,False,False,好羡慕这样的家庭[保卫萝卜_哭哭]真好啊，是我爸就已经开骂了。更难过的是有时候会发现自己开始变得像他[保卫萝卜_哭哭][保卫萝卜_哭哭]
1676401191,0,0,False,False,"我家…和这个挺像的吧，只不过会更欢脱一点，开过了会调侃开车的的人，忘了做饭会一起出去吃或者订饭…
其实我家以前也鸡飞狗跳，但在我得了病之后爸爸妈妈都在很努力的为我改变，我知道他们爱我，所以我也不会怨他们以前做错的事
翻看了好多评论…其实心里有点堵，我做不到什么，我帮不上忙，只能希望他们以后能远离让自己压抑的地方活的开心吧
希望你们都能够幸福"
1676456059,0,0,False,False,他们会暴躁一下，我一般都在中间乐呵呵贫嘴几下缓和气氛，转头就好了
1676480816,0,0,False,False,充分说明一件事思维的重要性，和plan b[笑哭]
1676473720,0,0,False,False,我的父母也会在这样的小事上互相体谅，但他们却每年为了钱争吵个不停
1676471890,1,0,False,False,"我爸：闭嘴，没看见走错路了吗！？[阴险]
我：[疼][难过][保卫萝卜_哭哭]
后来他还问我为什么遇到事就过度焦虑。"
1676465862,0,0,False,False,全部三个都经过我爸没骂过我，✌
1676481680,0,0,False,False,太科幻了。我爸容不得一点忤逆，我妈说一点就爆炸
1676481850,0,0,False,False,第三个挺离谱的，一个成年人没有时间观念是不正常的。其他的话和我家差不多一模一样了[doge]
1676385163,0,0,False,False,第三个换成我早就生气了 因为我身边好多人都这样，知道自己化妆慢不早化，别人都收拾就等ta一个人，甚至坐在旁边看着ta化，ta还一边刷手机一边发呆一边化，真的很想掐死这种人[笑]
1676385252,0,0,False,False,本来是家庭很平常的氛围，却成了科幻片…
