上传时间,回复数,点赞数,up是否回复,up是否点赞,评论文本
1676379306,0,0,False,False,虽然我爸妈不是这样的家庭，但是我儿子是这样的家庭[脱单doge]我和我老公经历的囧事只会成为我们美好的回忆和嘲笑彼此的笑料，有什么好生气的呢
1676356987,0,0,False,False,我爸妈就是这种的，但是第三个是真过了[无语]我爸妈会骂死我
1676479534,0,0,False,False,咋说呢，大家抱怨父母没问题，但是希望你们如果真的有了孩子，到时候不要变成你们讨厌的样子[OK]或者说现在开始朝着想让自己父母成为的类型努力，然后善待身边的人，我觉得这样会更好
1676420796,0,0,False,False,谢谢这个视频让我坚定了“逃离原生家庭，实现经济独立”的想法[奋斗]
1676389376,2,0,False,False,"今年春节从昆明回四川老家 老妈听朋友说走贵州人少不堵车 结果贵州高速当时出了一场大事故在路上堵了三四个小时 终于能动以后我爸就开车下高速想绕行了 结果老妈导航搞错了开到了人家村子里[笑哭]还好我老爸心态好 还拍照发朋友圈说 看看这是到谁老家了 
后来我们越走越离谱不知道开到了哪里山区 两边都是悬崖和苗寨 还下着大雪 爸妈也没生气全程开着玩笑 就当来苗寨旅游了 还时不时下车拍照
我们原本只需要八个小时的路程后面愣是走了三十多小时[doge]"
1676392140,0,0,False,False,看见弹幕好多说“这就是我家”的，好羡慕啊。不是说我家不好，而是像这种情况我家真的会开始吵架[藏狐]笑死，家里两天一小吵三天一大吵，比吃饭还准时
1676386453,0,0,False,False,第一个是我还真碰到，我爸上来就骂我，说开车一定不能走神（是他在开车），然后又骂我只知道玩手机，最后又冲着我说了一堆脏话……[藏狐]
1676421393,0,0,False,False,"好羡慕，我知道我的情绪不稳定
所以，就此结束吧，不想要下一代了"
1676393887,0,0,False,False,"我妈忘记事情
我:咋了？没事
我爸和我奶奶:你怎么这不行，那不行，这忘那忘
现在家里我夹在中间，家庭关系现在都不好，哎，求怎么缓和（我个人觉得换个爸靠谱）"
1676482417,0,0,False,False,"第一个我爸:诶，过了过了过了，看你妈妈弄的这事，然后就开始笑
第二个忘煮饭那是不可能的，顶多忘做菜
第三个多少有点逆天了，是能有多蠢因为化妆然后迟到的，不心疼钱是吧？"
1676387465,0,0,False,False,这我家就够打仗了[辣眼睛][辣眼睛][辣眼睛]
1676460329,0,0,False,False,老公生气了，我大声生气的说:我这段时间没带脑子，你又不是不知道，干嘛生气
1676476682,0,0,False,False,最后一句“我们女儿的美也很重要”这句话真的太酷了。旅游注重体验，自身外形优雅也是美好体验的一种。
1676472449,0,0,False,False,第一条好感慨，感觉就像是那种只是短暂的拥有温馨和谐的家庭一样，不然孩子为什么会担心会不会吵架[跪了]或许争吵才是常态吧
1676386795,0,0,False,False,好羡慕啊，可是我爸妈天天吵架摔东西，一言不合就喊，我掉头发他也喊，我生理上不适的时候还要刷碗，有洗碗机也不用，总能鸡蛋里挑骨头
1676394310,0,0,False,False,"笑死了，我家是疯狂怼对方，我倒是觉得这种气氛很好，你一句，我一句，说出来可能要被骂，但是我还是要说，我碰到第一种情况会先来一句:哎哟我滴个娘诶，你怎么开的车啊？还不如让我来开呢（本人17岁）我妈有时候会说，你行你来开（这种时候一般都是她本身心情就不好）有时候会说，得了吧你，又想拿你那个什么卡丁车来吹了是不是，赶紧给我导航下一个路口……
第二种情况是……嗯，没有这种情况，因为我家是重组家庭，跟父母一起吃饭的时间很少（初中之后）后爸对我很好，所以每次都是他催我，想吃什么，而且必须问出一道菜来，我娘的话，一般不回来吃。
第三种情况就好玩了，我哥是个拖沓的人就是那种卡点上车的人，我和我后爸也差不多，但是呢，我妈是个急性子，每次特别提前的时候就催我们，各种理由各种催，反正就是不说我们几句不放心（当然，我们该忘的东西还是得忘）这时候搞笑的就来了[doge]我哥不是喜欢卡点吗，他每次都想卡点去，一点都不着急的，我是开始不着急，快到时间了才开始着急[doge]然后每次出门都是这种情况，我妈催我们，我和我哥反驳我妈，然后我后爸沉默（别问，问就是不敢）过一会就变成，我们各种想，想一下这个带没带，那个带没带的。再然后，就变成了，我催我哥，我怪我哥太慢了，我妈就说，哎呀，你看吧，这还得亏是我催过了，要不然能赶上车吗？然后就开始各种说我们，最好玩的是[doge]她说起人来一家子都得挨上一顿。她才不管你干了啥，反正肯定有你事[doge]
我不知道你们怎么想的，反正我觉得我这个家庭氛围特别好，并不会觉得委屈啊什么的……卧槽等等，我好像和我妈还有后爸处成朋友了[热]"
1676462288,0,0,False,False,第二种，我小时候煮饭忘记插电，我妈就要打我，害
1676465617,0,0,False,False,哈哈哈，没煮饭那个深有同感，我只会哈哈哈哈哈大笑，然后点个外卖一起吃[脱单doge][脱单doge]
1676459767,0,0,False,False,这种家庭的孩子无疑是幸福的，我还是不看了，怕做梦
1676377094,0,0,False,False,这种情况我爸就会开始发癫了，疯狂埋怨别人。然后他一搞我就烦，开始爆炸，和他对骂[蛆音娘_die]
1676467745,0,0,False,False,没有情绪的人不是正常的[热]
1676198876,2,2,False,False,我可以这样[保卫萝卜_哇]心态好点就好了，反正都发生了，想想怎么解决就好；解决不了就躺平，也很好[打call]
1676466950,0,0,False,False,我爸妈也会吵 但是吵完马上就有说有笑了 我每次坐后座 一直笑[脱单doge][脱单doge][脱单doge]
1676438017,0,0,False,False,从小担惊受怕长大的我发誓以后我的家庭绝不会跟我原生家庭一样
1676370098,0,0,False,False,虽然这些和谐的场景在我家都不存在，但我觉得前两个是很不错的，第三个要是还不生气埋怨女儿几句那就有点过分了吧，家长也不能一点脾气都没有啊[嫌弃]
1676431703,0,0,False,False,第一个我会被叼的飞起来  然后一路上被骂  然后我开车会越来越暴躁  最后到服务区换人  第二个还好吧  就会说几句  第三个活该被骂[吃瓜]
1676395799,0,0,False,False,怎么才能做到这样呢，我认为是要排除搭伙过日子这种情况，也就是说：爱情。但是我还在找
1676199788,0,2,False,False,真的很开心我家是这种氛围[大笑]
1676474644,0,0,False,False,我情绪就特别不稳定 一点就着的，特别容易激怒生气，我估计大概率是遗传或者受家庭因素影响，我爸妈就是这样脾气贼差，一点小事就喊骂
1676190453,0,2,False,False,哈哈哈哈我爸也说反正没走过可以看风景，但不过是给自己找借口避免被我妈嘚嘚不看导航[doge]
1676386823,0,0,False,False,这下是真的科幻片了吧……真的存在吗？我都会怀疑这种状态真的好吗[大哭][大哭][大哭][大哭]
1676459808,0,0,False,False,第三个有点得寸进尺的感觉，当然如果自己也相当内疚则另当别论。
1676374238,0,0,False,False,我会自责，我爸妈也会抱怨几句，我觉得无所谓，与其埋怨不如自己变强点
1676398561,0,0,False,False,其实吧，我觉得该吵就吵，但是一定是有分寸的炒，而且是为了教育和解决问题的炒，不然一般人心里压的太久会出问题的，视频中的只是看起来好，现实中不建议
1676261457,0,0,False,False,我很渴望得到，并积极反馈给家里，家里人好了，我反而[跪了]情绪不好，正在努力调整自己这方面。
1676350357,0,0,False,False,对不起🧎‍♀️如果是我真的很生气😤计划性强的看不了这个
1676199520,0,2,False,False,我妈开车的时候有我爸死死盯着就基本不会出错，走错路一般是我爸，有时候聊嗨了就走错了哈哈哈哈
1676476442,0,0,False,False,这是真实存在的吗[跪了]
1676412327,0,0,False,False,刘慈欣还是保守了[酸了]
1676196958,0,2,False,False,我一般是夹在我爸妈中间劝架那个[灵魂出窍]
1676193946,0,2,False,False,希望自己能成为这种人，面对困难时不是去懊悔马后炮，而是相互鼓励继续克服
1676445218,0,0,False,False,真的是科幻片吧[大哭][大哭][大哭]
1676390589,0,0,False,False,怎么样才能不动声色让我爸妈看到[微笑]
1676389555,0,0,False,False,我好喜欢你家的氛围，你能嫁我让我和你们一起生活吗[doge]
1676179055,0,2,False,False,原来父母真的是可以这么和谐的吗
1676365380,0,0,False,False,很难每次都做到，但是努力[呲牙]
1676200210,0,2,False,False,只要我一直努力去维护关系，关系就永远不会塌，幸好我身在一个很稳定的家庭
1676476818,0,0,False,False,我比我爸妈还阴晴不定，情绪炸弹
1676133944,0,2,False,False,我家:不见了东西＝破口大骂+上升人身攻击[笑哭]
1676182314,0,2,False,False,我是一个秩序感很重的人，这种态度我只会给家人和比较好的朋友，其他人我都会让他好好感受感受自己的错误放在社会上有什么代价
1676361451,0,0,False,False,这个文案真的不是旺仔爸妈吗！！！！！我之前看过
1676377226,0,0,False,False,确实 真的不知道这些事情为什么要生气
1676202802,0,2,False,False,可能不是我们每个人都有这样的家庭，但要改变自己的认知，如果没有这样好的环境，那就要磨练出在你家庭环境里面生存下来的心理状态与认知。
1676461077,0,0,False,False,我真的好害怕因为一些小事发生争吵
1676394360,0,0,False,False,再提醒自己一次，爱情一定存在
1676396980,0,0,False,False,可笑的是我自己哄自己说这是段子是假的
1676472769,0,0,False,False,小事可以，不赶时间可以，但是如果是正事耽误了我真的会生气
1676472747,0,0,False,False,刘慈欣写的还是保守了[藏狐]
1676195932,0,2,False,False,第一个我就裂开了 我刚拿到牌那会还在实习期刚上路，因为变道变不过去没来得及掉头被我爸妈一前一后骂的狗血淋头，一直问我为什么不变道不走。。纯纯学完车被拿来做牛做马还要挨骂[藏狐][藏狐]
1676471090,0,0,False,False,我爸就是说听他的，他觉得导航瞎指，意见不合就吵[大哭]
1676361047,0,0,False,False,科幻片，不信[大哭][大哭][大哭]
1676393418,0,0,False,False,哈哈哈哈过年那天晚上我家就没煮饭，我和我妈直接哈哈哈哈哈哈哈哈哈哈
1676389949,0,0,False,False,确实科幻，不过像这种事情我们家一般也不会吵[笑哭][笑哭]
1676375323,0,0,False,False,我爸妈恩爱到在我面前秀…
1676264187,0,0,False,False,高速导航我记得会在两公里还是1.5公里提醒你前方有长实线，让你提前靠右行驶[doge]
1676188861,0,2,False,False,我爸下班会等我一个小时化妆然后我俩去商场[笑哭]
1676276176,0,0,False,False,我开车我爸话密得能上春晚
1676406639,0,0,False,False,谢谢，比流浪地球好看
1676199276,0,2,False,False,这辈子是没这样的福分能在这种家庭生活了
1676464514,0,0,False,False,我虽然易怒 但觉得视频里很正常啊 不都是这样的吗
1676401321,0,0,False,False,何其幸运做我父母的儿子[脱单doge]
1676469619,0,0,False,False,对于我来说，属于微科幻？我也不知道怎么形容了
1676417372,0,0,False,False,不是我说啥这咋开车还让别人导航啊，自己导航才能掌握实时信息
1676389330,0,0,False,False,忘记煮饭那个，我家也常有，最多晚点吃，然后一起大笑
1676467644,0,0,False,False,这种家庭只会发生在梦里
1676474488,0,0,False,False,我还好，身在了幸福的家庭里，很和气。
1676377291,0,0,False,False,最后一个应该还要再补一句，下次要注意一点哦
1676375743,0,0,False,False,什么梦幻家庭真好
1676452870,0,0,False,False,这是多少人的梦想
1676478398,0,0,False,False,卧槽，今年的科幻片榜首
1676221767,1,1,False,False,fp人的家庭[保卫萝卜_哭哭]
1676195741,1,2,False,False,我家跟这个很像，如果我妈没煮饭的话我们会选择吃饺子[呲牙]
1676399961,0,0,False,False,确实是做梦都不敢这么梦了
1676457835,0,0,False,False,一切都是建立在金钱之上的
1676454070,0,0,False,False,很幸运 我家就这样[微笑]
1676362686,0,0,False,False,我家差不多就是这样...
1676395335,0,0,False,False,我也情绪很稳定
1676460169,0,0,False,False,科幻片:6
1676251556,0,1,False,False,@隔壁店妈妈桑
1676272840,1,1,False,False,@新川宸濑
1676372963,0,0,False,False,我家从来不会这样
1676346739,0,1,False,False,童话故事吧，我不信[难过]
1676284619,0,1,False,False,太6了
1676280464,0,1,False,False,羡慕啊......
1676275466,0,1,False,False,看的很美好，但永远也不懂得长大
1676455505,0,1,False,False,"其实这些事情单独看很多家庭也可以这样包容的，但生活中的事儿都太复杂了，这些事情往往都只是导火索，日常积累的烦躁才是真正被引爆的炸药。
所以婚姻这段故事最开始的时候，就一定要学会双方及时的排除烦恼，不要积累起来，忍一忍就过去了之类的（这里不是说要所有事都不忍耐，只是说需要找到两个人一起排忧解难的方法）这样的人生哪怕不断有困难，也可以及时的排解出去，才是良性的，健康的婚姻。"
1676291402,0,1,False,False,可是，我连家庭都没有啊[大哭]
1676288659,0,1,False,False,哇，我家情况就是这种啊✿ヽ(°▽°)ノ✿
1676279930,0,1,False,False,新型科幻
1676267889,0,1,False,False,挺好的
1676269206,0,1,False,False,科幻片@冰淇凌怪兽
1676263549,0,1,False,False,想都不敢想
1676292400,0,1,False,False,没什么好抱怨的，从我们这一代开始吧
1676277460,0,1,False,False,我家就是这样的[脱单doge]
1676381524,0,0,False,False,下辈子投到这种家庭
1676389796,0,0,False,False,真的有这种家庭吗？[思考]
1676266639,0,1,False,False,不可能的！没有这种家庭存在！我不信！[酸了][酸了][酸了]
1676268782,1,1,False,False,@磊不打胰岛素 @Gin2群的 [难过][难过][难过]
1676316100,0,1,False,False,我在想，这几件事生气也是很正常的吧[笑哭]
1676303630,0,1,False,False,蹭下小王的热度，新人助眠up，超级不好存活，好心人如果对助眠感兴趣的话，可以看完后来看看我呦，谢谢啦，打扰啦[白色情人节_yyds]
1676292268,0,1,False,False,刘慈欣终究还是太保守了……
1676276546,0,1,False,False,70后做不到，90后父母能做到的应该多一点
1676312122,0,1,False,False,如果某一天开始，家里所有人都包容你，溺爱你，无条件原谅你，你会不会感觉到可怕[吃瓜]
1676294971,0,1,False,False,个人看法，情绪稳定不代表无限包容，像这种已经有确定时间却因为化妆耽误的，还是要让她长点记性的，例如到地方第一顿大餐就得让她请了
1676280675,0,1,False,False,第三个情况不能忍，我忍不了，我家里人都忍不了，提前准备好是最基本的，前两个情况我们家是无所谓的
1676262108,0,1,False,False,既然羡慕的话，那就让自己以后的家庭成为这样吧[奋斗][奋斗][奋斗]
1676319292,0,1,False,False,有一件小事对我影响很大：小时候帮家里端菜偶尔不小心摔了盘子的时候，我妈从来都不会生气也不会埋怨，因此在这样的环境下长大的我，在和自己的对象相处遇到类似情况的时候，我也会下意识觉得摔个盘子没什么大不了的，会选择主动安慰，不会因此生气。
1676305710,0,1,False,False,"我们家大概率也会吵，然后就很烦
但今天中午我一个人在家，估计点错了键没蒸米饭，然后把炒好的菜盖起来，开始蒸米饭，期间，清洗了一下厨具，夹了个头发，做了个酸奶捞（下午茶），就很奈斯"
1676303701,0,1,False,False,对我来说挺科幻的，比流浪地球还科幻，唉:-(
1676300945,0,1,False,False,爸爸开车  就会很搞笑的说  别跟我说话哟   不要影响驾驶员  。妈妈好像有时候爱忘  爸爸悄悄给我说体谅一下你妈  。去旅游  我们一家牵手出行  遇到什么特殊情况解决就可以了[给心心]
1676286048,1,1,False,False,那个 是不是要把出处标一下
1676341420,0,1,False,False,我们家庭氛围也挺好的，所以我现在也想组建自己的家庭
1676284773,0,1,False,False,前两个有，但是第三个确实不行，时间观念的，感觉催了就快点，如果是因为堵车什么来不及无所谓，但是在明知时间紧的情况下磨蹭就是主观上的放任自由，赶得上也好赶不上也罢的感觉。
1676260534,0,1,False,False,一和二都很正常，三没有时间观念不是很好
1676470509,0,0,False,False,我爸脾气还是挺好的
1676311673,1,1,False,False,情绪稳定？不稍微说两句我感觉更吓人了。比如第一个，如果我妈开车错过高速路口，我怎么着也得说道两句，当然不会吵起来，更多是玩笑性质的，之后还会时不时损她两句，一个家庭有拌嘴才显得正常吧。这种一点儿情绪波动也没的反而感觉很作的慌
1676305141,0,1,False,False,化妆那个被骂了不能怪父母吧？自己没有时间观念
1676275795,0,1,False,False,第三个我觉得不关情绪稳定的事，守时准时是一个人的涵养问题，为了自己的事耽误了别人（除非是类似大姨妈这种非人为可控的事），否则应该受到教育。
1676290692,0,1,False,False,从小到大 家庭都是支离破碎，长大后遇到一个温柔的女生，期望着组成一个幸福温馨的家庭，然而相伴几年后也因为我的条件而分开了，可能是有缘无分吧，不在想其他了，只想挣钱对家人好点，过好余生。
1676300094,0,1,False,False,天啊，这是上辈子修了什么福报，这辈子才有这样的家庭。我家一丁点点点点点事就会吵个天翻地覆，我真的好羡慕啊！[酸了]
1676258573,0,1,False,False,"如果今天只有一班车呢
避风港不是让你不负责任的避风港哦
家庭照顾你，你也要照顾家庭"
1676216959,0,1,False,False,科幻片
1676303626,0,1,False,False,第一个第二个还好，但是第三个如果真的来不及可以在车上化妆啊[脱单doge]，很多时候来不及了我出门的时候就是穿个短袖，然后一边走路一边套衣服，最后再戴上手链帽子啥的，节省好几分钟的时间[脱单doge]
1676272857,0,1,False,False,很自豪地说，我家就是这样的[tv_微笑][tv_微笑]
1676282154,1,1,False,False,"每个家都有每个家庭的相处模式。
这几种情景，我家就会吵，但是吵完之后啥事没有，没人会往心里去的，我觉得也挺好"
1676463957,0,0,False,False,三体人：6
1676313765,0,1,False,False,我算是一个情绪非常稳定的人，生活中很多很多的坏情绪都是自己消化的，自己消化完了还要接收别人的坏情绪，真觉得有点累了😂
1676307224,0,1,False,False,爸。。那个。刚把外套落在服务区了。。。老爸:你怎么现在才说，真是。。叽里呱啦，叽里呱啦！  到了地方下了车。老爸: 赶紧去，顺便把我帽子也拿回来。
1676304654,0,1,False,False,呃。。抱抱大家。。对我而言。。这不是科幻片。。我们一家除了我爸说话有点急就是这样子的。。我也很幸福知足去拥有一个这样的家庭[拥抱][拥抱][拥抱][拥抱]也希望大家以后也会给自己孩子一个这样的家庭~
1676297370,0,1,False,False,煮米饭这个事以前我经常把米放锅里后忘记按开关，饭菜都做好之后发现还是生米，每次都会被我妈劈头盖脸地骂，一做错事都很害怕会被谩骂指责，在家闲着的时候我都不太敢坐着，一坐就会被骂眼里看不到活整天不做事[无语]
1676270277,0,1,False,False,真正能找到心贴心的伴侣概率微乎其微。而且现实里挑选对象不单单只考虑性格，家庭背景薪资癖好住房条件等等方面都要考虑进来。总的来说就是，增加恐婚的人数吧！
1676266074,0,1,False,False,很骄傲，我爸妈就是这样的[兔年]我现在和男朋友也是一样甚至更佳的状态
1676258636,0,1,False,False,上高中的时候连着两年，每年大年三十父母必吵架，太绝望了，我就大年三十出去溜达[大哭]
1676395961,0,0,False,False,这种，不存在的
1676293884,0,1,False,False,遇到“问题”先别出口，要先想想这件事有没有解决办法，有就去做没必要生气，没有就算生气也改变不了什么了，事情都已经发生了。
1676282704,0,1,False,False,看这种视频心都在悬着，就是一种ptsd，不由自主的紧张觉得会吵起来然后打架  。。。[tv_困]
1676288197,0,1,False,False,最后一条不合理好吧，有重要事情本就应该提前准备，何况你化妆耽误时间并不是十分重要的情况，现在父母包容你难道任何大集体都包容？这种事情父母单说没关系完全就是娇纵，道歉惩罚也是该有的，被骂只能说活该，难道等外人再来教育你？那等的可不是父母不轻不痒的责怪了
1676283510,0,1,False,False,其实，一家人也需要磨合的，以前每次自驾游都回吵架，现在吵得少多了，事后大家都需要总结和自我批评，大家才能进步
1676274246,0,1,False,False,我情绪不稳定[笑哭]所以准备单身一辈子，就不祸祸别人了
1676304752,0,1,False,False,羡慕啊……我爸妈每天都吵架，真希望他们能好好沟通，当然我知道这不可能，都是我的幻想[酸了]
1676267129,0,1,False,False,这句话是写给我自己，也是写给你们的：没在这种家庭里成长起来的宝贝们，我们虽然过去很多遗憾，但是我们可以让我们以后的家庭是这样的，人们经历过的都会让人学到一些事情，我们会越来越好的，当然人们怎么做是自己的选择，希望宝贝们活这一辈子开开心心的，做自己喜欢的事情，遇到好多好多觉得世界值得的人，总会有人爱你[爱心]
1676293355,0,1,False,False,"第一个：我妈会骂我爸
第二个：（我妈不烧饭）
第三个：会把我骂死"
1676285912,1,1,False,False,哎…… 看懂的都哭了。。之所以我不敢去和别人组建家庭 就是因为我的原生家庭它并没有那么好的氛围 不是我理想中的状态……
1676269222,0,1,False,False,刚刚就吵了，吵架的原因很简单：在我看来的大事在他们看来毫无轻重，拿传统那一套“孝顺”来当挡箭牌的时候我彻底爆发了
1676224647,0,1,False,False,我家就是这样的！！[保卫萝卜_哇]
1676303150,0,1,False,False,从小到大，要么是爸爸带着我和哥哥出去，要么是妈妈带着我和哥哥，他们俩从来没一起出去过，因为每次只要一出去就会吵架，特别凶的那种，真的很害怕，还天天吵架，甚至打架，离过好几次婚，我和哥哥的脾气也在这种家庭下变坏了……小时候会被吓哭，现在已经习惯了，只是觉得吵架很吵，很烦……
1676265303,0,1,False,False,羡慕[tv_难过]一般从第一个开始就要被骂了……
1676261983,0,1,False,False,虽然有的事情很让人生气，但是已经发生的事情想下次避免和怎么解决就好了。对家人发脾气吵架都于事无补还会让大家都很生气不开心
1676291792,0,1,False,False,其实这种情绪管理和处理问题的方式不是每个人天生都有的，是要经过训练和预演的，人们嘴里说的“人和人之间的差距”就是通过各种小东西的训练和思考拉开的。包括但不限于“家庭关系”
1676267466,0,1,False,False,"有人问姜文“这个世界会变好吗？”
姜文说“只要一直怀着这个疑问，这个世界一定不会差到哪里去”
我们都觉得视频里的东西太梦幻，但现实里的从无到有不都是这样一步步出现的吗？[爱心]"
1676452452,0,0,False,False,我情绪很稳定
1676312933,0,1,False,False,说句题外话，也不好听，但是我觉得就算自己家庭不和谐也不是随便就对别人暴躁的理由，要是自己组建家庭难道让孩子重演一遍自己的苦难？就算不组建家庭，你经常对着你的朋友或者对象发火当压力怪也是不好的，我们应当尽量不让这种暴躁易怒的脾气传给任何人，包括网上的陌生人，不要把这种二笔情绪留给下一代
1676277210,0,1,False,False,说实话我一般在心里和他们吵，这样又不会憋屈又和谐。
