上传时间,回复数,点赞数,up是否回复,up是否点赞,评论文本
1676339088,0,5,False,False,[滑稽]首先第一步：先交2500到俱乐部
1676306358,1,8,False,False,这开始的弹幕，真是看不得，开了硬核屏蔽还有人说什么杀了zp第一不算冷门，能不能好好看看那个官方给的数据？官方就是认为李不如其他选手，数值很明显的东西，就硬杠是吧？
1676454552,1,0,False,False,真牛逼，这种1V1的RTS游戏根本不相信运气。我上学时候玩过星际争霸1，那个游戏顶级基本是南韩人垄断的。现在唯一记住的是人皇好像叫boxer。这种游戏对个人大局观，集中力，尤其是操作手速都有极高的要求，一旦有某一方面的技术差距，运气成分啥的都白扯。
1676302987,0,4,False,False,刘备诸葛亮都死了 姜维北定中原了
1676359480,0,2,False,False,凛凛人如在，谁云汉已亡
1676300555,4,5,False,False,锤了41t，41p，41z（前几个z比较近）夺得冠军，打了一遍韩国欧洲的冠军，这就是含金量！
1676321533,0,4,False,False,星际算是我的启蒙游戏 从1玩到2 年龄越大 操作越跟不上 脑子也跟不上 这游戏门槛真的高
1676320326,5,8,False,False,李少不是一个人 有人自己掏钱办比赛 组战队 也有几十万二五仔10年不离不弃 你们可以来蹭热度 但是不要诋毁先行者
1676465723,0,0,False,False,真的，以后可能会出现网络小说，李培南当之无愧的主角呀[吃瓜][吃瓜][吃瓜]
1676299181,7,12,False,False,流氓高手是真的好看呀 以至于我一直觉得星际争霸中国很强
1676323793,1,7,False,False,李少确实是平凡人，因为他对比的是托尼史塔克。而我们对比的参照物就是乞丐。
1676478389,0,0,False,False,"理赔难:没有什么事情是不可能的。
国足:不信谣，不传谣。"
1676304313,2,5,False,False,当年找人陪练，全靠请客吃饭。凯子！！！
1676437618,0,0,False,False,"首先李培楠牛逼！！！太激动了！！！

另外看到评论有人争什么家庭条件重要不重要的，我想说不管什么事，家庭条件是下限，自身努力跟天赋是上限！李少的努力跟天赋是无疑的，家庭条件重要不重要，其实经常看老仙跟孙哥直播的应该知道，李少每次出去比赛或者训练，拿了奖金，这个奖金基本都会请客，说白了就是社交成本，为什么那么多顶尖选手会跟他练习，至少一开始李少没有哪个水平的时候肯定是要做关系的，如果家庭条件不行，奖金都不够吃饭的，星际本身关注度也不高了，那么至少这个冠军可能要拖后好几年甚至可能都不会有的，所以没必要否定家庭条件的重要性"
1676350641,0,5,False,False,这才是最纯粹的电竞精神 在后面的那些项目里很难再有了
1676418256,0,0,False,False,只能说这是星际争霸在大陆区最完美的落幕，这个冠军我对星际二最后的执念，星际二大陆区结束吧，这是你最好的落幕
1676347556,1,3,False,False,罗贤老师傅给你点了个赞[吃瓜]
1676299530,0,3,False,False,唯一一个冠军啊，上一个还是双人的比赛。
1676448391,2,0,False,False,他的打法就像只练踢腿一招练十年，一踢踢中要害，直接创倒对手获得胜利的犀利。
1676427897,0,0,False,False,这难度相当于C罗世界杯带领葡萄牙 4：0击败摩洛哥，4：0击败法国，4：0击败阿根廷夺得冠军，还是场场大四喜。
1676394467,2,0,False,False,虽然真的为国争光了，虽然星际是游戏鄙视链的顶端，然而只有我们这些80后90初知道这款游戏的经典与难度。大部分从95后（注意是大部分不是全部）开始都不知道这是啥，也不会感兴趣。李培南赢得的了不起，然而却如锦衣夜行……这才是最让人寒心的……
1676432025,0,0,False,False,这个冠军没在等，没有任何一个星际观众哪怕李少自己，想象他能夺冠。至于星际2的难度，相当于围棋+钢琴，门槛太高
1676424502,0,1,False,False,丫的，弹幕里把这次冠军和非洲滑雪冠军比，不知道星际能不要乱评价吗，你知道这次四个对手都是什么级别吗，承认别人优秀很难吗，那个发弹幕的什么心态？
1676347609,0,2,False,False,堪比男足世界杯夺冠
1676396190,0,0,False,False,有多难？首先推荐看一下雷诺操作键盘的手速镜头，再看看各位选手第一视角，如果举点例子的话就是：人皇sky之前是星际职业选手，实在是谁都打不过被打跑了，没办法转去到war3里拿了俩世界冠军，LOL李哥纵使见了星际一的教主FLASH也得弯腰叫声前辈
1676406493,0,0,False,False,"感谢牛牛哥哥给我的青春和星际国服画上了一个完美的句号！CNSC,BEST SC！[大哭][大哭]"
1676287270,0,8,False,False,李培楠评分80，马茹小儿96分，这简直就是小智打丹帝，但是小智赢了[doge]
1676388869,0,0,False,False,国内星际不是凉了是早五年十年就死了一月二十三号才埋，前两年国内上线人数不会过万甚至不过千，对比其他游戏日活，可以跟传奇网游一比了，李培楠前几年在国内实力也是顶级的只不过已经没有什么用了，游戏服务器没有了战队队友什么都没有了连玩家和观众都没有，还有什么比这个情况更恶劣的吗
1676391553,0,0,False,False,有一部电影叫安德的游戏，我一直觉得里面的那些人都是彩笔，让打星际的选手上，分分钟锤爆
1676386812,0,0,False,False,星际争霸是一款完全不含运气成分的纯实力游戏，你的战术被对面针对了是因为你的侦查和反侦察做得不到位，不要说什么运气好之类的，李少是纯凭实力夺冠
1676435217,0,0,False,False,WCG国人第一炮是人族一个李姓选手打响的，星际2的冠军也是人族李姓选手，星际就像围棋，没有什么运气可言，冠军实至名归
1676287801,0,7,False,False,破釜沉舟buff[脱单doge]
1676385235,2,0,False,False,记住了！只是lpn坐上神座，其他人依旧都是lese，并不代表中国星际崛起了[doge]
1676285916,0,7,False,False,我们是冠军（虽然我不玩但是感到高兴）！
1676380831,2,0,False,False,星际现在真的冷门了，我同事问我，世界第一人族不应该是sky么[辣眼睛]
1676303817,2,3,False,False,继人皇sky之后星际争霸二的人皇也出现了
1676373837,0,0,False,False,牛本能站在这个金字塔尖其实还有一个重要原因是家庭，他自己不必为生计操心，家里虽然不看好这个行当，但是尊重他的选择，并且一直支持他追梦。
1676379189,0,0,False,False,家里有底子，经济支持得起。每天训练12小时，不是人人 受得了 的是专业的训练。
1676315254,2,4,False,False,吕布是吧，这里就是白门楼[doge]
1676398902,2,0,False,False,就像ti还有预选赛的时候，5个逼组队杀进外卡，小组赛进败者组，败者组1穿7夺冠[大哭][大哭][大哭]
1676381560,0,0,False,False,十年前报纸《星际之差，尤甚男足》[doge]
1676338232,0,4,False,False,"我很久没有关注过星际了，我以前还是看F91 
罗贤打比赛，星际2出来后就没关注过了，如今终于有国人夺冠了，可喜可贺阿"
1676416283,0,0,False,False,打雷诺真的是转折点，二是真没让，三也是真的追
1676387133,1,0,False,False,星际我虽然没玩过但是我也知道星际是讲手速和操作的在竞技类里顶尖难度的游戏。冠军这一路可没有运气全是实力。
1676395602,0,0,False,False,给为数不多的星际玩家打了一针兴奋剂！[打call]
1676325786,0,4,False,False,大一，高二之后就没碰过星际了，以前就因为老男孩喜欢星际，一直以为咱们遇到韩国的就是鸡饲料被韩国的鸡猛啄的，结果看到吧maru干了我是真的亚麻牛
1676296052,0,3,False,False,告诉我什么是传奇？这就是传奇
1676383657,0,0,False,False,今年原本应该像ig夺冠一样成为中国的星际元年
1676429328,0,0,False,False,挺可惜的，在最后的最后用第一的🏆去结束吗。要是早个五年该多好。不过，天道酬勤给他的确不错，天赋也不错，恭喜。
1676397869,0,1,False,False,看多了黑萝卜看他打真的太阳光了
1676317159,4,3,False,False,借着牛本的采访，有个问题，国足登顶世界杯这件事，到底是不是不可能的？
1676379354,0,0,False,False,不是第一个，星际争霸的职业电竞第一届比赛就是我们中国夺得的冠军。但是后来就。。。
1676336353,0,4,False,False,把黄旭东的嘴封住，手绑住就简单许多[doge]
1676369598,0,0,False,False,星际2其实是有机会火起来的，大概10年初，war3热度减退，DOTA和LOL还不火或者没有，可惜没有国服+没有激活码，好不容易国服开了还按月收费一个月20，还有那个优化和配置需求[辣眼睛]
1676443786,0,0,False,False,没战队支持？您猜猜kzg-time那个kzg是啥[微笑]
1676368144,1,0,False,False,星际争霸二的问题就在于在2010年作为一个Rts游戏采用了非常昂贵的月卡制收费，而非一次性买断或者部分收费模式，在本就较高的门槛上又加大了劝退难度
1676300231,3,4,False,False,魔兽争霸曾经的人皇sky，当年就是打星际绝望转战魔兽的。西恩暴雪的两位人皇都姓了李[doge]
1676377645,0,0,False,False,天道酬勤这话用普通人可以，但是有一些是不适用的，比如c罗没有天赋，梅西不努力一个道理，世界第一肯定是天赋加上努力才能实现。
1676336955,0,4,False,False,国足一队人加起来不如time一根毛[doge]
1676368655,0,0,False,False,看了看 这是把刘关张加吕布一锅烩了，哦对了没有吕布，吕布在白门楼上挂着呢[doge]
1676336474,0,2,False,False,UED回归了是，连斩PTZ顶尖
1676375473,0,0,False,False,"星际2太难玩，但是真的好看，我只知道神族的大螳螂会闪现就能看！
但是暴雪要自己办，嘿嘿，凉！"
1676364089,0,0,False,False,众所周知星际争霸2有三个种族，分别是人族，神族，虫族以及偏常者李培楠。人皇老大哥的统御权杖还是传下来了。[tv_doge]
1676364556,0,0,False,False,李培男15岁就出来打比赛了，干掉茂神之后被发现了，然后茂神反手就是一个举报[笑哭][笑哭][笑哭][笑哭][笑哭]
1676439496,0,0,False,False,就是看这部小说，入坑的星际。星际里面都是淫荡搞笑男。
1676436051,0,1,False,False,以后小说比赛就这么写，评论区嘲讽我就那这段打他们脸
1676286625,3,5,False,False,重创！手刃！降服！最强！
1676395720,0,0,False,False,别说平凡，这是天赋和努力，最重要的是坚持自我，你说平凡就是胡扯了
1676364598,0,0,False,False,晶体矿被抢走，高能瓦斯被征战，甚至主基地都已经被上级力量关停！能使用的资源都是一些其他势力不要的残羹剩饭，如此匮乏的时代正道大帝！只能说现实比小说更玄幻！李培楠牛逼！！李少开酒！！！！[大哭][大哭][大哭]
1676299500,0,3,False,False,太厉害了在我心里可以和sky并列了。
1676366800,0,0,False,False,楠哥是真的强，一个人单挑全世界夺冠[打call][打call]
1676473711,0,0,False,False,一人成军而弑神
1676389464,0,0,False,False,切断了卡拉，没有了埃蒙的腐蚀
1676368167,2,0,False,False,其实没有太夸张，跟男足比过分了，大概就是姚明时代男篮奥运连克西班牙 阿根廷 美国夺冠。
1676306996,0,3,False,False,我们服务器都没了……但我们是冠军[脱单doge]
1676310810,0,2,False,False,好家伙，小说都不敢这么写[doge]
1676370175,0,0,False,False,好比国足拿下世界杯冠军，堪称神迹
1676365070,0,0,False,False,"独狼威望，这tm就是独狼吧。
啊啊啊啊啊啊啊啊啊，牛逼！"
1676392819,0,0,False,False,哪怕只有0.000000000000000000001%概率，那只要成为那个1不就可以了吗
1676288430,0,5,False,False,为了梦想而奋斗的人 本身就有价值
1676288929,0,3,False,False,中国人的骄傲!
1676363348,0,0,False,False,只有赔钱的时候才是最热爱的人出现发光的时候
1676373006,0,0,False,False,几年前一直听说maru的传说，后来没关注了。一出现就是夺冠
1676387595,0,0,False,False,星际夺冠了！男足呢？
1676421647,0,0,False,False,说运气好的先去试试游戏ok？别说双线压制了，12d扛不住5分钟就结束了
1676293818,0,3,False,False,牛牛哥哥我滴超人[大哭][大哭][大哭]
1676397307,0,0,False,False,厉害了。不过一看到这个还以为是星际一。星际二实在没想到。
1676285996,0,4,False,False,谁言人族无大帝[打call]
1676355896,0,1,False,False,rts和ftg一样都练习成本高收益低，心理博弈重，除了练习自己怎么玩还要猜对手怎么玩
1676370804,0,0,False,False,击杀了，三位世界第一[笑哭]
1676419645,0,0,False,False,国足进世界杯八强难度
1676283220,0,3,False,False,ITS ABOUT TIME.
1676358383,0,1,False,False,20年了！星际争霸终于有了冠军！！
1676358759,0,1,False,False,这就去韩服看看频道里棒子们的酸样
1676299773,0,3,False,False,这真的是个奇迹！我们什么都没有，却诞生了一位人皇！
1676303067,9,1,False,False,虽然我不玩星际，但是这时候一个冠军感觉在疯狂的打考迪克的脸啊
1676298497,0,2,False,False,这游戏现在还在也是奇迹
1676298506,0,2,False,False,好厉害呀！！
1676365493,0,0,False,False,必须给牛牛哥做个金色的牛牛金杯
1676336524,2,3,False,False,不关注星际争霸，但是很高兴，现在压力来到刀塔LOL一边[妙啊]
1676363546,0,0,False,False,别人获奖感言不是说自己就玩了八年吗？你这儿就十几年？我听错了？
1676442791,7,0,False,False,有没有可能韩国也和国足一样外围操盘了
1676365920,0,0,False,False,现在暴雪的竞技比赛哪个不是靠热爱撑着的
1676374875,0,0,False,False,星际都夺冠了，世界杯也不是不可能
1676349624,0,1,False,False,"含金量无异于
吴京一人赤手空拳端了三体人老巢
灰太狼一狼单挑一千只喜羊羊
老婆没了却儿孙满堂"
1676337922,1,1,False,False,@看见偷影子的人 @莫咯老头 牛逼
1676300160,2,3,False,False,当你星际选手可是和男足相提并论的 [妙啊]
1676365691,0,0,False,False,对于最后那一段话，我只想说还有国足呢@国足
1676287494,0,3,False,False,En Taro ——
1676296221,0,2,False,False,time牛逼
1676352008,0,2,False,False,就像他说的，普通人也能成为冠军
1676376832,0,0,False,False,无敌，赢啦！！！牛逼！！！！！
1676375527,0,0,False,False,太难了，太强了，太牛逼了！[打call]
1676284441,18,4,False,False,有一说一，国服没了对选手日常训练比赛没啥影响
1676388177,0,0,False,False,终于有个播放高的人皇视频了
1676301855,0,2,False,False,[大哭]克哈的霓虹都为你闪烁
1676286693,0,5,False,False,把maru打的4：1属实牛逼
1676304241,1,3,False,False,星际上手门槛太高，上学的时候想拉同学入坑结果都被难度劝退了.......
1676394277,0,0,False,False,pvt电池砍了之后真是劣势对抗。
1676367718,0,0,False,False,用金色的笔这下的墓志铭吧
1676341122,0,2,False,False,流氓高手再看一遍[doge]
1676283111,0,3,False,False,二五仔集结，李少牛逼！
1676454153,0,0,False,False,李家出人皇啊[兔年]
1676317983,2,4,False,False,官方评道能不能严谨一点？跟我念：人类、异虫、星灵！
1676379219,0,0,False,False,李少开酒！
1676289034,0,4,False,False,他成为了一个传奇，牛批～
1676330905,0,2,False,False,得95%都是韩国人[笑哭]
1676306712,5,5,False,False,说一句 如果算上WCG的话。李培楠之前是西瓜亚军 输给MVP 自由之翼那时的WCG
1676289592,0,4,False,False,多亏马西西让看cs的人也看到这一幕
1676434834,0,0,False,False,第一次知道这个游戏就是看龙族里的路明非喜欢玩[doge]
1676320288,0,2,False,False,人皇都姓李[微笑]李培楠牛逼！！！！！牛牛哥哥世界No1
1676465338,0,0,False,False,"还真有人纯云说运气啊？
昨天的节奏是scboy在蹭，我笑了，知道理赔难的战队名是什么吗？
今天的节奏就成了运气，我都要笑不动了，当是抽卡还是当是打牌啊？你以为你打炉石呢跟顶级高手10把有机会赢几把？打星际我都不说让职业哥来，找个天梯有段位的开80%甚至更低血量都能暴打好吗？而且是花式的"
1676373930,0,0,False,False,接下来看国足了[妙啊]
1676305521,0,1,False,False,牛逼
1676349581,0,2,False,False,至暗时刻？我觉得暴雪滚了还挺光明的
1676350191,0,1,False,False,不破不立
1676338310,0,2,False,False,卷的不行的最难即时战略游戏，需要顶级天赋和长时间巨量练习，更不用说国内的环境。
1676392131,0,0,False,False,多发点，牛牛哥哥喜欢
1676422464,0,0,False,False,就和商业保险理赔难一样吧
1676367938,0,0,False,False,炉石大陆都不能参加。。
1676307724,0,1,False,False,[打call][打call][打call]
1676383673,0,0,False,False,我得再来把星际
1676383656,0,0,False,False,3DM有打算下手星际2业务吗
1676313038,2,2,False,False,"夺冠关键：无法预测。
你不知道他到底下一把的心态是怎么样的，自然也就没法预测他的战术，他的决策"
1676368996,0,0,False,False,最早一批玩星际的差不多40了吧
1676386668,0,0,False,False,太牛逼了李少
1676314933,0,1,False,False,恭喜中国星际！
1676382141,0,0,False,False,就很夸张，打hero和maru跟在打儿子一样[笑哭]。问题是平时关系是反过来的。
1676369378,3,0,False,False,忘了马天元当年是第几？
1676343933,0,2,False,False,感觉像死之前的回光返照，确实励志，但游戏却不可能有第二春了
1676292805,0,3,False,False,毕竟星际2国服某种程度上已经开始卡牌化了[脱单doge]
1676304753,0,1,False,False,天降猛男？
1676284055,0,3,False,False,手刃，重创，降服，最强。
1676379959,0,0,False,False,反正也没人玩了
1676349281,0,2,False,False,我还记得采访理赔难说了一句“现场这么多观众让我看到这个游戏不是个dead game”，真泪目了
1676296396,0,2,False,False,他的圆梦了[打call]我的梦也圆了
1676376868,0,0,False,False,这个配音好熟悉是谁？
1676418082,0,0,False,False,也算圆满了
1676304586,0,1,False,False,确实不容易
1676283778,0,2,False,False,李培楠牛b
1676306475,0,1,False,False,鸡毛难受，又不是什么大事
1676372694,0,0,False,False,好励志
1676287343,1,3,False,False,老仙诅咒都归time，不关奥利维亚事
1676298313,0,1,False,False,[打call]
1676370001,0,0,False,False,这波是tm把暴雪脸都给抽歪了
1676401759,0,0,False,False,泪目
1676385886,0,0,False,False,@吉良吉影给你丶赞
1676308928,0,1,False,False,游戏都黄了[大笑]
1676302216,0,1,False,False,人皇！
1676381792,0,1,False,False,说运气好的都是来酸的，time从出道开始一直都是中国星际2第一人，这次p级联赛IEM已经是当前星际2含金量最高的比赛了，赛方对其评分80分，与之对位的都是世界冠军世界第一tzp，从半决赛开始都是4-1赢的，要说运气好或者是对手轻敌也不至于轻敌四局吧。
1676285729,0,5,False,False,这就是：头！号！玩！家！[打call]
1676333796,0,1,False,False,等流氓高手新作也等好多年了 虽然基本无望了
1676290718,0,2,False,False,他是中国人的骄傲
1676285713,0,2,False,False,明天应该头像换他[吃瓜]
1676304454,1,1,False,False,李家出人皇啊
1676392438,0,0,False,False,666
1676299196,0,1,False,False,李少牛B
1676362421,0,0,False,False,有如wings战队，可惜了
1676305426,1,1,False,False,不知道bkGG看到有何感想
1676332901,0,1,False,False,李少牛逼！！！[大哭][大哭][大哭]
1676310006,0,1,False,False,培南继承3484吧～
1676299045,0,1,False,False,人皇再起
1676315867,4,1,False,False,下个会不会魔兽争霸，貌似魔兽争霸没什么事。
1676312547,0,1,False,False,卧槽，多少年没玩星际了
1676310595,1,2,False,False,你们不懂一人成龙，聚龙成虫的国人吗[doge]
1676335808,0,2,False,False,确实是全世界第一“人”[打call][呲牙]
1676360577,0,0,False,False,几十年出一个的人才啊
1676283002,0,2,False,False,星际已经不存在了[doge]
1676350164,0,1,False,False,没有什么是不可能的，比如。。。。国足拿到世界杯资格?
1676357403,0,1,False,False,这次终于让Maru认识了 who is time？
1676356009,0,1,False,False,这波暴雪错过一大批回流玩家
1676352751,1,12,False,False,不玩星际争霸，作为伪游戏迷，原本以为LOL的龙x夺冠已经很励志了，现在觉得李培楠真的更牛批
1676330870,0,1,False,False,等战队联赛大招芬兰仔吧[妙啊]
1676303384,29,0,False,False,果然，关注低的赛事，才更容易出好成绩[笑哭][笑哭][笑哭]
1676310365,7,3,False,False,李老八算是圆梦了他无疑是努力的也是幸运的。赶在暴雪游戏全面退出国内市场末尾拿了冠军，不过暴雪游戏dead game的现状是不会改变了。
1676350623,1,30,False,False,"这场比赛几乎是中国星际的破釜沉舟。
如果以边缘行者最后一集来说，李培南杀进打进八强，几乎等同于大卫站上了荒坂塔。
按照李培南的话来说，“这一切都和做梦一样”
而即将面对的对手世界冠军虫族雷诺，相当等于遇到了亚当重锤。
大卫被完全压制的情况下，找到了胜机，击败了亚当重锤。
击败世界第一神族小hero，几乎等于大卫杀穿了荒坂。
4比1击败世界第一人族maru，相当于大卫最后保持意识清醒重新和露西见面，虽然曾经的团队已经回不去了，但大卫实现了梦想，并和露西一起去了月球。
梦幻，不真实，不可思议，一切都太突然了，我们都没有意识到，这个堪称史诗的过程，按照常理，这种剧情只存在于小说爽文里。
这个结局几乎是不可能发生的。
赛前ai预测李培南夺冠概率是千分之三。
到与maru的决赛ai预测李培南有98％不能四比一战胜maru。

但李培南做到了。
为此付出了一切，用实力证明了自己。
在不被人看好，不被人理解，被人劝退的情况下，依然选择了不断坚持。
李培南坚守了八年，终于等到了这一刻。
取得了历史性的成绩，击败了强大的对手，获得了难以置信的世界冠军，实现了梦想，创造了，中国星际史上的一个奇迹。

李培南在赛后采访后说，我只是一个普通人，我热爱这个游戏，享受对局的过程，根本没想着我能夺冠，我只不过是练的比较多。

“看看我，我一个普通人都拿了世界冠军，还有什么事是不可能的”"
1676346058,1,19,False,False,"恭喜time
星际争霸2是一款孤独的游戏。
星际争霸2玩家绝对是时常体验到孤独的一群玩家。
不同于绝大部分其他游戏，在苦练星际2的时候，你更多的时间会在内心孤独的思考，提出(或学习）想法——在十几分钟的全神贯注操作中论证——在几秒钟的崩盘内承受所有挫败感或者独自喜悦——改进自己从而进步。
或许有的人会和朋友、师傅、教练一起前进，但绝大多数时间都会是一场暗影独行。
他们是不幸的，这一款游戏原本配得上更好的公司，玩家配得上更多的同行者。
但他们也是幸运的，因为中国星际的土壤里，有李培楠这样一位承载着历史，在一代又一代前辈的陪伴下，坚持着踏上荒芜的独行者。
谢谢你，cn星际。
谢谢你，time。"
1676350643,0,29,False,False,相当于在奥运会乒乓男单比赛里，一个名不见经传的外国选手，在8强3:2逆转樊振东，半决赛3:1干掉马龙，决赛4:1靠硬实力碾压张继科，而且这个外国选手的国家没有乒协没有教练没有资助支持...绝对是奇迹
1676336009,19,0,False,False,早在星际刚开始火爆那些年，中国选手早拿过冠军了
1676336816,0,4,False,False,"I don't care,i just play."
1676351507,1,4,False,False,那些怨天尤人的人啊，看看李培楠吧
1676350712,4,0,False,False,星际是个好游戏，但是门槛太高了[辣眼睛]
1676318964,1,3,False,False,星际要火！但是服务器…
1676314895,7,0,False,False,这个比赛相当于总决赛吗？ 因为IEM这一类的我总感觉像是第三方[笑哭]
1676319095,10,0,False,False,20多年是认真的吗@3DM游戏网官方
1676336952,5,0,False,False,星际争霸奖金应该也不低吧
1676351034,0,1,False,False,20多年了第一次拿冠军，上次还是2007年也只是拿了亚军，上次是星际1这次是星际2
1676299970,1,1,False,False,没有什么是不可能的！所以……世界杯世界杯世界杯
1676301166,0,1,False,False,虽然没玩过，但是还是要说一句牛逼
1676298114,0,2,False,False,卧槽，三大妈怎么跑这儿来额
1676360176,0,0,False,False,[萌宠狗狗_看戏]
1676343036,0,1,False,False,别乱说好吧，星际现在那个选手有资本后台，都是靠自己好吧
1676289406,0,1,False,False,绝唱！
1676352188,0,1,False,False,虽然看不大懂，但是跟着哭就对了[doge]
1676337340,0,1,False,False,好多年没看星际了，李少是肯定能打出来，但没想到他真成世界冠军了
1676337530,0,0,False,False,[打call][打call][打call][支持]
1676307699,0,1,False,False,前段时间指挥官免费的时候我还想去打打剧情的，可惜很快就出了不续约的事，唉
