上传时间,回复数,点赞数,up是否回复,up是否点赞,评论文本
1676466200,0,2,False,False,之前出去玩，过马路我咻的一下让人干飞了，飞了两米，还是脑袋着地，给我人干蒙b了。兄弟当时觉得自己要寄，埋哪里都想好了，还好最后没什么事💔还是希望大家注意安全，多多防范[保卫萝卜_哭哭]
1676464948,0,4,False,False,救命烤虾真的幸运，那么重的四轮摩托压在脸上和身上是什么概念啊，真的好吓人
1676452572,1,9,False,False,我还以为他俩分手了吓死我了
1676467012,0,2,False,False,初中和朋友去内蒙玩，一个小伙伴在草原上骑这种四轮摩托都翻了，这玩意真挺危险的
1676455616,0,5,False,False,[大哭][大哭][大哭][大哭][大哭][大哭][大哭]没事就好啊啊啊啊啊心疼
1676453396,0,6,False,False,以后多更点刺激的恐怖游戏就好了，这种还是以后别要了[doge]
1676453912,0,3,False,False,大虾烤姐看起来憔悴了不少，好好休息啊[委屈][委屈]
1676467032,0,2,False,False,说实话，犯太岁确实会有些倒霉事发生，还是求个平安符更安心一点
1676469619,0,3,False,False,好玩是好玩～但危险多少伴随着的！幸亏没事～up必有后福，注意恢复吧！
1676469136,0,2,False,False,我的妈呀看到急转弯没有防护我要吓死了……幸好在一个小土坡翻车人没掉山沟里去磕碰到！我也感觉有时候做事特别反常，被人操控了一样……心不在焉的。
1676459084,0,4,False,False,已经在等结婚vlog了[脱单doge]
1676457593,0,2,False,False,难怪大虾前几天直播好憔悴
1676461358,0,2,False,False,你两以后一定要注意安全！一起经历过生死的情侣一定要长长久久在一起啊
1676463513,1,2,False,False,想到我滑雪摔了一跤，小伤，代入很强，蟹蟹你们的提醒[拥抱][拥抱]
1676473541,0,4,False,False,真的小心，太吓人了，还好人没有大问题[拥抱]好好休养吧
1676460504,1,2,False,False,我也经历过 。。是小轿车出去玩回家的路上 经过一条那种一边是树另一半是稻田的山路 马路和田地中间有那种落差嘛 下雨天打滑了车直接整个侧翻下去了 还好我坐的位置冲击不是很大只是嘴裂一块我右手边朋友买了只小猫在车里 都压死了。。
1676461621,0,2,False,False,我第一次骑小电驴，前面的车在路中间突然停车然后开门我就撞上去了，当时我还载着我姐，我没什么事情我姐的整条腿都肿了，去医院看了没伤到骨头但是走路很困难在家休养了一个多月。挺内疚的其实，我感觉我再也不敢开车了，无论是两轮还是四轮（我有驾驶证）真的很恐怖，经历过交通事故上路心里都会放心不下
1676461822,0,2,False,False,我在新疆也做过，虽然没翻但是走泥路时人变成兵马俑了，还混进了牛粪[灵魂出窍]
1676465851,2,1,True,False,我有点疑问就是为什么会有人还压过去啊，我没有接触过山地魔托，是因为下坡不好刹车吗，感觉好吓人[囧]
1676453699,0,4,False,False,出去玩真的要注意安全！小心驶得万年船！
1676469579,0,2,False,False,@欣欣很善良 @Cdsajbh 我们以后玩这种有危险的运动真的得小心
1676465608,0,2,False,False,开过沙滩车，就像这种，我哥特别大胆地让9岁的我开过，根本把不住，把自己甩出去了，还好是在沙滩
1676453962,0,4,False,False,啊啊啊啊啊啊啊心疼死我了，现在还会疼嘛？
1676465426,0,2,False,False,还以为是摔了，没想到是被轧了，好危险啊[灵魂出窍]幸好没事
1676452433,0,10,False,False,烤虾烤虾[脱单doge]烤姐相信自己的颜值，颜值完全可以覆盖伤痕
1676466468,0,3,False,False,[大哭]你们一定要安全！！抱抱 希望看到你们一直幸福下去[黑泽诺亚NOIR_啾咪]
1676468221,0,2,False,False,注意安全啊烤虾[灵魂出窍][灵魂出窍]
1676454307,0,2,False,False,真《翻车》[Hiiro二周年_吓]
1676461375,0,2,False,False,目测来说，就像开到路肩上了，车子倾斜，然后机头歪了就会这样，这种重心高很容易侧翻[脱单doge]
1676456529,0,2,False,False,我去年本命年脚骨折了，滑雪没戴头盔把头摔了[大哭]
1676472663,0,1,False,False,啊啊啊我也经历过车祸，忘记什么车了，和你们好像都是侧翻，旁边没山崖但是坡弧度大点，翻的时候真的过的很慢[笑哭]我现在都能清楚的记得我翻的场景感觉还有失重的充血，然后我是撞到了颈椎还有其他小伤（撞的是凸起小土坡），然后去捏了颈椎，好多了，建议不让我枕枕头，好几年没用枕头了[笑哭]
1676452956,0,2,False,False,找到虾不更新的原因了，一定要注意安全！虾的偶像包袱好重（bushi）
1676471496,1,1,False,False,真的要小心啊 我去年九月份学校跑操的时候 突然摔倒了 摔在操场那种坑坑洼洼的塑胶跑道上 右脸两个大疤 现在还有印子 下面是我当时摔的样子 现在拍照不怎么明显 但现实里还是有印子的！！所以大家一定要注意安全啊！！
1676469350,0,1,False,False,别说烤姐你们骑这种比较小众的山地摩托，我之前和我婶婶去骑自行车，然后我们两个就开的是那种两个人并排的自行车，那种自行车看起来会比较稳，但是那个时候我们都不算很会骑的那种然后真的就一不小心就会懂东倒西歪，然后自行车绿道旁边就是一些种地的棚，然后还有一定高度，我们就从路上摔到那些地里了，真的当时脑子都是发懵的，脸摔破了好几处，最重要的是幸好我们比较幸运真的我们就摔到土地里，再往前摔一点我们就要摔到那种就是架起来那种塑料棚的上面了，那种棚上还有那种尖尖的木桩的，真的太后怕了，万一摔到那上面真的感觉命可能都没了……人真的是很脆弱，真的做什么事情都要抱着万分的小心，生命只有一次啊！最后希望烤姐和大虾今年平平安安~
1676472491,0,1,False,False,看封面我还以为是猫藓，原来真的是生死一线！[辣眼睛]
1676452792,0,3,False,False,注意安全啊你们两个[生气]下次去有危险的游乐设施（应该）要做好防护措施啊你们
1676469587,0,1,False,False,我前年十二月的时候是骑单车摔下来了，骨折倒是没骨折就是擦破脸了，去缝了个五针[囧]当时从地上爬起来的时候发现血一滴滴掉下来，差点以为自己吐血了）发现其实是人中那有块肉飞了了，跑去校医院结果发现要缝针，但是我很冷静，因为想着只要不是吐血就好
1676468481,0,1,False,False,之前我表弟教我骑三轮在老家的操场上也是平地，我当时和我弟说：“我觉得我会了，给你来个好玩的”，然后我就在平地上左右转弯，刚开始我觉得没什么的，但是他因为急转弯太多了轮子估计还没适应我得速度结果就翻了，翻的那一刻的我和烤姐说的差不多就是感觉那一瞬间我捕捉到了所有帧数直至倒地才发现被压到腿了，真的感觉翻下去的一刻好缓慢啊不过从那以后我就三轮车不敢转那么快的弯了不过我平时也不太骑三轮车也许回姥姥家的时候会偶尔骑一次的吧也许一般不会骑的
1676471271,0,1,False,False,我突然想起我骑电动车以一种极速撞到了一个汽车上，头磕了一下，腿有一个多月都没法好好走路，当时我才六年级[囧]
1676466621,0,1,False,False,省流:让催更的粉丝愧疚一辈子
1676474457,0,1,False,False,大难没事，必有后福啊虾总烤姐[星星眼][星星眼]
1676455480,0,2,False,False,[拥抱][拥抱][拥抱][拥抱][拥抱][拥抱][拥抱][拥抱][拥抱][拥抱][拥抱][拥抱][拥抱][拥抱][拥抱][拥抱][拥抱][拥抱][拥抱]
1676452377,0,7,False,False,袜还是小心啊
1676461644,0,1,False,False,解锁新成就：“生死之交”
1676453285,0,2,False,False,大难不死！必有后福！！[抓狂][抓狂][抓狂]
1676463705,0,1,False,False,高中的时候 回家路上有一个很长的坡 平时骑车的时候都是直接飙下去的 刹车都不按 然后某次搭同学回家 那条路刚修完 地上还有沙子 我那时候想控制下速度就按了刹车结果轮子直接打滑 我俩都摔了出去 同学门牙磕掉了 我趴在地上半天没缓过气来 脸有一点磨伤 右手一活动至今还会嘎哒响 [笑哭]也是内疚的要死 大家骑车一定要小心啊
1676460842,0,1,False,False,我上年7月在车间里，大腿被机器挤压，病房待了20天不到。现在看到出事故的，就感觉自己经历一样，害怕死了。
1676458830,0,1,False,False,去年和同学在学校里骑电动车，想着校园里没有机动车也不会出事吧，结果当时突然有人从人行道上走下来，我们来不及反应，也是大翻车，手脚都撞出血还差点脸着地。大家一定要注意安全，平平安安的！
1676470812,0,1,False,False,大虾当时心想:完了，这人还能让我娶走吗。[doge][doge]
1676459693,0,1,False,False,抱抱，祝你们顺顺利利[洛天依]
1676470236,0,1,False,False,呜呜呜呜[热词系列_我哭了]真的真的吓死我了，你们没事就好啊[大哭]
1676460124,0,1,False,False,以后一定一定要注意安全啊！！！！
1676460537,0,1,False,False,好危险！！！！一定要小心啊[大哭][大哭][大哭][大哭][大哭][大哭][大哭]你们是我最爱的up啊！！！！！[大哭][大哭][大哭][大哭][大哭]
1676458324,0,1,False,False,天哪。。。烤姐和大虾以后要注意安全啊 听到整辆车压过去真的很恐怖 希望大家以后都能安全！
1676460636,0,1,False,False,小时候去加油站我寻思顺便买点巧克力 然后刚要到加油站我可能脑子抽了给车门打开了踩着车边上喊巧克力😓我要掉下去的时候我就感觉时间都变慢了抓东西也抓不到脑子里全是汤姆抓东西的画面 然后我就躺地上了幸好我家长反应过来了不然我直接变成杨过😓（独臂大侠
1676458831,0,1,False,False,真的吓人，大虾和烤姐一定要平平安安的啊
1676458273,0,1,False,False,安全第一啊！心疼大虾和烤姐[大哭]看得我好揪心啊哭的稀里哗啦太可怕了，想到如果我以后见不到你们我真的太难受了[大哭][大哭][大哭]
1676460818,0,1,False,False,没事就好，没事就好，安全第一
1676467144,0,2,False,False,所以说有些刺激类的项目能不参加就别参加，那东西发生事故说没就没了
1676469805,0,1,False,False,真的要小心哦！！！两个人都要平平安安！[兔年]
1676456633,0,1,False,False,推荐：大虾考个驾照[给心心]
1676466086,0,1,False,False,看过一句话，当你对一个客观上有危险的东西失去警惕性的时候，即使是你之前熟练的东西，往往也是最容易发生事故的时候
1676473873,1,1,False,False,。。。前两天滑雪没刹住把一个小姑娘锁骨撞骨折了，我啥事没有[捂脸][灵魂出窍][灵魂出窍]
1676466304,0,1,False,False,"有没有人和我一样以为烤姐有喜了
[脱单doge][脱单doge][脱单doge][脱单doge]"
1676458780,0,1,False,False,抱抱大虾烤姐🥲大家平时都要注意安全哇！
1676459161,0,1,False,False,我今天晚饭没吃，看了一下封面，嗯，饱了，谢谢两位[OK]
1676456244,0,1,False,False,天哪烤姐大虾没事就好！这种事发生在谁身上都不好受，断更能理解的！
1676466819,0,1,False,False,是幸运的，你们注意身体不要想太多[拥抱]
1676461012,0,1,False,False,我之前开的时候老板千叮咛万嘱咐不允许开太快会翻车啊，这老板好不负责任啊🤔（不过再怎么叮咛队里确实还是有小伙伴翻车了）所以还没去玩过的真的要注意确实很容易翻车！！
1676463100,0,1,False,False,不说了，我也99，上个星期骑车也摔了，现在两边腿都是淤血淤青，摔的时候被电车带出去了在路上摩擦了几米。在路上摩擦的时候脑子里第一想法是希望不要摔的太惨，还有千万不要有大车过来，爬起来后额头上擦伤了，差点破相。本命年还是有点玄学在的
1676466176,0,1,False,False,我的天哪真的很危险，尤其是摔倒头，之前有一次从自行车摔下来直接摔的昏迷了一会，看到微博受伤担心坏了没事儿就好…烤烤记得涂祛疤药！！
1676463992,0,1,False,False,封面图好像那个对着女友耳边唱大专rap
1676452335,0,4,False,False,烤姐我爱你！！，
1676452769,0,2,False,False,"烤姐和大虾要记得注意安全，保护好自己呀
还有，[热词系列_新年快乐][热词系列_大展宏兔]"
1676474593,0,1,False,False,大虾是不是把牙给磕到了！感觉不一样了，和烤姐好好休息吧[大哭]
1676468457,0,1,False,False,烤虾要注意安全！这种小山路真的很危险啊[大哭][大哭]
1676453724,0,1,False,False,天嘞！我听到车从身上轧过去的时候吓死了🤯我之前在路上骑小电驴，走神人飞到了机动车道上。当时觉得没什么，只是两个膝盖擦伤，但是后面真的会后怕，想到万一后面有车刹车不及时，我就寄了[大哭][大哭]太理解后怕的感觉了，同时也会觉得幸亏幸亏。
1676474199,0,1,False,False,我有一位老师上班的时候骑小电驴 头盔没系那个扣，出车祸的时候头盔飞了已经在医院躺了4个月 希望大家都注意安全吧[大哭][大哭][给心心]
1676462698,0,1,False,False,太吓人了，大家一定要平平安安的[拥抱]
1676474029,0,1,False,False,一定要小心[拥抱][拥抱][拥抱]
1676458807,0,1,False,False,道路千万条 安全第一条
1676467059,0,1,False,False,总感觉大虾另一半脸有点肿  可能是视频的缘故，大虾的侧脸是一直朝着我们的 但是另一半总感觉  看起来不是那么协调[笑哭]
1676463658,0,1,False,False,我玩过这个也撞树上了[笑哭]真的好难开
1676455847,0,1,False,False,烤虾一定一定要平平安安的[大哭]
1676454367,0,1,False,False,出去玩真的要好好保护好自己，看着好心疼[大哭][大哭]
1676470863,0,1,False,False,@小呆呆_-_ 大虾这个头发 我很想烫
1676456518,0,1,False,False,这个疤会一直有吗？
1676473942,0,2,False,False,唉 大家都要好好的[拥抱][拥抱][拥抱][拥抱][拥抱]
1676470224,0,1,False,False,一定要注意安全啊烤姐和虾！！好心疼[大哭]
1676473997,0,0,False,False,"淦，看了这么多评论感觉我那车祸算幸运的了……[囧]
我走读每天上下学自己开的电车。我家那辆车比较旧，轮胎特容易打滑。去年秋天有一回周五下午刚下完雨，我快迟到了就开的很快，四十多码那样狂飙。但我经常走的那条路就在今天下午刚刚装上了施工绕道的牌子（拦在机动车道路中间）我看到的时候已经来不及转弯了，（旁边是转入汽车道的路口）下意识地一扭车头结果连人带车侧翻且以青蛙的姿势滑行了10cm左右……[疼]四肢好几处伤，关节处都有伤口……特别是右手手掌，俩伤口其中一个掉了块肉，血顺着我的小臂哗哗流……左小腿被车压着有好几块淤青……总之看起来还挺吓人的。然后一个路过的叔叔停下了车帮我把车扶起来（不然我整个人抖得像筛子也没力气扶）我凭着自己的意志开车到了学校找到老师请了假。（现在想想我好牛逼）当晚就去了诊所，医生给我上双氧水的时候我差点疼晕过去……[灵魂出窍][灵魂出窍]好在大多只是轻伤……而且当时气温比较热我穿的是短袖+大裤衩+拖鞋（如果穿得长裤和运动鞋可能就没摔得这么惨……）不仅如此我在同一周的周一早上因为疲劳驾驶创上了绿化带，还好开得很慢只有两处擦破皮不然我就提前寄了[灵魂出窍][灵魂出窍]"
1676455580,0,1,False,False,好吧，可以理解
1676466258,1,1,False,False,"靠，我今年也是本命年，过年的时候也出车祸了[笑哭]
真的犯太岁"
1676453368,0,1,False,False,大家一定一定安安全全的！！看的我也怕[饿了]
1676453453,0,1,False,False,还好没大事[大哭]活着就好[大哭][大哭]
1676453680,0,1,False,False,我还以为是做什么失败了，原来是物理上的翻车
1676459690,0,1,False,False,没什么大事太好啦[打call]，还是多注意安全[脱单doge]
1676453382,0,1,False,False,衣服衣服！穿搭！[星星眼][星星眼][星星眼]
1676452498,2,1,True,False,烤姐帽子好好看呀！求链接！
1676471712,0,1,False,False,没事就好没事就好！还有那个……这个灰蓝色毛衣有链接吗[笑哭]
1676474343,0,0,False,False,最近在医院住院，期间进过一次ICU，心跳180完全停不下来呼吸不了，这是我最接近死亡的一次，事发突然医生完全无法理解，就除了把我推进ICU准备急救没有任何办法，我靠自己顶着飞快的心脏跳动慢慢缓过来了，真就是鬼门关去过一次了，那180左右的心跳真的很难受，这辈子都不想再经历窒息感的同时还要拼命忍耐心跳带来的波动
1676452912,0,1,False,False,烤姐都更了 大虾还没更 不用我多说什么了吧[doge]把号给烤姐大虾当摄像师[doge]
1676473326,0,0,False,False,草 貌似知道了大虾为什么新的一期视频被说质量不是很好了 大虾和烤烤注意安全啊[保卫萝卜_哭哭]
1676471545,1,0,False,False,我小时候被自行车轧过，耳朵软骨裂了，现在还是错位的；被面包车撞过，滚了几圈落到小水沟里，身上紫了很多；被摩托车撞过；也落过水，去河边游泳，我弟被水冲走了我来不及喊人，直接扑上去拉住他，结果我俩一起被冲出一大截，后来抓住一个大石头被大人看见了才被拉起来，然后小时候可能缺钙骨头没长好，很容易摔跤，经常走两步摔一跤……怎么说呢，能长这么大我自己也挺意外的，就是因为小时候经历了太多，所以我总是相信既然小时候受了这么多磨难，长大肯定平平安安啦！[脸红]
1676472191,0,0,False,False,烤烤一定要少玩这种不太安全的！特别是没什么经验的 我舅舅是玩越野车的 老手那种 有一次玩的时候整个车翻了 特别恐怖 一定要注意安全呀[给心心][拥抱]
1676467608,0,0,False,False,可是真的会担心很多事啊，比如一个人去外地读大学，晚上住酒店的时候我就会超级担心，有时候更是因为为了省钱，知道需要三思而后行可还是冒着一些风险，我不知道该迷信还是怎样，更多的时候是对生活的无力，这个社会会不会变得更好一些，东西会被抢吗，人会被伤害吗，做任何事情都会有风险，山地摩托车是的，滑雪，过山车，人类真的太脆弱太渺小了，
1676467926,0,0,False,False,不经历的时候大家都觉得自己是天选之子，后来总会有些事教会我们，每个人都是脆弱的生命
1676453213,0,1,False,False,太危险了[保卫萝卜_哭哭]都要好好的[拥抱][拥抱]
1676470631,0,0,False,False,真的不能不信犯太岁的说法 我爸去年是本命年 多少年都好好的突然脚崴了 没办法走路 拄拐杖一个月[灵魂出窍]
1676470121,0,0,False,False,我k，我前两天也翻车了，骑小电驴摔倒了，摔下去脑袋完全是懵懵的，运转过来的第一反应是，应该没有摔傻吧，如果摔傻了我家人该怎么办，肯定担心坏了，然后我直接打车去医院做了一个全身的检查，去的路上完全控制不住眼泪，特别害怕。不过也还好，没啥事。真的，开车一定要注意安全！过了两天我才发现我的头盔都给摔裂了[微笑]
1676473762,0,1,False,False,你们吃一堑 大家长一智[捂眼]
1676457720,0,0,False,False,这谁呢不同情啊，对陌生的两个人遇到这种事也会同情，何况是自己喜欢的两个up。万幸平安，祝大虾和拿拿未来平平安安，健健康康[爱心][爱心][爱心]
1676464771,0,0,False,False,我也是犯太岁了，今年不兔年吗，我属虎的，在和兔年交替这期间一直受伤，连着四五天每天都见点血，然后28号那天从梯子上摔下来了，右腿软组织拉伤，骨头没啥事，工伤直接在家休了5天，后来也没上几天班，离职了[捂脸]
1676458408,0,0,False,False,果然，人感觉自己生命受到威胁的时候都会觉得那一刻过得非常慢[笑哭]
1676452804,0,1,False,False,我以为你俩分了。。。敲
1676463772,0,0,False,False,"像这种摩托项目这一类型一定要考虑好要不要去玩,因为真的很危险,上一秒发现更新,下一秒僵硬了[大哭]"
1676465685,0,0,False,False,高中的时候早上五六点就要自己骑车去上学，有一回早上没睡醒，懵懵的，过了个红绿灯转弯正好和一个开的贼快的逆行电动车撞上，我倒了，身上各处都擦破了皮还是脸着地，那人飞快的骑走了。过了很久自己都爬不起来，好在后来我班长看到了来扶我帮我打电话载我回家。。后来调监控的时候警察叔叔说好险，，后来的大卡车差点就要压上去了…[委屈]大家都要注意安全
1676471566,0,0,False,False,好可怕啊[大哭]，幸好没事，一定要小心啊[拥抱]
1676467248,0,0,False,False,我记得好像是郭麒麟吧，原本扣扣嗖嗖的，总想着将来买想买的，经历过一次意外之后，感悟了很多，今朝有酒今朝醉，我的意思是，要像视频最后说的那样小心小心再小心，但是也要在很小心的情况下做自己想做的事，不要等走马灯的时候感慨自己有什么想做的事没有做，我觉得，最起码烤姐在这次事故的前一秒还是开心的。虾哥的事故原因找的倒是对的，我爸和我说过，开车就是不能太紧张，越紧张就越容易手脚僵硬，就越容易出事故，就和我前段时间开家里好久没碰过的车然后车小碰了一下一样，车前杠完全坏了，去修的路上，我爸告诉我，该开还得开，不能因为害怕就不开，要吃一堑长一智，下次再开不这样了就好了，不是说烤虾谨慎点不对吧，就是，下次攻略做详细点，危险系数高的避免去做就好啦，爬个山还有危险系数呢，就不爬山了么，不要因为这个事就失去感受未知领域的探索欲吧
1676468814,0,0,False,False,真的想象不到意外和明天哪个会先来[大哭]我来说一个，走路一定一定不要玩手机，注意力集中！无论是过马路还是没什么人的大街上，我有一次走路在想东西，结果抬头的时候发现自己前面大概一厘米的位置有一个很尖锐的钢管直指我的脖子，真的差一点就被扎到了，很危险[大哭]
1676464697,0,1,False,False,平安就好[大哭]
1676464041,0,0,False,False,懂了，这就去复习，不要对老师捞你存0.01%的侥幸心理[脱单doge]
1676472412,0,0,False,False,谢谢头盔[大哭][大哭][大哭][大哭][大哭]不然真的可能见不到🦐了[大哭][大哭][大哭][大哭][大哭]
1676470550,0,0,False,False,有一次也是平地玩山地摩托，第一次玩没经验，也没教练带，刹车的时候我习惯性的用脚去撑地，但是这个车的惯性比较大，轮胎又很重，差点压到自己的腿，还好及时停下来了，否则腿可能就被压断了……想想都后怕，所以真的不要侥幸。
1676471333,0,0,False,False,！我有个相似但是还差蛮多的经历 我大概四五年级那会 和姥姥她们去乡下玩 那个时候就有个特别火的小车 用两只脚开合开合来控制的 很好玩 当时我们在消食散步 然后快回房子的路上 有一个特别陡而且滑的坡 我也没多想 就这么直直冲下去 听到后面大人们的叫声我才反应过来 然后我那个车看着就要创到铁栏杆上了 我直接反应过来一个急转弯 现在想想真的很吓人 要是我没反应过来说不定真的会拄拐杖什么的[大哭]
1676467323,0,0,False,False,我靠！！！！！大家真的都要多多小心啊啊啊啊啊太危险了😭😭没什么特别大的事就好 万幸万幸
1676474987,0,1,False,False,幸好你们俩没什么事 要平平安安的呀！！！！！[给心心]
1676460005,0,0,False,False,天呐 听着我都要吓死了 以前去旅游在陡坡上骑山地自行车 从来没骑过却那天不知道抽什么风 但是回想起来很后怕 因为万一失控没刹住直接就飞进湖里了
1676459665,0,0,False,False,你们两个一定要好好的 虽然我们互不相识 但离开你们我真的会难过[大哭][大哭]
1676462526,0,0,False,False,天哪，差点给我看哭了啊，你们一定要健健康康，平平安安的！！[大哭][大哭]
1676462368,0,0,False,False,不管玩啥都要小心啊烤姐[tv_大哭][灵魂出窍]
1676463784,0,0,False,False,烤烤虾虾要安安全全的啊[大哭]担心死我了 想看烤烤分享一下假睫毛!和一些便宜的饰品 便宜便宜便宜的（学生党买不起贵的）
1676466303,0,0,False,False,今年年初八也是生命中第一次感觉离生命意外最近的一次，车祸发生在自己身上时的无助惊慌，会是一生难忘…
1676459104,0,0,False,False,大难不死，必有后福。死劫已过，百无禁忌。大虾烤姐加油鸭!
1676463949,0,0,False,False,真的大家都要保护好自己[酸了]
1676471336,0,0,False,False,骑电动车撞树上了下巴骨裂吃了两个月流食（闭目）
