上传时间,回复数,点赞数,up是否回复,up是否点赞,评论文本
1676467551,0,0,False,False,骑电动车的时候也一定要记得带好头盔，绑好，不要觉得别人让你戴头盔是害你，头盔在特殊时候真的可以保命！！！
1676464763,0,1,False,False,以后都要多注意哦！大家都注意安全
1676473257,0,0,False,False,天哪 好好养伤 之后一定要谨慎一点 不过真的算幸运了
1676464103,0,0,False,False,我去游乐园，只会玩玩打枪之类的，不会去玩任何的机动游戏
1676465143,0,0,False,False,小时候调皮爬栏杆，然后一不小心摔下来正好摔在楼梯角上，把距眼睛一厘米不到的地方摔了一个长口子，不幸中的万幸，当时衣服前面流的都是血，现在还是一个口子的形状，[委屈][委屈]
1676462647,0,0,False,False,哦莫 姐姐和大虾是不是瘦了[灵魂出窍]感觉下颚线更明显了
1676455734,0,0,False,False,玩游戏玩的飘了，虽然是互联网高玩，但是你俩体质纤弱还是不要玩这种耗费力气的刺激项目，居然没驾照骑山地摩托！我听你俩讲，我也跟着担心……还好你俩现在看起来都已经没事了！今年你俩做事都谨慎哟 希望都好
1676464024,0,0,False,False,你们两个是越来越有夫妻相了 [嗑瓜子]
1676465826,0,0,False,False,啊救命好吓人，颠覆认知了，居然是真的会危险[惊讶]
1676471601,0,0,False,False,哇 好危险 我突然想到刘芸跟鲍蕾玩的就是这个吧 可能因为她们的场地稍微平坦一些
1676456538,0,0,False,False,本来以为是笑话，结果发现这是真的可能死人的[灵魂出窍][灵魂出窍][灵魂出窍]小心点啊
1676459159,0,0,False,False,初中的时候流行脱靶骑车，人菜瘾大结果摔得差点破相，自从那次后变得特别惜命了……[笑哭]
1676469833,2,1,False,False,你们是在深圳龙华那家卡丁车店玩的吗？？！
1676459193,0,0,False,False,差点就见不到你们了[大哭][大哭]大家都要注意安全啊[大哭]
1676457754,0,0,False,False,真的不敢想如果真出事了怎么办，大家一定都要平平安安的
1676457964,0,0,False,False,太可怕了，希望烤烤和大虾以后要好好的呀！身体最重要[拥抱][拥抱]
1676462418,0,0,False,False,真的是有命在的……必有后福！[保佑]
1676462419,0,0,False,False,保护好自己，大家都健健康康！
1676457808,0,0,False,False,也算是 过命的交情了 以后要好好的[拥抱]
1676472661,0,0,False,False,今年大年初二我小姨一家也出了车祸，她尾椎骨粉碎性骨折[保卫萝卜_哭哭]现在都还没养好
1676455331,0,0,False,False,天呐……太危险了 好心疼你们俩 虾虾是个很善良的人 不要给自己太多压力[拥抱][拥抱]
1676462326,0,0,False,False,我的天呐，吓死了[保卫萝卜_哭哭]以后千万千万要小心
1676467170,0,0,False,False,我也是一紧张越想着不能不能怎么样 反而就会变成这样[呆][呆][呆][呆]
1676454742,0,0,False,False,摸摸笨蛋小情侣 希望过了这道坎今年就不会有其他意外发生了[拥抱]
1676459134,0,0,False,False,太恐怖了我就说你们怎么这么久没更新 一定要平平安安的呀两个人
1676469174,0,0,False,False,不得不说，中国人不信闲神[大哭]我看了这个视频才想到，我本命年2016年的时候，我去参加小升初学校点考，就出车祸了（在医院住了一个多月）。虽然不是很严重，但也是伤到了眼皮周围（和烤姐一样）、右耳周围（和大虾一样！！）和面部其他地方，疤痕到现在还在。。。犯太岁是不是都是这个表现啊[灵魂出窍][灵魂出窍]
1676456369,0,0,False,False,大家本命年一定要小心！！！我身边几个都出事了[捂脸][捂脸][捂脸]真的好可怕
1676455124,0,0,False,False,都给我平平安安的[大哭]你俩吓死我了…走马灯那里让我想起来小时候，有一次我被瓷砖绊到了，肚子着地摔在地上半休克的时候，就是在看走马灯还又混乱又缓慢[酸了]另外就是一定要做好防范啊不要有侥幸心理米娜桑
1676455749,0,0,False,False,我记得我之前晚上骑自行车从一个大坡摔到了一个2米左右的坑里，摔下去的过程真的会感觉是一帧一帧的，然后就没有什么意识了，后来我也不知道多长时间我睁开眼看见自己在坑里车在我腿上压着，在我头的旁边就是块石头，幸亏没有什么事就是有不少擦伤，大家骑车什么的一定要注意安全，太危险了，现在真的后怕[大哭][大哭][大哭]
1676454845,0,0,False,False,你俩好可爱，可爱中又带着一丝搞笑。下次一定要小心点啊啊啊
1676466466,0,0,False,False,我初七的时候想贴紧一点对联，然后就从椅子上摔下来了，下面还有一堆大石头硌到盆骨，我也觉得我犯太岁
1676459260,0,0,False,False,突然想起来我前两天骑小黄车为了避让老人打滑人飞出去那件事，当时人都摔懵了[大哭]
1676455548,0,0,False,False,看得我都疼，下次可一定要注意安全呀![大哭][大哭][大哭]
1676455723,0,0,False,False,作为一个骑电动车都摔了很多次的过来人，有时候摔不是因为没反应过来，是反应过来了也操作不来，技术不到位，祝大家平平安安健健康康[脸红]每次摔了都会后悔，但是每次都会意外的摔[保卫萝卜_哭哭]
1676455029,0,0,False,False,虾真的好内疚。。
1676455419,0,0,False,False,大家在做某件自己没接触过或者有点风险的事情时都要提前做好功课！！可以查查小📕 或者dy b站！
1676470113,0,0,False,False,我靠烤姐。。。看着好痛 要小心嗷[大哭]
1676452914,0,1,False,False,烤虾注意安全！
1676457502,0,0,False,False,救命啊 一点也不伤感的bgm我盈泪看完的…
1676469978,0,0,False,False,还好现在恢复地差不多了！5555大虾和烤姐必有后福！[保卫萝卜_哭哭][保卫萝卜_哭哭]
1676454617,0,0,False,False,大虾肉眼可见的内疚[保卫萝卜_哭哭][保卫萝卜_哭哭]这种事情真的很可怕😱大家都要照顾好自己
1676454598,0,0,False,False,宝贝一定要注意安全 健健康康的[保卫萝卜_哭哭]听着就很痛
1676456426,0,0,False,False,看了赶紧去帮我爸妈买了红绳，希望大家都平平安安的[保佑][保佑]
1676455716,0,0,False,False,理性分析一波事故，对山路和车的了解程度不够，视频里面左前轮已经怼上去了就应该打反方向退一点，再前进。各位进行这种项目还是要了解一下相关知识再去最好。（勿喷）
1676455481,0,0,False,False,好吓人啊，两个人都差一点点，听得我心悸[tv_晕]
1676452389,0,2,False,False,注意安全啊！！！！！
1676466674,0,0,False,False,一起经历了生死的人一辈子就得在一起了
1676461882,0,0,False,False,安全最重要啊啊啊啊啊！！！！！
1676455741,0,0,False,False,没事就好，我的天，一定要安安全全的啊[大哭]
1676460630,0,0,False,False,我之前骑着共享单车过斑马线的时候也是被车撞了，根本就是反应不过来说往后退或者往前走什么的，脑子一片空白，幸好的是那个司机及时刹车，只有车头和我的单车夹住了我的腿没什么事，后面回去就真的是一阵阵后怕，以后过马路都是等车过完了才敢过了[大哭]
1676474283,0,1,False,False,我每次开长途车之前我都会看一边事故视频[doge]
1676455214,0,0,False,False,好心疼，大家一定要多注意安全啊，平平安安才是最重要的！
1676455536,0,0,False,False,天呐 心疼烤烤和虾 千万小心啊[灵魂出窍][灵魂出窍]
1676457994,0,0,False,False,原来微博里说的买金会出视频是这个原因啊 一定要平平安安的！你们俩大难不死一定必有后福[打call]
1676457220,0,0,False,False,太危险了！这种刺激项目大家还是少玩，安全保障低不说，签了那种合同很可能出了事老板会用那个合同来赖账不负责任的。
1676467363,0,0,False,False,注意安全啊大家都[大哭]要平平安安
1676468001,0,0,False,False,没事，以后小心点[给心心]，还是超帅超美的[打call][打call]
1676468106,0,0,False,False,好危险啊，它那个路还没有护栏[囧]
1676466911,0,0,False,False,人没事就好，真的太吓人了
1676462042,0,0,False,False,天哪 大家一定都要小心！平安健康
1676464646,0,0,False,False,这视频仿佛在讲我自己，情景再现了属于是[大哭]过年的时候我也翻车了，一样的我会开三轮车我妹不太会，然后我没开是我妹开，一样的驾驶人没控制住方向，一样的摔了以后我妹很自责，一直在问我有没有事。[辣眼睛]直接翻进路边的排水沟里，痛了好多天
1676474024,0,0,False,False,一开始还以为是你们两家暴互殴[捂脸][捂脸]
1676470753,0,0,False,False,这种还是要专业人员来开，太危险了
1676468629,0,0,False,False,烤虾平平安安啊，听着就害怕啊[保佑][保佑][保佑][保佑]
1676459606,0,0,False,False,大虾要小心啊，要是你出事了，我还怎么看你的视频啊[拥抱]
1676452831,0,1,False,False,我靠小心啊md
1676455525,0,0,False,False,烤姐和大虾要小心哇
1676468993,0,0,False,False,大虾烤姐出行千万千万注意安全！！！回想起来都好后怕
1676456502,0,0,False,False,这种路看起来是真的很危险
1676461583,2,0,False,False,等等等等等大虾视频不是说和烤姐网恋奔现么？怎么又说大学就开车载着大虾难不成高中网恋考到一个大学？！
1676455759,0,0,False,False,催更过的我正在疯狂扇我自己[大哭]
1676463847,0,0,False,False,好危险啊啊啊啊！真的要注意安全！！！[tv_难过][tv_难过]
1676472568,0,0,False,False,省流：狂飙失败
1676460399,0,0,False,False,你俩给我注意安全听到没有[妙啊]
1676456418,0,0,False,False,太危险了，注意安全啊[拥抱]
1676454401,0,0,False,False,感觉差一点就看不到你俩了 幸亏虾的头盔没有掉 太可怕了
1676463402,0,0,False,False,天哪，好危险这么一看，我的天，，，，
1676459071,0,0,False,False,我也是今年过年的时候去玩了这种山地车，根本不是想象中那样！！！而且我是一个人开，整个人紧张得不行，全身僵硬的龟速开完！！虽然回来被笑话开成这样，但这种谨慎小心不会错的！！！
1676470592,0,0,False,False,好险带了头盔，一定要戴头盔戴稳点
1676465944,0,0,False,False,保护好她 大虾“责任好吧”有困难家人朋友@我 我尽力
1676474388,0,0,False,False,[大哭]好危险 一定要注意安全
1676452419,0,1,False,False,大难不死，必有下回一定[doge]（别别别，安全第一，人没事就好）
1676467841,0,0,False,False,有一次我差点掉悬崖，要不是我后面有人拉我一把，我可能就没了[灵魂出窍]
1676465850,0,0,False,False,防护要做好，我的天[捂眼]
1676453117,0,1,False,False,[保佑][保佑]平安喜乐[保佑][保佑]
1676462293,0,0,False,False,我朋友之前亲眼目睹了一场车祸，她和她妈妈一起上街买年货，妈妈在前面骑车，结果一辆货车来了，可能是妈妈的自行车刹车不太好使，亮红灯了还在跑，妈妈也没反应过来，一辆货车开过来，妈妈连人带车被撞飞了，还好妈妈有很强的防范意识，戴了头盔、护腕和护膝，才没有被撞死，后背重重摔在地上皮都磨破了一大块，当时我朋友给我发照片时真的胆战心惊，连续几天她她的声音都有点发颤，姐妹们出门一定要戴好头盔、护腕、护膝，骑车之前一定一定要检查一下刹车，希望这样的事故不要再发生。[保佑][保佑][保佑]
1676463975,0,0,False,False,安全第一啊宝们，太危险了真的
1676470958,0,1,False,False,[拥抱][拥抱]
1676463539,0,0,False,False,所以保险赔了吗[傲娇]
1676470196,0,0,False,False,车轮 压头上[2233娘_吃惊]感觉好恐怖 真是太幸运了
1676456490,0,0,False,False,大家都要注意安全啊[大哭]
1676453461,0,0,False,False,鸟姐好棒 大虾也别太自责了 呜呜 你们俩要永远在一起！
1676472319,0,0,False,False,吓死我了，点进来之前我以为大虾和烤姐要分手[大哭][大哭]
1676453819,0,0,False,False,省流：翻车了，家银[大哭][大哭][大哭]
1676459158,0,0,False,False,[拥抱][拥抱]抱抱你俩，太惊险了！
1676463978,0,0,False,False,一方面拐弯拐早了，最重要的速度不够，虾太谨慎了，要是速度够应该也是平安无事的，最后俩人没事是最重要的[给心心]
1676470553,0,0,False,False,哇！好担心啊，两位记得多休息啊！
1676455310,0,0,False,False,呜呜小烤和大虾要健健康康!
1676453447,0,0,False,False,现在听你们两个说我都后怕，希望今年的厄运已经全部没了[保卫萝卜_哭哭]从今往后健康幸运下去[拥抱]
1676465615,0,0,False,False,真的好吓人啊，还好没有太大问题π_π
1676454095,0,1,False,False,好痛哭哭
1676454062,0,0,False,False,好吓人啊，我好喜欢你们，千万要小心[委屈][爱心][爱心]
1676470467,0,0,False,False,这个山地摩托真的很难开很吓人，我是之前刷到鲍蕾开山地摩托，本身她开车经验就很丰富加上她也足够大胆。大家都要注意安全！平平安安的！
1676472312,0,0,False,False,大难不死，必有后福。
1676453353,0,0,False,False,救命真的很吓人…一定要平平安安的呜呜呜
1676453469,0,0,False,False,"怎么办？我朋友今天胃疼，她说“我胃疼的时候会发生不好的事情…”就…结果….…

我朋友是预言家！！！！"
1676455435,0,0,False,False,真的好危险啊我的天 还好没事
1676456017,0,0,False,False,woc我为我心里催更打脸[大哭]
1676453440,0,0,False,False,天哪我都不敢想大虾要是头盔掉了会咋样  刚过完年大家都平平安安吧
1676453844,0,0,False,False,天，太可怕了，注意安全啊
1676456589,0,0,False,False,徐大虾你小子怎么变帅了
1676453902,0,0,False,False,我也玩过这种，我给我爸载的时候，他还让我们带安全帽，但骑的是沙滩，不过教练突然叫我们坐上他的车，是五人坐的那种，很大台，还要我们把安全帽脱下来，说要带我们玩刺激的，然后就带我们去飙沙，是那种特别陡的沙坡，还带我们去飙山，那个山路特别窄，就能正好让车过去，特别恐怖，还飙的特别快，主要是那个车没有安全带，我们也没带安全帽，不过是教练开的车，但还是挺危险的
1676453279,0,0,False,False,我天，真的好危险，前几天坐朋友的车，我坐副驾驶，由于一些突发原因撞到绿化带上了。快撞上去的那一秒我也在那走马灯，人都吓傻了。以后一定要注意安全[保佑][保佑]
1676453510,0,0,False,False,看了视频去搜了一下今年犯太岁的属相 吗的原来我也犯[大哭][大哭][大哭]
1676453380,0,0,False,False,烤烤的伤看着好心疼啊 一定很痛吧当时[大哭]抱抱 给你传好运 接下来顺顺利利平平安安
1676464648,0,0,False,False,天啊[大哭][大哭]没事就好没事就好 必有后福
1676453380,0,0,False,False,天啊，太危险了，以后一定要注意安全！！！
1676453353,0,0,False,False,突然感觉自己曾经催更好不是人[委屈]
1676467331,0,0,False,False,没事就好，先好好休息，过段时间再慢慢更视频吧！观众都会理解的[给心心]
1676455963,0,0,False,False,我胆小到不敢开骑车[大哭]
1676456553,0,0,False,False,烤烤和大虾要注意安全啊！[大哭][大哭][拥抱]
1676472465,0,0,False,False,真的很危险啊 万幸没伤到眼睛
1676464661,0,0,False,False,@毛利探長 但凡有危险的我俩都不去！
1676454272,0,0,False,False,一定要注意安全呀！！！！！！[大哭]
1676453652,0,0,False,False,两个人都要好好照顾自己啊，以后都要小心一点了🤧OMG我想想都害怕
1676453514,0,0,False,False,烤虾要注意安全啊[脱单doge]
1676474385,0,0,False,False,太危险了，一定要注意安全啊
1676455698,0,0,False,False,没事就好啊没事就好[拥抱]
1676467571,0,0,False,False,做任何事情都要小心谨慎，安全第一
1676453489,0,0,False,False,大家也一定要注意安全呀，好危险的说[难过][难过]
1676470621,0,0,False,False,这辈子不会玩这个东西了[囧][囧]
1676454138,0,0,False,False,天呐，抱抱烤姐[拥抱]以后一定要注意安全！
1676454501,0,0,False,False,天呐好吓人 幸好没事
1676455652,0,0,False,False,天啊……注意安全真的……
1676453489,0,0,False,False,我也是，初五摔伤左侧骨粉碎性骨折了，做了手术现在还在卧床，什么叫意外，这就是意外[tv_难过][tv_难过][tv_难过]
1676453441,0,0,False,False,一定一定要注意安全！尤其是这种要买保险的运动
1676453476,0,0,False,False,md看完了 没有什么想说的 希望我的偶像大虾还有女神烤姐好好的吧
1676454312,0,0,False,False,我去啊碾过去 还两次 好险啊[酸了]
1676470367,0,0,False,False,好可怕啊，一定要注意安全啊
1676453301,0,0,False,False,最后没大事就好[大哭][大哭]虾虾烤烤都要好好的55555
1676456301,0,1,False,False,之前玩过这个有驾照会开的话还是很爽的
1676472052,0,0,False,False,[跪了]好危险，注意安全啊
1676460004,0,0,False,False,差点就失去你们了[大哭][大哭][大哭][大哭]
1676473939,0,0,False,False,唉，真的是万幸，一定要注意安全
1676456802,0,0,False,False,好好养养，太吓人了[灵魂出窍]
1676455152,0,0,False,False,我趣太吓人了，幸好没事
1676461934,0,0,False,False,天啊 好危险 还好人没事！
1676453713,0,0,False,False,对不起我不该催更[大哭]
1676466109,0,0,False,False,省流：物理翻车
1676468805,0,0,False,False,天呐，祝大家永远平安🙏
1676453151,0,0,False,False,啊啊啊啊啊啊好恐怖！要注意安全呀！
1676454105,0,0,False,False,我骑自行车也在山上翻车过，但是听到车碾过去还是吓到了
1676463006,0,0,False,False,好恐怖😱，有没有伤到骨头！
1676474765,0,0,False,False,。。。我今天刚从电动车上摔了下来[笑哭]
1676453155,0,0,False,False,我懂，我也是很小心的人，但每次一出事情就是大事，搞得现在太小心了。
1676453942,0,0,False,False,平安健康最重要[拥抱][拥抱][拥抱]
1676453420,0,0,False,False,难怪大虾那么久没更新
1676454308,0,0,False,False,幸好没事！以后一定一定一定要注意安全啊！！！
1676470188,0,0,False,False,大家都要注意安全啊，不管是开车还是平常走路啥的[大哭]
1676469190,0,0,False,False,大家都要平平安安的[拥抱]
1676467747,0,0,False,False,烤的那个疤离眼睛好近………烤烤大虾都要小心呀[保卫萝卜_哭哭]
1676473823,0,0,False,False,光听描述都好痛 好好养伤吧
1676459674,0,0,False,False,很可怕欸，要注意安全
1676457264,0,0,False,False,天哪一定要注意安全呜呜呜
1676454362,0,0,False,False,一定要注意安全啊！太危险了
1676456080,0,0,False,False,滑雪摔倒后脑勺找地，还好有头盔，虽然头直接摔得蹦起来了，事后也就有点懵没其他大事，干什么安全措施一点要整好，不能抱有侥幸心理[保佑]
1676457866,0,0,False,False,注意安全 平平安安！！！[大哭][大哭][大哭]
1676457189,0,0,False,False,以后要好好注意安全！！！[拥抱][爱心]
1676463579,0,0,False,False,[大哭][大哭][大哭]心疼烤姐和大虾
1676472877,0,0,False,False,真的好吓人，刚刚看到封面差点没认出来，一定都要注意安全，平平安安！
1676454664,0,0,False,False,你们俩一定要好好的[大哭][大哭][大哭]
1676473723,0,0,False,False,烤姐千万注意安全！[大哭][大哭]
1676468811,0,1,False,False,不好意思 打扰大家 找工作被坑 饿了一天 有好心人请吃个饭的吗 谢谢大家 照顾好自己 注意防护 注意安全
1676454922,0,0,False,False,我不要看这个我要看撒狗粮
1676461982,0,0,False,False,救命好危险[大哭][大哭]抱抱
1676458428,0,0,False,False,必有后福呀烤烤和大虾！[保佑][保佑][拥抱][拥抱]
1676461312,0,0,False,False,大家都要健健康康平平安安啊
1676453216,0,0,False,False,还好没什么大事，万幸万幸[爱心]
1676454395,0,0,False,False,好吓人啊保护好自己啊[大哭]
1676454738,0,0,False,False,春装分享！！[星星眼]以及小烤和大虾注意安全哇！一定要小心小心！
1676457258,0,0,False,False,天啊  我说你们俩怎么那么久没更新  有段时间天天看你们有没有更新  久了就有点害怕不会出了啥事吧  但是想着是新年吧可能去玩了  没想到真的出事情了   心疼你们[拥抱]以后出去玩一定要做好安全防护 小心小心再小心  希望大家都平平安安的[给心心]
1676452963,0,0,False,False,生命真的很脆弱，珍惜眼前人
1676453871,0,0,False,False,没事就好，没事就好[囧]
1676464927,0,0,False,False,看封面我以为是得猫藓了
1676457127,0,0,False,False,我去不幸中的万幸了
1676468108,0,0,False,False,天哪 大家都要平平安安啊
1676452967,0,0,False,False,太恐怖了 以后一定要做好攻略啊 现在没事就好[拥抱][拥抱]
1676473351,0,0,False,False,烤姐大虾都要好好的[拥抱][拥抱][拥抱][拥抱]
1676464497,0,0,False,False,99年大年初一在景区骑双人自行车也被伤到了，明明有很多都是只有小孩自己在上边骑，就我撞墙伤到了，不会真有什么说法吧[囧]
1676453051,0,0,False,False,我小时候也因为骑单车撞到别人家的柴，然后整个人飞出去好几米远，还好我摔下的地方是田，所以我没什么事，真的好险
1676455873,0,0,False,False,骑电动牙摔掉了😫
1676453662,0,0,False,False,大家都要平平安安啊[灵魂出窍]
1676464218,0,0,False,False,想看平时用的多的，衣帽鞋袜生活用品都可以
1676452982,1,0,False,False,注意安全啊！！！！！完形没有大事！
1676463335,0,0,False,False,太危险了吧 注意安全啊希望大虾烤姐大家家人都要平平安安健健康康的
1676470618,0,0,False,False,@陈大才- 真的好危险[灵魂出窍]
1676468270,2,0,False,False,这两个人去查一下血缘吧。看起来真的像
1676465754,0,0,False,False,太危险了啊啊啊啊啊啊啊希望我们都要平平安安的啊
1676452693,0,1,False,False,1分钟前，大家注意安全
1676456225,0,0,False,False,啊啊啊aa！吓死了！你俩没事就好！[大哭]
1676455279,0,0,False,False,注意安全呀，现在身上还疼吗
1676455758,0,0,False,False,我的天！注意安全啊
1676452323,0,2,False,False,[星星眼][星星眼]好巧
1676454277,0,0,False,False,平安健康啊呜呜呜
1676461291,0,0,False,False,真的你们要小心啊，好好休息一下吧，粉丝就先别催更了，注意安全
1676457809,0,0,False,False,啊啊啊啊啊太吓人了 要注意安全哇[大哭]
1676472691,0,0,False,False,好吓人啊，注意安全
1676455127,0,0,False,False,抱抱，爱你们，万幸[爱心][爱心][爱心]
1676453107,0,1,False,False,[打call]
1676452961,0,0,False,False,一定要防范于未然呀
1676452960,0,0,False,False,天哪出去玩一定要注意安全[拥抱][拥抱]
1676469546,0,0,False,False,摸摸 一定一定要注意安全
1676454163,0,0,False,False,啊真的注意安全啊
1676456283,0,0,False,False,还知道更新 我好感动
1676458867,0,0,False,False,一定要注意安全！安全第一
1676474439,0,0,False,False,注意安全啊烤烤[拥抱]
1676457150,0,0,False,False,kao姐真的好漂亮
1676452838,0,0,False,False,注意安全啊以後玩新鮮事物[笑哭]
1676459846,0,0,False,False,我的妈呀真的好危险呜呜呜[大哭]
1676472513,0,0,False,False,心疼kaokaoniao
1676452856,0,0,False,False,烤姐注意安全！一定一定！
1676453441,0,0,False,False,平平安安，健健康康
1676453210,0,0,False,False,好可怕，下次多多注意安全吧
1676458506,0,0,False,False,天啊，幸好没什么事[大哭][大哭]，抱抱烤姐[拥抱][拥抱]
1676466872,0,0,False,False,啊啊啊啊啊注意安全啊真的好危险!!!!![保卫萝卜_哭哭][保卫萝卜_哭哭][保卫萝卜_哭哭][保卫萝卜_哭哭]好在烤姐和大虾没有太大事[doge]万幸了[吃瓜]
1676452715,0,0,False,False,好危险烤姐和大虾以后要注意安全！！
1676455010,0,0,False,False,注意安全啊！保护好自己
1676454209,0,0,False,False,你们一定要好好的在一起呀
1676471064,0,0,False,False,[拥抱]别太自责
1676473450,0,0,False,False,还是要戴好头盔
1676474455,0,0,False,False,感觉大虾要哭了
1676472228,0,0,False,False,出去威一定要带头盔[嗑瓜子]
1676464122,0,0,False,False,我去 太恐怖了
1676452646,0,0,False,False,芜湖~在我生日这天发视频了艾 好棒[星星眼][星星眼]
1676467727,0,0,False,False,内疚一辈子了…
1676452754,0,0,False,False,我敲，我说大虾怎么不更新呢，小心嗷，安全第一[doge][doge][doge]
1676452706,0,0,False,False,我说怎么一直不离开阿b，原来在等你[doge]
1676454592,0,0,False,False,真的很危险啊
1676467087,0,0,False,False,一定要注意安全啊，天呐
1676465237,0,0,False,False,大家都要平平安安的
1676457538,0,0,False,False,呜呜呜好吓人啊[大哭]要好好的
1676454613,0,0,False,False,什么是太岁
1676466073,0,0,False,False,真的真的要注意安全！！！！
1676454568,0,0,False,False,平平安安
1676456368,0,0,False,False,人没事就好[大哭][大哭]
1676463573,0,0,False,False,抱抱徐鸭
1676452380,0,1,False,False,烤姐注意安全啊啊啊啊
