上传时间,回复数,点赞数,up是否回复,up是否点赞,评论文本
1676121926,186,4137,False,False,全人类就坐等一个聚变反应堆了，真的希望能看到第五次工业革命的到来。话说，应该算第五次工业革命?
1676174006,38,1015,False,False,ITER确实不看好，扯后腿的太多了。咱们自己国家得有一个自己的，千万别把鸡蛋全放这簸箕上
1676121315,29,1933,False,False,坐标都发出来了，郭导快来化缘啊~[脱单doge][脱单doge][脱单doge]@郭帆FrantGwo  @电影流浪地球
1676176931,39,831,False,False,我兔不是说嫌弃造得太慢，自己造一个一模一样大小的自己国内玩吗？况且现在法国那个速度加快是我兔加入以后才快的，而且那些零件生产拖拖拉拉，连拖拉著名的法国人都看不下去，把大部份零件生产都转移到了中国。
1676120391,10,1697,False,False,好家伙，炫一楼嘴里。
1676141836,26,987,False,False,阴谋论一下，美国人不可能搞先出来，因为能源和军工不在国家手里，快搞成的时候估计又有科学家要自杀了。[doge]
1676120855,13,977,False,False,[Cat2_Chaos][Cat2_Infinite!][Cat2_Cross!][Cat2_Launch!]
1676187426,2,61,False,False,我看电影的时候只想着未来科技真好，什么都能建造，现实里根本完成不了。没想到，是我太肤浅，科学从不止步，人类向前永无止尽。
1676190883,3,65,False,False,中核：吾与城北徐工淑美？
1676121296,28,116,False,False,现在都这么高调了吗[吃瓜]
1676137376,9,106,False,False,印象里记得这个项目就是因为其他国家拖进度，所以我们自己又修了一个在国内[微笑]
1676194582,3,37,False,False,如果说核弹能把一个民族的历史分成上下两截，那可控核聚变将能够把一个文明的历史分成上下两截。
1676166665,2,54,False,False,[热词系列_三连][热词系列_三连]
1676197446,5,23,False,False,原来托卡马克装置这么大！我看央视拍的怎么好像电饭锅。
1676283277,3,15,False,False,突然想到。。未来都是手持核聚变设备。而我们这辈80后疯狂的吐槽，这玩意有辐射！！[辣眼睛][辣眼睛][辣眼睛]
1676167709,2,134,False,False,说到人造太阳那就不得不提我们合肥了[妙啊]
1676170700,3,31,False,False,我的第一反应，这是……可以放出来的[doge]
1676177041,3,27,False,False,为什么我形象中总觉得国际合作就是效率低？
1676139475,0,38,False,False,不要让国际合作项目，成为他人搜刮中国科研人辛苦成果的温室
1676299871,0,5,False,False,有一说一，看到这些国旗在一起有些莫名小感动
1676167267,2,29,False,False,以现在的国际形势来看，烂尾的几率十分大！
1676176361,7,25,False,False,《中国太阳》版权在谁手里，快来化缘[doge]
1676143387,7,6,False,False,我怎么记得国内也搞了一个，进度比这个国际的还要快。[脱单doge][脱单doge][脱单doge]
1676167494,6,30,False,False,ITER只可惜不在中国建造。按进度，中国算是按时完成了自己的份额。其他老六不好带。
1676159857,0,19,False,False,说实话，这玩意在欧洲就现在这个局势，不太放心。会不会局势不好的时候把国家摘出去。反正就是不太放心。
1676178076,0,26,False,False,不太看好这个，项目进度拖拖拉拉的，还是更看好国内自己在合肥搞的那个。
1676120701,8,24,False,False,ITER好大，难怪要靠国际合作
1676174656,6,16,False,False,这个跟咱们没啥太大关系，装置在欧洲，中国只是参与，真成了第一个就会把中国踢出去，管你付出多少，就算郭导想去取景，你说的算吗
1676166969,1,21,False,False,实际上中国能参与进来的主要原因，是中国在这方面领先，而美国在这个开建之前，基本处于空白阶段，懂了吧？
1676177697,1,16,False,False,你仿佛在勾引郭导演“快来呀，球3拍我！球3拍我”[doge]
1676136839,3,22,False,False,"自己搞也许比这个靠谱一些[OK]
几个合作国各怀鬼胎，美俄出工不出力，人家还要靠卖油过日子，日韩印技术跟不上……真心做这个的只有我们和欧盟，欧盟还心不齐[辣眼睛][辣眼睛][辣眼睛]"
1676186706,0,4,False,False,这个是550w自主决策，自主规划建的吗？
1676161521,0,12,False,False,不好看，进去拆了三个小时都没能偷走[doge]
1676275867,0,5,False,False,郭导，中核已经疯狂暗示小破球3可以来这里拍了！！！
1676200165,13,13,False,False,和西方合作，是对整个人类的不负责任
1676147314,6,16,False,False,看到这个我有点担心，万一当年欧洲伽利略导航卫星的事情再来一次就很头疼了，浪费时间金钱，不知国内项目进展如何？
1676122416,0,10,False,False,解放生产力的第一步！[星星眼]
1676139325,0,12,False,False,点开视频。。。玛德，泄密。。。[tv_发怒]一看账号！卧槽！[tv_吐血]官方？？？
1676161357,6,13,False,False,这破东西有生之年够呛能成功的，毕竟各国都有自己的小九九，15年了才建成这些，核心还遥遥无期…
1676164477,0,13,False,False,@中核集团 把你的拿出来，别藏着，知道你已经成功了！[抠鼻]
1676172103,5,18,False,False,说实话，不看好这个，国家太多，扯皮都扯不完，还是自己搞成功率高一点
1676214886,3,9,False,False,可控核聚变规模化如果成了，化石能源可能就废了。。真的要警惕资源垄断巨头的阻挠
1676196782,4,9,False,False,有一说一我国托卡马克是五常里玩的最溜的，仿星器欧洲那边（德国）玩的好一点，惯性约束好像都没有头绪，但是我国王淦昌（两弹一星元勋之一）院士主持的神光3大功率激光发生器项目有希望（诱发核聚变）。
1676134477,0,18,False,False,你是不是想尽办法要在3里面露脸？哪怕被炸毁的那种[笑哭]
1676189395,0,3,False,False,支持并感谢科学家们的努力
1676177119,5,9,False,False,东西不错，不过视频有着几乎所有国企发的视频都有的问题：BGM和视频内容对不上，节奏也不太好。
1676197240,1,3,False,False,"外行人看不懂只有一句厉害！
内行人看得懂只有一句就这？"
1676200303,0,3,False,False,开车去两个小时，不过不可以参观[tv_doge][tv_doge]地图上都打码了[tv_doge][tv_doge]
1676163107,2,9,False,False,[嗑瓜子]不看好，让人类保持团结和理智一样都是奢望，早晚得互相扯皮中黄了
1676463603,0,1,False,False,ITER的目的是试验工程，第二阶段是依托ITER的数据建立示范发电堆，第三阶段是建立示范商业堆。最初ITER工程预计2023年竣工，现在这效率怕是2033年也建不成，不过国内的工程聚变堆有望在35年建成。托卡马克堆对于人类来说已经是工程问题了，或许这次真的可以脱离50年循环，但愿不是以太之于光速。
1676160532,3,9,False,False,说实话，我还是更看好我国单独搞的那个堆，貌似在成都还是哪来着？
1676410423,1,1,False,False,快去请马村长来，这里有一个很屌的炉子[doge]
1676273425,0,3,False,False,550w   你不要试图给人类做此类精神建设，我们有准备！[脱单doge]
1676436846,0,1,False,False,这东西的核心部件就中国的已经造出来了，其他国家的慢慢等吧，与其期待这个还不如自己国家搞，咱们托克马克装置世界领先的
1676164036,3,8,False,False,设置个系统权限，免得白皮反悔
1676254896,0,6,False,False,流浪地球3幕后采访：导演把我们的反应堆借走了。
1676169831,4,12,False,False,不太看好这玩意，因为各个国家的研究进度是不一样，并且投入的资金，人才也是不一样的，而成功以后难道是直接共享技术吗？我是没有那个胸怀，我只想让我们中华民族独步天下
1676120584,1,24,False,False,炫我嘴里炫我嘴里！！
1676121969,0,15,False,False,省流，第一面是🇨🇳
1676177909,0,8,False,False,这都是国家掏钱，要是下回电影方借用拍摄说不定还可以得到民用资金注入。可以可以！
1676137278,0,9,False,False,众所周知，流浪地球是纪录片
1676156701,18,8,False,False,如果，我说如果核聚变发电真的技术成熟了，那电费就真成白菜价了吧[doge]
1676371642,0,1,False,False,不好看，聚变堆里睡了三个小时[吃瓜]
1676186413,1,4,False,False,认真看了一下是哪个UP主发的，中核。[歪嘴]
1676165616,3,7,False,False,这个项目不会有人贪吧！从中抽一点应该不会被发现吧[藏狐]
1676133877,3,12,False,False,流浪地球三拍摄地是吧！进度都已经差不多了吧，郭导表示可以[doge]开始筹备了
1676162512,1,9,False,False,[吃瓜]中石油员工实名羡慕 并踢了一脚中石化 说到：看看人家
1676143029,5,6,False,False,就怕这个我们投入最大投入技术也最大欧美又翻脸不认人了
1676217114,0,5,False,False,流浪地球3取景地预告[doge]
1676171503,3,7,False,False,这个iter真的很有希望的，结果美国人溜了是没想到的。。。
1676181693,0,6,False,False,正是国际合作项目，才能这样比较详细的展示，你想看我们自建的？先让苞米干事找你谈一谈[doge]
1676263438,0,3,False,False,导演快来，景都搭好了
1676174195,4,7,False,False,我看立起来的国旗，我只看到了中国，欧盟，印度，美国，俄罗斯
1676169054,9,5,False,False,流浪地球2告诉我们人类应该团结协作，评论区和弹幕告诉我这是在痴心妄想
1676168941,1,7,False,False,如果时间可以倒流，我一定好好学习，长大了来这里打工，这里太帅啦[保卫萝卜_笔芯]
1676124864,3,6,False,False,[吃瓜]战忽局的同志压力给过去了看你们怎么圆[笑哭][笑哭]
1676126440,0,10,False,False,明白了，这就是郭导刚化到的缘[吃瓜][吃瓜][吃瓜]
1676121162,0,7,False,False,地下城核聚变反应堆[吃瓜]
1676202767,0,5,False,False,@郭帆FrantGwo @电影流浪地球 你快坑他！他是真的很想被你坑啊！[奥比岛_喜欢]
1676174863,1,4,False,False,科学从来都有国界
1676177841,0,4,False,False,卧槽！原来是官媒！
1676182258,1,7,False,False,这里更适合拍环太平洋吧，而且BGM一股战地味[喜极而泣]
1676165284,4,5,False,False,这种国际合作，在现阶段的大环境下是不可能有好结果的！只希望国家少投资少损失，意思意思就行了！
1676142557,0,6,False,False,核聚变的突破必将引导电池技术的突破 这俩一突破真就无尽能源了
1676188394,7,5,False,False,希望还是注意下保密宣传能宣传的[辣眼睛]
1676137100,3,5,False,False,别出工又出力到时候被人踢出来了，长点心眼儿吧，防人之心不可无！
1676125249,1,7,False,False,希望我有生之年能够见到这项成果惠及全人类
1676278479,0,2,False,False,"就目前国际合作那尿性，ITER我是严重不看好。
还是把希望放在咱们自家的CFETR吧。"
1676144378,0,5,False,False,将太阳的光辉汇聚在指尖[tv_微笑][tv_微笑]
1676177551,3,7,False,False,哎，资本都不看好核聚变，这个视频人们似乎也不咋看好核技术，也就玩玩梗，更难受的是，它对战争意义的意义目前不如航天
1676165174,0,5,False,False,据说这个只是设备共用，实验分开，每个国家给燃料的配方保密，最后谁成了，还不知道呢
1676203000,1,4,False,False,真搞出来绝对是人类史级别的变革，那可是无限能源啊，全世界翻天覆地都不稀奇，绝对的技术爆炸
1676171549,3,4,False,False,那么大一玩意给你拍这么小？
1676266511,0,2,False,False,实际上，这东西的同款中国已经完全自主造出来了，而法国这个现在还在建造中
1676122625,0,10,False,False,核聚变反应堆，牛批[打call][打call][打call][打call][打call]
1676156265,0,4,False,False,这个…这个…可以展示吗[保卫萝卜_哭哭][保卫萝卜_哭哭][保卫萝卜_哭哭]
1676193453,0,2,False,False,这真的是你我能看到的吗
1676440760,0,0,False,False,下次拍摄建议拍个人进去，不然看不到对比，这些都是超级超级大型的设备
1676466812,0,0,False,False,再不搞个能源上的技术革命，我感觉真的快要大战了
1676123970,6,4,False,False,别急，等建设好了，美国会把相关技术占为己有，并以此来要挟全世界
1676368858,0,0,False,False,妲己，快快快，呼唤赛博妲己@郭帆FrantGwo
1676168424,0,5,False,False,快进到物理学不存在了[doge]
1676391872,0,0,False,False,我看见UP名字的时候甚至愣了三秒才反应过来他可能说是官号。
1676196381,0,3,False,False,漂亮国不可能搞这个，搞出来石油佬还怎么赚钱
1676195193,0,2,False,False,这是可以免费看的？[脱单doge][打call]
1676455242,0,0,False,False,搞一个人造恒星，然后烧开水[doge]
1676380109,0,0,False,False,热核发电是不是有进展啊，怎么最近宣传格外多呢？终于不是永远差五十年实现的技术了？
1676389596,0,0,False,False,球3中核要不要考虑给弄个玲珑堆~给片场供电？[笑哭][笑哭][笑哭]
1676120965,4,4,False,False,什么时候国产电影能在这取景[doge]
1676120944,3,4,False,False,36秒开始右边一排，那个是不是借给小破球拍过了？感觉像是无人机出来的那段场景啊。[呲牙][呲牙]
1676377730,0,0,False,False,郭帆：嗯，可以，我想好了，球3就来个前传的前传吧，你们这场地不错，可以租（借）我用一（亿）下么？
1676442554,0,0,False,False,请问招人吗，我想去打扫卫生[妙啊]
1676126270,0,6,False,False,造这个国家热核聚变装置可谓是历经坎坷
1676157276,0,3,False,False,之前小的都是实验堆，这个是真的点火堆[打call][打call]
1676176750,0,2,False,False,大东西看着都是科技感[微笑]
1676175584,0,3,False,False,验证一下，回来我们自己造。但是托卡马克好像我们成果比这个多
1676157755,0,3,False,False,我们将在地球上点亮一颗小太阳！
1676475631,0,0,False,False,你们要干什么？二创不是这样的[doge][doge][doge]
1676196111,0,2,False,False,好，流浪地球3就炸这里了
1676434322,0,0,False,False,切，烧开水而已，就知道吹[doge]
1676260082,0,2,False,False,共产主义的最终实现基于高度发达和高效的社会生产力，社会主义过渡到共产主义注定要求我们必须完成和实现“无限能源”，当那天来临的时候，人类社会的共产才能最大程度的接近实现！
1676149519,2,3,False,False,希望聚变反应堆小型化不用100年。
1676156517,1,3,False,False,等会，结尾怎么又有usa了[惊讶]不是之前说美国没参与吗
1676184276,0,6,False,False,快让郭导过来化缘
1676180593,0,3,False,False,这个技术还是看各国自己的研发团队[藏狐]
1676373502,0,0,False,False,拖拖拉拉的，老欧洲就是～慢！[doge]
1676134872,0,4,False,False,你管这个叫甜甜圈？！！！
1676156394,3,3,False,False,求求佛祖耶稣机神保佑，可千万别再延期了[酸了]我还想活着看到商用的那一天
1676364038,0,0,False,False,可恶，被他装到了[笑哭]
1676133717,0,4,False,False,这个好早就规划了，延期了好久，现在国内也同时再新建另一套
1676121061,4,4,False,False,这是....在造火石？
1676170123,0,2,False,False,还得多少年才能建好啊
1676296171,0,1,False,False,我好像看到了中国国旗
1676187194,1,2,False,False,造出来就又多了一种烧开水的方式
1676151660,0,3,False,False,一部分核心组建还有资金我们已经交付完成了
1676308137,0,1,False,False,那种人体和巨型机械构建的反差感，太有环太平洋的味道了
1676120514,0,8,False,False,好啊，希望以后能从修到集团制造的聚变反应堆
1676373365,1,0,False,False,小心敌特分子搞破坏
1676433220,0,0,False,False,这是我能看的吗[星星眼]
1676204063,0,4,False,False,丁仪说托卡马克这条路走不通[doge][doge][doge][doge][doge][doge][doge][doge]
1676154475,0,3,False,False,庆幸科技掌握在文明手中  [OK][OK]
1676299472,0,1,False,False,世人只知道前两次工业革命，却不知道由我国发起的第3次工业革命
1676180232,0,1,False,False,并没有比电影震撼
1676137806,0,3,False,False,乐观的话21世纪中叶有望实现，只是书上这么说的
1676295954,0,1,False,False,感觉这个地方当做最后的行星发动机总控制室挺好的，外面也荒凉，按小说的正好五千多人拉出去受冻，直接到这拍[脱单doge]
1676284709,0,1,False,False,你说把这里炸了会发生什么
1676141653,0,3,False,False,有了这个，是不是可以在星舰上烧开水，火星，土星，不在话下了？[doge]快进到星际矿工
1676477232,0,0,False,False,弱弱的问下 这是未来的世界吗？
1676294357,0,1,False,False,你们实话告诉我，是不是太阳出事了[脱单doge][脱单doge][脱单doge]
1676141041,0,2,False,False,小心点儿，防人之心不可无。
1676368729,0,0,False,False,会是有生之年系列吗？[来古-疑问]
1676137123,0,2,False,False,核聚变是人类的希望
1676171394,6,2,False,False,这如果成功才是真正的工业革命，不是什么5g
1676391685,0,0,False,False,期待人造小太阳[星星眼]
1676291972,0,1,False,False,美国的球形惯性约束搞到哪一步了？科学家没被能源巨头暗杀，应该距离使用还差得远吧[嗑瓜子]
1676285555,0,1,False,False,别说了，上链接[doge]
1676132070,0,3,False,False,这是能放出来的吗[doge]
1676141455,0,2,False,False,OMG，郭导演！快来啊阿啊阿啊～@郭帆FrantGwo
1676171188,1,2,False,False,这工程速度，是8小时/周工作制吗？
1676435134,0,0,False,False,你跟我玩儿真的啊[tv_doge]
1676166616,0,2,False,False,败则败矣，成则危矣
1676167972,0,2,False,False,来这里能参观到近防炮吗？[给心心]
1676160909,1,2,False,False,我有一个～一个梦想～[tv_doge]
1676180002,0,5,False,False,奈何本人没文化，一句牛逼走天下！
1676191301,0,2,False,False,自己搞成本太高，这样大家有人出人有钱出钱，成本预算啥的能分摊一下
1676387186,0,0,False,False,希望能改变生活
1676169473,0,2,False,False,等待人类文明进阶!
1676167255,7,2,False,False,啊，这，宣传力度其实不需要这么大的，万一被间谍分析出来啥咋办，注意保密啊
1676171643,0,2,False,False,我的第一反应也是“这是我能看到的视频内容吗？”
1676144849,2,2,False,False,这比《缺氧》里核电锅炉复杂多了[妙啊]
1676120708,3,2,False,False,人类什么时候能拥有自己的太阳呢，还是年复一年的50年吗[思考]
1676141130,1,2,False,False,是不是原理和结构大家都知道，拼的是材料和国家工业实力，配套产业链？所以不怕泄密/暴露？大大方方的展示？
1676382906,0,0,False,False,请您流浪地球。
1676128953,0,2,False,False,小破求果然是纪录片
1676479751,0,0,False,False,长子的视频[doge]
1676169060,0,2,False,False,来一条科幻脑洞概念，宇宙中的恒星都是这么造出来的。所以没有外星人，是因为他们的星球都变成恒星了。[喜极而泣]
1676126756,0,2,False,False,群星将掌握在人类手中！
1676133670,0,2,False,False,"坐等烧开水言论[doge]
（其实聚变终于不是烧开水了）"
1676137786,0,1,False,False,甜甜圈好耶！
1676394454,0,0,False,False,人类的未来！
1676133783,0,4,False,False,[妙啊]外面还缺路要修不，我中交的
1676217744,0,1,False,False,谁负责抽签?
1676137212,0,1,False,False,5常来了四常
1676370241,0,0,False,False,好酷[点赞]
1676258752,0,1,False,False,这种东西是能显示的吗？亲们？是我一个凡人能看的吗？
1676169449,1,1,False,False,这是怎么设计出来的
1676436963,0,0,False,False,聚变？？？
1676464374,0,0,False,False,[热词系列_知识增加]
1676182546,1,1,False,False,你没有自己的反应堆吗？
1676120807,0,1,False,False,50年？
1676184786,1,1,False,False,这BGM我差点就哼起战地了
1676179844,0,1,False,False,在？抽个…等等你是谁？
1676164086,0,1,False,False,这是不要会员能看的？[doge]
1676241767,0,1,False,False,杨磊！郭帆！快来取景！
1676124217,2,1,False,False,这个建在哪儿.是在国内么
1676133236,4,1,False,False,这是可以展示的吗？[doge]
1676213545,0,1,False,False,期待自造版本问世
1676346758,0,0,False,False,又要有一种新方法烧开水了
1676281862,0,1,False,False,你和郭帆是一个敢给一个敢收[doge]
1676347483,0,0,False,False,中国的国旗在最前面？这么牛
1676190570,1,1,False,False,仿星器才是唯一出路[doge]
1676351212,0,0,False,False,不好看，震撼了三小时
1676348777,0,0,False,False,咱这真的啥都拍哈哈哈哈哈哈
1676355076,0,0,False,False,结尾的音乐是啥
1676333669,0,0,False,False,预测一下剧本，核聚变成功了，然后发生了火灾，设备都烧毁了，美国表示很遗憾，并打算在国内建设新的聚变反应堆，并同时宣布这是某国导致的，制裁某国的聚变堆不能使用美国或者其他与美国同阵营的国家的任何技术[滑稽]
1676134547,0,1,False,False,什么时候叠个可控核聚变？
1676297308,0,0,False,False,这是我能看的吗[嗑瓜子]
1676303533,0,0,False,False,人类文明进阶前夜
1676295904,0,0,False,False,[妙啊][妙啊]
1676295513,0,0,False,False,感动
1676355485,0,0,False,False,"个人一点拙见。
一来这个项目确实太过庞大，资金，人员，技术上的投入都很多，博采各家之所长共同建设可以节约成本。
二来毕竟是一个可以改变能源科技前景，甚至改变人类命运的技术。咱们自己弄，容易变成众矢之的。如果在关键技术上被卡，即使是我们自己能攻破，也是会耗费极大人力物力和时间成本的。
最后虽说大家吐槽别的国家拖进度，但是我相信也是有贡献的。技术成果是共享的，对我们也是一种学习的好机会。至于说技术有了，各国有没有本事自己造，造不造得起，那是另一个层面的问题。"
1676283480,0,0,False,False,[惊讶][点赞]
1676291732,0,0,False,False,[嗑瓜子]红岸基地
1676164124,0,1,False,False,花式烧开水[滑稽][滑稽][滑稽][滑稽][滑稽]
1676287764,0,0,False,False,好棒啊啊啊啊啊！！！
1676189068,0,1,False,False,不是专业人士，但是很期待！！！
1676354866,0,0,False,False,小核你悠着点，战忽局已经因为小破球2在加班找补了，这消息一发战忽局的人又要加班了[doge]
1676347112,0,0,False,False,？？？？！！！！才注意到原来是中核！！！怪不得能拍这些呢
1676353681,0,0,False,False,这个项目估计要黄！太多国家参与了，中国自己的项目早就超过这个还未建成的项目
1676307785,0,0,False,False,这个装置在欧盟地头基本上就会搞得很慢
1676274988,0,0,False,False,哇！好帅[星星眼]
1676299478,0,0,False,False,(⊙o⊙)哇！！？
1676348352,0,0,False,False,别忙前忙后最后被人赶出来，这种事西方国家干起来可没什么负担
1676300237,0,0,False,False,核聚变还是烧开水么，有没有更加牛逼的方式[辣眼睛]
1676308145,0,0,False,False,國旗那裡真燃
1676307091,0,0,False,False,好了，3就在这里拍了，集体员工参与拍摄～3月开始拍摄，谢谢大家…
1676165290,0,1,False,False,希望有生之年能看见
1676252172,0,1,False,False,导！！！！有新素材了！
1676276915,0,0,False,False,郭帆：拿来把你！
1676197506,0,1,False,False,快说！是不是看到了月球背面！坦白从宽[doge]
1676187840,5,1,False,False,15年啊，感觉不如白鹤滩水电站
1676204102,0,1,False,False,盆友，考虑出场景模型吗[喜欢][喜欢][喜欢]
1676120516,0,1,False,False,好惨的官方。，
1676263313,0,0,False,False,牛逼
1676251076,0,1,False,False,"说实话，欧洲这个不炸都谢天谢地。
一堆拖后腿的会极大的放大事故概率。[捂脸]"
1676297431,0,0,False,False,但是这是全球几十个国家合作建造，只是选址在法国，而且我们也是主要成员
1676351892,0,0,False,False,可控核聚变反应堆？
1676221258,0,0,False,False,牛的
1676294077,0,0,False,False,[doge]中核广核都是良心国企啊
1676133187,2,1,False,False,弄个春节十二响[doge]
1676184949,1,1,False,False,没必要国际合作吧，我们自己来就行，他们都是蹭技术和资金的，最后还得自己来，比如北斗
1676195750,0,0,False,False,芜湖～～
1676163562,2,1,False,False,小心智子……[doge]
1676194219,0,1,False,False,别进厂房，道理我懂看了就出不去了，别进别进[脱单doge]
1676133749,1,1,False,False,"什么时候能掌握可控核聚变？
让科技在进一步？[吃瓜]"
1676155143,1,1,False,False,这个大小是全球最大的吧？
1676216499,2,1,False,False,你这样让战忽局的同志们怎么开展工作啊。。[跪了]
1676132765,0,1,False,False,我去，这也太实诚了
1676205775,0,0,False,False,人类之光
1676168703,0,1,False,False,[doge]不是吧，啊核，你来真的？
1676272588,0,0,False,False,流浪地球3，就去你这个拍摄了
1676214178,1,1,False,False,"人类真的该把自己的全部投入于尽快完成可控核聚变的发展。
当然，是对人类总体而言。对既得利益者和团体而言，可控核聚变的规模化。。不是一个很好的消息。"
1676180385,0,0,False,False,辛苦[打call]
1676139685,0,1,False,False,过于落后，可以展示[吃瓜]
1676160236,2,1,False,False,有了它，能源方面会不会打破依赖俄罗斯的局面，世界格局应该会改变吧？主要是它坐落于欧洲。
