上传时间,回复数,点赞数,up是否回复,up是否点赞,评论文本
1676395189,1,0,False,False,不得不说冯绍峰小时候我觉得他真的很奶油小生，我觉得他和杨幂的一部狗血剧里很好看唉[捂脸]这部剧狗血到我现在还记得
1676384921,1,0,False,False,这个时代现在到了郑郝圆也是大叔的程度了么，哭死，我老了[大哭][大哭]
1676454146,0,0,False,False,冯绍峰都算叔圈了吗？我已经这么老了吗[笑哭][笑哭][笑哭]
1676480465,1,0,False,False,卧槽，风一阵好帅啊，而且他某些角度跟素问有点像，可能这就是夫妻相！是我磕的cp没错
1676039508,0,3,False,False,朱由校和溪风居然是同一个人？！！！！
1676037970,0,3,False,False,什么乖乖啊这是？？？？！！！！他们年轻的剧我怎么都这么眼熟啊！
1676433177,0,0,False,False,郑皓原好帅啊怎么这么帅怎么完全长在我的审美上！为什么这么帅啊啊啊啊啊啊啊啊！！！
1676379111,0,0,False,False,我就说那些演员去哪儿了，原来他们一直都在，只是我不认识了啊！每一个都那么那么熟悉，画面一出来，就能记起来，这么看来他们那时候得多帅，才能让我记了十几二十几年
1676379195,0,0,False,False,小时候甚至觉得这些人不够帅哈哈哈，是我不知好歹了，现在的娱乐圈……emm
1676089100,0,2,False,False,年轻时的，我竟然都认识[脸红]
1676475110,0,0,False,False,好多都是开始：你谁，后面：卧槽是他
1676427728,0,0,False,False,陈键锋真的好帅啊，我对他滤镜太厚了 从学警三部曲、四大名捕、执法代言人、 最后的格格、美人心计、乱世佳人、封神榜等等看过他好多剧！不过还有一部叫《千谎百计》他在里面演了一个彻头彻尾坏到不能再坏的人我都还是喜欢他 他演技很好演好人的时候温文儒雅演坏蛋的时候又是真的好可怕那股狠劲 现在他退圈了看到还是好怀念
1676480702,0,0,False,False,我的天呐！！！！我的记忆力都是他们年轻的样子！！！感觉还在20年前呜呜呜呜他们居然都老了吗
1676397867,0,0,False,False,为什么我总感觉明明时间也没过太久，他们还是以前的样子，可和以前对比起来又发现他们老了，为什么难道印象永远是停留在人最美好的时候吗[笑哭][笑哭][笑哭][笑哭]
1676397238,0,0,False,False,陈键锋你小子怎么回事 我真的太爱美人心计里面的代王了[喜极而泣]我那时候还特意去找过他的资料 之前演的tvb剧也看过了 真的是我喜欢的俊美类型 怎么混到现在这个样子了[笑哭]
1676387951,0,0,False,False,吕行出来真的把我震撼到了！哥你好帅！啊啊啊啊！
1676468593,0,0,False,False,私以为 冯绍峰最帅是项羽[脱单doge]
1676425010,0,0,False,False,怪不得我看不下去现在的古偶仙侠剧😭原来我以前看的古装剧质量这么高！以至于现在的古装剧连忍着看都看不下去[笑哭]都怪我以前看过这么好的，才变得如此挑剔😭
1676391172,0,0,False,False,呜呜呜呜呜呜呜呜呜呜呜以前帅哥太多了，怎么不给这现在匀一点啊，心好痛，他们都老了，但我发现只要不胖还是有一点帅的
1676423568,0,0,False,False,这些演员，真是剧抛脸，大家看到自己熟悉的角色只会喊戏里的名字，而不是像现在这样喊演员名字
1676385044,0,0,False,False,这两颗圆圆的送给你，剪辑的镜头都在我审美点上蹦迪鸭[给心心][给心心]
1676385494,0,0,False,False,原来他们不是退了圈只是我记忆中的男神老了，中年了我也喜欢[害羞]
1676381342,0,0,False,False,看到他们现在还有戏拍 啊有种欣慰的感觉[思考]我在想现在这批所谓顶流什么演员什么玩意的现在就拍成这样 以后老了咋演啊
1676079732,0,2,False,False,保剑锋真的好贵气
1676466396,0,0,False,False,美人心计都算古早剧了吗 天呐
1676476524,0,0,False,False,现在古装帅的小鲜肉怎么都没有啊，啊啊啊啊，影视学院新人都去哪里了，都不喜欢演古装吗？杨超越那个新剧男主也是帅大叔了，男二不认识，妹妹自己造型像杨紫的那些古装剧，爱古装剧的我去年把孟丽君传奇刷了一遍，其他啥都没有，上一部追完的古装怕不是陈情令，长月烬明啥时候播啊[大哭]
1676403686,0,0,False,False,早期能当演员的颜值都是基础好不，都是天然美人，非常能打，哪像现在，比不了比不了
1676369965,0,0,False,False,"以前的演员是让我们记住了角色的名字
现在的明星是只剩自己的名字"
1676365769,0,0,False,False,我小学看的八大豪侠，我每次看到郑皓原出场我都恨不得回放再来一遍，是小学生看到也会心动的帅气啊啊啊啊啊。这种帅气，到现在我工作了都很清楚记得小学有一个剧里的角色很帅[星星眼][星星眼]就是后来他们都死了我哭死[笑哭]
1676389751,0,0,False,False,其实就是贴胡子和没贴胡子的区别。现在的“大叔”不贴胡子一样帅。
1676088377,1,2,False,False,是安！！！之前那个天才基本法里面的帅老师！！！
1676477947,0,0,False,False,已经脑补了他们都喜欢我的剧情了，谢谢谢谢，今天就梦乙女[脱单doge]
1676036667,0,2,False,False,代…代王！
1676453473,0,0,False,False,看每一个人年轻时的样子，第一个反应就是:是他???!!!
1676369061,0,0,False,False,每一个都会惊呼妈耶，是你的地步
1676381096,0,0,False,False,第一个好像南翔不爱做饭诶[脱单doge][脱单doge][脱单doge]
1676383500,0,0,False,False,陈键锋…怎么…这样了 我还记得四大名捕的追命 我的白月光😭
1676092437,0,2,False,False,友情提示，千万别连播，有蛊[捂脸][灵魂出窍]
1676385464,0,0,False,False,陈剑锋在姜子牙里面超级帅，我当时嫉妒死他老婆了[酸了]
1676416013,0,0,False,False,这些妆容妆造造型，一看就是之前的剧，现在只有滤镜滤镜滤镜，可能这就是科技的发展吧[笑哭]
1676383475,0,0,False,False,只能说感谢up让我把曾经儿时记忆中的经验跟现在成功一一对应
1676387484,0,0,False,False,甚至有点点想哭[大哭]岁月不饶人但是他们真的以前狠狠惊艳我而且现在仍然念念不忘[大哭]
1676477690,0,0,False,False,这里面好多人都叫不上来名字，但是能第一时间想起来角色名
1676436687,0,0,False,False,时光真快啊，看着这些演员感觉才过几年。很难想象现在自己差三年就到30岁了还是活的跟小孩一样[笑哭]
1676363452,0,0,False,False,姜子牙的时候已经不是陈剑健锋的巅峰期了，胖了一点，崩了一点，还是早期在姨于妈剧里的时候，还有在港剧里的时候更好看。
1676450971,0,0,False,False,救命，这些人年轻时候的样子我全都认识，老了我一个都不知道是他们了[笑哭]
1676387091,0,0,False,False,当年的人，年轻的时候是实力派的颜霸中年也是帅的很
1676468259,0,0,False,False,保剑锋最经典的应该是薛仁贵，竟然没有剪进去[傲娇]
1676368053,0,0,False,False,周正就是古装帅哥最牛的资本[支持]
1676042981,1,2,False,False,啊啊啊，他们年轻的时候真的很帅呀
1676039581,0,2,False,False,溪风原来老了……为什么
1676390002,0,0,False,False,都是我的童年，果然童年看多了帅哥，现在的就看不上眼了
1676418680,0,0,False,False,啊！第一个我着实震惊了～我看过那部剧啊，真的没认出来～可是他才1983年啊，多少1983年的还在演男主角呀，果真不出名老得快😂董璇现在看上去也没那个大呀
1676091139,1,2,False,False,代王你肿么了[热词系列_问号][热词系列_知识增加]
1676085162,0,2,False,False,都是我小时候的电视剧，真的很帅，难怪高中以后再也没怎么看过电视剧，以前真的男帅女美，而且各有风情
1676051811,0,2,False,False,说实话，里面还是有两三个年轻时也不算多帅的
1676384704,0,0,False,False,这不仅是帅了，是有魅力！角色被演活了，现在老是出戏烦死了
1676472040,1,0,False,False,不是不尊敬几位老师，但是我想说，以前盘点帅哥的时候这几位叔叔根本就想不起来他们。实话实说颜值在那个年代也就是颜值中等。
1676430517,0,0,False,False,"以前:神仙打架
现在:资本打架"
1676431529,0,0,False,False,多少都是有点英气的，剑眉星目，现在很多都没有这种感觉，少了那么点气质
1676375495,0,0,False,False,演艺者一直都在银屏中，只是老了，认不出
1676356199,1,1,False,False,我是男的，直的，但好喜欢看这个up剪的男明星！好帅啊，真的好帅啊！要被帅化了！眉宇间那股英气，那种少年俊美感，彻底沦陷！！！
1676379522,0,0,False,False,啧啧啧，如果我能在他们风华正茂时遇上…
1676385014,0,0,False,False,是安现在长这样了[tv_惊吓]他可是状元郎啊
1676047220,0,2,False,False,帅挺帅就是美颜开太大[脸红]
1676461416,0,0,False,False,这吕行真是没想到，小时候看过居然是他！太差异了
1676044185,0,2,False,False,一个个都是时代的眼泪，除了冯绍峰
1676385671,0,0,False,False,八大豪侠！！！！小时候最爱的也是最不敢看大结局的剧[脱单doge]
1676424180,0,0,False,False,加这么重的滤镜，挺好看的人变得不像真人[辣眼睛]
1676093969,0,2,False,False,以前的男演员有棱有角帅得各有特色，现在的……我脑子想不出
1676083607,1,2,False,False,八太子帅得我当时都不喜欢沉香了
1676086691,0,2,False,False,天呐，风一阵我真的好吃他的颜
1676380010,0,0,False,False,自然老去的话，帅气还是有的，现在有的男星都医美，脸假得很
1676362170,0,0,False,False,对不起＞人＜，感觉冯绍峰年轻的时候像老鹅啊哈哈哈哈笑死我了
1676477563,0,0,False,False,吕行，我真的，惊呆了[哦呼]这就是我的表情
1676381090,0,0,False,False,那时候大家眼睛里都有戏，亮晶晶的
1676040717,0,2,False,False,这视频告诉我们：找老公还是得找帅的，毕竟老了脸还在啊！
1676379732,0,0,False,False,第二个气质长相都跟朱一龙是一挂的，哈哈哈哈帅气
1676095873,0,2,False,False,八太子！！！！我的童年男神！！！现在还这么帅[大笑][大笑]
1676082181,0,2,False,False,冯绍峰现在虽然不咋样，但年轻时候确实挺帅的[tv_笑哭]
1676094473,1,2,False,False,现在审美倒退啊 好恨小时候没有识别美男的能力 光看剧了[藏狐]
1676084732,1,2,False,False,发现他们不论是年轻时候还是现在眼睛都很漂亮很有神
1676113393,0,3,False,False,想把大叔们扒光，吃干抹净[捂眼]
1676043752,0,2,False,False,很多帅哥都是做配角，所以老了只能演配角老头
1676394241,0,0,False,False,一直觉得宋洋挺帅的 不过他长得太周正了 没有星缘
1676378213,0,0,False,False,以前帅哥美女明星是帅的各有千秋美的与众不同，现在的明星，大多数帅的美的都是千篇一律，过眼即忘[吃瓜][吃瓜][吃瓜]
1676045440,0,2,False,False,哇！这大部分都是我小时候的心动男嘉宾！！！！[喜欢]
1676095315,0,2,False,False,我看冯绍峰第一部剧是锁清秋，可以称得上民国美男子了
1676374194,0,0,False,False,雨豪可以cos沉香他爹！@雨豪别张嘴
1676438738,0,0,False,False,真的是棱角分明各有各的帅[打call][打call]
1676054699,0,2,False,False,等下，除了保剑锋和冯绍峰，剩下几位咋都变这样了[笑哭]，我对他们的印象都还是本世纪初，看他们年轻的样眼熟，现在直接认不出来……
1676388985,0,0,False,False,[妙啊]原来不是我脸盲，是现在的明显没什么辨识度
1676378393,0,0,False,False,我去，他们原来都年长了[大哭]
1676053352,0,2,False,False,"发现一个宝藏up,你剪的全长在我审美点了"
1676025783,0,2,False,False,前几个其实现在看也不丑[妙啊]
1676049671,0,2,False,False,我真的老了，我小时候看他们帅的要死，我也没觉得我多老啊
1676478548,0,0,False,False,感觉也就是恍惚一瞬间的事，小时候喜欢的人都变老了，自己也长大了
1676084941,0,2,False,False,现在的偶像是真的入不了我的眼，毕竟我小时候可是看着这些人的剧长大的[doge]
1676027656,0,2,False,False,谢谢up让我想起来以前为啥爱看电视剧了[喜欢]
1676387812,0,0,False,False,我中学那会儿喜欢的都是80后的男明星，一晃80后都开始演大叔了[大哭]
1676098043,0,2,False,False,是怎么做到的，从漂亮少男变成随处可见的粗糙大叔甚至大爷[囧][笑哭]
1676094163,0,2,False,False,以前的帅哥没有退圈，变成老帅哥[喜极而泣]。娱乐圈现在的各位，没有以后了
1676391054,0,0,False,False,陈健峰颜值最巅峰是他还在香港发展的时候
1676387615,0,0,False,False,帅得很一目了然 不用硬吹氛围感
1676041404,0,2,False,False,我的妈那几个完全看不出来！！童年心头好！！！
1676048800,0,2,False,False,我靠我真的悲痛 白云飞古装美男子现在怎么这样了我爆哭（李现有点像他）
1676087001,0,2,False,False,我盲猜十年二十年以后，会有人做视频放出来现在的明星的视频，然后说“这不比那些流量帅？”
1676393375,0,0,False,False,第一个太惊艳了，越往后越一般
1676386773,0,0,False,False,重点他们老了，也是帅哥啊
1676391552,0,0,False,False,各有千秋不让我脸盲[呲牙]
