上传时间,回复数,点赞数,up是否回复,up是否点赞,评论文本
1676154167,0,3,False,False,哎我算是知道为什么张颂文总被人拒绝了[难过]
1676133426,0,3,False,False,是安真的好符合我的审美啊
1676157417,0,3,False,False,看到最后一个，我靠，陈键锋什么时候变成那样了吗？我的印象中他还是那个唇红齿白的美少年啊！
1676133554,0,3,False,False,其实大可不必开滤镜，感觉大叔的褶子都磨平了
1676125525,0,4,False,False,不怕说句凡尔赛的话，这些男演员在我们当年的电视剧里算是比较普的那波[doge]
1676142471,1,3,False,False,风一阵能不能和素问合个体，我真的好难受，从年幼无知难受到现在[难过]
1676127492,0,3,False,False,都是明眸皓齿。眼睛都囧囧有神的。
1676127585,2,3,False,False,我小时候竟然不喜欢保剑锋[疑惑][疑惑][疑惑]好像是因为他演过的一个坏蛋。小时候也不喜欢潘粤明老师因为他说话大喘气[辣眼睛][辣眼睛]
1676292212,0,2,False,False,同类长相的年轻男演员就剩陈晓了……
1676130972,0,3,False,False,是安老师@演员是安 你真的真的好帅啊啊啊啊啊啊[大哭][星星眼][星星眼]第一次认识你是在小时候看的活佛济公二里的状元郎，前段时间看风吹半夏的时候一眼就认出来了 苏医生 太帅了太帅了[大哭][大哭][大哭]天啊[大哭][大哭][星星眼][星星眼][星星眼]
1676093745,0,5,False,False,我发现了，老了还帅得有韵味的，年轻的时候都是大帅哥
1676044101,0,8,False,False,保剑锋我觉得最帅的就是古老师！！！我超爱古老师的！！
1676076733,0,8,False,False,状元郎真的拿捏我啊[脱单doge][脱单doge][脱单doge][奥比岛_喜欢]
1676047538,0,10,False,False,时间太残忍了 他们还是停留在我以前印象中的样子 小时候看他们都是帅哥
1676283444,0,2,False,False,弹幕在干什么啊，冯绍峰年轻的时候真的很帅啊，就算年龄大了在知否里演顾二一个武将也是帅的啊[无语]
1676044976,1,8,False,False,突然发现以前好多帅哥，但是小时候的我根本瞧不上[辣眼睛][辣眼睛]，小时候的我是咋了
1676056810,0,5,False,False,儿女传奇《真命天妃》，建议没看过的去看一下，好看到爆炸，郑皓原帅死
1676299920,0,2,False,False,蛙趣八大豪侠那个，我的童年男神了，虽然一直不知道叫啥哈哈哈
1676477070,0,1,False,False,他们的妆容，都给人一种英气，让观众一看就觉得是正面人物（当然也可能演的是衣冠禽兽，不过我没看过，也不确定），不像现在某些古装“阴”气
1676388881,0,1,False,False,当年冯绍峰和刘恺威可是民国剧里的两大扛把子[保卫萝卜_哭哭]
1676307812,0,2,False,False,第一个郑皓原我小时候特别喜欢他，只是不知道叫什么，长大了我还奇怪怎么不出现了[笑哭]
1676040543,1,6,False,False,一听名字都不认识 一看脸全是童年男神[热词系列_DNA]
1676034998,0,6,False,False,那个状元郎真的很有感觉[doge]
1676054227,0,6,False,False,[笑哭]果然年龄到了就会发腮了
1676053858,0,6,False,False,[笑哭]可以时光倒流吗，让他们再回来吧，都好多年没看过现在那些剧了
1676292254,0,2,False,False,以前的演员都好周正啊 各有各的特色 就算不是很帅 至少五官端正 有气质 现在的男演员帅是帅 但是好像那个脸就只能做那么一两个很有限的表情 其他大情绪的表情就全面崩盘……要么眼睛是歪的 要么嘴巴是歪的…… 演技没有就算了 怎么脸都不能做到不崩盘……
1676124958,0,3,False,False,突然意识到自己老了…
1676161168,0,3,False,False,刘冠翔的角色里最喜欢李陵了[给心心]我当时还纳闷，这么帅演技这么好的演员怎么不温不火的
1676042790,0,2,False,False,第二个我可以
1676037250,1,9,False,False,陈键锋怎么肿成这样了[笑哭]不是说香港演员善于管理自己吗？
1676128729,1,7,False,False,吕行居然是白云飞
1676039908,6,5,False,False,"陈键锋为啥花期那么短啊
当时跟舒畅那个烽火佳人还很火很帅的"
1676434445,0,1,False,False,好多小时候看的帅哥，那时候这么帅的人都是配角，现在的内娱，主角都找不出帅哥[辣眼睛]庆幸我们是在正常审美范围时期长大的。
1676136640,0,3,False,False,感觉审美真的在变化，这里面好几个男明星长相都很端正，现在反而很少见了，也不是说现在男明星不帅了，就是给人的感觉不一样了。
1676386873,0,1,False,False,以前当明星很多都是因为在普通人里太出众了，属于万里选一，现在都他妈的资本造星，强捧丑人，资源全给这些丑人了
1676347329,0,2,False,False,啊啊啊啊啊我是说我小时候看的古装剧男主怎么都不见了，原来他们年纪大了，续上了胡须，开始演男主爹戏份了
1676093184,0,5,False,False,并不会，up剪的这几个人是当年看剧的第一时间就惊艳到人的，并不是小时候到处骂人家丑的那批人哦
1676300429,0,2,False,False,原来他们都已经这个年纪了，可在我心里他们还都是旧时的容颜
1676093295,1,16,False,False,以前看这类回顾视频，演员年轻的时候都没见过，现在这些演员年轻的时候，是我的童年啊[tv_笑哭][tv_笑哭][tv_笑哭]
1676300120,2,1,False,False,@发发不想学习 这个是真的有质量的，每个我都惊呆了，不是那些假盘点
1676296939,0,2,False,False,[喜极而泣]原来很多演员没有退圈，只是他们老了
1676293493,3,2,False,False,每一个前后对比都让我震惊的程度[保卫萝卜_哭哭][保卫萝卜_哭哭]（除了冯绍峰[脱单doge]
1676106625,0,2,False,False,时光只解催人老，不信多情！唉～
1676472067,0,1,False,False,刘宇桥太帅了啊啊啊啊啊啊！小时候的剧是真好看！
1676448520,0,1,False,False,现在的古偶剧..啊 还我眼睛!!!!!!  新生代的  大概只有罗云熙和王鹤棣还能看吧 小时候的各个都是帅哥 长得帅只是基本要求..
1676389367,0,1,False,False,还离谱，我竟然全看过老叔们年轻的剧
1676120188,1,3,False,False,宝莲灯八太子真的惊艳我好久！当时觉得他是最帅的男明星[脸红]
1676298721,0,2,False,False,心理活动:我天，是你啊！啊是你？！！！我的童年啊[保卫萝卜_哭哭]
1676049012,2,7,False,False,郑皓原是不是改名字了[笑哭]以前好像叫郑晓龙来着
1676263695,0,2,False,False,00后，没想到时间过这么快，电视剧里的大帅哥都变成帅大叔和帅老头了了[大哭]
1676472463,0,1,False,False,这些人的作品都看过啊，怀念，不过不知道是太久没看到，长相变化太大了，还是现在化妆和画质的问题，确实不太好认了。
1676131078,0,2,False,False,刘宇桥原来是他！！！
1676376121,0,1,False,False,神奇的是 他们年轻时的剧我都看过 大叔时的剧我一个没看过[喜极而泣]
1676122769,0,3,False,False,啊啊啊啊原来他叫是安！！！当初看活佛济公就觉得这个状元太帅了！！！
1676363452,0,1,False,False,都是童年回忆杀，现在的小鲜肉是比不了的。
1676440837,0,1,False,False,小时候看的觉得挺普通的剧中人物，换现在仿佛找到宝一样……不得不说这是一种倒退，不过还是很幸运以前看过
1676433284,0,1,False,False,现在还是很帅的，乔振宇，严宽，欢迎补充[吃瓜]
1676385989,0,1,False,False,大都好物不坚牢，彩云易散琉璃脆[难过]我喜欢的帅哥都老了
1676098292,0,4,False,False,妈的 我小时候就是看着这些帅大叔的电视剧长大的🥹狗资本毁了多少大帅哥的机会啊
1676218506,0,2,False,False,都是小时候看过的帅哥！！！岁月…好残忍！！！
1676081890,0,5,False,False,风一阵我真的心动了……我小时候超喜欢的
1676044795,2,10,False,False,我恨男人花期短，不会保养的男人们QAQ
1676457814,0,1,False,False,都是从前看的那些，怪不得现在看的那些总觉得不帅，少些味道
1676377623,0,1,False,False,风一阵！！太帅了，小时候就特别喜欢[doge]
1676081288,0,5,False,False,陈键锋演包拯，亏导演制片想得出来[思考]
1676052492,0,13,False,False,每一个都是我瞪眼的程度
1676391381,0,1,False,False,郑皓原这个我惊了啊！！！太多年没看剧了，完全没想到啊喵！小时候的男神之一啊。
1676372827,0,1,False,False,看来我的审美真的十数年如一日，一大半都是我小时候看过的剧，已经快十年没怎么看过电视剧了。
1676117195,0,3,False,False,以前的选角真的专业，演员和剧情都深入人心，历久弥新；现在的选角更看重已有的名气和流量，所以剧不成剧，都是各家粉丝在争番位和控评[笑哭]
1676026823,0,4,False,False,神啊谁来拯救一下现在的影视圈啊，小时候天天看这些帅哥真的没啥感觉，现在就是把这些大叔拉出来拍偶像剧我都愿意看！
1676140850,0,2,False,False,到了大叔的年纪反而更有味了。
1676389494,0,1,False,False,我一直觉得李现很面熟，我想起来，原来是像吕行啊，我还看过他演得，跟张娜拉苏有朋
1676094783,0,4,False,False,以前的浓眉大眼国字脸真的好看，保剑锋是我小学一点点大的男神[脱单doge]
1676023631,2,4,False,False,啊啊啊啊风一阵啊！！！风一阵！！！虽然那时候不知道演员叫什么！但是当初真的好吃他的颜啊！！！好喜欢啊啊！！[星星眼][喜欢]
1676024871,0,5,False,False,陈键锋真的，唉……[笑哭][笑哭]以前的代王和姜子牙怎么不算白月光呢……
1676087100,0,6,False,False,救命，他是溪风，天哪，突然觉得仙剑的年代感来了，一眨眼我也二十岁了呐…
1676135391,0,3,False,False,突然看到好多小时候电视看到帅哥，我真的以为他们都退了[囧]
1676104004,0,3,False,False,陈键锋 代王真的是我的白月光谁懂啊 就因为美人心计所以我到现在都对他有滤镜
1676102831,0,3,False,False,溪风 代王陈键锋 都很帅的 我还有印象
1676099913,0,4,False,False,看这视频时我的心理反应《是他？卧槽？居然是他？啊？是他啊？？》
1676096676,1,3,False,False,是安现在也很帅啊
1676363872,0,1,False,False,为什么说冯绍峰算了？凭什么算了？他年轻时候也帅啊，不能因为现在就否定以前吧，当年也是爆过的帅哥啊
1676088802,0,4,False,False,原先的帅哥美女各有各的特点，现在千篇一律。
1676193658,0,1,False,False,我本来只想安安心心看帅哥，但是忍不住了，为啥冯绍峰出来弹幕一片算了算了的，我靠我现实中要是遇到这种帅哥我得挪不开眼了，这不帅吗，我真的觉得冯绍峰好帅啊，这明明就是那种。。。。很传统意义上的大帅哥啊
1676090801,0,4,False,False,[喜极而泣]当年帅哥太多了，当时都不觉得他们帅，妈呀，现在出道的小鲜肉看多了，看到大叔觉得每个都帅
1676045217,1,23,False,False,当年 八大豪侠 里面陈冠希死了我根本不相信，我觉得他肯定会复活的……
1676390170,0,1,False,False,保剑锋太帅了，古越涛是我心中的白月光！
1676391900,0,1,False,False,啊，怎么都这么帅，都是小时候看过的人呜呜呜呜呜呜呜呜呜
1676389140,0,1,False,False,最后那个是封神演义里面的姜子牙吗，映像不是很深了，我小时候特别喜欢姜子牙，感觉好帅[笑哭]
1676047331,1,7,False,False,虽然岁月在叔叔脸上留下了痕迹，但是从五官还是可以看得出叔叔年轻时的风采的
1676039429,4,7,False,False,他们是突然直接变老的吗[妙啊]
1676042143,2,7,False,False,郑皓原 是不是真命天妃的男主啊
1676284976,2,3,False,False,保剑锋是不是还演的梦华录那个皇帝呀！！！！真的好好看[保卫萝卜_哭哭][保卫萝卜_哭哭]
1676045887,0,3,False,False,宋洋的朱常洛YYDS
1676393105,0,1,False,False,保剑锋还是18岁的天空那会最帅啊✿ヽ(°▽°)ノ✿
1676474306,0,1,False,False,当年的帅哥都开始演老头了，爷的青春没啦[大哭]
1676091882,1,4,False,False,我真的很喜欢宋洋的朱由校[脱单doge]，明珠游龙里
1676087183,0,5,False,False,保剑锋啊 十八岁的天空 古越涛爱惨了😭
1676206282,0,2,False,False,冯绍峰应该放锁清秋里的沈朝宗，那个出场我真的记了好多年
1676169961,0,2,False,False,冯绍峰年轻时真的挺帅的 有点像琼瑶男主秦祥林
1676469594,0,1,False,False,有人知道朱时茂、唐国强甚至李金斗年轻的时候有多帅嘛
1676431685,0,1,False,False,怪不得现在看不了小鲜肉。因为之前吃得太好了[辣眼睛][辣眼睛][辣眼睛]
1676050000,2,4,False,False,我一定是困了，不然也不会在这里纠结该和他们哪一个结婚[尴尬]
1676120659,1,2,False,False,我说他们都去哪儿了[大哭][大哭][大哭]
1676127600,0,2,False,False,风一阵！！！！！！！我的启蒙老师，爱死他了
1676114406,0,3,False,False,他们没退圈，是你不关注，是安在风吹半夏里的苏医生就很有魅力
1676387415,0,1,False,False,突然感觉时间好快，一下子过去那么多年了，
1676300843,0,2,False,False,看到他们年轻时的模样，我眼睛一下亮了！
1676094287,0,3,False,False,所以现在的妆造的审美都是谁培养的？
1676185779,1,2,False,False,都眼熟，小时候的帅哥，什么时候成大叔了呀[惊讶]，记忆还停留在他们年轻的时候，好陌生呀
1676470387,0,1,False,False,有没有李连杰，赵文卓，吴奇隆？萧十一郎呀！黄飞鸿呀！
1676093906,0,4,False,False,陈键锋我的童年男神啊，美人心计、烽火佳人里面我真的特别特别喜欢他，真的好帅啊！当时我甚至不知道他名字就是喜欢他
1676062657,0,6,False,False,时光真的无情啊，这些大帅哥都变成帅大叔了。这一个个的年纪时候简直了都
1676044101,1,5,False,False,我tm太爱风一阵了！！！只可惜年轻时没多演几部戏[笑哭][笑哭]
1676051775,0,6,False,False,刘晓峰长得那么好看，就演一些奇奇怪怪的角色，比如，吴刚，“这么好的身子我就不信你不动心”是吧？还有法海，刘涛那版，真是可惜了
1676042702,0,4,False,False,现在的流量一个都比不上，气质都好好
1676185077,0,2,False,False,原来我的审美并没有变，变得是这个世道！[辣眼睛]
1676131297,0,2,False,False,一定要加这么厚的滤镜？不加滤镜一样抗打，和小鲜肉们不一样
1676099954,0,4,False,False,冯绍峰年轻的时候就是帅啊，我看美人心计看到刘璋出场真的眼前一亮
1676112526,0,4,False,False,最主要是他们不仅帅，还各有特色，演技还很好！
1676168566,0,2,False,False,啊啊啊啊啊最近在看活佛济公2，原来那个帅哥叫 是安啊，真的是从众多角色中脱颖而出啊，真的帅！
1676217332,0,2,False,False,"真的老了 这些演员年轻时候的剧大多我都看过
现在都成大叔了，[囧]不对我也老了[辣眼睛]"
1676094893,3,3,False,False,现在看以前的帅哥都是影视片段，那以后的人看现在的帅哥看啥？
1676045347,0,3,False,False,妈呀，第一个我一直记着他！！！
1676437099,2,1,False,False,陈键锋胖成这样了吗[笑哭]
1676049898,0,3,False,False,啊啊啊童年男神绝美姜子牙这是怎么了！
1676042377,5,6,False,False,风一阵啊我的风一阵，他和素问明明是官配，整个什么芊芊干啥！气死我了！直接导致我一直不喜欢李小璐[大哭][大哭][大哭]
1676048921,0,4,False,False,年轻的时候真的都帅的各有特点，啊啊啊尤其是代王那里！真的好帅啊55555
1676377308,0,1,False,False,玉面俏郎君[星星眼][星星眼][星星眼]
1676057627,0,5,False,False,视频中好多人的脸都看着好熟悉，但是他们演过的电视剧却一点想不起来
1676469559,0,1,False,False,有没有，沙溢和吴京？上错花轿嫁对郎，功夫小子闯情关，了解一下？
1676087945,0,4,False,False,弹幕说刘彦昌不帅的，细品一下为什么他能娶仙女
1676170463,0,2,False,False,冯绍峰年轻的时候很好看的，他的兰陵王都可以算是后期演的了[笑哭]
1676051328,1,6,False,False,原来八大豪侠和尔豪不是一个人……这么多年我都以为是一个人
1676051151,0,6,False,False,救命居然是他，第一个我小时候就觉得好帅啊居然都这么老了，不对仍年轻
1676391737,0,1,False,False,最喜欢是安了呜呜呜呜受不了
1676381685,0,1,False,False,每一个人的剧我都看过
1676129442,0,2,False,False,保剑锋好帅好帅!
1676092832,0,4,False,False,你知道吗，就这颜值，在我小时候男主颜值榜你都排不上号[脱单doge]
1676040454,0,3,False,False,陈键锋年轻时多帅啊，感觉生病了，没有正常的老去
1676035961,0,3,False,False,岁月是个养猪场[doge]
1676051270,0,7,False,False,关于保剑锋那个真心觉得古装的一般，现代那个前后差距也太大了，棱角分明，剑眉星目，整体立体了太多了，直接2d变3d
1676159668,2,2,False,False,还是以前好，现在找个帅哥看都难
1676086937,0,4,False,False,李现跟吕行年轻时候好像[哦呼]
1676086894,0,4,False,False,邱心志年轻也好看啊！和刘涛演的《原来就是你》里面的反派西装革履太帅了！
1676198754,0,2,False,False,只想说，多来几期，呜呜呜，想念那时候蹲在电视前两眼放光的日子
1676092657,0,3,False,False,以前的演员五官都端正的紧
1676091735,0,3,False,False,可恶，他们怎么老的这么快啊[大哭]
1676088590,0,3,False,False,白云飞和八太子惊了
1676128522,0,2,False,False,第一个真的太好看了，小奶狗
1676050560,0,3,False,False,帅哥老了也是老帅哥，人家只是帅的比较久而已[tv_无奈]
1676470426,0,1,False,False,焦恩俊二郎神和李寻欢呢？
1676089985,0,3,False,False,第一个那时候不好火，因为电视剧里那会火的是黄海冰焦恩俊这种周正俊朗的脸，不过放现在肯定火
1676040069,1,6,False,False,以前真的好多帅哥啊…现在….不可说😶
1676158225,0,2,False,False,都是小时候惊艳过我的演员们呜呜呜呜，原来已经过去这么久了吗😭
1676469633,0,1,False,False,有没有那个，云潇潇？凤在江湖那个。他叫啥来着？又忘了
1676049128,0,4,False,False,时光真的在流逝，我记忆中他们还是意气风发少年郎的样子
1676041041,0,8,False,False,那时候的男女都特别精神，土话讲特别zun（四声），站有站相，坐有坐相。不知到现在哪儿找的一帮二流子。
1676056495,0,5,False,False,本视频帅哥含量过高
1676298951,0,1,False,False,陈键锋长这样了？？？？？偷吃谁家酵母了？？？？？
1676122415,0,2,False,False,以前是选演员，现在是选流量，没得比
1676047000,0,4,False,False,所以现在的叔圈，还是当年喜欢那批人！！哈哈哈哈！好幸福啊！
1676388044,0,1,False,False,我为冯绍峰举大旗
1676084179,0,3,False,False,郑皓原和陈冠霖是真的长在我的审美点上(//∇//)
1676156298,0,2,False,False,以前的帅哥各有各的帅，现在是让人无力吐槽，我已经有7，8年都不看国产剧了
1676045358,0,5,False,False,其实他们现在仍然很帅，毕竟基本的骨相在那里，不可能差到哪里
1676038244,0,5,False,False,都是古装美男啊，哎，感觉再也看不到这样的美颜盛况了……[大哭]
1676135824,0,1,False,False,把我心脏拆了安在车上吧[大哭][大哭][大哭][大哭]跳成马达了朋友们
1676114445,0,2,False,False,第一个真他妈的帅啊[喜欢][喜欢][喜欢]
1676110069,0,2,False,False,是安的名字和他的脸好配[Cat2_Nyampage]
1676037657,0,4,False,False,是安是我童年最喜欢的状元郎[吃瓜]
1676049761,0,3,False,False,我记得当时看风云2的时候，明明被张叔平的霍霍得那么惨，可是冯绍峰还是好好看，还有女人花的吴雨声，那时候就是我的审美取向[星星眼]
1676153253,0,2,False,False,其他人我都不怎么认得出来年轻的样子，陈键锋五官其实没变过，就是发腮了[笑哭]
1676106574,0,2,False,False,救命那个状元郎好好看好好看好好看
1676024730,0,3,False,False,有几个人好熟悉啊，岁月不饶人，叔叔们都老了。[笑哭]
1676095746,0,2,False,False,都是我的童年男神[保卫萝卜_哭哭][保卫萝卜_哭哭][保卫萝卜_哭哭]
1676025054,0,5,False,False,保剑锋后期印象最深刻的就是华胥引里的容垣了，和郭珍霓那个cp感！苏到爆炸！十三月篇真的又虐又带感！
1676107824,0,2,False,False,宋洋一哭，我人没了[保卫萝卜_哭哭]
1676118013,0,2,False,False,小时候特别喜欢保剑锋，感觉好帅啊
1676130610,0,2,False,False,小时候觉得聂远赵子龙挺帅的 后来找不到这个人了 去搜才发现原来叫聂远
1676121305,0,2,False,False,每一个都是意料之外的人，但是现在的电视剧为什么没得几部好看的
1676130538,0,2,False,False,风一阵真的太帅了的，好久没见过了，惊艳了我的青春属于是
1676133489,0,2,False,False,是安真的帅！！！！流泪那里真的绝[抓狂]
1676106579,0,2,False,False,我以前就喜欢看以前演员的眼睛[保卫萝卜_白眼]眼睛会说话，不管男女
1676082657,0,4,False,False,不喜欢冯绍峰也得说一句人家年轻时候是帅的
1676110102,2,2,False,False,都是我小时候看过的剧啊，他们在我心里还都是年轻帅气的模样啊[大哭]
1676131186,0,2,False,False,他们年轻时候的剧我竟然大部分都看过[芮小凸小凹_666]当时就觉得这些人好帅哈哈哈哈哈哈哈哈哈哈哈
1676103965,0,2,False,False,弹幕“他的唇看起来好好亲啊”要笑死了
1676023367,0,7,False,True,是安！！！是安！！！[无悔华夏_好耶]
1676137468,0,2,False,False,看完整个混剪第一感受是好像一瞬间就过了十几年。老剧部分个个都认识，新剧个个都是路人甲。
1676129725,0,2,False,False,风吹半夏里的苏医生[大哭]是安老师[星星眼]@演员是安  苏医生 状元郎封面你上热门啦[脱单doge]
1676108507,1,2,False,False,大家知道白皮的古天乐吗[大哭]
1676124681,0,2,False,False,活到老，帅到老，不像现在，三年花期一到，立刻塌房
1676115961,1,2,False,False,"郑皓原演的《真命天妃》太甜了[doge]
经典语录：“太子妃，你醒啦！”
啊～～～～有没有看过的小伙伴"
1676113160,0,2,False,False,卧槽，突然发现王宽的感觉和陈键锋很像【你们懂吧！！！】就都是端方君子的感觉！
1676125477,1,2,False,False,冯绍峰的项羽真的在我的心巴上，以及这些老演员我竟然一个都没认出来，但是以前的角色一出我全能叫上来哈哈哈哈哈
1676469705,0,1,False,False,有没有陈坤？
1676117004,0,2,False,False,看这些大叔，再看年轻的形象都有啊原来是他！因为我不太看演员名字和都演过啥剧的那种人，居然真的在对方不同的年纪爱上对方[大哭][大哭][大哭][大哭][大哭][大哭]天呐
1676130185,2,2,False,False,风一阵的那个演员太好看了，新生代小生里陈哲远给人的感觉和他很像
1676469651,0,1,False,False,有没有张智尧？
1676051559,0,2,False,False,风一阵，我喜欢他
1676364857,0,0,False,False,冯绍峰还不够帅吗[保卫萝卜_问号][保卫萝卜_问号][保卫萝卜_问号][保卫萝卜_问号]他其实是最最周正的那种长相，纯中式帅哥，年轻的时候长相没有短板。就算年纪大了，知否演得也很好，这两年不知道中了什么邪还要去演偶像剧。。。
1676106337,1,2,False,False,救命，怎么里面每一个都是我喜欢过的[笑哭][笑哭][笑哭]
1676049752,0,2,False,False,我小时候的男主角都帅的不行
1676044724,1,3,False,False,"刘彦昌是真的帅[打call]
以及，代王怎么肿成这样了[捂脸]"
1676090457,0,2,False,False,都好帅，都很周正，比现在古偶那些男主好看。
1676082858,0,2,False,False,冯绍峰是怎么塞进来的……
1676053122,0,3,False,False,突然来个冯绍峰把我整不会了[囧]
1676090301,0,2,False,False,真的都好帅都好周正啊 原来我还是喜欢中式美男
1676101734,0,2,False,False,果然还是以前的帅哥是真的养眼
1676074049,0,2,False,False,哈哈哈，前面的只是老了，最后一个变形了。
1676364643,0,0,False,False,好喜欢这种大气方正，正气凛然，风度翩翩的长相啊啊啊，颜狗天堂
1676394782,0,0,False,False,保剑锋的薛仁贵真的很美啊[委屈]虽然剧里的人设是非常直男真汉子的那种，但是却有一种破碎的，母性的美感[委屈][委屈][喜欢]无法拒绝充满母性的男美人
1676091291,0,2,False,False,我第一次对识人能力产生了怀疑
1676055463,0,2,False,False,我靠，我就说陈哲远怎么看起来这么眼熟
1676100703,0,2,False,False,[脱单doge]岁月是一把杀猪刀，诚不欺我
1676389636,1,0,False,False,冯绍峰为啥算了？他不帅也不可能火啊，年轻的时候很明显的帅哥啊
1676397286,0,0,False,False,救命啊是我也老了吗 曾经印象里的帅哥站在都这么老了的吗[大哭]
1676427736,0,0,False,False,以前的帅哥脸型周正，剑眉星目老了都成普通人。现在的小鲜肉老了后不感想象。[doge]
1676444516,0,1,False,False,第一个我都没认出来
1676433893,0,0,False,False,岁月对他们做了什么！！！什么！！！什么！！！
