上传时间,回复数,点赞数,up是否回复,up是否点赞,评论文本
1676112377,0,0,False,False,我也想学一下对抗路怎么样带线怎么样转线呀感觉这个很难把握
1676137683,0,0,False,False,罐头笑声[辣眼睛]
1676112994,0,0,False,False,@机器工具人 2:30识别歌曲
1676105270,0,0,False,False,饮冰而行！
1676091188,0,0,False,False,[星星眼][星星眼][星星眼][星星眼][星星眼][星星眼][星星眼][星星眼]
1676216411,0,0,False,False,看到了吧，事实表明了，带线拆塔比杀人重要[doge]
1676120480,0,0,False,False,山哥yyds
1676113625,0,1,False,False,从你开始玩暗信，皮肤钱给报不[doge]
1676106056,0,0,False,False,秋山BGM限时返场
1676108080,0,0,False,False,暗信现在不行了佩服
1676130703,0,0,False,False,发一个暗信第一视角啊
1676087700,0,0,False,False,两分钟
1676087697,0,0,False,False,好早
1676160650,0,0,False,False,我记得不是相声主播吗？[脱单doge]
1676100538,0,0,False,False,这露娜确实强的离谱了
1676092102,0,0,False,False,想看一下全局[星星眼]
1676087680,0,0,False,False,[打call]
1676087591,0,0,False,False,早啊
1676087589,1,0,False,False,刚刚[星星眼]热乎的
1676135259,0,0,False,False,最后咋把兵线带过去的
1676094710,1,0,False,False,铭文和装备是什么，求回复[doge]
1676109919,0,0,False,False,打野也不太行，这个分段拿赵云不是送吗 ，还不如掏个肉凯
1676087637,0,0,False,False,[doge]
1676119515,0,0,False,False,山哥能发全局视频吗
1676114498,0,0,False,False,世界未亡，死不投降？
1676091558,0,0,False,False,喜欢！高手博弈，精彩精彩！
1676113829,0,0,False,False,想看一下全局录像[脱单doge]
1676087901,0,0,False,False,热乎的
1676087802,0,0,False,False,哦
1676137247,1,0,False,False,露娜：队友不行
1676105133,0,0,False,False,要看全局[脱单doge]
1676160249,0,0,False,False,问下，怎么才可以把兵线不知不觉的带过去？
1676087838,0,0,False,False,[吃瓜][吃瓜][吃瓜]
1676200568,0,0,False,False,秋山哥求个这把的全局想学思路[脱单doge][脱单doge][脱单doge]
1676116704,0,0,False,False,这把老秋山打得厉害👍
1676087856,0,0,False,False,头一次这么早[doge]
1676103470,0,0,False,False,秋山能吧这局给发出来吗
1676122422,0,0,False,False,我今天暗信4—13我偷塔赢了
1676089576,0,0,False,False,暗信玩家路过[doge]
1676167485,0,0,False,False,秋山，你可以不可以试试，不用一技能加速达到200攻速打匹配
1676135401,4,0,False,False,"为什么up每次升四级自动变成暗信？[辣眼睛][辣眼睛]
（真不知道，求解答"
1676092741,0,0,False,False,求一个全局[星星眼][星星眼][星星眼]
1676144405,0,0,False,False,如果给这露娜搞几个沉默呢
1676184448,0,0,False,False,这队友也强了 露娜再怎么秀 二塔都没掉[笑哭][笑哭] 就这还小带 代练满脑子都是水晶而不是秀
1676180083,8,0,False,False,人头差不多全在露娜身上，这是个团队游戏，除非偷塔
1676164205,0,0,False,False,这露娜真的厉害，当然李信也很厉害。
1676119985,0,0,False,False,秋山兄弟。我想要你的铭文
1676187875,0,0,False,False,露娜：我真的服了，你个老六[无语][无语][无语]
1676117172,0,0,False,False,我做个第一9000赞的人
1676158898,0,0,False,False,精彩，这波心里博弈，太精彩了
1676089171,0,0,False,False,久违的战歌[吃瓜]
1676088111,0,0,False,False,牛啊，把对面都拉扯麻了
1676130092,3,0,False,False,谁教我典韦怎么打露娜[doge]
1676102034,5,0,False,False,这露娜也太变态了吧...
1676116765,0,0,False,False,意识vs手法
1676087819,0,0,False,False,真的秀
1676100197,0,0,False,False,我要看全局录像[打call]
1676093906,0,0,False,False,能发整局吗？想学习一下[OK]
1676111047,0,0,False,False,太帅了[脱单doge]但是我没一念神魔[脱单doge]
1676180202,0,0,False,False,打败你的不是你的对手，是你的队友
1676205358,0,0,False,False,实话说，这是我看到过你细节和运营最强的一次，比以往的视频都要惊心动魄
1676108933,0,0,False,False,光信：落魄了，家人们
1676096044,0,0,False,False,借楼出号 安卓q区 v8 账号 全英雄1典藏15传说，水晶286抽了。真心出，绝对不盗号，可议价，心里价1200左右，有意购买的私信我，可平台，无二次
1676144180,0,0,False,False,可见露娜队友有多烂
1676109501,0,0,False,False,经过昨天和下午，我想放弃暗信了
1676288095,0,0,False,False,打吐了[热]
1676186357,0,0,False,False,就是看秋山视频，才让我学会的偷塔[脱单doge]
1676109536,1,0,False,False,最后那波线赵怀真不是清了吗[辣眼睛]
1676109630,1,0,False,False,我说我带线偷塔，队友抓住机会.4打5主动开团
1676124627,0,0,False,False,通天偷塔李天王[脱单doge]
1676255251,0,0,False,False,老有人说露娜吃了线导致队友不行。露娜光吃线不办事？全程视频看不到，但视频里这几波露娜不是血c？他牵制住了几个？你还知道这不是一个人的游戏，对面人没了那对面野区和中立资源全是我们的，不会推塔？没经济不会自己去拿？你指望一个打野输出血c的时候还让他推塔？其他人干嘛去了？非要说每次团战都提前挂了是因为露娜吃完线那我没话说
1676111899,0,0,False,False,厉害了，这露娜我遇见就没了
1676172515,0,0,False,False,露娜:今天遇到一个暗信小代
1676190072,0,0,False,False,战歌回来了！爷青回！（没想到在白起19开的那个视频给秋山的回复，秋山居然真看到了[脱单doge]）
1676106599,6,0,False,False,秋山能不能送我个李信伴生皮 求你了
1676088865,0,0,False,False,@王者荣耀秋疯崽 这里有人送钱[吃瓜]
1676174535,0,0,False,False,昨天也是，双排和朋友把对面打爆，被一个暗信一直牵制，除了我没人能管他，但没有我，打团就打不过对面。这就是很烦的地方
1676090642,0,0,False,False,看到这我就觉得进游戏，把队友当队友就输了一半。
1676217356,0,0,False,False,麻蛋，今天开的最后一把和你这阵容差不多，偷了两路高地，但还是没辙，另外四个货根本守不住，最可气的是，五个人来抓我，另外四个居然千里迢迢跑过来打架不知道拆塔。这么喜欢打架怎么不去玩格斗游戏。
1676123446,1,0,False,False,我就想知道你是怎么过去的，又是怎么在对面没发现的情况下清的线？[疑惑][疑惑][疑惑]
1676115525,0,0,False,False,这特效，你说他典藏我都信
1676190915,0,0,False,False,这种露娜是真的欠打[生气]
1676163318,0,0,False,False,不玩暗信但爱玩秋山[兔年]
1676107364,0,0,False,False,要是能把烂大街的怪笑去掉就更好了
1676088804,0,0,False,False,看了暗信，就想上线玩秋山[脱单doge]
1676125486,1,0,False,False,这露娜要是苏晨，你这把有职业都得输
1676102635,2,1,False,False,这种灵活的打野配明世隐感觉真不咋样，小明根本跟不上，反而还有种拖节奏的感觉
1676109459,3,0,False,False,但是遇到张良东皇这种专抓单带边就没招了[tv_目瞪口呆]
1676123568,0,0,False,False,每次对方有暗信   我都会把兵线带到对方水晶
1676123175,0,0,False,False,秋山：一代更比一代强，我叫通天带
1676124453,0,0,False,False,3分20秒，露娜追暗信其实是很简单的，但是他那波打算回头清兵再回头的时候已经来不及了，大失误
1676091411,0,0,False,False,这个老六，我听出了深深无奈[笑哭][笑哭][doge][doge][doge]
1676128558,0,0,False,False,当我玩暗信的时候就已经做好了信誉分大残的准备
1676103057,1,0,False,False,露娜一个人可以管暗信这把所有队友，只能说大意了[吃瓜]
1676099305,0,2,False,False,《写给露娜的一封信》[大笑][大笑]
1676104538,3,0,False,False,满嘴顺口溜你想考研那
1676103361,0,0,False,False,确实很nb
1676087606,0,0,False,False,一分钟
1676103967,2,1,False,False,所以遇到这种露娜应该怎么办
1676214185,1,1,False,False,这露娜看起来是把资源好像全吃了样子，还是那句话，荣耀不是一个人的游戏。[墨镜]
1676107477,0,0,False,False,小带vs小代
1676087846,0,0,False,False,6
1676087725,0,0,False,False,一播放55赞我出息了
1676113652,2,0,False,False,有一点没看懂，最后那波二塔还在，是怎么把兵线带进去的，塔没掉的话小兵不是应该先打塔吗？？？谁懂，给解答一下谢谢。
1676111118,0,0,False,False,只要自家水晶不爆炸，我就能让对面水晶爆炸。往死里带。
1676106163,3,0,False,False,匹配5排对面开局嘲讽说他们国服露娜，然后我们中野边辅直接反蓝，然后他们露娜8分钟没碰过一个蓝，最后打开主页一看，啥国服露娜啊，就一个市标...白针对一局
1676087569,2,0,False,False,1播放[doge]
1676138186,2,0,False,False,这把说实话就是俩边大神打架明显是露娜队友太垃圾了，这种局火舞和露娜一样会玩的是神不会的就是乐色但凡火舞会玩一点根本不怕暗信，露娜把你队友杀穿了直接一波就行，火舞会玩这把早没了，没办法会玩的露娜没控制就是这样随便秀，这把赢了真的只是巧合遇见这种露娜直接点了就行了，你家没硬控的话。
