上传时间,回复数,点赞数,up是否回复,up是否点赞,评论文本
1676344178,348,5663,False,False,如果一个游戏跟考研一样，没开始玩就得学一堆乱七八糟东西，再练习很长时间，那为啥不考研呢？考上研的成就感和现实意义不必玩这个游戏多太多了，up说的很对啊，娱乐玩家没有了，很难有新鲜血液了，特别是竞技游戏，只剩下卷王比谁更卷，自然就没人玩了。当时s2，都是盖伦剑圣，啥都不会就是q上去转，连补刀都不会，但是大家很开心啊，开心了自然就会玩下去了，如果一个消消乐游戏，第一关就需要你大量计算卡一周才能过，有几个人会玩
1676363035,248,3011,False,False,最大的问题就是，有人说竞技游戏不就是为了赢吗，这话是对的，但是up说的是“我就是打不过他，我又没送，为什么要骂我“，当一个竞技游戏走向僵局，又有这么多素质低下的人的时候就快要结束了
1676343733,39,879,False,False,"归根到底是把娱乐性给一削再削，连续大版本改动都是往比赛上靠拢，提高了竞技性冲突性。
这一系列操作直接导致小失误就可能葬送一整局，玩家间极易出现矛盾，胜负欲拉满。
十一年上古玩家去年退坑了，因为设计师又双叒叕在大乱斗惦记他那连游戏都不玩还追求的“平衡”，现在刷刷视频当一个云玩家轻松多了[大笑]"
1676377761,55,1557,False,False,"感性的拿cf举个例子吧，30人生化酒店，一个小黄在厕所墙角喷漆蹲着看你，你终结者把他抓了有得分，你会去抓吗？野队大部分人没那么分奴的吧。
换成lol，你辅助下路被4包2，ad被打掉，你辅助被对面34个围着开始f2f3大笑跳舞，对面会马上把你补了吗？反正以前是会和你一起跳舞的，现在马上把你补了去吃线，全是人性胜率机器了[嘉然_吓人]"
1676348722,174,1981,False,False,"整理一下UP的发言
UP的观点是，游戏的乐趣在于探索。当游戏机制被众多玩家探索完毕以后，匹配对局中萌新就失去游戏乐趣了。需要先度过一个相对枯燥乏味的学习阶段才能和别人站在相同起跑线上，才能真正开始享受游戏。如果一个游戏的学习阶段过于漫长枯燥，新手就会望而却步，游戏就会逐渐进入老玩家圈地自萌时期，时间一长老玩家总会因为这样那样的原因退坑，游戏也就慢慢没人玩了。
具体到LOL来说，它有过自己的辉煌时期，全网吧都在打lol的年代已经把一整个年龄段的玩家给吸收进来了。新手友好已经不是策划运营的工作中心。如何把已经在池子里的这些老玩家伺候好，然后从他们口袋里掏钱出来，才是重点。
所以就LOL来说，我不太认同UP的观点，LOL毕竟不是探索类游戏，对抗游戏需要了解机制，学习才能享受乐趣是天然的。棋类游戏的历史远比电子游戏古老，学习曲线更加漫长，依然有人在享受。这种对抗游戏的乐趣更多的应该是“胜利的乐趣”而不是“探索的乐趣”。如何平衡一局比赛以后10个人的心态才是长久运营的重点。好的策划让赢的人斗志昂扬，让输的人感到不服输想再来一把。差的策划让赢的人索然无味，让输的人摔桌子骂娘。用数学来比喻的话，一局比赛后10个人的心情相加应该是正的，至少不能是负的。"
1676354753,81,992,False,False,"虽然有人觉得up是情绪化的发言，但我认为除去马服涨价搞特权，攻略化内卷真的是凉的一部分原因…..现在突然发现网吧玩cf的人越来越多，连我这样大学才开始玩cf的女生也没事喜欢玩，cf就很能拿捏人，现在动不动出免费送各种皮肤的活动加上各种娱乐向的活动，比如跑跑对决跳跳乐，生化模式，人在下班累了一天后不是想在游戏里继续被压力，而是娱乐娱乐，我就经常喜欢去玩跳跳乐，输了就笑一笑然后再开下一局，跳不过去的地方就很懊恼但是一直很好玩。
云顶之弈也是一个道理，早年s1-s3那段时间lol官方还没出什么攻略，掌盟上也没有下棋助手，大家玩的真的很开心，九剑下天山，我记得当时我就买玩挖掘机然后给好多肉，一直回血好强好强，大家都开发属于自己的阵容，现在云顶之弈都有了比赛，隔三差五就发布新的推荐阵容，大家一局玩的阵容基本上都一模一样，抢不到牌大眼瞪小眼，真的没意思了。
想起特别早的时候（s5s6），那时候我还会突发奇想，诶发条可以出ad吗，玩了一局以后发现不可以，在朋友的欢声笑语的调侃中开始了下一把研究，现在呢，遍地的教学，加上设计师把出装多样性的路堵得越来越死，除了卷别无他法，加上恶劣的游戏环境，不变强就会双亲皆丧，甚至多死几次别人随便一举报系统还判定你送人头，以前觉得电竞比赛很有意思，我还喜欢看现场比赛经常买票，现在职业比赛都是不认识的新人，直播再也不想打开。可能是我真的老了，也可能lol再也无法吸引到我了吧。去年考研，从八月份开始就没再玩lol的排位，现在也只是玩玩无限火力大乱斗，是我不想玩峡谷模式吗，我其实也喜欢对线到团战和队友一起慢慢赢下的感觉，但我知道我几个月没玩，我也不是18岁了，我的反应肉眼可见的在变慢，加上几个月没玩排位，我不敢玩了，我怕队友的压力，我怕自己打不过别人的情绪内耗。游戏变得很累的时候就不再是游戏了。"
1676360339,27,647,False,False,说的有对有错，确实竞技游戏的寿命周期在那里，但是有一句我是认可的，这个游戏真的只剩下了所谓的高手，没有新手这点是很致命的，菜鸡互啄的空间被压缩，各种主播打号，小代，要么就是玩家自己内卷，“军事化游戏”，新鲜血液完全无法融入，从开服玩到现在的，大多数也年纪不小了吧，我反正身边朋友陆续退坑，到现在自己也不怎么玩了，有段时间和朋友只玩大乱斗，现在忙的大乱斗也不玩了，甚至大乱斗，你出错装备，或者你出了不常见的装备，也会被队友压力喷，问候家人，反正就是全员内卷，大乱斗里，胜率车队，红包局我就更不谈了，碰到一次被恶心一次，那真的是游戏吗？现实就算了，全带进了游戏里这真的不是一种病态？
1676363313,115,626,False,False,现在lol里那些所谓的老手在别人做错一件事或者和他意见不同的时候就疯狂的给压力，你觉得这种环境会有新血液进来吗？没有新血液进入老玩家又逐渐退坑，那这游戏不就凉了吗。我从s2就开始玩lol了，以前的玩家不会说去给别人指指点点最多就是让人来龙团来中路团，现在的玩家恨不得把你键盘抢过来帮你玩，玩家玩游戏是来享受的不是来让人指指点点的，现在上网的人多了各种阴阳人学了一点词就在游戏里疯狂输出，巨恶心人。
1676350702,97,362,False,False,为什么不玩lol了？菜是原罪。游戏玩不过别人了呗，没有游戏体验了自然就不玩了。从s1到现在s13，很多老玩家从学生到上班族，年龄大了和生活对线去了，当然就没那么多时间花在研究竞技类游戏了，偶尔玩几把适应不了版本，一直被虐当然就不玩了。说到底就是玩得时间少了，游戏玩不过别人了，体会不到乐趣了就不玩了。
1676361751,19,305,False,False,"看到后面，这东西其实也是现实，东亚三国都这样的，资源紧张，竞争激烈，从小大家被灌输的就是排名，分数，还有与别人对比获得优越感与快乐，一定要把别人踩在脚下证明自己是对的。
想让他们不与别人对比，太难了，思维早成定势了。
原神这种单机都能被很多人玩成pvp，何况lol这种不是输就是赢的游戏呢。
还有拿电竞思路去玩游戏，确实有收益，但是也确实就是一种拿上班的心态去玩游戏了，又没有钱，感兴趣玩玩还行，真的努力去学，去做做了就会期望回报，但是又赢不了的时候真的会很累。"
1676390181,35,315,False,False,现在的游戏是越简单越容易上手受众越多，从一开始的RTS游戏帝国时代红警星际争霸魔兽争霸，到魔兽争霸地图编辑器的澄海3Cmoba对抗忍者村大战，再到Dota6.43b，再到2011年lol出来再到手游王者荣耀，这个趋势和节奏难道不是游戏越来越简单了吗？受众越来越多了吗？越来越没难度了吗？说到底游戏公司越来越能赚钱（竞技排位开启elo模式），玩家越来越投入其中，但是呢有啥意义呢？我从一开始打游戏是为了探索为了锻炼自己的智商为了想方设法怎么去赢，现在游戏打得好已经不是你玩得好了，你技术apm厉害你反应神速你大局观你意识强大已经不值钱了，你原来以为的普世价值已经落后了这个平庸的时代，你的游戏观在这些平庸的人和只会赚钱的游戏公司眼里已经没意义了。昨天星际争霸2中国RTS夺冠了，我在想现在还有啥意义啊？WCG已经办不下去了，因为电竞已经没有强者了，这些锦标也就没有了意义，现在有的只有游戏公司的韭菜和自称电竞逃避现实的网瘾少年少女了。我现在宁愿打开pc玩一下十几年前的刺客信条，至少阿泰尔还能告诉我人应该变强人应该有独立思维[加油]
1676212810,52,484,False,True,"我是觉得马服皮肤强行限定，而且皮肤越来越流水线不用心。
而且有这打游戏的时间，能做很多有意义的事情，我之前关注的好几个主播，他们每天都开播，现在很少很少看到他们了"
1676343674,41,125,False,False,"这其实是适合不适合的问题，有些游戏玩家本来就不适合玩竞技类游戏而更适合玩单机，所以不用说什么竞技类整体水平提升不利于新玩家的话，新玩家真心喜欢自然回去研究，我就亲眼见过连跪3页的盖伦从青铜上钻石的。
对于我而言，我是杂食，单机美好的故事也要体验，竞技游戏也要体验，竞技游戏对我来说，我懂的更多技巧，我会想和更多同水平的高手过招，看看自己的实力，精彩的对局就算输了我也很开心，毕竟是可敬的对手。
我身边的朋友也都是更适合单机的，我们当初一起在黄金5排乐的很，最后他们最后都退游了，只有我留下来，并且自己上了电一白金二（因为太忙没多打，不然上个钻没啥问题）。
up主这个视频出发点错了，错在拿竞技游戏硬是匹配非竞技游戏爱好者，然后从非竞技游戏爱好者的出发点去寻找原因，这是不对的。之所以很多人会觉得up说的有道理，是因为这个游戏太火了，以一个竞技游戏的姿态让所有游戏玩家来接触，所以那些非竞技游戏爱好者自然会有认同感，根本原因还是玩家对自己的爱好定位不清晰。"
1676360661,40,304,False,False,其实最主要的原因，大家真不用杠，就是策划教我们如何玩游戏。 一个英雄策划说打哪就打哪，真的一点意思没有
1676355002,101,99,False,False,我建议你去玩dota2，深度足，出装套路多，低分菜逼也足够多，学习起来非常有趣，一局游戏好几个阶段，不像LOL对个线坐牢15分钟直接GG。
1676424077,32,249,False,False,"竞技游戏，适合低龄玩家。十几二十岁，三十以下。
精力旺盛，急切想要证明自己。他们会喜欢这个。
但是一旦岁数上来了。反应也跟不上了，精力也跟不上了。还没多少时间。就不那么愿意玩这种游戏了。

把LOL捧上神坛的那批玩家，老了。
仅此而已。"
1676456886,5,45,False,False,苦逼研究生在读，在实验室操磨到九点十点，回寝室突发奇想打了三把大乱斗。第三把因为被坑，被骂了。后面就彻底不玩了。忙一天很累了，脑子就不太够用了，打大乱斗就是想放松一下，没去匹配排位恶心别人，结果大乱斗都会有特别在乎输赢的人，因为一波团打的不好就开始骂，算了，回寝室玩也去玩pve游戏去了
1676403245,27,207,False,False,"以前：五个人蹲草逮一个，哈哈真好玩。
现在：砂仁不拿塔，真不配赢。
以前：我都等不及了，这把我盖伦必六把黑切重振我黑切教主的威名。
现在：卢锡安吸蓝刀狂风攻速鞋先出了再说。出什么别的装备，能赢么？AP卢锡安，别逗我笑了。
以前：我刚才那把潘森，对面肯定气死了，我就qqqqq吃蓝药继续qqqqq诶。好玩。
现在：你不会一秒四破玩什么剑姬？选个狗头有用么？你能吃到屁经验。以前是简单英雄也可以很强，流浪，脸滚键盘，小鱼，伤害爆炸。阿卡丽，全都是点人技能。铁男，顺发E叠起来白盾我就无敌。安妮，攒个晕你敢补刀么，我一套就秒了。现在呢，简单英雄全都不行了，小鱼改出肉了，火女秒不掉人了，流浪要算着技能刷盾，铁男也没有屹立不倒的爽快。阿卡丽还要算着距离。比赛是平衡了（真平衡了么？），不好玩了。
装备也给我限制了。我无限火力奎因我想出六个无尽！我诺手剑魔也想出六个无尽！能听懂人话不策划？你弄个神话把装备固定死了，你这叫三年游戏经验么？这真就是一天游戏经验重复了三年。为啥没人玩，因为没意思。就抱着你这神话装备系统不放手，这不是等着死。还有技能改的，以前是各有特色，现在是啥，妮蔻是婕拉的上位替代。萨勒芬妮是琴女的上位替代，以后是不是要搞个荣誉室，定期退环境？老英雄特色全无随便被替代。老玩家留不住，新玩家也不玩。好似。"
1676340793,24,123,False,False,上班以后不想碰这种游戏，节奏性太强，各种意识必须到位，团战细节等等。而且现在各种嘴臭，出现失误直接各种点你。我是玩游戏的，不是继续上班的。你说你到钻石大师段位有半毛钱用，他只是网络虚拟世界的一个象征
1676436690,12,43,False,False,中国人玩游戏就喜欢这样，社会和文化环境就是这样。搞什么都喜欢竞争，只要有点竞技要素的游戏都能给你玩成一个竞技为主的游戏。你再怎么去争取还是有人更在你前头，所以现在有了躺平文化。对于大多数竞技游戏玩家来说通过竞争获得了胜利才能给大家带来满足感。大多数中国人玩竞技游戏就是为了这种在背后付出了很多然后取胜的满足感和骑在别人头上、站在别人高点的优越感。所以我现在不玩竞技游戏，我的意见是：累了就远离竞技游戏，对竞技和非竞技玩家都好
1676432375,3,42,False,False,"打赢了没什么感觉，只是一场正常的对局。
打输了左下角直接祖安，影响心情。
也就是说玩这游戏得到的快乐远小于难受"
1676375566,30,92,False,False,说白了就是国内游戏的发展带来的惯性思维，在我看来，追求纯粹快乐的游戏，单机是远比电竞类的游戏优秀的。比如任天堂的全家桶。玩电竞类的游戏享受的其实是来回为了胜利而博弈的过程，lol没有以前那么多人玩其实不是凉了，而是我们国家游戏市场之前因为游戏机禁令只有联网的竞技游戏，所以只能玩lol这类，但现在不是了，所以不喜欢博弈的追求快乐的玩家就流失了。不是lol凉了，只是lol回到了应该有的状态
1676464128,1,10,False,False,"越玩越没有意思了，以前刚开始玩，只敢打人机，因为打匹配怕坑队友，后面打了一两百把人机才敢玩匹配，才发现大家都一样，都是为了开心来玩，输了坑了也不会打字骂人，不像现在玩个游戏还要很紧张。
现在我就想玩玩以前出过的那些模式，现在不是克隆就是无限火力，早都玩腻了，把之前那些血月杀、攻防模式、互选模式、死兆星锤石、末日人机、飞升模式、极限闪击、佣兵大作战、奥德赛模式这些重新轮换一下，也不至于越来越没意思，老玩家也不会弃坑"
1676459992,4,16,False,False,我觉得更主要的，现在人生活节奏快压力大，天天996，加上之前ELO，谁愿意辛苦了一天玩两把 游戏全是负能量，没有了游戏体验自然玩家流失，还有就是年轻人更多愿意玩手游，而不是这种需要入门时间堆熟练度，耗时耗力的游戏，我看我们频道的LOL分区天天讨论天天讨论比赛热火朝天，一问没一个人现在还在玩的
1676444458,2,37,False,False,是没错，LOL是个可以电竞的游戏。好多人说打排位就别娱乐啊，都去打匹配啊。但是匹配呢？依旧会有（不会玩就别玩啊，滚去打人机啊）。我大学拉我室友入坑打个匹配就被人喷，一起玩了几局就再也不玩了。进匹配前谁又没打过几局人机呢？没够等级又怎么会进匹配。（我甚至见过打人机都有人喷的，从简单人机到一般人机就是不一样的）要一直打人机难道就能会玩匹配了？怎么吸纳新玩家呢[辣眼睛]，我现在也很少上线了，需要很久的时间熟悉手感，而越需要手感就越不想上线了[热]。打匹配手感差可能补兵就少了，或者被对面单杀一两次，完了之后队友可能就开始点你，太常见了。断断续续也和联盟度过了十几年了，最开始那会每次周末去次网吧就为了玩玩联盟，约上几个朋友玩的不亦乐乎，后面不断的升学辗转，以前那帮人也联系不起来了。偶尔有个朋友要一起出去也是吃个饭，压压马路。如今对联盟也就看看比赛，但也难说支持哪个战队了，以前熟悉的那些选手也所剩无几了。真的对联盟再也没有什么热情了[再见]。
1676453530,6,22,False,False,我一8级账号的新手，键盘操作都没熟悉，去打一把，遇到的尽是些百多级的人，打了差不多白多把，也被虐了百多把，这百多把里只有一把运气好拿了个s评价，现在总算有点熟悉操作了，有人说为啥不玩人机，我也打了几十把，打算好好磨炼对线技术，被抢线的情况10把里至少有6把是这样的，也有碰到压力怪，人机一样被喷，而且玩人机的老玩家多半是分数不够只能玩人机，嘴臭的很，现在不管玩啥都直接代码屏蔽了，被不打排位的黑铁老玩家吊打我认，炸鱼的有一个算一个通通该似
1676455599,1,11,False,False,"英雄联盟作为一款游戏，游戏性质是否减弱大家都有目共睹，我想说的是，游戏正在慢慢的建立起一套完善的规则，往竞技方面不断加强，这也就是设计师不断干预游戏的原因，建立完善的规则了，那样就会慢慢的变成一项真正的竞技，就和运动一样，和足球篮球一样，你难道说足球篮球是一项很简单的运动嘛？不也是要不断的训练嘛？也是团队竞技游戏，你表现不好，队手也可能嘲讽你，队友也可能压力你，这个和英雄联盟这款游戏的关系不是很多，是人，人的原因最多。
作为一款游戏，是网络上的，在现实中，人们的各种戾气没办法发挥出来，你篮球打不好，他也不可能对你骂的太凶，但是网络上却能自己大骂特骂。再最近几年社会环境变化，压力变大，更加在网络上发泄，导致了环境越来越差。老玩家也就越来越少，被赶走。
我认为游戏的下限变高是一方面，另一方面是因为高玩们可以炸鱼导致的，也就是扮猪吃老虎是很容易的，在现实中打篮球，你可以很容易发现，并且选择你的队友队手，你们的实力差距不会太大。但是这游戏不一样，可以伪装，去炸鱼，去破坏别人的游戏体验。这个也就导致了新玩家越来越少。你想，篮球也是很难的运动，但是我们愿意去学习，因为有很多我们势均力敌的队友队手，我们可以总是阶梯级上升。
没有人真正讨厌胜利或者是失败，我们讨厌的是一直失败，那样才是真正的厌倦感。"
1676340190,7,51,False,False,倒不是说做攻略学攻略的人太多了，主要是现在环境太差，对新人太不友好，青铜白银都敢批评着别人线上有没有兵线理解，打野会不会做事情，就好像新人不配玩游戏似的，导致入坑门槛太高，没有朋友陪着一起玩谁闲的自己来找罪受。
1676441892,1,39,False,False,我出泰坦的版本玩的，那会还是学生，而且那会是真的好玩，对面是啥英雄，啥技能，都不懂，大家都一个样子，兵随缘打，212对线，，下了和LOL盒子，就每周想着这周可以周免啥，可以玩啥英雄，回学校和同学讨论半天周免怎么玩，好不容易攒够了6300也要纠结半天这个英雄适不适合我[tv_白眼][tv_白眼]，
1676459445,3,10,False,False,LOL不好玩了完全是因为现在大部分LOL玩家输不起、爱骂人又不喜欢被骂，那些LOL玩家以为竞技游戏只有赢了才能带来快乐，根本没意识到竞技游戏带来快乐的是为了赢的过程，不明白为什么有人输了都开心。
1676376970,9,62,False,False,既然能有云顶之巅就不能有瓜皮深渊吗？一个不需要太多理解不需要太多操作的服务器，检测到炸鱼行为就裁决之镰惩罚[doge]
1676454305,0,8,False,False,不说还不觉得   我感觉真的跟考研一样 为什么我那么努力还是打不过别人还要被人骂  一天辛辛苦苦上完班想上游戏爽一下   结果全部队友被薄纱   连输十把凌晨三点睡觉心情还裂开  上班又没精神又心情炸裂   还不如看看书看看视频来得轻松舒服
1676387287,9,15,False,False,说到我心坎里去了，我玩LOL只是为了玩，我还有我的学业，我的其他兴趣爱好，我还有别的游戏要玩，我还有新番要追，而不是像某些人，只能拿段位说事，我确实菜的抠脚，只有黄金左右的水平，但有的人是钻石大师就只是钻石大师（当然那些玩啥都nb，事业顺利的人就当我没说吧），反正我打LOL是真的从来没认真过，没必要，我只是为了开心，就算有人骂我打的菜，我也不会为了让一个陌生人认可我而努力训练，每天打个一把差差不多了
1676461910,0,7,False,False,我说两句，视频里的内容可以完全套到，永劫无间，一出来就办比赛，然后游戏难度略高新手退了一部分，又因为被高手操作开发的太多，内卷严重导致后来加入的玩家基本就是被打退坑，还有，举例，三排打上最高段位打单排是从最低段开始打（单双三段位分开）那新入坑的人碰到这些大佬心态都炸了，这还不是单一情况，你能怪人家炸鱼吗？他只是三排打腻罢了，然后没有新玩家，老玩家越来越卷，越卷人越少，陷入死循环，游戏是好游戏，但玩起来真的太累了[热]
1676373758,22,130,False,False,很多很多人其实是更愿意玩简单无脑少操作的英雄的，像老版本的狼人，老版本的卡特，老版本的阿卡丽，老版本的船长。现在联盟几乎找不到机制简单的英雄了，等哪天连石头人也重做的话就可以说拜拜了
1676475476,0,4,False,False,"个人感觉，lol的很早以前的娱乐模式做的是真挺好的，不是说一定好玩，但是他会一直出，会有新鲜感，即使平衡做的不好，保持新鲜感就有人会去尝试，而且还经常和当时的人物或者皮肤剧情相关，比如广受好评的浪焰之潮和船长的佣兵桥模式，又或是两次皮肤宇宙的pve模式，都是玩着就觉得很有创意。
但近些年lol本体（不含云顶）很少去做这些了，就一直给峡谷做补丁，无限火力和复制轮换打补丁，大乱斗更是越平衡越怪，从玩机制变成玩数值，谁补丁高贵谁nb，打多了根本不像娱乐，像坐牢抄公式。

还有就是lol的背景故事，不管是英雄的还是皮肤宇宙的，让拳头扪心自问，最近的人设和故事真的还有当初的水平吗？今年甚至能体现符文大陆一年一大发展的cg都没了，就算破败那年结局写烂了，他至少也让故事推进了吧，今年搞的啥玩意，剪一堆电竞相关的语音，充当新版本cg，剧情0推动，真要不想搞，不如直接全部让给lor，本家剧情退化到远古时期，遇事不决战争学院，建议再和唐家三少联个动，那人最会摆烂写玄幻世界学院。"
1676348413,18,76,False,False,反正我一个s2入坑一直玩坦克和战士的手残玩家感觉就是官方的一个大趋势就是强迫你去玩秀的，强迫你去操作。从瑞兹重做到现在没有一个英雄的重做是把他简单化，全都是复杂化，不允许操作简单的英雄存在！导致了我们这批老粉年纪越大，反应越慢，拳头越往复杂里搞。这游戏就搞的新手入门门槛高，老手操作跟不上没操作，自然就没人气了
