上传时间,回复数,点赞数,up是否回复,up是否点赞,评论文本
1676380441,0,3,False,False,我前天才碰到个恶心人的。特么的又是老鼠辅助，我玩个女警下路对线两人，一直塔下，对面大树打野无限来抓来越。最后整了个0-8，然后辅助就说了，我太菜没操作。然后举报我，其实举报我我也无所谓，本来就是下班休息玩下，懒得理他。特么的腾讯直接给我来了个封号1天。这可真的是被恶心到了
1676465388,5,2,False,False,电子竞技 菜是原罪 所以当一把游戏你有一半概率背锅时 那为什么要玩
1676421800,0,2,False,False,是这个道理，最典型的就是魔兽世界，最早的魔兽世界是没有任何指引，任务在哪需要看任务内容去找线索再找怪，主城在哪，所有NPC在哪？副本在哪？甚至地图都是黑的，完全未知。所以老玩家觉得好玩，而多年后的怀旧服都觉得这里那里里不好玩，实际游戏还是那个游戏，自己完全失去了对游戏的探索欲而已。也算是互联网时代游戏行业的痛点，游戏内容被过度消耗，本身游戏公司为玩家设计了一个可以玩一两年的大版本，而视频作者的教学让其他人走了近道，造成半年所有玩家毕业，仓促间游戏公司的版本设计也会越来越急，质量越来越差，玩家怨声载道纷纷脱坑，mmo类的游戏受害最严重，竞技游戏还有操作带来的不确定性可以勉强撑一撑，但也好不到哪里去。
1676477035,1,2,False,False,我现在打得比以前多了，原因一样时间少，没时间静下心玩大作，手机游戏又不好玩，LOL反而玩的多
1676451575,3,2,False,False,问题是这是一个团队竞技游戏，你娱乐了你队友呢？你是来玩游戏的不是来受气的，那你队友就不是来玩游戏的是来受你气的是专门来哄你开心的？就不说排位了，无限乱斗够娱乐了吧，但你本来玩得挺开心的突然对面一个领先你们两大件的大爹冲出来一打五追着杀，还怎么娱乐？
1676406196,1,2,False,False,"听了up的交心之谈，我又想起官方做的很多及其失败甚至于说是**的改动

比如【神话装备体系】，我记得我刚玩那会儿，出装有太多的选择了，甚至很多都是半件半件做装备的，就像是五彩纷呈的盛世
比如【极地的传送门】，有些英雄就是可以更快地到达战场，豹女凯南杰斯，我都不明白为什么要搞个传送门，就官方觉得自己像神一样想这么搞就怎么搞呗，现在这个传送门+阿克尚被动多强啊，一波团战打两波人，离谱！

然后官方又不能处理好高玩和普通玩家之间的平衡性，职业选手玩的好就使劲削[保卫萝卜_白眼][保卫萝卜_白眼]我现在不开黑根本不敢玩泽丽，打架就是去人脸上挨揍，最优出装还是脆皮暴击流，呕

本来官方的定位应该是【所有玩家群体中间的知心大哥哥】，照顾到所有人
现在看来就是个【偏爱高玩的偏心长辈】，跟玩家之间有代沟，然后不去了解，就看金字塔尖尖，全凭自己想法指指点点

唉，罄竹难书，罄竹难书[难过][难过]
这个游戏，要是我的朋友们不玩，我早不玩了，何况是马服"
1676452639,0,2,False,False,还是喜欢玩单机游戏，一个人体验大世界，没有争吵和攀比，而且很多单机游戏也有联机功能和多人合作
1676219052,3,9,True,False,说到心里去了……我属于是lol喜欢坑人整活（五黑，队友对输赢不太在意），然后原神也尽量自己玩不查攻略60级，我也很怀念当时最初玩王者荣耀什么都不会往别人脸上跳的刺激感，怀念最早玩大表哥2找警察的茬然后快乐逃跑。我有个朋友评价的让我记忆深刻，如果不是为了赢，和xxx一起玩游戏一定是很好玩的
1676390701,2,2,False,False,dota→lol→农药，30min+→20min+→10min+，正反补→正补→我补个P补
1676384731,1,2,False,False,前几天小炮拿了个5杀 都没怎么开心过 以前打lol打的激动的全身发抖 现在没这种感觉了 碰到几个有趣的队友比上分啊赢啊有趣的多感觉 没什么动力去像以前那样拼尽全力去玩了
1676423843,0,2,False,False,打游戏为什么要这么累呢，我也想说不能求同存异一下吗，就算你是杀的最多的，队友只要没送，你们都是想要赢的他也尽力了我觉得这就够了，就算是输了只要一起努力过不也很开心吗。现在随便开一把大乱斗正常玩都有人压力，就不能求同存异一下吗，大家都是在玩在热爱这个游戏的，这难道不能够吗非要压力别人，可能环境就这样吧，但我真的希望这样的环境能得到净化。
1676341100,4,9,False,False,我是感觉玩家越来越功利了，这也是我为啥14年就跑到台服。国服玩家你打个匹配稍微失误点直接全家就上天了，台服娱乐玩家心态都很好，很少能碰到喷人喷的特别狠的，我有一次大乱斗安妮挂了好几次，队友也就来了句：安妮真可爱，像个吉祥物。我赶紧说玩的不好，不怎么玩安妮。这事儿就过去了。搁国服我估计直接mute all了。
1676447146,0,2,False,False,偶尔上线大乱斗，看到队友选寒冰就需要摆烂[tv_笑哭]
1676438704,4,2,False,False,我不打是因为我没时间打，而不是这个游戏不好，英雄联盟仍然是我心中最好的游戏，有竞技有娱乐还有我的童年。让我去玩原神真的是受罪，整天抽卡跑图做任务，还有这个视频能上热门就证明英雄联盟仍然还有流量，跟它一样的竞品远远没有它好
1676347871,0,5,False,False,我从开服就玩这游戏，玩到现在怎么走A、取消后摇什么的都没学，排位太累最高只上到黄金就不想打了，现在回想起来玩得最开心的还是以前秒选剑圣偷塔能拯救世界的时候、大乱斗炮车没真眼提莫蘑菇随便铺的时候、船长重做之前朴实无华的一个Q直接秒人的时候。
1676461001,0,2,False,False,一直在打啊，热爱的怎么会厌倦呢？
1676306641,3,7,False,False,本人是今年开始实际上手的联盟，但从17年开始就看联赛看直播当个云玩家，我一直以为这个游戏最多也就是喷一喷队友菜什么的，然而实际体验下来只有喷，有时候大优势局也会到泉水挂机去喷你，可能真的是我段位低，我承认我很菜，毕竟我只是个新玩家，一个上手联盟6个月的人怎么能比得上上千把上万把的大佬，我最开始玩联盟的初衷只是我爸在玩，后来我们一家三口在大屏电视上看决赛，尽管我妈看不懂也会给我们做一些小零食，然后陪着我和我爸一起看，对那时候的幼小的我来说玩上一局联盟真的是很开心的一件事，无奈家里对电子产品管得严，直至今日才开始上手，我虽然熟知出装铭文，会个别我喜欢的英雄的连招，但我真的不懂兵线，对线期是怎么运营的，我只是单纯的想体验快乐，体验当年那个联盟，对于我来说联盟就是我的青春，我可以接受我的青春落幕，但我希望我是笑着送他走的，而不是在谩骂中黯然落幕，我现在除了无限火力就是大乱斗，峡谷只刷人机，我并非不求上进，只是想把上进心留给更值得的事情
1676430612,0,3,False,False,归根到底还是竞技游戏，你打不过别人确实就是孙子呀
1676439485,0,2,False,False,大多数游戏都会有一个最优解的，这没办法，每个版本更新都是设计师想改变这个最优解，以保证游戏不会变得一成不变，但是这个做法的缺点是不适合娱乐玩家，没有大量时间的玩家
1676443257,2,2,False,False,有些人是不是误会了什么？游戏的本质是为了快乐没有错，但是我认真玩游戏就是错了吗？竞技游戏我就是要赢对手就快乐，就是要变强就快乐我有错是吗？照你们说的游戏不好玩了是那些想要变强的人的错？
1676376461,0,2,False,False,我玩赛马娘也是，以前就是为了东海帝王玩的，现在天天坐牢练强马，东海帝王已经一年没有上过场了555~~
1676432459,0,2,False,False,说的太对了，都是在卷，但为了玩个游戏就把自己卷进去得不偿失，投入与回报不成正比，除非做到金字塔顶部。但能做到的人大多天赋大于努力，有这些天赋的人，大概率做那个行业都会成功的。
1676457980,5,2,False,False,我想说一嘴，或者是杠一嘴，任何游戏都有学习成本，你就算玩连连看也得学习他怎么玩，竞技游戏学习成本就是比娱乐游戏成本高很多，但是你不能说因为门槛低所以娱乐游戏就比竞技游戏好玩，而且历史也告诉了我们竞技游戏就是比娱乐游戏凉的快，拿暴雪举个例子：war3，星际1和2，就是活的不如炉石魔兽世界久，再看守望先锋，自打开始转为竞技游戏后在线人数一直暴跌，这是不可避免的，毕竟娱乐游戏我这件事干腻了我还可以在游戏里干点别的，竞技游戏就是一种玩法玩到死，可能会出现自走棋无限火力这一类的衍生玩法，但是只要他的核心还是竞技就不可避免两件事：1玩家流失2没有新人，这是大势所趋，谁来都不可避免
1676347937,2,5,False,False,现在只玩求生之路和枪火重生，偶尔玩玩死亡细胞！自娱自乐比什么都强！弹幕说学技术确实没错，参考大司马（他可是主播啊，现在玩lol感觉他很吃力）懂我意思吗？强的不是你而是18岁左右的你！随便了我已经退游好几年了（我并不是卖情怀，说的实话）有时候跟朋友一块玩也是玩大乱斗和下棋！我才24就感觉竞技类游戏很累了！之前玩守望上过大师偶尔摸摸宗师（主要还是不常玩），就像ow以前我喜欢玩c现在喜欢玩T！（ow已经死了）。                                    致敬20岁的我
1676455296,1,2,False,False,这本身就是竞技游戏，你要玩就做好心累的准备。评价是速来原
1676342836,2,5,False,False,国人社会压力大，在游戏里找存在感，想要体验强者高人一等的感觉满足自己的内心，然后开始学习，其他人被虐了不开心只有两个选择，要么挨打挨到退游，要么你也变强，这就和社会性是一样的，你说有段位嘛，前几年大家在低分段都很快乐，现在哪怕是低分段也不快乐。我以前两年青铜两年白银现在是钻石守门员。我打我朋友的青铜局也能赢。但是压力很大。他们属于是彻底的烂。大不了就投。死一次或者两次就15然后开始搞心态。你说他功利吗他不在乎分。你说他娱乐吗，他又在压力。这也导致了大家寻求捷径去找脚本。你不卷你只能挨打，你的快乐因为挨打变成了不快乐。你就想报复下去以此人传人恶性循环
1676458750,0,2,False,False,还是玩点不用看队友的游戏吧，想整什么活就整什么
1676331926,2,7,False,False,"当一个游戏我不愿意去找攻略，而是愿意自己去探索玩法，探索剧情，探索地图和人物设定时，我会觉得好玩，因为我觉得是我在玩游戏。
当一个游戏，我不得不去依赖攻略，没有一定攻略就玩不了，就会被卷死，或者被高压的游戏环境折磨时，那我会觉得好累，因为我觉得是游戏在玩我。
显然，现在的lol属于后者。"
1676342565,0,4,False,False,路人局太难玩了，好不容易几个好友聚在一起开个黑，又没号，好不容易借到号，又因为安全系统登不上。
1676341912,1,5,False,False,上了一天班想玩玩游戏放松一下 结果玩游戏人家让我找个班上[大哭]
1676271836,0,7,False,False,"这视频不就是退坑的原因，我能被你摸10下，但你别被我摸一下，12-0也给你秒咯[doge][doge]
开黑的时候吐槽现在的战士真的很恶心，能打能抗回复还贼高，然后就被说打不过就打入，但我又不喜欢玩近战[撇嘴][撇嘴]，玩了10年的lol，这个神话版本出来我这种喜欢玩远程感觉是最难受的，确实伤害是变高了，可是前提是你能不能活下来，现在的团战比王者荣耀秒人还快，而且很多这种战士都是飞来飞去或者锁定，什么极限走位，风骚躲技能，躲个屁，无脑一套(有的还不需要一套）我人就没了"
1676350638,2,3,False,False,这个游戏凉的一大部分原因是因为玩家素质降低
1676343659,0,8,False,False,装备畸形，英雄数值畸形，代练，公主，少爷遍地都是，脚本外挂，b站多少个都直接明着开挂直播的不管，垃圾wegame捆绑插件客户端臃肿卡顿掉帧，特效阉割，皮肤商城充钱活动数不胜数，哎.....
1676366802,0,1,False,False,"我发布了一篇笔记，快来看看吧
省流
https://www.bilibili.com/h5/note-app/view?cvid=21824813&pagefrom=comment&richtext=true"
1676348820,0,4,False,False,这游戏现在玩着就是上火，赢游戏运气成分越来越大，匹配最重要。翻盘几率大大降低，前十分钟定输赢，后面时间纯折磨。游戏中的有些失误会直接拉下整局游戏体验，尤其上路，你一个决策失误，会导致直接没的玩，雪球越滚越大，压力越来越大。
1676351591,0,3,False,False,有没有一种可能，你不适合玩电竞游戏，你该入坑单机，你说的这些在各种单机游戏里都能满足，建议你玩一下黑暗之魂哦，那研究后的快感你会知道的
1676342522,1,3,False,False,把压力怪去了，这游戏我还能玩几年
1676346324,0,3,False,False,跟我想的一样，现在上线，就是打个训练模式，爽一下卢锡安的无缝连招，爽一下亚索的双凤，无缝E，就下了。。。
1676349827,0,4,False,False,我跟不上游戏节奏了，但是有十七八岁的小伙子能跟上啊，现在问题是这游戏的替代品太多了，各种同类手游，游戏生命周期到末期了很正常，霸屏十年的游戏，已经是里程碑了
1676389324,1,2,False,False,所以人到中年以后才发现单机才是王道
1676451010,1,2,False,False,“种田型”玩家硬要融入为“杀手型”玩家服务的游戏，还要感慨游戏变了，在如今这个百花齐放游戏细分这么明确的时代，你就没有找准自己的位置，你也说自己就是下班了娱乐娱乐，买个switch、ps然后去玩3A大作不好嘛，多的是能满足你探索欲的游戏，是不是因为那些游戏要钱，所以你作罢了，毕竟你攒了一个月金币买个新英雄成就满满呢
1676356985,0,2,False,False,LOL就别哭惨了，在中国几乎都成电竞的代名词了，那关注度其他项目想都不敢想，你们都哭惨，其他项目是不是不用活了
1676335220,1,6,False,False,对我来说平时自己和朋友很难一起有空，只有过年的时候玩，这几年lol变化越来越大了，平时没时间研究对这个游戏越来越陌生，朋友当年的钻石仔在黄铜局被别人打到超鬼，一直黑屏一点游戏体验都没有还要被人骂，现在连无限火力都打不了了装备啥都不懂，好友列表不过年几乎全黑，明年估计就不会玩这个了
1676351751,0,2,False,False,电竞游戏末期就是如此，英雄联盟可不是娱乐型游戏，现在英雄之间的平衡，很拼操作和思路的，英雄联盟在电竞方面做的已经很棒了。你说的那种游戏探索的快感不该在电竞游戏上找，而在单机游戏。建议多玩steam，上面好玩的游戏太多了。
1676349569,0,3,False,False,説實話，就是學習成本太高了，自然就不會玩了
1676351489,0,2,False,False,关键是一个游戏火十几年就不合理，间接导致了很多不合理的东西
1676458481,0,2,False,False,还有我要提一嘴，炸鱼代练等等打不属于自己段位的人是真的该死，我指的所以游戏，没有新人炸鱼的锅至少占7成，你炸鱼很有成就感吗？打一群刚玩不到50小时的萌新你很有成就感？一边抱怨游戏没有新人一边炸鱼你良心不痛吗？我喊我朋友入坑了战地5，apex，彩六，结果一个游戏都没留住，全被炸鱼炸怕了，继续回去玩csgo了，呵呵[翻白眼][翻白眼]
1676349045,0,4,False,False,"我可以接受有人研究，大家都卷，毕竟想赢是人之常情。
但我不能接受官方教玩家玩游戏，难得的乐趣就因为不符合设计师的预期就硬改，这些改动真的有趣么。
大部分的玩家是要娱乐，而不是来跟设计师对线的。"
1676338800,7,5,False,False,根本原因是：我是来玩游戏的，不是来挑战自己的心理生理双重极限的
1676344560,2,4,False,False,初二s3的时候入坑的，当时也没什么英雄，拿个运存220mb的智能机用一个叫英雄联盟控的软件搁那看英雄技能，看看什么时候周免，看看什么皮肤好看然后分币不花。玩的时候就天天玩匹配，队友猛了就一顿互夸，加好友一起玩。现在除了加的认识的同学，那159个好友周末都没几个上线的。而且感觉已经好几年没加过或者被加陌生人的好友了，我也不懂是什么改变了游戏环境Zzz
1676339582,1,5,False,False,"27了，钻三大师徘徊的选手，没时间精力排位，想偶尔匹配玩玩，然而匹配完全成了带妹模式，10把有9把对面四个大师以上带个妹子，妹子就玩个猫咪，我寻思是不是匹配不带几个钻石队友都不敢玩了。
这游戏以前不是这样的，以前妹子还是很多的，有中单有辅助，那时候妹子都是想c的，都会去操作，不是现在，都是公主"
1676351514,0,2,False,False,"你说的对，但是这是无解的，这是竞技游戏无法停止的生命周期。从无知到精通，从精通到极致。从开放到封闭，从封闭到内卷。逐渐失去活力。
更新可以延缓，或者说把内卷的周期拉长，如果你一直不更新，那么结果就是所有人都会趋同于一个永恒不变的答案，那么游戏性会更快失去。"
1676346184,15,4,False,False,s5韩服大师退坑的老玩家现在回来，几个月前朋友给了个最新的郊区峡谷之巅的号，定位赛一堆公屏计召唤师时间，打运营，全部选比赛整容，几分几秒推线控河蟹，去峡谷先锋，辅助还要去中路吃经验到6打先锋团这些的，补刀各个10分钟100刀就离谱当初s5韩服大师都没这样玩的，现在定级赛都在疯狂交流打运营，操作也是一个比一个好，这游戏现在青铜白银就比当年s5职业选手还卷，可能现在青铜白银五黑能吊打当初s5的skt都说不定[大哭][大哭][大哭]
1676338705,0,5,False,False,很简单，因为赢了之后没什么成就感，输了就有点难受，不像大逃杀之类的 一天打下来估计就能吃2把鸡，但是提供的成就感比lol赢20把都高，可能也是玩的久了。游戏而已没必要死磕一个玩。
1676457287,0,2,False,False,地图编辑器，yyds
1676342254,0,4,False,False,已经过了巅峰期了，没了LOL地球一样会转....从S2开始玩LOL，从一开始的热爱...到后来一有新游戏就会跑去玩别的，然后回到峡谷发现LOL还是那么好玩...到现在，打开客户端...排位一把...算了太🐕8累，大乱斗？全是丢丢怪玩不了一点。算了先看看更新日志...哇好迷茫...下把棋吧....为什么啊 为什么3-5我就要凉了啊....算了不玩了...
1676442751,0,2,False,False,个人认为，游戏环境变差还有个原因是马服关闭了所有人聊天，有些人素质就是差，不让骂对面就只能攻击队友了呗，还有就是，我想问问，自从关闭了所有人聊天，你有多久没有加过对面的对手了，我曾经最快乐的一段时光，看到对面最c的那个那么强是会去夸他的，对面拿了5杀还是会公屏666的，对面太恶心也是会公屏扣字开喷的，队友的问题反而不会注意了，台服....或者说其他服为啥都开了所有人马服不开呢
1676434968,1,2,False,False,玩一玩台服就知道为什么现在马服凉了
1676464098,0,2,False,False,一个破逼游戏，给整成了竞技和比赛，那我还玩他个鸡儿。星际2虽然也有比赛天梯排名什么的，但是他PVP以外的战役做得很好啊，他还有很多好玩的单人战役和任务地图啊，LOL有吗？就是硬比。累，那就不玩了。
1676339801,0,5,False,False,LOL我已经一年多没玩过了，现在就是看看比赛，看看直播。最后一局游戏，我锤石辅助卢锡安，卢锡安拿二十多个人头，然后就开始浪。一直去找皎月单挑，连续被杀几波之后打野看不下去了就说这么帮你你这样玩？这人直接破防卖装备开送，后边我也忍不住了跟他骂起来了，他一句你就只能玩玩辅助混。让我心拔凉拔凉的，回想起开始玩辅助的两年时间这种话我真的听太多了，没意思，辅助玩家上分真的就是看队友。游戏打完我就卸载了
1676347212,0,4,False,False,任何游戏都是刚开始好玩，后来就不好玩了，为什么？因为分水岭，不是每个人都能全身心投入到天天研究攻略上的，就像我，初中的时候天天玩lol，天天看攻略，现在上班了，回家电脑甚至都不想打开，其实就跟现实一样，时间久了，你会发现社会盘根错节很多东西，越是时间长了，你看待社会的眼光也从儿时懵懂单纯到现在战战兢兢
1676345801,1,4,False,False,"不能完全苟同up的说法，但是也是给了我另一个想法，就是各种竞技游戏都有上分的玩法和娱乐的玩法。像FPS想上分就练枪练道具，娱乐就开黑当老六当瘤子。lol也一直都有娱乐玩法，大乱斗、特殊模式、心之钢，但是英雄联盟运营的行为很明显在铲除游戏的娱乐性来维持它那可怜的竞技性。
然后就和up的看法一样了，我只是来休息的，不是来换个地方上班的、"
1676344310,0,2,False,False,当一个游戏设计师想要教玩家玩游戏的时候！这个游戏已经离死不远了！可笑的是，他们自己根本就没意识到这件事！
1676347973,5,3,False,False,昨天我们基地还差一丝血被推    我们都没点投降   然后抓住机会吧对面一波推     当时觉得特牛逼   这或许就是游戏带给我们的快乐吧！然而已经没有和我分享这种喜悦的人了
1676404696,0,2,False,False,当时几个月没玩，我进LOL里面我靠还有神话装备。瞬间不会玩了。
1676358925,0,2,False,False,深有体会，如果我们这群老玩家不在坚持这款游戏，或许英雄联盟就已经结束了，毕竟这是游戏，而我们要面对的是生活，没有那么多的精力，最初开始也是因为和朋友们一起在游戏中寻求快乐，现在在大家都面对生活带来的一切，加上官方不在意的运营，已经没有理由继续 坚持了
1676433171,0,2,False,False,up看清了呀 我工作回家打游戏只是像放松只是想爽 lol现在学一大堆东西反正我是玩不来 还不如玩几把鬼泣 doom啥的让自己爽爽
1676338677,1,5,False,False,以前一把50分钟打完了十个人都说玩爽了，现在一把二三十分钟都有几分钟都在指责队友的，现在的匹配机制导致五个人根本很难做到水平相同，前面年底的时候钻石晋级赛，水平都差不多，十个人都想赢，最后四十多分钟水晶200多血翻盘，玩的也很爽，跟朋友一起五排，被打的还不了手互相嘴硬也可以很开心，归根到底还是匹配机制逆天
1676351196,0,3,False,False,其实我觉得玩家也有锅，没有划分界限，有的玩家就是喜欢打高端局那种氛围，通过提升自己来获得成就，那么就老老实实玩排位，当然不是不让你玩匹配，只是想让你玩匹配模式的时候，放下你那趾高气昂的态度，因为更你一起玩的队友他们可能是刚入坑的玩家，有可能是刚回归的玩家，有可能是从比你更高的山上下来的神，他们不会在意游戏的结果，而是这个过程，这个过程是否好玩，但是很多人缺越了界，在匹配模式里面乱叫，没有保护好本该是娱乐的地方，混进了几颗耗子屎，坏了这锅汤。
1676360239,0,3,False,False,s3入坑开始一直玩瑞文到现在没断过，也有一万多场了，还是觉得游戏很好玩啊，可能是工作比较轻松有多的精力吧，享受与对面玩家的博弈才是这个游戏的乐趣，什么玩家吵架摆烂我从不在意，直接屏蔽或玩好自己的，输了先从自己身上找原因，不是因为我坑了输游戏就不会在意，队友送再多也影响不了我，我享受的是与玩家博弈的感觉，输赢只是其次
1676337156,3,8,False,False,还有还有，把游戏内所有人聊天给强行关闭了，不交流总感觉玩的是单机游戏。哪怕我们不跟对面交流，但你不能剥夺我们交流的权利。。还有把游戏界面改的，游戏结束还要点一下才能看到大家的聊天记录，跟队友、跟对手都不让交流，不让喷、不让发泄，还玩个屁啊，玩人机算了
