上传时间,回复数,点赞数,up是否回复,up是否点赞,评论文本
1676444397,19,2844,True,True,这个医生真的，说的是非常非常科学的减肥方法，我减了32斤，反正也是从早睡早起开始的，时间规律了，吃饭也规律了，早饭吃了中午就不想吃太多，热量就下来了。晚饭就吃点素的，零食基本就不吃、时间长了也没兴趣吃零食。也没怎么反弹，也没有暴饮暴食的想法（因为吃饭很规律，碳水和菜都有吃）
1676459848,3,361,True,False,主要就是脾胃  养好脾胃  忌凉 医生说的太对了
1676455765,7,832,False,False,和我的中医说的很相似……一进诊室就被骂“[妙啊]昨晚上又去拯救世界了是伐？蝙蝠侠睡的都比你早”。。[捂眼][大哭]
1676455809,12,450,False,False,18点到睡前只能喝水，看着我饿了么里的两个在靠近的外卖小哥陷入了沉思
1676434351,3,248,True,False,这个医生好好啊，我搁着屏幕都觉得有动力坚持减肥了
1676436656,1,421,False,False,这医生已经说到点了还是有人不以为然[无语]
1676453929,5,89,True,False,关于我在一个减肥方法的视频里，一眼看中了裤子的故事[doge]
1676460405,2,42,False,False,哎 医生说的好有道理。我脱产半年，没怎么努力没怎么干活和运动就减了10公斤（67-57）。主要还是压力小了，对零食的需求减弱了。同时休息变规律、睡眠时间也长了。之前上班真的，晚上不来一顿宵夜的话，我感觉心理状态无法支持我活到明天....
1676454241,6,52,False,False,说实话啊，我减肥有效果维持一年多了，但是那些曾经戒掉的东西还是会喜欢的，唉，减肥好难，女生好难，幸好运动的习惯也让我保持下来了，现在是个紧致的胖子[正经人_揉脸]
1676459672,6,19,False,False,"控制不住嘴咋办，我一有空就想吃东西[笑哭]
夜猫子咋办，越晚上越兴奋，我差不多都四五点睡的，真的睡不着[保卫萝卜_哭哭]"
1676428230,12,94,True,False,关键是八小时睡眠吗？还是必须那个时间段睡觉[笑哭]
1676463850,0,8,False,False,基因性的就是别人不怎么控制都不胖，你一不小心没控制就胖回去………这就是差距，要我说胖点健康就行，也别太瘦了
1676458455,2,9,False,False,本多囊研究出的减肥方法，吃饭先吃青菜，然后是肉，最后是主食（我基本不吃），坚持不到一个月月经就开始正常了[委屈]但是一旦没有坚持，月经又会不规律
1676462743,1,9,False,False,除了熬夜什么也没干……
1676454461,1,19,False,False,可是螃蟹火龙果西瓜真的好好吃[辣眼睛]
1676440580,13,39,False,False,呜呜，寒凉的不能吃，是不是以后就和冰西瓜冰激凌什么的无缘了qwq
1676450021,0,13,False,False,我喝着牛奶看视频，看的津津有味，突然告诉我不能喝凉的牛奶[tv_笑哭]
1676455757,0,12,False,False,面包🍞的配图给爷整笑了[doge][藏狐]
1676455048,2,7,False,False,哎呀，反正得了胃病就自己就知道怎么减肥了[doge]我就是
1676466514,6,6,False,False,所以说为啥牛奶一定要加热喝[笑哭]
1676458858,0,2,False,False,"我就是，一回大学变肝帝+宿舍小床睡不踏实+不得不吃外卖/食堂的单一饮食，就发面
一放假回到家跟着父母老年作息早睡早起+家常小菜+心情舒畅没有寝室学校破事就咔咔掉秤"
1676455814,0,3,False,False,笑死，我们寝室晚上十一点前根本睡不了的，你想睡也会被吵的睡不着[微笑]
1676385777,5,22,True,False,医生好厉害[星星眼]
1676478417,0,1,False,False,感觉阳过后我自己都改了好多习惯，比如以前是天天熬夜，阳之后太累了睡得很早（虽然这几天好像又有些睡晚了）对奶茶咖啡之类的不感兴趣，对冰的不感兴趣（以前我可是冻死也要喝冰的啊）这次阳了让我有感觉得出来可能我之前喝太多冰的了。阳过都快2个月了我还是很怕冷，以前我的体质是怕热的
1676454684,6,8,False,False,听到什么西瓜螃蟹不能吃牛奶必须加热就知道不用看了[呲牙]
1676466232,1,1,True,False,看你这腿也不胖啊。
1676452335,4,7,False,False,啊！我真的一点儿都不爱吃主食，结果说不吃主食月经不调，还不减肥[大哭]
1676453937,5,3,False,False,不吃火龙果拉不下粑粑怎么办[笑哭]
1676467110,0,1,False,False,这医生真好，我去看内分泌挂的专家号，医生都不跟我细说[生病]
1676469014,0,1,False,False,规律饮食真的，只要按时吃饭中间就不会想吃零食，体重就下去了。
1676458589,0,1,False,False,大概是有用的 我bmi在偏瘦和正常那个临界点变  我平常除了作息不健康外这个饮食习惯和医生说的差不多 我不爱吃零食主要就吃个三餐[哦呼]
1676458056,0,1,False,False,笑死，我六点半才下班，不吃只能饿死
1676460349,0,1,False,False,一年四季除了白水只喝热水外，所有喝的都喝冷/冰的我+长期熬夜（晚上最早也就1点前睡），上次去看中医就被骂了[保卫萝卜_哭哭][保卫萝卜_哭哭][保卫萝卜_哭哭]
1676459225,0,1,False,False,天哪我怀疑我也是，我奶奶家都是易胖体质，而且我是工作后变得比较胖后才容易咳嗽，顺便我最近也在减肥，饮食习惯和这位医生说的很接近，加油，希望可以瘦下来让身体也更健康
1676463647,0,1,False,False,经常失眠，所以长期熬夜，早睡真的做不到啊[笑哭]
1676480240,2,0,False,False,现实…自己胖了后，连自己都嫌弃自己……根本不想爱自己…
1676478969,0,0,False,False,减肥真心特别简单 就创造热量缺口饮食注意碳蛋脂搭配，适量运动，不良习惯改改，就这么简单真的，熬夜什么都属于附加项了，只要有热量缺口不管你干啥都能减…  买本中国居民膳食指南2022解决一切问题
1676452120,5,2,False,False,问一下就是火龙果真的不能吃吗？火龙果我一直以为是热的，而且这个东西吃了之后，就是它很通便啊，我有时候便秘我就吃火龙果来着[tv_腼腆]
1676475324,0,0,False,False,还真是这样 过年回去了一个月 被迫每天早睡三餐按时吃 不吃零食因为感觉根本不饿  好多人都说我面色看起来比回来的时候好多了 还瘦了 [妙啊]但我现在一回来 又开始熬夜了 [辣眼睛]
1676475283,0,0,False,False,除了要热牛奶之外都非常科学。食物本身温度冷热其实无所谓，很多列举的“寒凉食物”问题都出在别的方面，比如奶茶和高糖水果是果糖太高了，除了长胖以外，对肝非常不好
1676470696,0,0,False,False,感觉好多姐妹不知道为什么不能喝冷牛奶，我这里解释一下，因为冷的东西会加重湿气，就像放冰水的杯子上会凝结水汽一样，身体湿气重了就会虚胖，没精神，中医上也是说的胖人多湿。
1676477800,0,0,False,False,高中生的我，多少陷入了沉思（但是我确实沉的一批）
1676475782,0,0,False,False,弱弱地问一句为什么牛奶必须喝热的常温都不行？冬天我也很喜欢喝热牛奶，但是夏天要到了真的很爱喝冰牛奶[奥比岛_委屈]
1676471472,0,0,False,False,这不就是我高中时候的饮食习惯吗[喜极而泣]不需要自己毅力坚持，高中的安排就能让你瘦[喜极而泣]我那时候瘦的腰间没有一点肉[藏狐]可惜了，现在都是肉
1676472062,1,0,False,False,这就是正常一日三餐啊……除了吃饭不吃零食这样，弹幕哀嚎不可能什么奶茶戒不了的，你猜猜为啥减不下来……
1676469166,0,0,False,False,这医生很不错也很科学，现在国际上比较推崇168轻断食+211餐盘法健康减肥，还有每周尽量中高强度运动150分钟以上，这不单单是给胖的人普通人也可以这样坚持获得更好的健康～
1676476625,0,0,False,False,不吃西瓜！那不如杀了我！！！竟然也不能吃西瓜呜呜呜
1676455537,0,1,False,False,呜呜呜我从高三开始发胖，月经也不调，打算这学期去开始去健身房减肥，调节饮食！up可以建一个减肥群嘛，想和姐妹们一起努力[打call][打call]
1676467281,0,0,False,False,加热喝这个我做不到，我除了冬天最冷的时候，其他时候全部喝凉的或者冰水，哪怕冬天，只要屋子里暖气足，我也是喝凉的，真不喜欢喝热水
1676467078,0,0,False,False,不吃火龙果拉不出粑粑！[保卫萝卜_哭哭]而且我还果酸过敏，没几种水果能吃了
1676463731,0,0,False,False,道理我都懂，但现代人有几个能这么健康生活，特别是年轻人[藏狐]
1676464188,0,0,False,False,感觉除了睡眠一定要充足这一点以外其他的并不适用于所有人，看看参考一下就完了，世界上没有一个能给所有人用的万能减肥方法，特别是医生针个人体质给开的这种，不要看到就盲目的照搬尝试[哈欠]
1676477086,0,0,False,False,我好像知道我为什么瘦了 从小到大除了一日三餐其他东西都不咋吃[呆]
1676469513,0,0,False,False,涂阿达帕林要避光，一下就把我熬夜的路打断了[捂脸]
1676462939,0,0,False,False,总的来说，规律饮食和作息就是最强的[脱单doge]
1676473493,0,0,False,False,我去查了，有点胰岛素抵抗，今天是吃二甲双胍的第一天，效果超好，正常吃饭之外一点食欲都么得[打call]
1676462979,0,0,False,False,我晚上靠着两大个丑橘和一大杯热牛奶撑得现在肚子还是胀的
1676469587,0,0,False,False,哇想起来我初中的时候回家直接两袋冰箱里拿出来的凉牛奶一口气下肚，好勇啊
1676471784,1,0,False,False,提问：酸奶或者老酸奶可以吃吗[给心心]（牛奶都要加热，那冰镇的酸奶[大哭]）
1676464077,1,0,False,False,我也想，我觉得我吃得已经够了，一到晚上肚子咕咕唧唧的响[保卫萝卜_哭哭]老尴尬，所以我会尽可能推后晚饭时间，八点左右才吃东西。
1676461887,0,0,False,False,早睡早起真的蛮重要的，有一段时间我就是比较早睡起的话也早起就瘦了，要知道在那之前我一直运动锻炼就是属于卡平台期的那种谁能想到就靠早睡早起加吃早饭掉称了[笑哭]
1676468210,0,0,False,False,怪说我难胖起来，因为我不爱吃零食喝饮料吃寒凉食物
1676463446,0,0,False,False,呜呜呜那个牛奶[tv_大哭]热的 都喝盒装的呜呜呜基本上都不会热 我尽力[tv_大哭]
1676462194,0,0,False,False,健身人士觉得她说的真的很对[doge]
1676461680,0,0,False,False,之前断碳水，断的我暴躁，尤其是经前，摔了好几个碗了[笑哭]
1676470545,0,0,False,False,最喜欢吃西瓜火龙果和螃蟹，牛奶只喜欢和冰凉凉的，怪不得我湿气重[生病]
1676464733,0,0,False,False,作为一个瘦子，我就说这样的生活习惯
1676465792,0,0,False,False,我要收藏这个视频，懒了就打开看看医生说的话。
1676470499,0,0,False,False,中医还是西医啊，我也想去看看医生了
1676470894,0,0,False,False,医院有专门的科室是研究减肥的嘛[大哭]要怎么才能找到这种医生[大哭][大哭][大哭]
1676471351,0,0,False,False,我是想胖都难
1676471960,1,0,False,False,中午在公司大家菜多肉少怎么吃的呀？主要是菜，外卖基本就一点蔬菜，带饭的话绿叶菜也不好带啊
1676465385,0,0,False,False,神奇！我这几天就莫名咳嗽没想到刷到了
1676464251,0,0,False,False,为啥一定要喝热牛奶，这点不明白
1676466034,0,0,False,False,我感觉我上班就是这样吃的呀，但还是胖，哦，我一周二个通宵夜班，找到原因了
1676460840,0,0,False,False,我吃的少也不妨碍我胖[笑哭]
1676462033,0,0,False,False,我是早晨不吃饭，到中午两点来钟起来做一点饭吃，吃完七点来钟再吃晚饭
1676447982,7,2,False,False,有些还是太离谱了，牛奶必须喝温的是什么鬼？
1676461458,0,0,False,False,虽然但是啊，你录音了医生知道吗？
1676476084,0,0,False,False,感觉好像南方中医比较靠谱  而且中医多
1676460306,0,0,False,False,和我家的饮食习惯基本一样，是真的有用，虽然说我也不是很瘦但一直没有100斤体重也挺稳定的
1676463036,0,0,False,False,我高中就这样，也没见瘦啊
1676457346,0,0,False,False,笑死，6点下班，剧终[笑哭]
1676457548,0,0,False,False,[笑哭][笑哭]小红书刷到了，b站也刷到了，[大哭][大哭]看来我是真的该减肥了
1676460544,0,0,False,False,好了，视频看完，赞也点了，快把裤子链接发出来吧！！！[妙啊][妙啊][妙啊]
1676478526,0,0,False,False,好的，那咳嗽怎么说的
1676458049,0,0,False,False,[脱单doge]其实早睡早起顺应天时自然而然能量就不堵了
1676463831,0,0,False,False,其实减肥贵在坚持[脱单doge]up加油
1676464716,0,0,False,False,对于已经绝食减肥过的人呢
1676455116,0,0,False,False,在不能吃东西的中间要是别人吃东西所散发的味道也会勾起食欲[保卫萝卜_哭哭]
1676455100,0,0,False,False,你说的我不参与，九点就要躺下八点做好准备工作六点吃一点东西那还不如四点半吃呢？为啥要那么晚，不吃任何零食正常时间吃饭不会胖在胖就胖几斤不会像吃零食那样胖的那么快
1676456583,0,0,False,False,我也是从小胖到大诶，还爱晚睡[辣眼睛]怪不得
1676459728,0,0,False,False,这个医生厉害，是中医吧？
1676455296,0,0,False,False,这个医生很好，一般医生都不会和你嘱咐那么多
1676463635,0,0,False,False,可是我吃碳水会长胖吃肉不会诶
1676455143,0,0,False,False,如果不胖感觉这个方法也挺健康的，我的饮食就很混乱，一顿多一顿少
1676454663,0,0,False,False,我喝凉牛奶雀氏不舒服！！回学校就贯彻落实[doge][doge][doge]
1676456467,0,0,False,False,控制好热量，多蛋白少碳水，增肌调理作息，
1676474502,0,0,False,False,我超爱火龙果和西瓜的[惊讶]
1676461658,0,0,False,False,认真吃饭就不怎么会馋零食奶茶
1676454920,0,0,False,False,但是打工人真的能在5点到6点吃晚饭么[藏狐]
1676470789,0,0,False,False,疯了减肥好难[抓狂]
1676460131,0,0,False,False,健康的作息很重要
1676477898,0,0,False,False,不喝水喝茶可以吗[笑哭]
1676460869,0,0,False,False,这就是专业啊
1676428340,1,1,True,False,谢谢分享，昨天决定减肥，今天就看到你了，你说巧不巧[星星眼]
1676472819,0,0,False,False,牛奶为什么一定喝热的
1676457516,0,0,False,False,6点都没下班
1676470725,0,0,False,False,但是我真的很喜欢吃西瓜和冰淇淋啊
1676463362,0,0,False,False,我最最最最最爱大螃蟹了呜呜呜
1676454110,0,0,False,False,！我每天就是这样过得 然后我去体检结果是消瘦。
1676459785,0,0,False,False,实在不爱喝热牛奶
1676455745,0,0,False,False,暗夜容易变胖容易吃多
1676475248,0,0,False,False,很好奇这是去什么科室看的呀？我也想去看看
1676428282,0,3,False,False,这个医生好厉害
1676454313,0,0,False,False,感觉像我去看中医时说的体寒
1676459722,0,0,False,False,我好蓬松[笑哭]
1676451022,0,1,False,False,这个医生说的真的很好，感谢up主。
1676468571,0,0,False,False,咳嗽咋说呢？
1676478759,0,0,False,False,必须顿顿有肉[笑哭]
1676464466,0,0,False,False,医生好好！
1676450934,0,1,False,False,"upup,有裤子链接吗[星星眼]"
1676458363,0,0,False,False,收藏夹吃灰
1676461305,0,0,False,False,30岁之后呢mmmmm新城代谢降低也这样吃吗
1676463104,0,0,False,False,紧致！
1676460880,0,0,False,False,谢谢医生
1676454355,1,0,False,False,可以吃辣吗，没有辣椒吃不下去饭[大哭]
1676460041,0,0,False,False,第一条就中了
1676453282,0,0,False,False,基本都踩雷了，熬夜吃零食，最近胃也老反酸，唉，早睡早起![打call]
1676463600,0,0,False,False,晚饭时间这么早吗？还没到家
1676458395,0,0,False,False,晚上睡不着怎么办
1676455447,2,0,False,False,为什么牛奶一定要喝热的呀？
1676462029,0,0,False,False,[保卫萝卜_哭哭]明天就开始
1676455980,0,0,False,False,为什么录音，经过同意了吗？
1676474954,0,0,False,False,好的，晚安
1676479795,0,0,False,False,谢谢up分享
1676451148,0,0,False,False,我们食堂基本见不到绿色的东西[笑哭]
1676475513,0,0,False,False,@石小丘 不要熬夜哦
1676475414,0,0,False,False,看的是什么科的呀？姐妹～
1676456872,0,0,False,False,很干货！
1676461769,0,0,False,False,牛啊，牛啊
1676478673,0,0,False,False,好的
1676474728,0,0,False,False,感谢分享
1676469314,0,0,False,False,@大肥菠萝好玩又好吃 来看看！！
1676450854,0,0,False,False,我在学校就这样吃，但是睡觉时间很少[笑哭]
1676457548,0,0,False,False,谢谢分享！最近刚好准备减肥啦！
1676467899,0,0,False,False,[打call]
1676460267,0,0,False,False,@江茶茶orz
1676448577,0,0,False,False,晚上一定要吃主食嘛[笑哭]我晚上一吃主食就睡不着[笑哭][笑哭]
1676454242,0,0,False,False,坐等课代表[doge][doge][doge][doge][doge][doge]
1676447410,3,0,False,False,牛奶可以不喝吗[笑哭]我一喝牛奶就胖
1676451652,0,0,False,False,我家也是，我姥姥，我妈，我舅
1676454693,0,0,False,False,我虚
1676455001,0,0,False,False,6
1676454335,1,0,False,False,@KONAちゃん [酸了]
1676427707,1,0,True,False,up你的鞋底是不是掉了[笑哭]
1676439999,1,0,False,False,早上八点多吃饭 十点多就饿了[笑哭][笑哭]
1676450159,0,0,False,False,@Deason啊 我要减肥！
1676438272,0,0,False,False,我是觉得很有用，马了
1676441302,0,0,False,False,想问一下牛奶必须加热吗，那凉白开是不是也不能多喝呀
1676381724,2,0,True,False,UP主加油！
1676427329,0,0,False,False,谢谢分享
1676480435,0,0,False,False,唉，我就是上班绝不吃零食的人，但是一个个摆着那么多零食的人都比我瘦 。。。现在睡眠是不好，可我好的时候也没瘦过。。。小的时候麻杆一个怎么都不胖，都说我吸收不好，现在吸收好了难道不是好事吗？可是胖的不像话了。
