上传时间,回复数,点赞数,up是否回复,up是否点赞,评论文本
1676441794,1,2,False,False,第五人格如果真的以克苏鲁来解释设计的就更合理。不用是怕被河蟹吗？还是为了回避？剧情推完不用神话来填坑，那就坑太多了。如果用神话力量来解释那样无论是监管者的存在技能。还是求生者的诉求，参加游戏的动力。都可以解释的清楚了
1676368605,1,2,False,False,中配是不是苏尚卿啊（？）好熟悉的感觉
1676382379,0,2,False,False,好帅好帅！啊！我要被摔死了[害羞][害羞][害羞]
1676370527,0,2,False,False,这么帅，带什么面罩呀[生气][生气][生气]
1676382435,4,4,False,False,他的声音真的好熟悉，有知道的介绍一下嘛[脱单doge]
1676368494,0,2,False,False,真的爱死了(ノ=Д=)ノ┻━┻
1676369927,0,2,False,False,[妙啊]用弟弟20年单身换得出这个帅哥
1676413503,1,2,False,False,老婆老婆，呜呜呜，又多了个新老婆，求求了，给我老婆的限定金吧
1676369610,3,2,False,False,问问这个对应哪个求生者[保卫萝卜_哭哭]
1676376801,0,2,False,False,好TM帅啊
1676369953,0,2,False,False,连着几个都是白毛
1676387081,0,2,False,False,我在这里留一个首冲翻倍，希望给五年老玩家一个限定金[大哭]
1676373539,0,2,False,False,三连换限定金！！！[2233电子喵_想桃子]
1676368819,0,2,False,False,中配好像杨天翔老师啊
1676365448,0,7,False,False,没关系，金皮会被永远埋葬
1676430581,0,2,False,False,黑杰克当我面组队你都不管，这个模式冷门真的应该[嫌弃]
1676395017,0,2,False,False,我不知道为啥，我觉得看这个角色的第一眼想到的声线是lol里面千珏的声线，内种有“妖精”的感觉的声线，没想到是个小男孩[笑哭][笑哭]
1676365773,0,6,False,False,长得帅 声音好听 我沦陷了[脱单doge]
1676365929,0,2,False,False,他的白毛吸引了我的注意，我不管他强不强了，他必被我纳入怀中，我来了，帅哥，结芬！！！[脱单doge][脱单doge][脱单doge]
1676467511,2,2,False,False,CV是谁呀
1676386934,0,2,False,False,许愿白嫖守夜人限定金，上次说如果白嫖芥川，我就买人虎，我已经做到承诺了，网易我们再交易一次[脱单doge]
1676437819,0,2,False,False,什么时候上线啊啊啊啊啊啊一定要搞到！
1676365384,0,5,False,False,有没有可能zack的联动给这位了(●—●)
1676365915,0,4,False,False,和想象中一样呢ww是风之子，腐朽的神性、和少年对于仇恨之间选择的残忍，在看到母亲被逼疯后做出的选择什么的，，，疯疯的，，，冰冷的湿（血）和白色的雪，纠缠着他，疯猫猫（感觉是呢。
1676388186,0,2,False,False,他真的我哭死还特意做了猫耳[脱单doge][doge][脱单doge]
1676390108,0,3,False,False,情人节送新老婆[星星眼][星星眼][星星眼]
1676368520,2,2,False,False,cv是谁啊cv是谁啊？有点耳熟。[星星眼][星星眼][星星眼]
1676365361,0,18,False,False,这么快！！五宝升为五贵妃！！
1676431677,0,2,False,False,欧非守恒  这期芥川我不抽了  我要守夜人！！！！！！！！！！！！！！！！！！！！！！！
1676375188,0,2,False,False,三连求金！！！（出了金网易我当场给你充五百！）
1676373019,0,2,False,False,擦。。好帅[2233塔罗牌_AWSL][2233塔罗牌_AWSL][2233塔罗牌_AWSL][2233塔罗牌_AWSL]
1676388472,0,2,False,False,@蔥蘢 @爷亻敖灬奈我何 😋
1676365783,0,2,False,False,见p，把他m我的世界启动器还回来
1676366658,4,3,False,False,看某站传的技能爆料感觉很一般啊，五宝快点发出技能告诉我那是假的[捂脸]
1676365556,0,4,False,False,铃屋什造（bushi）
1676366160,0,2,False,False,"你们好友文学。我只知道。老婆啊啊啊啊啊啊啊啊啊啊啊啊啊啊！
老婆嫁给我"
1676366046,0,2,False,False,好帅！救命！好帅！啊啊啊啊啊！（扭曲的爬行）
1676383570,0,3,False,False,啊哈哈哈 啊哈哈哈[doge][doge]
1676387397,1,1,False,False,"有个关于宗教过度解读：守夜人的故事有暗含基督教对于其他小信仰的迫害。
在故事中。守夜人代表的是小众的信仰，他哥哥是基督，但是守夜人的母亲代表的应该是信徒（有解释）
原因:1守夜人的原型是温迪戈，而历史上的温迪戈是小众信仰体系中的而且被基督扭曲成了邪神。
2温迪戈和守夜人的经历类似都是种本来有着光明的未来却应为“披着神明的皮囊”（温迪戈中指基督守夜人中指哥哥）变成邪恶的存在.（温迪戈没有被基督扭曲的话祂和信仰祂的民众回有光明的未来，而守夜人回在与母亲的呵护下有着完整的童年和未来）
3守夜人与他哥哥长得一样有可能暗指无论温迪戈一类的少众信仰还是基督都是一样的。没有本质区别。
4能孕育信仰的只有信徒，所以说信徒才是信仰神灵的母亲也说的过去对应守夜人被收养的情节。
基于以上的猜想那么：守夜人捡来的可以解读为温迪戈这个信仰不原创是继承(捡来的)，守夜人杀了哥哥并取代的情节代表着信徒并未改变信仰换来的是重压下的疯狂(对应母亲疯掉的情节)所以结局守夜人成了报复教会复仇者可以看作基督把温迪戈扭曲成了邪神（毕竟在一个信仰基督的眼里面在冷原复仇的守夜人不正像教典里邪恶的温迪戈一样可怕吗？）"
1676381402,0,1,False,False,三连求金！！！网易你也不想我不充钱吧[给心心][给心心]
1676458177,0,1,False,False,地狱空荡荡，魔鬼在教堂
1676466578,0,1,False,False,拜托拜托拜托拜托拜托金皮金皮，每天来 这里乱嚎一次（
1676380220,2,1,False,False,"自创求生者

注:后面的背景故事还没有设计好【如果有谁设计好了后面的背景故事可以向我投稿】"
1676381383,0,1,False,False,精华一我250发大保底了，说什么这个精华也得让我白嫖一次金皮吧[大哭]
1676457638,0,1,False,False,潘丽娟新皮肤有点像守夜人妈妈[大哭][大哭]
1676381184,0,1,False,False,许愿限定金[Cat2_DoorKeeper!][Cat2_EatDonut][Cat2_Hoop!][Cat2_CatAMail][Cat2_Chaos][Cat2_Infinite!][Cat2_Cross!][Cat2_BlackHole!][线条小狗_盯][线条小狗_爱你][线条小狗_求抱抱][线条小狗_哇哦][线条小狗_快乐]
1676379910,0,1,False,False,感觉可以整个双形态，人类能开门之前是人类形态，能开门之后直接变身成守夜人，地图开始下雪，就跟扒鸡打完蛇之后的变化似的（美美做梦）
1676365508,1,42,False,False,应该是一个替母报仇的故事
1676387153,0,2,False,False,然后又强不过体验服是吧，求生每次只会“玩不好的话”监管每次只会“玩的牛的话会”，一次一次被践踏，我觉得不论生活中还是游戏里都很难过，永远别等别人良心发现，为什么还会有屠夫玩家在啊，你玩着这个判定不恶心吗，你不觉得修机速度很恶心吗？他出监管只是为了卖皮肤你在等什么啊？既然人家一直看不见监管的难，无条件从求生者的角度帮他们更好的赢，这个游戏就变味了，你应该知道的，有些时候是带节奏还是说事实你心里清楚就好，我不多说，你不妨想一下未来是什么？某个监管终于强了被求生喷的被迫削？你不如退游，还有其他很多好游戏至少从平衡性上是比第五人格好的
1676384243,0,1,False,False,一些自己的猜测，守夜人与疑似教皇的人是双生子，而“母亲”捡到了被遗弃的他，并抚养长大。可好景不长，母亲被教皇以神的名义带走，结合母亲的红发和后面守夜人眼睛里的火光，应该是魔女审判，而守夜人躲在门后，因此没被发现。为救母亲，守夜人杀害了自己的哥哥（弟弟），并取而代之，可惜，此时的母亲已经被折磨的失去了理智。愤怒的守夜人成为了黄衣之主哈斯塔的信徒，成为了伊塔库亚，以伪神的名义，向抓走母亲的人进行“审判”
1676379100,0,1,False,False,守墓人：老子当天给你挖出来😃（）
1676382840,0,2,False,False,为什么又是美型男😭😭😭还借什么克苏鲁神话的名啊好好搞个人外不好吗😭😭😭是不是没钱了圈钱呢
1676387338,0,1,False,False,这适配度，杀戮天使联动会给他吧！[保卫萝卜_哭哭][保卫萝卜_哭哭][保卫萝卜_哭哭][打call][打call]
1676381444,0,1,False,False,"能不能给我的约瑟夫老婆补个pv,哦对了，可以加上我他没有我晚上睡不着[doge]"
1676375477,2,4,False,False,为什么有人问cv啊？这有什么意义吗？不觉得这种行为很让人反感吗？难道世界上声音好听的只有那些cv？是不是以后还得来个攀比？然后不是有名cv配的就拉踩？哪怕是有名的cv又有什么意义？还说人家网易不尊重人，咋了是人家cv免费配的？能不能不要搞饭圈文化。
1676375572,0,1,False,False,啊啊啊守夜人好戳我xp，已经自动脑补本子了嘿嘿嘿…………(爬行)(扭动)(分裂)(扭曲) (阴暗地蠕动) (翻滚) (激烈地爬动) (扭曲)(痉挛) (嘶吼) (蠕动) (阴森的低吼)(爬行)(分裂)(走上岸)(扭动)(痉挛) (蠕动) (扭曲的行走)(分泌黏液)(滚动爬行前进)(冲刺)（细胞增殖）（变身）（发射黑魔法）（麝惊）
1676385148,0,1,False,False,我单方面宣布这个情人节我和守夜人一起过[脱单doge]
1676373615,0,1,False,False,@霖柒1米8 新监管！新老婆！这个配音！这个身材！我的心巴！[喜欢][脱单doge]
1676381092,0,2,False,False,"守夜人技能
外在特质-明灯：
游戏开始时会在每一台密码机旁生成一盏明灯，求生者可以取出灯芯暂时熄灭明灯。这样做会对该求生者叠加一层黑暗状态，持有灯芯时，求生者每25秒会叠加一层黑暗状态，求生者可以继续熄灭其他明灯，但每一次熄灭明灯时会叠加一层黑暗状态。当求生者持有灯芯时可以看到离自己32米外最近的明灯，求生者可以在此处归还灯芯，归还灯芯后求生者减少3层黑暗状态。
外在特质-黑暗领域：
在黑暗领域中，守夜人将不在拥有恐惧范围和红光并将小幅提升移动速度，但在32米范围内则会间歇性可见。
外在特质-黑暗风暴：
当求生者破译密码机至90%时，会不断触发困难且快速的校准，如果求生者校准失败或停止破译密码机时，该密码机会被封锁20秒。
外在特质-黑暗召唤：解锁破坏未密码机的能力，破坏过的密码机将以求生者正常破译速度的200%回退，求生者破译被破坏过的密码机时该效果消失，效果消失后可再次破坏触发。求生者在被破坏过的密码机上完成校准时会给你一个提示。
外在特质-黑暗之潮：
当求生者被救下狂欢之椅时，你可以透视所有求生者7秒。
零阶技能-领域转换：
守夜人必须离开黑暗领域才能攻击求生者，长按技能键即可离开黑暗领域，再次长按技能键则进入黑暗领域。离开后的短时间内，守夜人仍然会在求生者者32米范围内间歇性可见。随后，如果他仍然保持离开黑暗领域，则会在32米范围内对求生者完全可见。现身和进入黑暗领域需要长按技能键1.5秒，且守夜人的移动速度会略微降低。
零阶技能-明灯传送：
守夜人可以在处于黑暗领域时将自身传送至自己指定明灯上并离开黑暗领域，守夜人完成传送后会获得2秒的50%移动速度加成并使明灯熄灭一段时间，明灯熄灭后守夜人无法进行传送。
零阶技能-黑暗入侵：
如果守夜人传送的明灯16米范围内存在求生者，则会为明灯范围内的求生者叠加一层黑暗状态，黑暗状态最多叠加七层，每叠加一层黑暗状态时，求生者的所有交互行为的交互速度减少5%。
一阶技能-万古长明:
如果守夜人在传送明灯后的10秒内击中求生者，则随机点亮3盏已经熄灭的明灯。
二阶技能-黑暗吞噬：
当求生者的黑暗层数叠加到3/5/7层时，会触发负面效果，并且负面效果可以叠加。3层时会使求生者的移动速度降低10%，5层时会使该求生者受到守夜人攻击时直接倒地，7层时如果该求生者倒地，守夜人可以原地淘汰该求生者。"
1676372818,0,1,False,False,这次的英配太棒了[tv_色][tv_色]
1676379225,0,1,False,False,帅吧——古神，勘探，击球，囚徒，飞轮，修机速度（）
1676390939,0,1,False,False,三连换守夜人金[保佑][保佑][保佑]
1676431320,1,1,False,False,"来自coc kp的直觉：
一：养母的装束（斗篷提灯）来看估计母亲的职业就是*守夜人*，形容母亲的那两句话，和追猎母亲的教廷，养母可能确实是信徒（伊塔库亚是行走的死亡/白雪与沉默之神，谁会在夜里独行在冷原上？是否是信仰伊塔库亚的密教成员？）
二：伊塔库亚会和人类的女性结合诞下子嗣，他们表面与人类无异，但可以展现类似伊塔库亚本体的形态。没有提到双生子的父亲，也没提及为何兄弟在教廷追猎队伍中领头。另一种可能性是，追猎养母的是信仰伊塔库亚的密教，而双生子的另一位正是以神子的身份身居高位。
三：抛弃的原因有可能是有关双子的诅咒（例如必将弑亲一类）。提及的*暴风雪*和*冷原*，有指代双子（和守夜人方与教廷方）的意味。伊塔库亚的化身有*一团有意识的、闪动着两点红光的暴风雪*这样的存在，如果二人是风行者子嗣，是否暴风雪和冷原指代的是不同的化身，或者分属密教中不同的派系？如此的话，养母遭受追猎或许是某种教会内部异端审判的性质。
猜测：吞噬人性的神明是否是伊塔库亚本尊？是否祂通过这个过程进行了某种污染或神降，从而导致了守夜人的形态（瘦骨嶙峋、身披褴褛，双眼是两团猩红色的亮光）？"
1676392842,0,1,False,False,不用说了，老婆，晋升为宸妃。我四妃全满了，但是我是皇帝所以多加一个份位[脱单doge]
1676383058,0,1,False,False,不放cv 不是也挺好吗 既然没有特别标注的话 那不是更方便玩家代入了？万一cv你不喜欢 或者后续出事了呢 少把cv和角色关联 单推人可以安心推角色 推cv的继续推cv。互不干扰[脱单doge][打call]
1676374476,0,1,False,False,有人认领了，不是（）的cv，安心了，至少弹幕不会被殖民了🙏
1676372114,0,1,False,False,@沫雪poem  新监管(◐‿◑)﻿
1676385023,0,1,False,False,[脱单doge]哈斯塔：凭什么你小子有PV
1676382325,0,1,False,False,爱上小男孩是我的宿命[害羞]
1676367831,0,1,False,False,希望能上联合！
1676379022,0,1,False,False,这真的是好大的惊喜[大哭]
1676377823,0,1,False,False,各位配音是 安志老师   击球同cv  微博是-安志-
1676475794,0,1,False,False,如何理解守夜人的技能：军团
1676374809,0,1,False,False,哥哥像约瑟夫，姿势像皮塔，你取代了你的哥哥？你是！第五人格的皮塔？[doge]
1676374492,0,1,False,False,三连换守夜人限定金！！！
1676372877,0,1,False,False,中也归宿双形态赶紧的！！！
1676368774,0,1,False,False,我上一次出金皮是在第十赛季，求你了，网易再给我一次机会吧！我只想带守夜人回家啊！
1676395973,0,1,False,False,无所谓，秘密会被埋葬（幻视）
1676375594,1,1,False,False,老婆！！！！！别管我！！！！我不要苦茶子了！
1676372332,0,1,False,False,有没有一种可能守夜人设计成这样是为了迎合接下来的杀戮天使的联动[脱单doge][脱单doge][脱单doge]
1676375819,0,1,False,False,草最后一幕怎么有点像千珏
1676368274,0,1,False,False,@顾南不是顾难 新监管来咯
1676375814,0,1,False,False,看到人外居然出人脸的那一刻，wy给我省钱
1676468186,0,1,False,False,英配那个笑声鸡皮疙瘩都起来了，
1676375093,0,1,False,False,家长还在举办， 小孩都在喊老婆了[脱单doge]
1676380943,0,1,False,False,新的老婆已经出现，怎么能够停止不前！
1676365630,0,2,False,False,呜呜呜又是一个小可怜[委屈][委屈][委屈][委屈]让我抱抱，亲亲！！！！
1676368090,0,1,False,False,但是帅啊，很帅啊[保卫萝卜_哭哭][保卫萝卜_哭哭][保卫萝卜_哭哭]
1676460661,0,1,False,False,00:31幼年皮塔[脱单doge]
1676454467,0,1,False,False,这就是扎克的模了吧(指之后的杀戮天使联动)
1676369161,0,1,False,False,英配好好听[脱单doge]
1676365762,0,1,False,False,速速出守夜求生人格，别逼我求你[大哭][大哭]
1676431827,0,1,False,False,并且两次提到尸体，伊塔库亚真的可以侵占尸体行动，如果他是真的死去…嗯，也许从幼时就有别的精神住进了身体，而他对自己的兄弟重复了这个过程。
1676380947,0,1,False,False,五宝！这辈子没求过什么，给我一只守夜人吧。我好爱他！！！！！！！[大哭]
1676368503,0,1,False,False,好消息！！我！冲！爆！了！！！！
1676380083,0,1,False,False,感觉他叫母亲的时候好温柔啊[大哭][大哭][大哭]
1676386036,0,1,False,False,我超 新老公[给心心]
1676432108,0,1,False,False,出守夜人限定金玩到关服
1676440804,0,1,False,False,求金！啊啊啊啊好喜欢这个监管！！！
1676475424,0,1,False,False,卧槽好帅好可爱好米好喜欢好爱啊啊啊啊啊啊啊啊啊啊啊啊啊啊加推了别管，从此开始学着玩监管
1676436469,1,1,False,False,好可爱，哪里都好可爱。两个形态都可爱。异形就能看出是一个少年了(*°▽°*)八(*°▽°*)♪
1676365381,0,6,False,False,又要结婚了捏[喜欢]
1676478469,0,1,False,False,费…德…提…克……
1676365495,0,3,False,False,我的妈！！！！不戴面具也好帅！！！
1676381242,0,1,False,False,中世纪时红头发的会被指责成女巫，当时欧洲还开展了猎巫运动，他的妈妈可能是被当做女巫抓走了
1676365476,0,3,False,False,没关系，我会添老公[脱单doge]
1676375443,0,1,False,False,"作为一个监管玩家希望强度足够配得上这复仇（）
还有现在他就是我新老公了！（什）"
1676381544,0,1,False,False,突然就想回坑了（
1676370707,0,1,False,False,许愿金光！
1676366150,1,1,False,False,所以说意思就是守夜人可能是某个皇亲国戚的私生子，然后被丢到了野外，一个善良的姐姐把他捡回去的当自己孩子抚养，结果某一天被守夜人素未谋面的兄弟抄家了……妈妈没了，守夜人跑去复仇杀了他的兄弟，然后就一直狩猎在雪原中的人？（勿喷勿喷我互联网胆小鬼
1676380804,0,1,False,False,提前交三连！我想要这个小帅哥的金皮[初音未来_大笑]
1676400852,0,1,False,False,白毛美少年正太[喜欢]还挑在情人节出pv，网易你是懂xp的
1676434589,1,1,False,False,这里明显有个黑影欸，谁知道这是什么
1676384068,0,1,False,False,帅的，帅的，尤其是监管者的外形。有一种又可爱又野性又危险的美[洛天依]
1676398480,1,1,False,False,抢先版音效有狗面的叹息声[doge]
1676365941,0,2,False,False,我是起夜人
1676380794,0,1,False,False,好帅[喜欢]
1676370344,0,1,False,False,声音好听，脸好看，监管形态又酷，帅哥，我喜欢上了[脱单doge]
1676379124,0,1,False,False,我去，28秒看到一个弹幕说“我来让他饱胀的感受炙热[脱单doge][脱单doge][脱单doge][脱单doge]”
1676382767,0,1,False,False,已三连，3年了，看着办吧，没出过金[星星眼]
1676388734,0,1,False,False,中配好好听啊音色感觉很合适哎
1676430144,1,1,False,False,新的老公已经出现，我越看他越顺眼，穿越时空，亲他两口，他就来到我身边[脱单doge][脱单doge][脱单doge]
1676378800,0,1,False,False,若黯夜终临，吾必立于万万人前，横刀向渊，血染天穹！
1676380296,0,1,False,False,感觉新角色的故事没啥记忆点啊，不是很出彩[思考]
1676385828,0,1,False,False,已经在攒碎片准备抽伴生金了，强度是可以练，但是好像多少有点难度（不确定）
1676370596,0,1,False,False,听到这个笑声我已经想到如果他联动的扎克[doge]
1676366849,0,1,False,False,嫁给我嫁给我嫁给我，第五好多角色我都觉得很漂亮很独特很有创意，这个是真的长在我的xp上[保卫萝卜_哭哭][保卫萝卜_哭哭][保卫萝卜_哭哭]
1676387640,0,1,False,False,身世悲残的白毛少年，谁的xp动了我不说
1676376618,0,1,False,False,呜呜呜，我劝你们先把网络给优化了，上个赛季有点卡就算了，这个赛季更新后卡死我了，明明是绿色的网，卡的我破防了呜呜呜[大哭][大哭]
1676383474,0,1,False,False,我已经差不多摸清第五人格角色背景的套路了:一种是把某个倒霉的亲密人物给弄了，另一种是倒霉地被某个亲密人物给弄了[doge][doge][doge]
1676371589,0,1,False,False,四年了，出个角色的限定金不过分吧？出了来还愿，没出来还怨，看你的了[脱单doge]
1676382932,0,1,False,False,@柴郡猫想当勇士 卧槽这个帅！
1676404550,0,1,False,False,文豪还有第三弹吗？
1676367324,0,1,False,False,五宝，我想知道配音演员是谁太好听了[脸红]
1676366877,0,1,False,False,天啊……好可爱的小甜心……你会用死亡的温床温暖我冰冷的生命吗？你会在雪原上追逐着我的炙热的鲜血吗？你会叫我mommy吗？[星星眼][星星眼]
1676368497,0,2,False,False,处罚⬇️最近的外挂，并且公示，谢谢听说这次挺严重的好像国外服都出现，而且特殊玩家也有开挂行为。[疑惑]
1676384812,0,1,False,False,守夜人杀戮的天使，的扎克，我总感觉会100%联动他
1676375702,1,1,False,False,帅哥，超了[喜欢][喜欢][喜欢]
1676370464,0,1,False,False,一想到面具后面是白毛帅哥，斯哈～斯哈[奥比岛_喜欢]
1676371372,0,1,False,False,应该就是双重人格吧，这样比较带感[星星眼][星星眼][星星眼]卖外敷
1676366709,0,1,False,False,哇哦，我一个求生玩家都想试试这个新监管了，感觉好帅气
1676369079,0,1,False,False,用我朋友每个人十秒的寿命来换限定金!
1676373754,1,1,False,False,我草？？？双重人格。？？？双胞胎？？？？？
1676384778,2,1,False,False,卧槽 退游俩三年了 看见新角色直接爆炸踏马好涩[喜欢][喜欢][喜欢]直接回游
1676369460,0,1,False,False,wy是不是和双胞胎有仇啊[思考]
1676465392,0,1,False,False,三连换守夜人金皮555[打call]
1676370483,0,1,False,False,网易赶紧出动画吧我说一百次了
1676385084,0,1,False,False,三连换伊塔库亚限定金！！！！！
1676367530,0,1,False,False,好帅好帅[大哭]超了超了（
1676371725,0,1,False,False,😍😍😍好涩，我要冲牌子
1676371703,0,1,False,False,给一次修改实名机会，隔壁厂能你不会不行吧[東雪蓮_头大]
1676370418,0,1,False,False,这就是日配吗，涨知识了[妙啊]
1676457865,0,1,False,False,帅哥我喜欢[doge]网易真懂我[脱单doge]
1676380101,0,1,False,False,刚开始，老婆！后面……老公！不确定，再看看，再想想……老婆！[doge]
1676369714,0,1,False,False,你小子最好别像中指哥一样外表配不上强度[呲牙]
1676382550,0,1,False,False,血是紫色的
1676365401,2,2,False,False,"无所谓，我古董商会出击。
无所谓，我咒术师会出击。"
1676368918,0,1,False,False,小破游出息了，知道英文字幕要用英配[脱单doge]
1676365448,0,2,False,False,我老公[doge][喜欢]
1676389829,0,1,False,False,听英配！！都给我听英配！！！都给我从头听到尾！！！！！！！
1676385125,0,1,False,False,@愛吃烤魚的熊 有點喜歡，不會是第五個監草吧，我不能玩遊戲啊😭😭😭
1676430476,0,1,False,False,还是抵不过前锋的球，撞断守夜人的腰[大哭]
1676377688,0,1,False,False,优化杰克紫挂鬼脸披肩，杰克玩家帮我顶一下
1676472048,0,1,False,False,说实话，我挺希望官方出一个女巫版的求生者，除了机械师
1676375167,0,1,False,False,"为什么鱼儿不会说话
尸体不会说话"
1676467748,0,1,False,False,@暴龙战士澈酱 ???我错过了什么？？？
1676391524,0,1,False,False,老婆!!!网易给我出金，不要不识好歹[妙啊][脱单doge]
1676368775,0,1,False,False,新的老婆已经出现😋😋
1676366859,0,1,False,False,这个笑声联动没跑了
1676470147,0,1,False,False,网易你就说这金光概率高不高吧【华强音】
1676380570,0,1,False,False,啊啊啊三连求限定金[崩坏3_脱非]
1676378950,0,1,False,False,呜呼，裤子飞飞
1676367870,0,1,False,False,没关系，非酋会被永远埋葬[微笑][微笑][保卫萝卜_哭哭]
1676385263,0,1,False,False,初见，结婚[脱单doge][脱单doge][脱单doge]
1676383966,0,1,False,False,你日语配音呢！！！
1676368126,0,1,False,False,没有日语韩语，都是英配加字幕
1676383595,1,1,False,False,@羽名氏 @黑麦面包_ 啊啊啊啊凭什么这么帅，这么疯
1676390913,0,1,False,False,为啥日文字幕和韩文字幕是英语配音，不直接用中文？（单纯好奇
1676392933,0,1,False,False,没有人发现日语配音也是英文吗
