上传时间,回复数,点赞数,up是否回复,up是否点赞,评论文本
1676476565,2,4,False,False,就这么一眼，我就确定了你是我唯一的妻子，不是妾，不是最重要的人，是我唯一最爱的妻子[脱单doge][脱单doge][脱单doge][脱单doge][脱单doge][星星眼][星星眼][星星眼][星星眼][星星眼]
1676435177,0,3,False,False,你能不能修修你的PC端！！！！！！！！！
1676365848,2,26,False,False,兄弟关系加一，母子关系加一，夫妻关系加一，我们的婚礼诚请大家参加[喜欢]
1676448880,0,3,False,False,求生者：新的玩具！[奸笑][奸笑]
1676381067,0,12,False,False,感谢wy情人节送来的新老婆[喜欢]
1676459505,0,3,False,False,五宝还是那么会做疯批诱捕器[脱单doge]
1676367262,0,26,False,False,omg哥哥你，再复杂也让我想练的程度…………
1676456401,2,5,False,False,新监管是不是小孩子啊，看着像小孩子耶，但是怎么这么高[保卫萝卜_哭哭]爱哭鬼很矮但他怎么看着比杰克都高，变异了吗
1676457116,2,5,False,False,"打扰啦！在官方新视频下面发一个招募～
排位或匹配搭子语音车队招人啦～～～～
q群群号481781241。欢迎大家来玩～
群内人约3-5阶，大部分是大学生，时间不固定，因为学业问题不太能全勤，一般出没时间为晚上。
奉行佛系不急眼快乐主义，目的是在能力范围内尽量上分！
欢迎对上分有想法，且心平气和善于交流的朋友们来加入！！"
1676377620,3,14,False,False,既然都是在夜间出没，那就设计一个阴天天气吧，真的很想有场景内的天气变换
1676425484,1,6,False,False,养母！养母！养母！好喜欢养母！我老婆了！
1676391569,1,7,False,False,会不会是两种人格，那个借着神旨意的红衣是贪婪的有欲望的人格，另一个黑衣的是没有感情的人格，他把红衣人格抹杀了，成了没有感情的怪物
1676386486,7,6,False,False,"[脱单doge][脱单doge][脱单doge][脱单doge][脱单doge][脱单doge]
【新监管者-守夜人】技能爆料【外在特质】如影随形当求生者受伤、倒地时会原地生成黑雾，伊塔库亚可以驱使黑雾中的生物对求生者造成上升恐惧值一半的伤害。 【特殊】黑雾会降低附近求生者15%的破译密码机和大门密码速度、10%的治疗速度和倒地自愈速度、以及10%的板窗交互速度；在有求生者入座的狂欢之椅附近，黑雾消弥时间为20秒，生成新的黑雾会使减少已生成的黑雾的2秒消弥时间。【外在特质】噩梦求生者在伊塔库亚的恐惧半径范围内时会为伊塔库亚的黑雾持续充能，充能完毕可获得黑雾的召唤次教。
最多可叠加5次。【实体能力】深渊侵袭（冷却时间：5秒）伊塔库亚可支配附近黑雾中的生物行动，长按技能按键选取视线中心的黑雾向其最近的求生者侵袭。【实体能力】不明深渊伊塔库亚可吸收求生者的恐惧为黑雾充能，召唤黑雾生物降临，长按移动到选定位置后释放黑雾。一阶【实体能力】深渊凝结（充能时间：40秒 充能数：0/5）随着存在感的增加，除吸收求生者的恐惧外，伊塔库亚的黑雾召唤会随时间获得
额外的充能，最多叠加5次。二阶【实体能力】深渊降临（冷却时间：5秒）伊塔库亚可选中并凝视一名求生者，被伊塔库亚凝视的求生者在20秒内经过黑雾时，伊塔库亚可多次点击技能按键，操纵该求生者附近的黑雾侵袭。
[脱单doge][脱单doge][脱单doge][脱单doge]"
1676380959,0,8,False,False,谢谢网易情人节送老婆[脱单doge]
1676365975,2,9,False,False,"伊塔库亚(Ithaqua)是克苏鲁神话中的旧日支配者之一，由奥古斯特·威廉·德雷斯所创造。最早出现在德雷斯的短篇小说《伊塔库亚》中。伊塔库亚又被称为“温迪戈(Wendigo)”，其原型是阿尔杰农·布莱克伍德的作品中的雪怪“温迪戈”，它的灵感来源于北美土著居民关于温迪戈的传说，或者说是传说中的雪人。
介绍
“头顶的星空被乌云遮盖......这朵巨云有着人形的轮廓......尽管乌云密布，在它的顶层，那人形的头部，闪耀着两颗明光烁亮的星，如同两支巨眼。”
——奥古斯特·威廉·德雷斯《乘风行走之物》
伊塔库亚是旧日支配者之一，形象为黑暗巨大的人形或者兽形轮廓，只露出一双鲜红闪亮的眼睛。伊塔库亚出现于北极到亚北极地区，最先由北美土著居民发现。据称它潜伏在北极地区的废墟中，残酷地猎杀过往的旅行者。在布莱恩·拉姆利的“提图斯·克劳(Titus Crow)”系列的作品中，伊塔库亚是冰雪世界波利亚(Borea)的统治者，它周期性的游荡在波利亚的土地及天空中，将捕获的受害者带回自己的领地。
德雷斯将所谓“元素”系统引入到克苏鲁神话之中。他将旧日支配者们依其象征的自然元素分成四个阵营：水、火、风、地。为了填补这一系统中的空白，德雷斯甚至专门创造了克图格亚(Cthugha)（象征火）和伊塔库亚(Ithaqua)（象征风）两个旧日支配者的形象。
在德雷斯的设定中，伊塔库亚是象征风的存在之一。信仰伊塔库亚的人很少，但是生活在极北地区的人们畏惧它，西伯利亚和阿拉斯加的居民祭祀它，多不是处于崇拜，而是处于安抚的目的。
伊塔库亚拥有“风行者”、“行走的死亡”、“伟大的白色沉默之神”、“不得见于图腾之神”等众多名称。它是吹拂于星际宇宙的风动，从属于黄衣之王“哈斯塔”的大气之神。

外形
在伊塔库亚的数个外形中，最典型的莫过于一个趾间生蹼、长着火红双眼、瘦骨嶙峋的巨大人形。它的面庞扭曲可怖，如同一张被拉扯变形、充满痛苦的人脸；它也常于狂风中闪现，枯槁的长发将随着身躯如鬼魂般在风中摇曳。
伊塔库亚另一个常见的外表是一个生着巨大犄角，布满毛发的人形，双爪如刀般锋利，口中长着凶恶的獠牙，双眼也闪着火亮的光泽。 它会从口中呼出大团云雾，而雪花则会奇异地环绕在它身旁；这一化身很有可能是史前人类所信仰、长角的自然之神的原形。"
1676374006,0,13,False,False,痛失兄弟姐妹四人组➕1（虽然这个不是痛失（？
1676465481,0,4,False,False,三连换伊塔库亚限定金！[脱单doge]
1676433502,1,4,False,False,看三视图还没很大感觉，因为面具有点像外星人，猫耳朵很可爱。但是当看到他面具下的容颜，不行我要被帅鼠了啊啊啊，白毛，是白毛啊[喜欢]，白毛蓝眸，还有刘海我太爱了[点赞]。希望他的强度也不错，就可以去练一手。许愿限定金[奥比岛_击爪][原神_哇]
1676371568,4,16,False,False,宝宝七:喔～天呐～我觉得这太可怕了[doge]
1676388109,2,3,False,False,庄园高危职业：老师、兄弟姐妹🐒
1676434228,1,3,False,False,用这个金换我老婆芥川龙之介[脱单doge]
1676373708,0,5,False,False,我觉得他妈是不是因为守夜人和折磨自己神官长的一样导致看见养子的脸就应激发疯[思考]
1676435084,0,5,False,False,"埃米尔：我不做人啦！
我才是真正的监管[阴险]
其实我的真实身份是守夜人
你们都错了[阴险]
所以我故意装疯就是为了博取艾达的信任
好让我获得能力[阴险]"
1676365577,5,23,False,False,看这个pv守夜人貌似还活着，算是为数不多存活的监管吗[tv_目瞪口呆]
1676370081,4,4,False,False,明明都是戴面具，为什么杰克感觉好呆[思考]
1676367438,2,48,False,False,所以cv到底是谁，亲爱的冈易，下次标一下cv吧[保卫萝卜_哭哭]
1676369698,2,14,False,False,你狂任你狂，古神三棍降。古门[来古-沉思]
1676384959,0,4,False,False,好好看…好好看，其实本来想过完文豪就要淡游的…你早说出个新监管我不就不氪那么多给联动了[保卫萝卜_哭哭][保卫萝卜_哭哭][保卫萝卜_哭哭]
1676367911,39,49,False,False,谁知道cv是谁啊 这声音好好听我好喜欢[原神_哇]
1676369355,1,7,False,False,玩了四年你别不知好歹监管一个限定金都没有五宝你最好给我出一个
1676469253,0,5,False,False,会出限定金吗？是这个赛季精华二吗？[脱单doge]
1676387945,1,4,False,False,大致是讲，守夜人是双胞胎，但他是被遗弃的那个，被养母救了后长成小帅哥。后来一伙打着神明旗号的人来他家想杀他养母祭祀（？），其中为首的那个正是守夜人的双胞胎兄弟。守夜人杀了为首的人并取而代之，但他养母被折磨疯了，守夜人于是开始复仇
1676375811,3,3,False,False,wy，给我他的限定金，不然我写你和mhy的本子！
1676367984,12,11,False,False,守夜人！！！！！我爱你！！！！！！！！我是你的狗！！！！！！！！快带我走！！！！！！！！！！
1676436473,5,5,False,False,叫你优化网络，没本事 ，叫你做好平衡，没本事。公屏那么多打广告的，不直接永封是吧？别人骂那么多脏话才禁俩小时？厕化还会干什么？哦，除了出皮肤圈钱是吧？还有人心疼网易亏多少钱，笑死我了，用得着你心疼？爱奇艺也说自己亏，你怎么不去充钱
1676367276,0,7,False,False,"情人节出的，好，意思是他是第五给我的情人对吧
那提前谢谢网易了，我知道你会让我一发金皮的[妙啊]"
1676368305,4,7,False,False,是人啊，我的旧日支配者呢？啊？[大哭]
1676376346,1,3,False,False,谈谈人设，因为唯一爱自己的人被杀了开始杀别人，符合扎克了，大概率巡夜人，中概率杰克，无概率柏西
1676377053,3,5,False,False,感觉他很强诶，祝大家抽到伴生金
1676368902,2,6,False,False,多的不说，预测一下，追击增益控场集一体的双刀监官[脱单doge]准了来刀我
1676365568,2,24,False,False,没关系，都会被古神暴打
1676372182,0,7,False,False,宝宝，像你这种帅哥来庄园就是要被我淦的[脱单doge]
1676383402,0,7,False,False,"新监管好帅
我以为他脚上绑的是刀片呢，原来是木片吗？"
1676379341,0,6,False,False,好帅[大哭]不出的话我真的会痛哭的[大哭]
1676373780,0,8,False,False,我拷我拷这个声线这个颜值 守夜太飒了吧我趣 期待一波技能 如果看得懂就入了 [喜欢]
1676377089,0,6,False,False,若黯夜终临 吾必立于万万人前 横刀向渊 血染天穹
1676387151,2,5,False,False,好奇声优是谁好好听！！！[2233塔罗牌_AWSL]
1676373546,2,7,False,False,英日韩的配音都好赞！各有各的特点！爱了[星星眼][星星眼]
1676441515,0,3,False,False,省流：渔女开端，守墓人承接，调香师转折，蜡像师结束（。）
1676388340,0,6,False,False,很不错 如果玩的顺手就打算练他了
1676366407,5,8,False,False,从pv中“披着神明的皮囊”以及披着的红色披风，手上拿着书本的形象来看，另一个人应该是教会的人，旁边有人指着母亲，他的告发导致母亲被抓走迫害（个人猜测）
1676374760,1,8,False,False,三连求金！！！《关于一个已经看淡的18年玩家的诉求》[保卫萝卜_哭哭]
1676370569,2,6,False,False,？？这新的监管者是男的？！我还以为是女的
1676371456,0,5,False,False,希望第五以后都不标画师和cv的名字，真的很烦有人把游戏角色本身和这些外人绑定，然后乱玩梗[tv_白眼]
1676373319,0,7,False,False,亲爱的老婆情人节我们务必一起过[喜欢][喜欢]
1676467821,0,3,False,False,英配太对味了[花花雪精灵_被击中]
1676381683,0,4,False,False,我就知道小男孩是会和我心心相吸的 看到海报的那一刻我就知道你是我命中注定的外敷[脱单doge][脱单doge]感谢冈易在情人节这天发我老婆的背景
1676412873,2,3,False,False,出必练，先来许愿，这角色在我xp上崩
1676434188,0,5,False,False,求求了，我好几个精华两百多发才出的金皮，看在我前不久才给文豪野犬氪了快两千，守夜人金皮就让我五十以内出吧[tv_难过][tv_难过][tv_难过]
1676460543,2,3,False,False,欢迎来到第五人格[脱单doge]守夜人
1676437380,1,4,False,False,如果“我”未曾见过光亮，如果你未曾救“我”，那么“我们”都不会活着。
1676476436,0,2,False,False,zack绝对是守夜人[OK]
1676395437,0,3,False,False,呃啊啊啊xp全中 网易你是懂我的[酸了]
1676391062,0,3,False,False,双胞胎一个作监管，一个作求生，珍宝卖爆[doge]
1676372888,1,4,False,False,像求生者的pv…[doge][doge][doge][doge]
1676383837,1,5,False,False,妈妈怎么疯了啊[大哭][大哭]我需要同人太太给我一个美丽的童话故事呜呜呜[tv_大哭][tv_大哭]
1676367891,8,8,False,False,据我所知，五宝一般上线角色都会砍一刀，隐士和古董商都是个例[doge][doge]
1676461218,0,3,False,False,那个鞋子，不对，靴子，反正就是脚踩的那个，建模师应该不会把那个建崩吧[吃瓜]
1676372210,1,7,False,False,长在XP上了[跪了][跪了]中医告诉我要适量[难过]
1676385355,0,3,False,False,"是你吗，孤独的守夜人?
若暗夜终临，我必立于万万人前，血染天穹[doge][doge][doge]"
1676365441,0,55,False,False,来了来了，声音好好听啊啊啊，是帅哥的感觉！期待露脸皮肤[doge]
1676367973,2,7,False,False,好喜欢他！上一个还是隐士，再上一个还是画家，再上上一个还是..！yi好多！
1676368250,0,6,False,False,我超我怎么感觉守夜人长得很像ddd的二次设（
1676433210,0,3,False,False,出限定金我只玩网易第五人格，啊啊啊新老婆亲亲
1676365555,1,22,False,False,空耳听成了“暴风雪杀死冷月的那个晚上”（）
1676379487,0,3,False,False,呜呼，视汝之貌，甚美，然阙一犬，吾有资乎？[脱单doge][脱单doge]
1676388577,1,8,False,False,三连，献祭猎龙者换老婆限定金[脱单doge]
1676365541,3,24,False,False,我的妻子让大家见笑了[doge]（好吧其实更想当他的妈咪（？
1676393892,0,3,False,False,妈妈应该没死吧，但其实疯了的话活着更加煎熬[雫るる制服ver._哭]气死了气死了那么温柔的美女姐姐啊
1676372896,0,5,False,False,我觉得可以和三面神的那个连起来看 [doge]
1676369751,0,4,False,False,网易，限定金把面具摘了，你懂的，恐怖元素多一点确实很好，但是我不想让一个帅哥的帅脸被埋没[脱单doge]
1676366457,1,10,False,False,好像是从小教会家的双胞胎被扔掉了一个，被养母捡到了扶养，然后有一天双胞胎的另一个跟着教会打进来了（是不是猎巫？具体我也不懂）把，养母被带走了，然后守夜人去复仇，结果养母疯了？
1676381750,0,3,False,False,呃啊 一下戳中了我的心巴[暹罗猫小豆泥 · 遇见泥_爱了爱了]
1676367173,0,4,False,False,剧情：男版调香师＋渔女（不是）
1676367835,0,8,False,False,这个声音一出来，我脑海中仿佛想起“注意看，这个男人……”
1676365372,41,46,False,False,cv是谁啊，好好奇
1676391751,0,4,False,False,啊不就是妈妈疯了后红色的头发犹如火焰，在他的眼中燃起了复仇的火焰？
1676380209,0,3,False,False,三连，换这个监管者的金皮[脱单doge]
1676383087,0,2,False,False,技能出了之后希望是个有脑强的屠夫，既不像记录员那样，也不像噩梦那样，强度跟红蝶差不多就更满意了
1676379792,1,5,False,False,啊啊啊啊啊啊啊啊啊我是死了伊塔库亚踩着你的小高跟踩我！！！！色爆了啊啊啊啊啊啊啊啊啊啊
1676366837,6,5,False,False,能不能出些像开膛手一样的怪谈类屠夫？像裂口女，八尺大人这些
1676381254,0,5,False,False,刚开始我以为是《我在精神病院里学斩神》里面的守夜人呢，不管怎么说，我是个双厨，哈哈哈哈哈哈哈[妙啊][妙啊][妙啊]
1676472225,0,3,False,False,第一眼看成兔妈，第二眼看成空洞骑士，第三眼看成老………[脱单doge]
1676371465,0,2,False,False,我滴妈，就这个颜！技能设计成啥样，我高低都要拿个牌子
1676467959,0,2,False,False,把开头的女巫看成了使徒
1676385800,0,2,False,False,新监管，好帅好帅。官方在情人节发一定早有预谋。[脱单doge]
1676365836,4,10,False,False,人类玩家有点心动，这就开始练屠夫[星星眼]
1676384902,0,2,False,False,老婆，老婆啊[大哭][大哭][大哭]我的，啊，世界需要大耳朵男孩子，需要白毛帅哥，我是超人强，我冲冲冲冲冲冲[大哭][给心心][大哭][给心心][给心心][大哭]宝贝啊我的小可爱钱都是你的都是你冈易的好好做好好做强度，你知道你游屠夫什么样吧，为了他我愿意回去打屠夫求你好好建模好好做强度，我求你了冈易[大哭][大哭][大哭][大哭][大哭]
1676435458,0,3,False,False,病娇白毛小美人，爱了爱了[喜欢][喜欢]
1676371425,1,4,False,False,好帅好帅好帅好帅！！！！！！！！斯哈斯哈，这个疯批笑，我直接爱上了，为新老婆献上三连！！！
1676365802,1,7,False,False,我还以为红龙女巫收养了他呢[脱单doge]
1676466431,0,2,False,False,孩子 是这样的 你母亲在你小时候订了我们的婚 请速速放下羞涩跟我去地下室van 我劝你不要不识好歹[脱单doge][脱单doge]
1676371002,2,2,False,False,如果是伊塔库亚的话…就算…就算被抓了也心甘情愿🤤🤤🤤🤤🤤🤤🤤🤤🤤🤤🤤🤤🤤🤤🤤🤤🤤🤤🤤🤤🤤[脱单doge]
1676394076,0,3,False,False,有没有一种可能，能出一个监管者能化身场上任何一个求生者中的一个[脱单doge]
1676389626,0,4,False,False,老婆老婆老婆 好涩斯哈斯哈斯哈[时光代理人周年纪念_期待][时光代理人周年纪念_期待][时光代理人周年纪念_期待]
1676365349,2,65,False,False,没关系，都一样
1676369911,3,8,False,False,是老婆啊[脱单doge][脱单doge][脱单doge]
1676460164,1,2,False,False,这监管者咋纯纯好人[脱单doge]一点坏都不沾
1676372295,0,2,False,False,新的老婆已经出现，怎么能够停滞不前[脱单doge][脱单doge]
1676373752,0,3,False,False,您好，结婚[脱单doge][脱单doge]
1676372716,0,4,False,False,一定要听英配！！！！太好听啦新的老公已经出现[洛天依]
1676374825,0,2,False,False,cv应该确定是配过击球手的安志老师了，老师微博转发了[OK]
1676373335,1,2,False,False,预言一波，一定有求生人格[热词系列_肥肠自信]
1676380220,1,4,False,False,这个新角色的打扮，武器和故事和隔壁兔妈好像阿。
1676377424,0,3,False,False,希望强度够高，这监管的颜我喜欢[脱单doge]
1676365733,0,7,False,False,所以这是为了给养母报仇杀了自己的血亲吗[哦呼]（盲猜一波守夜人当初被抛弃是因为家族内斗不想让他掌权）
1676367260,0,4,False,False,（压低了性感的嗓音）（叼玫瑰花出现）嗨老婆，不知你是否愿意…（被刺到嘴角）（匆匆离开）
1676387698,0,2,False,False,"0阶技能-挖坟
1阶技能-埋人(求生者可以挖出来)
2阶技能-守夜(踩几脚防止挖出来)[doge]"
1676454901,2,3,False,False,怎么一股散兵的味儿[doge]
1676379963,1,2,False,False,所以新屠夫的脸只是带了个面具吗，仍旧是人类啊，我还以为是人外[尴尬]
1676393165,0,3,False,False,《关于我在第五人格率领守夜人斩神这件事》[tv_思考]
1676459890,0,2,False,False,后面那个影子是鹿头吗？
1676465169,0,2,False,False,探过班了，不用猜了，国际服也是紫色的
1676378262,0,2,False,False,众所周知，双胞胎是一个危险的设定[妙啊]
1676367193,1,5,False,False,三连换你一手金不亏吧，答应我好吗[脱单doge]
1676365594,0,4,False,False,帅！！！希望能成为T0统治下一个版本，不要到时候被版本压制到查无此人
1676370717,1,3,False,False,@草莓种植技术 啊啊啊啊啊啊啊最后的这个笑声我直接彻底疯狂
1676369333,1,3,False,False,第五人格，这个寒假给你倾家荡产，你懂我意思吧。
1676391874,0,2,False,False,所以什么时候把地图调亮点？求生和屠夫都难受！白天玩手机根本看不见！
1676391118,0,2,False,False,这么帅，能不能让他强点[大哭]能上比赛就行
1676384684,0,2,False,False,网易，给我守夜人金皮，给你看看我最真挚的眼神[tv_冷漠][tv_冷漠]
1676371623,2,2,False,False,五宝，我想问一下文豪野犬联动有第三弹吗？可以联动一下组合，珍宝菲茨杰拉德可以联动教授，路易莎可以联动盲女，露西可以联动园丁，爱伦坡可以联动小说家，商城金可以弄陀思妥耶夫斯基，联动守墓人或者入验师。想要个答复[保卫萝卜_哭哭]
1676366785,0,3,False,False,所以他和那个神的信徒是双胞胎但是他被扔了？杀了哥哥然后救走守夜人，结果守夜人被神折磨的精神失常失去人性所以选择自己当那个守夜人在雪地开始了报复性的狩猎？
1676367447,1,3,False,False,cv是谁！
1676416140,2,2,False,False,我的天 一晚上三千评论四十万播放量
1676380455,5,4,False,False,下次监管者能给个冰雪元素的吗？(超喜欢冰雪元素的[微笑])
1676424685,0,2,False,False,许愿金皮，希望不强娶[生病]
1676390880,0,5,False,False,许愿守夜人限定金(五年无一抽到限定金)
1676450342,7,2,False,False,最近是不是玩家流失太多，四阶匹配等了四五分钟你觉得合理吗[无语]
1676367454,0,2,False,False,哦哟哟哟[脱单doge][脱单doge]好新鲜的一枚小帅哥呀[脱单doge]这边建议直接打包送货到我家[喜欢][喜欢][喜欢]
1676366266,3,5,False,False,看起来比较像贵族家庭的双胞胎  因为不吉利被丢掉了一个，活在权贵里的那个当着被扔掉的这个面鲨了养母，但养母后来好像也疯了？
1676389034,1,2,False,False,"双胞胎其中一个被丢弃被‘母亲’收养了，长大之后，这个双胞胎‘神明’把养母当做女巫审判，在‘守夜人’面前活活折磨烧死，‘守夜人’就把‘神明’给刀了   /   也可能没被烧死，‘守夜人’带上面具只是为了不让自己那跟‘神明’一模一样的脸给母亲带来刺激

如果死了，那他就可能囚禁了一个陌生女人【毕竟看起来被囚禁着】[哦呼][哦呼]"
1676397585,0,2,False,False,"画师:画点当代年轻人喜欢的:话女硬说男、兜帽面具淡色长发+可爱耳朵
第五:配合角色，请个大众喜欢的cv:安志
我:我很喜欢[阴险]"
1676449809,1,2,False,False,我想他联动扎克，真的好配
1676366633,0,5,False,False,今天情人节，谢谢wy给我送的新老公[脱单doge][脱单doge][脱单doge]
1676385549,0,2,False,False,真的不会为了杀戮天使联动而出的守夜吗[傲娇]
1676387418,0,7,False,False,啊啊啊啊啊啊啊老婆[喜欢][喜欢][喜欢][喜欢][喜欢][喜欢]
1676386474,0,2,False,False,情人节是吧，新的帅哥出现了[脱单doge][脱单doge]声音也好听，金皮是注定抽不到了以后攒好线索一定买[喜欢][喜欢]
1676397820,1,2,False,False,上一个抽到的角色限定金还是黄衣，那么这次能抽到伊塔库亚是很合理的对吧[tv_doge]
1676368051,0,2,False,False,这是什么！噢！小可怜！宝贝！让我亲一口！耳朵！什么猫猫！猫猫生来就是让我摸摸抱抱的！[喜欢][喜欢][喜欢]
1676368131,0,2,False,False,古神：没关系，我会出手😋
1676384150,0,3,False,False,好帅，五宝～宝贝～宝宝～给人家出这个帅哥的金皮嘛～[嘟嘟][嘟嘟][嘟嘟][嘟嘟][嘟嘟]
1676398428,0,2,False,False,"守夜人
可传授技能：昆汀．史密斯- Lv .40
即便在极端的情况下，你也要照看好自己的朋友。你和8米／8米／8米范围内的队友从障目、不治、疲劳、危险、出血、减速和浑然不觉状态中恢复速度增加20%/25%/30%。此效果在离开范围后仍会持续15秒／15秒／15秒。
""我会在这里等你醒来。你一定可以的。""一一昆汀·史密斯"
1676409704,0,2,False,False,居然只是带了个面具吗？猪场还是忘不了他的颜值监管
1676370174,1,4,False,False,你们在哪里看的日配，为什么我的日配是英语[辣眼睛]
1676461061,0,2,False,False,第五幼儿园[doge]新屠夫[脱单doge]
1676372491,0,2,False,False,三连了，伴生金可以给我吗[脱单doge]
1676423561,1,2,False,False,守夜人的记性一直不好，总是忘了我叫什么，所以每次见到我都问我姓娇吗？姓娇吗？🤤🤤🤤🤤第1次做好紧张，我什么时候进去
1676460077,0,2,False,False,网易，不管这次伊塔库亚金皮出成什么样子我都很喜欢，求求五宝这次不要让我吃保底了，我真的很需要他
1676371533,2,2,False,False,为什么，为什么尸体不会吃蛋糕鱼呢？
1676452823,0,2,False,False,这个声音嘶哈嘶哈，老婆！[喜欢][喜欢][喜欢]
1676366048,0,8,False,False,老婆快给我吵吵[喜欢][喜欢][喜欢][喜欢][喜欢]
