上传时间,回复数,点赞数,up是否回复,up是否点赞,评论文本
1676183228,0,21,False,False,汕头人表示支持小姐姐带走，好好照顾[支持]
1676117471,15,78,False,False,"每一次的相遇，都是短暂的停留，
它说：“带我走吧！”可都是善心
只有你，听懂了它的话"
1676177597,0,19,False,False,猫咪身体状况这么差也好意思让人家把猫送回去吗[辣眼睛]
1676117326,0,21,False,False,没编制的猫还是绑架了好
1676175458,1,20,False,False,是这样的，就是说你帮我把猫治好我再要回来，我没告你偷窃景区财物就是大气了，你别不识好歹
1676277855,2,5,False,False,我们学校的猫猫，不仅有同学老师投喂，还专门有动物协会照看，动医专业的老师同学给治病，像猫癣猫鼻支（公费养猫哈哈哈）还治跌打损伤（有一只大胖橘可凶了，老揍其他猫猫[笑哭]），大部分到年纪了就打疫苗和绝育。但即使这样，只要有同学愿意抱回家养，我们纵使万般不舍也会支持的，因为毕竟寒暑假学生就回家了或者忙自己的事，没什么人去照看，搭的猫窝毕竟也是室外的下雨下雪的哪有在家里养着舒服，老是在外边蹭的脏兮兮的不洗澡又舔毛，容易生病。放一张被领走的小橘[奥比岛_委屈]好想他哦，超有猫德的的小猫猫，值得一个安全温暖的家
1676172007,0,24,False,False,你们景点都没人管，光投喂逗猫，要真有那心早就像这姐一样干了
1676175920,2,20,False,False,第一次听说景点猫一身病的，景点这么穷的吗，一只猫养不好？
1676161333,1,22,False,False,强烈推荐苏州西园寺，门票五元，里面的猫猫算是景点猫，有僧人喂，而且僧人也会逗逗猫，里面的猫都很亲人，西园寺里面的素面也很好吃
1676189340,0,10,False,False,把他放景点有人准时喂吗，小猫皮肤病有人给看吗，让它平时抓鸟吃？麻雀都是三有动物呢[吃瓜]那天嘎在街头估计都没人管，还让人还猫，就为了让猫偶尔陪你玩就让小猫再从失去安定的生活是吧[吃瓜]那些说还猫的，希望你在福利院也经历这样的生活
1676129237,0,22,False,False,别说是只景点流浪猫，就是明确有主的养成这样我也不赞成还回去
1676193037,0,15,False,False,拉倒吧 浑身病 大部分只是去打个卡 摸几下新鲜新鲜就完事了 景区要是真的好好喂怎么能皮包骨 有了家的毛孩子比在那强百倍 小姐姐带走了你们又说是景点是地标 别理网友 净说废话 猫能吃饱能安全才是最重要的
1676132769,1,41,False,False,鸡毛的景点猫
1676298842,0,4,False,False,真剑呐，那些人网上敲几个字好像多爱猫一样，结果小猫身上全是问题😆
1676189970,2,20,False,False,没有时间，没有精力，没有耐心的我劝大家还是不要养[OK]
1676123552,0,22,False,False,[笑哭][笑哭]一点都不好笑，这是凄凉中带着温馨
1676160968,0,58,False,False,网红猫浑身是病没人管？有人管了又想要回去？[怪我咯]
1676188103,3,24,False,False,我之前和朋友去旅游的时候就遇到了景点猫，甚至景区还有给这些猫猫做铃铛周边，很可爱，我还买了两个回家，这些猫猫都很圆润，而且看起来也很健康，多数都不怕人，我们几个蹲在那撸猫撸到爽，这才是景点猫吧[吃瓜][吃瓜]
1676188016,2,22,False,False,切，我还以为把动物园的大猫绑回家呢。[吃瓜]
1676280157,0,5,False,False,毕竟养猫不好养，给猫检查看病更是烧钱，唯独敲键盘最好敲
1676181101,5,21,False,False,想问问景点猫定义是啥，无引战，真的不知道，我不是罕见只是常识有点缺乏[给心心]
1676132729,0,27,False,False,《要不要脸？？！！！爱它你们怎么不领养它🐱？！！》[惊讶][惊讶][惊讶][惊讶][惊讶][惊讶][惊讶][惊讶][惊讶][惊讶][惊讶][惊讶][惊讶]
1676176306,1,20,False,False,他们这么多人喂，关心，怎么还这么瘦啊，离谱
1676193039,0,12,False,False,00:15
1676173004,0,22,False,False,人家坐五百公里车只为带个小猫，这些景点的家伙把猫猫饿的皮包骨怎么好意思要[捂脸]
1676180585,0,12,False,False,但凡这猫身上有点肉，也没那一眼就能看出有病的身体，人家小姐姐都不会觉得可怜带回家。就是一只在景区的流浪猫，少扯什么景点猫。
1676200999,0,10,False,False,我是潮汕人 我表示小姐姐很善良 支持她救助流浪猫 给它一个温暖的家[给心心]
1676380249,0,2,False,False,"小姐姐喜提猫猫（ X ）
猫猫喜提小姐姐（ ✓）"
1676174269,0,23,False,False,一身病还这么瘦，小美女带回去养两个月就能成胖乎乎的小可爱，这多好啊。
1676186126,0,13,False,False,可笑的是网红猫却有一身病
1676189011,2,25,False,False,这还不算离谱，看我IP，我前年去浙江嘉兴打暑假工，好家伙，打工的地方里有只猫，我看他顺眼，回去的时候把它绑回了甘肃，现在小猫长得胖胖的，已经变成我妈的心头宝了，明明是我绑回来的猫[大哭]
1676162564,0,25,False,False,一开始以为是人家散养的猫猫，听到有病还行，结果猫猫饿的皮包骨头就很不对劲了。因为有些老人不想正儿八经的养动物、就会喂一只动物，会让它跟自己玩但是不养它（打疫苗做绝育治病什么的），但是这明显就是消费一只猫啊。
1676367856,0,2,False,False,猫：你们这些老6别酸了，我有漂亮姐姐投喂快乐死了，劝你们别多管闲事嗷[doge]
1676263790,0,8,False,False,本地人表示猫猫有人愿意养真好，不过弹幕有些人是不是差不多得了[疑惑]
1676164657,0,21,False,False,这就是流浪猫，给小姐姐带回去有吃有住。我看过植物园的景点猫每只都是胖胖干干净净的，看起来明显不一样
1676170847,1,20,False,False,别送回去，流浪猫注定不幸福，绑了就绑了，我广东人支持你！
1676174961,0,14,False,False,弄好了就想要回去了，老祖宗的智慧
1676134096,3,21,False,False,别养这种景点猫，首先养猫耗钱耗精力，其次养景点猫会被猫的粉丝压力。我的建议是让给我养，我能承受住网友的攻击[doge]
1676128746,0,20,False,False,这些要猫的不就是那些散养户一样不想负责只想用一些猫粮就想得到随时能撸又不想带去看病的 网红猫么
1676182637,0,20,False,False,景点猫，就流浪猫罢了，吃不饱，虽然冻不死，但活不了几年，有人养，能有人治病，能有个家，不应该替猫猫高兴么(´-ω-`)，有人说这就带回家了？早干嘛去了，有本事你养你带回家，以小动物生命用来取悦你。
1676191986,0,13,False,False,恭喜汕头喵喵远嫁福州！小姐姐人美心善[给心心][给心心][给心心]
1676173786,0,16,False,False,怎么好意思说是景点猫？支持小姐姐带回家
1676116847,0,77,False,False,它不是正式编，就给它一个家
1676164124,0,24,False,False,就这猫的这状态流浪猫都比他好，还景点猫没人喂没人照顾一身病，这不就是流浪猫吗？当地人偶尔投喂这个就更离谱了，这猫没病死都算命大[辣眼睛]
1676133367,11,19,False,False,"虽然我只是1/4福州人，但是坚决力挺小姐姐。
咋滴，要猫？把我吃了也没门。"
1676122801,0,20,False,False,视频里面那几条评论，典型的网络热点从众心理[微笑]
1676117217,0,43,False,False,确实，收养了很好啊，这一身病又营养不良，继续流浪的话活不了多久。
1676176534,0,11,False,False,非常支持小姐姐，景点猫个屁，居无定所，一身病还景点猫。可拉到吧，感谢小姐姐人美心善把猫咪绑架走了，祝福小姐姐一生幸福美满
1676165115,0,23,False,False,这猫最大不超过3个月大，还特么经常去看。编的时候能不能找只成年猫？
1676172548,0,25,False,False,要个屁，这猫之前的状态估计也没啥人疼，但是这个妹子可是身体力行吧它带回家并且照顾它了。
1676182268,0,18,False,False,请真心爱猫的朋友们，用绑架代替购买[豹富]
1676295426,0,5,False,False,我们去珠海跨年也遇到一只怀孕的猫咪，同行有四个人，唯独一直在蹭我。回头买了火腿肠喂了也给水，当时纠结好久要不要绑走。最后因为害怕处理不了出生的小猫就没拐走了。
1676266854,0,7,False,False,有人把猫当景点，有人把猫当猫
1676163430,1,24,False,False,一个景点还比不上大学的女生宿舍楼。我学校宿舍楼下五六只流浪猫。个个干干净净，壮壮的。还有救助站，猫生病了可以联系。学生会自发买猫粮或者去打饭时给它们分一点。
1676167138,0,21,False,False,我们单位门口的野猫都跟煤气罐似的，无论你刚来的时候多么苗条貌美如花，一个月后都是肥头大耳肚皮滚圆。
1676196852,2,58,False,False,那里不是有人管理的景区啊，旅行社在汕头小公园里面，就是一个老城区，因为那里都是民国时期的骑楼才变成景点
1676171752,3,20,False,False,[捂脸]我家橘子在去年10月份的时候也被一个好心小姐姐绑走了，因为是散养，就是为了抓老鼠的，结果晚上出去溜达被小姐姐发现，以为是流浪猫就带回去了，还好我们县有几个爱宠群，小姐姐也在群里，就发了照片和消息，我爸看见了就让我赶紧去看看小橘子在不在窝里，发现不在后就联系小姐姐说清楚了是我家的，半天后就送回来了[笑哭]
1676186026,0,19,False,False,流浪猫让它在那流浪也是破坏环境，真被人养了还能多活些日子，对谁都好，就是对那些“嫖客”不太好
1676197381,0,9,False,False,可怜的猫，有人收养都不错了，流浪猫是自由的，想跟谁走都行(ಡωಡ)
1676189948,0,12,False,False,别的地方的景点猫会这么瘦？
1676198635,0,8,False,False,网友充分表述了什么叫叶公好龙
1676263600,0,7,False,False,他们只是需要景点，不是真心爱猫，不要还回去
1676190801,0,14,False,False,照顾不好猫就为了满足人类就留在那？这些人真的好自私
1676196872,0,9,False,False,骨瘦如柴还有皮肤病，这叫景点猫？别搞笑了
1676157092,0,17,False,False,要说景点猫，还得看故宫的猫
1676210932,0,8,False,False,还以为景点猫是招牌那种，就是有吃有喝胖胖的招人喜欢，结果皮包骨，耳螨啥的，耳螨就不说了，流浪猫有虫可以理解，那皮包骨皮藓呢，不就是没人管嘛，没员工餐没员工宿舍的景点猫吗，真有脸说啊[辣眼睛]，我要是那只猫，我都选跟小姐姐回家，不求有多好待遇，但家里至少冬不受寒，日夜不受饥，对流浪猫来说就够了
1676176004,1,17,False,False,"6 
如果正如他们说的那么好，那流浪猫还叫流浪猫吗？不希望把流浪猫说成景点猫"
1676161546,0,19,False,False,要求把猫还回去的人多半也不会去养
1676135460,1,23,False,False,咋地？合同工不让转正是吧？！[翻白眼]
1676165764,0,19,False,False,还找了两天，人家不把猫“绑走”你估计只能找到一具尸体[阴险]
1676269178,0,7,False,False,我TM还以为，他们的景点猫活的很不错呢！好家伙，瘦的皮包骨，皮肤病，居然还喊话让还，[藏狐][藏狐][藏狐][藏狐]
1676182934,0,18,False,False,一只流浪猫而已 非给绑在一起嘛 到时候景点要说领养嘛 没有一个人会去领养，到最后弄着弄着死了，没人稀罕了
1676198678,0,7,False,False,这波哔站和抖音高下立判
1676175030,0,19,False,False,支持小姐姐把猫猫带回家，猫猫哪知道自己是什么景点猫呀猫猫只想有个家
1676168436,1,19,False,False,我们这里有景点单身狗，小姐姐要不要来打卡带走？[妙啊]
1676160782,0,14,False,False,满身病的景点猫？[思考]
1676213002,0,8,False,False,景点猫搁你们那都不爱护，小姐姐带回家照顾它有什么不对
1676208518,0,8,False,False,真是讽刺 这么多人惦记的猫能得病没人治饿的皮包骨 想来也不重视
1676181808,0,12,False,False,这样了还景点？ 到底谁自私啊
1676169288,0,20,False,False,他们就是嘴上说说景点猫也没做出实际行动啊，如果这个猫真的是他们的他们也那么喜欢那为什么还会生病啊还会那么瘦啊
1676183090,1,11,False,False,无主流浪猫 绑架代替购买挺好
1676132780,4,20,False,False,也存在景点猫，人家也是流浪至此，那至少人家景点或者当地人在照顾，不说多精致，窝和食物至少能保证，基本的身体健康能保证（身体脏那没办法，毕竟流浪猫）
1676137824,0,16,False,False,百家饭不如富婆姐姐[脱单doge]
1676216482,0,8,False,False,刚开还以为是有人照顾的，小姐姐绑架回去，没想到是流浪猫，我是支持小姐姐绑架回去的
1676250920,1,6,False,False,有一个小问题为什么这么多人惦记还是个皮包骨
1676185602,0,17,False,False,只是刚好在那里流浪，它不属于景点的
1676130180,0,21,False,False,都成那样了还景点猫，人啊[笑哭]
1676287216,0,4,False,False,人家说在英国还惦记这猫，重点是他在英国，而不是惦记猫[doge]
1676161228,0,20,False,False,开玩笑，这喵身体都不好了，不拿去治疗，早晚不行了
1676266764,0,7,False,False,但凡真的有这么多人惦记这只小猫，小猫也不至于饿成皮包骨还一身病[呆]而且就算从环境来说，收养流浪猫比那些投喂的也要道德太多。
1676116777,0,17,False,False,还以为故宫正式员工被游客带回家了
1676258984,7,6,False,False,那个小姐姐来广州旅游也顺带把我绑了吧！[大哭]我也很好绑的！[大哭]我甚至都不用你动手我直接自己来[doge]
1676127233,0,18,False,False,说是网红猫我以为是景点散养的呢，结果还是流浪猫
1676174043,0,17,False,False,我住汕头，不知道这只猫，过得那么惨的景点猫，猫过得好就行，管不着人家
1676164386,0,14,False,False,"叽叽歪歪的不叫真爱。
真正的爱从来不是哔哔赖赖。"
1676211494,0,8,False,False,这下子如果景点要猫的话我觉得就得，算景点的它虐待动物了，，小姐姐带回来检查猫猫一身毛病说明景点虐待动物。
1676174025,0,19,False,False,人家两个有缘分，你情我愿的，愿意这么远带个病猫回去也是真喜欢它了。
1676182073,0,14,False,False,道德且不违法，没什么好说的[doge]
1676162233,2,16,False,False,汕头人不是挺喜欢这猫的吗，怎么没给猫做好健康检查啊，一身的病，唉
1676197485,0,9,False,False,每个人都爱这只可爱的小猫，但只有小姐姐给了他一个温暖的家
1676132989,1,22,False,False,它属于大家一起喂的半散养猫好吗，这种情况下谁会特地带去做体检啊？有人愿意收编是好事，但怪人家景点喂得不好也是胡扯。
1676138659,0,34,False,False,恭喜流浪小猫咪终于等到了心软的神
1676199907,1,11,False,False,来看看那群类人形蟑螂人用的表情包画风是啥？记录每一种生活，见证每一种初生
1676163761,0,19,False,False,不就是一个在景点的流浪猫吗，看状态也不好啊，小姐姐带回去给他一个好的环境，挺好的
1676199129,0,9,False,False,[保卫萝卜_白眼][保卫萝卜_白眼]景点猫是指有工作人员喂养的猫。只是恰好在景点活动没人管的叫流浪猫[保卫萝卜_白眼][保卫萝卜_白眼]
1676190366,0,12,False,False,猫猫：劝你们不要多管闲事？
1676117790,0,60,False,False,我觉得挺好，至少能吃得饱、睡的暖、没有风吹雨打！还带去看病了！
1676129648,0,18,False,False,绑的好啊，还景点猫是吧？你景点养了还是怎么滴了
1676177032,0,17,False,False,景点里的流浪小猫遇到她心软的神了
1676194130,0,11,False,False,以前楼下平台有对狸花，后来它俩还生了一窝小狸花，邻居搭了个窝，它一家住这，也没谁想着收家里养，猫粮不缺，谁想起来也可以喂点吃的，看它们活的也挺好的，瞎溜达抓东西盯人看，就是这一家弄得骚味有点重，对我来说，也不是所有猫都要成可爱宠物，圈在家里，让它们生活顺其猫生呗。但有的猫啊买来了或者收养了 噶蛋这事我不评价 就说别再不养了让它们无家可归就行[笑哭]。
1676169241,0,17,False,False,根本就没什么景点猫，只不过一只流浪猫刚好跑到景点觅食生活，景点人多，一些游客喂了食拍了照片罢了。拍的照再多，归根究底只是一只无家可归的流浪猫而已
1676177103,0,17,False,False,猫猫看着就没什么精神，幸好收留了，如果碰上虐猫的那就完蛋了
1676136801,1,12,False,False,那种评论基本上都是开玩笑说说。。。博主这波有点带节奏了吧。。 我就是汕头的，本地基本上没觉得什么啊。有人领养都是支持的
1676195070,0,10,False,False,本汕头人表示没听说过，带去了就好好养着吧
1676209275,0,9,False,False,支持收养流浪猫。。这才是真正的爱心。。所谓的投喂流浪猫，投喂景点猫还好，投喂小区的，简直是灾难。。本人亲身经历被投喂群聚而来的流浪猫狗冲击我们楼找饲主。。满楼的拦路虎，满楼的屎尿臭气。。这就是所谓的爱心投喂？就这？喜欢你怎么不带回家？喜欢你只管喂只管逗，不管铲屎？自欺欺人的善良罢了。。所谓的爱心给整栋楼的人找麻烦，真正的自私
1676256173,1,6,False,False,绑的好，总不能因为某些人的虚伪打卡再让猫猫没有家吧。[疑惑]，还要回来的那些人是见不到猫过好日子吗，
1676198745,0,8,False,False,哈？这也能够被称之为景点猫吗？这只猫那么瘦小，不给它吃饭，它像流浪猫一样活着，那它就是流浪猫可以被别人领走
1676128981,0,17,False,False,只要不虐猫 猫在哪谁说不重要 因为有可能一时兴起或是热度才说的 没准过两天他们就有新的景点猫了 不过重要的是 猫有了一个家 这是最好的事 希望那只猫能健健康康的[吃瓜]
1676247418,0,6,False,False,经常喂怕不是一个月也就去三次，我家小区的流浪猫各个肥的流油，这才是被人经常喂[微笑]
1676212310,0,6,False,False,那些汕头人怎么有脸说自己惦记着猫的
1676200118,0,7,False,False,感觉就是，想和猫玩但又不想负责（）
1676203399,0,8,False,False,小姐姐人美心善 祝日子过得越来越好每天都开心幸福 猫猫也是[初音未来_大笑][初音未来_大笑][初音未来_大笑]
1676160816,2,17,False,False,现在资本连猫猫都要剥削吗(╯°Д°)╯︵┴┴
1676172130,0,21,False,False,眼睛都成这样了，说喜欢都不带他去看，我也是服了有些人了。
1676164287,3,15,False,False,呵呵  我们这里的公园猫，也是见人就蹭摸摸，但是人家白白胖胖，干干净净，还有遮风挡雨的窝，每天是真的有很多人喂它照顾它。
1676156241,0,16,False,False,这好意思叫景点猫？！
1676172636,0,20,False,False,什么破景点猫!叫它受害猫还行!满身皮肤病还景点猫网红猫，旅社人脑子进水了吧!这位美女是大好人!要是还回去就是把它又回送去让旅社人虐待[委屈]
1676173997,1,11,False,False,骗赞的 其实这猫还是流浪猫
1676172545,0,12,False,False,带走怎么了？在那里又吃不饱又生病了没人照顾，游客喂一下就走，景点也不管。带走过上幸福生活怎么了？难道它非得受病痛挨饿之苦展览在那吗？
1676170716,0,15,False,False,挺好的啊，猫猫有家了，希望捡到猫的小姐姐可以从一至终[兔年]
1676134932,2,40,False,False,《论人的主观意志和猫猫的实际需要》[doge]
1676167832,1,14,False,False,什么景点猫 就是流浪猫 这些为了自己拍照便利 宁愿让小猫在外面挨饿受冻的人良心不会痛么
1676193462,0,10,False,False,千万不要还，人家说是网红猫还又瘦又生病的，气死我了
1676161521,0,12,False,False,当地人偶尔投喂可还行，怪不得那么瘦
1676121772,0,16,False,False,支持小姐姐，像这种亲人的小猫就该被好心人绑走
1676204910,0,5,False,False,生活在这里的流浪猫，绑定有什么关系？他就是流浪猫啊。
1676212092,0,6,False,False,不可能，这猫这么小只，而且还得了皮肤病等病症，怎么可能是网红景点猫？
1676157074,0,15,False,False,大家都喜欢但是就是没人带回家呢[脱单doge]
1676278543,0,3,False,False,"都一群云养猫的咋咋呼呼
有谁会真关心一只猫"
1676176167,1,12,False,False,这只猫就是流浪猫...啥景点猫饭都不管...
1676215896,0,6,False,False,拍完照就走的人怎么好意思说的？
1676184664,0,13,False,False,生病，瘦骨伶仃，不是景点猫，可以绑
1676180491,0,11,False,False,这叫收养，不是拐卖[抠鼻]
1676198322,1,7,False,False,景点与猫绑定，有的猫绑定后成了员工有了家，有的猫绑定了只是一个流量来源罢了[捂脸]
1676174384,0,15,False,False,支持把这些亲人的流浪猫领养了，猫亲人的对路人和猫都不好（不是所有人都喜欢猫，亲人的猫会有时饿了会跟着路人），领养了对猫对主人对路人都好，皆大欢喜。
1676188705,1,12,False,False,终于有个家  这么多人就玩下不带走
1676203345,0,5,False,False,伪善和真善[doge]
1676177707,0,15,False,False,风餐露宿打黑工跟锦衣玉食入编制都晓得怎么选吧[doge]
1676171444,0,18,False,False,一身病还要说自己多关心，奶奶滴真是不嫌丢人
1676116997,11,74,False,False,想知道那个叫边牧丢了的金毛找到了没有.希望UP给个后续关注啊[星星眼]我现在看见边牧就想去打它.太可恨了
1676140871,0,16,False,False,"本汕头人是第一次听说这个……
现在玩得那么变态了？"
1676173081,0,14,False,False,有些人只会喂，而有的人带它去看病
1676174902,0,18,False,False,别的不说就一身病没人管 咋好意思张嘴要的
1676350963,0,3,False,False,故宫猫、冬宫猫、首席捕鼠大臣叫做景点猫因为它们都是有人专门喂养的，放外面算什么
1676289256,0,3,False,False,把猫咪当成景点来消费却没一个是真正关心猫咪的，不如让小姐姐带回家，起码对猫咪来说这是个好事
1676198199,0,6,False,False,这和我们这边故宫的那几大家子猫性质不一样啊。故宫的猫猫可是有工作的
1676189213,0,6,False,False,说实话要是这只猫被养的好好的也算，原来没人好好照顾，身上一身病，莫名其妙就叫景点猫，你看猫猫原意在那还是跟人家走
1676165857,0,11,False,False,我也支持带走，流浪猫成网红没啥好处，还容易有杀身之祸。
1676190066,0,6,False,False,景点猫也不是不行，景点要公示吧？吃喝拉撒有人管吗？被熊孩子欺负或是抓伤了熊孩子有人认吧？
1676198826,0,7,False,False,真的爱它怎么会不希望它被收养，在这些网友眼里它只是个打卡标志而已
1676169344,0,13,False,False,这太瘦了哪是景点猫啊，我去峨眉山的时候金顶有只巨肥的大橘，大家看日出的时候它还一起看
1676130382,0,14,False,False,你看流浪猫那么可爱，它却没有家。
1676270881,0,5,False,False,“远嫁”这个词并不贴切，远嫁本身就包含了远离亲人，饱含相思之苦，分别至亲之痛，更不知作为外氏嫁到异姓家中是何种境遇。应当用“定居”，恭喜汕头小猫定居福州。从此它不再颠沛流离有了定所，拥有了家的温暖和饱食。
1676142437,1,17,False,False,"我去抖音打探了一下，我刚开始倾向于视频中展现出来的评论是在玩梗，就是b站抖音都很常见的“一本正经胡说八道”那种玩法。
不过去抖音后发现，或许这几个人玩梗比较失当，又或许本身就很有歧义，反正现在热评基本都是骂这些说景点猫的了。
然后看小姐姐最新视频的简介，很多人帮小姐姐怼人，还有私信给她分享自己猫猫故事的。总之小姐姐精神状态完全良好，给小猫起了名字叫圆咪。最新视频里只要小姐姐喊“圆~”，小猫在她怀里有叫必应，仰头的时候小脸看起来就是圆圆的了[星星眼]
p1评论区
p2圆咪的圆脸
p3小姐姐最新视频简介"
1676213119,1,6,False,False,这根本不能叫景点员工猫啊，没人给治病偶尔才有人喂食物（真喂假喂都不知道），故宫那种才是，这个就是一群人故意消遣的吧，他们没人在乎猫过的好不好只觉得有这么一只猫亲自己感觉挺好，看着养眼，实际上猫就是死了也不会有什么感觉只是嘴上说说而已，就好比是古代皇帝有人阿谀奉承皇帝开心赏他点东西那人死了也就死了，一种自身心理上的满足而已
1676161063,0,13,False,False,还景点猫，说的真好听，呸
1676174691,0,15,False,False,景点猫你们都不给他看病？
1676299917,1,3,False,False,那些要猫回去的只是爱自己，不是爱猫猫
1676262737,0,5,False,False,神TM景点猫，喜欢就带回去，光投喂干什么
1676158503,0,9,False,False,[吃瓜]谁先办证归谁
1676183249,3,10,False,False,“每年看它”“皮包骨”，编的你先没个（），想要什么自己填[偷笑]
1676272921,0,4,False,False,景点猫应该是故宫那种吧，有统一管理定点投喂，生病了也有人管，还有自己的领养体系，虽然看似流浪实则是景点内散养
