上传时间,回复数,点赞数,up是否回复,up是否点赞,评论文本
1676166777,0,8,False,False,我是支持领养的
1676148026,0,9,False,False,支持绑架代替领养！[doge]
1676178246,0,15,False,False,支持小姐姐把猫猫带回家，好人有好报
1676167904,2,13,False,False,恭喜小流浪来到有福之州[给心心][给心心]
1676167613,0,15,False,False,我们学校的猫猫至少有小房子住，绝育啥的健康工作也都很齐全，每天都有老师同学带各种猫零食猫罐头投喂[傲娇] 像视频中过得这么惨的小可怜，被好心人领养后肯定比现在要幸福
1676293941,0,3,False,False,就看那皮肤病的状态，那不就是流浪猫么。要是说它是景点猫，那景点也没起到照顾的责任算什么景点猫。纯粹是把猫当景点没当成猫。
1676190072,0,7,False,False,千万别弄回去求求了，什么员工啊，这就是只可怜的流浪猫啊，谁家景点的猫瘦成这样还有病，猫猫好不容易找了个主人还要被带回去继续过饥一顿包一顿的日子是吧
1676175308,0,11,False,False,我学校宿舍楼下的流浪猫都有这个小猫两只大了，还好意思说有人喂
1676298034,0,2,False,False,景点猫？那为什么瘦得皮包骨？为什么浑身皮肤病？为什么还有耳螨？如果有人能用心对待，它为什么会是这样？还远在英国都挂心，也没见你的挂心让它胖一些，让它身上干净些，你们的挂心都挂哪儿去了？
1676195309,0,11,False,False,别吵了，让小猫自己选，小猫说了，不回去！[阴险]
1676122495,0,31,False,False,支持小姐姐！恭喜猫猫喜提户口！
1676180649,0,8,False,False,还是这个女生自己养吧，这猫都成啥了
1676198858,0,4,False,False,这猫就和世界上那些脏乱差的老城区一样，自称喜欢的人，无非就是来拍个照，假惺惺地怀个旧，实际这里人的生活好坏他们根本不关心，未来这里拆迁了，他们还会不疼不痒地声讨两句，认为这里居民过好日子破坏了他们十年都来不了一趟的精神故乡
1676258727,0,4,False,False,这波我站小姐姐
1676183127,1,8,False,False,我住在汕头，支持好心收养。
1676176011,0,13,False,False,这个状态是景区流浪猫，又不是景区散养猫，有真心爱猫的好心人带回家是好事啊
1676290825,0,3,False,False,支持 领养就是最高级的善意！领养流浪猫还他喵地要被人指手画脚？什么世道！支持小姐姐！
1676187276,0,7,False,False,可这猫一身病啊
1676165660,1,15,False,False,一群渣男以为自己很有爱心。我支持把猫带回家喂养。
1676218104,0,8,False,False,我家的猫也是捡回来的流浪，和这个景点猫长得一模一样，头上黑色分叉都一样。逆子很粘我，虽然也经常捣乱，但他已经是我的家人啦。看到这个受着苦难的妮妮，由衷祝福他有家啦。祝你快快病好
1676202556,0,6,False,False,能给猫猫一个归宿固然是好的，潮汕人表示赞同
1676269049,0,4,False,False,人家让你们白嫖了这么久，还不让人找小姐姐了，这还有天理了吗[大哭]
1676259003,0,5,False,False,真的喜欢猫就好好待它，而不是打个卡，它都患有皮肤病和螨，就应该给他治疗，我觉得小姐姐带回去是正确的
1676395179,0,2,False,False,"突然想起一句俗语~~不合适但很贴切~

活着不孝，死了乱叫~[妙啊]"
1676272369,0,3,False,False,让我们恭喜妮妮嫁了个好人家！
1676266150,1,5,False,False,这个小姐姐什么时候来湖南旅游？我也很亲人的~
1676184685,1,11,False,False,封面一看就知道是汕头老市区[doge]我家就在附近
1676178788,3,13,False,False,[doge]只有我一个人想到了这件事背后的流量了么？小姐姐千里绑架“网红猫”，“大家”想必很关心这只猫的后续，小姐姐持续上传这只猫猫的后续，大家点赞评论加关注，于是小姐姐靠猫就能来一大波流量，当然小姐姐这么有爱心，猫猫一定会过的很好，我只希望面对流量的时候小姐姐保持初心，别让小猫猫被迫营业
1676191325,0,9,False,False,不是除了人类以外所有的生命都可以物化
1676250236,0,5,False,False,景点猫应该像故宫那种，有人喂，有人给带去看病，这种顶多是偶尔有人来摸的流浪猫，支持小姐姐领养。
1676142379,1,11,False,False,话说回来福州市这么远，我从深圳到厦门都要3个小时，开车回去得多远
1676184782,0,8,False,False,要回去可以，给猫做的治疗费用之类的给清楚了再还，还景点猫呢咋不把你自己悬挂起来开个景点？
1676185149,0,12,False,False,一只流浪的猫不知何故，饿得皮包骨却不愿离开那片草丛，可能那是它被丢弃的地方吧……
1676183568,0,12,False,False,这猫是流浪猫，被人捡了更好
1676176240,1,8,False,False,啥景点猫这待遇？一身病吃不饱还上岗？黑心景点吧
1676172668,0,15,False,False,景点猫没人养没人管一身病……
1676175406,0,7,False,False,网红猫就这状态？ 笑死了 回去遭罪吗？
1676263785,0,3,False,False,无主物，谁带走就是谁的！
1676189005,0,7,False,False,这不就是流浪猫吗
1676168767,0,11,False,False,一个月给你1200还跟你说是在帮你。别人给你3000说是把你害了。你饿死了说是你命該如此。不是没有景点猫，人人都是景点猫。
1676182410,0,13,False,False,瘦不瘦无所谓，一身皮肤病别人带走治好怎么了
