上传时间,回复数,点赞数,up是否回复,up是否点赞,评论文本
1676166577,1,32,False,False,有些网友只是想摸摸猫看看小猫可爱的样子，等猫猫长大了油腻了他们就不喜欢，甚至遗弃掉
1676252485,0,15,False,False,"我理解的景点猫：有工作人员兜底的半放养猫
景点的理解：景点周边的流浪猫
[疑惑]"
1676183092,1,33,False,False,既然那么喜欢，为什么会有病，会瘦的皮包骨头呢
1676132921,0,45,False,False,绑得好，都一身病了，为了满足某些人去打个卡的欲望难不成还送回去不成嘛。
1676195098,0,22,False,False,一开始以为是景点工作人员养的正式职工猫，结果是流浪猫，那被带回去有个家才是最好的。
1676119788,1,35,False,False,"如果有人谴责，麻烦闭嘴，除了偶尔喂投，摸一摸，做过什么
小姐姐带去了医院看病，实实在在人美心善，支持带走[打call]"
1676147066,0,49,False,False,景点猫养成这样，人家给你景点出力出猫，你连饭都不喂病都不治，带回去没人阻拦，发出来就觉得抢了，但凡有人定时投喂和及时治病，这猫也不会这么容易被捡走
1676177113,0,30,False,False,汕头人来了 个人表支持！在那猫除了能被人拍照摸摸吃几口好吃的还能得到啥更好待遇？
1676188772,0,33,False,False,真正的善人已经动手了，虚假的只会敲键盘。
1676282556,0,8,False,False,真要景点网红猫至于瘦成这样？同样随机投食的大学猫都胖成啥样了。
1676189330,0,38,False,False,[抠鼻]他们那么喜欢这只猫怎么还会让猫猫满身是病啊
1676147996,1,28,False,False,"流浪猫没有晶片 被人领养这没啥毛病
要跟人要回去只是为了打卡？"
1676166472,0,34,False,False,要是没人家故宫的流浪猫那种状态，就别提什么景点猫，这猫泪痕耳朵的状态就挺受罪。
1676174991,0,35,False,False,那这就是流浪猫啊！别的旅客都只是喂食，不给打疫苗，不给家
1676179558,3,35,False,False,这种事情就和我在学校里面遇到的很像。我们学校宿舍有老猫，生了一窝小猫很小，都还没有断奶，眼睛还半睁不睁的，有同学看着大冬天的可怜，担心老猫带不活，就把小猫带走自己养了。结果真的是有几个坏人，因为别人把小猫带走了，他们平时摸不到也看不到了，就去学校各个表白墙上连续发帖子骂人，反正就是也不知道这些人有没有道德，就自以为是，站在道德制高点指责那些带走小猫的学生。后来那几个小姐姐被扒出了，寝室楼被扒出了专业，然后没有办法迫于压力，把小猫还回去了，但是经过这么一折腾，老猫也不要那些小猫了，第二天就冻死了。我当时气都快气死了，我的天呐，怎么有这么自私的人呐？为了他能看到这个流浪猫，能摸到能喂到这个流浪猫，就不让别人收养啊？
1676175584,1,34,False,False,"挺好的，本来流浪猫在人多的地方流连，见人就蹭，就是想找饭票，不是想给景点打工。
被好心人绑了属于得偿所愿，恭喜恭喜。"
1676276497,0,7,False,False,当地人都在消费这只小猫，而小姐姐给了它一个家。小猫要是会说话估计会说：“老子就跟定她了，不要问，问就是不回！”
1676191017,0,23,False,False,放他嬢的皮！几个月大的“景点猫”[嗑瓜子]
1676134114,0,40,False,False,真有那么多人喜欢它投喂它的话，它怎么可能还那么瘦，看起来好像也不属于很健康的状态[尴尬]现在终于遇到小姐姐真心去照顾它疼爱它是好事呀，希望猫猫以后过得幸福[给心心]
1676176614,0,37,False,False,胖成帕帕那样的才叫景点猫。那些人怎么有脸跟小姐姐要猫的……
1676213632,1,16,False,False,说是一直在喂结果还是这么瘦，还有各种病，人家给接走反而还对小猫好呢，千万别送回去[辣眼睛]
1676170893,1,34,False,False,以前新闻上一个大学的狗红了之后不是被毒死了吗，现实里人们大多是路过式关心，真正付诸实践的少之又少
1676185259,1,36,False,False,为了他们的体验，就要将这只满身病的可怜小猫扔回大马路上，美其名曰景点猫，景点养着了？那养的可“真不错”伙食待遇也“好炸”了。
1676156549,1,33,False,False,好听叫人家网红猫，不好听就叫流浪猫。。。搁你选当流浪猫还是有个家啊？我想大多数人都会选有个家有人真的照顾自己吧
1676135267,0,45,False,False,屁吧什么景点猫   真那么网红还能这么瘦小一身病？还什么汕头猫就应该在汕头 说的什么屁话 好心人的投喂都只是暂时的 不然这猫早投胎了 小姐姐给了它一个温暖的家不比继续流浪强  人家小姐姐肯打车500公里接猫回家 光是打车钱都多少了？！那些敲敲键盘偶尔喂喂的有什么资格说人家
1676168829,0,34,False,False,小姐姐是唯一一个真的收留它的人，景点来来往往很多人，猫猫亲人应该也是在努力找个饭票。终于遇到了小姐姐
1676207346,0,14,False,False,还回去？还回去让它继续流浪？继续每天被拍照却没人真正关心？看它的状态，待遇绝对特别差，不能因为自己舍不得小猫就要让它流浪吧
1676132848,0,33,False,False,非常赞成这位小姐姐的做法，不说生病的事，要是哪天遇到变态虐猫，嫉妒下毒的，谁来救它？小姐姐真棒👍
1676179211,0,27,False,False,都喜欢就是都不管。连耳螨都不处理
1676169349,0,33,False,False,[暗中观察]：为了满足你们可有可无的喜欢，饥一顿饱一顿的投喂，生病了无人关心，我就必须得流浪吗？
1676145146,0,38,False,False,要不要脸  不照顾  还敢说是景点猫
1676214628,1,15,False,False,我想起挺久以前看到一个学校里，一个学生蹲点绑走一只挺漂亮的长毛猫，然后学校的学生群里一人叫她把猫送回去，说这只一直是自己在喂的。这类都是想要可爱的小动物，却又不想负责……
1676194826,0,17,False,False,这么瘦，还景点猫？？？不应该被当成吉祥物一人喂点吃的吗
1676140371,0,35,False,False,扯淡的景点猫。在特么没人管就快饿死了。你瞅瘦成啥了。眼睛周围还有炎症。
1676167677,1,40,False,False,景点猫？笑死，你看看故宫那才叫景点猫，看看人家猫养的，再看看你们，丢大人了，这下全互联网都知道这个景点猫都养不好了
1676164507,2,38,False,False,什么网红猫，无非是一些人一己私欲得到满足，敲敲键盘就觉得自己了不起，合个影就觉得的自己作出贡献啦？万人追不如一人疼，善良且漂亮的小姐姐才是真的爱她的，其余那些吵吵把猫送回去的都是键盘渣
1676182264,1,30,False,False,上千次的临时投喂和摸摸，都不如有人带猫猫回家直接管吃管喝管住。
1676175715,0,36,False,False,在某些人眼中，是景点猫，在小姐姐眼中是可怜的无家可归猫。猫猫遇上爱心小姐姐，算是走上猫生巅峰了。
1676166175,0,31,False,False,有皮肤病和耳螨，这样都好意思让别喵做景点猫。如果有固定睡觉喂养的地方，出来营业只不过是太无聊想被撸这样才是景点猫。
1676179198,0,27,False,False,除了故宫那些有编制的。其余的都是流浪猫。
1676117651,3,30,False,False,我同意只有故宫这些前御猫可以算景点猫
1676271304,0,10,False,False,找这小姑娘要猫的属实是给汕头丢人丢到明面上了
1676174452,0,32,False,False,那个英国的 你一年能喂几次啊 都给孩子瘦成这样了 孩子有个家不好吗[藏狐]
1676163880,0,36,False,False,[无语]有没有可能猫咪去景点就是因为看着人多，不但能乞讨到食物还有可能被捡走，结果有些人就自以为是的给点吃的，就觉得自己是大善人了，支持小姐姐
1676167758,0,28,False,False,如果有人定期投喂，生病有人管那叫景区猫，比如故宫的。都没人管，景个啥？流浪猫而已
1676134286,0,32,False,False,如果猫咪真的被人照顾，它也不会被小姐姐看上，小姐姐是看它可怜那么瘦又有皮肤病才决定养的，如果只是瘦点说不定她会放到景点，顶多旅游这些日子喂他
1676173077,0,27,False,False,别胡说哈？本汕头人支持猫被带走，可以被家养谁要流浪啊。支持小姐姐。不用带回来好好对她就行
1676147962,0,30,False,False,"真是景点猫养成这样真的太怪了,真当赚钱工具呗?"
1676204492,0,13,False,False,笑死了，那些人喂了小猫几口饭就把小猫当自己的了。占有欲这么强，怎么不绑回家自己养？现在小猫有家了，有主人了。他们难道还想要让主人再送回去继续当流浪猫吗？
1676202530,3,19,False,False,哦🙄合着这么多人说喂他，还这么瘦，还有这么多伤病[翻白眼][翻白眼]
1676173113,1,40,False,False,都瘦成皮包骨头还生病了，你们这景点等着之后放个猫尸当路标是吧[无语]你们没人管他没人养他没人给他治病，就拿他当路标偶尔喂点吃的还整得跟人家感情对深厚一样
1676202240,0,16,False,False,开个玩笑就算了，别真有人认真了让小姐姐送回去。小姐姐好心会有好报的，流浪猫真的很可怜，恭喜这只小猫猫终于找到了自己的家啊
1676169083,0,29,False,False,当流浪猫和被收养，哪个生活更好明明显而易见，有些网友过于搞笑了
1676153402,0,26,False,False,景点🐱，一厢情愿罢了。支持小姐姐
1676192993,0,19,False,False,一群人只为发朋友圈打卡而已，甚至发言都是炫耀自己去过那地儿。
1676152850,1,15,False,False,命中注定的缘分即使相隔千万里都会相遇呢[大笑]
1676207998,0,13,False,False,不需要送回去，没有人和他有长期喂养关系，这姐们算是头一个，带走了更好，毕竟景区真需要还会找新的猫，社会是不缺工具的
1676208585,0,19,False,False,真的惦记猫爱猫会舍得看他生病，看他面黄肌瘦吗？那群人也不知道在装什么
1676177403,1,28,False,False,先看一下猫的年龄再说，如果一年都不到，去掉不能自理的前三个月，总共才几个月，景点多少年了……根本不能算是景点的猫，就是偶然在附近流浪的。
1676276077,0,6,False,False,医保都没有凭什么算员工！支持小姐姐带走瘦的皮包骨还有耳螨猫癣的修猫！
1676169643,0,29,False,False,凭良心讲，这比偶尔撸撸喂喂的，才是真爱吧。有几个人能在500km玩的时候，捡个流浪动物带回家的
1676136259,0,39,False,False,真有脸说是景点🐱，过得这么惨兮兮的浑身皮肤病瘦巴巴的，还要脸往回要，我呸
1676208270,0,13,False,False,瘦到皮包骨还有皮肤病这叫景点猫？这就是只小流浪，苏州西园寺里那样的才叫景点猫吧，胖成一坨，毛顺皮亮
1676141298,0,39,False,False,瞅着还没女生宿舍楼下猫活得滋润呢锤子景点猫[辣眼睛]
1676168144,0,30,False,False,这猫都那么严重的耳螨和皮肤病了，抱了就抱了，这就是个景点的流浪猫，真要有人管就不会让它有那么多疾病
1676173736,0,25,False,False,但是，这种情况就是流浪猫啊，这样做是对的，有爱心的人收养了小可爱不是很好吗？如果是有人照顾还能拿来说说，但是小猫根本就没人管啊！你凭什么阻止别人的爱心？
1676166958,3,28,False,False,神特么景点猫，不还是对的。要还就把检查治疗伙食费付了再说。
1676165127,0,30,False,False,故宫那种才叫景点猫，这种被带回去当然是好事了，最起码吃喝不愁
1676187021,0,29,False,False,去寺庙看到一直很好看的豹纹公猫，看样子就不便宜，油光水滑，胖乎乎的又很亲人，本来想带回家，扭头一看满盆的猫粮水，和它消失的蛋蛋，我什么都懂了[脱单doge]
1676185577,1,30,False,False,去景区拍猫的有些人就根本不是真喜欢这猫，只是想显示喜欢拍猫照的自己可爱罢了[妙啊]
1676165969,0,28,False,False,猫那么瘦还有病，要不是人家好心收留说不定哪天猫就没了，要真是有人养的猫一眼就看出来了
1676137739,1,39,False,False,还tm每次都会喂，什么脸说出来的，猫一个月就吃它那一顿就能活一样
1676128835,0,30,False,False,一身病饿的这么瘦，就是流浪猫。。。现在好歹有个家了，放景点流浪还不知道能活几年呢
1676173030,0,30,False,False,惦记就把医药费付了
1676133529,1,38,False,False,这么瘦这么可怜也叫景点网红猫？真莫名其妙[无语]
1676169621,0,26,False,False,像故宫的景点猫有定点喂食，有追踪，有定期驱虫，这种没人管的小可怜只是只流浪猫而已
1676169792,0,38,False,False,那些群人也真是，明明就是一只无家可归的流浪猫，愣是在那边装好人，还一口一个景点猫，景点猫还一身病啊。有本事你们也都带回去啊。还好被小姑娘领养了
1676166044,0,25,False,False,看看人家故宫猫啥状态，还景点猫！都病怏怏的，人家带回去也是好事
1676175062,0,28,False,False,一个个说的好像多爱那只猫，都只不过是把它当玩物罢了，她带流浪猫走又如何，起码猫在她那边有健康的保障和一个温暖的家[眞白花音_菜]
1676189482,0,32,False,False,[微笑]跟着小姐姐有主人疼爱有好吃饭饭，而不是回去挨饿受冻浑身爬虫
1676175702,0,29,False,False,"景点散养猫，简称景点猫
景点流浪猫，简称景点猫

这告诉我们，想要搞大新闻，要学会缩句，学会删减定语。
也告诉我们，想要不被忽悠，要学会扩句，学会找定语。"
1676142956,0,28,False,False,故宫里面的猫才是景点猫[妙啊]
1676146389,2,28,False,False,[笑哭]就是说不至于吃百家饭还这么惨吧，我散养流浪猫两年了那健康状态比家猫还好，甚至挑食
1676166949,4,34,False,False,要回？汕头某些人你们真好意思说[呆][呆]做为一个潮州人，只想说，你们过年这段时间，丢潮汕的脸还没丢够吗[辣眼睛]
1676176582,0,28,False,False,可是这个猫猫不是本来就病的很严重吗 景区的人也没好好喂 带回家好好照顾又怎么了
1676185359,0,27,False,False,吃瓜吃到自己家[辣眼睛]，这波支持小姐姐，呆在景点衣食住行都不能保证的，小姐姐带它走，肯定是更好的归宿
1676181132,0,27,False,False,这只猫要是真的每天被投喂，那为啥还瘦的皮包骨[微笑]
1676263104,0,11,False,False,我看人家别的UP对家门口的流浪猫还给搭个窝放猫粮和水那！这好意思叫景点猫？！我家附近公园的流浪猫长得可好了皮毛锃亮，一看就是喂的好。
1676173096,0,28,False,False,在景点的流浪猫，无数次的装模作样五分钟终于被人家荣华富贵一辈子了干嘛还要要回去？[吃瓜]希望小姐姐跟猫猫幸福
1676133971,1,24,False,False,故宫那些才叫景点猫
1676138591,6,34,False,False,看过原视频，底下评论大家都是开玩笑的，果然是语言的艺术，一下子变得戾气这么重
1676165176,0,37,False,False,景点猫？看看故宫猫，什么叫景点猫  有专门喂养，一个个膘肥体壮，油光水滑的，这只猫连健康都没，连吃饱都办不到
1676166999,1,24,False,False,英国那位，实属把我看乐了。
1676174529,0,29,False,False,要回去可以啊，自己开车500公里去带回来，医药费也付了
1676200104,0,13,False,False,是这样的，说有人会喂它，我们学校图书馆有一只流浪猫，我们都叫它馆长，没疫情之前天天有学生去喂它还能随便撸，长的老胖了。后来20年疫情我们学校5月中才开学，在看到它时候已经瘦的皮包骨头了。现在景点有人才有人去喂，要是再有情况没人了呢？
1676158593,2,23,False,False,汕头哪有景点猫[捂脸][捂脸]，等下。妮妮？[捂脸]汕头哪只猫都叫妮妮。当地语言勾引猫的叫法罢了
1676271054,0,9,False,False,"这也能叫景点猫，就先不说有多少人知道这个猫是景点猫。
故宫猫见过吧，专人喂养，专人看病，平时都看不着，吃的白白胖胖，不需要看人眼色，理都不带理人。
这只猫全身是病，瘦这样，被绑架回家有户口了，小姐姐明显心善啊。
这景点猫我都没听说过。。。。真景点猫，活这样，还不如给小姐姐带走。
不还，凭啥还?猫就在那，咋的路过景点就是景点猫啊，你去一次喂了，不代表他不是一只流浪猫，一只猫没有家，它就是流浪猫。
还有说为了热度的，管你是不是景点猫，央视之前新闻时乱叫的猫，不也被领养了，那主人也没用他热度，不要把人想那么坏。什么叫网红猫就一定用热度。
那些说要还回去的，请你先把小姐姐治猫的钱还上，既然不是小姐姐的猫，小姐姐没有义务替你们交钱看病，还猫先还治病钱，而且要确定以后它生病了你来看，饿了你来喂。做不到就闭嘴[微笑]"
1676213314,1,11,False,False,我觉得没问题，这猫没有实际所有人，也不是谁的财产，带走了就带走了。
1676183080,1,15,False,False,它是个屁的景点猫，就是流浪猫，真要是这么多人关心，怎么皮肤病和耳螨没人治呢？有好心人收养它是好事，调侃一下也能理解，让她还回去可就太可笑了，人家猫好不容易有个家还要放回去满足有些人那想起来就去喂喂完就不管的心理吗[难过]
1676173778,0,29,False,False,瘦成这样还不让领走，，，，，我们小区一个个煤气罐根本不会被人绑回家，每天整个小区投喂吃的比家养猫好多了
1676266939,0,11,False,False,[捂脸]说白了一堆不想负责的人 遇到一个负责的 猫之后生活好很多了
1676172943,2,26,False,False,我觉得底下人在打趣，不是认真的。因为小猫看起来才几个月大，哪有这么多人见过它。
1676215529,1,26,False,False,景点猫是有人专门喂的，这个猫是流浪猫不要混为一谈
1676173590,0,28,False,False,景点别踏马扯淡了，没人管还说是景点猫
1676174099,0,27,False,False,没毛病，喜欢就领养回家，投喂是最伪善和不负责的行为，而且要是真的喜欢，就不会又瘦又一身病了
1676170721,0,24,False,False,一身病没人管还好意思说是网红猫
1676179696,0,29,False,False,随便喂喂比得过人家给一个家嘛[辣眼睛]装这么爱猫怎么不像姐姐一样给一个家
1676184186,0,25,False,False,[吃瓜]只不过是死了一只换一只的工具喵，白嫖的不乐意了
1676167679,0,26,False,False,我以为景点猫都得跟故宫猫那样似的[嗑瓜子]既然都已经被旅行社作为景点猫了，不应该至少保证吃喝吗？大学的小流浪还有看有些街边饭店收养的流浪猫一个个都彪肥体壮，这只成这样子，他们还好意思说是景点猫？
1676188878,0,11,False,False,给猫猫吃的，给猫猫治病才能算养猫吧，这种一身病吃不饱的猫算什么景点猫，怎么好意思舔着个大脸说是景点猫，猫猫现在不愁吃喝有人治病，你跟猫猫说要送回去你看她挠不挠你
1676195473,0,16,False,False,开头我以为误绑了景区养的猫，结果是带回了一只在景区流浪的猫，那没毛病
1676142322,1,78,False,False,我看见游客喂猫就问，喜欢吗？带回家吧[笑哭]
1676184252,17,26,False,False,别说是流浪猫了，路上捡的我就带走，你来咬我？[辣眼睛]
1676117147,0,26,False,False,猫咪都病了它在原来的地方生活质量也不太行啊，小姐姐收养了它还带它去医院治病这比原来的生活好多了。希望小猫咪余生都好好的
1676191353,0,19,False,False,小姐姐干得好，这才是真正的爱这只猫猫
1676181178,0,66,False,False,我觉得网友要还猫也是在开玩笑，谁不希望小猫咪有个能遮风挡雨的家呢？景点小猫如果和故宫猫一样身体健康吃饱穿暖，小姐姐也不会以为是流浪猫带走了～
1676197325,0,11,False,False,“景点猫”是什么，喂不饱的就算了，能喂饱还凑合[笑哭]
1676173320,0,23,False,False,瘦到皮包骨一身病，为了自己能摸摸还不如别人救了是吧
1676197028,0,12,False,False,幸好人美心善的小姐姐带走了，不然皮肤病耳螨眼角发炎没人治疗太痛苦了，希望小猫早日痊愈幸福快乐的生活！
1676195449,0,13,False,False,这个猫看起来不到一岁吧？怎么就成景点猫了？这个景点只有一年历史？
1676207980,0,19,False,False,自家员工待遇不好留不住，还不让其另谋出路了吗？这不大好吧。
1676147563,0,22,False,False,猫咖上班至少还有吃有喝有医保
1676183490,0,24,False,False,真正的好心人会祝福这只猫，就算喂过也不会觉得自己就亏了。早日告别7型的爱，完善自我人格。[爱心]
1676169065,0,22,False,False,本人汕头人 带走得好 这么只小可怜 瘦的皮包骨 满身皮肤病 网红猫？景点猫？怕不是换了一只你们游客都不知道吧 牺牲品而已
1676168579,0,24,False,False,不算是景点猫吧，那种都是有景点工作人员复制喂养看护的，这个小家伙最多算是景点地区流浪猫，被好心人收养不该是最好的归宿吗，话说回来，有严重耳螨和皮肤病，瘦成那个样子，网上这群人是拿键盘喂猫的吗？
1676174134,0,22,False,False,[tv_偷笑]有景点猫，但是你说皮肤病耳螨，还没给搭窝属于比我们办公园区流浪猫待遇还差。
1676137132,1,103,False,False,"锤子网红景点猫！
饿的皮包骨头，健康状况也不好，还有皮肤病…
不如赶紧让妹子领养吧 还能过上好日子"
1676135422,2,23,False,False,在你们汕头饿成那样[doge]  去当福州猫怎么了[doge]
1676117285,0,15,False,False,景点顶多是偶尔投喂，又不带妮妮去看医生，又不给妮妮固定的饮食和住所，还拿妮妮做噱头吸引游客，这哪里是景点猫，这是被景点剥削。
1676173571,0,32,False,False,妮妮：滚啊，这是我香香的饭票，谁掰扯我跟谁急[doge][doge][doge]
1676178965,0,12,False,False,我也支持，啥病也不给治，想摸了就过去摸一摸，不想摸就放在那生病也不管，人家治好了来要了，这如意算盘打的可真是响[辣眼睛]
1676167162,0,21,False,False,"能有一个家不比所谓的景点好？
除非景点包吃包住包医疗保险"
1676167533,0,24,False,False,我以为景点猫是故宫那种结果又瘦又满身病，这次我支持带回家，想要回去就捐款给景区启动基金会保证养肥养膘保证健康有人监管。
1676169985,0,24,False,False,有主人有家更为靠谱 再红再火也还是一只流浪猫
1676134810,0,24,False,False,作为一个汕头人，我支持小姐姐，谢谢人美心善的小姐姐[给心心]
1676132645,0,27,False,False,他们哪儿来的脸要这只猫呀[辣眼睛]
1676127113,0,24,False,False,我宁可她带走。比起当个网红，我想，他更想有个家。
1676150546,0,21,False,False,我是汕头的，我支持她带走猫猫，好好养着！
1676174952,0,21,False,False,景点猫，无偿给景点打工是吗
1676195696,0,7,False,False,有些网友参与感真强，明明也没有很关心的猫的样子知道猫被带走照顾了还理直气壮地去要。
1676166901,0,29,False,False,真的是景点猫，会一身病吗？人家猫猫好不容易遇见善心人带走，反对什么啊？也不见得给猫猫治病，还要人家还猫猫，真的是无语
1676188877,1,28,False,False,为了大家到景点有纪念意义的打卡行为，牺牲一下流浪猫的幸福有错吗[doge]
1676171973,2,22,False,False,评论看似都很关心，但是没有人管猫笑死
1676267311,0,9,False,False,带走了也挺好的。起码她很负责，家里的环境也适合猫咪居住。
1676186219,0,22,False,False,野猫在野外真就靠野人养活呗
1676179701,1,23,False,False,猫：这么多年了。终于！终于！终。。于有人来带我走了
1676155235,0,23,False,False,还景点猫，说的好听，像我们小区的猫一样，是有人投喂，但冬天下大雪他们也只能住地下车库了
1676167128,0,26,False,False,确实，带走对猫更好一点，“景点猫”没人照顾一生病？也没工作人员照顾，根本不能说是“景点猫”，就好比周扒皮天天压榨你，不给你五险一金（身体检查），没有工资（鱼罐头），还能说你是周扒皮的员工吗？
1676176332,0,24,False,False,你们只把它当景点，有人关心过它瘦弱的身躯，身上的疾病吗？有人考虑过它风餐露宿是怎样的凄苦吗？有人想过它一次次亲人的表现是期待有一个安稳的家吗？这里我赞成绑猫小姐姐
1676201024,0,11,False,False,旅游遇到，愿意直接结束行程带回家，还带去看病，支持收养，我们学校的流浪猫都有窝有人定时投喂呢
1676251525,0,9,False,False,猫猫：说好装模作样5分钟，荣华富贵一辈子啊；怎么你们还拦着？
1676176105,0,21,False,False,又瘦又有严重耳螨 人家收养了算是最好的归宿了！
1676173368,0,21,False,False,不知道有没有过激言论，看up主选的这些还好，更像是调侃，这么多人认识但没人收养，让人收养了也还好，反正是无主流浪猫。
1676182396,0,21,False,False,做得好，“绑架”猫这种行为就应该提倡[doge]
1676268529,0,9,False,False,真的没必要还回去，它又没主人，流浪猫谁带走就是谁的。
