上传时间,回复数,点赞数,up是否回复,up是否点赞,评论文本
1676196196,106,3245,False,False,前两天跟老板聊天，聊到去年买车的问题。他说当时有考虑卡宴后来没买，我就问了下原因他说：“身边很多突然有钱的小老板都是这个，感觉掉价”。
1676306148,19,311,False,False,我想起b站内一个街头采访，问女生你最希望你以后的男朋友开什么车？一共是保时捷718、日产GT-R、宝马m5三辆选一个，绝大部分女的选保时捷718，少部分女的选宝马m5，只有一个女的选GT-R，主持人问她为什么日产车，那女的回答因为我是真的知道gt-r的价格。我以为其他女生输给了对价格的无知，看了半佛老师我才明白，是我输给了对品牌价值的认同。
1676196814,14,1025,False,True,"保时捷718的含金量：
保时捷718的7——保时捷917的7
保时捷718的1——保时捷911的1
保时捷718的8——保时捷918的8
（不是"
1676199159,58,1583,False,False,保时捷我还是喜欢虎P，帅气硬朗还能和人讲道理[脱单doge]
1676197268,32,666,False,False,上能斩牛屠马，中能保值养家，下能酒吧开花[脱单doge]
1676228866,26,340,False,False,坐标昆明，现在a3乞丐版全款落地18.8万，最走量的版本，我朋友16年买的a3 1.4t的顶配，贷款落地22万，我记得14还是15年出过一批1.4t手动档的，配置极低，没有天窗，卤素大灯，布座椅等等，但是落地价格15还是16万，好像是有300台，直接被几天就抢完了，至于性价比，只能说你手握10万左右，人又年轻，不想买普通品牌A级车，又想体验一下所谓的豪华品牌，么a3基本上就是你能用最低代价获得的车
1676226976,1,55,False,False,718车主觉得你说的太对了[喜极而泣]买车时就这么想的。好看 贵 但没贵到离谱 性能完全够用 逼格没那么高但还是有一些。就真的是装逼又没那么多钱的人的首选
1676200506,18,95,False,False,BBA之上，宾利和劳斯之下，玛莎坐在那里，无人问津……
1676195942,6,182,False,False,建议大家第二辆跑车买迈凯轮，因为你可以学到很多的修车知识
1676201237,9,52,False,False,拼尽全力，我仍旧不能确定半佛到底是在带货还是在带货还是带货。
1676198237,7,96,False,False,进攻D点！！[doge]
1676199017,6,110,False,False,"其实最开始了解保时捷是小时候玩的一款游戏知道的，里面的车都很有韵味，而且各个国家都有雷诺什么的，性价比也很高
俺到现在都对里面的一辆老款保时捷特别喜欢，就是问了三个国家的保时捷客服说都没货，真的太可惜了
哦，我说的是虎式（p）重型坦克即VK.45.01（P)，第二次世界大战中德国的斐迪南·保时捷博士设计所研发的坦克，一般称为“保时捷虎式（Porsche Tiger）[给心心][给心心][给心心][给心心]"
1676196668,13,50,False,False,保时捷就是个分水岭能当平民的目标，也能当富豪的底线
1676196362,12,54,False,False,"不认同这个视频。对汽车比较了解的话就知道，718扣掉标卖也值那么多钱，属于高性价比的车了。对比Supra、z4、莲花等车，718简直是良心。
保时捷最体现logo价格的是SUV。"
1676195899,0,47,False,False,保时捷自己都说中国的小富婆们拯救了718这个系列[doge]
1676198888,1,31,False,False,一般来说，想要露财装逼，就不能考虑性价比，性价比高就说明实用性大于价格，就说明你这个人考虑完实用性就没有多余的钱考虑装逼了，所以保时捷精准抓住这种想装逼但又没比别人牛逼多少的人的心理，关键是还真成了，这种车你说装，在不懂的人眼里确实够装，打的就是一个信息差，在懂的人眼里，光靠一辆车本来也装不起来，也没必要花更多钱了，这种营销属实把人性拿捏得死死的
1676200108,5,32,False,False,好几年前买的macan（卡宴的mini版），当时一看50w+起步，还以为可以不到60w拿下，后来发现那个入门版本屁都不是，至少得上个s版或者turbo，不过考虑到买turbo的价格不如直接入卡宴，就搞了s版，再加上几个“蜘蛛轮胎”一个3w+，办下来就快100w了，只能说保时捷标价是真的会标，没买过其他品牌车不知道其他是不是也这样
1676363856,0,2,False,False,不过实话，保时捷718驾驶是真硬核。确实是十分有乐趣好玩的车。
1676195906,2,10,False,False,记得提肛[吃瓜]
1676374122,1,19,False,False,718这车，不懂人觉得👍🏻，懂一点的人觉得👎🏻，懂的多的人又觉得👍🏻，很有意思
1676290379,2,18,False,False,23岁 全力倚父
1676208934,2,20,False,False,保时捷不如以前了，车越做越小，发动机也阉割了，最重要的是，主炮也没了
1676374278,0,3,False,False,718这车，不懂人觉得👍🏻，懂一点的人觉得👎🏻，真懂的人又觉得👍🏻
1676226630,8,23,False,False,20年陪我朋友去看过718，强制选配15w+，落地差不多要80w。我朋友家里搞不锈钢的，家庭年收入150w左右，但不稳定，最后家里没肯买，嫌贵。家庭年收入到不了稳定150w往上建议还是算了，这车三年出二手得亏20w+，还有保险，保养，油费等等三年至少也得15w往上。等于三年用车成本差不多就要40w。特别是家庭年收入在70w-80w的，别想了，这车不适合你，或者说你还撑不起这台718。
1676212556,1,22,False,False,我买这车说白了就图能用大几十万的价买一辆中置后驱水平对置的跑车，而且还有换挡飞快的pdk变速箱。只花几十万就能有接近几百万的中置后驱超跑的操控，只是动力差点，可以说是性价比爆炸，而且保时捷的质量比很多超跑靠谱。至于那种说女人车，买不起911才买这车的人，我只能说我确实舍不得买911，也买不起法拉利，但现实里遇到说这种话的人我估计都不会正眼看他一眼
1676220572,9,9,False,False,"但718是最便宜实力最强的性能跑车，4.0+lsd如果在小赛道里甚至能干除了gt2 gt3外的其他大哥。对上小牛 马丁之类的，大部分时候能互有胜负。
四五百万以内的车，除了他大哥，基本跟谁都可以55开。"
1676209368,4,16,False,False,其实保时捷最大的特点就是，买车的时候光选装的配置就够买一辆十几万的小车了
1676200769,3,44,False,False,19年的时候，我女儿出生之前要换新车，看了一圈就是卡宴最合适，一百多万suv，预算其实是多一些的，一起对比的玛莎suv和特斯拉，玛莎怕被认为是微商，特斯拉怕找不到地方充电，最后选了卡宴最新款的油混，平时上下班来电，有事情外出就加油，限牌，但是我摇号第一个月就摇到了，杭州景区绿牌还不限号，满足[脱单doge][脱单doge][脱单doge]
1676213220,6,45,False,False,车真的是面子，以前上学总觉得用车充面子很俗，直到21年我大学毕业，家里提了一辆5系给我开，我才发现真香，自己还是幼稚了[抱拳]比如有一会停车，因为周围没停车场，路边也挺满了，但我旁边有个大楼，前面有空地可以停车，我直接开车进去了。下车才发现是个政府大楼，我朋友说前两天他想停进来都被拦住了[笑哭]我居然畅通无阻。而且20多岁刚毕业开这个车，公司同事和老板都会多看两眼，唉，这就是现实没办法
1676265520,0,20,False,False,只要保时捷是真的，你的站西百达翡丽，七浦路LV，莆田椰子也都会是真的。
1676211585,2,11,False,False,从来没见过有人提50多万的毛坯版保时捷718出来
1676280139,2,15,False,False,哈哈，我就是花70万买保时捷的人。就是这个价位你没有其他选择空间了，能把B装满的就是保时捷。至于说性价比这个东西，都买保时捷了还考虑性价比是不是来错片场了
1676210303,5,16,False,False,保时捷能卖这么好责任全90%在路特斯和玛莎。高于BBA的装x属性和低于宾利的价格属性只有保时捷一家，根本没得选。想不明白为什么玛莎做了这么多轿车和suv甚至去对标macan就是不做入门跑车，以玛莎的三叉戟标，对标718的那款只要不太烂，必然能获得更高的装x属性。还有路特斯，emira不到100的价格，外观和300的法拉利差不多，卖了这么多现在交不出来车，早干嘛去了。这两位卧龙凤雏其中一个醒过来了终于要开始做电动了，另一个还在梦游。
1676210734,3,14,False,False,保时捷我还是喜欢“鼠”式战车，非常硬朗还能在里面多人运动[脱单doge]
1676211636,1,11,False,False,重要的一点你没说出来，路特斯emira还没交车，718是目前 百万内唯一中置后驱跑车。性能吊打同价位。赛道性能很好。
1676254331,4,12,False,False,抛开其他社交属性不谈，各位不懂车的人，根本不知道保时捷有多强。911和718都是无解的存在，同价位甚至夸级别都是碾压，尤其718这个价格唯一的中置。
1676221727,3,14,False,False,我是因为喜欢操控 赛道圈速买的718GTS  改了轮胎排气程序刹车后 圈速应该比原厂992S快一丢丢  车去年63W买的 性价比拉满 我觉得找不出任何一辆这个价位性价比更高的赛道车了。  很满足了[呲牙]
1676217940,4,13,False,False,看评论 我以为这里是某乎 他们那边30万已经不算豪车了 我寻思着718哪怕丐版落地怎么着也是六七十万的车了吧（二手就别抬杠了） 你们人均都是911 GTR起步吗 能买这种车的 起码车主是已经脱离汽车这种基本功能为代步的阶段了 大多数人哪怕真的预算有六七十 他会考虑的也是BBA的高端车型 依然是4门车为主 买得起跟硬买是两回事
1676212621,13,14,False,False,"保时捷就是属于价格卡在BBA和大劳宾利之间，但品牌逼格却能和大劳宾利站在一起的神奇品牌。
所以如果你拥有BBA以上大劳以下的经济实力，又想装个超豪华品牌汽车的比，保时捷是唯一选，没有之一。"
1676224772,2,12,False,False,718是中产阶级能努力触碰到的中置跑车，而且只要不是丐版，性能不虚。
1676210433,0,7,False,False,718车主路过，说到底，718就是BRZ，就是用更低的价格越级打比自己高一级別两级别跑车的圈速，跑车界小米名不虚传
1676267258,2,11,False,False,718买的好的另一个原因就是赛道真的快，无脑的快，中置布局在小型赛道甚至比911弯道速度还要快
1676211499,4,51,False,False,718是真的牛逼，品牌价值装x上半佛讲了，然而在性能上也是牛逼，圈速快得离谱，玩车的也喜欢买，懂车不懂车的都喜欢，这就是718的厉害之处
1676217646,3,7,False,False,买车时候去看了捷豹的，奔驰的GT和718，最后从颜值性价比等方面选了718，开到现在第三年了还是觉得我的小车车最可爱好看[星星眼]
1676198255,9,161,False,False,现在新款的奔驰前脸大口太圆润，新款宝马的鼻孔又太大了，奥迪又不像选，结果对上法拉利兰博基尼和本利又太贵，最后看到保时捷，总是觉得是二奶车，所以还是开我的老款卡迪拉克SRX去做浴皇大帝吧，毕竟停车场遇到了牛老师他都说好~~然后他上了富老头的奔驰......[doge][doge]
1676196201,14,33,False,False,有没有跟我讲讲半佛的暗号都有什么，比如资本马桶揣，逻辑鬼才什么的都是啥意思[给心心]
1676301891,3,4,False,False,保时捷最大的优势没说到啊，就是保值率高，相对于其他跑车来说，保时捷只要是选配对了，不愁卖的，开几年也亏不了多少
1676211891,6,4,False,False,现在努力上班的意义就在于买一辆全新718！
1676283545,0,10,False,False,你这个视频唯一的问题就是你说的那些车怎么没有配照片，我都不认识[委屈]
1676213567,6,10,False,False,本718车主来了[脱单doge]买它不就是图pdk、mr、sc和标么[脱单doge]同价位赛道上谁打得过啊[脱单doge]入门版刷完零百也4.2了路上有几个比他快啊[脱单doge]718是我开了这么多车里面数一数二好开的[脱单doge]别说我没开过好车我同时也是卡宴帕梅车主准法拉利车主[脱单doge]
1676293133,0,4,False,False,一句话能说完的事，能水十分钟，不愧是你
1676211769,0,9,False,False,保时捷还真就是性价比之选，波子的神话又不是吹出来的。赛道里论实力不管什么价位波子都能越级打，论外观家族式的造型传承这么多年，更别说还有Rwb这种尤物，这就是每个稍微懂一点车的男孩终极梦想。而且保时捷远谈不上奢侈吧，其他有能力和它相提并论的价格都更离谱
1676225032,1,9,False,False,之前有考虑718 但是想了想不够实用，还是决定今年搞一辆宝马4系敞篷。因为4系能拉3个人，718只能拉一个[2233娘_耶]
1676207152,3,3,False,False,来温州出差，发现真的好多卡宴 保时捷帕拉梅拉不常见卡宴是真一辆接一辆。
1676254971,1,7,False,False,718在中国市场流行没有竞争对手，放日本，60多万R不到70，能买22新款的GTR，中低端市场，14万左右能拿下mx-5
1676209480,0,22,False,False,718在不懂车只认品牌的人面前，就是能被认为是大哥911，尤其是外观党改了GTS的包围，看着比入门版911还虎人。其实718比起macan 卡宴 帕美来说，算是亲儿子，底盘和平台都不和奥迪大众那一系列共用平台。
1676247934,0,3,False,False,你说得对，我选雅迪
1676243145,0,3,False,False,不否定718在这个级别里面的机械素质强大， 但有多少人买它是因为它强大才买的[脱单doge]
1676211277,0,5,False,False,不行啊 我的硬币要留着生硬币[tv_doge]
1676196681,8,19,False,False,真正有钱的反而更会玩 我家楼下 有个开五菱mini 你以为他穷 但他那五个车位 除了日常开的五菱 还有分别停了A8 劳斯莱斯 宾利 剩一个位停几台「破」摩托车 z1000 r1 社卡迪⋯⋯⋯
1676200932,3,20,False,False,看完视频去搜了下日本的718价格，入门级按现在汇率，刚刚40万的价格。。还是官网看的。。[辣眼睛][辣眼睛]整得我都心动了
1676230857,0,3,False,False,老实说嗷，真想彰显身份还不如买个737-800BBJ，实在不行买个Longitude嘛，这个牛X到爆[脱单doge][脱单doge]
1676294008,1,8,False,False,718说实话一点都不差，哪怕你算上国内特供的削减马力版本赛道上同价位也没有必有比718跑得更快的了。从这个角度来看保时捷真的就是性价比爆炸的存在。911也是。
1676196936,8,10,False,False,老婆我悟了，鼠鼠我呀3200这就不吃不喝存20年(3200*12*20=768000）买一台718。所以我可以去你家通勤么？一日两次[给心心]
1676197726,4,20,False,False,省流：保时捷718只卖80w
1676195962,2,17,False,False,我来这里只为办三件事，提肛，提肛，还是tmd提肛[doge]
1676221958,2,8,False,False,02：30 太对了，我外婆家有个院子，我舅舅有个典当方面的朋友。由于院子比较适合，我舅就把这院子借给他停别人当的车。20年初一堆车停里面，宝马宾利奔驰，但多半是偏商务的。今年再去看很多都开走了，估计是放开以后生意做好赎回去的？笑死，放那里风吹日晒雨淋根本没人看护，有些车轮胎都锈了……
1676211997,5,8,False,False,说实话，718真的 真的性价比很高，尤其是喜欢开车的，我上过一次赛道，很业余但是也很快，这车就是这么离谱，还有强烈建议上硬顶版，尤其是大城市通勤，敞篷开一阵子就后悔
1676276427,0,6,False,False,有钱买车享受，没钱网上口嗨，双赢
1676244911,0,6,False,False,难以理解，718我身边只有同龄人的会开开，大多是女生，买的时候基本也都是觉得两座比较小巧价格也合适。但如果买车是单纯为了用品牌来装逼，那你最多也就装给基本不懂跑车甚至连车标都搞不清的人，但是装逼给这样的人看到底能获得啥满足感...高人一等的感觉吗？何况718的车型也不会让人觉得你很稳重适合做生意，更多的会觉得你是一个喜欢穿粉色西装的骚包吧。
1676237831,2,6,False,False,对于一个月薪3000的我来说，怎么敢点进来的
1676209647,6,6,False,False,"我现在看到保时捷就来气，我以前的老板开卡宴给我装叉，还天天剥削我们。前几天单行道我开的正心情愉悦，对面来了一辆macan怼我脸上，下车后我没骂人她先开始骂人。
最气的是昨天上海下雨天被911溅了一身水，我气不过打了一辆车去追，结果出租车追不上。
后面报警了，这911没逃掉[吃瓜]。"
1676196068,6,13,False,False,我从非吉利星瑞不买，到了特斯拉真便宜，再到了奔驰C260L落地才30，再到718也不贵。回头一看，一年就能挣到手15个，还是攒钱凑首付吧[笑哭]
1676453770,0,1,False,False,要硬币就去lpl春季赛，看哪边赔率高就买哪边
1676196291,1,16,False,False,奢侈品消费市场最大的需求是装X需求[脱单doge]买的就是一个面子
1676197428,11,13,False,False,80万买个低配Grecale，比718有面子，空间还能车震，连开房的钱都省了[滑稽]
1676220953,0,5,False,False,关键是718在喜欢的车里 算是比较好实现的[doge]
1676394321,1,1,False,False,同价位里，赛道super 音道718[吃瓜]
1676424108,0,1,False,False,保时捷718的7——保时捷917的7
1676218842,7,7,False,False,"保时捷718、兰博基尼huracan
我只喜欢这两种车，品牌只是其中之一
更多是他们在路上，没那么“烂大街”
因为他们是“入门级”，更不会被内卷比速度！[保卫萝卜_哇]最重要的是，我不是富哥，仅仅是这2车就是我个人的奋斗目标"
1676196484,0,12,False,False,如果我有钱买718不如把这钱砸半佛脸上让他给我专门出一期文案水平更高的视频[藏狐][藏狐][藏狐]
1676263582,0,6,False,False,十几年前家里还没车，当时考虑的是雅阁，结果我爸大手一挥，直接贷款买5系了。做生意确实需要脸面(装b)，混的好不好全看开什么车了
1676197346,11,54,False,False,现在宝马二手车已经便宜到比一手现代还便宜了！[原神_欸嘿][原神_喝茶][滑稽][辣眼睛][doge][热词系列_知识增加]
1676211024,2,7,False,False,718不仅牌子硬 保值率高 颜值高 最重要的是它甚至不是一个花瓶 这玩意在赛道快的离谱 别的品牌的车哪怕是比他低一个档次的牌子 想要达到它的圈速也要比他贵很多 上可去酒吧泡妞 下可去赛道刷圈 这价位没一个能打的
1676212055,6,30,False,False,虽然但是，保时捷是靠suv救活了跑车生意，和卡宴 macan比起来，718更像是个大玩具，销量也就那样吧
1676224889,0,3,False,False,16款的车贩子也要30个往上，玩不起的[酸了]
1676292721,6,9,False,False,帕莎拉蒂才是最拉的，一流的价格、二流的名气、三流的做工。[嗑瓜子][嗑瓜子]
1676299838,1,6,False,False,跑车在性能这块算是一分钱一分货，比718便宜太多的跑车性能就已经没有可比性了。那么你该把718同价位的竞争者拉出来一对比再综合颜值，品牌，性能那不是一目了然了
1676279443,0,6,False,False,兰博法拉才多少钱 区区几千万的玩具，我刚才在小x上看到个帖子，下面评论人手六七千亿：对你没看错 我也没打错字，别问我为啥 帖子上就写的那么多。
1676271935,0,5,False,False,我身边开718的不多，macan才是真的多
1676205875,5,11,False,False,大奔最蠢的一件事情就是CLA200的整车外观设计跟GT63 AMG过于相似[吃瓜]
1676214207,1,6,False,False,省流：718装逼的性价比最高的[脱单doge]
1676227446,4,8,False,False,许多人觉得718和Macan便宜的，去买一台就知道便不便宜了。有时间在网上键盘不如多花花心思提升自己的经济实力。
1676287224,0,5,False,False,拿买保时捷的💰买了A股[doge]我做的对嘛
1676222280,0,3,False,False,这期我好像看过，不是之前苹果说过一次了么，这么能水，罚你明天再更一期[tv_doge]
1676277923,8,5,False,False,老婆想要拍拉梅拉。。我还是想买RS6。。。。。这可咋办
1676200735,0,9,False,False,"五菱宏光——昨夜西风凋碧树。独上高楼，望尽天涯路
宝马i3——衣带渐宽终不悔，为伊消得人憔悴。
保时捷718——众里寻他千百度，蓦然回首，那人却在，灯火阑珊处"
1676201824,2,12,False,False,主要是…水平对卧…中置后驱…PDK…都是特殊的存在。再加上金盾黑马…我其实觉得718挺好的…[笑哭]
1676220752,5,6,False,False,能买得起这个车的中产阶级，基本大多数是开了公司，为了开票抵税的中小企业老板们。而土老板们，最喜欢开的无非就是三种，七系，S级，A8。都是刚刚好在百万左右的好车。所以这才是bba守门员真正的含义，区分了土老板和大老板之间的距离[doge]
1676271076,4,16,False,False,要装X直接买二手啊，买年限近的省个购置税更具性价比[doge]
1676222412,1,6,False,False,我做项目的总包啊，公司老板啊，很多人买豪车可不仅仅是装逼面子，买豪车是能省大钱的，很多都是年底买了抵税，然后抵押贷款流动资金
1676195822,0,12,False,False,愣了一下错失第一捏
1676318791,0,2,False,False,但是718确实是个好车 跑山开过一次真的挺好开的 不要因为它好像是个卖标的就忽视了它本身机能方面的价值
1676203113,1,7,False,False,保时捷贵吗？ 值几个包？几件高定？几件奢侈品？这么一看是不是更具性价比了[doge]
1676199611,0,10,False,False,我一个每个月都要发愁各种贷款的，居然在大家研究为嘛买保时捷……  还是回去搬砖吧
1676245789,0,2,False,False,保时捷其实厉害的是全车选配，车主收获了个性，车商收获了额外的利润。
1676203220,1,7,False,False,"这两年
帕梅干不过S480和GT50/53
卡宴干不过GLS480
关键911还并不比AMG GT强多少
就只有718和小卡宴还具有超过奔驰的销量以及盈利能力了"
1676212282,3,17,False,False,嫌718排量小的，真下赛道，没几个能跑过718，真当保时捷给你造个就会花拳绣腿的车吗。
1676288731,0,4,False,False,这时候评论区置顶一个保时捷的优惠券领取网址那真的是比山姆大叔做的草莓派还要完美
1676198671,0,9,False,False,还是保时捷虎（P）比较喜欢[脱单doge]
1676210831,0,4,False,False,这玩具车可是买不起
1676212012,3,6,False,False,一辆30多万的BBA就是普通人一辈子能够的着的天花板了，不是所有人都年薪20W，也不是所有钱都可以拿来买车。
1676299841,9,6,False,False,刚毕业工作的时候，公司去一个富人区的普通火锅店吃饭，老板奔驰车后面停了一辆红色跑车，超级好看，车标是一匹奔驰的骏马，我们都觉得这个车要是二手得百十来万……搜了一下，新一点的二手五百万……Maya
1676198143,3,7,False,False,赛道里以下克上，有一种重生之我是消炎的快感[嗑瓜子]
1676203623,2,6,False,False,家里帕梅日常macan买菜，没开过718，不实用，顺便看看前排口嗨的家里都几辆豪车，口气这么大
1676202167,8,3,False,False,比亚迪仰望了解一下
1676212711,1,2,False,False,让你说的，我都想买一辆了。
1676209708,0,5,False,False,718这么好的车咋这么多人说他沽名钓誉。
1676270794,0,5,False,False,印象里就是比bba高一档的、而且这车面子底子都有
1676200573,1,9,False,False,很好，但是我不是它的目标受众。如果我开宝马，奔驰爸妈会说我出息了。如果我开保时捷，他们一定会痛骂我。“败家玩意，有这钱还不赶紧付了别墅的首付！！”
1676292947,0,2,False,False,@装甲尼禄
1676211919,3,2,False,False,那么，问题来了，保时捷718到底长什么样？
1676198292,4,73,False,False,[doge]也许两年后退休年龄加上去了，未婚生育折腾成型了，你们就都买718了，[热]因为买房不如租房
1676195912,0,9,False,False,我没法帮大家买有性价比的保时捷，但是我可以提醒大家要提肛[脱单doge]
1676221971,0,5,False,False,一句话，最便宜的保时捷跑车
1676204625,2,8,False,False,讲道理保时捷718性价比还真的高，看看同价位的玛莎拉蒂吉博力那才叫不坑穷人
1676257811,2,4,False,False,我有钱肯定先买个718，趁着年轻装装b。别看评论都是什么烂大街、二奶车，大多数人也就只认识标，百分之九十都拿不出这八十万，有辆718从他旁边过高低也得再看一眼[doge]
1676196623,0,10,False,False,这车是真的非常性价比，不行你去看看某红书，人均保时捷，围起来可绕地球一百圈[doge]
1676199458,1,8,False,False,二手保时捷灵车20万左右[吃瓜]
1676195887,1,6,False,False,虽然但是，记得提肛！
1676291678,0,5,False,False,查了下样子我发现我见过，我朋友买了一辆，哈哈哈，我之前只知道是保时捷不晓得是哪一款现在知道了
1676211148,0,5,False,False,省流:半佛表白doinb[doge][doge]
1676196713,40,6,False,False,[嘉然2.0_打盹]718说到底还是姐姐车，有能力的富哥还是上911吧
1676283974,0,3,False,False,佛老师，抽个718？
