上传时间,回复数,点赞数,up是否回复,up是否点赞,评论文本
1676005555,1,2,False,False,王小七你好，能否请你为我们的国宝丫丫发声？丫丫乐乐在孟菲斯动物园的生活苦不堪言，让见到的国人非常心痛！如今乐乐已客死异乡，只剩下瘦骨嶙峋、皮肤病满身的丫丫，真的太可怜了……距离丫丫回家的日子还有2个月，我们不知丫丫能否撑到回家的那天……希望你帮帮咱们的国宝，为她发声，使她得到更多关注，让丫丫有机会提前回家……谢谢你！
1675939127,0,2,False,False,加油！支持小七
1675947883,0,4,False,False,黑子：怎么证明你的数据是真的
1675936151,0,3,False,False,有时候，爱心也是一种资本
1675940197,0,3,False,False,不一定是水果，茶叶之类的有机会也可以试试了解一下，慢慢来吧
1675952663,1,3,False,False,已下单，支持小七，学校水果店三根香蕉9块钱，坑死人了[捂脸]
1675948442,0,4,False,False,up主这么真诚，看的我很感动，如果视频内容所说全部属实的话，大家喜欢吃橘子的真的可以支持一下，我不想看到up的一颗真诚的心，在将来某一天因为资本打压而消失。[笑哭]
1675951712,3,3,False,False,一开始亏钱是正常的吧，价值投资不是嘛。觉得至少不需要觉得自己很亏一样。
1675969213,1,2,False,False,其实小七没爱要这么较真！要怼你的任何理由都有！b战现在做扶贫助农的，从我关注到后面做的up温暖的冷风！也遇到质疑！他现在发视频都很少，也发过类似回复！都不容易！不用解释！信的人一直会，不信，你说多了，反而有更多攻击！保持初心就好！
1675936301,0,3,False,False,小七加油！！已经下单一箱橘子啦！可以吃水果还可以助农！！感觉很好！[打call][打call][打call]
1675942950,0,3,False,False,省流:260万。
1675941364,0,3,False,False,应该适当减减成本，或者想办法扩大宣传力度和销量
1675949411,0,4,False,False,我是一个大学生我家就是广西的，我知道广西的农村果农有多难，也知道家里和广西农村人供一个孩子读书有多难，up主这些真心办实事的举动真的有在帮助农村人，我必须支持一波[大哭][大哭][大哭]
1675940179,1,3,False,False,买了猕猴桃，前几天没熟，后来熟了吃了两天又坏了，希望以后多买点容易吃的吧[喜极而泣]
1675936825,0,3,False,False,前期基础确实需要资金慢慢垒实的 慢慢来吧创业都是前期累且投资高的 加油
1676080651,0,2,False,False,"一个商人，如果能在赚取利润的同时，还能帮助到其他人，回馈到社会，我们会说这个人是个慈善家。
一个商人，如果没有赚取利润的同时，还能帮助到其他人，回馈到社会，我们会说这个人是个活菩萨。"
1675991987,1,5,False,False,"可以提前来广东东莞大朗镇水平村这边考察下，五月六月荔枝上市，但是本地荔枝很多都卖不出去，这边也有果园合作社之类，不过没研究过。
我在这边上班，经常路边买水果。前年路边荔枝两块钱一斤，质量很好，去年荔枝小年，五六块一斤"
1675941127,1,3,False,False,太棒了，看完了视频，觉得你好棒，等我开学了把开学事宜稳定下来后再买时希望还能有货！
1676010490,0,2,False,False,说实话，包果园的可不都是农民
1675937456,1,3,False,False,下单了，支持助农[OK]
1676114161,1,2,False,False,谁真助农，我笑他两年半，除非你搞大烟做农业，没出路的
1675951539,1,3,False,False,支持，up加油，想买但甘肃不支持[大哭]
1675939909,0,3,False,False,敬你是条汉子！加油！
1675951654,1,4,False,False,希望好好做 实在不行大家众筹把漏洞补上 不要降低水果品质来省钱[口罩]
1676421154,0,1,False,False,三连助力，up加油
1675940360,1,3,False,False,希望我也能不忘初心，来小七你的视频下面还愿！
1675936878,0,3,False,False,反正我是支持的，我在大学的时候吃过武鸣的沃柑，确实比其他的好吃
1675955311,2,2,False,False,小七能不能找到优质芒果阿，我超爱吃芒果的[tv_色]
1675938177,0,3,False,False,已经安利给身边的朋友了，加油呀[打call][打call][打call]
1676001356,0,2,False,False,你不就是中间商咯？你应该自己去种水果啊
1675938686,3,3,False,False,买了一箱猕猴桃，不好，一个没吃成。也没退。不会再买了
1675938093,0,2,False,False,加油小七 love you
1675945354,0,3,False,False,小七的三观是真的正[喜极而泣]关注你是有原因的
1675940735,0,3,False,False,我长期在芭芭农场、菜鸟农场里种水果领水果[给心心]
1675943262,0,3,False,False,"卖的越多亏的越多🤔
大家快买啊！让这“黑心”up主亏大钱[doge][doge][doge]"
1675936341,0,3,False,False,我喜欢沃柑，补充维C，已经下单~~~
1675947447,0,14,False,False,感谢王小七同志为劳动人民做出的贡献！
1675940863,1,3,False,False,加油，但是“该区域暂不支持购买”能不能想想办法[给心心]
1675947638,2,3,False,False,省流：工资发多了[doge]
1675940505,0,3,False,False,从王小七开始做助农视频开始，虽然没有关注但是一期不落的全看了( ゜- ゜)つロ
1675973708,0,2,False,False,有些人差不多得嘞，up确实也只是搞一个噱头，但是明面上也确实在助农，亏不亏钱也无所谓了，毕竟小七打的这个噱头可以赚流量和粉丝，亏的那点和这些流量与粉丝比起来简直是小巫见大巫了，而且农民也可以赚钱，双赢的事情这么可能会作假[吃瓜]倒不如说老老实实的做好助农才会得到更多的粉丝和流量
1675939522,0,3,False,False,挺便宜的，先买点尝尝，太酸就当做公益，甜了多买点[脸红][脸红]
1675969621,1,2,False,False,名也要利也要，你好贪啊[脱单doge]
1675940878,0,3,False,False,在武鸣上学的人表示，武鸣沃柑真的好好吃呜呜呜
1675941969,0,3,False,False,本来想买点，让你多赔点，哈尔滨不是销售区域，你躲过一劫
1675955066,1,1,False,False,8.8斤78，有点贵
1676437561,0,0,False,False,您是值得尊敬的理想主义者[tv_抓狂][tv_抓狂]您是人民的英雄[tv_抓狂][tv_抓狂][tv_抓狂]
1675938728,1,8,False,False,@指法芬芳张大仙 一起？[脱单doge]
1676454352,0,0,False,False,小七好适合做扶贫工作，哦不对，你这也就是在扶贫[脱单doge]当时买了2箱猕猴桃，是真好吃，不麻，不酸，几乎纯甜。爽死了，之后再看看买点，加油，希望真心扶贫的人别倒[脱单doge]
1675939068,0,3,False,False,已下单，微薄之力，支持
1675937831,0,3,False,False,说句实话，吃了小七店里买的沃柑，真的很甜，核还少。刚吃完准备再去买
1675944573,2,3,False,False,要是能搞定剥皮机，沃柑做果汁绝对大卖，而且什么调料都不用放。
1675941442,0,3,False,False,希望小七的水果可以让更多地方的人能买到，好多地方都发不了货，另外陕西咸阳淳化的苹果很好哦！up有空可以了解一下[白色情人节_一键三连]
1675950690,0,3,False,False,支持你。也希望每个善良的人都能被善良相待。
1675938246,0,2,False,False,必须支持啊[保佑]
1675936972,2,3,False,False,我其实特别想支持一下，可惜啊，赤峰不给发货[笑哭]
1675936372,0,3,False,False,希望up和农户都能有盈利的一天。
1675938261,0,3,False,False,已下单，略尽微薄之力。
1675936735,0,3,False,False,前路漫漫，希望你能坚持下去。别忘了还有很多支持你的人。
1675937921,0,2,False,False,@央视农业 期待联动[打call]
1675953967,0,2,False,False,希望小七的这种销售模式能够扩散到全国各个农村，希望星星之火可以燎原
1676379034,0,0,False,False,看了视频，明白了up主亏损的原因，支出过大，而且做供应链每一个细节都要严格把控，希望up主坚持做下去，因为第一年的沟通监督成本太高，还有up主需要完善整个供应链的管理成本和机制，而不是全部由自己承担风险，这样才能持续化发展
1675940392,1,3,False,False,我这是地理位置受限。其实我个人不在意水果收到之后会不会受冻影响口感什么的，毕竟路途中是纯天然冷藏。不过，果然还是距离太过遥远了吧，极具挑战性
1675953175,0,2,False,False,up无论怎么做都不会让所有人满意，那就让自己最满意就好了
1675949971,0,3,False,False,将心比心，才是能打动大多数人的最好办法
1675950942,0,3,False,False,"乐，真正的助农就是平常多吃水果。
乱助农的下场，就是大家都喊惨，人均滞销，帮帮我们[tv_doge]"
1675945476,0,3,False,False,助农真的很好啊！谢谢你帮助他们
1676455765,0,1,False,False,支持小七
1676434931,0,0,False,False,昨天买的橙子到了，非常嫩，非常好吃，希望up主再接再厉，记得一定要赚钱，赚钱了才能保持下去
1675944985,1,3,False,False,我真的希望助农up可以赚到钱，这样才能鼓动更多人去做助农的事
1675949680,0,3,False,False,很久之前关注的，今天才发现小七还不到300w粉。一个不正直的人是无法做出这么多正能量的视频的，这就我相信他的原因。
1675947858,0,3,False,False,我是真心佩服你，我长大一定要做和您相同的事[给心心]
1676389176,0,0,False,False,投币止损！我现在还没有经济独立，不能大力支持！真的可惜[大哭]
1675938456,1,2,False,False,薪资给的很高啊
1676472830,0,0,False,False,支持了一箱，几十块钱门口水果店能买两个就不错了，这个能买5斤
1676350346,0,0,False,False,up，有良心可赚不到钱
1676467872,0,0,False,False,买了特大果，挺好吃的，吃多了撑得睡不着来评论一下
1676464626,0,0,False,False,希望粉丝有辨别能力，不当冤大头
1676384817,0,0,False,False,选品是一次成本，至少是多年一次的成本，可以摊薄的。另外税费你们不交吗？
1675948040,0,6,False,False,“我六块收七块卖是我本身”[doge]
1675943246,0,3,False,False,后期顺了开支就少了，先争取收支平衡。慈善太难了，相信你的人自然相信你，有杂心的怎么都能挑出刺。
1675938048,0,2,False,False,辽宁买不了，可惜
1676374400,0,0,False,False,不知道有什么好的农副产品，但实际是好的农副产品有很多
1676381859,0,1,False,False,谢谢你.........[给心心]
1675939924,0,2,False,False,下单了，认真做事的会支持的
1675940330,0,2,False,False,真心换真心，真心难啊
1675952333,0,2,False,False,君子，有机会一定会支持。
1675937497,0,2,False,False,猕猴桃真的很好吃，加油[支持]
1675948714,0,4,False,False,啥话也不多说，马上下单，我来自农村，知道农民要点挣钱多不容易，有的时候果子卖不出去就只能烂在树上。谢谢UP主！
1676379039,0,0,False,False,小王，下了一单希望好吃哦[脱单doge]
1675938553,0,2,False,False,青海不送[可爱联盟_哭哭][可爱联盟_哭哭][可爱联盟_哭哭][可爱联盟_哭哭]
1675944555,0,2,False,False,你不去领补贴肯定会亏
1675936244,1,2,False,False,黑龙江不支持购买[歪嘴]
1676434654,0,0,False,False,说工资高的，还不如买推荐朋友多点水果支持。。
1675941728,0,2,False,False,贵州正好比较近，媳妇也爱吃。先买3斤尝尝
1675940527,0,2,False,False,不过起步难之后，后续不出意外供货商就已经好找了
1675942798,0,2,False,False,尽管我不买，但还是支持你[支持]
1675950581,0,2,False,False,我怎么感觉up这么弄会被黑心商针对注意安全
1675952171,0,2,False,False,这不算赔钱，前期选品投入后期能源源不断带来收益。
1675940423,0,2,False,False,我想说我都不知道，关注时间也不短了啊，淦[辣眼睛]
1675950987,1,2,False,False,虽然但是辽宁不能买🥹
1676367442,0,0,False,False,买三斤沃柑尝尝[脱单doge]就是有点远
1675951155,0,2,False,False,哈哈，让水果贩子破口大骂
1676429756,0,0,False,False,我不喜欢吃水果，不想买来浪费了，能不能直接捐款支持啊
1675948631,0,2,False,False,那些说工资很高的，你是有什么大病？你的意思是助农就不应该赚钱？UP主不拿工资，他找的员工也不拿？还是都要up自己负担？就是因为有你们这种人才让人觉得做好事难
1675935893,2,2,False,False,等我吃完这箱猕猴桃先[吃瓜]
1675935392,0,2,False,False,没有什么能力！3连补血
1675947234,0,2,False,False,这属于前期投资了，后期肯定赚的。
1675935927,1,2,False,False,第一箱橘子吃完了，挺好吃了，准备买第二箱[doge]
1676359051,0,0,False,False,大卖，三连抱拳支持[脱单doge]
1676297083,1,0,False,False,煎饼果子算水果么？我这早中晚基本一直都有卖的然后还有很多人吃。
1675937207,0,2,False,False,后天应该能到，好吃再买点[吃瓜]
1675938444,0,2,False,False,我都不忍心看下去。。。。这也太亏了
1676453580,0,0,False,False,"拍了,买谁 都是买 ,.起码你给我看了个视频 不管真假 起码能照亮那么几个人"
1675948970,1,2,False,False,中间商就是中间商，你做亏了就是你做的不对，别扯什么助农帮卖扶贫，项目也不是能单独拉出来的，卖惨不可取，要做就好好做，找到一个盈利模式，虽然卖惨也是
1676263320,0,1,False,False,我想知道能不能在网店按照月份推荐应季水果[思考]
1675950307,0,2,False,False,买了，65-78mm，5斤，祝小七今年能赚钱[给心心]
1676281716,0,1,False,False,从来不在TB买东西，可以再开一个PDD店或微店吗？
1676435070,0,0,False,False,能卖耙耙柑吗，买的沃柑真巨好吃
1676426931,0,0,False,False,我也是刚刚开了淘宝店铺的，真的好难，这条视频都看不下去，看得心疼😭
1675943160,2,2,False,False,我没说你骗人，但是260万粉丝不是钱
1676352946,0,1,False,False,已收到货，非常好吃
1675951697,1,2,False,False,运营成本太高了
1676117928,0,1,False,False,加油，正能量up[给心心]
1675943917,0,2,False,False,我们这水果店的沃柑，个小，八块钱一斤。。。
1676167595,0,1,False,False,"如果你是为了扶农，我不支持你这样做，这样没有意义，生产价值并没有增加，还不如你直接给六万给你想帮助的人。这多省心省事
如果你想名声。为自己的利益，甚至为了网购环境，这我倒是真的支持你。赚钱不寒碜，现在网购环境也不好了。真真假假刷单很难辩。"
1675947761,0,2,False,False,水果其实很便宜贵的是冷链和长途运输
1675946653,0,3,False,False,有幸买了一次，多的不说，这黄心猕猴桃真心好吃。
1675943153,0,2,False,False,做好的视频，他日就是纪录片[热词表情_世萌双冠][热词表情_世萌双冠][热词表情_世萌双冠]
1675946255,1,2,False,False,算成本还是算的挺高的感觉，一般人一个月的人力成本内那么高吧
1676194685,0,1,False,False,冰糖橙直接去市场买才几毛钱一斤到一块钱一斤
1675939264,3,2,False,False,所以我应该买还是不买呢，岂不是买了up会亏[笑哭]
1676131483,0,1,False,False,我要这硬币有何用？
1676103321,0,1,False,False,全网真实的up爱了爱了
1676296358,2,0,False,False,我微信没有钱了
1676112675,0,1,False,False,可惜我只能弄两个币
1676207949,0,1,False,False,这样的up希望他赚钱
1676042998,0,1,False,False,不说啥，淘宝支持了8斤。
1676037630,0,1,False,False,你谁啊
1675944437,0,1,False,False,淘宝已买
1676041445,0,1,False,False,今天下单了两件沃柑[脱单doge]
1676031626,0,1,False,False,[热词系列_三连]
1675950269,0,2,False,False,我愿意真心换真心，将心比心。
1675948148,0,1,False,False,[笑哭][支持]
1675938594,0,2,False,False,up你做吧，时间会给你一个答案的，跟从自己的内心就好
1676006370,0,1,False,False,已下单
1676031464,0,1,False,False,希望你能赚钱
1675944676,0,2,False,False,应该是先打开销路吧，第一手试水。现在疫情放开，各方面都在慢慢复苏，慢慢就好了，小七加油
1675944648,1,2,False,False,三连支持的集合！！！[给心心][给心心]
1675991590,0,1,False,False,投币回点血
1675940346,0,1,False,False,三连了[脱单doge]
1675940858,0,2,False,False,但你家东西也不便宜耶，上次买了橙子还挺小的，希望这次沃柑能好吃
1675951096,0,2,False,False,"我不知道你是否是好人，也不知道你是否为坏人
但我知道好人做的好的话，可以名利双收
坏人做好了，或许也可以，但可能会被翻旧账"
1675949775,0,2,False,False,武鸣的水果真的很不错，我同学家里就是种水果的，芒果沃柑超好吃
1675938543,0,2,False,False,抱抱，你已经做的很好了，加油！安利给周围的朋友了。
1676397773,0,0,False,False,已喜欢小七，已支持，如果好吃会常买[微笑]
1675940796,0,1,False,False,加油！！！
1676374981,0,0,False,False,太贵了 支持不了 我还是去朋友的果园买
1675946043,0,2,False,False,现在这个阶段还在前期摸索的阶段，亏的这些权当学费了，加油吧，这些学费早晚会加倍回来的
1676462299,0,0,False,False,买了一箱5斤的，真的很好吃(｢･ω･)｢嘿，又下单了一箱8斤的也已经发货了[星星眼]
1675939265,0,2,False,False,加油吧，想把这个做成长期的事业，前期的考察花费都是必不可少的。希望能早日扭亏为盈
1675939398,0,2,False,False,沃柑挺甜的，品质没让我失望，两天炫了五斤[OK]
1675940440,1,2,False,False,小七，我在甘肃酒泉能不能以后支持发货到我这里啊，我问了客服说甘肃不发货。。。。
1675954643,0,1,False,False,下单投币支持
1675940762,0,1,False,False,[热词系列_好人卡]
1675946977,0,2,False,False,"真论成本和利润，是不可能比得过规模化的资本的。
哪怕只是想维持下去，也得提高10%售价，跟商业化的规模化种植也竞争不过。
唉"
1675944788,0,2,False,False,这么坦诚看起来确实不是在骗钱，支持up
1676002998,0,1,False,False,给你点赞👍！你的这个想法很好！买了一箱！相信你
1675957327,1,1,False,False,先装箱才称？
1675938405,0,1,False,False,[支持][支持]
1675944245,0,2,False,False,三连回血，不知道如何评价up，不！应该说我何德何能评价up！这样的人多一点，英特纳雄耐尔会更早一天实现…
1675957191,0,0,False,False,猕猴桃和冰糖橙我都买过，我吃着觉得都不错。猕猴桃没熟的时候比较硬和酸，熟了口感才会变好；冰糖橙很甜，本人很喜欢甜食，所以觉得挺好。
1675940440,0,2,False,False,[热词系列_三连]小七的真心实实在在！正好最近想吃水果，首选有了[热词表情_哎呦不错哦]
1675959963,1,1,False,False,这个价格比拼多多贵吧？
1676471825,0,0,False,False,要赚钱的，加油！
1675946525,0,2,False,False,"支持up，希望更多人参与进来，和中间商竞争，良性发展。
而不是中间商吃信息差，低价收购，高价出售，两头赚，伤了果农和商家，肥了自己。如果算上运输，就是三头吃。"
1676033313,0,1,False,False,果子没有打蜡，看着不是很好看，但真好吃！
1675948872,0,1,False,False,先三连在看
1675946601,1,2,False,False,君子论迹不论心，只要真正的做好事就很厉害了，没有人真正的不存私心的
1675940326,0,1,False,False,加油！支持小七
1675942696,0,1,False,False,已下单，支持
1675947598,0,2,False,False,小七店里的猕猴桃几个月前买过一次，只能说质量是真没话说，酸酸甜甜超好吃[星星眼]
1675948817,0,2,False,False,去看了眼…卖的太便宜了[笑哭][笑哭][笑哭]
1676467263,0,0,False,False,买了，支持小七和助农[打call][打call]
1676436611,0,0,False,False,有些脑子不好使的人天天就是见不得别人好，看到别人做的事他们就会上来不管别的就是喷，他们的脑子里根本就没有想到如果这种UP不赚到一点能维持团队的钱那么所谓的助农就是一张空话，合理的利润才能保证长期的运行下去，我每次遇到这种没脑子的人就会说，你能免费给你老板打工甚至付费上班吗?他们肯定会说不能，那么你凭什么要求这些人免费打工甚至赔钱做这些事情？
1675950835,0,1,False,False,支持，up主加油
1675943063,0,2,False,False,切，不就60000而已嘛？你这都属于小生意来的[doge][doge][doge]
1676372658,0,0,False,False,支持博主，以后买水果就买你卖的
1675953828,0,1,False,False,投币回血
1675977173,0,1,False,False,第一次刷到是不是快递浪费太多钱，你们卖的跟广州这边没有便宜，是不是要换一下模式
1676026603,0,1,False,False,你是真的在做事情，支持！！！
1675947335,0,1,False,False,已购买。+1[洛天依]
1675951907,0,1,False,False,加油[支持]
1675954345,0,1,False,False,买了两单沃柑，很甜
1675952124,0,1,False,False,买了买了，助力一下
1675937372,0,1,False,False,已点赞投币
1675948784,0,2,False,False,🙂想带穷苦百姓脱离苦难的人，一个脱离低级趣味的人。
1676025560,1,1,False,False,我家就是种这个的[doge]65mm的ab级收购一斤两块八，快递十斤运费十一二块[doge]up的价格还挺良心
1675967692,0,1,False,False,我们是同志了
1676042537,0,1,False,False,水果在发快递的过程中损耗会不少，快递不会因为你是水果就会轻拿轻放的，包装一破损一箱就坏了！
1675953458,0,1,False,False,新青年呀，小七[打call]
1675990019,0,1,False,False,助农赔6w从客观上来讲算不错了。
1675992938,0,1,False,False,不是你这样太麻烦，每个都套，污染环境，你用气泡袋，比较省。也不会坏
1675948715,0,1,False,False,加油！
1676458706,0,0,False,False,猕猴桃没有了吗？
1676023423,0,1,False,False,先顾好自己再说，公益可以以后做先做起来不赔钱才是最重要的！
1676415773,0,0,False,False,互粉 互赞 必回！[脱单doge]点赞此评论为信号，半小时必回，诚信互粉，永不取关，每天检查 [脱单doge]
1676020874,0,1,False,False,永远支持小七，当代鲁迅
1676024464,1,1,False,False,这唯一的缺点，就是买不到，东北不给发货[笑哭]
1675936013,0,1,False,False,已下单
1676368455,0,0,False,False,和我预想的差不多、
1675960748,0,1,False,False,我就是觉得这水果也不便宜……
