上传时间,回复数,点赞数,up是否回复,up是否点赞,评论文本
1675949719,95,3703,False,False,"我更希望你赚到了钱，因为只有你赚到了钱，这件事才能继续下去。孔子也对他的弟子说过，做了好事，应当获得奖励。
所以你应该赚钱，更要赚大钱！因为你是真真正正的扶贫"
1675945524,13,1486,False,False,本着赚钱的目的去助农才是最好的，会带动其他人
1675939353,246,3490,False,False,你这样是砸很多黑商的饭碗，一定要注意安全。保住[doge]命，我们才可以通过你去支持帮助那些该被帮助的人
1675941312,131,998,False,False,"说实话，up主推荐的这个水果按网购来看算比较贵的，沃柑八斤的都要40+，平均一斤5+，我坐标上海，一些便宜水果店沃柑也就5元左右的价格，我网购沃柑的话9斤一般也就30左右。
当然不知道up主推荐的品质是不是比我这水果店买的品质还好，支持一箱试试。"
1675941318,11,579,False,False,如果你能带普通百姓共同富裕，那，你，我的朋友，你是真正的英雄
1675943411,8,436,False,False,可以和当地政府对接一下，一般来说，地方政府很支持联农带农工作的，基本的政策支持都是会给的。要是能让当地脱贫户创收，当地政府高兴还来不及呢@王小七Fire
1675950320,6,262,False,False,"对助农者表示敬意。
不过听到“真心换真心”那段，，感觉有点危险，商场如战场，在明处做好人不容易。。。三连祝福你，以及干同性质事业的人们。。"
1675937350,9,636,False,False,up的善良和实际行动已经超过了99%的人了，自己做沙发上怼着手机啥也不干，尬黑的是真没良心[藏狐]
1675939540,45,1854,False,False,有一说一，扶贫真男人[点赞][点赞][点赞]
1675950181,1,63,False,False,反正我个人觉得，你能赚多少那都是你的本事，当然前提是农户也不亏能获得收入。那我就支持！！！
1675941078,3,95,False,False,伟大的劳动人民，伟大的马克思主义者！
1675950708,0,29,False,False,同志，请继续继续下去，我们这些同志会支持你的。
1675942209,5,14,False,False,等我把水果猎人的沃柑吃完 再来[doge]  tm的一天旋3个！
1675947799,20,85,False,False,感动中国十大人物以后必定会有小七的，加油加油，[打call][打call]努力，奥利给！[给心心]
1675949736,17,63,False,False,除了水果成本的其它成本花的真多，不亏待自己人的
1675952227,16,52,False,False,我买过一次 但是真的不好吃 不如赶集买的便宜好吃
1675940526,0,82,False,False,而你，我的朋友！你是真正的英雄
1675950047,2,7,False,False,猕猴桃有我！我还送了我的好homie一箱！
1675952036,6,10,False,False,印刷找我撒 我给你优惠
1675952912,1,11,False,False,一直看，现在去拍一单吧！
1676176464,4,15,False,False,不是。这不是在忽悠沙子吗。你拿前期开拓成本来说事。而且给我们还用人员成本这一套。哥，你去骗资方爸爸，别拿来骗观众。
1675942172,6,113,False,False,正在和小七做一样的事情，利用家里的渠道帮农民卖当地的农副产品。助学这块我也在做，我这边的建议是请不要给帮助对象钱！只能给物品和直接帮他们交学费。后续如果他们学业上情急用现金可以直接找我借，但是能直接帮他们买的绝对会直接帮他们买，你永远不能太信任一部分农村家长他们有的会拿钱赌博 有的喝酒 有的干脆存着不给花。
1675935657,6,62,False,False,你知道为什么亏吗？第一选错平台，第二人力成太高，第三不会经营水果这个类目，我举个例子拼多多上卖的只有你一半的价格，但一天发的货比你几个月都多还有钱赚，你非得做精品项目得上天猫或者京东
1675939650,1,38,False,False,为什么亏钱？因为赚的钱太干净了。[委屈][委屈]
1675939600,1,41,False,False,"一点提议，欢迎讨论
首先，建议小七前期暂时不要急着再去找别的水果产地做项目。老老实实把现有的水果产地做好做成熟。做好前期积累的准备，以便后续扩大
其次，像这种要跑多地的业务，只靠你一个人跑来跑去是不现实的。我的建议是在当地直接招代理人，不然成本真的很高。
最后，拉赞助这件事刻不容缓。而且，鉴于你这几期视频来看，我认为你拉赞助的条件时机都已经成熟。是时候要求点场外援助了"
1675963202,8,15,False,False,"首先你的人员工资开的有点高了 
其次你后期盯的太紧了去产地的次数太多了 
最后因为你的量不会很大注定了没有很大的议价权 
所以我觉得你现阶段最应该做的是节流 主要是我觉得你要做的不是靠着这头补那头把整个摊子支起来 而是应该想办法跑出一条相对没有那么高门槛的路 让更多的人参与进来 人多了 电商和某些水果商的定价权就没有了 这才是助农 而不是靠着自身能力去走一条只有你才能走通的路 当然也可能是我见识浅薄没有什么前瞻性"
1675935988,0,73,False,False,做水果电商不容易啊，大部分农户和合作社不懂物流，不懂包装，不懂售后，还有的贪小便宜，这些都需要你们去作，物流和售后以及损耗都是成本的大头，很多大网红都不敢做，加油吧，也只能支持一下了，事情不好做，道阻且长
1675937049,0,41,False,False,我在本地水果批发市场，经营户去除各种成本，一斤沃柑中果2块4，大果2块8，特大果3块2，品相很好。属于up说的AB级。买了一框，40斤，110块。这个价格对消费者很实惠，但对种植户来说，绝对不会很美好。对up主小团队来说，助农是非常艰难的事。我也在up主那买了5斤特大果，小小支持一下吧。明天就到货了。
1676128399,0,5,False,False,省流：打着助农旗号流量变现创业[吃瓜]
1675937071,0,33,False,False,文案措辞上，用“鸡鸣狗盗”不合适，鸡鸣狗盗指微不足道的技能，应该该用“蝇营狗苟”或者“挂羊头卖狗肉之事”会更合适，希望up可以看到我的建议@王小七Fire
1675935503,2,33,False,False,这是一个可以让百大提高含金量的优质UP主
1675990104,7,10,False,False,我觉得你助农助错方向了，你找的优质合作社根本不缺销路，你只是帮他们赚更多而已，真正难的是散户，被中间商压榨最惨的也是散户，烂地里卖不出去的也是散户，你助了个几百
1675939959,0,24,False,False,三连了，虽然很想鼓励UP，但不完全支持这样的做法。我始终认为，真心想做慈善的话绝对不能赔钱，因为这样迟早会做不下去，希望UP能尽快实现盈利，一直做下去，加油！[OK]
1675937712,0,29,False,False,君子论迹不论心，但行好事莫问前程
1675940596,2,28,False,False,不说别的，小七敢把账目明细发出来，这份勇气就比绝大多数所谓的理中客强得多。支持[打call]
1675940737,0,30,False,False,我家就是农民出身，我了解在我国农村在当下的处境。我在想，既然已经有人率先行动了，我们因为能力有限，既然做不到真正去贫困山区实地考察帮助农民，那就支持up主，投个币或者去淘宝上关注店铺然后购买一次自己喜欢的水果都可以，或者什么都没做只要我们观看了视频就已经做到了帮助up主宣传。穷则独善其身，达则兼济天下。我愿意用我最大的能力去支持up主！
1675938945,1,28,False,False,你在做一件让风气变好的事，希望你们能赚到钱
1675953534,4,24,False,False,"Up主创业，我提供几个建议：
1.一个250w粉丝的博主只卖70多w背后的原因好好想一下：平台选择很重要。水果真正的消费群体主要是谁，真不是年纪小的孩子，以我天猫店水果的客群分析，超过80%的顾客是28岁以上的，超过80%的顾客是女性。我不是说b站不好，但我还是建议全平台发展，你有内容，在其他平台也能火的。
2.只靠卖水果养活团队很困难，我现在的公司每个月卖的肯定比你多，但是依然亏损，因为水果这种初级农产品门槛低，价格卷，毛利率是不足以让你花钱投流赚到钱的，所以一定要开拓其他收入来源：比如给一些有品牌的水果代言赋能，赚广告费；除了水果也可以卖一些高毛利的标品：比如干果坚果零食等。
3.要建立好自己的私域，不要全靠视频平台挂链接，要拉微信粉丝群，200多w粉丝能有20w精准粉丝成为你的朋友和客户，你后半辈子就不用愁了。
4.我本身就是从事水果行业的，本来想创业做up主的，然后卖自己擅长操作的水果的，结果看了你这视频，心凉了半截，🐎的，还想成为第二个“杨晓洋”呢，伤心[委屈][委屈]"
1675939093,4,179,False,False,"不说别的，之前的猕猴桃和冰糖橙都有复购，一是比我家附近水果店便宜，二是确实都很好吃，作为消费者我是很满意的，作为小七的粉丝觉得自己的支持能够间接帮助到一些弱势群体也很有意义。
今天又下单了沃柑，好想快点吃到呀
我会继续支持小七的事业，希望你们能早日盈利，能够帮助更多需要帮助的人，加油！！！"
1676040865,3,10,False,False,"这个帐算的多少有点假。
或许纸面数据亏6万，但是。。。因为作者件事情，水了N 个视频，收获了N++的关注，获得无形的正面形象，这些难道不应该被纳入收入一部分？视频博主，不是靠作视频来获取收益的？
然后我们看下机会成本，即不做这件事情，你会不会亏。不作这件事情，你就需要作其他视频，作其他视频，你也需要最起码1个小伙伴帮你剪视频（从视频得知），就算你不需雇其他人，这样你需要支出连你自己在内，最起码12万支出（按照视频算法）。所以其实你从中少亏6万（如果把视频制作成本算成亏钱的话，反正我不这么算）。
然后这是真扶农么？或许。但这个生意本身就有问题。为什么有人说卖的贵？是因为心黑么？这个阶段最起码不是，因为成本高，为什么成本高？进货前要一大堆的实地考察之类，当然会增加成本。这本身就不是一种多赢做法。那为什么不直接开车去农村，每斤比市场价加5毛，这不是更直接？本身前提其实还是和市场经济接轨。所谓扶农多少有点伪命题。"
1676018787,0,8,False,False,"省流:销售额76.13万，毛利率25% 
最后亏了6.37w，捐了6000+
给一点个人建议，建议完善产业链。想帮助果农自然很好，亏损维持果农的生计显然是不行的，虽然说你做自媒体有钱，但是长此以往会形成吃大户心理，加油投币了。
相信你会完成的，越来越好的，很早之前就关注你了，从牛奶事件就关注你了。"
1676094777,1,5,False,False,我作为购买者，尊重你们助农的举措，可我作为消费者对你们的售后是不满意的，期间实在忍不住给你发私信，也是发不过去的。找客服，等了一周，就两箱水果快递两个单子，然后我收到一箱和就没有然后了，问询一周后才说已经到了，但水果呐？过了几天才收到！我作为个人支持你们，左右消费者我觉得我不会光顾！
1675938347,0,29,False,False,好人就该被人拿枪指着吗[脱单doge]
1676217399,1,4,False,False,你这人力成本这么高？
1675938808,0,46,False,False,"典型好人被枪指，老实人被欺负，有人说你不会留心眼吗？做人好难…做事留心眼被别人说心眼多，不留心眼又说太老实活该[捂脸]
永远不要让别人去理解你，你要理解你自己[脱单doge]"
1675937349,1,25,False,False,第一次不是被强行感动的，让我明白了不靠BGM，不靠刻意的故事渲染，单纯的数据，单纯的科普视频，只要是真诚，也是能打动人的[水稻]
1675939415,0,24,False,False,"为众人抱薪者,不可使其冻毙于风雪，有能力可以支持一下"
1675992421,4,6,False,False,"我就是中间商。压低毛利提高收购价有两个结果，农民捞点好处，相应的产地高1毛消费者就要多掏2毛钱，买单的还是消费者，好像没什么意义。
        农产品的价格取决于总体产量、品质、市场行情，市场行情看主要看时间，还有其它众多因素，比如砂糖橘的价格。
        虽然算是同行，但八竿子打不着，所以我客观的角度说，up这么做不能说是没有意义，只能说完全没意义，除非up有能力消化全国的耙耙柑。
        农户是不管你是不是做公益，想要好货，就出高价，谁的价高给谁。合作社不管你是不是做公益，想找货，就出代办费。合作社赚代办费才多少成本，还有合作社带你找的货会不会是他家亲戚的。"
1675937751,0,20,False,False,有缺点的战士终竟是战士，完美的苍蝇也终竟不过是苍蝇。资本宣传不是销售的长远之计，真心和产品才是[打call]
1675939331,1,20,False,False,"想要真心做善事，必然是亏的。利益和人心之间太复杂，觉得需要这种水果的，就支持下，不需要的，也没必要强行买。
up亏不亏自己会衡量的。"
1675935865,0,18,False,False,额，up主竟然还赔了，真没想到。我买了四次，每次两箱，自己一箱，家里人一箱，我觉得很好吃，我两岁的侄子，每次我说吃猕猴桃，他就乖乖做好说吃桃，能给吃的非常干净。
1675939214,23,18,False,False,省流：赔了6.39万，君子论迹不论心，支持up
1675938054,1,25,False,False,为众报薪着不可使其冻毙于风雪之中[给心心][给心心][给心心]赶紧投币支持up！像这样敢说敢做的up主不多啦！[热词系列_你币有了]
1675940227,0,17,False,False,才知道我是买到冰糖橙的幸运的1/1360，小七的冰糖橙大果价格跟北京中果一个价格，还更甜，真的超实惠～话说不打蜡不染色的橙皮真的很赞，做的糖渍橙皮饱受亲友好评，感觉更赚了～PS，糖渍橙皮某宝22一斤[笑哭]
1675938683,0,18,False,False,没啥，现在快递都差不多活了，会好起来的
1675948912,0,18,False,False,我记得有句话大概意思是…你相信社会黑暗面，也该相信会有人会舍身取义的
1675944697,1,16,False,False,任何公益还是助农一定要有盈利，失去了自我造血的能力就一定会死掉。只有公益/助农能挣到钱才能让更多的人参与助农之中，加油小七，过几天回校就买[脱单doge]
1675958833,5,4,False,False,别人专业的，比你便宜还有利润，品质也不差。你贵，还赔钱，不去直接拿赔的钱做慈善，纯粹[翻白眼]
1675937849,1,16,False,False,甘肃李广杏  求求了，前几年旅游在当地买的6块一斤，后来在淘宝一直没搜到，京东死贵
1675948462,2,18,False,False,这么多粉丝，这么多播放量，这么多平台…不挣钱的事情谁干，还赔钱…肯定不可能…个个平台收入…签约收入……不管怎么样，还是帮助了别人…加油加油，希望快快赚钱，我们西安周至这里今年种猕猴桃，很多家一亩地就卖了3500左右一家也就三亩地…很多人现在都不种地了，整个村子现在1/3的人都不种了，辛辛苦苦一年不如外边三个月…
1676031013,5,10,False,False,我家种沃柑的，就说说我这卖沃柑的情况吧。渠道一：大老板直接去地里收的。一般是需要本地中介，一斤水果七八分钱（刚问我妈），原来是一毛，中介的作用在于去考察地里的水果，联系农户，还包括找人来装果，平均一个妇女负责四五千斤甚至还包括上车，一人就两百左右。剪果是果农自己找，自己付钱的。有的大老板会把水果拉到打蜡厂，清洗，分大小，打蜡。也有装鲜果的，直接当天发货。渠道二：果农自己一车一车拉来市场上卖给老板，往往这种才是最辛苦的，一般都是家里种的比较少的，往往凌晨四五点就开始出发了，在老板还没开门前就等着，去晚了卖不了好价格。这种渠道也会去打蜡厂。渠道三：部分果农自己寄快递，据我了解，快递费一般十几块十斤（包括泡沫箱子了），其实放个四五天水果还是新鲜的水果的味道不变，我爸妈寄过。如果说味道变了，那么就要考虑是不是水果放久了。
1675940825,1,15,False,False,想到自己初中以前写的希望成为什么人，写了慈善家，看了你做的事，让我既羡慕也羞耻[捂脸]
1675935354,0,18,False,False,这轮前期成本太高了，开销路拉合作都是从头开始，下一轮应该就能好很多，至少盈亏应该能平衡[笑哭]
1676032279,1,5,False,False,心是好的，但实话说任何一方的亏本都只能说明这扶贫项目的失败。扶贫必须要以双赢为目标，否则那不叫扶贫，叫赔本做慈善。
1675941023,0,13,False,False,"看了很多你小七的故事，因为也有类似的助农经历，所以深深的知道此路的艰辛。
想要支持小七一下，可是为什么，作为省会的西安显示“该区域暂不支持购买”…………[酸了]@王小七Fire"
1675939783,0,13,False,False,小七加油[打call]，也期待着那些农民的故事，让我这个原本出生在农村，却忘了农村遁入城市……
1675939354,0,12,False,False,你在做一件让风气变好的事，希望你们能赚到钱
1675964868,1,5,False,False,看了下最次5元一斤，最贵7.8一斤，比一般水果店卖的还贵
1675949506,1,13,False,False,"我去，你这样太良心了。帮农户销售了产品，又正经的发了同伴工资。
说实话，你亏本搞得话我觉得你做不久啊。
下次能不能带我一起?解决一个贫困山区孩子的就业问题?[doge]"
1675936476,0,13,False,False,"农产品运输本身就是困难的。
再加上很多地方都是个体种植，即使是集体，规模也不大。
特别是水果，运输成本就在那摆着，你除非是种植园，不然根本不赚钱。"
1675939374,5,12,False,False,哪里有人(ー_ー)!!会做亏本生意，up没有盈利亏钱的善事是做不下去的。水果可以赚钱，帮农户卖产品，赚到了钱，再把钱拿去帮助需要帮助的人。然后up也赚钱，这才是共赢模式。
1675942202,1,12,False,False,或许你我做不了理想主义者。但我希望在中国这片热土上，在你我微小的支持下，让理想主义者多几个，让他们在理想的道路上坚持多几天。加油！
1675936791,0,12,False,False,我已经买了两箱猕猴桃一箱沃柑了，猕猴桃吃完了，沃柑今天刚到，味道真没的说，如果要买水果，可以支持这个，都是共赢，何乐不为
1675937942,1,12,False,False,带这种广告敢不开精选留言的可信度都比较高
1676385052,0,2,False,False,已经买了吃了，真的好好吃
1675938169,0,34,False,False,有缺点的战士终竟是战士，完美的苍蝇也终竟不过是苍蝇。资本宣传不是销售的长远之计，真心和产品才是！君子论迹不论心，但行好事莫问前程！！！
1675936357,9,11,False,False,良心是赚不了钱的
1675942772,0,12,False,False,小七这种理想主义者永远都让我敬佩和向往，我自己想成为这种人，但我做不到，也没有勇气，怕苦怕累，所以只能多买点小七的水果来支持一下小七了
1675993996,5,5,False,False,说工资高的有点搞笑了。。4个人的团队做这么复杂的项目，在能比较好完成工作的人里，别说1W，就1.5W也没多少人愿意干。
1675939023,0,12,False,False,永远不要低估人性的黑暗，要保重自己，加油
1675935606,0,13,False,False,"推荐通知书
        尊敬的up主，您好，由于您的作品过于出色，现已于推荐页面可见，希望您的作品能做得更好。
                                       bilibili观众认证💮"
1675957635,1,3,False,False,小王在农民眼里还是一个倒爷。你的吞吐量小，又有管理  运营费。这就是一个倒爷的标配。
1675946057,1,11,False,False,小七要不要联动一下@水果猎人杨晓洋 品鉴一下果子！他吃水果是认真的[给心心][给心心][给心心]
1675941601,0,11,False,False,不行不行，越看越敬佩[兔年]up的这份决心对我和很多朋友都是一盏指路明灯。人性有贪婪虚荣的成分，但这不代表所有人，所有时刻都会被它诱惑驱使。我们一定要牢牢记住自己的初心，这样每次我们迷路时，回头看看，就不会忘记自己为何出发，就会增添继续前行的勇气。[鼓掌]
1675940387,2,11,False,False,看到视频底下的沃柑广告了，谢谢up对广西农户的帮助。我亲戚是种果树的，今年柑子的收成不太好，也不甜，很多都烂在树上和地里了[委屈]
1675945597,0,10,False,False,助农不赚钱的话不长久，这样反而不是最好的结果。希望这个视频不会影响那些助农有赚钱的up主。
1675938192,0,11,False,False,被触动利益的一方是不会看up做了多少善事，帮助了多少穷人的。他们因利益而来，为利益鸡鸣狗盗。小七这么专注务实已经很棒了，加油[打call][打call][打call]
1675950411,0,9,False,False,我们这边广西批发出去  也就2块5   后面全是中间商加价[OK][辣眼睛]
1675942591,1,10,False,False,天冷不太想吃，年前买的一箱苹果基本没动。可以向冷风学习，他粉丝只有你一半，去年8月卖凯特芒，39.9元9斤，超大个才3个，早上切一个吃一天，销量10万+。做好品控，保证利润，至少不亏，助农是长期事业，赚多了可以回馈果农。
1675953054,1,6,False,False,价格确实比某多多和某团上团购的贵，但是在个头和口感上确实更好更甜。我在多多买的平均差不多3元每斤，个头在4-5cm之间，有酸有甜，酸多甜少。在小七这里买的7cm大果，合着5.5元一斤，外观全是好的没有花皮，纯甜不酸。小七这里个头小点（6cm的）果子差不多4元一斤，口感应该是一样的。对我来说，我愿意在小七这里买。
1675936673,0,10,False,False,你的出发点非常好，但是道路艰难，希望前路能慢慢变好
1675947746,11,5,False,False,你也只是说了个大概收支。也没详细发出来实际支出啊。一直强调很详细是啥意思呢。
1675959998,1,3,False,False,没说实话
1675940968,2,10,False,False,那些说工资高的怎么想的？天天风里来雨里去舟车劳顿的，而且这个团队只有四个人，这四个人要把所有的事情全部做好，做完，一个人要干着几个人的活，你觉得1万多吗？
1676031291,0,3,False,False,我希望不再有农民蒙受苦厄
1675939767,1,10,False,False,我真的好喜欢吃柑橘，但是新疆不配送耶[委屈]好吧新疆偏远我接受，那我去学校再买，可是哈尔滨居然也不配送[委屈]你让我怎么支持啊啊啊
1676021684,0,4,False,False,广西的水果真的很好吃的呀！！欢迎大家购买！我在外地上学之后真的总会都想念家乡的水果，不仅量大，还便宜[星星眼]
1675945723,1,9,False,False,只要你跟工农站一起，那么我们就是好兄弟。
1675938324,0,10,False,False,帅气，真心希望小七的“新新之火”，能温暖这个残酷的世界！支持你
1675962858,0,4,False,False,pdd买同样的东西，比你便宜一半，笑死
1675940561,2,10,False,False,助农不赚钱还有谁助农，最起码农民可以出更高的价位
1675935569,2,11,False,False,是从什么时候起做好事都需要举证证明了。。。。。。。[笑哭]
1675956297,7,6,False,False,虽然我想欢呼，但是后真相时代种种经典例子已经打过我的脸了，都先观望一下吧，互联网上骗人的还少吗？当然，你花的是你的钱，尊重你的选择
1676030524,0,3,False,False,而你我的朋友，你是真正的英雄
1675945469,0,9,False,False,这个社会不怕你赚钱，但是赚的要有良心。宁可穷一人富万家，而不可富一人穷万家。祝愿UP主长守本心
1675957809,4,5,False,False,说到底还是没有说清楚这么多人买，竟然还赔了，那钱到底去了哪里？劝大家理智，不要被“助农”“生病”的标签迷惑，一看到就义无反顾的去帮助。善良是好事，但是谨记要理智。对于公众人物更要时刻监督
1675936123,3,9,False,False,前期成本太高，希望小七能达成夙愿吧。下单支持
1675940549,1,9,False,False,可惜了，想买点支持一下，结果新疆果然不支持发货，这是第几个来着了，我想买却没办法买。只能投两个币给up加油了。
1675938125,1,9,False,False,广西沃柑真的非常好吃！！推荐给所有人[打call]有条件的到广西买会很便宜
1675960010,1,4,False,False,我依然持怀疑态度😓
1676030421,2,7,False,False,"其实最需要帮助的是东北卖主粮的农民，因为产量大，市场相对于本地过于饱和。
以玉米举例，农民那里直接收购的价格低到每公斤几毛钱，但上市价格翻了好几倍，而实际上每年农药、种子和化肥钱高的你难以想象……
最主要农民自己也自暴自弃，他们甚至每年都是卖散户而不是自己找稳定的供应渠道"
1675938599,0,9,False,False,六子，不惜的搭理他们，跟我肘[Cat_escort]
1675942678,0,3,False,False,已购8斤
