上传时间,回复数,点赞数,up是否回复,up是否点赞,评论文本
1676034969,0,3,False,False,刚到，真的吼吃的，卖相也好看，等发工资了给我家人也买点[点赞][点赞]
1675938338,14,8,False,False,工资1万有点多了，说真的
1675938964,0,8,False,False,没关系的，网络环境会变好的✿ヽ(°▽°)ノ✿
1675939214,0,8,False,False,真诚永远是你的必杀技[爱心][爱心][爱心]
1675935705,1,8,False,False,绝对不能让助农up主只火阿力木[打call][打call][打call]加油
1675939851,0,8,False,False,你说要助农的那一刻就有预感你要赔钱了……
1675948132,15,22,False,False,我是路人，只关注到了一个人工资成本1.34万。已经是金字塔顶部的人了[doge]。我们这里做公益的兼职义工周末上班一个月900[微笑]。
1675937958,0,8,False,False,这年头做好事也这么难了吗，加油吧[加油]
1675938240,0,8,False,False,省流！！！给我买！！！支持up主！！！
1675940609,1,8,False,False,"猕猴桃很不错，冰糖橙很正宗，沃柑还没买，家里人过年囤了很多[笑哭]。
发来的基本都是好果子，不过猕猴桃和冰糖橙都是需要放置一会儿，所以买来可以不急着吃。（可能我买的得早）"
1675953056,0,5,False,False,大哥大哥，我们富平柿饼今年严重滞销，三四块一斤被收走，卖不出去啊，过年前后是销售期，我今年就回家开合作社去。有机会合作
1675935715,0,8,False,False,之前猕猴桃可选分类太少了，我怕吃不完[笑哭]犹犹豫豫没有买，这次有三斤的，算了算比我们学校便宜，下单了[打call]
1675936452,1,7,False,False,UP主啊。你视频更新的太慢了。我都不知道有沃柑这个项目。只知道有猕猴桃。
1675935106,1,9,False,False,一直支持小七[打call][打call][打call][打call]，小七的真诚我们都能看见[给心心][给心心][给心心]，清者自清，没必要去在意“某些人”的无脑言论[doge]
1675935386,0,9,False,False,投币止损，希望up能坚持下去，更希望up可以盈利
1675937550,0,8,False,False,中国的农民占大多数，也恰恰是最需要帮助的人，我爷爷奶奶都是农民，知道他们的心酸。能给农民以富足的生活又恰恰是我们这个社会需要履行的，国家的兴起也正是依靠他们
1675948520,0,8,False,False,"偶然点击，播放音频做背景。
在这里评论下，你有自己的高道德标准等价值观，太多次强调“真心”这个词。
我个人觉得做事业，尤其涉及商业运转和发展的事业，做事业是很专业的事，情绪（情怀啊，助人的急切心情啊等等）在规划里一定不能排在商品品质，物流，合理收益，良性发展……更重要的位置，商业靠商道，我说的商道不是坑蒙拐骗下作伎俩，有你—老板，员工，果农，我们顾客，你的其他合作伙伴如物流公司等共同圈子里各种人性矛盾的最佳处理方案，“真心”放在第一位极难实现你的构想和维持，因为虽然你们热情高涨，但当足够多的挫败感和疲惫心寒经历后心境很可怕，以商道为基托，合理加入真心则事半功倍，可成。
祝福你，气温允许时我去你的店下单。"
1675938190,0,8,False,False,压力别太大，你已经做的很好了。[支持]如果需要，我们都是你的“狗头”军师[脱单doge]
1676018978,0,3,False,False,差旅成本只有一开始选合作社的时候才多，后面就降下来了。起步的时候会很困难，但只要把头开起来了然后熬到正常运转，后面就基本亏不了了。不过up还是要小心同行攻击
1675939829,0,7,False,False,希望您的真心，继续保持，不要忘记[奋斗]
1675937946,0,6,False,False,我这个人喜欢吃丑橘，不知道up能不能搞一下。
1675935247,2,6,False,False,不是我不想支持up主，买过猕猴桃，同价位有更好品质选择
1675961734,0,3,False,False,我就是在深圳做生鲜采购的，产地我也去过不少。价格虽然不便宜，但这个体量不大，这么搞是不合理的，亏本很正常。
1676001842,4,3,False,False,提高收购价的方向就是错的。最好是按市场均价，分品质等级阶梯收购价。即便是助农，本质是买卖，如果卖家赔钱，买家也买不到符合价格质量的产品，所谓助农也注定不能长久，最后一地鸡毛。
1675938415,0,7,False,False,我觉得up这个能坚持的线路多几条应该就能成了，因为你毕竟掌握流量。
1676010973,6,3,False,False,看完了再评论一次，感觉UP主做事比较官方，在产地找合作社其实比较省事，但是没有合作社的散户抗风险能力才是最差的，拿砂糖桔来说每年赔本的农户占大多数，大部分并不是因为贪心不卖才卖不出去，而是每年集中成熟的时候收购价基本都是赔本价，果子熟了又留不住，只能赔本卖所以大部分果农都是赚不到钱甚至每年都赔钱的
1675943976,0,7,False,False,人在武鸣，可以负责任的跟你们说现在的沃柑是最好吃的最甜的，年前双桥镇上卖沃柑我车压根不敢进去，进去了出不来太堵了[笑哭]
1675938636,1,7,False,False,@央视新闻
1675939665,0,7,False,False,"你是什么样这个社会就是什么样
我是什么样这个社会就是什么样
我们每个人都心怀善意，这个社会就会温馨和谐！"
1675950137,0,7,False,False,谢谢帮助武鸣沃柑，我曾经也想推家乡的水果，太难做了！投币了
1675938867,0,3,False,False,给个俩币
1675935617,0,6,False,False,买过8斤武鸣沃柑，品质很好，也很实惠[打call]
1675943566,0,7,False,False,另一个up说过一句“助农得先保证活下来”。小七想法不错，但是只有赚到钱，活下去才能长久。希望像你一样真正助农的能赚到钱。这样才能推广开
1675938462,0,7,False,False,已三连，非常感谢小七，希望小七越来越好，能够坚持下去[奋斗][奋斗][奋斗][奋斗]
1675953782,0,4,False,False,"正宗广西武鸣沃柑新鲜水果一级纯甜王小七当季整箱精品蜜柑橘桔子

您已成功付款38.90元

我混网20年，第一次买up推荐的东西。

太多想说的，到嘴边也只剩下两个字，加油。"
1675936358,0,7,False,False,支持阿婆，希望这个助农项目越做越好，做大做强[打call][打call]
1675936694,0,7,False,False,那个橙子是我网购橙子最满意的一次[脱单doge]
1675951149,0,7,False,False,看似亏了，实际是挣了，赢得了名声，创造了平台，但这些都是up该有的，双赢的局面何乐不为，希望多谢up这种好人[doge]
1676003172,0,3,False,False,你想赚钱很容易，起码现在你的人群又拓展了。另外生鲜产品，这个里面成本空间还有很大减少的空间，非常多项目可以削减甚至砍掉开支。也就是现在阶段你具体是赚还是赔其实都不重要，你的人群已经圈住了，并且还扩大了人群。总体来说你已经干成了，今天大概率是能赚到盆满钵满。
1675938178,0,21,False,False,有缺点的战士终竟是战士，完美的苍蝇也终竟不过是苍蝇。资本宣传不是销售的长远之计， 真心和产品才是！君子论迹不论心，但行好事莫问前程！！！
1675935186,0,8,False,False,从来没怀疑过，水果明天到，可以开吃了[呲牙]
1675940130,1,6,False,False,up你好，不知道您那边还招人吗？我的本专业是植物保护，农业专业，看了你的视频我也想做些什么。
1675960444,1,3,False,False,不是说社区团购挤占小商小贩生存空间吗？鼓励人们支持线上助农，难道线上买水果不挤占小商小贩生存空间吗？
1675936124,0,8,False,False,反正只要是up，我肯定会毫不犹豫的支持，我是个不爱吃水果的人，一斤苹果能吃一个月[笑哭][笑哭]，但上次的猕猴桃我没吃完，不太好保存，我自己体质也不太适合猕猴桃，沃柑不错，来啦来啦！！这就去下单[星星眼][打call][打call]
1675935488,0,6,False,False,买过两次猕猴桃一次橙子，真不错，很甜
1676431595,1,1,False,False,只能说，你既然都算上剪视频的开销了，为什么不算上视频收益与粉丝增加呢？还有，你把开拓成本摆出来算成了花销了，在前期当然是亏损的，就像，造机器的厂房，前几个月当然赚不出买机器的开销了。只能说能骗到一些不仔细考虑的人吧。当然，赚钱无可厚非，能做慈善更比大部分商户好了。
1676192184,0,2,False,False,有良心的很难赚到大钱的。成立一家投资公司，给出年化12%的收益，吸引人来存钱，再用新用户存的钱给老用户发利息，等到资金池子够大就准备转移财产跑路。这就是我之前公司老板的操作。后面老板被抓坐牢，工资没有了，投资人的钱也没有了。还记得最后那几天一个老太太上来哭诉存了100W，还拉了亲戚朋友存了
1675935191,1,6,False,False,大冤种up主
1675981958,4,3,False,False,你的这个工资走访成本很高也就算了，你家其他水果，东西不比其他商店的好吃，不光比水果大店贵不说，比网络上供销社水果还贵非常多……因为我特别喜欢网上买各地水果，所以大概水果价格也知道，就拿橙子，除非达到农夫山泉家的那个天赋，要不你家东西偏贵太多
1675935199,2,7,False,False,好好干，争取成为第二个“背景太假”，共勉
1675997051,9,6,False,False,别的什么都不说，这些B员工拿着你的1.34W工资，报销还给你搞200一天标准，真的有点不是人了。我好歹也是出差大江南北很多地方了，公司报销额度260，我出差也能赚150左右一天。（公司额度，也算一个出差小补贴PS坐标杭州临平区）给你报200一天的人，你还能留？最后说一点，其实嘛，UP主做透明化收入支出这一点出发点是好的，但是透明的不完善总会被人抓着很多漏洞，到后来只会越描越黑。要不就严谨到底，要不就不做回应。
1675940163,0,6,False,False,你是真勇士，弄水果渠道挺多人利益相关的
1675938038,0,6,False,False,做好事就论迹不论心
1675937731,6,6,False,False,虽然但是，还是想听听农民故事，好几个视频都是在说自己助农的事，都是在夸自己啊。。。。。
1675938241,0,5,False,False,没关系，一起支持你呀
1676030540,0,2,False,False,要保护好自己哦
1675936061,0,6,False,False,助农真男人，投俩币回血[星星眼]
1675940333,0,7,False,False,加油，能帮助贫困农民的都是真正的同志，注意安全[加油]
1675938631,0,6,False,False,小七 你好 我是专家 我要说话了
1675952266,0,6,False,False,其实吧   那些相对价高收购水果的  就会导致当地在消费水平不高的情况下失去了  自产区优惠的福利   我们这边就是  外地收购的价高   导致当地小贩进价高卖价高   而且这边还没采摘园  真就是自产区自己吃不起啊   太难了[大哭][大哭][大哭]
1675952031,0,6,False,False,感谢你同志，我也在助农一线，你的视频给我很大启发，我们的目的一定会实现
1675948235,0,6,False,False,"科级，1.5W+，朝九晚五，闲着喝茶。
这个不着家，风吹日晒，为农民做好事，1W不多。。"
1676422037,0,1,False,False,会有越来越多的人支持这项伟大的事业
1675938822,1,6,False,False,该地区暂不支持购买[笑哭]
1675937576,0,6,False,False,小七真的很棒，不要理会网络的zz言论，希望未来越来越好，支持你，加油[给心心][给心心][给心心]
1676390560,0,1,False,False,真厉害，有理想有行动[给心心]
1676368952,2,1,False,False,朋友们请大胆购买。好吃，很甜，就是子多
1675944348,0,11,False,False,挺好，不过违背我赚钱的初衷了，同样作为一个做生意的我挺羡慕你的，能克服人的本能真的很难
1675950835,0,4,False,False,加油    但一定不要做六子
1675935627,0,6,False,False,经用户举报，你的视频质量过高，严重符合观众审美。经审定，我决定对你做出点赞投币收藏的惩罚，以示警告(｀・ω・´)[doge][doge]
1676051469,0,1,False,False,老板，还招人吗，认真的[星星眼]
1675936097,2,10,False,False,有良心道德底线的人做生意，很少能赚到大钱，甚至会赔钱，这和你有多少粉丝没关系。摊子上能赚钱的基本都有鬼称！
1675953644,0,3,False,False,我觉得可以先稍微降低人力成本吧，主要是能赚钱，再考虑把条件住宿车费奖金之类，愿意一起留下来干到销售好起来，可以多给奖金。一直不赚钱很难坚持，做的长久。
1675992134,0,2,False,False,这一斤能在太原买两斤的 还是算了吧
1675953291,0,2,False,False,加油[奥比岛_点赞]
1675953261,0,3,False,False,初心很棒。支持你。我在深入基层，了解过，亲身经历过后才真正明白，人和人不一样。贫困的问题不是贫困，人赚不到认知以外的钱，这些话是什么意思？扶贫和助农不难，但是帮助摆脱贫困和帮助农民增收远比我想的复杂。
1675937748,0,5,False,False,支持！祝愿小七团队越做越好。
1675938693,0,5,False,False,"买过一箱猕猴桃，不过确实没有我买开的翠香好吃[笑哭]
up继续加油。"
1676437425,0,1,False,False,新粉 下单8斤 希望保证质量
1675938411,0,4,False,False,我感觉这个计划有望火起来
1675951186,0,5,False,False,这早就在我的预料之中，做好事儿，永远不可能建立在利益之上，我指的是利益终将无法用来更好的办好事，不是那号人
1675940327,0,5,False,False,清者自清，吾心无愧无悔，即可！支持你，加油！！！[奋斗][奋斗][奋斗]
1675941334,0,4,False,False,希望博主要一直不忘初心哦！
1675942818,0,5,False,False,"人力差旅成本太高了, 都是为了诚信付出的代价！"
1675938653,2,9,False,False,这与六子剖腹验粉有啥区别[微笑]
1675947546,1,5,False,False,"家里做水果批发生意的，我敢说绝大多数，甚至90%的在网上卖水果的价格比线下还贵不少。
同样的货，线下对比能明显看出来，网上就根本不知道。以次充好太普遍了。"
1676025655,0,2,False,False,原来你还保证五险一金，还是可以的呀[支持]
1675952446,0,5,False,False,31.4买了两箱，含泪薅羊毛[委屈]
1675940711,1,5,False,False,大丈夫立于天地间，当为天地立心，为生命立命。这是真的大丈夫[保卫萝卜_哇][保卫萝卜_哇][保卫萝卜_哇]
1675948360,3,8,False,False,“该地区不支持购买”[难过]
1675936078,1,5,False,False,买的今天到 明天拿 买是相信小七  质量好坏明天回来反馈给各位
1675951675,1,5,False,False,“为众人抱薪者，不可使其冻毙于风雪！”不喜欢无偿的善心，会让很多人觉得你是对的，但不会去做！只有让人看到了你们和果农双赢才会让更多有心人去付之行动。
1675936037,1,5,False,False,小七一定要多多小心线上和线下别有用心之人啊！
1675946855,0,5,False,False,能直接落到村民兜里，就值得大赞
1675941265,0,5,False,False,总有人举着光，照亮着前行的路。
1675940300,0,4,False,False,水果就不买了，投两个币，给你回血
1675946310,0,5,False,False,扶贫不光是扶经济，还要扶志气，要善良更要有智慧。这条路不好走
1675942684,0,5,False,False,小七助农的猕猴桃是真的好！！第一次我就想支持一下，没想到会那么好吃！！黄心的猕猴桃中果个头也大！又买了一箱寄到办公室，同事也被安利到了，都下单了一箱，后面还都回购了。我家现在一共买了五箱了，品控真的不错。支持小七鸭
1675953295,0,3,False,False,"虽然没关注过up,也不太了解你们，但咱就只喜欢做实在事的人，看了这个视频，咱感觉up就是这样的人，三连表达一下心意。以后会持续关注你，用爱发电不易，希望你能坚持下去。你坚持，我支持。"
1675940460,0,3,False,False,吓得我赶紧买了个5斤的[笑哭]
1675940181,0,4,False,False,扶贫为己任，小七真男人
1675937062,0,5,False,False,可以跟温暖的冷风那个up主交流一下，他助农做慈善的经验蛮丰富的[打call]加油加油[打call]。
1675950978,0,5,False,False,买过几次小七家的水果，从猕猴桃到沃柑，每次都有很好的体验，良心助农UP主[兔年]真诚是永远的必杀技w
1675942327,0,30,False,False,人民的好朋友，百姓的好帮手。能得此up，幸之！[打call][打call]
1675936006,0,3,False,False,这个币，不要也罢，投了
1675937610,0,5,False,False,武鸣沃柑是真的好吃，我以前在武鸣读高中，放假坐动车回老家都会带一些回去，汁水充盈且甜而不腻，没几天就干完了
1676021212,0,2,False,False,视频看一半，我就去买了[笑哭] UP主成本方面，其实好多都可以省去的。做久了，我相信你肯定能赚钱！
1675939413,2,4,False,False,我关注的倆up主都推了这个水果，价格还不一样[doge]
1675938549,0,3,False,False,加油！两个硬币奉上
1675941765,1,4,False,False,感觉一斤五块多价格确实便宜[永雏塔菲_喵喵拳]
1675944439,0,5,False,False,我做过水果店，我可以用自己亲身经历告诉其他朋友，小七说的蔬果利润基本就是这么样的。很多都是单品在赔钱的
1675938204,0,5,False,False,小七走的这一条路，注定有无数诋毁和谩骂，但仍愿他继续发光发热，敢说这些话的up不多了
1675945790,0,4,False,False,讲究的就是一个真心换真心！[Cat2_CatAMail][不问天_好耶]
1675940559,0,4,False,False,你这波更是个……真正的man，买一点沃柑试一试，不错就给家人买
1675935114,0,5,False,False,那天看到上了沃柑了 马上下单两箱 怎么上新品了都不通知一下 真的过分！！！！！
1675941432,0,3,False,False,我特么直接三连，这是我们的榜样
1675941325,0,3,False,False,支持，视频已三连，刚刚买了8斤，就等着果子到了[脱单doge]。
1675941680,0,2,False,False,强的，支持支持[打call]
1675948738,1,5,False,False,扶贫我绝对支持，我现在就是学生可能做不了什么但是以后会随着前辈的路一起用自己的方式来帮助需要的人
1675940098,2,4,False,False,现在网上买的水果不超过三分之一坏的就算是不错的了
1675942210,0,4,False,False,冰糖橙好好吃！！！！！！！！能不能重新上！！！
1675941829,0,5,False,False,比起某些网络搞捐款的，大家肯定更愿意相信你
1675939914,0,3,False,False,支持小七，之前有些忙，我这边的快递也不太好，现在放开了，我一定支持小七
1675941883,0,2,False,False,支持你小七
1675935694,0,3,False,False,好人难做啊
1675963833,0,6,False,False,做生意务必要赚钱，不然长久不了。虽然我知道助农的过程中自媒体就已经让你得到该有的曝光和收入。但那仅仅是你啊，你可以做表率，去赚钱、这样其他人才会有助农的想法，能赚钱的同时又得到好名声，站着把钱赚了才是靠谱的。小七吾辈楷模，希望越走越远。
1675948929,0,5,False,False,谁不想找一个离家近，工资高的工作？谁愿意一个月就和家人相处不到10天，工资又低，谁做？
1675943169,0,5,False,False,买了5斤。吃了再评价水果的质量。信任不能被辜负。互相的都是
1675935757,1,4,False,False,出一个视频下单一次⌓‿⌓    可惜猕猴桃催熟太难把握一开始的猕猴桃不是没熟就全部过头了。。。
1675935432,2,4,False,False,至少我买了[doge]
1675941518,0,4,False,False,这么清楚的账，我只能下个8斤尝尝了[脱单doge]
1675940534,0,3,False,False,虽然我没下单，但是我三连支持
1675937994,2,10,False,False,高品质的水果其实很贵（至少水果店很贵）
1675935935,1,3,False,False,我买的那三斤比较一般，有的没啥水分，客服退了四分之一
1675991849,0,2,False,False,成本控制下吧。利润说真的不算低了 但肯定不算高。但是做农业 一定要学会省 要不然亏是必须的
1675936870,1,4,False,False,加油吧，这世界良心真的不多了。毕竟被伤害的事情太多
1675940738,0,4,False,False,自己弄这些真的很难，我上一个买过的 鸡鳄计划  已经....
1675940362,0,4,False,False,我能做那匹马吗？我不要1万，你将就给也行，能吃苦[兔年]
1675938531,0,4,False,False,给在老家的父母买了五斤，期待父母的评论[脱单doge]
1675937457,5,15,False,False,等我过两天到学校订一两箱，到时候回来评价
1675944466,0,4,False,False,我没有买，我也没有看完，up很阳光的讲这件事就值得每人2币。如果你看到肯定明白我的意思。我斩钉截铁的说收购价肯定高了。出售价肯定低了。有些人做灰是一定并且不会杜绝的。掌控好并接受无论你做什么都走的更宽阔。
1675942243,2,3,False,False,人工每人每月1.3w，过于离谱。
1675942879,0,2,False,False,[呲牙]下单支持一下
1675938465,2,4,False,False,本来是不相信的，没想到还有后续，看了评论基本都是好评，我也下单试试，如果好吃我会继续下单
1675941427,0,4,False,False,勿以善小而不为，佩服踏实做实事的人
1675940048,0,4,False,False,我是广西本地人，在广西医科大学武鸣校区读大一，武鸣的沃柑真的好吃😋😋😋😋
1676001511,0,2,False,False,[doge]你给我开一万，我带车投奔你，除了意外险以外都不用给我买
1675938543,0,3,False,False,加油，已经买了三斤试试
1675937101,0,4,False,False,希望小七能成功吧  在做一件伟大又很难的事情
1675951321,0,3,False,False,已经下单，看了蛮多你的视频，无理由相信你。
1675935047,0,3,False,False,[2023]
1676036084,0,2,False,False,小七的真心和价值观是我关注支持你的原因，我曾见过无数的人面兽心，但你是在这茫茫人海中的一束光，就如你的名字：灯火君。我希望你的光和热能够更加的温暖，脚踏实地，一步一步的将你的真心传达给每一个人。不要担心，你的努力我们都看在眼里，我们会永远的支持你的。愿你的梦想和努力获得巨大的成功。
1675945833,0,3,False,False,支持家乡！支持小七！[保卫萝卜_笔芯]
1676011778,1,2,False,False,钱都给中间的人赚走了。你以为助农了 笑死
1675944790,0,4,False,False,"加油，为老百姓干实事的都是好同志！
不过希望up更快找到更多的优质的助农水果，现在只有一款沃柑在卖，也想买一点，但橘子容易上火，自己又血热，不清楚沃柑上不上火。[脸红]"
1676011643,8,2,False,False,还是处理方式有问题，为什么不找当地人做，或者直接招聘去当地负责这个事，这样成本至少降一半，你们几个拿高薪的人来回跑，不讲效率低下，经验也没有，怎么可能赚钱
1675941281,0,4,False,False,"看到一半忍不住下单了，让我尝尝啥味[吃瓜]
要是好吃我就推给我家人[保卫萝卜_哇]"
1675966246,1,2,False,False,坚定的无产主义理想者，支持你。
1675950467,2,3,False,False,买过，要自己买苹果啥的催熟，放久了又干又b瘪不甜。
1676030186,0,2,False,False,好人就应该多赚钱，这样才能帮助更多的人！
1675939867,0,4,False,False,希望小七和团队成员合理休息，别太累[打call][打call][打call]
1675938923,0,3,False,False,买了5斤，比我楼下8块一斤的甜多了
1676028859,0,2,False,False,去年的猕猴桃回购了两次，还寄了一箱给我姐吃，橙子也好吃，皮薄，口感脆甜，近几年网购水果中质量算优质的了，希望up一直保持这种选品，以后我的水果篮子就在这里了，up卖的比水果店实惠多了，不用担心吃不起。
1675938371,0,3,False,False,想要荔枝！[小A和小B_应援][小A和小B_应援][小A和小B_应援]
1675939642,0,3,False,False,小七加油，你和阿立木很像！加油！
1675938954,0,4,False,False,只要有一个像up这样的人，我就会支持他。
1675947722,2,4,False,False,五百万粉丝的up主，愿意用自己的影响力去做这种吃力不赚钱的事情，就应该支持一下。这个粉丝体量，干别的可能年收入早就几十个w了叭。他一个月就给自己算1.3w已经比我想的少多了
1676031636,0,2,False,False,这种视频底下真的能见证物种多样性[星星眼][星星眼][星星眼]
1676010134,0,2,False,False,十年水果人路过，水果行业水深得很，没交过几年学费很难做好，拿沃柑大概的成本来说，产地商超货2-3元，电商货1-2元，包装材料2-3元/件，包装人工0.4-1元/件，快递费3-6元/件，售后成本就看人了
1675945135,0,4,False,False,助农的都好喜欢卖桔子啊，去支持了五斤，真心换真心[脱单doge]
1675938400,0,3,False,False,买了五斤 基本都很甜 水分足[支持]
1675935838,0,3,False,False,买不了水果，所以只能投币支持了[保卫萝卜_哇]
1675945697,0,3,False,False,刚点开链接，买了八斤，这个价格不算贵，小七是很好很好的up主！
1675939691,0,3,False,False,先下单试试，如果好吃就继续买[打call]
