上传时间,回复数,点赞数,up是否回复,up是否点赞,评论文本
1676425944,34,365,True,True,看到T君T酱的这个视频就忍不住让我分享与女友的相处经历，女友是一个共情能力非常强的高敏感人，她是一个看完陈朵篇泪流满面的人，也是一个在我发牢骚的时候感受到我的委屈暗自落泪的人。作为男友，我了解了她的过去，深度思考了她可能存在的痛点是缺乏安全感，我愿意为她做到与异性不闲聊不暧昧，爱情公开社交媒体无隐私。在所有我们闹不开心的经历中，都是我对她的语气和表情敏感性不够或者过于敏感导致的，这个度需要在长久的恋爱经历中慢慢的去把握，自己的女孩一定要自己来宠。像T君T酱所说的，智性型的人可能会缺乏浪漫，但是我认为哈，作为恋爱关系中的一方应该多思考如何让自己的另一半开心，浪漫就是其中最关键的一环。我会在冬天给她织手工围巾、给她叠1314个千纸鹤、每逢节日鲜花必不可少、给她辫手绳等等等，目前正在做拾柒的书嘿嘿（ps:她可能会看见这个评论）。如果有幸有人看到了最后，可能认为我的付出太多了，但是这么做的前提完全是因为她值得，她给予我的情绪价值是我人生中的曙光，是我奋斗的动力。每次累了的时候我都知道她永远会在我身边说一句老公辛苦了，亲亲。我爱她，当然怎么做都不会嫌多，甚至永远嫌不够多，上了这么多年学学会的只有如何学习，所以我穷尽自己一身的本领也要学会怎么爱我的女孩。希望大家都可以找到自己心爱的另一半。
1676398487,9,207,True,True,我高敏...天天会为很多事焦虑 看到女性受压迫新闻会担忧 看到韩国偷文化会愤怒 摘口罩后为姥姥的身体焦虑 明明都是个人没法改变的事情 却一直会想怎么解决...把新闻发给对象想要深度讨论 得到的是“别总往自己身上套 不会发生的” 虽然和他考研期间一起奋斗的时光很美好 但是他处处无法共情 感觉真的很难在一起了
1676301662,23,1845,True,True,我觉得我已经遇见了一个智性型的人，在我想不通一些事情并且钻牛角尖的时候开导我，和我一起找解决的办法。我情绪低落不愿意张口说话的时候，他也会开导我，让我表达我的痛苦。有时候他也比较敏感，也会找我倾诉，那时我俩又像是两个敏感心灵在交流。他对我很重要。我很幸运
1676314405,63,795,False,False,高敏感+感情洁癖+纯爱战神+沙雕[脱单doge]
1676307494,26,1029,False,True,大半夜的在情人节前夕看哭了。我是高敏感中的高敏感，所幸谈过的都没有走进t酱说过的两个雷区。现在的男朋友是法国人，也是高敏感中的高敏感，我们俩在一起就像电光火石一样，飞快地相识和相爱，互相照顾，互相理解。今年跨年我和他去海边玩，和他对视时我想到这一年被别人伤害抛弃，而他却用一个眼神就能理解我，治愈我，我哭得泣不成声，而他轻轻抱住我，亲吻我的眼泪，说我哭起来也很美。上个月告诉爸妈他的事，爸妈很反对，一开始我也很迷茫，他也很伤心，导致我们经常争吵，吵架时山崩地裂互相伤害，仿佛回不到以前，但慢慢地我还是看到了我的心，我就是要和我喜欢的人在一起。我明天见他时想跟他复述这个视频，告诉他我们适合，我们相爱。谢谢t酱给我信心。[给心心]
1676333053,10,249,False,False,你和他聊宇宙天空人生 他说宝贝我好困不如早点睡
1676314792,16,300,False,False,刷了下怎么都在夸情绪稳定型啊，你们是真的没有遇到过他们在兴趣爱好艺术追求音乐欣赏审美阅读旅游生活上无法和你共鸣的乏味和无力感。
1676343801,32,343,False,False,已经高敏感了，赶紧离开父母才是第一件事，不是恋爱。高敏感是父母造成的，离开他们直接减少一半，不恋爱就更稳定，恋爱就两个暴躁抑郁两个极点跳跃。谈恋爱快三年还没脱敏，只是变得冷漠和麻木了，还是要先完善自己，爱情救赎不了人，只有自己可以。
1676361670,5,250,False,False,我还挺敏感的，但是感觉自己在逐渐的成熟之中走向了学会情绪稳定 很神奇 既能享受敏感给我的那些细微的美好的感受 然后也会开始尝试去驯服我的感性，用理性去观察我的情绪 稳住自己
1676308591,15,187,True,True,"我也是高敏感人群，喜欢一个女孩到现在已经9年了，当初，她每天找我谈话聊天，我们无话不谈亲密无间，由于我害怕周边的种种原因，一直没有表白，我们的关系变得越来越疏远。
时隔五年，也就是前两天，我不甘心这段感情，鼓起勇气找她表白，她告诉我现在有男朋友，而且最近很忙，今年六月取毕业证。
我问她以前有没有在意过我，喜欢过我，她说是的，我们两个是互相喜欢。
我真的很后悔当初的自己，现在我还是满脑子那个女孩，不知道还有没有机会，不管最后怎样，我已经下定决心等她一辈子，我已经活成了她的影子，只要她转身，我就在身后"
1676441600,0,9,False,True,我爸是第一类，前女友第二类。知道自己毛病多不太适合遇到的大多数人所以多年没谈，但感觉这或许机会遇到合适的。悄悄地尝试石层大海式自我解刨式征友[脸红]本人男，受生活毒打而被脱敏治疗多年。日常处于追求内心平静波澜不惊的状态，但还是容易共情上情绪感动流泪。社会活动时会下意识留意大家的表情和反应。性格随和温柔，熟识后或者睡眠不足时搞笑制杖神经嘴贱卖傻槽点制造机。属猴，硬读北美弱校心理学博士多年无果。外貌普通，曾有少量异性和一名同性追求。擅长烹饪喜欢慢跑和阅读和看化妆视频的头尾。下午天气好会出门散步晒太阳听播客听书。吃饭时会看美剧和新番。喜欢留意人的手指。喜女。
1676347368,0,72,False,False,[兔年]高敏感是世界给我的礼物，因为我可以用一颗跳动的心感受百分百的鲜活的世界。
1676302804,86,1016,False,True,"我是个典型高敏人。讨厌巨大的声音，强烈闪光，共情力MAX，浪漫理想主义者。
然后喜欢上了一个回避型的女孩……
在长达数年的拉锯战中，才慢慢认清了现实。

现在正在学习着接受孤独。

就是想说，如果有类似的情况，觉得不合适的人，还是应该尽早地抽身的。"
1676462869,0,8,False,True,高敏感会在看完《红楼梦》后失落好久走不出来，成长的过程是不断受伤害，不断愈合伤口的过程。世人也许会觉得你明明没有遇到过多少不好事情，为什么会有这么深的情绪感受，为什么觉得受到了莫大的伤害。这个问题也曾经困扰我，会觉得是不是我太敏感了，所以错的是我？我还在慢慢治愈自己中，拥抱受到的痛苦，尝试从好的方面解读记忆。
1676340179,0,36,False,False,我作为一个高敏人给其他朋友包括不是高敏人的朋友一个建议或者说是参考，期待从理想化的爱情或者友情中满足自己的情绪需求其实可以理解，很多高敏人童年时多多少少都有被父母忽视自己情绪的经历，所以长大后在亲密关系中会有补偿心理，但是理想的爱情或者友情都是可遇不可求的。我当然不是说放弃在伴侣和朋友身上满足情绪需求，只是说别人没有共情你的义务，就像楼上说的“找智性恋或者情绪稳定的不是更香吗？为什么要找高敏感的呢？”，所以在我看来，高敏人最重要的课题不是找到属于自己的灵魂伴侣，而是接纳并完善自我，学会自爱。
1676341828,0,42,False,False,原来我和身边的人格格不入不是因为心眼小是因为高敏啊[大哭]原来世界上还有这么多和我一样的朋友[大哭]期待未来和大家的相遇[酸了]
1676342115,26,122,False,False,我觉得我现在是高敏感和智性型的结合体，在小时候可能是纯粹的高敏感，但在随着时间慢慢长大的过程中，我的逻辑能力越来越强，逐渐形成了批判性思维，越来越多智性型人格的特点就在我身上出现了，不知道有没有和我一样的人
1676340204,11,114,False,False,"我是一个高敏感infp,我老公是超稳定智性intp.很多次我情绪没绷住，他都稳稳接住了。而且事后当我又左思右想跟他道歉时，他每次都不许我说了，说他忘了。跟他在一起真的很幸福！"
1676311537,18,48,True,True,"咋说呢，高敏感+心理学就像是个定论一样hhh在留学的时候莫名其妙就转专业到心理学，然后一直持续学习到现在，渐渐的可以帮到身边很多的人，让他们能够了解真实的自己，自己表面需求背后的深层需求到底是什么之类的。
不过缺点也是有的，学得相对以前更深入了之后，对待感情从花花公子变得有些过于谨慎了，每次稍稍有些动心，身体会自动反应让自己的心归位，开始更理智的分析双方的匹配程度...越学越难谈恋爱可太逗了hhhhh"
1676305092,6,60,False,False,智性+稳定型真的是天使中的战斗机[保卫萝卜_哭哭]既能温柔地接纳你，也能很快get到你，还可以很坦率地讨论自己的对方…每天给我一点小小震撼，世界上怎么会有这样厉害的人[保卫萝卜_哭哭]
1676339827,7,120,False,False,其实我觉得现在网友挺“神奇”的，听一件事，看一个视频就把自己带入了，然后觉得说什么都对，自己就这样，就那样，嗯，我觉得，重要的事总要慢慢来，先好好审视自己了，然后再决定要不要踏入一段新的历程，展开一段新的恋情。别人说的，别人给你看的只能是一种参考，最后怎么样还全得靠自己
1676307179,24,225,False,True,我以前就是个高敏感的人，发现被EX PUA以后快速分手，不断看心理方面的课程，我觉得自己已经慢慢转变了，变成了偏稳定和智性型了，所以高敏感的小伙伴不一定要等着这两种类型的伴侣来治愈自己噢，我们也可以自愈的[兔年]
1676383462,1,13,False,False,聊宇宙人生哲学，虽然想法很不成熟，但真的很爽。能聊的人太少了。搞清楚一件事对不同人的利益，性质到底是好是坏，从各个去方面推敲琢磨，很有意思啊。可惜连自己都觉得是不是太牛角尖闲得慌。大家更喜欢感性的处理一件事。
1676337243,0,53,False,True,"高敏的天赋是隐藏型，懂得都懂，总结了几条，欢迎补充[doge]
1.倾听共鸣与陪伴，绝对的小天使
2.陪你探索内心最隐秘的创伤，绝对的灵魂伴侣
3.把对象放在很高的优先级，永远的贴心小棉袄
4.超强的学习能力，精神成长速度快到你跟不上
5.自律的生活方式，沉静的生活方式，给家庭带来稳定的基石"
1676461553,0,4,False,False,高敏感+高共情（+母性？）（不清楚，她们说我有妈妈的感觉），导致我很容易吸引抑郁人群，不是说他们不好，他们也是闪闪发光的存在，我也很爱他们，只是有时候难免被带入情绪漩涡，让我觉得疲惫不堪。再加上过度关注外在，经常性社会评论，容易内耗
1676302494,2,16,False,False,感觉这期视频内容也适合高敏感人对朋友关系的筛选和维持
1676354928,1,24,False,False,我小时候就是高敏感，后来我选择关闭自己的情感通道，能快速体察你的情绪和痛苦，但我就是不和你产生共情，简直不要太爽[tv_目瞪口呆]
1676325846,5,39,False,True,倒是想找，可长期的高敏导致过于在意别人的行为言论，我已经很努力的去学习压抑情绪和表情，可心底里那股惆怅是散不掉的，就怕惹得人家烦。长期的不安全感又学会了伪装，见人说人话见鬼说鬼话，有时候我自己都不知道哪句话是真的哪句是假的，怎么让别人开心怎么来。渴望与别人接触但又喜欢独处，绝了，单着吧，糟心。
1676366277,5,50,False,True,"我高敏感，想找一个稳定和智性的男盆友
22/大四/长沙读大学/预计在长沙考教师编制/重庆人
有想法的可以聊一下[给心心][给心心]"
1676303663,13,326,False,True,"感谢T酱！说的真的太好了。作为曾经的高敏感真的希望自己能早些看到你~
这里插一下我个人早期经历，如果对各位有帮助的话就好了。没帮助请当做我在碎碎念[跪了]
我个人早期真的是高敏感个体，和父母沟通不顺，尤其是我父亲是个很强势的人，他总是以对我好为名指责我各种做不好的地方。小时候会说成绩不好，一定考不过谁是谁，长大了之后因为我比较胖，说你这个谁会要呀之类的。我母亲平时相对来说就比较沉默，不太会回应我的感情。很小的时候，我听我妈妈说，人都会走向死亡，我就抱着她哭。当时是很依恋她的吧，但她好像后来就再也不提这些事情了。我小的时候会经常思考生命意义，一直也没有人能够回应我内心的恐惧。
高中的时候就考到了市里，住宿基本不回家，只有我妈妈每周一次，会过来看我，也不会聊些什么自己的感情啊，想法啊什么的（可能那时候叛逆[笑哭]）。
直到后来在大学，经历了一些自我认同失败，去看过心理医生之后，开始自己学一些心理学的内容，慢慢发现自己遇到的和人相处的问题其实是和原生家庭环境相关，和父母重新建立起链接。
这几年和父母的沟通经历（其实主要是和我妈，我爸那个臭脾气很难沟通orz）让我意识到，很多事并不是我当年想象的那样。妈妈也有很多心里话想对我说，但可能因为她太不理解我，所以就只能保持沉默。她的心里经常装着很多的事情，会因为一些小事纠结很久，也会感到自卑什么的。和父母沟通多了，发现自己这才真正爱上了他们。
就是感觉自己学过了心理学，也在各位亲爱的朋友那里获得了支持，真正做到了成长，反过来看父母曾经的那些语言和行动，才真正理解了他们，对于过去的那些指责批评真正释然了。当然我感觉我也会喜欢高敏感人群，因为，能感受到他人痛苦，这样的人大多会选择善良，这样的好孩子谁不爱呢。
最后想补充的就是说，我有一次出去修手机，正好认识了那个修手机的师傅和我性格各方面都很像。坐下来聊天之后，他一边修，一边和我聊起他的孩子的事迹。孩子虽然学习不好（他家家庭条件属实不太好，这位师傅也出身不太好），我听完之后觉得孩子真的很善良，愿意帮忙免费辅导孩子学习。当时心里想的其实就是隐隐约约觉得，想见见非打击式教育长大的孩子（这个父亲很会教孩子做人），也愿意为之助力，把自己的一部分投射到这个孩子身上，也让自己在这个过程中获得成长。这项事业确实收获很多，也获得了很多朋友，家里人的支持。（谢谢大家看到这里[拥抱]）"
1676316626,4,77,False,True,高敏感的人 极度浪漫主义 强大的共情力 不想改变了 我一定会遇到合适自己的男孩
1676339806,0,7,False,False,本高敏感人欢欢喜喜摸鱼回来，在情人节的大早上，刷到这个视频，像是一条路过的狗莫名其妙被踢了一脚[阴险]
1676375268,2,12,True,False,怎么改标题了，本来想分享给父母让他们别催婚的[笑哭]
1676336395,98,260,False,False,可是，智性型的和稳定型的是六边战士吧，它们这么好为什么要选你高敏型接受你情绪呢。[doge]
1676342365,5,14,False,False,我是高敏x智性x稳定三个都有些...woc，原来我自己才是自己最适合的交往对象?[来古-疑问][来古-疑问][来古-疑问]
1676348644,9,22,False,False,听我的兄弟们，远离高敏感人群，真的很累，普通人搞不定的，到头来伤了他人自己也累[微笑]
1676341328,0,42,False,False,我等太久了，自己已经成了个情绪稳定的人了，99%的情况下，都是第一时间解决问题
1676301260,5,87,False,False,以我自己的经验，高敏感也会成为自恋型。两个高敏感在一起付出更少、更被动的那个有可能变得像自恋型[笑哭]
1676312394,0,7,False,False,在别人面前他是谦卑忍让的。但在我面前他总是贬低某些人或事，他总是推卸责任，他总是抬高音量，他总是妄图控制我。只要我想，我总能将他的问题一步步显露出来，拿捏他弱小而脆弱的自尊。只是在最后，他总会用：“我可是你父亲！”“你不会忘了是谁养的你吧！”这样的话来结束我对他的质疑与反抗。十几年了，他还是没变。我不由得想起他说的那句：“我上了年纪了，不会变了，要改变的是你！”他说这话时，眼神中好像带着恳求吧。可我也是不会轻易改变的。是他教我要明辨是非，可他从来没有清楚地指出过我错在哪了。我不明白，为什么只有顺从他，贬低我，才是正确的。我不是他，他不是我！十几年了，我一直坚称我没错，就和他一样。
1676301689,1,12,False,False,有一种一直为别人想的思维方式。我感觉渐渐的不知道自己是什么了。。。
1676341067,6,35,False,False,一个高敏感恋爱前，请先调查对方父母相处方式，是习惯性争吵还是和和美美。如果是前者，大概率对方不会对你有太多耐心，因为看到你就跟看到他的未来和父母一样，让他烦。
1676366394,1,6,True,True,呜呜呜 TT的视频为啥每次都这么戳我 搞得我看完接下来要讲的问题就想狂按三连了 世界上有你们也太好了～[给心心]
1676301079,12,213,False,True,真的想找到一个比我大的且成熟的，不求轰轰烈烈只求细水长流[大哭]
1676306311,41,64,True,True,艹，我直接在评论区相亲[脱单doge]
1676355663,0,11,False,False,看的想哭，感觉得到了救赎，我以前真的是纯粹的高敏感，现在平时会有更多理智的时候，事情在变的更好，期待up出后续的那4个问题[打call]
1676384520,0,3,False,False,巧了我也是，但是我是由于被校园暴力的童年阴影才导致对朋友及以上关系极不信任（跟父母的感情倒是特别好），之前也不是没追求过异性，但是总是被莫名疏离，我搞不清楚缘由，于是我才学了哲学和心理学。不过现在说这些已经没用啦，我已经决心跨性别成为一个女孩子啦，在我的心里女性是代表美好的形象，我希望我能以自己理想的身份活着。
1676392109,1,3,True,True,谢谢阿婆主，又一个失眠的晚上再次被治愈
1676302608,3,20,False,False,本高敏感人，正在经受感情里的痛苦，而对方却一直逃避听我讲，渴望他能和我一起去看见甚至和我的高敏感特性共存，可他却说，那是你自己的问题，又不是我造成的，不要把这些带给他。
1676348109,0,8,False,False,我感觉自己是高敏感+智性+稳定型人格，但身边的人又大多数是低敏型的人格，感觉这辈子有点难找到伴侣了
1676395602,0,3,False,True,今天和朋友还在讨论这个 一直觉得高敏感的人共情能力很强 捕捉生活的信息能力也很强 但是高敏感的人也容易内耗 不过不要难过哦 这是属于自己的特色 加油 反正infp真的很喜欢高敏感人 做一个敏感加钝感的人吧
1676301445,0,5,False,False,是的，世界上没有任何一个人值得我们委屈自己。
1676404226,2,5,False,False,"高敏真的很容易精神内耗今天已经看了一天关于如何解决这个问题的视频，自己总结了一些规律（虽然很乱，但是希望能有用吧：
放空思想 学习/看书 想到既行动 安静的音乐 脑子里的想法不是我自己 
王明阳心学：分开事实与看法 
不要再机械性地刷首页了，试着分析自己的欲望，想看游戏实况就搜游戏实况，想看美食视频就搜美食视频，不知道想看什么就去做一些别的有意义的事情。找准自己的欲望目标，而不是一遍又一遍的刷新首页浪费你的时间。看视频是如此，做别的事情也是如此，先有目标再行动可以增加你每天的有效时间"
1676305456,16,18,False,False,我想说：最适合的应该是情绪稳定的高敏感[doge]
1676388384,0,3,False,False,我遇见了一个高敏感/善于思考/安全型三种特质都有的人，但对方是个男的[辣眼睛]
1676374767,1,3,False,False,现在才发现自己条条都中，一直不是很喜欢敏感的自己，高敏感高自卑，但是骨子里又慕强，会在能力范围内做到最好！工作常常被夸，可是生活状态很不满意。什么时候能遇到那个理解又爱我的人呢？快绝望了[奥比岛_委屈]
1676364053,1,4,False,False,很奇怪，我是infp+回避，但我就是对那种呆呆的人会感兴趣，并且总会被他那令人担忧的共情能力气到，但很快就翻篇了。反而对于情商高情绪稳定的人，虽然像男妈妈一样包容关照我，但是就是觉得他有点无聊...
1676346549,0,4,False,False,爱上了一个不合适的人就是在消灭自我
1676395222,0,3,False,True,好可爱啊，后半那三种cp
1676392924,0,3,False,False,我感觉我总遇到爱教育我的对象，情绪低落的时候总会特别理智地让我多去想想世界上还有很多不如我，吃不饱饭的人。哎，其实，我只是希望自己的情绪能够被看见，被承认罢了，而不是一上来就教育我，告诉我我的情绪有多不合理。[tv_难过][tv_难过][tv_难过][tv_难过]
1676350381,0,7,False,False,所以要两个付出型的在一起，那是最幸福的。
1676338375,7,7,False,False,今天情人节啦，28岁的牡丹从来没收到过情人节礼物，有人要我送礼物吗？(伸手)[脱单doge]
1676322509,0,13,False,True,高敏感，哭了，被人理解倾听超棒的
1676343611,0,3,False,False,我在这里可以给各位想爱的高敏感er找另一半提供一个思路，借住高敏感敏锐的洞察力和强大的大脑处理信息能力，去观察和模仿前两类相克的特点吸引同类人，但是用后面三种适合高敏的方法去对待他们实现一条龙服务[脱单doge]
1676344501,0,9,False,False,"不管什么人都不应该随便找个人结婚！
这个标题欸。。。潜意识暗示下，多少人又开始对号入坐 自己给自己贴标签[辣眼睛]
看了不少评论都在自己找理由 pua自己而已"
1676316219,9,16,False,True,可以相个亲，本人（女）不止敏感，还焦虑型依恋人格障碍，二十多了[妙啊]恋爱里没有分手这个词，你敢甩我我就敢跟你同归于尽
1676320879,0,17,False,True,我们就是两个高敏感 两个infp 在一起十几年 一直在互相刺激成长 能在收到刺激的时候有共鸣并一起成长 真的太重要了 不然吵架永远在第一层有什么意思
1676331714,0,7,False,False,爱情成功的定义从来不是确认关系或者进入婚姻，而是自我认知和成长
1676361385,4,4,False,False,"有一次在一个小群里聊天，都是我现实认识见过面的朋友。
聊着聊着我了解到A女生经常熬夜两三点才睡，但我觉得她几乎没有黑眼圈，我就说：羡慕啊，天天熬夜没黑眼圈，我只是偶尔熬都有。
此时B女生（确实黑眼圈比较明显）（对我说）：你就是想说我有眼圈呗。
我：。。。。。。

你们怎么看。[笑哭]"
1676301210,1,9,False,True,在迷茫与什么样的人恋爱之前，对现阶段是否需要恋爱已经陷入迷茫了
1676337255,4,6,False,False,"作为一个回避，感觉回避型也不适合高敏QwQ……有点被逼疯和想远离的感觉。接不住细腻的情绪，甚至会觉得莫名其妙；也无力承担炽烈的爱和追求，更经不起纠缠。
心路历程may be：
1.没人有资格要求我们共情不是吗？
2.高敏既然自诩会共情，是不是也应该共情回避被折磨的难受？
3.心理学上，我能理解高敏感和回避过得都不容易，或许我们真的很难互相共情。或许T酱有什么更温柔的见解或者解决方法吗？"
1676358725,0,4,False,False,所以非高敏感的人为什么要找一个高敏感的人做伴侣呢？无时无刻都在小心翼翼的对方相处不会很累吗。
1676307899,0,7,False,False,我就是高敏感人群，就是想和另一半耳鬓厮磨，但是我也是智恋型人格，希望在一段关系里能让自己和对方更加优秀，长久稳定的给对方爱。
1676341883,3,25,False,False,高敏感男生已经变为高兼容男生了
1676412669,1,2,True,True,谢谢T酱，被治愈了呜呜
1676376403,0,4,False,False,up请问可以出一期关于建议里面自我安慰的方法专题吗？虽然不太懂但是感觉会很有用[星星眼]
1676428285,0,2,False,False,intp，一点小事想很多，敏感。前任不能给我安全感嫌我烦人。基本没可能有人能理解我。与其失望还不如一个人
1676431831,2,2,False,False,我自己是个智性型高敏感，只要一敏感就用逻辑分析，所以我情绪很稳定，但是也从来没有遇见合适的人……
