上传时间,回复数,点赞数,up是否回复,up是否点赞,评论文本
1676332878,1,5,False,False,作为讨好型人格，经历过背叛，也经历过和我在一起不是因为喜欢，一直想不明白为什么会这样，直到以我自己为实验对象去分析问题。但是不管怎么样，我觉得起码在我那个时候我对的起她们。现在只想找个能带我飞的姐姐，一起努力[脱单doge]
1676324517,3,17,False,True,高敏感真的是一种天赋啊[给心心]
1676329832,0,3,False,False,大家都这么忙着给自己立情人节人设么
1676462726,0,2,False,False,偶尔高敏感，但我觉得自己调整的还比较快。大概是因为小时候是留守儿童吧。
1676332139,6,3,False,False,证个对象。本人女，22，学的美术，打算从事原画。容易生气且高敏，相处中可能会发生冲突，但目的是想要解决问题。所以希望未来的你并不是习惯回避问题的类型，我们都奔着一个更好的方向协同进步，不断调整彼此的相处方式。如果不合适我也会给给予明确答复。[脱单doge]
1676339000,0,15,False,False,去找一个愿意理解，愿意包容的人。也许你们爱好不一样，想法不一样，但是会愿意好好的去说，你想去哪里我也想陪你去，哪怕我根本不感兴趣，因为我感兴趣的是你
1676313822,0,5,False,False,我不会伤害任何人，但会很谨慎的挑人
1676347125,1,5,False,False,我个人认为还是理性看待事物吧，大家千万不要为了高敏感而高敏感，在很多事情上往往理智更加明智
1676343506,0,4,False,False,只要不喝毒鸡汤，互相理解，平等相处，就无所谓高敏感。
1676455592,0,2,False,False,学会了，这就找对象，女🉑，男可，只网恋不奔现。
1676363264,0,2,False,False,我就偏智性恋一点，但感觉现实中符合我心中那种很有智慧的人太少了，我宁可单着
1676354377,6,4,False,False,我是属于理性的。但我到现在就没有遇见过能和我深入交流，能聊得起的。确实，有些事情很敏感。但我也确实会有耐心。如果有相似的可以联系一下，至少聊聊天挺不错的。
1676343076,2,4,False,False,人是极其复杂的，往往一个人各方面都会有点，不要太带入了
1676334764,0,10,False,False,高敏很容易被小人缠上，朋友都如此，恋爱更不能提及了。
1676372585,2,2,False,True,"征个友[脱单doge]坐标北京，高敏感+感情洁癖+纯爱战神+沙雕（谢谢 693念，复制的ta的评论）
没谈过，但是因为前两种类型受过伤"
1676324923,0,4,False,True,高敏+1呀！ 好想认识高敏/智慧型的人
1676349949,3,4,False,False,可我是男的，怎么可能有智性型女的喜欢我这个内心敏感的呢。。[脸红][脱单doge]
1676431445,2,2,False,False,不要结婚不要结婚不要结婚，同时什么都别干
1676338750,0,4,False,False,有的“障碍”自己过得很爽，还能轻松拿捏别人。有的障碍一辈子都难受[大哭]
1676447302,1,2,False,False,女友回避型依恋＋高敏感，怎么破[蛆音娘_扶额][蛆音娘_扶额]
1676358981,3,2,False,False,为什么我就没遇到过高敏感的男孩子啊啊啊！甚至怀疑身边一个高敏都没有，就我一个这么特殊，每天一定需要独处，对入睡环境很苛刻，讨厌无效社交，却找了个24h值班的工作，简直太难受了TAT
1676336117,0,2,False,False,呀 好有道理 感觉自己之前唯一努力去喜欢过的人就是回避型…好累啊 所以我后面很干脆的跟对方say goodbye了[喜极而泣][笑哭]
1676455343,0,2,False,False,我一个男的高敏感都不知道该怎么找女朋友好[笑哭][笑哭][笑哭]
1676350160,2,2,False,False,谢谢T君T酱，这是我收到的最好的成长的礼物了[爱心][爱心][爱心]
1676360996,0,3,False,False,up讲的很细致，我也想用自己的情感经历做一些补充。up描述了高敏人群的性格特质，但我认为人的性格是很复杂的不能用某一种来对号入座，性格也会跟随阅历而改变，每个阶段都要关注自己的情绪来相应调整。我自己是经历了从高敏→npd→eup+npd 我在童年时期为了更多被关注到一直努力做个听话的孩子，不断压抑自己的情感。后期也因为把对情感的期待放在爱情当中，注定了几段感情的失败。高敏很容易爱上抽象的人而不是具体的人，很容易把自己对情感的期待和想象投射到伴侣身上，最后两败俱伤。我在高敏时期遇到的恋人也是高敏，如果能共情的点在一起非常容易轰轰烈烈。但人是很难长期同频的，每个人都有自己要做的事，一旦这个点不在一起了，高敏和高敏只能激发出双方负面的情绪。在这个阶段的恋人因为比我还敏，讨好型人格，导致我发展成了npd[无语]我在npd阶段有些自暴自弃式的把自己常年得不到满足的情感以pua的形式发泄在当时的伴侣身上，这点非常不好。因为我有重郁那段时间有着混沌的清醒感，一边知道自己不做人一遍又很享受对伴侣的掌控感[难过]但这种掌控感依然没有让我得到情感上的满足。只能说遇到就跑吧，不要想着纯npd会看到你的付出，他们只会觉得是理所当然。接着遇到了一位稳定型恋人，最开始真的是被他的情绪稳定所折服。他不在乎会不会被掌控，会安静地陪着我，每次我情绪崩溃他都可以分析出原因，但诚如up所言，时间久了就像喇嘛念经非常无趣...很多时候我只是想要情感上的共情而不是讲道理。各种情感上的挫败使我不仅对感情失望也对自己失望，渐渐地不再回应别人的感情又变成了章鱼哥[无语]因为我有重度抑郁，在npd和章鱼哥的同时又很敏感，导致我非常矛盾，白天在自恋和虚无主义切换晚上又是高敏。好在最后遇到了我现在的伴侣，一个智性型的男妈妈。虽然性格爱好完全不同，但他发自内心欣赏我的艺术性和生命力（崩溃起来要死要活他从来没见过笑死），喜欢跟我一起旅行和探索，有情绪问题就追着我吵架然后解决直到和好，相处非常愉快。在我个人目前所有的经历里所得出的结论就是不论是什么性格的人，谈恋爱的重点在于“谈”，要有有来有往的情感交流，如果只是单方输出，那大概率三观就是不合的，这种情况及时止损吧。正如up所说世界上没有完美的伴侣，两个人长久的相处必然需要双方的不断沟通与妥协。好的感情是会让人状态越来越好的，而不是不断消耗。
1676301255,0,5,False,False,俺是智性型，居然适合高敏呢🤔
1676335063,0,3,False,False,高敏感的容易抑郁[热]，尤其是怀孕的时候
1676307794,0,13,False,True,up讲的太好了，我就是高敏感，现在越来越觉得有很多优势
1676370290,0,2,False,False,t酱这期的妆发造型干净清爽，很好看[牛年]
1676313885,0,4,False,False,谁都不要随便找个人结婚（严肃）
1676304489,0,2,False,False,"我发布了一篇笔记，快来看看吧
我发布了一篇笔记，快来看看吧~
https://www.bilibili.com/h5/note-app/view?cvid=21810490&pagefrom=comment&richtext=true"
1676342703,1,4,False,False,"我发布了一篇笔记，快来看看吧
我发布了一篇笔记，快来看看吧~
https://www.bilibili.com/h5/note-app/view?cvid=21815605&pagefrom=comment&richtext=true"
1676344112,0,2,False,False,t酱，我要说这期的服饰真得很适合你，给人焕然一新的感觉。:)
1676318157,1,3,False,False,高敏感跟高敏感在一起就好了吧，我想要一个高敏感男友
1676310648,1,7,True,True,谢谢你 非常感谢[大哭]
1676307273,8,57,False,True,看完眼泪忍不住，我错了，我因为把我们的关系说给父母听，却没能得到想听到的期待，防疫工作弄得当时自己一直开着手机，听到信息的声音直接PTSD。但是，我真的不想把自己的负面情绪给她，微信弹出来的信息除了工作就是任务，我真的不会微信聊天，只想见面看你的样子，看你开心，看你眼睛。屯的年假想我们一起出去走走的，我那天真的很难受，身体和精神真的很累，直接一整个人躲起来，却心底里期待下次见面能说出来，却让你气的说了些伤自尊的话。也许本不是这个意思，但我心底里真的希望你能见到我的异常，能问问我怎么了，而不是一来就说这些。我当时也真的失望和生气，觉得在感情里很卑微，感觉自己给的时间什么都不是。分开了，你也很快遇到更好的人了，我知道我很普通，甚至普通都算不上，普通人还能改个造型，能离你更近。我梦寐以求的能和你上下班，听着喜欢的歌，他人唾手可得。我也希望我有正常的自拍，有去别的地方旅游，再分享给你。但当时真的走不了，我对你做设计的工作，对生活的态度，不仅是喜欢，更是欣赏，你在我眼里的美丽是最不值得提的优点。从什么时候起你开始把emo说得更多给我，把我的穿着，化妆的不足要求我等等，我都在适应着做，毕竟以往自己没如此注意。但有时我也累了，真的需要消化下自己的情绪，需要跑个步，看看书，好明天再继续。5年前遇到你的那一刻，真的就像昨天一样，你却总觉得只是和我聊天的话题。其实你在我身边，认真的样子，是最最最美丽的画面，我当时怎么都拍不出来。很抱歉没能理解你在感情里的压力，也许你也有自己的过去导致你总觉得没有安全感吧，我当时真的好想换到你身边工作，或者把你接到身边来。但已经没机会说了。当时分开都希望你能离开我之后变得像我们在一起之前那样开心，是我太高估自己的承受能力了，朋友只是我以为能维持在你身边的借口。我现在真的说不出来能祝你幸福，身边好多都是和你一起去过的地方，我真的好想你，这真的不是一个话题，不是你问我然后想得到满意答案的问题，是真的很想你，不想只能隔着屏幕看你。
1676301498,2,29,True,True,谢谢up主 戳到我的心底了
1676303278,3,4,False,False,我都弄不清自己是不是高敏了，大脑每时每刻都在思来想去内耗，麻木又让我变的处理某些事极度的理智、冷血，感觉自己就像两个人一样[灵魂出窍]
1676339373,0,3,False,False,我曾经想帮助别人，然后发现高敏感其实是我自己。最后选择放下助人情节，尊重他人命运[OK][OK]
1676302102,2,4,False,False,我之前以为自己不是高敏感的人，但是遇到智性型现任之后才了解到，我不是不敏感，只是自己都没察觉到自己不开心已经外化表现出来，以为自己隐藏的很好。现在另一半会把所有的可能性都想到并跟我沟通，随时发觉我不开心的小情绪并进行疏导，真是太好了[打call]
1676335344,1,9,False,False,有时候晚上睡不着想到10年前自己做的一件尴尬的事，或因年龄限制做出的稚嫩行为，都会涌上止不住的难堪和后悔，不知道旁人如何，我自己却是无法宽宥自己。很讨厌心软敏感的自己，明明很多时候做自己就好了，情绪每次还是会被他人左右。
1676359395,1,2,False,False,下面评论对高敏人还是有很多偏见，越是这样的环境，越不想跟自以为是的人类接触。说幼稚也好情绪小孩也罢，我不觉得别人的性格就是完美，也有很多让我接受不了的地方，比如我可以用我的共情力为你考虑，但是你不行[脸红]爱与被爱是相互的
1676344237,0,4,False,False,高敏感但是不成熟的人也是很麻烦的，这样的人在感情中会很缠人，非常容易吃醋吵架，慎交往之
1676301728,0,4,False,False,能碰到有共同话题的人就知足了，不祈求太多，活着真心累。
1676342695,2,3,False,False,我是属于高敏感人群，但后天的思考导致了我拥有智性型和情绪稳定型的特质，看来我非常适合去找一个高敏感的人作为伴侣。
1676337986,1,8,False,False,和高敏性格的人相处一般人很难不被烦死。只有情商特别高特别有耐心的可以处下去了…但这种人太少了。
1676301378,0,9,False,False,遇不到就独身，，觉得不舒服就断掉，，助人助己
1676301266,1,11,True,True,t酱的衣服好好看~
1676391604,0,2,False,True,我真的好喜欢智性恋人[大哭][大哭][大哭]
1676302784,1,3,False,False,高敏的我已经被慢慢磨成低敏了
1676338148,0,3,False,False,我的建议是看半佛前段时间出的一期，成年人只筛选不改变才是真理
1676301087,0,4,False,True,高敏感和情绪不稳定可不是一回事
1676302485,0,3,False,False,NPD不适合做恋人，更不适合做朋友！！因为成为恋人门槛更高一些，做朋友可能会更隐形地剥削你（血泪教训[委屈][委屈]
1676343355,1,10,False,False,单身会上瘾
1676302988,0,3,False,False,智性型真的是致命吸引[喜欢]我纠结很久的事情，他一句话，四两拨千斤。为什么呀为什么他这么厉害！但是没办法在一起。出了学校可能也很难再遇到了[大哭]所以提问！我可不可以自己分裂出一个的智性型的人格？自己吸引自己！？
1676301082,1,8,False,True,高敏感和情绪不稳定没关系，被黑惨啦，只是比较容易低落沉默罢啦。生气看起来也没有杀伤力
1676331279,0,3,False,False,在这个世界痛苦的挣扎最后还是决定保持我的高敏，它已经成为我的一部分感知力了，在我隔绝掉的那一瞬间觉得自己的灵魂空落落的。如果我从未体验过也许我并不在乎，但是我曾拥有过能更深刻感知这个世界的能力，我没有办法放弃它。
1676301469,0,3,False,False,啊！我身边就有高敏感的女性＋NPD的男性这样的伴侣组合，两个字总结：折磨，无休止的折磨。还是单方面对高敏感的折磨，无休止的负能量和言语暴力[捂脸][无语]
1676349409,0,3,False,False,贾宝玉和林黛玉
1676313152,1,15,False,True,原来我是高敏感，怪不得智型或男妈妈类型吸引我
1676333190,0,3,False,False,up的经历真的能找到自己的影子，不论什么伴侣，我们都要爱自己[兔年]
1676302271,4,51,False,False,不了解高敏感的家人们，可以看看我们早期的这个视频https://b23.tv/BV1w3411q7yX
1676354380,3,2,False,False,问题是怎么找呀，坐标北京[脱单doge]
1676316615,3,6,False,False,高敏男生，经历一次感情创伤之后觉得很难过，以为自己永远走不出来的时候 遇到了现任 感觉生活都因她变得活泼起来 经常感叹自己的幸运， 以前的我经常会想要在网上搜索HSP相关的书籍，视频去了解探索自己，给自己说以后一定是找一个和自己一样的HSP，直到遇到她后发现生活变简单了 没有那么多过多的想法了 不会再陷入深度猜疑了 一些高敏的属性感觉都被覆盖掉了 我发现也许我需要的就是一个“直球式”的恋爱
1676301831,2,7,False,True,呜呜，本高敏感人流泪了😭
1676346807,2,27,False,False,评论区狠狠的感同身受了，高敏感高共情的特质既是一种天赋，也是一种高唤醒的痛觉，总是不自觉保护自己的动作真叫人心疼啊[大哭]
1676301073,0,6,False,True,高敏感真的会很痛苦
1676335879,3,20,False,False,我是高敏感人，但我有时会陷入精神内耗。在处理人际关系时如果对方没能给我足够的安全感，我真的容易多想，我好怕他们和我相处起来很累，所以有时如果对方对我冷淡后退1步，我就会识趣的走完剩下99步。但我又觉得高敏感是一种天赋，超强的共情能力和洞察情绪的能力更会体贴别人的感受。虽然我还没遇到那个适合我的他，但是很感谢我的朋友们，他们很照顾我的情绪，我爱他们！！！呜呜呜，我还能遇到真正能理解我给我足够安全感把我抱在怀里的他吗好想哭哭[大哭][大哭][大哭]
1676301584,1,13,False,True,高敏感集合[doge]
1676340670,0,2,False,False,我是infp 高敏感。还好我自私没怎么受过情伤[脱单doge]
1676302691,0,6,False,False,一打开被t的小背心美不活了[打call]
1676326713,2,6,False,False,但是自恋型人格确实很迷人呐，受伤小狗谁能拒绝啊[大哭]，如果是自恋但内心深处敏感又善良的attention seeker我简直爱死[星星眼]
1676301215,0,4,False,True,我就是高敏感人[笑哭]，好累
1676332294,0,2,False,False,我前任是个NPD处女座[翻白眼]恶心死了，pua我两年，我跑的太晚
1676330210,3,11,False,False,"人是可以自我成長的，不要被某一類型給限定好吧

雖然大多數人都選擇不成長就是了"
1676378086,0,3,False,False,现在就是担心以后遇不到人了。。。很害怕自己只能孤独下去，遇不到双向的，真心是因为喜欢才在一起的人。。。
1676345260,0,3,False,False,算了，太累了，也许我遇不到了，无所谓了
1676400246,0,2,False,False,评论区有没有适合高敏感的类型一起发展下[脱单doge]给彼此一个机会
1676419136,0,2,False,True,heat shot protein
1676434193,0,1,False,False,其实我觉得说来说去还是性格偏见的问题。只要你足够的感同身受，不要总是待在自己的舒适区，那么你跟任何人都能相处的比较融洽，当然前提是对方是一个性格“正常”的人。比如你是一个容易情绪化的人，那你就要了解情绪化人的缺点，影响别人的心态，破坏情感，这样你也能理解当别人接受不了你的情绪时你能更容易想开一点。相反的，如果你是一个能够控制情绪的人，你也应该明白控制情绪人的缺点，压抑自己不得到释放，不能共情别人的情绪，那么当矛盾来临你也能反思自己的错误。同样的，高敏感人群比任何人清楚高敏感人群的缺点，那么你就要走出舒适区，别总是逃避，强迫自己变得潇洒豁达一点，不拘小节一点，不要总是过度揣摩别人的心思，过度防备，让真正对你好的人受到伤害，高敏感人群无法拥有亲密关系几乎都是因为自己的敏感让别人受到伤害无法靠近，敏感的人让自己痛苦，也更容易让别人感到窒息。相反神经大条的人也要走出自己的舒适区，多察言观色，体谅别人的情绪，认真对待别人的感受，不要总是一副我心胸开阔无所吊谓的样子，忽视身边人的感受只会让别人觉得你是个自恋狂，而且这样的人对待家庭比高敏感人群更加恐怖。
1676302073,2,7,False,False,高敏人泪目，暧昧对方也是高敏但是会感觉在处世上不太成熟，害怕受伤不敢戳破暧昧泡泡了……好不安……
1676431100,0,1,False,False,曾经也想找一个性格互补的人，开朗的，社交能力强的，后来慢慢意识到，好像我需要找一个跟我差不多的人，相处可能会更舒服一点。
1676462550,0,1,False,False,"很喜欢你的每句：世界和我爱着你
“人类的救赎，经由爱而成于爱”"
1676303377,1,7,False,False,有一个高敏感的对象……[无语]唉 只能说，尽量别找这种的吧 你以为他温柔体贴，实际上负面的地方会让你崩溃
1676345931,0,2,False,False,不光是伴侣，选朋友也一样
1676349104,0,2,False,False,母胎单身[打call][打call]
1676432097,0,1,False,False,我高敏感＋情绪稳定。高敏感在 暗恋的人谈之前一周就能察觉出现情况了🤔。情绪稳定在 我当天就立刻能预测这俩一年必分😄，然后我就该吃吃该玩玩——然后他俩就真分了。
1676480556,0,1,False,False,"本人intp加高敏感加4号人格
本人喜欢音乐物理但学艺术的
一直极致理智和极致感性中来回穿梭很难受"
1676320367,0,2,False,False,我只会直球……
1676306510,5,6,False,True,还好我女朋友是长腿大姐姐类型的，温柔有耐心宠我还多金，唯一难受的是我跟她上班和休息的时间是错开的[笑哭]
1676386319,0,1,False,False,确实，我曾经有一个朋友就是NPD，特别以自我为中心，不把别人的感受放在眼里，说话经常戳人痛处，从来得不到她的肯定而是指责和否定，颐指气使还高傲，跟她在一起的每天都很痛苦 幸亏及时止损了[微笑]
1676407258,1,1,False,False,自己正在努力克服过去因高敏感带来的创伤，然后感觉自我学习后新生出的特性就像是智性型的诶，这算啥，自己治愈自己，自己爱自己？[笑哭]这难道是顶级单身狗的自我修养？[思考]
1676375739,0,2,False,False,我只想遇到一个镜子一样的对方
1676435087,0,1,False,False,高敏，但是自从高中开始有意识训练自己的钝感力，以至于有时候过于理性冷漠但又事后痛苦
1676428444,0,1,False,False,还是会共情、内耗，只能说是接受自己，在慢慢长大吧
1676393913,0,1,False,False,可是我好羡慕高敏感的人啊！虽然他们恋爱里可能会作天作地，但是好像很轻而易举就能找到爱他们的另一半，不管是爱说话的还是比较沉默的，不管是长得普通的还是长得好看的，他们就是很容易和别人谈恋爱，我是完全无法，我心里有这种渴望，但是真的等有个男的来爱我，我会挑三拣四，非常疏离，不过对方本来也不太真心就是了，但是有时候会很羡慕，特别是那些能找到又帅又聪明男朋友的女孩，不管她们怎么样，反正就是很羡慕
1676348293,0,2,False,False,好家伙，前任就是这种自恋型，还好我觉得不舒服分手了
1676384587,0,1,False,False,好巧哦，乔峰阿朱，郭靖黄蓉真的就是我唯一想要的理想亲密关系诶！！[星星眼] 想到存在着这样的人，我觉得就值得孤独的等待[给心心]
1676422481,0,1,False,False,谢谢T酱，原来并不是自己不够好，只是不合适而已[拥抱][拥抱]
1676335763,0,4,False,False,老婆高敏型我是极端理智型。生活属于互补。老婆照顾我的生活，我照顾老婆的情绪。
1676374408,0,1,False,False,高敏感，有幸遇到过谈及的三种类型的男朋友。一个高敏感，需要我去稳定他，我接不住。一个稳定＋智性，关注点差得太多，他后来都听不进去我的话。只能说，遇到一个刚刚好的，特别难。
1676369043,2,1,False,False,高敏感是不是活的很累。。我本人就是高敏感，感觉越来越累，看很多事情不顺眼别人都觉得是我有问题[委屈]
1676336803,0,5,False,True,标题这句话可太重要了，前段时间相亲了一个对象，可以说是有点一和二的结合体，本来我第一周相处就已经把他毙掉了，被亲戚父母洗脑非让我磨合，结果就是越来越难受，第二周就彻底拜拜了[藏狐]
1676302382,0,2,False,False,[打call]做更好的自己，面对未来
1676429344,0,1,False,False,让生命滋养生命，世界和我爱着你。[给心心][大哭]你把我说哭了～
1676475930,0,1,False,False,已经改的差不多了，我觉得我已经是小高敏大稳定[脱单doge]
1676385977,0,2,False,False,我建了个群 高敏感沙雕们快来 相信我们一定聊的很愉快！524254054
1676320554,0,2,False,False,我是稳定性女生
1676333931,4,4,False,False,原来如此，我前任是自恋型+情绪无能型+回避型全占了[藏狐]
1676356497,0,1,False,False,哇，谢谢t酱，感觉我就是高敏感，但又很难找到这么匹配的对象吧本来对象就难找了～[撇嘴]感觉一谈恋爱就有很多负面情绪，情绪起伏特别大，单身就比较平静快乐，怎么办啊😣
1676366102,0,1,False,False,心理学的本质是统计学，所以不必带入，它并不是严谨的科学，相信你自己能做到很多事，能控制自己改变自己，这才是人
1676380645,0,1,False,False,我靠我前面几次恋爱都是和相克的这种在一起的。。。每次都会不由自主地自我反思是不是自己错了。。。。。
1676360189,0,1,False,False,高敏人群报道，我爸爸也是高敏，情绪特别不稳定，所以我择偶第一要求就是情绪稳定。我对自己的要求也是情绪稳定，我不想像我爸一样，给我留下了很深的心理阴影[笑哭]
1676301938,0,4,False,False,"[委屈]说的太好了呜呜呜呜，我之前就是很担心两个高敏感的人会不会不合适的那种人
感谢T酱给我吃了颗定心丸，也希望自己可以早点抱得美人归[脱单doge]"
1676336394,6,3,False,False,能不能讲一讲高敏感对恋人的好处？
1676359259,1,1,False,False,我一开始也以为自己只是高敏感，我当时看高敏感是种天赋看的情绪失控。后来去了医院看了医生才告诉我是焦虑障碍[难过]
1676389422,0,1,False,False,就从没遇见过“不敏感”的人
1676347010,0,2,False,False,我妈妈就是情绪无能，前女友也是这样的[大哭][大哭][大哭]真的很难受，我说我很难她就说我比你更难受，你这算什么[大哭]
1676333992,0,2,False,False,找到我是智性恋且喜欢温柔情绪稳定的人理由了。[doge]
1676306045,0,2,False,False,[藏狐]我是一个理性到极致的INTJ
1676359400,0,1,False,False,感谢，我爸是第一种，我妈早年是第二种，我感觉我很强大，已经百毒不侵了
1676333128,5,2,False,False,本人男，高敏感，对喜欢的人比较黏，想试着找一位能互相陪伴的女孩子。
1676303123,0,3,False,True,每个视频都是我的刚需[笑哭]
